URL,EXTRACTED VALUE
"/media/Dados/bases/SWDE/book/book-bookdepository/0225.htm",Reviews for The Slap
"/media/Dados/bases/SWDE/book/book-bookdepository/0045.htm",Reviews for Shit My Dad Says
"/media/Dados/bases/SWDE/book/book-bookdepository/0059.htm",Reviews for There Was an Old Lady Who Swallowed a Fly
"/media/Dados/bases/SWDE/book/book-bookdepository/0492.htm",Reviews for Sugar Animals
"/media/Dados/bases/SWDE/book/book-bookdepository/0029.htm",Reviews for Empire of Silver
"/media/Dados/bases/SWDE/book/book-bookdepository/0808.htm",Reviews for The Janus Stone
"/media/Dados/bases/SWDE/book/book-bookdepository/0790.htm",Reviews for Persuasion
"/media/Dados/bases/SWDE/book/book-bookdepository/0576.htm",Reviews for Leaving Paradise
"/media/Dados/bases/SWDE/book/book-bookdepository/0057.htm",Reviews for Percy Jackson and the Battle of the Labyrinth
"/media/Dados/bases/SWDE/book/book-bookdepository/0310.htm",Reviews for Jane Eyre
"/media/Dados/bases/SWDE/book/book-bookdepository/0800.htm",Reviews for Dear Fatty
"/media/Dados/bases/SWDE/book/book-bookdepository/0389.htm",Reviews for A Touch of Dead
"/media/Dados/bases/SWDE/book/book-bookdepository/1052.htm","Reviews for ""How to be the Perfect Housewife"""
"/media/Dados/bases/SWDE/book/book-bookdepository/0505.htm",Reviews for Who Moved My Cheese?
"/media/Dados/bases/SWDE/book/book-bookdepository/0043.htm",Reviews for Greg Heffley's Journal
"/media/Dados/bases/SWDE/book/book-bookdepository/0585.htm",Reviews for The Darkest Passion
"/media/Dados/bases/SWDE/book/book-bookdepository/0239.htm",Reviews for Almost French
"/media/Dados/bases/SWDE/book/book-bookdepository/0428.htm",Reviews for On the Road
"/media/Dados/bases/SWDE/book/book-bookdepository/0335.htm",Reviews for The Eye of the World
"/media/Dados/bases/SWDE/book/book-bookdepository/0031.htm",Reviews for Scott Pilgrim: Scott Pilgrim's Precious Little Life v. 1
"/media/Dados/bases/SWDE/book/book-bookdepository/0114.htm",Reviews for The Fury: AND The Reunion Bks. 3 & 4
"/media/Dados/bases/SWDE/book/book-bookdepository/0453.htm",Reviews for Bake
"/media/Dados/bases/SWDE/book/book-bookdepository/1551.htm",Reviews for Twenty Boy Summer
"/media/Dados/bases/SWDE/book/book-bookdepository/0206.htm",Reviews for To Kill a Mockingbird
"/media/Dados/bases/SWDE/book/book-bookdepository/1991.htm",Reviews for The Walking Dead: Made to Suffer v. 8
"/media/Dados/bases/SWDE/book/book-bookdepository/0004.htm",Reviews for Jasper Jones
"/media/Dados/bases/SWDE/book/book-bookdepository/0211.htm",Reviews for The Boy in the Striped Pyjamas
"/media/Dados/bases/SWDE/book/book-bookdepository/1945.htm",Reviews for Life of Pi
"/media/Dados/bases/SWDE/book/book-bookdepository/0243.htm",Reviews for Anna Karenina
"/media/Dados/bases/SWDE/book/book-bookdepository/0179.htm","Reviews for Death Note: v. 1, 13"
"/media/Dados/bases/SWDE/book/book-bookdepository/0393.htm",Reviews for Dead and Gone
"/media/Dados/bases/SWDE/book/book-bookdepository/0327.htm",Reviews for Preserving Food without Freezing or Canning
"/media/Dados/bases/SWDE/book/book-bookdepository/0833.htm",Reviews for The Yiddish Policemen's Union
"/media/Dados/bases/SWDE/book/book-bookdepository/1933.htm",Reviews for Heartstone
"/media/Dados/bases/SWDE/book/book-bookdepository/0483.htm","Reviews for Hush, Hush"
"/media/Dados/bases/SWDE/book/book-bookdepository/0427.htm",Reviews for Percy Jackson and the Sea of Monsters
"/media/Dados/bases/SWDE/book/book-bookdepository/0339.htm",Reviews for The Demon Trappers: Forsaken
"/media/Dados/bases/SWDE/book/book-bookdepository/0096.htm","Reviews for 3,096 Days"
"/media/Dados/bases/SWDE/book/book-bookdepository/0478.htm",Reviews for The Boat
"/media/Dados/bases/SWDE/book/book-bookdepository/0923.htm",Reviews for Death Note: v. 1
"/media/Dados/bases/SWDE/book/book-bookdepository/0314.htm",Reviews for Her Fearful Symmetry
"/media/Dados/bases/SWDE/book/book-bookdepository/0823.htm",Reviews for Just My Type
"/media/Dados/bases/SWDE/book/book-bookdepository/1504.htm",Reviews for What a Dragon Should Know
"/media/Dados/bases/SWDE/book/book-bookdepository/0530.htm","Reviews for Night World: Bind-up v. 1, Bks. 1-3"
"/media/Dados/bases/SWDE/book/book-bookdepository/0051.htm",Reviews for To Kill a Mockingbird
"/media/Dados/bases/SWDE/book/book-bookdepository/0556.htm",Reviews for Batman: Killing Joke
"/media/Dados/bases/SWDE/book/book-bookdepository/0610.htm",Reviews for Succubus on Top
"/media/Dados/bases/SWDE/book/book-bookdepository/0383.htm",Reviews for Fire Study
"/media/Dados/bases/SWDE/book/book-bookdepository/0055.htm",Reviews for The Digital Photography Book
"/media/Dados/bases/SWDE/book/book-bookdepository/0597.htm",Reviews for Crafting Springtime Gifts
"/media/Dados/bases/SWDE/book/book-bookdepository/0820.htm",Reviews for The White Queen
"/media/Dados/bases/SWDE/book/book-bookdepository/0480.htm",Reviews for Breath
"/media/Dados/bases/SWDE/book/book-bookdepository/0152.htm",Reviews for Letters from London and Europe
"/media/Dados/bases/SWDE/book/book-bookdepository/1692.htm",Reviews for Darkness Unleashed
"/media/Dados/bases/SWDE/book/book-bookdepository/1272.htm",Reviews for Rich Dad's Guide to Investing
"/media/Dados/bases/SWDE/book/book-bookdepository/0387.htm",Reviews for Robbins and Cotran Pathologic Basis of Disease
"/media/Dados/bases/SWDE/book/book-bookdepository/0165.htm",Reviews for Shadow Kiss
"/media/Dados/bases/SWDE/book/book-bookdepository/0306.htm",Reviews for Room on the Broom
"/media/Dados/bases/SWDE/book/book-bookdepository/1293.htm",Reviews for The Thousand Autumns of Jacob De Zoet
"/media/Dados/bases/SWDE/book/book-bookdepository/1857.htm","Reviews for 200 Crochet Blocks for Blankets, Throws and Afghans"
"/media/Dados/bases/SWDE/book/book-bookdepository/0541.htm",Reviews for A Hunger Like No Other
"/media/Dados/bases/SWDE/book/book-bookdepository/0270.htm",Reviews for Shadow Kiss
"/media/Dados/bases/SWDE/book/book-bookdepository/0246.htm",Reviews for How to Win Friends and Influence People
"/media/Dados/bases/SWDE/book/book-bookdepository/1599.htm",Reviews for The Neuroscience of Psychotherapy
"/media/Dados/bases/SWDE/book/book-bookdepository/0920.htm",Reviews for Death Note: How to Read v. 13
"/media/Dados/bases/SWDE/book/book-bookdepository/0050.htm",Reviews for Start-Up Nation
"/media/Dados/bases/SWDE/book/book-bookdepository/0695.htm",Reviews for Cross Stitch
"/media/Dados/bases/SWDE/book/book-bookdepository/0115.htm",Reviews for The Awakening: AND The Struggle Bks. 1 & 2
"/media/Dados/bases/SWDE/book/book-bookdepository/0150.htm",Reviews for The Radleys
"/media/Dados/bases/SWDE/book/book-bookdepository/1526.htm","Reviews for ""In the Night Garden"": Little Library"
"/media/Dados/bases/SWDE/book/book-bookdepository/0046.htm",Reviews for The Flavour Thesaurus
"/media/Dados/bases/SWDE/book/book-bookdepository/0577.htm",Reviews for Cracked Up to be
"/media/Dados/bases/SWDE/book/book-bookdepository/0153.htm",Reviews for False Gods
"/media/Dados/bases/SWDE/book/book-bookdepository/1289.htm",Reviews for Middlesex
"/media/Dados/bases/SWDE/book/book-bookdepository/1158.htm",Reviews for Seven Hundred Penguins
"/media/Dados/bases/SWDE/book/book-bookdepository/0254.htm",Reviews for Shit My Dad Says
"/media/Dados/bases/SWDE/book/book-bookdepository/0180.htm",Reviews for Death Note: v. 1
"/media/Dados/bases/SWDE/book/book-bookdepository/0166.htm",Reviews for Frostbite: Vampire Academy No. 2
"/media/Dados/bases/SWDE/book/book-bookdepository/0758.htm",Reviews for The Road
"/media/Dados/bases/SWDE/book/book-bookdepository/0420.htm",Reviews for Soulless
"/media/Dados/bases/SWDE/book/book-bookdepository/0047.htm",Reviews for The Princess Bride
