URL,EXTRACTED VALUE
"/sdd/edimar/Desktop/doutorado/doutorado04/bases/WEIR/finance/www.marketwatch.com/HAS.html","Top 10 Pre-Market Analyst Calls (ACI, RATE, BKS, GS, HAS, MOS, OXPS, POT, SIRF, YHOO)"
"/sdd/edimar/Desktop/doutorado/doutorado04/bases/WEIR/finance/www.marketwatch.com/CTB.html","Tire Inflation Coming? (TWI, GT, CTB)"
"/sdd/edimar/Desktop/doutorado/doutorado04/bases/WEIR/finance/www.marketwatch.com/ARIA.html","Pre-Market Stock News (July 12, 2007)"
"/sdd/edimar/Desktop/doutorado/doutorado04/bases/WEIR/finance/www.marketwatch.com/PWAV.html","Top 10 Pre-Market Analyst Calls (ABH, ALKS, AMAT, DEO, EBAY, KNXA, MMM, PWAV, TKC, NRG, EIX, ETR)"
"/sdd/edimar/Desktop/doutorado/doutorado04/bases/WEIR/finance/www.marketwatch.com/ADP.html","Goldman Sachs Changes on Conviction Buy List in Tech (DOX, ADP, SNCR, SVR)"
"/sdd/edimar/Desktop/doutorado/doutorado04/bases/WEIR/finance/www.marketwatch.com/WHR.html","Pre-Market Stock News (July 20, 2007)"
"/sdd/edimar/Desktop/doutorado/doutorado04/bases/WEIR/finance/www.marketwatch.com/BDX.html","Top 10 Pre-Market Analyst Calls (AMD, LSI, NSM, AMZN, BHI, BDX, HUM, IACI, INTC, TXN, PCLN, SBUX, UNH)"
"/sdd/edimar/Desktop/doutorado/doutorado04/bases/WEIR/finance/www.marketwatch.com/SLAB.html","Pre-Market Analyst Calls (October 4, 2007)"
"/sdd/edimar/Desktop/doutorado/doutorado04/bases/WEIR/finance/www.marketwatch.com/FCEL.html","Top 10 Pre-Market Analyst Calls (CS, DB, UBS, ASML, IFX, PHG, ETFC, FCEL, MHK, PLUG, TMX, VLO, WNR)"
"/sdd/edimar/Desktop/doutorado/doutorado04/bases/WEIR/finance/www.marketwatch.com/KLAC.html",Does KLA-Tencor's (KLAC) Quarter Signal Chip Turnaround
"/sdd/edimar/Desktop/doutorado/doutorado04/bases/WEIR/finance/www.marketwatch.com/SNV.html","Pre-Market Stock News (December 18, 2007)"
"/sdd/edimar/Desktop/doutorado/doutorado04/bases/WEIR/finance/www.marketwatch.com/FLR.html","Pre-Market Stock News (August 16, 2007)"
"/sdd/edimar/Desktop/doutorado/doutorado04/bases/WEIR/finance/www.marketwatch.com/GAP.html","Pre-Market Analyst Calls (July 23, 2007)"
"/sdd/edimar/Desktop/doutorado/doutorado04/bases/WEIR/finance/www.marketwatch.com/GAS.html","Higher Utility Bills Coming; Rate Relief Filed (FE, CHG, AEE, AYE, GAS)"
"/sdd/edimar/Desktop/doutorado/doutorado04/bases/WEIR/finance/www.marketwatch.com/PAYX.html","Pre-Market Stock News (June 27, 2007)"
"/sdd/edimar/Desktop/doutorado/doutorado04/bases/WEIR/finance/www.marketwatch.com/UNM.html","Icahn's Top Holdings (APC, BEAS, BIIB, CSX, LEA, M, MOT, JCP, REGN, TIN, TWX, TWC, UNM, WMB)"
"/sdd/edimar/Desktop/doutorado/doutorado04/bases/WEIR/finance/www.marketwatch.com/CELG.html","Backward & Forward, Cramer In 2007 To 2008"
"/sdd/edimar/Desktop/doutorado/doutorado04/bases/WEIR/finance/www.marketwatch.com/WMB.html","Short Selling Energy, Oil & Gas Stocks (June 2007)"
"/sdd/edimar/Desktop/doutorado/doutorado04/bases/WEIR/finance/www.marketwatch.com/DE.html","Top 10 Pre-Market Analyst Calls (AET, RATE, CELG, DE, FNM, FRE, GRP, ISIL, PHG, SGP, TDW)"
"/sdd/edimar/Desktop/doutorado/doutorado04/bases/WEIR/finance/www.marketwatch.com/KEYN.html","52-Week Low Club (AMLN, CYMI, NTCH, KEYN, MMA, NATI, STE, WTW)"
"/sdd/edimar/Desktop/doutorado/doutorado04/bases/WEIR/finance/www.marketwatch.com/CI.html","Pre-Market Stock News (November 27, 2007)"
"/sdd/edimar/Desktop/doutorado/doutorado04/bases/WEIR/finance/www.marketwatch.com/CA.html",What To Expect Ahead of VMware's VMWORLD Conference
"/sdd/edimar/Desktop/doutorado/doutorado04/bases/WEIR/finance/www.marketwatch.com/RIG.html","Coal for Christmas: Stocks on 52-Week Lows (APL, KDE, HNSN, IPCM, LUFK, SYNA, THO, TRAC, RIG)"
"/sdd/edimar/Desktop/doutorado/doutorado04/bases/WEIR/finance/www.marketwatch.com/HELX.html","Top 10 Pre-Market Analyst Calls (ADSK, BRKS, CVC, LNG, ITG, SNN, TTEK, TSN, YHOO, AUY)"
"/sdd/edimar/Desktop/doutorado/doutorado04/bases/WEIR/finance/www.marketwatch.com/LLTC.html","Short Interest: NASDAQ Semiconductor Stocks (June, 2007)"
"/sdd/edimar/Desktop/doutorado/doutorado04/bases/WEIR/finance/www.marketwatch.com/CHKP.html","Pre-Market Stock News (January 23, 2008)"
"/sdd/edimar/Desktop/doutorado/doutorado04/bases/WEIR/finance/www.marketwatch.com/NVDA.html","NVIDIA May Finally Be Worth A Look (NVDA, AMD, INTC)"
"/sdd/edimar/Desktop/doutorado/doutorado04/bases/WEIR/finance/www.marketwatch.com/BSX.html","Drug-Eluting Stent Data Shows More Promise (BSX, ANPI, JNJ, SRDX, MDT, ABT)"
"/sdd/edimar/Desktop/doutorado/doutorado04/bases/WEIR/finance/www.marketwatch.com/NVLS.html","Short Interest: NASDAQ Semiconductor Stocks (June, 2007)"
"/sdd/edimar/Desktop/doutorado/doutorado04/bases/WEIR/finance/www.marketwatch.com/CMA.html","Baird on Banks (BAC, BBT, CMA, FITB, KEY, MI, MTB, PNC, STI, USB, WB, WFC)"
"/sdd/edimar/Desktop/doutorado/doutorado04/bases/WEIR/finance/www.marketwatch.com/SIAL.html","Top Pre-Market Analyst Upgrades (BBT, EXPD, FLR, JEC, JCG, NOK, SIAL, VMED)"
"/sdd/edimar/Desktop/doutorado/doutorado04/bases/WEIR/finance/www.marketwatch.com/MCK.html","Top 10 Pre-Market Analyst Calls (ADCT, ABC, CAH, MCK, CRUS, LNG, HAIN, ISRG, NFS, PTR, VMED, WLK)"
"/sdd/edimar/Desktop/doutorado/doutorado04/bases/WEIR/finance/www.marketwatch.com/SUN.html","Frontier Oil, Refiner Earnings Lagging Peers (FTO, SUN, WNR, VLO)"
"/sdd/edimar/Desktop/doutorado/doutorado04/bases/WEIR/finance/www.marketwatch.com/AEOS.html","Pre-Market Analyst Calls (September 4, 2007)"
"/sdd/edimar/Desktop/doutorado/doutorado04/bases/WEIR/finance/www.marketwatch.com/KKD.html",Krispy Kreme Sinks To The Bottom
"/sdd/edimar/Desktop/doutorado/doutorado04/bases/WEIR/finance/www.marketwatch.com/RL.html","Cramer's Retail & Apparel Calls On The Fed (PVH, PERY, RL, DLTR, GPS, AEO)"
"/sdd/edimar/Desktop/doutorado/doutorado04/bases/WEIR/finance/www.marketwatch.com/UTSI.html","Massive List of 52-Week Lows (June 20, 2007)"
"/sdd/edimar/Desktop/doutorado/doutorado04/bases/WEIR/finance/www.marketwatch.com/HP.html",A Big Bear Case Before Intel's (INTC) Earnings
"/sdd/edimar/Desktop/doutorado/doutorado04/bases/WEIR/finance/www.marketwatch.com/PZZA.html","Short Sellers Lighten Up On Growth Restaurant Chains (RRGB, PZZA, MSSR, BWLD, SBUX, CAKE, TXRH, CBRL, PFCB, PNRA)"
"/sdd/edimar/Desktop/doutorado/doutorado04/bases/WEIR/finance/www.marketwatch.com/PCAR.html",Early Research Calls 7/9/2007
"/sdd/edimar/Desktop/doutorado/doutorado04/bases/WEIR/finance/www.marketwatch.com/MSO.html","Pre-Market Earnings Gappers (November 2, 2007)"
"/sdd/edimar/Desktop/doutorado/doutorado04/bases/WEIR/finance/www.marketwatch.com/GR.html","Top Pre-Market Analyst Downgrades (JOBS, AUO, AVR, CRDN, CLX, DKS, GR, MPEL, PLXS, VSE)"
"/sdd/edimar/Desktop/doutorado/doutorado04/bases/WEIR/finance/www.marketwatch.com/HGSI.html","Pre-Market Analyst Calls (June 26, 2007)"
"/sdd/edimar/Desktop/doutorado/doutorado04/bases/WEIR/finance/www.marketwatch.com/ADI.html","NYSE June 2007 Short Interest: Semiconductor Stocks (NSM, SMH, AMD, MU, TXN)"
"/sdd/edimar/Desktop/doutorado/doutorado04/bases/WEIR/finance/www.marketwatch.com/AVY.html",The 52-Week Low Club
"/sdd/edimar/Desktop/doutorado/doutorado04/bases/WEIR/finance/www.marketwatch.com/RDC.html","UBS Hikes Oil (CVX, DO, HERO, NE, PDE, RDC, RIG)"
"/sdd/edimar/Desktop/doutorado/doutorado04/bases/WEIR/finance/www.marketwatch.com/WMI.html","The Business Day In Global Warming (WMI, AMSC, BP, RDS, COST, ENCS)"
"/sdd/edimar/Desktop/doutorado/doutorado04/bases/WEIR/finance/www.marketwatch.com/ANDW.html","Pre-Market Stock News (June 27, 2007)"
"/sdd/edimar/Desktop/doutorado/doutorado04/bases/WEIR/finance/www.marketwatch.com/G.html","Media Digest 8/10/2007 Reuters, WSJ, NYTimes, FT, Barron's"
"/sdd/edimar/Desktop/doutorado/doutorado04/bases/WEIR/finance/www.marketwatch.com/RFMD.html","Media Digest 7/25/2007 Reuters, WSJ, NYTimes, FT, Barron's"
"/sdd/edimar/Desktop/doutorado/doutorado04/bases/WEIR/finance/www.marketwatch.com/CINF.html","Midwest Floods & Fifth Third Hit Cincinnati Financial (CINF, FITB)"
"/sdd/edimar/Desktop/doutorado/doutorado04/bases/WEIR/finance/www.marketwatch.com/R.html","Top 10 Pre-Market Analyst Calls (CAT, CRUS, EQ, HCCI, MAR, MTG, PPC, R, SLB, WFC)"
"/sdd/edimar/Desktop/doutorado/doutorado04/bases/WEIR/finance/www.marketwatch.com/ZQK.html",The 52-Week Low Club (FNSR)(CNXT)
"/sdd/edimar/Desktop/doutorado/doutorado04/bases/WEIR/finance/www.marketwatch.com/CCE.html","52-Week Low Club (LNG, CCE, GEOY, HANS, IPAS, KNOT, TDSC, VLO)"
"/sdd/edimar/Desktop/doutorado/doutorado04/bases/WEIR/finance/www.marketwatch.com/DOV.html","Top Pre-Market Analyst Downgrades (AEP, DOV, GS, HWCC, ITT, LXK, TYC, UTHR, WYNN)"
"/sdd/edimar/Desktop/doutorado/doutorado04/bases/WEIR/finance/www.marketwatch.com/SLM.html",Media Digest 12/27/2007
"/sdd/edimar/Desktop/doutorado/doutorado04/bases/WEIR/finance/www.marketwatch.com/PHG.html","Pre-Market Stock News (July 17, 2007)"
"/sdd/edimar/Desktop/doutorado/doutorado04/bases/WEIR/finance/www.marketwatch.com/CAG.html","Defensive Stock Picks Better Than The Market (September 7, 2007)"
"/sdd/edimar/Desktop/doutorado/doutorado04/bases/WEIR/finance/www.marketwatch.com/CMS.html","Top 10 Pre-Market Analyst Upgrades & Downgrades (MO, STZ, LVS, LYV, RF, AXP, CMS, DELL, SOLR, TIBX)"
"/sdd/edimar/Desktop/doutorado/doutorado04/bases/WEIR/finance/www.marketwatch.com/NWL.html","Major S&P Stocks On Decade Lows (AA, AMAT, AMD, DOW, EK, GCI, HOG, INTC, IP, JNY, M, MU, MSFT, NWL, NWS, SLE, STX, LUV, HOT, YRCW)"
"/sdd/edimar/Desktop/doutorado/doutorado04/bases/WEIR/finance/www.marketwatch.com/QLGC.html","Pre-Market Analyst Calls (July 10, 2007)"
"/sdd/edimar/Desktop/doutorado/doutorado04/bases/WEIR/finance/www.marketwatch.com/TBL.html","This Week's Top Share Buyback Changes (SCHW, DRH, LCAPA, QCOM, TBL, TEL)"
"/sdd/edimar/Desktop/doutorado/doutorado04/bases/WEIR/finance/www.marketwatch.com/CAH.html","Pre-Market Earnings Gappers (January 29, 2008)"
"/sdd/edimar/Desktop/doutorado/doutorado04/bases/WEIR/finance/www.marketwatch.com/HON.html","Backward & Forward, Cramer In 2007 To 2008"
"/sdd/edimar/Desktop/doutorado/doutorado04/bases/WEIR/finance/www.marketwatch.com/TER.html",Short Sellers Taking Heat in Semiconductor Stocks July 2007
"/sdd/edimar/Desktop/doutorado/doutorado04/bases/WEIR/finance/www.marketwatch.com/PDLI.html","Cramer Talks Fannie, Freddie, Biotech"
"/sdd/edimar/Desktop/doutorado/doutorado04/bases/WEIR/finance/www.marketwatch.com/ATI.html","Allegheny Warning Melts Metal (ATI, X, TIE)"
"/sdd/edimar/Desktop/doutorado/doutorado04/bases/WEIR/finance/www.marketwatch.com/IFF.html","Pre-Market Stock News (September 17, 2007)"
"/sdd/edimar/Desktop/doutorado/doutorado04/bases/WEIR/finance/www.marketwatch.com/CVS.html","Media Digest 8/13/2008 Reuters, WSJ, NYTimes, FT, Bloomberg"
"/sdd/edimar/Desktop/doutorado/doutorado04/bases/WEIR/finance/www.marketwatch.com/N.html","NetSuite Prices At Even Higher Premium (N, ORCL)"
"/sdd/edimar/Desktop/doutorado/doutorado04/bases/WEIR/finance/www.marketwatch.com/STJ.html",Mixed Short Interest in Drug & Medical Stocks (June 2007)
"/sdd/edimar/Desktop/doutorado/doutorado04/bases/WEIR/finance/www.marketwatch.com/TROW.html","Top 10 Pre-Market Analyst Calls (CPLA, CEPH, DYN, HBC, MS, SGP, SLM, TASR, TROW, VISN)"
"/sdd/edimar/Desktop/doutorado/doutorado04/bases/WEIR/finance/www.marketwatch.com/ALTR.html","Short Interest: NASDAQ Semiconductor Stocks (June, 2007)"
"/sdd/edimar/Desktop/doutorado/doutorado04/bases/WEIR/finance/www.marketwatch.com/MIL.html","52-Week Low Club (AVID, CERN, DRIV, MIL, NZ, OMCL, HPOL, FLE, ACTU)"
"/sdd/edimar/Desktop/doutorado/doutorado04/bases/WEIR/finance/www.marketwatch.com/BBBY.html","Early Bird Analyst Calls (BBBY, BBT, FHN, LCAPA, OIIM, RF, STI, UHS)"
"/sdd/edimar/Desktop/doutorado/doutorado04/bases/WEIR/finance/www.marketwatch.com/CPN.html","Top 10 Pre-Market Analyst Calls (ACS, AEP, CPN, CVX, CTXS, F, POT, SYMC, THC, WB)"
"/sdd/edimar/Desktop/doutorado/doutorado04/bases/WEIR/finance/www.marketwatch.com/CCL.html","Early Bird Analyst Downgrades (B, CCL, CTCM, DO, ESS, HAL, HMY, IP, ODFL, PKG)"
"/sdd/edimar/Desktop/doutorado/doutorado04/bases/WEIR/finance/www.marketwatch.com/WOR.html","Goldman Sachs & Massive Steel Prices (X, NUE, ATI, STLD, SCHN, GNA, WOR, AKS, ROCK, RS, CMC)"
"/sdd/edimar/Desktop/doutorado/doutorado04/bases/WEIR/finance/www.marketwatch.com/RMBS.html","Short Interest: NASDAQ Semiconductor Stocks (June, 2007)"
"/sdd/edimar/Desktop/doutorado/doutorado04/bases/WEIR/finance/www.marketwatch.com/HUM.html","Top 10 Pre-Market Analyst Calls (AMD, LSI, NSM, AMZN, BHI, BDX, HUM, IACI, INTC, TXN, PCLN, SBUX, UNH)"
"/sdd/edimar/Desktop/doutorado/doutorado04/bases/WEIR/finance/www.marketwatch.com/NIKU.html",What To Expect Ahead of VMware's VMWORLD Conference
"/sdd/edimar/Desktop/doutorado/doutorado04/bases/WEIR/finance/www.marketwatch.com/EMN.html","Top 10 Pre-Market Analyst Calls (CAT, EMN, GIS, K, GNTX, MEDX, MRK, N, NE, PLT, WAG)"
"/sdd/edimar/Desktop/doutorado/doutorado04/bases/WEIR/finance/www.marketwatch.com/ISIL.html","Short Interest: NASDAQ Semiconductor Stocks (June, 2007)"
"/sdd/edimar/Desktop/doutorado/doutorado04/bases/WEIR/finance/www.marketwatch.com/DLX.html","52-Week Low Club (ALO, AEIS, CAMD, DGII, DLX, EBAY, IPCS, MRCY, MTSC, PRS, RJF, THQI, VRTX)"
"/sdd/edimar/Desktop/doutorado/doutorado04/bases/WEIR/finance/www.marketwatch.com/HOTT.html","52-Week Low Club I (AMD, BIG, DRIV, FRPT, HOTT, SOLD)"
"/sdd/edimar/Desktop/doutorado/doutorado04/bases/WEIR/finance/www.marketwatch.com/EMR.html","Emerson Added to Goldman Sachs Conviction Buy List (EMR, DHR, TYC)"
"/sdd/edimar/Desktop/doutorado/doutorado04/bases/WEIR/finance/www.marketwatch.com/A.html","Top 10 Pre-Market Analyst Calls (A, BBBY, BBY, DTV, ECL, EP, IBM, NTAP, LRCX, MOT, CRM)"
"/sdd/edimar/Desktop/doutorado/doutorado04/bases/WEIR/finance/www.marketwatch.com/CHINA.html",CDC Corp. Online Gaming Unit IPO Spin-Off (CHINA)
"/sdd/edimar/Desktop/doutorado/doutorado04/bases/WEIR/finance/www.marketwatch.com/AM.html","52-Week Low Club (AAI, ANN, AM, BIG, BJRI, CHS, CC, LIZ, M, OMX, MSO, RL, HOT, WM, WEN, ZLC)"
"/sdd/edimar/Desktop/doutorado/doutorado04/bases/WEIR/finance/www.marketwatch.com/PMCS.html","Shorting the NASDAQ Hi-Flyers (June 2007) (ATML, CNXT, CHTR, CMGI, FNSR, LVLT, PMCS, SIRI, SUNW, COMS)"
"/sdd/edimar/Desktop/doutorado/doutorado04/bases/WEIR/finance/www.marketwatch.com/SHW.html","Top 10 Pre-Market Analyst Calls (AEM, MDRX, BP, CSCO, ENR, GRMN, SHW, STI, TGT, RIG)"
"/sdd/edimar/Desktop/doutorado/doutorado04/bases/WEIR/finance/www.marketwatch.com/MDP.html","Top 10 Pre-Market Analyst Calls (BVF, CERN, GIGM, IRBT, MHS, MDP, SII, STLD, STI, TRI)"
"/sdd/edimar/Desktop/doutorado/doutorado04/bases/WEIR/finance/www.marketwatch.com/AGN.html","Today's & Upcoming Stock Splits (June 19, 2007)"
"/sdd/edimar/Desktop/doutorado/doutorado04/bases/WEIR/finance/www.marketwatch.com/ELNK.html","Media Digest 7/2/2007 Reuters, WSJ, NYTimes, FT, Barron's"
"/sdd/edimar/Desktop/doutorado/doutorado04/bases/WEIR/finance/www.marketwatch.com/MXIM.html","Short Interest: NASDAQ Semiconductor Stocks (June, 2007)"
"/sdd/edimar/Desktop/doutorado/doutorado04/bases/WEIR/finance/www.marketwatch.com/SVU.html","Pre-Market Analyst Calls (October 1, 2007)"
"/sdd/edimar/Desktop/doutorado/doutorado04/bases/WEIR/finance/www.marketwatch.com/BDK.html",The 52-Week Low Club (FNSR)(CNXT)
"/sdd/edimar/Desktop/doutorado/doutorado04/bases/WEIR/finance/www.marketwatch.com/BNI.html",The 52-Week Low Club (UNG)(AM)(BNI)(CPHD)
"/sdd/edimar/Desktop/doutorado/doutorado04/bases/WEIR/finance/www.marketwatch.com/VFC.html","Pre-Market Stock News (December 6, 2007)"
"/sdd/edimar/Desktop/doutorado/doutorado04/bases/WEIR/finance/www.marketwatch.com/LTD.html","Pre-Market Stock News (December 6, 2007)"
"/sdd/edimar/Desktop/doutorado/doutorado04/bases/WEIR/finance/www.marketwatch.com/GLW.html","As Market Plunges, Major Stocks Fall Under $10 (AEO, BCS, C, GLW, DRYS, IPAR, IPCS, LULU)"
"/sdd/edimar/Desktop/doutorado/doutorado04/bases/WEIR/finance/www.marketwatch.com/COMS.html",A Sovereign Fund For The US Government?
"/sdd/edimar/Desktop/doutorado/doutorado04/bases/WEIR/finance/www.marketwatch.com/PX.html","The Business Day In Global Warming (GE, BLDP, UTX, PX, FWLT, PBOF, OPTT, YGE, FPL, GWSO)"
"/sdd/edimar/Desktop/doutorado/doutorado04/bases/WEIR/finance/www.marketwatch.com/PMTC.html","Pre-Market Stock News (January 23, 2008)"
"/sdd/edimar/Desktop/doutorado/doutorado04/bases/WEIR/finance/www.marketwatch.com/LIZ.html","Media Digest 7/31/2007 Reuters, WSJ, NYTimes, FT, Barron's"
"/sdd/edimar/Desktop/doutorado/doutorado04/bases/WEIR/finance/www.marketwatch.com/COKE.html",Coca-Cola Bottling Files To Raise Cash (COKE)
"/sdd/edimar/Desktop/doutorado/doutorado04/bases/WEIR/finance/www.marketwatch.com/APD.html","Pre-Market Analyst Calls (October 2, 2007)"
"/sdd/edimar/Desktop/doutorado/doutorado04/bases/WEIR/finance/www.marketwatch.com/CRGN.html",The 52-Week Low Club
"/sdd/edimar/Desktop/doutorado/doutorado04/bases/WEIR/finance/www.marketwatch.com/KSWS.html","Pre-Market Stock News (November 6, 2007)"
"/sdd/edimar/Desktop/doutorado/doutorado04/bases/WEIR/finance/www.marketwatch.com/OSIS.html",OSI Systems Wins More Cargo Inspection Orders (OSIS)
"/sdd/edimar/Desktop/doutorado/doutorado04/bases/WEIR/finance/www.marketwatch.com/ADPT.html","52-Week Lows Today (November 23, 2007)"
"/sdd/edimar/Desktop/doutorado/doutorado04/bases/WEIR/finance/www.marketwatch.com/NSM.html","Bracing For Data From 3 More Chip Stocks (TXN, NSM, ALTR)"
"/sdd/edimar/Desktop/doutorado/doutorado04/bases/WEIR/finance/www.marketwatch.com/MMC.html","Pre-Market Analyst Calls (September 25, 2007)"
"/sdd/edimar/Desktop/doutorado/doutorado04/bases/WEIR/finance/www.marketwatch.com/CEG.html","Constellation, Maybe Not Out For The Count (CEG)"
"/sdd/edimar/Desktop/doutorado/doutorado04/bases/WEIR/finance/www.marketwatch.com/CR.html","Top Pre-Market Analyst Upgrades (AOC, BAC, CR, DOV, FSLR, HPT, MMM, MMC, MA, SPWRA, TROW, V, WU)"
"/sdd/edimar/Desktop/doutorado/doutorado04/bases/WEIR/finance/www.marketwatch.com/DRI.html",The 52-Week Low Club
"/sdd/edimar/Desktop/doutorado/doutorado04/bases/WEIR/finance/www.marketwatch.com/IR.html","Media Digest 12/17/2007 Reuters, WSJ, NYTimes, FT, Barron's"
"/sdd/edimar/Desktop/doutorado/doutorado04/bases/WEIR/finance/www.marketwatch.com/JKHY.html",24/7 Wall St. Day Trading Alerts (NVTL)(STP)(JKHY)
"/sdd/edimar/Desktop/doutorado/doutorado04/bases/WEIR/finance/www.marketwatch.com/PSS.html",The 52-Week Low Club (PSS)(SUN)(THO)
"/sdd/edimar/Desktop/doutorado/doutorado04/bases/WEIR/finance/www.marketwatch.com/PCG.html","Pre-Market Analyst Calls (September 4, 2007)"
"/sdd/edimar/Desktop/doutorado/doutorado04/bases/WEIR/finance/www.marketwatch.com/ARBA.html","Top 10 Pre-Market Analyst Calls (AKAM, AEO, ARBA, BBI, CPWR, DVAX, FNSR, NCC, TOO, TXN)"
"/sdd/edimar/Desktop/doutorado/doutorado04/bases/WEIR/finance/www.marketwatch.com/BEN.html","Pre-Market Analyst Calls (October 26, 2007)"
"/sdd/edimar/Desktop/doutorado/doutorado04/bases/WEIR/finance/www.marketwatch.com/UIS.html",The 52-Week Low Club (WB)(CFC)(WM)(TWX)(GM)
"/sdd/edimar/Desktop/doutorado/doutorado04/bases/WEIR/finance/www.marketwatch.com/BGG.html",The 52-Week Low Club (BGG)(LVS)(CRMH)(EPIC)
"/sdd/edimar/Desktop/doutorado/doutorado04/bases/WEIR/finance/www.marketwatch.com/ITW.html","Pre-Market Analyst Calls (September 18, 2007)"
"/sdd/edimar/Desktop/doutorado/doutorado04/bases/WEIR/finance/www.marketwatch.com/VMC.html","Pre-Market Stock News (July 19, 2007)"
"/sdd/edimar/Desktop/doutorado/doutorado04/bases/WEIR/finance/www.marketwatch.com/DIA.html","ETF Winners & Losers (June 14, 2007)"
"/sdd/edimar/Desktop/doutorado/doutorado04/bases/WEIR/finance/www.marketwatch.com/DEL.html","Pre-Market Analyst Calls (August 20, 2007)"
"/sdd/edimar/Desktop/doutorado/doutorado04/bases/WEIR/finance/www.marketwatch.com/PSUN.html","Pre-Market Stock News (December 6, 2007)"
"/sdd/edimar/Desktop/doutorado/doutorado04/bases/WEIR/finance/www.marketwatch.com/MDR.html","Infrastructure Earnings Scorecard (MDR, FLR, FWLT, ACM)"
"/sdd/edimar/Desktop/doutorado/doutorado04/bases/WEIR/finance/www.marketwatch.com/HBAN.html",The 52-Week Low Club (CRS)(CC)(FHN)(HBAN)(FITB)
"/sdd/edimar/Desktop/doutorado/doutorado04/bases/WEIR/finance/www.marketwatch.com/TUP.html","Top Pre-Market Analyst Downgrades (BGFV, CME, QSII, TUP, SKS)"
"/sdd/edimar/Desktop/doutorado/doutorado04/bases/WEIR/finance/www.marketwatch.com/PH.html","Top Pre-Market Analyst Upgrades (AKAM, AIV, AMGN, CNX, KND, MCO, NEU, PH, SE)"
"/sdd/edimar/Desktop/doutorado/doutorado04/bases/WEIR/finance/www.marketwatch.com/FPL.html","The Business Day In Global Warming (GE, BLDP, UTX, PX, FWLT, PBOF, OPTT, YGE, FPL, GWSO)"
"/sdd/edimar/Desktop/doutorado/doutorado04/bases/WEIR/finance/www.marketwatch.com/AOC.html","Top 10 Pre-Market Analyst Calls (AOC, AVAV, CMED, CC, DKS, FCX, INTC, MNI, ODP, DGX)"
"/sdd/edimar/Desktop/doutorado/doutorado04/bases/WEIR/finance/www.marketwatch.com/FOSL.html","Major Buybacks This Week (CCOI, FOSL, HIG, KALU, OSG, URI, UTX)"
"/sdd/edimar/Desktop/doutorado/doutorado04/bases/WEIR/finance/www.marketwatch.com/SYY.html","Pre-Market Analyst Calls (July 20, 2007)"
"/sdd/edimar/Desktop/doutorado/doutorado04/bases/WEIR/finance/www.marketwatch.com/DLTR.html","Top 10 Pre-Market Analyst Calls (AIG, BBW, CPST, LNG, CMC, DLTR, IMCL, PSUN, TDSC, TAL)"
"/sdd/edimar/Desktop/doutorado/doutorado04/bases/WEIR/finance/www.marketwatch.com/AZO.html","Top Pre-Market Analyst Downgrades (AZO, CX, FNM, ISIL, MHK, NVDA, PETM, POR, TSCO, UST)"
"/sdd/edimar/Desktop/doutorado/doutorado04/bases/WEIR/finance/www.marketwatch.com/FMC.html",FMC Corp.: Jim Cramer's Hidden Agriculture Trade (FMC)
"/sdd/edimar/Desktop/doutorado/doutorado04/bases/WEIR/finance/www.marketwatch.com/RMD.html","Pre-Market Analyst Calls (September 27, 2007)"
"/sdd/edimar/Desktop/doutorado/doutorado04/bases/WEIR/finance/www.marketwatch.com/AMTD.html","Short Selling: Trouble Brewing In Online Brokers? (AMTD, ETFC, SCHW)"
"/sdd/edimar/Desktop/doutorado/doutorado04/bases/WEIR/finance/www.marketwatch.com/CSC.html","Pre-Market Stock News (August 15, 2007)"
"/sdd/edimar/Desktop/doutorado/doutorado04/bases/WEIR/finance/www.marketwatch.com/NSC.html","Buffett & Berkshire Hathaway Holdings ""H to P"" (BRK-A, BRK-B, HD, IR, IRM, JNJ, KFT, MTB, MCO, NKE, NSC, PG)"
"/sdd/edimar/Desktop/doutorado/doutorado04/bases/WEIR/finance/www.marketwatch.com/MYGN.html","Pre-Market Analyst Calls (September 18, 2007)"
"/sdd/edimar/Desktop/doutorado/doutorado04/bases/WEIR/finance/www.marketwatch.com/NOVL.html",What To Expect Ahead of VMware's VMWORLD Conference
"/sdd/edimar/Desktop/doutorado/doutorado04/bases/WEIR/finance/www.marketwatch.com/PBY.html",The 52-Week Low Club
"/sdd/edimar/Desktop/doutorado/doutorado04/bases/WEIR/finance/www.marketwatch.com/AMCC.html","Key Tech Upgrades & Downgrades (AMCC, CTXS, SCOR, EBAY, FFIV, GRMN, LSI, MFE, MCHP, OMTR, SONS, SYMC, THQI, WDC)"
"/sdd/edimar/Desktop/doutorado/doutorado04/bases/WEIR/finance/www.marketwatch.com/DHR.html","Emerson Added to Goldman Sachs Conviction Buy List (EMR, DHR, TYC)"
"/sdd/edimar/Desktop/doutorado/doutorado04/bases/WEIR/finance/www.marketwatch.com/HSY.html","Media Digest 11/12/2007 Reuters, WSJ, NYTimes, FT, Barron's"
"/sdd/edimar/Desktop/doutorado/doutorado04/bases/WEIR/finance/www.marketwatch.com/BC.html",Sovereign Funds Run And Hide (C)(JPM)(BSC)(MER)(LEH)(WM)
"/sdd/edimar/Desktop/doutorado/doutorado04/bases/WEIR/finance/www.marketwatch.com/ADSK.html","Top 10 Pre-Market Analyst Calls (ANDE, ADSK, CCL, RCL, KO, PEP, HAS, MAT, OVTI, ORCL, TGT)"
"/sdd/edimar/Desktop/doutorado/doutorado04/bases/WEIR/finance/www.marketwatch.com/SEE.html","Earnings Gappers (July 25, 2007)"
"/sdd/edimar/Desktop/doutorado/doutorado04/bases/WEIR/finance/www.marketwatch.com/SANM.html",Sanmina-SCI (SANM): A Quiet Company Announces Quiet Results
"/sdd/edimar/Desktop/doutorado/doutorado04/bases/WEIR/finance/www.marketwatch.com/PGR.html","Progressive Fights the Caveman: Recapitalization, Dividend, Buyback (PGR)"
"/sdd/edimar/Desktop/doutorado/doutorado04/bases/WEIR/finance/www.marketwatch.com/ACV.html","Top Pre-Market Analyst Upgrades (ACV, CMM, NCC, NT, RHD, TLAB, TRA, XLNX)"
"/sdd/edimar/Desktop/doutorado/doutorado04/bases/WEIR/finance/www.marketwatch.com/GPC.html","Top Pre-Market Analyst Downgrades (BBL, CBE, CPRT, DT, GPC, MPW, SAP, TRIN)"
"/sdd/edimar/Desktop/doutorado/doutorado04/bases/WEIR/finance/www.marketwatch.com/SPLS.html","Can Staples Earnings Change The ""going sideways"" Path?"
"/sdd/edimar/Desktop/doutorado/doutorado04/bases/WEIR/finance/www.marketwatch.com/CPWR.html",Pamplona Bulls Crush Compuware (CPWR)
"/sdd/edimar/Desktop/doutorado/doutorado04/bases/WEIR/finance/www.marketwatch.com/KMB.html","Goldman Sachs Changes Consumer Products Coverage (AVP, CL, BARE, PG, KMB)"
"/sdd/edimar/Desktop/doutorado/doutorado04/bases/WEIR/finance/www.marketwatch.com/THC.html","NYSE Short Interest, June 2007"
"/sdd/edimar/Desktop/doutorado/doutorado04/bases/WEIR/finance/www.marketwatch.com/ODP.html",The 52-Week Low Club
"/sdd/edimar/Desktop/doutorado/doutorado04/bases/WEIR/finance/www.marketwatch.com/PEG.html","Getting a Grip on Carbon Emissions (CEG, ED, PEG)"
"/sdd/edimar/Desktop/doutorado/doutorado04/bases/WEIR/finance/www.marketwatch.com/CBE.html","Top Pre-Market Analyst Downgrades (BBL, CBE, CPRT, DT, GPC, MPW, SAP, TRIN)"
"/sdd/edimar/Desktop/doutorado/doutorado04/bases/WEIR/finance/www.marketwatch.com/IP.html",The 52-Week Low Club (RF)(SNV)(IP)(FITB)(CENX)
"/sdd/edimar/Desktop/doutorado/doutorado04/bases/WEIR/finance/www.marketwatch.com/EIX.html","Pre-Market Analyst Calls (June 26, 2007)"
"/sdd/edimar/Desktop/doutorado/doutorado04/bases/WEIR/finance/www.marketwatch.com/CVG.html",The 52-Week Low Club 7/23/2008 (MIR)(CVG)(ADTC)(FORM)
