URL,EXTRACTED VALUE
"/sdd/edimar/Desktop/doutorado/doutorado04/bases/WEIR/finance/www.marketwatch.com/CSC.html","Caterpillar Retreats; Alcoa, Valero Off, Too"
"/sdd/edimar/Desktop/doutorado/doutorado04/bases/WEIR/finance/www.marketwatch.com/TROW.html",10-Q: PRICE T ROWE GROUP INC
"/sdd/edimar/Desktop/doutorado/doutorado04/bases/WEIR/finance/www.marketwatch.com/ALTR.html","Analysts Changing Semiconductor Ratings (ALTR, AMCC, ASML, BRCM, LSCC, MRVL, WFR, MU, PMCS, STM, XLNX)"
"/sdd/edimar/Desktop/doutorado/doutorado04/bases/WEIR/finance/www.marketwatch.com/WHR.html","Bill to Benefit Nuclear, Clean-Power Utilities"
"/sdd/edimar/Desktop/doutorado/doutorado04/bases/WEIR/finance/www.marketwatch.com/BDX.html",Becton Dickinson Profit Slips 5.4%
"/sdd/edimar/Desktop/doutorado/doutorado04/bases/WEIR/finance/www.marketwatch.com/NOVL.html",Red Hat: A Tempting Target
"/sdd/edimar/Desktop/doutorado/doutorado04/bases/WEIR/finance/www.marketwatch.com/MTG.html",Hoping Convertibles Can Turn a Corner
"/sdd/edimar/Desktop/doutorado/doutorado04/bases/WEIR/finance/www.marketwatch.com/FCEL.html",10-Q: FUELCELL ENERGY INC
"/sdd/edimar/Desktop/doutorado/doutorado04/bases/WEIR/finance/www.marketwatch.com/AVP.html",10-Q: AVON PRODUCTS INC
"/sdd/edimar/Desktop/doutorado/doutorado04/bases/WEIR/finance/www.marketwatch.com/KLAC.html","In Semiconductor-Equipment Stocks, Good Looks Are Deceiving"
"/sdd/edimar/Desktop/doutorado/doutorado04/bases/WEIR/finance/www.marketwatch.com/CPN.html",Calpine Swings to a Profit
"/sdd/edimar/Desktop/doutorado/doutorado04/bases/WEIR/finance/www.marketwatch.com/SNV.html",10-K/A: SYNOVUS FINANCIAL CORP
"/sdd/edimar/Desktop/doutorado/doutorado04/bases/WEIR/finance/www.marketwatch.com/AFL.html",Corporate Debt Whets Risk Appetite
"/sdd/edimar/Desktop/doutorado/doutorado04/bases/WEIR/finance/www.marketwatch.com/RMBS.html",Rambus Nears EU Settlement
"/sdd/edimar/Desktop/doutorado/doutorado04/bases/WEIR/finance/www.marketwatch.com/CTXS.html","Top Analyst Downgrades (BMO, BIG, BMR, CTXS, HMY, MRO, ODP)"
"/sdd/edimar/Desktop/doutorado/doutorado04/bases/WEIR/finance/www.marketwatch.com/ISIL.html","Early Bird Technology Analyst Upgrades & Downgrades (AAPL, GOOG, ELX, ISIL, ITRI, GRMN)"
"/sdd/edimar/Desktop/doutorado/doutorado04/bases/WEIR/finance/www.marketwatch.com/XLNX.html",Xilinx Loses Tax Ruling
"/sdd/edimar/Desktop/doutorado/doutorado04/bases/WEIR/finance/www.marketwatch.com/VRSN.html",Stocks in the Spotlight Monday
"/sdd/edimar/Desktop/doutorado/doutorado04/bases/WEIR/finance/www.marketwatch.com/LLTC.html",10-Q: LINEAR TECHNOLOGY CORP /CA/
"/sdd/edimar/Desktop/doutorado/doutorado04/bases/WEIR/finance/www.marketwatch.com/HOTT.html",Hot Topic Goes Cold; Buckle Wears a Smile
"/sdd/edimar/Desktop/doutorado/doutorado04/bases/WEIR/finance/www.marketwatch.com/EMR.html",Unease Brewing at Anheuser
"/sdd/edimar/Desktop/doutorado/doutorado04/bases/WEIR/finance/www.marketwatch.com/BMC.html",Oracle's Dicey Deal -- and Why It's a Sign of the Mergers Ahead
"/sdd/edimar/Desktop/doutorado/doutorado04/bases/WEIR/finance/www.marketwatch.com/CB.html",10-Q: CHUBB CORP
"/sdd/edimar/Desktop/doutorado/doutorado04/bases/WEIR/finance/www.marketwatch.com/BCE.html","Top 10 Pre-Market Analyst Upgrades & Downgrades (ALTR, AMZN, BCE, BIIB, LEAP, PDLI, CLUB, VAR, AUY)"
"/sdd/edimar/Desktop/doutorado/doutorado04/bases/WEIR/finance/www.marketwatch.com/SPLS.html",10-Q: STAPLES INC
"/sdd/edimar/Desktop/doutorado/doutorado04/bases/WEIR/finance/www.marketwatch.com/FLEX.html",10-K: FLEXTRONICS INTERNATIONAL LTD.
"/sdd/edimar/Desktop/doutorado/doutorado04/bases/WEIR/finance/www.marketwatch.com/CHINA.html",China Railway Construction Pricing At Top Of Range
"/sdd/edimar/Desktop/doutorado/doutorado04/bases/WEIR/finance/www.marketwatch.com/MEDX.html",Medarex Positive Data in Rheumatoid Arthritis Trial (MEDX)
"/sdd/edimar/Desktop/doutorado/doutorado04/bases/WEIR/finance/www.marketwatch.com/NVLS.html","Second Round Analyst Downgrades (AINV, T, GSIC, MFE, NVLS, SNH, TSO, TXRH, VZ)"
"/sdd/edimar/Desktop/doutorado/doutorado04/bases/WEIR/finance/www.marketwatch.com/PMCS.html",Intel's Guidance May Weigh on Chip Stocks
"/sdd/edimar/Desktop/doutorado/doutorado04/bases/WEIR/finance/www.marketwatch.com/SHW.html","Early Bird Analyst Upgrades & Downgrades (ENS, ERIC, SHW, UDR, BT, BLDR, PCAR, VE)"
"/sdd/edimar/Desktop/doutorado/doutorado04/bases/WEIR/finance/www.marketwatch.com/ELNK.html",AOL Should Cut Off Access
"/sdd/edimar/Desktop/doutorado/doutorado04/bases/WEIR/finance/www.marketwatch.com/MCK.html",McKesson Posts Flat Revenue
"/sdd/edimar/Desktop/doutorado/doutorado04/bases/WEIR/finance/www.marketwatch.com/AEOS.html",Wal-Mart to Sell Miley Cyrus Line
"/sdd/edimar/Desktop/doutorado/doutorado04/bases/WEIR/finance/www.marketwatch.com/MXIM.html",Notebooks Get a Boost From Chinese Farmers
"/sdd/edimar/Desktop/doutorado/doutorado04/bases/WEIR/finance/www.marketwatch.com/KKD.html",10-K: KRISPY KREME DOUGHNUTS INC
"/sdd/edimar/Desktop/doutorado/doutorado04/bases/WEIR/finance/www.marketwatch.com/BDK.html","Alcoa Drops, as Do Corning, Caterpillar"
"/sdd/edimar/Desktop/doutorado/doutorado04/bases/WEIR/finance/www.marketwatch.com/CREE.html",Clean-Energy Bill May Power These Picks
"/sdd/edimar/Desktop/doutorado/doutorado04/bases/WEIR/finance/www.marketwatch.com/RL.html",10-K: POLO RALPH LAUREN CORP
"/sdd/edimar/Desktop/doutorado/doutorado04/bases/WEIR/finance/www.marketwatch.com/VFC.html",Stocks in the Spotlight Wednesday
"/sdd/edimar/Desktop/doutorado/doutorado04/bases/WEIR/finance/www.marketwatch.com/MSO.html",Martha Stewart Shakes Up Ranks
"/sdd/edimar/Desktop/doutorado/doutorado04/bases/WEIR/finance/www.marketwatch.com/COMS.html",Cost Cutting Boosts 3Com
"/sdd/edimar/Desktop/doutorado/doutorado04/bases/WEIR/finance/www.marketwatch.com/APD.html",China Slowdown Stunts Entrepreneurs
"/sdd/edimar/Desktop/doutorado/doutorado04/bases/WEIR/finance/www.marketwatch.com/AFFX.html",The 52-Week Low Club (AFFX)(PIR)(AXL)
"/sdd/edimar/Desktop/doutorado/doutorado04/bases/WEIR/finance/www.marketwatch.com/WY.html",Weyerhaeuser Closes Two Lumber Mills
"/sdd/edimar/Desktop/doutorado/doutorado04/bases/WEIR/finance/www.marketwatch.com/MAR.html",Travel-Industry Weakness Hits Starwood
"/sdd/edimar/Desktop/doutorado/doutorado04/bases/WEIR/finance/www.marketwatch.com/ASH.html",Eagle Rock Drops 41%; Revlon Soars
"/sdd/edimar/Desktop/doutorado/doutorado04/bases/WEIR/finance/www.marketwatch.com/RDC.html","Top Analyst Upgrades & Downgrades (ATHN, ARUN, FAS, CVLT, DEO, NE, RDC, ZUMZ)"
"/sdd/edimar/Desktop/doutorado/doutorado04/bases/WEIR/finance/www.marketwatch.com/ETR.html","Top Analyst Upgrades (AZN, BMR, ETR, MMM, NFLX, NVO, SWK)"
"/sdd/edimar/Desktop/doutorado/doutorado04/bases/WEIR/finance/www.marketwatch.com/JBL.html",Stocks in the Spotlight Wednesday
"/sdd/edimar/Desktop/doutorado/doutorado04/bases/WEIR/finance/www.marketwatch.com/RFMD.html",Deltic Timber Falls 8%; Chico's FAS Gains 6%
"/sdd/edimar/Desktop/doutorado/doutorado04/bases/WEIR/finance/www.marketwatch.com/NCR.html",Blockbuster Earnings Sink 39%
"/sdd/edimar/Desktop/doutorado/doutorado04/bases/WEIR/finance/www.marketwatch.com/MMC.html",Marsh & McLennan Swings to Profit
"/sdd/edimar/Desktop/doutorado/doutorado04/bases/WEIR/finance/www.marketwatch.com/CEG.html","Buffett & Berkshire Keep Unloading Constellation Energy (CEG, BRK-A, BRK-B)"
"/sdd/edimar/Desktop/doutorado/doutorado04/bases/WEIR/finance/www.marketwatch.com/APA.html",Squeeze That Sponge
"/sdd/edimar/Desktop/doutorado/doutorado04/bases/WEIR/finance/www.marketwatch.com/PCG.html",10-Q: PG&E CORP
"/sdd/edimar/Desktop/doutorado/doutorado04/bases/WEIR/finance/www.marketwatch.com/BEN.html","Top Analyst Upgrades (FINL, FTI, FL, BEN, GS, KEY, NDAQ, NOK, NRG, VIP)"
"/sdd/edimar/Desktop/doutorado/doutorado04/bases/WEIR/finance/www.marketwatch.com/ZQK.html","Quiksilver, LCA-Vision: Biggest Price Decliners (ZQK, LCAV)"
"/sdd/edimar/Desktop/doutorado/doutorado04/bases/WEIR/finance/www.marketwatch.com/ETN.html","Buffett & Berkshire Hathaway Q1-2009 Holdings A to F (BRK-A, AXP, BAC, BNI, KMX, KO, CMCSA, CDCO, COP, CEG, COST, ETN)"
"/sdd/edimar/Desktop/doutorado/doutorado04/bases/WEIR/finance/www.marketwatch.com/SLM.html","SLM, Park Bancorp: Biggest Price Gainers (SLM, PFED)"
"/sdd/edimar/Desktop/doutorado/doutorado04/bases/WEIR/finance/www.marketwatch.com/PHG.html",Riveting Outlook for Steel
"/sdd/edimar/Desktop/doutorado/doutorado04/bases/WEIR/finance/www.marketwatch.com/VMC.html","Unusual Dividend Tracking (CAT, CLX, MSFT, TGT, TSCM, VMC, ACAS, IAF)"
"/sdd/edimar/Desktop/doutorado/doutorado04/bases/WEIR/finance/www.marketwatch.com/ITW.html",It's Earnings Season; Relax!
"/sdd/edimar/Desktop/doutorado/doutorado04/bases/WEIR/finance/www.marketwatch.com/GT.html",Stress Tests Relax Credit Markets
"/sdd/edimar/Desktop/doutorado/doutorado04/bases/WEIR/finance/www.marketwatch.com/PSUN.html",10-K: PACIFIC SUNWEAR OF CALIFORNIA INC
"/sdd/edimar/Desktop/doutorado/doutorado04/bases/WEIR/finance/www.marketwatch.com/MDR.html",An Energy Play With a Safety Net
"/sdd/edimar/Desktop/doutorado/doutorado04/bases/WEIR/finance/www.marketwatch.com/ED.html",Overheard
"/sdd/edimar/Desktop/doutorado/doutorado04/bases/WEIR/finance/www.marketwatch.com/AKAM.html",Oracle's Dicey Deal -- and Why It's a Sign of the Mergers Ahead
"/sdd/edimar/Desktop/doutorado/doutorado04/bases/WEIR/finance/www.marketwatch.com/HRB.html",A Buy Signal for a High-Tech Defense Stock
"/sdd/edimar/Desktop/doutorado/doutorado04/bases/WEIR/finance/www.marketwatch.com/CAH.html",Alcoa Advances 7% as AmEx Pulls Back
"/sdd/edimar/Desktop/doutorado/doutorado04/bases/WEIR/finance/www.marketwatch.com/TER.html","In Semiconductor-Equipment Stocks, Good Looks Are Deceiving"
"/sdd/edimar/Desktop/doutorado/doutorado04/bases/WEIR/finance/www.marketwatch.com/PDLI.html","Top Pre-Market Analyst Downgrades (AUDC, BDX, FUL, LEH, MEDX, NVDA, PDLI)"
"/sdd/edimar/Desktop/doutorado/doutorado04/bases/WEIR/finance/www.marketwatch.com/SRE.html","Smart Meter, Dumb Idea?"
"/sdd/edimar/Desktop/doutorado/doutorado04/bases/WEIR/finance/www.marketwatch.com/LRCX.html","KLA-Tencor Kills V-Bottom Chip Recovery Hopes (KLAC, AMAT, LRCX)"
"/sdd/edimar/Desktop/doutorado/doutorado04/bases/WEIR/finance/www.marketwatch.com/ATI.html","Top 10 Analyst Upgrades & Downgrades (ATI, APOL, AUO, ABX, BWLD, EXPD, HAL, JCOM, NOK, MTN)"
"/sdd/edimar/Desktop/doutorado/doutorado04/bases/WEIR/finance/www.marketwatch.com/AEP.html",Flipping Nuclear Power Back On
