URL,EXTRACTED VALUE
"/sdd/edimar/Desktop/doutorado/doutorado04/bases/WEIR/finance/www.marketwatch.com/HAS.html","Hasbro Brands Meet Ongoing Demand for Vintage and Graphic T-Shirts for Men, Women and Children"
"/sdd/edimar/Desktop/doutorado/doutorado04/bases/WEIR/finance/www.marketwatch.com/PPG.html","PPG Protective and Marine Coatings Names General Manager for U.S., Canada"
"/sdd/edimar/Desktop/doutorado/doutorado04/bases/WEIR/finance/www.marketwatch.com/CTB.html","Money Markets and More for Wednesday, May 6th"
"/sdd/edimar/Desktop/doutorado/doutorado04/bases/WEIR/finance/www.marketwatch.com/ARIA.html",Stocks in focus for Monday
"/sdd/edimar/Desktop/doutorado/doutorado04/bases/WEIR/finance/www.marketwatch.com/PFE.html",Gamma Pharmaceuticals Inc. Expands Retail Reach in Pennsylvania
"/sdd/edimar/Desktop/doutorado/doutorado04/bases/WEIR/finance/www.marketwatch.com/PWAV.html","Pitney Bowes, Smith & Wesson hit hard by soft forecasts"
"/sdd/edimar/Desktop/doutorado/doutorado04/bases/WEIR/finance/www.marketwatch.com/PTV.html",Pactiv profit jumps; shares rally late
"/sdd/edimar/Desktop/doutorado/doutorado04/bases/WEIR/finance/www.marketwatch.com/S.html",$8.7 Million in New Projects Awarded to WPCS
"/sdd/edimar/Desktop/doutorado/doutorado04/bases/WEIR/finance/www.marketwatch.com/PBI.html",Pitney Bowes Business Insight Announces the Verification of Its Insurance Premium Tax Solution By The Kentucky Department of Insurance
"/sdd/edimar/Desktop/doutorado/doutorado04/bases/WEIR/finance/www.marketwatch.com/WHR.html",Forget to Have and to Hold - Men and Women Take Vows to Load and Re-Fold When it Comes to Chores
"/sdd/edimar/Desktop/doutorado/doutorado04/bases/WEIR/finance/www.marketwatch.com/BDX.html",Stocks in focus for Tuesday
"/sdd/edimar/Desktop/doutorado/doutorado04/bases/WEIR/finance/www.marketwatch.com/WFC.html","Plastipak Holdings, Inc. to File Quarterly Report With Trustee for Holders of Its Senior Notes"
"/sdd/edimar/Desktop/doutorado/doutorado04/bases/WEIR/finance/www.marketwatch.com/IPG.html",Fitch Assigns 'BB+' Rating to Interpublic Group's Proposed Notes; Outlook Remains Positive
"/sdd/edimar/Desktop/doutorado/doutorado04/bases/WEIR/finance/www.marketwatch.com/SLAB.html",S&P braces for third test of major support
"/sdd/edimar/Desktop/doutorado/doutorado04/bases/WEIR/finance/www.marketwatch.com/FCEL.html",FuelCell Energy 3rd Quarter Loss/Shr 24c Versus Loss 37c
"/sdd/edimar/Desktop/doutorado/doutorado04/bases/WEIR/finance/www.marketwatch.com/KLAC.html",KLA-Tencor swings to quarterly loss; rev falls 49%
"/sdd/edimar/Desktop/doutorado/doutorado04/bases/WEIR/finance/www.marketwatch.com/SNV.html",Stocks in focus for Wednesday
"/sdd/edimar/Desktop/doutorado/doutorado04/bases/WEIR/finance/www.marketwatch.com/FLR.html",Fluor Receives Prestigious UK Safety Award
"/sdd/edimar/Desktop/doutorado/doutorado04/bases/WEIR/finance/www.marketwatch.com/GAP.html",Great Atlantic & Pacific loses $4.15 a share
"/sdd/edimar/Desktop/doutorado/doutorado04/bases/WEIR/finance/www.marketwatch.com/PAYX.html",Paychex third-quarter profit falls to 36 cents a share
"/sdd/edimar/Desktop/doutorado/doutorado04/bases/WEIR/finance/www.marketwatch.com/UNM.html",Unum reports quarterly net income of $164.9 mln
"/sdd/edimar/Desktop/doutorado/doutorado04/bases/WEIR/finance/www.marketwatch.com/CELG.html","Medical Marijuana Inc's CEO Bruce Perlowin to Appear on ""Corporate Strategies with Tim Connolly"" June 5th, 2009 at 10:00 a.m. ET"
"/sdd/edimar/Desktop/doutorado/doutorado04/bases/WEIR/finance/www.marketwatch.com/WMB.html",Williams Closes Joint-Venture Agreement to Enter Marcellus Shale
"/sdd/edimar/Desktop/doutorado/doutorado04/bases/WEIR/finance/www.marketwatch.com/KEYN.html",Technorati founder says blog growth exploding
"/sdd/edimar/Desktop/doutorado/doutorado04/bases/WEIR/finance/www.marketwatch.com/DE.html","Bank of America, Target, McDonald's in focus"
"/sdd/edimar/Desktop/doutorado/doutorado04/bases/WEIR/finance/www.marketwatch.com/CI.html","Annmarie Hagan Succeeds Michael W. Bell as Executive Vice President, Chief Financial Officer of CIGNA Corporation"
"/sdd/edimar/Desktop/doutorado/doutorado04/bases/WEIR/finance/www.marketwatch.com/MCD.html",McDonald's caught in currency crossfire
"/sdd/edimar/Desktop/doutorado/doutorado04/bases/WEIR/finance/www.marketwatch.com/CA.html",CA Clarity PPM Positioned in 'Leaders' Quadrant for Project and Portfolio Management by Leading Analyst Firm
"/sdd/edimar/Desktop/doutorado/doutorado04/bases/WEIR/finance/www.marketwatch.com/BCR.html",Health-care stocks are just the tonic for ailing portfolios
"/sdd/edimar/Desktop/doutorado/doutorado04/bases/WEIR/finance/www.marketwatch.com/RIG.html",Transocean net income falls 18%
"/sdd/edimar/Desktop/doutorado/doutorado04/bases/WEIR/finance/www.marketwatch.com/HELX.html",Brooks Automation Swings To 2nd Quarter Loss Of $8.29M
"/sdd/edimar/Desktop/doutorado/doutorado04/bases/WEIR/finance/www.marketwatch.com/LNC.html","Dividend Declaration: Delaware Investments(R) Dividend and Income Fund, Inc. Announces Dividends"
"/sdd/edimar/Desktop/doutorado/doutorado04/bases/WEIR/finance/www.marketwatch.com/UPS.html",UPS Revises Guidelines for Employee Stock Sales
"/sdd/edimar/Desktop/doutorado/doutorado04/bases/WEIR/finance/www.marketwatch.com/NVDA.html",Stock Alerts on Active Industry Leaders; Issued by InvestorSoup.com
"/sdd/edimar/Desktop/doutorado/doutorado04/bases/WEIR/finance/www.marketwatch.com/BSX.html",Boston Scientific Announces Two Directors Leave Board as Burns Named CEO of Xerox and Johnson Confirmed as Under Secretary of Energy
"/sdd/edimar/Desktop/doutorado/doutorado04/bases/WEIR/finance/www.marketwatch.com/SO.html","Southern Company, Environmental Partners Award Eight Wetland Restoration Grants Through Five Star Program"
"/sdd/edimar/Desktop/doutorado/doutorado04/bases/WEIR/finance/www.marketwatch.com/NVLS.html",Novellus Systems swings to first-quarter loss
"/sdd/edimar/Desktop/doutorado/doutorado04/bases/WEIR/finance/www.marketwatch.com/CMA.html",Comerica Directors Declare Dividend
"/sdd/edimar/Desktop/doutorado/doutorado04/bases/WEIR/finance/www.marketwatch.com/INTC.html",COMPUTEX TAIPEI Shows Influences on Global Hi-Tech Industry
"/sdd/edimar/Desktop/doutorado/doutorado04/bases/WEIR/finance/www.marketwatch.com/SIAL.html","BioInformatics, LLC New Report -- The Market for Antibodies: Keys to Success for Commercial Suppliers, Vol. III"
"/sdd/edimar/Desktop/doutorado/doutorado04/bases/WEIR/finance/www.marketwatch.com/MCK.html","McKesson profit dips slightly, sales stay flat"
"/sdd/edimar/Desktop/doutorado/doutorado04/bases/WEIR/finance/www.marketwatch.com/SUN.html",Sunoco Completes Sale of Tulsa Refinery
"/sdd/edimar/Desktop/doutorado/doutorado04/bases/WEIR/finance/www.marketwatch.com/AEOS.html",Zale's shares bid sharply lower in mixed sector
"/sdd/edimar/Desktop/doutorado/doutorado04/bases/WEIR/finance/www.marketwatch.com/UTSI.html",Stocks in focus for Tuesday
"/sdd/edimar/Desktop/doutorado/doutorado04/bases/WEIR/finance/www.marketwatch.com/RL.html",Polo Ralph Lauren's fourth-quarter profit falls
"/sdd/edimar/Desktop/doutorado/doutorado04/bases/WEIR/finance/www.marketwatch.com/FNM.html",Veros' Valuation Risk Management System Meets New Fannie Mae Requirement
"/sdd/edimar/Desktop/doutorado/doutorado04/bases/WEIR/finance/www.marketwatch.com/ALL.html",Allstate Recognized as a Top Company for Multicultural Women
"/sdd/edimar/Desktop/doutorado/doutorado04/bases/WEIR/finance/www.marketwatch.com/HP.html",Venezuela opposition reflects on loss; economists warn of trouble
"/sdd/edimar/Desktop/doutorado/doutorado04/bases/WEIR/finance/www.marketwatch.com/PZZA.html",Investors can learn from companies' March Madness ad onslaught
"/sdd/edimar/Desktop/doutorado/doutorado04/bases/WEIR/finance/www.marketwatch.com/PCAR.html",Stocks in focus for Tuesday
"/sdd/edimar/Desktop/doutorado/doutorado04/bases/WEIR/finance/www.marketwatch.com/GR.html",Goodrich to Address the Macquarie Aerospace and Defense Conference 2009
"/sdd/edimar/Desktop/doutorado/doutorado04/bases/WEIR/finance/www.marketwatch.com/CMCSK.html",Comcast Creates Digital Broadcast Transition Rapid Response Team
"/sdd/edimar/Desktop/doutorado/doutorado04/bases/WEIR/finance/www.marketwatch.com/DDS.html",Monday's biggest gaining and declining stocks
"/sdd/edimar/Desktop/doutorado/doutorado04/bases/WEIR/finance/www.marketwatch.com/ERTS.html",Millions Embrace The Sims 3 with Biggest Launch Week in Franchise History
"/sdd/edimar/Desktop/doutorado/doutorado04/bases/WEIR/finance/www.marketwatch.com/HGSI.html","S&P and the Dow, undaunted by 200-day averages"
"/sdd/edimar/Desktop/doutorado/doutorado04/bases/WEIR/finance/www.marketwatch.com/ADI.html",Analog Devices Announces Financial Results for the Second Quarter of Fiscal Year 2009
"/sdd/edimar/Desktop/doutorado/doutorado04/bases/WEIR/finance/www.marketwatch.com/AIG.html",AIG To Sell Consumer Finance Operations in Argentina
"/sdd/edimar/Desktop/doutorado/doutorado04/bases/WEIR/finance/www.marketwatch.com/WMI.html",Stocks in focus for Wednesday
"/sdd/edimar/Desktop/doutorado/doutorado04/bases/WEIR/finance/www.marketwatch.com/RDC.html",Sector falls with broad market as oil cools off
"/sdd/edimar/Desktop/doutorado/doutorado04/bases/WEIR/finance/www.marketwatch.com/ANDW.html",CommScope Makes Environmental Stewardship Part of Its Advanced Network Connectivity Technologies
"/sdd/edimar/Desktop/doutorado/doutorado04/bases/WEIR/finance/www.marketwatch.com/MHP.html",Winners Announced for the McGraw-Hill - Magna Publications Scholarly Work on Teaching and Learning Award
"/sdd/edimar/Desktop/doutorado/doutorado04/bases/WEIR/finance/www.marketwatch.com/G.html",HealthEdge(R) and Click4Care(R) Announce Common Leadership
"/sdd/edimar/Desktop/doutorado/doutorado04/bases/WEIR/finance/www.marketwatch.com/RFMD.html",RFMD(R) Introduces High Efficiency Linear Power Amplifier Designed for WiFi and WiMAX Applications
"/sdd/edimar/Desktop/doutorado/doutorado04/bases/WEIR/finance/www.marketwatch.com/VZ.html","Fitch: DIRECTV Adds 460,000 New Video Subscribers Added During 1Q; Leads Industry"
"/sdd/edimar/Desktop/doutorado/doutorado04/bases/WEIR/finance/www.marketwatch.com/CINF.html",Cincinnati Financial profit falls
"/sdd/edimar/Desktop/doutorado/doutorado04/bases/WEIR/finance/www.marketwatch.com/GE.html",Ricoh Americas Corporation launches Distribution Finance Program with GE Capital to Ricoh U.S. Dealers
"/sdd/edimar/Desktop/doutorado/doutorado04/bases/WEIR/finance/www.marketwatch.com/R.html",Asbury Park Press Selects Ryder for Transportation Services
"/sdd/edimar/Desktop/doutorado/doutorado04/bases/WEIR/finance/www.marketwatch.com/PNC.html",PNC Global Investment Servicing Launches Fund Distribution Support in Asia
"/sdd/edimar/Desktop/doutorado/doutorado04/bases/WEIR/finance/www.marketwatch.com/LUV.html",Southwest Airlines Celebrates 15 Years of LUV Across the Northwest
"/sdd/edimar/Desktop/doutorado/doutorado04/bases/WEIR/finance/www.marketwatch.com/ADM.html",Archer Daniels Midland 3Q profit falls
"/sdd/edimar/Desktop/doutorado/doutorado04/bases/WEIR/finance/www.marketwatch.com/UNH.html","OptumHealth, American Well Join Forces to Provide First Nationwide Service Offering Consumers 24/7 Online Access to Physicians"
"/sdd/edimar/Desktop/doutorado/doutorado04/bases/WEIR/finance/www.marketwatch.com/ZQK.html",Friday's biggest gaining and losing stocks
"/sdd/edimar/Desktop/doutorado/doutorado04/bases/WEIR/finance/www.marketwatch.com/CCE.html",Coca-Cola Enterprises affirms guidance
"/sdd/edimar/Desktop/doutorado/doutorado04/bases/WEIR/finance/www.marketwatch.com/FCX.html",Freeport-McMoRan's net income tumbles 96%
"/sdd/edimar/Desktop/doutorado/doutorado04/bases/WEIR/finance/www.marketwatch.com/DOV.html",Stocks in focus for Wednesday
"/sdd/edimar/Desktop/doutorado/doutorado04/bases/WEIR/finance/www.marketwatch.com/SLM.html",New National Study from Sallie Mae and Gallup Provides Insights into How America Saves for College
"/sdd/edimar/Desktop/doutorado/doutorado04/bases/WEIR/finance/www.marketwatch.com/PHG.html",Peace Bridge Shines With LED Lighting Transformation by Philips
"/sdd/edimar/Desktop/doutorado/doutorado04/bases/WEIR/finance/www.marketwatch.com/CAG.html",In Hot Dog Wars There Can Only Be One Top Dog: Hebrew National(R) Lets America Decide
"/sdd/edimar/Desktop/doutorado/doutorado04/bases/WEIR/finance/www.marketwatch.com/NEWP.html","S&P 500 stalls again just under 1,300 points"
"/sdd/edimar/Desktop/doutorado/doutorado04/bases/WEIR/finance/www.marketwatch.com/AMZN.html","Today's top stock alerts include: ETFC, AMGN, BRCD, OCNF, BRCM, AMZN"
"/sdd/edimar/Desktop/doutorado/doutorado04/bases/WEIR/finance/www.marketwatch.com/NWL.html","Expo Holdings Receives Order From Newell Rubbermaid, Inc."
"/sdd/edimar/Desktop/doutorado/doutorado04/bases/WEIR/finance/www.marketwatch.com/QLGC.html",Fibre Channel Industry Association Validates Fibre Channel Over Ethernet (FCoE) Interoperability in Multi-Vendor Testing
"/sdd/edimar/Desktop/doutorado/doutorado04/bases/WEIR/finance/www.marketwatch.com/DOW.html","PennyStocksLove alerted its members on: COP, CVS, CVX, DOW, F, WFC"
"/sdd/edimar/Desktop/doutorado/doutorado04/bases/WEIR/finance/www.marketwatch.com/CSCO.html",Draper Fisher Jurvetson and Cisco to Hold Global Business Plan Competition via Cisco TelePresence(TM)
"/sdd/edimar/Desktop/doutorado/doutorado04/bases/WEIR/finance/www.marketwatch.com/TBL.html",U.S. markets hesitate at major resistance
"/sdd/edimar/Desktop/doutorado/doutorado04/bases/WEIR/finance/www.marketwatch.com/EBAY.html","Today's alerts include: NWSA, RIMM, EBAY, SBUX, DTV, JAVA"
"/sdd/edimar/Desktop/doutorado/doutorado04/bases/WEIR/finance/www.marketwatch.com/JNPR.html","NI Technology Research Updates Outlooks for Intel, Wind River Systems, Juniper Networks, Goldman Sachs, Bank of America and JPMorgan Chase"
"/sdd/edimar/Desktop/doutorado/doutorado04/bases/WEIR/finance/www.marketwatch.com/HON.html",Honeywell Wins Extended Contract to Continue Marine Corps Support for Logistics Support Services
"/sdd/edimar/Desktop/doutorado/doutorado04/bases/WEIR/finance/www.marketwatch.com/CAH.html",Cardinal Health profit falls but pharma sales rise
"/sdd/edimar/Desktop/doutorado/doutorado04/bases/WEIR/finance/www.marketwatch.com/TER.html",A buy for technology stocks from a value manager
"/sdd/edimar/Desktop/doutorado/doutorado04/bases/WEIR/finance/www.marketwatch.com/ABX.html",Gold and silver lose some luster after jobs report
"/sdd/edimar/Desktop/doutorado/doutorado04/bases/WEIR/finance/www.marketwatch.com/MMM.html",3M Announces Management Changes
"/sdd/edimar/Desktop/doutorado/doutorado04/bases/WEIR/finance/www.marketwatch.com/CVS.html","PennyStocksLove alerted its members on: COP, CVS, CVX, DOW, F, WFC"
"/sdd/edimar/Desktop/doutorado/doutorado04/bases/WEIR/finance/www.marketwatch.com/HMC.html",Honda Begins Sales of Honda Safety Navi Safe Driving Educational Software for PC-based Auto Driving Simulator
"/sdd/edimar/Desktop/doutorado/doutorado04/bases/WEIR/finance/www.marketwatch.com/N.html",NetSuite CFO Jim McGeever to Present at Upcoming Investor Conferences
"/sdd/edimar/Desktop/doutorado/doutorado04/bases/WEIR/finance/www.marketwatch.com/SWY.html","Today's top stock alerts include: SWY, T, TGT, TWX, UNH"
"/sdd/edimar/Desktop/doutorado/doutorado04/bases/WEIR/finance/www.marketwatch.com/STJ.html",LifeTech Capital Group Joins Jesup & Lamont
"/sdd/edimar/Desktop/doutorado/doutorado04/bases/WEIR/finance/www.marketwatch.com/FDX.html",FedEx SmartPost Signs Lease at the Hardy Distribution Center
"/sdd/edimar/Desktop/doutorado/doutorado04/bases/WEIR/finance/www.marketwatch.com/BMS.html",Only the fittest stocks are surviving this Darwinian market
"/sdd/edimar/Desktop/doutorado/doutorado04/bases/WEIR/finance/www.marketwatch.com/TROW.html",Franklin Resources' profit falls 70%
"/sdd/edimar/Desktop/doutorado/doutorado04/bases/WEIR/finance/www.marketwatch.com/PG.html",Procter & Gamble Uses SPSS Predictive Analytics Software for Product and Branding Research
"/sdd/edimar/Desktop/doutorado/doutorado04/bases/WEIR/finance/www.marketwatch.com/ALTR.html","Altera Ships Highest Density, Highest System-Bandwidth FPGA Targeting 40G/100G Applications"
"/sdd/edimar/Desktop/doutorado/doutorado04/bases/WEIR/finance/www.marketwatch.com/BBBY.html",U.S. markets absorb another round of bad news
"/sdd/edimar/Desktop/doutorado/doutorado04/bases/WEIR/finance/www.marketwatch.com/MSTR.html",Business Objects: MicroStrategy Loses Patent Suit Appeal
"/sdd/edimar/Desktop/doutorado/doutorado04/bases/WEIR/finance/www.marketwatch.com/CCL.html",Closing bell report from MarketWatch Radio Network
"/sdd/edimar/Desktop/doutorado/doutorado04/bases/WEIR/finance/www.marketwatch.com/NOC.html",Northrop Grumman Awarded A-10 Thunderbolt II Total Life-Cycle Program Support Contract
"/sdd/edimar/Desktop/doutorado/doutorado04/bases/WEIR/finance/www.marketwatch.com/WOR.html","Worthington Industries posts quarterly loss, to shut plant"
"/sdd/edimar/Desktop/doutorado/doutorado04/bases/WEIR/finance/www.marketwatch.com/LEH.html",Credit-crunch and bear-market indicator tumbles
"/sdd/edimar/Desktop/doutorado/doutorado04/bases/WEIR/finance/www.marketwatch.com/NTRS.html",youDevise HIP Client Northern Trust Named Fund of Hedge Funds Administrator of the Year
"/sdd/edimar/Desktop/doutorado/doutorado04/bases/WEIR/finance/www.marketwatch.com/RMBS.html",U.S. stock futures signal slightly weaker start
"/sdd/edimar/Desktop/doutorado/doutorado04/bases/WEIR/finance/www.marketwatch.com/CHIR.html","Growth in the Parkinson's Disease Drug Market, Fueled by the Launch of Several New Therapies, Will be Offset by Generic Erosion of Key Agents"
"/sdd/edimar/Desktop/doutorado/doutorado04/bases/WEIR/finance/www.marketwatch.com/HUM.html",Humana Inc. to Present at the 2009 INVESTKentucky Conference
"/sdd/edimar/Desktop/doutorado/doutorado04/bases/WEIR/finance/www.marketwatch.com/NIKU.html",CA Clarity PPM Positioned in 'Leaders' Quadrant for Project and Portfolio Management by Leading Analyst Firm
"/sdd/edimar/Desktop/doutorado/doutorado04/bases/WEIR/finance/www.marketwatch.com/ISIL.html",A bear-market rally is underway
"/sdd/edimar/Desktop/doutorado/doutorado04/bases/WEIR/finance/www.marketwatch.com/CAL.html",AMIGOS and Continental Airlines Announce Latin America Photo Contest
"/sdd/edimar/Desktop/doutorado/doutorado04/bases/WEIR/finance/www.marketwatch.com/DLX.html",Deluxe Corp 4th Quarter Net Falls To $40.2M; 2006 Had Tax Benefit
"/sdd/edimar/Desktop/doutorado/doutorado04/bases/WEIR/finance/www.marketwatch.com/BRCM.html","Today's top stock alerts include: ETFC, AMGN, BRCD, OCNF, BRCM, AMZN"
"/sdd/edimar/Desktop/doutorado/doutorado04/bases/WEIR/finance/www.marketwatch.com/A.html","TRADE NEWS: Agilent Technologies' New Power Meters, Enhanced Power Sensors Improve on Popular Older Models"
"/sdd/edimar/Desktop/doutorado/doutorado04/bases/WEIR/finance/www.marketwatch.com/BK.html",The Bank of New York Mellon to Repurchase Preferred Stock Related to TARP Capital Investment
"/sdd/edimar/Desktop/doutorado/doutorado04/bases/WEIR/finance/www.marketwatch.com/KO.html",AirTran Airways Freshens Inflight Drinks Menu With Fresca(R)
"/sdd/edimar/Desktop/doutorado/doutorado04/bases/WEIR/finance/www.marketwatch.com/TIF.html","Updates, advisories and surprises"
"/sdd/edimar/Desktop/doutorado/doutorado04/bases/WEIR/finance/www.marketwatch.com/CHINA.html",CDC Software Agrees to Acquire Informance for Expansion of CDC Factory Product Line
"/sdd/edimar/Desktop/doutorado/doutorado04/bases/WEIR/finance/www.marketwatch.com/TGT.html","Today's top stock alerts include: SWY, T, TGT, TWX, UNH, WLP"
"/sdd/edimar/Desktop/doutorado/doutorado04/bases/WEIR/finance/www.marketwatch.com/USM.html",Telecom stocks retreat en masse in early trades
"/sdd/edimar/Desktop/doutorado/doutorado04/bases/WEIR/finance/www.marketwatch.com/MDT.html","Study Shows Consistent Use of Insulin Pump Therapy, Augmented with Continuous Glucose Monitoring, Results in Significant A1C Reductions"
"/sdd/edimar/Desktop/doutorado/doutorado04/bases/WEIR/finance/www.marketwatch.com/T.html",Outfit Dad With the Power of Touch and TV This Father's Day
"/sdd/edimar/Desktop/doutorado/doutorado04/bases/WEIR/finance/www.marketwatch.com/KYO.html",Solar Energy Initiatives Finalizes $6MM Contract for Solar Installation
"/sdd/edimar/Desktop/doutorado/doutorado04/bases/WEIR/finance/www.marketwatch.com/SHW.html",Thursday's biggest gaining and declining stocks
"/sdd/edimar/Desktop/doutorado/doutorado04/bases/WEIR/finance/www.marketwatch.com/ELNK.html",EarthLink shares fall on AOL bid speculation
"/sdd/edimar/Desktop/doutorado/doutorado04/bases/WEIR/finance/www.marketwatch.com/AGN.html",Metastorm Growth and Leadership Continue
"/sdd/edimar/Desktop/doutorado/doutorado04/bases/WEIR/finance/www.marketwatch.com/MDP.html","Updates, advisories and surprises"
"/sdd/edimar/Desktop/doutorado/doutorado04/bases/WEIR/finance/www.marketwatch.com/NXTP.html",$8.7 Million in New Projects Awarded to WPCS
"/sdd/edimar/Desktop/doutorado/doutorado04/bases/WEIR/finance/www.marketwatch.com/HNZ.html",Heinz fourth-quarter profit slips
"/sdd/edimar/Desktop/doutorado/doutorado04/bases/WEIR/finance/www.marketwatch.com/APC.html",Anadarko Announces Pricing of $900 Million of Senior Notes
"/sdd/edimar/Desktop/doutorado/doutorado04/bases/WEIR/finance/www.marketwatch.com/CVX.html","Integrity Media: Profile for Investors of Oil and Gas Companies SGCA, BP, CVX, XOM, and COP Released"
"/sdd/edimar/Desktop/doutorado/doutorado04/bases/WEIR/finance/www.marketwatch.com/ANF.html",Johnson: Days of easy rallies are over
"/sdd/edimar/Desktop/doutorado/doutorado04/bases/WEIR/finance/www.marketwatch.com/SVU.html",SUPERVALU PHARMACIES Aids Migraine Sufferers for a Cause
"/sdd/edimar/Desktop/doutorado/doutorado04/bases/WEIR/finance/www.marketwatch.com/RTN.html",EODT Announces Appointment of Senior Vice President of Business Development
"/sdd/edimar/Desktop/doutorado/doutorado04/bases/WEIR/finance/www.marketwatch.com/BDK.html",Black & Decker cuts profit forecast for the year
"/sdd/edimar/Desktop/doutorado/doutorado04/bases/WEIR/finance/www.marketwatch.com/MET.html",MetLife Launches Online Open Enrollment Portal for Employers and Brokers
"/sdd/edimar/Desktop/doutorado/doutorado04/bases/WEIR/finance/www.marketwatch.com/BNI.html",BNSF Crews Begin $11 Million Track Maintenance Project in Montana
"/sdd/edimar/Desktop/doutorado/doutorado04/bases/WEIR/finance/www.marketwatch.com/XOM.html",ExxonMobil Honors Local Hispanic Students for Outstanding Achievements in Engineering and Mathematics
"/sdd/edimar/Desktop/doutorado/doutorado04/bases/WEIR/finance/www.marketwatch.com/VFC.html","Updates, advisories and surprises"
"/sdd/edimar/Desktop/doutorado/doutorado04/bases/WEIR/finance/www.marketwatch.com/BAC.html","NI Technology Research Updates Outlooks for Intel, Wind River Systems, Juniper Networks, Goldman Sachs, Bank of America and JPMorgan Chase"
"/sdd/edimar/Desktop/doutorado/doutorado04/bases/WEIR/finance/www.marketwatch.com/LTD.html",Retail stocks slip; Limited advances
"/sdd/edimar/Desktop/doutorado/doutorado04/bases/WEIR/finance/www.marketwatch.com/GLW.html",Corning to Receive Awards at SID 2009
"/sdd/edimar/Desktop/doutorado/doutorado04/bases/WEIR/finance/www.marketwatch.com/ENZ.html",Enzo Biochem to sell 3.3M shares at $14 each
"/sdd/edimar/Desktop/doutorado/doutorado04/bases/WEIR/finance/www.marketwatch.com/PX.html",Praxair says recession hits first-quarter results
"/sdd/edimar/Desktop/doutorado/doutorado04/bases/WEIR/finance/www.marketwatch.com/COMS.html",3Com Executives to Present at Barclays Capital Worldwide Wireless and Wireline Conference in New York
"/sdd/edimar/Desktop/doutorado/doutorado04/bases/WEIR/finance/www.marketwatch.com/PMTC.html",PTC Expands Product Analytics Strategy with Acquisition of Relex Software Corporation
"/sdd/edimar/Desktop/doutorado/doutorado04/bases/WEIR/finance/www.marketwatch.com/LIZ.html",Retail stocks fall on a surprise April sales drop
"/sdd/edimar/Desktop/doutorado/doutorado04/bases/WEIR/finance/www.marketwatch.com/COKE.html",MedCath's James Harris to become Coca-Cola Bottling CFO
"/sdd/edimar/Desktop/doutorado/doutorado04/bases/WEIR/finance/www.marketwatch.com/APD.html",Air Products and EPRI Working Together on ITM Oxygen Technology for Use in Advanced Clean Power Generation Systems
"/sdd/edimar/Desktop/doutorado/doutorado04/bases/WEIR/finance/www.marketwatch.com/CRGN.html",Monday's biggest gaining and declining stocks
"/sdd/edimar/Desktop/doutorado/doutorado04/bases/WEIR/finance/www.marketwatch.com/KSWS.html",Thursday's biggest stock gainers and decliners
"/sdd/edimar/Desktop/doutorado/doutorado04/bases/WEIR/finance/www.marketwatch.com/OSIS.html",OSI Systems sees fourth-quarter revenue up 22%
"/sdd/edimar/Desktop/doutorado/doutorado04/bases/WEIR/finance/www.marketwatch.com/YHOO.html",Bankrate: Mortgage Rates Move Higher
"/sdd/edimar/Desktop/doutorado/doutorado04/bases/WEIR/finance/www.marketwatch.com/BBT.html",BrandPartners Announces First Quarter Results
"/sdd/edimar/Desktop/doutorado/doutorado04/bases/WEIR/finance/www.marketwatch.com/KBH.html","UPDATE: Hagens Berman: Homeowners Claim KB Home, Countrywide and LandSafe Rigged Appraisals"
"/sdd/edimar/Desktop/doutorado/doutorado04/bases/WEIR/finance/www.marketwatch.com/GOOG.html","InsanePicks alerts you on hot stocks: QQQQ, DRYS, MSFT, AAPL, GOOG, CSCO"
"/sdd/edimar/Desktop/doutorado/doutorado04/bases/WEIR/finance/www.marketwatch.com/LLY.html",Meta-Analysis of Clinical Data Showed No Increased Risk of Cardiovascular Events Associated With Exenatide Use: Data Presented at ADA 2009
"/sdd/edimar/Desktop/doutorado/doutorado04/bases/WEIR/finance/www.marketwatch.com/ADPT.html",Adaptec's quarterly loss narrows
