URL,EXTRACTED VALUE
"/sdd/edimar/Desktop/doutorado/doutorado04/bases/WEIR/finance/www.marketwatch.com/ABT.html",Abbott and AstraZeneca Extend Relationship to Include Co-Promotion of TRILIPIX(R) (fenofibric acid)
"/sdd/edimar/Desktop/doutorado/doutorado04/bases/WEIR/finance/www.marketwatch.com/NSM.html",Avnet and Xilinx Open Registration for X-fest 2009
"/sdd/edimar/Desktop/doutorado/doutorado04/bases/WEIR/finance/www.marketwatch.com/CEG.html","Constellation Energy Names Shameek Konar Senior Vice President, Corporate Strategy and Development"
"/sdd/edimar/Desktop/doutorado/doutorado04/bases/WEIR/finance/www.marketwatch.com/MMC.html","Veritas Capital Acquires Kroll Government Services, Inc."
"/sdd/edimar/Desktop/doutorado/doutorado04/bases/WEIR/finance/www.marketwatch.com/DRI.html",Darden shares heat up; MGM swings to more than $1 billion loss
"/sdd/edimar/Desktop/doutorado/doutorado04/bases/WEIR/finance/www.marketwatch.com/IR.html",Facilities Engineers Learn to Develop a Strategic Energy Plan During Trane and AFE Webinar
"/sdd/edimar/Desktop/doutorado/doutorado04/bases/WEIR/finance/www.marketwatch.com/FRE.html",Freddie Mac Announces Results of Tender Offers
"/sdd/edimar/Desktop/doutorado/doutorado04/bases/WEIR/finance/www.marketwatch.com/NUE.html","Nucor posts loss, sees deeper loss in next quarter"
"/sdd/edimar/Desktop/doutorado/doutorado04/bases/WEIR/finance/www.marketwatch.com/JKHY.html",The top performers' most popular tech stocks
"/sdd/edimar/Desktop/doutorado/doutorado04/bases/WEIR/finance/www.marketwatch.com/SGP.html",Adult Glioblastoma: Best Approaches to a Challenging Diagnosis
"/sdd/edimar/Desktop/doutorado/doutorado04/bases/WEIR/finance/www.marketwatch.com/PSS.html",Stocks in focus for Tuesday
"/sdd/edimar/Desktop/doutorado/doutorado04/bases/WEIR/finance/www.marketwatch.com/PCG.html",PG&E and BrightSource Sign Record Solar Power Deal
"/sdd/edimar/Desktop/doutorado/doutorado04/bases/WEIR/finance/www.marketwatch.com/XRX.html",ProMOS Technologies DRAM Patents Posed to Sell at Ocean Tomo Live IP Auction on July 23rd in Chicago
"/sdd/edimar/Desktop/doutorado/doutorado04/bases/WEIR/finance/www.marketwatch.com/ARBA.html",Carlsberg Group Drives Spend Management Success With Ariba
"/sdd/edimar/Desktop/doutorado/doutorado04/bases/WEIR/finance/www.marketwatch.com/BEN.html","Templeton Dragon Fund, Inc. (""TDF"") to Withdraw Osaka Securities Exchange Listing; Retains New York Stock Exchange Listing"
"/sdd/edimar/Desktop/doutorado/doutorado04/bases/WEIR/finance/www.marketwatch.com/UIS.html",SS&C Acquires MAXIMIS Business from Unisys
"/sdd/edimar/Desktop/doutorado/doutorado04/bases/WEIR/finance/www.marketwatch.com/ITW.html",Thursday's biggest gaining and declining stocks
"/sdd/edimar/Desktop/doutorado/doutorado04/bases/WEIR/finance/www.marketwatch.com/ADVS.html",G2 Systems Named to Advent Software's Alliance Partner Program
"/sdd/edimar/Desktop/doutorado/doutorado04/bases/WEIR/finance/www.marketwatch.com/JWN.html",Quova Appoints Tim Krozek to Head Global Sales
"/sdd/edimar/Desktop/doutorado/doutorado04/bases/WEIR/finance/www.marketwatch.com/DELL.html","Dell, Goodwill Expand Free Computer Recycling Program to Seven More States"
"/sdd/edimar/Desktop/doutorado/doutorado04/bases/WEIR/finance/www.marketwatch.com/DEL.html","Deltic Timber quarterly earns, revenue fall"
"/sdd/edimar/Desktop/doutorado/doutorado04/bases/WEIR/finance/www.marketwatch.com/CAT.html","LoveForStocks issued alerts to members on: BG, BRKA, C, CAH, CAT"
"/sdd/edimar/Desktop/doutorado/doutorado04/bases/WEIR/finance/www.marketwatch.com/PSUN.html","American Apparel surges on investment, leading sector gains"
"/sdd/edimar/Desktop/doutorado/doutorado04/bases/WEIR/finance/www.marketwatch.com/DIS.html","Broadcast networks, advertisers stalled in upfront"
"/sdd/edimar/Desktop/doutorado/doutorado04/bases/WEIR/finance/www.marketwatch.com/PBG.html",Shareholders of the Pepsi Bottling Group Re-Elect Directors
"/sdd/edimar/Desktop/doutorado/doutorado04/bases/WEIR/finance/www.marketwatch.com/HBAN.html",Huntington Bancshares Announces Amendment to Cash Tender Offer for Trust Preferred Securities
"/sdd/edimar/Desktop/doutorado/doutorado04/bases/WEIR/finance/www.marketwatch.com/TUP.html","When going gets tough, some fund managers go shopping for stocks"
"/sdd/edimar/Desktop/doutorado/doutorado04/bases/WEIR/finance/www.marketwatch.com/CHL.html",Taiwan may reportedly amend China Mobile deal
"/sdd/edimar/Desktop/doutorado/doutorado04/bases/WEIR/finance/www.marketwatch.com/FPL.html",NextEra Energy Resources Announces Completion of Subsidiary Financing
"/sdd/edimar/Desktop/doutorado/doutorado04/bases/WEIR/finance/www.marketwatch.com/AOC.html",Aon Consulting Announces U.S. Vice President Promotions
"/sdd/edimar/Desktop/doutorado/doutorado04/bases/WEIR/finance/www.marketwatch.com/SYY.html",Stocks in focus for Monday
"/sdd/edimar/Desktop/doutorado/doutorado04/bases/WEIR/finance/www.marketwatch.com/AVA.html","Updates, advisories and surprises"
"/sdd/edimar/Desktop/doutorado/doutorado04/bases/WEIR/finance/www.marketwatch.com/AZO.html",Stocks in focus for Wednesday
"/sdd/edimar/Desktop/doutorado/doutorado04/bases/WEIR/finance/www.marketwatch.com/FMC.html",Nasdaq extends to another six-year high
"/sdd/edimar/Desktop/doutorado/doutorado04/bases/WEIR/finance/www.marketwatch.com/QCOM.html","CONNECTIONS(TM) Identifies Key Growth Areas, Obstacles, and Opportunities for Industry Players"
"/sdd/edimar/Desktop/doutorado/doutorado04/bases/WEIR/finance/www.marketwatch.com/AMTD.html","Ameritrade 2Q Net Dn,Trading Offsets Some Mkt Hurt"
"/sdd/edimar/Desktop/doutorado/doutorado04/bases/WEIR/finance/www.marketwatch.com/NSC.html",Fitch Rates Norfolk Southern's New Notes 'BBB+'
"/sdd/edimar/Desktop/doutorado/doutorado04/bases/WEIR/finance/www.marketwatch.com/CSC.html",CSC Receives 'Positive' Rating in P&C Insurance Policy Administration MarketScope Report
"/sdd/edimar/Desktop/doutorado/doutorado04/bases/WEIR/finance/www.marketwatch.com/HAL.html",Schlumberger earnings beat brightens sector
"/sdd/edimar/Desktop/doutorado/doutorado04/bases/WEIR/finance/www.marketwatch.com/PEP.html",Internet Geek Girl Stephanie Agresta Joins Porter Novelli
"/sdd/edimar/Desktop/doutorado/doutorado04/bases/WEIR/finance/www.marketwatch.com/WAG.html",Walgreens to Withdraw from Delaware Medicaid Program
"/sdd/edimar/Desktop/doutorado/doutorado04/bases/WEIR/finance/www.marketwatch.com/MYGN.html",Nasdaq edges to five-month highs
"/sdd/edimar/Desktop/doutorado/doutorado04/bases/WEIR/finance/www.marketwatch.com/NOVL.html",Novell Reports Financial Results for Second Fiscal Quarter 2009
"/sdd/edimar/Desktop/doutorado/doutorado04/bases/WEIR/finance/www.marketwatch.com/PBY.html",Auto Services Company Looks to Acxiom to Gain Marketing Edge in Competitive Industry
"/sdd/edimar/Desktop/doutorado/doutorado04/bases/WEIR/finance/www.marketwatch.com/DHR.html","Danaher posts lower profit, cuts outlook"
"/sdd/edimar/Desktop/doutorado/doutorado04/bases/WEIR/finance/www.marketwatch.com/HSY.html",Hershey reports profit rise
"/sdd/edimar/Desktop/doutorado/doutorado04/bases/WEIR/finance/www.marketwatch.com/UTX.html",UTC Board of Directors Declares Quarterly Dividend
"/sdd/edimar/Desktop/doutorado/doutorado04/bases/WEIR/finance/www.marketwatch.com/ADSK.html",Autodesk to Webcast Its Annual Meeting of Stockholders
"/sdd/edimar/Desktop/doutorado/doutorado04/bases/WEIR/finance/www.marketwatch.com/X.html",Sharp upturn in equity deals could mark turning point
"/sdd/edimar/Desktop/doutorado/doutorado04/bases/WEIR/finance/www.marketwatch.com/NTAP.html",NetApp and Data Domain Enter Into Revised Acquisition Agreement
"/sdd/edimar/Desktop/doutorado/doutorado04/bases/WEIR/finance/www.marketwatch.com/PGR.html",Near-term tension masks longer-term upside
"/sdd/edimar/Desktop/doutorado/doutorado04/bases/WEIR/finance/www.marketwatch.com/ACV.html",Merrill Lynch shifts stance in consumer products
"/sdd/edimar/Desktop/doutorado/doutorado04/bases/WEIR/finance/www.marketwatch.com/OKE.html",Oneok sees third-quarter results at low end of forecast
"/sdd/edimar/Desktop/doutorado/doutorado04/bases/WEIR/finance/www.marketwatch.com/GIS.html",Yoplait(R) YoPlus(TM) Clinically Shown to Naturally Help Regulate Digestive Health
"/sdd/edimar/Desktop/doutorado/doutorado04/bases/WEIR/finance/www.marketwatch.com/SPLS.html",Helen of Troy Limited OXO Brand Enters Office Products and Pharmaceutical Devices Categories With Announcement of Two Strategic Licensing Agreements
"/sdd/edimar/Desktop/doutorado/doutorado04/bases/WEIR/finance/www.marketwatch.com/CF.html",Agrium to Withdraw and Re-File Hart-Scott-Rodino Notification in Connection With Proposed Acquisition of CF Industries
"/sdd/edimar/Desktop/doutorado/doutorado04/bases/WEIR/finance/www.marketwatch.com/CPWR.html",Compuware fourth-quarter profit slips
"/sdd/edimar/Desktop/doutorado/doutorado04/bases/WEIR/finance/www.marketwatch.com/KMB.html",Stocks in focus for Wednesday
"/sdd/edimar/Desktop/doutorado/doutorado04/bases/WEIR/finance/www.marketwatch.com/THC.html",Tenet Announces Private Offering of $450 Million of Senior Secured Notes due 2019
"/sdd/edimar/Desktop/doutorado/doutorado04/bases/WEIR/finance/www.marketwatch.com/ODP.html","U.S. stocks pointing higher with data, GM in view"
"/sdd/edimar/Desktop/doutorado/doutorado04/bases/WEIR/finance/www.marketwatch.com/CBE.html",Thursday's biggest gaining and losing stocks
"/sdd/edimar/Desktop/doutorado/doutorado04/bases/WEIR/finance/www.marketwatch.com/PEG.html",Stephen Byrd to Become President and CEO of Energy Storage & Power (ES&P)
"/sdd/edimar/Desktop/doutorado/doutorado04/bases/WEIR/finance/www.marketwatch.com/K.html",Thursday's biggest gaining and declining stocks
"/sdd/edimar/Desktop/doutorado/doutorado04/bases/WEIR/finance/www.marketwatch.com/CCU.html",Production up 0.8%
"/sdd/edimar/Desktop/doutorado/doutorado04/bases/WEIR/finance/www.marketwatch.com/AMD.html","Google, Apple, Yahoo lead techs lower"
"/sdd/edimar/Desktop/doutorado/doutorado04/bases/WEIR/finance/www.marketwatch.com/EIX.html",Edison International net income falls 16%
"/sdd/edimar/Desktop/doutorado/doutorado04/bases/WEIR/finance/www.marketwatch.com/DD.html",BASF Sues DuPont for Patent Infringement
"/sdd/edimar/Desktop/doutorado/doutorado04/bases/WEIR/finance/www.marketwatch.com/CREE.html","NI Technology Research Updates Outlooks for Cree, Corning, Microvision, and Intel"
"/sdd/edimar/Desktop/doutorado/doutorado04/bases/WEIR/finance/www.marketwatch.com/CVG.html",IDC Believes Cloud Providers Can Learn from Telecom Service Providers That Rating Does Pay
"/sdd/edimar/Desktop/doutorado/doutorado04/bases/WEIR/finance/www.marketwatch.com/QSFT.html",Quest Desktop Virtualization Group Captures Two SYS-CON Virtualization Journal Readers' Choice Awards for VDI
"/sdd/edimar/Desktop/doutorado/doutorado04/bases/WEIR/finance/www.marketwatch.com/ADIC.html",Quantum Corp. 1st Quarter Loss/Shr 11c Versus Loss 2c
"/sdd/edimar/Desktop/doutorado/doutorado04/bases/WEIR/finance/www.marketwatch.com/VIA.html","Spike TV Salutes Action Star David Carradine With Movie Marathon Tribute on Saturday, June 13"
"/sdd/edimar/Desktop/doutorado/doutorado04/bases/WEIR/finance/www.marketwatch.com/EMC.html",Presidio Networked Solutions Honored as Recipient of 2009 EMC Velocity2 Authorized Services Network Quality Award
"/sdd/edimar/Desktop/doutorado/doutorado04/bases/WEIR/finance/www.marketwatch.com/ECL.html",Ecolab Schedules Webcast of Industry Conference for June 3rd
"/sdd/edimar/Desktop/doutorado/doutorado04/bases/WEIR/finance/www.marketwatch.com/KR.html","Smith's Donates $837,000 to Primary Children's Medical Center in Utah"
"/sdd/edimar/Desktop/doutorado/doutorado04/bases/WEIR/finance/www.marketwatch.com/KEI.html",Highlights of rising and falling U.S. stocks
"/sdd/edimar/Desktop/doutorado/doutorado04/bases/WEIR/finance/www.marketwatch.com/FO.html",Moen Redefines Square With New 90 degrees(TM) Collection
"/sdd/edimar/Desktop/doutorado/doutorado04/bases/WEIR/finance/www.marketwatch.com/WY.html",Weyerhaeuser loss grows
"/sdd/edimar/Desktop/doutorado/doutorado04/bases/WEIR/finance/www.marketwatch.com/TEK.html","Danaher posts lower profit, cuts outlook"
"/sdd/edimar/Desktop/doutorado/doutorado04/bases/WEIR/finance/www.marketwatch.com/GES.html",Stocks in focus for Friday
"/sdd/edimar/Desktop/doutorado/doutorado04/bases/WEIR/finance/www.marketwatch.com/RSH.html",Thursday's biggest gaining and losing stocks
"/sdd/edimar/Desktop/doutorado/doutorado04/bases/WEIR/finance/www.marketwatch.com/PD.html",Freeport-McMoRan's net income tumbles 96%
"/sdd/edimar/Desktop/doutorado/doutorado04/bases/WEIR/finance/www.marketwatch.com/TIN.html",Temple-Inland swings to fourth-quarter loss
"/sdd/edimar/Desktop/doutorado/doutorado04/bases/WEIR/finance/www.marketwatch.com/C.html",Iberdrola Renewables shares to trade in the U.S.
"/sdd/edimar/Desktop/doutorado/doutorado04/bases/WEIR/finance/www.marketwatch.com/TM.html",Production of Toyota 'Highlander' Begins in China
"/sdd/edimar/Desktop/doutorado/doutorado04/bases/WEIR/finance/www.marketwatch.com/DISH.html",TiVo Statement on U.S District Court for the Eastern District of Texas Decision:
"/sdd/edimar/Desktop/doutorado/doutorado04/bases/WEIR/finance/www.marketwatch.com/MOT.html",Verizon Wireless Announces the Availability of the Motorola Rival
"/sdd/edimar/Desktop/doutorado/doutorado04/bases/WEIR/finance/www.marketwatch.com/SLE.html",Stocks in focus for Thursday
"/sdd/edimar/Desktop/doutorado/doutorado04/bases/WEIR/finance/www.marketwatch.com/JBL.html",Wednesday's biggest gaining and declining stocks
"/sdd/edimar/Desktop/doutorado/doutorado04/bases/WEIR/finance/www.marketwatch.com/OI.html","Owens-Illinois, Scana shares up on naming to S&P 500"
"/sdd/edimar/Desktop/doutorado/doutorado04/bases/WEIR/finance/www.marketwatch.com/BBY.html",Only Seven Percent of U.S. Fifteen Year-Olds Have All Three Life Experiences Key to Their Futures
"/sdd/edimar/Desktop/doutorado/doutorado04/bases/WEIR/finance/www.marketwatch.com/NCR.html","Adventist Health System Wins Self Service Excellence Award for Speeding, Simplifying Patient Interactions"
"/sdd/edimar/Desktop/doutorado/doutorado04/bases/WEIR/finance/www.marketwatch.com/NXTL.html",$8.7 Million in New Projects Awarded to WPCS
"/sdd/edimar/Desktop/doutorado/doutorado04/bases/WEIR/finance/www.marketwatch.com/ITT.html",ITT profit climbs 7% as group cuts outlook
"/sdd/edimar/Desktop/doutorado/doutorado04/bases/WEIR/finance/www.marketwatch.com/MERQ.html","Telstra Signs Applications Services Contract with EDS, an HP Company"
"/sdd/edimar/Desktop/doutorado/doutorado04/bases/WEIR/finance/www.marketwatch.com/GPS.html","Gap to revamp 50 Old Navys, grows internationally"
"/sdd/edimar/Desktop/doutorado/doutorado04/bases/WEIR/finance/www.marketwatch.com/NAV.html",Navistar Engine Group to Supply V8 Diesels to Capacity of Texas
"/sdd/edimar/Desktop/doutorado/doutorado04/bases/WEIR/finance/www.marketwatch.com/PCLN.html",Priceline.com President & CEO Jeffery H. Boyd To Speak At Bank of America and Merrill Lynch 2009 U.S. Technology Conference
"/sdd/edimar/Desktop/doutorado/doutorado04/bases/WEIR/finance/www.marketwatch.com/PHM.html",Before the Close Report from MarketWatch Radio Network
"/sdd/edimar/Desktop/doutorado/doutorado04/bases/WEIR/finance/www.marketwatch.com/PLUG.html",Thursday's biggest stock gainers and decliners
"/sdd/edimar/Desktop/doutorado/doutorado04/bases/WEIR/finance/www.marketwatch.com/MGM.html",Chef Stephen Kalt to Open Fornelletto at Borgata Hotel Casino & Spa
"/sdd/edimar/Desktop/doutorado/doutorado04/bases/WEIR/finance/www.marketwatch.com/BRCD.html",QLogic Appoints Jim Rothstein as Vice President of North America Sales
"/sdd/edimar/Desktop/doutorado/doutorado04/bases/WEIR/finance/www.marketwatch.com/INFY.html",Wednesday's biggest gaining and declining stocks
"/sdd/edimar/Desktop/doutorado/doutorado04/bases/WEIR/finance/www.marketwatch.com/AMAT.html",Applied Materials Extends Copper PVD Technology Leadership to 22nm Node
"/sdd/edimar/Desktop/doutorado/doutorado04/bases/WEIR/finance/www.marketwatch.com/WWE.html",WWE(R) VS. NBA
"/sdd/edimar/Desktop/doutorado/doutorado04/bases/WEIR/finance/www.marketwatch.com/SWK.html",Stanley Works net off 43%
"/sdd/edimar/Desktop/doutorado/doutorado04/bases/WEIR/finance/www.marketwatch.com/LPX.html",U.S. stock futures lower to start the week
"/sdd/edimar/Desktop/doutorado/doutorado04/bases/WEIR/finance/www.marketwatch.com/APA.html",Exxon profit miss leaves sector in the cold
"/sdd/edimar/Desktop/doutorado/doutorado04/bases/WEIR/finance/www.marketwatch.com/TXT.html",AAI Small Unmanned Aircraft Systems Complete a Successful Simultaneous Flight Demonstration
"/sdd/edimar/Desktop/doutorado/doutorado04/bases/WEIR/finance/www.marketwatch.com/DUK.html",Duke Energy Carolinas Asking for 12.6 Percent Rate Increase in North Carolina
"/sdd/edimar/Desktop/doutorado/doutorado04/bases/WEIR/finance/www.marketwatch.com/STI.html",SunTrust Accelerates Capital Plan Implementation; Executing on 'Clear Path' to Meet SCAP Target
"/sdd/edimar/Desktop/doutorado/doutorado04/bases/WEIR/finance/www.marketwatch.com/JCI.html",Johnson Controls to Recognize National Student Winners of Igniting Creative Energy Challenge
"/sdd/edimar/Desktop/doutorado/doutorado04/bases/WEIR/finance/www.marketwatch.com/COST.html",Midday report from MarketWatch Radio Network
"/sdd/edimar/Desktop/doutorado/doutorado04/bases/WEIR/finance/www.marketwatch.com/WEN.html",Wendy's to Review National Agency Resources as Key Step in its Growth Strategy
"/sdd/edimar/Desktop/doutorado/doutorado04/bases/WEIR/finance/www.marketwatch.com/KSS.html",Newegg Inc. Sues Kohl's for Trademark Infringement
"/sdd/edimar/Desktop/doutorado/doutorado04/bases/WEIR/finance/www.marketwatch.com/GT.html","Goodyear Announces Plan to Discontinue Consumer Tire Production at French Plant; Will Explore Divesting EMEA, Latin America Farm Tire Businesses"
"/sdd/edimar/Desktop/doutorado/doutorado04/bases/WEIR/finance/www.marketwatch.com/AXP.html",Small Business Matchmaking Event Set for Meadowlands June 17
"/sdd/edimar/Desktop/doutorado/doutorado04/bases/WEIR/finance/www.marketwatch.com/REGN.html",Analyst rating change move drug stocks
"/sdd/edimar/Desktop/doutorado/doutorado04/bases/WEIR/finance/www.marketwatch.com/HD.html",Mayor Bloomberg to Introduce Boys' Club All-Star Band Concert at Lincoln Center on June 9th at 7:00PM
"/sdd/edimar/Desktop/doutorado/doutorado04/bases/WEIR/finance/www.marketwatch.com/AKAM.html","BullMarket.com Updates Outlook on Akamai, Limelight, Citrix, and VMWare"
"/sdd/edimar/Desktop/doutorado/doutorado04/bases/WEIR/finance/www.marketwatch.com/SEBL.html","InsanePicks alerts you on hot stocks: PG, S, SUN, SVU, ORCL"
"/sdd/edimar/Desktop/doutorado/doutorado04/bases/WEIR/finance/www.marketwatch.com/MAT.html",Golden coffins: 10 of the most egregious CEO perks
"/sdd/edimar/Desktop/doutorado/doutorado04/bases/WEIR/finance/www.marketwatch.com/HRB.html",Liberty Tax Service's Growth a Record Among Big Three Tax Companies for 2009: Increased Brand Awareness Boosts Volume
"/sdd/edimar/Desktop/doutorado/doutorado04/bases/WEIR/finance/www.marketwatch.com/STT.html",State Street Appointed by CIGT to Provide Custody Services for China Insurance (Holdings) Co Ltd.'s Operations in Hong Kong
"/sdd/edimar/Desktop/doutorado/doutorado04/bases/WEIR/finance/www.marketwatch.com/SILI.html",Vishay says revenue to fall short of forecast
"/sdd/edimar/Desktop/doutorado/doutorado04/bases/WEIR/finance/www.marketwatch.com/MSFT.html",Microsoft Declares Quarterly Dividend; Board of Directors Proposes New Shareholder Right
"/sdd/edimar/Desktop/doutorado/doutorado04/bases/WEIR/finance/www.marketwatch.com/SLB.html",FBR upgrades oil drillers on 2011 profit prospects
"/sdd/edimar/Desktop/doutorado/doutorado04/bases/WEIR/finance/www.marketwatch.com/NEM.html",Gold and silver lose some luster after jobs report
"/sdd/edimar/Desktop/doutorado/doutorado04/bases/WEIR/finance/www.marketwatch.com/LEG.html",Leggett & Platt profit falls nearly 80%
"/sdd/edimar/Desktop/doutorado/doutorado04/bases/WEIR/finance/www.marketwatch.com/IBM.html",Women in Technology International Names IBM Executive Sandy Carter to WITI Advisory Board
"/sdd/edimar/Desktop/doutorado/doutorado04/bases/WEIR/finance/www.marketwatch.com/LMT.html",Lockheed Martin Achieves Key Integration Milestones on Second SBIRS Missile Warning Satellite
"/sdd/edimar/Desktop/doutorado/doutorado04/bases/WEIR/finance/www.marketwatch.com/FITB.html",Fifth Third Announces Capital Actions
"/sdd/edimar/Desktop/doutorado/doutorado04/bases/WEIR/finance/www.marketwatch.com/RIMM.html","Today's alerts include: NWSA, RIMM, EBAY, SBUX, DTV, JAVA"
"/sdd/edimar/Desktop/doutorado/doutorado04/bases/WEIR/finance/www.marketwatch.com/ORCL.html","InsanePicks alerts you on hot stocks: PG, S, SUN, SVU, ORCL"
"/sdd/edimar/Desktop/doutorado/doutorado04/bases/WEIR/finance/www.marketwatch.com/EFX.html",Equifax Transforms Credit Transparency
"/sdd/edimar/Desktop/doutorado/doutorado04/bases/WEIR/finance/www.marketwatch.com/CMVT.html",Stocks in focus for Tuesday
"/sdd/edimar/Desktop/doutorado/doutorado04/bases/WEIR/finance/www.marketwatch.com/TXN.html",Autoliv chooses Texas Instruments for its world's first night vision system with pedestrian detection
"/sdd/edimar/Desktop/doutorado/doutorado04/bases/WEIR/finance/www.marketwatch.com/AVP.html","Avon profit drops 36%, hurt by a stronger dollar"
"/sdd/edimar/Desktop/doutorado/doutorado04/bases/WEIR/finance/www.marketwatch.com/GM.html",Global DiSCS Trust 2004-1 (TSX: DST.UN) Announces General Motors Corporation Credit Event
"/sdd/edimar/Desktop/doutorado/doutorado04/bases/WEIR/finance/www.marketwatch.com/SNE.html",Panasonic bets on green to drive Europe growth
"/sdd/edimar/Desktop/doutorado/doutorado04/bases/WEIR/finance/www.marketwatch.com/AFL.html",Thursday's biggest gaining and declining stocks
"/sdd/edimar/Desktop/doutorado/doutorado04/bases/WEIR/finance/www.marketwatch.com/DAL.html","Delta Offers 2,500 Bonus Miles - and New Low Fares - on Every Shuttle Flight"
"/sdd/edimar/Desktop/doutorado/doutorado04/bases/WEIR/finance/www.marketwatch.com/NOK.html",Nokia N97 Mobile Computer to Begin Selling Worldwide in June
"/sdd/edimar/Desktop/doutorado/doutorado04/bases/WEIR/finance/www.marketwatch.com/WMT.html",Anapol Schwartz Files Hydroxycut Complaint
"/sdd/edimar/Desktop/doutorado/doutorado04/bases/WEIR/finance/www.marketwatch.com/SNDK.html","SanDisk Begins Shipping High-Speed, Next-Generation Solid State Drives for Ultra-Hot Netbook Market"
"/sdd/edimar/Desktop/doutorado/doutorado04/bases/WEIR/finance/www.marketwatch.com/CTXS.html","BullMarket.com Updates Outlook on Akamai, Limelight, Citrix, and VMWare"
"/sdd/edimar/Desktop/doutorado/doutorado04/bases/WEIR/finance/www.marketwatch.com/BHI.html",Technical battle lines drawn on the S&P 500
"/sdd/edimar/Desktop/doutorado/doutorado04/bases/WEIR/finance/www.marketwatch.com/SBUX.html","Today's alerts include: NWSA, RIMM, EBAY, SBUX, DTV, JAVA"
"/sdd/edimar/Desktop/doutorado/doutorado04/bases/WEIR/finance/www.marketwatch.com/MRK.html",Swonk: Not much to celebrate in May jobs news
"/sdd/edimar/Desktop/doutorado/doutorado04/bases/WEIR/finance/www.marketwatch.com/MO.html","Updates, advisories and surprises"
"/sdd/edimar/Desktop/doutorado/doutorado04/bases/WEIR/finance/www.marketwatch.com/XLNX.html",Xilinx and LynuxWorks Demonstrate Avionics Application Solution at the Military and Aerospace Forum and Avionics USA Conference 2009
"/sdd/edimar/Desktop/doutorado/doutorado04/bases/WEIR/finance/www.marketwatch.com/VRSN.html",Tucows Inc. Enables More Web Hosting Companies and ISPs to Offer Trusted Protection With VeriSign SSL Certificates
"/sdd/edimar/Desktop/doutorado/doutorado04/bases/WEIR/finance/www.marketwatch.com/JPM.html",Ameriprise Financial Announces $900 Million Offering of Common Stock
"/sdd/edimar/Desktop/doutorado/doutorado04/bases/WEIR/finance/www.marketwatch.com/PNW.html","Updates, advisories and surprises"
"/sdd/edimar/Desktop/doutorado/doutorado04/bases/WEIR/finance/www.marketwatch.com/CTX.html",Before the Close Report from MarketWatch Radio Network
"/sdd/edimar/Desktop/doutorado/doutorado04/bases/WEIR/finance/www.marketwatch.com/ARW.html","Updates, advisories and surprises"
"/sdd/edimar/Desktop/doutorado/doutorado04/bases/WEIR/finance/www.marketwatch.com/ELON.html",Fed-induced rally places U.S. markets at major resistance
"/sdd/edimar/Desktop/doutorado/doutorado04/bases/WEIR/finance/www.marketwatch.com/BMC.html","CUSTOMER SUCCESS: CARFAX Reduces Manual Tasks by 70 Percent with BMC Software, Boosting ROI and Expediting Customer Service"
"/sdd/edimar/Desktop/doutorado/doutorado04/bases/WEIR/finance/www.marketwatch.com/CB.html",Stocks in focus for Thursday
"/sdd/edimar/Desktop/doutorado/doutorado04/bases/WEIR/finance/www.marketwatch.com/DJ.html",Dow Jones Newswires Names Former Hedge Fund Analyst and Former Trader to Editorial Team
"/sdd/edimar/Desktop/doutorado/doutorado04/bases/WEIR/finance/www.marketwatch.com/BCE.html",BCE reinstates dividend and plans buyback
"/sdd/edimar/Desktop/doutorado/doutorado04/bases/WEIR/finance/www.marketwatch.com/BKS.html",Barnes & Noble Reports First Quarter Financial Results
"/sdd/edimar/Desktop/doutorado/doutorado04/bases/WEIR/finance/www.marketwatch.com/FLEX.html",A buy for technology stocks from a value manager
"/sdd/edimar/Desktop/doutorado/doutorado04/bases/WEIR/finance/www.marketwatch.com/MEDX.html",Drug stocks take U-turn north
"/sdd/edimar/Desktop/doutorado/doutorado04/bases/WEIR/finance/www.marketwatch.com/D.html","Virginia Rises to the Top of $13 Billion in 2009 Industrial Project Starts in Mid-Atlantic Region, an Industrial Info News Alert"
"/sdd/edimar/Desktop/doutorado/doutorado04/bases/WEIR/finance/www.marketwatch.com/WLP.html","Today's top stock alerts include: SWY, T, TGT, TWX, UNH, WLP"
