URL,EXTRACTED VALUE
"/sdd/edimar/Desktop/doutorado/doutorado04/bases/WEIR/finance/www.marketwatch.com/AMTD.html","BlackRock, BNY Mellon Profits Fall"
"/sdd/edimar/Desktop/doutorado/doutorado04/bases/WEIR/finance/www.marketwatch.com/TROW.html",Bank Issues Pull Market by the Nose
"/sdd/edimar/Desktop/doutorado/doutorado04/bases/WEIR/finance/www.marketwatch.com/NSC.html",Slump Persists for Freight Haulers
"/sdd/edimar/Desktop/doutorado/doutorado04/bases/WEIR/finance/www.marketwatch.com/ADP.html",Layoffs May Have Peaked
"/sdd/edimar/Desktop/doutorado/doutorado04/bases/WEIR/finance/www.marketwatch.com/MTG.html","Top 10 Pre-Market Analyst Calls (CAT, CRUS, EQ, HCCI, MAR, MTG, PPC, R, SLB, WFC)"
"/sdd/edimar/Desktop/doutorado/doutorado04/bases/WEIR/finance/www.marketwatch.com/FCEL.html",Fuel Cells Get Nod in Connecticut (FCEL)
"/sdd/edimar/Desktop/doutorado/doutorado04/bases/WEIR/finance/www.marketwatch.com/KLAC.html","Top Pre-Market Analyst Downgrades (KELYA, KLAC, LRCX, MRVL, PNY, RHI, SNDA, XLNX)"
"/sdd/edimar/Desktop/doutorado/doutorado04/bases/WEIR/finance/www.marketwatch.com/AFL.html",Pressure Won't Let Up on Life Insurers
"/sdd/edimar/Desktop/doutorado/doutorado04/bases/WEIR/finance/www.marketwatch.com/RMBS.html",Rambus Scores (RMBS)
"/sdd/edimar/Desktop/doutorado/doutorado04/bases/WEIR/finance/www.marketwatch.com/CELG.html","Citi, Financials Rise; Ford Gains on Sales"
"/sdd/edimar/Desktop/doutorado/doutorado04/bases/WEIR/finance/www.marketwatch.com/HUM.html",Health Plans: New Safeguards
"/sdd/edimar/Desktop/doutorado/doutorado04/bases/WEIR/finance/www.marketwatch.com/ADSK.html",More Meltdown
"/sdd/edimar/Desktop/doutorado/doutorado04/bases/WEIR/finance/www.marketwatch.com/CTXS.html","Despite Virtualization Hype, Citrix Tanks Today & Ahead (CTXS, VMW, MSFT)"
"/sdd/edimar/Desktop/doutorado/doutorado04/bases/WEIR/finance/www.marketwatch.com/WMB.html",Williams and the Venezuelan Pokey (WMB)
"/sdd/edimar/Desktop/doutorado/doutorado04/bases/WEIR/finance/www.marketwatch.com/DE.html",Deere Lowers Forecast as Profit Drops
"/sdd/edimar/Desktop/doutorado/doutorado04/bases/WEIR/finance/www.marketwatch.com/CI.html",Cigna Will Freeze Pension Plan
"/sdd/edimar/Desktop/doutorado/doutorado04/bases/WEIR/finance/www.marketwatch.com/XLNX.html",Signs of Stability Drive Up Stocks
"/sdd/edimar/Desktop/doutorado/doutorado04/bases/WEIR/finance/www.marketwatch.com/VRSN.html",10-Q: VERISIGN INC/CA
"/sdd/edimar/Desktop/doutorado/doutorado04/bases/WEIR/finance/www.marketwatch.com/RIG.html",Offshore Drillers Continue Treading Water
"/sdd/edimar/Desktop/doutorado/doutorado04/bases/WEIR/finance/www.marketwatch.com/HOTT.html","Hot Topic, Blackboard Pace a Broad Decline"
"/sdd/edimar/Desktop/doutorado/doutorado04/bases/WEIR/finance/www.marketwatch.com/SPLS.html","Top Pre-Market Analyst Downgrades (DDR, FII, LM, PIR, SPLS, ULTA, WFMI)"
"/sdd/edimar/Desktop/doutorado/doutorado04/bases/WEIR/finance/www.marketwatch.com/BKS.html",E-Book Market Heats Up
"/sdd/edimar/Desktop/doutorado/doutorado04/bases/WEIR/finance/www.marketwatch.com/NVDA.html",Lower Margins Crimp Nvidia's Bottom Line
"/sdd/edimar/Desktop/doutorado/doutorado04/bases/WEIR/finance/www.marketwatch.com/MEDX.html","Top 10 Early Analyst Upgrades & Downgrades (FUL, OZM, REP, TOL, DOV, EMR, GA, GSK, MEDX, RDS-A)"
"/sdd/edimar/Desktop/doutorado/doutorado04/bases/WEIR/finance/www.marketwatch.com/BSX.html","Media Digest 4/21/2009 Reuters, WSJ, NYTimes, FT, Bloomberg"
"/sdd/edimar/Desktop/doutorado/doutorado04/bases/WEIR/finance/www.marketwatch.com/THC.html",10-Q: TENET HEALTHCARE CORP
"/sdd/edimar/Desktop/doutorado/doutorado04/bases/WEIR/finance/www.marketwatch.com/NVLS.html",The 52-Week Low Club (DAL)(AMR)(LCC)(UAUA)
"/sdd/edimar/Desktop/doutorado/doutorado04/bases/WEIR/finance/www.marketwatch.com/ODP.html",Stocks in the Spotlight Tuesday
"/sdd/edimar/Desktop/doutorado/doutorado04/bases/WEIR/finance/www.marketwatch.com/CLX.html",Clorox Investors Could Clean Up
"/sdd/edimar/Desktop/doutorado/doutorado04/bases/WEIR/finance/www.marketwatch.com/AGN.html","Just as Banks Giveth, So Do They Taketh"
"/sdd/edimar/Desktop/doutorado/doutorado04/bases/WEIR/finance/www.marketwatch.com/OXY.html",High Hopes for Hess and Hershey
"/sdd/edimar/Desktop/doutorado/doutorado04/bases/WEIR/finance/www.marketwatch.com/ELNK.html",EarthLink Manages Costs To Beat Earnings (ELNK)
"/sdd/edimar/Desktop/doutorado/doutorado04/bases/WEIR/finance/www.marketwatch.com/CMA.html",Parsing the PPIP
"/sdd/edimar/Desktop/doutorado/doutorado04/bases/WEIR/finance/www.marketwatch.com/AEOS.html",Hedging the High Skew
"/sdd/edimar/Desktop/doutorado/doutorado04/bases/WEIR/finance/www.marketwatch.com/SVU.html",10-K: SUPERVALU INC
"/sdd/edimar/Desktop/doutorado/doutorado04/bases/WEIR/finance/www.marketwatch.com/BNI.html","Top Analyst Downgrades (BJS, BUCY, BNI, INTU, JOYG,PBR, TKC, WFMI)"
"/sdd/edimar/Desktop/doutorado/doutorado04/bases/WEIR/finance/www.marketwatch.com/GLW.html","Top Analyst Downgrades (GLW, ETN, EBAY, GMCR, INTU, WFR, VDSI, WFC, WYNN)"
"/sdd/edimar/Desktop/doutorado/doutorado04/bases/WEIR/finance/www.marketwatch.com/MSO.html",10-K: MARTHA STEWART LIVING OMNIMEDIA INC
"/sdd/edimar/Desktop/doutorado/doutorado04/bases/WEIR/finance/www.marketwatch.com/COMS.html","Top 10 Pre-Market Analyst Calls (ARUN, BLK, COMS, DLB, HAL, JNPR, MOT, OMRX, QLGC, STX, AUY)"
"/sdd/edimar/Desktop/doutorado/doutorado04/bases/WEIR/finance/www.marketwatch.com/LIZ.html","3 Stock Picks: AMAT, ANN, BZH (Market Movers)"
"/sdd/edimar/Desktop/doutorado/doutorado04/bases/WEIR/finance/www.marketwatch.com/KR.html",Want to Save? Put It on the List
"/sdd/edimar/Desktop/doutorado/doutorado04/bases/WEIR/finance/www.marketwatch.com/FO.html",Pernod to Sell Wild Turkey
"/sdd/edimar/Desktop/doutorado/doutorado04/bases/WEIR/finance/www.marketwatch.com/CSX.html",Fund Sells CSX Shares
"/sdd/edimar/Desktop/doutorado/doutorado04/bases/WEIR/finance/www.marketwatch.com/MAR.html","Media Digest 4/14/2009 Reuters, WSJ, NYTime, FT, Barron’s"
"/sdd/edimar/Desktop/doutorado/doutorado04/bases/WEIR/finance/www.marketwatch.com/RSH.html",Less Hope in Store for Retailers
"/sdd/edimar/Desktop/doutorado/doutorado04/bases/WEIR/finance/www.marketwatch.com/NSM.html",New Chips Can Boost Solar Power
"/sdd/edimar/Desktop/doutorado/doutorado04/bases/WEIR/finance/www.marketwatch.com/INTU.html",Google Outside Counsel Clearly Well-Prepared for FTC Fight Over Apple Board Seat–See This Internal Doc
"/sdd/edimar/Desktop/doutorado/doutorado04/bases/WEIR/finance/www.marketwatch.com/BBI.html",Mind if I Pay These Late Fees With a Few of My Blockbuster Shares?
"/sdd/edimar/Desktop/doutorado/doutorado04/bases/WEIR/finance/www.marketwatch.com/MMC.html","Top Pre-Market Analyst Upgrades (AOC, BAC, CR, DOV, FSLR, HPT, MMM, MMC, MA, SPWRA, TROW, V, WU)"
"/sdd/edimar/Desktop/doutorado/doutorado04/bases/WEIR/finance/www.marketwatch.com/CEG.html",Constellation Energy Swings to Loss
"/sdd/edimar/Desktop/doutorado/doutorado04/bases/WEIR/finance/www.marketwatch.com/PCLN.html",Priceline's Differences Appeal
"/sdd/edimar/Desktop/doutorado/doutorado04/bases/WEIR/finance/www.marketwatch.com/DRI.html",10-Q: DARDEN RESTAURANTS INC
"/sdd/edimar/Desktop/doutorado/doutorado04/bases/WEIR/finance/www.marketwatch.com/IR.html",Ingersoll-Rand Ready to Roll
"/sdd/edimar/Desktop/doutorado/doutorado04/bases/WEIR/finance/www.marketwatch.com/BRCD.html","Cramer’s #4 Speculative Tech Pick: ON Semiconductor (ONNN, TKLC, BRCD, CDNS)"
"/sdd/edimar/Desktop/doutorado/doutorado04/bases/WEIR/finance/www.marketwatch.com/UNP.html",Net at Three Big Railroads Is Off Track
"/sdd/edimar/Desktop/doutorado/doutorado04/bases/WEIR/finance/www.marketwatch.com/APA.html","Will Big Oil Go Shopping? (XOM, CVX, RDS, BP, COP, APA, DVN, APC)"
"/sdd/edimar/Desktop/doutorado/doutorado04/bases/WEIR/finance/www.marketwatch.com/PCG.html",Negativity Reigns
"/sdd/edimar/Desktop/doutorado/doutorado04/bases/WEIR/finance/www.marketwatch.com/BEN.html",10-Q: FRANKLIN RESOURCES INC
"/sdd/edimar/Desktop/doutorado/doutorado04/bases/WEIR/finance/www.marketwatch.com/SLM.html","Promises, Not Problems, Occupy Markets"
"/sdd/edimar/Desktop/doutorado/doutorado04/bases/WEIR/finance/www.marketwatch.com/PHG.html","Top Analyst Downgrades (BCS, CBY, CBS, LFC, CHL, DBD, ELX, NCR, PHG, QSII)"
"/sdd/edimar/Desktop/doutorado/doutorado04/bases/WEIR/finance/www.marketwatch.com/CAG.html",DJ LIVESTOCK HIGHLIGHTS: Top Stories Of The Day
"/sdd/edimar/Desktop/doutorado/doutorado04/bases/WEIR/finance/www.marketwatch.com/MRO.html",Chevron Focuses on Refineries
"/sdd/edimar/Desktop/doutorado/doutorado04/bases/WEIR/finance/www.marketwatch.com/EK.html",Settlement for Morgan Stanley
"/sdd/edimar/Desktop/doutorado/doutorado04/bases/WEIR/finance/www.marketwatch.com/HBAN.html","Bullish Buzz Builds in Banks, Led by Fifth Third"
"/sdd/edimar/Desktop/doutorado/doutorado04/bases/WEIR/finance/www.marketwatch.com/AKAM.html","Top Pre-Market Analyst Downgrades (AKAM, CVLT, JNPR, LVS, MUR, N, PDX)"
"/sdd/edimar/Desktop/doutorado/doutorado04/bases/WEIR/finance/www.marketwatch.com/HRB.html",TurboTax Growth Accelerates
"/sdd/edimar/Desktop/doutorado/doutorado04/bases/WEIR/finance/www.marketwatch.com/MAT.html","GE, Google Gain, but Citi Stumbles"
"/sdd/edimar/Desktop/doutorado/doutorado04/bases/WEIR/finance/www.marketwatch.com/HON.html",Honeywell Says Committed to India
"/sdd/edimar/Desktop/doutorado/doutorado04/bases/WEIR/finance/www.marketwatch.com/FPL.html","GE-Cisco-FPL Take On Smart Grid & Efficiency (GE, CSCO, FPL)"
"/sdd/edimar/Desktop/doutorado/doutorado04/bases/WEIR/finance/www.marketwatch.com/DLTR.html",Leasing Could Be a Dollar Saved
"/sdd/edimar/Desktop/doutorado/doutorado04/bases/WEIR/finance/www.marketwatch.com/AEP.html",Corrections & Amplifications
"/sdd/edimar/Desktop/doutorado/doutorado04/bases/WEIR/finance/www.marketwatch.com/CVS.html",A Synergy Emerges at CVS Caremark
