URL,EXTRACTED VALUE
"/sdd/edimar/Desktop/doutorado/doutorado04/bases/WEIR/finance/www.marketwatch.com/OXY.html",S&P stages 14-to-1 spike from major support
"/sdd/edimar/Desktop/doutorado/doutorado04/bases/WEIR/finance/www.marketwatch.com/TWX.html","Today's top stock alerts include: SWY, T, TGT, TWX, UNH, WLP"
"/sdd/edimar/Desktop/doutorado/doutorado04/bases/WEIR/finance/www.marketwatch.com/COF.html",New Capital One Card Lab Connect Program to Help Nonprofits Enhance Fundraising Efforts
"/sdd/edimar/Desktop/doutorado/doutorado04/bases/WEIR/finance/www.marketwatch.com/BAX.html",Water Street Healthcare Partners Expands Team With Senior Investment Professionals
"/sdd/edimar/Desktop/doutorado/doutorado04/bases/WEIR/finance/www.marketwatch.com/F.html","Ford E-News - June 10, 2009"
"/sdd/edimar/Desktop/doutorado/doutorado04/bases/WEIR/finance/www.marketwatch.com/AA.html",AIAS and Kawneer Announce 2009 Student Design Competition
"/sdd/edimar/Desktop/doutorado/doutorado04/bases/WEIR/finance/www.marketwatch.com/KEY.html",Kristen Manos Joins KeyCorp Board of Directors
"/sdd/edimar/Desktop/doutorado/doutorado04/bases/WEIR/finance/www.marketwatch.com/NYT.html",Bankrate: Mortgage Rates Move Higher
"/sdd/edimar/Desktop/doutorado/doutorado04/bases/WEIR/finance/www.marketwatch.com/USB.html",U.S. Bank Opens Office in Charlotte for Its National Corporate Banking and High Grade Fixed Income Businesses
"/sdd/edimar/Desktop/doutorado/doutorado04/bases/WEIR/finance/www.marketwatch.com/CSX.html",Michael Ward Cited for Support of Wounded Warrior Project
"/sdd/edimar/Desktop/doutorado/doutorado04/bases/WEIR/finance/www.marketwatch.com/JCP.html",JCPenney Board of Directors Declares Quarterly Dividend
"/sdd/edimar/Desktop/doutorado/doutorado04/bases/WEIR/finance/www.marketwatch.com/ADBE.html",Acacia Subsidiary Enters into Settlement and License Agreement with Adobe Systems Incorporated
"/sdd/edimar/Desktop/doutorado/doutorado04/bases/WEIR/finance/www.marketwatch.com/AFFX.html","Affymetrix, Cepheid shares battered on outlooks"
"/sdd/edimar/Desktop/doutorado/doutorado04/bases/WEIR/finance/www.marketwatch.com/AET.html",Aetna Shareholders Approve Board Nominees
"/sdd/edimar/Desktop/doutorado/doutorado04/bases/WEIR/finance/www.marketwatch.com/MAR.html",Earn Elite Status Twice as Fast with Marriott Rewards
"/sdd/edimar/Desktop/doutorado/doutorado04/bases/WEIR/finance/www.marketwatch.com/PPL.html",Stocks in focus for Friday
"/sdd/edimar/Desktop/doutorado/doutorado04/bases/WEIR/finance/www.marketwatch.com/AAPL.html",2009 FileMaker Developer Conference 'Early-Bird' Pricing Ends Soon
"/sdd/edimar/Desktop/doutorado/doutorado04/bases/WEIR/finance/www.marketwatch.com/ETR.html",Entergy Foundation Gives $1.4 Million in Grants to Nonprofits in Seven States
"/sdd/edimar/Desktop/doutorado/doutorado04/bases/WEIR/finance/www.marketwatch.com/INTU.html",Five Questions Facing Corporate Social Media: Critical Discussion at GasPedal's BlogWell Conference
"/sdd/edimar/Desktop/doutorado/doutorado04/bases/WEIR/finance/www.marketwatch.com/RX.html",Par Pharmaceutical Begins Shipment of Generic Risperdal(R) M-TAB
"/sdd/edimar/Desktop/doutorado/doutorado04/bases/WEIR/finance/www.marketwatch.com/GRA.html",Will GE's earnings miss derail the recovery?
"/sdd/edimar/Desktop/doutorado/doutorado04/bases/WEIR/finance/www.marketwatch.com/GCI.html",Thirty Percent of Workers Whose Companies Have Experienced Layoffs Reported They are Burned Out
"/sdd/edimar/Desktop/doutorado/doutorado04/bases/WEIR/finance/www.marketwatch.com/CPB.html",Campbell Appoints Jennifer Driscoll Vice President Investor Relations
"/sdd/edimar/Desktop/doutorado/doutorado04/bases/WEIR/finance/www.marketwatch.com/OMC.html",DDB Dominates Effies: Agency Wins Twice Those of Closest Competitors and is Finalist for Grand Effie
"/sdd/edimar/Desktop/doutorado/doutorado04/bases/WEIR/finance/www.marketwatch.com/PKI.html",PerkinElmer Expands Its EcoAnalytix(TM) Biofuels Solutions Portfolio to Support Increasing Demands for Diversified Energy
"/sdd/edimar/Desktop/doutorado/doutorado04/bases/WEIR/finance/www.marketwatch.com/HIG.html",Spike In Severe Weather And Looming Alzheimer's Disease Epidemic - A Formula For Disaster
"/sdd/edimar/Desktop/doutorado/doutorado04/bases/WEIR/finance/www.marketwatch.com/AES.html",AES Corp.'s quarterly net profit off more than 6%
"/sdd/edimar/Desktop/doutorado/doutorado04/bases/WEIR/finance/www.marketwatch.com/UNP.html",Stocks in focus for Thursday
"/sdd/edimar/Desktop/doutorado/doutorado04/bases/WEIR/finance/www.marketwatch.com/AEE.html",Users' Group Recognizes Ameren's Hutsonville as 'PRB Coal Plant of the Year' 2009
"/sdd/edimar/Desktop/doutorado/doutorado04/bases/WEIR/finance/www.marketwatch.com/BA.html",Boeing Completes 787 Intermediate Gauntlet Testing
"/sdd/edimar/Desktop/doutorado/doutorado04/bases/WEIR/finance/www.marketwatch.com/ETN.html",GrafTech Stockholders Elect Randy Carson to Board
"/sdd/edimar/Desktop/doutorado/doutorado04/bases/WEIR/finance/www.marketwatch.com/CL.html",Procter & Gamble profit beats view; outlook cut
"/sdd/edimar/Desktop/doutorado/doutorado04/bases/WEIR/finance/www.marketwatch.com/DTE.html",/C O R R E C T I O N -- DTE Energy/
"/sdd/edimar/Desktop/doutorado/doutorado04/bases/WEIR/finance/www.marketwatch.com/INCY.html","Dow closes in on the 13,000 mark"
"/sdd/edimar/Desktop/doutorado/doutorado04/bases/WEIR/finance/www.marketwatch.com/MBI.html",Banks suing MBIA over business split: WSJ
"/sdd/edimar/Desktop/doutorado/doutorado04/bases/WEIR/finance/www.marketwatch.com/MRO.html",Marathon Announces Oberon Discovery in Deepwater Angola Block 31
"/sdd/edimar/Desktop/doutorado/doutorado04/bases/WEIR/finance/www.marketwatch.com/EK.html",Kodak Awarded $1.7 Million U.S. Department of Energy Contract to Develop OLED Lighting
"/sdd/edimar/Desktop/doutorado/doutorado04/bases/WEIR/finance/www.marketwatch.com/FE.html",FirstEnergy Earns Excellence Award for Supplier Diversity
"/sdd/edimar/Desktop/doutorado/doutorado04/bases/WEIR/finance/www.marketwatch.com/GD.html",General Dynamics Littoral Combat Ship Team Completes Main Propulsion System Testing in Preparation for LCS 2 Sea Trials
"/sdd/edimar/Desktop/doutorado/doutorado04/bases/WEIR/finance/www.marketwatch.com/TLAB.html","Tellabs, Alcatel-Lucent lead gainers"
"/sdd/edimar/Desktop/doutorado/doutorado04/bases/WEIR/finance/www.marketwatch.com/MAS.html",Stocks in focus for Tuesday
"/sdd/edimar/Desktop/doutorado/doutorado04/bases/WEIR/finance/www.marketwatch.com/ED.html",Go Green for Less Green: ConEdison Solutions Now Offers 'Green Power' to Connecticut Businesses and Households
"/sdd/edimar/Desktop/doutorado/doutorado04/bases/WEIR/finance/www.marketwatch.com/BMY.html",Bristol-Myers Squibb to Present at Goldman Sachs Global Healthcare Conference
"/sdd/edimar/Desktop/doutorado/doutorado04/bases/WEIR/finance/www.marketwatch.com/LOW.html","Retail stocks rise, led by Home Depot, Lowe's"
"/sdd/edimar/Desktop/doutorado/doutorado04/bases/WEIR/finance/www.marketwatch.com/VOD.html","Verizon Wireless Expands 3G Wireless Network in West Warren, Massachusetts"
"/sdd/edimar/Desktop/doutorado/doutorado04/bases/WEIR/finance/www.marketwatch.com/SRE.html",California Natural Gas Class Action Settlements Receive Preliminary Approval
"/sdd/edimar/Desktop/doutorado/doutorado04/bases/WEIR/finance/www.marketwatch.com/JNJ.html",Cougar's board recommends accepting J&J's offer
"/sdd/edimar/Desktop/doutorado/doutorado04/bases/WEIR/finance/www.marketwatch.com/LRCX.html","Nasdaq ends Friday in red, but posts second week of gains"
"/sdd/edimar/Desktop/doutorado/doutorado04/bases/WEIR/finance/www.marketwatch.com/AEP.html",Landis+Gyr Unveils Five-Year Smart Meter Deal With AEP Texas
"/sdd/edimar/Desktop/doutorado/doutorado04/bases/WEIR/finance/www.marketwatch.com/TJX.html",TJX May same-store sales up 5%
"/sdd/edimar/Desktop/doutorado/doutorado04/bases/WEIR/finance/www.marketwatch.com/YUM.html",Pizza Hut(R) and EA SPORTS Land a Knockout with Fight Night Round 4 Sweepstakes
"/sdd/edimar/Desktop/doutorado/doutorado04/bases/WEIR/finance/www.marketwatch.com/SBC.html",Outfit Dad With the Power of Touch and TV This Father's Day
"/sdd/edimar/Desktop/doutorado/doutorado04/bases/WEIR/finance/www.marketwatch.com/MU.html",Semiconductor Memory Start-Up Unity Semiconductor Closes $22M Series C Financing
