URL,EXTRACTED VALUE
"/sdd/edimar/Desktop/doutorado/doutorado04/bases/WEIR/finance/www.marketwatch.com/CREE.html","Pre-Market Analyst Calls (July 13, 2007)"
"/sdd/edimar/Desktop/doutorado/doutorado04/bases/WEIR/finance/www.marketwatch.com/QSFT.html",Quest Software Buys Into Virtualization (QSFT)
"/sdd/edimar/Desktop/doutorado/doutorado04/bases/WEIR/finance/www.marketwatch.com/BLL.html","Top Pre-Market Analyst Upgrades (AVR, BLL, CE, ETR, HCP, HR, MRK, PTNR, PTEN, UAUA, VSE)"
"/sdd/edimar/Desktop/doutorado/doutorado04/bases/WEIR/finance/www.marketwatch.com/ECL.html","Top 10 Pre-Market Analyst Calls (A, BBBY, BBY, DTV, ECL, EP, IBM, NTAP, LRCX, MOT, CRM)"
"/sdd/edimar/Desktop/doutorado/doutorado04/bases/WEIR/finance/www.marketwatch.com/KR.html","Top Pre-Market Analyst Upgrades (ACE, NLY, ESLR, GFIG, HOKU, ITG, GS, KR, MON, NDAQ, TRV)"
"/sdd/edimar/Desktop/doutorado/doutorado04/bases/WEIR/finance/www.marketwatch.com/FO.html",Norm Wesley Transitions Out of CEO Role at Fortune Brands (FO)
"/sdd/edimar/Desktop/doutorado/doutorado04/bases/WEIR/finance/www.marketwatch.com/WY.html",Short Sellers Attack Restructure & Re-Org Stocks (June 2007)
"/sdd/edimar/Desktop/doutorado/doutorado04/bases/WEIR/finance/www.marketwatch.com/ASH.html","Top 10 Pre-Market Analyst Calls (ANN, ASH, SCHW, AMTD, COH, DHT, NAT, PHTN, WYNN, BK, LEH, GS, IVZ, STT)"
"/sdd/edimar/Desktop/doutorado/doutorado04/bases/WEIR/finance/www.marketwatch.com/TEK.html","Emerson Added to Goldman Sachs Conviction Buy List (EMR, DHR, TYC)"
"/sdd/edimar/Desktop/doutorado/doutorado04/bases/WEIR/finance/www.marketwatch.com/GES.html","Cramer Calls A Bottom & Gives Play Book Picks (C, CVS, COST, GES, JCG, IBM, DD)"
"/sdd/edimar/Desktop/doutorado/doutorado04/bases/WEIR/finance/www.marketwatch.com/RSH.html","Top Pre-Market Analyst Downgrades (BBY, BBBY, CC, DELL, HPQ, JNS, LIZ, LSI, PIR, RACK, RSH, SFD)"
"/sdd/edimar/Desktop/doutorado/doutorado04/bases/WEIR/finance/www.marketwatch.com/TIN.html","Pre-Market Analyst Calls (Oct. 3, 2007)"
"/sdd/edimar/Desktop/doutorado/doutorado04/bases/WEIR/finance/www.marketwatch.com/DISH.html","Early-Bird Analyst Downgrades (AAP, ALNY, COMV, DISH, DPS, HAS, NATI, NVTL, STEL)"
"/sdd/edimar/Desktop/doutorado/doutorado04/bases/WEIR/finance/www.marketwatch.com/OI.html","Top 10 Pre-Market Analyst Calls (ADBL, GOOG, LOW, MXIM, MEDX, MS, MOT, OI, TIVO, DIS)"
"/sdd/edimar/Desktop/doutorado/doutorado04/bases/WEIR/finance/www.marketwatch.com/JBL.html","Media Digest 6/22/2007 Reuters, WSJ, NYTimes, FT, Barron's"
"/sdd/edimar/Desktop/doutorado/doutorado04/bases/WEIR/finance/www.marketwatch.com/NCR.html","Cardtronics Sets Initial IPO Terms (CATM, DBD, NCR, TDC)"
"/sdd/edimar/Desktop/doutorado/doutorado04/bases/WEIR/finance/www.marketwatch.com/NAV.html","Top Pre-Market Analyst Upgrades (HD, ILMN, MFE, NAV, OMX, VTA, VRNM, WAT)"
"/sdd/edimar/Desktop/doutorado/doutorado04/bases/WEIR/finance/www.marketwatch.com/ITT.html","Pre-Market Stock News (June 26, 2007)"
"/sdd/edimar/Desktop/doutorado/doutorado04/bases/WEIR/finance/www.marketwatch.com/PCLN.html",Priceline.com Earnings Keep Flying (PCLN)
"/sdd/edimar/Desktop/doutorado/doutorado04/bases/WEIR/finance/www.marketwatch.com/PLUG.html","Plug Power...Fuel Cells to Wal-Mart, Sort Of (PLUG, WMT)"
"/sdd/edimar/Desktop/doutorado/doutorado04/bases/WEIR/finance/www.marketwatch.com/BRCD.html",What To Expect Ahead of VMware's VMWORLD Conference
"/sdd/edimar/Desktop/doutorado/doutorado04/bases/WEIR/finance/www.marketwatch.com/LPX.html","Top 10 Pre-Market Analyst Calls (ABH, ETN, HES, LECO, LPX, MVSN, MUR, NVO, SWS, WBS)"
"/sdd/edimar/Desktop/doutorado/doutorado04/bases/WEIR/finance/www.marketwatch.com/SWK.html","Pre-Market Analyst Calls (July 13, 2007)"
"/sdd/edimar/Desktop/doutorado/doutorado04/bases/WEIR/finance/www.marketwatch.com/WWE.html",Cramer Goes Wrestling (WWE)
"/sdd/edimar/Desktop/doutorado/doutorado04/bases/WEIR/finance/www.marketwatch.com/APA.html","Goldman Sachs Major Oil Changes (APA, FST, KWK, KGS, EP, XOM, FTO, HES, MUR, OXY, CVX)"
"/sdd/edimar/Desktop/doutorado/doutorado04/bases/WEIR/finance/www.marketwatch.com/JCI.html","Backward & Forward, Cramer In 2007 To 2008"
"/sdd/edimar/Desktop/doutorado/doutorado04/bases/WEIR/finance/www.marketwatch.com/WEN.html","Top Pre-Market Analyst Upgrades (ARCC, BNI, MOT, PALM, RVBD, WEN)"
"/sdd/edimar/Desktop/doutorado/doutorado04/bases/WEIR/finance/www.marketwatch.com/GT.html","Pre-Market Earnings Gappers (July 26, 2007)"
"/sdd/edimar/Desktop/doutorado/doutorado04/bases/WEIR/finance/www.marketwatch.com/REGN.html","Icahn's Top Holdings (APC, BEAS, BIIB, CSX, LEA, M, MOT, JCP, REGN, TIN, TWX, TWC, UNM, WMB)"
"/sdd/edimar/Desktop/doutorado/doutorado04/bases/WEIR/finance/www.marketwatch.com/AKAM.html","52-Week Low Club (ABK, AKAM, C, CPKI, EBAY, FFIV, FUL, NMX, PMI, ZQK, SGMS, STXS, TTI, XRX, ZBRA)"
"/sdd/edimar/Desktop/doutorado/doutorado04/bases/WEIR/finance/www.marketwatch.com/HRB.html",Cramer Reviews 10 More Warren Buffett Stock Picks
"/sdd/edimar/Desktop/doutorado/doutorado04/bases/WEIR/finance/www.marketwatch.com/MAT.html",Baxter (BAX) Takes On Mattel's (MAT) Mantle
"/sdd/edimar/Desktop/doutorado/doutorado04/bases/WEIR/finance/www.marketwatch.com/SILI.html","Why So Many Mergers Are Failing (WMI, RSG, AW, VSH, IRF, DBD, UTX, SNDK)"
"/sdd/edimar/Desktop/doutorado/doutorado04/bases/WEIR/finance/www.marketwatch.com/TMK.html","Buffett & Berkshire Hathaway Holdings T - W (BRK-A, BRK-B, TMK, TT, USB, USG, UNP, UPS, UNH, WBC, WMT, WPO, WFC, WLP, WSC)"
"/sdd/edimar/Desktop/doutorado/doutorado04/bases/WEIR/finance/www.marketwatch.com/LEG.html","Massive List of 52-Week Lows (June 20, 2007)"
"/sdd/edimar/Desktop/doutorado/doutorado04/bases/WEIR/finance/www.marketwatch.com/EFX.html","52-Week Low Club: Transport, Semiconductors & Financials (January 2, 2008)"
"/sdd/edimar/Desktop/doutorado/doutorado04/bases/WEIR/finance/www.marketwatch.com/CMVT.html","Early-Bird Analyst Downgrades (CMVT, CTRP, GET, DNA, HAR, JNJ, PTRY, WDFC)"
"/sdd/edimar/Desktop/doutorado/doutorado04/bases/WEIR/finance/www.marketwatch.com/MTG.html","Cramer Launches ""Cramer's Mortgage Madness Index"""
"/sdd/edimar/Desktop/doutorado/doutorado04/bases/WEIR/finance/www.marketwatch.com/AVP.html","Goldman Sachs Changes Consumer Products Coverage (AVP, CL, BARE, PG, KMB)"
"/sdd/edimar/Desktop/doutorado/doutorado04/bases/WEIR/finance/www.marketwatch.com/AFL.html","Pre-Market Analyst Calls (July 23, 2007)"
"/sdd/edimar/Desktop/doutorado/doutorado04/bases/WEIR/finance/www.marketwatch.com/ICGE.html","Safeguard Scientifics CEO Interview: ""Small Cap Value Stock"" (SFE, CLRT, CMGI, ICGE)"
"/sdd/edimar/Desktop/doutorado/doutorado04/bases/WEIR/finance/www.marketwatch.com/CTXS.html","Sun Micro Wants Deeper Virtualization (JAVA, CTXS, VMW)"
"/sdd/edimar/Desktop/doutorado/doutorado04/bases/WEIR/finance/www.marketwatch.com/XLNX.html","Short Interest: NASDAQ Semiconductor Stocks (June, 2007)"
"/sdd/edimar/Desktop/doutorado/doutorado04/bases/WEIR/finance/www.marketwatch.com/VRSN.html","Top 10 Pre-Market Analyst Calls (AMGN, ENP, NTAP, PT, QCOM, SWIR, VCLK, VRSN, WY)"
"/sdd/edimar/Desktop/doutorado/doutorado04/bases/WEIR/finance/www.marketwatch.com/ARW.html",The 52-Week Low Club (ABK)(ARW)(MNI)(CAL)(NWA)(TSFG)(DAKT)
"/sdd/edimar/Desktop/doutorado/doutorado04/bases/WEIR/finance/www.marketwatch.com/ELON.html","Top Analyst Upgrades (AMAT, BP, CPST, EGLT, ELON, ITRI, KLAC, NSC, PQ, PCLN)"
"/sdd/edimar/Desktop/doutorado/doutorado04/bases/WEIR/finance/www.marketwatch.com/BMC.html",BMC Software's Best Bet: Its Own Stock (BMC)
"/sdd/edimar/Desktop/doutorado/doutorado04/bases/WEIR/finance/www.marketwatch.com/CB.html",Merrill Lynch (MER) And Citigroup (C): Where Were The Boards?
"/sdd/edimar/Desktop/doutorado/doutorado04/bases/WEIR/finance/www.marketwatch.com/BCE.html",BCE (BCE) Gets Bought
"/sdd/edimar/Desktop/doutorado/doutorado04/bases/WEIR/finance/www.marketwatch.com/FLEX.html","Mergers Closing For Vote (FLEX, SLR, PYX, ENR, NWRE, HPQ, AGE, WB, AV, RARE, DRI)"
"/sdd/edimar/Desktop/doutorado/doutorado04/bases/WEIR/finance/www.marketwatch.com/BKS.html",Barnes & Noble (BKS) + Borders (BGP) = 0
"/sdd/edimar/Desktop/doutorado/doutorado04/bases/WEIR/finance/www.marketwatch.com/MEDX.html",The 52-Week Low Club
"/sdd/edimar/Desktop/doutorado/doutorado04/bases/WEIR/finance/www.marketwatch.com/UVV.html",Universal Files To Raise Cash (UVV)
"/sdd/edimar/Desktop/doutorado/doutorado04/bases/WEIR/finance/www.marketwatch.com/D.html","Pre-Market Stock News (June 28, 2007)"
"/sdd/edimar/Desktop/doutorado/doutorado04/bases/WEIR/finance/www.marketwatch.com/CLX.html","Top Pre-Market Analyst Downgrades (JOBS, AUO, AVR, CRDN, CLX, DKS, GR, MPEL, PLXS, VSE)"
"/sdd/edimar/Desktop/doutorado/doutorado04/bases/WEIR/finance/www.marketwatch.com/OXY.html","Pre-Market Earnings Gappers (January 29, 2008)"
"/sdd/edimar/Desktop/doutorado/doutorado04/bases/WEIR/finance/www.marketwatch.com/TMO.html","Pre-Market Stock News (December 18, 2007)"
"/sdd/edimar/Desktop/doutorado/doutorado04/bases/WEIR/finance/www.marketwatch.com/BAX.html","Biotech Movers & Shakers (FOLD, BAX, CYTK, DSCO, HALO, IMCL, SGEN)"
"/sdd/edimar/Desktop/doutorado/doutorado04/bases/WEIR/finance/www.marketwatch.com/CSX.html","Top Analyst Upgrades (BWA, CLWR, CLF, CSX, NTLS, PFCB, VPHM)"
"/sdd/edimar/Desktop/doutorado/doutorado04/bases/WEIR/finance/www.marketwatch.com/AFFX.html",Affymetrix Year-Lows On Debt..No Good Deed Goes Unpunished (AFFX)
"/sdd/edimar/Desktop/doutorado/doutorado04/bases/WEIR/finance/www.marketwatch.com/TKR.html","Top Pre-Market Analyst Downgrades (ALL, AZN, ETFC, FITB, JNPR, QCOM, RF, RYAAY, SEPR, HOT, TKR, TWC, TROW, UA, VE, ZNT)"
"/sdd/edimar/Desktop/doutorado/doutorado04/bases/WEIR/finance/www.marketwatch.com/SAPE.html","Pre-Market Analyst Calls (July 17, 2007)"
"/sdd/edimar/Desktop/doutorado/doutorado04/bases/WEIR/finance/www.marketwatch.com/MAR.html","Media Digest 7/5/2007 Reuters, WSJ, NYTimes, FT, Barron's"
"/sdd/edimar/Desktop/doutorado/doutorado04/bases/WEIR/finance/www.marketwatch.com/PPL.html","More Nukes in the Pipeline (CEG, PPL, EXC)"
"/sdd/edimar/Desktop/doutorado/doutorado04/bases/WEIR/finance/www.marketwatch.com/ROK.html","Pre-Market Stock News (January 23, 2008)"
"/sdd/edimar/Desktop/doutorado/doutorado04/bases/WEIR/finance/www.marketwatch.com/ETR.html",Entergy Spinning Off Nuclear Operations (ETR)
"/sdd/edimar/Desktop/doutorado/doutorado04/bases/WEIR/finance/www.marketwatch.com/INTU.html","52-Week Lows, Massive List (ALU, BGP, CELL, BBW, CVO, DENN, GCI, INFY, INTU, KLAC, NT, NWA, NXTM, PDLI, PFE, Q, SVVS, SNE, BID, TWX)"
"/sdd/edimar/Desktop/doutorado/doutorado04/bases/WEIR/finance/www.marketwatch.com/TIBX.html","Reuters $1B IT Outsourcing Pact Names Fujitsu Instead of TIBCO (TIBX, VMW, RTRSY, TOC)"
"/sdd/edimar/Desktop/doutorado/doutorado04/bases/WEIR/finance/www.marketwatch.com/RX.html",IMS Health (RX) Shares Down 25% On Raw Earnings
"/sdd/edimar/Desktop/doutorado/doutorado04/bases/WEIR/finance/www.marketwatch.com/BBI.html",Market Shrugs Off Major Outage At Netflix (NFLX) (BBI)
"/sdd/edimar/Desktop/doutorado/doutorado04/bases/WEIR/finance/www.marketwatch.com/CPB.html","52-Week High Bear Market Surprises (JPM, CPB, CBSH, FFH, THS)"
"/sdd/edimar/Desktop/doutorado/doutorado04/bases/WEIR/finance/www.marketwatch.com/OMC.html","Today's & Upcoming Stock Splits (June 19, 2007)"
"/sdd/edimar/Desktop/doutorado/doutorado04/bases/WEIR/finance/www.marketwatch.com/LXK.html",Early Research Calls 7/9/2007
"/sdd/edimar/Desktop/doutorado/doutorado04/bases/WEIR/finance/www.marketwatch.com/UNP.html","CSX Rides The Reading Railroad (CSX, UNP, BNI)"
"/sdd/edimar/Desktop/doutorado/doutorado04/bases/WEIR/finance/www.marketwatch.com/AES.html","The Business Day In Global Warming (ASTI, NHY, AES, CLNE, EFOI, WMT, AMSC, BSRC)"
"/sdd/edimar/Desktop/doutorado/doutorado04/bases/WEIR/finance/www.marketwatch.com/AEE.html","Electricity Generation Costs More, Sells Less (FE, CHG, AEE)"
"/sdd/edimar/Desktop/doutorado/doutorado04/bases/WEIR/finance/www.marketwatch.com/ETN.html","Goldman Sachs Changes On Convistion Buy List (RCL, ETN)"
"/sdd/edimar/Desktop/doutorado/doutorado04/bases/WEIR/finance/www.marketwatch.com/INCY.html","Top Pre-Market Analyst Upgrades & Downgrades (EXPO, EHTH, INCY, RIGL, WBD, AMR, AMLN, BKUNA, NGG)"
"/sdd/edimar/Desktop/doutorado/doutorado04/bases/WEIR/finance/www.marketwatch.com/DTE.html","Top 10 Pre-Market Analyst Calls (CSIQ, COLM, DTE, ERTS, KMP, MER, MU, NKE, ZQK, YHOO)"
"/sdd/edimar/Desktop/doutorado/doutorado04/bases/WEIR/finance/www.marketwatch.com/MBI.html",The Shorts Get Out Of Banks And Into Tech (C)(WFC)(WB)(BAC)(MBI)(AIG)(INTC)(MSFT)(ORCL)(DELL)(QCOM)(SIRI)(F)
"/sdd/edimar/Desktop/doutorado/doutorado04/bases/WEIR/finance/www.marketwatch.com/MRO.html","Earnings Heading Up For Refiners? (MRO, CVX, VLO)"
"/sdd/edimar/Desktop/doutorado/doutorado04/bases/WEIR/finance/www.marketwatch.com/EK.html","10 CEOs To Go In 2009 (BSX, C, DDS, EK, GM, NT, RAD, SNDK, SIRI, JAVA)"
"/sdd/edimar/Desktop/doutorado/doutorado04/bases/WEIR/finance/www.marketwatch.com/FE.html","Electricity Generation Costs More, Sells Less (FE, CHG, AEE)"
"/sdd/edimar/Desktop/doutorado/doutorado04/bases/WEIR/finance/www.marketwatch.com/TLAB.html",Will Nortel Buy Tellabs? Hopefully Not
"/sdd/edimar/Desktop/doutorado/doutorado04/bases/WEIR/finance/www.marketwatch.com/MAS.html","Many Housing Stocks Still Hitting Lows (CTX, DHI, KBH, LEN, RYL, MHO, BECN, BLDR, MAS, XHB)"
"/sdd/edimar/Desktop/doutorado/doutorado04/bases/WEIR/finance/www.marketwatch.com/ED.html","Cramer's Tight End Fantasy Stock Picks (T, ED, EPD)"
"/sdd/edimar/Desktop/doutorado/doutorado04/bases/WEIR/finance/www.marketwatch.com/CTL.html",Internet Service Providers To Compete With Web Giants For Ads
"/sdd/edimar/Desktop/doutorado/doutorado04/bases/WEIR/finance/www.marketwatch.com/SRE.html","Earlybird Analyst Calls (June 19, 2007)"
"/sdd/edimar/Desktop/doutorado/doutorado04/bases/WEIR/finance/www.marketwatch.com/PLL.html","Top Pre-Market Analyst Upgrades (BNI, CMP, CSX, MET, MXB, NI, PLL, XEL)"
"/sdd/edimar/Desktop/doutorado/doutorado04/bases/WEIR/finance/www.marketwatch.com/LRCX.html","Previewing Applied Materials Earnings; They Didn't Get The Down Market Memo (AMAT, KLAC, NVLS, LRCX, ASML)"
"/sdd/edimar/Desktop/doutorado/doutorado04/bases/WEIR/finance/www.marketwatch.com/AEP.html","Top 10 Pre-Market Analyst Calls (AKAM, AEP, AAPL, BIDZ, CHINA, FMD, LVLT, PNRA, CRM, SPLS)"
