URL,EXTRACTED VALUE
"/sdd/edimar/Desktop/doutorado/doutorado04/bases/WEIR/finance/www.marketwatch.com/STJ.html",Three Med-Device Stocks on the Mend
"/sdd/edimar/Desktop/doutorado/doutorado04/bases/WEIR/finance/www.marketwatch.com/CTB.html","52-Week Low Club (AGN, WTR, CTB, ISLE, LPSN, OPTT, SGIC, SNCR)"
"/sdd/edimar/Desktop/doutorado/doutorado04/bases/WEIR/finance/www.marketwatch.com/ARIA.html","Today in Biotech Stocks (ALNY, ARIA, CEPH, CYPB, GTCB, ITMN)"
"/sdd/edimar/Desktop/doutorado/doutorado04/bases/WEIR/finance/www.marketwatch.com/PWAV.html","Early Bird Analyst Downgrades (DO, ESV, HBC, MORN, PPO, PWAV, RDC, TDW, TROW)"
"/sdd/edimar/Desktop/doutorado/doutorado04/bases/WEIR/finance/www.marketwatch.com/CSC.html",Computer Sciences Profit Soars
"/sdd/edimar/Desktop/doutorado/doutorado04/bases/WEIR/finance/www.marketwatch.com/BDX.html",Three Med-Device Stocks on the Mend
"/sdd/edimar/Desktop/doutorado/doutorado04/bases/WEIR/finance/www.marketwatch.com/NOVL.html",Dell May Use Google's Android in Products
"/sdd/edimar/Desktop/doutorado/doutorado04/bases/WEIR/finance/www.marketwatch.com/MTG.html",The 52-Week Low Club (MTG)(PLL)(ROCK)
"/sdd/edimar/Desktop/doutorado/doutorado04/bases/WEIR/finance/www.marketwatch.com/SLAB.html","Top Pre-Market Analyst Downgrades (AXP, ATML, BX, CHA, CYPB, HPQ, SLAB, UBS, WSM)"
"/sdd/edimar/Desktop/doutorado/doutorado04/bases/WEIR/finance/www.marketwatch.com/DHR.html","Top Analyst Upgrades (AAP, AZO, ED, CRH, DHR, LLY, INTC, LEAP, ORLY, SEIC)"
"/sdd/edimar/Desktop/doutorado/doutorado04/bases/WEIR/finance/www.marketwatch.com/KLAC.html","One Last Day of Chip Earnings (BRCM, IDTI, KLAC, MXIM, MCHP, PMCS, RMBS, VSEA)"
"/sdd/edimar/Desktop/doutorado/doutorado04/bases/WEIR/finance/www.marketwatch.com/GAP.html",Twelve Major Brands That Will Disappear
"/sdd/edimar/Desktop/doutorado/doutorado04/bases/WEIR/finance/www.marketwatch.com/WOR.html","Top Pre-Market Analyst Downgrades (ABX, COGT, GMR, GG, NEM, NAT, PRU, UBS, X, WOR)"
"/sdd/edimar/Desktop/doutorado/doutorado04/bases/WEIR/finance/www.marketwatch.com/GAS.html",Nicor: Shares Could Head South Today (GAS)
"/sdd/edimar/Desktop/doutorado/doutorado04/bases/WEIR/finance/www.marketwatch.com/CTXS.html",10-Q: CITRIX SYSTEMS INC
"/sdd/edimar/Desktop/doutorado/doutorado04/bases/WEIR/finance/www.marketwatch.com/SANM.html",The 52-Week Low Club (TSL)(RBS)(GGP)(SANM)
"/sdd/edimar/Desktop/doutorado/doutorado04/bases/WEIR/finance/www.marketwatch.com/PGR.html",Chubb Shares Could Fatten Up
"/sdd/edimar/Desktop/doutorado/doutorado04/bases/WEIR/finance/www.marketwatch.com/ISIL.html",The 52-Week Low Club (CHK)(WFT)(RIG)(MSCC)(ISIL)
"/sdd/edimar/Desktop/doutorado/doutorado04/bases/WEIR/finance/www.marketwatch.com/ELON.html",10-K: ECHELON CORP
"/sdd/edimar/Desktop/doutorado/doutorado04/bases/WEIR/finance/www.marketwatch.com/LLTC.html",Intel's Guidance May Weigh on Chip Stocks
"/sdd/edimar/Desktop/doutorado/doutorado04/bases/WEIR/finance/www.marketwatch.com/BCE.html","Top 10 Pre-Market Analyst Upgrades & Downgrades (ACTI, BCE, KSU, MYL, TEVA, AXP, AAPL, ROCK, SNV, TKC)"
"/sdd/edimar/Desktop/doutorado/doutorado04/bases/WEIR/finance/www.marketwatch.com/A.html",10-Q: AGILENT TECHNOLOGIES INC
"/sdd/edimar/Desktop/doutorado/doutorado04/bases/WEIR/finance/www.marketwatch.com/CHKP.html",Security Software's Outlook Seems Safer
"/sdd/edimar/Desktop/doutorado/doutorado04/bases/WEIR/finance/www.marketwatch.com/AM.html",The 52-Week Low Club (BA)(AM)(ROK)(HON)(SONC)(LCAV)
"/sdd/edimar/Desktop/doutorado/doutorado04/bases/WEIR/finance/www.marketwatch.com/CHINA.html",Markets Looking To China Rail IPO
"/sdd/edimar/Desktop/doutorado/doutorado04/bases/WEIR/finance/www.marketwatch.com/CPWR.html","This Week's Key Stock Buybacks & Repurchases (SYK, NILE, TDC, WW, CPWR, CE, EFX, VARI)"
"/sdd/edimar/Desktop/doutorado/doutorado04/bases/WEIR/finance/www.marketwatch.com/D.html",Negativity Reigns
"/sdd/edimar/Desktop/doutorado/doutorado04/bases/WEIR/finance/www.marketwatch.com/NVLS.html","Top Pre-Market Analyst Upgrades (ADS, AUTH, BRCM, EXC, NVLS, SAI, SNDA)"
"/sdd/edimar/Desktop/doutorado/doutorado04/bases/WEIR/finance/www.marketwatch.com/PMCS.html","One Last Day of Chip Earnings (BRCM, IDTI, KLAC, MXIM, MCHP, PMCS, RMBS, VSEA)"
"/sdd/edimar/Desktop/doutorado/doutorado04/bases/WEIR/finance/www.marketwatch.com/PEG.html",10-Q: PUBLIC SERVICE ENTERPRISE GROUP INC
"/sdd/edimar/Desktop/doutorado/doutorado04/bases/WEIR/finance/www.marketwatch.com/ELNK.html",AOL: When I Was Born the Doctor Slapped My Mother [Digital Daily]
"/sdd/edimar/Desktop/doutorado/doutorado04/bases/WEIR/finance/www.marketwatch.com/EIX.html","52-Week Low Club (CCJ, CVI, EIX, MDR, SSRI, ZINC)"
"/sdd/edimar/Desktop/doutorado/doutorado04/bases/WEIR/finance/www.marketwatch.com/MXIM.html","Top Analyst Upgrades & Downgrades (KG, MXIM, NWL, WFMI, WY, LM, POWI, S)"
"/sdd/edimar/Desktop/doutorado/doutorado04/bases/WEIR/finance/www.marketwatch.com/BDK.html","Top Analyst Downgrades (AAP, AMZN, AZO, BDK, LAZ, MS, TXN)"
"/sdd/edimar/Desktop/doutorado/doutorado04/bases/WEIR/finance/www.marketwatch.com/CVG.html",The 52-Week Low Club (PDGI)(PRXL)(LVS)(USG)(MF)(CVG)
"/sdd/edimar/Desktop/doutorado/doutorado04/bases/WEIR/finance/www.marketwatch.com/QSFT.html","Top 10 Pre-Market Analyst Calls (AIG, TRAK, DECK, ETR, ITLN, MF, PFE, QSFT, REP, RHD)"
"/sdd/edimar/Desktop/doutorado/doutorado04/bases/WEIR/finance/www.marketwatch.com/HP.html",Sifting for Gold Among High-Profit Stocks
"/sdd/edimar/Desktop/doutorado/doutorado04/bases/WEIR/finance/www.marketwatch.com/LTD.html",10-K: LIMITED BRANDS INC
"/sdd/edimar/Desktop/doutorado/doutorado04/bases/WEIR/finance/www.marketwatch.com/COMS.html",3Com Yields Another Rabbit (COMS)
"/sdd/edimar/Desktop/doutorado/doutorado04/bases/WEIR/finance/www.marketwatch.com/GR.html","Top Pre-Market Analyst Downgrades (ALU, AUO, BEC, BA, GR, KSU, LULU, SEPR)"
"/sdd/edimar/Desktop/doutorado/doutorado04/bases/WEIR/finance/www.marketwatch.com/COKE.html","If Coke Follow’s Pepsi’s Bottling Roll-Up (PEP, PAS, PBG, KO, COKE, CCE, KOF, CCH)"
"/sdd/edimar/Desktop/doutorado/doutorado04/bases/WEIR/finance/www.marketwatch.com/APD.html","Cramer Touting More Dividend Growers (PG, APD, NAT, MMM)"
"/sdd/edimar/Desktop/doutorado/doutorado04/bases/WEIR/finance/www.marketwatch.com/AFFX.html","Earnings Confessions Starting (AFFX, BEAV, COHR, CONN, NTY, ORBK)"
"/sdd/edimar/Desktop/doutorado/doutorado04/bases/WEIR/finance/www.marketwatch.com/WY.html","Top Analyst Upgrades & Downgrades (KG, MXIM, NWL, WFMI, WY, LM, POWI, S)"
"/sdd/edimar/Desktop/doutorado/doutorado04/bases/WEIR/finance/www.marketwatch.com/TEK.html","Top Analyst Upgrades (AAP, AZO, ED, CRH, DHR, LLY, INTC, LEAP, ORLY, SEIC)"
"/sdd/edimar/Desktop/doutorado/doutorado04/bases/WEIR/finance/www.marketwatch.com/ASH.html",Ashland Shares May Cool Off
"/sdd/edimar/Desktop/doutorado/doutorado04/bases/WEIR/finance/www.marketwatch.com/ROK.html","Top Pre-Market Analyst Downgrades (APKT, FITB, GNTX, NYM, PLD, ROK, TSS, VRAD)"
"/sdd/edimar/Desktop/doutorado/doutorado04/bases/WEIR/finance/www.marketwatch.com/HGSI.html",10-Q: HUMAN GENOME SCIENCES INC
"/sdd/edimar/Desktop/doutorado/doutorado04/bases/WEIR/finance/www.marketwatch.com/WMI.html","Top Pre-Market Analyst Downgrades (AEG, AAPL, BHP, CSIQ, CWST, JASO, MTB, NT, RRGB, STP, TRMB, WMI)"
"/sdd/edimar/Desktop/doutorado/doutorado04/bases/WEIR/finance/www.marketwatch.com/TIN.html",10-Q: TEMPLE INLAND INC
"/sdd/edimar/Desktop/doutorado/doutorado04/bases/WEIR/finance/www.marketwatch.com/ETR.html",Court Revives Cost Rules on Power Plants
"/sdd/edimar/Desktop/doutorado/doutorado04/bases/WEIR/finance/www.marketwatch.com/ANDW.html",10-Q: COMMSCOPE INC
"/sdd/edimar/Desktop/doutorado/doutorado04/bases/WEIR/finance/www.marketwatch.com/JBL.html","Top Pre-Market Analyst Upgrades (AXL, ARCC, FSLR, F, GOOG, HOG, JBL, LEA, MYL, RYAAY, UL)"
"/sdd/edimar/Desktop/doutorado/doutorado04/bases/WEIR/finance/www.marketwatch.com/TIBX.html","Early-Bird Technology Upgrades & Downgrades (ARMH, FFIV, MFE, MOT, NOK, NOVL, QCOM, TIBX)"
"/sdd/edimar/Desktop/doutorado/doutorado04/bases/WEIR/finance/www.marketwatch.com/RFMD.html",10-K: RF MICRO DEVICES INC
"/sdd/edimar/Desktop/doutorado/doutorado04/bases/WEIR/finance/www.marketwatch.com/ITT.html","Top 10 Pre-Market Analyst Calls (MO, HLF, ITT, M, MCK, NTRI, PM, SLM, STT, YGE)"
"/sdd/edimar/Desktop/doutorado/doutorado04/bases/WEIR/finance/www.marketwatch.com/LXK.html","H-P Joins The Club... Of 52-Week Lows (HPQ, DELL, IBM, LXK)"
"/sdd/edimar/Desktop/doutorado/doutorado04/bases/WEIR/finance/www.marketwatch.com/SWK.html","Many Monday Pre-Market Downgrades (CEG, FIS, FISV, DNA, KBW, NKE, PSO, SHW, SWIR, SWK, WERN, WIT)"
"/sdd/edimar/Desktop/doutorado/doutorado04/bases/WEIR/finance/www.marketwatch.com/LPX.html","Top Pre-Market Analyst Downgrades (AHII, NILE, FOSL, HNT, HSNI, IPCS, LPX, MCHP, PALM, PPCO, RJF, PCU)"
"/sdd/edimar/Desktop/doutorado/doutorado04/bases/WEIR/finance/www.marketwatch.com/UIS.html",Unisys Looking For New Turnaround CEO (UIS)
"/sdd/edimar/Desktop/doutorado/doutorado04/bases/WEIR/finance/www.marketwatch.com/ITW.html","Top 10 Analyst Upgrades & Downgrades (ABC, BWA, DRYS, FIS, ITW, JPM, MHP, NOK, SOHU, ZUMZ)"
"/sdd/edimar/Desktop/doutorado/doutorado04/bases/WEIR/finance/www.marketwatch.com/DIA.html","Stock Markets Take Out October Lows (DIA, SPY, QQQQ)"
"/sdd/edimar/Desktop/doutorado/doutorado04/bases/WEIR/finance/www.marketwatch.com/QLGC.html",QLogic Shows Some Still Win In Tech (QLGC)
"/sdd/edimar/Desktop/doutorado/doutorado04/bases/WEIR/finance/www.marketwatch.com/FE.html",10-Q: FIRSTENERGY CORP
"/sdd/edimar/Desktop/doutorado/doutorado04/bases/WEIR/finance/www.marketwatch.com/REGN.html","Biotech Business Daily (ANIK, ATHX, HALO, IDRA, MRK, OMPI, REGN, DDD, SQNM)"
"/sdd/edimar/Desktop/doutorado/doutorado04/bases/WEIR/finance/www.marketwatch.com/PSUN.html",Retailers Close 'Concept' Stores
"/sdd/edimar/Desktop/doutorado/doutorado04/bases/WEIR/finance/www.marketwatch.com/TLAB.html","Top Pre-Market Analyst Upgrades (ABC, BRCM, COH, DNA, IILG, LXK, NUAN, STLD, TLAB)"
"/sdd/edimar/Desktop/doutorado/doutorado04/bases/WEIR/finance/www.marketwatch.com/MDR.html",The 52-Week Low Club (VCI)(SVR)(MDR)(ANN)(CRL)(GT)(NOBL)(THQI)
"/sdd/edimar/Desktop/doutorado/doutorado04/bases/WEIR/finance/www.marketwatch.com/AKAM.html",Stocks in the Spotlight Friday
"/sdd/edimar/Desktop/doutorado/doutorado04/bases/WEIR/finance/www.marketwatch.com/CTL.html","Media Digest 10/28/2008 Reuters, WSJ, NYTimes, FT, Bloomberg"
"/sdd/edimar/Desktop/doutorado/doutorado04/bases/WEIR/finance/www.marketwatch.com/TER.html","Top Pre-Market Analyst Upgrades (ARAY, AZN, SAM, BSX, CNX, MLM, TER, TWX)"
"/sdd/edimar/Desktop/doutorado/doutorado04/bases/WEIR/finance/www.marketwatch.com/AOC.html",An Investor With D&eacute;j&aacute; Vu
"/sdd/edimar/Desktop/doutorado/doutorado04/bases/WEIR/finance/www.marketwatch.com/PDLI.html","Top 10 Pre-Market Analyst Calls (AFL, AW, CPB, MWV, NYX, ODFL, PDLI, PCZ, SPIL, WDFC)"
"/sdd/edimar/Desktop/doutorado/doutorado04/bases/WEIR/finance/www.marketwatch.com/PLL.html",10-Q: PALL CORP
"/sdd/edimar/Desktop/doutorado/doutorado04/bases/WEIR/finance/www.marketwatch.com/SYY.html",Pounding the Table for Sysco
"/sdd/edimar/Desktop/doutorado/doutorado04/bases/WEIR/finance/www.marketwatch.com/TMK.html",Pressure Won't Let Up on Life Insurers
"/sdd/edimar/Desktop/doutorado/doutorado04/bases/WEIR/finance/www.marketwatch.com/LRCX.html","In Semiconductor-Equipment Stocks, Good Looks Are Deceiving"
"/sdd/edimar/Desktop/doutorado/doutorado04/bases/WEIR/finance/www.marketwatch.com/IFF.html","Top 10 Early Bird Analyst Calls (ARTC, AGO, FDRY, IFF, PETS, PDS, CRM, SNDK, TEF, TXN)"
"/sdd/edimar/Desktop/doutorado/doutorado04/bases/WEIR/finance/www.marketwatch.com/ATI.html","Stocks Which Doubled Market Performance (ATI, CMCSA, COH, FMCN, HPC, IPG, MICC, NEM, SNI, TIE, VMED)"
"/sdd/edimar/Desktop/doutorado/doutorado04/bases/WEIR/finance/www.marketwatch.com/N.html","Top Pre-Market Analyst Downgrades (AKAM, CVLT, JNPR, LVS, MUR, N, PDX)"
