URL,EXTRACTED VALUE
"/sdd/edimar/Desktop/doutorado/doutorado04/bases/WEIR/finance/moneycentral.msn.com/GT.html",Goodyear's US plants and production
"/sdd/edimar/Desktop/doutorado/doutorado04/bases/WEIR/finance/moneycentral.msn.com/CAL.html",Sector Snap: Airline shares mostly lower
"/sdd/edimar/Desktop/doutorado/doutorado04/bases/WEIR/finance/moneycentral.msn.com/ENZ.html",View all ENZ news
"/sdd/edimar/Desktop/doutorado/doutorado04/bases/WEIR/finance/moneycentral.msn.com/KR.html",King Soopers workers to vote on contract proposal
"/sdd/edimar/Desktop/doutorado/doutorado04/bases/WEIR/finance/moneycentral.msn.com/AMAT.html",Applied Materials sets 6-cent quarterly dividend
"/sdd/edimar/Desktop/doutorado/doutorado04/bases/WEIR/finance/moneycentral.msn.com/TM.html",Toyota responds to published report on Miss. plant
"/sdd/edimar/Desktop/doutorado/doutorado04/bases/WEIR/finance/moneycentral.msn.com/ADP.html",7 Stocks to Start You Off
"/sdd/edimar/Desktop/doutorado/doutorado04/bases/WEIR/finance/moneycentral.msn.com/LTD.html",Pa. woman sues Victoria's Secret over bra design
"/sdd/edimar/Desktop/doutorado/doutorado04/bases/WEIR/finance/moneycentral.msn.com/WMI.html",View all WMI news
"/sdd/edimar/Desktop/doutorado/doutorado04/bases/WEIR/finance/moneycentral.msn.com/MAR.html",Sector Snap: Hotels mixed after hotel default
"/sdd/edimar/Desktop/doutorado/doutorado04/bases/WEIR/finance/moneycentral.msn.com/BBBY.html",The Best Opportunity This Decade
"/sdd/edimar/Desktop/doutorado/doutorado04/bases/WEIR/finance/moneycentral.msn.com/AMTD.html",TD Ameritrade completes thinkorswim acquisition
"/sdd/edimar/Desktop/doutorado/doutorado04/bases/WEIR/finance/moneycentral.msn.com/AXP.html",Computer glitch at NYSE halts some floor trading
"/sdd/edimar/Desktop/doutorado/doutorado04/bases/WEIR/finance/moneycentral.msn.com/PCH.html",Potlatch cuts harvest plans as lumber prices slip
"/sdd/edimar/Desktop/doutorado/doutorado04/bases/WEIR/finance/moneycentral.msn.com/MRK.html",Final Glance: Pharmaceuticals companies
"/sdd/edimar/Desktop/doutorado/doutorado04/bases/WEIR/finance/moneycentral.msn.com/MTG.html",Early Glance: Insurers companies
"/sdd/edimar/Desktop/doutorado/doutorado04/bases/WEIR/finance/moneycentral.msn.com/TMK.html",A.M. Best revises Torchmark ratings downward
"/sdd/edimar/Desktop/doutorado/doutorado04/bases/WEIR/finance/moneycentral.msn.com/NSC.html",Midday Glance: Railroads companies
"/sdd/edimar/Desktop/doutorado/doutorado04/bases/WEIR/finance/moneycentral.msn.com/GRA.html",Bankruptcy filing by GM would shake up Dow index
"/sdd/edimar/Desktop/doutorado/doutorado04/bases/WEIR/finance/moneycentral.msn.com/DTE.html","MichCon wants rate hike, says bills would be less"
"/sdd/edimar/Desktop/doutorado/doutorado04/bases/WEIR/finance/moneycentral.msn.com/TYC.html",Michigan announces $24.5M settlement with Tyco
"/sdd/edimar/Desktop/doutorado/doutorado04/bases/WEIR/finance/moneycentral.msn.com/HAS.html",Ohio State president to join Bob Evans Farm board
"/sdd/edimar/Desktop/doutorado/doutorado04/bases/WEIR/finance/moneycentral.msn.com/ADSK.html",Yahoo open to Microsoft deal under right terms
"/sdd/edimar/Desktop/doutorado/doutorado04/bases/WEIR/finance/moneycentral.msn.com/COF.html",Sources: Banks will start repaying TARP next week
"/sdd/edimar/Desktop/doutorado/doutorado04/bases/WEIR/finance/moneycentral.msn.com/WMB.html","Atlas Pipeline, Williams Cos. close joint venture"
"/sdd/edimar/Desktop/doutorado/doutorado04/bases/WEIR/finance/moneycentral.msn.com/S.html",Final Glance: Telecom companies
"/sdd/edimar/Desktop/doutorado/doutorado04/bases/WEIR/finance/moneycentral.msn.com/CREE.html","Cree shares up on raised 4Q profit, sales outlook"
"/sdd/edimar/Desktop/doutorado/doutorado04/bases/WEIR/finance/moneycentral.msn.com/RMBS.html","Rambus settles EU antitrust probe, avoids fines"
"/sdd/edimar/Desktop/doutorado/doutorado04/bases/WEIR/finance/moneycentral.msn.com/NKE.html",Travel habits prompt conflict of interest concerns
"/sdd/edimar/Desktop/doutorado/doutorado04/bases/WEIR/finance/moneycentral.msn.com/QCOM.html",Market Report -- In Play (QCOM)
"/sdd/edimar/Desktop/doutorado/doutorado04/bases/WEIR/finance/moneycentral.msn.com/ACV.html",View all ACV news
"/sdd/edimar/Desktop/doutorado/doutorado04/bases/WEIR/finance/moneycentral.msn.com/ALL.html",Fitch: P&C insurance market remains challenged
"/sdd/edimar/Desktop/doutorado/doutorado04/bases/WEIR/finance/moneycentral.msn.com/CI.html",Final Glance: Managed Care companies
"/sdd/edimar/Desktop/doutorado/doutorado04/bases/WEIR/finance/moneycentral.msn.com/AES.html",View all AES news
"/sdd/edimar/Desktop/doutorado/doutorado04/bases/WEIR/finance/moneycentral.msn.com/NOVL.html",Novell shares fall after mixed 2Q results
"/sdd/edimar/Desktop/doutorado/doutorado04/bases/WEIR/finance/moneycentral.msn.com/AEE.html",View all AEE news
"/sdd/edimar/Desktop/doutorado/doutorado04/bases/WEIR/finance/moneycentral.msn.com/SBUX.html",Starbucks: Memorial Day double-charges resolved
"/sdd/edimar/Desktop/doutorado/doutorado04/bases/WEIR/finance/moneycentral.msn.com/CF.html",Sector Snap: Analyst sees fertilizer recovery
"/sdd/edimar/Desktop/doutorado/doutorado04/bases/WEIR/finance/moneycentral.msn.com/UNP.html",Midday Glance: Railroads companies
"/sdd/edimar/Desktop/doutorado/doutorado04/bases/WEIR/finance/moneycentral.msn.com/AMR.html",Sector Snap: Airline shares mostly lower
"/sdd/edimar/Desktop/doutorado/doutorado04/bases/WEIR/finance/moneycentral.msn.com/AMGN.html",Final Glance: Biotechnology companies
"/sdd/edimar/Desktop/doutorado/doutorado04/bases/WEIR/finance/moneycentral.msn.com/UVV.html",View all UVV news
"/sdd/edimar/Desktop/doutorado/doutorado04/bases/WEIR/finance/moneycentral.msn.com/PAYX.html","Movers roundup: BlackRock, Paychex"
"/sdd/edimar/Desktop/doutorado/doutorado04/bases/WEIR/finance/moneycentral.msn.com/RL.html",Polo Ralph Lauren 4Q profit falls on charges
"/sdd/edimar/Desktop/doutorado/doutorado04/bases/WEIR/finance/moneycentral.msn.com/NCR.html","NCR move threatens Dayton charities, arts groups"
"/sdd/edimar/Desktop/doutorado/doutorado04/bases/WEIR/finance/moneycentral.msn.com/TIF.html",Market Report -- In Play (TIF)
"/sdd/edimar/Desktop/doutorado/doutorado04/bases/WEIR/finance/moneycentral.msn.com/PCLN.html",The Cheapest Stocks I Know
"/sdd/edimar/Desktop/doutorado/doutorado04/bases/WEIR/finance/moneycentral.msn.com/AMD.html",Shareholder lawsuit against Intel tossed out
"/sdd/edimar/Desktop/doutorado/doutorado04/bases/WEIR/finance/moneycentral.msn.com/CSC.html",CSC to provide IT services in UK for $50 million
"/sdd/edimar/Desktop/doutorado/doutorado04/bases/WEIR/finance/moneycentral.msn.com/HSY.html","Hot in recession: Chocolate, running shoes, Spam"
"/sdd/edimar/Desktop/doutorado/doutorado04/bases/WEIR/finance/moneycentral.msn.com/JCP.html",Ticker Shock: Three Reasons to Cruise With Royal Caribbean Stock
"/sdd/edimar/Desktop/doutorado/doutorado04/bases/WEIR/finance/moneycentral.msn.com/MGM.html",Is Wynn Resorts Really a Terrible Stock?
"/sdd/edimar/Desktop/doutorado/doutorado04/bases/WEIR/finance/moneycentral.msn.com/D.html",Environmentalists back Dominion Virginia wind plan
"/sdd/edimar/Desktop/doutorado/doutorado04/bases/WEIR/finance/moneycentral.msn.com/HMC.html",Cash-for-Clunkers Plan Still in the Ditch
"/sdd/edimar/Desktop/doutorado/doutorado04/bases/WEIR/finance/moneycentral.msn.com/HUM.html",Midday Glance: Managed Care companies
"/sdd/edimar/Desktop/doutorado/doutorado04/bases/WEIR/finance/moneycentral.msn.com/BAX.html",Final Glance: Medical Devices companies
"/sdd/edimar/Desktop/doutorado/doutorado04/bases/WEIR/finance/moneycentral.msn.com/WWE.html",Double bookings at arenas can mean double trouble
"/sdd/edimar/Desktop/doutorado/doutorado04/bases/WEIR/finance/moneycentral.msn.com/A.html",Moody's Blues: Time to Short the Agency?
"/sdd/edimar/Desktop/doutorado/doutorado04/bases/WEIR/finance/moneycentral.msn.com/NTAP.html",Data Domain to comment on EMC bid by June 16
"/sdd/edimar/Desktop/doutorado/doutorado04/bases/WEIR/finance/moneycentral.msn.com/CPB.html",US putting up $2.7M to keep Campbell in Camden
"/sdd/edimar/Desktop/doutorado/doutorado04/bases/WEIR/finance/moneycentral.msn.com/BEN.html",Asset manager shares mostly rise on upgrades
"/sdd/edimar/Desktop/doutorado/doutorado04/bases/WEIR/finance/moneycentral.msn.com/PHM.html",Ahead of the Bell: New Home Sales
"/sdd/edimar/Desktop/doutorado/doutorado04/bases/WEIR/finance/moneycentral.msn.com/CAH.html",4 Dividend Stocks Showing You the Money
"/sdd/edimar/Desktop/doutorado/doutorado04/bases/WEIR/finance/moneycentral.msn.com/PG.html",Safety or Growth? 3 Stocks That Offer Both
"/sdd/edimar/Desktop/doutorado/doutorado04/bases/WEIR/finance/moneycentral.msn.com/CA.html",CA shares gain after 4Q results top Street
"/sdd/edimar/Desktop/doutorado/doutorado04/bases/WEIR/finance/moneycentral.msn.com/BKS.html",Lost in translation: The Spanish-language puzzle
"/sdd/edimar/Desktop/doutorado/doutorado04/bases/WEIR/finance/moneycentral.msn.com/NTRS.html",Sources: Banks will start repaying TARP next week
"/sdd/edimar/Desktop/doutorado/doutorado04/bases/WEIR/finance/moneycentral.msn.com/CCL.html",The Most Dangerous Way to Invest Today
"/sdd/edimar/Desktop/doutorado/doutorado04/bases/WEIR/finance/moneycentral.msn.com/MRO.html",S&P cuts rating on Petroleos de Venezuela to 'B+'
"/sdd/edimar/Desktop/doutorado/doutorado04/bases/WEIR/finance/moneycentral.msn.com/ED.html",Midday Glance: Utilities companies
"/sdd/edimar/Desktop/doutorado/doutorado04/bases/WEIR/finance/moneycentral.msn.com/INTU.html",Will You Need a License to File Your Taxes?
"/sdd/edimar/Desktop/doutorado/doutorado04/bases/WEIR/finance/moneycentral.msn.com/UTSI.html","UTStarcom to cut 2,300 jobs by end of 4Q"
"/sdd/edimar/Desktop/doutorado/doutorado04/bases/WEIR/finance/moneycentral.msn.com/MCD.html",Early Glance: Food companies
"/sdd/edimar/Desktop/doutorado/doutorado04/bases/WEIR/finance/moneycentral.msn.com/PX.html",Sector Snap: Specialty chemicals rise on upgrade
"/sdd/edimar/Desktop/doutorado/doutorado04/bases/WEIR/finance/moneycentral.msn.com/ORCL.html",Big Money Is All in the Timing
"/sdd/edimar/Desktop/doutorado/doutorado04/bases/WEIR/finance/moneycentral.msn.com/PNW.html","Premarket roundup: Monsanto, Bank of America"
"/sdd/edimar/Desktop/doutorado/doutorado04/bases/WEIR/finance/moneycentral.msn.com/FLR.html",Early Glance: Construction companies
"/sdd/edimar/Desktop/doutorado/doutorado04/bases/WEIR/finance/moneycentral.msn.com/PSS.html",Collective Brands reports higher 1Q profits
"/sdd/edimar/Desktop/doutorado/doutorado04/bases/WEIR/finance/moneycentral.msn.com/SLE.html","Premarket roundup: Sara Lee, hospitals"
"/sdd/edimar/Desktop/doutorado/doutorado04/bases/WEIR/finance/moneycentral.msn.com/HON.html",Honeywell in $700 million military logistics contract
"/sdd/edimar/Desktop/doutorado/doutorado04/bases/WEIR/finance/moneycentral.msn.com/PSUN.html",Pacific Sunwear of Calif. posts smaller 1Q loss
"/sdd/edimar/Desktop/doutorado/doutorado04/bases/WEIR/finance/moneycentral.msn.com/YUM.html",Was That the Market Hitting Its Peak?
"/sdd/edimar/Desktop/doutorado/doutorado04/bases/WEIR/finance/moneycentral.msn.com/TBL.html",View all TBL news
"/sdd/edimar/Desktop/doutorado/doutorado04/bases/WEIR/finance/moneycentral.msn.com/GE.html",Sarah Palin: Letterman owes women an apology
"/sdd/edimar/Desktop/doutorado/doutorado04/bases/WEIR/finance/moneycentral.msn.com/OSCI.html",View all OSCI news
"/sdd/edimar/Desktop/doutorado/doutorado04/bases/WEIR/finance/moneycentral.msn.com/LLY.html",Early Glance: Pharmaceuticals companies
"/sdd/edimar/Desktop/doutorado/doutorado04/bases/WEIR/finance/moneycentral.msn.com/DOV.html",Chief Automotive moving Neb. production to Ind.
"/sdd/edimar/Desktop/doutorado/doutorado04/bases/WEIR/finance/moneycentral.msn.com/JPM.html",Treasury faces pressure on price of TARP exit
"/sdd/edimar/Desktop/doutorado/doutorado04/bases/WEIR/finance/moneycentral.msn.com/SO.html",Midday Glance: Utilities companies
"/sdd/edimar/Desktop/doutorado/doutorado04/bases/WEIR/finance/moneycentral.msn.com/DUK.html",Utilities profit from lower electricity sales
"/sdd/edimar/Desktop/doutorado/doutorado04/bases/WEIR/finance/moneycentral.msn.com/ADBE.html",Buffett's Biggest Mistake
"/sdd/edimar/Desktop/doutorado/doutorado04/bases/WEIR/finance/moneycentral.msn.com/R.html",View all R news
"/sdd/edimar/Desktop/doutorado/doutorado04/bases/WEIR/finance/moneycentral.msn.com/AGN.html",Midday Glance: Medical Devices companies
"/sdd/edimar/Desktop/doutorado/doutorado04/bases/WEIR/finance/moneycentral.msn.com/WOR.html",Market Report -- In Play (WOR)
"/sdd/edimar/Desktop/doutorado/doutorado04/bases/WEIR/finance/moneycentral.msn.com/ERTS.html",EA creates a racket (and a golf club) on the Wii
"/sdd/edimar/Desktop/doutorado/doutorado04/bases/WEIR/finance/moneycentral.msn.com/MOT.html","Tessera shares jump on 2Q outlook, Motorola deal"
"/sdd/edimar/Desktop/doutorado/doutorado04/bases/WEIR/finance/moneycentral.msn.com/SKX.html",View all SKX news
"/sdd/edimar/Desktop/doutorado/doutorado04/bases/WEIR/finance/moneycentral.msn.com/RFMD.html",View all RFMD news
"/sdd/edimar/Desktop/doutorado/doutorado04/bases/WEIR/finance/moneycentral.msn.com/WLP.html",Midday Glance: Managed Care companies
"/sdd/edimar/Desktop/doutorado/doutorado04/bases/WEIR/finance/moneycentral.msn.com/FO.html",5-Star Stocks Poised to Pop: Diageo
"/sdd/edimar/Desktop/doutorado/doutorado04/bases/WEIR/finance/moneycentral.msn.com/AKAM.html",Early Glance: Internet companies
"/sdd/edimar/Desktop/doutorado/doutorado04/bases/WEIR/finance/moneycentral.msn.com/WAG.html",Midday Glance: Drugstore companies
"/sdd/edimar/Desktop/doutorado/doutorado04/bases/WEIR/finance/moneycentral.msn.com/NEM.html",Nevada gold mine closed due to mercury emissions
"/sdd/edimar/Desktop/doutorado/doutorado04/bases/WEIR/finance/moneycentral.msn.com/FCEL.html",Market Report -- In Play (FCEL)
"/sdd/edimar/Desktop/doutorado/doutorado04/bases/WEIR/finance/moneycentral.msn.com/EMN.html",Eastman Chemical spent $270K to lobby gov't in 1Q
"/sdd/edimar/Desktop/doutorado/doutorado04/bases/WEIR/finance/moneycentral.msn.com/CCE.html","Premarket roundup: Coca-Cola Ent., Jack in the Box"
"/sdd/edimar/Desktop/doutorado/doutorado04/bases/WEIR/finance/moneycentral.msn.com/SNDK.html",SanDisk shares soar after Samsung deal on chips
"/sdd/edimar/Desktop/doutorado/doutorado04/bases/WEIR/finance/moneycentral.msn.com/HOTT.html",Sector Snap: Teen retailer shares mainly fall
"/sdd/edimar/Desktop/doutorado/doutorado04/bases/WEIR/finance/moneycentral.msn.com/MCK.html",View all MCK news
"/sdd/edimar/Desktop/doutorado/doutorado04/bases/WEIR/finance/moneycentral.msn.com/WFC.html",You Are About to Make a Bad Investment
"/sdd/edimar/Desktop/doutorado/doutorado04/bases/WEIR/finance/moneycentral.msn.com/ROK.html",7 Great American Stocks on Sale
"/sdd/edimar/Desktop/doutorado/doutorado04/bases/WEIR/finance/moneycentral.msn.com/THC.html",Key health care senators have industry ties
"/sdd/edimar/Desktop/doutorado/doutorado04/bases/WEIR/finance/moneycentral.msn.com/NAV.html",Navistar Intl narrows fiscal '09 outlook
"/sdd/edimar/Desktop/doutorado/doutorado04/bases/WEIR/finance/moneycentral.msn.com/SUN.html","Refining stocks fall on 2Q worries, cash concerns"
"/sdd/edimar/Desktop/doutorado/doutorado04/bases/WEIR/finance/moneycentral.msn.com/MAS.html",Sector Snap: Construction materials suppliers gain
"/sdd/edimar/Desktop/doutorado/doutorado04/bases/WEIR/finance/moneycentral.msn.com/PCG.html",View all PCG news
"/sdd/edimar/Desktop/doutorado/doutorado04/bases/WEIR/finance/moneycentral.msn.com/DD.html",Final Glance: Chemicals companies
"/sdd/edimar/Desktop/doutorado/doutorado04/bases/WEIR/finance/moneycentral.msn.com/COMS.html",View all COMS news
"/sdd/edimar/Desktop/doutorado/doutorado04/bases/WEIR/finance/moneycentral.msn.com/MET.html",Stress-tested banks raise $75.2 billion in capital
"/sdd/edimar/Desktop/doutorado/doutorado04/bases/WEIR/finance/moneycentral.msn.com/TWX.html",Early Glance: Media companies
"/sdd/edimar/Desktop/doutorado/doutorado04/bases/WEIR/finance/moneycentral.msn.com/EMR.html",Early Glance: Electrical companies
"/sdd/edimar/Desktop/doutorado/doutorado04/bases/WEIR/finance/moneycentral.msn.com/WMT.html",Correction: Wal-Mart Executive Compensation story
"/sdd/edimar/Desktop/doutorado/doutorado04/bases/WEIR/finance/moneycentral.msn.com/F.html",Final Glance: Autos companies
"/sdd/edimar/Desktop/doutorado/doutorado04/bases/WEIR/finance/moneycentral.msn.com/FNM.html",Keepin' It Real Estate: Where Have All the Houses Gone?
"/sdd/edimar/Desktop/doutorado/doutorado04/bases/WEIR/finance/moneycentral.msn.com/HAL.html",3 Bargain Stocks for This Market
"/sdd/edimar/Desktop/doutorado/doutorado04/bases/WEIR/finance/moneycentral.msn.com/BBY.html",Earnings schedule for week of 6/15/09
"/sdd/edimar/Desktop/doutorado/doutorado04/bases/WEIR/finance/moneycentral.msn.com/KSS.html",Department chain sales results for May
"/sdd/edimar/Desktop/doutorado/doutorado04/bases/WEIR/finance/moneycentral.msn.com/X.html",5 Top-Rated Value Stocks
"/sdd/edimar/Desktop/doutorado/doutorado04/bases/WEIR/finance/moneycentral.msn.com/SNE.html",US video game sales slide 23 pct in May
"/sdd/edimar/Desktop/doutorado/doutorado04/bases/WEIR/finance/moneycentral.msn.com/BA.html",Final Glance: Aerospace companies
"/sdd/edimar/Desktop/doutorado/doutorado04/bases/WEIR/finance/moneycentral.msn.com/PLL.html","Movers roundup: Sina, Skilled Healthcare"
"/sdd/edimar/Desktop/doutorado/doutorado04/bases/WEIR/finance/moneycentral.msn.com/VOD.html","Verizon Wireless to carry Android, Pre phones"
"/sdd/edimar/Desktop/doutorado/doutorado04/bases/WEIR/finance/moneycentral.msn.com/AIG.html",Washington to CEOs: Meet Your Compensation Czar
"/sdd/edimar/Desktop/doutorado/doutorado04/bases/WEIR/finance/moneycentral.msn.com/HRB.html",Jackson Hewitt shares jump on CEO appointment
"/sdd/edimar/Desktop/doutorado/doutorado04/bases/WEIR/finance/moneycentral.msn.com/GD.html",General Dynamics gets $20M contract
"/sdd/edimar/Desktop/doutorado/doutorado04/bases/WEIR/finance/moneycentral.msn.com/OXY.html",Ahead of the Bell: Natural gas boost expected
"/sdd/edimar/Desktop/doutorado/doutorado04/bases/WEIR/finance/moneycentral.msn.com/SHW.html",Sector Snap: Specialty chemicals rise on upgrade
"/sdd/edimar/Desktop/doutorado/doutorado04/bases/WEIR/finance/moneycentral.msn.com/BRCM.html",Emulex again tells shareholders to reject offer
"/sdd/edimar/Desktop/doutorado/doutorado04/bases/WEIR/finance/moneycentral.msn.com/QSFT.html",Quest Software to buy back shares in Dutch auction
"/sdd/edimar/Desktop/doutorado/doutorado04/bases/WEIR/finance/moneycentral.msn.com/JCI.html",Wisconsin-based company announces $100M SC project
"/sdd/edimar/Desktop/doutorado/doutorado04/bases/WEIR/finance/moneycentral.msn.com/NWL.html",View all NWL news
"/sdd/edimar/Desktop/doutorado/doutorado04/bases/WEIR/finance/moneycentral.msn.com/APD.html",Chemical shares rally after positive economic news
"/sdd/edimar/Desktop/doutorado/doutorado04/bases/WEIR/finance/moneycentral.msn.com/FLEX.html",Flextronics starts tender offer worth up to $200M
"/sdd/edimar/Desktop/doutorado/doutorado04/bases/WEIR/finance/moneycentral.msn.com/KKD.html",Krispy Kreme Doughnuts fiscal 1Q profit declines
"/sdd/edimar/Desktop/doutorado/doutorado04/bases/WEIR/finance/moneycentral.msn.com/SGP.html",Thomas Weisel analyst rates Idenix 'Overweight'
"/sdd/edimar/Desktop/doutorado/doutorado04/bases/WEIR/finance/moneycentral.msn.com/TNB.html",Final Glance: Electrical companies
"/sdd/edimar/Desktop/doutorado/doutorado04/bases/WEIR/finance/moneycentral.msn.com/GR.html",Air France searchers struggle in worsening weather
"/sdd/edimar/Desktop/doutorado/doutorado04/bases/WEIR/finance/moneycentral.msn.com/PTV.html",View all PTV news
"/sdd/edimar/Desktop/doutorado/doutorado04/bases/WEIR/finance/moneycentral.msn.com/ANF.html",Which Consumer Stocks Should You Buy Today?
"/sdd/edimar/Desktop/doutorado/doutorado04/bases/WEIR/finance/moneycentral.msn.com/EIX.html",Edison to decommission coal-fired Nev. power plant
"/sdd/edimar/Desktop/doutorado/doutorado04/bases/WEIR/finance/moneycentral.msn.com/DIS.html",Early Glance: Media companies
"/sdd/edimar/Desktop/doutorado/doutorado04/bases/WEIR/finance/moneycentral.msn.com/HNZ.html",Heinz shuffles senior executives
"/sdd/edimar/Desktop/doutorado/doutorado04/bases/WEIR/finance/moneycentral.msn.com/VZ.html",Midday Glance: Telecom companies
"/sdd/edimar/Desktop/doutorado/doutorado04/bases/WEIR/finance/moneycentral.msn.com/KO.html",Final Glance: Beverages companies
"/sdd/edimar/Desktop/doutorado/doutorado04/bases/WEIR/finance/moneycentral.msn.com/INFY.html",India-based companies get boost in US trading
"/sdd/edimar/Desktop/doutorado/doutorado04/bases/WEIR/finance/moneycentral.msn.com/SPLS.html",Staples sets 8.25-cent quarterly dividend
"/sdd/edimar/Desktop/doutorado/doutorado04/bases/WEIR/finance/moneycentral.msn.com/CELG.html",Final Glance: Biotechnology companies
"/sdd/edimar/Desktop/doutorado/doutorado04/bases/WEIR/finance/moneycentral.msn.com/BP.html",Gas prices rise for 45 straight days
"/sdd/edimar/Desktop/doutorado/doutorado04/bases/WEIR/finance/moneycentral.msn.com/VFC.html",Why China's Stimulus Plan Will Change the World
"/sdd/edimar/Desktop/doutorado/doutorado04/bases/WEIR/finance/moneycentral.msn.com/FPL.html",Otter Tail to build wind farm in North Dakota
"/sdd/edimar/Desktop/doutorado/doutorado04/bases/WEIR/finance/moneycentral.msn.com/HGSI.html","Movers roundup: Ezcorp, Skilled Healthcare"
"/sdd/edimar/Desktop/doutorado/doutorado04/bases/WEIR/finance/moneycentral.msn.com/TXN.html",How the major stock indexes fared on Friday
"/sdd/edimar/Desktop/doutorado/doutorado04/bases/WEIR/finance/moneycentral.msn.com/MHP.html",Ahead of the Bell: Natural gas boost expected
"/sdd/edimar/Desktop/doutorado/doutorado04/bases/WEIR/finance/moneycentral.msn.com/ADM.html",Grants aid repair of damaged Iowa railroad bridges
"/sdd/edimar/Desktop/doutorado/doutorado04/bases/WEIR/finance/moneycentral.msn.com/PMTC.html",View all PMTC news
"/sdd/edimar/Desktop/doutorado/doutorado04/bases/WEIR/finance/moneycentral.msn.com/DRI.html",Sector Snap: Restaurant shares dip on menu bill
"/sdd/edimar/Desktop/doutorado/doutorado04/bases/WEIR/finance/moneycentral.msn.com/VIA.html",The iPhone: App Your Service
"/sdd/edimar/Desktop/doutorado/doutorado04/bases/WEIR/finance/moneycentral.msn.com/PPL.html",View all PPL news
"/sdd/edimar/Desktop/doutorado/doutorado04/bases/WEIR/finance/moneycentral.msn.com/ABT.html",Midday Glance: Medical Devices companies
"/sdd/edimar/Desktop/doutorado/doutorado04/bases/WEIR/finance/moneycentral.msn.com/VMC.html",Market Report -- In Play (VMC)
"/sdd/edimar/Desktop/doutorado/doutorado04/bases/WEIR/finance/moneycentral.msn.com/CPWR.html","Earnings roundup: J.C. Penney, Abercrombie & Fitch"
"/sdd/edimar/Desktop/doutorado/doutorado04/bases/WEIR/finance/moneycentral.msn.com/OI.html",Analyst downgrades specialty packaging sector
"/sdd/edimar/Desktop/doutorado/doutorado04/bases/WEIR/finance/moneycentral.msn.com/BMS.html",Sealed Air to offer $250M in unsecured notes
"/sdd/edimar/Desktop/doutorado/doutorado04/bases/WEIR/finance/moneycentral.msn.com/CRGN.html",Market Report -- In Play (CRGN)
"/sdd/edimar/Desktop/doutorado/doutorado04/bases/WEIR/finance/moneycentral.msn.com/ASH.html",DuPont spent nearly $1.1M to lobby Congress in 1Q
"/sdd/edimar/Desktop/doutorado/doutorado04/bases/WEIR/finance/moneycentral.msn.com/TGT.html",Early Glance: Broadline Retail companies
"/sdd/edimar/Desktop/doutorado/doutorado04/bases/WEIR/finance/moneycentral.msn.com/PGR.html",Market Report -- In Play (PGR)
"/sdd/edimar/Desktop/doutorado/doutorado04/bases/WEIR/finance/moneycentral.msn.com/UNH.html",Midday Glance: Managed Care companies
"/sdd/edimar/Desktop/doutorado/doutorado04/bases/WEIR/finance/moneycentral.msn.com/T.html",Midday Glance: Telecom companies
"/sdd/edimar/Desktop/doutorado/doutorado04/bases/WEIR/finance/moneycentral.msn.com/HD.html",Midday Glance: Specialty Retail companies
"/sdd/edimar/Desktop/doutorado/doutorado04/bases/WEIR/finance/moneycentral.msn.com/SVU.html",Safeway: Colo. workers' contract extended again
"/sdd/edimar/Desktop/doutorado/doutorado04/bases/WEIR/finance/moneycentral.msn.com/SWY.html","Premarket roundup: Procter & Gamble, Safeway"
"/sdd/edimar/Desktop/doutorado/doutorado04/bases/WEIR/finance/moneycentral.msn.com/CMS.html",Market Report -- In Play (CMS)
"/sdd/edimar/Desktop/doutorado/doutorado04/bases/WEIR/finance/moneycentral.msn.com/PH.html",View all PH news
"/sdd/edimar/Desktop/doutorado/doutorado04/bases/WEIR/finance/moneycentral.msn.com/AFFX.html",4-Star Stocks Poised to Pop: Illumina
"/sdd/edimar/Desktop/doutorado/doutorado04/bases/WEIR/finance/moneycentral.msn.com/MXIM.html",View all MXIM news
"/sdd/edimar/Desktop/doutorado/doutorado04/bases/WEIR/finance/moneycentral.msn.com/GCI.html",U.S. job-seekers try new tricks to get employers' eye
"/sdd/edimar/Desktop/doutorado/doutorado04/bases/WEIR/finance/moneycentral.msn.com/AEP.html",Va. SCC sets 2 hearings on high voltage power line
"/sdd/edimar/Desktop/doutorado/doutorado04/bases/WEIR/finance/moneycentral.msn.com/CCK.html",View all CCK news
"/sdd/edimar/Desktop/doutorado/doutorado04/bases/WEIR/finance/moneycentral.msn.com/RDC.html",View all RDC news
"/sdd/edimar/Desktop/doutorado/doutorado04/bases/WEIR/finance/moneycentral.msn.com/PKI.html",Early Glance: Health Care Equipment companies
"/sdd/edimar/Desktop/doutorado/doutorado04/bases/WEIR/finance/moneycentral.msn.com/MBI.html",Final Glance: Insurers companies
"/sdd/edimar/Desktop/doutorado/doutorado04/bases/WEIR/finance/moneycentral.msn.com/CMA.html",View all CMA news
"/sdd/edimar/Desktop/doutorado/doutorado04/bases/WEIR/finance/moneycentral.msn.com/BBI.html","Blockbuster to pay $300,000 in dispute over prices"
