URL,EXTRACTED VALUE
"/sdd/edimar/Desktop/doutorado/doutorado04/bases/WEIR/finance/moneycentral.msn.com/ECL.html",View all ECL news
"/sdd/edimar/Desktop/doutorado/doutorado04/bases/WEIR/finance/moneycentral.msn.com/BAC.html",Final Glance: Finance companies
"/sdd/edimar/Desktop/doutorado/doutorado04/bases/WEIR/finance/moneycentral.msn.com/EBAY.html",Final Glance: Internet companies
"/sdd/edimar/Desktop/doutorado/doutorado04/bases/WEIR/finance/moneycentral.msn.com/BDX.html",Final Glance: Health Care Equipment companies
"/sdd/edimar/Desktop/doutorado/doutorado04/bases/WEIR/finance/moneycentral.msn.com/GLW.html",Stocks With Room to Run
"/sdd/edimar/Desktop/doutorado/doutorado04/bases/WEIR/finance/moneycentral.msn.com/DLTR.html",Dollar General profit soars as shoppers seek value
"/sdd/edimar/Desktop/doutorado/doutorado04/bases/WEIR/finance/moneycentral.msn.com/ZQK.html",Quiksilver shares fall 18 pct on near-term worries
"/sdd/edimar/Desktop/doutorado/doutorado04/bases/WEIR/finance/moneycentral.msn.com/DDS.html","Same-store sales results for May, by sector"
"/sdd/edimar/Desktop/doutorado/doutorado04/bases/WEIR/finance/moneycentral.msn.com/HBAN.html",Huntington Bancshares prices stock offer
"/sdd/edimar/Desktop/doutorado/doutorado04/bases/WEIR/finance/moneycentral.msn.com/UN.html",View all UN news
"/sdd/edimar/Desktop/doutorado/doutorado04/bases/WEIR/finance/moneycentral.msn.com/SYY.html",What Will You Regret Not Buying in 20 Years?
"/sdd/edimar/Desktop/doutorado/doutorado04/bases/WEIR/finance/moneycentral.msn.com/TMO.html",Early Glance: Health Care Equipment companies
"/sdd/edimar/Desktop/doutorado/doutorado04/bases/WEIR/finance/moneycentral.msn.com/FDX.html",FedEx readies campaign against UPS over labor bill
"/sdd/edimar/Desktop/doutorado/doutorado04/bases/WEIR/finance/moneycentral.msn.com/MDT.html",Midday Glance: Medical Devices companies
"/sdd/edimar/Desktop/doutorado/doutorado04/bases/WEIR/finance/moneycentral.msn.com/BHI.html","Premarket roundup: Lockheed Martin, banks"
"/sdd/edimar/Desktop/doutorado/doutorado04/bases/WEIR/finance/moneycentral.msn.com/BLL.html",View all BLL news
"/sdd/edimar/Desktop/doutorado/doutorado04/bases/WEIR/finance/moneycentral.msn.com/XOM.html",S&P cuts rating on Petroleos de Venezuela to 'B+'
"/sdd/edimar/Desktop/doutorado/doutorado04/bases/WEIR/finance/moneycentral.msn.com/LNC.html",Prudential Financial raises $2.4B from offerings
"/sdd/edimar/Desktop/doutorado/doutorado04/bases/WEIR/finance/moneycentral.msn.com/CHINA.html",CDC shares jump on video game revenue
"/sdd/edimar/Desktop/doutorado/doutorado04/bases/WEIR/finance/moneycentral.msn.com/YHOO.html",Profits Stand Up JDate
"/sdd/edimar/Desktop/doutorado/doutorado04/bases/WEIR/finance/moneycentral.msn.com/ODP.html","Analyst lifts Office Depot's rating, price target"
"/sdd/edimar/Desktop/doutorado/doutorado04/bases/WEIR/finance/moneycentral.msn.com/DELL.html",Midday Glance: Computer companies
"/sdd/edimar/Desktop/doutorado/doutorado04/bases/WEIR/finance/moneycentral.msn.com/MYGN.html",View all MYGN news
"/sdd/edimar/Desktop/doutorado/doutorado04/bases/WEIR/finance/moneycentral.msn.com/ABX.html",Ahead of the Bell: Barrick raised to 'Outperform'
"/sdd/edimar/Desktop/doutorado/doutorado04/bases/WEIR/finance/moneycentral.msn.com/FMC.html","DuPont CEO touts innovation, stresses cost control"
"/sdd/edimar/Desktop/doutorado/doutorado04/bases/WEIR/finance/moneycentral.msn.com/STT.html",BlackRock shares fall after deal with Barclays
"/sdd/edimar/Desktop/doutorado/doutorado04/bases/WEIR/finance/moneycentral.msn.com/CB.html",Fitch: P&C insurance market remains challenged
"/sdd/edimar/Desktop/doutorado/doutorado04/bases/WEIR/finance/moneycentral.msn.com/FCX.html",The Bullish Signal You've Been Waiting For
"/sdd/edimar/Desktop/doutorado/doutorado04/bases/WEIR/finance/moneycentral.msn.com/WPI.html",View all WPI news
"/sdd/edimar/Desktop/doutorado/doutorado04/bases/WEIR/finance/moneycentral.msn.com/CSCO.html",Trading Lessons: Learn to Doubt Yourself
"/sdd/edimar/Desktop/doutorado/doutorado04/bases/WEIR/finance/moneycentral.msn.com/NYT.html",Early Glance: Media companies
"/sdd/edimar/Desktop/doutorado/doutorado04/bases/WEIR/finance/moneycentral.msn.com/KEY.html","Premarket roundup: Palm, Sallie Mae"
"/sdd/edimar/Desktop/doutorado/doutorado04/bases/WEIR/finance/moneycentral.msn.com/STJ.html",Midday Glance: Medical Devices companies
"/sdd/edimar/Desktop/doutorado/doutorado04/bases/WEIR/finance/moneycentral.msn.com/MIL.html",Early Glance: Health Care Equipment companies
"/sdd/edimar/Desktop/doutorado/doutorado04/bases/WEIR/finance/moneycentral.msn.com/EC.html",View all EC news
"/sdd/edimar/Desktop/doutorado/doutorado04/bases/WEIR/finance/moneycentral.msn.com/BRCD.html","Movers roundup: Brocade, Cardinal Health"
"/sdd/edimar/Desktop/doutorado/doutorado04/bases/WEIR/finance/moneycentral.msn.com/AFL.html",View all AFL news
"/sdd/edimar/Desktop/doutorado/doutorado04/bases/WEIR/finance/moneycentral.msn.com/CVG.html",View all CVG news
"/sdd/edimar/Desktop/doutorado/doutorado04/bases/WEIR/finance/moneycentral.msn.com/IBM.html",Midday Glance: Computer companies
"/sdd/edimar/Desktop/doutorado/doutorado04/bases/WEIR/finance/moneycentral.msn.com/BMY.html",Key health care senators have industry ties
"/sdd/edimar/Desktop/doutorado/doutorado04/bases/WEIR/finance/moneycentral.msn.com/WY.html",Why You Shouldn't Follow Warren Buffett
"/sdd/edimar/Desktop/doutorado/doutorado04/bases/WEIR/finance/moneycentral.msn.com/KLAC.html",View all KLAC news
"/sdd/edimar/Desktop/doutorado/doutorado04/bases/WEIR/finance/moneycentral.msn.com/JBL.html",Market Report -- Story Stocks (JBL)
"/sdd/edimar/Desktop/doutorado/doutorado04/bases/WEIR/finance/moneycentral.msn.com/AET.html",Midday Glance: Managed Care companies
"/sdd/edimar/Desktop/doutorado/doutorado04/bases/WEIR/finance/moneycentral.msn.com/PEP.html",Early Glance: Beverages companies
"/sdd/edimar/Desktop/doutorado/doutorado04/bases/WEIR/finance/moneycentral.msn.com/MMC.html",View all MMC news
"/sdd/edimar/Desktop/doutorado/doutorado04/bases/WEIR/finance/moneycentral.msn.com/IPG.html",Market Report -- In Play (IPG)
"/sdd/edimar/Desktop/doutorado/doutorado04/bases/WEIR/finance/moneycentral.msn.com/CVX.html",S&P cuts rating on Petroleos de Venezuela to 'B+'
"/sdd/edimar/Desktop/doutorado/doutorado04/bases/WEIR/finance/moneycentral.msn.com/INTC.html",You Can Make Money in Any Market
"/sdd/edimar/Desktop/doutorado/doutorado04/bases/WEIR/finance/moneycentral.msn.com/CAG.html",Federal agents begin assessing NC explosion site
"/sdd/edimar/Desktop/doutorado/doutorado04/bases/WEIR/finance/moneycentral.msn.com/RSH.html",View all RSH news
"/sdd/edimar/Desktop/doutorado/doutorado04/bases/WEIR/finance/moneycentral.msn.com/CTX.html",Midday Glance: Homebuilders companies
"/sdd/edimar/Desktop/doutorado/doutorado04/bases/WEIR/finance/moneycentral.msn.com/ETR.html","S&P raises outlook on Entergy, citing spinoff"
"/sdd/edimar/Desktop/doutorado/doutorado04/bases/WEIR/finance/moneycentral.msn.com/ATI.html",Sector Snap: Titanium makers fall on airline ills
"/sdd/edimar/Desktop/doutorado/doutorado04/bases/WEIR/finance/moneycentral.msn.com/AA.html",You Can Make Money in Any Market
"/sdd/edimar/Desktop/doutorado/doutorado04/bases/WEIR/finance/moneycentral.msn.com/CL.html",You Won't Retire When You Think You Will
"/sdd/edimar/Desktop/doutorado/doutorado04/bases/WEIR/finance/moneycentral.msn.com/GIS.html",4-Star Stocks Poised to Pop: Kellogg
"/sdd/edimar/Desktop/doutorado/doutorado04/bases/WEIR/finance/moneycentral.msn.com/CAT.html",Final Glance: Machinery companies
"/sdd/edimar/Desktop/doutorado/doutorado04/bases/WEIR/finance/moneycentral.msn.com/AVA.html",Former Montana governor joins Avista board
"/sdd/edimar/Desktop/doutorado/doutorado04/bases/WEIR/finance/moneycentral.msn.com/GOOG.html",MV Weather Report: Tech Sector Freezes Broader Market?
"/sdd/edimar/Desktop/doutorado/doutorado04/bases/WEIR/finance/moneycentral.msn.com/GES.html",Market Report -- In Play (GES)
"/sdd/edimar/Desktop/doutorado/doutorado04/bases/WEIR/finance/moneycentral.msn.com/BNI.html",Midday Glance: Railroads companies
"/sdd/edimar/Desktop/doutorado/doutorado04/bases/WEIR/finance/moneycentral.msn.com/CEG.html",Berkshire sells all its Constellation shares
"/sdd/edimar/Desktop/doutorado/doutorado04/bases/WEIR/finance/moneycentral.msn.com/MMM.html",House panel divided on new financial rules
"/sdd/edimar/Desktop/doutorado/doutorado04/bases/WEIR/finance/moneycentral.msn.com/USB.html",Sources: Banks will start repaying TARP next week
"/sdd/edimar/Desktop/doutorado/doutorado04/bases/WEIR/finance/moneycentral.msn.com/WHR.html",Final Glance: Durable Goods companies
"/sdd/edimar/Desktop/doutorado/doutorado04/bases/WEIR/finance/moneycentral.msn.com/NUE.html",Nucor sets 35-cent quarterly dividend
"/sdd/edimar/Desktop/doutorado/doutorado04/bases/WEIR/finance/moneycentral.msn.com/ITW.html","Premarket roundup: Abercrombie & Fitch, Yahoo"
"/sdd/edimar/Desktop/doutorado/doutorado04/bases/WEIR/finance/moneycentral.msn.com/FITB.html",Stress-tested banks raise $75.2 billion in capital
"/sdd/edimar/Desktop/doutorado/doutorado04/bases/WEIR/finance/moneycentral.msn.com/BCR.html",Final Glance: Medical Devices companies
"/sdd/edimar/Desktop/doutorado/doutorado04/bases/WEIR/finance/moneycentral.msn.com/RIMM.html",MV Weather Report: Tech Sector Freezes Broader Market?
"/sdd/edimar/Desktop/doutorado/doutorado04/bases/WEIR/finance/moneycentral.msn.com/SLM.html",Ahead of the Bell: Student lender Sallie Mae
"/sdd/edimar/Desktop/doutorado/doutorado04/bases/WEIR/finance/moneycentral.msn.com/SNA.html",Early Glance: Durable Goods companies
"/sdd/edimar/Desktop/doutorado/doutorado04/bases/WEIR/finance/moneycentral.msn.com/CSX.html",Midday Glance: Railroads companies
"/sdd/edimar/Desktop/doutorado/doutorado04/bases/WEIR/finance/moneycentral.msn.com/CHL.html",This Stock Has Tremendous Upside
"/sdd/edimar/Desktop/doutorado/doutorado04/bases/WEIR/finance/moneycentral.msn.com/ARW.html",Arrow Electronics falls after 2Q guidance narrowed
"/sdd/edimar/Desktop/doutorado/doutorado04/bases/WEIR/finance/moneycentral.msn.com/UNM.html",View all UNM news
"/sdd/edimar/Desktop/doutorado/doutorado04/bases/WEIR/finance/moneycentral.msn.com/BC.html",View all BC news
"/sdd/edimar/Desktop/doutorado/doutorado04/bases/WEIR/finance/moneycentral.msn.com/EK.html",Why Microsoft Will Rise Again
"/sdd/edimar/Desktop/doutorado/doutorado04/bases/WEIR/finance/moneycentral.msn.com/DNA.html",View all DNA news
"/sdd/edimar/Desktop/doutorado/doutorado04/bases/WEIR/finance/moneycentral.msn.com/TIN.html",View all TIN news
"/sdd/edimar/Desktop/doutorado/doutorado04/bases/WEIR/finance/moneycentral.msn.com/PFE.html",Final Glance: Pharmaceuticals companies
"/sdd/edimar/Desktop/doutorado/doutorado04/bases/WEIR/finance/moneycentral.msn.com/TJX.html",Midday Glance: Specialty Retail companies
"/sdd/edimar/Desktop/doutorado/doutorado04/bases/WEIR/finance/moneycentral.msn.com/APC.html",Andarko Petroleum sets $900M senior notes pricing
"/sdd/edimar/Desktop/doutorado/doutorado04/bases/WEIR/finance/moneycentral.msn.com/JNPR.html","Movers roundup: Juniper Networks, Cardinal Health"
"/sdd/edimar/Desktop/doutorado/doutorado04/bases/WEIR/finance/moneycentral.msn.com/BK.html","BlackRock to buy BGI, becomes top asset manager"
"/sdd/edimar/Desktop/doutorado/doutorado04/bases/WEIR/finance/moneycentral.msn.com/MU.html","Rambus settles EU antitrust probe, avoids fines"
"/sdd/edimar/Desktop/doutorado/doutorado04/bases/WEIR/finance/moneycentral.msn.com/GWW.html",Grainger May sales down 10 percent
"/sdd/edimar/Desktop/doutorado/doutorado04/bases/WEIR/finance/moneycentral.msn.com/KYO.html",View all KYO news
"/sdd/edimar/Desktop/doutorado/doutorado04/bases/WEIR/finance/moneycentral.msn.com/EMC.html",Data Domain to comment on EMC bid by June 16
"/sdd/edimar/Desktop/doutorado/doutorado04/bases/WEIR/finance/moneycentral.msn.com/NOK.html",Is It Time to Sell?
"/sdd/edimar/Desktop/doutorado/doutorado04/bases/WEIR/finance/moneycentral.msn.com/CTL.html",CenturyTel to switch to CenturyLink name
"/sdd/edimar/Desktop/doutorado/doutorado04/bases/WEIR/finance/moneycentral.msn.com/K.html",Companies You Should Buy Right Now
"/sdd/edimar/Desktop/doutorado/doutorado04/bases/WEIR/finance/moneycentral.msn.com/PHG.html",Kindle display maker E Ink to be bought for $215M
"/sdd/edimar/Desktop/doutorado/doutorado04/bases/WEIR/finance/moneycentral.msn.com/JNJ.html",Final Glance: Pharmaceuticals companies
"/sdd/edimar/Desktop/doutorado/doutorado04/bases/WEIR/finance/moneycentral.msn.com/NOC.html",Final Glance: Aerospace companies
"/sdd/edimar/Desktop/doutorado/doutorado04/bases/WEIR/finance/moneycentral.msn.com/CTB.html",View all CTB news
"/sdd/edimar/Desktop/doutorado/doutorado04/bases/WEIR/finance/moneycentral.msn.com/RIG.html",5-Star Stocks Poised to Pop: Ensco International
"/sdd/edimar/Desktop/doutorado/doutorado04/bases/WEIR/finance/moneycentral.msn.com/CBE.html",View all CBE news
"/sdd/edimar/Desktop/doutorado/doutorado04/bases/WEIR/finance/moneycentral.msn.com/UPS.html",Make Millions From Thousands
"/sdd/edimar/Desktop/doutorado/doutorado04/bases/WEIR/finance/moneycentral.msn.com/XLNX.html",Cisco to record $130 million tax-related charge
"/sdd/edimar/Desktop/doutorado/doutorado04/bases/WEIR/finance/moneycentral.msn.com/MSFT.html",UK's Cambridge awards Bill Gates honorary degree
"/sdd/edimar/Desktop/doutorado/doutorado04/bases/WEIR/finance/moneycentral.msn.com/LXK.html",Midday Glance: Computer companies
"/sdd/edimar/Desktop/doutorado/doutorado04/bases/WEIR/finance/moneycentral.msn.com/PBY.html",Icahn company setting up corporate residence in ND
"/sdd/edimar/Desktop/doutorado/doutorado04/bases/WEIR/finance/moneycentral.msn.com/VRSN.html",VeriSign sells security services unit
"/sdd/edimar/Desktop/doutorado/doutorado04/bases/WEIR/finance/moneycentral.msn.com/DAL.html",Air France searchers struggle in worsening weather
"/sdd/edimar/Desktop/doutorado/doutorado04/bases/WEIR/finance/moneycentral.msn.com/CVS.html",Final Glance: Drugstore companies
"/sdd/edimar/Desktop/doutorado/doutorado04/bases/WEIR/finance/moneycentral.msn.com/BBT.html",Sources: Banks will start repaying US bailouts
"/sdd/edimar/Desktop/doutorado/doutorado04/bases/WEIR/finance/moneycentral.msn.com/INCY.html","Movers roundup: Incyte, Marvell Technology"
"/sdd/edimar/Desktop/doutorado/doutorado04/bases/WEIR/finance/moneycentral.msn.com/SEE.html",Sealed Air to offer $250M in unsecured notes
"/sdd/edimar/Desktop/doutorado/doutorado04/bases/WEIR/finance/moneycentral.msn.com/NSM.html",Market Report -- In Play (NSM)
"/sdd/edimar/Desktop/doutorado/doutorado04/bases/WEIR/finance/moneycentral.msn.com/DOW.html",Chemical trade group spent $970K to lobby in 1Q
"/sdd/edimar/Desktop/doutorado/doutorado04/bases/WEIR/finance/moneycentral.msn.com/C.html",Summers says financial rescues were 'necessity'
"/sdd/edimar/Desktop/doutorado/doutorado04/bases/WEIR/finance/moneycentral.msn.com/ETN.html","Premarket roundup: Costco, Hewlett-Packard"
"/sdd/edimar/Desktop/doutorado/doutorado04/bases/WEIR/finance/moneycentral.msn.com/AAPL.html",MV Weather Report: Tech Sector Freezes Broader Market?
"/sdd/edimar/Desktop/doutorado/doutorado04/bases/WEIR/finance/moneycentral.msn.com/DE.html",Early Glance: Machinery companies
"/sdd/edimar/Desktop/doutorado/doutorado04/bases/WEIR/finance/moneycentral.msn.com/STI.html",Sector Snap: Banks await gov't OK to repay TARP
"/sdd/edimar/Desktop/doutorado/doutorado04/bases/WEIR/finance/moneycentral.msn.com/ITT.html",Kaman appoints former ITT CFO to board
"/sdd/edimar/Desktop/doutorado/doutorado04/bases/WEIR/finance/moneycentral.msn.com/RTN.html",Early Glance: Aerospace companies
"/sdd/edimar/Desktop/doutorado/doutorado04/bases/WEIR/finance/moneycentral.msn.com/REGN.html",Market Report -- In Play (REGN)
"/sdd/edimar/Desktop/doutorado/doutorado04/bases/WEIR/finance/moneycentral.msn.com/ADI.html",Ahead of the Bell: ADI shares jump
"/sdd/edimar/Desktop/doutorado/doutorado04/bases/WEIR/finance/moneycentral.msn.com/CLX.html",Market Report -- In Play (CLX)
"/sdd/edimar/Desktop/doutorado/doutorado04/bases/WEIR/finance/moneycentral.msn.com/EFX.html",View all EFX news
"/sdd/edimar/Desktop/doutorado/doutorado04/bases/WEIR/finance/moneycentral.msn.com/SRE.html",Sempra Energy sets 39 cent dividend
"/sdd/edimar/Desktop/doutorado/doutorado04/bases/WEIR/finance/moneycentral.msn.com/ALTR.html",Yahoo hires CFO from Altera
"/sdd/edimar/Desktop/doutorado/doutorado04/bases/WEIR/finance/moneycentral.msn.com/GPS.html",Midday Glance: Specialty Retail companies
"/sdd/edimar/Desktop/doutorado/doutorado04/bases/WEIR/finance/moneycentral.msn.com/WEN.html",Sector Snap: Restaurant shares dip on menu bill
"/sdd/edimar/Desktop/doutorado/doutorado04/bases/WEIR/finance/moneycentral.msn.com/FRE.html",Keepin' It Real Estate: Where Have All the Houses Gone?
"/sdd/edimar/Desktop/doutorado/doutorado04/bases/WEIR/finance/moneycentral.msn.com/SNV.html",Synovus president resigns; CEO to assume role
"/sdd/edimar/Desktop/doutorado/doutorado04/bases/WEIR/finance/moneycentral.msn.com/LOW.html",Midday Glance: Specialty Retail companies
"/sdd/edimar/Desktop/doutorado/doutorado04/bases/WEIR/finance/moneycentral.msn.com/MO.html",Fitch: FDA oversight of tobacco helps bigger cos.
"/sdd/edimar/Desktop/doutorado/doutorado04/bases/WEIR/finance/moneycentral.msn.com/JWN.html",Department chain sales results for May
"/sdd/edimar/Desktop/doutorado/doutorado04/bases/WEIR/finance/moneycentral.msn.com/MDR.html",Ahead of the Bell: Engineering and Construction
"/sdd/edimar/Desktop/doutorado/doutorado04/bases/WEIR/finance/moneycentral.msn.com/NVDA.html",Market Report -- In Play (NVDA)
"/sdd/edimar/Desktop/doutorado/doutorado04/bases/WEIR/finance/moneycentral.msn.com/COST.html",Early Glance: Broadline Retail companies
"/sdd/edimar/Desktop/doutorado/doutorado04/bases/WEIR/finance/moneycentral.msn.com/BSX.html",Midday Glance: Medical Devices companies
"/sdd/edimar/Desktop/doutorado/doutorado04/bases/WEIR/finance/moneycentral.msn.com/XRX.html",Why You Shouldn't Follow Warren Buffett
"/sdd/edimar/Desktop/doutorado/doutorado04/bases/WEIR/finance/moneycentral.msn.com/PBG.html",Market Report -- Story Stocks (PBG)
"/sdd/edimar/Desktop/doutorado/doutorado04/bases/WEIR/finance/moneycentral.msn.com/PCAR.html",Miss. governor meets with Chinese delegation
"/sdd/edimar/Desktop/doutorado/doutorado04/bases/WEIR/finance/moneycentral.msn.com/IR.html",Quanta to replace Ingersoll-Rand in S&P 500
"/sdd/edimar/Desktop/doutorado/doutorado04/bases/WEIR/finance/moneycentral.msn.com/KSWS.html",View all KSWS news
"/sdd/edimar/Desktop/doutorado/doutorado04/bases/WEIR/finance/moneycentral.msn.com/AMZN.html",Final Glance: Internet companies
"/sdd/edimar/Desktop/doutorado/doutorado04/bases/WEIR/finance/moneycentral.msn.com/KMB.html",Mylan names former Dr Pepper exec Varney as CFO
"/sdd/edimar/Desktop/doutorado/doutorado04/bases/WEIR/finance/moneycentral.msn.com/SLB.html",Don't Buy Into This Energy Bull
"/sdd/edimar/Desktop/doutorado/doutorado04/bases/WEIR/finance/moneycentral.msn.com/AOC.html",Manchester United signs Aon as shirt sponsor
"/sdd/edimar/Desktop/doutorado/doutorado04/bases/WEIR/finance/moneycentral.msn.com/APA.html",Why You Shouldn't Follow Warren Buffett
"/sdd/edimar/Desktop/doutorado/doutorado04/bases/WEIR/finance/moneycentral.msn.com/MAT.html",Travel habits prompt conflict of interest concerns
"/sdd/edimar/Desktop/doutorado/doutorado04/bases/WEIR/finance/moneycentral.msn.com/FE.html",Analyst applauds FirstEnergy profit outlook
"/sdd/edimar/Desktop/doutorado/doutorado04/bases/WEIR/finance/moneycentral.msn.com/PPG.html","PPG Industries spent $278,784 to lobby gov't in 1Q"
"/sdd/edimar/Desktop/doutorado/doutorado04/bases/WEIR/finance/moneycentral.msn.com/AVP.html",Caris downgrades Avon on service disruptions
"/sdd/edimar/Desktop/doutorado/doutorado04/bases/WEIR/finance/moneycentral.msn.com/PNC.html","Premarket roundup: Palm, Sallie Mae"
"/sdd/edimar/Desktop/doutorado/doutorado04/bases/WEIR/finance/moneycentral.msn.com/GAP.html",View all GAP news
"/sdd/edimar/Desktop/doutorado/doutorado04/bases/WEIR/finance/moneycentral.msn.com/KBH.html",Market Report -- Story Stocks (KBH)
"/sdd/edimar/Desktop/doutorado/doutorado04/bases/WEIR/finance/moneycentral.msn.com/MEDX.html",Medarex's arthritis drug passes mid-stage trial
"/sdd/edimar/Desktop/doutorado/doutorado04/bases/WEIR/finance/moneycentral.msn.com/LMT.html",Buffett's Biggest Mistake
"/sdd/edimar/Desktop/doutorado/doutorado04/bases/WEIR/finance/moneycentral.msn.com/TXT.html","Cessna Aircraft plans 1,300 more layoffs"
"/sdd/edimar/Desktop/doutorado/doutorado04/bases/WEIR/finance/moneycentral.msn.com/IP.html",International Paper receives bond tender offers
"/sdd/edimar/Desktop/doutorado/doutorado04/bases/WEIR/finance/moneycentral.msn.com/HIG.html",Market Report -- In Play (HIG)
"/sdd/edimar/Desktop/doutorado/doutorado04/bases/WEIR/finance/moneycentral.msn.com/DISH.html",Market Report -- In Play (DISH)
"/sdd/edimar/Desktop/doutorado/doutorado04/bases/WEIR/finance/moneycentral.msn.com/AZO.html",Midday Glance: Specialty Retail companies
"/sdd/edimar/Desktop/doutorado/doutorado04/bases/WEIR/finance/moneycentral.msn.com/UTX.html",Kaman appoints former ITT CFO to board
"/sdd/edimar/Desktop/doutorado/doutorado04/bases/WEIR/finance/moneycentral.msn.com/LUV.html",Sector Snap: Airline shares mostly lower
