URL,EXTRACTED VALUE
"/media/Dados/bases/SWDE/book/book-booksamillion/0407.htm",", December 2005, Published by Echo Library"
"/media/Dados/bases/SWDE/book/book-booksamillion/0541.htm",for
"/media/Dados/bases/SWDE/book/book-booksamillion/0289.htm",", January 2008, Published by Tutis Digital Pub"
"/media/Dados/bases/SWDE/book/book-booksamillion/0769.htm",", December 1999, Published by Trident Reference Pub"
"/media/Dados/bases/SWDE/book/book-booksamillion/1790.htm",for
"/media/Dados/bases/SWDE/book/book-booksamillion/1254.htm",", November 2001, Published by Naxos Audiobooks"
"/media/Dados/bases/SWDE/book/book-booksamillion/0913.htm",", December 1999, Published by Trident Reference Pub"
