URL,EXTRACTED VALUE
"/media/Dados/bases/SWDE/book/book-booksamillion/1027.htm",The darkest hour is before the dawn... headlines a sinful new anthology where the dark and light sides of desire collide...
"/media/Dados/bases/SWDE/book/book-booksamillion/0892.htm",The #1 Internationally Bestselling Series
"/media/Dados/bases/SWDE/book/book-booksamillion/1810.htm",THE STAKES HAVE NEVER BEEN HIGHER.
"/media/Dados/bases/SWDE/book/book-booksamillion/1329.htm","Expect the unexpected! Kane delivers dark, sexy urban fantasy at its finest in this second installment of the Downside Ghosts series."
"/media/Dados/bases/SWDE/book/book-booksamillion/1695.htm",He's the bad boy she always wanted.
"/media/Dados/bases/SWDE/book/book-booksamillion/1992.htm",The fate of all Krynn hangs in the balance.
"/media/Dados/bases/SWDE/book/book-booksamillion/0405.htm",- Ferm Michaels is one of the strongest brand names in publishing and has a long winnning streak with over 25 consecutive New York Times bestsellers
"/media/Dados/bases/SWDE/book/book-booksamillion/0479.htm",In a place where ecstasy can cost you your life . . .
"/media/Dados/bases/SWDE/book/book-booksamillion/1131.htm","""Where Yesterday Lives, When Joy Came to Stay,"" and ""On Every Side"" are collected in this edition--three page-turning novels in one volume."
"/media/Dados/bases/SWDE/book/book-booksamillion/1911.htm","First in a stunning new urban fantasy series from an author who aNEVER CEASES TO AMAZE.a (""BOOKLIST,"" STARRED REVIEW)"
"/media/Dados/bases/SWDE/book/book-booksamillion/0483.htm",New in the national bestselling series
"/media/Dados/bases/SWDE/book/book-booksamillion/1255.htm",What you don't know can kill you.
"/media/Dados/bases/SWDE/book/book-booksamillion/1320.htm",SLOCUM's got nothing to lose-except his life...
"/media/Dados/bases/SWDE/book/book-booksamillion/1592.htm",This new anthology includes three paranormal erotic novellas from Aphrodisia's bestselling authors.
"/media/Dados/bases/SWDE/book/book-booksamillion/1965.htm",The FBI believes that the killer plans to murder seven women. Can Paradise help before it's too late?
"/media/Dados/bases/SWDE/book/book-booksamillion/0924.htm","But when Kateas werewolf friend Derek is discovered nearly dead, she must confront her greatest challenge yet."
"/media/Dados/bases/SWDE/book/book-booksamillion/0271.htm",Animator and vampire hunter Anita Blake is about to discover that some secrets are better left buried-and some people better off dead...
"/media/Dados/bases/SWDE/book/book-booksamillion/0387.htm","THE ""New York Times"" Bestseller"
"/media/Dados/bases/SWDE/book/book-booksamillion/0131.htm","New in the series from ""New York Times"" bestselling author of the Sookie Stackhouse novels."
"/media/Dados/bases/SWDE/book/book-booksamillion/1843.htm",COME TO ME
"/media/Dados/bases/SWDE/book/book-booksamillion/1012.htm",THE GUNSMITH is plagued with a royal pain.
"/media/Dados/bases/SWDE/book/book-booksamillion/1063.htm","A sweeping, emotionally riveting first novel--an enthralling family saga of Africa and America, doctors and patients, exile and home."
"/media/Dados/bases/SWDE/book/book-booksamillion/1509.htm",If only Steve were so lucky...
"/media/Dados/bases/SWDE/book/book-booksamillion/0377.htm",Adelia is back in this thrilling fourth installment of the Mistress of the Art of Death series.
"/media/Dados/bases/SWDE/book/book-booksamillion/0936.htm",Heart of darkness...
"/media/Dados/bases/SWDE/book/book-booksamillion/0289.htm",An abridgment of the classic story with all the characters depicted as animals.
"/media/Dados/bases/SWDE/book/book-booksamillion/0668.htm","In the brand-new novel in the ""USA Today"" bestselling series, Jessica Fletcher learns that some songs end on a fatal note."
"/media/Dados/bases/SWDE/book/book-booksamillion/0254.htm","#1 ""New York Times"", bestselling author J. D. Robb takes us to the New York City of 2060, where Lieutenant Eve Dallas faces down a cop killer."
"/media/Dados/bases/SWDE/book/book-booksamillion/0594.htm","""Heart and Soul"" is Maeve Binchy at her storytelling best."
"/media/Dados/bases/SWDE/book/book-booksamillion/0340.htm",Cole and Hitch are back in a new Western classic...
"/media/Dados/bases/SWDE/book/book-booksamillion/1537.htm","Bringing together Michael Connelly's two most popular characters, ""The Brass Verdict""""""""""is sure to be his biggest book yet."
"/media/Dados/bases/SWDE/book/book-booksamillion/0669.htm","A new Joe Pickett novel from the Edgar(r) Award-winning author of ""Blood Trail."""
"/media/Dados/bases/SWDE/book/book-booksamillion/1368.htm",THEY'RE LIVING LIFE TO THE EXTREME...AND BURNING UP THE COLD MOUNTAIN NIGHTS
"/media/Dados/bases/SWDE/book/book-booksamillion/0489.htm","Everything changes when BoneMan takes Ryan's estranged daughter, Bethany, as his seventh victim. Ryan goes after BoneMan on his own."
"/media/Dados/bases/SWDE/book/book-booksamillion/0693.htm","First in a new back-to- back series from the ""New York Times"" bestselling author"
"/media/Dados/bases/SWDE/book/book-booksamillion/1523.htm","""A PAGE-TURNER . . . THOROUGHLY FRIGHTENING."""
"/media/Dados/bases/SWDE/book/book-booksamillion/1197.htm",HE'S AN ELITE NAVY SEAL LIVING A RISKY DOUBLE LIFE.
"/media/Dados/bases/SWDE/book/book-booksamillion/0607.htm",SAVING LIVES IS HIS MISSION.
"/media/Dados/bases/SWDE/book/book-booksamillion/1218.htm","Lee Child confirms his early acclaim with this new tale, as swift and stylish as any suspense novel being written today."
"/media/Dados/bases/SWDE/book/book-booksamillion/0448.htm",LONGARM teams up with a lovely loose canon.
"/media/Dados/bases/SWDE/book/book-booksamillion/0257.htm",The thrilling third novel in Shannon K. Butcher's new urban fantasy series...
"/media/Dados/bases/SWDE/book/book-booksamillion/1673.htm","The ""New York Times""a bestselling author and adean of intrigue novelistsa returns with a remarkable novel of espionage and revenge."
"/media/Dados/bases/SWDE/book/book-booksamillion/1100.htm",A missing thumb and dead developers are only the beginning for Sheriff Walt Longmire
"/media/Dados/bases/SWDE/book/book-booksamillion/1326.htm","Join the revolution with ""The New York Times"" best-selling author Richard Baker"
"/media/Dados/bases/SWDE/book/book-booksamillion/1410.htm","The first in a three book series by VC Andrews, DELIA'S CROSSING features a young girl who comes from Mexico to live with a rich aunt in Palm Springs."
"/media/Dados/bases/SWDE/book/book-booksamillion/1977.htm","From the national bestselling authora the new novel set in the adarkly fascinating worlda(""SF Site"") of the Black Jewels."
"/media/Dados/bases/SWDE/book/book-booksamillion/0755.htm","An audacious new historical thriller from the grand master of adventure. Unabridged CDs a 10 CDs, 12 hours"
"/media/Dados/bases/SWDE/book/book-booksamillion/0820.htm","Minion: ""The Special Huntress Edition"""
"/media/Dados/bases/SWDE/book/book-booksamillion/0726.htm","A riveting and frightening tale of false accusation from the author of ""Eye Contact"""
"/media/Dados/bases/SWDE/book/book-booksamillion/1608.htm","Five women, one passion, and the unbreakable bond of friendship"
"/media/Dados/bases/SWDE/book/book-booksamillion/1294.htm","When youare immortal, being a mom wonat kill youa it will only make you stronger"
"/media/Dados/bases/SWDE/book/book-booksamillion/0710.htm","A brand-new page-turning Holly Barker novel from the perennially entertaining ""New York Times""-bestselling author Stuart Woods."
"/media/Dados/bases/SWDE/book/book-booksamillion/0105.htm","Secret, betrayal, and a mysterious family history plague the heroine in the latest novel from ""New York Times""-bestselling author Karen Robards."
"/media/Dados/bases/SWDE/book/book-booksamillion/1089.htm","From the ""New York Times"" bestselling author of ""Guilty"""
"/media/Dados/bases/SWDE/book/book-booksamillion/1696.htm",JUSTINE KNOWS SHE'S GOING TO DIE. ANY SECOND NOW.
"/media/Dados/bases/SWDE/book/book-booksamillion/1473.htm","Summer days are anything but lazy for the Howard sisters. As work, romance, and fun mix, can the warm summer breezes be the winds of change?"
"/media/Dados/bases/SWDE/book/book-booksamillion/0661.htm","A riveting sequel to the ""New York Times"" bestseller ""Rules of Deception"" that confirms Christopher Reich as the master of the espionage thriller."
"/media/Dados/bases/SWDE/book/book-booksamillion/1564.htm",TORN BETWEEN DUTY AND DESIRE
"/media/Dados/bases/SWDE/book/book-booksamillion/1373.htm","Genghis Khan almost conquered the world. Now, one man wants to finish the job-unless Dirk Pitt can stop him."
"/media/Dados/bases/SWDE/book/book-booksamillion/0816.htm","Between semesters, she takes a job as a part-time nanny."
"/media/Dados/bases/SWDE/book/book-booksamillion/0840.htm",2009 Retailer's Choice Award winner
"/media/Dados/bases/SWDE/book/book-booksamillion/0199.htm",Love is hottest in the darkness before dawn.
"/media/Dados/bases/SWDE/book/book-booksamillion/1858.htm",Second in an engaging series about a legendary ranching dynasty in Texas-from an exciting new author
"/media/Dados/bases/SWDE/book/book-booksamillion/0865.htm","Dear Reader,"
"/media/Dados/bases/SWDE/book/book-booksamillion/0811.htm","""Unfolds like a poisonous lotus blossom redolent with luxurious evil."""
"/media/Dados/bases/SWDE/book/book-booksamillion/0497.htm","Returning to the home she fled in disgrace, will Hannah find healing for the wounds of the past?"
"/media/Dados/bases/SWDE/book/book-booksamillion/0566.htm",SOMEONE TO WATCH OVER ME
"/media/Dados/bases/SWDE/book/book-booksamillion/1276.htm","From the ""New York Times"" bestselling author of ""The Last Templar"""
"/media/Dados/bases/SWDE/book/book-booksamillion/0035.htm","The Played For High Stakes--Passion, Honor, And Revenge..."
"/media/Dados/bases/SWDE/book/book-booksamillion/1674.htm",The second book in Anne Rice's hugely ambitious and masterful life of Christ.
"/media/Dados/bases/SWDE/book/book-booksamillion/1855.htm","Conclusion to the trilogy that started with ""How to Knit a Wild Bikini"" and ""Unravel Me."""
"/media/Dados/bases/SWDE/book/book-booksamillion/0192.htm","Bound by blood, addicted to danger, they'll enter the darkest--and most erotic--place of all."
"/media/Dados/bases/SWDE/book/book-booksamillion/0752.htm","For one man, they are the five most terrifying words of all . . ."""
"/media/Dados/bases/SWDE/book/book-booksamillion/1284.htm",- Includes over fifty original recipes
"/media/Dados/bases/SWDE/book/book-booksamillion/0712.htm","""One man. One choice. Someone must die."
"/media/Dados/bases/SWDE/book/book-booksamillion/1863.htm","In his latest innovative novel, the award-winning author evokes the dazzling Tang Dynasty of 8th-century China in a story of honor and power."
"/media/Dados/bases/SWDE/book/book-booksamillion/0740.htm","Dear Reader,"
"/media/Dados/bases/SWDE/book/book-booksamillion/0089.htm","""Steel Magnolias"" meets ""The Help"" in this Southern debut novel sparkling with humor, heart, and feminine wisdom"
"/media/Dados/bases/SWDE/book/book-booksamillion/0697.htm",His heart is broken. His partner is in jail. And someone is trying to kill him.
"/media/Dados/bases/SWDE/book/book-booksamillion/1287.htm",THE SPECIAL OPS HERO FEARED NOTHING--
"/media/Dados/bases/SWDE/book/book-booksamillion/0033.htm","In his first collection of short stories, John Grisham takes us back to Ford County, Mississippi, the setting of his first novel, ""A Time to Kill."""
"/media/Dados/bases/SWDE/book/book-booksamillion/1045.htm",It's a real coup for the West-except for one thing: Kurbsky is still working for the Russians. And his master plan is about to unfold.
"/media/Dados/bases/SWDE/book/book-booksamillion/1282.htm","Dear Reader,"
"/media/Dados/bases/SWDE/book/book-booksamillion/0198.htm","""The Map of All Things"" continues Kevin J Anderson's epic fantasy of sailing ships, crusading armies, sea monsters and enchanted islands."
"/media/Dados/bases/SWDE/book/book-booksamillion/0075.htm","#1 ""New York Times"" bestselling author Nora Roberts invites readers to the wedding event of the year"
"/media/Dados/bases/SWDE/book/book-booksamillion/0117.htm",Separated by time
"/media/Dados/bases/SWDE/book/book-booksamillion/0754.htm",The story of a young heiress's initiation into the dark society of the Chicagoland Vampires continues...
"/media/Dados/bases/SWDE/book/book-booksamillion/0894.htm","Nalini Singh writes aparanormal romance at its besta(""PUBLISHERS WEEKLY"")."
"/media/Dados/bases/SWDE/book/book-booksamillion/1479.htm","A ""New York Times""-bestselling author returns with a tale about a cunning female serial killer who is not the woman she appears to be. Original."
"/media/Dados/bases/SWDE/book/book-booksamillion/0070.htm","""""The ancestors are out there...you have to believe me."""
"/media/Dados/bases/SWDE/book/book-booksamillion/0968.htm",Nora Roberts returns to Chesapeake Bay and her beloved Quinn family for the story of Seth Quinn. The conclusion to the breathtaking saga.
"/media/Dados/bases/SWDE/book/book-booksamillion/1706.htm","Truth has never been more important, nor so difficult to discern."
"/media/Dados/bases/SWDE/book/book-booksamillion/0482.htm",is one of Dickens's most energetic and exciting works.
"/media/Dados/bases/SWDE/book/book-booksamillion/0763.htm","""One of the best long-running SF series in existence"" (""Publishers Weekly"") continues with the second novel in a brand-new ""Foreigner"" sequence."
"/media/Dados/bases/SWDE/book/book-booksamillion/0690.htm","She might even find time to track down her wayward husband, if she feels like it."
"/media/Dados/bases/SWDE/book/book-booksamillion/0624.htm",It is a novel only Anne Rice could write....
"/media/Dados/bases/SWDE/book/book-booksamillion/1327.htm",Vengeance doesn't always turn out the way you planned.
"/media/Dados/bases/SWDE/book/book-booksamillion/0185.htm","The Anita Blake, Vampire Hunter backlist takes flight with a whole new look."
"/media/Dados/bases/SWDE/book/book-booksamillion/1929.htm",The past is never over. It just gets dusty.
"/media/Dados/bases/SWDE/book/book-booksamillion/0619.htm","The latest Tea Shop mystery from the author of ""The Silver Needle Murder"""
"/media/Dados/bases/SWDE/book/book-booksamillion/0453.htm",Now Available in a box set-the first four Dark Tower Books -- with new material from the author
"/media/Dados/bases/SWDE/book/book-booksamillion/1414.htm",A wry and life-affirming novel from the internationally bestselling author
"/media/Dados/bases/SWDE/book/book-booksamillion/0558.htm",Miamor is a skilled contract killer who loses her heart to a ruthless gangster's son--and becomes torn between love and revenge.
"/media/Dados/bases/SWDE/book/book-booksamillion/1147.htm","The second mystery featuring Georgiana Neverall, plumber's apprentice extraordinaire."
"/media/Dados/bases/SWDE/book/book-booksamillion/0897.htm","Double the sales with a sexy new contemporary romance collectionafeaturing a new Winston novella from ""New York Times"" bestselling author Lori Foster."
"/media/Dados/bases/SWDE/book/book-booksamillion/0048.htm","New in the #1 ""New York Times"" bestselling series"
"/media/Dados/bases/SWDE/book/book-booksamillion/1112.htm","Facts collide with fiction in the pulse-pounding sequel to the highly praised ""The Alexander Cipher, "" featuring archaeologist Daniel Knox."
"/media/Dados/bases/SWDE/book/book-booksamillion/0652.htm","Second in the all-new trilogy from the ""New York Times"" bestselling author of ""Gorgeous as Sin"""
"/media/Dados/bases/SWDE/book/book-booksamillion/0854.htm","A spellbinding novel about family loyalty and love pushed to the limits of endurance, No Time to Wave Goodbye is Jacquelyn Mitchard at her best."
"/media/Dados/bases/SWDE/book/book-booksamillion/0210.htm","Unabridged CDs, 10 CDs, 12 hours"
"/media/Dados/bases/SWDE/book/book-booksamillion/1481.htm",MaryJanice Davidson
"/media/Dados/bases/SWDE/book/book-booksamillion/0252.htm","The Anita Blake, Vampire Hunter backlist lights up the night."
"/media/Dados/bases/SWDE/book/book-booksamillion/0247.htm","Key West is a great place to unwind, unless you're Stone Barrington, and you're looking for someone who doesn't want to be found."
"/media/Dados/bases/SWDE/book/book-booksamillion/0618.htm",Home renovation and design tips included
"/media/Dados/bases/SWDE/book/book-booksamillion/0476.htm",trespass 'trespes n: a transgression of law involving one's obligations to God or to one's neighbor; a violation of moral law; an offense; a sin
"/media/Dados/bases/SWDE/book/book-booksamillion/0743.htm","Another cutting-edge thriller set at the intersection of science, religion, and history from the bestselling author of ""The Last Templar"""
"/media/Dados/bases/SWDE/book/book-booksamillion/0542.htm",NATIONAL BESTSELLER
"/media/Dados/bases/SWDE/book/book-booksamillion/1708.htm",A Novel of the Sons of Destiny...
"/media/Dados/bases/SWDE/book/book-booksamillion/0550.htm",Sixth book in the must-read series from a national bestselling afresh new voice in fantasy romance.a( Robin D. Owens)
"/media/Dados/bases/SWDE/book/book-booksamillion/1356.htm",A collection of four best-selling R.A. Salvatore novels available in paperback for the first time.
"/media/Dados/bases/SWDE/book/book-booksamillion/1923.htm",From the author of
"/media/Dados/bases/SWDE/book/book-booksamillion/1086.htm",The author of the super-hot Lord of Satyr series delivers more irresistible heroes in a duo of sizzling new novellas.
"/media/Dados/bases/SWDE/book/book-booksamillion/1769.htm","The Dark Disciple's story, now complete"
"/media/Dados/bases/SWDE/book/book-booksamillion/0093.htm","The brothers are back-the latest installment in J. R. Ward's sizzling #1""New York Times"" bestselling series."
"/media/Dados/bases/SWDE/book/book-booksamillion/0584.htm","Three sisters reveal their most intimate secrets in an erotic romance from ""an undoubted master."""
"/media/Dados/bases/SWDE/book/book-booksamillion/0856.htm","In this latest Orchard mystery, amateur sleuth Meg Corey takes a bite out of crime..."
"/media/Dados/bases/SWDE/book/book-booksamillion/0612.htm",HE'S A NAVY SEAL SUSPECTED OF MURDER.
"/media/Dados/bases/SWDE/book/book-booksamillion/0687.htm","The ""New York Times"" bestselling author of ""Daemons are Forever"" is back..."
"/media/Dados/bases/SWDE/book/book-booksamillion/0050.htm","In the latest novel from #1 ""New York Times""-bestselling author J.D. Robb, it is game over for the criminals pursued by NYPSD Lieutenant Eve Dallas."
"/media/Dados/bases/SWDE/book/book-booksamillion/0073.htm",Kate Daniels cleans up the paranormal problems no one else wants to deal with-especially if they involve Atlanta's shapeshifting community.
"/media/Dados/bases/SWDE/book/book-booksamillion/0449.htm",MONTANA DESTINY
"/media/Dados/bases/SWDE/book/book-booksamillion/1499.htm",The epic poem
"/media/Dados/bases/SWDE/book/book-booksamillion/0651.htm",Jane Yellowrock is back on the prowl against the children of the night...
"/media/Dados/bases/SWDE/book/book-booksamillion/1460.htm",The night sizzles to new heights in these novels of romantic suspense
"/media/Dados/bases/SWDE/book/book-booksamillion/0868.htm","Riane Arvid is a superhuman cop from the future, trapped in the year 2009 by group of murderous fanatics called the Xeran."
"/media/Dados/bases/SWDE/book/book-booksamillion/0011.htm",The only person who can stop a rogue wizard gone mad is another rogue wizard. But what do you do when another rogue wizard can't be found?
"/media/Dados/bases/SWDE/book/book-booksamillion/0765.htm",A RADICAL WAY TO DIE
"/media/Dados/bases/SWDE/book/book-booksamillion/1865.htm",Dear Listener:
"/media/Dados/bases/SWDE/book/book-booksamillion/1363.htm",PREMIUM MASS MARKET EDITION
"/media/Dados/bases/SWDE/book/book-booksamillion/1868.htm","""New York Times""-bestselling author Foster delivers a sparkling contemporary romance specially gift-wrapped for the holidays. Original."
"/media/Dados/bases/SWDE/book/book-booksamillion/0526.htm",The body in the trunk was just the beginning.
"/media/Dados/bases/SWDE/book/book-booksamillion/1325.htm","In this eagerly awaited follow-up to Randy Wayne White's Sanibel Flats, Doc"
"/media/Dados/bases/SWDE/book/book-booksamillion/1945.htm",A fun new mystery series from the author of Gone with the Witch.
"/media/Dados/bases/SWDE/book/book-booksamillion/1452.htm",Talk about a bad-hair day
"/media/Dados/bases/SWDE/book/book-booksamillion/1354.htm","In Stuart Woods's perfect mix of sexy intrigue and swift suspense, Stone Barrington investigates the suicide of a CIA officer-his cousin."
"/media/Dados/bases/SWDE/book/book-booksamillion/0821.htm","Nicolae Carpathia is assassinated, setting the stage for the last half of the Tribulation in the bestselling ""Left Behind"" series."
"/media/Dados/bases/SWDE/book/book-booksamillion/0347.htm",- Available for the first time in paperback.
"/media/Dados/bases/SWDE/book/book-booksamillion/0604.htm","From the acclaimed author of ""Mastering the Marquess"" comes a sexy new Regency romance. Original."
"/media/Dados/bases/SWDE/book/book-booksamillion/1906.htm","Unabridged CDs, 10 CDs, 13 hours"
"/media/Dados/bases/SWDE/book/book-booksamillion/1243.htm","Set includes: Interview with the Vampire, The Vampire Lestat, The Queen of the Damned, and The Tale of the Body Thief."
"/media/Dados/bases/SWDE/book/book-booksamillion/0398.htm","The ""New York Times"" best seller now in mass market paperback"
"/media/Dados/bases/SWDE/book/book-booksamillion/0274.htm",The fourth thrilling adventure in the Destroyermen series.
"/media/Dados/bases/SWDE/book/book-booksamillion/0715.htm","""New York Times"" and ""USA Today"" bestselling author Karen chance has written a paranormalawith bite."
"/media/Dados/bases/SWDE/book/book-booksamillion/0140.htm","Never-before-published-from the ""New York Times"" bestselling author of ""Rewriting Monday"""
"/media/Dados/bases/SWDE/book/book-booksamillion/1307.htm","The propulsive, shockingly plausible sequel to ""New York Times"" bestseller ""Daemon,"" the ""Greatest. Techno-thriller. Period.""*"
"/media/Dados/bases/SWDE/book/book-booksamillion/0823.htm","""Urban erotica has never been hotter """
"/media/Dados/bases/SWDE/book/book-booksamillion/0425.htm",Private Investigator Kinsey Millhone embarks on a terrifying but all-too-real ride that will reveal not everyone is who they say they are.
"/media/Dados/bases/SWDE/book/book-booksamillion/0648.htm","The ""richly detailed, almost indecently thrilling"" (""New York Times"") follow up to ""The Serpent's Tale"""
"/media/Dados/bases/SWDE/book/book-booksamillion/0222.htm",2009 Retailer's Choice Award winner
"/media/Dados/bases/SWDE/book/book-booksamillion/0573.htm",He would sell his warrior soul to possess her. . . .
"/media/Dados/bases/SWDE/book/book-booksamillion/0188.htm",An All-New Drake Sisters Novel
"/media/Dados/bases/SWDE/book/book-booksamillion/0963.htm","Sun Valley sheriff Walt Fleming returns in this high-intensity thriller from ""New York Times""- bestselling author Ridley Pearson."
"/media/Dados/bases/SWDE/book/book-booksamillion/0321.htm","Following the instant #1 New York Times bestseller Stone Cold,"
"/media/Dados/bases/SWDE/book/book-booksamillion/0182.htm","Don't miss the gripping conclusion to Salvatore's ""New York Times"" best-selling Transitions trilogy"
"/media/Dados/bases/SWDE/book/book-booksamillion/0595.htm","Two days later she was dead, the victim of murder."
"/media/Dados/bases/SWDE/book/book-booksamillion/1352.htm",The Basis for a New Showtime(R) Original Series Starring Michael C. Hall
"/media/Dados/bases/SWDE/book/book-booksamillion/0262.htm","A look that kills for the fifth Anita Blake, Vampire Hunter novel."
"/media/Dados/bases/SWDE/book/book-booksamillion/0145.htm","Once again, Hilderbrand masterfully weaves an intense tale of love and loyalty set against the backdrop of endless summer island life."
"/media/Dados/bases/SWDE/book/book-booksamillion/0475.htm",AN ELITE FIGHTING FORCE UNLIKE THE WORLD HAS EVER SEEN . . .
"/media/Dados/bases/SWDE/book/book-booksamillion/0643.htm","CIA agent John Wells returns in a cutting-edge novel of modern suspense from the #1 ""New York Times""-bestselling writer."
"/media/Dados/bases/SWDE/book/book-booksamillion/0304.htm",Seduction that kills. Pleasure to die for.
"/media/Dados/bases/SWDE/book/book-booksamillion/0446.htm",A brand new thriller featuring returning characters Shaw and Katie James from The Whole Truth.
"/media/Dados/bases/SWDE/book/book-booksamillion/0069.htm","From the ""New York Times"" bestselling author-a momentous new novel about a family suddenly thrown together"
"/media/Dados/bases/SWDE/book/book-booksamillion/0700.htm",It's Longarm against the clock...
"/media/Dados/bases/SWDE/book/book-booksamillion/0373.htm","The ""New York Times"" bestselling author of ""Demon Mistress"" returns with a new sensual Otherworld paranormal..."
"/media/Dados/bases/SWDE/book/book-booksamillion/0008.htm",LONGARM is asked to lend a hand.
"/media/Dados/bases/SWDE/book/book-booksamillion/0004.htm","The #1 ""New York Times"" bestselling Sookie Stackhouse series- the basis for HBO(r)'s ""True Blood""-continues"
"/media/Dados/bases/SWDE/book/book-booksamillion/0945.htm","Welcome back to the sleepy little town of Shakespeare, Arkansas, where secrets come to hide."
"/media/Dados/bases/SWDE/book/book-booksamillion/1879.htm",Jack Reacher is back.
"/media/Dados/bases/SWDE/book/book-booksamillion/1180.htm","""New York Times"" bestselling author Sara Paretsky's fourth V.I. Warshawski novel"
"/media/Dados/bases/SWDE/book/book-booksamillion/1024.htm","From the national bestselling author of ""Batter Off Dead,"" the newest Pennsylvania Dutch mystery"
