URL,EXTRACTED VALUE
"/media/Dados/bases/SWDE/book/book-booksamillion/0416.htm","A publishing event- #1 ""New York Times""-bestselling author Terry Goodkind turns in a new direction and delivers a stunningly original thriller."
"/media/Dados/bases/SWDE/book/book-booksamillion/0797.htm","In the north, the new Godking has a plan. If it comes to fruition, no one will have the power to stop him."
"/media/Dados/bases/SWDE/book/book-booksamillion/1651.htm",He's a hotshot firefighter addicted to risk.
"/media/Dados/bases/SWDE/book/book-booksamillion/0926.htm","""New York Times"" Bestseller"
"/media/Dados/bases/SWDE/book/book-booksamillion/1126.htm","""Witty, sophisticated, suspenseful and endless fun...the best first novel I've read this year."" -""Washington Post"""
"/media/Dados/bases/SWDE/book/book-booksamillion/1362.htm","Then he began dreaming of an ethereal beauty, who calls him to return home to a destiny that will take him beyond the realm of anything he imagined."
"/media/Dados/bases/SWDE/book/book-booksamillion/1193.htm","Alternately sad and uproariously funny, ""The Cardinal Virtues"" is about the meaning of religion, the meaning of faith, and the meaning of life."
"/media/Dados/bases/SWDE/book/book-booksamillion/0388.htm",First in the brand-new Southern Beauty Shop mystery series
"/media/Dados/bases/SWDE/book/book-booksamillion/1316.htm","A collection of four"" New York Times"" bestselling novels by R. A. Salvatore."
"/media/Dados/bases/SWDE/book/book-booksamillion/0450.htm","New from the national bestselling author of ""The Trouble with Demons"""
"/media/Dados/bases/SWDE/book/book-booksamillion/0279.htm","Spirited, moving, and highly original, The Imperfectionists will establish Tom Rachman as one of our most perceptive, assured literary talents."
"/media/Dados/bases/SWDE/book/book-booksamillion/1530.htm","Whatever the cost, seven men must die."
"/media/Dados/bases/SWDE/book/book-booksamillion/0451.htm","National bestselling author of ""Mortal Seductions"""
"/media/Dados/bases/SWDE/book/book-booksamillion/1901.htm","""IRRESISTIBLE!"""
"/media/Dados/bases/SWDE/book/book-booksamillion/0390.htm",Danger turns her on.
"/media/Dados/bases/SWDE/book/book-booksamillion/1088.htm","Unabridged CDs a 11 CDs, 12 hours From Americaas #1 bestselling crime writer comes the extraordinary new Kay Scarpetta novel."
