URL,EXTRACTED VALUE
"/sdd/edimar/Desktop/doutorado/doutorado04/bases/WEIR/soccer/www.teamtalk.com/1784_8917.html",Tottenham defender Jonathan Woodgate will be sent to see a specialist after aggravating a back injury against Manchester United on Saturday.
"/sdd/edimar/Desktop/doutorado/doutorado04/bases/WEIR/soccer/www.teamtalk.com/1914_4846.html",Kenny Miller's calf injury may force him to miss a third Rangers match after Walter Smith admitted he is doubtful for Saturday's Hearts clash.
"/sdd/edimar/Desktop/doutorado/doutorado04/bases/WEIR/soccer/www.teamtalk.com/1873_7405.html",Rangers boss Walter Smith expects defenders David Weir and Christian Dailly to sign new deals with the club when they return for training.
"/sdd/edimar/Desktop/doutorado/doutorado04/bases/WEIR/soccer/www.teamtalk.com/1766_156744.html",Arsenal manager Arsene Wenger has challenged Carlos Vela to seize his opportunity to impress in the Carling Cup on Tuesday night.
"/sdd/edimar/Desktop/doutorado/doutorado04/bases/WEIR/soccer/www.teamtalk.com/1806_9105.html","West Ham have hit back at George McCartney's claim they instigated his move to Sunderland, insisting they wanted to keep the full-back."
"/sdd/edimar/Desktop/doutorado/doutorado04/bases/WEIR/soccer/www.teamtalk.com/1778_136763.html",Manchester United winger Nani has begged for forgiveness after getting himself sent off for headbutting West Ham's Lucas Neill on Saturday.
"/sdd/edimar/Desktop/doutorado/doutorado04/bases/WEIR/soccer/www.teamtalk.com/2483_6551.html","Matthew Upson has urged his West Ham team-mates to show their ""resilience and character"" going into the busy Christmas period."
"/sdd/edimar/Desktop/doutorado/doutorado04/bases/WEIR/soccer/www.teamtalk.com/2483_148245.html",Lokomotiv Moscow have claimed that winger Haminu Dramani will not be allowed to join Stoke until the end of the Russian season.
"/sdd/edimar/Desktop/doutorado/doutorado04/bases/WEIR/soccer/www.teamtalk.com/2483_98655.html",Blackburn boss Sam Allardyce has ruled out Roque Santa Cruz joining Manchester City because he can not find a replacement for the striker.
"/sdd/edimar/Desktop/doutorado/doutorado04/bases/WEIR/soccer/www.teamtalk.com/1873_8908.html",Scotland defender David Weir is looking to celebrate his 40th birthday preparing for the 2010 World Cup finals in South Africa.
"/sdd/edimar/Desktop/doutorado/doutorado04/bases/WEIR/soccer/www.teamtalk.com/1789_7158.html",Striker Jay Bothroyd has revealed he is loving life at Cardiff and is determined to bring Premier League football to the club's new stadium.
"/sdd/edimar/Desktop/doutorado/doutorado04/bases/WEIR/soccer/www.teamtalk.com/1806_130961.html","Kenwyne Jones insists Sunderland are not yet involved in a relegation fight - and says they just need to ""maintain our progression""."
"/sdd/edimar/Desktop/doutorado/doutorado04/bases/WEIR/soccer/www.teamtalk.com/2483_92090.html",Owen Hargreaves has gone to see surgeon Dr Richard Steadman in a bid to cure the tendinitis problem that is threatening to wreck his career.
"/sdd/edimar/Desktop/doutorado/doutorado04/bases/WEIR/soccer/www.teamtalk.com/2483_92389.html",Dimitar Berbatov has declared his confidence that he and his fellow strikers can fire Manchester United to the Premier League title this year.
"/sdd/edimar/Desktop/doutorado/doutorado04/bases/WEIR/soccer/www.teamtalk.com/1784_95034.html",Micah Richards and Aaron Lennon have withdrawn from the England Under-21 squad to face Wales in their European Championship play-off.
"/sdd/edimar/Desktop/doutorado/doutorado04/bases/WEIR/soccer/www.teamtalk.com/2483_51689.html","Everton hope Segundo Castillo, Joseph Yobo and Victor Anichebe will be fit for Saturday's Premier League clash against Manchester United."
"/sdd/edimar/Desktop/doutorado/doutorado04/bases/WEIR/soccer/www.teamtalk.com/1767_3633.html",Stiliyan Petrov says his Aston Villa side must play at their best against all sides - not just the top ones - if they are to make the top four.
"/sdd/edimar/Desktop/doutorado/doutorado04/bases/WEIR/soccer/www.teamtalk.com/1863_38903.html",Celtic's Champions League opener against Aalborg cannot come quickly enough for Hoops forward Shaun Maloney.
"/sdd/edimar/Desktop/doutorado/doutorado04/bases/WEIR/soccer/www.teamtalk.com/982_60903.html","Leeds skipper Frazer Richardson has urged his team-mates ""to stand up and be counted"" ahead of ""four massive games"" for the club."
"/sdd/edimar/Desktop/doutorado/doutorado04/bases/WEIR/soccer/www.teamtalk.com/1805_77687.html",Andrew Davies admitted he was sorry to be leaving Southampton after completing his move back to the Premier League with Stoke.
"/sdd/edimar/Desktop/doutorado/doutorado04/bases/WEIR/soccer/www.teamtalk.com/2483_98855.html",Out-of-favour Sunderland duo Pascal Chimbonda and El-Hadji Diouf are in the reserves squad for Wednesday's trip to Sheffield United.
"/sdd/edimar/Desktop/doutorado/doutorado04/bases/WEIR/soccer/www.teamtalk.com/8535_143456.html",Championship side Watford have allowed winger Lionel Ainsworth to rejoin his former League One club Hereford on a month-long loan deal.
"/sdd/edimar/Desktop/doutorado/doutorado04/bases/WEIR/soccer/www.teamtalk.com/2483_8829.html","Manchester United stalwart Ryan Giggs admits his glittering career could come to an end in May, at the age of 35."
"/sdd/edimar/Desktop/doutorado/doutorado04/bases/WEIR/soccer/www.teamtalk.com/1908_9135.html",Liverpool captain Steven Gerrard returned to training with little fanfare on Wednesday as he seeks to turn his attention back to football.
"/sdd/edimar/Desktop/doutorado/doutorado04/bases/WEIR/soccer/www.teamtalk.com/1855_8889.html",Scunthorpe midfielder Grant McCann is on standby for Northern Ireland's World Cup qualifiers against Slovenia and San Marino next month.
"/sdd/edimar/Desktop/doutorado/doutorado04/bases/WEIR/soccer/www.teamtalk.com/1784_96934.html",Tottenham manager Juande Ramos has completed the signing of veteran goalkeeper Cesar Sanchez from Spanish club Real Zaragoza.
"/sdd/edimar/Desktop/doutorado/doutorado04/bases/WEIR/soccer/www.teamtalk.com/2483_7115.html",Summer signing Louis Saha believes Everton are capable of securing a European spot this season after their impressive 3-1 win at West Ham.
"/sdd/edimar/Desktop/doutorado/doutorado04/bases/WEIR/soccer/www.teamtalk.com/2483_9135.html",Liverpool captain Steven Gerrard returned to training with little fanfare on Wednesday as he seeks to turn his attention back to football.
"/sdd/edimar/Desktop/doutorado/doutorado04/bases/WEIR/soccer/www.teamtalk.com/2483_92309.html",Everton manager David Moyes has revealed Lars Jacobsen is in contention to make his Toffees debut against Stoke City on Sunday.
"/sdd/edimar/Desktop/doutorado/doutorado04/bases/WEIR/soccer/www.teamtalk.com/2483_90026.html",Liverpool midfielder Xabi Alonso has insisted that the Reds are enjoying the pressure of the title race as they go head to head with Chelsea.
"/sdd/edimar/Desktop/doutorado/doutorado04/bases/WEIR/soccer/www.teamtalk.com/1857_7265.html",Southend United striker Dougie Freedman is hoping to put a torrid spell on the sidelines with a thigh injury behind him.
"/sdd/edimar/Desktop/doutorado/doutorado04/bases/WEIR/soccer/www.teamtalk.com/1872_77862.html","Motherwell new boy John Sutton has admitted that he was so keen to join the club, he was ""panicking"" the deal would fall through."
"/sdd/edimar/Desktop/doutorado/doutorado04/bases/WEIR/soccer/www.teamtalk.com/2483_73945.html",Sunderland striker El Hadji Diouf has warned Ricky Sbragia he could leave the club this month if he is not given assurances of regular action.
"/sdd/edimar/Desktop/doutorado/doutorado04/bases/WEIR/soccer/www.teamtalk.com/1844_113624.html",On-loan Grimsby defender Rob Atkinson wants to repeat the success of his first loan spell and help the Mariners get their season on track.
"/sdd/edimar/Desktop/doutorado/doutorado04/bases/WEIR/soccer/www.teamtalk.com/1873_3673.html","Walter Smith insists Newcastle have not enquired about Rangers skipper Barry Ferguson, who played in Sunday's 3-0 SPL win at Inverness."
"/sdd/edimar/Desktop/doutorado/doutorado04/bases/WEIR/soccer/www.teamtalk.com/1804_6600.html",Blackpool manager Simon Grayson has backed on-loan midfielder Lee Hendrie to rediscover the spark which earned him full England honours.
"/sdd/edimar/Desktop/doutorado/doutorado04/bases/WEIR/soccer/www.teamtalk.com/1809_96183.html",Wigan defender Emmerson Boyce claims he is close to agreeing a contract extension with the Premier League club.
"/sdd/edimar/Desktop/doutorado/doutorado04/bases/WEIR/soccer/www.teamtalk.com/2483_17403.html",West Ham manager Gianfranco Zola has confirmed that striker Dean Ashton is on target to return to fitness early next month.
"/sdd/edimar/Desktop/doutorado/doutorado04/bases/WEIR/soccer/www.teamtalk.com/1794_6857.html","Ipswich defender David Wright has set his sights on a Scotland call-up and said it ""would be a great honour"" to play for the national side."
"/sdd/edimar/Desktop/doutorado/doutorado04/bases/WEIR/soccer/www.teamtalk.com/1860_138331.html",Yeovil boss Russell Slade will run the rule over a quintet of trialists this week as he bids to bolster his squad before the upcoming season.
"/sdd/edimar/Desktop/doutorado/doutorado04/bases/WEIR/soccer/www.teamtalk.com/1767_7270.html","Martin O'Neill says he ""doesn't know what the future holds"" for Marlon Harewood after the striker was linked with a move away from Aston Villa."
"/sdd/edimar/Desktop/doutorado/doutorado04/bases/WEIR/soccer/www.teamtalk.com/1842_136913.html",Accrington chief executive Robert Heys has confirmed the club are set to renew their interest in former Yeovil midfielder Anthony Barry.
"/sdd/edimar/Desktop/doutorado/doutorado04/bases/WEIR/soccer/www.teamtalk.com/1912_22108.html",Andy Reid believes Premier League strugglers Sunderland must adopt a siege mentality if they are to shake off their shackles.
"/sdd/edimar/Desktop/doutorado/doutorado04/bases/WEIR/soccer/www.teamtalk.com/1813_79162.html","Mansfield defender Alex John-Baptiste has admitted ""it was a big decision"" after handing in his transfer request this week."
"/sdd/edimar/Desktop/doutorado/doutorado04/bases/WEIR/soccer/www.teamtalk.com/1809_6906.html",Michael Brown has rejected rumours linking him with a move away from Wigan and says he is relishing the start of the new season.
"/sdd/edimar/Desktop/doutorado/doutorado04/bases/WEIR/soccer/www.teamtalk.com/2483_6744.html",Combative West Brom defender Paul Robinson has vowed to try and stay out of trouble with Premier League referees this season.
"/sdd/edimar/Desktop/doutorado/doutorado04/bases/WEIR/soccer/www.teamtalk.com/1824_7825.html",Luton Town manager Mick Harford is backing his skipper Kevin Nicholls to make a swift comeback from his hamstring injury.
"/sdd/edimar/Desktop/doutorado/doutorado04/bases/WEIR/soccer/www.teamtalk.com/2483_23088.html",Ipswich manager Jim Magilton has made experienced former Spain international midfielder Ivan Campo available for a loan move.
"/sdd/edimar/Desktop/doutorado/doutorado04/bases/WEIR/soccer/www.teamtalk.com/2483_97732.html",Manchester City have terminated discussions with AC Milan over the proposed world-record £108million transfer of Brazilian playmaker Kaka.
"/sdd/edimar/Desktop/doutorado/doutorado04/bases/WEIR/soccer/www.teamtalk.com/1802_55084.html",Watford have completed the signing of central defender Sam Sodje from Championship rivals Reading on an initial month-long loan deal.
"/sdd/edimar/Desktop/doutorado/doutorado04/bases/WEIR/soccer/www.teamtalk.com/2483_16443.html",Nicolas Anelka has expressed sympathy for Didier Drogba who was given a three-match ban by the FA after admitting a charge of violent conduct.
"/sdd/edimar/Desktop/doutorado/doutorado04/bases/WEIR/soccer/www.teamtalk.com/1812_6924.html",Rob Kozluk has hit out at Tony McMahon after the Sheffield Wednesday right-back's horror tackle in Tuesday night's South Yorkshire derby.
"/sdd/edimar/Desktop/doutorado/doutorado04/bases/WEIR/soccer/www.teamtalk.com/1809_32003.html",John Toshack had to thank his young stars for Wales' World Cup qualifying victory as he continues to struggle with the Jason Koumas puzzle.
"/sdd/edimar/Desktop/doutorado/doutorado04/bases/WEIR/soccer/www.teamtalk.com/1778_8837.html",Manchester United's Paul Scholes has admitted he would rather be back home than halfway around the world competing for the World Club Cup.
"/sdd/edimar/Desktop/doutorado/doutorado04/bases/WEIR/soccer/www.teamtalk.com/2483_8835.html","David Beckham is set to be on the substitutes' bench for AC Milan's Serie A clash with Roma on Sunday, coach Carlo Ancelotti has confirmed."
"/sdd/edimar/Desktop/doutorado/doutorado04/bases/WEIR/soccer/www.teamtalk.com/1782_6529.html",Portsmouth boss Harry Redknapp could see his new-look strikeforce at full strength for their next game against Middlesbrough.
"/sdd/edimar/Desktop/doutorado/doutorado04/bases/WEIR/soccer/www.teamtalk.com/2483_92716.html",Sunderland striker Djibril Cisse has declared that he was unaffected by rumours that manager Roy Keane had walked out on the club last week.
"/sdd/edimar/Desktop/doutorado/doutorado04/bases/WEIR/soccer/www.teamtalk.com/2483_94204.html",West Ham boss Gianfranco Zola is confident he can defy the credit crunch to add Spanish striker Diego Tristan to his Upton Park squad.
"/sdd/edimar/Desktop/doutorado/doutorado04/bases/WEIR/soccer/www.teamtalk.com/1807_10476.html",Watford have allowed defender Leigh Bromby to return to former club Sheffield United on loan until the end of the season.
"/sdd/edimar/Desktop/doutorado/doutorado04/bases/WEIR/soccer/www.teamtalk.com/1863_154563.html",Celtic's Barry Robson backed Artur Boruc after the Hoops keeper came in for some criticism for conceding the goal against Manchester United.
"/sdd/edimar/Desktop/doutorado/doutorado04/bases/WEIR/soccer/www.teamtalk.com/1768_8928.html",West Ham midfielder Lee Bowyer believes the Hammers' leaky defence will continue to cost them unless they can find a solution.
"/sdd/edimar/Desktop/doutorado/doutorado04/bases/WEIR/soccer/www.teamtalk.com/2483_97245.html","Juventus insist they have had no contact from Manchester City over £63million-rated goalkeeper Gianluigi Buffon, according to the Italian club."
"/sdd/edimar/Desktop/doutorado/doutorado04/bases/WEIR/soccer/www.teamtalk.com/2483_75608.html",Blackburn's new midfield general Stephen Warnock is happy to sacrifice any England ambitions for the good of his club-mates.
"/sdd/edimar/Desktop/doutorado/doutorado04/bases/WEIR/soccer/www.teamtalk.com/2483_124034.html","Arsene Wenger has revealed ""congestion"" at the centre of Arsenal's defence prompted his decision to allow Philippe Senderos to join AC Milan."
"/sdd/edimar/Desktop/doutorado/doutorado04/bases/WEIR/soccer/www.teamtalk.com/1873_93509.html",Kirk Broadfoot believes Rangers team-mate Kevin Thomson has the strength of character to return from his latest injury stronger than before.
"/sdd/edimar/Desktop/doutorado/doutorado04/bases/WEIR/soccer/www.teamtalk.com/1843_73752.html","Darlington boss Dave Penney admits he is chasing a number of targets, as Peterborough stall over selling Liam Hatch to the Quakers."
"/sdd/edimar/Desktop/doutorado/doutorado04/bases/WEIR/soccer/www.teamtalk.com/2483_134495.html",Chelsea have reached an agreement with Norwegian club Lyn Oslo in their dispute over the transfer of John Mikel Obi in 2006.
"/sdd/edimar/Desktop/doutorado/doutorado04/bases/WEIR/soccer/www.teamtalk.com/1765_99309.html",Chelsea defender Ricardo Carvalho could be out for a minimum of three weeks after being forced out to limp out of the victory over Hull.
"/sdd/edimar/Desktop/doutorado/doutorado04/bases/WEIR/soccer/www.teamtalk.com/2483_136547.html",Rangers striker Kyle Lafferty has outlined his determination to silence his detractors and prove his worth to a sceptical Ibrox fan base.
"/sdd/edimar/Desktop/doutorado/doutorado04/bases/WEIR/soccer/www.teamtalk.com/2483_92144.html","Chelsea midfielder Michael Essien has refused to set a date for his comeback from a knee injury - but says ""everything is going well""."
"/sdd/edimar/Desktop/doutorado/doutorado04/bases/WEIR/soccer/www.teamtalk.com/2483_92690.html",Petr Cech has complete faith in William Gallas' honesty after his former Chelsea team-mate sparked a row with his public criticism of Arsenal.
"/sdd/edimar/Desktop/doutorado/doutorado04/bases/WEIR/soccer/www.teamtalk.com/2483_149564.html",Newcastle caretaker Joe Kinnear believes the loss of Joey Barton will be softened by the return of Danny Guthrie to the first team.
"/sdd/edimar/Desktop/doutorado/doutorado04/bases/WEIR/soccer/www.teamtalk.com/1910_9223.html","Northern Ireland captain Aaron Hughes is adamant their World Cup qualifying hopes will remain alive, even if they lose to the Czech Republic."
"/sdd/edimar/Desktop/doutorado/doutorado04/bases/WEIR/soccer/www.teamtalk.com/2483_100358.html",Tottenham striker Roman Pavlyuchenko is expected to be out for three weeks after scans showed he has a partially torn ankle ligament.
"/sdd/edimar/Desktop/doutorado/doutorado04/bases/WEIR/soccer/www.teamtalk.com/1806_92711.html",Teemu Tainio looks set to be at Sunderland chief Roy Keane's disposal for the weekend clash against Wigan after overcoming a hamstring injury.
"/sdd/edimar/Desktop/doutorado/doutorado04/bases/WEIR/soccer/www.teamtalk.com/1823_77727.html",Hull defender Anthony Gardner is expected to miss the Tigers' next two games before being ready to make his Premier League comeback.
"/sdd/edimar/Desktop/doutorado/doutorado04/bases/WEIR/soccer/www.teamtalk.com/1873_92521.html",Rangers striker Jean-Claude Darcheville could be set for a move to Marseille after admitting he is ready for a return to France.
"/sdd/edimar/Desktop/doutorado/doutorado04/bases/WEIR/soccer/www.teamtalk.com/2483_3673.html","Walter Smith insists Newcastle have not enquired about Rangers skipper Barry Ferguson, who played in Sunday's 3-0 SPL win at Inverness."
"/sdd/edimar/Desktop/doutorado/doutorado04/bases/WEIR/soccer/www.teamtalk.com/1784_47443.html","Darren Bent has vowed to make ""as strong a claim as possible"" for the England striking spot he believes is available alongside Wayne Rooney."
"/sdd/edimar/Desktop/doutorado/doutorado04/bases/WEIR/soccer/www.teamtalk.com/1770_83049.html","Bolton manager Gary Megson has allowed Nicky Hunt to extend his loan spell at Birmingham, keeping the defender at St Andrews until January 10."
"/sdd/edimar/Desktop/doutorado/doutorado04/bases/WEIR/soccer/www.teamtalk.com/2483_3864.html",James McFadden insists Birmingham's recovery against Charlton on Saturday shows they have the fight to sustain a serious promotion challenge.
"/sdd/edimar/Desktop/doutorado/doutorado04/bases/WEIR/soccer/www.teamtalk.com/2483_9035.html","Fulham midfielder Simon Davies has been named as Wales Footballer of the Year, with Tottenham's Chris Gunter taking the Young Player gong."
"/sdd/edimar/Desktop/doutorado/doutorado04/bases/WEIR/soccer/www.teamtalk.com/1869_11701.html",Veteran Inverness winger Barry Wilson is hoping to thrash out his long-term future before the turn of the year.
"/sdd/edimar/Desktop/doutorado/doutorado04/bases/WEIR/soccer/www.teamtalk.com/1800_87281.html",Preston boss Alan Irvine has dropped a heavy hint that Richard Chaplow may have to settle for a place among the substitutes against Wolves.
"/sdd/edimar/Desktop/doutorado/doutorado04/bases/WEIR/soccer/www.teamtalk.com/2483_127840.html",Middlesbrough are facing a defensive crisis after deciding not to appeal against David Wheater's sending off in Saturday's defeat at Hull.
"/sdd/edimar/Desktop/doutorado/doutorado04/bases/WEIR/soccer/www.teamtalk.com/2483_94966.html",Robin van Persie does not believe he is the disruptive influence in the Arsenal dressing room described by team-mate William Gallas.
"/sdd/edimar/Desktop/doutorado/doutorado04/bases/WEIR/soccer/www.teamtalk.com/1814_8422.html",Bristol Rovers boss Paul Trollope has paid tribute to Chris Carruthers and Sammy Igoe after the pair were released by the club on Wednesday.
"/sdd/edimar/Desktop/doutorado/doutorado04/bases/WEIR/soccer/www.teamtalk.com/2483_139234.html",Micah Richards says Manchester City's stars fear they could be axed in January when Mark Hughes launches his widely-anticipated spending spree.
"/sdd/edimar/Desktop/doutorado/doutorado04/bases/WEIR/soccer/www.teamtalk.com/1794_85821.html","Dean Bowditch admits he has come to Brentford looking to ""kick-start"" his career after a goalscoring debut at the weekend."
"/sdd/edimar/Desktop/doutorado/doutorado04/bases/WEIR/soccer/www.teamtalk.com/2483_137647.html",Valencia star David Silva says he has 'no desire' to move to the Premier League after being linked with Liverpool and Manchester United.
"/sdd/edimar/Desktop/doutorado/doutorado04/bases/WEIR/soccer/www.teamtalk.com/2483_97735.html",Andriy Shevchenko was relieved to end his goalscoring drought in the 1-0 second-leg triumph at FC Zurich in the UEFA Cup first round.
"/sdd/edimar/Desktop/doutorado/doutorado04/bases/WEIR/soccer/www.teamtalk.com/1767_9029.html","Middlesbrough full-back Luke Young should not expect any favours from his ex-Aston VIlla team-mates, keeper Ross Turnbull has warned."
"/sdd/edimar/Desktop/doutorado/doutorado04/bases/WEIR/soccer/www.teamtalk.com/2483_92501.html",Manchester United's old guard may not be as prominant as they once were but Patrice Evra insists they remain the heartbeat of Old Trafford.
"/sdd/edimar/Desktop/doutorado/doutorado04/bases/WEIR/soccer/www.teamtalk.com/1908_77684.html",Gareth Southgate has revealed he has every intention of keeping Stewart Downing at Middlesbrough until at least the summer.
"/sdd/edimar/Desktop/doutorado/doutorado04/bases/WEIR/soccer/www.teamtalk.com/1773_8862.html",Chelsea midfielder Frank Lampard believes axed striker Didier Drogba should stay and fight for his place at Stamford Bridge.
"/sdd/edimar/Desktop/doutorado/doutorado04/bases/WEIR/soccer/www.teamtalk.com/2483_106973.html",Manchester United reserve keeper Tomasz Kuszczak has signed a two-year contract extension which will keep him at the club until at least 2012.
"/sdd/edimar/Desktop/doutorado/doutorado04/bases/WEIR/soccer/www.teamtalk.com/1916_39141.html",Gillingham midfielder Andrew Crofts has joined League One Peterborough on loan until the end of January with a view to a permanent move.
"/sdd/edimar/Desktop/doutorado/doutorado04/bases/WEIR/soccer/www.teamtalk.com/1816_127704.html",Port Vale have lost their appeal against midfielder Ross Davidson's sending off in his side's League Two game against Brentford at the weekend.
"/sdd/edimar/Desktop/doutorado/doutorado04/bases/WEIR/soccer/www.teamtalk.com/1802_139209.html",Reading's Noel Hunt has revealed his bizarre goal celebration against Watford was a kangaroo impression in honour of Adam Federici's father.
"/sdd/edimar/Desktop/doutorado/doutorado04/bases/WEIR/soccer/www.teamtalk.com/1868_77329.html",Derek Riordan knows he has to keep banging in the goals for Hibernian if his dream of a Scotland recall is to be realised.
"/sdd/edimar/Desktop/doutorado/doutorado04/bases/WEIR/soccer/www.teamtalk.com/1776_9141.html",Liverpool defender Jamie Carragher is not surprised the Reds are top of the Premier League table - because he believes they belong there.
"/sdd/edimar/Desktop/doutorado/doutorado04/bases/WEIR/soccer/www.teamtalk.com/2483_34245.html",Stoke's Dave Kitson and Ryan Shawcross are to see specialists in order to diagnose the extent of respective knee and back injuries.
"/sdd/edimar/Desktop/doutorado/doutorado04/bases/WEIR/soccer/www.teamtalk.com/2483_6534.html",Portsmouth chief executive Peter Storrie has ruled out a move to bring former Arsenal and West Ham star Freddie Ljungberg to Fratton Park.
"/sdd/edimar/Desktop/doutorado/doutorado04/bases/WEIR/soccer/www.teamtalk.com/1777_8925.html",The FAI have confirmed that Richard Dunne will play for the Republic of Ireland in Wednesday night's friendly against Poland in Dublin.
"/sdd/edimar/Desktop/doutorado/doutorado04/bases/WEIR/soccer/www.teamtalk.com/1771_169768.html",Neil Warnock was full of praise for Nathaniel Clyne after the latest Crystal Palace Academy graduate enjoyed an impressive debut on Saturday.
"/sdd/edimar/Desktop/doutorado/doutorado04/bases/WEIR/soccer/www.teamtalk.com/1844_9265.html","Grimsby chairman John Fenty is hoping the signings of Robbie Stockdale, Matt Heywood and Richard Hope will boost the Mariners' defence."
"/sdd/edimar/Desktop/doutorado/doutorado04/bases/WEIR/soccer/www.teamtalk.com/2483_77684.html",Gareth Southgate has revealed he has every intention of keeping Stewart Downing at Middlesbrough until at least the summer.
"/sdd/edimar/Desktop/doutorado/doutorado04/bases/WEIR/soccer/www.teamtalk.com/1780_8923.html","Mark Viduka has targeted a return to international action with Australia - but admits his top priority is to ""get back playing"" for Newcastle."
"/sdd/edimar/Desktop/doutorado/doutorado04/bases/WEIR/soccer/www.teamtalk.com/2483_85069.html",Caleb Folan is hoping to show Republic of Ireland boss Giovanni Trapattoni what he has been missing in Thursday's game with Nottingham Forest.
"/sdd/edimar/Desktop/doutorado/doutorado04/bases/WEIR/soccer/www.teamtalk.com/2483_72264.html",Kirk Broadfoot believes Rangers team-mate Kevin Thomson has the strength of character to return from his latest injury stronger than before.
"/sdd/edimar/Desktop/doutorado/doutorado04/bases/WEIR/soccer/www.teamtalk.com/2483_6564.html",Sunderland boss Roy Keane has dismissed reports he is set to swoop for Inter Milan midfielder Patrick Vieira in the January transfer window.
"/sdd/edimar/Desktop/doutorado/doutorado04/bases/WEIR/soccer/www.teamtalk.com/1914_9621.html",Paul Hartley has backed Celtic to finally overcome their travel sickness in the Champions League when they face Aalborg next week.
