URL,EXTRACTED VALUE
"/sdd/edimar/Desktop/doutorado/doutorado04/bases/WEIR/soccer/www.teamtalk.com/1872_72305.html",Motherwell striker David Clarkson can scarcely believe he is about to make his European debut after coming through difficult times at Fir Park.
"/sdd/edimar/Desktop/doutorado/doutorado04/bases/WEIR/soccer/www.teamtalk.com/1809_8979.html",Boss Steve Bruce singled out the performance of much-maligned centre-back Titus Bramble for special praise after Wigan's 0-0 draw with Stoke.
"/sdd/edimar/Desktop/doutorado/doutorado04/bases/WEIR/soccer/www.teamtalk.com/2483_99226.html",Jonathan Greening and Scott Carson are hoping West Brom striker Luke Moore can fill the void in the team left by the injured Ishmael Miller.
"/sdd/edimar/Desktop/doutorado/doutorado04/bases/WEIR/soccer/www.teamtalk.com/1798_113337.html",Nottingham Forest defender Julian Bennett hopes to return to action within the next two weeks to help the club move away from the drop zone.
"/sdd/edimar/Desktop/doutorado/doutorado04/bases/WEIR/soccer/www.teamtalk.com/2483_97513.html",Inter Milan president Massimo Moratti is confident Adriano will remain at the Serie A club despite reported interest from Chelsea and Flamengo.
"/sdd/edimar/Desktop/doutorado/doutorado04/bases/WEIR/soccer/www.teamtalk.com/1776_94967.html",Liverpool's joint top scorer Dirk Kuyt says the Anfield club dare not take their foot off the gas in their hunt for a first title in 19 years.
"/sdd/edimar/Desktop/doutorado/doutorado04/bases/WEIR/soccer/www.teamtalk.com/2483_127303.html",Cardiff handed a start to Joe Ledley in Saturday's FA Cup clash with Reading despite the winger closing on a £7million move to Stoke.
"/sdd/edimar/Desktop/doutorado/doutorado04/bases/WEIR/soccer/www.teamtalk.com/1779_92670.html","The FA has vowed to ""take the strongest possible action"" against anyone guilty of Islamophobic or racist chanting against Middlesbrough's Mido."
"/sdd/edimar/Desktop/doutorado/doutorado04/bases/WEIR/soccer/www.teamtalk.com/1908_8875.html",Jermain Defoe has admitted it is 'great to be back' at Tottenham Hotspur after conceding he did not want to leave the club 12 months ago.
"/sdd/edimar/Desktop/doutorado/doutorado04/bases/WEIR/soccer/www.teamtalk.com/2483_9175.html",Blackpool boss Simon Grayson looks set to miss out on signing Paul Dickov after Leicester chief Milan Mandaric confirmed talks have been held.
"/sdd/edimar/Desktop/doutorado/doutorado04/bases/WEIR/soccer/www.teamtalk.com/1783_100207.html",Watford manager Adrian Boothroyd is confident that new signing Grzegorz Rasiak will be amongst the goals for the Hornets this season.
"/sdd/edimar/Desktop/doutorado/doutorado04/bases/WEIR/soccer/www.teamtalk.com/1766_8833.html","Mikael Silvestre says Arsenal have time to ""grow up"" and remain very much ""still in the race"" for both European and Premier League glory."
"/sdd/edimar/Desktop/doutorado/doutorado04/bases/WEIR/soccer/www.teamtalk.com/1779_115281.html",Middlesbrough boss Gareth Southgate has laughed off suggestions that Chelsea could get their hands on striker Tuncay Sanli for £8million.
"/sdd/edimar/Desktop/doutorado/doutorado04/bases/WEIR/soccer/www.teamtalk.com/1828_151139.html",Defender Lee Collins believes Port Vale are still to reach their full potential this season and insisted they are good enough to win promotion.
"/sdd/edimar/Desktop/doutorado/doutorado04/bases/WEIR/soccer/www.teamtalk.com/1908_9192.html","Shaun Wright-Phillips ""learned plenty"" from his time at Chelsea under three different managers, declaring himself ""wiser"" for the experience."
"/sdd/edimar/Desktop/doutorado/doutorado04/bases/WEIR/soccer/www.teamtalk.com/2483_8872.html",Fulham boss Roy Hodgson insists it would take 'something special' for him to part with Jimmy Bullard or Brede Hangeland this month.
"/sdd/edimar/Desktop/doutorado/doutorado04/bases/WEIR/soccer/www.teamtalk.com/2483_148250.html",David Moyes claims Merseyside rivals Liverpool played a major part in Everton's record-breaking £15million purchase of Marouane Fellaini.
"/sdd/edimar/Desktop/doutorado/doutorado04/bases/WEIR/soccer/www.teamtalk.com/2483_94828.html",Arsenal striker Emmanuel Adebayor believes William Gallas was right to publicly question his Gunners team-mates' stomach for a fight.
"/sdd/edimar/Desktop/doutorado/doutorado04/bases/WEIR/soccer/www.teamtalk.com/1806_3644.html","Bradford City boss Stuart McCall is running the rule over former Barnsley goalkeeper Nick Colgan, who is training with the Bantams."
"/sdd/edimar/Desktop/doutorado/doutorado04/bases/WEIR/soccer/www.teamtalk.com/2483_94893.html",Bolton boss Gary Megson believes striker Johan Elmander is finally starting to show why he broke the club's transfer record to sign the Swede.
"/sdd/edimar/Desktop/doutorado/doutorado04/bases/WEIR/soccer/www.teamtalk.com/1908_6518.html",Chelsea rounded off their pre-season tour of Asia with a 2-0 victory over a strong Malaysian Select XI on Tuesday afternoon.
"/sdd/edimar/Desktop/doutorado/doutorado04/bases/WEIR/soccer/www.teamtalk.com/1910_114003.html",West Brom have suffered a double injury blow ahead of their trip to Middlesbrough after both Chris Brunt and Abdoulaye Meite were ruled out.
"/sdd/edimar/Desktop/doutorado/doutorado04/bases/WEIR/soccer/www.teamtalk.com/2483_80542.html",Aston Villa winger James Milner is hoping to go on a goalscoring run following his double against Gillingham in the FA Cup.
"/sdd/edimar/Desktop/doutorado/doutorado04/bases/WEIR/soccer/www.teamtalk.com/1767_98621.html",Aston Villa's Martin O'Neill and Ashley Young have claimed the Barclays Manager and Player of the Month awards for December.
"/sdd/edimar/Desktop/doutorado/doutorado04/bases/WEIR/soccer/www.teamtalk.com/2483_92954.html",Barcelona midfielder Alexander Hleb admits he has been trying to persuade former Arsenal team-mate Cesc Fabregas to join him at the Nou Camp.
"/sdd/edimar/Desktop/doutorado/doutorado04/bases/WEIR/soccer/www.teamtalk.com/2483_100749.html",Nemanja Vidic is adamant the Carling Cup defeat at Derby will not have an adverse affect on Manchester United's performance against Chelsea.
"/sdd/edimar/Desktop/doutorado/doutorado04/bases/WEIR/soccer/www.teamtalk.com/2483_4846.html",Kenny Miller's calf injury may force him to miss a third Rangers match after Walter Smith admitted he is doubtful for Saturday's Hearts clash.
"/sdd/edimar/Desktop/doutorado/doutorado04/bases/WEIR/soccer/www.teamtalk.com/2483_130961.html","Kenwyne Jones insists Sunderland are not yet involved in a relegation fight - and says they just need to ""maintain our progression""."
"/sdd/edimar/Desktop/doutorado/doutorado04/bases/WEIR/soccer/www.teamtalk.com/2483_7846.html",Injured Stoke midfielder Liam Lawrence is hoping to make a first-team return before Christmas after resuming light training on Monday.
"/sdd/edimar/Desktop/doutorado/doutorado04/bases/WEIR/soccer/www.teamtalk.com/2483_8867.html",Chelsea manager Luiz Felipe Scolari has told Tottenham Hotspur to forget any plans to sign England midfielder Joe Cole.
"/sdd/edimar/Desktop/doutorado/doutorado04/bases/WEIR/soccer/www.teamtalk.com/1802_150965.html",Southampton have completed the signing of centre-back Alex Pearce on loan until January from Championship rivals Reading.
"/sdd/edimar/Desktop/doutorado/doutorado04/bases/WEIR/soccer/www.teamtalk.com/1794_23088.html",Charlton manager Alan Pardew has dismissed reports linking him with a move for Ipswich midfielder Ivan Campo.
"/sdd/edimar/Desktop/doutorado/doutorado04/bases/WEIR/soccer/www.teamtalk.com/1808_7015.html",Hayden Mullins has vowed to fight for his place in the West Ham side despite being linked with a move away from Upton Park.
"/sdd/edimar/Desktop/doutorado/doutorado04/bases/WEIR/soccer/www.teamtalk.com/1790_38821.html",Hartlepool's director of sport Chris Turner is confident Pools striker Kevin Kyle will extend his loan stay with the League One outfit.
"/sdd/edimar/Desktop/doutorado/doutorado04/bases/WEIR/soccer/www.teamtalk.com/2483_153437.html","Manchester United teenager Rafael da Silva has praised manager Sir Alex Ferguson, labelling the Scot a ""lovely man"" and ""like a father to me""."
"/sdd/edimar/Desktop/doutorado/doutorado04/bases/WEIR/soccer/www.teamtalk.com/1780_134245.html",Newcastle have completed the signing of Spain Under-21 striker Xisco on a five-year deal from Deportivo La Coruna for an undisclosed fee.
"/sdd/edimar/Desktop/doutorado/doutorado04/bases/WEIR/soccer/www.teamtalk.com/1908_8862.html",Chelsea midfielder Frank Lampard believes axed striker Didier Drogba should stay and fight for his place at Stamford Bridge.
"/sdd/edimar/Desktop/doutorado/doutorado04/bases/WEIR/soccer/www.teamtalk.com/1841_4772.html","Port Vale have brought midfielder Scott Brown to the League Two club on trial, with a view to arranging a loan move."
"/sdd/edimar/Desktop/doutorado/doutorado04/bases/WEIR/soccer/www.teamtalk.com/1790_7011.html",Coventry are waiting to discover the extent of Leon McKenzie's thigh injury amid concerns the striker could face a lengthy spell out.
"/sdd/edimar/Desktop/doutorado/doutorado04/bases/WEIR/soccer/www.teamtalk.com/1873_22144.html","Rangers striker Alan Gow has agreed a two-and-a-half-year contract with Championship leaders Wolves, the player's agent has revealed."
"/sdd/edimar/Desktop/doutorado/doutorado04/bases/WEIR/soccer/www.teamtalk.com/1815_49221.html",Striker Michael Boulding rates Bradford City wingers Joe Colbeck and Omar Daley as the fastest two players he has seen.
"/sdd/edimar/Desktop/doutorado/doutorado04/bases/WEIR/soccer/www.teamtalk.com/2483_40681.html","Manuel Almunia believes William Gallas is still the real leader of Arsenal, despite having been stripped of the captaincy."
"/sdd/edimar/Desktop/doutorado/doutorado04/bases/WEIR/soccer/www.teamtalk.com/2483_100246.html",Arsenal manager Arsene Wenger believes it will not be long before the Gunners see striker Eduardo back in action after his broken leg.
"/sdd/edimar/Desktop/doutorado/doutorado04/bases/WEIR/soccer/www.teamtalk.com/2483_96813.html",Scottish Premier League champions Celtic have confirmed playmaker Shunsuke Nakamura will not be leaving Parkhead before the end of the season.
"/sdd/edimar/Desktop/doutorado/doutorado04/bases/WEIR/soccer/www.teamtalk.com/1916_151488.html","Teenage striker Ched Evans, who spent last season on loan with Norwich City, has signed a three-year contract extension with Manchester City."
"/sdd/edimar/Desktop/doutorado/doutorado04/bases/WEIR/soccer/www.teamtalk.com/2483_9130.html","Liverpool boss Rafa Benitez has branded the new UEFA rule which forced him to leave Sami Hyypia out of his Champions League squad a ""mistake""."
"/sdd/edimar/Desktop/doutorado/doutorado04/bases/WEIR/soccer/www.teamtalk.com/1768_6576.html","Birmingham captain Lee Carsley insists there is ""a lot more to come"" from Blues despite their unbeaten start in the Championship this season."
"/sdd/edimar/Desktop/doutorado/doutorado04/bases/WEIR/soccer/www.teamtalk.com/982_8999.html",Ipswich defender Richard Naylor believes that the 1-0 win over Derby on Sunday could put Town on track for a successful 2009.
"/sdd/edimar/Desktop/doutorado/doutorado04/bases/WEIR/soccer/www.teamtalk.com/1816_7240.html",Port Vale have confirmed the proposed transfer of Craig Pead will not be going through after they failed to reach an agreement.
"/sdd/edimar/Desktop/doutorado/doutorado04/bases/WEIR/soccer/www.teamtalk.com/1873_40584.html",Birmingham manager Alex McLeish has played down the prospect of making a breakthrough in his bid to sign Rangers striker Kris Boyd.
"/sdd/edimar/Desktop/doutorado/doutorado04/bases/WEIR/soccer/www.teamtalk.com/1778_94454.html",Park Ji-sung is confident Manchester United will win the Premier League and Champions League again despite a shaky start to the season.
"/sdd/edimar/Desktop/doutorado/doutorado04/bases/WEIR/soccer/www.teamtalk.com/2483_96219.html","Juventus midfielder Tiago has rejected the chance to join Everton, the Serie A club's sporting director Alessio Secco has confirmed."
"/sdd/edimar/Desktop/doutorado/doutorado04/bases/WEIR/soccer/www.teamtalk.com/2483_98991.html",Aston Villa boss Martin O'Neill has confirmed that John Carew will not require operations on troublesome back and hip injuries.
"/sdd/edimar/Desktop/doutorado/doutorado04/bases/WEIR/soccer/www.teamtalk.com/1771_8588.html",Crystal Palace winger Paul Ifill is hoping he can perform well enough to get himself taken off the transfer list by gaffer Neil Warnock.
"/sdd/edimar/Desktop/doutorado/doutorado04/bases/WEIR/soccer/www.teamtalk.com/1812_6792.html",Barnsley's Iain Hume was discharged from hospital on Wednesday following his horrific fractured skull injury as the Tykes hit out at the FA.
"/sdd/edimar/Desktop/doutorado/doutorado04/bases/WEIR/soccer/www.teamtalk.com/1873_163659.html",Maurice Edu's arrival in Glasgow to link up with Rangers was delayed after he was caught up in the collapse of Zoom airline.
"/sdd/edimar/Desktop/doutorado/doutorado04/bases/WEIR/soccer/www.teamtalk.com/1807_149843.html",Chelsea youngster Jack Cork has revealed he would jump at the chance to extend his loan spell with Championship side Southampton.
"/sdd/edimar/Desktop/doutorado/doutorado04/bases/WEIR/soccer/www.teamtalk.com/1823_8238.html",Hull captain Ian Ashbee admits the Premier League new boys have a glorious chance to make a flying start to their first term in the top flight.
"/sdd/edimar/Desktop/doutorado/doutorado04/bases/WEIR/soccer/www.teamtalk.com/2483_6544.html",Portsmouth have not given up hope of signing Jermaine Pennant - even though the winger has pleaded with Liverpool not to sell him.
"/sdd/edimar/Desktop/doutorado/doutorado04/bases/WEIR/soccer/www.teamtalk.com/2483_8934.html",Paul Ince has urged Fabio Capello to give Paul Robinson another chance for England after insisting he is the best keeper in the country.
"/sdd/edimar/Desktop/doutorado/doutorado04/bases/WEIR/soccer/www.teamtalk.com/2483_115462.html",Mixu Paatelainen is ready to let striker Steven Fletcher leave Hibernian - but only after one more season at Easter Road.
"/sdd/edimar/Desktop/doutorado/doutorado04/bases/WEIR/soccer/www.teamtalk.com/1767_8193.html",Aston Villa boss Martin O'Neill has backed Nicky Shorey to force his way back into the first-team fold at Villa Park.
"/sdd/edimar/Desktop/doutorado/doutorado04/bases/WEIR/soccer/www.teamtalk.com/1908_6570.html","Gareth Barry believes Aston Villa are in a ""perfect position"" to maintain their push for a Champions League spot during the rest of the season."
"/sdd/edimar/Desktop/doutorado/doutorado04/bases/WEIR/soccer/www.teamtalk.com/1806_8545.html",Sunderland skipper Dean Whitehead is confident the range of talents in the club's midfield can help them climb the Premier League table.
"/sdd/edimar/Desktop/doutorado/doutorado04/bases/WEIR/soccer/www.teamtalk.com/1789_66725.html",Rangers winger Chris Burke is understood to be having a medical with Cardiff on Thursday as he looks to tie up a move from the Glasgow giants.
"/sdd/edimar/Desktop/doutorado/doutorado04/bases/WEIR/soccer/www.teamtalk.com/2483_126515.html",Shakhtar Donetsk goalkeeper Jan Lastuvka is hoping to secure a return to the Premier League by wrapping up a move to West Ham.
