URL,EXTRACTED VALUE
"/sdd/edimar/Desktop/doutorado/doutorado04/bases/WEIR/soccer/www.teamtalk.com/2483_6571.html",George Boateng believes Hull were guilty of being overrawed for the first time this season during Saturday's 4-3 defeat at Manchester United.
"/sdd/edimar/Desktop/doutorado/doutorado04/bases/WEIR/soccer/www.teamtalk.com/1765_8860.html",Rio Ferdinand has warned his Manchester United team-mates not to get carried away after moving to within a game of being named world champions
"/sdd/edimar/Desktop/doutorado/doutorado04/bases/WEIR/soccer/www.teamtalk.com/1820_7389.html",Doncaster midfielder Brian Stock is undergoing intensive back treatment as he bids to be fit for Saturday's visit of Blackpool.
"/sdd/edimar/Desktop/doutorado/doutorado04/bases/WEIR/soccer/www.teamtalk.com/1908_8835.html","David Beckham is set to be on the substitutes' bench for AC Milan's Serie A clash with Roma on Sunday, coach Carlo Ancelotti has confirmed."
"/sdd/edimar/Desktop/doutorado/doutorado04/bases/WEIR/soccer/www.teamtalk.com/1873_72284.html",Rangers goalkeeper Allan McGregor has played down injury fears after revealing he is struggling at the moment with fluid on his knee.
"/sdd/edimar/Desktop/doutorado/doutorado04/bases/WEIR/soccer/www.teamtalk.com/1910_9105.html","West Ham have hit back at George McCartney's claim they instigated his move to Sunderland, insisting they wanted to keep the full-back."
"/sdd/edimar/Desktop/doutorado/doutorado04/bases/WEIR/soccer/www.teamtalk.com/1775_9230.html",Mark Schwarzer will head into Saturday's friendly against Holland with more than one eye on next week's World Cup qualifier against Uzbekistan.
"/sdd/edimar/Desktop/doutorado/doutorado04/bases/WEIR/soccer/www.teamtalk.com/2483_3633.html",Stiliyan Petrov says his Aston Villa side must play at their best against all sides - not just the top ones - if they are to make the top four.
"/sdd/edimar/Desktop/doutorado/doutorado04/bases/WEIR/soccer/www.teamtalk.com/2483_90049.html",Liverpool's Fernando Torres says he does not share Rafa Benitez's belief that Manchester United get an easy ride from referees and officials.
"/sdd/edimar/Desktop/doutorado/doutorado04/bases/WEIR/soccer/www.teamtalk.com/1792_32842.html",Derby midfielder Stephen Pearson is eyeing a regular starting berth at Pride Park despite the fact he has yet to feature this season.
"/sdd/edimar/Desktop/doutorado/doutorado04/bases/WEIR/soccer/www.teamtalk.com/1785_149553.html",Peterborough director of football Barry Fry has revealed that the club were close to signing Arsenal striker Jay Simpson on loan.
"/sdd/edimar/Desktop/doutorado/doutorado04/bases/WEIR/soccer/www.teamtalk.com/1860_7312.html","Danny Schofield is poised to sign for Yeovil after being released from Huddersfield, much to the delight of Glovers manager Russell Slade."
"/sdd/edimar/Desktop/doutorado/doutorado04/bases/WEIR/soccer/www.teamtalk.com/1802_25721.html",Reading defender Ivar Ingimarsson has backed manager Steve Coppell's decision to name 27-year-old midfielder James Harper as captain.
"/sdd/edimar/Desktop/doutorado/doutorado04/bases/WEIR/soccer/www.teamtalk.com/1802_159517.html",Southend have bolstered their wide options by completing the loan signing of Reading winger Hal Robson-Kanu on a month-long deal.
"/sdd/edimar/Desktop/doutorado/doutorado04/bases/WEIR/soccer/www.teamtalk.com/1908_6551.html","Matthew Upson has urged his West Ham team-mates to show their ""resilience and character"" going into the busy Christmas period."
"/sdd/edimar/Desktop/doutorado/doutorado04/bases/WEIR/soccer/www.teamtalk.com/1802_7529.html",Reading centre-back Ivar Ingimarsson believes his partnership with Andre Bikey provides great balance at the heart of the Royals' defence.
"/sdd/edimar/Desktop/doutorado/doutorado04/bases/WEIR/soccer/www.teamtalk.com/1850_8367.html",Northampton Town defender Andy Holt has signed a new two-year contract with manager Stuart Gray's League One outfit.
"/sdd/edimar/Desktop/doutorado/doutorado04/bases/WEIR/soccer/www.teamtalk.com/1805_36301.html",Michael Tonge thinks there is even more to come from Stoke - and he has warned the Premier League they had better watch out for Ricardo Fuller.
"/sdd/edimar/Desktop/doutorado/doutorado04/bases/WEIR/soccer/www.teamtalk.com/1806_7712.html",Wolves have been handed a blow with the news Sunderland have recalled winger Carlos Edwards from his loan spell at Molineux.
"/sdd/edimar/Desktop/doutorado/doutorado04/bases/WEIR/soccer/www.teamtalk.com/2483_47443.html","Darren Bent has vowed to make ""as strong a claim as possible"" for the England striking spot he believes is available alongside Wayne Rooney."
"/sdd/edimar/Desktop/doutorado/doutorado04/bases/WEIR/soccer/www.teamtalk.com/1824_8276.html",Released Colchester United midfielder Kevin Watson has been handed a trial with troubled League Two outfit Luton Town.
"/sdd/edimar/Desktop/doutorado/doutorado04/bases/WEIR/soccer/www.teamtalk.com/2483_126532.html",Alberto Aquilani's agent insists the Roma star will still be at the Stadio Olimpico come the start of next season.
"/sdd/edimar/Desktop/doutorado/doutorado04/bases/WEIR/soccer/www.teamtalk.com/1820_8427.html",Doncaster Rovers manager Sean O'Driscoll expects all five of his out-of-contract players to agree improved deals at the Keepmoat Stadium.
"/sdd/edimar/Desktop/doutorado/doutorado04/bases/WEIR/soccer/www.teamtalk.com/1808_7056.html",Luis Boa Morte's agent has claimed the West Ham midfielder has not been made aware of any interest in him from Hull City boss Phil Brown.
"/sdd/edimar/Desktop/doutorado/doutorado04/bases/WEIR/soccer/www.teamtalk.com/1768_3864.html",James McFadden insists Birmingham's recovery against Charlton on Saturday shows they have the fight to sustain a serious promotion challenge.
"/sdd/edimar/Desktop/doutorado/doutorado04/bases/WEIR/soccer/www.teamtalk.com/2483_95034.html",Micah Richards and Aaron Lennon have withdrawn from the England Under-21 squad to face Wales in their European Championship play-off.
"/sdd/edimar/Desktop/doutorado/doutorado04/bases/WEIR/soccer/www.teamtalk.com/2483_6709.html",Jason Roberts has promised John Terry another physical challenge when Chelsea visit to Blackburn in the Premier League on Sunday.
"/sdd/edimar/Desktop/doutorado/doutorado04/bases/WEIR/soccer/www.teamtalk.com/2483_72281.html",Everton manager David Moyes has rubbished suggestions that the club will cash in on star midfielder Mikel Arteta during the transfer window.
"/sdd/edimar/Desktop/doutorado/doutorado04/bases/WEIR/soccer/www.teamtalk.com/1912_8925.html",The FAI have confirmed that Richard Dunne will play for the Republic of Ireland in Wednesday night's friendly against Poland in Dublin.
"/sdd/edimar/Desktop/doutorado/doutorado04/bases/WEIR/soccer/www.teamtalk.com/1766_152667.html",Arsenal boss Arsene Wenger looks set to give another of his youngsters a chance to impress in the final game of the season at Sunderland.
"/sdd/edimar/Desktop/doutorado/doutorado04/bases/WEIR/soccer/www.teamtalk.com/2483_8844.html",Everton captain Phil Neville has urged his team-mates to build on their 1-1 draw with champions Manchester United on Saturday.
"/sdd/edimar/Desktop/doutorado/doutorado04/bases/WEIR/soccer/www.teamtalk.com/2483_99309.html",Chelsea defender Ricardo Carvalho could be out for a minimum of three weeks after being forced out to limp out of the victory over Hull.
"/sdd/edimar/Desktop/doutorado/doutorado04/bases/WEIR/soccer/www.teamtalk.com/1791_79189.html",Crewe Alexandra have completed the signing of striker Clayton Donaldson from Scottish Premier League club Hibernian for an undisclosed fee.
"/sdd/edimar/Desktop/doutorado/doutorado04/bases/WEIR/soccer/www.teamtalk.com/2483_113156.html",Newcastle defender Habib Beye has admitted he was devastated to be sent off against Manchester City in Monday's Premier League clash.
"/sdd/edimar/Desktop/doutorado/doutorado04/bases/WEIR/soccer/www.teamtalk.com/1808_94604.html",Wigan's Henri Camara insists he is ready to seize the opportunity afforded by the injury to Emile Heskey and force his way back into the side.
"/sdd/edimar/Desktop/doutorado/doutorado04/bases/WEIR/soccer/www.teamtalk.com/1785_6744.html",Combative West Brom defender Paul Robinson has vowed to try and stay out of trouble with Premier League referees this season.
"/sdd/edimar/Desktop/doutorado/doutorado04/bases/WEIR/soccer/www.teamtalk.com/2483_96735.html","Chelsea have hailed ""an important decision for football"" after FIFA ordered Adrian Mutu to pay the club £13.68million in compensation."
"/sdd/edimar/Desktop/doutorado/doutorado04/bases/WEIR/soccer/www.teamtalk.com/1812_66521.html",Barnsley manager Simon Davey is hoping to fast-track Argentinian midfielder Hugo Colace into his slow-starting side.
"/sdd/edimar/Desktop/doutorado/doutorado04/bases/WEIR/soccer/www.teamtalk.com/2483_123760.html",New Plymouth Argyle striker Emile Mpenza has spoken of resurrecting his international career after sealing his move to the Pilgrims.
"/sdd/edimar/Desktop/doutorado/doutorado04/bases/WEIR/soccer/www.teamtalk.com/2483_49783.html","Tyrone Mears has joined Marseille on loan from Derby, just days after he flew out to France for a trial against the wishes of the club."
"/sdd/edimar/Desktop/doutorado/doutorado04/bases/WEIR/soccer/www.teamtalk.com/2483_9185.html",Celtic defender Gary Caldwell has revealed he is keen to pledge his long-term future to the club by signing a new deal to keep him at Parkhead.
"/sdd/edimar/Desktop/doutorado/doutorado04/bases/WEIR/soccer/www.teamtalk.com/2483_82927.html",Luke Moore believes he can deliver goals to help West Brom's bid for another 'great escape' if he is given an extended first-team run.
"/sdd/edimar/Desktop/doutorado/doutorado04/bases/WEIR/soccer/www.teamtalk.com/1873_4846.html",Kenny Miller's calf injury may force him to miss a third Rangers match after Walter Smith admitted he is doubtful for Saturday's Hearts clash.
"/sdd/edimar/Desktop/doutorado/doutorado04/bases/WEIR/soccer/www.teamtalk.com/1815_8356.html",Centre-back Graeme Lee is close to sealing a switch to Bradford City after holding talks with the Bantams on Friday morning.
"/sdd/edimar/Desktop/doutorado/doutorado04/bases/WEIR/soccer/www.teamtalk.com/2483_6527.html",Robert Pires has urged the French Football Federation (FFF) to appoint Arsenal boss Arsene Wenger as national team coach.
"/sdd/edimar/Desktop/doutorado/doutorado04/bases/WEIR/soccer/www.teamtalk.com/2483_92742.html",Stoke have signed their second Faye of the day after landing Senegal defender Abdoulaye in a £2.25million deal from Newcastle.
"/sdd/edimar/Desktop/doutorado/doutorado04/bases/WEIR/soccer/www.teamtalk.com/1778_68918.html",Manchester United striker Wayne Rooney believes the Red Devils are well placed in a three-horse race for the Premier League title.
"/sdd/edimar/Desktop/doutorado/doutorado04/bases/WEIR/soccer/www.teamtalk.com/2483_141604.html",Carlos Tevez's Manchester United future is again in doubt after his agent refused to confirm whether he would be at the club next season.
"/sdd/edimar/Desktop/doutorado/doutorado04/bases/WEIR/soccer/www.teamtalk.com/1800_112216.html",Preston striker Stephen Elliott is confident his in-form side can sustain their challenge for promotion to the Premier League.
"/sdd/edimar/Desktop/doutorado/doutorado04/bases/WEIR/soccer/www.teamtalk.com/1765_82321.html",Sunderland central defender Anton Ferdinand wants to follow his big brother Rio into Fabio Capello's England team.
"/sdd/edimar/Desktop/doutorado/doutorado04/bases/WEIR/soccer/www.teamtalk.com/1815_7473.html",Bradford City manager Stuart McCall has offered striker Barry Conlon another short-term contract with the League Two outfit.
"/sdd/edimar/Desktop/doutorado/doutorado04/bases/WEIR/soccer/www.teamtalk.com/2483_94257.html",Tony Adams has praised the quality of Hull forward Geovanni and revealed Portsmouth passed up the chance to sign him on a free 18 months ago.
"/sdd/edimar/Desktop/doutorado/doutorado04/bases/WEIR/soccer/www.teamtalk.com/1777_92348.html","Manchester City winger Martin Petrov is expected to be out for ""three or four months"" with a knee injury, manager Mark Hughes has revealed."
"/sdd/edimar/Desktop/doutorado/doutorado04/bases/WEIR/soccer/www.teamtalk.com/2483_8860.html",Rio Ferdinand has warned his Manchester United team-mates not to get carried away after moving to within a game of being named world champions
"/sdd/edimar/Desktop/doutorado/doutorado04/bases/WEIR/soccer/www.teamtalk.com/2483_149550.html",Portsmouth boss Harry Redknapp has dismissed suggestions that the club could sign Armand Traore on a permanent deal from Arsenal.
"/sdd/edimar/Desktop/doutorado/doutorado04/bases/WEIR/soccer/www.teamtalk.com/1784_92711.html",Teemu Tainio looks set to be at Sunderland chief Roy Keane's disposal for the weekend clash against Wigan after overcoming a hamstring injury.
"/sdd/edimar/Desktop/doutorado/doutorado04/bases/WEIR/soccer/www.teamtalk.com/1802_8947.html",Reading defender Michael Duberry made a successful comeback from his calf injury in the 6-0 reserves win over Northampton on Wednesday.
"/sdd/edimar/Desktop/doutorado/doutorado04/bases/WEIR/soccer/www.teamtalk.com/2483_92670.html","The FA has vowed to ""take the strongest possible action"" against anyone guilty of Islamophobic or racist chanting against Middlesbrough's Mido."
"/sdd/edimar/Desktop/doutorado/doutorado04/bases/WEIR/soccer/www.teamtalk.com/1778_100749.html",Nemanja Vidic is adamant the Carling Cup defeat at Derby will not have an adverse affect on Manchester United's performance against Chelsea.
"/sdd/edimar/Desktop/doutorado/doutorado04/bases/WEIR/soccer/www.teamtalk.com/1834_6695.html",Jabo Ibehre believes the return of strike partner Michael Ricketts could be the crucial factor that leads to a turnaround in Walsall's form.
"/sdd/edimar/Desktop/doutorado/doutorado04/bases/WEIR/soccer/www.teamtalk.com/1776_9135.html",Liverpool captain Steven Gerrard returned to training with little fanfare on Wednesday as he seeks to turn his attention back to football.
"/sdd/edimar/Desktop/doutorado/doutorado04/bases/WEIR/soccer/www.teamtalk.com/2483_79266.html",Preston manager Alan Irvine has paid tribute to Ross Wallace after the midfielder committed his long-term future to the Lancashire club.
"/sdd/edimar/Desktop/doutorado/doutorado04/bases/WEIR/soccer/www.teamtalk.com/2483_6578.html","Newcastle winger Damien Duff has admitted he ""would 'love"" to see Joe Kinnear handed the Magpies managerial job on a permanent basis."
"/sdd/edimar/Desktop/doutorado/doutorado04/bases/WEIR/soccer/www.teamtalk.com/1910_6583.html",Charlton winger Keith Gillespie is excited about the prospect of playing football on a Saturday afternoon instead of watching it on TV.
"/sdd/edimar/Desktop/doutorado/doutorado04/bases/WEIR/soccer/www.teamtalk.com/2483_132102.html",Sporting Lisbon have warned the Premier League suitors of Joao Moutinho or Miguel Veloso that they have no intention of selling the pair.
"/sdd/edimar/Desktop/doutorado/doutorado04/bases/WEIR/soccer/www.teamtalk.com/1806_8842.html",Sydney FC have quelled rumours they are preparing a move to bring Dwight Yorke back to the club from Sunderland in January.
"/sdd/edimar/Desktop/doutorado/doutorado04/bases/WEIR/soccer/www.teamtalk.com/1908_9128.html","Jose Mourinho has rejected speculation Inter Milan may move for Michael Owen, insisting the Newcastle star is no longer the player he once was."
"/sdd/edimar/Desktop/doutorado/doutorado04/bases/WEIR/soccer/www.teamtalk.com/2483_9192.html","Shaun Wright-Phillips ""learned plenty"" from his time at Chelsea under three different managers, declaring himself ""wiser"" for the experience."
"/sdd/edimar/Desktop/doutorado/doutorado04/bases/WEIR/soccer/www.teamtalk.com/1778_104399.html",Burnley winger Chris Eagles admits he can hardly wait to face his boyhood idols Tottenham in the Carling Cup semi-finals.
"/sdd/edimar/Desktop/doutorado/doutorado04/bases/WEIR/soccer/www.teamtalk.com/1843_50042.html",On-loan Southend United striker Richie Foran is confident he can resurrect his career at League Two table toppers Darlington.
"/sdd/edimar/Desktop/doutorado/doutorado04/bases/WEIR/soccer/www.teamtalk.com/2483_73279.html",Hull City goalkeeper Boaz Myhill believes his international experiences with Wales have helped him improve as a player.
"/sdd/edimar/Desktop/doutorado/doutorado04/bases/WEIR/soccer/www.teamtalk.com/1773_92665.html",Chelsea midfielder Frank Lampard believes axed striker Didier Drogba should stay and fight for his place at Stamford Bridge.
"/sdd/edimar/Desktop/doutorado/doutorado04/bases/WEIR/soccer/www.teamtalk.com/2483_104383.html",Arsenal midfielder Cesc Fabregas has confirmed he will not undergo surgery on the damaged knee which will rule him out for four months.
"/sdd/edimar/Desktop/doutorado/doutorado04/bases/WEIR/soccer/www.teamtalk.com/2483_141141.html",Tony Mowbray has backed Borja Valero to become a West Brom star after watching his club-record signing make an impressive Premier League debut.
"/sdd/edimar/Desktop/doutorado/doutorado04/bases/WEIR/soccer/www.teamtalk.com/1873_124173.html",DaMarcus Beasley could return to the Rangers side for Saturday's clash with Hearts at Ibrox after recovering from injury.
"/sdd/edimar/Desktop/doutorado/doutorado04/bases/WEIR/soccer/www.teamtalk.com/1806_128939.html",Sunderland boss Roy Keane has blasted Premier League new boys Stoke over their 'bloody disgraceful' treatment of goalkeeper Marton Fulop.
"/sdd/edimar/Desktop/doutorado/doutorado04/bases/WEIR/soccer/www.teamtalk.com/2483_125724.html",Zenit St Petersburg will meet with Arsenal officials on Tuesday as the two clubs look to strike an agreement over Andrei Arshavin.
"/sdd/edimar/Desktop/doutorado/doutorado04/bases/WEIR/soccer/www.teamtalk.com/1780_140409.html",Newcastle star Jonas Gutierrez is hoping to make his return from injury on Monday in the Premier League clash at home to Manchester City.
"/sdd/edimar/Desktop/doutorado/doutorado04/bases/WEIR/soccer/www.teamtalk.com/1814_9003.html",Bournemouth skipper Darren Anderton has backed the Cherries to build on their goalless draw with Rotherham last Saturday.
"/sdd/edimar/Desktop/doutorado/doutorado04/bases/WEIR/soccer/www.teamtalk.com/1785_6688.html",Peter Grant has revealed West Brom have decided not to opt for immediate surgery for Neil Clement as he battles his most recent injury.
"/sdd/edimar/Desktop/doutorado/doutorado04/bases/WEIR/soccer/www.teamtalk.com/2483_147259.html",Wales goalkeeper Wayne Hennessey is hoping to be given a chance to impress against Denmark in order to help him regain his place at Wolves.
"/sdd/edimar/Desktop/doutorado/doutorado04/bases/WEIR/soccer/www.teamtalk.com/1816_73284.html",Former Barnet midfielder Charlie Oatway insists he bears no grudge against Marcus Bean after a tackle which resulted in him breaking his leg.
"/sdd/edimar/Desktop/doutorado/doutorado04/bases/WEIR/soccer/www.teamtalk.com/1806_22108.html",Andy Reid believes Premier League strugglers Sunderland must adopt a siege mentality if they are to shake off their shackles.
"/sdd/edimar/Desktop/doutorado/doutorado04/bases/WEIR/soccer/www.teamtalk.com/1825_114130.html",Plymouth Argyle manager Paul Sturrock is keeping a close eye on the progress of winger Jason Puncheon during his loan spell at MK Dons.
"/sdd/edimar/Desktop/doutorado/doutorado04/bases/WEIR/soccer/www.teamtalk.com/1867_100682.html",Hearts defender Christos Karipidis says the Gorgie faithful will watch a different brand of football this season under new boss Csaba Laszlo.
"/sdd/edimar/Desktop/doutorado/doutorado04/bases/WEIR/soccer/www.teamtalk.com/2483_97101.html",Porto winger Ricardo Quaresma is set to put pen to paper on a five-year deal at Inter Milan after the two clubs came to an agreement on Sunday.
"/sdd/edimar/Desktop/doutorado/doutorado04/bases/WEIR/soccer/www.teamtalk.com/2483_115281.html",Middlesbrough boss Gareth Southgate has laughed off suggestions that Chelsea could get their hands on striker Tuncay Sanli for £8million.
"/sdd/edimar/Desktop/doutorado/doutorado04/bases/WEIR/soccer/www.teamtalk.com/1846_46504.html",Shrewsbury boss Paul Simpson is keen to keep Sean Thornton at the club - but warns financial constraints could scupper a possible deal.
"/sdd/edimar/Desktop/doutorado/doutorado04/bases/WEIR/soccer/www.teamtalk.com/2483_97163.html",Newcastle striker Obafemi Martins is in danger of being forced to sit out the Magpies' busy Christmas Premier League schedule.
"/sdd/edimar/Desktop/doutorado/doutorado04/bases/WEIR/soccer/www.teamtalk.com/2483_95025.html",Georgios Samaras admits giving Irish ace Cillian Sheridan a striking masterclass may have made winning his Celtic place back even harder.
"/sdd/edimar/Desktop/doutorado/doutorado04/bases/WEIR/soccer/www.teamtalk.com/2483_77727.html",Hull defender Anthony Gardner is expected to miss the Tigers' next two games before being ready to make his Premier League comeback.
"/sdd/edimar/Desktop/doutorado/doutorado04/bases/WEIR/soccer/www.teamtalk.com/2483_94592.html",Manchester United winger Cristiano Ronaldo has already set his sights on being named the best player in the world again next year.
"/sdd/edimar/Desktop/doutorado/doutorado04/bases/WEIR/soccer/www.teamtalk.com/2483_6602.html",Portsmouth goalkeeper David James has admitted he has never known a stranger January transfer window - but is hoping for some new arrivals.
"/sdd/edimar/Desktop/doutorado/doutorado04/bases/WEIR/soccer/www.teamtalk.com/1815_95941.html",Striker Michael Boulding rates Bradford City wingers Joe Colbeck and Omar Daley as the fastest two players he has seen.
"/sdd/edimar/Desktop/doutorado/doutorado04/bases/WEIR/soccer/www.teamtalk.com/2483_88581.html",Justin Hoyte believes Middlesbrough's defence holds the key to their chances of earning a shock result in Saturday's home clash with Chelsea.
"/sdd/edimar/Desktop/doutorado/doutorado04/bases/WEIR/soccer/www.teamtalk.com/1809_9126.html",Wigan do not expect striker Emile Heskey to leave in the transfer window after claiming the player pledged to stay until at least the summer.
"/sdd/edimar/Desktop/doutorado/doutorado04/bases/WEIR/soccer/www.teamtalk.com/1914_72305.html",Motherwell striker David Clarkson can scarcely believe he is about to make his European debut after coming through difficult times at Fir Park.
"/sdd/edimar/Desktop/doutorado/doutorado04/bases/WEIR/soccer/www.teamtalk.com/1782_9000.html",Portsmouth defender Sol Campbell fears behind-the-scenes issues could impact on the second half of Pompey's Premier League season.
"/sdd/edimar/Desktop/doutorado/doutorado04/bases/WEIR/soccer/www.teamtalk.com/1916_9035.html","Fulham midfielder Simon Davies has been named as Wales Footballer of the Year, with Tottenham's Chris Gunter taking the Young Player gong."
"/sdd/edimar/Desktop/doutorado/doutorado04/bases/WEIR/soccer/www.teamtalk.com/2483_94972.html",Glenn Loovens will not over-burden himself with history as Celtic look for an elusive away win at Villarreal in the Champions League next week.
"/sdd/edimar/Desktop/doutorado/doutorado04/bases/WEIR/soccer/www.teamtalk.com/2483_126151.html",Newcastle boss Joe Kinnear has hit out at fresh speculation that several of his key players are up for grabs during the transfer window.
"/sdd/edimar/Desktop/doutorado/doutorado04/bases/WEIR/soccer/www.teamtalk.com/1863_55172.html",Glenn Roeder admits his last-minute attempts to lure Pat McCourt to Carrow Road were doomed to fail after Celtic expressed their interest.
"/sdd/edimar/Desktop/doutorado/doutorado04/bases/WEIR/soccer/www.teamtalk.com/1778_80808.html",Manchester United goalkeeper Ben Foster is keen to follow the lead of Rafael and break into the Red Devils first team on a permanent basis.
"/sdd/edimar/Desktop/doutorado/doutorado04/bases/WEIR/soccer/www.teamtalk.com/1782_8717.html",Peter Crouch believes his Portsmouth partnership with Jermain Defoe can thrive with England if the duo are chosen for the World Cup qualifiers.
"/sdd/edimar/Desktop/doutorado/doutorado04/bases/WEIR/soccer/www.teamtalk.com/1820_9191.html",James Coppinger is backing Doncaster to continue their good form after Rovers registered consecutive wins for the first time this season.
"/sdd/edimar/Desktop/doutorado/doutorado04/bases/WEIR/soccer/www.teamtalk.com/2483_92088.html",Germany coach Joachim Low has warned Michael Ballack of the 'consequences' should he again voice his views of the national team to the media.
"/sdd/edimar/Desktop/doutorado/doutorado04/bases/WEIR/soccer/www.teamtalk.com/2483_8862.html",Chelsea midfielder Frank Lampard believes axed striker Didier Drogba should stay and fight for his place at Stamford Bridge.
"/sdd/edimar/Desktop/doutorado/doutorado04/bases/WEIR/soccer/www.teamtalk.com/1791_65948.html",Crewe Alexandra's on-loan striker Anthony Elding is relishing the chance to help Lincoln City push for promotion from League Two.
"/sdd/edimar/Desktop/doutorado/doutorado04/bases/WEIR/soccer/www.teamtalk.com/1796_131321.html",On-loan Blackpool striker DJ Campbell insists he never doubted his ability after joining the club on loan from League One leaders Leicester.
"/sdd/edimar/Desktop/doutorado/doutorado04/bases/WEIR/soccer/www.teamtalk.com/1823_7187.html","Hull striker Marlon King, on loan at the KC Stadium from Wigan, has been arrested after being accused of assaulting a woman in a bar."
"/sdd/edimar/Desktop/doutorado/doutorado04/bases/WEIR/soccer/www.teamtalk.com/1802_132292.html",Reading midfielder Kalifa Cisse believes his strike in the 4-1 win against Bristol City at the weekend was the best goal of his career.
"/sdd/edimar/Desktop/doutorado/doutorado04/bases/WEIR/soccer/www.teamtalk.com/2483_68918.html",Manchester United striker Wayne Rooney believes the Red Devils are well placed in a three-horse race for the Premier League title.
