URL,EXTRACTED VALUE
"/sdd/edimar/Desktop/doutorado/doutorado04/bases/WEIR/soccer/www.teamtalk.com/1816_135755.html",Brentford boss Andy Scott admits that any deal to sign on-loan Alan Bennett will depend on the amount of money made available in January.
"/sdd/edimar/Desktop/doutorado/doutorado04/bases/WEIR/soccer/www.teamtalk.com/1912_9070.html","Hull City have completed the signing of winger Kevin Kilbane from Wigan for an undisclosed fee, handing him a two-and-a-half-year contract."
"/sdd/edimar/Desktop/doutorado/doutorado04/bases/WEIR/soccer/www.teamtalk.com/2483_9000.html",Portsmouth defender Sol Campbell fears behind-the-scenes issues could impact on the second half of Pompey's Premier League season.
"/sdd/edimar/Desktop/doutorado/doutorado04/bases/WEIR/soccer/www.teamtalk.com/2483_81483.html",Portsmouth boss Tony Adams has reportedly made Newcastle midfielder Joey Barton his top target in the January transfer window.
"/sdd/edimar/Desktop/doutorado/doutorado04/bases/WEIR/soccer/www.teamtalk.com/1776_90026.html",Liverpool midfielder Xabi Alonso has insisted that the Reds are enjoying the pressure of the title race as they go head to head with Chelsea.
"/sdd/edimar/Desktop/doutorado/doutorado04/bases/WEIR/soccer/www.teamtalk.com/1847_9062.html",Lincoln boss Peter Jackson refused to blame injuries to key duo Frank Sinclair and Stefan Oakes for Saturday's 3-1 home loss to Dagenham.
"/sdd/edimar/Desktop/doutorado/doutorado04/bases/WEIR/soccer/www.teamtalk.com/2483_67903.html",West Ham frontman Carlton Cole has revealed his delight after signing a new five-year contract with the Premier League side.
"/sdd/edimar/Desktop/doutorado/doutorado04/bases/WEIR/soccer/www.teamtalk.com/1809_7097.html",Mario Melchiot believes Steve Bruce's will to win has helped Wigan forge a tough team spirit that will stand them in good stead this season.
"/sdd/edimar/Desktop/doutorado/doutorado04/bases/WEIR/soccer/www.teamtalk.com/1815_8511.html",Bradford boss Stuart McCall has snapped up his second signing in 24 hours after midfielder Paul McLaren signed a two-year deal.
"/sdd/edimar/Desktop/doutorado/doutorado04/bases/WEIR/soccer/www.teamtalk.com/1775_9223.html","Northern Ireland captain Aaron Hughes is adamant their World Cup qualifying hopes will remain alive, even if they lose to the Czech Republic."
"/sdd/edimar/Desktop/doutorado/doutorado04/bases/WEIR/soccer/www.teamtalk.com/1785_82927.html",Luke Moore believes he can deliver goals to help West Brom's bid for another 'great escape' if he is given an extended first-team run.
"/sdd/edimar/Desktop/doutorado/doutorado04/bases/WEIR/soccer/www.teamtalk.com/1813_6575.html",Blackpool manager Simon Grayson insists the Championship club is ready to step up contract talks with several of their players.
"/sdd/edimar/Desktop/doutorado/doutorado04/bases/WEIR/soccer/www.teamtalk.com/1860_20462.html",Yeovil are awaiting news of the condition of midfielder Darren Way after revealing he was involved in a car accident on Wednesday afternoon.
"/sdd/edimar/Desktop/doutorado/doutorado04/bases/WEIR/soccer/www.teamtalk.com/1814_38583.html",Bournemouth will complete the signing of defender Scott Guyett from Yeovil on a two-year contract on Friday.
"/sdd/edimar/Desktop/doutorado/doutorado04/bases/WEIR/soccer/www.teamtalk.com/2483_94812.html",Centre-back Jamie Carragher believes Liverpool are demonstrating the type of character needed to win the Premier League title.
"/sdd/edimar/Desktop/doutorado/doutorado04/bases/WEIR/soccer/www.teamtalk.com/1778_144290.html",Sir Alex Ferguson says Anderson can follow in the footsteps of Bryan Robson and Roy Keane to become the next Manchester United midfield legend.
"/sdd/edimar/Desktop/doutorado/doutorado04/bases/WEIR/soccer/www.teamtalk.com/2483_83047.html",David Bentley has hailed new boss Harry Redknapp as the king of communication and believes that is the reason behind Tottenham's revival.
"/sdd/edimar/Desktop/doutorado/doutorado04/bases/WEIR/soccer/www.teamtalk.com/1916_144695.html","Wales boss John Toshack saluted Gareth Bale despite his penalty miss against Russia, saying he ""showed his all-round ability"" in Moscow."
"/sdd/edimar/Desktop/doutorado/doutorado04/bases/WEIR/soccer/www.teamtalk.com/2483_29310.html","Darren Fletcher wants to stamp his authority on the Manchester United team this season, starting in Wednesday's Carling Cup tie at Derby."
"/sdd/edimar/Desktop/doutorado/doutorado04/bases/WEIR/soccer/www.teamtalk.com/2483_64071.html",Brazil-born Spain midfielder Marcos Senna has voiced his support for Nacho Novo in his bid to become a Scottish international.
"/sdd/edimar/Desktop/doutorado/doutorado04/bases/WEIR/soccer/www.teamtalk.com/2483_113176.html",Liverpool defender Daniel Agger hopes a new deal for him to stay at Anfield can be ironed out in the very near future.
"/sdd/edimar/Desktop/doutorado/doutorado04/bases/WEIR/soccer/www.teamtalk.com/1794_74376.html",Ipswich striker Jon Walters is determined to score the goals to help the club win promotion from the Championship back into the top flight.
"/sdd/edimar/Desktop/doutorado/doutorado04/bases/WEIR/soccer/www.teamtalk.com/2483_15875.html","Liverpool manager Rafael Benitez is ""very close"" to sealing a new contract extension with the Reds, according to chief executive Rick Parry."
"/sdd/edimar/Desktop/doutorado/doutorado04/bases/WEIR/soccer/www.teamtalk.com/2483_149259.html",Michael Johnson hopes to be fit for Monday's trip to Newcastle but admits his injury problems could be jeopardising his Manchester City future.
"/sdd/edimar/Desktop/doutorado/doutorado04/bases/WEIR/soccer/www.teamtalk.com/1827_6724.html",Peterborough chairman Darragh MacAnthony has revealed that he received abuse from Posh fans over the decision to release Micah Hyde.
"/sdd/edimar/Desktop/doutorado/doutorado04/bases/WEIR/soccer/www.teamtalk.com/1820_6806.html",Doncaster Rovers manager Sean O'Driscoll expects all five of his out-of-contract players to agree improved deals at the Keepmoat Stadium.
"/sdd/edimar/Desktop/doutorado/doutorado04/bases/WEIR/soccer/www.teamtalk.com/1863_9621.html",Paul Hartley has backed Celtic to finally overcome their travel sickness in the Champions League when they face Aalborg next week.
"/sdd/edimar/Desktop/doutorado/doutorado04/bases/WEIR/soccer/www.teamtalk.com/1765_92389.html",Dimitar Berbatov has declared his confidence that he and his fellow strikers can fire Manchester United to the Premier League title this year.
"/sdd/edimar/Desktop/doutorado/doutorado04/bases/WEIR/soccer/www.teamtalk.com/1815_7566.html",Chris Brandon must endure another two weeks on the sidelines before he can be in contention to make his long-awaited Bradford debut.
"/sdd/edimar/Desktop/doutorado/doutorado04/bases/WEIR/soccer/www.teamtalk.com/1802_8153.html",Reading defender Chris Armstrong has revealed that he nearly quit the game during his lengthy battle with a knee problem.
"/sdd/edimar/Desktop/doutorado/doutorado04/bases/WEIR/soccer/www.teamtalk.com/2483_98687.html",Chelsea midfielder Claude Makelele is reportedly due to undergo a medical at Ligue 1 side Paris St Germain on Saturday.
"/sdd/edimar/Desktop/doutorado/doutorado04/bases/WEIR/soccer/www.teamtalk.com/1839_73797.html","Bury director Ian Harrop says the club have received no bids for Andy Bishop, despite speculation linking with a move away from the club."
"/sdd/edimar/Desktop/doutorado/doutorado04/bases/WEIR/soccer/www.teamtalk.com/1862_66143.html","Darlington manager Dave Penney is threatening to ""knock on the head"" striker Tommy Wright's proposed move to Scottish giants Aberdeen."
"/sdd/edimar/Desktop/doutorado/doutorado04/bases/WEIR/soccer/www.teamtalk.com/2483_92665.html",Chelsea midfielder Frank Lampard believes axed striker Didier Drogba should stay and fight for his place at Stamford Bridge.
"/sdd/edimar/Desktop/doutorado/doutorado04/bases/WEIR/soccer/www.teamtalk.com/2483_7213.html","Chris Kirkland believes referee Alan Wiley should admit that he made a mistake in sending off Antonio Valencia, who 'did nothing wrong'."
"/sdd/edimar/Desktop/doutorado/doutorado04/bases/WEIR/soccer/www.teamtalk.com/2483_97248.html","West Ham, Portsmouth and Arsenal are all reported to be considering a free transfer swoop for in-demand Ghanaian midfielder Stephen Appiah."
"/sdd/edimar/Desktop/doutorado/doutorado04/bases/WEIR/soccer/www.teamtalk.com/2483_6913.html",Hull City's veteran striker Dean Windass has decided to join League One outfit Oldham on loan until the end of the season.
"/sdd/edimar/Desktop/doutorado/doutorado04/bases/WEIR/soccer/www.teamtalk.com/2483_144044.html",David Moyes pleaded with Everton supporters to be patient with new signings Marouane Fellaini and Segundo Castillo after the 3-2 win at Stoke.
"/sdd/edimar/Desktop/doutorado/doutorado04/bases/WEIR/soccer/www.teamtalk.com/1797_7432.html",Millwall defender Danny Senda has suffered a slight setback in his bid to recover from a long-term knee injury just as he was set for a return.
"/sdd/edimar/Desktop/doutorado/doutorado04/bases/WEIR/soccer/www.teamtalk.com/2483_139386.html",Aston Villa striker Gabriel Agbonlahor has set his sights on pulling off a top-class double against Arsenal at Villa Park.
"/sdd/edimar/Desktop/doutorado/doutorado04/bases/WEIR/soccer/www.teamtalk.com/1784_26970.html","Jermaine Jenas admits Tottenham still have work to do to climb out of trouble, but believes Harry Redknapp is the manager to lift the team."
"/sdd/edimar/Desktop/doutorado/doutorado04/bases/WEIR/soccer/www.teamtalk.com/1912_6968.html",Goalkeeper Dean Kiely has returned to the international stage and warned people not to pay too much attention to his birth certificate.
"/sdd/edimar/Desktop/doutorado/doutorado04/bases/WEIR/soccer/www.teamtalk.com/2483_125657.html",Reading director of football Nick Hammond insists the club have yet to receive any offers for long-term Everton target Stephen Hunt.
"/sdd/edimar/Desktop/doutorado/doutorado04/bases/WEIR/soccer/www.teamtalk.com/2483_126064.html",Robinho believes Manchester City's inconsistent form may be partly down to the threat of the axe hanging over several of the club's players.
"/sdd/edimar/Desktop/doutorado/doutorado04/bases/WEIR/soccer/www.teamtalk.com/1914_72264.html",Kirk Broadfoot believes Rangers team-mate Kevin Thomson has the strength of character to return from his latest injury stronger than before.
"/sdd/edimar/Desktop/doutorado/doutorado04/bases/WEIR/soccer/www.teamtalk.com/2483_9126.html",Wigan do not expect striker Emile Heskey to leave in the transfer window after claiming the player pledged to stay until at least the summer.
"/sdd/edimar/Desktop/doutorado/doutorado04/bases/WEIR/soccer/www.teamtalk.com/2483_164721.html",Manchester United have been boosted by the news that Rodrigo Possebon did not get his leg broken by Middlesbrough captain Emanuel Pogatetz.
"/sdd/edimar/Desktop/doutorado/doutorado04/bases/WEIR/soccer/www.teamtalk.com/1785_100227.html","Robert Koren insists the confidence of the West Brom players remains high despite three defeats, which have seen them plummet down the table."
"/sdd/edimar/Desktop/doutorado/doutorado04/bases/WEIR/soccer/www.teamtalk.com/1859_8755.html","Striker Scott McGleish, who is on loan at Northampton Town from Wycombe Wanderers, has admitted that he is planning for life after football."
"/sdd/edimar/Desktop/doutorado/doutorado04/bases/WEIR/soccer/www.teamtalk.com/1785_6968.html",Goalkeeper Dean Kiely has returned to the international stage and warned people not to pay too much attention to his birth certificate.
"/sdd/edimar/Desktop/doutorado/doutorado04/bases/WEIR/soccer/www.teamtalk.com/2483_99315.html",Chelsea playmaker Deco has stuck up for Luiz Felipe Scolari and revealed his confidence that the Blues will finish the season as champions.
"/sdd/edimar/Desktop/doutorado/doutorado04/bases/WEIR/soccer/www.teamtalk.com/1784_9032.html","Tottenham captain Ledley King has warned his team-mates they must ""stand up and fight for each other"" if they want to stay up this season."
"/sdd/edimar/Desktop/doutorado/doutorado04/bases/WEIR/soccer/www.teamtalk.com/1850_7256.html",Northampton captain Chris Doig has stepped up his comeback from injury by completing 90 minutes for the League One club's reserves.
"/sdd/edimar/Desktop/doutorado/doutorado04/bases/WEIR/soccer/www.teamtalk.com/2483_3565.html","Derby manager Paul Jewell believes the decision to send Alan Stubbs for knee surgery now, rather than in the close season, will be vindicated."
"/sdd/edimar/Desktop/doutorado/doutorado04/bases/WEIR/soccer/www.teamtalk.com/1809_56510.html",Wigan defender Ryan Taylor may not even have the support of his own family for Monday night's clash with Everton at the JJB Stadium.
"/sdd/edimar/Desktop/doutorado/doutorado04/bases/WEIR/soccer/www.teamtalk.com/2483_7024.html","Eidur Gudjohnsen's agent has played down reports linking the Barcelona star to Aston Villa, saying 'he'd prefer to go to London or Manchester'."
"/sdd/edimar/Desktop/doutorado/doutorado04/bases/WEIR/soccer/www.teamtalk.com/1816_6972.html",Brentford have completed their eighth signing of pre-season with forward Charlie MacDonald joining from Southend for an undisclosed fee.
"/sdd/edimar/Desktop/doutorado/doutorado04/bases/WEIR/soccer/www.teamtalk.com/1800_3584.html",Preston boss Alan Irvine insists the injuries which have affected his preparations for the new season are only minor niggles.
"/sdd/edimar/Desktop/doutorado/doutorado04/bases/WEIR/soccer/www.teamtalk.com/1916_150487.html",Wolves striker Sam Vokes insists he will continue to take any chances that come his way after an impressive brace against Charlton on Saturday.
"/sdd/edimar/Desktop/doutorado/doutorado04/bases/WEIR/soccer/www.teamtalk.com/2483_93341.html",West Brom's Gianni Zuiverloon is expected to shake off a minor knock picked up at Old Trafford in time to feature against Hull on Saturday.
"/sdd/edimar/Desktop/doutorado/doutorado04/bases/WEIR/soccer/www.teamtalk.com/1785_99226.html",Jonathan Greening and Scott Carson are hoping West Brom striker Luke Moore can fill the void in the team left by the injured Ishmael Miller.
"/sdd/edimar/Desktop/doutorado/doutorado04/bases/WEIR/soccer/www.teamtalk.com/1800_28907.html",Northampton boss Stuart Gray admits he will have one eye on Preston's results this month after extending Karl Hawley's loan for a second month.
"/sdd/edimar/Desktop/doutorado/doutorado04/bases/WEIR/soccer/www.teamtalk.com/1910_17946.html",Sunderland striker David Healy hopes his side's new manager will give him the chance to finally prove himself worthy of a Premier League place.
"/sdd/edimar/Desktop/doutorado/doutorado04/bases/WEIR/soccer/www.teamtalk.com/1873_142946.html",Rangers defender Madjid Bougherra has vowed to resist any offers of a move away from the club in the January transfer window.
"/sdd/edimar/Desktop/doutorado/doutorado04/bases/WEIR/soccer/www.teamtalk.com/1767_18342.html","Martin O'Neill has hailed the career of Aston Villa goalkeeper Brad Friedel, who will become a Premier League record-breaker on Saturday."
"/sdd/edimar/Desktop/doutorado/doutorado04/bases/WEIR/soccer/www.teamtalk.com/1778_8831.html","Sir Alex Ferguson will offer new Manchester Unites deals to Gary Neville and Park Ji-sung, but has ""no idea"" what will happen to Carlos Tevez."
"/sdd/edimar/Desktop/doutorado/doutorado04/bases/WEIR/soccer/www.teamtalk.com/2483_94454.html",Park Ji-sung is confident Manchester United will win the Premier League and Champions League again despite a shaky start to the season.
"/sdd/edimar/Desktop/doutorado/doutorado04/bases/WEIR/soccer/www.teamtalk.com/1807_77688.html",Watford boss Adrian Boothroyd has called for his lacklustre strikeforce to raise their game ahead of the League opener against Crystal Palace.
"/sdd/edimar/Desktop/doutorado/doutorado04/bases/WEIR/soccer/www.teamtalk.com/1834_6819.html",Walsall goalkeeper Clayton Ince is urging his team-mates to take lessons in how to defend a lead from the Premier League's top sides.
"/sdd/edimar/Desktop/doutorado/doutorado04/bases/WEIR/soccer/www.teamtalk.com/1794_9028.html",Ipswich manager Jim Magilton has admitted he is prepared to drop Richard Wright after the former England goalkeeper's indifferent run of form.
"/sdd/edimar/Desktop/doutorado/doutorado04/bases/WEIR/soccer/www.teamtalk.com/1873_47340.html",Deportivo La Coruna could table an offer for Nacho Novo in the January transfer window after confirming their interest in the Rangers striker.
"/sdd/edimar/Desktop/doutorado/doutorado04/bases/WEIR/soccer/www.teamtalk.com/2483_6570.html","Gareth Barry believes Aston Villa are in a ""perfect position"" to maintain their push for a Champions League spot during the rest of the season."
"/sdd/edimar/Desktop/doutorado/doutorado04/bases/WEIR/soccer/www.teamtalk.com/2483_8717.html",Peter Crouch believes his Portsmouth partnership with Jermain Defoe can thrive with England if the duo are chosen for the World Cup qualifiers.
"/sdd/edimar/Desktop/doutorado/doutorado04/bases/WEIR/soccer/www.teamtalk.com/982_105213.html","Leeds have beaten a host of clubs to land highly-rated Livingston striker Robert Snodgrass, who has signed a three-year deal at Elland Road."
"/sdd/edimar/Desktop/doutorado/doutorado04/bases/WEIR/soccer/www.teamtalk.com/1778_92501.html",Manchester United's old guard may not be as prominant as they once were but Patrice Evra insists they remain the heartbeat of Old Trafford.
"/sdd/edimar/Desktop/doutorado/doutorado04/bases/WEIR/soccer/www.teamtalk.com/1857_154098.html",Southend manager Steve Tilson has revealed he expects to complete a deal for Portsmouth's Jean-Francois Christophe by the end of the week.
"/sdd/edimar/Desktop/doutorado/doutorado04/bases/WEIR/soccer/www.teamtalk.com/1808_7228.html",Birmingham manager Alex McLeish has extended midfielder Nigel Quashie's loan deal from West Ham into a third and final month.
"/sdd/edimar/Desktop/doutorado/doutorado04/bases/WEIR/soccer/www.teamtalk.com/1769_6579.html",Blackburn boss Paul Ince's plans for Saturday's visit of Fulham have been rocked by the news David Dunn faces four months on the sidelines.
"/sdd/edimar/Desktop/doutorado/doutorado04/bases/WEIR/soccer/www.teamtalk.com/1848_13201.html",Macclesfield Town midfielder Terry Dunfield admits he is proud to skipper Keith Alexander's promising young Silkmen side.
"/sdd/edimar/Desktop/doutorado/doutorado04/bases/WEIR/soccer/www.teamtalk.com/2483_8837.html",Manchester United's Paul Scholes has admitted he would rather be back home than halfway around the world competing for the World Club Cup.
"/sdd/edimar/Desktop/doutorado/doutorado04/bases/WEIR/soccer/www.teamtalk.com/1770_9092.html",Midfielder Gavin McCann believes Bolton's win over West Ham is the perfect preparation for the club's upcoming derby against Blackburn.
"/sdd/edimar/Desktop/doutorado/doutorado04/bases/WEIR/soccer/www.teamtalk.com/2483_156601.html",Wigan boss Steve Bruce has revealed that another club - believed to be Manchester City - have joined Tottenham in the race for Wilson Palacios.
"/sdd/edimar/Desktop/doutorado/doutorado04/bases/WEIR/soccer/www.teamtalk.com/1780_9128.html","Jose Mourinho has rejected speculation Inter Milan may move for Michael Owen, insisting the Newcastle star is no longer the player he once was."
"/sdd/edimar/Desktop/doutorado/doutorado04/bases/WEIR/soccer/www.teamtalk.com/1767_80542.html",Aston Villa winger James Milner is hoping to go on a goalscoring run following his double against Gillingham in the FA Cup.
"/sdd/edimar/Desktop/doutorado/doutorado04/bases/WEIR/soccer/www.teamtalk.com/2483_26970.html","Jermaine Jenas admits Tottenham still have work to do to climb out of trouble, but believes Harry Redknapp is the manager to lift the team."
"/sdd/edimar/Desktop/doutorado/doutorado04/bases/WEIR/soccer/www.teamtalk.com/1768_38981.html",Striker Garry O'Connor has had to pull out of Scotland's squad for their forthcoming World Cup qualifiers due to injury.
"/sdd/edimar/Desktop/doutorado/doutorado04/bases/WEIR/soccer/www.teamtalk.com/2483_8726.html",Fulham boss Roy Hodgson has given his backing to strike duo Andrew Johnson and Bobby Zamora and believes the pair will come good.
"/sdd/edimar/Desktop/doutorado/doutorado04/bases/WEIR/soccer/www.teamtalk.com/1863_3638.html",John Kennedy's hopes of a Scotland call-up to face Norway have been dashed after he was ruled out for up to a month through injury.
"/sdd/edimar/Desktop/doutorado/doutorado04/bases/WEIR/soccer/www.teamtalk.com/1773_8867.html",Chelsea manager Luiz Felipe Scolari has told Tottenham Hotspur to forget any plans to sign England midfielder Joe Cole.
"/sdd/edimar/Desktop/doutorado/doutorado04/bases/WEIR/soccer/www.teamtalk.com/1776_127377.html",Alvaro Arbeloa believes Liverpool can pick themselves up from another disappointing result at Anfield when they travel to Arsenal on Sunday.
"/sdd/edimar/Desktop/doutorado/doutorado04/bases/WEIR/soccer/www.teamtalk.com/1873_9709.html",He already has his Rangers place back - now goalkeeper Neil Alexander is after Allan McGregor's spot in the Scotland squad.
"/sdd/edimar/Desktop/doutorado/doutorado04/bases/WEIR/soccer/www.teamtalk.com/1873_66725.html",Rangers winger Chris Burke is understood to be having a medical with Cardiff on Thursday as he looks to tie up a move from the Glasgow giants.
"/sdd/edimar/Desktop/doutorado/doutorado04/bases/WEIR/soccer/www.teamtalk.com/5649_147493.html",Sunderland misfit Arnau Riera could be heading for Blackpool after failing to persuade manager Roy Keane he has a part to play on Wearside.
"/sdd/edimar/Desktop/doutorado/doutorado04/bases/WEIR/soccer/www.teamtalk.com/2483_66442.html",Michael Dawson believes Heurelho Gomes has repaid the faith of his Tottenham team-mates to prove he can cut it in the Premier League.
"/sdd/edimar/Desktop/doutorado/doutorado04/bases/WEIR/soccer/www.teamtalk.com/1768_6904.html",Marcus Bent admits he snubbed a move to Cardiff in favour of a last-gasp switch to Birmingham as Blues have a 'better chance of promotion'.
"/sdd/edimar/Desktop/doutorado/doutorado04/bases/WEIR/soccer/www.teamtalk.com/1775_126541.html",Summer signing John Pantsil has urged Fulham's fans to carry the passion and intensity of their home support onto the road this season.
"/sdd/edimar/Desktop/doutorado/doutorado04/bases/WEIR/soccer/www.teamtalk.com/1784_146948.html","Spurs defender Vedran Corluka has put his faith in Juande Ramos, but concedes international duty has given him a break from his club troubles."
"/sdd/edimar/Desktop/doutorado/doutorado04/bases/WEIR/soccer/www.teamtalk.com/1776_97016.html",Liverpool's Jose Reina is adamant there is no problem with racism in Spain as the Reds prepare to face Atletico Madrid in the Champions League.
"/sdd/edimar/Desktop/doutorado/doutorado04/bases/WEIR/soccer/www.teamtalk.com/1826_9275.html",Oldham goalkeeper Mark Crossley needs a back operation which will rule him out for the League One club until March next year.
"/sdd/edimar/Desktop/doutorado/doutorado04/bases/WEIR/soccer/www.teamtalk.com/5649_93472.html",Crystal Palace goalkeeper Scott Flinders could be set to extend his loan deal at Falkirk until the end of the season.
"/sdd/edimar/Desktop/doutorado/doutorado04/bases/WEIR/soccer/www.teamtalk.com/2483_147918.html",Liverpool boss Rafael Benitez has admitted that he turned down the chance to sign Atletico Madrid hot-shot Sergio Aguero.
"/sdd/edimar/Desktop/doutorado/doutorado04/bases/WEIR/soccer/www.teamtalk.com/2483_153302.html",Sir Alex Ferguson admits he could recall Fraizer Campbell from his loan at Tottenham in January - but will not let Danny Welbeck leave on loan.
"/sdd/edimar/Desktop/doutorado/doutorado04/bases/WEIR/soccer/www.teamtalk.com/2483_9223.html","Northern Ireland captain Aaron Hughes is adamant their World Cup qualifying hopes will remain alive, even if they lose to the Czech Republic."
"/sdd/edimar/Desktop/doutorado/doutorado04/bases/WEIR/soccer/www.teamtalk.com/1805_9064.html",Stoke keeper Thomas Sorensen insists he never referred to title-chasing Arsenal as 'spineless' after their recent Premier League clash.
"/sdd/edimar/Desktop/doutorado/doutorado04/bases/WEIR/soccer/www.teamtalk.com/1830_149867.html",Stockport County have completed a deal to bring Wolves midfielder Stephen Gleeson back to Edgeley Park on a six-month loan.
"/sdd/edimar/Desktop/doutorado/doutorado04/bases/WEIR/soccer/www.teamtalk.com/1807_7855.html",Watford midfielder Lee Williamson has revealed his disappointment at the performance of the side in their defeat to Sheffield Wednesday.
"/sdd/edimar/Desktop/doutorado/doutorado04/bases/WEIR/soccer/www.teamtalk.com/2483_9210.html",Newcastle boss Joe Kinnear does not believe there is any danger of Shay Given leaving this month following a meeting with the keeper on Friday.
"/sdd/edimar/Desktop/doutorado/doutorado04/bases/WEIR/soccer/www.teamtalk.com/2483_7078.html","Espanyol have ruled out selling Republic of Ireland right-back Steve Finnan in January, despite reported interest from Arsenal and Tottenham."
"/sdd/edimar/Desktop/doutorado/doutorado04/bases/WEIR/soccer/www.teamtalk.com/1804_6583.html",Charlton winger Keith Gillespie is excited about the prospect of playing football on a Saturday afternoon instead of watching it on TV.
"/sdd/edimar/Desktop/doutorado/doutorado04/bases/WEIR/soccer/www.teamtalk.com/1770_6674.html",Jussi Jaaskelainen reckons Bolton can challenge for a top-half spot in the Premier League this season following a relegation battle last term.
"/sdd/edimar/Desktop/doutorado/doutorado04/bases/WEIR/soccer/www.teamtalk.com/1873_3820.html",The SFA claim they wanted to keep Lee McCulloch's international retirement quiet until after the World Cup qualifiers in Macedonia and Iceland.
