URL,EXTRACTED VALUE
"/sdd/edimar/Desktop/doutorado/doutorado04/bases/WEIR/soccer/uk.eurosport.yahoo.com/ross-wallace.html",Keane prepares to trim Cats squad
"/sdd/edimar/Desktop/doutorado/doutorado04/bases/WEIR/soccer/uk.eurosport.yahoo.com/rio-ferdinand.html",Goal a dream come true for Upson
"/sdd/edimar/Desktop/doutorado/doutorado04/bases/WEIR/soccer/uk.eurosport.yahoo.com/marouane-chamakh.html",Champions League - Behind Enemy Lines
"/sdd/edimar/Desktop/doutorado/doutorado04/bases/WEIR/soccer/uk.eurosport.yahoo.com/david-wheater.html",Megson applauds Teessiders set-up
"/sdd/edimar/Desktop/doutorado/doutorado04/bases/WEIR/soccer/uk.eurosport.yahoo.com/stephen-bywater.html",Attwell angers Rams in derby draw
"/sdd/edimar/Desktop/doutorado/doutorado04/bases/WEIR/soccer/uk.eurosport.yahoo.com/dimitar-berbatov.html",Manchester United seek put-down for City upstarts
"/sdd/edimar/Desktop/doutorado/doutorado04/bases/WEIR/soccer/uk.eurosport.yahoo.com/joey-obrien.html",Trapattoni Wants A Happy Camp
"/sdd/edimar/Desktop/doutorado/doutorado04/bases/WEIR/soccer/uk.eurosport.yahoo.com/javier-garrido.html",City On The Up For Derby Date
"/sdd/edimar/Desktop/doutorado/doutorado04/bases/WEIR/soccer/uk.eurosport.yahoo.com/aaron-mokoena.html",Grieving McCarthy in SA squad
"/sdd/edimar/Desktop/doutorado/doutorado04/bases/WEIR/soccer/uk.eurosport.yahoo.com/ricardo-gardner.html",Premier League - Liverpool beat Bolton
"/sdd/edimar/Desktop/doutorado/doutorado04/bases/WEIR/soccer/uk.eurosport.yahoo.com/graeme-murty.html",Duberry in contention for Royals
"/sdd/edimar/Desktop/doutorado/doutorado04/bases/WEIR/soccer/uk.eurosport.yahoo.com/anthony-stokes.html","Irish, Scottish players eat 'rubbish', says Keane"
"/sdd/edimar/Desktop/doutorado/doutorado04/bases/WEIR/soccer/uk.eurosport.yahoo.com/david-villa.html",Warnock set to step in for Olsson
"/sdd/edimar/Desktop/doutorado/doutorado04/bases/WEIR/soccer/uk.eurosport.yahoo.com/dickson-etuhu.html",Duo in doubt for key Latics clash
"/sdd/edimar/Desktop/doutorado/doutorado04/bases/WEIR/soccer/uk.eurosport.yahoo.com/paul-konchesky.html",I have to stick with Gomes - Harry
"/sdd/edimar/Desktop/doutorado/doutorado04/bases/WEIR/soccer/uk.eurosport.yahoo.com/steven-davis.html",Worthy hails Taylor commitment
"/sdd/edimar/Desktop/doutorado/doutorado04/bases/WEIR/soccer/uk.eurosport.yahoo.com/jonathan-woodgate.html",UEFA Cup - King out for Tottenham
"/sdd/edimar/Desktop/doutorado/doutorado04/bases/WEIR/soccer/uk.eurosport.yahoo.com/joe-cole.html",Scolari feeling 'zero' pressure
"/sdd/edimar/Desktop/doutorado/doutorado04/bases/WEIR/soccer/uk.eurosport.yahoo.com/filippo-inzaghi.html",Adams Grizzly Over Sloppy Pompey
"/sdd/edimar/Desktop/doutorado/doutorado04/bases/WEIR/soccer/uk.eurosport.yahoo.com/owen-hargreaves.html",Capello not getting carried away
"/sdd/edimar/Desktop/doutorado/doutorado04/bases/WEIR/soccer/uk.eurosport.yahoo.com/wilson-palacios.html",Camara strike eases Wigan worries
"/sdd/edimar/Desktop/doutorado/doutorado04/bases/WEIR/soccer/uk.eurosport.yahoo.com/peter-halmosi.html",Brown: Tigers need more belief
"/sdd/edimar/Desktop/doutorado/doutorado04/bases/WEIR/soccer/uk.eurosport.yahoo.com/giles-barnes.html",Championship - Team news: Full programme
"/sdd/edimar/Desktop/doutorado/doutorado04/bases/WEIR/soccer/uk.eurosport.yahoo.com/john-carew.html",Villa ambitions frustrated by Fulham
"/sdd/edimar/Desktop/doutorado/doutorado04/bases/WEIR/soccer/uk.eurosport.yahoo.com/darren-fletcher.html",Evra Not Worried By City Wealth
"/sdd/edimar/Desktop/doutorado/doutorado04/bases/WEIR/soccer/uk.eurosport.yahoo.com/claude-makelele.html",Blues Ready To Prove Their Mettle
"/sdd/edimar/Desktop/doutorado/doutorado04/bases/WEIR/soccer/uk.eurosport.yahoo.com/sylvain-distin.html",Pompey foiled by Milan fightback
"/sdd/edimar/Desktop/doutorado/doutorado04/bases/WEIR/soccer/uk.eurosport.yahoo.com/mustapha-riga.html",Elmander poised for Whites return
"/sdd/edimar/Desktop/doutorado/doutorado04/bases/WEIR/soccer/uk.eurosport.yahoo.com/george-mccartney.html",Worthy hails Taylor commitment
"/sdd/edimar/Desktop/doutorado/doutorado04/bases/WEIR/soccer/uk.eurosport.yahoo.com/lee-bowyer.html",Hammers Stars Behind Zola
"/sdd/edimar/Desktop/doutorado/doutorado04/bases/WEIR/soccer/uk.eurosport.yahoo.com/stephen-warnock.html",Ince Unfazed By Mounting Pressure
"/sdd/edimar/Desktop/doutorado/doutorado04/bases/WEIR/soccer/uk.eurosport.yahoo.com/kevin-davies.html",Megson Keen To See New Faces
"/sdd/edimar/Desktop/doutorado/doutorado04/bases/WEIR/soccer/uk.eurosport.yahoo.com/david-healy.html",Healy keen to get more action
"/sdd/edimar/Desktop/doutorado/doutorado04/bases/WEIR/soccer/uk.eurosport.yahoo.com/robert-earnshaw.html",Garner grabs a point for Forest
"/sdd/edimar/Desktop/doutorado/doutorado04/bases/WEIR/soccer/uk.eurosport.yahoo.com/david-bentley.html",Spurs nick narrow victory over NEC
"/sdd/edimar/Desktop/doutorado/doutorado04/bases/WEIR/soccer/uk.eurosport.yahoo.com/matthew-upson.html",Hammers boss hails 'perfect' Upson
"/sdd/edimar/Desktop/doutorado/doutorado04/bases/WEIR/soccer/uk.eurosport.yahoo.com/branislav-ivanovic.html",Carling Cup - Burnley stun Chelsea in shoot-out
"/sdd/edimar/Desktop/doutorado/doutorado04/bases/WEIR/soccer/uk.eurosport.yahoo.com/antoine-sibierski.html",Canaries boss sweats on Sibierski
"/sdd/edimar/Desktop/doutorado/doutorado04/bases/WEIR/soccer/uk.eurosport.yahoo.com/ben-sahar.html",Blues boss backing for friendlies
"/sdd/edimar/Desktop/doutorado/doutorado04/bases/WEIR/soccer/uk.eurosport.yahoo.com/mario-melchiot.html",Friendly fire from Latics boss
"/sdd/edimar/Desktop/doutorado/doutorado04/bases/WEIR/soccer/uk.eurosport.yahoo.com/kim.html",Maradona secures debut win
"/sdd/edimar/Desktop/doutorado/doutorado04/bases/WEIR/soccer/uk.eurosport.yahoo.com/james-harper.html",Matejovsky ready for Royals return
"/sdd/edimar/Desktop/doutorado/doutorado04/bases/WEIR/soccer/uk.eurosport.yahoo.com/martin-petrov.html",Bolton trot into seventh after victory
"/sdd/edimar/Desktop/doutorado/doutorado04/bases/WEIR/soccer/uk.eurosport.yahoo.com/alan-smith.html",Duff and Ameobi missing for Magpies
"/sdd/edimar/Desktop/doutorado/doutorado04/bases/WEIR/soccer/uk.eurosport.yahoo.com/fredrik-stoor.html",World Cup qual. - Squads: Sweden lose Linderoth
"/sdd/edimar/Desktop/doutorado/doutorado04/bases/WEIR/soccer/uk.eurosport.yahoo.com/stephen-pearson.html",Kisnorbo still missing for Foxes
"/sdd/edimar/Desktop/doutorado/doutorado04/bases/WEIR/soccer/uk.eurosport.yahoo.com/julien-faubert.html",Premier League - Everton late show stuns Zola
"/sdd/edimar/Desktop/doutorado/doutorado04/bases/WEIR/soccer/uk.eurosport.yahoo.com/greg-halford.html",Halford nearly made Addicks switch
"/sdd/edimar/Desktop/doutorado/doutorado04/bases/WEIR/soccer/uk.eurosport.yahoo.com/jermain-defoe.html",Kaboul Stunned By Pompey Fans
"/sdd/edimar/Desktop/doutorado/doutorado04/bases/WEIR/soccer/uk.eurosport.yahoo.com/martin-laursen.html",Ferguson Tips Villa For Top Four
"/sdd/edimar/Desktop/doutorado/doutorado04/bases/WEIR/soccer/uk.eurosport.yahoo.com/ashley-young.html",Bolton trot into seventh after victory
"/sdd/edimar/Desktop/doutorado/doutorado04/bases/WEIR/soccer/uk.eurosport.yahoo.com/dean-leacock.html",Rams boss has a cunning plan
"/sdd/edimar/Desktop/doutorado/doutorado04/bases/WEIR/soccer/uk.eurosport.yahoo.com/william-gallas.html",Almunia eyeing Fab new Gunners era
"/sdd/edimar/Desktop/doutorado/doutorado04/bases/WEIR/soccer/uk.eurosport.yahoo.com/steven-pienaar.html",Moyes: Everton Need Star Quality
"/sdd/edimar/Desktop/doutorado/doutorado04/bases/WEIR/soccer/uk.eurosport.yahoo.com/james-mcfadden.html",Blues staying grounded - McLeish
"/sdd/edimar/Desktop/doutorado/doutorado04/bases/WEIR/soccer/uk.eurosport.yahoo.com/andreas-granqvist.html",World Cup qual. - Sweden name squad
"/sdd/edimar/Desktop/doutorado/doutorado04/bases/WEIR/soccer/uk.eurosport.yahoo.com/leon-osman.html",Pienaar strikes to earn Blues victory
"/sdd/edimar/Desktop/doutorado/doutorado04/bases/WEIR/soccer/uk.eurosport.yahoo.com/alberto-gilardino.html",Int Football - Italy name squad for Greece friendly
"/sdd/edimar/Desktop/doutorado/doutorado04/bases/WEIR/soccer/uk.eurosport.yahoo.com/francesco-totti.html",Liverpooland Atletico through to last 16
"/sdd/edimar/Desktop/doutorado/doutorado04/bases/WEIR/soccer/uk.eurosport.yahoo.com/ryan-giggs.html",Champions League - Evra hails former team-mate Rossi
"/sdd/edimar/Desktop/doutorado/doutorado04/bases/WEIR/soccer/uk.eurosport.yahoo.com/tim-howard.html",Camara strike eases Wigan worries
"/sdd/edimar/Desktop/doutorado/doutorado04/bases/WEIR/soccer/uk.eurosport.yahoo.com/claudio-cacapa.html",Injuries Hamper Kinnear Plans
"/sdd/edimar/Desktop/doutorado/doutorado04/bases/WEIR/soccer/uk.eurosport.yahoo.com/ledley-king.html",Harry still fond of deadly Yak
"/sdd/edimar/Desktop/doutorado/doutorado04/bases/WEIR/soccer/uk.eurosport.yahoo.com/xisco.html",Defensive dilemma for Bridge battle
"/sdd/edimar/Desktop/doutorado/doutorado04/bases/WEIR/soccer/uk.eurosport.yahoo.com/erik-edman.html",World Cup qual. - Squads: Sweden lose Linderoth
"/sdd/edimar/Desktop/doutorado/doutorado04/bases/WEIR/soccer/uk.eurosport.yahoo.com/nyron-nosworthy.html",Jones set to start at the Bridge
"/sdd/edimar/Desktop/doutorado/doutorado04/bases/WEIR/soccer/uk.eurosport.yahoo.com/leroy-lita.html",Lita up for Canaries stay
"/sdd/edimar/Desktop/doutorado/doutorado04/bases/WEIR/soccer/uk.eurosport.yahoo.com/alan-hutton.html",UEFA Cup - King out for Tottenham
"/sdd/edimar/Desktop/doutorado/doutorado04/bases/WEIR/soccer/uk.eurosport.yahoo.com/mikel-arteta.html",Premier League - Everton share points with Boro
"/sdd/edimar/Desktop/doutorado/doutorado04/bases/WEIR/soccer/uk.eurosport.yahoo.com/maceo-rigters.html",Moore set to bolster Tykes defence
"/sdd/edimar/Desktop/doutorado/doutorado04/bases/WEIR/soccer/uk.eurosport.yahoo.com/vicente.html",Atletico Progress In Empty Stadium
"/sdd/edimar/Desktop/doutorado/doutorado04/bases/WEIR/soccer/uk.eurosport.yahoo.com/roque-santacruz.html",Transfers - Gossip shop: Terry on City wishlist
"/sdd/edimar/Desktop/doutorado/doutorado04/bases/WEIR/soccer/uk.eurosport.yahoo.com/lee-cattermole.html",Latics victory a real Brucey bonus
"/sdd/edimar/Desktop/doutorado/doutorado04/bases/WEIR/soccer/uk.eurosport.yahoo.com/steve-finnan.html",Fa To Look At Beye Red Card
"/sdd/edimar/Desktop/doutorado/doutorado04/bases/WEIR/soccer/uk.eurosport.yahoo.com/scott-carson.html",Pulis: We can beat anyone at Brit
"/sdd/edimar/Desktop/doutorado/doutorado04/bases/WEIR/soccer/uk.eurosport.yahoo.com/tomas-rosicky.html",Gunners hoping trio tackle Blues
"/sdd/edimar/Desktop/doutorado/doutorado04/bases/WEIR/soccer/uk.eurosport.yahoo.com/stelios-giannakopoulos.html",Brown enjoying new Hull challenge
"/sdd/edimar/Desktop/doutorado/doutorado04/bases/WEIR/soccer/uk.eurosport.yahoo.com/jeremie-aliadiere.html",Magpies scrape out of bottom three
"/sdd/edimar/Desktop/doutorado/doutorado04/bases/WEIR/soccer/uk.eurosport.yahoo.com/didier-digard.html",Boro star eyes top-eight finish
"/sdd/edimar/Desktop/doutorado/doutorado04/bases/WEIR/soccer/uk.eurosport.yahoo.com/rob-hulse.html",Championship - Round-up: Top two both win
"/sdd/edimar/Desktop/doutorado/doutorado04/bases/WEIR/soccer/uk.eurosport.yahoo.com/luke-young.html",Lewington missing for Bulls clash
"/sdd/edimar/Desktop/doutorado/doutorado04/bases/WEIR/soccer/uk.eurosport.yahoo.com/scott-sinclair.html",Scolari Calm Despite Injury Crisis
"/sdd/edimar/Desktop/doutorado/doutorado04/bases/WEIR/soccer/uk.eurosport.yahoo.com/daniel-cousin.html",Premier League - Hull frustrate Pompey
"/sdd/edimar/Desktop/doutorado/doutorado04/bases/WEIR/soccer/uk.eurosport.yahoo.com/bastian-schweinsteiger.html",Bayern fear Schweinsteiger exit
"/sdd/edimar/Desktop/doutorado/doutorado04/bases/WEIR/soccer/uk.eurosport.yahoo.com/jussi-jaaskelainen.html",Premier League - Benitez warns Torres
"/sdd/edimar/Desktop/doutorado/doutorado04/bases/WEIR/soccer/uk.eurosport.yahoo.com/jisung-park.html",O'Neill: Vidic should have seen red
"/sdd/edimar/Desktop/doutorado/doutorado04/bases/WEIR/soccer/uk.eurosport.yahoo.com/andy-cole.html",Cole announces retirement
"/sdd/edimar/Desktop/doutorado/doutorado04/bases/WEIR/soccer/uk.eurosport.yahoo.com/joey-barton.html",Kinnear Identifies January Targets
"/sdd/edimar/Desktop/doutorado/doutorado04/bases/WEIR/soccer/uk.eurosport.yahoo.com/demirel-volkan.html",Wenger: Arsenal want fair fight
"/sdd/edimar/Desktop/doutorado/doutorado04/bases/WEIR/soccer/uk.eurosport.yahoo.com/jason-koumas.html",Family strife for Latics defender
"/sdd/edimar/Desktop/doutorado/doutorado04/bases/WEIR/soccer/uk.eurosport.yahoo.com/guillermo-franco.html",Juve Triumph On Sombre Night
"/sdd/edimar/Desktop/doutorado/doutorado04/bases/WEIR/soccer/uk.eurosport.yahoo.com/gareth-southgate.html",Oba comes closest in derby draw
"/sdd/edimar/Desktop/doutorado/doutorado04/bases/WEIR/soccer/uk.eurosport.yahoo.com/emmanuel-eboue.html",Premier League - Gallas: Arsenal in civil war
"/sdd/edimar/Desktop/doutorado/doutorado04/bases/WEIR/soccer/uk.eurosport.yahoo.com/leighton-baines.html",Gritty Gunners see off Toffees
"/sdd/edimar/Desktop/doutorado/doutorado04/bases/WEIR/soccer/uk.eurosport.yahoo.com/daniel-agger.html",Reds go through as Gerrard sinks OM
"/sdd/edimar/Desktop/doutorado/doutorado04/bases/WEIR/soccer/uk.eurosport.yahoo.com/lassana-diarra.html",Star Pompey pair back in running
"/sdd/edimar/Desktop/doutorado/doutorado04/bases/WEIR/soccer/uk.eurosport.yahoo.com/craig-fagan.html",Premier League - Team news: Hull v Man City
"/sdd/edimar/Desktop/doutorado/doutorado04/bases/WEIR/soccer/uk.eurosport.yahoo.com/steve-harper.html",Kinnear: Shay Transfer Not A Given
"/sdd/edimar/Desktop/doutorado/doutorado04/bases/WEIR/soccer/uk.eurosport.yahoo.com/stilian-petrov.html",Premier League - Davis off in Villa stalemate
"/sdd/edimar/Desktop/doutorado/doutorado04/bases/WEIR/soccer/uk.eurosport.yahoo.com/david-beckham.html",Podolski Demands Transfer
"/sdd/edimar/Desktop/doutorado/doutorado04/bases/WEIR/soccer/uk.eurosport.yahoo.com/hatem-benarfa.html",Reds go through as Gerrard sinks OM
"/sdd/edimar/Desktop/doutorado/doutorado04/bases/WEIR/soccer/uk.eurosport.yahoo.com/amaury-bischoff.html",Almunia: 'Angry' Walcott can shine
"/sdd/edimar/Desktop/doutorado/doutorado04/bases/WEIR/soccer/uk.eurosport.yahoo.com/valon-behrami.html",Hammers boss hails 'perfect' Upson
"/sdd/edimar/Desktop/doutorado/doutorado04/bases/WEIR/soccer/uk.eurosport.yahoo.com/mohamed-shawky.html",Premier League - Team of the Week
"/sdd/edimar/Desktop/doutorado/doutorado04/bases/WEIR/soccer/uk.eurosport.yahoo.com/robert-kovac.html",Capello not getting carried away
"/sdd/edimar/Desktop/doutorado/doutorado04/bases/WEIR/soccer/uk.eurosport.yahoo.com/julio-arca.html",Yakubu earns point for Toffees
"/sdd/edimar/Desktop/doutorado/doutorado04/bases/WEIR/soccer/uk.eurosport.yahoo.com/eric-abidal.html",World Cup qual. - Vieira and Ribery return
"/sdd/edimar/Desktop/doutorado/doutorado04/bases/WEIR/soccer/uk.eurosport.yahoo.com/danny-higginbotham.html","City spank Gunners, top two held"
"/sdd/edimar/Desktop/doutorado/doutorado04/bases/WEIR/soccer/uk.eurosport.yahoo.com/niko-kranjcar.html",Kaboul Stunned By Pompey Fans
"/sdd/edimar/Desktop/doutorado/doutorado04/bases/WEIR/soccer/uk.eurosport.yahoo.com/javier-zanetti.html",Mascherano revels in captaincy
"/sdd/edimar/Desktop/doutorado/doutorado04/bases/WEIR/soccer/uk.eurosport.yahoo.com/sidney-govou.html",Couceiro pleads for calm
"/sdd/edimar/Desktop/doutorado/doutorado04/bases/WEIR/soccer/uk.eurosport.yahoo.com/renato.html",La Liga - Round-up Valencia win; Real held
"/sdd/edimar/Desktop/doutorado/doutorado04/bases/WEIR/soccer/uk.eurosport.yahoo.com/carlo-cudicini.html",Drogba coin row adds to Chelsea's misery as it crashes out of League Cup
"/sdd/edimar/Desktop/doutorado/doutorado04/bases/WEIR/soccer/uk.eurosport.yahoo.com/martin-skrtel.html",Premier League - Gossip Shop: Buffon to Man City
"/sdd/edimar/Desktop/doutorado/doutorado04/bases/WEIR/soccer/uk.eurosport.yahoo.com/martin-jorgensen.html",World Cup qual. - Squads: Sweden lose Linderoth
"/sdd/edimar/Desktop/doutorado/doutorado04/bases/WEIR/soccer/uk.eurosport.yahoo.com/philipp-lahm.html",Champions League - Bayern and Lyon through
"/sdd/edimar/Desktop/doutorado/doutorado04/bases/WEIR/soccer/uk.eurosport.yahoo.com/titus-bramble.html",Latics fight back to stun Baggies
"/sdd/edimar/Desktop/doutorado/doutorado04/bases/WEIR/soccer/uk.eurosport.yahoo.com/michael-ball.html",Premier League - Ronaldo off as Rooney silences City
"/sdd/edimar/Desktop/doutorado/doutorado04/bases/WEIR/soccer/uk.eurosport.yahoo.com/nigel-reocoker.html",Villa tamed by terrific Tuncay double
"/sdd/edimar/Desktop/doutorado/doutorado04/bases/WEIR/soccer/uk.eurosport.yahoo.com/georgios-samaras.html",Hoops crash out after Caldwell woe
"/sdd/edimar/Desktop/doutorado/doutorado04/bases/WEIR/soccer/uk.eurosport.yahoo.com/michael-duberry.html",Same again for Royals boss Coppell
"/sdd/edimar/Desktop/doutorado/doutorado04/bases/WEIR/soccer/uk.eurosport.yahoo.com/claude-davis.html",Powell poised for first Rams start
"/sdd/edimar/Desktop/doutorado/doutorado04/bases/WEIR/soccer/uk.eurosport.yahoo.com/kalifa-cisse.html",Wolves Maintain Pace At Top
"/sdd/edimar/Desktop/doutorado/doutorado04/bases/WEIR/soccer/uk.eurosport.yahoo.com/john-pantsil.html",Benitez rues missed opportunity
"/sdd/edimar/Desktop/doutorado/doutorado04/bases/WEIR/soccer/uk.eurosport.yahoo.com/shaun-maloney.html",Hoops made to pay for Boruc gaffe
"/sdd/edimar/Desktop/doutorado/doutorado04/bases/WEIR/soccer/uk.eurosport.yahoo.com/paul-robinson.html",Latics fight back to stun Baggies
"/sdd/edimar/Desktop/doutorado/doutorado04/bases/WEIR/soccer/uk.eurosport.yahoo.com/roy-carroll.html",Championship - Jewell 'amazed' by weekend loss
"/sdd/edimar/Desktop/doutorado/doutorado04/bases/WEIR/soccer/uk.eurosport.yahoo.com/george-boateng.html",Premier League - Hull frustrate Pompey
"/sdd/edimar/Desktop/doutorado/doutorado04/bases/WEIR/soccer/uk.eurosport.yahoo.com/alexander-hleb.html",La Liga - Team news: Atletico anxious over Aguero
"/sdd/edimar/Desktop/doutorado/doutorado04/bases/WEIR/soccer/uk.eurosport.yahoo.com/tyrone-mears.html",Championship - Mears seals Marseille move
"/sdd/edimar/Desktop/doutorado/doutorado04/bases/WEIR/soccer/uk.eurosport.yahoo.com/lorik-cana.html",Diouf positive despite defeat
"/sdd/edimar/Desktop/doutorado/doutorado04/bases/WEIR/soccer/uk.eurosport.yahoo.com/john-terry.html",Wenger Hails His 'Unbreakables'
"/sdd/edimar/Desktop/doutorado/doutorado04/bases/WEIR/soccer/uk.eurosport.yahoo.com/kevin-nolan.html",Megson Keen To See New Faces
"/sdd/edimar/Desktop/doutorado/doutorado04/bases/WEIR/soccer/uk.eurosport.yahoo.com/mladen-petric.html",UEFA Cup - Round-up: Big names move on
"/sdd/edimar/Desktop/doutorado/doutorado04/bases/WEIR/soccer/uk.eurosport.yahoo.com/nemanja-vidic.html",Champions League - United through despite draw
"/sdd/edimar/Desktop/doutorado/doutorado04/bases/WEIR/soccer/uk.eurosport.yahoo.com/ricardocarvalho.html",Joe doubtful for Gunners showdown
"/sdd/edimar/Desktop/doutorado/doutorado04/bases/WEIR/soccer/uk.eurosport.yahoo.com/bafetimbi-gomis.html",Ligue 1 - Round-up: Ben Arfa inspires OM win
"/sdd/edimar/Desktop/doutorado/doutorado04/bases/WEIR/soccer/uk.eurosport.yahoo.com/anderson.html",Championship - Tykes hit by injury blow
"/sdd/edimar/Desktop/doutorado/doutorado04/bases/WEIR/soccer/uk.eurosport.yahoo.com/zoltan-gera.html",Worthington fumes after defeat
"/sdd/edimar/Desktop/doutorado/doutorado04/bases/WEIR/soccer/uk.eurosport.yahoo.com/richard-dunne.html",Rooney wins Manchester derby for United
"/sdd/edimar/Desktop/doutorado/doutorado04/bases/WEIR/soccer/uk.eurosport.yahoo.com/steed-malbranque.html",Cats collapse against Trotters
"/sdd/edimar/Desktop/doutorado/doutorado04/bases/WEIR/soccer/uk.eurosport.yahoo.com/barry-ferguson.html",Benitez looks to Spanish stars as title race gathers pace
"/sdd/edimar/Desktop/doutorado/doutorado04/bases/WEIR/soccer/uk.eurosport.yahoo.com/robert-huth.html",Arca in contention for Boro return
"/sdd/edimar/Desktop/doutorado/doutorado04/bases/WEIR/soccer/uk.eurosport.yahoo.com/keith-gillespie.html",Addicks new boys set for debuts
"/sdd/edimar/Desktop/doutorado/doutorado04/bases/WEIR/soccer/uk.eurosport.yahoo.com/stephen-ireland.html",Scottish Premier League - Team news: McGeady out
"/sdd/edimar/Desktop/doutorado/doutorado04/bases/WEIR/soccer/uk.eurosport.yahoo.com/raymond-domenech.html",Lippi Record As Italy Draw In Greece
"/sdd/edimar/Desktop/doutorado/doutorado04/bases/WEIR/soccer/uk.eurosport.yahoo.com/pedro-mendes.html",FA Could Punish Morgan
"/sdd/edimar/Desktop/doutorado/doutorado04/bases/WEIR/soccer/uk.eurosport.yahoo.com/habib-beye.html",Injuries Hamper Kinnear Plans
"/sdd/edimar/Desktop/doutorado/doutorado04/bases/WEIR/soccer/uk.eurosport.yahoo.com/peter-crouch.html",Fireworks at Fratton Park as Milan come to town
"/sdd/edimar/Desktop/doutorado/doutorado04/bases/WEIR/soccer/uk.eurosport.yahoo.com/marc-crosas.html",Scottish Premier League - Team news: McGeady out
"/sdd/edimar/Desktop/doutorado/doutorado04/bases/WEIR/soccer/uk.eurosport.yahoo.com/frank-lampard.html",Draw Not Down To Drogba - Lampard
"/sdd/edimar/Desktop/doutorado/doutorado04/bases/WEIR/soccer/uk.eurosport.yahoo.com/ignacio-gonzalez.html",Injuries Hamper Kinnear Plans
"/sdd/edimar/Desktop/doutorado/doutorado04/bases/WEIR/soccer/uk.eurosport.yahoo.com/fabricio-coloccini.html",Kinnear targets January signings
"/sdd/edimar/Desktop/doutorado/doutorado04/bases/WEIR/soccer/uk.eurosport.yahoo.com/michael-johnson.html",Wedderburn in for Kettering clash
"/sdd/edimar/Desktop/doutorado/doutorado04/bases/WEIR/soccer/uk.eurosport.yahoo.com/teemu-tainio.html",Premier League - Anelka leads Chelsea rout
"/sdd/edimar/Desktop/doutorado/doutorado04/bases/WEIR/soccer/uk.eurosport.yahoo.com/hayden-mullins.html",Southgate: Ross has made his mark
"/sdd/edimar/Desktop/doutorado/doutorado04/bases/WEIR/soccer/uk.eurosport.yahoo.com/joseba-llorente.html",Champions League - Behind enemy lines
"/sdd/edimar/Desktop/doutorado/doutorado04/bases/WEIR/soccer/uk.eurosport.yahoo.com/micah-richards.html",City On The Up For Derby Date
"/sdd/edimar/Desktop/doutorado/doutorado04/bases/WEIR/soccer/uk.eurosport.yahoo.com/stuart-parnaby.html",McLeish to shake-up forward line
"/sdd/edimar/Desktop/doutorado/doutorado04/bases/WEIR/soccer/uk.eurosport.yahoo.com/gianluigi-buffon.html",Transfers - Gossip shop: Terry on City wishlist
"/sdd/edimar/Desktop/doutorado/doutorado04/bases/WEIR/soccer/uk.eurosport.yahoo.com/ian-pearce.html",League One - Round-up: Cox earns Swindon point
"/sdd/edimar/Desktop/doutorado/doutorado04/bases/WEIR/soccer/uk.eurosport.yahoo.com/miroslav-klose.html",Bayern in the pink as Ribery magic rubs off
"/sdd/edimar/Desktop/doutorado/doutorado04/bases/WEIR/soccer/uk.eurosport.yahoo.com/massimo-donati.html",McGeady to miss Caley encounter
"/sdd/edimar/Desktop/doutorado/doutorado04/bases/WEIR/soccer/uk.eurosport.yahoo.com/brad-guzan.html",Villa duo doubtful for Boro visit
"/sdd/edimar/Desktop/doutorado/doutorado04/bases/WEIR/soccer/uk.eurosport.yahoo.com/thomas-augustinussen.html",Celtic own goal gives Aalborg victory
"/sdd/edimar/Desktop/doutorado/doutorado04/bases/WEIR/soccer/uk.eurosport.yahoo.com/steve-sidwell.html",Villa ambitions frustrated by Fulham
"/sdd/edimar/Desktop/doutorado/doutorado04/bases/WEIR/soccer/uk.eurosport.yahoo.com/tom-huddlestone.html",Bent could feel Gunners tension
"/sdd/edimar/Desktop/doutorado/doutorado04/bases/WEIR/soccer/uk.eurosport.yahoo.com/philippe-senderos.html",UEFA Cup - Defoe does not need surgery
"/sdd/edimar/Desktop/doutorado/doutorado04/bases/WEIR/soccer/uk.eurosport.yahoo.com/robert-green.html",Premier League - Behrami gives West Ham win
"/sdd/edimar/Desktop/doutorado/doutorado04/bases/WEIR/soccer/uk.eurosport.yahoo.com/andrea-dossena.html",Gerrard can get better - Benitez
"/sdd/edimar/Desktop/doutorado/doutorado04/bases/WEIR/soccer/uk.eurosport.yahoo.com/louis-saha.html",Moyes won't moan about credit crunch
"/sdd/edimar/Desktop/doutorado/doutorado04/bases/WEIR/soccer/uk.eurosport.yahoo.com/joseph-yobo.html",Yobo pulls out of Nigeria squad
"/sdd/edimar/Desktop/doutorado/doutorado04/bases/WEIR/soccer/uk.eurosport.yahoo.com/francis-jeffers.html",Owls striker sits out Cov clash
"/sdd/edimar/Desktop/doutorado/doutorado04/bases/WEIR/soccer/uk.eurosport.yahoo.com/gareth-bale.html",Bellamy sees bright Wales future
"/sdd/edimar/Desktop/doutorado/doutorado04/bases/WEIR/soccer/uk.eurosport.yahoo.com/robin-vanpersie.html",Mixed night for Gallas on Arsenal return
"/sdd/edimar/Desktop/doutorado/doutorado04/bases/WEIR/soccer/uk.eurosport.yahoo.com/alexander-frei.html",Bundesliga - Wolfsburg no longer unbeaten
"/sdd/edimar/Desktop/doutorado/doutorado04/bases/WEIR/soccer/uk.eurosport.yahoo.com/darren-bent.html",Premier League - Spurs climb out of drop zone
