URL,EXTRACTED VALUE
"/media/Dados/bases/SWDE/book/book-buy/0166.htm","Use these buttons to minimize the program window, restore the window to full size, or close the window."
"/media/Dados/bases/SWDE/book/book-buy/1339.htm","""You''re a brain surgeon,"" Walter says."
"/media/Dados/bases/SWDE/book/book-buy/1590.htm","KEY VERSE: ""Do not think that I came to abolish the Law or the Prophets; I did not come to abolish but to fulfill"" (5:17)."
"/media/Dados/bases/SWDE/book/book-buy/0883.htm","The door swings open and bangs into the metal trailer. ""Yeah?"""
"/media/Dados/bases/SWDE/book/book-buy/0292.htm","So in this scheme, when light hits a metal surface, photons hit the free electrons, and an electron completely absorbs each photon. When the energy,"
"/media/Dados/bases/SWDE/book/book-buy/0958.htm",“Will you be my girlfriend?” he asked again before I left.
"/media/Dados/bases/SWDE/book/book-buy/0255.htm",One of his silver brows rose into his thinning hairline.
"/media/Dados/bases/SWDE/book/book-buy/0415.htm","is a delightful, fragrant word."
"/media/Dados/bases/SWDE/book/book-buy/1576.htm","Remove from the oven, let cool thoroughly, and store in an airtight container."
"/media/Dados/bases/SWDE/book/book-buy/0068.htm","however, always exists between a sponsor and his or her sponsee."
"/media/Dados/bases/SWDE/book/book-buy/1778.htm",Open your text editor and type the following into the file:
