URL,EXTRACTED VALUE
"/media/Dados/bases/SWDE/book/book-buy/1905.htm",A rolled diploma with real Latin words
"/media/Dados/bases/SWDE/book/book-buy/0021.htm","- And more, which no coherent mind could fathom nor human tongue repeat!"
"/media/Dados/bases/SWDE/book/book-buy/0848.htm","* Detailed labeled maps will reveal the quickest and safest path to your object as well as identify enemies, equipment, and points of interest."
"/media/Dados/bases/SWDE/book/book-buy/1731.htm",? 40 lecciones paso a paso
"/media/Dados/bases/SWDE/book/book-buy/0351.htm",Special sections on MCAT essays and a review of essential mathematics
"/media/Dados/bases/SWDE/book/book-buy/0888.htm",a[Search tools for government job websites
"/media/Dados/bases/SWDE/book/book-buy/1495.htm","-Tables, charts and diagrams to help you best prepare for AP Chemistry"
"/media/Dados/bases/SWDE/book/book-buy/1892.htm","- PSP: Grand Theft Auto Liberty City Stories, Death Jr., MediEvil Resurrection"
"/media/Dados/bases/SWDE/book/book-buy/1196.htm",-- Preparing a loan application
