URL,EXTRACTED VALUE
"/media/Dados/bases/SWDE/book/book-buy/0590.htm","So when life hits,"
"/media/Dados/bases/SWDE/book/book-buy/1264.htm","So, when we wallow in self-pity, it's important to remember that there is almost always someone much worse off than ourself."
"/media/Dados/bases/SWDE/book/book-buy/0908.htm",Not so this time.
"/media/Dados/bases/SWDE/book/book-buy/1233.htm",Rotating the zoom ring allows you to change the focal length of the lens. Prime lenses do not have a zoom ring.
"/media/Dados/bases/SWDE/book/book-buy/1115.htm","23 ""You shall make two boards for the corners of the tabernacle at the rear."
"/media/Dados/bases/SWDE/book/book-buy/1899.htm","Eve nodded, walked back. ""You."" She pointed. ""Name?"""
"/media/Dados/bases/SWDE/book/book-buy/1727.htm",Did we kill
"/media/Dados/bases/SWDE/book/book-buy/1888.htm",Hotels continue to pop up in the booming
"/media/Dados/bases/SWDE/book/book-buy/0043.htm","I was taken aback but tried to defend myself. ""what are you talking about? I was trying to listen to people and understand what they were saying."""
"/media/Dados/bases/SWDE/book/book-buy/0760.htm",(Koh Samui; [??]
