URL,EXTRACTED VALUE
"/media/Dados/bases/SWDE/book/book-buy/0097.htm","A moving, funny, and unforgettable memoir of homeless life in New York City,"
"/media/Dados/bases/SWDE/book/book-buy/1811.htm","Designed to be a true alternative to traditional argument texts,"
"/media/Dados/bases/SWDE/book/book-buy/1705.htm","""If Your Heart Is Open,|Love Will Always Find Its Way In."""
"/media/Dados/bases/SWDE/book/book-buy/1364.htm",Your Ticket to Heaven
"/media/Dados/bases/SWDE/book/book-buy/1921.htm",PASSPORT TO YOUR NATIONAL PARKS® COMPANION GUIDES
"/media/Dados/bases/SWDE/book/book-buy/0968.htm",for getting excellent grades |
"/media/Dados/bases/SWDE/book/book-buy/0221.htm","The oldest known military treatise,"
"/media/Dados/bases/SWDE/book/book-buy/0935.htm",Cut workout time in half and get double the results!
"/media/Dados/bases/SWDE/book/book-buy/0561.htm",The second edition of
