URL,EXTRACTED VALUE
"/media/Dados/bases/SWDE/book/book-buy/0384.htm","During my relationship seminars, single women often come up to me and describe in great detail what they thought was a wonderful date."
"/media/Dados/bases/SWDE/book/book-buy/0348.htm","The novel that defined the Beat generation, this exuberant tale of two men traversing America is as fresh and fantastic as ever."
"/media/Dados/bases/SWDE/book/book-buy/0520.htm","The bestselling author of the ""Botany of Desire"" explores the ecology of eating to unveil why man consumes what he consumes in the 21st century."
"/media/Dados/bases/SWDE/book/book-buy/1400.htm",So the talk of random brutality wasn't just talk.
"/media/Dados/bases/SWDE/book/book-buy/0698.htm",Satire on the possible horrors of a totalitarian regime in England in 1984.
"/media/Dados/bases/SWDE/book/book-buy/0668.htm",One day Grandfather wouldn't get out of bed. He just lay there and stared at the ceiling and looked sad.
"/media/Dados/bases/SWDE/book/book-buy/1280.htm","My life--my real life--started when a man walked into it, a handsome stranger in a perfectly cut suit, and, yes, I know how that sounds."
"/media/Dados/bases/SWDE/book/book-buy/0337.htm","A Chinese American woman tells of the Chinese myths, family stories and events of her California childhood that have shaped her identity."
