URL,EXTRACTED VALUE
"/media/Dados/bases/SWDE/book/book-buy/1128.htm",is the ultimate reference and tutorial for Revit MEP users of all abilities.
"/media/Dados/bases/SWDE/book/book-buy/1432.htm",Here are three good reasons to make baby food at home:
"/media/Dados/bases/SWDE/book/book-buy/0005.htm","challenges the way we think all over again, exploring the hidden side of everything with such questions as:"
"/media/Dados/bases/SWDE/book/book-buy/1006.htm",Includes information on:
"/media/Dados/bases/SWDE/book/book-buy/1542.htm",With
"/media/Dados/bases/SWDE/book/book-buy/0332.htm",Now you can discover the acclaimed RIE approach. This practical and enlightening guide will help you:
"/media/Dados/bases/SWDE/book/book-buy/1121.htm",[b]Special Features:[/b]
"/media/Dados/bases/SWDE/book/book-buy/0697.htm","|A fun guide for you and your cockatiel,"
"/media/Dados/bases/SWDE/book/book-buy/0616.htm","Designed for today’s students, THINK SOCIOLOGY shows you how sociologists think and how to understand the rapidly changing world they live in."
"/media/Dados/bases/SWDE/book/book-buy/0618.htm","can guarantee the same richer, longer life to any company that applies them."
"/media/Dados/bases/SWDE/book/book-buy/0879.htm","Written with wry humor and huge personality-and tackling faith, love, family, and aging-"
"/media/Dados/bases/SWDE/book/book-buy/1466.htm",Discover how to||
"/media/Dados/bases/SWDE/book/book-buy/1332.htm",* a wise old man of great power and intelligence but no morals whatsoever
"/media/Dados/bases/SWDE/book/book-buy/0622.htm","es un fenómeno internacional que ha inspirado a millones de personas a llevar vidas extraordinarias. Ahora, con"
"/media/Dados/bases/SWDE/book/book-buy/0889.htm",This is the ideal guide to prepare you for Microsoft's new Windows 7 certification.
"/media/Dados/bases/SWDE/book/book-buy/0969.htm",Features:
"/media/Dados/bases/SWDE/book/book-buy/0539.htm",The Jackal (crazy and unpredictable)
"/media/Dados/bases/SWDE/book/book-buy/0387.htm","by Michael Covel? I'm long this book."""
"/media/Dados/bases/SWDE/book/book-buy/1183.htm",|2. Fear of Conflict |
"/media/Dados/bases/SWDE/book/book-buy/0630.htm",Each Experiment Contains:
"/media/Dados/bases/SWDE/book/book-buy/1627.htm","Direct, unambiguous identification of the issues"
"/media/Dados/bases/SWDE/book/book-buy/0314.htm","iMovie and iDVD are preloaded on every new Mac. Especially if you're new to the Mac, you'll appreciate how"
"/media/Dados/bases/SWDE/book/book-buy/0662.htm",The sacred lies in the ordinary.
"/media/Dados/bases/SWDE/book/book-buy/0429.htm","Since his recovery, Rubin has dedicated his life to sharing his dynamic health programs including authoring such well known books as"
"/media/Dados/bases/SWDE/book/book-buy/0971.htm",A bunch of great lunches fingerlicking sandwiches and more||
"/media/Dados/bases/SWDE/book/book-buy/0705.htm",Discover how to||
"/media/Dados/bases/SWDE/book/book-buy/0259.htm",Everything you need to excel on the exam:
"/media/Dados/bases/SWDE/book/book-buy/0066.htm",-- To chat with someone in the same room via instant messaging service instead of in person.
"/media/Dados/bases/SWDE/book/book-buy/1740.htm",Problems and solutions have been updated to reflect code changes that will take effect with the April 2008 exam.
"/media/Dados/bases/SWDE/book/book-buy/0434.htm","With sections devoted to each part of the day,"
"/media/Dados/bases/SWDE/book/book-buy/0999.htm","This comprehensive handbook covers specific business issues as well. If you have a website, the"
"/media/Dados/bases/SWDE/book/book-buy/1903.htm",|—Warren Davidson
"/media/Dados/bases/SWDE/book/book-buy/1344.htm",is intended for all readers interested in preparatory chemistry.
"/media/Dados/bases/SWDE/book/book-buy/0896.htm",Learn how to ride—the
"/media/Dados/bases/SWDE/book/book-buy/1339.htm","Smart, honest, and tough, Sage is a teen with more going for her than she thinks, but she still has a lot to learn."
"/media/Dados/bases/SWDE/book/book-buy/1650.htm",Mastering the Art and Craft
"/media/Dados/bases/SWDE/book/book-buy/1596.htm","Can a self-help book do all this? Studies show that two thirds of depressed readers of Dr. Burns's classic bestseller,"
"/media/Dados/bases/SWDE/book/book-buy/0438.htm","Within each profile, you'll find three parts:"
"/media/Dados/bases/SWDE/book/book-buy/0901.htm","Only Vicky Ward, an insider journalist who writes for"
"/media/Dados/bases/SWDE/book/book-buy/0906.htm","Written by a veteran security professional,"
"/media/Dados/bases/SWDE/book/book-buy/1097.htm",For marketing professionals who place special emphasis to creativity and imagination in marketing management.
"/media/Dados/bases/SWDE/book/book-buy/1906.htm","From acclaimed author and illustrator Mercer Mayer, kids will love learning math with Little Critter and his friends!"
"/media/Dados/bases/SWDE/book/book-buy/1478.htm","|Presenting complex theories in simple terms and helping you decode the jargon, understand the equations, and debunk the common misconceptions,"
"/media/Dados/bases/SWDE/book/book-buy/0098.htm","Fun factd and word searches about your favorite team, combined for fun, relaxing, and enjoyable word games for your favorite sports and trivia fun!"
"/media/Dados/bases/SWDE/book/book-buy/0814.htm","From acclaimed author and illustrator Mercer Mayer, kids will love learning to spell with Little Critter and his friends!"
"/media/Dados/bases/SWDE/book/book-buy/0550.htm",Clergy Standards and Behavior • Public Ritual
"/media/Dados/bases/SWDE/book/book-buy/0995.htm",Firefly Books is proud to offer this sentimental favorite in a variety of editions and sizes:
