URL,EXTRACTED VALUE
"/media/Dados/bases/SWDE/book/book-buy/0407.htm","In spite of it all, there's just"
"/media/Dados/bases/SWDE/book/book-buy/0510.htm",You meet at the time appointed under an archway of white stone. The words MOUNT ZION CEMETERY
"/media/Dados/bases/SWDE/book/book-buy/0460.htm","Penney said nothing, but sat down and nodded in a guarded way."
"/media/Dados/bases/SWDE/book/book-buy/0722.htm",A hand in the hair meant only one thing. Get out. Get moving. Now.
"/media/Dados/bases/SWDE/book/book-buy/1763.htm","""Oh, Enz,"" he says."
