URL,EXTRACTED VALUE
"/media/Dados/bases/SWDE/book/book-buy/1329.htm",Program output demonstrating expected results from running the examples
"/media/Dados/bases/SWDE/book/book-buy/1378.htm",The entire contents of every STUDENT CONSULT title you purchase.
"/media/Dados/bases/SWDE/book/book-buy/1052.htm","Deal with noisy, sweaty, and frozen pipes| |"
"/media/Dados/bases/SWDE/book/book-buy/0005.htm",Which adds more value: a pimp or a Realtor?
"/media/Dados/bases/SWDE/book/book-buy/1617.htm",Create and alter database tables
"/media/Dados/bases/SWDE/book/book-buy/1618.htm",The workbook is three-hole punched and perforated for convenience.
"/media/Dados/bases/SWDE/book/book-buy/1476.htm",Radiation
"/media/Dados/bases/SWDE/book/book-buy/1743.htm",Build and manage a multipage site| |
"/media/Dados/bases/SWDE/book/book-buy/0999.htm",Generate financial records |
"/media/Dados/bases/SWDE/book/book-buy/0763.htm",Keep appropriate records
"/media/Dados/bases/SWDE/book/book-buy/0010.htm",A patient teaching icon indicates information that should be shared with patients and their families.
