URL,EXTRACTED VALUE
"/media/Dados/bases/SWDE/book/book-buy/1590.htm","""But as for me, I would seek God, And I would place my cause before God;"
"/media/Dados/bases/SWDE/book/book-buy/0255.htm","""No,"" Lord Sanabalis replied. ""Unless something goes gravely, gravely wrong, the Emperor has more important duties to attend."""
"/media/Dados/bases/SWDE/book/book-buy/1296.htm","18 The Lord God said, ""It is not good for the man to be alone. I will make a helper suitable for him."""
"/media/Dados/bases/SWDE/book/book-buy/0415.htm",People had only to look at Jesus to see what God is like.
"/media/Dados/bases/SWDE/book/book-buy/1871.htm","""What the fuck do you want from me?"" she yelled again."
"/media/Dados/bases/SWDE/book/book-buy/1693.htm","""Attaboy!"" Flip said, clapping me on the back. He put a clean, white baseball in my glove."
"/media/Dados/bases/SWDE/book/book-buy/0068.htm",What a Sponsor Does Not Do
"/media/Dados/bases/SWDE/book/book-buy/0518.htm",Many people use the words
"/media/Dados/bases/SWDE/book/book-buy/0034.htm",and British papers ran the story; French papers soon followed.
