URL,EXTRACTED VALUE
"/media/Dados/bases/SWDE/restaurant/restaurant-usdiners/0071.htm","Our finest selection of warm wraps. Italian Chicken, BBQ Chicken, Santa Fa Chicken, Mexican Grill"
"/media/Dados/bases/SWDE/restaurant/restaurant-usdiners/1057.htm","w/ tartar sauce, lettuce & tomato"
"/media/Dados/bases/SWDE/restaurant/restaurant-usdiners/1001.htm",Soy beans boiled and lightly salted
"/media/Dados/bases/SWDE/restaurant/restaurant-usdiners/0433.htm",tuna salad topped with melted American cheese served on grilled rye bread
"/media/Dados/bases/SWDE/restaurant/restaurant-usdiners/1105.htm","tender spinach, smoked bacon, hard boiled egg, fire roasted red pepper, crumbled bleu tossed in citron-olive oil"
