URL,EXTRACTED VALUE
"/media/Dados/bases/SWDE/camera/camera-buy/0198.htm",Flash Modes: Auto/ for low light and backlit conditions Red Eye Reduction Fill in Off
"/media/Dados/bases/SWDE/camera/camera-buy/0236.htm",Included Features
"/media/Dados/bases/SWDE/camera/camera-buy/0265.htm",Flash Modes: Auto/ for low light and backlit conditions Red Eye Reduction Fill in Off
"/media/Dados/bases/SWDE/camera/camera-buy/0187.htm","Auto, Manual, Picture Stabilization /Anti blur, Movie"
"/media/Dados/bases/SWDE/camera/camera-buy/0226.htm",Exposure mode Programmed AE
"/media/Dados/bases/SWDE/camera/camera-buy/0235.htm","White Balance: iESP2 Auto, Presets/ Daylight, Overcast, Tungsten, and 3 Fluorescents"
"/media/Dados/bases/SWDE/camera/camera-buy/0171.htm","Flash Modes: Auto/ for low light and backlit conditions, Red-Eye Reduction Fill in Off"
