URL,EXTRACTED VALUE
"/media/Dados/bases/SWDE/camera/camera-buy/0291.htm",Noah Company MediaMate MG-M2TVDW Digital Multimedia Player
"/media/Dados/bases/SWDE/camera/camera-buy/0429.htm",Garmin nüvi 255W Automobile Navigator
"/media/Dados/bases/SWDE/camera/camera-buy/0292.htm",Belkin TuneBase FM Transmitter for iPod
"/media/Dados/bases/SWDE/camera/camera-buy/0031.htm",Microsoft LifeCam VX-3000 Webcam
"/media/Dados/bases/SWDE/camera/camera-buy/0015.htm",Apple 8GB iPod Touch
"/media/Dados/bases/SWDE/camera/camera-buy/0476.htm",Polaroid XSA-10169 Digital Frame
"/media/Dados/bases/SWDE/camera/camera-buy/0001.htm",Belkin HDMI to HDMI Audio/Video Cable
"/media/Dados/bases/SWDE/camera/camera-buy/0297.htm",3 Pack of Super High Resolution HDMI M/M Cables - 6 ft
"/media/Dados/bases/SWDE/camera/camera-buy/0495.htm",Cisco Linksys WRT400N Simultaneous Dual-Band Wireless-N Router
