URL,EXTRACTED VALUE
"/media/Dados/bases/SWDE/book/book-barnesandnoble/0296.htm","Alice waited, suspended in the front hallway, holding the handle of her suitcase."
"/media/Dados/bases/SWDE/book/book-barnesandnoble/1625.htm","off spring, cursed by him when she made the decision to avoid academic"
"/media/Dados/bases/SWDE/book/book-barnesandnoble/0298.htm",Cayal breathed in the aroma and hoped.
"/media/Dados/bases/SWDE/book/book-barnesandnoble/0315.htm",cliché homophobic views:
"/media/Dados/bases/SWDE/book/book-barnesandnoble/1951.htm","He shook his head. ""I assure you that if I had met you, I would not have forgotten."""
"/media/Dados/bases/SWDE/book/book-barnesandnoble/0412.htm","""I can leave it to whomever I please,"" Gran said, her eyes cold as slate."
"/media/Dados/bases/SWDE/book/book-barnesandnoble/0701.htm","""Is that all you get paid for watching all those kids? Fifty cents?"" I couldn't get over it. Fifty cents a week?"
"/media/Dados/bases/SWDE/book/book-barnesandnoble/1095.htm","magazine on June 15, and they were mobbed everywhere they went."
"/media/Dados/bases/SWDE/book/book-barnesandnoble/0367.htm","“Mama, did you bring me any chocolate chip cookies?” Stevie Rae asked."
