URL,EXTRACTED VALUE
"/media/Dados/bases/SWDE/book/book-barnesandnoble/1382.htm",Graydon Carter is the editor of
"/media/Dados/bases/SWDE/book/book-barnesandnoble/1608.htm",And . . . yes!
"/media/Dados/bases/SWDE/book/book-barnesandnoble/1796.htm",lives in Pennslyvania with her husband and two daughters.
"/media/Dados/bases/SWDE/book/book-barnesandnoble/1093.htm",CHEYENNE MCCRAY
"/media/Dados/bases/SWDE/book/book-barnesandnoble/1719.htm",Better Than Barebones Cooking (Page 162) A good soup or stew starts with a stock. Learn how stocks and broths can make you a better cook.
"/media/Dados/bases/SWDE/book/book-barnesandnoble/0292.htm","Throughout the book, you'll discover:"
"/media/Dados/bases/SWDE/book/book-barnesandnoble/0681.htm","is the author of numerous business bestsellers, including"
"/media/Dados/bases/SWDE/book/book-barnesandnoble/0436.htm","is a popular columnist and speaker. A close confidante of John Wooden, he is coauthor of the bestselling biography"
