URL,EXTRACTED VALUE
"/media/Dados/bases/SWDE/book/book-barnesandnoble/1829.htm",and
"/media/Dados/bases/SWDE/book/book-barnesandnoble/1080.htm",by Diane Mott Davidson
"/media/Dados/bases/SWDE/book/book-barnesandnoble/1741.htm",", with their unpredictable eddies of thought and wonderfully personal voice."
"/media/Dados/bases/SWDE/book/book-barnesandnoble/0742.htm",", and"
"/media/Dados/bases/SWDE/book/book-barnesandnoble/0239.htm",was chosen to appear as a plot point on the popular Disney-produced preteen series
