URL,EXTRACTED VALUE
"/media/Dados/bases/SWDE/book/book-barnesandnoble/1515.htm","Roger Bennett has written books about music, culture, and sport and articles for outlets including"
"/media/Dados/bases/SWDE/book/book-barnesandnoble/0279.htm","illustrator of more than 100 children's books, including Ali, Child"
"/media/Dados/bases/SWDE/book/book-barnesandnoble/0398.htm",and publisher of
"/media/Dados/bases/SWDE/book/book-barnesandnoble/1498.htm",You can find out more about Christopher and Inheritance at
"/media/Dados/bases/SWDE/book/book-barnesandnoble/0098.htm","magazine. This is her first book. For more information, visit her website at RebeccaSkloot.com."
"/media/Dados/bases/SWDE/book/book-barnesandnoble/0396.htm","Mary lives in Eureka, California."
"/media/Dados/bases/SWDE/book/book-barnesandnoble/1458.htm",tells a great American story of spectacular achievement—yet it never loses sight of the public and private costs at which that achievement came.
"/media/Dados/bases/SWDE/book/book-barnesandnoble/1457.htm",. She holds a PhD in holistic health and a Master’s degree in nutrition education. She lives in Idaho.
"/media/Dados/bases/SWDE/book/book-barnesandnoble/0470.htm","Your panic room, self-defense training and tools."
"/media/Dados/bases/SWDE/book/book-barnesandnoble/1562.htm",", and he illustrated numerous books of poetry."
"/media/Dados/bases/SWDE/book/book-barnesandnoble/1400.htm",". As an actor, he has appeared in"
