URL,EXTRACTED VALUE
"/media/Dados/bases/SWDE/book/book-barnesandnoble/0875.htm",“Where are you?” she wanted to know. “Are you at the bail bonds office?”
"/media/Dados/bases/SWDE/book/book-barnesandnoble/0190.htm",“Where are you?” she wanted to know. “Are you at the bail bonds office?”
"/media/Dados/bases/SWDE/book/book-barnesandnoble/1598.htm","""Go ahead and kill him,"" Neely would say, egging on a mad dog. One less defensive lineman made Neely's job much easier."
"/media/Dados/bases/SWDE/book/book-barnesandnoble/1287.htm","Taking my cue from the pistol, I assumed a standing position next to the conference table, a few feet from Mister, who had developed the irritating"
"/media/Dados/bases/SWDE/book/book-barnesandnoble/0808.htm","room with her parents, or with Ashoke at her side. She wishes the curtains"
"/media/Dados/bases/SWDE/book/book-barnesandnoble/1646.htm","Mabel gave her head a shake. ""I don't know what Fred was doing with these pictures. Why would a person have pictures like this?"""
