URL,EXTRACTED VALUE
"/media/Dados/bases/SWDE/book/book-barnesandnoble/1449.htm","If you've ever been curious about just what goes on in the kitchen of your favorite eatery,"
"/media/Dados/bases/SWDE/book/book-barnesandnoble/1375.htm","In a masterful departure from the Boston-based hard-boiled mysteries he's known for, New York Times bestselling author Dennis Lehane ("
"/media/Dados/bases/SWDE/book/book-barnesandnoble/0216.htm","In a masterful departure from the Boston-based hard-boiled mysteries he's known for, New York Times bestselling author Dennis Lehane ("
"/media/Dados/bases/SWDE/book/book-barnesandnoble/1287.htm","is Grisham's latest legal thriller, a gripping page-turner much like his earlier book"
"/media/Dados/bases/SWDE/book/book-barnesandnoble/1558.htm","offers a wealth of company, inspiration, and humorand finally, recipes that require no division or subtraction."
