URL,EXTRACTED VALUE
"/media/Dados/bases/SWDE/book/book-barnesandnoble/0310.htm","form a novel, in a way?"
"/media/Dados/bases/SWDE/book/book-barnesandnoble/1239.htm",proud of her own display of self-control.
"/media/Dados/bases/SWDE/book/book-barnesandnoble/1694.htm","Don't worry! You are not in for a brand-new load of guilt, I promise! That's precisely what this book is"
"/media/Dados/bases/SWDE/book/book-barnesandnoble/1603.htm","is that, despite everything, Jeannette Walls refuses to condemn her parents. Were you able to be equally nonjudgmental?"
"/media/Dados/bases/SWDE/book/book-barnesandnoble/0809.htm","slippers almost everywhere. When we ate at the local diner, my mother would yank"
