URL,EXTRACTED VALUE
"/media/Dados/bases/SWDE/book/book-barnesandnoble/0296.htm","""No."""
"/media/Dados/bases/SWDE/book/book-barnesandnoble/1625.htm","manga, graphic novels, and Dungeons and Dragons manuals, and his"
"/media/Dados/bases/SWDE/book/book-barnesandnoble/0298.htm","Ignoring the throbbing in his neck and jaw, trying to sound commanding, Cayal nodded. ""You must ...execute me again. Only this time, do it properly."""
"/media/Dados/bases/SWDE/book/book-barnesandnoble/0075.htm","""Good."" McMahon settled back into his spot on the couch. ""So what's the deal with the meeting this morning?"""
"/media/Dados/bases/SWDE/book/book-barnesandnoble/0315.htm",Not that Leon Winkler
"/media/Dados/bases/SWDE/book/book-barnesandnoble/1951.htm","""I don't love him."""
"/media/Dados/bases/SWDE/book/book-barnesandnoble/0588.htm","The younger, Rika, had been taken off guard, because of Kaderin's panicked approach. The vampire had smiled when Kaderin dropped to her knees."
"/media/Dados/bases/SWDE/book/book-barnesandnoble/0367.htm","None of that would go over well with ultra-religious, ultra-judgmental Mom and John."
