URL,EXTRACTED VALUE
"/media/Dados/bases/SWDE/book/book-barnesandnoble/0032.htm","and lemon and eggs, and at five, the timer buzzed and I pulled"
"/media/Dados/bases/SWDE/book/book-barnesandnoble/1143.htm","“But he never signed them,” I said."
"/media/Dados/bases/SWDE/book/book-barnesandnoble/0830.htm",do believe is that although there is only one kind of stuff in the universe and it
"/media/Dados/bases/SWDE/book/book-barnesandnoble/0492.htm",some are dark. Untellable.
"/media/Dados/bases/SWDE/book/book-barnesandnoble/0556.htm",Telephone exchange/number: I have no earthly idea
