URL,EXTRACTED VALUE
"/media/Dados/bases/SWDE/book/book-barnesandnoble/1379.htm","Generally, novels make us turn the pages because we want to know what happens next. But with Sam Lipsyte's"
"/media/Dados/bases/SWDE/book/book-barnesandnoble/1442.htm",Few authors do dread as well as Waters (
"/media/Dados/bases/SWDE/book/book-barnesandnoble/1811.htm","Second Sight, Eyes Of Night, and"
"/media/Dados/bases/SWDE/book/book-barnesandnoble/0021.htm","""Is this how it is?"" Olympia asks John after their second rapturous assignation. ""Is this the secret all men and women share?"""
"/media/Dados/bases/SWDE/book/book-barnesandnoble/1416.htm","At once unflinching and compassionate,"
