URL,EXTRACTED VALUE
"/media/Dados/bases/SWDE/book/book-barnesandnoble/1934.htm","""They"" referred to Terra Prime, the cable channel devoted to science and nature that was underwriting the expedition."
"/media/Dados/bases/SWDE/book/book-barnesandnoble/0945.htm",What was that about incompatible? What was that about a major rethink? I feel a jolt of alarm.
"/media/Dados/bases/SWDE/book/book-barnesandnoble/1003.htm","Discipline (rules, boundaries and limitations)"
"/media/Dados/bases/SWDE/book/book-barnesandnoble/1598.htm","""Yeah, because you kept screwin' up."""
"/media/Dados/bases/SWDE/book/book-barnesandnoble/0015.htm",“Shh!” Osborn stamped on Dobson’s foot to shut him up as Lord John turned back to the young men.
"/media/Dados/bases/SWDE/book/book-barnesandnoble/1010.htm","""Right,"" Myron said. ""Maybe she should stand a couple times during each broadcast. Twirl around a few times, bend over, something like that."""
"/media/Dados/bases/SWDE/book/book-barnesandnoble/1253.htm",“Isn’t it? Not even this reality?”
