URL,EXTRACTED VALUE
"/media/Dados/bases/SWDE/book/book-barnesandnoble/0247.htm",Los Angeles Times.
"/media/Dados/bases/SWDE/book/book-barnesandnoble/0049.htm",. So any intelligent buyer can probably guess going in that the previously unseen work now collected for publication as
"/media/Dados/bases/SWDE/book/book-barnesandnoble/0711.htm","Atkinson's first novel, the Whitbread-winning"
"/media/Dados/bases/SWDE/book/book-barnesandnoble/0443.htm","The Victorians thrilled to ghost stories, creepy ones, of course, but even ultimately comic ones like Dickens's"
"/media/Dados/bases/SWDE/book/book-barnesandnoble/1778.htm",It was William Faulkner who laid bare the possibilities of this storytelling method in
