URL,EXTRACTED VALUE
"/media/Dados/bases/SWDE/book/book-barnesandnoble/0878.htm",Edward’s soft voice came from behind me.
"/media/Dados/bases/SWDE/book/book-barnesandnoble/1207.htm","#1"
"/media/Dados/bases/SWDE/book/book-barnesandnoble/1694.htm","What if you, personally, could make the world a better place...by tomorrow?"
"/media/Dados/bases/SWDE/book/book-barnesandnoble/0597.htm",The heart-wrenching companion to the bestselling novels
"/media/Dados/bases/SWDE/book/book-barnesandnoble/0346.htm","In this rich, vibrant tale, Diana Gabaldon continues the story of Claire Randall and Jamie Fraser that began with the now-classic novel"
"/media/Dados/bases/SWDE/book/book-barnesandnoble/1716.htm","Unabridged CDs • 5 CDs, 6 hours"
"/media/Dados/bases/SWDE/book/book-barnesandnoble/0036.htm",Become an authority on Percy's world with this must-have guide to the Percy Jackson and the Olympians series.
"/media/Dados/bases/SWDE/book/book-barnesandnoble/1639.htm","Copyright © Reed Business Information, a division of Reed Elsevier Inc. All rights reserved."
"/media/Dados/bases/SWDE/book/book-barnesandnoble/0146.htm",I FELT LIKE I WAS TRAPPED IN ONE OF THOSE TERRIFYING NIGHTMARES…
"/media/Dados/bases/SWDE/book/book-barnesandnoble/1826.htm", is hunting her?
"/media/Dados/bases/SWDE/book/book-barnesandnoble/0558.htm",He's brought:
"/media/Dados/bases/SWDE/book/book-barnesandnoble/1514.htm","Michael Buckley is at his comic best in this madcap new series sure to appeal to kids looking for a quick, exciting read."
"/media/Dados/bases/SWDE/book/book-barnesandnoble/0156.htm",textbook. You could say Wes and I experienced a lot of firsts together that spring. It was scary. It was fun. It was love.
"/media/Dados/bases/SWDE/book/book-barnesandnoble/0090.htm","They've been best friends since seventh grade. But this summer, on the threshold of thirty, four women are going to need each other more than ever."
"/media/Dados/bases/SWDE/book/book-barnesandnoble/0300.htm",Following the acclaimed
"/media/Dados/bases/SWDE/book/book-barnesandnoble/1278.htm","Dear Reader,"
"/media/Dados/bases/SWDE/book/book-barnesandnoble/1913.htm","In what is sure to be the debut of the season,"
"/media/Dados/bases/SWDE/book/book-barnesandnoble/1338.htm",Skill 1: Focus and Self Control
"/media/Dados/bases/SWDE/book/book-barnesandnoble/0229.htm",Black Magic Sanction
"/media/Dados/bases/SWDE/book/book-barnesandnoble/1844.htm",To mark the fiftieth anniversary of
"/media/Dados/bases/SWDE/book/book-barnesandnoble/0415.htm",The title of the latest assemblage from the author of
"/media/Dados/bases/SWDE/book/book-barnesandnoble/1976.htm","You have within you unlimited capacities for love, for joy, for communion with life, and for unshakable freedom—and here is how to awaken them. In"
"/media/Dados/bases/SWDE/book/book-barnesandnoble/0818.htm","“The Power of One has everything: suspense, the exotic, violence; mysticism, psychology and magic; schoolboy adventures, drama.”"
"/media/Dados/bases/SWDE/book/book-barnesandnoble/0025.htm","Copyright © Reed Business Information, a division of Reed Elsevier Inc. All rights reserved."
"/media/Dados/bases/SWDE/book/book-barnesandnoble/0924.htm","takes readers into the lives of these families  and shows what survival, faith, hope, love, and redemption really mean."
"/media/Dados/bases/SWDE/book/book-barnesandnoble/1186.htm",From the author of the bestselling
"/media/Dados/bases/SWDE/book/book-barnesandnoble/0208.htm",Last Light Over Carolina
"/media/Dados/bases/SWDE/book/book-barnesandnoble/0445.htm",Many dangers lurk in the deep-the worst of them are human.
"/media/Dados/bases/SWDE/book/book-barnesandnoble/1151.htm","Today I am sad, my mood's heavy and gray."
"/media/Dados/bases/SWDE/book/book-barnesandnoble/0936.htm",Edward’s soft voice came from behind me.
"/media/Dados/bases/SWDE/book/book-barnesandnoble/1556.htm",Logan’s sudden death leaves Aura devastated. He’s gone.
"/media/Dados/bases/SWDE/book/book-barnesandnoble/0510.htm",As the co-host of MSNBC’s popular show
"/media/Dados/bases/SWDE/book/book-barnesandnoble/0165.htm","In high school, the last thing you want is for people to think you talk to ghosts."
"/media/Dados/bases/SWDE/book/book-barnesandnoble/0009.htm","Combining a passionate, doomed love story, a vivid evocation of life during the war, and a poignant mother/daughter drama,"
"/media/Dados/bases/SWDE/book/book-barnesandnoble/1289.htm",her luck.
"/media/Dados/bases/SWDE/book/book-barnesandnoble/0727.htm",", published in 1906. Now in its fifteenth edition,"
"/media/Dados/bases/SWDE/book/book-barnesandnoble/0788.htm","Heralding the arrival of a stunning new voice in American fiction, Robin Black’s"
"/media/Dados/bases/SWDE/book/book-barnesandnoble/0116.htm",The truth doesn’t always set you free.
"/media/Dados/bases/SWDE/book/book-barnesandnoble/1516.htm","There isn't a woman on this earth who hasn't wanted, at one time or another, to trade in her husband for a new one."
"/media/Dados/bases/SWDE/book/book-barnesandnoble/0002.htm","But that conventional image is all wrong, as veteran journalist and author M. Stanton Evans reveals in this groundbreaking book. The long-awaited"
"/media/Dados/bases/SWDE/book/book-barnesandnoble/0306.htm",From the author of the acclaimed novel
"/media/Dados/bases/SWDE/book/book-barnesandnoble/0724.htm",It begins with a floater.
"/media/Dados/bases/SWDE/book/book-barnesandnoble/0093.htm",Edward’s soft voice came from behind me.
"/media/Dados/bases/SWDE/book/book-barnesandnoble/1039.htm","Copyright © Reed Business Information, a division of Reed Elsevier Inc. All rights reserved."
"/media/Dados/bases/SWDE/book/book-barnesandnoble/0490.htm",Fate takes many forms. . . .
"/media/Dados/bases/SWDE/book/book-barnesandnoble/0246.htm","Considered to be ""as monumental -- and enigmatic -- a legend as American sport has ever seen"" ("
"/media/Dados/bases/SWDE/book/book-barnesandnoble/0839.htm",The completely revised American Edition includes:
"/media/Dados/bases/SWDE/book/book-barnesandnoble/0452.htm",", set in the remote village of Paradise, where the Bonner family that readers first met in"
"/media/Dados/bases/SWDE/book/book-barnesandnoble/0740.htm",The 2010 Newbery Honor Book by highly acclaimed author Rodman Philbrick is now in paperback!
"/media/Dados/bases/SWDE/book/book-barnesandnoble/0767.htm","Devin Alexander lives by the motto that ""twenty minutes in the kitchen can save you 3 hours on the treadmill!"" The chef and author of"
"/media/Dados/bases/SWDE/book/book-barnesandnoble/1400.htm","Serving up equal parts sincerity and cynicism,"
"/media/Dados/bases/SWDE/book/book-barnesandnoble/0574.htm",First in the Kurt Wallander series.
"/media/Dados/bases/SWDE/book/book-barnesandnoble/0752.htm",Master of suspense and #1
"/media/Dados/bases/SWDE/book/book-barnesandnoble/1042.htm",Few works of literature are as universally beloved as
"/media/Dados/bases/SWDE/book/book-barnesandnoble/0783.htm",A delightful comedy of manners about two sisters who must put aside their differences when they inherit a house in the Hamptons.
"/media/Dados/bases/SWDE/book/book-barnesandnoble/0061.htm",show's Michele Borba's cures for difficult childhood behaviors
"/media/Dados/bases/SWDE/book/book-barnesandnoble/0865.htm",The #1
"/media/Dados/bases/SWDE/book/book-barnesandnoble/1274.htm","On November 19, 1943, the submarine"
"/media/Dados/bases/SWDE/book/book-barnesandnoble/1915.htm",", whispers the cobwebby voice of the hogboon."
"/media/Dados/bases/SWDE/book/book-barnesandnoble/0562.htm",What Room Are You In?
"/media/Dados/bases/SWDE/book/book-barnesandnoble/0497.htm",Like Charles Frazier's
"/media/Dados/bases/SWDE/book/book-barnesandnoble/0107.htm","Detective Isaac Bell, hero of"
"/media/Dados/bases/SWDE/book/book-barnesandnoble/1097.htm","A literary mystery, historical adventure, and dual love story,"
"/media/Dados/bases/SWDE/book/book-barnesandnoble/1043.htm",Seth Godin is the worldwide bestselling author of
"/media/Dados/bases/SWDE/book/book-barnesandnoble/1752.htm",With her now-classic novel
"/media/Dados/bases/SWDE/book/book-barnesandnoble/1914.htm",“How long do I have to convince you that my brother is not capable of murdering sixty people?”
"/media/Dados/bases/SWDE/book/book-barnesandnoble/0840.htm","When she was a toddler in Omaha, her parents called her Mary Sunshine."
"/media/Dados/bases/SWDE/book/book-barnesandnoble/0455.htm","A wealthy banker, seeing his world about to crumble around him, knows his family is in unfathomable danger. . . ."
"/media/Dados/bases/SWDE/book/book-barnesandnoble/0601.htm","Copyright © Reed Business Information, a division of Reed Elsevier Inc. All rights reserved."
"/media/Dados/bases/SWDE/book/book-barnesandnoble/0499.htm",Rachel Renee Russell's sequel to DORK DIARIES is packed with adorable art and tons of laughs.
"/media/Dados/bases/SWDE/book/book-barnesandnoble/0649.htm","Drawing on new and little-known research from prestigious medical centers around the world, Neal Barnard, M.D., author of"
"/media/Dados/bases/SWDE/book/book-barnesandnoble/1108.htm","Chosen to care, he makes his way through town helping and hurting (when necessary), until only one question remains: Who’s behind Ed’s mission?"
"/media/Dados/bases/SWDE/book/book-barnesandnoble/1943.htm",introduces a new generation of Americans to the vibrant flavors of modern Mexico.
"/media/Dados/bases/SWDE/book/book-barnesandnoble/0237.htm",– The Ninety Day Rule: Ford requires it of its employees. Should you require it of your man?
"/media/Dados/bases/SWDE/book/book-barnesandnoble/0657.htm",amply demonstrates the impact unconditional love can have on your life.
"/media/Dados/bases/SWDE/book/book-barnesandnoble/1359.htm",Berlin 1942
"/media/Dados/bases/SWDE/book/book-barnesandnoble/1670.htm",From the creator of
"/media/Dados/bases/SWDE/book/book-barnesandnoble/1014.htm","An ever-growing legion of fans greets the publication of each new tale from the inimitable Jane Green. Her latest gem,"
"/media/Dados/bases/SWDE/book/book-barnesandnoble/0476.htm",In 1978 Stephen King published
"/media/Dados/bases/SWDE/book/book-barnesandnoble/0591.htm",A graphic novel based on the bestselling Harry Dresden books by Jim Butcher!
"/media/Dados/bases/SWDE/book/book-barnesandnoble/0663.htm",Gone But Not Forgotten
"/media/Dados/bases/SWDE/book/book-barnesandnoble/0590.htm","Once upon a time, I was a little girl who disappeared."
"/media/Dados/bases/SWDE/book/book-barnesandnoble/0448.htm",Based on the award-winning 10-million-plus-hit blog
"/media/Dados/bases/SWDE/book/book-barnesandnoble/1148.htm",From acclaimed author Scott Sigler—
"/media/Dados/bases/SWDE/book/book-barnesandnoble/1445.htm",“It’s not the magic that makes it work; it’s the way we work that makes it magic.”
"/media/Dados/bases/SWDE/book/book-barnesandnoble/1632.htm",It isn't that Abby Carson
"/media/Dados/bases/SWDE/book/book-barnesandnoble/0987.htm",Join the tiny seed on an adventure as it becomes a giant flower! Plant the detachable seed-embedded paper to grow beautiful flowers of your very own.
"/media/Dados/bases/SWDE/book/book-barnesandnoble/0257.htm",Read by TBA
"/media/Dados/bases/SWDE/book/book-barnesandnoble/1450.htm",You can quote lines from
"/media/Dados/bases/SWDE/book/book-barnesandnoble/1060.htm",She is delivering lots of love love love as she plays Cupid and makes everyone happy happy happy.
"/media/Dados/bases/SWDE/book/book-barnesandnoble/1378.htm",Author Biography:
"/media/Dados/bases/SWDE/book/book-barnesandnoble/1534.htm","Cynthia Eden returns to the realm of the Other, where the supernatural bounty hunters of Night Watch work hard and play harder..."
"/media/Dados/bases/SWDE/book/book-barnesandnoble/0785.htm",A regular on
"/media/Dados/bases/SWDE/book/book-barnesandnoble/0893.htm",I FELT LIKE I WAS TRAPPED IN ONE OF THOSE TERRIFYING NIGHTMARES…
"/media/Dados/bases/SWDE/book/book-barnesandnoble/0678.htm",America's favorite doctors Michael Roizen and Mehmet Oz cover pregnancy from conception to birth.
"/media/Dados/bases/SWDE/book/book-barnesandnoble/1234.htm",The #1 New York Times bestselling author's groundbreaking new book investigates the complicated relationship women have with money.
"/media/Dados/bases/SWDE/book/book-barnesandnoble/1547.htm",better known as the Giant Squid. But Billy’s tour takes an unexpected turn when the squid suddenly and impossibly vanishes into thin air.
"/media/Dados/bases/SWDE/book/book-barnesandnoble/1865.htm","Bestselling author L. E. Modesitt, Jr., presents the second big novel in the Imager Portfolio, in a world where magic rules in secret."
"/media/Dados/bases/SWDE/book/book-barnesandnoble/0185.htm","Based on author Sebastian Mallaby's unprecedented access to the industry, including three hundred hours of interviews,"
"/media/Dados/bases/SWDE/book/book-barnesandnoble/0060.htm",From the #1
"/media/Dados/bases/SWDE/book/book-barnesandnoble/0347.htm",The World of Plum Has Never Been Merrier!
"/media/Dados/bases/SWDE/book/book-barnesandnoble/0872.htm","Unabridged CDs • 6 CDs, 8 hours"
"/media/Dados/bases/SWDE/book/book-barnesandnoble/0268.htm","And for her twelfth novel, Fairstein takes Alexandra Cooper inside a world"
"/media/Dados/bases/SWDE/book/book-barnesandnoble/1316.htm",is a masterfully plotted novel that cements Christopher Reich’s reputation as one of the most admired espionage thriller writers today.
"/media/Dados/bases/SWDE/book/book-barnesandnoble/1094.htm",What could be fancier than Christmas?
"/media/Dados/bases/SWDE/book/book-barnesandnoble/0871.htm",Carly: She was sweet. Smart. Self-destructive. She knew the secrets of Brighton Day School’s most privileged students. Secrets that got her killed.
"/media/Dados/bases/SWDE/book/book-barnesandnoble/1205.htm",Celebrate the holidays with the Creed forefathers—Montana men who built the family homestead and established a legacy of love…
"/media/Dados/bases/SWDE/book/book-barnesandnoble/1318.htm","Celebrated journalist R. W. (“Johnny”) Apple was a veteran political reporter, a"
"/media/Dados/bases/SWDE/book/book-barnesandnoble/0376.htm",“Beware of geeks bearing formulas.”
"/media/Dados/bases/SWDE/book/book-barnesandnoble/0528.htm","<font face=""Times New Roman"" size=""5"" color=""#000000"">"
