URL,EXTRACTED VALUE
"/media/Dados/bases/SWDE/book/book-barnesandnoble/0111.htm",Sixty-one hours. Not a minute to spare.
"/media/Dados/bases/SWDE/book/book-barnesandnoble/1789.htm","· Get further, faster by setting goals in a dramatically more powerful way"
"/media/Dados/bases/SWDE/book/book-barnesandnoble/1426.htm","one of the few I've read in the last decade that genuinely deserve and renew that largely debased adjective. As Chaon says, in"
"/media/Dados/bases/SWDE/book/book-barnesandnoble/0922.htm",is the must-have guide to the joy of everyday entertaining.
"/media/Dados/bases/SWDE/book/book-barnesandnoble/0781.htm",", they bring their heavenly inspired cooking down to earth for all to share."
"/media/Dados/bases/SWDE/book/book-barnesandnoble/0975.htm",Genuine leadership – leadership with a “little
"/media/Dados/bases/SWDE/book/book-barnesandnoble/1638.htm",* What do PET scans and MRIs reveal about the brain's response to music?
"/media/Dados/bases/SWDE/book/book-barnesandnoble/1768.htm","Because if it's true, then this whole thing leads down a lot more trails than he thoughtand every one of them is booby-trapped."
"/media/Dados/bases/SWDE/book/book-barnesandnoble/0665.htm","Praise for the first book in the Pacific War Series,"
"/media/Dados/bases/SWDE/book/book-barnesandnoble/0041.htm","* The long, bloody relationship between the Puritans and Indians that runs counter to the idyllic scene of the Thanksgiving feast"
