URL,EXTRACTED VALUE
"/media/Dados/bases/SWDE/book/book-barnesandnoble/0296.htm","""This really isn't new information, Ali. We disagree about Lydia. Can't it wait until I get back?"""
"/media/Dados/bases/SWDE/book/book-barnesandnoble/1625.htm","his shortwave radio, his telescope, his machinery, his library of"
"/media/Dados/bases/SWDE/book/book-barnesandnoble/0298.htm","The Warden had been far from impressed. ""A Tide Lord, eh?"""
"/media/Dados/bases/SWDE/book/book-barnesandnoble/0315.htm",turn me on so completely?
"/media/Dados/bases/SWDE/book/book-barnesandnoble/1951.htm","""Why not?"" Ramsey demanded, his irritation obvious."
"/media/Dados/bases/SWDE/book/book-barnesandnoble/0412.htm","She walked off down the hall, her cane briskly tapping along."
"/media/Dados/bases/SWDE/book/book-barnesandnoble/1389.htm",The words were oddly ominous and a clattering filled Richard’s ears as his teeth began to chatter.
