URL,EXTRACTED VALUE
"/media/Dados/bases/SWDE/book/book-barnesandnoble/1426.htm",Here's what can be safely revealed about
"/media/Dados/bases/SWDE/book/book-barnesandnoble/1728.htm","The entertaining third installment of bestseller Maguire's Wicked Years series, a revisionist chronicle of L. Frank Baum's classic"
"/media/Dados/bases/SWDE/book/book-barnesandnoble/0450.htm",Gr 4 Up
"/media/Dados/bases/SWDE/book/book-barnesandnoble/0624.htm","is the author of presidential bestsellers, including"
"/media/Dados/bases/SWDE/book/book-barnesandnoble/1539.htm",is the author of
