URL,EXTRACTED VALUE
"/media/Dados/bases/SWDE/book/book-barnesandnoble/0819.htm",Calli opened her eyes as Roger's four-wheel-drive truck came down the lane and pulled up next to them.
"/media/Dados/bases/SWDE/book/book-barnesandnoble/1100.htm",". There weren't a lot of jackals in the world, but the few he'd met were damn cute."
"/media/Dados/bases/SWDE/book/book-barnesandnoble/0353.htm",", you were treated to a sneak peek of"
"/media/Dados/bases/SWDE/book/book-barnesandnoble/1331.htm","upon the face of all the earth, and every tree, in the which is the fruit of a tree yielding seed; to you it shall be for meat."
"/media/Dados/bases/SWDE/book/book-barnesandnoble/1659.htm","reading my grades."""
"/media/Dados/bases/SWDE/book/book-barnesandnoble/1169.htm",(pause)
"/media/Dados/bases/SWDE/book/book-barnesandnoble/1154.htm",. In what ways does the past repeat itself? How are the characters shaped by past circumstances? When are their painful cycles to be broken?
"/media/Dados/bases/SWDE/book/book-barnesandnoble/0071.htm",say you are going to need willpower. I say
"/media/Dados/bases/SWDE/book/book-barnesandnoble/0486.htm","marine?"""
"/media/Dados/bases/SWDE/book/book-barnesandnoble/1284.htm",", which symbolizes Joanna's longing for freedom and her determination to deliver those she loves from slavery."
