URL,EXTRACTED VALUE
"/media/Dados/bases/SWDE/book/book-barnesandnoble/1730.htm",March family (Fictitious characters) -> Children's fiction
"/media/Dados/bases/SWDE/book/book-barnesandnoble/0972.htm",Autobiographical Fiction
"/media/Dados/bases/SWDE/book/book-barnesandnoble/0523.htm",Historical Romance - Victorian/Gilded Age
"/media/Dados/bases/SWDE/book/book-barnesandnoble/0770.htm",New York Times Notable Nonfiction of 2005
"/media/Dados/bases/SWDE/book/book-barnesandnoble/0183.htm",Christian Scientist Monitor's Best History Books of 2007
