URL,EXTRACTED VALUE
"/media/Dados/bases/SWDE/book/book-barnesandnoble/1934.htm","""And it's getting deeper the farther we go,"" replied Marshall. ""At some point, this branch pipe must have been filled with water."""
"/media/Dados/bases/SWDE/book/book-barnesandnoble/0945.htm","I stop, and there’s a polite silence. My face is prickling. “It, um, it is very . . .”"
"/media/Dados/bases/SWDE/book/book-barnesandnoble/1598.htm","""I mean, you know, is she in shape?"""
"/media/Dados/bases/SWDE/book/book-barnesandnoble/1010.htm",Myron felt his legs buckle a bit. He let himself land on the chaise.
"/media/Dados/bases/SWDE/book/book-barnesandnoble/1253.htm",“Mm. At least in here they’re too old to leap up and down.”
