URL,EXTRACTED VALUE
"/media/Dados/bases/SWDE/book/book-barnesandnoble/0883.htm","-- a powerful description of the time, and of a man in complete contradiction with himself."
"/media/Dados/bases/SWDE/book/book-barnesandnoble/1425.htm","-- a powerful description of the time, and of a man in complete contradiction with himself."
"/media/Dados/bases/SWDE/book/book-barnesandnoble/1040.htm","story published in 2003, was nominated for a National Magazine Award."
"/media/Dados/bases/SWDE/book/book-barnesandnoble/0344.htm","-- a powerful description of the time, and of a man in complete contradiction with himself."
"/media/Dados/bases/SWDE/book/book-barnesandnoble/1945.htm","came next, starring Denzel Washington and Angelina Jolie."
