URL,EXTRACTED VALUE
"/media/Dados/bases/SWDE/book/book-barnesandnoble/1345.htm",Lord of the Flies
"/media/Dados/bases/SWDE/book/book-barnesandnoble/0454.htm",How to Cook Everything
"/media/Dados/bases/SWDE/book/book-barnesandnoble/1509.htm","Elizabeth Bird, New York Public Library"
"/media/Dados/bases/SWDE/book/book-barnesandnoble/0128.htm",Holes
"/media/Dados/bases/SWDE/book/book-barnesandnoble/0769.htm","Elizabeth Bird, New York Public Library"
"/media/Dados/bases/SWDE/book/book-barnesandnoble/0308.htm",It's Your Time
"/media/Dados/bases/SWDE/book/book-barnesandnoble/1558.htm",Colbert Report
"/media/Dados/bases/SWDE/book/book-barnesandnoble/0681.htm",Why We Like This Book
