URL,EXTRACTED VALUE
"/media/Dados/bases/SWDE/book/book-barnesandnoble/1009.htm","sampson. Nay, as they dare. I will bite my thumb at them; which is a disgrace to them, if they bear it."
"/media/Dados/bases/SWDE/book/book-barnesandnoble/1472.htm","With that Ruth dropped the chocolate bunny to the floor, shattering it."
"/media/Dados/bases/SWDE/book/book-barnesandnoble/0730.htm","I yelled toward the kitchen, “Morning, Tom! Nice tree!”"
"/media/Dados/bases/SWDE/book/book-barnesandnoble/1038.htm",“Call me later?” she threw over her shoulder as she beat a hasty retreat out the side door.
"/media/Dados/bases/SWDE/book/book-barnesandnoble/1301.htm","""Norman has a wife and two sons,"" the marquess told"
"/media/Dados/bases/SWDE/book/book-barnesandnoble/1551.htm","“An autopsy, a postmortem, whatever you call it—I don’t want that done.”"
"/media/Dados/bases/SWDE/book/book-barnesandnoble/1265.htm","•The baby responds to familiar requests, such as waving bye-bye or being asked to give something to the parent."
"/media/Dados/bases/SWDE/book/book-barnesandnoble/0983.htm","“But . . . what are we going to do later on, if the real number comes out?”"
"/media/Dados/bases/SWDE/book/book-barnesandnoble/0117.htm",Alice waited. David waited too. He put his elbow on the desk and rested his chin in his hand.
"/media/Dados/bases/SWDE/book/book-barnesandnoble/0573.htm","The Minion thrashed and hissed as death overtook him. Then, finally, he stilled."
"/media/Dados/bases/SWDE/book/book-barnesandnoble/1461.htm","""I can never remember. I've got it written down somewhere. Upstairs."""
"/media/Dados/bases/SWDE/book/book-barnesandnoble/1110.htm","""Yeah. Let me in,"" he said. ""What’s going on?"""
"/media/Dados/bases/SWDE/book/book-barnesandnoble/1526.htm","""Dear me,"" a voice chuckled. ""A damsel in distress."""
"/media/Dados/bases/SWDE/book/book-barnesandnoble/1470.htm","""It is both,"" Miner replied. ""I won't tell you because I can't."""
"/media/Dados/bases/SWDE/book/book-barnesandnoble/1404.htm","Shukhov's hands were frozen, so when he got back to the warders' room with the steaming bucket he shoved them in the water. He felt warmer."
"/media/Dados/bases/SWDE/book/book-barnesandnoble/1442.htm","I picked up my bag. ‘Well, I can’t help you if you won’t say.’"
"/media/Dados/bases/SWDE/book/book-barnesandnoble/1359.htm","‘Well, I don’t like the way we have to turn all the lights off at night now,’ he admitted."
"/media/Dados/bases/SWDE/book/book-barnesandnoble/1527.htm","“Food and basic supplies, bound for LodeCorp Mining asteroid Nine-Alpha-Four, Roche system.”"
"/media/Dados/bases/SWDE/book/book-barnesandnoble/1642.htm","""For him,"" Kade pointed out. ""Not us."""
"/media/Dados/bases/SWDE/book/book-barnesandnoble/0142.htm","She was right. Whatever mess Gavin had gotten himself and his family into, I couldn’t fix it. Foolish to even try."
"/media/Dados/bases/SWDE/book/book-barnesandnoble/1853.htm","""The story is a practical parable,"" Bill continued. ""So it's not just what's"
"/media/Dados/bases/SWDE/book/book-barnesandnoble/0632.htm",It was something only a true dog would hurl in Marguerite's face.
"/media/Dados/bases/SWDE/book/book-barnesandnoble/0111.htm",But not enough.
"/media/Dados/bases/SWDE/book/book-barnesandnoble/0032.htm","My birthday is in March, and that year it fell during an"
"/media/Dados/bases/SWDE/book/book-barnesandnoble/1143.htm","“This cannot be happening,” I said."
"/media/Dados/bases/SWDE/book/book-barnesandnoble/0709.htm",You give a warning. You get a fit.
"/media/Dados/bases/SWDE/book/book-barnesandnoble/1913.htm","Toni cocked her head, raised an eyebrow. ""Let me see it,"" she said. ""Not my thing? What is my thing?"""
"/media/Dados/bases/SWDE/book/book-barnesandnoble/1825.htm","Valin smiled at them, but not in a friendly way. �Two maladjusted want-to-be bounty hunters and their dressed-up protocol droid.�"
"/media/Dados/bases/SWDE/book/book-barnesandnoble/0830.htm","belief. In his boyhood at least, my chaplain was presumably not aware (nor"
"/media/Dados/bases/SWDE/book/book-barnesandnoble/0492.htm","All Daddy, that's me."
"/media/Dados/bases/SWDE/book/book-barnesandnoble/0975.htm","When you first look in the mirror in the morning, do you say to yourself, ""Today, I'm going to change the world!""?"
"/media/Dados/bases/SWDE/book/book-barnesandnoble/0556.htm","“Well, hell,” he groaned. “It is the only time we had real badges pinned to us.”"
"/media/Dados/bases/SWDE/book/book-barnesandnoble/1794.htm","""Thanks."" ""Friends,"" Xhinna said solemnly. ""Good,"" Fiona replied, snuggling up against her. ""I can't stand sleeping alone."""
"/media/Dados/bases/SWDE/book/book-barnesandnoble/1751.htm","Niles’s glance met his. “We’re not punishing you. We’re trying to keep you alive,” he said, very softly."
"/media/Dados/bases/SWDE/book/book-barnesandnoble/1737.htm","""Troy Morgan,"" he said, as if in answer. ""My boss would like to talk to you."""
"/media/Dados/bases/SWDE/book/book-barnesandnoble/1813.htm","""Did too."""
"/media/Dados/bases/SWDE/book/book-barnesandnoble/0252.htm","“The safe house is real close,” the director told him. “Shouldn’t take long. It might even be over before you get there.”"
"/media/Dados/bases/SWDE/book/book-barnesandnoble/0439.htm",Vitamin B
"/media/Dados/bases/SWDE/book/book-barnesandnoble/1739.htm","""Yeah, Mom,"" Lyle said. ""She's waiting at the Lost and Found?"""
"/media/Dados/bases/SWDE/book/book-barnesandnoble/1730.htm","""We've got father and mother, and each other, anyhow,"" said Beth, contentedly, from her corner."
"/media/Dados/bases/SWDE/book/book-barnesandnoble/0854.htm","“So,” she says, and remembers that Deborah is a graduate student somewhere, in something. “School is good?”"
"/media/Dados/bases/SWDE/book/book-barnesandnoble/1241.htm","[3] The quotation is from Adams to Benjamin Rush, 17 August 1812, in John A. Schutz and Douglass Adair, eds.,"
"/media/Dados/bases/SWDE/book/book-barnesandnoble/1086.htm","And they had been safe, perched on a deep ledge inside the cave, waiting for the storm to blow itself out before sailing home for supper."
"/media/Dados/bases/SWDE/book/book-barnesandnoble/1776.htm",Both were now approaching from behind.
"/media/Dados/bases/SWDE/book/book-barnesandnoble/1000.htm",5. Bennington College
