URL,EXTRACTED VALUE
"/sdd/edimar/Desktop/doutorado/doutorado04/bases/WEIR/videogame/www.metacritic.com/psx_disneysaladdininnasirasrevenge.html",Simply too average for anything to stand out.
"/sdd/edimar/Desktop/doutorado/doutorado04/bases/WEIR/videogame/www.metacritic.com/psx_backyardsoccer.html","Some kid games are fun for adults, Backyard Soccer is not one of those games but it is very well done game for younger kids."
"/sdd/edimar/Desktop/doutorado/doutorado04/bases/WEIR/videogame/www.metacritic.com/psx_vip.html","Numbingly repetitive and distressingly difficult. [Dec 2001, p.175]"
"/sdd/edimar/Desktop/doutorado/doutorado04/bases/WEIR/videogame/www.metacritic.com/psx_mtvsportstjlavinsultimatebmx.html","The problem with the controls is that they don't seem accurate, causing sloppy game play."
"/sdd/edimar/Desktop/doutorado/doutorado04/bases/WEIR/videogame/www.metacritic.com/xbox360_operationdarkness.html","So while it falls short of greatness, Operation Darkness can content itself with being merely a fun game with an amazing premise."
"/sdd/edimar/Desktop/doutorado/doutorado04/bases/WEIR/videogame/www.metacritic.com/psx_twistedmetalsmallbrawl.html","""Twisted Metal 2"" is light years beyond Small Brawl. Small Brawl is more akin to a Gameboy Advance game than a full fledged PSX SKU."
"/sdd/edimar/Desktop/doutorado/doutorado04/bases/WEIR/videogame/www.metacritic.com/psx_gundambattleassault.html","This isn't a game for serious fighter fans, but it's definitely one for Gundam fans, Wing or otherwise."
"/sdd/edimar/Desktop/doutorado/doutorado04/bases/WEIR/videogame/www.metacritic.com/psx_polarissnocross.html",It's purely an arcade experience but it's incredibly fun and I was really impressed with Vicarious Visions' track designs.
"/sdd/edimar/Desktop/doutorado/doutorado04/bases/WEIR/videogame/www.metacritic.com/xbox360_championshipmanager2007.html","It's a decent management game, truth be told, although it's still no ""Footy Man."" [May 2007, p.82]"
