URL,EXTRACTED VALUE
"/sdd/edimar/Desktop/doutorado/doutorado04/bases/WEIR/videogame/www.metacritic.com/psx_disneysaladdininnasirasrevenge.html","The movie wasn't lucky enough to appear in theaters, but Disney didn't miss the window to create an entire 3D platformer out of it."
"/sdd/edimar/Desktop/doutorado/doutorado04/bases/WEIR/videogame/www.metacritic.com/xbox360_popcaparcadevol1.html","This compilation features Bejeweled 2, AstroPop, Feeding Frenzy and Zuma."
"/sdd/edimar/Desktop/doutorado/doutorado04/bases/WEIR/videogame/www.metacritic.com/psx_superpuzzlefighter2turbo.html",A Tetris-esque puzzle game featuring characters from many Capcom games.
"/sdd/edimar/Desktop/doutorado/doutorado04/bases/WEIR/videogame/www.metacritic.com/xbox360_destroyallhumanspathofthefuron.html",Crypto takes a trip of enlightenment and destruction through the funky 1970s.
"/sdd/edimar/Desktop/doutorado/doutorado04/bases/WEIR/videogame/www.metacritic.com/psx_nflgameday2004.html",The latest in Sony's line of NFL football games comes to the PS One.
"/sdd/edimar/Desktop/doutorado/doutorado04/bases/WEIR/videogame/www.metacritic.com/xbox360_halflife2theorangebox.html",Games included in The Orange Box compilation: The original
"/sdd/edimar/Desktop/doutorado/doutorado04/bases/WEIR/videogame/www.metacritic.com/psx_tonyhawksproskater.html",The game that first captured the true feel of skateboarding and truly defined the extreme sports action game genre.
"/sdd/edimar/Desktop/doutorado/doutorado04/bases/WEIR/videogame/www.metacritic.com/psx_smurfracer.html",The original Blue Man Group joins the relatively crowded world of kart racing.
"/sdd/edimar/Desktop/doutorado/doutorado04/bases/WEIR/videogame/www.metacritic.com/psx_acecombat2.html",Dogfights have never been this much fun! ACE COMBAT 2 lets you get into your own fighter plane and shoot your opponents into fiery death. [Namco]
"/sdd/edimar/Desktop/doutorado/doutorado04/bases/WEIR/videogame/www.metacritic.com/psx_simpsonswrestling.html","The TV show's cast supplies the vocals in this ""wrestling"" (there's ironically not much wrestling involved!) game for Springfield supremacy."
"/sdd/edimar/Desktop/doutorado/doutorado04/bases/WEIR/videogame/www.metacritic.com/psx_metalslugx.html",The classic side-scrolling shooter is alive and kicking with the most recent edition to the Metal Slug series.
"/sdd/edimar/Desktop/doutorado/doutorado04/bases/WEIR/videogame/www.metacritic.com/psx_tekken3.html","...Four years later, on Jin Kazama's 19th birthday, the curtains rise for the King of Iron Fist Tournament 3. [Namco]"
"/sdd/edimar/Desktop/doutorado/doutorado04/bases/WEIR/videogame/www.metacritic.com/psx_highheatbaseball2002.html","Customization freaks who like to play with hundreds of control, managerial, and trading options should be at home with this baseball sim."
"/sdd/edimar/Desktop/doutorado/doutorado04/bases/WEIR/videogame/www.metacritic.com/xbox360_wet.html","Wet is an over-the-top action game that introduces Ruby, a lethal heroine who will take any job as she likes it and the price is right."
"/sdd/edimar/Desktop/doutorado/doutorado04/bases/WEIR/videogame/www.metacritic.com/xbox360_fearfiles.html",campaign as well as the award-winning expansion pack
"/sdd/edimar/Desktop/doutorado/doutorado04/bases/WEIR/videogame/www.metacritic.com/psx_mtvsportstjlavinsultimatebmx.html","Listen to the punk/rap/rock soundtrack while competing as one of ten professional BMX riders in three areas: dirt, vert, and street."
"/sdd/edimar/Desktop/doutorado/doutorado04/bases/WEIR/videogame/www.metacritic.com/psx_castlevaniachronicles.html","Konami's PlayStation port of the Japanese X68000 old-school 2D side-scrolling title released in the early 90s also includes a new ""arranged"" version."
