URL,EXTRACTED VALUE
"/sdd/edimar/Desktop/doutorado/doutorado04/bases/WEIR/videogame/www.metacritic.com/xbox360_justcause.html","A laugh-out-loud, gun toting riot of action. [Nov 2006, p.67]"
"/sdd/edimar/Desktop/doutorado/doutorado04/bases/WEIR/videogame/www.metacritic.com/xbox360_guitarheroaerosmith.html","Thankfully, the inclusion of master tracks and a slick menu interface means that this title sounds and plays exactly how it ought to."
"/sdd/edimar/Desktop/doutorado/doutorado04/bases/WEIR/videogame/www.metacritic.com/xbox360_bluedragon.html","Enormous, intelligent, wily - a true dragon. [Sept 2007, p.98]"
"/sdd/edimar/Desktop/doutorado/doutorado04/bases/WEIR/videogame/www.metacritic.com/xbox360_needforspeedcarbon.html",Need For Speed Carbon takes the lead among next-gen street racers.
"/sdd/edimar/Desktop/doutorado/doutorado04/bases/WEIR/videogame/www.metacritic.com/xbox360_mercenaries2worldinflames.html","Mercs 2 is a largely successful effort that will literally give you more ""bang"" for your buck than most games out there."
"/sdd/edimar/Desktop/doutorado/doutorado04/bases/WEIR/videogame/www.metacritic.com/xbox360_tonyhawksprovingground.html","While the Tony Hawk franchise soars once again, it certainly hasn’t flown into the same stratosphere of excellence reached by earlier Tony Hawk games."
"/sdd/edimar/Desktop/doutorado/doutorado04/bases/WEIR/videogame/www.metacritic.com/xbox360_brothersinarmshellshighway.html","Hell's Highway is a polished, coherent experience that, despite a few setbacks, remains compelling with interesting mechanics and compelling gameplay."
"/sdd/edimar/Desktop/doutorado/doutorado04/bases/WEIR/videogame/www.metacritic.com/xbox360_fullauto.html",If you are of the old school class that enjoys the simple things in life you will undoubtedly find a lot to like about this game.
