URL,EXTRACTED VALUE
"/sdd/edimar/Desktop/doutorado/doutorado04/bases/WEIR/videogame/www.metacritic.com/xbox360_crossfire.html","Drearily predictable stain on the franchise. [Apr 2008, p.88]"
"/sdd/edimar/Desktop/doutorado/doutorado04/bases/WEIR/videogame/www.metacritic.com/xbox360_turok.html","The game is much better than what I expected it to be, but the flaws cannot be overlooked."
"/sdd/edimar/Desktop/doutorado/doutorado04/bases/WEIR/videogame/www.metacritic.com/xbox360_marbleblastultra.html",The multiplayer is probably the best part of this game. It combines simple fun and “pick-up-and-playability” very well.
"/sdd/edimar/Desktop/doutorado/doutorado04/bases/WEIR/videogame/www.metacritic.com/xbox360_stuntmanignition.html","If the heavy focus on trial and error doesn't rattle you, Stuntman: Ignition can be some explosive fun."
"/sdd/edimar/Desktop/doutorado/doutorado04/bases/WEIR/videogame/www.metacritic.com/xbox360_tombraiderlegend.html",If they continue to deliver this caliber of game I really don’t think the fans will miss Core Design too much.
"/sdd/edimar/Desktop/doutorado/doutorado04/bases/WEIR/videogame/www.metacritic.com/xbox360_geometrywarsretroevolved.html","If you're looking for a throwback to the Space Invader days with the futuristic colors and sound of the powerful 360, this is your game."
"/sdd/edimar/Desktop/doutorado/doutorado04/bases/WEIR/videogame/www.metacritic.com/xbox360_narutoriseofaninja.html","Naruto: Rise of Ninja is easily one of the better games to have been inspired by an anime series, that both fans and non-fans can enjoy together."
"/sdd/edimar/Desktop/doutorado/doutorado04/bases/WEIR/videogame/www.metacritic.com/xbox360_justcause.html","It’s often a glitchy and shallow experience, yet you’ll have an absolute blast playing it."
"/sdd/edimar/Desktop/doutorado/doutorado04/bases/WEIR/videogame/www.metacritic.com/xbox360_beowulf.html","If you really must satisfy your bloodlust, then ""Conan"" is the slightly better option. [Jan 2008, p.91]"
"/sdd/edimar/Desktop/doutorado/doutorado04/bases/WEIR/videogame/www.metacritic.com/xbox360_condemnedcriminalorigins.html","An intense, exciting, experience that is sure to have you slowing down your pace a bit to make sure the boogie man isn’t around the next corner."
"/sdd/edimar/Desktop/doutorado/doutorado04/bases/WEIR/videogame/www.metacritic.com/xbox360_uno.html","Creating Uno for Xbox probably took 1/1000 the man-hours of the average 360 game, but its replay value is considerably greater."
"/sdd/edimar/Desktop/doutorado/doutorado04/bases/WEIR/videogame/www.metacritic.com/xbox360_testdriveunlimited.html",The innovations and online aspects have shown that this series is once again a force to be reckoned with.
"/sdd/edimar/Desktop/doutorado/doutorado04/bases/WEIR/videogame/www.metacritic.com/xbox360_facebreaker.html",FaceBreaker is perhaps one of the few games that has driven me to despair.
"/sdd/edimar/Desktop/doutorado/doutorado04/bases/WEIR/videogame/www.metacritic.com/xbox360_dancedancerevolutionuniverse.html",The initial focus on training and gently bringing novice players into the fold is definitely one of the biggest selling points.
"/sdd/edimar/Desktop/doutorado/doutorado04/bases/WEIR/videogame/www.metacritic.com/xbox360_geometrywarsretroevolved2.html","The daddy is back. [Issue#37, p.116]"
"/sdd/edimar/Desktop/doutorado/doutorado04/bases/WEIR/videogame/www.metacritic.com/xbox360_blazingangelssquadronsofww2.html","You know, there's a crowd out there that Blazing Angels: Squadrons of WWII was built for, and it's spelled out in clear letters- ARCADE."
"/sdd/edimar/Desktop/doutorado/doutorado04/bases/WEIR/videogame/www.metacritic.com/xbox360_stranglehold.html","The game is short, explosive and downright slick and it's everything we hoped it was going to be."
"/sdd/edimar/Desktop/doutorado/doutorado04/bases/WEIR/videogame/www.metacritic.com/xbox360_meettherobinsons.html","Button mashing is boring. [Issue#20, p.93]"
"/sdd/edimar/Desktop/doutorado/doutorado04/bases/WEIR/videogame/www.metacritic.com/xbox360_ncaamarchmadness07.html","Beneath numerous flaws there's a decent basketball game in March Madness 07, but you've got to dig too deep to find it."
"/sdd/edimar/Desktop/doutorado/doutorado04/bases/WEIR/videogame/www.metacritic.com/xbox360_callofduty4modernwarfare.html",Call of Duty 4 easily earns its place among the elite shooters available for the Xbox 360.
"/sdd/edimar/Desktop/doutorado/doutorado04/bases/WEIR/videogame/www.metacritic.com/xbox360_fifasoccer06.html",It's missing far too much.
"/sdd/edimar/Desktop/doutorado/doutorado04/bases/WEIR/videogame/www.metacritic.com/xbox360_samuraiwarriors2.html","Ultimately, it’s barely any better or worse than the ones that came before it – and probably after as well."
"/sdd/edimar/Desktop/doutorado/doutorado04/bases/WEIR/videogame/www.metacritic.com/xbox360_hourofvictory.html",Hour of Victory is simply too bad for anyone to spend their money on.
"/sdd/edimar/Desktop/doutorado/doutorado04/bases/WEIR/videogame/www.metacritic.com/xbox360_chroniclesofnarniaprincecaspian.html","Unless you are an absolute die-hard Narni-ite, this game belongs as far away from your 360 as humanly possible."
"/sdd/edimar/Desktop/doutorado/doutorado04/bases/WEIR/videogame/www.metacritic.com/xbox360_callofduty3.html","If you've played one Call of Duty game, you know exactly what to expect from this one. Of course, that's not necessarily a bad thing."
"/sdd/edimar/Desktop/doutorado/doutorado04/bases/WEIR/videogame/www.metacritic.com/xbox360_nhl07.html",NHL 07's thrilling new skill stick makes up for its bare-bones package.
"/sdd/edimar/Desktop/doutorado/doutorado04/bases/WEIR/videogame/www.metacritic.com/xbox360_nbalive06.html",Here is hoping the next one will feature a full franchise mode and is a little more polished overall.
"/sdd/edimar/Desktop/doutorado/doutorado04/bases/WEIR/videogame/www.metacritic.com/xbox360_nhl2k6.html","I haven't enjoyed a hockey game this much in a long time (it's just cheaper on the original Xbox). [Jan 2006, p.48]"
"/sdd/edimar/Desktop/doutorado/doutorado04/bases/WEIR/videogame/www.metacritic.com/xbox360_doom.html","This Xbox 360 version of the game stays mostly faithful to the original, and it holds up well after all these years."
"/sdd/edimar/Desktop/doutorado/doutorado04/bases/WEIR/videogame/www.metacritic.com/xbox360_dynastywarriors6.html","The best thing to say about Dynasty Warriors 6 is that it's an easy way to kill quite a few hours, but that doesn't make it particularly good."
"/sdd/edimar/Desktop/doutorado/doutorado04/bases/WEIR/videogame/www.metacritic.com/xbox360_operationdarkness.html",It's a very disappointing game in nearly every aspect.
"/sdd/edimar/Desktop/doutorado/doutorado04/bases/WEIR/videogame/www.metacritic.com/xbox360_twoworlds.html",Two Worlds is not the worst game on the Xbox 360. But it is the worst RPG available for Microsoft's console.
"/sdd/edimar/Desktop/doutorado/doutorado04/bases/WEIR/videogame/www.metacritic.com/xbox360_gun.html","The big surprise comes from the strength of the narrative, which crackles with snappy dialogue and characters that show real emotion. [Jan 2006, p.47]"
"/sdd/edimar/Desktop/doutorado/doutorado04/bases/WEIR/videogame/www.metacritic.com/xbox360_nba2k8.html","It's as good as everyone expects it to be, but that's also the problem; the game is great, but it plays it too safe."
"/sdd/edimar/Desktop/doutorado/doutorado04/bases/WEIR/videogame/www.metacritic.com/xbox360_projectsylpheed.html",It’s a good shooter romp that could have been great.
"/sdd/edimar/Desktop/doutorado/doutorado04/bases/WEIR/videogame/www.metacritic.com/psx_finalfantasy8.html","Unfortunately while the game is graphically superior to FFVII, in terms of setting, story and controls it lags way behind."
"/sdd/edimar/Desktop/doutorado/doutorado04/bases/WEIR/videogame/www.metacritic.com/xbox360_fuzionfrenzy2.html","In the end, Fuzion Frenzy 2 is simply an average (at best) party/compilation game that lacks depth, an overall sense of continuity and fun."
"/sdd/edimar/Desktop/doutorado/doutorado04/bases/WEIR/videogame/www.metacritic.com/xbox360_nbalive08.html","This shot definitely goes in, but not before taking a few lucky bounces on the rim."
"/sdd/edimar/Desktop/doutorado/doutorado04/bases/WEIR/videogame/www.metacritic.com/xbox360_lost.html","Not exactly a mess of plane wreck proportions, but it is nonetheless thoroughly unremarkable and only worth the interest to see what happens."
"/sdd/edimar/Desktop/doutorado/doutorado04/bases/WEIR/videogame/www.metacritic.com/xbox360_alienhominidhd.html","Alien Hominid HD appears to be cute on the surface, but the vicious and difficult shooter gameplay will separate the men from the boys."
"/sdd/edimar/Desktop/doutorado/doutorado04/bases/WEIR/videogame/www.metacritic.com/xbox360_guitarhero2.html","This is, by far, one of the best games on any platform – ever."
"/sdd/edimar/Desktop/doutorado/doutorado04/bases/WEIR/videogame/www.metacritic.com/xbox360_ironman.html","Any way you cut it, it's just not worth the aggravation to play through what is just another botched licensed movie game. [June 2008, p.81]"
"/sdd/edimar/Desktop/doutorado/doutorado04/bases/WEIR/videogame/www.metacritic.com/xbox360_darkmessiahofmightandmagicelements.html","Dark Messiah is a frustrating title, since moments of fun are outweighed by long stretches of tedium."
"/sdd/edimar/Desktop/doutorado/doutorado04/bases/WEIR/videogame/www.metacritic.com/xbox360_rocketmenaxisofevil.html","The best way to describe the gameplay in Rocketmen: Axis of Evil would be to call it the bastard child of ""Flash Gordon"" and ""Smash TV."""
"/sdd/edimar/Desktop/doutorado/doutorado04/bases/WEIR/videogame/www.metacritic.com/xbox360_masseffect.html","It’s a game that’s accessible to players who aren’t familiar with traditional RPGs, but above all, a real treat for sci-fi lovers."
"/sdd/edimar/Desktop/doutorado/doutorado04/bases/WEIR/videogame/www.metacritic.com/xbox360_legostarwarsthecompletesaga.html","Even if the new bells and whistles aren't enough to bring back established fans, this is still Lego Star Wars at its finest."
"/sdd/edimar/Desktop/doutorado/doutorado04/bases/WEIR/videogame/www.metacritic.com/xbox360_kingkong.html","The main story only lasts about 10 hours, but it is 10 hours you will not soon forget."
"/sdd/edimar/Desktop/doutorado/doutorado04/bases/WEIR/videogame/www.metacritic.com/xbox360_pinballfx.html","The total of three available tables is just a shade below acceptable. [Issue #22, p.114]"
"/sdd/edimar/Desktop/doutorado/doutorado04/bases/WEIR/videogame/www.metacritic.com/xbox360_bionicleheroes.html","I cannot recommend this game for adults, kids, or even a rental, unless you plan to find humour in a so bad it's good kind of way."
"/sdd/edimar/Desktop/doutorado/doutorado04/bases/WEIR/videogame/www.metacritic.com/xbox360_blacksitearea51.html",BlackSite: Area 51 is an ordinary first-person shooter that's held back by a collection of bugs and other issues.
"/sdd/edimar/Desktop/doutorado/doutorado04/bases/WEIR/videogame/www.metacritic.com/xbox360_earthdefenseforce2017.html","This is what gaming is all about: simple controls, nonstop action, and buckets of fun. [May 2007, p.84]"
"/sdd/edimar/Desktop/doutorado/doutorado04/bases/WEIR/videogame/www.metacritic.com/xbox360_aloneinthedark.html","If you can endure some vexing technical flaws, Alone in the Dark can be a clever, satisfying adventure."
"/sdd/edimar/Desktop/doutorado/doutorado04/bases/WEIR/videogame/www.metacritic.com/xbox360_overlord.html",Overlord is a fun and original title that takes some great elements across a spectrum of genres and applies them very well together.
"/sdd/edimar/Desktop/doutorado/doutorado04/bases/WEIR/videogame/www.metacritic.com/xbox360_wwesmackdownvsraw2007.html",Another bone of contention is your AI tag-team partner that can be totally oblivious to your situation as you’re getting the hit shicked out of you.
"/sdd/edimar/Desktop/doutorado/doutorado04/bases/WEIR/videogame/www.metacritic.com/xbox360_vivapinata.html",Like a breath of fresh air. The gardening and raising of piñatas is great fun and good pastime for the holiday season. [Jan 2007]
"/sdd/edimar/Desktop/doutorado/doutorado04/bases/WEIR/videogame/www.metacritic.com/xbox360_kaneandlynchdeadmen.html",Popcorn-crunching blockbuster in need of better scripting.
"/sdd/edimar/Desktop/doutorado/doutorado04/bases/WEIR/videogame/www.metacritic.com/xbox360_supremecommander.html",Stick with the PC version.
"/sdd/edimar/Desktop/doutorado/doutorado04/bases/WEIR/videogame/www.metacritic.com/xbox360_devilmaycry4.html","It's polished and slick, it's got gargantuan-sized gods, near-musical interludes, and infernal, flaming bosses. It's nothing short of brilliant."
"/sdd/edimar/Desktop/doutorado/doutorado04/bases/WEIR/videogame/www.metacritic.com/xbox360_darkness.html","Part of The Darkness’s charm is its wealth of extravagant, often irrelevant detail."
"/sdd/edimar/Desktop/doutorado/doutorado04/bases/WEIR/videogame/www.metacritic.com/xbox360_shadowrun.html","Shadowrun is definitely good--""Counter-Strike with magic"" works very well--but it should be great. [Aug 2007, p.76]"
"/sdd/edimar/Desktop/doutorado/doutorado04/bases/WEIR/videogame/www.metacritic.com/xbox360_nplus.html","N+ may not look like much, but it’s fun and addictive."
"/sdd/edimar/Desktop/doutorado/doutorado04/bases/WEIR/videogame/www.metacritic.com/xbox360_bluedragon.html","A solid battle system is flanked hour after hour by attention-grabbing cutscenes and cinematics. Fun to watch, fun to play."
"/sdd/edimar/Desktop/doutorado/doutorado04/bases/WEIR/videogame/www.metacritic.com/xbox360_fifasoccer08.html",FIFA 08 is definitely a marked improvement as it has continued to evolve over the past few years.
"/sdd/edimar/Desktop/doutorado/doutorado04/bases/WEIR/videogame/www.metacritic.com/xbox360_flatoutultimatecarnage.html",FlatOut: Ultimate Carnage comes highly recommended for anyone who enjoys arcade racing titles. This is a game that definitely lives up to its title.
"/sdd/edimar/Desktop/doutorado/doutorado04/bases/WEIR/videogame/www.metacritic.com/xbox360_uefachampionsleague20062007.html","Compared to EA’s last 360 FIFA release, the game’s flow seems much more natural than FIFA 07’s sometimes bizarrely inaccurate passing and crossing."
"/sdd/edimar/Desktop/doutorado/doutorado04/bases/WEIR/videogame/www.metacritic.com/xbox360_castlecrashers.html","Castle Crashers, even with the faults it currently has is quite possibly still the best Xbox LIVE Arcade game available."
"/sdd/edimar/Desktop/doutorado/doutorado04/bases/WEIR/videogame/www.metacritic.com/xbox360_battlefieldbadcompany.html","If you're looking for a shooter to carry you through the hot summer months, I highly recommend you enlist in Battlefield: Bad Company."
"/sdd/edimar/Desktop/doutorado/doutorado04/bases/WEIR/videogame/www.metacritic.com/xbox360_pacmanchampionshipedition.html","Filing stuff. [Issue#23, p.98]"
"/sdd/edimar/Desktop/doutorado/doutorado04/bases/WEIR/videogame/www.metacritic.com/xbox360_vikingbattleforasgard.html",The combat is a piece of cake since you don’t have to worry about a pressing some elaborate button combination to pull off your moves.
"/sdd/edimar/Desktop/doutorado/doutorado04/bases/WEIR/videogame/www.metacritic.com/xbox360_tonyhawksproject8.html","Tony Hawk is back to what maters, skating without all the extra annoyances Hawk games have started to become."
"/sdd/edimar/Desktop/doutorado/doutorado04/bases/WEIR/videogame/www.metacritic.com/xbox360_condemned2bloodshot.html",Quotation forthcoming. [Apr 2008]
"/sdd/edimar/Desktop/doutorado/doutorado04/bases/WEIR/videogame/www.metacritic.com/xbox360_fightnightround3.html","Between the supreme visual polish and deep, excellent play, this is the uncontested champ."
"/sdd/edimar/Desktop/doutorado/doutorado04/bases/WEIR/videogame/www.metacritic.com/xbox360_sealifesafari.html",Sea Life Safari's on-rails adventuring is about as exciting as scuba diving in your own bathtub.
"/sdd/edimar/Desktop/doutorado/doutorado04/bases/WEIR/videogame/www.metacritic.com/xbox360_talesofvesperia.html","The graphics are stunning, the characters are interesting and the game is simply really fun to play."
"/sdd/edimar/Desktop/doutorado/doutorado04/bases/WEIR/videogame/www.metacritic.com/xbox360_beijing2008.html","They still haven't worked out how to go beyond button-mashing without breaking people. [Aug 2008, p.75]"
"/sdd/edimar/Desktop/doutorado/doutorado04/bases/WEIR/videogame/www.metacritic.com/xbox360_ikaruga.html","I recommend it to those who grew up in arcades, those who enjoy a challenge, and casual gamers looking for something they can pick up and play."
"/sdd/edimar/Desktop/doutorado/doutorado04/bases/WEIR/videogame/www.metacritic.com/xbox360_marvelultimatealliance.html",A good game with a great longevity factor.
"/sdd/edimar/Desktop/doutorado/doutorado04/bases/WEIR/videogame/www.metacritic.com/xbox360_simpsonsgame.html","Untimately, though, The Simpsons lives and dies on the strength of its gameplay and here it doesn't particularly shine. [Nov 2007, p.64]"
"/sdd/edimar/Desktop/doutorado/doutorado04/bases/WEIR/videogame/www.metacritic.com/xbox360_universeatwarearthassault.html",There is a very playable game hiding underneath some serious issues here. Whether you can overlook them is up to you.
"/sdd/edimar/Desktop/doutorado/doutorado04/bases/WEIR/videogame/www.metacritic.com/xbox360_tigerwoodspgatour09.html","Tiger Woods PGA Tour 09, like so many other sports games, doesn’t have a headlining feature, but the handful of new additions perform fairly well."
"/sdd/edimar/Desktop/doutorado/doutorado04/bases/WEIR/videogame/www.metacritic.com/xbox360_ninjagaiden2.html",Ninja Gaiden II is easily one of the best action games on Xbox 360.
"/sdd/edimar/Desktop/doutorado/doutorado04/bases/WEIR/videogame/www.metacritic.com/xbox360_incrediblehulk2008.html","You won't like it when this simplistic, repetitive, and occasionally broken game makes you angry."
"/sdd/edimar/Desktop/doutorado/doutorado04/bases/WEIR/videogame/www.metacritic.com/xbox360_segasuperstarstennis.html","Superstars Tennis may as well be a dream for Sega fans, but hardly will win any converts."
"/sdd/edimar/Desktop/doutorado/doutorado04/bases/WEIR/videogame/www.metacritic.com/xbox360_donkingpresentsprizefighter.html","I can see where 2K Sports was trying to go with Prizefighter, but in the end it just falls flat."
"/sdd/edimar/Desktop/doutorado/doutorado04/bases/WEIR/videogame/www.metacritic.com/xbox360_blitztheleague.html","As playable as ever but too similar to the original even at a lower price tag. [Issue 18, p.94]"
"/sdd/edimar/Desktop/doutorado/doutorado04/bases/WEIR/videogame/www.metacritic.com/xbox360_infiniteundiscovery.html",This isn't a game marred with horrendous bugs or unplayable combat. And it's not boring. It's just misguided.
"/sdd/edimar/Desktop/doutorado/doutorado04/bases/WEIR/videogame/www.metacritic.com/xbox360_assassinscreed.html",Just don't draw any conclusions until you've played the game from beginning to end.
"/sdd/edimar/Desktop/doutorado/doutorado04/bases/WEIR/videogame/www.metacritic.com/xbox360_eternalsonata.html",Eternal Sonata is a wonderful ensemble of fascinating characters and a remarkable story about the life (and death) of Frederic Chopin.
"/sdd/edimar/Desktop/doutorado/doutorado04/bases/WEIR/videogame/www.metacritic.com/xbox360_toohuman.html","A bit too repetitive for its own good, but the unique controls and the online co-op are quite nice indeed."
"/sdd/edimar/Desktop/doutorado/doutorado04/bases/WEIR/videogame/www.metacritic.com/xbox360_bullyscholarshipedition.html",Rockstar have done a good job of porting the game from thePlayStation 2 to one of the most entertaining XBOX 360 titles available.
"/sdd/edimar/Desktop/doutorado/doutorado04/bases/WEIR/videogame/www.metacritic.com/psx_finalfantasyorigins.html","Pleasant graphically, but disturbing as a more complete experience."
"/sdd/edimar/Desktop/doutorado/doutorado04/bases/WEIR/videogame/www.metacritic.com/xbox360_worms.html","The ""Worms"" series has been around for years, but it's finally found the perfect home on Live Arcade. [May 2007, p.68]"
"/sdd/edimar/Desktop/doutorado/doutorado04/bases/WEIR/videogame/www.metacritic.com/xbox360_blazingangelssecretmissions.html","So if it’s short on believability and plain fairness, what does Blazing Angels 2 have to offer? In a word: variety. [Oct 2007, p.110]"
"/sdd/edimar/Desktop/doutorado/doutorado04/bases/WEIR/videogame/www.metacritic.com/xbox360_walle.html","Whilst WALL-E might be the most adorable robot you’ll ever see, the game certainly isn’t. The game feels rushed and is a very poor use of the license."
"/sdd/edimar/Desktop/doutorado/doutorado04/bases/WEIR/videogame/www.metacritic.com/xbox360_pure.html","Pure is one of the most appealing arcade games of the last years. It's uncompromising, full of energy and with high production values."
"/sdd/edimar/Desktop/doutorado/doutorado04/bases/WEIR/videogame/www.metacritic.com/xbox360_enemyterritoryquakewars.html","Sadly, ET:QW looks like a good idea that wasn't properly fleshed out to meet that potential."
"/sdd/edimar/Desktop/doutorado/doutorado04/bases/WEIR/videogame/www.metacritic.com/xbox360_vampiresrain.html",Avoid Vampire Rain like a vampire would avoid sharing a garlic burger with a priest on Miami Beach at noon.
"/sdd/edimar/Desktop/doutorado/doutorado04/bases/WEIR/videogame/www.metacritic.com/xbox360_braid.html",An amazing title which further solidifies Xbox Live Arcade's position as a fantastic platform for gamers and developers alike. Highly recommended.
"/sdd/edimar/Desktop/doutorado/doutorado04/bases/WEIR/videogame/www.metacritic.com/xbox360_tiqal.html",You can't help but feel that TiQal is a few years too late.
"/sdd/edimar/Desktop/doutorado/doutorado04/bases/WEIR/videogame/www.metacritic.com/xbox360_bombermanactzero.html",This game has no variety and is just boring to play.
"/sdd/edimar/Desktop/doutorado/doutorado04/bases/WEIR/videogame/www.metacritic.com/xbox360_emenchantarm.html","A solid Japanese RPG that fans of the genre will enjoy, but not quite superb enough to interest new players in the genre."
"/sdd/edimar/Desktop/doutorado/doutorado04/bases/WEIR/videogame/www.metacritic.com/xbox360_everyextendextraextreme.html","The player is barely involved in the game at all, which effectively makes it little more than a snazzy light show."
"/sdd/edimar/Desktop/doutorado/doutorado04/bases/WEIR/videogame/www.metacritic.com/xbox360_spidermanfriendorfoe.html",The game doesn’t even feel like it belongs on the Xbox 360.
"/sdd/edimar/Desktop/doutorado/doutorado04/bases/WEIR/videogame/www.metacritic.com/xbox360_beemoviegame.html","The various gameplay elements are hit or miss, but at least it seems to be more hit than miss, despite some glaring flaws."
"/sdd/edimar/Desktop/doutorado/doutorado04/bases/WEIR/videogame/www.metacritic.com/xbox360_halo3.html",Halo 3 is essential. An Xbox 360 without a copy of the game is like a human without a heart.
"/sdd/edimar/Desktop/doutorado/doutorado04/bases/WEIR/videogame/www.metacritic.com/xbox360_omegafive.html","If mainstream releases are leaving you feeling a little uninspired, Omega Five should be just the kind of boost your daily intake needs."
"/sdd/edimar/Desktop/doutorado/doutorado04/bases/WEIR/videogame/www.metacritic.com/xbox360_sceneitlightscameraaction.html","A decent ""Buzz!""-rival for the Xbox 360, but don't expect any thrills or frills. [Christmas 2007, p.83]"
"/sdd/edimar/Desktop/doutorado/doutorado04/bases/WEIR/videogame/www.metacritic.com/xbox360_armoredcore4.html","It's simple and frankly quite fun, but it's just a bit too short for a $60 game, and it can easily be finished in a day."
"/sdd/edimar/Desktop/doutorado/doutorado04/bases/WEIR/videogame/www.metacritic.com/xbox360_overgfighters.html","Modern missiles are too good to make games any fun - give us crap biplanes any day. [Sept 2006, p.65]"
"/sdd/edimar/Desktop/doutorado/doutorado04/bases/WEIR/videogame/www.metacritic.com/xbox360_nhl08.html","The best recreation of ice hockey to date: an excellent sports game! [Dec 2007, p.84]"
"/sdd/edimar/Desktop/doutorado/doutorado04/bases/WEIR/videogame/www.metacritic.com/xbox360_legoindianajonestheoriginaladventures.html","To round off, as a game in itself, Lego Indiana Jones: The Original Adventures is a fantastic game, even for people who haven't seen the movies."
"/sdd/edimar/Desktop/doutorado/doutorado04/bases/WEIR/videogame/www.metacritic.com/psx_driver.html",A game that might be mediocre in its presentation but more than makes up for it in its gameplay and concept.
"/sdd/edimar/Desktop/doutorado/doutorado04/bases/WEIR/videogame/www.metacritic.com/xbox360_1942jointstrike.html","Although the gameplay is limited and only takes around 30 minutes to clock (per plane), 1942: Joint Strike is still a satisfying gaming experience."
