URL,EXTRACTED VALUE
"/sdd/edimar/Desktop/doutorado/doutorado04/bases/WEIR/videogame/www.metacritic.com/xbox360_robertludlumsthebourneconspiracy.html","A trifle repetitive and brief, The Bourne Conspiracy is a diamond in the rough. Well worth a look but it’s not going to change your life."
"/sdd/edimar/Desktop/doutorado/doutorado04/bases/WEIR/videogame/www.metacritic.com/xbox360_frontlinesfuelofwar.html","There are a lot of good ideas contained in Frontlines: Fuel of War, but their execution just seems to make the game feel average."
"/sdd/edimar/Desktop/doutorado/doutorado04/bases/WEIR/videogame/www.metacritic.com/xbox360_wwesmackdownvsraw2007.html","The game is worth buying and will offer gamers hours of fun, whether it is creating custom wrestlers or fighting for your life in the career mode."
"/sdd/edimar/Desktop/doutorado/doutorado04/bases/WEIR/videogame/www.metacritic.com/xbox360_godfather.html",The enhancements from the last-gen versions are clear to see. [Issue #15]
"/sdd/edimar/Desktop/doutorado/doutorado04/bases/WEIR/videogame/www.metacritic.com/xbox360_maddennfl07.html","Do you like football games? If the answer is yes, then purchase it, if the answer is no, then dont."
"/sdd/edimar/Desktop/doutorado/doutorado04/bases/WEIR/videogame/www.metacritic.com/xbox360_darksector.html","One should go into the title with the knowledge that there isn't much of a story, and some of the gameplay can get pretty frustrating."
"/sdd/edimar/Desktop/doutorado/doutorado04/bases/WEIR/videogame/www.metacritic.com/xbox360_tombraiderlegend.html",A brilliant game that no 360 gamer should ignore.
