URL,EXTRACTED VALUE
"/sdd/edimar/Desktop/doutorado/doutorado04/bases/WEIR/videogame/www.metacritic.com/xbox360_cyberball2072.html","You'll need to be a serious American football/robot fan to get stuck in now. [Dec 2007, p.96]"
"/sdd/edimar/Desktop/doutorado/doutorado04/bases/WEIR/videogame/www.metacritic.com/xbox360_historychannelcivilwaranationdivided.html",While Civil War isn’t going to win over most FPS fans the game does show a huge amount of potential.
"/sdd/edimar/Desktop/doutorado/doutorado04/bases/WEIR/videogame/www.metacritic.com/xbox360_spectralforce3.html","Pretty or not, no JRPG on the 360 has the edge on Spectral Force 3 in terms of gameplay. In other words, it has a great personality."
"/sdd/edimar/Desktop/doutorado/doutorado04/bases/WEIR/videogame/www.metacritic.com/xbox360_screwjumper.html",Charging 800 points for this when the aforementioned Castlevania: SotN comes at the same price is taking the proverbial. Steer well clear of this one.
"/sdd/edimar/Desktop/doutorado/doutorado04/bases/WEIR/videogame/www.metacritic.com/psx_gunfighterlegendofjessejames.html",The average gamer is going to have a hard time looking past the game's generally poor production and repetitive gameplay.
"/sdd/edimar/Desktop/doutorado/doutorado04/bases/WEIR/videogame/www.metacritic.com/xbox360_tron.html",This is one game from the past that's best left forgotten.
