URL,EXTRACTED VALUE
"/sdd/edimar/Desktop/doutorado/doutorado04/bases/WEIR/videogame/www.metacritic.com/xbox360_crossfire.html","Conflict Denied Ops is a bad game, there I said it. No amount of glossing over or hyping the game is going to change that."
"/sdd/edimar/Desktop/doutorado/doutorado04/bases/WEIR/videogame/www.metacritic.com/xbox360_castlecrashers.html","Gloriously imaginative and heaps of fun. [Nov 2008, p.100]"
"/sdd/edimar/Desktop/doutorado/doutorado04/bases/WEIR/videogame/www.metacritic.com/xbox360_soulcalibur4.html","The amount of characters and styles is huge but, the Story mode is greatly lacking, and the other modes can be incredibly frustrating at times."
"/sdd/edimar/Desktop/doutorado/doutorado04/bases/WEIR/videogame/www.metacritic.com/xbox360_flatoutultimatecarnage.html","Destruction is simply more fun than obsessive tuning, assuming you've got a few screws loose to start with. [Nov 2007, p.84]"
"/sdd/edimar/Desktop/doutorado/doutorado04/bases/WEIR/videogame/www.metacritic.com/xbox360_battlestationsmidway.html","Battlestations may not be the deepest or prettiest WWII-themed 360 game on the shelves, but it still hits a solid broadside. [Mar 2007, p.80]"
"/sdd/edimar/Desktop/doutorado/doutorado04/bases/WEIR/videogame/www.metacritic.com/xbox360_halflife2theorangebox.html",That so much great content is offered at the standard single-game price is astonishing.
"/sdd/edimar/Desktop/doutorado/doutorado04/bases/WEIR/videogame/www.metacritic.com/xbox360_projectgothamracing4.html",Extreme weather variables add substance to the racing.
"/sdd/edimar/Desktop/doutorado/doutorado04/bases/WEIR/videogame/www.metacritic.com/xbox360_deadrising.html","With so many missions available, Dead Rising is sure to keep its players busy."
"/sdd/edimar/Desktop/doutorado/doutorado04/bases/WEIR/videogame/www.metacritic.com/xbox360_skate.html",A pretty well balanced game. The only slight drawbacks are the slightly iffy controls and steep learning curve.
"/sdd/edimar/Desktop/doutorado/doutorado04/bases/WEIR/videogame/www.metacritic.com/xbox360_harrypotterandtheorderofthephoenix.html",The video game version of Order of the Phoenix captures none of the magic in the Harry Potter books or films.
"/sdd/edimar/Desktop/doutorado/doutorado04/bases/WEIR/videogame/www.metacritic.com/xbox360_battlefieldbadcompany.html",Battlefield Bad Company is a great game and continues the excellent fun found in every game in the Battlefield series that I've played so far.
"/sdd/edimar/Desktop/doutorado/doutorado04/bases/WEIR/videogame/www.metacritic.com/xbox360_chromehounds.html","Chromehounds wields tons of fire-power online, but its gameplay gears are rusty. [Aug 2006, p.87]"
"/sdd/edimar/Desktop/doutorado/doutorado04/bases/WEIR/videogame/www.metacritic.com/xbox360_frontlinesfuelofwar.html","This Battlefield-style shooter isn't very original, but it's still pretty fun."
"/sdd/edimar/Desktop/doutorado/doutorado04/bases/WEIR/videogame/www.metacritic.com/xbox360_forzamotorsport2.html","The racing, in itself, is excellent. Striking a wonderful balance between simulation and thrills. [July 2007, p.86]"
"/sdd/edimar/Desktop/doutorado/doutorado04/bases/WEIR/videogame/www.metacritic.com/xbox360_guitarheroaerosmith.html","The latest Guitar Hero is an Aerosmith fan's dream come true, but the game's narrow focus and lack of content will prove unappealing to many others."
"/sdd/edimar/Desktop/doutorado/doutorado04/bases/WEIR/videogame/www.metacritic.com/xbox360_vikingbattleforasgard.html","As entertaining as the game is, it's abundantly clear that things could have been a whole lot better."
"/sdd/edimar/Desktop/doutorado/doutorado04/bases/WEIR/videogame/www.metacritic.com/xbox360_bioniccommandorearmed.html","Between the multiplayer modes and the Challenge Rooms, there's more than enough innovation to make up for the minor irritations of the retro controls."
"/sdd/edimar/Desktop/doutorado/doutorado04/bases/WEIR/videogame/www.metacritic.com/xbox360_tonyhawksproject8.html","All in all, Project 8 looks good but lacks any real innovations in the controls, progression through the story or overall style of gameplay."
"/sdd/edimar/Desktop/doutorado/doutorado04/bases/WEIR/videogame/www.metacritic.com/xbox360_wwesmackdownvsraw2008.html",A very disappointing release and to only marginally improve on a title that was already a huge disappointment is almost criminal.
"/sdd/edimar/Desktop/doutorado/doutorado04/bases/WEIR/videogame/www.metacritic.com/xbox360_condemned2bloodshot.html","If Condemned was the starter, this is the main course. Gory, dark and great. [Apr 2008, p.64]"
"/sdd/edimar/Desktop/doutorado/doutorado04/bases/WEIR/videogame/www.metacritic.com/xbox360_shrekthethird.html",Shrek the Third's main problem is its complete lack of spark.
"/sdd/edimar/Desktop/doutorado/doutorado04/bases/WEIR/videogame/www.metacritic.com/xbox360_crackdown.html",A solid and downright addictive open-ended action title.
"/sdd/edimar/Desktop/doutorado/doutorado04/bases/WEIR/videogame/www.metacritic.com/xbox360_maddennfl08.html",The most realistic football experience on consoles. It also happens to be the most challenging Madden since as far back as I can remember.
"/sdd/edimar/Desktop/doutorado/doutorado04/bases/WEIR/videogame/www.metacritic.com/xbox360_callofduty4modernwarfare.html","A completely intense thrill-ride from start to finish, Call of Duty 4 grabs hold of you and doesn’t let go."
"/sdd/edimar/Desktop/doutorado/doutorado04/bases/WEIR/videogame/www.metacritic.com/xbox360_marvelultimatealliance.html","Play it in co-op and it's a hoot. A superhero mash-up that's simple but top fun. [Christmas 2006, p.80]"
"/sdd/edimar/Desktop/doutorado/doutorado04/bases/WEIR/videogame/www.metacritic.com/xbox360_lostplanet.html","As an action game, Lost Planet: Extreme Condition delivers in spades – even if it can be finished in under 8 hours total playtime."
"/sdd/edimar/Desktop/doutorado/doutorado04/bases/WEIR/videogame/www.metacritic.com/xbox360_tigerwoodspgatour08.html","Tiger Woods 08 is a solid game, but not great. It also doesn't offer enough new features to justify purchase."
"/sdd/edimar/Desktop/doutorado/doutorado04/bases/WEIR/videogame/www.metacritic.com/xbox360_tabletennis.html",It's a lot of fun – a keeper – no doubt.
"/sdd/edimar/Desktop/doutorado/doutorado04/bases/WEIR/videogame/www.metacritic.com/xbox360_tigerwoodspgatour09.html","Tiger Woods PGA Tour 09 doesn’t shake things up, but its enhancements keep the game entertaining and addictive, which is really all that matters."
"/sdd/edimar/Desktop/doutorado/doutorado04/bases/WEIR/videogame/www.metacritic.com/xbox360_tenchuz.html",Tenchu Z proves that just because ninjas and video games are a perfect fit that doesn't mean that all ninja games are fun to play.
"/sdd/edimar/Desktop/doutorado/doutorado04/bases/WEIR/videogame/www.metacritic.com/xbox360_ninjagaiden2.html","With faults and flaws, Ryu Hayabusa's return is still one of the most enjoyable high-speed action titles available."
"/sdd/edimar/Desktop/doutorado/doutorado04/bases/WEIR/videogame/www.metacritic.com/xbox360_vivapinatatroubleinparadise.html","A sequel with a suitably Darwinian focus on simple refinement. [Nov 2008, p.100]"
"/sdd/edimar/Desktop/doutorado/doutorado04/bases/WEIR/videogame/www.metacritic.com/xbox360_nhl2k6.html","This is the Xbox 360 dammit, show it some respect and put some effort into your ports people."
"/sdd/edimar/Desktop/doutorado/doutorado04/bases/WEIR/videogame/www.metacritic.com/xbox360_spiderman3.html","As a licensed game, Spiderman 3 is exceptional, but its problems and shortcomings stop it from being a notable game altogether."
"/sdd/edimar/Desktop/doutorado/doutorado04/bases/WEIR/videogame/www.metacritic.com/xbox360_dynastywarriors6.html","Visually, it's very similar to Warriors Orochi on Xbox 360, while the gameplay and appeal are as stagnant and underwhelming as they've ever been."
"/sdd/edimar/Desktop/doutorado/doutorado04/bases/WEIR/videogame/www.metacritic.com/xbox360_segasuperstarstennis.html","Sega Superstars would have benefited from a more diverse character lineup, as the roster leans rather heavily on a few select franchises."
"/sdd/edimar/Desktop/doutorado/doutorado04/bases/WEIR/videogame/www.metacritic.com/xbox360_spiderwickchronicles.html",The game's control scheme is basic to the point where you could play with an Atari controller.
"/sdd/edimar/Desktop/doutorado/doutorado04/bases/WEIR/videogame/www.metacritic.com/xbox360_toohuman.html","This game should have been so much better considering how long it’s been in production, but it’s not and it shows."
"/sdd/edimar/Desktop/doutorado/doutorado04/bases/WEIR/videogame/www.metacritic.com/xbox360_lostodyssey.html",A major improvement over Blue Dragon.
"/sdd/edimar/Desktop/doutorado/doutorado04/bases/WEIR/videogame/www.metacritic.com/xbox360_callofjuarez.html","More old than wild wild west. [Aug 2007, p.98]"
"/sdd/edimar/Desktop/doutorado/doutorado04/bases/WEIR/videogame/www.metacritic.com/xbox360_nhl2k8.html","Inadequate next to EA's title. [Jan 2008, p.79]"
"/sdd/edimar/Desktop/doutorado/doutorado04/bases/WEIR/videogame/www.metacritic.com/xbox360_lost.html","If you’re not a fan of Lost in any way, there is just no way I can possibly recommended this game to you."
"/sdd/edimar/Desktop/doutorado/doutorado04/bases/WEIR/videogame/www.metacritic.com/xbox360_rezhd.html",If you give it a chance you just might find yourself locked in the trance that so many have come to enjoy.
"/sdd/edimar/Desktop/doutorado/doutorado04/bases/WEIR/videogame/www.metacritic.com/xbox360_guitarhero2.html","With the improved visuals, increased song count and the crucial addition of friend-bating online leaderboards, the 360 version is the best yet."
"/sdd/edimar/Desktop/doutorado/doutorado04/bases/WEIR/videogame/www.metacritic.com/xbox360_enemyterritoryquakewars.html",The console version arrived late and not improved at all. Worse visuals and less players make it inferior to the PC counterpart.
"/sdd/edimar/Desktop/doutorado/doutorado04/bases/WEIR/videogame/www.metacritic.com/xbox360_vivapinatapartyanimals.html","A minigame compilation that lacks any real charm, and simply isn't enough fun. [Jan 2007, p.69]"
"/sdd/edimar/Desktop/doutorado/doutorado04/bases/WEIR/videogame/www.metacritic.com/xbox360_lordoftheringsthebattleformiddleearth2.html","Yes, the RTS genre has been seen on consoles in the past, but never to this level, and with this much polish."
"/sdd/edimar/Desktop/doutorado/doutorado04/bases/WEIR/videogame/www.metacritic.com/xbox360_vampiresrain.html",As the back of the box says: Identify (that the game's a bit rubbish). Eliminate (it off your shopping list). Survive (with your dignity intact).
"/sdd/edimar/Desktop/doutorado/doutorado04/bases/WEIR/videogame/www.metacritic.com/xbox360_braid.html","A beautiful and brilliantly demanding game that barely contains its dense population of ideas. [Sept 2008, p.89]"
"/sdd/edimar/Desktop/doutorado/doutorado04/bases/WEIR/videogame/www.metacritic.com/xbox360_needforspeedmostwanted.html",The story started to grate on me after beating the first few Blacklist opponents.
"/sdd/edimar/Desktop/doutorado/doutorado04/bases/WEIR/videogame/www.metacritic.com/xbox360_tnaimpact.html","I hope that Midway really delivers a top-shelf game next time around, because their first effort is mediocre."
"/sdd/edimar/Desktop/doutorado/doutorado04/bases/WEIR/videogame/www.metacritic.com/xbox360_timeshift.html","Breaking no moulds, but good solid fun. [Christmas 2007, p.90]"
"/sdd/edimar/Desktop/doutorado/doutorado04/bases/WEIR/videogame/www.metacritic.com/xbox360_tomclancysrainbowsixvegas2.html","Still a brilliant shooter, but needed better levels and more new content. [May 2008, p.81]"
"/sdd/edimar/Desktop/doutorado/doutorado04/bases/WEIR/videogame/www.metacritic.com/xbox360_kingdomunderfirecircleofdoom.html","Online or offline, the conclusion is only one – this adventure is dull, tremendously repetitive and not very absorbing."
"/sdd/edimar/Desktop/doutorado/doutorado04/bases/WEIR/videogame/www.metacritic.com/xbox360_halo3.html","Halo 3 is the action game to buy this Fall, quite simply because it does exactly the same thing that the previous two have."
"/sdd/edimar/Desktop/doutorado/doutorado04/bases/WEIR/videogame/www.metacritic.com/xbox360_needforspeedprostreet.html","The realistic physics and driving model works very well, but the setting and structure of the racing events ultimately brings it down."
"/sdd/edimar/Desktop/doutorado/doutorado04/bases/WEIR/videogame/www.metacritic.com/xbox360_wolfofthebattlefieldcommando3.html","There’s a real lack of enemy variety, as well."
"/sdd/edimar/Desktop/doutorado/doutorado04/bases/WEIR/videogame/www.metacritic.com/xbox360_wwesmackdownvsraw2007.html",The quality of the action and the intuitive controls will not disappoint wrestling fans.
"/sdd/edimar/Desktop/doutorado/doutorado04/bases/WEIR/videogame/www.metacritic.com/xbox360_kaneandlynchdeadmen.html",A sadistically satisfying experience that just feels too rough around the edges to become a true classic.
"/sdd/edimar/Desktop/doutorado/doutorado04/bases/WEIR/videogame/www.metacritic.com/xbox360_cmr07.html",DiRT is a great game to show off your Xbox 360’s graphical capabilities and is a fun and addictive racing game with a high amount of replay value.
"/sdd/edimar/Desktop/doutorado/doutorado04/bases/WEIR/videogame/www.metacritic.com/xbox360_dynastywarriorsgundam.html","Middling fun in small doses, but how many times can you play the same game? [Dec 2007, p.85]"
"/sdd/edimar/Desktop/doutorado/doutorado04/bases/WEIR/videogame/www.metacritic.com/xbox360_motogp06.html",Some of the best graphics video gaming has ever seen. [Issue #11]
"/sdd/edimar/Desktop/doutorado/doutorado04/bases/WEIR/videogame/www.metacritic.com/xbox360_amped3.html","Could've just as easily been a current-gen title. Average graphics, annoying story and too-easy gameplay make for a ho-hum game."
"/sdd/edimar/Desktop/doutorado/doutorado04/bases/WEIR/videogame/www.metacritic.com/xbox360_devilmaycry4.html","The Devil My Cry series makes a good debut on the Xbox 360, but it comes up a little short of being a truly great game."
"/sdd/edimar/Desktop/doutorado/doutorado04/bases/WEIR/videogame/www.metacritic.com/xbox360_virtuafighter5.html","There’s no doubt that Virtua Fighter is an excellent fighting game, very solid, but leaves something to be desired in terms of contents."
"/sdd/edimar/Desktop/doutorado/doutorado04/bases/WEIR/videogame/www.metacritic.com/xbox360_maddennfl09.html","If you are already a Madden fan you will enjoy this title. If not, rent before you buy."
"/sdd/edimar/Desktop/doutorado/doutorado04/bases/WEIR/videogame/www.metacritic.com/xbox360_nplus.html","What makes N+ really new and fresh though is its customizability. [Jan 2008, p.66]"
"/sdd/edimar/Desktop/doutorado/doutorado04/bases/WEIR/videogame/www.metacritic.com/xbox360_mxvsatvuntamed.html","As you can probably tell by now, MX Vs. ATV: Untamed’s appeal lies in its gameplay."
