URL,EXTRACTED VALUE
"/sdd/edimar/Desktop/doutorado/doutorado04/bases/WEIR/videogame/www.metacritic.com/xbox360_forzamotorsport2.html","Racing Simulation games have been done before, but they have never been done this well."
"/sdd/edimar/Desktop/doutorado/doutorado04/bases/WEIR/videogame/www.metacritic.com/xbox360_projectgothamracing3.html","The visuals and immersion [are] simplly amazing in this game. The graphics are incredibly impressive, something unmatched by any other game."
"/sdd/edimar/Desktop/doutorado/doutorado04/bases/WEIR/videogame/www.metacritic.com/xbox360_braid.html","Braid is one of the best, if not the best, games I have ever played."
"/sdd/edimar/Desktop/doutorado/doutorado04/bases/WEIR/videogame/www.metacritic.com/xbox360_deadoralive4.html","So, Dead or Alive 4 has it all: sexy looks, sexy women, sexy sound, sexy gameplay, sexy online play, sexy... you get the picture."
"/sdd/edimar/Desktop/doutorado/doutorado04/bases/WEIR/videogame/www.metacritic.com/xbox360_burnoutparadise.html","Other than the lack of waypoints and some AI-balancing complaints, there's not much to find fault with when it comes to Burnout Paradise."
