URL,EXTRACTED VALUE
"/sdd/edimar/Desktop/doutorado/doutorado04/bases/WEIR/videogame/www.metacritic.com/xbox360_meettherobinsons.html","Delicious design. [June 2007, p.92]"
"/sdd/edimar/Desktop/doutorado/doutorado04/bases/WEIR/videogame/www.metacritic.com/xbox360_twoworlds.html","An epic adventure that's come too late and is let down by being rough around the edges. [Nov 2007, p.72]"
"/sdd/edimar/Desktop/doutorado/doutorado04/bases/WEIR/videogame/www.metacritic.com/xbox360_teenagemutantninjaturtles.html","TMNT 1989 has its share of problems...Nevertheless, the game remains a solid thrill. [June 2007, p.76]"
"/sdd/edimar/Desktop/doutorado/doutorado04/bases/WEIR/videogame/www.metacritic.com/xbox360_piratesofthecaribbeanatworldsend.html","There were a few moments where I felt like Pirates could actually spark my interest, but I left bored in the long run."
"/sdd/edimar/Desktop/doutorado/doutorado04/bases/WEIR/videogame/www.metacritic.com/xbox360_madtracks.html","Mad Tracks makes for a nice distraction, but it’s doubtful that you’ll want to play this for more than ten minutes at a time."
"/sdd/edimar/Desktop/doutorado/doutorado04/bases/WEIR/videogame/www.metacritic.com/xbox360_lostcities.html",You’re left with a light filler card game that has nowhere near the staying power of the other board game ports that are on XBL.
"/sdd/edimar/Desktop/doutorado/doutorado04/bases/WEIR/videogame/www.metacritic.com/xbox360_missilecommand.html","There's not actually that much to do here. [Sept 2007, p.108]"
"/sdd/edimar/Desktop/doutorado/doutorado04/bases/WEIR/videogame/www.metacritic.com/psx_nbashootout2001.html",I am sorry that 989 has mastered how to mess a game up as it ages as opposed to making a game shine as it matures.
"/sdd/edimar/Desktop/doutorado/doutorado04/bases/WEIR/videogame/www.metacritic.com/xbox360_crashofthetitans.html","It's a fairly sturdy, combat-heavy platformer with a good hook, but it lacks a real distinct attitude."
"/sdd/edimar/Desktop/doutorado/doutorado04/bases/WEIR/videogame/www.metacritic.com/xbox360_joust.html","Even though Joust is weird it still has a quirky loveable quality to it. Don't let the simplistic levels and objective fool you, Joust is a challenge."
"/sdd/edimar/Desktop/doutorado/doutorado04/bases/WEIR/videogame/www.metacritic.com/xbox360_tetrissplash.html","While the formula may never grow old, purchasing its incarnations is becoming rather trivial."
"/sdd/edimar/Desktop/doutorado/doutorado04/bases/WEIR/videogame/www.metacritic.com/xbox360_galaga.html","This frantic game still delivers the twitch frenzy that gamers crave, and deserves its spot in your quick-fix collection."
"/sdd/edimar/Desktop/doutorado/doutorado04/bases/WEIR/videogame/www.metacritic.com/xbox360_paperboy.html","If you ever cared about the arcade version of Paperboy, you'll get some nostalgic excitement from this emulation of the original."
"/sdd/edimar/Desktop/doutorado/doutorado04/bases/WEIR/videogame/www.metacritic.com/psx_hogsofwar.html",Crude presentation and lackluster humor can't save this game from the trough.
"/sdd/edimar/Desktop/doutorado/doutorado04/bases/WEIR/videogame/www.metacritic.com/xbox360_rocketmenaxisofevil.html","Fun for a little bit, but even die hard fans of the genre will be put off after an hour or so."
"/sdd/edimar/Desktop/doutorado/doutorado04/bases/WEIR/videogame/www.metacritic.com/xbox360_tenchuz.html","Although it's not a great game, it is worth investing time in, and one that grows on you in less than a half-dozen missions."
"/sdd/edimar/Desktop/doutorado/doutorado04/bases/WEIR/videogame/www.metacritic.com/xbox360_shrekthethird.html","Shrek the Third isn’t an altogether bad game, but is certainly a sloppy one."
"/sdd/edimar/Desktop/doutorado/doutorado04/bases/WEIR/videogame/www.metacritic.com/xbox360_donkingpresentsprizefighter.html","In my opinion, the only reason to buy this game is if you have played all the way through Fight Night and you’re just itching for a new boxing title."
"/sdd/edimar/Desktop/doutorado/doutorado04/bases/WEIR/videogame/www.metacritic.com/psx_nflgameday2001.html","For me, I will stick with ""Madden."" ""Gameday 2001"" is still stuck in training camp."
"/sdd/edimar/Desktop/doutorado/doutorado04/bases/WEIR/videogame/www.metacritic.com/xbox360_nbalive07.html","It’s simply not that fun to play, and is not what gamers should expect from a next-gen title."
"/sdd/edimar/Desktop/doutorado/doutorado04/bases/WEIR/videogame/www.metacritic.com/xbox360_boomboomrocket.html","If you are looking for a good musical game and don’t want to spend 90 bucks, Boom Boom Rocket is worth checking out."
"/sdd/edimar/Desktop/doutorado/doutorado04/bases/WEIR/videogame/www.metacritic.com/psx_mtvsportspureride.html","Unfortunately, there's some yellow snow on this mountain."
"/sdd/edimar/Desktop/doutorado/doutorado04/bases/WEIR/videogame/www.metacritic.com/psx_ncaagamebreaker2001.html",It just does not seem like a title you would want to run out and buy if you already have last year's game.
"/sdd/edimar/Desktop/doutorado/doutorado04/bases/WEIR/videogame/www.metacritic.com/xbox360_bulletwitch.html","Bullet Witch is very entertaining, but the overall pacing of the game and the frustrating controls bring it down."
