URL,EXTRACTED VALUE
"/sdd/edimar/Desktop/doutorado/doutorado04/bases/WEIR/videogame/www.metacritic.com/xbox360_grid.html",I would have to say that GRID is probably one of the best racers to date on the Xbox 360 console.
"/sdd/edimar/Desktop/doutorado/doutorado04/bases/WEIR/videogame/www.metacritic.com/xbox360_virtuafighter5.html","Despite a few corny audio samples, Virtua Fighter 5 offers hard-hitting fighting perfection that no one should miss."
"/sdd/edimar/Desktop/doutorado/doutorado04/bases/WEIR/videogame/www.metacritic.com/xbox360_guitarhero3legendsofrock.html","The greatest Guitar Hero yet. Amazing songs, phenomenal gameplay, and it's online too! [Issue 27, p.86]"
"/sdd/edimar/Desktop/doutorado/doutorado04/bases/WEIR/videogame/www.metacritic.com/xbox360_puzzlequestchallengeofthewarlords.html","RPG action meets addictive puzzling in one of this year's best games. [Dec 2007, p.84]"
"/sdd/edimar/Desktop/doutorado/doutorado04/bases/WEIR/videogame/www.metacritic.com/xbox360_nhl09.html",I highly recommend NHL 09 for the Xbox 360 to any sports fan out there even if you are not familiar with the hockey at the NHL level.
"/sdd/edimar/Desktop/doutorado/doutorado04/bases/WEIR/videogame/www.metacritic.com/xbox360_tomclancyssplintercelldoubleagent.html","The game has always looked amazing, and now they’ve taken it up a notch by giving more detail to each character, especially Sam, and environments."
"/sdd/edimar/Desktop/doutorado/doutorado04/bases/WEIR/videogame/www.metacritic.com/xbox360_burnoutparadise.html","Don't be afraid of the different route this sequel took, Burnout Paradise is every bit as exhilarating as you could hope for."
"/sdd/edimar/Desktop/doutorado/doutorado04/bases/WEIR/videogame/www.metacritic.com/xbox360_fightnightround3.html","But if you want a staggering multiplayer fight game that looks better than anything else on Xbox 360, get this."
