URL,EXTRACTED VALUE
"/sdd/edimar/Desktop/doutorado/doutorado04/bases/WEIR/finance/www.quote.com/rimm.html",Stock Alerts on Wall Street Movers; Issued by InvestorSoup.com
"/sdd/edimar/Desktop/doutorado/doutorado04/bases/WEIR/finance/www.quote.com/kr.html",Kroger to Webcast Annual Meeting of Shareholders June 25
"/sdd/edimar/Desktop/doutorado/doutorado04/bases/WEIR/finance/www.quote.com/sne.html",Sony develops mercury-free alkaline button batteries
"/sdd/edimar/Desktop/doutorado/doutorado04/bases/WEIR/finance/www.quote.com/celg.html",Celgene To Present At Goldman Sachs 30th Annual Global Healthcare Conference; Webcast At 9:40 AM
"/sdd/edimar/Desktop/doutorado/doutorado04/bases/WEIR/finance/www.quote.com/mu.html","BUYINS.NET: LVLT, ESLR, MU, VSTN, LEA, INTC: Top 6 Highest Net Buy Volume With Lowest Price Friction Stocks For June 10, 2009"
"/sdd/edimar/Desktop/doutorado/doutorado04/bases/WEIR/finance/www.quote.com/mat.html",Appeals court denies MGA emergency motion on Bratz
"/sdd/edimar/Desktop/doutorado/doutorado04/bases/WEIR/finance/www.quote.com/wmt.html",STOCKS NEWS US-Retail index edges up after May sales data
"/sdd/edimar/Desktop/doutorado/doutorado04/bases/WEIR/finance/www.quote.com/rfmd.html",StockSource.us: ELRA -- A Precious Metals Exploration Company.
"/sdd/edimar/Desktop/doutorado/doutorado04/bases/WEIR/finance/www.quote.com/unh.html",BRIEF-Oppenheimer cuts UnitedHealth to 'underperform'
"/sdd/edimar/Desktop/doutorado/doutorado04/bases/WEIR/finance/www.quote.com/amgn.html",Pfizer oral drug may shake up arthritis market
"/sdd/edimar/Desktop/doutorado/doutorado04/bases/WEIR/finance/www.quote.com/kss.html","Kohl's celebrates remodeled north store: Wood flooring, new fixtures, brighter graphics create fresh look"
"/sdd/edimar/Desktop/doutorado/doutorado04/bases/WEIR/finance/www.quote.com/brcm.html",Qualcomm Lifts Q3 Revenue Outlook - Update
"/sdd/edimar/Desktop/doutorado/doutorado04/bases/WEIR/finance/www.quote.com/ccl.html",CARNIVAL PLC - Carnival Corporation & Plc Second Quarter Conf. Call
"/sdd/edimar/Desktop/doutorado/doutorado04/bases/WEIR/finance/www.quote.com/cag.html","ATF National Response Team Activated to Garner, N.C. --ConAgra Plant Explosion Results in Three Fatalities, Numerous Injuries"
"/sdd/edimar/Desktop/doutorado/doutorado04/bases/WEIR/finance/www.quote.com/snv.html",Synovus declares quarterly dividend of USD0.01 on common stock
"/sdd/edimar/Desktop/doutorado/doutorado04/bases/WEIR/finance/www.quote.com/ppg.html",PPG Industries Signs Global Sales and Distribution Agreement with Farecla - Quick Facts
"/sdd/edimar/Desktop/doutorado/doutorado04/bases/WEIR/finance/www.quote.com/csco.html",SmarTrend(R) News Watch: AT&T Sweetens Cisco Telepresence Service Offer
"/sdd/edimar/Desktop/doutorado/doutorado04/bases/WEIR/finance/www.quote.com/mil.html",Millipore Expands with New Bioprocess Manufacturing Facility in Massachusetts
"/sdd/edimar/Desktop/doutorado/doutorado04/bases/WEIR/finance/www.quote.com/nvda.html",Schaeffer's Option Blog: NVIDIA (NVDA) Sees Huge Jump in Call Trading
"/sdd/edimar/Desktop/doutorado/doutorado04/bases/WEIR/finance/www.quote.com/kbh.html",KB Home Down 4.2% Since SmarTrend's Sell Recommendation
"/sdd/edimar/Desktop/doutorado/doutorado04/bases/WEIR/finance/www.quote.com/fpl.html",UPDATE 1-Maryland seeks review of Constellation/EdF deal
"/sdd/edimar/Desktop/doutorado/doutorado04/bases/WEIR/finance/www.quote.com/usb.html",EDITORIAL: A little good banking news
"/sdd/edimar/Desktop/doutorado/doutorado04/bases/WEIR/finance/www.quote.com/jnpr.html",Juniper and Nokia Siemens Partner to Create JV for Carrier Ethernet Market
"/sdd/edimar/Desktop/doutorado/doutorado04/bases/WEIR/finance/www.quote.com/aee.html",Ameren Illinois Utilities executive explains reasons for rate hike request
"/sdd/edimar/Desktop/doutorado/doutorado04/bases/WEIR/finance/www.quote.com/tmk.html",A.M. Best Revises Outlook to Negative for Torchmark Corporation and Its Operating Subsidiaries
"/sdd/edimar/Desktop/doutorado/doutorado04/bases/WEIR/finance/www.quote.com/ebay.html","PennyStockPickAlert.com Issues Technical Trade Alerts on Market Movers Today: C, S, PFE, JAZZ, EBAY, MRVL"
"/sdd/edimar/Desktop/doutorado/doutorado04/bases/WEIR/finance/www.quote.com/hmc.html",Honda Motor Co. celebrates 50th anniversary in U.S.
"/sdd/edimar/Desktop/doutorado/doutorado04/bases/WEIR/finance/www.quote.com/amat.html",Cap Utilization to Give Clues
"/sdd/edimar/Desktop/doutorado/doutorado04/bases/WEIR/finance/www.quote.com/fdx.html","Memphis City Council considers pay cuts, no tax hike"
"/sdd/edimar/Desktop/doutorado/doutorado04/bases/WEIR/finance/www.quote.com/cal.html",Continental Airlines To Present At Bank of America - Merrill Lynch Global Transportation Conference; Webcast At 9:45 AM
"/sdd/edimar/Desktop/doutorado/doutorado04/bases/WEIR/finance/www.quote.com/ctxs.html",Citrix and TCS provide satellite comms system for US Army
"/sdd/edimar/Desktop/doutorado/doutorado04/bases/WEIR/finance/www.quote.com/txn.html","Zacks Industry Rank Analysis Highlights: Texas Instruments, Analog Devices, Cree, Marvell Technology Group and Semtech http://www.profit.zacks.com/"
"/sdd/edimar/Desktop/doutorado/doutorado04/bases/WEIR/finance/www.quote.com/wpi.html",Watson files ANDA for generic Mucinex
"/sdd/edimar/Desktop/doutorado/doutorado04/bases/WEIR/finance/www.quote.com/pg.html",Clorox Backs FY10 View; Hikes Quarterly Dividend by 9% - Update
"/sdd/edimar/Desktop/doutorado/doutorado04/bases/WEIR/finance/www.quote.com/cb.html",BRIEF-Chubb Board sets regular quarterly dividend
"/sdd/edimar/Desktop/doutorado/doutorado04/bases/WEIR/finance/www.quote.com/lly.html",Eli Lilly Up 9.9% Since SmarTrend's Buy Recommendation
"/sdd/edimar/Desktop/doutorado/doutorado04/bases/WEIR/finance/www.quote.com/tjx.html","UPDATE1-JP Morgan ups Citi Trends, sees a healthy growth story"
"/sdd/edimar/Desktop/doutorado/doutorado04/bases/WEIR/finance/www.quote.com/adsk.html",ADSK: Conference call regarding To Webcast Its Annual Meeting of Stockholders @ 18:00 ET Today [delayed]
