URL,EXTRACTED VALUE
"/sdd/edimar/Desktop/doutorado/doutorado04/bases/WEIR/finance/www.quote.com/bcr.html",SmarTrend(R) News Watch: CR Bard Raises Dividend
"/sdd/edimar/Desktop/doutorado/doutorado04/bases/WEIR/finance/www.quote.com/gci.html",Employers Share the Most Unconventional Tactics Job Seekers Have Used to Get Their Attention in New CareerBuilder Survey
"/sdd/edimar/Desktop/doutorado/doutorado04/bases/WEIR/finance/www.quote.com/ek.html",CORRECTED-SEC sues 3 Canada residents over tips via Merrill
"/sdd/edimar/Desktop/doutorado/doutorado04/bases/WEIR/finance/www.quote.com/trow.html",T. Rowe Price Group Closed at Highest Level in Eight Months Tuesday
"/sdd/edimar/Desktop/doutorado/doutorado04/bases/WEIR/finance/www.quote.com/pcln.html","Priceline.com Launches New, Enhanced Hotel Reservation Service New hotel guest satisfaction scorecards highlight enhancements"
"/sdd/edimar/Desktop/doutorado/doutorado04/bases/WEIR/finance/www.quote.com/met.html",A.M. Best Affirms Ratings of MetLife Auto & Home and Its Members - Quick Facts
"/sdd/edimar/Desktop/doutorado/doutorado04/bases/WEIR/finance/www.quote.com/cah.html",Cardinal Health to Present At Goldman Sachs Global Healthcare Conference; Webcast At 11:00 AM
"/sdd/edimar/Desktop/doutorado/doutorado04/bases/WEIR/finance/www.quote.com/d.html",New Issue-Dominion Resources sells $625 mln in debt
"/sdd/edimar/Desktop/doutorado/doutorado04/bases/WEIR/finance/www.quote.com/novl.html","BUYINS.NET: IDTI, DISH, OTEX, ELMG, NOVL and PCTI Are Seasonally Ripe To Go Lower In The Next 5 Weeks"
"/sdd/edimar/Desktop/doutorado/doutorado04/bases/WEIR/finance/www.quote.com/cvg.html",Convergys a Leader in Hiring U.S. Military Spouses
"/sdd/edimar/Desktop/doutorado/doutorado04/bases/WEIR/finance/www.quote.com/ntap.html",NetApp Announces New Enhancements to NetApp Partner Program
"/sdd/edimar/Desktop/doutorado/doutorado04/bases/WEIR/finance/www.quote.com/sle.html",Nestle's Nepresso sees double-digit sales growth
"/sdd/edimar/Desktop/doutorado/doutorado04/bases/WEIR/finance/www.quote.com/cree.html",Cree To Present At Deutsche Bank Investor Conference 1:40 PM
"/sdd/edimar/Desktop/doutorado/doutorado04/bases/WEIR/finance/www.quote.com/sbux.html",REFILE-Nestle's Nespresso sees double-digit sales growth
"/sdd/edimar/Desktop/doutorado/doutorado04/bases/WEIR/finance/www.quote.com/ter.html",Sigurd Accepts 500th Teradyne Gen4 Microwave Instrument
"/sdd/edimar/Desktop/doutorado/doutorado04/bases/WEIR/finance/www.quote.com/icge.html","Internet Capital Group to Hold Annual Stockholders' Meeting on June 19, 2009"
"/sdd/edimar/Desktop/doutorado/doutorado04/bases/WEIR/finance/www.quote.com/ecl.html",Ecolab To Present At William Blair Investor Conference; Webcast At 9:40 AM
"/sdd/edimar/Desktop/doutorado/doutorado04/bases/WEIR/finance/www.quote.com/qsft.html","BUYINS.NET: MTRX, NWK, ROCM, RFMD, QSFT and IF Are Seasonally Ripe To Go Lower In The Next 5 Weeks"
"/sdd/edimar/Desktop/doutorado/doutorado04/bases/WEIR/finance/www.quote.com/ava.html",Notice of Complaint
"/sdd/edimar/Desktop/doutorado/doutorado04/bases/WEIR/finance/www.quote.com/nke.html","NIKE, Inc. Announces Fourth Quarter Fiscal 2009 Earnings and Conference Call"
"/sdd/edimar/Desktop/doutorado/doutorado04/bases/WEIR/finance/www.quote.com/bbi.html","BUYINS.NET: TWTC, ABMD, Q, COO, BBI and NTRI Are Seasonally Ripe To Go Lower In The Next 5 Weeks"
"/sdd/edimar/Desktop/doutorado/doutorado04/bases/WEIR/finance/www.quote.com/ko.html","Coca-Cola Forms New Services Structure, Harry Anderson To Lead - Update"
"/sdd/edimar/Desktop/doutorado/doutorado04/bases/WEIR/finance/www.quote.com/wlp.html",WellPoint To Present At Goldman Sachs 30th Annual Global Healthcare Conference; Webcast At 11:40 AM
"/sdd/edimar/Desktop/doutorado/doutorado04/bases/WEIR/finance/www.quote.com/hum.html",Humana To Present At Goldman Sachs Healthcare Conference; Webcast At 10:20 AM
"/sdd/edimar/Desktop/doutorado/doutorado04/bases/WEIR/finance/www.quote.com/acv.html",Conference Calls Today: 10-10:45 A.M. EDT
"/sdd/edimar/Desktop/doutorado/doutorado04/bases/WEIR/finance/www.quote.com/adm.html",Conference Calls Today: 7:45-9:40 A.M. EDT
"/sdd/edimar/Desktop/doutorado/doutorado04/bases/WEIR/finance/www.quote.com/ben.html",French and Benelux stocks - Factors to watch on June 10
"/sdd/edimar/Desktop/doutorado/doutorado04/bases/WEIR/finance/www.quote.com/amd.html",AMD: Conference call regarding To Webcast Server Platform Q&A Session @ 16:30 ET Today [delayed]
"/sdd/edimar/Desktop/doutorado/doutorado04/bases/WEIR/finance/www.quote.com/dri.html",Darden Restaurants Applauds Senate's Compromise Language on Uniform Nutrition Disclosure
"/sdd/edimar/Desktop/doutorado/doutorado04/bases/WEIR/finance/www.quote.com/adbe.html",Adobe to Webcast Q2 Earnings Conference Call
"/sdd/edimar/Desktop/doutorado/doutorado04/bases/WEIR/finance/www.quote.com/intu.html","Intuit GoPayment Turns Palm Pre Phone Into Credit Card Terminal Available in Pre's App Catalog, GoPayment Helps Business Owners Get Paid on the Spot"
"/sdd/edimar/Desktop/doutorado/doutorado04/bases/WEIR/finance/www.quote.com/amzn.html",Amazon.com Webcast Investor Conference Presentation At 12:45 PM
