URL,EXTRACTED VALUE
"/sdd/edimar/Desktop/doutorado/doutorado04/bases/WEIR/finance/bigcharts.marketwatch.com/WWE.html",Money Markets & More for March 26
"/sdd/edimar/Desktop/doutorado/doutorado04/bases/WEIR/finance/bigcharts.marketwatch.com/NEWP.html",Newport shares tumble on earnings shortfall
"/sdd/edimar/Desktop/doutorado/doutorado04/bases/WEIR/finance/bigcharts.marketwatch.com/KSWS.html",Stocks to Watch: Stocks in focus for Tuesday
"/sdd/edimar/Desktop/doutorado/doutorado04/bases/WEIR/finance/bigcharts.marketwatch.com/KEI.html",Movers & Shakers: Highlights of rising and falling U.S. stocks
"/sdd/edimar/Desktop/doutorado/doutorado04/bases/WEIR/finance/bigcharts.marketwatch.com/SUN.html","Traders Sow Seeds of Profit in Mosaic, Agrium"
"/sdd/edimar/Desktop/doutorado/doutorado04/bases/WEIR/finance/bigcharts.marketwatch.com/PCAR.html",Movers & Shakers: Friday's biggest gaining and losing stocks
"/sdd/edimar/Desktop/doutorado/doutorado04/bases/WEIR/finance/bigcharts.marketwatch.com/MAR.html","Airlines, global markets hit by swine-flu fears"
"/sdd/edimar/Desktop/doutorado/doutorado04/bases/WEIR/finance/bigcharts.marketwatch.com/SNDK.html",SanDisk soars on Samsung agreement
