URL,EXTRACTED VALUE
"/sdd/edimar/Desktop/doutorado/doutorado04/bases/WEIR/finance/bigcharts.marketwatch.com/A.html",Fast Pandemic Detection Tool Ready to Fight Flu
"/sdd/edimar/Desktop/doutorado/doutorado04/bases/WEIR/finance/bigcharts.marketwatch.com/HD.html",The Home Depot Presents Strategic Priorities and Outlines Long-Term Operating Targets; Updates 2009 EPS Guidance
"/sdd/edimar/Desktop/doutorado/doutorado04/bases/WEIR/finance/bigcharts.marketwatch.com/ANF.html",Challenge for Retailers: Shrink to Fit
"/sdd/edimar/Desktop/doutorado/doutorado04/bases/WEIR/finance/bigcharts.marketwatch.com/NOK.html",Europe's Markets End Mixed
"/sdd/edimar/Desktop/doutorado/doutorado04/bases/WEIR/finance/bigcharts.marketwatch.com/GIS.html","Trade Alerts on Active Stocks: Apple, Keryx, Angiotech, General Mills, Pep Boys and Talbots; Issued by InvestorSoup.com"
"/sdd/edimar/Desktop/doutorado/doutorado04/bases/WEIR/finance/bigcharts.marketwatch.com/MHP.html","J.D. Power and Associates to Release 2009 Initial Quality Study Results at the Detroit Athletic Club on Monday, June 22"
"/sdd/edimar/Desktop/doutorado/doutorado04/bases/WEIR/finance/bigcharts.marketwatch.com/JNJ.html","The Stockpickers: Sanfilippo, Teradata, J&J grow on Appleseed Fund"
"/sdd/edimar/Desktop/doutorado/doutorado04/bases/WEIR/finance/bigcharts.marketwatch.com/BAC.html",Merrill Lynch Global Wealth Management Tops Competition On Barron's 'Top 100 Women Financial Advisors' List
"/sdd/edimar/Desktop/doutorado/doutorado04/bases/WEIR/finance/bigcharts.marketwatch.com/TM.html",Toyota USA Foundation Announces $3.3 Million in New Grants
"/sdd/edimar/Desktop/doutorado/doutorado04/bases/WEIR/finance/bigcharts.marketwatch.com/YHOO.html","HP, Intel and Yahoo! Attract Leading Research Organizations to Collaborative Cloud Computing Test Bed"
"/sdd/edimar/Desktop/doutorado/doutorado04/bases/WEIR/finance/bigcharts.marketwatch.com/CAG.html",Foster Farms to Acquire Fernando's and El Extremo Foodservice Brands From ConAgra Foods
"/sdd/edimar/Desktop/doutorado/doutorado04/bases/WEIR/finance/bigcharts.marketwatch.com/LUV.html",Southwest Airlines Co. to Present at the Bank of America - Merrill Lynch 2009 Global Transportation Conference
"/sdd/edimar/Desktop/doutorado/doutorado04/bases/WEIR/finance/bigcharts.marketwatch.com/BAX.html",Baxter to Present at the William Blair Growth Stock Conference
"/sdd/edimar/Desktop/doutorado/doutorado04/bases/WEIR/finance/bigcharts.marketwatch.com/MIL.html",Millipore Opens New Bioprocess Manufacturing Facility in Massachusetts
"/sdd/edimar/Desktop/doutorado/doutorado04/bases/WEIR/finance/bigcharts.marketwatch.com/STJ.html","St. Jude Medical Acquires Intellectual Property and Non-Cash Assets of Northstar Neuroscience, Inc."
"/sdd/edimar/Desktop/doutorado/doutorado04/bases/WEIR/finance/bigcharts.marketwatch.com/KR.html",Kroger to Webcast First Quarter Conference Call with Investors
"/sdd/edimar/Desktop/doutorado/doutorado04/bases/WEIR/finance/bigcharts.marketwatch.com/BHI.html",The Ratings Game: FBR upgrades oil drillers on 2011 profit prospects
"/sdd/edimar/Desktop/doutorado/doutorado04/bases/WEIR/finance/bigcharts.marketwatch.com/PCAR.html",Kenworth T370 Becomes First Medium Duty Hybrid Truck in New York City's Fleet
"/sdd/edimar/Desktop/doutorado/doutorado04/bases/WEIR/finance/bigcharts.marketwatch.com/CA.html",AXA Technology Services Wins CA IDUG Award for Outstanding Work in DB2
"/sdd/edimar/Desktop/doutorado/doutorado04/bases/WEIR/finance/bigcharts.marketwatch.com/WLP.html",Deciphering Your Health Insurance
"/sdd/edimar/Desktop/doutorado/doutorado04/bases/WEIR/finance/bigcharts.marketwatch.com/VOD.html",Ads Tout Pre's Nimble Moves
"/sdd/edimar/Desktop/doutorado/doutorado04/bases/WEIR/finance/bigcharts.marketwatch.com/NYT.html",N.Y. Times to seek Boston Globe bids: paper
"/sdd/edimar/Desktop/doutorado/doutorado04/bases/WEIR/finance/bigcharts.marketwatch.com/NOVL.html",Novell to Demo Moblin-based Operating System on Acer and MSI Devices at Computex
"/sdd/edimar/Desktop/doutorado/doutorado04/bases/WEIR/finance/bigcharts.marketwatch.com/DUK.html",Green-energy gurus not holding breath on CO2 rules
"/sdd/edimar/Desktop/doutorado/doutorado04/bases/WEIR/finance/bigcharts.marketwatch.com/ALTR.html",Altera Eases Development of 40-nm FPGAs with Stratix IV GX FPGA Development Kit
"/sdd/edimar/Desktop/doutorado/doutorado04/bases/WEIR/finance/bigcharts.marketwatch.com/SWY.html","Today's top stock alerts include: SWY, T, TGT, TWX, UNH, WLP"
"/sdd/edimar/Desktop/doutorado/doutorado04/bases/WEIR/finance/bigcharts.marketwatch.com/CSCO.html",Duke Energy Partners with Cisco to Fast-Track Development of Utility's 'Smart Grid'
"/sdd/edimar/Desktop/doutorado/doutorado04/bases/WEIR/finance/bigcharts.marketwatch.com/WY.html",All iLevel by Weyerhaeuser Facilities Certified to SFI or PEFC
"/sdd/edimar/Desktop/doutorado/doutorado04/bases/WEIR/finance/bigcharts.marketwatch.com/NVDA.html",Rambus Moves to Withdraw Patents From ITC Proceedings Against NVIDIA
"/sdd/edimar/Desktop/doutorado/doutorado04/bases/WEIR/finance/bigcharts.marketwatch.com/IPG.html","Weber Shandwick Named Agency of Record for Brammo, Manufacturer of Plug-In Electric Motorcycles"
"/sdd/edimar/Desktop/doutorado/doutorado04/bases/WEIR/finance/bigcharts.marketwatch.com/SNE.html",Peter Jackson to Attend Comic-Con for the First Time
"/sdd/edimar/Desktop/doutorado/doutorado04/bases/WEIR/finance/bigcharts.marketwatch.com/NEM.html",Metals Stocks: Gold rises as dollar slips
"/sdd/edimar/Desktop/doutorado/doutorado04/bases/WEIR/finance/bigcharts.marketwatch.com/KO.html",Harris Corporation Recognized by Foreign Policy Association for Commitment to Corporate Responsibility
"/sdd/edimar/Desktop/doutorado/doutorado04/bases/WEIR/finance/bigcharts.marketwatch.com/AMD.html",Intel lost market share in first quarter: iSuppli
"/sdd/edimar/Desktop/doutorado/doutorado04/bases/WEIR/finance/bigcharts.marketwatch.com/JNPR.html",Juniper Networks Protects Customers from New Microsoft Vulnerabilities Disclosed Today
"/sdd/edimar/Desktop/doutorado/doutorado04/bases/WEIR/finance/bigcharts.marketwatch.com/DD.html","Solae, LLC Launches Innovative Soy Protein Isolate"
"/sdd/edimar/Desktop/doutorado/doutorado04/bases/WEIR/finance/bigcharts.marketwatch.com/BBT.html",Treasury: Ten banks can repay $68 billion in TARP
"/sdd/edimar/Desktop/doutorado/doutorado04/bases/WEIR/finance/bigcharts.marketwatch.com/QCOM.html",FLO TV Goes National - Expands Live Mobile TV Service as DTV Transition Frees Broadband Spectrum
"/sdd/edimar/Desktop/doutorado/doutorado04/bases/WEIR/finance/bigcharts.marketwatch.com/JWN.html",Retail Stocks: Talbots to sell J. Jill brand as sector rebounds
"/sdd/edimar/Desktop/doutorado/doutorado04/bases/WEIR/finance/bigcharts.marketwatch.com/GCI.html",Margaret Buchanan named top publisher in Gannett U.S. Community Publishing
"/sdd/edimar/Desktop/doutorado/doutorado04/bases/WEIR/finance/bigcharts.marketwatch.com/MMC.html",Kroll Helps Healthcare Providers Face Looming Red Flag Rules
"/sdd/edimar/Desktop/doutorado/doutorado04/bases/WEIR/finance/bigcharts.marketwatch.com/ABX.html",Metals Stocks: Gold rises as dollar slips
"/sdd/edimar/Desktop/doutorado/doutorado04/bases/WEIR/finance/bigcharts.marketwatch.com/SRE.html",SDG&E Offers Nearly $40 Million in Energy-Efficiency Incentives for Businesses
"/sdd/edimar/Desktop/doutorado/doutorado04/bases/WEIR/finance/bigcharts.marketwatch.com/JCP.html",Retail Stocks: Talbots to sell J. Jill brand as sector rebounds
"/sdd/edimar/Desktop/doutorado/doutorado04/bases/WEIR/finance/bigcharts.marketwatch.com/VMC.html",Management Change at Aggregate Industries US
"/sdd/edimar/Desktop/doutorado/doutorado04/bases/WEIR/finance/bigcharts.marketwatch.com/BCR.html",Thoratec Announces Appointment of Paul LaViolette to Board of Directors
"/sdd/edimar/Desktop/doutorado/doutorado04/bases/WEIR/finance/bigcharts.marketwatch.com/VIA.html","Money Markets & More for Wednesday, June 10: The salad bar edition"
"/sdd/edimar/Desktop/doutorado/doutorado04/bases/WEIR/finance/bigcharts.marketwatch.com/LMT.html","Savi Unveils New Low-Cost, Simplified RTLS Wireless System to Locate Assets in Facilities and Yards"
