URL,EXTRACTED VALUE
"/sdd/edimar/Desktop/doutorado/doutorado04/bases/WEIR/finance/bigcharts.marketwatch.com/CAH.html",Cardinal Health hikes dividend
"/sdd/edimar/Desktop/doutorado/doutorado04/bases/WEIR/finance/bigcharts.marketwatch.com/CPB.html",Stocks to Watch: Stocks in focus for Friday
"/sdd/edimar/Desktop/doutorado/doutorado04/bases/WEIR/finance/bigcharts.marketwatch.com/MSO.html",Martha Stewart Living Names CFO
"/sdd/edimar/Desktop/doutorado/doutorado04/bases/WEIR/finance/bigcharts.marketwatch.com/WHR.html","Carnival Sinks 14% as Glaxo, GM Jump"
"/sdd/edimar/Desktop/doutorado/doutorado04/bases/WEIR/finance/bigcharts.marketwatch.com/KBH.html","S&P 500 turns higher, led by industrial and materials firms"
"/sdd/edimar/Desktop/doutorado/doutorado04/bases/WEIR/finance/bigcharts.marketwatch.com/PFE.html",Israel Stocks: Israeli stocks fall; Teva and telecoms in focus
"/sdd/edimar/Desktop/doutorado/doutorado04/bases/WEIR/finance/bigcharts.marketwatch.com/ADSK.html",Autodesk soars as analysts cite cost cutting
"/sdd/edimar/Desktop/doutorado/doutorado04/bases/WEIR/finance/bigcharts.marketwatch.com/BGG.html",Briggs & Stratton 3rd-period net quadrupled; sales up 11%
"/sdd/edimar/Desktop/doutorado/doutorado04/bases/WEIR/finance/bigcharts.marketwatch.com/PX.html",Praxair's net falls 7.5% on demand drop; revenue view cut
"/sdd/edimar/Desktop/doutorado/doutorado04/bases/WEIR/finance/bigcharts.marketwatch.com/CCU.html",Chilean ADRs fall in uncertain response to election
"/sdd/edimar/Desktop/doutorado/doutorado04/bases/WEIR/finance/bigcharts.marketwatch.com/COMS.html",Stocks to Watch: Stocks in focus for Friday
"/sdd/edimar/Desktop/doutorado/doutorado04/bases/WEIR/finance/bigcharts.marketwatch.com/UNP.html",Net at Three Big Railroads Is Off Track
"/sdd/edimar/Desktop/doutorado/doutorado04/bases/WEIR/finance/bigcharts.marketwatch.com/TGT.html",Retail Stocks: Retail stocks drop; Lululemon guidance misses
"/sdd/edimar/Desktop/doutorado/doutorado04/bases/WEIR/finance/bigcharts.marketwatch.com/NCR.html",Selloff Stings Conmed and NCR but Spares Acorda
"/sdd/edimar/Desktop/doutorado/doutorado04/bases/WEIR/finance/bigcharts.marketwatch.com/FRE.html",Freddie Mac: 30-year fixed-rate mortgage climbs
"/sdd/edimar/Desktop/doutorado/doutorado04/bases/WEIR/finance/bigcharts.marketwatch.com/XOM.html",NYSE glitch halts some floor trading
"/sdd/edimar/Desktop/doutorado/doutorado04/bases/WEIR/finance/bigcharts.marketwatch.com/LUV.html",US Airlines April fuel bill falls 48%
"/sdd/edimar/Desktop/doutorado/doutorado04/bases/WEIR/finance/bigcharts.marketwatch.com/X.html",Market Snapshot: Stocks look to China for next leg of rally
"/sdd/edimar/Desktop/doutorado/doutorado04/bases/WEIR/finance/bigcharts.marketwatch.com/ATI.html",Movers & Shakers: Wednesday's biggest gaining and declining stocks
"/sdd/edimar/Desktop/doutorado/doutorado04/bases/WEIR/finance/bigcharts.marketwatch.com/HOTT.html",Hot Topic May same-store sales decline 6.4%
"/sdd/edimar/Desktop/doutorado/doutorado04/bases/WEIR/finance/bigcharts.marketwatch.com/RIMM.html",Therese Poletti's Tech Tales: Is AT&T an albatross around Apple's neck?
"/sdd/edimar/Desktop/doutorado/doutorado04/bases/WEIR/finance/bigcharts.marketwatch.com/CA.html",Stocks to Watch: Stocks in focus for Thursday
"/sdd/edimar/Desktop/doutorado/doutorado04/bases/WEIR/finance/bigcharts.marketwatch.com/PCLN.html","Earnings Watch: Updates, advisories and surprises"
"/sdd/edimar/Desktop/doutorado/doutorado04/bases/WEIR/finance/bigcharts.marketwatch.com/TIN.html","Earnings Watch: Updates, advisories and surprises"
"/sdd/edimar/Desktop/doutorado/doutorado04/bases/WEIR/finance/bigcharts.marketwatch.com/CSX.html",Railway Keeps Its Furloughed at Hand
"/sdd/edimar/Desktop/doutorado/doutorado04/bases/WEIR/finance/bigcharts.marketwatch.com/ELNK.html","Multinational tech stocks facing headwinds, says Jacob"
"/sdd/edimar/Desktop/doutorado/doutorado04/bases/WEIR/finance/bigcharts.marketwatch.com/ALTR.html",Yahoo names GE veteran as new finance chief
"/sdd/edimar/Desktop/doutorado/doutorado04/bases/WEIR/finance/bigcharts.marketwatch.com/IP.html",International Paper: 'Black liquor' boosts profit
"/sdd/edimar/Desktop/doutorado/doutorado04/bases/WEIR/finance/bigcharts.marketwatch.com/TKR.html","Timken profit falls sharply, firm halves dividend"
"/sdd/edimar/Desktop/doutorado/doutorado04/bases/WEIR/finance/bigcharts.marketwatch.com/CEG.html",Power firms earnings lose their spark
"/sdd/edimar/Desktop/doutorado/doutorado04/bases/WEIR/finance/bigcharts.marketwatch.com/QCOM.html",Qualcomm boosts third-quarter outlook
"/sdd/edimar/Desktop/doutorado/doutorado04/bases/WEIR/finance/bigcharts.marketwatch.com/FLR.html",Stocks to Watch: Stocks in focus for Tuesday
"/sdd/edimar/Desktop/doutorado/doutorado04/bases/WEIR/finance/bigcharts.marketwatch.com/NTRS.html",FundWatch: Build America Bonds boost muni-bond market
"/sdd/edimar/Desktop/doutorado/doutorado04/bases/WEIR/finance/bigcharts.marketwatch.com/BP.html",Exxon joining $26 billion TransCanada pipeline
"/sdd/edimar/Desktop/doutorado/doutorado04/bases/WEIR/finance/bigcharts.marketwatch.com/PSUN.html",Pacific Sunwear says Adrenalina withdraws board nominees
"/sdd/edimar/Desktop/doutorado/doutorado04/bases/WEIR/finance/bigcharts.marketwatch.com/MSFT.html","iShares MSCI Emerging Markets, Microsoft: Money Flow Leaders (EEM, MSFT)"
"/sdd/edimar/Desktop/doutorado/doutorado04/bases/WEIR/finance/bigcharts.marketwatch.com/KSWS.html",K-Swiss declares special dividend of $2-share
"/sdd/edimar/Desktop/doutorado/doutorado04/bases/WEIR/finance/bigcharts.marketwatch.com/AMAT.html",New Chips Can Boost Solar Power
"/sdd/edimar/Desktop/doutorado/doutorado04/bases/WEIR/finance/bigcharts.marketwatch.com/AHC.html","A.H. Belo to Cut Pay, Benefits"
"/sdd/edimar/Desktop/doutorado/doutorado04/bases/WEIR/finance/bigcharts.marketwatch.com/CPN.html",Calpine Swings to a Profit
"/sdd/edimar/Desktop/doutorado/doutorado04/bases/WEIR/finance/bigcharts.marketwatch.com/TIF.html","Retail Stocks: J. Crew, Office Depot lead sector rally"
"/sdd/edimar/Desktop/doutorado/doutorado04/bases/WEIR/finance/bigcharts.marketwatch.com/TJX.html",Beemer: Memorial Day shocker for retail
"/sdd/edimar/Desktop/doutorado/doutorado04/bases/WEIR/finance/bigcharts.marketwatch.com/MCK.html",McKesson Posts Flat Revenue
"/sdd/edimar/Desktop/doutorado/doutorado04/bases/WEIR/finance/bigcharts.marketwatch.com/PH.html",Parker Hannifin lowers full-year outlook as profit tumbles
"/sdd/edimar/Desktop/doutorado/doutorado04/bases/WEIR/finance/bigcharts.marketwatch.com/BSX.html",Boston Sci wins FDA approval for Liberte stent
"/sdd/edimar/Desktop/doutorado/doutorado04/bases/WEIR/finance/bigcharts.marketwatch.com/FCEL.html",Stocks in focus for Monday
"/sdd/edimar/Desktop/doutorado/doutorado04/bases/WEIR/finance/bigcharts.marketwatch.com/UN.html",Tate & Lyle's Annual Net Profit Drops
"/sdd/edimar/Desktop/doutorado/doutorado04/bases/WEIR/finance/bigcharts.marketwatch.com/ETN.html",Movers & Shakers: Monday's biggest gaining and declining stocks
"/sdd/edimar/Desktop/doutorado/doutorado04/bases/WEIR/finance/bigcharts.marketwatch.com/BAC.html",Mark Hulbert: Stocks go from roller coaster to yawner
"/sdd/edimar/Desktop/doutorado/doutorado04/bases/WEIR/finance/bigcharts.marketwatch.com/TM.html",Commodities lead broad Asia market rally
"/sdd/edimar/Desktop/doutorado/doutorado04/bases/WEIR/finance/bigcharts.marketwatch.com/UNM.html","Earnings Watch: Updates, advisories and surprises"
"/sdd/edimar/Desktop/doutorado/doutorado04/bases/WEIR/finance/bigcharts.marketwatch.com/BA.html","Delta, American to Cut Back"
"/sdd/edimar/Desktop/doutorado/doutorado04/bases/WEIR/finance/bigcharts.marketwatch.com/USM.html","AT&T, Verizon lead telecoms, buck market decline"
"/sdd/edimar/Desktop/doutorado/doutorado04/bases/WEIR/finance/bigcharts.marketwatch.com/CREE.html",Stocks to Watch: Stocks in focus for Wednesday
"/sdd/edimar/Desktop/doutorado/doutorado04/bases/WEIR/finance/bigcharts.marketwatch.com/BDK.html",Movers & Shakers: Thursday's biggest gaining and losing stocks
"/sdd/edimar/Desktop/doutorado/doutorado04/bases/WEIR/finance/bigcharts.marketwatch.com/HMC.html","Nikkei Stands Tall, Hits 8-Month High"
"/sdd/edimar/Desktop/doutorado/doutorado04/bases/WEIR/finance/bigcharts.marketwatch.com/PSS.html",Retail Stocks: Best Buy rises; analyst sees boost from Circuit City closures
"/sdd/edimar/Desktop/doutorado/doutorado04/bases/WEIR/finance/bigcharts.marketwatch.com/UNH.html",Traders Set 'Put' Floors
"/sdd/edimar/Desktop/doutorado/doutorado04/bases/WEIR/finance/bigcharts.marketwatch.com/NSC.html",Norfolk Southern profit hit by steep drop in freight
"/sdd/edimar/Desktop/doutorado/doutorado04/bases/WEIR/finance/bigcharts.marketwatch.com/VRSN.html",Traders Turn Bullish on Tech Sector
"/sdd/edimar/Desktop/doutorado/doutorado04/bases/WEIR/finance/bigcharts.marketwatch.com/CSCO.html","In California, Google's man is well-connected"
"/sdd/edimar/Desktop/doutorado/doutorado04/bases/WEIR/finance/bigcharts.marketwatch.com/CAT.html",Stocks to Watch: Stocks in focus for Wednesday
"/sdd/edimar/Desktop/doutorado/doutorado04/bases/WEIR/finance/bigcharts.marketwatch.com/IPG.html",Rate Worries Keep Damper on Treasurys
"/sdd/edimar/Desktop/doutorado/doutorado04/bases/WEIR/finance/bigcharts.marketwatch.com/HIG.html","Before the Bell: BlackRock, import prices, Microsoft in focus"
"/sdd/edimar/Desktop/doutorado/doutorado04/bases/WEIR/finance/bigcharts.marketwatch.com/WMT.html","Retail Stocks: Retail stocks fall, but Saks gains on upgrade"
"/sdd/edimar/Desktop/doutorado/doutorado04/bases/WEIR/finance/bigcharts.marketwatch.com/SO.html",Southern profit hit by big drop in power sales
"/sdd/edimar/Desktop/doutorado/doutorado04/bases/WEIR/finance/bigcharts.marketwatch.com/TYC.html","Earnings Watch: Updates, advisories and surprises"
"/sdd/edimar/Desktop/doutorado/doutorado04/bases/WEIR/finance/bigcharts.marketwatch.com/BBT.html",MarketWatch Hot Stocks: TARP News Hits Financials
"/sdd/edimar/Desktop/doutorado/doutorado04/bases/WEIR/finance/bigcharts.marketwatch.com/AET.html",Aetna Cuts Earnings Forecast
"/sdd/edimar/Desktop/doutorado/doutorado04/bases/WEIR/finance/bigcharts.marketwatch.com/NSM.html",Tech Stocks: Tech stocks stay in the red despite upswing
"/sdd/edimar/Desktop/doutorado/doutorado04/bases/WEIR/finance/bigcharts.marketwatch.com/UPS.html","Money Markets And More (U.S. Markets Preview for Wednesday, May 27th): Taking the pulse of housing"
"/sdd/edimar/Desktop/doutorado/doutorado04/bases/WEIR/finance/bigcharts.marketwatch.com/F.html",Chinese Interest in Volvo Grows
"/sdd/edimar/Desktop/doutorado/doutorado04/bases/WEIR/finance/bigcharts.marketwatch.com/VFC.html","VF, E*TRADE Financial: Biggest Price Decliners (VFC, ETFC)"
"/sdd/edimar/Desktop/doutorado/doutorado04/bases/WEIR/finance/bigcharts.marketwatch.com/ABT.html",New Hope for Breast-Cancer Patients
"/sdd/edimar/Desktop/doutorado/doutorado04/bases/WEIR/finance/bigcharts.marketwatch.com/CCL.html","BofA Climbs 9.9%; Lowe's, Wynn Gain"
"/sdd/edimar/Desktop/doutorado/doutorado04/bases/WEIR/finance/bigcharts.marketwatch.com/HNZ.html",Midday report from MarketWatch Radio Network
"/sdd/edimar/Desktop/doutorado/doutorado04/bases/WEIR/finance/bigcharts.marketwatch.com/USB.html",Ten large banks can return $68 billion in TARP
"/sdd/edimar/Desktop/doutorado/doutorado04/bases/WEIR/finance/bigcharts.marketwatch.com/BEN.html",Bidders Emerge for AIG Unit
"/sdd/edimar/Desktop/doutorado/doutorado04/bases/WEIR/finance/bigcharts.marketwatch.com/AVP.html",Avon profit drops more than expected
"/sdd/edimar/Desktop/doutorado/doutorado04/bases/WEIR/finance/bigcharts.marketwatch.com/COF.html",Nine Banks to Repay TARP Money
