URL,EXTRACTED VALUE
"/sdd/edimar/Desktop/doutorado/doutorado04/bases/WEIR/finance/bigcharts.marketwatch.com/A.html",Agilent swings to a fiscal second-quarter loss
"/sdd/edimar/Desktop/doutorado/doutorado04/bases/WEIR/finance/bigcharts.marketwatch.com/LLY.html",Antipsychotic Drugs Seen Effective in Kids
"/sdd/edimar/Desktop/doutorado/doutorado04/bases/WEIR/finance/bigcharts.marketwatch.com/S.html",IRS Weighs Tax on Work-Cellphone Use
"/sdd/edimar/Desktop/doutorado/doutorado04/bases/WEIR/finance/bigcharts.marketwatch.com/APD.html",Air Products second-quarter profit slumps
"/sdd/edimar/Desktop/doutorado/doutorado04/bases/WEIR/finance/bigcharts.marketwatch.com/JNJ.html",Antipsychotic Drugs Seen Effective in Kids
"/sdd/edimar/Desktop/doutorado/doutorado04/bases/WEIR/finance/bigcharts.marketwatch.com/ROK.html",Rockwell Automation 2Q plummets
"/sdd/edimar/Desktop/doutorado/doutorado04/bases/WEIR/finance/bigcharts.marketwatch.com/GPC.html",Genuine Parts' shares rally as results eclipse targets
"/sdd/edimar/Desktop/doutorado/doutorado04/bases/WEIR/finance/bigcharts.marketwatch.com/CHL.html",H-P Seeks Wireless Deals in China
"/sdd/edimar/Desktop/doutorado/doutorado04/bases/WEIR/finance/bigcharts.marketwatch.com/BAC.html","Top Ten: MarketWatch's top stories of the week, June 8-12"
"/sdd/edimar/Desktop/doutorado/doutorado04/bases/WEIR/finance/bigcharts.marketwatch.com/EMR.html",Emerson profit drops as sales fall 16%
"/sdd/edimar/Desktop/doutorado/doutorado04/bases/WEIR/finance/bigcharts.marketwatch.com/RSH.html",Palm's Pre Set for June Release
"/sdd/edimar/Desktop/doutorado/doutorado04/bases/WEIR/finance/bigcharts.marketwatch.com/DDS.html",Dillard May same-store sales down 13%
"/sdd/edimar/Desktop/doutorado/doutorado04/bases/WEIR/finance/bigcharts.marketwatch.com/X.html","TI, BlackRock Gain; Suntech Also Rises"
"/sdd/edimar/Desktop/doutorado/doutorado04/bases/WEIR/finance/bigcharts.marketwatch.com/HOTT.html",After Hours: NetApp reaches M&A deal; Hot Topic shares drop
"/sdd/edimar/Desktop/doutorado/doutorado04/bases/WEIR/finance/bigcharts.marketwatch.com/MMM.html","Pair Danaher buy with 3M short, Merrill Lynch says"
"/sdd/edimar/Desktop/doutorado/doutorado04/bases/WEIR/finance/bigcharts.marketwatch.com/CSX.html",Late Burst Extends Stocks' Streak
"/sdd/edimar/Desktop/doutorado/doutorado04/bases/WEIR/finance/bigcharts.marketwatch.com/DE.html","Boeing, Caterpillar, Alcoa Pace the Dow"
"/sdd/edimar/Desktop/doutorado/doutorado04/bases/WEIR/finance/bigcharts.marketwatch.com/INTC.html",Mark Hulbert: Stocks go from roller coaster to yawner
"/sdd/edimar/Desktop/doutorado/doutorado04/bases/WEIR/finance/bigcharts.marketwatch.com/FCX.html",Emerging Nations Buoy Resources
"/sdd/edimar/Desktop/doutorado/doutorado04/bases/WEIR/finance/bigcharts.marketwatch.com/LOW.html",Home Depot raises full-year profit forecasts
"/sdd/edimar/Desktop/doutorado/doutorado04/bases/WEIR/finance/bigcharts.marketwatch.com/AAPL.html",Tech Stocks: Tech stocks stay in the red despite upswing
"/sdd/edimar/Desktop/doutorado/doutorado04/bases/WEIR/finance/bigcharts.marketwatch.com/ZQK.html","Quiksilver, LCA-Vision: Biggest Price Decliners (ZQK, LCAV)"
"/sdd/edimar/Desktop/doutorado/doutorado04/bases/WEIR/finance/bigcharts.marketwatch.com/GT.html",Goodyear to cut consumer-tire production in France
"/sdd/edimar/Desktop/doutorado/doutorado04/bases/WEIR/finance/bigcharts.marketwatch.com/WFC.html",Chuck Jaffe: Evergreen Funds get a black eye
"/sdd/edimar/Desktop/doutorado/doutorado04/bases/WEIR/finance/bigcharts.marketwatch.com/JNPR.html","Before the Bell: J.P. Morgan, Morgan Stanley, Barclays in focus"
"/sdd/edimar/Desktop/doutorado/doutorado04/bases/WEIR/finance/bigcharts.marketwatch.com/NSM.html",Market Snapshot: Improved sentiment reflected in stock market
"/sdd/edimar/Desktop/doutorado/doutorado04/bases/WEIR/finance/bigcharts.marketwatch.com/AXP.html","After Hours: Yahoo names new CFO, National Semi posts loss"
"/sdd/edimar/Desktop/doutorado/doutorado04/bases/WEIR/finance/bigcharts.marketwatch.com/NTRS.html",Treasury: Ten banks can repay $68 billion in TARP
"/sdd/edimar/Desktop/doutorado/doutorado04/bases/WEIR/finance/bigcharts.marketwatch.com/IR.html",Quanta replacing Ingersoll-Rand in S&P 500
"/sdd/edimar/Desktop/doutorado/doutorado04/bases/WEIR/finance/bigcharts.marketwatch.com/ABT.html",AstraZeneca to co-promote Abbott's Trilipix
"/sdd/edimar/Desktop/doutorado/doutorado04/bases/WEIR/finance/bigcharts.marketwatch.com/MSFT.html",Tech Stocks: Tech stocks stay in the red despite upswing
"/sdd/edimar/Desktop/doutorado/doutorado04/bases/WEIR/finance/bigcharts.marketwatch.com/AMAT.html",After Hours: Intuit off; chip stocks edge up after dayside fall
"/sdd/edimar/Desktop/doutorado/doutorado04/bases/WEIR/finance/bigcharts.marketwatch.com/CTL.html",Western Digital to replace Embarq in S&P 500
"/sdd/edimar/Desktop/doutorado/doutorado04/bases/WEIR/finance/bigcharts.marketwatch.com/DELL.html",Dell Looks To Ramp Up Acquisitions
"/sdd/edimar/Desktop/doutorado/doutorado04/bases/WEIR/finance/bigcharts.marketwatch.com/CVX.html",Single-Digit P/E Ratios
"/sdd/edimar/Desktop/doutorado/doutorado04/bases/WEIR/finance/bigcharts.marketwatch.com/RMBS.html",Tech Stocks: Tech stocks stay in the red despite upswing
