URL,EXTRACTED VALUE
"/sdd/edimar/Desktop/doutorado/doutorado04/bases/WEIR/finance/bigcharts.marketwatch.com/FCEL.html",Stocks in focus for Monday
"/sdd/edimar/Desktop/doutorado/doutorado04/bases/WEIR/finance/bigcharts.marketwatch.com/AIG.html","AIG Announces Pricing of Secondary Offering of Its Shares in Transatlantic Holdings, Inc."
"/sdd/edimar/Desktop/doutorado/doutorado04/bases/WEIR/finance/bigcharts.marketwatch.com/ADSK.html",Cyberhand Technologies and TriEye Lead Designer's Work Featured in Fortune Magazine
"/sdd/edimar/Desktop/doutorado/doutorado04/bases/WEIR/finance/bigcharts.marketwatch.com/PHG.html",Huge Energy Savings in Prospect as LUXEON Rebel LEDs Power Next-Generation Floodlight
"/sdd/edimar/Desktop/doutorado/doutorado04/bases/WEIR/finance/bigcharts.marketwatch.com/PZZA.html","Papa John's Debuts Groundbreaking Augmented Reality Feature Online, Expands to Pizza Boxes June 1"
"/sdd/edimar/Desktop/doutorado/doutorado04/bases/WEIR/finance/bigcharts.marketwatch.com/BGG.html",Briggs & Stratton Corporation Reduces Electricity Consumption by 9.4 Million Kilowatt-Hours Using Orion Technology
"/sdd/edimar/Desktop/doutorado/doutorado04/bases/WEIR/finance/bigcharts.marketwatch.com/ORCL.html",Personal Finance Daily: Older workers' time is coming
"/sdd/edimar/Desktop/doutorado/doutorado04/bases/WEIR/finance/bigcharts.marketwatch.com/CAL.html",Continental Airlines Presenting at the Bank of America - Merrill Lynch Global Transportation Conference
"/sdd/edimar/Desktop/doutorado/doutorado04/bases/WEIR/finance/bigcharts.marketwatch.com/NCR.html",NCR Appoints Alex C. Camara as Vice President and General Manager of NCR Entertainment Solutions
"/sdd/edimar/Desktop/doutorado/doutorado04/bases/WEIR/finance/bigcharts.marketwatch.com/UNM.html","Earnings Watch: Updates, advisories and surprises"
"/sdd/edimar/Desktop/doutorado/doutorado04/bases/WEIR/finance/bigcharts.marketwatch.com/GPS.html",Business Wire Retail Report on May 2009 Retail Sales Figures
"/sdd/edimar/Desktop/doutorado/doutorado04/bases/WEIR/finance/bigcharts.marketwatch.com/NTAP.html","Levi & Korsinsky, LLP Investigates Breach of Fiduciary Duty by the Board of Data Domain, Inc."
"/sdd/edimar/Desktop/doutorado/doutorado04/bases/WEIR/finance/bigcharts.marketwatch.com/ATI.html",Movers & Shakers: Wednesday's biggest gaining and declining stocks
"/sdd/edimar/Desktop/doutorado/doutorado04/bases/WEIR/finance/bigcharts.marketwatch.com/SBUX.html",Dunkin' Donuts Betting on Asia
"/sdd/edimar/Desktop/doutorado/doutorado04/bases/WEIR/finance/bigcharts.marketwatch.com/HMC.html","Nikkei Stands Tall, Hits 8-Month High"
"/sdd/edimar/Desktop/doutorado/doutorado04/bases/WEIR/finance/bigcharts.marketwatch.com/TXN.html",Autoliv chooses Texas Instruments for its world's first night vision system with pedestrian detection
"/sdd/edimar/Desktop/doutorado/doutorado04/bases/WEIR/finance/bigcharts.marketwatch.com/UNH.html","Today's top stock alerts include: SWY, T, TGT, TWX, UNH, WLP"
"/sdd/edimar/Desktop/doutorado/doutorado04/bases/WEIR/finance/bigcharts.marketwatch.com/COST.html",Retail Stocks: Sector tumbles after May sales results
"/sdd/edimar/Desktop/doutorado/doutorado04/bases/WEIR/finance/bigcharts.marketwatch.com/PCG.html",PG&E sticks to 2009 earnings generation view
"/sdd/edimar/Desktop/doutorado/doutorado04/bases/WEIR/finance/bigcharts.marketwatch.com/FDX.html",FedEx SmartPost Signs Lease at the Hardy Distribution Center
"/sdd/edimar/Desktop/doutorado/doutorado04/bases/WEIR/finance/bigcharts.marketwatch.com/N.html",StarVest Partners Extends Software-As-A-Service Portfolio
"/sdd/edimar/Desktop/doutorado/doutorado04/bases/WEIR/finance/bigcharts.marketwatch.com/DHR.html","Danaher posts lower profit, cuts outlook"
"/sdd/edimar/Desktop/doutorado/doutorado04/bases/WEIR/finance/bigcharts.marketwatch.com/BSC.html",Fitch Places 14 Classes of Bear Stearns Commercial Mortgage Securities Trust 2007-TOP26 on Watch Neg
"/sdd/edimar/Desktop/doutorado/doutorado04/bases/WEIR/finance/bigcharts.marketwatch.com/CVG.html",Convergys Launches Loan Modification Solutions that Provide Mortgage Lenders with New Capabilities to Improve the Customer Experience
"/sdd/edimar/Desktop/doutorado/doutorado04/bases/WEIR/finance/bigcharts.marketwatch.com/AET.html",Aetna Cuts Earnings Forecast
"/sdd/edimar/Desktop/doutorado/doutorado04/bases/WEIR/finance/bigcharts.marketwatch.com/MET.html","A.M. Best Assigns Debt Rating to MetLife, Inc.'s Senior Notes Offering"
"/sdd/edimar/Desktop/doutorado/doutorado04/bases/WEIR/finance/bigcharts.marketwatch.com/NTRS.html",FundWatch: Build America Bonds boost muni-bond market
"/sdd/edimar/Desktop/doutorado/doutorado04/bases/WEIR/finance/bigcharts.marketwatch.com/LTD.html",Limited same-store sales fell 7% in May
"/sdd/edimar/Desktop/doutorado/doutorado04/bases/WEIR/finance/bigcharts.marketwatch.com/CI.html","CIGNA International Makes Medical Tourism, Other Podcasts Available"
"/sdd/edimar/Desktop/doutorado/doutorado04/bases/WEIR/finance/bigcharts.marketwatch.com/CCL.html","BofA Climbs 9.9%; Lowe's, Wynn Gain"
"/sdd/edimar/Desktop/doutorado/doutorado04/bases/WEIR/finance/bigcharts.marketwatch.com/MSTR.html",MicroStrategy to Provide Additional Reporting and Analytics Tools for Lowe's
"/sdd/edimar/Desktop/doutorado/doutorado04/bases/WEIR/finance/bigcharts.marketwatch.com/USB.html",Ten large banks can return $68 billion in TARP
"/sdd/edimar/Desktop/doutorado/doutorado04/bases/WEIR/finance/bigcharts.marketwatch.com/KSS.html",Johnson: Days of easy rallies are over
"/sdd/edimar/Desktop/doutorado/doutorado04/bases/WEIR/finance/bigcharts.marketwatch.com/TJX.html",Beemer: Memorial Day shocker for retail
"/sdd/edimar/Desktop/doutorado/doutorado04/bases/WEIR/finance/bigcharts.marketwatch.com/MCK.html",McKesson Posts Flat Revenue
"/sdd/edimar/Desktop/doutorado/doutorado04/bases/WEIR/finance/bigcharts.marketwatch.com/COF.html","Integrity Media Issues Pre-Market Alert for Investors of Financial Companies IFSL, V, AXP, DFS, MA, COF"
