URL,EXTRACTED VALUE
"/sdd/edimar/Desktop/doutorado/doutorado04/bases/WEIR/finance/bigcharts.marketwatch.com/GR.html",Goodrich Sensor On Board Historic Space Shuttle Launch to Hubble Telescope
"/sdd/edimar/Desktop/doutorado/doutorado04/bases/WEIR/finance/bigcharts.marketwatch.com/MSO.html","Martha Stewart Living Omnimedia, Inc. Appoints Kelli Turner Chief Financial Officer"
"/sdd/edimar/Desktop/doutorado/doutorado04/bases/WEIR/finance/bigcharts.marketwatch.com/MYGN.html",Breast Cancer Action Sues to End Gene Patenting
"/sdd/edimar/Desktop/doutorado/doutorado04/bases/WEIR/finance/bigcharts.marketwatch.com/BGG.html",Briggs & Stratton Corporation Reports Results for the Third Quarter of Fiscal 2009 and Declares Reduced Quarterly Dividend
"/sdd/edimar/Desktop/doutorado/doutorado04/bases/WEIR/finance/bigcharts.marketwatch.com/ORCL.html",Kraft Saves Miles and Fuel With Optimized Transportation Project
"/sdd/edimar/Desktop/doutorado/doutorado04/bases/WEIR/finance/bigcharts.marketwatch.com/BRCD.html","Brocade Delivers High-Performance, Cost-Effective Data Center Server Connectivity and Consolidation Solutions for HP Server and Storage Platforms"
"/sdd/edimar/Desktop/doutorado/doutorado04/bases/WEIR/finance/bigcharts.marketwatch.com/AFL.html","A.M. Best Assigns Indicative Debt Ratings to Aflac, Inc.'s Shelf Registration"
"/sdd/edimar/Desktop/doutorado/doutorado04/bases/WEIR/finance/bigcharts.marketwatch.com/KMB.html",Kimberly-Clark Announces First Quarter 2009 Results
"/sdd/edimar/Desktop/doutorado/doutorado04/bases/WEIR/finance/bigcharts.marketwatch.com/DRI.html",LongHorn Steakhouse Brings the Spirit of the West to Chesterfield
"/sdd/edimar/Desktop/doutorado/doutorado04/bases/WEIR/finance/bigcharts.marketwatch.com/KR.html","OffTheWallStocks featuring on its newsletter: HPQ, IBM, JNJ, JPM, KR. WMT, XOM"
"/sdd/edimar/Desktop/doutorado/doutorado04/bases/WEIR/finance/bigcharts.marketwatch.com/CSX.html",CSX Corporation Vice President to Participate in Wolfe Research Global Transportation Conference Panel
"/sdd/edimar/Desktop/doutorado/doutorado04/bases/WEIR/finance/bigcharts.marketwatch.com/KKD.html",Krispy Kreme and the Law Enforcement Torch Run(R) Are Teaming Up to Raise Funds and Awareness for Special Olympics
"/sdd/edimar/Desktop/doutorado/doutorado04/bases/WEIR/finance/bigcharts.marketwatch.com/ELNK.html",Five Ways to Save Online
"/sdd/edimar/Desktop/doutorado/doutorado04/bases/WEIR/finance/bigcharts.marketwatch.com/SWY.html",Safeway Kicks Off Campaign to Support Prostate Cancer Research
"/sdd/edimar/Desktop/doutorado/doutorado04/bases/WEIR/finance/bigcharts.marketwatch.com/IP.html",International Paper Announces Debt Tender Offer
"/sdd/edimar/Desktop/doutorado/doutorado04/bases/WEIR/finance/bigcharts.marketwatch.com/LOW.html",Lowe's to Webcast Annual Meeting of Shareholders
"/sdd/edimar/Desktop/doutorado/doutorado04/bases/WEIR/finance/bigcharts.marketwatch.com/OKE.html",ONEOK Partners Declares Quarterly Distribution
"/sdd/edimar/Desktop/doutorado/doutorado04/bases/WEIR/finance/bigcharts.marketwatch.com/AMGN.html",ARIAD Announces Updates On NF-kB Patent Appeals
"/sdd/edimar/Desktop/doutorado/doutorado04/bases/WEIR/finance/bigcharts.marketwatch.com/WMI.html",Waste Management Announces First Quarter 2009 Earnings
"/sdd/edimar/Desktop/doutorado/doutorado04/bases/WEIR/finance/bigcharts.marketwatch.com/MDP.html",Meredith Continues to Expand Social Networking Footprint With MixingBowl.com
"/sdd/edimar/Desktop/doutorado/doutorado04/bases/WEIR/finance/bigcharts.marketwatch.com/ASH.html",Ashland Inc. Reports Preliminary Net Income of 65 Cents Per Share for Fiscal Second Quarter
"/sdd/edimar/Desktop/doutorado/doutorado04/bases/WEIR/finance/bigcharts.marketwatch.com/IR.html",Ingersoll Rand to Present at J.P. Morgan HVAC Conference
"/sdd/edimar/Desktop/doutorado/doutorado04/bases/WEIR/finance/bigcharts.marketwatch.com/NVLS.html",Novellus' 32nm UV-Absorbing Dielectric Films Key to Improved Device Reliability
"/sdd/edimar/Desktop/doutorado/doutorado04/bases/WEIR/finance/bigcharts.marketwatch.com/KSWS.html",K-Swiss Sets First Quarter Earnings Release and Conference Call Dates
"/sdd/edimar/Desktop/doutorado/doutorado04/bases/WEIR/finance/bigcharts.marketwatch.com/AMAT.html",Applied Materials Redefines Chip Packaging Productivity with New Charger PVD System
"/sdd/edimar/Desktop/doutorado/doutorado04/bases/WEIR/finance/bigcharts.marketwatch.com/RL.html","Polo Ralph Lauren Fourth Quarter Fiscal Year 2009 Results to Be Released Wednesday, May 27, 2009"
"/sdd/edimar/Desktop/doutorado/doutorado04/bases/WEIR/finance/bigcharts.marketwatch.com/ADM.html",ADM Earns Foreign Policy Association Social Responsibility Award
"/sdd/edimar/Desktop/doutorado/doutorado04/bases/WEIR/finance/bigcharts.marketwatch.com/CRGN.html",CuraGen to Present CR011-vcMMAE Data at ASCO
"/sdd/edimar/Desktop/doutorado/doutorado04/bases/WEIR/finance/bigcharts.marketwatch.com/FITB.html",Fifth Third Announces Supervisory Capital Assessment Results
"/sdd/edimar/Desktop/doutorado/doutorado04/bases/WEIR/finance/bigcharts.marketwatch.com/FCEL.html",Connecticut Department of Public Utility Control Issues Final Decision Approving 27.3 Megawatts of Projects Using FuelCell Energy Power Plants
"/sdd/edimar/Desktop/doutorado/doutorado04/bases/WEIR/finance/bigcharts.marketwatch.com/RX.html",Mylan Receives Tentative FDA Approval for Generic Version of Singulair(R)
"/sdd/edimar/Desktop/doutorado/doutorado04/bases/WEIR/finance/bigcharts.marketwatch.com/AEE.html",CIBER Announces 3-Year Outsourcing Renewal With Ameren Energy
"/sdd/edimar/Desktop/doutorado/doutorado04/bases/WEIR/finance/bigcharts.marketwatch.com/WPI.html",Watson to Present at the Sanford C. Bernstein & Co. Twenty-Fifth Annual Strategic Decisions 2009 Conference
"/sdd/edimar/Desktop/doutorado/doutorado04/bases/WEIR/finance/bigcharts.marketwatch.com/MHP.html",Noble Financial 2009 Fifth Annual Equity Conference Presenting Company Profiles
"/sdd/edimar/Desktop/doutorado/doutorado04/bases/WEIR/finance/bigcharts.marketwatch.com/HBAN.html",Huntington Bancshares Prices $324 Million Common Equity Capital Raise
"/sdd/edimar/Desktop/doutorado/doutorado04/bases/WEIR/finance/bigcharts.marketwatch.com/BA.html",Boeing Completes 787 Intermediate Gauntlet Testing
"/sdd/edimar/Desktop/doutorado/doutorado04/bases/WEIR/finance/bigcharts.marketwatch.com/USM.html",TDS and U.S. Cellular First Quarter Operating Results Conference Call
"/sdd/edimar/Desktop/doutorado/doutorado04/bases/WEIR/finance/bigcharts.marketwatch.com/CREE.html","Notable Price Action in Cree Inc. (CREE), Polo Ralph Lauren Corp. (RL), and Cephalon Inc. (CEPH) - www.ONN.tv Reports"
"/sdd/edimar/Desktop/doutorado/doutorado04/bases/WEIR/finance/bigcharts.marketwatch.com/BHI.html",Baker Hughes Announces April 2009 Rig Counts
"/sdd/edimar/Desktop/doutorado/doutorado04/bases/WEIR/finance/bigcharts.marketwatch.com/OI.html","Owens-Illinois, Inc. Commences Tender Offer for Its $250,000,000 7 1/2% Senior Debentures due 2010"
"/sdd/edimar/Desktop/doutorado/doutorado04/bases/WEIR/finance/bigcharts.marketwatch.com/UNH.html",UnitedHealth Group Announces Results of Annual Shareholder Meeting
"/sdd/edimar/Desktop/doutorado/doutorado04/bases/WEIR/finance/bigcharts.marketwatch.com/REGN.html",Regeneron Announces Presentation at the Deutsche Bank 34th Annual Healthcare Conference
"/sdd/edimar/Desktop/doutorado/doutorado04/bases/WEIR/finance/bigcharts.marketwatch.com/NYT.html","Boston.com Expands ""Your Town"" Community News Sites to Six Additional Towns in Greater Boston"
"/sdd/edimar/Desktop/doutorado/doutorado04/bases/WEIR/finance/bigcharts.marketwatch.com/KEY.html","KeyCorp to Webcast May 21, 2009 Annual Meeting"
"/sdd/edimar/Desktop/doutorado/doutorado04/bases/WEIR/finance/bigcharts.marketwatch.com/DUK.html",Duke Energy Partners with Lowe's(R) to Promote Energy Saving CFLs
"/sdd/edimar/Desktop/doutorado/doutorado04/bases/WEIR/finance/bigcharts.marketwatch.com/PMCS.html","NI Technology Research Updates Outlooks on KLA-Tencor, Lattice Semiconductor, Microsemi, and PMC-Sierra"
"/sdd/edimar/Desktop/doutorado/doutorado04/bases/WEIR/finance/bigcharts.marketwatch.com/SUN.html","InsanePicks alerts you on hot stocks: PG, S, SUN, SVU, ORCL"
"/sdd/edimar/Desktop/doutorado/doutorado04/bases/WEIR/finance/bigcharts.marketwatch.com/NVDA.html",Stock Alerts on Active Industry Leaders; Issued by InvestorSoup.com
"/sdd/edimar/Desktop/doutorado/doutorado04/bases/WEIR/finance/bigcharts.marketwatch.com/DHR.html",Mexican Airports Purchase Fluke Thermal Imagers to Aid in Flu Screening
"/sdd/edimar/Desktop/doutorado/doutorado04/bases/WEIR/finance/bigcharts.marketwatch.com/DOV.html",Hill PHOENIX Receives 2009 EPA Ozone Layer Protection Award
"/sdd/edimar/Desktop/doutorado/doutorado04/bases/WEIR/finance/bigcharts.marketwatch.com/GT.html","With Summer Driving Increasing, Goodyear Has Key Tire Advice"
"/sdd/edimar/Desktop/doutorado/doutorado04/bases/WEIR/finance/bigcharts.marketwatch.com/CMA.html",Comerica Announces Annual Meeting Results
"/sdd/edimar/Desktop/doutorado/doutorado04/bases/WEIR/finance/bigcharts.marketwatch.com/LTD.html",Limited Brands Reports First Quarter 2009 Earnings
"/sdd/edimar/Desktop/doutorado/doutorado04/bases/WEIR/finance/bigcharts.marketwatch.com/MSTR.html",Sybase and MicroStrategy Team up to Dramatically Reduce Time for Implementation of Business Analytics
"/sdd/edimar/Desktop/doutorado/doutorado04/bases/WEIR/finance/bigcharts.marketwatch.com/SIAL.html",Sigma-Aldrich Introduces Precisio(TM) Kinases for High-Throughput Screening and Kinase Profiling
