URL,EXTRACTED VALUE
"/sdd/edimar/Desktop/doutorado/doutorado04/bases/WEIR/finance/bigcharts.marketwatch.com/FPL.html",FPL Group Chairman Tells Shareholders Clean-Energy Investments Positioning Company for Continued Growth
"/sdd/edimar/Desktop/doutorado/doutorado04/bases/WEIR/finance/bigcharts.marketwatch.com/KBH.html",KB Home to Broadcast Presentation at the Eighth Annual JMP Securities Research Conference
"/sdd/edimar/Desktop/doutorado/doutorado04/bases/WEIR/finance/bigcharts.marketwatch.com/INFY.html",Infosys BPO Listed as a Top Enterprise Provider in FAO Today's Annual Survey
"/sdd/edimar/Desktop/doutorado/doutorado04/bases/WEIR/finance/bigcharts.marketwatch.com/XRX.html","Xerox Business Development Programs Offer Print Providers Ways to Drive Profits, Uncover New Revenue Streams During Tough Times"
"/sdd/edimar/Desktop/doutorado/doutorado04/bases/WEIR/finance/bigcharts.marketwatch.com/AIG.html","Transatlantic Holdings, Inc. Prices Public Offering of AIG's Interest"
"/sdd/edimar/Desktop/doutorado/doutorado04/bases/WEIR/finance/bigcharts.marketwatch.com/MYGN.html",Myriad Genetics Sets Record and Distribution Dates for Spin-Off of Myriad Pharmaceuticals
"/sdd/edimar/Desktop/doutorado/doutorado04/bases/WEIR/finance/bigcharts.marketwatch.com/IFF.html",IFF Elects Kevin Berryman Chief Financial Officer
"/sdd/edimar/Desktop/doutorado/doutorado04/bases/WEIR/finance/bigcharts.marketwatch.com/KLAC.html",KLA-Tencor Declares Regular Cash Dividend for Fourth Quarter of Fiscal Year 2009
"/sdd/edimar/Desktop/doutorado/doutorado04/bases/WEIR/finance/bigcharts.marketwatch.com/AMZN.html",Amazon.com to Webcast Investor Conference Presentation
"/sdd/edimar/Desktop/doutorado/doutorado04/bases/WEIR/finance/bigcharts.marketwatch.com/UNP.html",Union Pacific Corporation Declares Quarterly Dividend of 27 Cents a Share
"/sdd/edimar/Desktop/doutorado/doutorado04/bases/WEIR/finance/bigcharts.marketwatch.com/PLL.html",Pall Corporation Provides Webcast Details for Third Quarter Fiscal 2009 Sales and Earnings
"/sdd/edimar/Desktop/doutorado/doutorado04/bases/WEIR/finance/bigcharts.marketwatch.com/ARBA.html",Ariba Defines Future of Enterprise Applications
"/sdd/edimar/Desktop/doutorado/doutorado04/bases/WEIR/finance/bigcharts.marketwatch.com/EIX.html",BPL Global Contributes Key Components to Participating Load Project for Southern California Edison
"/sdd/edimar/Desktop/doutorado/doutorado04/bases/WEIR/finance/bigcharts.marketwatch.com/YHOO.html","HP, Intel and Yahoo! Attract Leading Research Organizations to Collaborative Cloud Computing Test Bed"
"/sdd/edimar/Desktop/doutorado/doutorado04/bases/WEIR/finance/bigcharts.marketwatch.com/EMR.html",Emerson Declares Dividend
"/sdd/edimar/Desktop/doutorado/doutorado04/bases/WEIR/finance/bigcharts.marketwatch.com/QSFT.html",Quest Software to Host Virtual Expo for SharePoint
"/sdd/edimar/Desktop/doutorado/doutorado04/bases/WEIR/finance/bigcharts.marketwatch.com/UIS.html",Unisys Clients Bancolombia and Commonwealth of Pennsylvania Named 2009 Computerworld Honors Program Award Winners
"/sdd/edimar/Desktop/doutorado/doutorado04/bases/WEIR/finance/bigcharts.marketwatch.com/BAX.html",Baxter to Present at the William Blair Growth Stock Conference
"/sdd/edimar/Desktop/doutorado/doutorado04/bases/WEIR/finance/bigcharts.marketwatch.com/ENZ.html",Enzo Biochem Clinical Labs Subsidiary Announces Regional Services Contract with Horizon Blue Cross Blue Shield of New Jersey
"/sdd/edimar/Desktop/doutorado/doutorado04/bases/WEIR/finance/bigcharts.marketwatch.com/PPG.html","PPG Appoints Lampe Vice President, Purchasing and Distribution"
"/sdd/edimar/Desktop/doutorado/doutorado04/bases/WEIR/finance/bigcharts.marketwatch.com/PCH.html",Clearwater Paper Corporation Announces Proposed Offering of Senior Notes
"/sdd/edimar/Desktop/doutorado/doutorado04/bases/WEIR/finance/bigcharts.marketwatch.com/MMM.html",3M Announces Multi-Touch Developer Kit Availability
"/sdd/edimar/Desktop/doutorado/doutorado04/bases/WEIR/finance/bigcharts.marketwatch.com/ALL.html",High Tech Takes Root on the High Plains
"/sdd/edimar/Desktop/doutorado/doutorado04/bases/WEIR/finance/bigcharts.marketwatch.com/FO.html",Jim Beam(TM) Partners With Kid Rock and His 2009 Rock N' Rebels Tour to Launch Red Stag by Jim Beam
"/sdd/edimar/Desktop/doutorado/doutorado04/bases/WEIR/finance/bigcharts.marketwatch.com/CTX.html",Pulte Homes Announces Expiration of Hart-Scott-Rodino Waiting Period for Centex Merger
"/sdd/edimar/Desktop/doutorado/doutorado04/bases/WEIR/finance/bigcharts.marketwatch.com/INTC.html","NI Technology Research Updates Outlooks for Intel, Wind River Systems, Juniper Networks, Goldman Sachs, Bank of America and JPMorgan Chase"
"/sdd/edimar/Desktop/doutorado/doutorado04/bases/WEIR/finance/bigcharts.marketwatch.com/SNV.html",Synovus to Present at Baird's 2009 Growth Stock Conference
"/sdd/edimar/Desktop/doutorado/doutorado04/bases/WEIR/finance/bigcharts.marketwatch.com/MOLX.html",Ultra-Narrow SlimStack(TM) Board-to-Board Connectors from Molex Save Space for Compact Applications
"/sdd/edimar/Desktop/doutorado/doutorado04/bases/WEIR/finance/bigcharts.marketwatch.com/CBE.html",Cooper Industries Offers Wide Ranging Solutions for Renewable Energy Applications
"/sdd/edimar/Desktop/doutorado/doutorado04/bases/WEIR/finance/bigcharts.marketwatch.com/DLTR.html",Dr. Christopher Lee Joins Softscape in Executive Webinar on Effective Talent Management
"/sdd/edimar/Desktop/doutorado/doutorado04/bases/WEIR/finance/bigcharts.marketwatch.com/ECL.html",Angelica Corporation Raises Bar Again for Increased Patient Safety
"/sdd/edimar/Desktop/doutorado/doutorado04/bases/WEIR/finance/bigcharts.marketwatch.com/CRGN.html","Levi & Korsinsky, LLP Investigates Breach of Fiduciary Duty by the Board of CuraGen Corporation"
"/sdd/edimar/Desktop/doutorado/doutorado04/bases/WEIR/finance/bigcharts.marketwatch.com/SLB.html",Schlumberger Announces First-Quarter 2009 Results
"/sdd/edimar/Desktop/doutorado/doutorado04/bases/WEIR/finance/bigcharts.marketwatch.com/RMBS.html",Rambus to Present at the UBS Global Technology and Services Conference
"/sdd/edimar/Desktop/doutorado/doutorado04/bases/WEIR/finance/bigcharts.marketwatch.com/OSCI.html","Oscient Pharmaceuticals Files Form 12b-25 Notification of Late Filing for Form 10-Q for Quarterly Period Ended March 31, 2009"
"/sdd/edimar/Desktop/doutorado/doutorado04/bases/WEIR/finance/bigcharts.marketwatch.com/KEYN.html","Start Your Engines: Announcing the FastWeb Race, a Competition to Accelerate Web Performance"
"/sdd/edimar/Desktop/doutorado/doutorado04/bases/WEIR/finance/bigcharts.marketwatch.com/BMC.html",BMC Software Receives CIO 100 Award for Datacenter Innovation
"/sdd/edimar/Desktop/doutorado/doutorado04/bases/WEIR/finance/bigcharts.marketwatch.com/UN.html",Now It's Lipton Green Tea's Turn To Sparkle!
"/sdd/edimar/Desktop/doutorado/doutorado04/bases/WEIR/finance/bigcharts.marketwatch.com/PHM.html",Pulte Considers Vote in 2010 on Declassification of Board and Rights Plan
"/sdd/edimar/Desktop/doutorado/doutorado04/bases/WEIR/finance/bigcharts.marketwatch.com/PHG.html","Photos: Philips Expands Home Healthcare Commitment With Portable Life-Support Ventilator; Offers Ease of Use, Portability and Versatility for Patient"
"/sdd/edimar/Desktop/doutorado/doutorado04/bases/WEIR/finance/bigcharts.marketwatch.com/ODP.html",Desktone Secures Registered Marks for Desktops as a Service and DaaS
"/sdd/edimar/Desktop/doutorado/doutorado04/bases/WEIR/finance/bigcharts.marketwatch.com/EC.html",Ecopetrol and Glencore Closed Negotiation on Reficar S.A.
"/sdd/edimar/Desktop/doutorado/doutorado04/bases/WEIR/finance/bigcharts.marketwatch.com/LRCX.html",IBM Announces Seven-Year Outsourcing Agreement With Lam Research
"/sdd/edimar/Desktop/doutorado/doutorado04/bases/WEIR/finance/bigcharts.marketwatch.com/UNM.html",Watjen Tells Stockholders Unum Remains Well-Positioned
"/sdd/edimar/Desktop/doutorado/doutorado04/bases/WEIR/finance/bigcharts.marketwatch.com/SGP.html",Alder Biopharmaceuticals Announces Expanded Collaboration With Schering-Plough
"/sdd/edimar/Desktop/doutorado/doutorado04/bases/WEIR/finance/bigcharts.marketwatch.com/DOW.html",Sixteen Innovations to Make Global Debut at Singapore International Water Week 2009
"/sdd/edimar/Desktop/doutorado/doutorado04/bases/WEIR/finance/bigcharts.marketwatch.com/PWAV.html",Powerwave to Present at Upcoming Investor Conference
"/sdd/edimar/Desktop/doutorado/doutorado04/bases/WEIR/finance/bigcharts.marketwatch.com/JKHY.html",Jack Henry & Associates' ProfitStars(R) Division Teams With Pitney Bowes to Offer Innovative Remote Deposit Capture (RDC) Solution
"/sdd/edimar/Desktop/doutorado/doutorado04/bases/WEIR/finance/bigcharts.marketwatch.com/CHINA.html",John Clough Named as Chairman of the Board of CDC Software Corporation
"/sdd/edimar/Desktop/doutorado/doutorado04/bases/WEIR/finance/bigcharts.marketwatch.com/PBI.html",Pitney Bowes Launches P/I OfficeMail(TM) Software
"/sdd/edimar/Desktop/doutorado/doutorado04/bases/WEIR/finance/bigcharts.marketwatch.com/JBL.html",Jabil Announces Quarterly Dividend
"/sdd/edimar/Desktop/doutorado/doutorado04/bases/WEIR/finance/bigcharts.marketwatch.com/PNW.html","APS, Starwood Energy to Collaborate on Major Concentrating Solar Plant"
"/sdd/edimar/Desktop/doutorado/doutorado04/bases/WEIR/finance/bigcharts.marketwatch.com/DEL.html",Deltic Schedules First Quarter Conference Call
"/sdd/edimar/Desktop/doutorado/doutorado04/bases/WEIR/finance/bigcharts.marketwatch.com/WY.html",All iLevel by Weyerhaeuser Facilities Certified to SFI or PEFC
"/sdd/edimar/Desktop/doutorado/doutorado04/bases/WEIR/finance/bigcharts.marketwatch.com/NVDA.html",Rambus Moves to Withdraw Patents From ITC Proceedings Against NVIDIA
"/sdd/edimar/Desktop/doutorado/doutorado04/bases/WEIR/finance/bigcharts.marketwatch.com/KO.html",Harris Corporation Recognized by Foreign Policy Association for Commitment to Corporate Responsibility
"/sdd/edimar/Desktop/doutorado/doutorado04/bases/WEIR/finance/bigcharts.marketwatch.com/AMD.html",AMD to Webcast Server Platform Q&A Session
"/sdd/edimar/Desktop/doutorado/doutorado04/bases/WEIR/finance/bigcharts.marketwatch.com/CCE.html",Coca-Cola Enterprises Inc. to Webcast Goldman Sachs Consumer Products Symposium Presentation
"/sdd/edimar/Desktop/doutorado/doutorado04/bases/WEIR/finance/bigcharts.marketwatch.com/CRA.html",Celera Corporation Reports First Quarter 2009 Results
"/sdd/edimar/Desktop/doutorado/doutorado04/bases/WEIR/finance/bigcharts.marketwatch.com/LEG.html",Leggett & Platt Announces Impact From Customer Shutdown
"/sdd/edimar/Desktop/doutorado/doutorado04/bases/WEIR/finance/bigcharts.marketwatch.com/ARW.html",Arrow Electronics Updates Outlook for the Second Quarter Ahead of Investor Day
"/sdd/edimar/Desktop/doutorado/doutorado04/bases/WEIR/finance/bigcharts.marketwatch.com/UPS.html",UPS Acquires Delivery Firm in Slovenia
"/sdd/edimar/Desktop/doutorado/doutorado04/bases/WEIR/finance/bigcharts.marketwatch.com/ERTS.html",Mythic Entertainment Announces the Rise of the Tomb Kings Live Event for Warhammer Online: Age of Reckoning
"/sdd/edimar/Desktop/doutorado/doutorado04/bases/WEIR/finance/bigcharts.marketwatch.com/JWN.html","Nordstrom Rack to Open at Belmar in Lakewood, Colorado"
"/sdd/edimar/Desktop/doutorado/doutorado04/bases/WEIR/finance/bigcharts.marketwatch.com/DLX.html",Deluxe Declares Quarterly Dividend
"/sdd/edimar/Desktop/doutorado/doutorado04/bases/WEIR/finance/bigcharts.marketwatch.com/PMTC.html",Social Computing Meets Product Development
"/sdd/edimar/Desktop/doutorado/doutorado04/bases/WEIR/finance/bigcharts.marketwatch.com/AES.html","AES to Webcast Investor Day Wednesday, May 27, 2009 at 9:00 a.m. EDT"
"/sdd/edimar/Desktop/doutorado/doutorado04/bases/WEIR/finance/bigcharts.marketwatch.com/SLAB.html",Silicon Laboratories to Present at Eighth Annual JMP Securities Research Conference
"/sdd/edimar/Desktop/doutorado/doutorado04/bases/WEIR/finance/bigcharts.marketwatch.com/OSIS.html",OSI Systems Announces Follow on Order from TSA for Approximately $3 Million for Advanced Technology X-Ray Aviation Screening Systems
"/sdd/edimar/Desktop/doutorado/doutorado04/bases/WEIR/finance/bigcharts.marketwatch.com/SPLS.html","Staples, Inc. Announces First Quarter 2009 Performance"
"/sdd/edimar/Desktop/doutorado/doutorado04/bases/WEIR/finance/bigcharts.marketwatch.com/BCR.html",Thoratec Announces Appointment of Paul LaViolette to Board of Directors
"/sdd/edimar/Desktop/doutorado/doutorado04/bases/WEIR/finance/bigcharts.marketwatch.com/COF.html",Capital One Bank Receives $90 Million Allocation of New Markets Tax Credits To Support Revitalization of Underserved Areas
"/sdd/edimar/Desktop/doutorado/doutorado04/bases/WEIR/finance/bigcharts.marketwatch.com/WWE.html",WWE(R) Reschedules Loveland and Colorado Springs Events
"/sdd/edimar/Desktop/doutorado/doutorado04/bases/WEIR/finance/bigcharts.marketwatch.com/GR.html",Goodrich Employees' Children Reach for the Stars in Rocket Contest National Finals
"/sdd/edimar/Desktop/doutorado/doutorado04/bases/WEIR/finance/bigcharts.marketwatch.com/GRA.html",Grace Wins Responsible Care Energy Efficiency Awards
"/sdd/edimar/Desktop/doutorado/doutorado04/bases/WEIR/finance/bigcharts.marketwatch.com/ITT.html",ITT Declares Second Quarter Dividend of 21.25 Cents Per Share
"/sdd/edimar/Desktop/doutorado/doutorado04/bases/WEIR/finance/bigcharts.marketwatch.com/EFX.html","Small-Business Bankruptcy Filings Continued to Increase in March, Equifax Data Shows"
"/sdd/edimar/Desktop/doutorado/doutorado04/bases/WEIR/finance/bigcharts.marketwatch.com/STT.html",State Street Selected by Rio Tinto to Provide Range of Investment Services for Its Global Pension Schemes
"/sdd/edimar/Desktop/doutorado/doutorado04/bases/WEIR/finance/bigcharts.marketwatch.com/BMS.html",Bemis Company Declares Regular Quarterly Dividend
"/sdd/edimar/Desktop/doutorado/doutorado04/bases/WEIR/finance/bigcharts.marketwatch.com/LPX.html",LP Reports First Quarter 2009 Results
"/sdd/edimar/Desktop/doutorado/doutorado04/bases/WEIR/finance/bigcharts.marketwatch.com/GIS.html","Trade Alerts on Active Stocks: Apple, Keryx, Angiotech, General Mills, Pep Boys and Talbots; Issued by InvestorSoup.com"
"/sdd/edimar/Desktop/doutorado/doutorado04/bases/WEIR/finance/bigcharts.marketwatch.com/ADBE.html",Clear Channel Radio Adopts Adobe Flash Platform
"/sdd/edimar/Desktop/doutorado/doutorado04/bases/WEIR/finance/bigcharts.marketwatch.com/S.html","PennyStockPickAlert.com Issues Technical Trade Alerts on Market Movers Today: C, S, PFE, JAZZ, EBAY, MRVL"
"/sdd/edimar/Desktop/doutorado/doutorado04/bases/WEIR/finance/bigcharts.marketwatch.com/PZZA.html",INVESTKentucky Equity Conference Announces Corporate Presentation Lineup and Schedule
"/sdd/edimar/Desktop/doutorado/doutorado04/bases/WEIR/finance/bigcharts.marketwatch.com/PX.html",Praxair CEO to Address Bernstein Conference
"/sdd/edimar/Desktop/doutorado/doutorado04/bases/WEIR/finance/bigcharts.marketwatch.com/CCU.html",Operation HOPE Announces Continued Partnership with Premiere Radio Networks during The Milken Institute Global Conference 2009
"/sdd/edimar/Desktop/doutorado/doutorado04/bases/WEIR/finance/bigcharts.marketwatch.com/BRCD.html",Mizuno USA Sports Brocade High-Performance LAN and Application Delivery Networking Solution
"/sdd/edimar/Desktop/doutorado/doutorado04/bases/WEIR/finance/bigcharts.marketwatch.com/TGT.html","Today's top stock alerts include: SWY, T, TGT, TWX, UNH, WLP"
"/sdd/edimar/Desktop/doutorado/doutorado04/bases/WEIR/finance/bigcharts.marketwatch.com/CLX.html",Clorox Announces Executive Committee Changes
"/sdd/edimar/Desktop/doutorado/doutorado04/bases/WEIR/finance/bigcharts.marketwatch.com/MIL.html",Millipore Opens New Bioprocess Manufacturing Facility in Massachusetts
"/sdd/edimar/Desktop/doutorado/doutorado04/bases/WEIR/finance/bigcharts.marketwatch.com/ELON.html",Echelon Reports First Quarter 2009 Results
"/sdd/edimar/Desktop/doutorado/doutorado04/bases/WEIR/finance/bigcharts.marketwatch.com/HUM.html",Humana Inc. to Present at the Goldman Sachs Healthcare Conference
"/sdd/edimar/Desktop/doutorado/doutorado04/bases/WEIR/finance/bigcharts.marketwatch.com/PCAR.html",Kenworth T370 Becomes First Medium Duty Hybrid Truck in New York City's Fleet
"/sdd/edimar/Desktop/doutorado/doutorado04/bases/WEIR/finance/bigcharts.marketwatch.com/SEE.html",Sealed Air to Participate in Goldman Sachs Basic Materials Conference
"/sdd/edimar/Desktop/doutorado/doutorado04/bases/WEIR/finance/bigcharts.marketwatch.com/CR.html",Robert D. Starr Appointed Vice President and Treasurer at Kaman Corp.
"/sdd/edimar/Desktop/doutorado/doutorado04/bases/WEIR/finance/bigcharts.marketwatch.com/PCLN.html",Priceline.com President & CEO Jeffery H. Boyd Wins Lodging Leadership Award for Best Performing CEO
"/sdd/edimar/Desktop/doutorado/doutorado04/bases/WEIR/finance/bigcharts.marketwatch.com/ADP.html","ADP National Employment Report Shows U.S. Employment Decreased by 532,000 Private Sector Jobs in May"
"/sdd/edimar/Desktop/doutorado/doutorado04/bases/WEIR/finance/bigcharts.marketwatch.com/TIN.html",Temple-Inland Inc. Reports First Quarter 2009 Results
"/sdd/edimar/Desktop/doutorado/doutorado04/bases/WEIR/finance/bigcharts.marketwatch.com/COKE.html",Coke Consolidated Announces Second Quarter Dividend
"/sdd/edimar/Desktop/doutorado/doutorado04/bases/WEIR/finance/bigcharts.marketwatch.com/SWY.html","Today's top stock alerts include: SWY, T, TGT, TWX, UNH, WLP"
"/sdd/edimar/Desktop/doutorado/doutorado04/bases/WEIR/finance/bigcharts.marketwatch.com/HSY.html",Hershey to Webcast First Quarter Conference Call
"/sdd/edimar/Desktop/doutorado/doutorado04/bases/WEIR/finance/bigcharts.marketwatch.com/ICGE.html","Internet Capital Group Executives to Speak at the Eighth Annual JMP Securities Research Conference on May 20th, 2009"
"/sdd/edimar/Desktop/doutorado/doutorado04/bases/WEIR/finance/bigcharts.marketwatch.com/TKR.html",Timken Expands Lubrication Line with New Delivery Devices
"/sdd/edimar/Desktop/doutorado/doutorado04/bases/WEIR/finance/bigcharts.marketwatch.com/APC.html",Anadarko Announces Pricing of $900 Million of Senior Notes
"/sdd/edimar/Desktop/doutorado/doutorado04/bases/WEIR/finance/bigcharts.marketwatch.com/MDR.html",B&W and USEC Inc. to Create Centrifuge Manufacturing Company
"/sdd/edimar/Desktop/doutorado/doutorado04/bases/WEIR/finance/bigcharts.marketwatch.com/ARIA.html",ARIAD to Present at Upcoming Meetings
"/sdd/edimar/Desktop/doutorado/doutorado04/bases/WEIR/finance/bigcharts.marketwatch.com/NAV.html",Navistar Continues to Expand Presence in Southern Africa
"/sdd/edimar/Desktop/doutorado/doutorado04/bases/WEIR/finance/bigcharts.marketwatch.com/TER.html",MAN Nutzfahrzeuge Selects Teradyne's i-VIEW(TM) Prima for Vehicle Communication Interface
"/sdd/edimar/Desktop/doutorado/doutorado04/bases/WEIR/finance/bigcharts.marketwatch.com/AMTD.html",thinkorswim Exchange Offer Threshold Price
"/sdd/edimar/Desktop/doutorado/doutorado04/bases/WEIR/finance/bigcharts.marketwatch.com/TNB.html",Thomas & Betts Corporation Reports First Quarter 2009 Earnings
"/sdd/edimar/Desktop/doutorado/doutorado04/bases/WEIR/finance/bigcharts.marketwatch.com/FNM.html",Fannie Mae Redemption
"/sdd/edimar/Desktop/doutorado/doutorado04/bases/WEIR/finance/bigcharts.marketwatch.com/TBL.html","From the Power of One to the Effort of Many, Timberland Celebrates Earth Day by Recognizing Earthkeepers around the World"
"/sdd/edimar/Desktop/doutorado/doutorado04/bases/WEIR/finance/bigcharts.marketwatch.com/CPN.html",Calpine Corporation Announces Upsizing and Pricing ofSenior Secured Notes Offering by Subsidiaries
"/sdd/edimar/Desktop/doutorado/doutorado04/bases/WEIR/finance/bigcharts.marketwatch.com/INCY.html",Incyte to Present at Goldman Sachs 30th Annual Global Healthcare Conference
"/sdd/edimar/Desktop/doutorado/doutorado04/bases/WEIR/finance/bigcharts.marketwatch.com/TIF.html",Tiffany Declares Regular Quarterly Dividend
"/sdd/edimar/Desktop/doutorado/doutorado04/bases/WEIR/finance/bigcharts.marketwatch.com/KYO.html",Kyocera Wireless Wins Top Recycling Award for Ninth Consecutive Year
"/sdd/edimar/Desktop/doutorado/doutorado04/bases/WEIR/finance/bigcharts.marketwatch.com/CHKP.html",Entrust SSL VPN Certificates Available to Check Point Software Customers to Protect Data In-Transit
"/sdd/edimar/Desktop/doutorado/doutorado04/bases/WEIR/finance/bigcharts.marketwatch.com/SAPE.html",Sapient Interactive Launches Full-Service Creative and Broadcast Production Capability
"/sdd/edimar/Desktop/doutorado/doutorado04/bases/WEIR/finance/bigcharts.marketwatch.com/A.html",Fast Pandemic Detection Tool Ready to Fight Flu
"/sdd/edimar/Desktop/doutorado/doutorado04/bases/WEIR/finance/bigcharts.marketwatch.com/ADI.html",Analog Devices Enables Secure and Robust Transmission of Remote Data for Smart Grids and Home and Building Automation
"/sdd/edimar/Desktop/doutorado/doutorado04/bases/WEIR/finance/bigcharts.marketwatch.com/TMO.html",Thermo Fisher Scientific Unveils Innovative Products and Solutions for a Range of Applications at ACHEMA 2009
"/sdd/edimar/Desktop/doutorado/doutorado04/bases/WEIR/finance/bigcharts.marketwatch.com/BSX.html",Celsion Receives Final $15 Million Payment from Boston Scientific for Prolieve(R) Assets Completing its Transition to a Drug Development Company
"/sdd/edimar/Desktop/doutorado/doutorado04/bases/WEIR/finance/bigcharts.marketwatch.com/SLM.html","Sallie Mae, Building Hope, and Reading Is Fundamental Literacy Campaign Brings 44,000 New Books to D.C. Schools"
"/sdd/edimar/Desktop/doutorado/doutorado04/bases/WEIR/finance/bigcharts.marketwatch.com/AVY.html",Wall Street Media Presents Exclusive Growth Stock Videos
"/sdd/edimar/Desktop/doutorado/doutorado04/bases/WEIR/finance/bigcharts.marketwatch.com/HRB.html",H&R Block Names New Head of Government Relations
"/sdd/edimar/Desktop/doutorado/doutorado04/bases/WEIR/finance/bigcharts.marketwatch.com/CHL.html","IRG Technology, Media, and Telecoms Weekly China Market Review"
"/sdd/edimar/Desktop/doutorado/doutorado04/bases/WEIR/finance/bigcharts.marketwatch.com/DNB.html",D&B Declares Quarterly Dividend
"/sdd/edimar/Desktop/doutorado/doutorado04/bases/WEIR/finance/bigcharts.marketwatch.com/CAG.html",Foster Farms to Acquire Fernando's and El Extremo Foodservice Brands From ConAgra Foods
"/sdd/edimar/Desktop/doutorado/doutorado04/bases/WEIR/finance/bigcharts.marketwatch.com/YUM.html","Yum! Brands Announces Results of Cash Tender Offer To Purchase Up To $150 Million of Its 7.700% Senior Notes due July 1, 2012"
"/sdd/edimar/Desktop/doutorado/doutorado04/bases/WEIR/finance/bigcharts.marketwatch.com/GAS.html",Nicor Announces First Quarter Earnings Conference Call
"/sdd/edimar/Desktop/doutorado/doutorado04/bases/WEIR/finance/bigcharts.marketwatch.com/STJ.html","St. Jude Medical Acquires Intellectual Property and Non-Cash Assets of Northstar Neuroscience, Inc."
"/sdd/edimar/Desktop/doutorado/doutorado04/bases/WEIR/finance/bigcharts.marketwatch.com/PAYX.html",Paychex Names New Vice President and Controller
"/sdd/edimar/Desktop/doutorado/doutorado04/bases/WEIR/finance/bigcharts.marketwatch.com/EK.html",Kodak Names Eric H. Samuels as Corporate Controller
"/sdd/edimar/Desktop/doutorado/doutorado04/bases/WEIR/finance/bigcharts.marketwatch.com/PGR.html",The Progressive Corporation Announces 2009 Investor Relations Meeting
"/sdd/edimar/Desktop/doutorado/doutorado04/bases/WEIR/finance/bigcharts.marketwatch.com/PMCS.html",PMC-Sierra Presents Industry Keynote at OptiNet China Conference 2009
"/sdd/edimar/Desktop/doutorado/doutorado04/bases/WEIR/finance/bigcharts.marketwatch.com/CSCO.html",Duke Energy Partners with Cisco to Fast-Track Development of Utility's 'Smart Grid'
"/sdd/edimar/Desktop/doutorado/doutorado04/bases/WEIR/finance/bigcharts.marketwatch.com/TXT.html",Sensor Fuzed Weapon Units from New Assembly Line Successfully Tested
"/sdd/edimar/Desktop/doutorado/doutorado04/bases/WEIR/finance/bigcharts.marketwatch.com/HIG.html","The Hartford Teams Up With Lance Armstrong Foundation To Help Americans Protect Health, Finances Against Cancer"
"/sdd/edimar/Desktop/doutorado/doutorado04/bases/WEIR/finance/bigcharts.marketwatch.com/CMVT.html",Comverse Technology Announces the Appointment of Stephen Swad as Chief Financial Officer
"/sdd/edimar/Desktop/doutorado/doutorado04/bases/WEIR/finance/bigcharts.marketwatch.com/AXP.html","Integrity Media Issues Pre-Market Alert for Investors of Financial Companies IFSL, V, AXP, DFS, MA, COF"
"/sdd/edimar/Desktop/doutorado/doutorado04/bases/WEIR/finance/bigcharts.marketwatch.com/SKX.html",SKECHERS to Cover Consumers from Head to Toe with Branded Eyewear
"/sdd/edimar/Desktop/doutorado/doutorado04/bases/WEIR/finance/bigcharts.marketwatch.com/MMC.html",Kroll Helps Healthcare Providers Face Looming Red Flag Rules
"/sdd/edimar/Desktop/doutorado/doutorado04/bases/WEIR/finance/bigcharts.marketwatch.com/ABX.html",Andina to Double Mineral Concession Area Around Volcan Project Through Share Transaction With Barrick
"/sdd/edimar/Desktop/doutorado/doutorado04/bases/WEIR/finance/bigcharts.marketwatch.com/GOOG.html","GenuinePennyStocks alerts you on hot stocks: QQQQ, DRYS, MSFT, AAPL, GOOG, CSCO"
"/sdd/edimar/Desktop/doutorado/doutorado04/bases/WEIR/finance/bigcharts.marketwatch.com/NKE.html",Nike Declares $0.25 Quarterly Dividend
"/sdd/edimar/Desktop/doutorado/doutorado04/bases/WEIR/finance/bigcharts.marketwatch.com/SLE.html","Ball Park(R) Files Federal Lawsuit against Kraft Foods, Inc. Makers of Oscar Mayer(R) Wieners"
"/sdd/edimar/Desktop/doutorado/doutorado04/bases/WEIR/finance/bigcharts.marketwatch.com/ETR.html","Fitch Affirms Entergy's IDR at 'BBB-', Outlook to Stable; Entergy New Orleans Upgraded to 'BB+'"
"/sdd/edimar/Desktop/doutorado/doutorado04/bases/WEIR/finance/bigcharts.marketwatch.com/VMC.html",Management Change at Aggregate Industries US
