URL,EXTRACTED VALUE
"/sdd/edimar/Desktop/doutorado/doutorado04/bases/WEIR/finance/bigcharts.marketwatch.com/MSO.html",Martha Stewart Living's third-quarter loss narrows; forecast cut
"/sdd/edimar/Desktop/doutorado/doutorado04/bases/WEIR/finance/bigcharts.marketwatch.com/PFE.html",Mark Hulbert: Should investors sing 'Hail to the Chief?'
"/sdd/edimar/Desktop/doutorado/doutorado04/bases/WEIR/finance/bigcharts.marketwatch.com/MGM.html",Kerkorian Stake in MGM Shrinks
"/sdd/edimar/Desktop/doutorado/doutorado04/bases/WEIR/finance/bigcharts.marketwatch.com/CCU.html",Mutual Understanding: S&P 500 index clear winner
"/sdd/edimar/Desktop/doutorado/doutorado04/bases/WEIR/finance/bigcharts.marketwatch.com/COMS.html",Movers & Shakers: Friday's biggest gaining and declining stocks
"/sdd/edimar/Desktop/doutorado/doutorado04/bases/WEIR/finance/bigcharts.marketwatch.com/MBI.html",Banks suing MBIA over business split: WSJ
"/sdd/edimar/Desktop/doutorado/doutorado04/bases/WEIR/finance/bigcharts.marketwatch.com/NCR.html",Tech Stocks: Broad-market losses hammer tech sector
"/sdd/edimar/Desktop/doutorado/doutorado04/bases/WEIR/finance/bigcharts.marketwatch.com/DDS.html",Movers & Shakers: Monday's biggest gaining and declining stocks
"/sdd/edimar/Desktop/doutorado/doutorado04/bases/WEIR/finance/bigcharts.marketwatch.com/X.html",Banks Lead Stocks Downward
"/sdd/edimar/Desktop/doutorado/doutorado04/bases/WEIR/finance/bigcharts.marketwatch.com/KMB.html","Money Markets and More for Wednesday, April 22: Delta hits customers with new fee"
"/sdd/edimar/Desktop/doutorado/doutorado04/bases/WEIR/finance/bigcharts.marketwatch.com/HOTT.html","Money Markets & More for Wednesday, May 20: Playing layoffs for laughs"
"/sdd/edimar/Desktop/doutorado/doutorado04/bases/WEIR/finance/bigcharts.marketwatch.com/RIMM.html",Palm's Pre Sells Briskly at Launch
"/sdd/edimar/Desktop/doutorado/doutorado04/bases/WEIR/finance/bigcharts.marketwatch.com/TIN.html","Earnings Watch: Updates, advisories and surprises"
"/sdd/edimar/Desktop/doutorado/doutorado04/bases/WEIR/finance/bigcharts.marketwatch.com/CSX.html",Movers & Shakers: Wednesday's biggest gaining and declining stocks
"/sdd/edimar/Desktop/doutorado/doutorado04/bases/WEIR/finance/bigcharts.marketwatch.com/HON.html",Honeywell Says Committed to India
"/sdd/edimar/Desktop/doutorado/doutorado04/bases/WEIR/finance/bigcharts.marketwatch.com/WEN.html",Advisory firms differ in heated Target proxy fight
"/sdd/edimar/Desktop/doutorado/doutorado04/bases/WEIR/finance/bigcharts.marketwatch.com/AMGN.html","Earnings Watch: Updates, advisories and surprises"
"/sdd/edimar/Desktop/doutorado/doutorado04/bases/WEIR/finance/bigcharts.marketwatch.com/CEG.html",Jennifer Openshaw: Warren Buffett's recent actions offer four lessons for investors
"/sdd/edimar/Desktop/doutorado/doutorado04/bases/WEIR/finance/bigcharts.marketwatch.com/NTRS.html",Financial Stocks: Financial sector investors eye TARP tactics
"/sdd/edimar/Desktop/doutorado/doutorado04/bases/WEIR/finance/bigcharts.marketwatch.com/ASH.html",Mark Hulbert: Is Ben Graham's approach once again relevant?
"/sdd/edimar/Desktop/doutorado/doutorado04/bases/WEIR/finance/bigcharts.marketwatch.com/FNM.html","David Weidner's Writing on the Wall: In GM, Wall Street gets another bailout"
"/sdd/edimar/Desktop/doutorado/doutorado04/bases/WEIR/finance/bigcharts.marketwatch.com/IR.html","Ingersoll-Rand Swings To 1Q Loss, Cut 2,700 Jobs Since 4Q"
"/sdd/edimar/Desktop/doutorado/doutorado04/bases/WEIR/finance/bigcharts.marketwatch.com/PSUN.html","Earnings Watch: Updates, advisories and surprises"
"/sdd/edimar/Desktop/doutorado/doutorado04/bases/WEIR/finance/bigcharts.marketwatch.com/AA.html","Alcoa, Valero and Aetna Lead a Broad Decline"
"/sdd/edimar/Desktop/doutorado/doutorado04/bases/WEIR/finance/bigcharts.marketwatch.com/AMAT.html",Clarity Is Missing Link in Supply Chain
"/sdd/edimar/Desktop/doutorado/doutorado04/bases/WEIR/finance/bigcharts.marketwatch.com/EBAY.html","Tech Stocks: Techs dip, but Nasdaq posts 3rd week of gains"
"/sdd/edimar/Desktop/doutorado/doutorado04/bases/WEIR/finance/bigcharts.marketwatch.com/ADM.html",Archer Daniels Midland profit plunges
"/sdd/edimar/Desktop/doutorado/doutorado04/bases/WEIR/finance/bigcharts.marketwatch.com/TJX.html","Earnings Watch: Updates, advisories and surprises"
"/sdd/edimar/Desktop/doutorado/doutorado04/bases/WEIR/finance/bigcharts.marketwatch.com/MO.html","SABMiller net drops 7% on commodity, finance costs"
"/sdd/edimar/Desktop/doutorado/doutorado04/bases/WEIR/finance/bigcharts.marketwatch.com/FITB.html",Financial Stocks: KeyCorp gains spark financial sector rally
"/sdd/edimar/Desktop/doutorado/doutorado04/bases/WEIR/finance/bigcharts.marketwatch.com/BSX.html","Earnings Watch: Updates, advisories and surprises"
"/sdd/edimar/Desktop/doutorado/doutorado04/bases/WEIR/finance/bigcharts.marketwatch.com/FCEL.html",CORRECT: Wall Street interest in clean tech grows
"/sdd/edimar/Desktop/doutorado/doutorado04/bases/WEIR/finance/bigcharts.marketwatch.com/UN.html",MarketWatch First Take: Unilever goes uptown
"/sdd/edimar/Desktop/doutorado/doutorado04/bases/WEIR/finance/bigcharts.marketwatch.com/BSY.html","BSkyB, Virgin Media close to deal on channels - report"
"/sdd/edimar/Desktop/doutorado/doutorado04/bases/WEIR/finance/bigcharts.marketwatch.com/TM.html",Exporters lead Tokyo rise as U.S. dollar climbs
"/sdd/edimar/Desktop/doutorado/doutorado04/bases/WEIR/finance/bigcharts.marketwatch.com/ETN.html","Eaton profit drops 36% on economy, currency bite"
"/sdd/edimar/Desktop/doutorado/doutorado04/bases/WEIR/finance/bigcharts.marketwatch.com/NTAP.html",Data Domain reviewing EMC's hostile bid
"/sdd/edimar/Desktop/doutorado/doutorado04/bases/WEIR/finance/bigcharts.marketwatch.com/USM.html",Telecom Stocks: Alcatel-Lucent gains; Nortel shrinks
"/sdd/edimar/Desktop/doutorado/doutorado04/bases/WEIR/finance/bigcharts.marketwatch.com/BDK.html","Alcoa Drops, as Do Corning, Caterpillar"
"/sdd/edimar/Desktop/doutorado/doutorado04/bases/WEIR/finance/bigcharts.marketwatch.com/MRK.html",Swonk: Not much to celebrate in May jobs news
"/sdd/edimar/Desktop/doutorado/doutorado04/bases/WEIR/finance/bigcharts.marketwatch.com/OI.html","The Stockpickers: Fund manager taps Alpha Natural Resources, Owens-Illinois, Hewitt"
"/sdd/edimar/Desktop/doutorado/doutorado04/bases/WEIR/finance/bigcharts.marketwatch.com/HMC.html",Small Parts Suppliers Fight to Survive
"/sdd/edimar/Desktop/doutorado/doutorado04/bases/WEIR/finance/bigcharts.marketwatch.com/EK.html",Kodak Ads Get More Aggressive
"/sdd/edimar/Desktop/doutorado/doutorado04/bases/WEIR/finance/bigcharts.marketwatch.com/VRSN.html",VeriSign swings to profit in first quarter
"/sdd/edimar/Desktop/doutorado/doutorado04/bases/WEIR/finance/bigcharts.marketwatch.com/VOD.html",Sprint aims to turn the corner with Palm Pre
"/sdd/edimar/Desktop/doutorado/doutorado04/bases/WEIR/finance/bigcharts.marketwatch.com/EMC.html",Data Domain to review EMC's unsolicited bid
"/sdd/edimar/Desktop/doutorado/doutorado04/bases/WEIR/finance/bigcharts.marketwatch.com/IPG.html",ABC Counts On Laughs
"/sdd/edimar/Desktop/doutorado/doutorado04/bases/WEIR/finance/bigcharts.marketwatch.com/SUN.html",Gasoline Supply Fears Lift Crude
"/sdd/edimar/Desktop/doutorado/doutorado04/bases/WEIR/finance/bigcharts.marketwatch.com/BMY.html",Elan in Talks to Sell Minority Stake
"/sdd/edimar/Desktop/doutorado/doutorado04/bases/WEIR/finance/bigcharts.marketwatch.com/BBT.html","JP Morgan, Goldman among banks set to repay TARP"
"/sdd/edimar/Desktop/doutorado/doutorado04/bases/WEIR/finance/bigcharts.marketwatch.com/OMC.html",Strong Dollar Weighs on Omnicom
"/sdd/edimar/Desktop/doutorado/doutorado04/bases/WEIR/finance/bigcharts.marketwatch.com/SO.html",Stocks to Watch: Stocks in focus for Tuesday
"/sdd/edimar/Desktop/doutorado/doutorado04/bases/WEIR/finance/bigcharts.marketwatch.com/QQQ.html","PowerShares QQQ, General Electric: Money Flow Leaders (QQQQ, GE)"
"/sdd/edimar/Desktop/doutorado/doutorado04/bases/WEIR/finance/bigcharts.marketwatch.com/ARW.html","Earnings Watch: Updates, advisories and surprises"
"/sdd/edimar/Desktop/doutorado/doutorado04/bases/WEIR/finance/bigcharts.marketwatch.com/UPS.html",UPS Pulls Ad Following FedEx Suit
"/sdd/edimar/Desktop/doutorado/doutorado04/bases/WEIR/finance/bigcharts.marketwatch.com/ABT.html",Jensen Sees Quality Among Battle-Tested
"/sdd/edimar/Desktop/doutorado/doutorado04/bases/WEIR/finance/bigcharts.marketwatch.com/CCL.html",Flights to Mexico continue and deals are available
"/sdd/edimar/Desktop/doutorado/doutorado04/bases/WEIR/finance/bigcharts.marketwatch.com/BEN.html",CEO to face the music at Bank of America meeting
"/sdd/edimar/Desktop/doutorado/doutorado04/bases/WEIR/finance/bigcharts.marketwatch.com/SLE.html",Sara Lee Eyes Consumer-Products Deal
"/sdd/edimar/Desktop/doutorado/doutorado04/bases/WEIR/finance/bigcharts.marketwatch.com/VMC.html",Outside the Box: How to help your portfolio under Obama
