URL,EXTRACTED VALUE
"/sdd/edimar/Desktop/doutorado/doutorado04/bases/WEIR/finance/bigcharts.marketwatch.com/KBH.html",Indications: U.S. stock futures reverse course higher; builders rise
"/sdd/edimar/Desktop/doutorado/doutorado04/bases/WEIR/finance/bigcharts.marketwatch.com/WHR.html","Earnings Watch: Updates, advisories and surprises"
"/sdd/edimar/Desktop/doutorado/doutorado04/bases/WEIR/finance/bigcharts.marketwatch.com/C.html",Iberdrola Renewables shares to trade in the U.S.
"/sdd/edimar/Desktop/doutorado/doutorado04/bases/WEIR/finance/bigcharts.marketwatch.com/LPX.html",Movers & Shakers: Monday's biggest gaining and declining stocks
"/sdd/edimar/Desktop/doutorado/doutorado04/bases/WEIR/finance/bigcharts.marketwatch.com/AIG.html",Pay Czar to Get Broad Authority
"/sdd/edimar/Desktop/doutorado/doutorado04/bases/WEIR/finance/bigcharts.marketwatch.com/MGM.html",MGM Mirage Macau Venture Criticized
"/sdd/edimar/Desktop/doutorado/doutorado04/bases/WEIR/finance/bigcharts.marketwatch.com/S.html",Surfing in Your Own Wireless Network
"/sdd/edimar/Desktop/doutorado/doutorado04/bases/WEIR/finance/bigcharts.marketwatch.com/NWL.html",Movers & Shakers: Thursday's biggest gaining and declining stocks
"/sdd/edimar/Desktop/doutorado/doutorado04/bases/WEIR/finance/bigcharts.marketwatch.com/EIX.html",Edison International net income falls 16%
"/sdd/edimar/Desktop/doutorado/doutorado04/bases/WEIR/finance/bigcharts.marketwatch.com/X.html",Taking advantage of bear-market rallies
"/sdd/edimar/Desktop/doutorado/doutorado04/bases/WEIR/finance/bigcharts.marketwatch.com/BAX.html",CSL: U.S. regulators to bar $3.1 bln Talecris bid
"/sdd/edimar/Desktop/doutorado/doutorado04/bases/WEIR/finance/bigcharts.marketwatch.com/KMB.html","Kimberly-Clark Posts Lower Net, Sales"
"/sdd/edimar/Desktop/doutorado/doutorado04/bases/WEIR/finance/bigcharts.marketwatch.com/HUM.html","Carnival Sinks 14% as Glaxo, GM Jump"
"/sdd/edimar/Desktop/doutorado/doutorado04/bases/WEIR/finance/bigcharts.marketwatch.com/PCLN.html",Priceline earnings per share up 89%
"/sdd/edimar/Desktop/doutorado/doutorado04/bases/WEIR/finance/bigcharts.marketwatch.com/HAL.html",Energy Stocks: Sector rallies to finish out big week of gains
"/sdd/edimar/Desktop/doutorado/doutorado04/bases/WEIR/finance/bigcharts.marketwatch.com/CSX.html",Justice Family in Greenbrier Deal
"/sdd/edimar/Desktop/doutorado/doutorado04/bases/WEIR/finance/bigcharts.marketwatch.com/HON.html",Macquarie ups commercial aerospace to overweight
"/sdd/edimar/Desktop/doutorado/doutorado04/bases/WEIR/finance/bigcharts.marketwatch.com/T.html",Therese Poletti's Tech Tales: Is AT&T an albatross around Apple's neck?
"/sdd/edimar/Desktop/doutorado/doutorado04/bases/WEIR/finance/bigcharts.marketwatch.com/DE.html",House Panel Approves Climate Bill
"/sdd/edimar/Desktop/doutorado/doutorado04/bases/WEIR/finance/bigcharts.marketwatch.com/ELNK.html","Earnings Watch: Updates, advisories and surprises"
"/sdd/edimar/Desktop/doutorado/doutorado04/bases/WEIR/finance/bigcharts.marketwatch.com/INTC.html",After Hours: CORRECT: Palm CEO to leave; shares move higher
"/sdd/edimar/Desktop/doutorado/doutorado04/bases/WEIR/finance/bigcharts.marketwatch.com/HSY.html","Hershey profit up 20% on pricing, strong shipments"
"/sdd/edimar/Desktop/doutorado/doutorado04/bases/WEIR/finance/bigcharts.marketwatch.com/WEN.html","Money Markets And More (U.S. Markets Preview for Friday, May 29th): Is Tiffany's regaining its sparkle?"
"/sdd/edimar/Desktop/doutorado/doutorado04/bases/WEIR/finance/bigcharts.marketwatch.com/RDC.html",Rowan net income rises 34%
"/sdd/edimar/Desktop/doutorado/doutorado04/bases/WEIR/finance/bigcharts.marketwatch.com/ASH.html","Ashland, Veeco Instruments, Borders Rise"
"/sdd/edimar/Desktop/doutorado/doutorado04/bases/WEIR/finance/bigcharts.marketwatch.com/CB.html",Stocks to Watch: Stocks in focus for Friday
"/sdd/edimar/Desktop/doutorado/doutorado04/bases/WEIR/finance/bigcharts.marketwatch.com/DLTR.html",Dollar Tree profit jumps 39%
"/sdd/edimar/Desktop/doutorado/doutorado04/bases/WEIR/finance/bigcharts.marketwatch.com/KSWS.html",Stocks to Watch: Stocks in focus for Tuesday
"/sdd/edimar/Desktop/doutorado/doutorado04/bases/WEIR/finance/bigcharts.marketwatch.com/MDT.html",Movers & Shakers: Tuesday's biggest gaining and declining stocks
"/sdd/edimar/Desktop/doutorado/doutorado04/bases/WEIR/finance/bigcharts.marketwatch.com/TJX.html",Opening bell report from the MarketWatch Radio Network
"/sdd/edimar/Desktop/doutorado/doutorado04/bases/WEIR/finance/bigcharts.marketwatch.com/MO.html",Tobacco Likely to Face FDA Regulation
"/sdd/edimar/Desktop/doutorado/doutorado04/bases/WEIR/finance/bigcharts.marketwatch.com/SBC.html",Therese Poletti's Tech Tales: Is AT&T an albatross around Apple's neck?
"/sdd/edimar/Desktop/doutorado/doutorado04/bases/WEIR/finance/bigcharts.marketwatch.com/SLM.html",Movers & Shakers: Monday's biggest gaining and declining stocks
"/sdd/edimar/Desktop/doutorado/doutorado04/bases/WEIR/finance/bigcharts.marketwatch.com/UN.html",Cable Weighs Approach to Targeted Ads
"/sdd/edimar/Desktop/doutorado/doutorado04/bases/WEIR/finance/bigcharts.marketwatch.com/MHP.html",McGraw Sees Turnaround Ahead
"/sdd/edimar/Desktop/doutorado/doutorado04/bases/WEIR/finance/bigcharts.marketwatch.com/JNJ.html",Diabetes Study Questions Treatments
"/sdd/edimar/Desktop/doutorado/doutorado04/bases/WEIR/finance/bigcharts.marketwatch.com/SGP.html",J&J asks for end of Schering Remicade pacts
"/sdd/edimar/Desktop/doutorado/doutorado04/bases/WEIR/finance/bigcharts.marketwatch.com/CAG.html",ConAgra to sell $1 billion in senior notes
"/sdd/edimar/Desktop/doutorado/doutorado04/bases/WEIR/finance/bigcharts.marketwatch.com/NTAP.html",NetApp CEO says Data Domain deal to remain on hold
"/sdd/edimar/Desktop/doutorado/doutorado04/bases/WEIR/finance/bigcharts.marketwatch.com/GPS.html","Gap to revamp 50 Old Navys, grows internationally"
"/sdd/edimar/Desktop/doutorado/doutorado04/bases/WEIR/finance/bigcharts.marketwatch.com/USM.html","Telecom Stocks: Qwest, Sprint, Ericsson tack lower"
"/sdd/edimar/Desktop/doutorado/doutorado04/bases/WEIR/finance/bigcharts.marketwatch.com/HMC.html",India Car Sales Rise 2.5% in May
"/sdd/edimar/Desktop/doutorado/doutorado04/bases/WEIR/finance/bigcharts.marketwatch.com/GM.html",Summers defends intervention as necessary
"/sdd/edimar/Desktop/doutorado/doutorado04/bases/WEIR/finance/bigcharts.marketwatch.com/COST.html",Midday report from MarketWatch Radio Network
"/sdd/edimar/Desktop/doutorado/doutorado04/bases/WEIR/finance/bigcharts.marketwatch.com/NYT.html",More Firms Cut Pay to Save Jobs
"/sdd/edimar/Desktop/doutorado/doutorado04/bases/WEIR/finance/bigcharts.marketwatch.com/BBBY.html","Kleintop: Less bad, but not yet good economic news"
"/sdd/edimar/Desktop/doutorado/doutorado04/bases/WEIR/finance/bigcharts.marketwatch.com/SUN.html","Traders Sow Seeds of Profit in Mosaic, Agrium"
"/sdd/edimar/Desktop/doutorado/doutorado04/bases/WEIR/finance/bigcharts.marketwatch.com/IPG.html",Interpublic Plans Note Buyback
"/sdd/edimar/Desktop/doutorado/doutorado04/bases/WEIR/finance/bigcharts.marketwatch.com/KO.html",Coca-Cola streamlines global business operations
"/sdd/edimar/Desktop/doutorado/doutorado04/bases/WEIR/finance/bigcharts.marketwatch.com/WFC.html",Market Downturn Hit Lawmakers
"/sdd/edimar/Desktop/doutorado/doutorado04/bases/WEIR/finance/bigcharts.marketwatch.com/BBT.html",Ten large banks can return $68 billion in TARP
"/sdd/edimar/Desktop/doutorado/doutorado04/bases/WEIR/finance/bigcharts.marketwatch.com/DD.html","Boeing Rises 4%, as DuPont Is Pounded"
"/sdd/edimar/Desktop/doutorado/doutorado04/bases/WEIR/finance/bigcharts.marketwatch.com/AET.html",Indications: U.S. stock futures fall before Bernanke speech
"/sdd/edimar/Desktop/doutorado/doutorado04/bases/WEIR/finance/bigcharts.marketwatch.com/SNDK.html",SanDisk soars on Samsung agreement
"/sdd/edimar/Desktop/doutorado/doutorado04/bases/WEIR/finance/bigcharts.marketwatch.com/K.html",Bond Report: Treasurys up; Fed may buy more U.S. debt
"/sdd/edimar/Desktop/doutorado/doutorado04/bases/WEIR/finance/bigcharts.marketwatch.com/PEP.html",Pepsi Bottling Raises Profit Forecast
"/sdd/edimar/Desktop/doutorado/doutorado04/bases/WEIR/finance/bigcharts.marketwatch.com/F.html",Chinese firms interested in Ford's Volvo: WSJ
"/sdd/edimar/Desktop/doutorado/doutorado04/bases/WEIR/finance/bigcharts.marketwatch.com/MMC.html","Before the Bell: ADP report, Walt Disney, Bank of America in focus"
"/sdd/edimar/Desktop/doutorado/doutorado04/bases/WEIR/finance/bigcharts.marketwatch.com/CSC.html",Computer Sciences posts higher quarterly profit
"/sdd/edimar/Desktop/doutorado/doutorado04/bases/WEIR/finance/bigcharts.marketwatch.com/NKE.html",After Hours: Blockbuster shares sink: Nordstrom raises outlook
"/sdd/edimar/Desktop/doutorado/doutorado04/bases/WEIR/finance/bigcharts.marketwatch.com/SPLS.html",Retail stocks drop as Staples profit falls 33%
"/sdd/edimar/Desktop/doutorado/doutorado04/bases/WEIR/finance/bigcharts.marketwatch.com/DISH.html",Appeals court stays decision in EchoStar-TiVo case
"/sdd/edimar/Desktop/doutorado/doutorado04/bases/WEIR/finance/bigcharts.marketwatch.com/JPM.html",Hedge Funds: Highbridge founder jumps as J.P. Morgan takes over
