URL,EXTRACTED VALUE
"/sdd/edimar/Desktop/doutorado/doutorado04/bases/WEIR/finance/bigcharts.marketwatch.com/CAH.html",Sarnova Names Hank Struik Chief Executive Officer
"/sdd/edimar/Desktop/doutorado/doutorado04/bases/WEIR/finance/bigcharts.marketwatch.com/BC.html","Brunswick Expands Consumer Support, Adding Nine Boat Brands to Marine Industry's First Payment Protection Promotion; Now Includes 12 Boat Brands"
"/sdd/edimar/Desktop/doutorado/doutorado04/bases/WEIR/finance/bigcharts.marketwatch.com/NUE.html",Nucor Announces One-Hundred Forty-Fifth (145th) Consecutive Cash Dividend
"/sdd/edimar/Desktop/doutorado/doutorado04/bases/WEIR/finance/bigcharts.marketwatch.com/GRA.html","W. R. Grace & Co. Renews Donation to Libby, Montana Hospital"
"/sdd/edimar/Desktop/doutorado/doutorado04/bases/WEIR/finance/bigcharts.marketwatch.com/ONVI.html","Recovery.org Tracks 10,000th American Recovery and Reinvestment Act Project"
"/sdd/edimar/Desktop/doutorado/doutorado04/bases/WEIR/finance/bigcharts.marketwatch.com/EFX.html",Equifax and FICO Introduce BEACON 09 Credit Score
"/sdd/edimar/Desktop/doutorado/doutorado04/bases/WEIR/finance/bigcharts.marketwatch.com/CINF.html",Cincinnati Financial Corporation Declares Regular Quarterly Cash Dividend
"/sdd/edimar/Desktop/doutorado/doutorado04/bases/WEIR/finance/bigcharts.marketwatch.com/WHR.html",Attensity to Host Free Webinar on Growing Your Retail Business By Understanding and Acting on Customer Conversations
"/sdd/edimar/Desktop/doutorado/doutorado04/bases/WEIR/finance/bigcharts.marketwatch.com/KBH.html","California KB Homes Operation Target of Investigation, Hagens Berman Announces"
"/sdd/edimar/Desktop/doutorado/doutorado04/bases/WEIR/finance/bigcharts.marketwatch.com/CMS.html",CMS Energy Announces Pricing of $150 Million of Convertible Senior Notes and $300 Million of Senior Notes
"/sdd/edimar/Desktop/doutorado/doutorado04/bases/WEIR/finance/bigcharts.marketwatch.com/MGM.html",MGM MIRAGE Announces Consent Solicitation for Its 13% Senior Secured Notes Due 2013
"/sdd/edimar/Desktop/doutorado/doutorado04/bases/WEIR/finance/bigcharts.marketwatch.com/AMZN.html",Amazon Turns to Customers for New TV Advertising Campaign
"/sdd/edimar/Desktop/doutorado/doutorado04/bases/WEIR/finance/bigcharts.marketwatch.com/UNP.html",Union Pacific Corporation's CFO to Address Bank of America Merrill Lynch 2009 Global Transportation Conference
"/sdd/edimar/Desktop/doutorado/doutorado04/bases/WEIR/finance/bigcharts.marketwatch.com/AVA.html",Fitch Upgrades Avista Corp. to Investment Grade
"/sdd/edimar/Desktop/doutorado/doutorado04/bases/WEIR/finance/bigcharts.marketwatch.com/AEP.html",California Natural Gas Class Action Settlements Receive Preliminary Approval
"/sdd/edimar/Desktop/doutorado/doutorado04/bases/WEIR/finance/bigcharts.marketwatch.com/DAL.html",Delta-Northwest Merger Brings Service Enhancements to International Flights
"/sdd/edimar/Desktop/doutorado/doutorado04/bases/WEIR/finance/bigcharts.marketwatch.com/PDLI.html",PDL BioPharma Provides Second Quarter 2009 Revenue Guidance of Approximately $125 Million
"/sdd/edimar/Desktop/doutorado/doutorado04/bases/WEIR/finance/bigcharts.marketwatch.com/SWK.html",The Stanley Works Announces 2nd Quarter Dividend
"/sdd/edimar/Desktop/doutorado/doutorado04/bases/WEIR/finance/bigcharts.marketwatch.com/PCAR.html",Truck Manufacturers Association Elects New Officers
"/sdd/edimar/Desktop/doutorado/doutorado04/bases/WEIR/finance/bigcharts.marketwatch.com/PEG.html",PSE&G Solar Programs Receive Industry Award for Innovation
"/sdd/edimar/Desktop/doutorado/doutorado04/bases/WEIR/finance/bigcharts.marketwatch.com/CA.html",CA Security Architect Testifies Before Congress on Need for More Cyber Security Research and Education
"/sdd/edimar/Desktop/doutorado/doutorado04/bases/WEIR/finance/bigcharts.marketwatch.com/FO.html",Fitch Rates Fortune Brands' $500MM Sr Notes 'BBB-'
"/sdd/edimar/Desktop/doutorado/doutorado04/bases/WEIR/finance/bigcharts.marketwatch.com/FLEX.html",Flextronics Announces Partial Tender Offer and Consent Solicitation for Its 6 1/2% and 6 1/4% Senior Subordinated Notes
"/sdd/edimar/Desktop/doutorado/doutorado04/bases/WEIR/finance/bigcharts.marketwatch.com/CTX.html",Pulte Considers Vote in 2010 on Declassification of Board and Rights Plan
"/sdd/edimar/Desktop/doutorado/doutorado04/bases/WEIR/finance/bigcharts.marketwatch.com/NOVL.html",CompanionLink Desktop PC Synchronization Available for Palm Pre at Launch
"/sdd/edimar/Desktop/doutorado/doutorado04/bases/WEIR/finance/bigcharts.marketwatch.com/DE.html",Stock Alerts on Leading Movers in the News; Issued by InvestorSoup.com
"/sdd/edimar/Desktop/doutorado/doutorado04/bases/WEIR/finance/bigcharts.marketwatch.com/N.html",NetSuite CEO Zach Nelson to Deliver Keynote at SIIA OnDemand Europe
"/sdd/edimar/Desktop/doutorado/doutorado04/bases/WEIR/finance/bigcharts.marketwatch.com/BLL.html",Monster Import Debuts in Resealable Cans From Ball
"/sdd/edimar/Desktop/doutorado/doutorado04/bases/WEIR/finance/bigcharts.marketwatch.com/CB.html",Wildfire Threat Influences Home-Buying Decisions
"/sdd/edimar/Desktop/doutorado/doutorado04/bases/WEIR/finance/bigcharts.marketwatch.com/GCI.html",Employers Share the Most Unconventional Tactics Job Seekers Have Used to Get Their Attention in New CareerBuilder Survey
"/sdd/edimar/Desktop/doutorado/doutorado04/bases/WEIR/finance/bigcharts.marketwatch.com/AHC.html",Valassis and The Dallas Morning News Join Forces to Extend Reach and Targeting for Advertisers in Dallas-Ft. Worth
"/sdd/edimar/Desktop/doutorado/doutorado04/bases/WEIR/finance/bigcharts.marketwatch.com/TWX.html",Time Warner Honors Employees' Outstanding Volunteer Achievements with 28th Annual Andrew Heiskell Community Service Awards
"/sdd/edimar/Desktop/doutorado/doutorado04/bases/WEIR/finance/bigcharts.marketwatch.com/CTL.html",CenturyTel and EMBARQ Receive All Necessary State Approvals for Merger
"/sdd/edimar/Desktop/doutorado/doutorado04/bases/WEIR/finance/bigcharts.marketwatch.com/WMB.html",Williams Partners L.P. Provides Update on Ignacio Gas Processing Plant
"/sdd/edimar/Desktop/doutorado/doutorado04/bases/WEIR/finance/bigcharts.marketwatch.com/PNC.html",PNC Financial Services Group Names Deutsch as Advertising Agency Of Record
"/sdd/edimar/Desktop/doutorado/doutorado04/bases/WEIR/finance/bigcharts.marketwatch.com/TIF.html",Tiffany Reports First Quarter Results
"/sdd/edimar/Desktop/doutorado/doutorado04/bases/WEIR/finance/bigcharts.marketwatch.com/AMCC.html",Applied Micro Circuits Corporation Reports Fourth Quarter Fiscal 2009 Financial Results
"/sdd/edimar/Desktop/doutorado/doutorado04/bases/WEIR/finance/bigcharts.marketwatch.com/HD.html",Stock Alerts on Wall Street's News Makers; Issued by InvestorSoup.com
"/sdd/edimar/Desktop/doutorado/doutorado04/bases/WEIR/finance/bigcharts.marketwatch.com/MCD.html",Correction - Fitch Rates McDonald's EUR300MM Notes 'A'; Outlook Stable
"/sdd/edimar/Desktop/doutorado/doutorado04/bases/WEIR/finance/bigcharts.marketwatch.com/PH.html","Parker to Present at the Sanford C. Bernstein and Company Strategic Decisions Conference on May 29, 2009 at 8:00 a.m. Eastern."
"/sdd/edimar/Desktop/doutorado/doutorado04/bases/WEIR/finance/bigcharts.marketwatch.com/TMO.html",Thermo Fisher Scientific Elects Two New Directors
"/sdd/edimar/Desktop/doutorado/doutorado04/bases/WEIR/finance/bigcharts.marketwatch.com/BSX.html",Reportlinker Adds South and Central America Patient Monitoring Market Analysis & Forecasts to 2015
"/sdd/edimar/Desktop/doutorado/doutorado04/bases/WEIR/finance/bigcharts.marketwatch.com/MAR.html","Marriott International to Release Second Quarter 2009 Earnings July 16, 2009"
"/sdd/edimar/Desktop/doutorado/doutorado04/bases/WEIR/finance/bigcharts.marketwatch.com/MAS.html",Video: Merillat Launches 'The Good Life' Music Video and Contest
"/sdd/edimar/Desktop/doutorado/doutorado04/bases/WEIR/finance/bigcharts.marketwatch.com/MXIM.html","Maxim to Present At Two Conferences On June 9, 2009"
"/sdd/edimar/Desktop/doutorado/doutorado04/bases/WEIR/finance/bigcharts.marketwatch.com/RSH.html",RadioShack Reminds Consumers to Rescan Converter Boxes After June 12 Digital Television Transition to Pick Up More Channels
"/sdd/edimar/Desktop/doutorado/doutorado04/bases/WEIR/finance/bigcharts.marketwatch.com/BDK.html",Black & Decker Reduces Quarterly Cash Dividend
"/sdd/edimar/Desktop/doutorado/doutorado04/bases/WEIR/finance/bigcharts.marketwatch.com/JKHY.html",Symitar Collaborates With JustSystems to Reap the Benefits of Structured Authoring
"/sdd/edimar/Desktop/doutorado/doutorado04/bases/WEIR/finance/bigcharts.marketwatch.com/MGG.html",/C O R R E C T I O N -- DTE Energy/
"/sdd/edimar/Desktop/doutorado/doutorado04/bases/WEIR/finance/bigcharts.marketwatch.com/GWW.html",Grainger to Present at William Blair Growth Stock Conference
"/sdd/edimar/Desktop/doutorado/doutorado04/bases/WEIR/finance/bigcharts.marketwatch.com/NSC.html",Norfolk Southern CEO Moorman to Address Bank of America and Merrill Lynch Global Transportation Conference
"/sdd/edimar/Desktop/doutorado/doutorado04/bases/WEIR/finance/bigcharts.marketwatch.com/GM.html","General Motors, Penske Outline Proposed Deal for Purchase of Saturn"
"/sdd/edimar/Desktop/doutorado/doutorado04/bases/WEIR/finance/bigcharts.marketwatch.com/PCG.html","Tricor Ten Section Hub, LLC Holds Open Season for Western U.S. Hub Natural Gas Storage Service"
"/sdd/edimar/Desktop/doutorado/doutorado04/bases/WEIR/finance/bigcharts.marketwatch.com/TUP.html",Tupperware Brands Corporation Declares Quarterly Dividend
"/sdd/edimar/Desktop/doutorado/doutorado04/bases/WEIR/finance/bigcharts.marketwatch.com/TMK.html",Torchmark Corporation Updates Status of Investment Portfolio and Liquidity and Capital
"/sdd/edimar/Desktop/doutorado/doutorado04/bases/WEIR/finance/bigcharts.marketwatch.com/AM.html",Consumers Saying Congratulations Not Goodbye to Class of 2009
"/sdd/edimar/Desktop/doutorado/doutorado04/bases/WEIR/finance/bigcharts.marketwatch.com/CAT.html","LoveForStocks issued alerts to members on: BG, BRKA, C, CAH, CAT, VLO"
"/sdd/edimar/Desktop/doutorado/doutorado04/bases/WEIR/finance/bigcharts.marketwatch.com/TLAB.html",Tellabs Presentation at the UBS Global Technology and Services Conference to Be Webcast Live
"/sdd/edimar/Desktop/doutorado/doutorado04/bases/WEIR/finance/bigcharts.marketwatch.com/CCE.html",Coca-Cola Enterprises Affirms Full-Year 2009 Guidance
"/sdd/edimar/Desktop/doutorado/doutorado04/bases/WEIR/finance/bigcharts.marketwatch.com/APA.html",Apache Completes Acquisition of Permian Basin Properties
"/sdd/edimar/Desktop/doutorado/doutorado04/bases/WEIR/finance/bigcharts.marketwatch.com/SO.html",Southern Company COO Tom Fanning to Address Macquarie's Global Infrastructure Conference in New York
"/sdd/edimar/Desktop/doutorado/doutorado04/bases/WEIR/finance/bigcharts.marketwatch.com/DD.html",LINE-X(R) Protective Coatings and Truck Covers USA Partner to Offer the New American X-Box
"/sdd/edimar/Desktop/doutorado/doutorado04/bases/WEIR/finance/bigcharts.marketwatch.com/TYC.html",Tyco International to Present at Electrical Products Group Annual Conference
"/sdd/edimar/Desktop/doutorado/doutorado04/bases/WEIR/finance/bigcharts.marketwatch.com/HGSI.html",Human Genome Sciences Reports Positive Long-Term Data for BENLYSTA(TM) (Formerly LymphoStat-B(R)) in Patients With Active Systemic Lupus Erythematosus
"/sdd/edimar/Desktop/doutorado/doutorado04/bases/WEIR/finance/bigcharts.marketwatch.com/LEG.html","Empire Investment Holdings Appoints CFO for its Latest Acquisition Polyester Fibers, LLC"
"/sdd/edimar/Desktop/doutorado/doutorado04/bases/WEIR/finance/bigcharts.marketwatch.com/K.html",Kellogg Company to Webcast Presentation At Deutsche Bank Global Consumer & Food Retail Conference
"/sdd/edimar/Desktop/doutorado/doutorado04/bases/WEIR/finance/bigcharts.marketwatch.com/NSM.html","NI Technology Research Updates Outlooks for Texas Instruments, National Semiconductor, Palm, Cypress Semiconductor, and SanDisk"
"/sdd/edimar/Desktop/doutorado/doutorado04/bases/WEIR/finance/bigcharts.marketwatch.com/FE.html","Emission Concerns Give Bigger Push for Sequestration Projects, an Industrial Info News Alert"
"/sdd/edimar/Desktop/doutorado/doutorado04/bases/WEIR/finance/bigcharts.marketwatch.com/ABT.html",Abbott Announces New EAS(R) Myoplex(R) Strength Formula Nutrition Shake and Debuts Bottle Packaging
"/sdd/edimar/Desktop/doutorado/doutorado04/bases/WEIR/finance/bigcharts.marketwatch.com/CCL.html",Holland America Line Announces More Details on Its Latest Signature of Excellence Enhancements
"/sdd/edimar/Desktop/doutorado/doutorado04/bases/WEIR/finance/bigcharts.marketwatch.com/BBI.html",Blockbuster Creates Movie Road Map for Film Lovers Looking to Escape in This Summer
"/sdd/edimar/Desktop/doutorado/doutorado04/bases/WEIR/finance/bigcharts.marketwatch.com/PPL.html",PPL Agrees to Sell Long Island Generation Business to J-POWER USA
"/sdd/edimar/Desktop/doutorado/doutorado04/bases/WEIR/finance/bigcharts.marketwatch.com/AVP.html",Avon & Expresion en Corto to Launch 'Speak Out Against Domestic Violence Short Film Contest' During Cannes Film Festival
"/sdd/edimar/Desktop/doutorado/doutorado04/bases/WEIR/finance/bigcharts.marketwatch.com/DTE.html","DTE Energy Sponsors, Kicks Off Environmental Conference at Cobo Center"
"/sdd/edimar/Desktop/doutorado/doutorado04/bases/WEIR/finance/bigcharts.marketwatch.com/MRO.html","Today's alerts include: MET, MHS, MRO, MS, PFE"
"/sdd/edimar/Desktop/doutorado/doutorado04/bases/WEIR/finance/bigcharts.marketwatch.com/DISH.html",TiVo Statement on the Federal Circuit Court of Appeals' Decision to Issue a Temporary Stay of Injunction
"/sdd/edimar/Desktop/doutorado/doutorado04/bases/WEIR/finance/bigcharts.marketwatch.com/FMC.html",FMC Corporation Plans Objections to EPA Action on Carbofuran
"/sdd/edimar/Desktop/doutorado/doutorado04/bases/WEIR/finance/bigcharts.marketwatch.com/BDX.html",BD Board Declares Dividend
