URL,EXTRACTED VALUE
"/sdd/edimar/Desktop/doutorado/doutorado04/bases/WEIR/finance/bigcharts.marketwatch.com/MSO.html",Martha Stewart Signs Rich Contract Renewal
"/sdd/edimar/Desktop/doutorado/doutorado04/bases/WEIR/finance/bigcharts.marketwatch.com/XRX.html",Investor group calls for change in Target board
"/sdd/edimar/Desktop/doutorado/doutorado04/bases/WEIR/finance/bigcharts.marketwatch.com/GIS.html","Earnings Watch: Updates, advisories and surprises"
"/sdd/edimar/Desktop/doutorado/doutorado04/bases/WEIR/finance/bigcharts.marketwatch.com/MGM.html",Nevada Weighs Lifting Limits on Casino Stakes
"/sdd/edimar/Desktop/doutorado/doutorado04/bases/WEIR/finance/bigcharts.marketwatch.com/S.html",Sprint Considers Level 3 Venture
"/sdd/edimar/Desktop/doutorado/doutorado04/bases/WEIR/finance/bigcharts.marketwatch.com/COMS.html",Movers & Shakers: Friday's biggest gaining and losing stocks
"/sdd/edimar/Desktop/doutorado/doutorado04/bases/WEIR/finance/bigcharts.marketwatch.com/BKS.html","Money Markets And More (U.S. Markets Preview for Monday, June 1st): GM at center stage but more news in the wings."
"/sdd/edimar/Desktop/doutorado/doutorado04/bases/WEIR/finance/bigcharts.marketwatch.com/FRE.html","Money Markets and More (US markets preview for Friday, June 12th) The mood of the consumer is in focus"
"/sdd/edimar/Desktop/doutorado/doutorado04/bases/WEIR/finance/bigcharts.marketwatch.com/NCR.html",Blockbuster Plays Catch-Up
"/sdd/edimar/Desktop/doutorado/doutorado04/bases/WEIR/finance/bigcharts.marketwatch.com/CLX.html",Clorox hikes quarterly dividend 9%
"/sdd/edimar/Desktop/doutorado/doutorado04/bases/WEIR/finance/bigcharts.marketwatch.com/STI.html","Wall Street feasting on stock, but for how long?"
"/sdd/edimar/Desktop/doutorado/doutorado04/bases/WEIR/finance/bigcharts.marketwatch.com/X.html","Oil's Rise Aids Exxon, Stymies Southwest"
"/sdd/edimar/Desktop/doutorado/doutorado04/bases/WEIR/finance/bigcharts.marketwatch.com/ELON.html",The Streetlamp Gets a Green Update
"/sdd/edimar/Desktop/doutorado/doutorado04/bases/WEIR/finance/bigcharts.marketwatch.com/KMB.html",Banks Use Insurance to Fund Bonuses
"/sdd/edimar/Desktop/doutorado/doutorado04/bases/WEIR/finance/bigcharts.marketwatch.com/HOTT.html",Stocks to Watch: Stocks in focus for Thursday
"/sdd/edimar/Desktop/doutorado/doutorado04/bases/WEIR/finance/bigcharts.marketwatch.com/CR.html",Movers & Shakers: Tuesday's biggest gaining and declining stocks
"/sdd/edimar/Desktop/doutorado/doutorado04/bases/WEIR/finance/bigcharts.marketwatch.com/ADP.html",Dollar Gets Reprieve
"/sdd/edimar/Desktop/doutorado/doutorado04/bases/WEIR/finance/bigcharts.marketwatch.com/SYY.html","Earnings Watch: Updates, advisories and surprises"
"/sdd/edimar/Desktop/doutorado/doutorado04/bases/WEIR/finance/bigcharts.marketwatch.com/HON.html",Air France Debris Found in Atlantic
"/sdd/edimar/Desktop/doutorado/doutorado04/bases/WEIR/finance/bigcharts.marketwatch.com/D.html","Earnings Watch: Updates, advisories and surprises"
"/sdd/edimar/Desktop/doutorado/doutorado04/bases/WEIR/finance/bigcharts.marketwatch.com/ICGE.html",Internet Capital: Parter CreditTrade to merge with Creditex
"/sdd/edimar/Desktop/doutorado/doutorado04/bases/WEIR/finance/bigcharts.marketwatch.com/ZQK.html",Retail Stocks: Retail stocks rise as Men's Wearhouse beats views
"/sdd/edimar/Desktop/doutorado/doutorado04/bases/WEIR/finance/bigcharts.marketwatch.com/ARIA.html",Movers & Shakers: Thursday's biggest stock gainers and decliners
"/sdd/edimar/Desktop/doutorado/doutorado04/bases/WEIR/finance/bigcharts.marketwatch.com/CEG.html",Weekend Edition: Smart grid not clever enough to avoid recession
"/sdd/edimar/Desktop/doutorado/doutorado04/bases/WEIR/finance/bigcharts.marketwatch.com/TER.html",Movers & Shakers: Wednesday's biggest gaining and declining stocks
"/sdd/edimar/Desktop/doutorado/doutorado04/bases/WEIR/finance/bigcharts.marketwatch.com/IR.html",Stocks to Watch: Stocks in focus for Friday
"/sdd/edimar/Desktop/doutorado/doutorado04/bases/WEIR/finance/bigcharts.marketwatch.com/TBL.html","Money Markets and More for Thursday, February 5th"
"/sdd/edimar/Desktop/doutorado/doutorado04/bases/WEIR/finance/bigcharts.marketwatch.com/SRE.html",Power firms earnings lose their spark
"/sdd/edimar/Desktop/doutorado/doutorado04/bases/WEIR/finance/bigcharts.marketwatch.com/TJX.html",U.S. Retailers Post Lower Sales
"/sdd/edimar/Desktop/doutorado/doutorado04/bases/WEIR/finance/bigcharts.marketwatch.com/MCD.html",Market Snapshot: Dollar's a wild card for stocks
"/sdd/edimar/Desktop/doutorado/doutorado04/bases/WEIR/finance/bigcharts.marketwatch.com/ANF.html","Money Markets and More (US Markets Preview for Thursday, June 11th): Retail sales in focus"
"/sdd/edimar/Desktop/doutorado/doutorado04/bases/WEIR/finance/bigcharts.marketwatch.com/RIG.html",Energy Stocks: Drop in petroleum supplies fuels energy stocks
"/sdd/edimar/Desktop/doutorado/doutorado04/bases/WEIR/finance/bigcharts.marketwatch.com/PHG.html",Belgian Hero Fights Comic-Book Crisis
"/sdd/edimar/Desktop/doutorado/doutorado04/bases/WEIR/finance/bigcharts.marketwatch.com/PBY.html","Money Markets and More for Tuesday, March 31st"
"/sdd/edimar/Desktop/doutorado/doutorado04/bases/WEIR/finance/bigcharts.marketwatch.com/LRCX.html",Bulls Root on Fertilizer Firms
"/sdd/edimar/Desktop/doutorado/doutorado04/bases/WEIR/finance/bigcharts.marketwatch.com/GPC.html",Movers & Shakers: Thursday's biggest gaining and declining stocks
"/sdd/edimar/Desktop/doutorado/doutorado04/bases/WEIR/finance/bigcharts.marketwatch.com/ETN.html",Market Snapshot: GM bankruptcy may spell relief for stocks
"/sdd/edimar/Desktop/doutorado/doutorado04/bases/WEIR/finance/bigcharts.marketwatch.com/CAG.html",Food Firms Cook Up Ways to Combat Slump
"/sdd/edimar/Desktop/doutorado/doutorado04/bases/WEIR/finance/bigcharts.marketwatch.com/NTAP.html",Dell Looks To Ramp Up Acquisitions
"/sdd/edimar/Desktop/doutorado/doutorado04/bases/WEIR/finance/bigcharts.marketwatch.com/GAS.html",Nicor net income rises 6%
"/sdd/edimar/Desktop/doutorado/doutorado04/bases/WEIR/finance/bigcharts.marketwatch.com/BDK.html",Black & Decker cuts quarterly dividend by 71%
"/sdd/edimar/Desktop/doutorado/doutorado04/bases/WEIR/finance/bigcharts.marketwatch.com/MRK.html",NYSE glitch halts some floor trading
"/sdd/edimar/Desktop/doutorado/doutorado04/bases/WEIR/finance/bigcharts.marketwatch.com/HMC.html",Toyota Expects India 2009 Sales to Remain Flat
"/sdd/edimar/Desktop/doutorado/doutorado04/bases/WEIR/finance/bigcharts.marketwatch.com/EK.html","Earnings Watch: Updates, advisories and surprises"
"/sdd/edimar/Desktop/doutorado/doutorado04/bases/WEIR/finance/bigcharts.marketwatch.com/VRSN.html",Movers & Shakers: Monday's biggest gaining and declining stocks
"/sdd/edimar/Desktop/doutorado/doutorado04/bases/WEIR/finance/bigcharts.marketwatch.com/PCG.html",Weekend Edition: Smart grid not clever enough to avoid recession
"/sdd/edimar/Desktop/doutorado/doutorado04/bases/WEIR/finance/bigcharts.marketwatch.com/JBL.html",Movers & Shakers: Monday's biggest gaining and declining stocks
"/sdd/edimar/Desktop/doutorado/doutorado04/bases/WEIR/finance/bigcharts.marketwatch.com/KEY.html","KeyCorp Advances; Alcoa, Chevron Follow"
"/sdd/edimar/Desktop/doutorado/doutorado04/bases/WEIR/finance/bigcharts.marketwatch.com/EMC.html",Therese Poletti's Tech Tales: Deal-making and the Data Domain battle
"/sdd/edimar/Desktop/doutorado/doutorado04/bases/WEIR/finance/bigcharts.marketwatch.com/WY.html",Moody's cuts Weyerhaeuser's debt ratings to junk
"/sdd/edimar/Desktop/doutorado/doutorado04/bases/WEIR/finance/bigcharts.marketwatch.com/SNE.html",Advertisers Play Role of Producer
"/sdd/edimar/Desktop/doutorado/doutorado04/bases/WEIR/finance/bigcharts.marketwatch.com/JNPR.html","Tech Stocks: Amazon, Oracle lead techs higher"
"/sdd/edimar/Desktop/doutorado/doutorado04/bases/WEIR/finance/bigcharts.marketwatch.com/CCE.html","Before the Bell: Insurers, consumer prices, Barclays in focus"
"/sdd/edimar/Desktop/doutorado/doutorado04/bases/WEIR/finance/bigcharts.marketwatch.com/APA.html",Energy Stocks: Sector kicks off May with gains
"/sdd/edimar/Desktop/doutorado/doutorado04/bases/WEIR/finance/bigcharts.marketwatch.com/BBT.html",Banks to Repay Bailout Cash
"/sdd/edimar/Desktop/doutorado/doutorado04/bases/WEIR/finance/bigcharts.marketwatch.com/AZO.html",AutoZone earnings per share up 26%
"/sdd/edimar/Desktop/doutorado/doutorado04/bases/WEIR/finance/bigcharts.marketwatch.com/ARW.html",Movers & Shakers: Wednesday's biggest gaining and declining stocks
"/sdd/edimar/Desktop/doutorado/doutorado04/bases/WEIR/finance/bigcharts.marketwatch.com/LTD.html",Challenge for Retailers: Shrink to Fit
"/sdd/edimar/Desktop/doutorado/doutorado04/bases/WEIR/finance/bigcharts.marketwatch.com/ERTS.html",Video game sales fall for third-straight month
"/sdd/edimar/Desktop/doutorado/doutorado04/bases/WEIR/finance/bigcharts.marketwatch.com/JWN.html","Money Markets and More (US Markets Preview for Thursday, June 11th): Retail sales in focus"
"/sdd/edimar/Desktop/doutorado/doutorado04/bases/WEIR/finance/bigcharts.marketwatch.com/MMC.html","Bloggers, Beware of Lawsuits"
"/sdd/edimar/Desktop/doutorado/doutorado04/bases/WEIR/finance/bigcharts.marketwatch.com/SLE.html","Earnings Watch: Updates, advisories and surprises"
"/sdd/edimar/Desktop/doutorado/doutorado04/bases/WEIR/finance/bigcharts.marketwatch.com/FMC.html","Economic Preview: Retail sales, producer-price data on tap"
