URL,EXTRACTED VALUE
"/sdd/edimar/Desktop/doutorado/doutorado04/bases/WEIR/finance/bigcharts.marketwatch.com/CAH.html",Cardinal Health Raises Dividend
"/sdd/edimar/Desktop/doutorado/doutorado04/bases/WEIR/finance/bigcharts.marketwatch.com/MSO.html",Gibraltar Industries and Quiksilver Lead Surge
"/sdd/edimar/Desktop/doutorado/doutorado04/bases/WEIR/finance/bigcharts.marketwatch.com/KBH.html",Traders Add to Already-Heady Real-Estate Positions
"/sdd/edimar/Desktop/doutorado/doutorado04/bases/WEIR/finance/bigcharts.marketwatch.com/WHR.html",Weak Demand Pressures Whirlpool
"/sdd/edimar/Desktop/doutorado/doutorado04/bases/WEIR/finance/bigcharts.marketwatch.com/PFE.html",FDA panel recommends psych drugs for teens
"/sdd/edimar/Desktop/doutorado/doutorado04/bases/WEIR/finance/bigcharts.marketwatch.com/AIG.html",Fed Earned $2.7 Billion in Quarter
"/sdd/edimar/Desktop/doutorado/doutorado04/bases/WEIR/finance/bigcharts.marketwatch.com/MGM.html","After Hours: B. of A. tops movers, GMAC needs to cut costs"
"/sdd/edimar/Desktop/doutorado/doutorado04/bases/WEIR/finance/bigcharts.marketwatch.com/BGG.html",Movers & Shakers: Thursday's biggest gaining and declining stocks
"/sdd/edimar/Desktop/doutorado/doutorado04/bases/WEIR/finance/bigcharts.marketwatch.com/AFL.html","Financial Stocks: FDIC report, rising mortgage rates hit banks"
"/sdd/edimar/Desktop/doutorado/doutorado04/bases/WEIR/finance/bigcharts.marketwatch.com/AEP.html",Green-energy gurus not holding breath on CO2 rules
"/sdd/edimar/Desktop/doutorado/doutorado04/bases/WEIR/finance/bigcharts.marketwatch.com/XOM.html",Mark Hulbert: Stocks go from roller coaster to yawner
"/sdd/edimar/Desktop/doutorado/doutorado04/bases/WEIR/finance/bigcharts.marketwatch.com/QSFT.html",The Technical Indicator: S&P 500 threatens to violate major support
"/sdd/edimar/Desktop/doutorado/doutorado04/bases/WEIR/finance/bigcharts.marketwatch.com/ATI.html","Earnings Watch: Updates, advisories and surprises"
"/sdd/edimar/Desktop/doutorado/doutorado04/bases/WEIR/finance/bigcharts.marketwatch.com/KMB.html","P&G, Colgate Hit by Consumer Thrift"
"/sdd/edimar/Desktop/doutorado/doutorado04/bases/WEIR/finance/bigcharts.marketwatch.com/HOTT.html",After the bell report from MarketWatch Radio Network
"/sdd/edimar/Desktop/doutorado/doutorado04/bases/WEIR/finance/bigcharts.marketwatch.com/SYY.html",Sysco net income falls 6%
"/sdd/edimar/Desktop/doutorado/doutorado04/bases/WEIR/finance/bigcharts.marketwatch.com/HON.html",MarketWatch First Take: Dow deletions often outperform their replacements
"/sdd/edimar/Desktop/doutorado/doutorado04/bases/WEIR/finance/bigcharts.marketwatch.com/ELNK.html","Technology giants face headwinds, fund manager says"
"/sdd/edimar/Desktop/doutorado/doutorado04/bases/WEIR/finance/bigcharts.marketwatch.com/ALTR.html",Stocks to Watch: Stocks in focus for Friday
"/sdd/edimar/Desktop/doutorado/doutorado04/bases/WEIR/finance/bigcharts.marketwatch.com/WEN.html",Alcoa Advances 7% as AmEx Pulls Back
"/sdd/edimar/Desktop/doutorado/doutorado04/bases/WEIR/finance/bigcharts.marketwatch.com/AMGN.html",Biotech Stocks: Drug stocks slump; Sequenom jumps on upgrade
"/sdd/edimar/Desktop/doutorado/doutorado04/bases/WEIR/finance/bigcharts.marketwatch.com/QCOM.html","Palm, Qualcomm highlight early tech trading action"
"/sdd/edimar/Desktop/doutorado/doutorado04/bases/WEIR/finance/bigcharts.marketwatch.com/FLR.html",After Hours: MBIA jumps; Ford falls after share-offering plans
"/sdd/edimar/Desktop/doutorado/doutorado04/bases/WEIR/finance/bigcharts.marketwatch.com/NTRS.html",MarketWatch Hot Stocks: TARP News Hits Financials
"/sdd/edimar/Desktop/doutorado/doutorado04/bases/WEIR/finance/bigcharts.marketwatch.com/CI.html",Health Groups Outline Savings
"/sdd/edimar/Desktop/doutorado/doutorado04/bases/WEIR/finance/bigcharts.marketwatch.com/CB.html",Some Insurers May Not Be Quite Ready
"/sdd/edimar/Desktop/doutorado/doutorado04/bases/WEIR/finance/bigcharts.marketwatch.com/DLTR.html",Bargain-hunting shoppers lift Dollar General's net
"/sdd/edimar/Desktop/doutorado/doutorado04/bases/WEIR/finance/bigcharts.marketwatch.com/GLW.html",Corning Hires Laid-Off Staff
"/sdd/edimar/Desktop/doutorado/doutorado04/bases/WEIR/finance/bigcharts.marketwatch.com/UST.html","After Hours: El Paso gets boost from sale, S&P 500 change lifts Iron Mountain"
"/sdd/edimar/Desktop/doutorado/doutorado04/bases/WEIR/finance/bigcharts.marketwatch.com/AA.html",Stocks Wilt After Early Jump
"/sdd/edimar/Desktop/doutorado/doutorado04/bases/WEIR/finance/bigcharts.marketwatch.com/PSUN.html",Retail Stocks: Retail edges up after jobs data fall near expectations
"/sdd/edimar/Desktop/doutorado/doutorado04/bases/WEIR/finance/bigcharts.marketwatch.com/TWX.html",Jon Friedman's Media Web: Media Web turns 10: Highlights and lowlights
"/sdd/edimar/Desktop/doutorado/doutorado04/bases/WEIR/finance/bigcharts.marketwatch.com/RL.html",Restructuring Costs Crimp Polo
"/sdd/edimar/Desktop/doutorado/doutorado04/bases/WEIR/finance/bigcharts.marketwatch.com/ADM.html",Ethanol debate rages anew in policy circles
"/sdd/edimar/Desktop/doutorado/doutorado04/bases/WEIR/finance/bigcharts.marketwatch.com/RMBS.html",Rambus rallies on tentative E.U. settlement
"/sdd/edimar/Desktop/doutorado/doutorado04/bases/WEIR/finance/bigcharts.marketwatch.com/MCK.html",Stocks to Watch: Stocks in focus for Tuesday
"/sdd/edimar/Desktop/doutorado/doutorado04/bases/WEIR/finance/bigcharts.marketwatch.com/FITB.html",Treasury: Ten banks can repay $68 billion in TARP
"/sdd/edimar/Desktop/doutorado/doutorado04/bases/WEIR/finance/bigcharts.marketwatch.com/UN.html",Wal-Mart Comes to India
"/sdd/edimar/Desktop/doutorado/doutorado04/bases/WEIR/finance/bigcharts.marketwatch.com/BAC.html",Closing bell from MarketWatch Radio Network
"/sdd/edimar/Desktop/doutorado/doutorado04/bases/WEIR/finance/bigcharts.marketwatch.com/UNM.html",Stocks to Watch: Stocks in focus for Thursday
"/sdd/edimar/Desktop/doutorado/doutorado04/bases/WEIR/finance/bigcharts.marketwatch.com/SGP.html","Biotech Stocks: Exelixis, Sanofi gain on partnering deal"
"/sdd/edimar/Desktop/doutorado/doutorado04/bases/WEIR/finance/bigcharts.marketwatch.com/BA.html",Regions Rises 9.3%; Wal-Mart Loses Mojo
"/sdd/edimar/Desktop/doutorado/doutorado04/bases/WEIR/finance/bigcharts.marketwatch.com/USM.html","Telecom Stocks: AT&T, Verizon are havens amid decline"
"/sdd/edimar/Desktop/doutorado/doutorado04/bases/WEIR/finance/bigcharts.marketwatch.com/OI.html",Movers & Shakers: Wednesday's biggest gaining and declining stocks
"/sdd/edimar/Desktop/doutorado/doutorado04/bases/WEIR/finance/bigcharts.marketwatch.com/WLP.html",Deciphering Your Health Insurance
"/sdd/edimar/Desktop/doutorado/doutorado04/bases/WEIR/finance/bigcharts.marketwatch.com/PSS.html",Retail Stks Up;Best Buy Gets Boost From Circuit City Closures
"/sdd/edimar/Desktop/doutorado/doutorado04/bases/WEIR/finance/bigcharts.marketwatch.com/NSC.html",Stocks to Watch: Stocks in focus for Wednesday
"/sdd/edimar/Desktop/doutorado/doutorado04/bases/WEIR/finance/bigcharts.marketwatch.com/EMC.html",Weekend Investor: These tech stocks have matured into winners
"/sdd/edimar/Desktop/doutorado/doutorado04/bases/WEIR/finance/bigcharts.marketwatch.com/TUP.html","Money Markets and More for Wednesday, February, 4th"
"/sdd/edimar/Desktop/doutorado/doutorado04/bases/WEIR/finance/bigcharts.marketwatch.com/DUK.html",Green-energy gurus not holding breath on CO2 rules
"/sdd/edimar/Desktop/doutorado/doutorado04/bases/WEIR/finance/bigcharts.marketwatch.com/SUN.html",Xerox's Mulcahy Steps Aside as CEO
"/sdd/edimar/Desktop/doutorado/doutorado04/bases/WEIR/finance/bigcharts.marketwatch.com/IPG.html","Media Report: Broadcast networks, advertisers stalled in upfront"
"/sdd/edimar/Desktop/doutorado/doutorado04/bases/WEIR/finance/bigcharts.marketwatch.com/BBT.html",Treasury: Ten banks can repay $68 billion in TARP
"/sdd/edimar/Desktop/doutorado/doutorado04/bases/WEIR/finance/bigcharts.marketwatch.com/QQQ.html",Check actual market trends instead of slogans
"/sdd/edimar/Desktop/doutorado/doutorado04/bases/WEIR/finance/bigcharts.marketwatch.com/SNDK.html",Options Traders Up the Ante in Chips
"/sdd/edimar/Desktop/doutorado/doutorado04/bases/WEIR/finance/bigcharts.marketwatch.com/ARW.html",Arrow Electronics sharpens 2nd-quarter estimates
"/sdd/edimar/Desktop/doutorado/doutorado04/bases/WEIR/finance/bigcharts.marketwatch.com/PEP.html",Pepsi Deal Could Get a Bit Sweeter
"/sdd/edimar/Desktop/doutorado/doutorado04/bases/WEIR/finance/bigcharts.marketwatch.com/PBG.html",Pepsi Deal Could Get a Bit Sweeter
"/sdd/edimar/Desktop/doutorado/doutorado04/bases/WEIR/finance/bigcharts.marketwatch.com/DIA.html",Peter Brimelow: Deception? Dawn? Or take the long view?
"/sdd/edimar/Desktop/doutorado/doutorado04/bases/WEIR/finance/bigcharts.marketwatch.com/USB.html",Midday report from MarketWatch Radio Network
"/sdd/edimar/Desktop/doutorado/doutorado04/bases/WEIR/finance/bigcharts.marketwatch.com/HNZ.html",Heinz Earnings Drop
"/sdd/edimar/Desktop/doutorado/doutorado04/bases/WEIR/finance/bigcharts.marketwatch.com/AVP.html",Movers & Shakers: Tuesday's biggest gaining and declining stocks
"/sdd/edimar/Desktop/doutorado/doutorado04/bases/WEIR/finance/bigcharts.marketwatch.com/COF.html",Midday report from MarketWatch Radio Network
"/sdd/edimar/Desktop/doutorado/doutorado04/bases/WEIR/finance/bigcharts.marketwatch.com/CCK.html",Stocks to Watch: Stocks in focus for Tuesday
"/sdd/edimar/Desktop/doutorado/doutorado04/bases/WEIR/finance/bigcharts.marketwatch.com/LPX.html",Louisiana-Pacific posts wider quarterly loss
"/sdd/edimar/Desktop/doutorado/doutorado04/bases/WEIR/finance/bigcharts.marketwatch.com/ADSK.html","Tech Stocks: Tech stocks slip, but Nasdaq ends week higher"
"/sdd/edimar/Desktop/doutorado/doutorado04/bases/WEIR/finance/bigcharts.marketwatch.com/PZZA.html",Madison Avenue Flirts With 3D
"/sdd/edimar/Desktop/doutorado/doutorado04/bases/WEIR/finance/bigcharts.marketwatch.com/COMS.html",Cost Cutting Boosts 3Com
"/sdd/edimar/Desktop/doutorado/doutorado04/bases/WEIR/finance/bigcharts.marketwatch.com/CCU.html",Chilean ADRs dip in uncertain response to election
"/sdd/edimar/Desktop/doutorado/doutorado04/bases/WEIR/finance/bigcharts.marketwatch.com/PX.html","Earnings Watch: Updates, advisories and surprises"
"/sdd/edimar/Desktop/doutorado/doutorado04/bases/WEIR/finance/bigcharts.marketwatch.com/MBI.html","Einhorn calls AAA rating a curse, shorts Moody’s"
"/sdd/edimar/Desktop/doutorado/doutorado04/bases/WEIR/finance/bigcharts.marketwatch.com/FRE.html",Before the Close Report from the MarketWatch Radio Network
"/sdd/edimar/Desktop/doutorado/doutorado04/bases/WEIR/finance/bigcharts.marketwatch.com/NCR.html","Earnings Watch: Updates, advisories and surprises"
"/sdd/edimar/Desktop/doutorado/doutorado04/bases/WEIR/finance/bigcharts.marketwatch.com/LNC.html",Traders Take Positions In WellPoint and Aetna
"/sdd/edimar/Desktop/doutorado/doutorado04/bases/WEIR/finance/bigcharts.marketwatch.com/LUV.html",Airline stocks sink with higher oil prices
"/sdd/edimar/Desktop/doutorado/doutorado04/bases/WEIR/finance/bigcharts.marketwatch.com/HUM.html",Brain fitness moves from senior centers to the job
"/sdd/edimar/Desktop/doutorado/doutorado04/bases/WEIR/finance/bigcharts.marketwatch.com/ADP.html","Economic Report: Private sector cuts 532,000 jobs in May, ADP says"
"/sdd/edimar/Desktop/doutorado/doutorado04/bases/WEIR/finance/bigcharts.marketwatch.com/T.html",Mark Hulbert: Stocks go from roller coaster to yawner
"/sdd/edimar/Desktop/doutorado/doutorado04/bases/WEIR/finance/bigcharts.marketwatch.com/KKD.html",Krispy Kreme Strikes Deal With Lenders
"/sdd/edimar/Desktop/doutorado/doutorado04/bases/WEIR/finance/bigcharts.marketwatch.com/IP.html","Earnings Watch: Updates, advisories and surprises"
"/sdd/edimar/Desktop/doutorado/doutorado04/bases/WEIR/finance/bigcharts.marketwatch.com/FCX.html","Boeing, Caterpillar, Alcoa Pace the Dow"
"/sdd/edimar/Desktop/doutorado/doutorado04/bases/WEIR/finance/bigcharts.marketwatch.com/TKR.html","Earnings Watch: Updates, advisories and surprises"
"/sdd/edimar/Desktop/doutorado/doutorado04/bases/WEIR/finance/bigcharts.marketwatch.com/ARIA.html","Merck, Ariad team up on cancer drug"
"/sdd/edimar/Desktop/doutorado/doutorado04/bases/WEIR/finance/bigcharts.marketwatch.com/CEG.html","Earnings Watch: Updates, advisories and surprises"
"/sdd/edimar/Desktop/doutorado/doutorado04/bases/WEIR/finance/bigcharts.marketwatch.com/ASH.html",Ashland sues Oppenheimer & Co. over auction rate securities
"/sdd/edimar/Desktop/doutorado/doutorado04/bases/WEIR/finance/bigcharts.marketwatch.com/MSFT.html",Mark Hulbert: Stocks go from roller coaster to yawner
"/sdd/edimar/Desktop/doutorado/doutorado04/bases/WEIR/finance/bigcharts.marketwatch.com/KSWS.html",Movers & Shakers: Thursday's biggest gaining and declining stocks
"/sdd/edimar/Desktop/doutorado/doutorado04/bases/WEIR/finance/bigcharts.marketwatch.com/EBAY.html",Third-party business fuels Amazon's overall growth
"/sdd/edimar/Desktop/doutorado/doutorado04/bases/WEIR/finance/bigcharts.marketwatch.com/CPN.html",Stocks to Watch: Stocks in focus for Friday
"/sdd/edimar/Desktop/doutorado/doutorado04/bases/WEIR/finance/bigcharts.marketwatch.com/BNI.html",Railway Keeps Its Furloughed at Hand
"/sdd/edimar/Desktop/doutorado/doutorado04/bases/WEIR/finance/bigcharts.marketwatch.com/TIF.html",Midday report from MarketWatch Radio Network
"/sdd/edimar/Desktop/doutorado/doutorado04/bases/WEIR/finance/bigcharts.marketwatch.com/TJX.html",Closing bell report from MarketWatch Radio Network
"/sdd/edimar/Desktop/doutorado/doutorado04/bases/WEIR/finance/bigcharts.marketwatch.com/LIZ.html",Liz Fizzes; Nixed Trial Makes Medicines Go Down
"/sdd/edimar/Desktop/doutorado/doutorado04/bases/WEIR/finance/bigcharts.marketwatch.com/SBC.html",Mark Hulbert: Stocks go from roller coaster to yawner
"/sdd/edimar/Desktop/doutorado/doutorado04/bases/WEIR/finance/bigcharts.marketwatch.com/PH.html","Parker Hannifin 3Q Net Skids 79%, EPS View Cut A 3rd Time"
"/sdd/edimar/Desktop/doutorado/doutorado04/bases/WEIR/finance/bigcharts.marketwatch.com/RIG.html",Accenture to Move Base To Ireland
"/sdd/edimar/Desktop/doutorado/doutorado04/bases/WEIR/finance/bigcharts.marketwatch.com/MAT.html",Mattel fined $2.3 mln over lead paint violations
"/sdd/edimar/Desktop/doutorado/doutorado04/bases/WEIR/finance/bigcharts.marketwatch.com/BSY.html",New Subscribers Boost BSkyB
"/sdd/edimar/Desktop/doutorado/doutorado04/bases/WEIR/finance/bigcharts.marketwatch.com/XLNX.html",Court rules against Xilinx in high-profile case
"/sdd/edimar/Desktop/doutorado/doutorado04/bases/WEIR/finance/bigcharts.marketwatch.com/ETN.html","BofA, Citi, TI Slide; Sun Is a Bright Spot"
"/sdd/edimar/Desktop/doutorado/doutorado04/bases/WEIR/finance/bigcharts.marketwatch.com/TM.html",GM Pulls Plug on Hybrid Model
"/sdd/edimar/Desktop/doutorado/doutorado04/bases/WEIR/finance/bigcharts.marketwatch.com/BRCM.html","Emulex schedules annual meeting, blasts Broadcom"
"/sdd/edimar/Desktop/doutorado/doutorado04/bases/WEIR/finance/bigcharts.marketwatch.com/CAG.html",Popcorn Partner Shared the Wealth
"/sdd/edimar/Desktop/doutorado/doutorado04/bases/WEIR/finance/bigcharts.marketwatch.com/YUM.html","Money Markets And More (U.S. Markets Preview for Friday, May 29th): Is Tiffany's regaining its sparkle?"
"/sdd/edimar/Desktop/doutorado/doutorado04/bases/WEIR/finance/bigcharts.marketwatch.com/NTAP.html",Therese Poletti's Tech Tales: Deal-making and the Data Domain battle
"/sdd/edimar/Desktop/doutorado/doutorado04/bases/WEIR/finance/bigcharts.marketwatch.com/MRK.html",Marshall Loeb: 'How the Mighty Fall'
"/sdd/edimar/Desktop/doutorado/doutorado04/bases/WEIR/finance/bigcharts.marketwatch.com/MU.html",Micron to sell majority stake in Aptina Imaging
"/sdd/edimar/Desktop/doutorado/doutorado04/bases/WEIR/finance/bigcharts.marketwatch.com/HMC.html",Doing without the automotive bells and whistles
"/sdd/edimar/Desktop/doutorado/doutorado04/bases/WEIR/finance/bigcharts.marketwatch.com/BCE.html",MarketWatch First Take: It's official: private equity had a terrible year too
"/sdd/edimar/Desktop/doutorado/doutorado04/bases/WEIR/finance/bigcharts.marketwatch.com/EK.html","Kodak reports wider loss, suspends dividend"
"/sdd/edimar/Desktop/doutorado/doutorado04/bases/WEIR/finance/bigcharts.marketwatch.com/GM.html",Creditors Cry Foul at Chrysler Precedent
"/sdd/edimar/Desktop/doutorado/doutorado04/bases/WEIR/finance/bigcharts.marketwatch.com/VOD.html",Ads Tout Pre's Nimble Moves
"/sdd/edimar/Desktop/doutorado/doutorado04/bases/WEIR/finance/bigcharts.marketwatch.com/CAT.html",Stocks Wilt After Early Jump
"/sdd/edimar/Desktop/doutorado/doutorado04/bases/WEIR/finance/bigcharts.marketwatch.com/CF.html",Agrium Responds to CF's Rejection
"/sdd/edimar/Desktop/doutorado/doutorado04/bases/WEIR/finance/bigcharts.marketwatch.com/WOR.html",Stocks to Watch: Stocks in focus for Wednesday
"/sdd/edimar/Desktop/doutorado/doutorado04/bases/WEIR/finance/bigcharts.marketwatch.com/WMT.html",US Retail Stocks Fall But Saks Up On Upgrade; Best Buy Up Too
"/sdd/edimar/Desktop/doutorado/doutorado04/bases/WEIR/finance/bigcharts.marketwatch.com/BMY.html",Mead Johnson Still Has Room to Grow
"/sdd/edimar/Desktop/doutorado/doutorado04/bases/WEIR/finance/bigcharts.marketwatch.com/TYC.html",Movers & Shakers: Thursday's biggest gaining and declining stocks
"/sdd/edimar/Desktop/doutorado/doutorado04/bases/WEIR/finance/bigcharts.marketwatch.com/OMC.html",WPP Shareholders Back Bonus Plan
"/sdd/edimar/Desktop/doutorado/doutorado04/bases/WEIR/finance/bigcharts.marketwatch.com/SO.html",Power firms take body blow from slower economy
"/sdd/edimar/Desktop/doutorado/doutorado04/bases/WEIR/finance/bigcharts.marketwatch.com/MET.html","Genworth's Rise: Hope, Faith or Charity?"
"/sdd/edimar/Desktop/doutorado/doutorado04/bases/WEIR/finance/bigcharts.marketwatch.com/NSM.html",After Hours: National Semi shares extended dayside losses
"/sdd/edimar/Desktop/doutorado/doutorado04/bases/WEIR/finance/bigcharts.marketwatch.com/F.html",GM Pulls Plug on Hybrid Model
"/sdd/edimar/Desktop/doutorado/doutorado04/bases/WEIR/finance/bigcharts.marketwatch.com/VFC.html",Movers & Shakers: Wednesday's biggest rising and declining stocks
"/sdd/edimar/Desktop/doutorado/doutorado04/bases/WEIR/finance/bigcharts.marketwatch.com/HP.html",Energy Stocks: Sector turns in first week of gains in more than a month
"/sdd/edimar/Desktop/doutorado/doutorado04/bases/WEIR/finance/bigcharts.marketwatch.com/NKE.html","Nike to Cut 1,750 Jobs Globally"
"/sdd/edimar/Desktop/doutorado/doutorado04/bases/WEIR/finance/bigcharts.marketwatch.com/SLE.html","Sara Lee net income up 8%, sales dip"
"/sdd/edimar/Desktop/doutorado/doutorado04/bases/WEIR/finance/bigcharts.marketwatch.com/VMC.html","Indications: U.S. futures dip on retail data, ahead of auction"
