URL,EXTRACTED VALUE
"/sdd/edimar/Desktop/doutorado/doutorado04/bases/WEIR/finance/bigcharts.marketwatch.com/BC.html",Brunswick Replaces Existing Accounts Receivable Sale Program Under Joint Venture Agreement
"/sdd/edimar/Desktop/doutorado/doutorado04/bases/WEIR/finance/bigcharts.marketwatch.com/NUE.html",BetterInvesting Magazine Releases August Stock to Study and Undervalued Stock Choices for Investors' Informational and Educational Use
"/sdd/edimar/Desktop/doutorado/doutorado04/bases/WEIR/finance/bigcharts.marketwatch.com/KBH.html",KB Home's 2009 Second Quarter Earnings Conference Call to Be Broadcast Live on kbhome.com
"/sdd/edimar/Desktop/doutorado/doutorado04/bases/WEIR/finance/bigcharts.marketwatch.com/WHR.html",Daisy Brand(R) Cottage Cheese Invites Americans to Freshen Up Your Fridge
"/sdd/edimar/Desktop/doutorado/doutorado04/bases/WEIR/finance/bigcharts.marketwatch.com/MGM.html",MGM MIRAGE Announces Expiration of the Tender Offer for Senior Notes Maturing in 2009
"/sdd/edimar/Desktop/doutorado/doutorado04/bases/WEIR/finance/bigcharts.marketwatch.com/BK.html",The Bank of New York Mellon Jumps to Third Place in Latest HFMWeek Ranking of Single Manager Hedge Fund Administrators
"/sdd/edimar/Desktop/doutorado/doutorado04/bases/WEIR/finance/bigcharts.marketwatch.com/VRTS.html",Ocarina Networks Adds Industry Veteran to Board of Directors
"/sdd/edimar/Desktop/doutorado/doutorado04/bases/WEIR/finance/bigcharts.marketwatch.com/MYGN.html",Myriad Genetics Announces Effectiveness of Myriad Pharmaceuticals Registration Statement on Form 10
"/sdd/edimar/Desktop/doutorado/doutorado04/bases/WEIR/finance/bigcharts.marketwatch.com/AMZN.html",Battle Road Research Expands Healthcare Coverage and Launches Blog
"/sdd/edimar/Desktop/doutorado/doutorado04/bases/WEIR/finance/bigcharts.marketwatch.com/YHOO.html",Morse Appointed Chief Financial Officer of Yahoo!
"/sdd/edimar/Desktop/doutorado/doutorado04/bases/WEIR/finance/bigcharts.marketwatch.com/DAL.html","Delta: Global Recession, Rising Oil Prices Forcing Additional Changes to Business"
"/sdd/edimar/Desktop/doutorado/doutorado04/bases/WEIR/finance/bigcharts.marketwatch.com/PDLI.html",PDL BioPharma Announces Record Date for October 1 Dividend Payment
"/sdd/edimar/Desktop/doutorado/doutorado04/bases/WEIR/finance/bigcharts.marketwatch.com/BAX.html",Baxter Advances to Full-Scale Production of A/H1N1 Vaccine
"/sdd/edimar/Desktop/doutorado/doutorado04/bases/WEIR/finance/bigcharts.marketwatch.com/SBUX.html",Starbucks Voted Best Coffee by Zagat Survey
"/sdd/edimar/Desktop/doutorado/doutorado04/bases/WEIR/finance/bigcharts.marketwatch.com/HOTT.html",Girls Gone Wild Magazine Hits One-Year Mark With Big Summer Issue
"/sdd/edimar/Desktop/doutorado/doutorado04/bases/WEIR/finance/bigcharts.marketwatch.com/KR.html",Kroger to Webcast Annual Meeting of Shareholders June 25
"/sdd/edimar/Desktop/doutorado/doutorado04/bases/WEIR/finance/bigcharts.marketwatch.com/SWK.html",The Stanley Works Reports 1Q 2009 Results
"/sdd/edimar/Desktop/doutorado/doutorado04/bases/WEIR/finance/bigcharts.marketwatch.com/PEG.html",PSEG Chairman Ralph Izzo Testifies on Federal Transmission Policy
"/sdd/edimar/Desktop/doutorado/doutorado04/bases/WEIR/finance/bigcharts.marketwatch.com/CA.html",Calvert Social Index Quarterly Adjustments
"/sdd/edimar/Desktop/doutorado/doutorado04/bases/WEIR/finance/bigcharts.marketwatch.com/HON.html",Honeywell Selected as Member of SESAR
"/sdd/edimar/Desktop/doutorado/doutorado04/bases/WEIR/finance/bigcharts.marketwatch.com/DE.html",Deere Announces Ottumwa Layoffs
"/sdd/edimar/Desktop/doutorado/doutorado04/bases/WEIR/finance/bigcharts.marketwatch.com/D.html",Fitch Rates Dominion's $625MM Hybrid Notes 'BBB'; Outlook Stable
"/sdd/edimar/Desktop/doutorado/doutorado04/bases/WEIR/finance/bigcharts.marketwatch.com/ITW.html",The Executives' Club of Chicago Announces the Election of its 2009 - 2010 Board of Directors
"/sdd/edimar/Desktop/doutorado/doutorado04/bases/WEIR/finance/bigcharts.marketwatch.com/N.html","NetSuite Announces New Financial Planning Module Enabling Business Performance Management for Strategy, Planning and Execution"
"/sdd/edimar/Desktop/doutorado/doutorado04/bases/WEIR/finance/bigcharts.marketwatch.com/NEM.html",Nevada Gold Holdings Inc. Provides Overview of Nevada Exploration
"/sdd/edimar/Desktop/doutorado/doutorado04/bases/WEIR/finance/bigcharts.marketwatch.com/SNV.html",Synovus Announces Quarterly Stock Dividend
"/sdd/edimar/Desktop/doutorado/doutorado04/bases/WEIR/finance/bigcharts.marketwatch.com/RDC.html",LeTourneau Technologies and PetroVietnam Enter Contract for Newbuild Jack-up Rig Kit and Services
"/sdd/edimar/Desktop/doutorado/doutorado04/bases/WEIR/finance/bigcharts.marketwatch.com/BLL.html",New Enhanced Water Launches in Ball's 16-oz. Alumi-Tek(R) Bottles
"/sdd/edimar/Desktop/doutorado/doutorado04/bases/WEIR/finance/bigcharts.marketwatch.com/ADPT.html",Adaptec Selected for Network Products Guide 2009 Product Innovation Award
"/sdd/edimar/Desktop/doutorado/doutorado04/bases/WEIR/finance/bigcharts.marketwatch.com/NTRS.html","Keller Rohrback L.L.P. Announces Investigation of the Motorola, Inc. 401(K) Plan Regarding the Securities Lending Program in the Plan"
"/sdd/edimar/Desktop/doutorado/doutorado04/bases/WEIR/finance/bigcharts.marketwatch.com/CB.html",Chubb Board Declares Regular Quarterly Dividend
"/sdd/edimar/Desktop/doutorado/doutorado04/bases/WEIR/finance/bigcharts.marketwatch.com/AHC.html",Executive Appointments Emphasize Integrated Sales and Marketing Strategy at The Dallas Morning News
"/sdd/edimar/Desktop/doutorado/doutorado04/bases/WEIR/finance/bigcharts.marketwatch.com/RTN.html",Raytheon Miniature Air Launched Decoy Jammer Completes Design Milestone
"/sdd/edimar/Desktop/doutorado/doutorado04/bases/WEIR/finance/bigcharts.marketwatch.com/TWX.html",Time Warner Inc. to Report Second-Quarter 2009 Results
"/sdd/edimar/Desktop/doutorado/doutorado04/bases/WEIR/finance/bigcharts.marketwatch.com/CTL.html",CenturyTel and EMBARQ Announce Name and Logo of Combined Company
"/sdd/edimar/Desktop/doutorado/doutorado04/bases/WEIR/finance/bigcharts.marketwatch.com/PNC.html",PNC Executive to Participate in Conference Call Hosted by Sanford C. Bernstein
"/sdd/edimar/Desktop/doutorado/doutorado04/bases/WEIR/finance/bigcharts.marketwatch.com/CMCSK.html",Photo of Comcast's DTV Situation Room is Available on Business Wire's Web Site
"/sdd/edimar/Desktop/doutorado/doutorado04/bases/WEIR/finance/bigcharts.marketwatch.com/MCD.html",McDonald's Delivers Another Strong Month; May Global Comparable Sales Up 5.1%
"/sdd/edimar/Desktop/doutorado/doutorado04/bases/WEIR/finance/bigcharts.marketwatch.com/UTX.html",Tata Group and Sikorsky Aircraft Seal Agreement to Manufacture S-92(R) Helicopter Cabins in India
"/sdd/edimar/Desktop/doutorado/doutorado04/bases/WEIR/finance/bigcharts.marketwatch.com/PHM.html",PrivateCommunities.com Hires Top Silicon Valley SEM Experts
"/sdd/edimar/Desktop/doutorado/doutorado04/bases/WEIR/finance/bigcharts.marketwatch.com/UN.html","Unilever to Close Manufacturing Plant in Hagerstown, Maryland"
"/sdd/edimar/Desktop/doutorado/doutorado04/bases/WEIR/finance/bigcharts.marketwatch.com/APD.html",Air Products' 2009 Corporate Responsibility Report Now Available
"/sdd/edimar/Desktop/doutorado/doutorado04/bases/WEIR/finance/bigcharts.marketwatch.com/MAS.html",BEHR Paints Introduces a Colorful New Way to Paint and Prime All in One with BEHR Premium Plus Ultra(TM) Interior
"/sdd/edimar/Desktop/doutorado/doutorado04/bases/WEIR/finance/bigcharts.marketwatch.com/SGP.html",New Survey Reveals That More Than Half of Rheumatoid Arthritis Patients in Europe and Canada Feel Their Disease Controls Their Lives
"/sdd/edimar/Desktop/doutorado/doutorado04/bases/WEIR/finance/bigcharts.marketwatch.com/DOW.html",Component Changes Made to Dow Jones Islamic Market Indexes
"/sdd/edimar/Desktop/doutorado/doutorado04/bases/WEIR/finance/bigcharts.marketwatch.com/JKHY.html",Symitar Selects CGS's VirtualEvents365(SM) Platform for its 2009 Educational Conference & Technology Expo
"/sdd/edimar/Desktop/doutorado/doutorado04/bases/WEIR/finance/bigcharts.marketwatch.com/MGG.html",Greektown Casino-Hotel Increases Revenue 7.2 Percent While Detroit Gaming Market Decreases 4.2 Percent
"/sdd/edimar/Desktop/doutorado/doutorado04/bases/WEIR/finance/bigcharts.marketwatch.com/OI.html","Owens-Illinois, Inc. Announces Completion of Its Tender Offer for Its $250,000,000 7-1/2% Senior Debentures due 2010"
"/sdd/edimar/Desktop/doutorado/doutorado04/bases/WEIR/finance/bigcharts.marketwatch.com/WLP.html",HealthCore Invites Community-based Practitioners to Participate in 'Real-world' Research Network
"/sdd/edimar/Desktop/doutorado/doutorado04/bases/WEIR/finance/bigcharts.marketwatch.com/GWW.html",Grainger Reports May 2009 Sales Results
"/sdd/edimar/Desktop/doutorado/doutorado04/bases/WEIR/finance/bigcharts.marketwatch.com/NSC.html",Norfolk Southern: A Decade of Growth - And a Vision for Tomorrow
"/sdd/edimar/Desktop/doutorado/doutorado04/bases/WEIR/finance/bigcharts.marketwatch.com/TUP.html",Tupperware Brands Corporation Second Quarter 2009 Earnings Call
"/sdd/edimar/Desktop/doutorado/doutorado04/bases/WEIR/finance/bigcharts.marketwatch.com/FDX.html",NCR to Provide Customers with Faster Service Delivery Through New Inventory Management Program
"/sdd/edimar/Desktop/doutorado/doutorado04/bases/WEIR/finance/bigcharts.marketwatch.com/TMK.html",A.M. Best Revises Outlook to Negative for Torchmark Corporation and Its Operating Subsidiaries
"/sdd/edimar/Desktop/doutorado/doutorado04/bases/WEIR/finance/bigcharts.marketwatch.com/NVDA.html",Stock Alerts on Active Leaders in the News; Issued by InvestorSoup.com
"/sdd/edimar/Desktop/doutorado/doutorado04/bases/WEIR/finance/bigcharts.marketwatch.com/DD.html",DuPont North America Agricultural Seed Sales Volume Up Significantly
"/sdd/edimar/Desktop/doutorado/doutorado04/bases/WEIR/finance/bigcharts.marketwatch.com/SNDK.html","NI Technology Research Updates Outlooks for Texas Instruments, National Semiconductor, Palm, Cypress Semiconductor, and SanDisk"
"/sdd/edimar/Desktop/doutorado/doutorado04/bases/WEIR/finance/bigcharts.marketwatch.com/LEG.html","Samsung, Duracell, Hosiden and Leggett & Platt Join Wireless Power Consortium to Set Universal Standard"
"/sdd/edimar/Desktop/doutorado/doutorado04/bases/WEIR/finance/bigcharts.marketwatch.com/HGSI.html",Stock Alerts on Stocks Ready to Run; Issued by InvestorSoup.com
"/sdd/edimar/Desktop/doutorado/doutorado04/bases/WEIR/finance/bigcharts.marketwatch.com/ABT.html",Abbott Announces Launch of Next-Generation Embolic Protection System
"/sdd/edimar/Desktop/doutorado/doutorado04/bases/WEIR/finance/bigcharts.marketwatch.com/DLX.html",PartnerUp Unveils Enhanced Online Community Website
"/sdd/edimar/Desktop/doutorado/doutorado04/bases/WEIR/finance/bigcharts.marketwatch.com/CCL.html",Carnival Corporation & plc to Hold Conference Call on Second Quarter Earnings
"/sdd/edimar/Desktop/doutorado/doutorado04/bases/WEIR/finance/bigcharts.marketwatch.com/AVP.html",Video: Beauty and Fashion Brand Offers Young Women an Earning Opportunity to Make Their Entrepreneurial mark in the World
"/sdd/edimar/Desktop/doutorado/doutorado04/bases/WEIR/finance/bigcharts.marketwatch.com/MRO.html",Apache Completes Acquisition of Permian Basin Properties
"/sdd/edimar/Desktop/doutorado/doutorado04/bases/WEIR/finance/bigcharts.marketwatch.com/SPLS.html","Staples, Inc. Announces Second Quarter 2009 Cash Dividend"
"/sdd/edimar/Desktop/doutorado/doutorado04/bases/WEIR/finance/bigcharts.marketwatch.com/DISH.html","DISH Network and Fisher Communications, Inc. Reach Multi-Year Carriage Agreement"
"/sdd/edimar/Desktop/doutorado/doutorado04/bases/WEIR/finance/bigcharts.marketwatch.com/BDX.html",BD to Present at Investor Healthcare Conferences
"/sdd/edimar/Desktop/doutorado/doutorado04/bases/WEIR/finance/bigcharts.marketwatch.com/ONVI.html",EchoSign Wins Beagle Research's 2009 'CRM WizKids' Award
"/sdd/edimar/Desktop/doutorado/doutorado04/bases/WEIR/finance/bigcharts.marketwatch.com/EFX.html",Regulatory DataCorp Expands Executive Team
"/sdd/edimar/Desktop/doutorado/doutorado04/bases/WEIR/finance/bigcharts.marketwatch.com/CINF.html",Colorado Agency Appointed to Represent The Cincinnati Insurance Company
"/sdd/edimar/Desktop/doutorado/doutorado04/bases/WEIR/finance/bigcharts.marketwatch.com/GES.html",Wrapping up the Week with Stock Alerts on Friday's Market Movers; Issued by InvestorSoup.com
"/sdd/edimar/Desktop/doutorado/doutorado04/bases/WEIR/finance/bigcharts.marketwatch.com/CMS.html",Fitch Rates CMS Energy Corp.'s New Senior Notes 'BB+'
"/sdd/edimar/Desktop/doutorado/doutorado04/bases/WEIR/finance/bigcharts.marketwatch.com/CCU.html","Clear Channel Names Advertising & Marketing Veteran John Partilla as Corporate EVP and President, Global Media Sales"
"/sdd/edimar/Desktop/doutorado/doutorado04/bases/WEIR/finance/bigcharts.marketwatch.com/AVA.html",Advantage IQ CEO Stu Stiles Announces His Plans to Leave the Company
"/sdd/edimar/Desktop/doutorado/doutorado04/bases/WEIR/finance/bigcharts.marketwatch.com/LNC.html",Lincoln Financial Group Names Thomas P. O'Neill Chief Operating Officer of Lincoln Financial Distributors
"/sdd/edimar/Desktop/doutorado/doutorado04/bases/WEIR/finance/bigcharts.marketwatch.com/MIL.html",Millipore Unveils Its First Single-Use Bioreactor For Process Development
"/sdd/edimar/Desktop/doutorado/doutorado04/bases/WEIR/finance/bigcharts.marketwatch.com/DRI.html",Darden Restaurants Applauds Senate's Compromise Language on Uniform Nutrition Disclosure
"/sdd/edimar/Desktop/doutorado/doutorado04/bases/WEIR/finance/bigcharts.marketwatch.com/TXN.html","NI Technology Research Updates Outlooks for Apple, Altera, Xilinx, Qualcomm and Microchip Technology"
"/sdd/edimar/Desktop/doutorado/doutorado04/bases/WEIR/finance/bigcharts.marketwatch.com/KKD.html",Krispy Kreme Reports Operating and Net Income for the First Quarter of Fiscal 2010
"/sdd/edimar/Desktop/doutorado/doutorado04/bases/WEIR/finance/bigcharts.marketwatch.com/SWY.html",Safeway Launches Campaign to Promote Locally Grown Produce
"/sdd/edimar/Desktop/doutorado/doutorado04/bases/WEIR/finance/bigcharts.marketwatch.com/APC.html","Triple Star Lineup of Anadarko, AEP & United Power Company at Third Annual Carbon Sequestration Summit"
"/sdd/edimar/Desktop/doutorado/doutorado04/bases/WEIR/finance/bigcharts.marketwatch.com/UTSI.html",UTStarcom Announces Corporate Initiatives to Improve Financial Performance
"/sdd/edimar/Desktop/doutorado/doutorado04/bases/WEIR/finance/bigcharts.marketwatch.com/FNM.html",Fannie Mae Redemption
"/sdd/edimar/Desktop/doutorado/doutorado04/bases/WEIR/finance/bigcharts.marketwatch.com/GCI.html",USA TODAY Launches Economic Outlook Index
"/sdd/edimar/Desktop/doutorado/doutorado04/bases/WEIR/finance/bigcharts.marketwatch.com/PG.html",Stock Alerts on Wall Street's News Makers; Issued by InvestorSoup.com
"/sdd/edimar/Desktop/doutorado/doutorado04/bases/WEIR/finance/bigcharts.marketwatch.com/MEDX.html",Medarex to Present at Three Upcoming Investor Conferences
"/sdd/edimar/Desktop/doutorado/doutorado04/bases/WEIR/finance/bigcharts.marketwatch.com/TIF.html",Tiffany Devotes Store Windows to Coral Conservation
"/sdd/edimar/Desktop/doutorado/doutorado04/bases/WEIR/finance/bigcharts.marketwatch.com/LMT.html",Lockheed Martin Selected as Associate Prime to Support A-10 Modernization and Sustainment
"/sdd/edimar/Desktop/doutorado/doutorado04/bases/WEIR/finance/bigcharts.marketwatch.com/PH.html",Parker is Named Rolls-Royce Supplier of the Year for Gas Turbines
"/sdd/edimar/Desktop/doutorado/doutorado04/bases/WEIR/finance/bigcharts.marketwatch.com/HD.html",Former Home Depot Employee Sentenced to Prison for Orchestrating Vendor Kickback Scheme
"/sdd/edimar/Desktop/doutorado/doutorado04/bases/WEIR/finance/bigcharts.marketwatch.com/MAR.html",Top Marriott Owners and Franchisees Recognized for Hospitality Excellence
"/sdd/edimar/Desktop/doutorado/doutorado04/bases/WEIR/finance/bigcharts.marketwatch.com/YUM.html",A Second Colonel? KFC Launches Search for New Face of Kentucky Grilled Chicken(TM)
"/sdd/edimar/Desktop/doutorado/doutorado04/bases/WEIR/finance/bigcharts.marketwatch.com/RSH.html",Virgin Mobile USA Channels the Extrovert in You With Samsung Mantra(TM)
"/sdd/edimar/Desktop/doutorado/doutorado04/bases/WEIR/finance/bigcharts.marketwatch.com/ACV.html",Alberto Culver to Present at the William Blair & Company 29th Annual Growth Stock Conference
"/sdd/edimar/Desktop/doutorado/doutorado04/bases/WEIR/finance/bigcharts.marketwatch.com/GM.html",VIDEO from Medialink and General Motors: Largest Automotive Battery Lab in the US Opens
"/sdd/edimar/Desktop/doutorado/doutorado04/bases/WEIR/finance/bigcharts.marketwatch.com/PCG.html",PG&E Purchases More Solar Power to Serve California Customers
"/sdd/edimar/Desktop/doutorado/doutorado04/bases/WEIR/finance/bigcharts.marketwatch.com/AM.html",American Greetings to Webcast Fiscal 2010 First Quarter Conference Call
"/sdd/edimar/Desktop/doutorado/doutorado04/bases/WEIR/finance/bigcharts.marketwatch.com/CAT.html",Caterpillar Inc. Maintains Dividend Rate
"/sdd/edimar/Desktop/doutorado/doutorado04/bases/WEIR/finance/bigcharts.marketwatch.com/TLAB.html",Telmar Network Technology Introduces Executive Advisory Board
"/sdd/edimar/Desktop/doutorado/doutorado04/bases/WEIR/finance/bigcharts.marketwatch.com/CMA.html",Comerica Executive to Participate in Conference Call Hosted by Sanford C. Bernstein
"/sdd/edimar/Desktop/doutorado/doutorado04/bases/WEIR/finance/bigcharts.marketwatch.com/GD.html","Kendall Law Group, LLP Announces Investigation Into Axsys Technologies Takeover Price"
"/sdd/edimar/Desktop/doutorado/doutorado04/bases/WEIR/finance/bigcharts.marketwatch.com/TYC.html",Tyco International Announces Exchange Rate for Quarterly Dividend
"/sdd/edimar/Desktop/doutorado/doutorado04/bases/WEIR/finance/bigcharts.marketwatch.com/OMC.html",Cristina Saralegui to Receive All-Star Honor at 2009 ADCOLOR(R) Awards
"/sdd/edimar/Desktop/doutorado/doutorado04/bases/WEIR/finance/bigcharts.marketwatch.com/MET.html",A.M. Best Affirms Ratings of MetLife Auto & Home and Its Members
"/sdd/edimar/Desktop/doutorado/doutorado04/bases/WEIR/finance/bigcharts.marketwatch.com/ABX.html","Barrick Gold Corporation Second Quarter 2009 Results Release, Conference Call and Webcast"
"/sdd/edimar/Desktop/doutorado/doutorado04/bases/WEIR/finance/bigcharts.marketwatch.com/BBI.html",Summer Escape Pass From BLOCKBUSTER(R) Gives Consumers Passport to Movie & Game Values
"/sdd/edimar/Desktop/doutorado/doutorado04/bases/WEIR/finance/bigcharts.marketwatch.com/PPL.html",PPL Generation Names Chief Nuclear Officer
"/sdd/edimar/Desktop/doutorado/doutorado04/bases/WEIR/finance/bigcharts.marketwatch.com/VIA.html",American Film Institute Honors Michael Douglas at 37th AFI Life Achievement Award Gala
"/sdd/edimar/Desktop/doutorado/doutorado04/bases/WEIR/finance/bigcharts.marketwatch.com/CVX.html",SmallCapSentinel.com: Where Once There Were Riches
