URL,EXTRACTED VALUE
"/media/Dados/bases/SWDE/nbaplayer/nbaplayer-wiki/0053.htm","As a freshman, he averaged 27.1 minutes per game, 8.5"
"/media/Dados/bases/SWDE/nbaplayer/nbaplayer-wiki/0402.htm","On December 16, 2009, Casspi made his first NBA start. Scoring 22 points against the"
"/media/Dados/bases/SWDE/nbaplayer/nbaplayer-wiki/0014.htm","On April 27, 2008, West made perhaps the most clutch 3-pointer of his NBA career with 5.4 seconds left in a playoff game against the"
"/media/Dados/bases/SWDE/nbaplayer/nbaplayer-wiki/0356.htm","On February 18, 2007, Radmanović told the Lakers that he had separated his shoulder, when he fell on a patch of ice in"
"/media/Dados/bases/SWDE/nbaplayer/nbaplayer-wiki/0174.htm",in
"/media/Dados/bases/SWDE/nbaplayer/nbaplayer-wiki/0121.htm","On July 1, 2006, Posey opted to exercise his $6.4 million contract option, opting not to become a free agent."
"/media/Dados/bases/SWDE/nbaplayer/nbaplayer-wiki/0013.htm",Wafer joined the Greek
"/media/Dados/bases/SWDE/nbaplayer/nbaplayer-wiki/0131.htm","Gooden re-signed with the Cavaliers for three more years on August 14, 2006."
