URL,EXTRACTED VALUE
"/media/Dados/bases/SWDE/nbaplayer/nbaplayer-wiki/0171.htm",ESPN
"/media/Dados/bases/SWDE/nbaplayer/nbaplayer-wiki/0006.htm",Celtics sign second-round pick Luke Harangody
"/media/Dados/bases/SWDE/nbaplayer/nbaplayer-wiki/0245.htm",Xavier Henry announces he’s coming to KU
"/media/Dados/bases/SWDE/nbaplayer/nbaplayer-wiki/0140.htm",Mike Bibby Bio Page
"/media/Dados/bases/SWDE/nbaplayer/nbaplayer-wiki/0050.htm",Controlling win over Bulls pushes Raptors toward No. 2 seed
"/media/Dados/bases/SWDE/nbaplayer/nbaplayer-wiki/0038.htm",http://espn.go.com/ncb/recap?gameId=290710041
"/media/Dados/bases/SWDE/nbaplayer/nbaplayer-wiki/0214.htm","Butler returns as Wizards dodge Cavs, get back to .500"
"/media/Dados/bases/SWDE/nbaplayer/nbaplayer-wiki/0083.htm",Daniel Gibson Game Log
"/media/Dados/bases/SWDE/nbaplayer/nbaplayer-wiki/0067.htm",Forbes Helps Skyforce Scale 14ers
"/media/Dados/bases/SWDE/nbaplayer/nbaplayer-wiki/0003.htm",Celtics' Glen Davis Injured in Accident
"/media/Dados/bases/SWDE/nbaplayer/nbaplayer-wiki/0115.htm",http://m.si.com/news/sp/to_nba_sports/detail/1359439;jsessionid=5CC6B043A9543D924C8280C02C0EECB6.cnnsilive9i
"/media/Dados/bases/SWDE/nbaplayer/nbaplayer-wiki/0353.htm",Warriors Checking Ellis' Story
"/media/Dados/bases/SWDE/nbaplayer/nbaplayer-wiki/0395.htm",http://granthill.com/giving-back/national.php
"/media/Dados/bases/SWDE/nbaplayer/nbaplayer-wiki/0376.htm",NBA.com - Player Movement Central 2003
"/media/Dados/bases/SWDE/nbaplayer/nbaplayer-wiki/0104.htm",USA Men's Team Announced For FIBA Americas Championship
