URL,EXTRACTED VALUE
"/media/Dados/bases/SWDE/nbaplayer/nbaplayer-wiki/0237.htm",He declared for the
"/media/Dados/bases/SWDE/nbaplayer/nbaplayer-wiki/0050.htm","In 2004, Nocioni was a key factor when Argentina became the first South American team, as well as the first"
"/media/Dados/bases/SWDE/nbaplayer/nbaplayer-wiki/0108.htm","On June 25, 2009, Wallace was traded to the"
"/media/Dados/bases/SWDE/nbaplayer/nbaplayer-wiki/0145.htm","On March 5, 2006, he was one of 23 NBA players named to the 2006–08"
"/media/Dados/bases/SWDE/nbaplayer/nbaplayer-wiki/0017.htm","On 15 September 2010, Graham signed with the"
"/media/Dados/bases/SWDE/nbaplayer/nbaplayer-wiki/0312.htm","Internationally, Marks represented"
"/media/Dados/bases/SWDE/nbaplayer/nbaplayer-wiki/0010.htm","On April 28, 2008, Pierce was fined $25,000 by the"
"/media/Dados/bases/SWDE/nbaplayer/nbaplayer-wiki/0285.htm","On July 15th, 2010, Al Harrington signed a contract with the"
"/media/Dados/bases/SWDE/nbaplayer/nbaplayer-wiki/0323.htm",After playing only a handful of games in the
"/media/Dados/bases/SWDE/nbaplayer/nbaplayer-wiki/0231.htm","On April 28, 2009 Lee was hit in the face by"
"/media/Dados/bases/SWDE/nbaplayer/nbaplayer-wiki/0011.htm","Robinson competed in the 2007 Slam Dunk Contest to defend his 2006 title, and came in second place after"
"/media/Dados/bases/SWDE/nbaplayer/nbaplayer-wiki/0027.htm","On August 13, 2008, Smith was traded to the"
"/media/Dados/bases/SWDE/nbaplayer/nbaplayer-wiki/0379.htm",Bryant's fortunes would soon change when
"/media/Dados/bases/SWDE/nbaplayer/nbaplayer-wiki/0098.htm","On April 14, 2006, in a Bulls win over the Washington Wizards, Gordon tied the record for the most consecutive three-pointers made in a game with 9."
"/media/Dados/bases/SWDE/nbaplayer/nbaplayer-wiki/0059.htm","On 2 March 2007, the Raptors announced that Calderón was named as a Right To Play Athlete Ambassador."
"/media/Dados/bases/SWDE/nbaplayer/nbaplayer-wiki/0071.htm","In addition, former Cavaliers owner"
"/media/Dados/bases/SWDE/nbaplayer/nbaplayer-wiki/0182.htm",By the
"/media/Dados/bases/SWDE/nbaplayer/nbaplayer-wiki/0154.htm","On October 6, 2009, Bobcats picked up third-year option on Augustin's contract."
"/media/Dados/bases/SWDE/nbaplayer/nbaplayer-wiki/0165.htm","Also in 2006, an exhibition match was played in"
"/media/Dados/bases/SWDE/nbaplayer/nbaplayer-wiki/0352.htm",Curry ended his
"/media/Dados/bases/SWDE/nbaplayer/nbaplayer-wiki/0368.htm",Gomes also played in all 82 games in the 2008-2009 season in which he set a career high in points scored per game (13.3).
"/media/Dados/bases/SWDE/nbaplayer/nbaplayer-wiki/0405.htm","On January 4, 2010, Tyreke Evans was named Western Conference T-Mobile Rookie of the Month for the second straight month."
"/media/Dados/bases/SWDE/nbaplayer/nbaplayer-wiki/0277.htm","On July 13, 2009, he was traded along with"
"/media/Dados/bases/SWDE/nbaplayer/nbaplayer-wiki/0249.htm",The
"/media/Dados/bases/SWDE/nbaplayer/nbaplayer-wiki/0131.htm","Gooden re-signed with the Cavaliers for three more years on August 14, 2006."
"/media/Dados/bases/SWDE/nbaplayer/nbaplayer-wiki/0286.htm",Lawson was drafted 18th overall by the
"/media/Dados/bases/SWDE/nbaplayer/nbaplayer-wiki/0401.htm","However, Warrick is best known for his blocked shot in the"
"/media/Dados/bases/SWDE/nbaplayer/nbaplayer-wiki/0382.htm",Ebanks declared for the
"/media/Dados/bases/SWDE/nbaplayer/nbaplayer-wiki/0180.htm","On July 15, 2010, Miller signed a five year $25 million contract with the"
"/media/Dados/bases/SWDE/nbaplayer/nbaplayer-wiki/0121.htm","On July 1, 2006, Posey opted to exercise his $6.4 million contract option, opting not to become a free agent."
"/media/Dados/bases/SWDE/nbaplayer/nbaplayer-wiki/0259.htm",Mensah-Bonsu was part of the
"/media/Dados/bases/SWDE/nbaplayer/nbaplayer-wiki/0176.htm","On July 12, 2005, Ilgauskas signed a contract extension with the Cavaliers. The deal was reportedly worth over $55 million over 5 years."
"/media/Dados/bases/SWDE/nbaplayer/nbaplayer-wiki/0124.htm","Stephenson received his ""Born Ready"" nickname from"
"/media/Dados/bases/SWDE/nbaplayer/nbaplayer-wiki/0224.htm","Jason Terry and his wife, Johnyika, have four daughters; Jasionna, Jalayah, Jaida and Jasa Azuré."
"/media/Dados/bases/SWDE/nbaplayer/nbaplayer-wiki/0302.htm","On July 20, 2009, Telfair was traded to the"
"/media/Dados/bases/SWDE/nbaplayer/nbaplayer-wiki/0147.htm","His baby boy was born on May 18, 2010."
"/media/Dados/bases/SWDE/nbaplayer/nbaplayer-wiki/0095.htm","Williams was a free agent in summer 2007, but decided to stay with the Bucks by signing a six-year, $52 million deal."
"/media/Dados/bases/SWDE/nbaplayer/nbaplayer-wiki/0156.htm",When Lakers center
"/media/Dados/bases/SWDE/nbaplayer/nbaplayer-wiki/0252.htm","Ariza's father, Kenny McClary, played at the"
"/media/Dados/bases/SWDE/nbaplayer/nbaplayer-wiki/0005.htm",In the
"/media/Dados/bases/SWDE/nbaplayer/nbaplayer-wiki/0157.htm",Carroll also ranks as Notre Dame's second all-time leader in three-point field goals made (301) behind
"/media/Dados/bases/SWDE/nbaplayer/nbaplayer-wiki/0376.htm","On November 14, 2008, Barnes was suspended for two games without pay for his role in a fight after a non-call foul on"
"/media/Dados/bases/SWDE/nbaplayer/nbaplayer-wiki/0370.htm",Griffin finished the 2008–09 season with a
"/media/Dados/bases/SWDE/nbaplayer/nbaplayer-wiki/0104.htm",In the
"/media/Dados/bases/SWDE/nbaplayer/nbaplayer-wiki/0380.htm","On January 13, 2008, he suffered an injury during a game against the"
"/media/Dados/bases/SWDE/nbaplayer/nbaplayer-wiki/0321.htm",After the decision by the owners of the team to relocate to
"/media/Dados/bases/SWDE/nbaplayer/nbaplayer-wiki/0414.htm","On January 29, 2008, Powe had a breakout performance that took place in"
"/media/Dados/bases/SWDE/nbaplayer/nbaplayer-wiki/0189.htm",During the
"/media/Dados/bases/SWDE/nbaplayer/nbaplayer-wiki/0128.htm","On August 18, 2009, Raptors signed and traded Delfino to"
"/media/Dados/bases/SWDE/nbaplayer/nbaplayer-wiki/0063.htm",Evans was put in as the starting
"/media/Dados/bases/SWDE/nbaplayer/nbaplayer-wiki/0014.htm","On April 27, 2008, West made perhaps the most clutch 3-pointer of his NBA career with 5.4 seconds left in a playoff game against the"
"/media/Dados/bases/SWDE/nbaplayer/nbaplayer-wiki/0107.htm","In June 2009, Villanueva signed a five year contract with the Pistons worth $35 million."
"/media/Dados/bases/SWDE/nbaplayer/nbaplayer-wiki/0197.htm",Arenas had a career year during the
"/media/Dados/bases/SWDE/nbaplayer/nbaplayer-wiki/0173.htm","On July 12, 2010, Haslem re-signed with the Heat. He would have received nearly 10 million more if he were to sign with the"
"/media/Dados/bases/SWDE/nbaplayer/nbaplayer-wiki/0356.htm","On February 18, 2007, Radmanović told the Lakers that he had separated his shoulder, when he fell on a patch of ice in"
"/media/Dados/bases/SWDE/nbaplayer/nbaplayer-wiki/0203.htm",In the
"/media/Dados/bases/SWDE/nbaplayer/nbaplayer-wiki/0057.htm",Bargnani's form and numbers continued in the
"/media/Dados/bases/SWDE/nbaplayer/nbaplayer-wiki/0353.htm",", one of the eight other players to achieve the feat; the other guards to perform this feat were"
"/media/Dados/bases/SWDE/nbaplayer/nbaplayer-wiki/0234.htm","In February 2002, he was traded by the Bulls with"
"/media/Dados/bases/SWDE/nbaplayer/nbaplayer-wiki/0300.htm","On February 17, 2010, Milicic was traded to the"
"/media/Dados/bases/SWDE/nbaplayer/nbaplayer-wiki/0267.htm","On June 21, 2006, Bonner was traded with"
"/media/Dados/bases/SWDE/nbaplayer/nbaplayer-wiki/0299.htm","In a press conference on April 17, 2008, Love announced his intention to leave UCLA to enter the"
"/media/Dados/bases/SWDE/nbaplayer/nbaplayer-wiki/0051.htm","On June 23, 2009, he was traded to the"
"/media/Dados/bases/SWDE/nbaplayer/nbaplayer-wiki/0248.htm","Thabeet is the son of Thabit Manka and Rukia Manka. His mother, Rukia, resides in Dar es Salaam. He has one sister, Sham, and one brother, Akbar."
"/media/Dados/bases/SWDE/nbaplayer/nbaplayer-wiki/0023.htm",With
"/media/Dados/bases/SWDE/nbaplayer/nbaplayer-wiki/0238.htm","In Yao's first game in Miami on December 16, 2002, the"
"/media/Dados/bases/SWDE/nbaplayer/nbaplayer-wiki/0065.htm",Kleiza has also played with the senior
"/media/Dados/bases/SWDE/nbaplayer/nbaplayer-wiki/0271.htm","On June 26, 2008 Jefferson was traded to the"
"/media/Dados/bases/SWDE/nbaplayer/nbaplayer-wiki/0192.htm",Duhon played a key role in the Bulls winning their first playoff series since the
"/media/Dados/bases/SWDE/nbaplayer/nbaplayer-wiki/0188.htm","During the 2008 Sprite Slam Dunk Contest, Nelson assisted"
"/media/Dados/bases/SWDE/nbaplayer/nbaplayer-wiki/0045.htm","On June 17, 2010 he was traded along with"
"/media/Dados/bases/SWDE/nbaplayer/nbaplayer-wiki/0085.htm",freshman
"/media/Dados/bases/SWDE/nbaplayer/nbaplayer-wiki/0199.htm","On September 24, 2010, Blatche received a contract extension that will pay him $35M over the next five years."
"/media/Dados/bases/SWDE/nbaplayer/nbaplayer-wiki/0053.htm","As a freshman, he averaged 27.1 minutes per game, 8.5"
"/media/Dados/bases/SWDE/nbaplayer/nbaplayer-wiki/0093.htm","In his rookie season, Varejão played in 54 games and averaged 4.9 points and 4.8 rebounds in 16 minutes played per game."
"/media/Dados/bases/SWDE/nbaplayer/nbaplayer-wiki/0257.htm",Mbenga speaks five languages:
"/media/Dados/bases/SWDE/nbaplayer/nbaplayer-wiki/0343.htm","Last updated: May 19, 2009."
"/media/Dados/bases/SWDE/nbaplayer/nbaplayer-wiki/0031.htm","Curry's ex-girlfriend, Nova Henry, and their nine-month-old daughter Ava were found murdered in"
"/media/Dados/bases/SWDE/nbaplayer/nbaplayer-wiki/0268.htm",In the
"/media/Dados/bases/SWDE/nbaplayer/nbaplayer-wiki/0030.htm","Wilson Chandler scored 22 points in a season opening win for the Knicks on October 27, 2010."
"/media/Dados/bases/SWDE/nbaplayer/nbaplayer-wiki/0365.htm","On July 9th, 2010, Cook was signed by the Los Angeles Clippers."
"/media/Dados/bases/SWDE/nbaplayer/nbaplayer-wiki/0243.htm",was traded to the
"/media/Dados/bases/SWDE/nbaplayer/nbaplayer-wiki/0408.htm",game for the first time in school history but lost to
"/media/Dados/bases/SWDE/nbaplayer/nbaplayer-wiki/0260.htm",The
"/media/Dados/bases/SWDE/nbaplayer/nbaplayer-wiki/0266.htm",In the
"/media/Dados/bases/SWDE/nbaplayer/nbaplayer-wiki/0032.htm",He earned ACC All-Defensive Team honors again and was selected to the All-ACC First Team.
"/media/Dados/bases/SWDE/nbaplayer/nbaplayer-wiki/0388.htm","In December 2008, a woman named Stacy Elizabeth Beshear"
"/media/Dados/bases/SWDE/nbaplayer/nbaplayer-wiki/0208.htm","On October 31, 2008, Thornton had a double-double with 30 points and 11 rebounds, a season high."
"/media/Dados/bases/SWDE/nbaplayer/nbaplayer-wiki/0233.htm",", 4.5"
"/media/Dados/bases/SWDE/nbaplayer/nbaplayer-wiki/0397.htm","After graduating with a degree in sociology,"
"/media/Dados/bases/SWDE/nbaplayer/nbaplayer-wiki/0177.htm","In June 2008, James donated $20,000 to a committee to elect"
"/media/Dados/bases/SWDE/nbaplayer/nbaplayer-wiki/0407.htm","On January 10, 2009, Greene was assigned to the"
"/media/Dados/bases/SWDE/nbaplayer/nbaplayer-wiki/0160.htm","On January 16, 2009, he was traded to the"
"/media/Dados/bases/SWDE/nbaplayer/nbaplayer-wiki/0019.htm","Humphries was on the 2002 U.S. Junior World Championship Qualifying Tournament Team, alongside future Raptors' teammate"
"/media/Dados/bases/SWDE/nbaplayer/nbaplayer-wiki/0099.htm","On May 13, 2008, Hamilton surpassed"
"/media/Dados/bases/SWDE/nbaplayer/nbaplayer-wiki/0221.htm","For the 2007–08 season, Novak began playing with the"
"/media/Dados/bases/SWDE/nbaplayer/nbaplayer-wiki/0253.htm","On November 20, 2010, Banks was traded to the New Orleans Hornets with"
"/media/Dados/bases/SWDE/nbaplayer/nbaplayer-wiki/0202.htm","In his second year, Hinrich's"
"/media/Dados/bases/SWDE/nbaplayer/nbaplayer-wiki/0170.htm",Prior to the
"/media/Dados/bases/SWDE/nbaplayer/nbaplayer-wiki/0214.htm","Butler is known offensively for his face up line drive jumper, as well as his athleticism and ability to finish around the rim."
"/media/Dados/bases/SWDE/nbaplayer/nbaplayer-wiki/0015.htm",With the departure of
"/media/Dados/bases/SWDE/nbaplayer/nbaplayer-wiki/0402.htm","On December 16, 2009, Casspi made his first NBA start. Scoring 22 points against the"
"/media/Dados/bases/SWDE/nbaplayer/nbaplayer-wiki/0161.htm",Following the
"/media/Dados/bases/SWDE/nbaplayer/nbaplayer-wiki/0088.htm","On February 17, 2010, Jamison was traded to the"
"/media/Dados/bases/SWDE/nbaplayer/nbaplayer-wiki/0398.htm","On December 10, 2008, Richardson was traded along with"
"/media/Dados/bases/SWDE/nbaplayer/nbaplayer-wiki/0120.htm","On March 22, 2007 McRoberts declared himself eligible for the"
"/media/Dados/bases/SWDE/nbaplayer/nbaplayer-wiki/0245.htm","Henry scored 27 points in his first college game, breaking the record for most points scored by a Jayhawk in a debut game as a freshman."
"/media/Dados/bases/SWDE/nbaplayer/nbaplayer-wiki/0105.htm",He also played in the 2009 Rookie Challenge contest with the sophomore team during All-Star weekend.
"/media/Dados/bases/SWDE/nbaplayer/nbaplayer-wiki/0410.htm","On March 17, 2009 at 4:00 AM Carl Landry was involved in an incident in"
"/media/Dados/bases/SWDE/nbaplayer/nbaplayer-wiki/0318.htm",Roy started in the first 48 games of the
"/media/Dados/bases/SWDE/nbaplayer/nbaplayer-wiki/0167.htm",Since the departure of
"/media/Dados/bases/SWDE/nbaplayer/nbaplayer-wiki/0012.htm",In his
"/media/Dados/bases/SWDE/nbaplayer/nbaplayer-wiki/0083.htm",His first start in the playoffs came in the third game of the
"/media/Dados/bases/SWDE/nbaplayer/nbaplayer-wiki/0186.htm",'s record of four from
"/media/Dados/bases/SWDE/nbaplayer/nbaplayer-wiki/0378.htm","On February 7, 2009, Brown was traded, along with"
"/media/Dados/bases/SWDE/nbaplayer/nbaplayer-wiki/0175.htm",In the final days before his senior season decision regarding his
"/media/Dados/bases/SWDE/nbaplayer/nbaplayer-wiki/0069.htm",Rose accepted a scholarship to play for the
"/media/Dados/bases/SWDE/nbaplayer/nbaplayer-wiki/0375.htm",The brawl began when Artest
"/media/Dados/bases/SWDE/nbaplayer/nbaplayer-wiki/0003.htm","In the summer of 2001, at only 15 years of age, Davis attended a basketball camp run by"
"/media/Dados/bases/SWDE/nbaplayer/nbaplayer-wiki/0008.htm",In O'Neal's
"/media/Dados/bases/SWDE/nbaplayer/nbaplayer-wiki/0196.htm",in the
"/media/Dados/bases/SWDE/nbaplayer/nbaplayer-wiki/0002.htm","on his lower right arm, and"
"/media/Dados/bases/SWDE/nbaplayer/nbaplayer-wiki/0144.htm","During his 2007–2008 rookie season, Horford was honored as Rookie of the Month on four separate occasions: November, February, March and April."
"/media/Dados/bases/SWDE/nbaplayer/nbaplayer-wiki/0369.htm","Gordon's announcement gave Indiana a very strong 2007 recruiting class, ranked by some analysts as the third-best incoming class in the country."
"/media/Dados/bases/SWDE/nbaplayer/nbaplayer-wiki/0174.htm",in
"/media/Dados/bases/SWDE/nbaplayer/nbaplayer-wiki/0235.htm",As a member of the senior
"/media/Dados/bases/SWDE/nbaplayer/nbaplayer-wiki/0007.htm","When O'Neal arrived at his new club, new coach"
"/media/Dados/bases/SWDE/nbaplayer/nbaplayer-wiki/0135.htm",Mbah a Moute also plays for the
"/media/Dados/bases/SWDE/nbaplayer/nbaplayer-wiki/0216.htm","On July 28, 2009, he was traded to the"
"/media/Dados/bases/SWDE/nbaplayer/nbaplayer-wiki/0287.htm","Believing injuries were behind him, Kenyon and the Nuggets were crushed to learn the swelling now occurring in his"
"/media/Dados/bases/SWDE/nbaplayer/nbaplayer-wiki/0102.htm",In the
"/media/Dados/bases/SWDE/nbaplayer/nbaplayer-wiki/0184.htm","On March 10, 2006, in an ACC Tournament quarterfinal against"
"/media/Dados/bases/SWDE/nbaplayer/nbaplayer-wiki/0215.htm",He spent the rest of the 2002–03 season playing in the
"/media/Dados/bases/SWDE/nbaplayer/nbaplayer-wiki/0013.htm",Wafer joined the Greek
"/media/Dados/bases/SWDE/nbaplayer/nbaplayer-wiki/0281.htm",During a game three playoff game against the
"/media/Dados/bases/SWDE/nbaplayer/nbaplayer-wiki/0133.htm",Jennings was selected tenth overall by the
"/media/Dados/bases/SWDE/nbaplayer/nbaplayer-wiki/0261.htm","Paul finished the 2005–06 season averaging 16.1 points, 7.8 assists, and 5.1 rebounds. He was also the only unanimous selection to the"
"/media/Dados/bases/SWDE/nbaplayer/nbaplayer-wiki/0209.htm","On April 7, 2010, Wall announced that he would forgo his final three seasons of collegiate eligibility and enter the"
"/media/Dados/bases/SWDE/nbaplayer/nbaplayer-wiki/0049.htm","On April 7, 2009, Meeks declared his eligibility for the"
"/media/Dados/bases/SWDE/nbaplayer/nbaplayer-wiki/0316.htm","To begin his Trail Blazers career, Oden chose the uniform number 52. On July 1, before his first NBA practice, Oden was signed to a"
"/media/Dados/bases/SWDE/nbaplayer/nbaplayer-wiki/0269.htm","After some initial issues with San Antonio over his contract, Ginóbili re-signed with the Spurs and started every game during the"
"/media/Dados/bases/SWDE/nbaplayer/nbaplayer-wiki/0166.htm",Thomas is known for his extensive
"/media/Dados/bases/SWDE/nbaplayer/nbaplayer-wiki/0366.htm",", then television analyst, called Davis' performance in the"
"/media/Dados/bases/SWDE/nbaplayer/nbaplayer-wiki/0334.htm",One of the most notable incidents of Bell's career occurred in the
"/media/Dados/bases/SWDE/nbaplayer/nbaplayer-wiki/0112.htm","Elsewhere, Ford is mentioned by"
"/media/Dados/bases/SWDE/nbaplayer/nbaplayer-wiki/0341.htm","Miles has seen limited playing time in his first 3 seasons with the Jazz, occasionally being sent down to the"
"/media/Dados/bases/SWDE/nbaplayer/nbaplayer-wiki/0067.htm","On July 31, 2009, he was traded along with"
"/media/Dados/bases/SWDE/nbaplayer/nbaplayer-wiki/0346.htm",The
"/media/Dados/bases/SWDE/nbaplayer/nbaplayer-wiki/0371.htm","Due to injuries among the Clippers' low post players, Jordan was pushed into the starting lineup for the January 19 game against the"
"/media/Dados/bases/SWDE/nbaplayer/nbaplayer-wiki/0274.htm",During the
"/media/Dados/bases/SWDE/nbaplayer/nbaplayer-wiki/0075.htm",Though Noah could be eligible for international competitions such as the
"/media/Dados/bases/SWDE/nbaplayer/nbaplayer-wiki/0385.htm",In his first year with the Los Angeles Lakers incurred a left shoulder injury which forced him to miss the end of the
"/media/Dados/bases/SWDE/nbaplayer/nbaplayer-wiki/0006.htm","After the season, Harangody was named the conference"
"/media/Dados/bases/SWDE/nbaplayer/nbaplayer-wiki/0251.htm",Andersen also played for Australia in the
"/media/Dados/bases/SWDE/nbaplayer/nbaplayer-wiki/0284.htm","In the summer of 2007, Gary played for Panamanian National Team in the"
"/media/Dados/bases/SWDE/nbaplayer/nbaplayer-wiki/0162.htm","On June 16, 2008, doctors allowed Livingston to resume basketball activities"
"/media/Dados/bases/SWDE/nbaplayer/nbaplayer-wiki/0279.htm","On February 13, 2004, Anthony participated in the"
"/media/Dados/bases/SWDE/nbaplayer/nbaplayer-wiki/0340.htm",player due to his contributions to many statistics.
"/media/Dados/bases/SWDE/nbaplayer/nbaplayer-wiki/0039.htm",During the
"/media/Dados/bases/SWDE/nbaplayer/nbaplayer-wiki/0179.htm",Magloire signed with the
"/media/Dados/bases/SWDE/nbaplayer/nbaplayer-wiki/0151.htm",Thomas actively supported
"/media/Dados/bases/SWDE/nbaplayer/nbaplayer-wiki/0395.htm",Much like
"/media/Dados/bases/SWDE/nbaplayer/nbaplayer-wiki/0330.htm","On July 13, 2007, the"
"/media/Dados/bases/SWDE/nbaplayer/nbaplayer-wiki/0171.htm",Chalmers helped his team win the
"/media/Dados/bases/SWDE/nbaplayer/nbaplayer-wiki/0000.htm","On January 12, 2007, Allen scored a career-high 54 points against the"
"/media/Dados/bases/SWDE/nbaplayer/nbaplayer-wiki/0419.htm",He averaged 10.4 points and 5.1 rebounds per game in seven games in the Russian Super League
"/media/Dados/bases/SWDE/nbaplayer/nbaplayer-wiki/0225.htm","On June 28, 2006, Battier was traded by the Grizzlies to the"
"/media/Dados/bases/SWDE/nbaplayer/nbaplayer-wiki/0282.htm","On August 14, 2009 the Nuggets again resigned Carter to a one-year contract for $1.3 million."
"/media/Dados/bases/SWDE/nbaplayer/nbaplayer-wiki/0307.htm","Batum scored a career-high 31 points along with 7 rebounds, 7 assists, and 3 steals on February 27, 2010, against the"
"/media/Dados/bases/SWDE/nbaplayer/nbaplayer-wiki/0377.htm",The
"/media/Dados/bases/SWDE/nbaplayer/nbaplayer-wiki/0218.htm",". However, New Jersey's season would end without an improbable NBA crown, as Kidd and the Nets were swept in four games by"
"/media/Dados/bases/SWDE/nbaplayer/nbaplayer-wiki/0290.htm","On July 14, 2010, he signed a one year contract with the"
"/media/Dados/bases/SWDE/nbaplayer/nbaplayer-wiki/0308.htm","Camby has led the NBA in blocked shots for several seasons; however, frequent injuries have limited the impact of his career in the NBA. The"
"/media/Dados/bases/SWDE/nbaplayer/nbaplayer-wiki/0115.htm","In the 2008–2009 season, he scored a career high 42 points against the"
"/media/Dados/bases/SWDE/nbaplayer/nbaplayer-wiki/0338.htm","When Hayward first emerged as a star at the World U-19s, and"
"/media/Dados/bases/SWDE/nbaplayer/nbaplayer-wiki/0387.htm",In Game 6 of the
"/media/Dados/bases/SWDE/nbaplayer/nbaplayer-wiki/0298.htm",Koufos was selected by the
"/media/Dados/bases/SWDE/nbaplayer/nbaplayer-wiki/0335.htm","On February 21, 2008, Elson was traded by the"
"/media/Dados/bases/SWDE/nbaplayer/nbaplayer-wiki/0040.htm","The Lakers, on July 18, decided not to match the Warriors' offer and the deal was finalized."
"/media/Dados/bases/SWDE/nbaplayer/nbaplayer-wiki/0291.htm",on April 11 at the Los Angeles Athletic Club.
"/media/Dados/bases/SWDE/nbaplayer/nbaplayer-wiki/0339.htm","After landing in Minnesota, Jefferson quickly signed a large contract extension before the season."
"/media/Dados/bases/SWDE/nbaplayer/nbaplayer-wiki/0213.htm","Following the conclusion of his NCAA career he was described as a gifted rebounder for his size, a good passer, and a flexible shooter by scouts."
"/media/Dados/bases/SWDE/nbaplayer/nbaplayer-wiki/0372.htm","In January 2008, Kaman revealed that he was misdiagnosed with"
"/media/Dados/bases/SWDE/nbaplayer/nbaplayer-wiki/0148.htm","On February 2, 2010, against the"
"/media/Dados/bases/SWDE/nbaplayer/nbaplayer-wiki/0204.htm",Martin was invited to Wizards training camp for the 2010-11 season.
"/media/Dados/bases/SWDE/nbaplayer/nbaplayer-wiki/0222.htm","However, Pitino's plan was foiled by Nelson, whose team had the sixth pick. Nelson worked out draft day deals with the"
"/media/Dados/bases/SWDE/nbaplayer/nbaplayer-wiki/0351.htm","On July 9, 2008, Rodney Carney,"
"/media/Dados/bases/SWDE/nbaplayer/nbaplayer-wiki/0303.htm","In the 2010 off-season, Tolliver joined the"
"/media/Dados/bases/SWDE/nbaplayer/nbaplayer-wiki/0250.htm",and
"/media/Dados/bases/SWDE/nbaplayer/nbaplayer-wiki/0158.htm","In his second season with the Jayhawks, Collins won the 2008 Big 12 Sixth Man Award."
"/media/Dados/bases/SWDE/nbaplayer/nbaplayer-wiki/0018.htm",Harris showed marked improvement in the early stages of the
"/media/Dados/bases/SWDE/nbaplayer/nbaplayer-wiki/0035.htm",In his first
"/media/Dados/bases/SWDE/nbaplayer/nbaplayer-wiki/0210.htm","On November 9, Yi played against Yao for the first time when the"
"/media/Dados/bases/SWDE/nbaplayer/nbaplayer-wiki/0125.htm","Due to his long term injury, Bogut missed out playing with the"
"/media/Dados/bases/SWDE/nbaplayer/nbaplayer-wiki/0169.htm","Initially, with Pistons coach"
"/media/Dados/bases/SWDE/nbaplayer/nbaplayer-wiki/0384.htm","On December 24, 2009 Gasol signed a 3-year extension with the Lakers worth $64.7 million."
"/media/Dados/bases/SWDE/nbaplayer/nbaplayer-wiki/0066.htm","During the 2006 offseason, he re-signed with the Pacers, only to be traded to the then-"
"/media/Dados/bases/SWDE/nbaplayer/nbaplayer-wiki/0315.htm","The Gaels were nationally ranked for most of the season, ultimately finishing second in WCC regular-season play to"
"/media/Dados/bases/SWDE/nbaplayer/nbaplayer-wiki/0355.htm",and one of 11 finalists for the
"/media/Dados/bases/SWDE/nbaplayer/nbaplayer-wiki/0332.htm","On March 2, 2009 Westbrook recorded a triple double with 17 points, 10 rebounds and 10 assists. He was the first rookie to do so since"
"/media/Dados/bases/SWDE/nbaplayer/nbaplayer-wiki/0220.htm","On February 13, 2009, Marion was traded to the"
"/media/Dados/bases/SWDE/nbaplayer/nbaplayer-wiki/0289.htm","On February 10, 2009, Smith was chosen to replace the injured"
"/media/Dados/bases/SWDE/nbaplayer/nbaplayer-wiki/0280.htm","On July 28, 2008, Balkman was traded to the"
"/media/Dados/bases/SWDE/nbaplayer/nbaplayer-wiki/0270.htm","On July 14, 2008, in his first summer league game as a Spur, George Hill scored 17 points and grabbed 8 rebounds while holding fellow draft pick"
"/media/Dados/bases/SWDE/nbaplayer/nbaplayer-wiki/0090.htm",In the
"/media/Dados/bases/SWDE/nbaplayer/nbaplayer-wiki/0354.htm","On February 11, Lee was chosen to replace"
