URL,EXTRACTED VALUE
"/media/Dados/bases/SWDE/nbaplayer/nbaplayer-wiki/0186.htm",", 8.1 blocks and 3.5"
"/media/Dados/bases/SWDE/nbaplayer/nbaplayer-wiki/0016.htm",where he scored a game-high 21 points and was named
"/media/Dados/bases/SWDE/nbaplayer/nbaplayer-wiki/0202.htm","On July 8, 2010, Hinrich was traded to the Washington Wizards."
"/media/Dados/bases/SWDE/nbaplayer/nbaplayer-wiki/0037.htm",", 1.2 assists, 1.13 steals, and 2.26"
"/media/Dados/bases/SWDE/nbaplayer/nbaplayer-wiki/0115.htm",and then transferred to
"/media/Dados/bases/SWDE/nbaplayer/nbaplayer-wiki/0100.htm",in the face. Both players were suspended one regular season game for an ensuing fight.
"/media/Dados/bases/SWDE/nbaplayer/nbaplayer-wiki/0012.htm",which earned him a spot on the All-State honors and was named the 7th Region Player of the Year. He transferred to Virginia's
