URL,EXTRACTED VALUE
"/media/Dados/bases/SWDE/nbaplayer/nbaplayer-wiki/0385.htm",in the off-season. The Clippers declined to match the Heat's offer for Odom after matching another offer Miami made to
"/media/Dados/bases/SWDE/nbaplayer/nbaplayer-wiki/0379.htm",Bryant was the runner-up for the
"/media/Dados/bases/SWDE/nbaplayer/nbaplayer-wiki/0041.htm","affiliate, the"
"/media/Dados/bases/SWDE/nbaplayer/nbaplayer-wiki/0400.htm",", the Magic reached the"
"/media/Dados/bases/SWDE/nbaplayer/nbaplayer-wiki/0215.htm",by the
"/media/Dados/bases/SWDE/nbaplayer/nbaplayer-wiki/0397.htm",". At that time, it had been five years since the Broncos appeared in the NCAA tournament. That changed when Nash led the Broncos to a"
"/media/Dados/bases/SWDE/nbaplayer/nbaplayer-wiki/0238.htm","and was subsequently banned from playing for China,"
