URL,EXTRACTED VALUE
"/media/Dados/bases/SWDE/nbaplayer/nbaplayer-wiki/0269.htm",The Spurs then entered
"/media/Dados/bases/SWDE/nbaplayer/nbaplayer-wiki/0175.htm","On December 12, 2008, he was signed by the"
"/media/Dados/bases/SWDE/nbaplayer/nbaplayer-wiki/0222.htm",and outplayed future US NBA stars
"/media/Dados/bases/SWDE/nbaplayer/nbaplayer-wiki/0170.htm","made serious attempts, but it was"
"/media/Dados/bases/SWDE/nbaplayer/nbaplayer-wiki/0238.htm","Barkley made good on his bet by kissing the buttock of a donkey purchased by Smith for the occasion (Smith's ""ass"")."
