URL,EXTRACTED VALUE
"/media/Dados/bases/SWDE/nbaplayer/nbaplayer-wiki/0106.htm",", Summers was a starting"
"/media/Dados/bases/SWDE/nbaplayer/nbaplayer-wiki/0015.htm",", a"
"/media/Dados/bases/SWDE/nbaplayer/nbaplayer-wiki/0037.htm",for his junior year.
"/media/Dados/bases/SWDE/nbaplayer/nbaplayer-wiki/0355.htm","After graduating from Harvard University, Lin went undrafted in the"
"/media/Dados/bases/SWDE/nbaplayer/nbaplayer-wiki/0140.htm",. He is the son of former NBA player
"/media/Dados/bases/SWDE/nbaplayer/nbaplayer-wiki/0008.htm",and later leading his team to the
"/media/Dados/bases/SWDE/nbaplayer/nbaplayer-wiki/0323.htm","for his senior year, during which he grew two more inches."
"/media/Dados/bases/SWDE/nbaplayer/nbaplayer-wiki/0154.htm",". While at Brother Martin, Augustin led the team to two state championships."
"/media/Dados/bases/SWDE/nbaplayer/nbaplayer-wiki/0206.htm",". He did not play basketball until he was in high school, instead playing soccer when he was younger."
