URL,EXTRACTED VALUE
"/media/Dados/bases/SWDE/nbaplayer/nbaplayer-wiki/0186.htm","Following his high school successes, Howard chose to forego college and declared for the"
"/media/Dados/bases/SWDE/nbaplayer/nbaplayer-wiki/0041.htm","(born October 9, 1987 in"
"/media/Dados/bases/SWDE/nbaplayer/nbaplayer-wiki/0112.htm","In his first season at Texas, Ford not only led the team in"
"/media/Dados/bases/SWDE/nbaplayer/nbaplayer-wiki/0404.htm","(born May 10, 1981) is a"
"/media/Dados/bases/SWDE/nbaplayer/nbaplayer-wiki/0359.htm","Wright has two younger brothers, Brian and Trevor."
