URL,EXTRACTED VALUE
"/media/Dados/bases/SWDE/nbaplayer/nbaplayer-wiki/0389.htm",Heat continue run with 10th win in 11 games
"/media/Dados/bases/SWDE/nbaplayer/nbaplayer-wiki/0066.htm",Career Leaders and Records for 3-Pt Field Goals
"/media/Dados/bases/SWDE/nbaplayer/nbaplayer-wiki/0405.htm",http://www.nba.com/kings/news/goal_accomplished_2010_04_12.html
"/media/Dados/bases/SWDE/nbaplayer/nbaplayer-wiki/0246.htm",O.J. cleared to play
"/media/Dados/bases/SWDE/nbaplayer/nbaplayer-wiki/0300.htm",Darko Milicic angry and vulgar outburst video (English subtitle)
"/media/Dados/bases/SWDE/nbaplayer/nbaplayer-wiki/0277.htm",Arron Afflalo Career Stats Page
