URL,EXTRACTED VALUE
"/media/Dados/bases/SWDE/nbaplayer/nbaplayer-wiki/0279.htm","Due to his struggles with the ACT, his family and friends wondered whether Anthony would forget about college and move on to the NBA."
"/media/Dados/bases/SWDE/nbaplayer/nbaplayer-wiki/0186.htm","However, the Magic were swept by the eventual Eastern Conference finalist"
"/media/Dados/bases/SWDE/nbaplayer/nbaplayer-wiki/0385.htm",". Odom and his wife,"
"/media/Dados/bases/SWDE/nbaplayer/nbaplayer-wiki/0189.htm",NBA All-Star Team starting lineup several times through fan balloting.
"/media/Dados/bases/SWDE/nbaplayer/nbaplayer-wiki/0218.htm",He became the second player in NBA history to average a triple-double for an entire postseason.
"/media/Dados/bases/SWDE/nbaplayer/nbaplayer-wiki/0088.htm","In his second game with the Cavaliers, Jamison scored 19 points against the"
"/media/Dados/bases/SWDE/nbaplayer/nbaplayer-wiki/0108.htm","On November 25, 2008, Wallace grabbed his 9,000th career rebound and blocked his 1,900th career shot."
"/media/Dados/bases/SWDE/nbaplayer/nbaplayer-wiki/0090.htm",by the end of the regular season.
