URL,EXTRACTED VALUE
"/media/Dados/bases/SWDE/nbaplayer/nbaplayer-wiki/0118.htm",Boston Celtics
"/media/Dados/bases/SWDE/nbaplayer/nbaplayer-wiki/0207.htm",NBA.com Profile
"/media/Dados/bases/SWDE/nbaplayer/nbaplayer-wiki/0314.htm",List of National Basketball Association career assists leaders
"/media/Dados/bases/SWDE/nbaplayer/nbaplayer-wiki/0397.htm",NBA Most Valuable Player
"/media/Dados/bases/SWDE/nbaplayer/nbaplayer-wiki/0082.htm",List of NCAA Division I men's basketball season rebounding leaders
