URL,EXTRACTED VALUE
"/media/Dados/bases/SWDE/nbaplayer/nbaplayer-wiki/0269.htm","The following year, Ginóbili was named by ESPN as one of the best Euroleague players to have graced the NBA."
"/media/Dados/bases/SWDE/nbaplayer/nbaplayer-wiki/0210.htm",although Chinese officials said that it was probably a typographical error.
"/media/Dados/bases/SWDE/nbaplayer/nbaplayer-wiki/0102.htm","On February 20, 2010, McGrady made his debut for the Knicks against the"
"/media/Dados/bases/SWDE/nbaplayer/nbaplayer-wiki/0375.htm",signed Ron Artest to a five-year deal worth about $33 million.
"/media/Dados/bases/SWDE/nbaplayer/nbaplayer-wiki/0005.htm",. The wedding was the reason he did not take part in the
"/media/Dados/bases/SWDE/nbaplayer/nbaplayer-wiki/0323.htm",Along with his mother he was also raised by his grandmother Barbara Davis.
"/media/Dados/bases/SWDE/nbaplayer/nbaplayer-wiki/0261.htm",", who has been involved with the franchise since 1995."
