URL,EXTRACTED VALUE
"/media/Dados/bases/SWDE/nbaplayer/nbaplayer-wiki/0010.htm",", stated that Pierce has been repeatedly doing it before and that it was not"
"/media/Dados/bases/SWDE/nbaplayer/nbaplayer-wiki/0291.htm",", and remains best friends with both players."
"/media/Dados/bases/SWDE/nbaplayer/nbaplayer-wiki/0121.htm",". Boston, who dealt Walker to the Heat, received a package that included"
"/media/Dados/bases/SWDE/nbaplayer/nbaplayer-wiki/0005.htm",training staff as 7 ft 1 in (2.16 m) tall in his basketball shoes.
"/media/Dados/bases/SWDE/nbaplayer/nbaplayer-wiki/0096.htm",", drafted 5th overall and winning the 2005–06 NBA Development League Rookie of the Year award."
