URL,EXTRACTED VALUE
"/media/Dados/bases/SWDE/nbaplayer/nbaplayer-wiki/0050.htm","He played in 81 games during his rookie campaign and posted averages of 8.3 ppg, 4.8 rpg, 1.5 apg and 23.4 mpg."
"/media/Dados/bases/SWDE/nbaplayer/nbaplayer-wiki/0167.htm",Wallace is represented by
"/media/Dados/bases/SWDE/nbaplayer/nbaplayer-wiki/0211.htm","On January 9, 2010, Young was fined $10,000 by the Washington Wizards for participating in"
"/media/Dados/bases/SWDE/nbaplayer/nbaplayer-wiki/0010.htm",Prior to the
"/media/Dados/bases/SWDE/nbaplayer/nbaplayer-wiki/0285.htm","On January 17, 2007, Harrington was dealt to the"
"/media/Dados/bases/SWDE/nbaplayer/nbaplayer-wiki/0069.htm",Derrick Rose was born and raised in
"/media/Dados/bases/SWDE/nbaplayer/nbaplayer-wiki/0058.htm",Bayless was traded to the
"/media/Dados/bases/SWDE/nbaplayer/nbaplayer-wiki/0375.htm",Artest was selected by the
"/media/Dados/bases/SWDE/nbaplayer/nbaplayer-wiki/0008.htm",The
"/media/Dados/bases/SWDE/nbaplayer/nbaplayer-wiki/0278.htm","Following the 2007-08 NBA season, Andersen was released by the Hornets. Andersen signed a one-year contract with the Nuggets on July 24, 2008"
"/media/Dados/bases/SWDE/nbaplayer/nbaplayer-wiki/0144.htm","On May 13, 2008, he was the only unanimous selection to the 2008 Rookie First Team."
"/media/Dados/bases/SWDE/nbaplayer/nbaplayer-wiki/0089.htm","On February 13, 2009, Moon was traded by Toronto to the Miami Heat, along with"
"/media/Dados/bases/SWDE/nbaplayer/nbaplayer-wiki/0011.htm",at
"/media/Dados/bases/SWDE/nbaplayer/nbaplayer-wiki/0294.htm",Flynn was named to the preseason All Big East team
"/media/Dados/bases/SWDE/nbaplayer/nbaplayer-wiki/0347.htm",Adrien played
"/media/Dados/bases/SWDE/nbaplayer/nbaplayer-wiki/0287.htm","Believing injuries were behind him, Kenyon and the Nuggets were crushed to learn the swelling now occurring in his"
"/media/Dados/bases/SWDE/nbaplayer/nbaplayer-wiki/0154.htm","On April 23, 2008, Augustin declared himself eligible for the NBA Draft."
"/media/Dados/bases/SWDE/nbaplayer/nbaplayer-wiki/0165.htm","On July 11, 2008 he signed a contract with the"
"/media/Dados/bases/SWDE/nbaplayer/nbaplayer-wiki/0136.htm",Redd has frequently played for
"/media/Dados/bases/SWDE/nbaplayer/nbaplayer-wiki/0281.htm",For the
"/media/Dados/bases/SWDE/nbaplayer/nbaplayer-wiki/0368.htm","On July 31, 2007, Gomes was traded along with"
"/media/Dados/bases/SWDE/nbaplayer/nbaplayer-wiki/0405.htm","On December 1, 2009, Evans was named NBA Western Conference Rookie of the Month for games played from the beginning of the season through November"
"/media/Dados/bases/SWDE/nbaplayer/nbaplayer-wiki/0064.htm","On July 1 2010, Johnson signed a 5 year, $34 million contract with the"
"/media/Dados/bases/SWDE/nbaplayer/nbaplayer-wiki/0249.htm",Against
"/media/Dados/bases/SWDE/nbaplayer/nbaplayer-wiki/0261.htm",In Paul's first NBA playoff game against the
"/media/Dados/bases/SWDE/nbaplayer/nbaplayer-wiki/0131.htm","On March 1, Gooden was bought out of his contract making him a free agent after playing just one game for the Kings."
"/media/Dados/bases/SWDE/nbaplayer/nbaplayer-wiki/0286.htm",Lawson was drafted 18th overall by the
"/media/Dados/bases/SWDE/nbaplayer/nbaplayer-wiki/0049.htm","On February 18, 2010, Meeks was traded to the"
"/media/Dados/bases/SWDE/nbaplayer/nbaplayer-wiki/0062.htm","On April 4, 2010, Dorsey was signed to a non-guaranteed contract by the Raptors."
"/media/Dados/bases/SWDE/nbaplayer/nbaplayer-wiki/0342.htm","during free agency of summer 2010. He started alongside newly acquired center Al Jefferson, who came to Utah via trade from the"
"/media/Dados/bases/SWDE/nbaplayer/nbaplayer-wiki/0334.htm","On December 10, 2008, Bell was traded to the"
"/media/Dados/bases/SWDE/nbaplayer/nbaplayer-wiki/0180.htm","On June 23, 2009, Miller and"
"/media/Dados/bases/SWDE/nbaplayer/nbaplayer-wiki/0259.htm","On 21 August 2009, Mensah-Bonsu verbally agreed to a deal to join the"
"/media/Dados/bases/SWDE/nbaplayer/nbaplayer-wiki/0087.htm","On August 3, 2009, he was signed by the"
"/media/Dados/bases/SWDE/nbaplayer/nbaplayer-wiki/0001.htm",At the
"/media/Dados/bases/SWDE/nbaplayer/nbaplayer-wiki/0176.htm","On February 17, 2010, Ilgauskas, along with a"
"/media/Dados/bases/SWDE/nbaplayer/nbaplayer-wiki/0124.htm","As a sophomore, he was the youngest player featured in the movie"
"/media/Dados/bases/SWDE/nbaplayer/nbaplayer-wiki/0320.htm",He won the 2009–10 men's college basketball
"/media/Dados/bases/SWDE/nbaplayer/nbaplayer-wiki/0252.htm","In the playoffs, Ariza scored a playoff career-high 21 points in Game 1 of the first round against"
"/media/Dados/bases/SWDE/nbaplayer/nbaplayer-wiki/0156.htm","On August 23, 2010, Brown signed a 1-year deal with the"
"/media/Dados/bases/SWDE/nbaplayer/nbaplayer-wiki/0219.htm",Mahinmi signed with the
"/media/Dados/bases/SWDE/nbaplayer/nbaplayer-wiki/0005.htm","During the 2007 off-season, Taylor admitted that although he had planned on retaining Garnett, he would finally listen to trade offers."
"/media/Dados/bases/SWDE/nbaplayer/nbaplayer-wiki/0371.htm",The website also projected him to be picked at No. 16 by the
"/media/Dados/bases/SWDE/nbaplayer/nbaplayer-wiki/0104.htm",In his
"/media/Dados/bases/SWDE/nbaplayer/nbaplayer-wiki/0380.htm",With Lakers centers
"/media/Dados/bases/SWDE/nbaplayer/nbaplayer-wiki/0063.htm","On June 9, 2009, Evans was traded to the"
"/media/Dados/bases/SWDE/nbaplayer/nbaplayer-wiki/0014.htm",West is of
"/media/Dados/bases/SWDE/nbaplayer/nbaplayer-wiki/0128.htm","On August 18, 2009, Raptors signed and traded Delfino to"
"/media/Dados/bases/SWDE/nbaplayer/nbaplayer-wiki/0107.htm",In 2009 when
"/media/Dados/bases/SWDE/nbaplayer/nbaplayer-wiki/0284.htm",Tallied 22 points (season high) and 9 rebounds against
"/media/Dados/bases/SWDE/nbaplayer/nbaplayer-wiki/0162.htm",Livingston's contract with the Clippers expired after the
"/media/Dados/bases/SWDE/nbaplayer/nbaplayer-wiki/0325.htm",Harden was named to the 2009
"/media/Dados/bases/SWDE/nbaplayer/nbaplayer-wiki/0197.htm","), in a high-scoring 144–139 Wizards win over the Suns."
"/media/Dados/bases/SWDE/nbaplayer/nbaplayer-wiki/0132.htm","In July 2009, İlyasova returned to the Bucks, signing a three-year $7 million contract."
"/media/Dados/bases/SWDE/nbaplayer/nbaplayer-wiki/0356.htm","On February 7, 2009, Radmanović was dealt to the Charlotte Bobcats in exchange for forward"
"/media/Dados/bases/SWDE/nbaplayer/nbaplayer-wiki/0203.htm",Howard was drafted with the 29th selection in the first round by the
"/media/Dados/bases/SWDE/nbaplayer/nbaplayer-wiki/0151.htm","In January 2010, Thomas donated $30,000 to the Haiti relief efforts after the"
"/media/Dados/bases/SWDE/nbaplayer/nbaplayer-wiki/0353.htm","On April 26, he received the"
"/media/Dados/bases/SWDE/nbaplayer/nbaplayer-wiki/0081.htm","On July 21 2010, Watson was acquired in a sign and trade deal by the"
"/media/Dados/bases/SWDE/nbaplayer/nbaplayer-wiki/0305.htm",During the end of the 2006–2007 season he was diagnosed with
"/media/Dados/bases/SWDE/nbaplayer/nbaplayer-wiki/0171.htm","After working out for 13 teams, Chalmers was drafted with the 34th overall pick in the second round of the"
"/media/Dados/bases/SWDE/nbaplayer/nbaplayer-wiki/0195.htm","On September 16, 2010, the"
"/media/Dados/bases/SWDE/nbaplayer/nbaplayer-wiki/0000.htm","During the 2004 preseason, Allen had a brief war of words with"
"/media/Dados/bases/SWDE/nbaplayer/nbaplayer-wiki/0225.htm",He played for the
"/media/Dados/bases/SWDE/nbaplayer/nbaplayer-wiki/0282.htm","On December 20, 2007, Carter hit a runner in the lane with 0.8 seconds left in double"
"/media/Dados/bases/SWDE/nbaplayer/nbaplayer-wiki/0248.htm",In a November 10 game against the
"/media/Dados/bases/SWDE/nbaplayer/nbaplayer-wiki/0307.htm","After coming off the bench for the first three games of his NBA career, Batum moved into the starting lineup in the place of"
"/media/Dados/bases/SWDE/nbaplayer/nbaplayer-wiki/0377.htm",The
"/media/Dados/bases/SWDE/nbaplayer/nbaplayer-wiki/0290.htm","On July 14, 2010, he signed a one year contract with the"
"/media/Dados/bases/SWDE/nbaplayer/nbaplayer-wiki/0065.htm","On July 7, 2010, Kleiza terminated his contract with Olympiacos. He was signed by the"
"/media/Dados/bases/SWDE/nbaplayer/nbaplayer-wiki/0333.htm",He was recalled just five days later on March 9 after averaging 23 points and 11 rebounds in four starts for Tulsa.
"/media/Dados/bases/SWDE/nbaplayer/nbaplayer-wiki/0045.htm","On June 17, 2010 he was traded along with"
"/media/Dados/bases/SWDE/nbaplayer/nbaplayer-wiki/0228.htm","From 2003 to 2009, Hayes had the second highest defensive"
"/media/Dados/bases/SWDE/nbaplayer/nbaplayer-wiki/0199.htm",on April 4th.
"/media/Dados/bases/SWDE/nbaplayer/nbaplayer-wiki/0394.htm",Frye was married in 2009.
"/media/Dados/bases/SWDE/nbaplayer/nbaplayer-wiki/0335.htm","On February 18, 2010, Elson was traded to the"
"/media/Dados/bases/SWDE/nbaplayer/nbaplayer-wiki/0257.htm",Mbenga was later waived by the Mavericks in order for them to sign
"/media/Dados/bases/SWDE/nbaplayer/nbaplayer-wiki/0268.htm",He overcame this to become a standout for the
"/media/Dados/bases/SWDE/nbaplayer/nbaplayer-wiki/0092.htm","On April 14, 2008, Sessions scored a then career-high 20 points, adding 8 rebounds and a Milwaukee Bucks franchise-record 24 assists against the"
"/media/Dados/bases/SWDE/nbaplayer/nbaplayer-wiki/0223.htm","On August 5, 2006 Stevenson signed a two-year contract worth the"
"/media/Dados/bases/SWDE/nbaplayer/nbaplayer-wiki/0213.htm",and led NU with a team-high 25 double-figure scoring games.
"/media/Dados/bases/SWDE/nbaplayer/nbaplayer-wiki/0073.htm",". Most recently, he won the 2008 UN Refugee Agency's Humanitarian of the Year Award as part of the"
"/media/Dados/bases/SWDE/nbaplayer/nbaplayer-wiki/0243.htm","Gay, widely regarded as one of the top future NBA prospects, announced on April 17 that he would enter the"
"/media/Dados/bases/SWDE/nbaplayer/nbaplayer-wiki/0260.htm","On April 16, 2004, Okafor declared his eligibility for the"
"/media/Dados/bases/SWDE/nbaplayer/nbaplayer-wiki/0372.htm",Kaman's agent is
"/media/Dados/bases/SWDE/nbaplayer/nbaplayer-wiki/0148.htm","On February 2, 2010, against the"
"/media/Dados/bases/SWDE/nbaplayer/nbaplayer-wiki/0032.htm","in his right (shooting) hand, forcing him to sit out six games (nearly a month)—of which Florida State lost five."
"/media/Dados/bases/SWDE/nbaplayer/nbaplayer-wiki/0350.htm","In his third year, Biedriņš got a lucky break when the Warriors decided to replace coach"
"/media/Dados/bases/SWDE/nbaplayer/nbaplayer-wiki/0016.htm",Favors was named ACC Rookie of the Year and to the ACC All-Freshman Team.
"/media/Dados/bases/SWDE/nbaplayer/nbaplayer-wiki/0208.htm","On February 17, 2010, Thornton was traded from the"
"/media/Dados/bases/SWDE/nbaplayer/nbaplayer-wiki/0072.htm","On February 5, 2009, Bogans was traded to the"
"/media/Dados/bases/SWDE/nbaplayer/nbaplayer-wiki/0397.htm",In the
"/media/Dados/bases/SWDE/nbaplayer/nbaplayer-wiki/0407.htm",Greene and
"/media/Dados/bases/SWDE/nbaplayer/nbaplayer-wiki/0018.htm","On November 7, 2008, Harris posted a career-high 38 points against"
"/media/Dados/bases/SWDE/nbaplayer/nbaplayer-wiki/0149.htm",Sy was a member of the ninth-place
"/media/Dados/bases/SWDE/nbaplayer/nbaplayer-wiki/0035.htm","In the 2007–2008 season, he also played for the first time in the elite Europe-wide"
"/media/Dados/bases/SWDE/nbaplayer/nbaplayer-wiki/0210.htm",Yi's first major international experience came at the
"/media/Dados/bases/SWDE/nbaplayer/nbaplayer-wiki/0357.htm",In the
"/media/Dados/bases/SWDE/nbaplayer/nbaplayer-wiki/0183.htm","Richardson has appeared in multiple acting roles, most notably as himself in the 2002 film"
"/media/Dados/bases/SWDE/nbaplayer/nbaplayer-wiki/0122.htm",", helping the team advance to the"
"/media/Dados/bases/SWDE/nbaplayer/nbaplayer-wiki/0170.htm","The teenager went on to lead Lincoln High to win the Class 4A state title before 16,990 fans as he racked up 23"
"/media/Dados/bases/SWDE/nbaplayer/nbaplayer-wiki/0201.htm",Gee was waived by the
"/media/Dados/bases/SWDE/nbaplayer/nbaplayer-wiki/0214.htm",The summer after his freshman season he started for the US team that took home gold in the 2001 FIBA
"/media/Dados/bases/SWDE/nbaplayer/nbaplayer-wiki/0315.htm","After repeating as Staunton Medallist in 2007,"
"/media/Dados/bases/SWDE/nbaplayer/nbaplayer-wiki/0355.htm","Lin sent his resume and a DVD of highlights to all the Ivy League schools,"
"/media/Dados/bases/SWDE/nbaplayer/nbaplayer-wiki/0402.htm","In 2009, Casspi again declared himself available for the draft. He was drafted 23rd overall by the Sacramento Kings."
"/media/Dados/bases/SWDE/nbaplayer/nbaplayer-wiki/0332.htm","On March 2, 2009 Westbrook recorded a triple double with 17 points, 10 rebounds and 10 assists. He was the first rookie to do so since"
"/media/Dados/bases/SWDE/nbaplayer/nbaplayer-wiki/0161.htm","On October 6, 2006, there were police reports that Jackson and three other"
"/media/Dados/bases/SWDE/nbaplayer/nbaplayer-wiki/0220.htm","On February 13, 2009, Marion was traded to the"
"/media/Dados/bases/SWDE/nbaplayer/nbaplayer-wiki/0398.htm",Richardson began to gain attention with the Bobcats when he led the team to a road win against the
