URL,EXTRACTED VALUE
"/media/Dados/bases/SWDE/nbaplayer/nbaplayer-wiki/0342.htm","A few weeks later, he signed a offer sheet from the"
"/media/Dados/bases/SWDE/nbaplayer/nbaplayer-wiki/0272.htm",and
"/media/Dados/bases/SWDE/nbaplayer/nbaplayer-wiki/0076.htm",. He was then later released by Treviso during that same 2007-08 season. Lucas was signed by the
"/media/Dados/bases/SWDE/nbaplayer/nbaplayer-wiki/0050.htm",", 80 km south of Santa Fe, where Andrés attended school."
"/media/Dados/bases/SWDE/nbaplayer/nbaplayer-wiki/0112.htm",Ford decided to turn professional after his second year of college to enter the
"/media/Dados/bases/SWDE/nbaplayer/nbaplayer-wiki/0055.htm",basketball in the
"/media/Dados/bases/SWDE/nbaplayer/nbaplayer-wiki/0259.htm",", the"
"/media/Dados/bases/SWDE/nbaplayer/nbaplayer-wiki/0314.htm","On January 30th, 2010, Miller scored a career high of 52 points while making 22 of 31 field goals in an overtime win against the"
"/media/Dados/bases/SWDE/nbaplayer/nbaplayer-wiki/0167.htm",", Wallace has been captain of the Bobcats. Wallace is also the only Bobcat ever to score 30 points and 10 rebounds in 2 consecutive games"
"/media/Dados/bases/SWDE/nbaplayer/nbaplayer-wiki/0176.htm","On December 2, 2009, Ilgauskas came off the bench in a game against"
"/media/Dados/bases/SWDE/nbaplayer/nbaplayer-wiki/0397.htm","and on 3 June 2008, it was announced that Nash would receive a star on"
"/media/Dados/bases/SWDE/nbaplayer/nbaplayer-wiki/0240.htm",were excused from NBA's Rookie Training Camp following a marijuana-related incident.
"/media/Dados/bases/SWDE/nbaplayer/nbaplayer-wiki/0386.htm",", and draft picks, to the"
"/media/Dados/bases/SWDE/nbaplayer/nbaplayer-wiki/0210.htm",invited him to attend the company's ABCD camp in
"/media/Dados/bases/SWDE/nbaplayer/nbaplayer-wiki/0285.htm",he became a
"/media/Dados/bases/SWDE/nbaplayer/nbaplayer-wiki/0169.htm",", and Arroyo again was at the backup point guard position. On November 28, 2007, he had a career-high 14 assists in a game against the"
"/media/Dados/bases/SWDE/nbaplayer/nbaplayer-wiki/0067.htm",", and earned first team All-"
"/media/Dados/bases/SWDE/nbaplayer/nbaplayer-wiki/0219.htm","Summer League, Mahinmi tore his right"
"/media/Dados/bases/SWDE/nbaplayer/nbaplayer-wiki/0117.htm",in
"/media/Dados/bases/SWDE/nbaplayer/nbaplayer-wiki/0357.htm",", he was the"
"/media/Dados/bases/SWDE/nbaplayer/nbaplayer-wiki/0333.htm",by the
"/media/Dados/bases/SWDE/nbaplayer/nbaplayer-wiki/0183.htm",", Richardson was traded to the"
"/media/Dados/bases/SWDE/nbaplayer/nbaplayer-wiki/0380.htm",", in"
"/media/Dados/bases/SWDE/nbaplayer/nbaplayer-wiki/0189.htm","with the fifth overall pick, and then traded to the"
"/media/Dados/bases/SWDE/nbaplayer/nbaplayer-wiki/0029.htm",signed Azubuike.
"/media/Dados/bases/SWDE/nbaplayer/nbaplayer-wiki/0268.htm",", which centers around the genial and antagonistic character of Will Hunting, portrayed by"
"/media/Dados/bases/SWDE/nbaplayer/nbaplayer-wiki/0143.htm",against
"/media/Dados/bases/SWDE/nbaplayer/nbaplayer-wiki/0284.htm",He committed to play at the
"/media/Dados/bases/SWDE/nbaplayer/nbaplayer-wiki/0007.htm",as the 17th pick in the
"/media/Dados/bases/SWDE/nbaplayer/nbaplayer-wiki/0170.htm",Bosh was forced to play out of position as the Raptors' starting
"/media/Dados/bases/SWDE/nbaplayer/nbaplayer-wiki/0154.htm",player
"/media/Dados/bases/SWDE/nbaplayer/nbaplayer-wiki/0279.htm",coaches where lined up to recruit Anthony to a school on the
"/media/Dados/bases/SWDE/nbaplayer/nbaplayer-wiki/0197.htm",", Arenas established himself as a threat in close game situations. On January 3, 2007, Arenas hit a 32-foot buzzer-beater to win the game against the"
"/media/Dados/bases/SWDE/nbaplayer/nbaplayer-wiki/0306.htm","In his first game, Babbitt recorded a 20 point, 12 rebound"
"/media/Dados/bases/SWDE/nbaplayer/nbaplayer-wiki/0102.htm","However, since Yao Ming was having another breakout season, he was deferring to Yao as the number one option."
"/media/Dados/bases/SWDE/nbaplayer/nbaplayer-wiki/0060.htm",In the
"/media/Dados/bases/SWDE/nbaplayer/nbaplayer-wiki/0080.htm",", coming in third and second in those contests respectively. In the"
"/media/Dados/bases/SWDE/nbaplayer/nbaplayer-wiki/0317.htm",", chosen by the"
"/media/Dados/bases/SWDE/nbaplayer/nbaplayer-wiki/0398.htm",Richardson set the Warrior franchise record for three-pointers made in a game without missing (8) in a home win against the
"/media/Dados/bases/SWDE/nbaplayer/nbaplayer-wiki/0133.htm",". On April 24, 2007, he decided instead to join the"
"/media/Dados/bases/SWDE/nbaplayer/nbaplayer-wiki/0028.htm",and is one of few athletes to do so. He was also a finalist in the Lowe's Senior Class Award
