URL,EXTRACTED VALUE
"/media/Dados/bases/SWDE/nbaplayer/nbaplayer-wiki/0186.htm",is an American
"/media/Dados/bases/SWDE/nbaplayer/nbaplayer-wiki/0057.htm",and was selected first overall by the
"/media/Dados/bases/SWDE/nbaplayer/nbaplayer-wiki/0008.htm",", expectations for the Lakers increased. However, personnel changes were a source of instability during the"
"/media/Dados/bases/SWDE/nbaplayer/nbaplayer-wiki/0170.htm",", Bosh worked out under Ken Roberson, looking to add 20 pounds and bring his weight up to 250."
"/media/Dados/bases/SWDE/nbaplayer/nbaplayer-wiki/0238.htm",He has led
"/media/Dados/bases/SWDE/nbaplayer/nbaplayer-wiki/0021.htm",", Los Angeles to Deborah Ledford and his now-estranged father Heriberto Lopez, a native of"
"/media/Dados/bases/SWDE/nbaplayer/nbaplayer-wiki/0177.htm",with the first overall pick in the
