URL,EXTRACTED VALUE
"/media/Dados/bases/SWDE/nbaplayer/nbaplayer-wiki/0302.htm","On July 22, 2008 the Minnesota Timberwolves re-signed Telfair to a three-year contract. Because the Timberwolves fired head coach"
"/media/Dados/bases/SWDE/nbaplayer/nbaplayer-wiki/0271.htm",to become the Nets' second all-time leading scorer.
"/media/Dados/bases/SWDE/nbaplayer/nbaplayer-wiki/0162.htm",Livingston's contract with the Clippers expired after the
"/media/Dados/bases/SWDE/nbaplayer/nbaplayer-wiki/0371.htm",In the
"/media/Dados/bases/SWDE/nbaplayer/nbaplayer-wiki/0312.htm","On October 21, 2010, Marks was waived by the"
