URL,EXTRACTED VALUE
"/media/Dados/bases/SWDE/nbaplayer/nbaplayer-wiki/0269.htm",before prevailing in a very defensive oriented seven-game series against the
"/media/Dados/bases/SWDE/nbaplayer/nbaplayer-wiki/0210.htm","After the game, Yao called Yi's talent ""unbelievable"", and"
"/media/Dados/bases/SWDE/nbaplayer/nbaplayer-wiki/0005.htm",(the owner of the team)
"/media/Dados/bases/SWDE/nbaplayer/nbaplayer-wiki/0323.htm",cited the experience of the remaining players as the deciding factor in making the cut.
"/media/Dados/bases/SWDE/nbaplayer/nbaplayer-wiki/0012.htm","along with a career-high in assists (16 points, 13 rebounds and 17 assists), against the"
"/media/Dados/bases/SWDE/nbaplayer/nbaplayer-wiki/0261.htm","with 24 points, 12 rebounds, and 12 assists."
