URL,EXTRACTED VALUE
"/media/Dados/bases/SWDE/nbaplayer/nbaplayer-wiki/0179.htm",once. He attended high school at
"/media/Dados/bases/SWDE/nbaplayer/nbaplayer-wiki/0112.htm",. Following an injury sustained in the
"/media/Dados/bases/SWDE/nbaplayer/nbaplayer-wiki/0292.htm","Brewer is 6'9"" and weighs 185 lbs. On December 1, 2008, it was announced that Brewer had sustained an"
"/media/Dados/bases/SWDE/nbaplayer/nbaplayer-wiki/0404.htm",and lived there for fourteen years before moving to Montreal. After playing 8 seasons with the
"/media/Dados/bases/SWDE/nbaplayer/nbaplayer-wiki/0300.htm",and
"/media/Dados/bases/SWDE/nbaplayer/nbaplayer-wiki/0213.htm","following his participation in the NBA Vegas Summer league, becoming the seventh Puerto Rican to play in the NBA. He was a member of the"
