URL,EXTRACTED VALUE
"/media/Dados/bases/SWDE/nbaplayer/nbaplayer-wiki/0279.htm","He suddenly became one of the area’s top players and made a name for himself in the area, being named"
"/media/Dados/bases/SWDE/nbaplayer/nbaplayer-wiki/0053.htm","2006–07 Class AA all-state team, a day before Rose's Simeon eliminated Turner's St. Joseph in the Illinois Class AA supersectional."
"/media/Dados/bases/SWDE/nbaplayer/nbaplayer-wiki/0012.htm","He had little contact with his father, who left his family when he was seven years old."
"/media/Dados/bases/SWDE/nbaplayer/nbaplayer-wiki/0090.htm","However, half a year later Parker longed a return to Israel, a country he had grown to love."
"/media/Dados/bases/SWDE/nbaplayer/nbaplayer-wiki/0274.htm","With Parker operating as the starting point guard in the 2006–07 season, the Spurs qualified for the"
