URL,EXTRACTED VALUE
"/media/Dados/bases/SWDE/job/job-hotjobs/1930.htm",Identify new search media opportunities for the line of business.
"/media/Dados/bases/SWDE/job/job-hotjobs/1913.htm",Identify new search media opportunities for the line of business.
"/media/Dados/bases/SWDE/job/job-hotjobs/1927.htm",Identify new search media opportunities for the line of business.
"/media/Dados/bases/SWDE/job/job-hotjobs/0295.htm",Provide regular status updates and quickly escalate potential issues to Optimization Managers.
"/media/Dados/bases/SWDE/job/job-hotjobs/0275.htm",Challenge conventional solutions and wisdom
"/media/Dados/bases/SWDE/job/job-hotjobs/1920.htm",Continue to help define and refine SEO processes with the Web Team and IT.
