URL,EXTRACTED VALUE
"/media/Dados/bases/SWDE/job/job-hotjobs/0696.htm",View Juniper Networks profile and job listings
"/media/Dados/bases/SWDE/job/job-hotjobs/0572.htm",View Juniper Networks profile and job listings
"/media/Dados/bases/SWDE/job/job-hotjobs/0315.htm",View Smith & Associates Professional Placements profile and job listings
"/media/Dados/bases/SWDE/job/job-hotjobs/0772.htm",View Patelco Credit Union profile and job listings
"/media/Dados/bases/SWDE/job/job-hotjobs/1019.htm","View Advanced Placement Services, Inc. profile and job listings"
"/media/Dados/bases/SWDE/job/job-hotjobs/0874.htm",View Unspecified profile and job listings
"/media/Dados/bases/SWDE/job/job-hotjobs/0809.htm",View Venator Ventures profile and job listings
"/media/Dados/bases/SWDE/job/job-hotjobs/0415.htm","View MediaTek USA, Inc. profile and job listings"
"/media/Dados/bases/SWDE/job/job-hotjobs/0399.htm",View Approva Corp. profile and job listings
"/media/Dados/bases/SWDE/job/job-hotjobs/0713.htm",View Equinox Corporation profile and job listings
"/media/Dados/bases/SWDE/job/job-hotjobs/0034.htm",View Qumu profile and job listings
"/media/Dados/bases/SWDE/job/job-hotjobs/1431.htm","View Wenner Media, LLC profile and job listings"
"/media/Dados/bases/SWDE/job/job-hotjobs/0855.htm",View Netcom Solutions profile and job listings
"/media/Dados/bases/SWDE/job/job-hotjobs/0671.htm",View University of Virginia Health System profile and job listings
"/media/Dados/bases/SWDE/job/job-hotjobs/0523.htm",View Tech Results profile and job listings
"/media/Dados/bases/SWDE/job/job-hotjobs/0824.htm",View Zoran Corporation profile and job listings
"/media/Dados/bases/SWDE/job/job-hotjobs/0615.htm",View Telatron Marketing Group profile and job listings
"/media/Dados/bases/SWDE/job/job-hotjobs/0787.htm",View Jefferson Associates profile and job listings
"/media/Dados/bases/SWDE/job/job-hotjobs/0304.htm","View Cornerstone OnDemand, Inc. profile and job listings"
"/media/Dados/bases/SWDE/job/job-hotjobs/0476.htm",View Independent Health profile and job listings
"/media/Dados/bases/SWDE/job/job-hotjobs/0429.htm",View SMGT Tek profile and job listings
"/media/Dados/bases/SWDE/job/job-hotjobs/0595.htm","View Inquira, Inc. profile and job listings"
"/media/Dados/bases/SWDE/job/job-hotjobs/0151.htm",View Patelco Credit Union profile and job listings
"/media/Dados/bases/SWDE/job/job-hotjobs/0720.htm",View Alarm.com profile and job listings
"/media/Dados/bases/SWDE/job/job-hotjobs/0605.htm",View Juniper Networks profile and job listings
"/media/Dados/bases/SWDE/job/job-hotjobs/0224.htm",View Aldon profile and job listings
"/media/Dados/bases/SWDE/job/job-hotjobs/0492.htm",View Norfolk Southern Corporation profile and job listings
"/media/Dados/bases/SWDE/job/job-hotjobs/1422.htm","View Successful Transition Solutions, LLC profile and job listings"
"/media/Dados/bases/SWDE/job/job-hotjobs/0471.htm",View Programming Resources profile and job listings
"/media/Dados/bases/SWDE/job/job-hotjobs/0566.htm",View EventBooking.com profile and job listings
"/media/Dados/bases/SWDE/job/job-hotjobs/0544.htm","View Intouch Staffing Professionals, Inc. profile and job listings"
"/media/Dados/bases/SWDE/job/job-hotjobs/0686.htm","View Benchmark Revenue Management, Inc profile and job listings"
"/media/Dados/bases/SWDE/job/job-hotjobs/1865.htm",View International Asset Systems profile and job listings
"/media/Dados/bases/SWDE/job/job-hotjobs/0405.htm",View Insight Placement profile and job listings
"/media/Dados/bases/SWDE/job/job-hotjobs/0183.htm",View Electroniccareers.com profile and job listings
"/media/Dados/bases/SWDE/job/job-hotjobs/0398.htm",View Bloom Capital Management profile and job listings
"/media/Dados/bases/SWDE/job/job-hotjobs/0845.htm",View Bluewolf profile and job listings
"/media/Dados/bases/SWDE/job/job-hotjobs/0722.htm",View Infinite Technology Solutions profile and job listings
"/media/Dados/bases/SWDE/job/job-hotjobs/0561.htm",View The E.W. Scripps Co. profile and job listings
"/media/Dados/bases/SWDE/job/job-hotjobs/1641.htm",View Wyse Technology profile and job listings
"/media/Dados/bases/SWDE/job/job-hotjobs/0706.htm",View Turn Inc profile and job listings
"/media/Dados/bases/SWDE/job/job-hotjobs/0413.htm",View Sharp Microelectronics America profile and job listings
"/media/Dados/bases/SWDE/job/job-hotjobs/0773.htm",View Company Confidential profile and job listings
"/media/Dados/bases/SWDE/job/job-hotjobs/0767.htm",View Zoran Corporation profile and job listings
"/media/Dados/bases/SWDE/job/job-hotjobs/0878.htm",View Norfolk Southern Corporation profile and job listings
"/media/Dados/bases/SWDE/job/job-hotjobs/0439.htm","View Intouch Staffing Professionals, Inc. profile and job listings"
"/media/Dados/bases/SWDE/job/job-hotjobs/1432.htm",View SMGT Tek profile and job listings
"/media/Dados/bases/SWDE/job/job-hotjobs/1652.htm","View Kendall & Davis, Inc profile and job listings"
"/media/Dados/bases/SWDE/job/job-hotjobs/0766.htm",View e-MDs profile and job listings
"/media/Dados/bases/SWDE/job/job-hotjobs/0214.htm","View CSA, Inc. profile and job listings"
"/media/Dados/bases/SWDE/job/job-hotjobs/0853.htm",View Infinite Technology Solutions profile and job listings
"/media/Dados/bases/SWDE/job/job-hotjobs/1013.htm",View Blackboard Inc. profile and job listings
"/media/Dados/bases/SWDE/job/job-hotjobs/0408.htm",View Juniper Networks profile and job listings
"/media/Dados/bases/SWDE/job/job-hotjobs/0644.htm",View Wave Systems Corp. profile and job listings
"/media/Dados/bases/SWDE/job/job-hotjobs/0493.htm","View Regis Technologies, Inc. profile and job listings"
"/media/Dados/bases/SWDE/job/job-hotjobs/0083.htm",View NetLogic Microsystems profile and job listings
"/media/Dados/bases/SWDE/job/job-hotjobs/0571.htm",View Panfa Solutions profile and job listings
"/media/Dados/bases/SWDE/job/job-hotjobs/0419.htm","View Autonomy, Inc. profile and job listings"
"/media/Dados/bases/SWDE/job/job-hotjobs/0674.htm",View Juniper Networks profile and job listings
"/media/Dados/bases/SWDE/job/job-hotjobs/1024.htm",View Norfolk Southern Corporation profile and job listings
"/media/Dados/bases/SWDE/job/job-hotjobs/0821.htm",View V3it Consulting profile and job listings
"/media/Dados/bases/SWDE/job/job-hotjobs/0593.htm",View Unspecified profile and job listings
"/media/Dados/bases/SWDE/job/job-hotjobs/0823.htm","View Cornerstone OnDemand, Inc. profile and job listings"
"/media/Dados/bases/SWDE/job/job-hotjobs/0842.htm",View University of Texas at Dallas profile and job listings
"/media/Dados/bases/SWDE/job/job-hotjobs/0755.htm",View Amphion Medical Solutions profile and job listings
"/media/Dados/bases/SWDE/job/job-hotjobs/0485.htm",View Juniper Networks profile and job listings
"/media/Dados/bases/SWDE/job/job-hotjobs/0045.htm",View Argin profile and job listings
"/media/Dados/bases/SWDE/job/job-hotjobs/0792.htm",View Juniper Networks profile and job listings
"/media/Dados/bases/SWDE/job/job-hotjobs/0763.htm","View Intouch Staffing Professionals, Inc. profile and job listings"
"/media/Dados/bases/SWDE/job/job-hotjobs/0082.htm",View NetLogic Microsystems profile and job listings
"/media/Dados/bases/SWDE/job/job-hotjobs/0716.htm",View Trident Micro Systems profile and job listings
"/media/Dados/bases/SWDE/job/job-hotjobs/0826.htm",View Qumu profile and job listings
"/media/Dados/bases/SWDE/job/job-hotjobs/0814.htm",View e-MDs profile and job listings
"/media/Dados/bases/SWDE/job/job-hotjobs/0768.htm",View CyberSource Corporation profile and job listings
"/media/Dados/bases/SWDE/job/job-hotjobs/0742.htm",View HireWave Technologies profile and job listings
"/media/Dados/bases/SWDE/job/job-hotjobs/0263.htm","View Sigma Designs, Inc. profile and job listings"
"/media/Dados/bases/SWDE/job/job-hotjobs/0518.htm","View SBS Creatix, LLC profile and job listings"
"/media/Dados/bases/SWDE/job/job-hotjobs/0676.htm",View Shield Healthcare profile and job listings
