URL,EXTRACTED VALUE
"/media/Dados/bases/SWDE/job/job-hotjobs/0338.htm",Experience with Software Roll Outs
"/media/Dados/bases/SWDE/job/job-hotjobs/0404.htm",Ensure that the technical environment is properly monitored and that any problems are rectified.
"/media/Dados/bases/SWDE/job/job-hotjobs/1215.htm",Assist with all end of month revenue activities including data entry of products and fees
"/media/Dados/bases/SWDE/job/job-hotjobs/0351.htm",Extensive experience with data migrations
"/media/Dados/bases/SWDE/job/job-hotjobs/0340.htm",Strong ability to manage to deliverables/timelines
"/media/Dados/bases/SWDE/job/job-hotjobs/0366.htm",Develop the messaging for Photoshop for all customer segments (Creative Pros and Knowledge Workers)
"/media/Dados/bases/SWDE/job/job-hotjobs/0028.htm",Enter ticket information into company ticketing system & assign tickets that require onsite support to field technicians
"/media/Dados/bases/SWDE/job/job-hotjobs/0403.htm",Sends invoices to customers on a timely and accurate manner.
