URL,EXTRACTED VALUE
"/media/Dados/bases/SWDE/job/job-hotjobs/0586.htm","Demonstrated ability to communicate and interact with users, vendors and support techs in the support of hospital applications;"
"/media/Dados/bases/SWDE/job/job-hotjobs/0699.htm",Experience in developing commercial applications
"/media/Dados/bases/SWDE/job/job-hotjobs/0665.htm",Experience with business rule engines and web services preferred
"/media/Dados/bases/SWDE/job/job-hotjobs/0590.htm","2 + years sales experience across multiple verticals of TBO including health & welfare, defined benefits and defined contribution"
"/media/Dados/bases/SWDE/job/job-hotjobs/0373.htm",Interpersonal and leadership skills sufficient to work with other departments in the development of training materials
"/media/Dados/bases/SWDE/job/job-hotjobs/0844.htm","Performs installation or detailed, client-specific configurations for hardware residing on servers, mainframes and operation systems;"
"/media/Dados/bases/SWDE/job/job-hotjobs/0633.htm","Ability to achieve results through knowledge, commitment and attention to detail and to meet established deadlines"
