URL,EXTRACTED VALUE
"/media/Dados/bases/SWDE/job/job-hotjobs/0100.htm","Experience with a variety of online acquisition channels, online ad sales, and mobile strongly preferred"
"/media/Dados/bases/SWDE/job/job-hotjobs/1220.htm",Strong organizational and analytical skills
"/media/Dados/bases/SWDE/job/job-hotjobs/0112.htm","Experience with Flash application development, ActionScript 3, ActionScript 2.0 a plus"
"/media/Dados/bases/SWDE/job/job-hotjobs/0753.htm","U.S Citizen, U.S Government clearance eligible"
"/media/Dados/bases/SWDE/job/job-hotjobs/0876.htm",Experience with configuring Cisco/Juniper routers and L4 switches is a big plus;
"/media/Dados/bases/SWDE/job/job-hotjobs/0082.htm",BS (EE or CS) required with 3-8 years relevant experience. MS (EE or CS) preferred
"/media/Dados/bases/SWDE/job/job-hotjobs/0068.htm",Ability to operate remotely and/or travel at least 50% of the time
