URL,EXTRACTED VALUE
"/media/Dados/bases/SWDE/job/job-hotjobs/0539.htm",Other duties as assigned or needed
"/media/Dados/bases/SWDE/job/job-hotjobs/0602.htm",Work closely with internal and external customers
"/media/Dados/bases/SWDE/job/job-hotjobs/0446.htm",he ability to provide off/after hour support via phone and internet
"/media/Dados/bases/SWDE/job/job-hotjobs/0388.htm",Suggest areas for improvement in internal processes along with possible solutions.
"/media/Dados/bases/SWDE/job/job-hotjobs/0048.htm","Effectively prioritizes and accurately identifies project tasks and controls project scope, schedule and resources"
"/media/Dados/bases/SWDE/job/job-hotjobs/0065.htm","Communicate project progress, raising areas of concern to appropriate levels within Macy's Logistics"
