URL,EXTRACTED VALUE
"/media/Dados/bases/SWDE/book/book-christianbook/1860.htm",Read all The Holy Spirit and the Renewal of All Things: Pneumatology in Paul and Jurgen Moltmann reviews
"/media/Dados/bases/SWDE/book/book-christianbook/0860.htm",Read all Unquestionably Free: Empowering Prayers for Champions reviews
"/media/Dados/bases/SWDE/book/book-christianbook/0296.htm",Read all I Am Not Ashamed: 50 Devotions for Teens on Romans reviews
"/media/Dados/bases/SWDE/book/book-christianbook/1478.htm",Read all Beyond the Bliss reviews
"/media/Dados/bases/SWDE/book/book-christianbook/1120.htm",Read all Pig-a-Boo reviews
"/media/Dados/bases/SWDE/book/book-christianbook/1422.htm","Read all St. Peter and St. Jude, International Critical Commentary reviews"
"/media/Dados/bases/SWDE/book/book-christianbook/0667.htm",Read all The Fall and Sin: What We Have Become as Sinners reviews
"/media/Dados/bases/SWDE/book/book-christianbook/1741.htm",Read all Living in A Zoo? reviews
"/media/Dados/bases/SWDE/book/book-christianbook/0592.htm",Read all Exploring Creation with Astronomy: Notebooking Journal reviews
"/media/Dados/bases/SWDE/book/book-christianbook/1126.htm",Read all Busy Baby: Tabbed Diggers reviews
"/media/Dados/bases/SWDE/book/book-christianbook/1375.htm",Read all 101 of the Dumbest Things People Have Done reviews
"/media/Dados/bases/SWDE/book/book-christianbook/1099.htm",Read all Mercer Mayer's Little Critter: What a Bad Dream reviews
"/media/Dados/bases/SWDE/book/book-christianbook/0586.htm",Read all Family Life Illustrated for Finances reviews
"/media/Dados/bases/SWDE/book/book-christianbook/0146.htm","Read all Experiencing God DVD Leader Kit, Revised & Expanded reviews"
"/media/Dados/bases/SWDE/book/book-christianbook/0112.htm",Read all Healing The Whole Man Handbook reviews
"/media/Dados/bases/SWDE/book/book-christianbook/0629.htm",Read all Daughters of Miriam: Women Prophets in Ancient Israel reviews
"/media/Dados/bases/SWDE/book/book-christianbook/1639.htm",Read all Pilgrims in the Kingdom: Travels in Christian Britain reviews
"/media/Dados/bases/SWDE/book/book-christianbook/1917.htm","Read all The Aeneid, Fresh Prose Translation reviews"
"/media/Dados/bases/SWDE/book/book-christianbook/1485.htm",Read all Little Hands Story Bible reviews
"/media/Dados/bases/SWDE/book/book-christianbook/0711.htm",Read all The Agony and the Ecstasy: A Biographical Novel of Michelangelo reviews
"/media/Dados/bases/SWDE/book/book-christianbook/1826.htm","Read all The Cottage at Bantry Bay, The O'Sullivan Family #1 reviews"
"/media/Dados/bases/SWDE/book/book-christianbook/1691.htm",Read all Subversive Spirituality reviews
"/media/Dados/bases/SWDE/book/book-christianbook/1387.htm",Read all Stories for Telling reviews
"/media/Dados/bases/SWDE/book/book-christianbook/1774.htm",Read all Handbook of Christian Apologetics reviews
"/media/Dados/bases/SWDE/book/book-christianbook/1604.htm",Read all God-Esteem: God Help Me See Me As You See Me reviews
"/media/Dados/bases/SWDE/book/book-christianbook/1109.htm","Read all Chicken Soup for the Pet Lover's Soul: Stories about Pets as Teachers, Healers, Heroes & reviews"
"/media/Dados/bases/SWDE/book/book-christianbook/1024.htm",Read all Occupy until I Come: A.T. Pierson and World Evangelization reviews
"/media/Dados/bases/SWDE/book/book-christianbook/1475.htm",Read all Border Lands: The Best of David Adam's Celtic Vision reviews
"/media/Dados/bases/SWDE/book/book-christianbook/1906.htm",Read all The Devil Goes to Church: Combating the Everyday Attacks of Satan reviews
"/media/Dados/bases/SWDE/book/book-christianbook/0677.htm",Read all Paul reviews
"/media/Dados/bases/SWDE/book/book-christianbook/0948.htm",Read all The Woman of the Forest reviews
"/media/Dados/bases/SWDE/book/book-christianbook/0140.htm","Read all Mommy, Why Don't We Celebrate Halloween? reviews"
"/media/Dados/bases/SWDE/book/book-christianbook/1445.htm",Read all Los Vencedores que Dios Busca (God's Overcomers) reviews
"/media/Dados/bases/SWDE/book/book-christianbook/1500.htm","Read all Finding Anna, Large-print reviews"
"/media/Dados/bases/SWDE/book/book-christianbook/1803.htm",Read all Sunday School Specials reviews
"/media/Dados/bases/SWDE/book/book-christianbook/1548.htm",Read all Saving Salvation: The Amazing Evolution of Grace reviews
"/media/Dados/bases/SWDE/book/book-christianbook/0483.htm",Read all Powers in Encounters with Powers: reviews
"/media/Dados/bases/SWDE/book/book-christianbook/0566.htm",Read all Patristic Greek Lexicon reviews
"/media/Dados/bases/SWDE/book/book-christianbook/0739.htm",Read all Selected Poems reviews
"/media/Dados/bases/SWDE/book/book-christianbook/1220.htm",Read all Slaying the Giants in Your Life reviews
"/media/Dados/bases/SWDE/book/book-christianbook/1871.htm","Read all Milagra de la Vida, Miracle of Life reviews"
"/media/Dados/bases/SWDE/book/book-christianbook/0088.htm","Read all Elsie's Womanhood #4, The Original Elsie Classics Series (Softcover) reviews"
"/media/Dados/bases/SWDE/book/book-christianbook/1344.htm",Read all The Renewing of the Holy Ghost reviews
"/media/Dados/bases/SWDE/book/book-christianbook/1904.htm",Read all The Theology of the Christian Life in J.I. Packer's Thought reviews
"/media/Dados/bases/SWDE/book/book-christianbook/0186.htm",Read all Reasoning from the Scriptures with Catholics reviews
"/media/Dados/bases/SWDE/book/book-christianbook/0540.htm",Read all From Victim to Princess reviews
"/media/Dados/bases/SWDE/book/book-christianbook/1918.htm",Read all Meditation in Motion: Exercise Your Body and Soul - At the Same Time reviews
"/media/Dados/bases/SWDE/book/book-christianbook/0129.htm",Read all Becoming a Modern-Day Princess Journal reviews
"/media/Dados/bases/SWDE/book/book-christianbook/0442.htm","Read all God's Gifts to Me: God Made the World, Mini Board Book reviews"
"/media/Dados/bases/SWDE/book/book-christianbook/1301.htm",Read all The Gospel of the Kingdom: Scriptural Studies in the Kingdom of God reviews
"/media/Dados/bases/SWDE/book/book-christianbook/0013.htm",Read all Wedded Bliss? reviews
"/media/Dados/bases/SWDE/book/book-christianbook/1398.htm",Read all Calvin's Wisdom reviews
"/media/Dados/bases/SWDE/book/book-christianbook/0558.htm",Read all The Second Most Important Prayer reviews
"/media/Dados/bases/SWDE/book/book-christianbook/1612.htm",Read all The First Easter: The Story of Why We Celebrate Easter reviews
"/media/Dados/bases/SWDE/book/book-christianbook/1887.htm","Read all Christian Heroes Then & Now: Rachel Saint, A Star in the Jungle reviews"
"/media/Dados/bases/SWDE/book/book-christianbook/0897.htm",Read all God Talk: Cautions for Those Who Hear God's Voice reviews
"/media/Dados/bases/SWDE/book/book-christianbook/0079.htm",Read all Good Sense Counselor Training Workshop Participant's Guide reviews
"/media/Dados/bases/SWDE/book/book-christianbook/0284.htm",Read all The Prophet's Handbook: A Guide to Prophecy and Its Operation reviews
"/media/Dados/bases/SWDE/book/book-christianbook/1948.htm","Read all Kierkegaard's Writings, VI: Fear and Trembling/ Repetition reviews"
"/media/Dados/bases/SWDE/book/book-christianbook/1568.htm",Read all Gilbert Guide to Senior Housing reviews
"/media/Dados/bases/SWDE/book/book-christianbook/1241.htm",Read all Francis of Assisi: Living Fortitude reviews
"/media/Dados/bases/SWDE/book/book-christianbook/0163.htm","Read all The Reckoning, Heritage of Lancaster County Series #3 reviews"
"/media/Dados/bases/SWDE/book/book-christianbook/1277.htm",Read all Katy Duck Is a Caterpillar reviews
"/media/Dados/bases/SWDE/book/book-christianbook/1869.htm",Read all Heart's Haven reviews
"/media/Dados/bases/SWDE/book/book-christianbook/0164.htm",Read all Tell the Truth: The Whole Gospel to the Whole Person by Whole People reviews
"/media/Dados/bases/SWDE/book/book-christianbook/0680.htm",Read all A Girl's Best Friend reviews
"/media/Dados/bases/SWDE/book/book-christianbook/1724.htm","Read all Quaker Writing: An Anthology, 1650-1920 reviews"
"/media/Dados/bases/SWDE/book/book-christianbook/1142.htm",Read all Re-examining Paul's Letters: A History of the Pauline Correspondence reviews
"/media/Dados/bases/SWDE/book/book-christianbook/0928.htm",Read all Torn Asunder Workbook: Recovering from an Extramarital Affair reviews
"/media/Dados/bases/SWDE/book/book-christianbook/1487.htm",Read all Virgin Snow reviews
"/media/Dados/bases/SWDE/book/book-christianbook/0480.htm","Read all Oramos Pideindo Revelación, Paquete de 10 (A Prayer for Revelation, Pack of 10) reviews"
"/media/Dados/bases/SWDE/book/book-christianbook/0818.htm",Read all Shark reviews
"/media/Dados/bases/SWDE/book/book-christianbook/1958.htm","Read all New Sermons: Part 3, Volume 11 reviews"
"/media/Dados/bases/SWDE/book/book-christianbook/1743.htm",Read all Practicing Your Path: A Book of Retreats for an Intentional Life reviews
"/media/Dados/bases/SWDE/book/book-christianbook/1572.htm",Read all Just Jesus: The Message of a Better World reviews
"/media/Dados/bases/SWDE/book/book-christianbook/0225.htm",Read all Living the Presence of the Spirit reviews
"/media/Dados/bases/SWDE/book/book-christianbook/1987.htm",Read all A Young Person's Guide to Knowing God reviews
"/media/Dados/bases/SWDE/book/book-christianbook/0939.htm",Read all La Verdad Acerca del Matrimonio Homosexual (The Truth About Same-Sex Marriage) reviews
"/media/Dados/bases/SWDE/book/book-christianbook/0093.htm",Read all Be Authentic (Genesis 26-50) reviews
"/media/Dados/bases/SWDE/book/book-christianbook/0570.htm",Read all Worship in the New Testament: Divine Mystery and Human Response reviews
"/media/Dados/bases/SWDE/book/book-christianbook/1020.htm",Read all Heaven - The Threshold and Beyond: An Illustrated Panorama reviews
"/media/Dados/bases/SWDE/book/book-christianbook/1434.htm",Read all The Upward Call: Spiritual Formation & the Holy Life reviews
"/media/Dados/bases/SWDE/book/book-christianbook/0185.htm",Read all Be Real (1 John) reviews
"/media/Dados/bases/SWDE/book/book-christianbook/0571.htm","Read all Acts Part 2, The Church Ignited: Wisdom of the Word Series reviews"
"/media/Dados/bases/SWDE/book/book-christianbook/1678.htm",Read all When They Turn Away reviews
"/media/Dados/bases/SWDE/book/book-christianbook/1065.htm",Read all Sisters Bible Study for Women: Unfailing Love (Growing Closer to Jesus Christ) - DVD Curriculum reviews
"/media/Dados/bases/SWDE/book/book-christianbook/1876.htm",Read all Apostles reviews
"/media/Dados/bases/SWDE/book/book-christianbook/0870.htm",Read all Staying Alive: The Paratrooper's Story reviews
"/media/Dados/bases/SWDE/book/book-christianbook/0499.htm",Read all On Solitude reviews
"/media/Dados/bases/SWDE/book/book-christianbook/1677.htm",Read all From Physicist to Priest: An Autobiography reviews
"/media/Dados/bases/SWDE/book/book-christianbook/0902.htm",Read all The Intimate Marriage: A Practical Guide to Building a Great Marriage reviews
"/media/Dados/bases/SWDE/book/book-christianbook/0888.htm",Read all Rainforest Strategy: The Planet's Most Successful Business Model reviews
"/media/Dados/bases/SWDE/book/book-christianbook/0896.htm","Read all Reason for the Season: Ministerial Reflections on Personal Grief, Suffering and Loss reviews"
"/media/Dados/bases/SWDE/book/book-christianbook/1252.htm","Read all Nicolas/Nicolae, Left Behind Series #3, Spanish Edition reviews"
"/media/Dados/bases/SWDE/book/book-christianbook/0509.htm",Read all The New Context of Ministry: The Impact of the New Economy of the Church reviews
"/media/Dados/bases/SWDE/book/book-christianbook/0866.htm",Read all Good Grief: 50th Anniversary Gift Edition reviews
"/media/Dados/bases/SWDE/book/book-christianbook/1510.htm","Read all Psalms 1-59, Continental Commentary Series reviews"
"/media/Dados/bases/SWDE/book/book-christianbook/1457.htm",Read all Wrestling the Word: The Old Testament and the Christian Believer reviews
"/media/Dados/bases/SWDE/book/book-christianbook/0774.htm",Read all Reason Within the Bounds of Religion reviews
"/media/Dados/bases/SWDE/book/book-christianbook/1238.htm",Read all Politically Incorrect Guide to the Vietnam War reviews
"/media/Dados/bases/SWDE/book/book-christianbook/0465.htm",Read all The Gifts and Ministries of the Holy Spirit Updated Edition reviews
"/media/Dados/bases/SWDE/book/book-christianbook/0912.htm",Read all Elmo's Ducky Day reviews
"/media/Dados/bases/SWDE/book/book-christianbook/0890.htm",Read all Word-Order Variation in Biblical Hebrew Poetry: Differentiating Progmatics and Poetics reviews
"/media/Dados/bases/SWDE/book/book-christianbook/0666.htm",Read all Letters from Medjugorje reviews
"/media/Dados/bases/SWDE/book/book-christianbook/1614.htm","Read all Happy Birthday, Addy! Paperback reviews"
"/media/Dados/bases/SWDE/book/book-christianbook/1680.htm",Read all Money Life Basics- Investing & Insurance reviews
"/media/Dados/bases/SWDE/book/book-christianbook/0393.htm",Read all Java With the Judges: A Coffee Cup Bible Study reviews
"/media/Dados/bases/SWDE/book/book-christianbook/0044.htm",Read all God Calling reviews
"/media/Dados/bases/SWDE/book/book-christianbook/1178.htm",Read all Word Becomes Flesh Dimensions of Christology reviews
"/media/Dados/bases/SWDE/book/book-christianbook/1832.htm",Read all Expecting a Visitation of God's Grace Thru Worship: Una Presencia Manifiesta reviews
"/media/Dados/bases/SWDE/book/book-christianbook/1168.htm",Read all Children Are A Blessing From the Lord reviews
"/media/Dados/bases/SWDE/book/book-christianbook/0891.htm","Read all Abigail's Story, Large-print reviews"
"/media/Dados/bases/SWDE/book/book-christianbook/0434.htm",Read all How to Lead a LifeGuide Bible Study reviews
"/media/Dados/bases/SWDE/book/book-christianbook/0387.htm","Read all The Confession, Heritage of Lancaster County Series #2 reviews"
"/media/Dados/bases/SWDE/book/book-christianbook/1580.htm",Read all Sunshine Country: A Story of Family Love and Home reviews
"/media/Dados/bases/SWDE/book/book-christianbook/1088.htm",Read all The Reality of God and the Problem of Evil reviews
"/media/Dados/bases/SWDE/book/book-christianbook/0084.htm",Read all Know the Truth: A Handbook of Christian Belief reviews
"/media/Dados/bases/SWDE/book/book-christianbook/1769.htm","Read all Single, Married, Separated, And Life After Divorce reviews"
"/media/Dados/bases/SWDE/book/book-christianbook/1950.htm",Read all Vacation Time reviews
"/media/Dados/bases/SWDE/book/book-christianbook/1079.htm",Read all Win It All: The Way to Heaven for Catholic Teens reviews
"/media/Dados/bases/SWDE/book/book-christianbook/0815.htm",Read all Once in Blueberry Dell reviews
"/media/Dados/bases/SWDE/book/book-christianbook/1763.htm","Read all Old Testament Exegesis, 3rd Ed.: A Handbook For Students And Pastors reviews"
"/media/Dados/bases/SWDE/book/book-christianbook/0279.htm",Read all Too Soon to Quit!: Fifteen Achievers from the Bible Teach Us How to Keep Going and How to Finish Well reviews
"/media/Dados/bases/SWDE/book/book-christianbook/0893.htm","Read all Poder del Espiritu Santa, Holy Spirit Power reviews"
"/media/Dados/bases/SWDE/book/book-christianbook/1662.htm",Read all Old Testament Evangelistic Sermons reviews
"/media/Dados/bases/SWDE/book/book-christianbook/1712.htm",Read all Comience a Disfrutar su Vida (Enjoy Life: Moving Past Everyday Struggles) reviews
"/media/Dados/bases/SWDE/book/book-christianbook/1417.htm",Read all Exploring Proverbs Volume 2 reviews
"/media/Dados/bases/SWDE/book/book-christianbook/0772.htm",Read all Sundays with Scottie reviews
"/media/Dados/bases/SWDE/book/book-christianbook/0133.htm",Read all Questioning Evangelism: Engaging People's Hearts the Way Jesus Did reviews
"/media/Dados/bases/SWDE/book/book-christianbook/1925.htm","Read all Art, Creativity, and the Sacred reviews"
"/media/Dados/bases/SWDE/book/book-christianbook/0001.htm",Read all How to Pray: The Best of John Wesley on Prayer reviews
"/media/Dados/bases/SWDE/book/book-christianbook/0760.htm","Read all Nancy's Mysterious Letter, Nancy Drew Mystery Stories Series #8 reviews"
"/media/Dados/bases/SWDE/book/book-christianbook/1260.htm",Read all The Way of Prayer: Learning to Pray with the Our Father reviews
"/media/Dados/bases/SWDE/book/book-christianbook/0414.htm",Read all Basic Training For The Prophetic Ministry reviews
"/media/Dados/bases/SWDE/book/book-christianbook/1787.htm",Read all Hug Hug! reviews
"/media/Dados/bases/SWDE/book/book-christianbook/0675.htm","Read all Jeremiah, Volume 1, Hermeneia Commentary Series reviews"
"/media/Dados/bases/SWDE/book/book-christianbook/1493.htm",Read all Conciliarism and Papalism reviews
"/media/Dados/bases/SWDE/book/book-christianbook/1462.htm",Read all Ordinary Orchards: The Secret Revealed reviews
"/media/Dados/bases/SWDE/book/book-christianbook/0969.htm",Read all Reverend Fun...Offline reviews
"/media/Dados/bases/SWDE/book/book-christianbook/0294.htm","Read all The Pine Tree Parable, The Parable Series #4 reviews"
"/media/Dados/bases/SWDE/book/book-christianbook/1844.htm",Read all Boat reviews
"/media/Dados/bases/SWDE/book/book-christianbook/1759.htm",Read all Absolute Truths reviews
"/media/Dados/bases/SWDE/book/book-christianbook/1471.htm","Read all Flight of the Outcasts, Aedyn Chronicles Series #2 reviews"
"/media/Dados/bases/SWDE/book/book-christianbook/0095.htm",Read all The Tangible Kingdom: Creating Incarnational Community reviews
"/media/Dados/bases/SWDE/book/book-christianbook/1197.htm",Read all Becoming the Noble Woman: Is God's Master Plan for the Ideal Wife and Mother reviews
"/media/Dados/bases/SWDE/book/book-christianbook/1333.htm",Read all But God reviews
"/media/Dados/bases/SWDE/book/book-christianbook/1717.htm",Read all Winter: A Spiritual Biography of the Season reviews
"/media/Dados/bases/SWDE/book/book-christianbook/0158.htm",Read all Psalms: The Prayerbook of the Bible reviews
"/media/Dados/bases/SWDE/book/book-christianbook/1294.htm",Read all Teach Me to Pray: Learning to Pray Like Jesus reviews
"/media/Dados/bases/SWDE/book/book-christianbook/0700.htm",Read all The Transforming Power of God reviews
"/media/Dados/bases/SWDE/book/book-christianbook/0822.htm",Read all Inspired By Autism: A Spoonful of Comfort for Parents of Children with Disabilities reviews
"/media/Dados/bases/SWDE/book/book-christianbook/0599.htm",Read all Joy To The World reviews
"/media/Dados/bases/SWDE/book/book-christianbook/1054.htm","Read all Transformation: Discipleship that Turns Lives, Churches, and the World Upside Down reviews"
"/media/Dados/bases/SWDE/book/book-christianbook/1233.htm",Read all Desert Wisdom: Sayings from the Desert Fathers reviews
"/media/Dados/bases/SWDE/book/book-christianbook/1903.htm",Read all Molly Who Flew Away reviews
"/media/Dados/bases/SWDE/book/book-christianbook/0668.htm","Read all Gold of Kings, Large print reviews"
"/media/Dados/bases/SWDE/book/book-christianbook/0037.htm",Read all Virginia Brides reviews
"/media/Dados/bases/SWDE/book/book-christianbook/0310.htm",Read all Jesus Returns to Heaven (revised) Easter Arch Books reviews
"/media/Dados/bases/SWDE/book/book-christianbook/1112.htm",Read all On the Absence and Unknowability of God: Heidegger and the Areopagite reviews
"/media/Dados/bases/SWDE/book/book-christianbook/1310.htm",Read all Kings and Carpenters: One Hundred Bible Land Jobs You Might Have Praised or Panned reviews
"/media/Dados/bases/SWDE/book/book-christianbook/1001.htm",Read all Fasting: A Biblical Historical Study reviews
"/media/Dados/bases/SWDE/book/book-christianbook/1224.htm",Read all Restoring Relationships: 5 Things to Try Before you Say Goodbye reviews
"/media/Dados/bases/SWDE/book/book-christianbook/0343.htm",Read all The Letter to the Ephesians: The Pillar New Testament Commentary reviews
"/media/Dados/bases/SWDE/book/book-christianbook/0175.htm","Read all Leadership Essentials: Shaping Vision, Multiplying Influence, Defining Character reviews"
"/media/Dados/bases/SWDE/book/book-christianbook/1308.htm","Read all Suzanne Tate's Nature Series #17: Katie K. Whale, A Whale of a Tale reviews"
"/media/Dados/bases/SWDE/book/book-christianbook/0262.htm",Read all Daniel: An Ironside Expository Commentary reviews
"/media/Dados/bases/SWDE/book/book-christianbook/0418.htm",Read all Right and Wrong Thinking reviews
"/media/Dados/bases/SWDE/book/book-christianbook/1641.htm",Read all Revelation reviews
"/media/Dados/bases/SWDE/book/book-christianbook/0601.htm",Read all Collected Works of Watchman Nee #3 reviews
"/media/Dados/bases/SWDE/book/book-christianbook/0533.htm","Read all The Thirteenth Pearl, Nancy Drew Mystery Stories Series #56 reviews"
"/media/Dados/bases/SWDE/book/book-christianbook/1802.htm",Read all 100 Respuestas a 100 Preguntas Acerca de la Oración (100 Answers to 100 Questions about God's Promises for You) reviews
"/media/Dados/bases/SWDE/book/book-christianbook/1625.htm",Read all Gold Tried in The Fire: Tested Truths for Trying Times reviews
"/media/Dados/bases/SWDE/book/book-christianbook/0519.htm",Read all God's Fervent Love: Discovering Peace and Joy in an Age of Fear reviews
"/media/Dados/bases/SWDE/book/book-christianbook/0995.htm",Read all Spirit and Spirituality reviews
"/media/Dados/bases/SWDE/book/book-christianbook/1913.htm",Read all Weather! reviews
"/media/Dados/bases/SWDE/book/book-christianbook/1945.htm",Read all The Way of a Pilgrim: Complete Text and Reader's Guide reviews
"/media/Dados/bases/SWDE/book/book-christianbook/0153.htm",Read all Oraciones Que Rompen Maldiciones (Prayers That Break Curses) reviews
"/media/Dados/bases/SWDE/book/book-christianbook/1891.htm",Read all The Faith Once For All: Bible Doctrine for Today reviews
"/media/Dados/bases/SWDE/book/book-christianbook/0099.htm",Read all The Postcard reviews
"/media/Dados/bases/SWDE/book/book-christianbook/1263.htm",Read all Reflections of Messiah: Contemporary Advent Meditations Inspired by Handel reviews
"/media/Dados/bases/SWDE/book/book-christianbook/0087.htm",Read all Discipleship of the Mind: Learning to Love God in the Ways We Think reviews
"/media/Dados/bases/SWDE/book/book-christianbook/1100.htm",Read all Descent into Hell reviews
"/media/Dados/bases/SWDE/book/book-christianbook/0504.htm",Read all Advent and Christmas: Bridges to Contemplative Living with Thomas Merton reviews
"/media/Dados/bases/SWDE/book/book-christianbook/1258.htm",Read all Reason Informed by Faith: Foundations of Christian Morality reviews
"/media/Dados/bases/SWDE/book/book-christianbook/1410.htm",Read all Prayers and Promises for Supernatural Childbirth reviews
"/media/Dados/bases/SWDE/book/book-christianbook/1379.htm",Read all Selected Writings-Eckhart reviews
"/media/Dados/bases/SWDE/book/book-christianbook/0410.htm","Read all The Special Treat, Pack of 25 Tracts reviews"
"/media/Dados/bases/SWDE/book/book-christianbook/0869.htm",Read all Slavery in Early Christianity reviews
"/media/Dados/bases/SWDE/book/book-christianbook/1063.htm",Read all iFaith: Connecting With God in the 21st Century reviews
"/media/Dados/bases/SWDE/book/book-christianbook/0041.htm",Read all Prayers That Heal The Heart reviews
"/media/Dados/bases/SWDE/book/book-christianbook/1356.htm",Read all Who Has Bewitched You? reviews
"/media/Dados/bases/SWDE/book/book-christianbook/1702.htm","Read all The Apocalyptic Imagination, An Introduction to Jewish Apocalyptic Literature reviews"
"/media/Dados/bases/SWDE/book/book-christianbook/1638.htm",Read all Amazing Encounters with God: Stories to Open Your Eyes to His Power reviews
"/media/Dados/bases/SWDE/book/book-christianbook/0961.htm",Read all Lifeskills for Adult Children reviews
"/media/Dados/bases/SWDE/book/book-christianbook/0402.htm","Read all The Gospel of Matthew New International Commentary on the New Testament, NICNT reviews"
"/media/Dados/bases/SWDE/book/book-christianbook/1365.htm",Read all Miracles of the Bible: A Celebration of the Wonders of God reviews
"/media/Dados/bases/SWDE/book/book-christianbook/1090.htm",Read all Love Has Come: A Twenty-Eight Day Journey Through the Gospel of Matthew reviews
"/media/Dados/bases/SWDE/book/book-christianbook/0507.htm",Read all In Search of the Genesis World: Debunking the Evolution Myth reviews
"/media/Dados/bases/SWDE/book/book-christianbook/1600.htm","Read all Cry in the Night, Rock Harbor Series #4, Large Print reviews"
"/media/Dados/bases/SWDE/book/book-christianbook/0567.htm",Read all Autobiography reviews
"/media/Dados/bases/SWDE/book/book-christianbook/1474.htm",Read all The Feeling Intellect: Reading the Bible with C. S. Lewis reviews
"/media/Dados/bases/SWDE/book/book-christianbook/1234.htm","Read all My First Family Photo Album, A Personal Photo Storybook reviews"
"/media/Dados/bases/SWDE/book/book-christianbook/1196.htm",Read all We're Running Late!: Teachable Moments for Working Mothers reviews
"/media/Dados/bases/SWDE/book/book-christianbook/1332.htm",Read all Seven Spiritual Gifts of Waiting reviews
"/media/Dados/bases/SWDE/book/book-christianbook/1587.htm",Read all Closer to God Youth Experiencing Prayer reviews
"/media/Dados/bases/SWDE/book/book-christianbook/1080.htm","Read all The Books of James & First and Second Peter: Faith, Suffering and Knowledge - Twenty-first Century Biblical Commentary reviews"
"/media/Dados/bases/SWDE/book/book-christianbook/1226.htm",Read all Following God's Plan For Your Life reviews
"/media/Dados/bases/SWDE/book/book-christianbook/1139.htm",Read all Restoration of Men reviews
"/media/Dados/bases/SWDE/book/book-christianbook/0166.htm",Read all Between Two Worlds reviews
"/media/Dados/bases/SWDE/book/book-christianbook/1225.htm",Read all Missing Persons and Mistaken Identities: Women and Gender in Ancient Israel reviews
"/media/Dados/bases/SWDE/book/book-christianbook/1014.htm",Read all Trekking Toward Wholeness: A Resource for Care Group Leaders reviews
