URL,EXTRACTED VALUE
"/media/Dados/bases/SWDE/book/book-christianbook/0181.htm",Author Ed Decker is the founder and International Director of
"/media/Dados/bases/SWDE/book/book-christianbook/1357.htm",Warning: Choking Hazard. Contains small parts--not intended for children under 3 years old.
"/media/Dados/bases/SWDE/book/book-christianbook/1215.htm","Based on her own experience as a pastor's wife, in-depth research and interviews with Christian counselors and medical professionals, the author of"
"/media/Dados/bases/SWDE/book/book-christianbook/0721.htm",This edition in the
"/media/Dados/bases/SWDE/book/book-christianbook/0405.htm","As with all BECNT volumes,"
"/media/Dados/bases/SWDE/book/book-christianbook/1929.htm","Based on Chuck Swindoll's,"
"/media/Dados/bases/SWDE/book/book-christianbook/1000.htm","Written by a health writer and mother of four and reviewed by a certified midwife and registered nurse,"
"/media/Dados/bases/SWDE/book/book-christianbook/0451.htm",Includes chapter guides for personal reflection or group discussions
"/media/Dados/bases/SWDE/book/book-christianbook/1384.htm",. The life and times of the author
"/media/Dados/bases/SWDE/book/book-christianbook/0897.htm",In
"/media/Dados/bases/SWDE/book/book-christianbook/1307.htm","""...Es maravilloso que tú, el Señor de la vida, me invites a dar vida. De tí la recibo en cada instante y ahora me llamas a compartirla."""
"/media/Dados/bases/SWDE/book/book-christianbook/0770.htm",served as pastor of St Micheals Lutheran Church in Philadelphia for more than 20 years. She holds an MDiv degree from Harvard Divinity School.
"/media/Dados/bases/SWDE/book/book-christianbook/0619.htm",offers sensitive and liberating insights that will help reader express emotions and experience emotional wholeness. Paperback.
"/media/Dados/bases/SWDE/book/book-christianbook/1293.htm",In
"/media/Dados/bases/SWDE/book/book-christianbook/0928.htm",The workbook allows couples to work through and apply the material presented in
"/media/Dados/bases/SWDE/book/book-christianbook/1389.htm",Contents and contributors include:
"/media/Dados/bases/SWDE/book/book-christianbook/1960.htm",Each chapter includes questions for reflection and guidelines for small groups or a Lenten retreat.
"/media/Dados/bases/SWDE/book/book-christianbook/0321.htm",is poised to show new readers just how special their country is.
"/media/Dados/bases/SWDE/book/book-christianbook/0444.htm",In
"/media/Dados/bases/SWDE/book/book-christianbook/1273.htm","When they complete the activities, they will gain a strong working knowledge of ADHD and its characteristics. Included are:"
"/media/Dados/bases/SWDE/book/book-christianbook/0223.htm",", and a long time associate of Tozer, has written an Introduction to the book that delightfully captures Tozer's irascible genius."
"/media/Dados/bases/SWDE/book/book-christianbook/0439.htm",This thought-provoking and intimate study includes:
"/media/Dados/bases/SWDE/book/book-christianbook/0923.htm","Norman Geisler (PhD, Loyola University) is president of Southern Evangelical Seminary and author or coauthor of over fifty books including"
"/media/Dados/bases/SWDE/book/book-christianbook/0330.htm",is a companion to
"/media/Dados/bases/SWDE/book/book-christianbook/0544.htm","The longing for spiritual fulfillment, inevitably paired with spiritual frustration, is common among Christians."
"/media/Dados/bases/SWDE/book/book-christianbook/0426.htm",", the studies in this guide are designed to bring us to the heart of the cross with an understanding of what was accomplished there on our behalf."
"/media/Dados/bases/SWDE/book/book-christianbook/0293.htm",and
"/media/Dados/bases/SWDE/book/book-christianbook/0317.htm",In
"/media/Dados/bases/SWDE/book/book-christianbook/0130.htm",Douglas J. Moo is Blanchard Professor of New Testament at Wheaton Graduate School.
"/media/Dados/bases/SWDE/book/book-christianbook/0873.htm","A teacher for over 30 years, author Michael ""Doc"" Pennock knows that to connect with youth, you have to connect to their most heartfelt concerns. In"
"/media/Dados/bases/SWDE/book/book-christianbook/0228.htm",In
"/media/Dados/bases/SWDE/book/book-christianbook/1907.htm",Dear's efforts on behalf of social justice and world peace have won him international admiration and spurred features in the
"/media/Dados/bases/SWDE/book/book-christianbook/1936.htm",and he shares his findings with you. Discover how to:
"/media/Dados/bases/SWDE/book/book-christianbook/1348.htm","This lighthearted story, with bold and comical illustrations, will have readers cheering for the lovable Swimming Sal."
"/media/Dados/bases/SWDE/book/book-christianbook/1715.htm","In our ongoing battle against sin in our life as believers, we need all the help we can get."
"/media/Dados/bases/SWDE/book/book-christianbook/1410.htm",Based on
"/media/Dados/bases/SWDE/book/book-christianbook/1366.htm",Then a weekend with Kristen helps Joy see that God has been watching over her all along and that his plan for Joy just might reaching our to Patti.
"/media/Dados/bases/SWDE/book/book-christianbook/0888.htm",. How to define your vision and find your focus
"/media/Dados/bases/SWDE/book/book-christianbook/0161.htm","The first in Bill Myers' witty and wacky fictions series,"
"/media/Dados/bases/SWDE/book/book-christianbook/1726.htm",series.
"/media/Dados/bases/SWDE/book/book-christianbook/1558.htm",returns us to the mythical realm of
"/media/Dados/bases/SWDE/book/book-christianbook/0465.htm",In
"/media/Dados/bases/SWDE/book/book-christianbook/1234.htm",Contains small parts: Not recommended for children under 3 years
"/media/Dados/bases/SWDE/book/book-christianbook/0075.htm",In
"/media/Dados/bases/SWDE/book/book-christianbook/0154.htm",Each of the session contains:
"/media/Dados/bases/SWDE/book/book-christianbook/0367.htm",Features & Benefits
"/media/Dados/bases/SWDE/book/book-christianbook/1477.htm",is great for the new believer as well as for Christian who needs some clarity in the essentials of the faith and in their application.
"/media/Dados/bases/SWDE/book/book-christianbook/0416.htm","Craig L. Blomberg (Ph.D., Aberdeen) is Distinguished Professor of New Testament at Denver Seminary in Denver, Colorado. His books include"
"/media/Dados/bases/SWDE/book/book-christianbook/0454.htm",Based on the thousands of questions sent to the editors by readers of
"/media/Dados/bases/SWDE/book/book-christianbook/1008.htm",Seize this opportunity to learn what our Master has to teach us about mentoring!
