URL,EXTRACTED VALUE
"/media/Dados/bases/SWDE/book/book-christianbook/1053.htm",Focus on the Family
"/media/Dados/bases/SWDE/book/book-christianbook/1157.htm",American Idol
"/media/Dados/bases/SWDE/book/book-christianbook/0462.htm",Still More TalkSheets for High School Students
"/media/Dados/bases/SWDE/book/book-christianbook/0155.htm",Deeper Connections Series
"/media/Dados/bases/SWDE/book/book-christianbook/0718.htm",Madres de la Biblia
"/media/Dados/bases/SWDE/book/book-christianbook/0151.htm",Vine's Complete Expository Dictionary of Old and New Testament Words
"/media/Dados/bases/SWDE/book/book-christianbook/1916.htm",Robert E. Webber Center for an Ancient-Evangelical Future
"/media/Dados/bases/SWDE/book/book-christianbook/1688.htm",Lo que no digo cantando
