URL,EXTRACTED VALUE
"/media/Dados/bases/SWDE/book/book-christianbook/1292.htm","Teens Talk Middle School-101 Stories of Life, Love, and Learning For Younger Teens"
"/media/Dados/bases/SWDE/book/book-christianbook/1426.htm",Karl Barth & the Pietists: The Young Karl Barth's Critique of Pietism & Its Response
"/media/Dados/bases/SWDE/book/book-christianbook/1048.htm",Silent Pledge
"/media/Dados/bases/SWDE/book/book-christianbook/0336.htm","Faithgirlz! Shine On, Girl: Devotions to Keep You Smiling"
"/media/Dados/bases/SWDE/book/book-christianbook/1172.htm",What Is Faith?
"/media/Dados/bases/SWDE/book/book-christianbook/1152.htm",The Easter Angels
"/media/Dados/bases/SWDE/book/book-christianbook/1128.htm",Beyond Me: Living a You-First Life in a Me-First World
"/media/Dados/bases/SWDE/book/book-christianbook/1608.htm",Lifepac Select: Astronomy
"/media/Dados/bases/SWDE/book/book-christianbook/1058.htm",Strengthening the Soul of Your Leadership: Seeking God in the Crucible of Ministry
"/media/Dados/bases/SWDE/book/book-christianbook/0219.htm",God's Smuggler: 35th Anniversary Edition
"/media/Dados/bases/SWDE/book/book-christianbook/0298.htm",Life Lessons: The Gospel of John
"/media/Dados/bases/SWDE/book/book-christianbook/1188.htm","So Long, Insecurity: You've Been a Bad Friend to Us, Hardcover"
"/media/Dados/bases/SWDE/book/book-christianbook/1170.htm",Living Lights: The Berenstain Bears Play a Good Game
"/media/Dados/bases/SWDE/book/book-christianbook/1190.htm",Surviving the Holocaust
"/media/Dados/bases/SWDE/book/book-christianbook/0690.htm","Twilight's Serenade, Songs of Alaska Series #3"
"/media/Dados/bases/SWDE/book/book-christianbook/0085.htm","Acts: Build Community, New Community Series"
"/media/Dados/bases/SWDE/book/book-christianbook/1092.htm",VeggieTales: Larry Boy and the Bad Apple: A Lesson in Fighting Temptation
"/media/Dados/bases/SWDE/book/book-christianbook/1293.htm","I'm Amazed, Accompaniment CD"
"/media/Dados/bases/SWDE/book/book-christianbook/0687.htm","#2: Infidel-Graphic Novel"
"/media/Dados/bases/SWDE/book/book-christianbook/1646.htm",The Emerging Church: A Model for Change and a Map for Renewal
"/media/Dados/bases/SWDE/book/book-christianbook/1956.htm","Ministerial Ethics, Second Edition"
"/media/Dados/bases/SWDE/book/book-christianbook/1391.htm","Invasion of the Widows' Club, Widows Club Series #2"
"/media/Dados/bases/SWDE/book/book-christianbook/0266.htm","Santee Series, Vols 1-2"
"/media/Dados/bases/SWDE/book/book-christianbook/0034.htm",Here Burns My Candle
"/media/Dados/bases/SWDE/book/book-christianbook/1150.htm",Teen Study Bible Revised Mud Splat Moss
"/media/Dados/bases/SWDE/book/book-christianbook/1023.htm",How Much Is That Doggie in the Window? Board Book
"/media/Dados/bases/SWDE/book/book-christianbook/0894.htm",Curious George Goes to a Movie Softcover
"/media/Dados/bases/SWDE/book/book-christianbook/1749.htm",Preparing for Adolescence: How to Survive the Coming Years of Change
"/media/Dados/bases/SWDE/book/book-christianbook/0318.htm","Lit Links: Misty of Chincoteague, Grades 4-6"
"/media/Dados/bases/SWDE/book/book-christianbook/0351.htm",Spiritual Depression
"/media/Dados/bases/SWDE/book/book-christianbook/1788.htm",The Complete Therese of Lisieux
"/media/Dados/bases/SWDE/book/book-christianbook/0803.htm",Be Hopeful (1 Peter)
"/media/Dados/bases/SWDE/book/book-christianbook/1817.htm",Life Is Tremendous
"/media/Dados/bases/SWDE/book/book-christianbook/1649.htm",My Giving Bank
"/media/Dados/bases/SWDE/book/book-christianbook/1991.htm",How to Pray: The Best of John Wesley on Prayer
"/media/Dados/bases/SWDE/book/book-christianbook/0357.htm","God, I Need to Talk with You about Paying Attention"
"/media/Dados/bases/SWDE/book/book-christianbook/0784.htm",A Guy's Guide to Life: How to Become a Man in 224 Pages or Less
"/media/Dados/bases/SWDE/book/book-christianbook/1338.htm",Together for Life
"/media/Dados/bases/SWDE/book/book-christianbook/0545.htm","#2: Last Breath"
"/media/Dados/bases/SWDE/book/book-christianbook/1476.htm",The Fox and the Hound: Hide and Seek
"/media/Dados/bases/SWDE/book/book-christianbook/0692.htm",Mayhem in Maryland
"/media/Dados/bases/SWDE/book/book-christianbook/0977.htm",Know Your Bible: All 66 Books Explained and Applied
"/media/Dados/bases/SWDE/book/book-christianbook/0576.htm","The Thorn, Rose Trilogy Series #1"
"/media/Dados/bases/SWDE/book/book-christianbook/0370.htm",Great Lives: Elijah: A Man of Heroism and Humility
"/media/Dados/bases/SWDE/book/book-christianbook/0030.htm",The Power of a Praying Wife: Book of Prayers
"/media/Dados/bases/SWDE/book/book-christianbook/0188.htm",Whatever Happened to Truth?
"/media/Dados/bases/SWDE/book/book-christianbook/1880.htm",Know Your Bible: All 66 Books Explained and Applied
"/media/Dados/bases/SWDE/book/book-christianbook/0947.htm",Faith & Doubt
"/media/Dados/bases/SWDE/book/book-christianbook/1768.htm","Elementary Greek, Year One Kit"
"/media/Dados/bases/SWDE/book/book-christianbook/1146.htm",Bringing Home the Gospel: A Weekly Journal for Catholic Parents: The Year of Mark
"/media/Dados/bases/SWDE/book/book-christianbook/1626.htm",The Life Recovery Workbook: A Biblical Guide Through the 12 Steps
"/media/Dados/bases/SWDE/book/book-christianbook/0098.htm",The Gospel According to Jesus: Revised & Updated Anniversary Edition
"/media/Dados/bases/SWDE/book/book-christianbook/1933.htm","Germ: If You Breathe, It Will Find You"
"/media/Dados/bases/SWDE/book/book-christianbook/0371.htm",Pride and Prejudice
"/media/Dados/bases/SWDE/book/book-christianbook/1596.htm",Topical Memory System Life Issues
"/media/Dados/bases/SWDE/book/book-christianbook/0872.htm",Libere Su Potencial (Releasing Your Potential)
"/media/Dados/bases/SWDE/book/book-christianbook/0367.htm","Evangelical Dictionary of Theology, 2nd Edition"
"/media/Dados/bases/SWDE/book/book-christianbook/0375.htm","Run Baby Run, DVD"
"/media/Dados/bases/SWDE/book/book-christianbook/1820.htm","Everything You Want to Know About the Bible: Well . . . Maybe Not Everything, but Enough to Get You Started"
"/media/Dados/bases/SWDE/book/book-christianbook/0997.htm","Paddle-to-the-Sea, Hardcover"
"/media/Dados/bases/SWDE/book/book-christianbook/1409.htm",Evidence Not Seen: A Woman's Miraculous Faith in the Jungles of World War II
"/media/Dados/bases/SWDE/book/book-christianbook/0236.htm",The Story of Rolf and the Viking Bow
"/media/Dados/bases/SWDE/book/book-christianbook/0328.htm","Attributes of God, Book and Study Guide"
"/media/Dados/bases/SWDE/book/book-christianbook/1345.htm",The Anatomy of Grace
"/media/Dados/bases/SWDE/book/book-christianbook/0587.htm",My Giant Fold-Out Bible Stories
"/media/Dados/bases/SWDE/book/book-christianbook/1027.htm",The Tale of the Flopsy Bunnies
"/media/Dados/bases/SWDE/book/book-christianbook/0695.htm",Know Your Bible: All 66 Books Explained and Applied
"/media/Dados/bases/SWDE/book/book-christianbook/1883.htm",Greeting 101: Easy Steps to Greeting in the Local Church
"/media/Dados/bases/SWDE/book/book-christianbook/0198.htm",El Poder De Los Padres Que Oran (The Power of a Praying Parent)
"/media/Dados/bases/SWDE/book/book-christianbook/1351.htm","The Mystery of History & Enrichment4You.com, Volume 1 Craft Pak on CD-ROM"
"/media/Dados/bases/SWDE/book/book-christianbook/0172.htm","Before You Say I Do, Revised and Expanded"
"/media/Dados/bases/SWDE/book/book-christianbook/0203.htm",Heaven - Audiobook on CD
"/media/Dados/bases/SWDE/book/book-christianbook/1889.htm",Saved by Grace
"/media/Dados/bases/SWDE/book/book-christianbook/0156.htm","Robber of the Cruel Streets: The Prayerful Life of George Muller, DVD"
"/media/Dados/bases/SWDE/book/book-christianbook/0844.htm",Shield of Faith--Pewter Pendant
"/media/Dados/bases/SWDE/book/book-christianbook/0535.htm",The Pastoral Care of Depression: A Guidebook
"/media/Dados/bases/SWDE/book/book-christianbook/1752.htm",Answers for Difficult Days: Surviving the Storm of Secularism
"/media/Dados/bases/SWDE/book/book-christianbook/0525.htm",Bible Blurt! Card Game
"/media/Dados/bases/SWDE/book/book-christianbook/1773.htm",Becoming the Woman God Wants Me to Be: A 90-Day Guide to Living the Proverbs 31 Life
"/media/Dados/bases/SWDE/book/book-christianbook/0992.htm",7 Things He'll Never Tell You...But You Need to Know
"/media/Dados/bases/SWDE/book/book-christianbook/0307.htm","The Epistle to the Romans, NICNT, New International Commentary on the New Testament"
"/media/Dados/bases/SWDE/book/book-christianbook/0194.htm","Fifth Seal, A.D. Chronicles Series #5"
"/media/Dados/bases/SWDE/book/book-christianbook/1866.htm","Ephesians, Philippian, Colossians, and Philemon"
"/media/Dados/bases/SWDE/book/book-christianbook/0957.htm","The Supremacy of God in Preaching, rev. ed."
"/media/Dados/bases/SWDE/book/book-christianbook/1235.htm",Black Beauty
"/media/Dados/bases/SWDE/book/book-christianbook/0798.htm",Crazy Love: Overwhelmed by a Relentless God
"/media/Dados/bases/SWDE/book/book-christianbook/0189.htm","The Book of Isaiah, 3 Volumes"
"/media/Dados/bases/SWDE/book/book-christianbook/0565.htm",Arithmetic Series One- Quarter Two
"/media/Dados/bases/SWDE/book/book-christianbook/0076.htm","Wisdom: Making Life Work, Christian Basics Bible Studies"
"/media/Dados/bases/SWDE/book/book-christianbook/0091.htm",Nothing Daunted: The Story of Isobel Kuhn
"/media/Dados/bases/SWDE/book/book-christianbook/1645.htm",Key to the Prison
"/media/Dados/bases/SWDE/book/book-christianbook/1629.htm",How to Read the Bible for All Its Worth
"/media/Dados/bases/SWDE/book/book-christianbook/1355.htm",The Hardy Boys' Mysteries #52: The Shattered Helmet
"/media/Dados/bases/SWDE/book/book-christianbook/1963.htm",The Best Christmas Gift Ever Activity Book
"/media/Dados/bases/SWDE/book/book-christianbook/1349.htm",The Way of the Heart
"/media/Dados/bases/SWDE/book/book-christianbook/0880.htm",Mysteries of the Glory Unveiled: A New Wave of Signs & Wonders
"/media/Dados/bases/SWDE/book/book-christianbook/0726.htm",Meeting Jesus in the Sacraments
"/media/Dados/bases/SWDE/book/book-christianbook/0910.htm",Chicka Chicka ABC
"/media/Dados/bases/SWDE/book/book-christianbook/1284.htm",Opening Up Psalms
"/media/Dados/bases/SWDE/book/book-christianbook/0689.htm",A Family Guide to the Bible
"/media/Dados/bases/SWDE/book/book-christianbook/0400.htm",No Wonder They Call Him the Savior: Experiencing the Truth of the Cross
"/media/Dados/bases/SWDE/book/book-christianbook/0169.htm",Narnia Chronology
"/media/Dados/bases/SWDE/book/book-christianbook/1273.htm","God, I Need to Talk with You about Paying Attention"
"/media/Dados/bases/SWDE/book/book-christianbook/0764.htm",The Importance of Being Foolish: How to Think Like Jesus
"/media/Dados/bases/SWDE/book/book-christianbook/0395.htm","The 21 Irrefutable Laws of Leadership, 10th Anniversary Edition"
"/media/Dados/bases/SWDE/book/book-christianbook/1919.htm",Jonah
"/media/Dados/bases/SWDE/book/book-christianbook/0436.htm",The Reason for God: Belief in God in an Age of Skepticism
"/media/Dados/bases/SWDE/book/book-christianbook/1928.htm",A Matter of Conviction: A History of Southern Baptist Engagement with the Culture
"/media/Dados/bases/SWDE/book/book-christianbook/1518.htm","Colossians & Philemon, NT Wright for Everyone Series"
"/media/Dados/bases/SWDE/book/book-christianbook/1732.htm",Mysteries in Our National Parks #13: Night of the Black Bear
"/media/Dados/bases/SWDE/book/book-christianbook/0810.htm","Christian Worship Worldwide: Expanding Horizons, Deepening Practices"
"/media/Dados/bases/SWDE/book/book-christianbook/1692.htm","The Knight, Bowers Files Series #3"
"/media/Dados/bases/SWDE/book/book-christianbook/1867.htm",Know Your Bible: All 66 Books Explained and Applied
"/media/Dados/bases/SWDE/book/book-christianbook/0293.htm",Old Testament Survey
"/media/Dados/bases/SWDE/book/book-christianbook/0009.htm","The Search, Lancaster County Secrets Series #3"
"/media/Dados/bases/SWDE/book/book-christianbook/1053.htm",How to Pray: The Best of John Wesley on Prayer
"/media/Dados/bases/SWDE/book/book-christianbook/0427.htm",Blue Genes
"/media/Dados/bases/SWDE/book/book-christianbook/1164.htm","Lost Art Of Intercession, Expanded Edition"
"/media/Dados/bases/SWDE/book/book-christianbook/0606.htm",Beyond the Shadowlands: C.S. Lewis on Heaven & Hell
"/media/Dados/bases/SWDE/book/book-christianbook/0401.htm",Scripture Confessions for Finances
"/media/Dados/bases/SWDE/book/book-christianbook/1275.htm",The Tower of Babel
"/media/Dados/bases/SWDE/book/book-christianbook/1002.htm",Streams of Living Water
"/media/Dados/bases/SWDE/book/book-christianbook/1868.htm",Lo Hizo por Tí (He Did this Just for You)
"/media/Dados/bases/SWDE/book/book-christianbook/0996.htm",The Christmas Miracle Of Jonathan Toomey With CD
"/media/Dados/bases/SWDE/book/book-christianbook/1731.htm",The Steps to Freedom in Christ
"/media/Dados/bases/SWDE/book/book-christianbook/0051.htm",Daniel and the Roaring Lions
"/media/Dados/bases/SWDE/book/book-christianbook/0889.htm",Desperate Women of the Bible: Lessons on Passion from the Gospels
"/media/Dados/bases/SWDE/book/book-christianbook/0531.htm",The Skeptic's Guide to Global Poverty
"/media/Dados/bases/SWDE/book/book-christianbook/1706.htm",Breaking the Bondage of Legalism: When Trying Harder Isn't Enough
"/media/Dados/bases/SWDE/book/book-christianbook/0702.htm",Planet Zoom VBS Starter Kit
"/media/Dados/bases/SWDE/book/book-christianbook/1935.htm",The Blessing of Africa: The Bible and African Christianity
"/media/Dados/bases/SWDE/book/book-christianbook/1684.htm",Release the Power of Prayer
"/media/Dados/bases/SWDE/book/book-christianbook/1943.htm",Pilgrim's Progress: The Game For Ages: 5 and Up
"/media/Dados/bases/SWDE/book/book-christianbook/0809.htm",Confessions of a Reformission Rev.: Hard Lessons From an Emerging Missional Church
"/media/Dados/bases/SWDE/book/book-christianbook/0786.htm",How Can We Be Silent CD
"/media/Dados/bases/SWDE/book/book-christianbook/0714.htm",Out On the Edge on CD-ROM
"/media/Dados/bases/SWDE/book/book-christianbook/0612.htm","Letters to God, DVD"
"/media/Dados/bases/SWDE/book/book-christianbook/1339.htm","Esther: The Girl Who Became Queen, Classic VeggieTales DVD, Reissued"
"/media/Dados/bases/SWDE/book/book-christianbook/1004.htm",Led to Follow
"/media/Dados/bases/SWDE/book/book-christianbook/0036.htm","Love & Respect: The Love She Most Desires, the Respect He Desperately Needs"
"/media/Dados/bases/SWDE/book/book-christianbook/1287.htm","Footprints, Mini Metal Bookmark"
"/media/Dados/bases/SWDE/book/book-christianbook/0681.htm",Because I Love You! Board Book
"/media/Dados/bases/SWDE/book/book-christianbook/1838.htm",The Power of a Praying Woman Deluxe Edition hard cover padded with ribbon
"/media/Dados/bases/SWDE/book/book-christianbook/0938.htm","The Measure of a Man, Revised and Expanded Edition"
"/media/Dados/bases/SWDE/book/book-christianbook/0060.htm","The Fundamentals, 2 Volumes"
"/media/Dados/bases/SWDE/book/book-christianbook/1633.htm",Encountering the Book of Romans: A Theological Survey
"/media/Dados/bases/SWDE/book/book-christianbook/1061.htm",Smith Wigglesworth/Spirit Filled
"/media/Dados/bases/SWDE/book/book-christianbook/0349.htm",Risky Reunion
"/media/Dados/bases/SWDE/book/book-christianbook/1429.htm","Looking for God: An Unexpected Journey Through Tattoos, Tofu, and Pronouns"
"/media/Dados/bases/SWDE/book/book-christianbook/1046.htm","Tiny Bear's Bible, Girl"
"/media/Dados/bases/SWDE/book/book-christianbook/0174.htm",The Shaping of Things to Come: Innovation and Mission for the 21st-Century Church - Slightly Imperfect
"/media/Dados/bases/SWDE/book/book-christianbook/1520.htm","1 & 2 Timothy and Titus, NT Wright for Everyone Series"
"/media/Dados/bases/SWDE/book/book-christianbook/1102.htm",Power Pak Series: Leading as a Friend
"/media/Dados/bases/SWDE/book/book-christianbook/1516.htm",Philippians
"/media/Dados/bases/SWDE/book/book-christianbook/0408.htm",Perspectives Old and New on Paul: The Lutheran Paul and His Critics
"/media/Dados/bases/SWDE/book/book-christianbook/1494.htm",Call and Consequences: A Womanist Reading of Mark
"/media/Dados/bases/SWDE/book/book-christianbook/0045.htm",Life Principles Study Guide: Becoming Emotionally Whole
"/media/Dados/bases/SWDE/book/book-christianbook/1431.htm","Her Mother's Hope, Marta's Legacy Series #1"
"/media/Dados/bases/SWDE/book/book-christianbook/0918.htm",Prayer: Does It Make Any Difference? DVD
"/media/Dados/bases/SWDE/book/book-christianbook/1093.htm",Come Look with Me: Enjoying Art with Children
"/media/Dados/bases/SWDE/book/book-christianbook/0237.htm",On the New Testament
"/media/Dados/bases/SWDE/book/book-christianbook/0654.htm",The Youth Worker's Guide to Helping Teenagers in Crisis
"/media/Dados/bases/SWDE/book/book-christianbook/1045.htm",The Joy of Encouragement
"/media/Dados/bases/SWDE/book/book-christianbook/0033.htm",199 Treasures of Wisdom on Talking with God
"/media/Dados/bases/SWDE/book/book-christianbook/1664.htm",Sacred Influence: How God Uses Wives to Shape the Souls of Their Husbands
"/media/Dados/bases/SWDE/book/book-christianbook/1490.htm",Training in Christianity
"/media/Dados/bases/SWDE/book/book-christianbook/1473.htm","Nancy Drew and The Clue Crew: Lights, Camera.... Cats! # 8"
"/media/Dados/bases/SWDE/book/book-christianbook/0495.htm",Creation and Christ: The Wisdom of Hildegard of Bingen
"/media/Dados/bases/SWDE/book/book-christianbook/0260.htm",Night Light: A Devotional for Couples
"/media/Dados/bases/SWDE/book/book-christianbook/1044.htm",The Adventures of Average Boy: Growing Up Super Average
"/media/Dados/bases/SWDE/book/book-christianbook/1972.htm",Trading Places: The Best Move You'll Ever Make In Your Marriage
"/media/Dados/bases/SWDE/book/book-christianbook/0931.htm","The New Testament Deacon Pack, 2 Volumes"
"/media/Dados/bases/SWDE/book/book-christianbook/1323.htm","The Haunted Bridge, Nancy Drew Mystery Stories Series #15"
"/media/Dados/bases/SWDE/book/book-christianbook/1414.htm",The One Year Walk with God Devotional - LeatherLike (repkg)
"/media/Dados/bases/SWDE/book/book-christianbook/1577.htm",Conozca Su Biblia: 1 y 2 Corintios (Know Your Bible: 1 & 2 Corinthians)
"/media/Dados/bases/SWDE/book/book-christianbook/1964.htm",How to Prepare for Your Baptism
"/media/Dados/bases/SWDE/book/book-christianbook/0282.htm",Why Boys & Girls Are Different--Ages 4 to 6
"/media/Dados/bases/SWDE/book/book-christianbook/1357.htm","CBD Exclusive Communion Cups, 1000"
"/media/Dados/bases/SWDE/book/book-christianbook/1830.htm",Redeeming Love
"/media/Dados/bases/SWDE/book/book-christianbook/0300.htm",Until We Reach Home
"/media/Dados/bases/SWDE/book/book-christianbook/0020.htm",199 Treasures of Wisdom on Talking with God
"/media/Dados/bases/SWDE/book/book-christianbook/0306.htm",Not-So-Stupid Parents: Why Your Kids Think You're Weird and How to Prove Otherwise
"/media/Dados/bases/SWDE/book/book-christianbook/1953.htm",Chicken Soup for the Christian Family Soul
"/media/Dados/bases/SWDE/book/book-christianbook/0056.htm","The Yada Yada Prayer Group Gets Tough, Yada Yada Series #4"
"/media/Dados/bases/SWDE/book/book-christianbook/0202.htm","Nightmare Academy, The Veritas Project #2"
"/media/Dados/bases/SWDE/book/book-christianbook/0846.htm",The Real Story of The Creation
"/media/Dados/bases/SWDE/book/book-christianbook/1135.htm","Desiring God, Revised & Expanded"
"/media/Dados/bases/SWDE/book/book-christianbook/1022.htm",The Story of Liberty (A Christian History Text)
"/media/Dados/bases/SWDE/book/book-christianbook/0920.htm","We Have This Moment, Grace Chapel Inn Series #5"
"/media/Dados/bases/SWDE/book/book-christianbook/0958.htm",Raising Up Spiritual Champions Newsletters (CD-ROM included)
"/media/Dados/bases/SWDE/book/book-christianbook/1299.htm",Just One More: When Desires Don't Take No For An Answer
"/media/Dados/bases/SWDE/book/book-christianbook/0288.htm",Why True Love Waits
"/media/Dados/bases/SWDE/book/book-christianbook/0077.htm",God in the Dock
"/media/Dados/bases/SWDE/book/book-christianbook/1939.htm","Kittens In The Kitchen, Animal Ark Series #1"
"/media/Dados/bases/SWDE/book/book-christianbook/0836.htm",The Christian Life Profile Assessment Tool Training Kit
"/media/Dados/bases/SWDE/book/book-christianbook/0177.htm",A Model of Christian Maturity: An Exposition of 2 Corinthians 10-13
"/media/Dados/bases/SWDE/book/book-christianbook/0537.htm",Davey and Goliath DVD Volume 3: Learning About Forgiveness
"/media/Dados/bases/SWDE/book/book-christianbook/1654.htm","Heroes of History: George Washington Carver, From Slave to Scientist"
"/media/Dados/bases/SWDE/book/book-christianbook/0240.htm","First the Dead, A Bug Man Series #3"
"/media/Dados/bases/SWDE/book/book-christianbook/1193.htm",Red Rock Mysteries #5: Grave Shadows
"/media/Dados/bases/SWDE/book/book-christianbook/1280.htm","True Light, Restoration Series #3"
"/media/Dados/bases/SWDE/book/book-christianbook/0621.htm",Red Rock Mysteries #6: Phantom Writer
"/media/Dados/bases/SWDE/book/book-christianbook/1395.htm",Poodle and Hound
"/media/Dados/bases/SWDE/book/book-christianbook/0080.htm",Lydia's Charm
"/media/Dados/bases/SWDE/book/book-christianbook/0272.htm",Glory In The Highest CD
"/media/Dados/bases/SWDE/book/book-christianbook/1223.htm","Jorge el Curioso, Edición Bilingüe (Curious George, Bilingual Edition)"
"/media/Dados/bases/SWDE/book/book-christianbook/0796.htm",Bible Healing Study Course
"/media/Dados/bases/SWDE/book/book-christianbook/1624.htm",Sense & Nonsense About Angels & Demons
"/media/Dados/bases/SWDE/book/book-christianbook/0014.htm",Get Out of That Pit: Straight Talk about God's Deliverance from a Former Pit-Dweller
"/media/Dados/bases/SWDE/book/book-christianbook/0261.htm",God's Top 10: Blowing the Lid Off the Commandments
"/media/Dados/bases/SWDE/book/book-christianbook/1341.htm",I Don't Have Enough Faith to Be an Atheist
"/media/Dados/bases/SWDE/book/book-christianbook/1296.htm","Psalms, 3 volumes"
"/media/Dados/bases/SWDE/book/book-christianbook/1201.htm","Wordkeeper ® Economy Canvas Bible Cover, Blue, Medium"
"/media/Dados/bases/SWDE/book/book-christianbook/0780.htm",Championship Fathering: How to Win at Being a Dad
"/media/Dados/bases/SWDE/book/book-christianbook/1886.htm",Empty Nesters-101 Stories about Surviving and Thriving When The Kids Leave Home
"/media/Dados/bases/SWDE/book/book-christianbook/0403.htm","Revelation: When All Things Become New, Great Books of the Bible Series"
"/media/Dados/bases/SWDE/book/book-christianbook/1269.htm",30 Days to Taming Your Tongue: What You Say (and Don't Say) Can Improve Your Relationships
"/media/Dados/bases/SWDE/book/book-christianbook/1656.htm",The Power of a Praying Wife Prayer and Study Guide
"/media/Dados/bases/SWDE/book/book-christianbook/1559.htm",Let's Meet Famous Artists
"/media/Dados/bases/SWDE/book/book-christianbook/1816.htm",Names of Jesus Throw
"/media/Dados/bases/SWDE/book/book-christianbook/0378.htm",Stupid Parents: Why They Just Don't Understand and How You Can Help
"/media/Dados/bases/SWDE/book/book-christianbook/0674.htm",The Origin of Satan
"/media/Dados/bases/SWDE/book/book-christianbook/1367.htm",Know Your Bible: All 66 Books Explained and Applied
"/media/Dados/bases/SWDE/book/book-christianbook/0275.htm","Cracking Da Vinci's Code, Mass Market Edition"
"/media/Dados/bases/SWDE/book/book-christianbook/1992.htm",I Saw Him in Your Eyes
"/media/Dados/bases/SWDE/book/book-christianbook/1492.htm","Who Am I, Accompaniment CD"
"/media/Dados/bases/SWDE/book/book-christianbook/0552.htm",Elsie's Holiday at Roselands
"/media/Dados/bases/SWDE/book/book-christianbook/0660.htm",Exodus: Saved for God's Glory- Preaching the Word Series
"/media/Dados/bases/SWDE/book/book-christianbook/1256.htm",I Spy I Love You (Level 1)
"/media/Dados/bases/SWDE/book/book-christianbook/1318.htm","Romans: Amazing Grace, Catholic Perspectives"
"/media/Dados/bases/SWDE/book/book-christianbook/0123.htm",Miracles: The Listener and The Gifted 2 in 1
"/media/Dados/bases/SWDE/book/book-christianbook/1394.htm","#13: Green Algae and Bubble Gum Wars"
"/media/Dados/bases/SWDE/book/book-christianbook/0161.htm",My Life as Dinosaur Dental Floss: The Incredible Worlds of Wally McDoogle #5
"/media/Dados/bases/SWDE/book/book-christianbook/0227.htm","The Case for Christ/The Case for Faith, Student Editions Leader's Guide"
"/media/Dados/bases/SWDE/book/book-christianbook/1199.htm","T.D. Jakes Speaks to Men, 3 Volumes in 1"
"/media/Dados/bases/SWDE/book/book-christianbook/0745.htm",Broken: Making Sense of Life After Your Parents' Divorce
"/media/Dados/bases/SWDE/book/book-christianbook/1877.htm",Adventures in Odyssey® Life Lessons Series #6: Perseverance
"/media/Dados/bases/SWDE/book/book-christianbook/0926.htm",199 Promises of God
"/media/Dados/bases/SWDE/book/book-christianbook/0209.htm","Becoming Lucy, Winds Across the Prairie Series #1"
"/media/Dados/bases/SWDE/book/book-christianbook/0389.htm","Science and Bible, 3 Volumes"
"/media/Dados/bases/SWDE/book/book-christianbook/0126.htm",Developing the Leaders Around You
"/media/Dados/bases/SWDE/book/book-christianbook/0861.htm",Bible Study Package (2 Studies - Psalm & Prov31)
"/media/Dados/bases/SWDE/book/book-christianbook/0167.htm",199 Treasures of Wisdom on Talking with God
"/media/Dados/bases/SWDE/book/book-christianbook/0248.htm",Exploring Hebrews
"/media/Dados/bases/SWDE/book/book-christianbook/1689.htm",Davy Crockett: His own Story
"/media/Dados/bases/SWDE/book/book-christianbook/0489.htm","Christian Worship Worldwide: Expanding Horizons, Deepening Practices"
"/media/Dados/bases/SWDE/book/book-christianbook/1553.htm",Souls Passion For God
"/media/Dados/bases/SWDE/book/book-christianbook/0580.htm",The Slumber of Christianity: Awakening a Passion for Heaven on Earth
