URL,EXTRACTED VALUE
"/media/Dados/bases/SWDE/book/book-christianbook/0940.htm",Gave His life on the cross and rose from the dead
"/media/Dados/bases/SWDE/book/book-christianbook/0127.htm",tiene las mismas ilustraciones a todo color que hicieron famosa la serie
"/media/Dados/bases/SWDE/book/book-christianbook/1001.htm",fasting? Author Romara Dean Chatham in
"/media/Dados/bases/SWDE/book/book-christianbook/1957.htm",*Full-color game board
"/media/Dados/bases/SWDE/book/book-christianbook/0326.htm","506 pages, softcover from Hendrickson."
"/media/Dados/bases/SWDE/book/book-christianbook/1774.htm","guidebook for anyone looking for answers to questions of faith and reason. No other text categorizes, summarizes,"
"/media/Dados/bases/SWDE/book/book-christianbook/1186.htm",and
"/media/Dados/bases/SWDE/book/book-christianbook/1295.htm",Kathryn's husband mysteriously disappears. Can she save their ranch alone? In
"/media/Dados/bases/SWDE/book/book-christianbook/0337.htm",gives you the tools to bring this revolution to your church.
"/media/Dados/bases/SWDE/book/book-christianbook/0428.htm",sequel to the award-winning
"/media/Dados/bases/SWDE/book/book-christianbook/1205.htm",offers a fresh understanding of a world that has irrevocably changed and how Christ can still make a difference in an age of terror.
"/media/Dados/bases/SWDE/book/book-christianbook/1802.htm","If you're in need of a prayer partner,"
"/media/Dados/bases/SWDE/book/book-christianbook/1814.htm","is a ""romance,"" the story of Natty Bumppo's unsuccessful courtship of a young woman during the French and Indian War."
"/media/Dados/bases/SWDE/book/book-christianbook/1135.htm","to each other. 288 pages, softcover from Nelson."
"/media/Dados/bases/SWDE/book/book-christianbook/1384.htm",", Dr. Kenneth Boa encapsulates and discusses the classic works that helped shape Western civilization: books like"
"/media/Dados/bases/SWDE/book/book-christianbook/0005.htm","is the greatest ambition? 176 pages, softcover."
"/media/Dados/bases/SWDE/book/book-christianbook/0565.htm","Neil Wayne Northey, author of"
"/media/Dados/bases/SWDE/book/book-christianbook/1833.htm",- NKJV) Paperback.
"/media/Dados/bases/SWDE/book/book-christianbook/0087.htm",Sire wants to engage your mind at every step of the process.
"/media/Dados/bases/SWDE/book/book-christianbook/0681.htm",*Full-color game board
"/media/Dados/bases/SWDE/book/book-christianbook/1054.htm",rather than a
"/media/Dados/bases/SWDE/book/book-christianbook/1020.htm",includes:
"/media/Dados/bases/SWDE/book/book-christianbook/0472.htm",Al Gibson shares their story. You'll be amazed and encouraged as you read story after story and hear of God's miracle provision to heal and deliver.
"/media/Dados/bases/SWDE/book/book-christianbook/1932.htm",modern-day outlaws? Could there be some good in those Herdman hearts? Find out in this heartwarming sequel to
"/media/Dados/bases/SWDE/book/book-christianbook/0742.htm",", and Dan Brown's"
"/media/Dados/bases/SWDE/book/book-christianbook/1195.htm","recondite Pelikan takes us on a fascinating historical tour of how Mary has been portrayed and venerated inside and outside the church, such as"
"/media/Dados/bases/SWDE/book/book-christianbook/0338.htm",", written to remind all of us of the very strong God that we worship and serve. Does it succeed? Indeed, it does."
"/media/Dados/bases/SWDE/book/book-christianbook/0308.htm",", which gives a fuller insight into preparing for and building a healthy marriage. An Alpha resource."
