URL,EXTRACTED VALUE
"/media/Dados/bases/SWDE/book/book-christianbook/1653.htm",Read all Pudgy Where is Your Nose? Book reviews
"/media/Dados/bases/SWDE/book/book-christianbook/1292.htm",Read all Preteens Talk-Inspiration and Support For Preteens From Kids Just Like Them reviews
"/media/Dados/bases/SWDE/book/book-christianbook/1920.htm","Read all Luke, Beacon Bible Expositions reviews"
"/media/Dados/bases/SWDE/book/book-christianbook/1793.htm",Read all I Am...: Biblical Women Tell Their Own Stories reviews
"/media/Dados/bases/SWDE/book/book-christianbook/1048.htm",Read all Solemn Oath reviews
"/media/Dados/bases/SWDE/book/book-christianbook/1186.htm","Read all Teaching the Faith, Forming the Faithful: A Biblical Vision for Education in the Church reviews"
"/media/Dados/bases/SWDE/book/book-christianbook/1172.htm",Read all Remember Him reviews
"/media/Dados/bases/SWDE/book/book-christianbook/1152.htm",Read all The Sparrow's Easter Song reviews
"/media/Dados/bases/SWDE/book/book-christianbook/1655.htm",Read all Cross-Cultural Connections: Stepping Out & Fitting In Around the World reviews
"/media/Dados/bases/SWDE/book/book-christianbook/1549.htm",Read all Curious George and the Ice Cream Surprise reviews
"/media/Dados/bases/SWDE/book/book-christianbook/0783.htm",Read all The Blackwell Companion to Eastern Christianity reviews
"/media/Dados/bases/SWDE/book/book-christianbook/1428.htm",Read all The Best Story reviews
"/media/Dados/bases/SWDE/book/book-christianbook/1977.htm",Read all Nightmare Along Pennsylvania Avenue reviews
"/media/Dados/bases/SWDE/book/book-christianbook/0142.htm",Read all Smith Wigglesworth on Spiritual Gifts reviews
"/media/Dados/bases/SWDE/book/book-christianbook/1190.htm",Read all Snow Treasure: A Story of Courage and Adventure reviews
"/media/Dados/bases/SWDE/book/book-christianbook/1293.htm",Read all Somewhere In Heaven: The Remarkable Love Story of Dana and Christopher Reeve reviews
"/media/Dados/bases/SWDE/book/book-christianbook/1092.htm","Read all Stanley, Flat Again! reviews"
"/media/Dados/bases/SWDE/book/book-christianbook/0281.htm",Read all Spurgeon's Sermons on Prayer reviews
"/media/Dados/bases/SWDE/book/book-christianbook/1455.htm",Read all No Other Gods reviews
"/media/Dados/bases/SWDE/book/book-christianbook/1542.htm",Read all Religious Human Rights in Global Perspective: Legal Perspectives reviews
"/media/Dados/bases/SWDE/book/book-christianbook/0374.htm",Read all Be Decisive (Jeremiah) reviews
"/media/Dados/bases/SWDE/book/book-christianbook/0794.htm",Read all Psalm 91 reviews
"/media/Dados/bases/SWDE/book/book-christianbook/1956.htm",Read all A Handbook of Contemporary Theology reviews
"/media/Dados/bases/SWDE/book/book-christianbook/1751.htm",Read all Off to First Grade reviews
"/media/Dados/bases/SWDE/book/book-christianbook/1023.htm",Read all Shoo Fly! reviews
"/media/Dados/bases/SWDE/book/book-christianbook/1749.htm",Read all When Your Teen Goes Astray reviews
"/media/Dados/bases/SWDE/book/book-christianbook/0634.htm",Read all Wheelchair for Sale reviews
"/media/Dados/bases/SWDE/book/book-christianbook/0878.htm",Read all Signs of the Times reviews
"/media/Dados/bases/SWDE/book/book-christianbook/0627.htm",Read all Expecting A Miracle reviews
"/media/Dados/bases/SWDE/book/book-christianbook/0803.htm",Read all Be Obedient (Genesis 12-25) reviews
"/media/Dados/bases/SWDE/book/book-christianbook/0412.htm","Read all Heroes of History: Daniel Boone, Frontiersman reviews"
"/media/Dados/bases/SWDE/book/book-christianbook/0357.htm","Read all God, I Need to Talk to You about Greed reviews"
"/media/Dados/bases/SWDE/book/book-christianbook/1991.htm",Read all How to be Heard in Heaven: Releasing the Power of God through Prayer reviews
"/media/Dados/bases/SWDE/book/book-christianbook/1338.htm","Read all Marriage: The Rock On Which the Family Is Built, 2nd Edition reviews"
"/media/Dados/bases/SWDE/book/book-christianbook/0784.htm",Read all The Grace to Grow reviews
"/media/Dados/bases/SWDE/book/book-christianbook/0390.htm",Read all In Freedom's Cause (Grades 7 to 12) reviews
"/media/Dados/bases/SWDE/book/book-christianbook/0977.htm",Read all What Do I Do When Teenagers Question Their Sexuality? reviews
"/media/Dados/bases/SWDE/book/book-christianbook/0576.htm",Read all An Irish Christmas reviews
"/media/Dados/bases/SWDE/book/book-christianbook/1291.htm",Read all Rufus M. reviews
"/media/Dados/bases/SWDE/book/book-christianbook/1113.htm","Read all Diverse Worship: African-American, Caribbean and Hispanic Prespectives reviews"
"/media/Dados/bases/SWDE/book/book-christianbook/0188.htm","Read all God Is Great, God Is Good: Why Believing in God Is Reasonable and Responsible reviews"
"/media/Dados/bases/SWDE/book/book-christianbook/0991.htm",Read all Sacred Cows Make Gourmet Burgers reviews
"/media/Dados/bases/SWDE/book/book-christianbook/0309.htm",Read all Seven Steps to Receiving The Holy Spirit reviews
"/media/Dados/bases/SWDE/book/book-christianbook/0541.htm",Read all Camino a Emaus: Compartiendo La Mision de Jesus / Walking Toward Emmaus - Spanish reviews
"/media/Dados/bases/SWDE/book/book-christianbook/1768.htm",Read all Elementary Greek Workbook Year 1 reviews
"/media/Dados/bases/SWDE/book/book-christianbook/1146.htm",Read all Practical Catechesis: Visions & Tasks for Catechetical Leaders reviews
"/media/Dados/bases/SWDE/book/book-christianbook/0789.htm","Read all Morning for Dove, Winds Across the Prairie Series #2 reviews"
"/media/Dados/bases/SWDE/book/book-christianbook/0523.htm",Read all In That Day reviews
"/media/Dados/bases/SWDE/book/book-christianbook/1965.htm",Read all Gregory the Great and his World reviews
"/media/Dados/bases/SWDE/book/book-christianbook/1819.htm","Read all Lonely Girl, Gracious God: A Mother's Story of Autism's Devastation and God's Promise of Enduring Love reviews"
"/media/Dados/bases/SWDE/book/book-christianbook/0782.htm",Read all Jamberoo Road reviews
"/media/Dados/bases/SWDE/book/book-christianbook/1421.htm",Read all Worry reviews
"/media/Dados/bases/SWDE/book/book-christianbook/0882.htm","Read all Pop-Up Play Shopping: Buy, Sell, and Plan - Two Great Games to Play! reviews"
"/media/Dados/bases/SWDE/book/book-christianbook/0375.htm",Read all Run Baby Run reviews
"/media/Dados/bases/SWDE/book/book-christianbook/1506.htm","Read all Teeth, Softcover reviews"
"/media/Dados/bases/SWDE/book/book-christianbook/1409.htm",Read all To the Golden Shore The Life of Adoniram reviews
"/media/Dados/bases/SWDE/book/book-christianbook/0236.htm","Read all Augustine Came to Kent, Living History Library reviews"
"/media/Dados/bases/SWDE/book/book-christianbook/0183.htm",Read all The Tale of Three Trees reviews
"/media/Dados/bases/SWDE/book/book-christianbook/1345.htm",Read all In Over Our Heads: Meditations on Grace reviews
"/media/Dados/bases/SWDE/book/book-christianbook/0587.htm",Read all Lift the Flap: Lost Sheep reviews
"/media/Dados/bases/SWDE/book/book-christianbook/0773.htm",Read all Japan reviews
"/media/Dados/bases/SWDE/book/book-christianbook/0173.htm",Read all Concord Cunningham: The Scripture Sleuth #1 reviews
"/media/Dados/bases/SWDE/book/book-christianbook/1856.htm",Read all The Bald Eagle's View of American History reviews
"/media/Dados/bases/SWDE/book/book-christianbook/1829.htm",Read all The Way Is Made by Walking: A Pilgrimage Along the Camino de Santiago reviews
"/media/Dados/bases/SWDE/book/book-christianbook/1351.htm",Read all Sir Robert Anderson Classic Library Series: Types in Hebrew reviews
"/media/Dados/bases/SWDE/book/book-christianbook/1795.htm",Read all Who Is This Jesus? reviews
"/media/Dados/bases/SWDE/book/book-christianbook/1195.htm",Read all Mary Through the Centuries: Her Place in the History of Culture reviews
"/media/Dados/bases/SWDE/book/book-christianbook/0970.htm",Read all Two Noble Kinsmen reviews
"/media/Dados/bases/SWDE/book/book-christianbook/1889.htm",Read all Created in God's Image reviews
"/media/Dados/bases/SWDE/book/book-christianbook/1635.htm",Read all Two-Minute Bible Stories reviews
"/media/Dados/bases/SWDE/book/book-christianbook/1602.htm","Read all One Perfect Day, Large Print reviews"
"/media/Dados/bases/SWDE/book/book-christianbook/1997.htm",Read all The Mommy Diaries: Finding Yourself in the Daily Adventure reviews
"/media/Dados/bases/SWDE/book/book-christianbook/0307.htm","Read all The Gospel of Mark, New International Commentary on the New Testament, NICNT, Revised reviews"
"/media/Dados/bases/SWDE/book/book-christianbook/1385.htm","Read all Finding God in the Storms of Life, 5 Pack reviews"
"/media/Dados/bases/SWDE/book/book-christianbook/0428.htm",Read all A God-Centered Church: Experiencing God Together reviews
"/media/Dados/bases/SWDE/book/book-christianbook/0230.htm","Read all 2 Timothy: Standing Firm in Truth, John Stott Bible Studies reviews"
"/media/Dados/bases/SWDE/book/book-christianbook/1407.htm",Read all Jan Brett's Little Library reviews
"/media/Dados/bases/SWDE/book/book-christianbook/0484.htm",Read all John Climacus: The Ladder of Divine Ascent reviews
"/media/Dados/bases/SWDE/book/book-christianbook/0957.htm","Read all Plowing in Hope: Towards a Biblical Theology of Culture, Second Edition reviews"
"/media/Dados/bases/SWDE/book/book-christianbook/1354.htm",Read all World Scriptures: An Introduction to Comparative Religion reviews
"/media/Dados/bases/SWDE/book/book-christianbook/0189.htm","Read all Isaiah 1-39, New International Commentary on the Old Testament reviews"
"/media/Dados/bases/SWDE/book/book-christianbook/0565.htm",Read all Old Homestead Tales Volume Five: Wild Animals of Africa reviews
"/media/Dados/bases/SWDE/book/book-christianbook/0949.htm",Read all The Canon: A Whirligig Tour of the Beautiful Basics of Science reviews
"/media/Dados/bases/SWDE/book/book-christianbook/0990.htm",Read all A Good Man is Hard to Find reviews
"/media/Dados/bases/SWDE/book/book-christianbook/0837.htm",Read all Devil: Perceptions of Evil From Antiquity to Primitive Christianity reviews
"/media/Dados/bases/SWDE/book/book-christianbook/0091.htm","Read all Adventures of an Arctic Missionary #3, 77 Zebra reviews"
"/media/Dados/bases/SWDE/book/book-christianbook/1629.htm",Read all The Bible Believer's Handbook reviews
"/media/Dados/bases/SWDE/book/book-christianbook/1355.htm",Read all The Hardy Boys' Mysteries #53: The Clue of the Hissing Serpent reviews
"/media/Dados/bases/SWDE/book/book-christianbook/1963.htm",Read all In Sickness and in Health: Strengthening Your Marriage When Your Spouse is Ill reviews
"/media/Dados/bases/SWDE/book/book-christianbook/0904.htm",Read all Turkish Delight & Treasure Hunts: Delightful Treats and Games from Classic Children's Books reviews
"/media/Dados/bases/SWDE/book/book-christianbook/1798.htm",Read all Fallen Stars and Bitter Waters: A Novel reviews
"/media/Dados/bases/SWDE/book/book-christianbook/0880.htm",Read all Visions of the Harvest reviews
"/media/Dados/bases/SWDE/book/book-christianbook/0726.htm","Read all The Eucharist for Beginners: Sacrament, Sacrifice, and Communion reviews"
"/media/Dados/bases/SWDE/book/book-christianbook/1284.htm",Read all Acts-Church on The Move: An Expositional Commentary reviews
"/media/Dados/bases/SWDE/book/book-christianbook/1495.htm",Read all God and the Rhetoric of Sexuality reviews
"/media/Dados/bases/SWDE/book/book-christianbook/1273.htm",Read all Empowering ADHD Kids: Practical Strategies to Assist Children with ADHD in Developing Learning and Social Competencies reviews
"/media/Dados/bases/SWDE/book/book-christianbook/1746.htm",Read all Tiny Tidings of Joy for You Daughter reviews
"/media/Dados/bases/SWDE/book/book-christianbook/1518.htm","Read all 1 Corinthians, NT Wright for Everyone Series reviews"
"/media/Dados/bases/SWDE/book/book-christianbook/0426.htm","Read all The Cross, LifeGuide Topical Bible Studies reviews"
"/media/Dados/bases/SWDE/book/book-christianbook/0337.htm","Read all Emotionally Healthy Spirituality, Church-Wide Initiative Kit reviews"
"/media/Dados/bases/SWDE/book/book-christianbook/0562.htm","Read all Vision Para Vivir, Romanos, Insights NT - Romans reviews"
"/media/Dados/bases/SWDE/book/book-christianbook/1692.htm","Read all Evidence of Grace, Jenna's Creek Series #3 reviews"
"/media/Dados/bases/SWDE/book/book-christianbook/1463.htm",Read all The Life Kit: For Youth reviews
"/media/Dados/bases/SWDE/book/book-christianbook/1073.htm","Read all What Are the Gospels? A Comparison with Graeco-Roman Biography, 2d. ed. reviews"
"/media/Dados/bases/SWDE/book/book-christianbook/0293.htm",Read all The Foundations of Christian Doctrine: A Practical Guide to Christian Belief reviews
"/media/Dados/bases/SWDE/book/book-christianbook/0606.htm",Read all Letters to An American Lady reviews
"/media/Dados/bases/SWDE/book/book-christianbook/0401.htm",Read all Prayers and Proclamations reviews
"/media/Dados/bases/SWDE/book/book-christianbook/1936.htm",Read all Imagine That reviews
"/media/Dados/bases/SWDE/book/book-christianbook/1275.htm","Read all Noah, Didn't It Rain? Book and CD reviews"
"/media/Dados/bases/SWDE/book/book-christianbook/1448.htm",Read all Early Christianity and Greek Paideia reviews
"/media/Dados/bases/SWDE/book/book-christianbook/1731.htm",Read all Stomping Out Depression reviews
"/media/Dados/bases/SWDE/book/book-christianbook/0051.htm",Read all Jailhouse Rock: Acts 16:22-40 for Children Arch Book Series reviews
"/media/Dados/bases/SWDE/book/book-christianbook/0234.htm",Read all Berenstain Bears and the Joy of Giving reviews
"/media/Dados/bases/SWDE/book/book-christianbook/0232.htm",Read all Rocky Mountain Match reviews
"/media/Dados/bases/SWDE/book/book-christianbook/0115.htm",Read all The Canon of Scripture reviews
"/media/Dados/bases/SWDE/book/book-christianbook/0702.htm","Read all Bookmarks, Volume 2: Bible Exploration for Older Youth reviews"
"/media/Dados/bases/SWDE/book/book-christianbook/1706.htm",Read all The Religion Trap reviews
"/media/Dados/bases/SWDE/book/book-christianbook/1267.htm",Read all Gifts of Friendship: Real Life Reflections reviews
"/media/Dados/bases/SWDE/book/book-christianbook/1722.htm",Read all Exploring Christian Thought reviews
"/media/Dados/bases/SWDE/book/book-christianbook/1438.htm",Read all Lutheran Pastors and Politics: Issues in the Public Square reviews
"/media/Dados/bases/SWDE/book/book-christianbook/0148.htm","Read all Abraham Lincoln, Sower Series reviews"
"/media/Dados/bases/SWDE/book/book-christianbook/0786.htm","Read all Very Busy Spider, The reviews"
"/media/Dados/bases/SWDE/book/book-christianbook/0714.htm",Read all Momentum for Life Group Session DVD reviews
"/media/Dados/bases/SWDE/book/book-christianbook/0612.htm",Read all You Can Soar Like an Eagle reviews
"/media/Dados/bases/SWDE/book/book-christianbook/0496.htm",Read all Raining Cats and Dogs reviews
"/media/Dados/bases/SWDE/book/book-christianbook/0193.htm",Read all A Defence of Calvinism reviews
"/media/Dados/bases/SWDE/book/book-christianbook/1004.htm","Read all Pastors Under Pressure: Conflicts on The Outside, Fears Within, (Revised and Expanded Edition) reviews"
"/media/Dados/bases/SWDE/book/book-christianbook/0613.htm",Read all The Guide ... Colossians & Philemon reviews
"/media/Dados/bases/SWDE/book/book-christianbook/0681.htm",Read all Kirsten Boxed Set with Game reviews
"/media/Dados/bases/SWDE/book/book-christianbook/1698.htm","Read all Teens Talk Growing Up-Stories About Growing Up, Meeting Challenges, and Learning From Life reviews"
"/media/Dados/bases/SWDE/book/book-christianbook/0241.htm",Read all Jesus Calms the Storm reviews
"/media/Dados/bases/SWDE/book/book-christianbook/0312.htm",Read all Hard Sayings of the Bible reviews
"/media/Dados/bases/SWDE/book/book-christianbook/0060.htm","Read all Lectures in Systematic Theology, rev. ed. reviews"
"/media/Dados/bases/SWDE/book/book-christianbook/0502.htm",Read all From Slavery to Freedom: A Personal Reading of the Exodus Story reviews
"/media/Dados/bases/SWDE/book/book-christianbook/1057.htm","Read all God's Gifts to Me: God Made Animals, Mini Board Book reviews"
"/media/Dados/bases/SWDE/book/book-christianbook/1679.htm","Read all A Textual Commentary on the Greek New Testament, Second Edition reviews"
"/media/Dados/bases/SWDE/book/book-christianbook/0349.htm",Read all Secret Agent Father reviews
"/media/Dados/bases/SWDE/book/book-christianbook/1061.htm",Read all Gifts of the Spirit reviews
"/media/Dados/bases/SWDE/book/book-christianbook/1216.htm",Read all Perseverance in Gratitude: A Socio-Rhetorical Commentary on the Epistle to the Hebrews reviews
"/media/Dados/bases/SWDE/book/book-christianbook/0646.htm",Read all Las Profundas Verdades de la Biblia (God's Word Made Plain) reviews
"/media/Dados/bases/SWDE/book/book-christianbook/0930.htm",Read all Study Guide to Biblical Eldership reviews
"/media/Dados/bases/SWDE/book/book-christianbook/1520.htm","Read all Colossians & Philemon, NT Wright for Everyone Series reviews"
"/media/Dados/bases/SWDE/book/book-christianbook/0933.htm",Read all Rediscovering the Lord's Prayer reviews
"/media/Dados/bases/SWDE/book/book-christianbook/1516.htm",Read all The Genesis of Sex; Sexual Relationships in the First Book of the Bible reviews
"/media/Dados/bases/SWDE/book/book-christianbook/1494.htm","Read all Mark, Hermeneia Commentary Series reviews"
"/media/Dados/bases/SWDE/book/book-christianbook/0408.htm","Read all The Freedom of a Christian: Grace, Vocation, and the Meaning of Our Humanity reviews"
"/media/Dados/bases/SWDE/book/book-christianbook/1431.htm",Read all Serenity Bay reviews
"/media/Dados/bases/SWDE/book/book-christianbook/1857.htm",Read all Good Sex Youth Leader's Guide: A Whole-Person Approach to Teenage Sexuality and God reviews
"/media/Dados/bases/SWDE/book/book-christianbook/0361.htm",Read all Florida Weddings reviews
"/media/Dados/bases/SWDE/book/book-christianbook/1853.htm",Read all Ponder These Things: Praying with Icons of the Virgin reviews
"/media/Dados/bases/SWDE/book/book-christianbook/0748.htm","Read all Serving the People of God, Volume 2 reviews"
"/media/Dados/bases/SWDE/book/book-christianbook/1045.htm",Read all Joy of Relationship: Understanding God's Most Important Message - The reviews
"/media/Dados/bases/SWDE/book/book-christianbook/0898.htm",Read all 100 Word-Building Pyramid Puzzles reviews
"/media/Dados/bases/SWDE/book/book-christianbook/0769.htm","Read all Suzanne Tate's Nature Series #18: Perky Pelican, A Tale of a Lively Bird reviews"
"/media/Dados/bases/SWDE/book/book-christianbook/1473.htm",Read all Arthur and the Dog Show reviews
"/media/Dados/bases/SWDE/book/book-christianbook/1490.htm","Read all Designer Sex, 5 Pack reviews"
"/media/Dados/bases/SWDE/book/book-christianbook/0392.htm",Read all A Contemporary Handbook for Weddings & Funerals and Other Occasions reviews
"/media/Dados/bases/SWDE/book/book-christianbook/1491.htm",Read all Prayers and Promises: Timeless Gospel Stories reviews
"/media/Dados/bases/SWDE/book/book-christianbook/1227.htm",Read all Kingdom Come: The Local Church as a Catalyst for Social Change reviews
"/media/Dados/bases/SWDE/book/book-christianbook/0269.htm",Read all Just in Time Esther: The Book of Esther for Children reviews
"/media/Dados/bases/SWDE/book/book-christianbook/0779.htm",Read all Revival Sermons: How You Can Be a Part of Today's Spiritual Awakening reviews
"/media/Dados/bases/SWDE/book/book-christianbook/0643.htm",Read all The Earliest Text of the Hebrew Bible: The Relationship between the Masoretic Text & the Hebrew base of the LXX reviews
"/media/Dados/bases/SWDE/book/book-christianbook/1044.htm",Read all Adventures in Odyssey Imagination Station #4: Revenge of the Red Knight reviews
"/media/Dados/bases/SWDE/book/book-christianbook/1972.htm",Read all Power Prayers for Mothers reviews
"/media/Dados/bases/SWDE/book/book-christianbook/0931.htm",Read all The Hospitality Commands: Building Loving Christian Community reviews
"/media/Dados/bases/SWDE/book/book-christianbook/1599.htm",Read all The Complete Idiot's Guide to Personal Bankruptcy reviews
"/media/Dados/bases/SWDE/book/book-christianbook/1323.htm","Read all The Quest of the Missing Map, Nancy Drew Mystery Stories Series #19 reviews"
"/media/Dados/bases/SWDE/book/book-christianbook/1695.htm",Read all Silver Linings: Breaking Through the Clouds of Depression reviews
"/media/Dados/bases/SWDE/book/book-christianbook/1577.htm","Read all La historia de Israel - Primera parte, History of Israel Part 1 reviews"
"/media/Dados/bases/SWDE/book/book-christianbook/1357.htm",Read all On That Christmas Night reviews
"/media/Dados/bases/SWDE/book/book-christianbook/1005.htm","Read all Micah, Basic Bible Commentary, Volume 16 reviews"
"/media/Dados/bases/SWDE/book/book-christianbook/0539.htm",Read all The Beginnings: Word & Spirit in Conversion reviews
"/media/Dados/bases/SWDE/book/book-christianbook/1953.htm",Read all Chicken Soup for the Grandparent's Soul: Stories to Rekindle the Spirits of Grandparents reviews
"/media/Dados/bases/SWDE/book/book-christianbook/0383.htm",Read all Who Needs Theology? An Invitation to the Study of God reviews
"/media/Dados/bases/SWDE/book/book-christianbook/1011.htm",Read all Free Inside and Out reviews
"/media/Dados/bases/SWDE/book/book-christianbook/0458.htm",Read all The Expansion of Christianity reviews
"/media/Dados/bases/SWDE/book/book-christianbook/1135.htm",Read all Distant Partner: How to Tear Down Emotional Walls and Communicate with Your Husband reviews
"/media/Dados/bases/SWDE/book/book-christianbook/0473.htm","Read all Running Shoes, Hardcover reviews"
"/media/Dados/bases/SWDE/book/book-christianbook/1043.htm",Read all Experiencing the Psalms: Weaving the Psalms Into Your Ministry and Faith reviews
"/media/Dados/bases/SWDE/book/book-christianbook/1022.htm",Read all Prepared for Action: Equipping Home Educators for the Political Arena reviews
"/media/Dados/bases/SWDE/book/book-christianbook/1299.htm",Read all Priorities: Mastering Time Management reviews
"/media/Dados/bases/SWDE/book/book-christianbook/0920.htm","Read all Recipes & Wooden Spoons, Grace Chapel Inn Series #2 reviews"
"/media/Dados/bases/SWDE/book/book-christianbook/0958.htm",Read all How We Make Our Kids Angry: Suggestions for Parents Who Want to Change reviews
"/media/Dados/bases/SWDE/book/book-christianbook/0042.htm",Read all Dictionary of Paul & His Letters reviews
"/media/Dados/bases/SWDE/book/book-christianbook/1939.htm",Read all The Kitten Who Thought He Was a Mouse reviews
"/media/Dados/bases/SWDE/book/book-christianbook/1952.htm",Read all Speaking Conflict: Stories of a Controversial Jesus reviews
"/media/Dados/bases/SWDE/book/book-christianbook/0623.htm",Read all Dialogues Concerning Natural Religion reviews
"/media/Dados/bases/SWDE/book/book-christianbook/1864.htm",Read all Digital Storytellers: The Art of Communicating the Gospel in Worship reviews
"/media/Dados/bases/SWDE/book/book-christianbook/1654.htm","Read all Heroes of History: Clara Barton, Angel of the Battlefield reviews"
"/media/Dados/bases/SWDE/book/book-christianbook/1280.htm",Read all Because Of Jesus reviews
"/media/Dados/bases/SWDE/book/book-christianbook/1289.htm",Read all In Pursuit of Love: Catholic Morality & Human Sexuality reviews
"/media/Dados/bases/SWDE/book/book-christianbook/1960.htm",Read all Wilderness Wanderings: A Lenten Pilgrimage reviews
"/media/Dados/bases/SWDE/book/book-christianbook/1661.htm","Read all Renovacion de la mente, La 10/Package The Renewing of the Mind (Spanish) reviews"
"/media/Dados/bases/SWDE/book/book-christianbook/0903.htm",Read all El Dios de la Segunda Oportunidad (The God of Second Chances) reviews
"/media/Dados/bases/SWDE/book/book-christianbook/1395.htm",Read all Family Reminders reviews
"/media/Dados/bases/SWDE/book/book-christianbook/1427.htm",Read all Héroes Cristianos de Ayer y de Hoy: Eric Liddell (Christian Heroes Then & Now: Eric Liddell) reviews
"/media/Dados/bases/SWDE/book/book-christianbook/1912.htm",Read all Motherhood to Otherhood reviews
"/media/Dados/bases/SWDE/book/book-christianbook/0000.htm",Read all Know Your Bible: All 66 Books Explained and Applied reviews
"/media/Dados/bases/SWDE/book/book-christianbook/1060.htm","Read all Corrie Ten Boom: The Watchmaker's Daughter, Trail Blazers Series reviews"
"/media/Dados/bases/SWDE/book/book-christianbook/0796.htm",Read all The Believer's Authority reviews
"/media/Dados/bases/SWDE/book/book-christianbook/1624.htm",Read all Fallen Angels: Soldiers of Satan's Realm reviews
"/media/Dados/bases/SWDE/book/book-christianbook/1930.htm",Read all The Portable Roman Reader reviews
"/media/Dados/bases/SWDE/book/book-christianbook/0261.htm",Read all Following God Series: The Ten Commandments reviews
"/media/Dados/bases/SWDE/book/book-christianbook/0840.htm",Read all Dream Again reviews
"/media/Dados/bases/SWDE/book/book-christianbook/0780.htm",Read all Making Room for Summer Study Guide reviews
"/media/Dados/bases/SWDE/book/book-christianbook/1886.htm","Read all Barbara & Susan's Guide to the Empty Nest: Discovering New Purpose, Passion & Your Next Great Adventure reviews"
"/media/Dados/bases/SWDE/book/book-christianbook/0491.htm","Read all Ordinary Ministry, Extraordinary Challenge Women and the Roles of Ministry reviews"
"/media/Dados/bases/SWDE/book/book-christianbook/1081.htm","Read all A House Divided, Misadventures of Willie Plummet #20 reviews"
"/media/Dados/bases/SWDE/book/book-christianbook/1833.htm",Read all The Power of Money: How to Avoid a Devil's Snare reviews
"/media/Dados/bases/SWDE/book/book-christianbook/0614.htm",Read all Misplacing God: And Finding Him Again reviews
"/media/Dados/bases/SWDE/book/book-christianbook/0378.htm","Read all The Dirt on Sex, repackaged edition reviews"
