URL,EXTRACTED VALUE
"/media/Dados/bases/SWDE/book/book-christianbook/1499.htm",Read all Blue Like Play Dough: The Shape of Motherhood in the Grip of God reviews
"/media/Dados/bases/SWDE/book/book-christianbook/0404.htm","Read all Forget Me Not, Crossroads Crisis Center Series #1 reviews"
"/media/Dados/bases/SWDE/book/book-christianbook/0447.htm","Read all Simple Life: Time, Relationships, Money, God reviews"
"/media/Dados/bases/SWDE/book/book-christianbook/0006.htm",Read all Do Hard Things: A Teenage Rebellion Against Low Expectations reviews
"/media/Dados/bases/SWDE/book/book-christianbook/0137.htm",Read all Vintage Church: Timeless Truths and Timely Methods reviews
