URL,EXTRACTED VALUE
"/media/Dados/bases/SWDE/book/book-christianbook/1816.htm",Read all El Refugio de Dios (The Stronghold of God) reviews
"/media/Dados/bases/SWDE/book/book-christianbook/1890.htm",Read all Missions and Service Projects: Fresh Ideas Series reviews
"/media/Dados/bases/SWDE/book/book-christianbook/0674.htm",Read all The Prince of Darkness reviews
"/media/Dados/bases/SWDE/book/book-christianbook/0450.htm",Read all Mommy to Be: A Devotional Journal reviews
"/media/Dados/bases/SWDE/book/book-christianbook/0275.htm","Read all The Da Vinci Question, 5 copies reviews"
"/media/Dados/bases/SWDE/book/book-christianbook/1992.htm",Read all Silent Storm: Finding Spiritual Shelter During Hepatitis C reviews
"/media/Dados/bases/SWDE/book/book-christianbook/1108.htm","Read all Strike Three, Game On! Series for Girls reviews"
"/media/Dados/bases/SWDE/book/book-christianbook/1366.htm","Read all Full Court Pressure, Game On! Series for Girls reviews"
"/media/Dados/bases/SWDE/book/book-christianbook/0660.htm",Read all We Are Baptist: Studies for Older Elementary Children reviews
"/media/Dados/bases/SWDE/book/book-christianbook/1622.htm","Read all Preaching the Revised Common Lectionary, Year C Advent/Christmas/Epiphany reviews"
"/media/Dados/bases/SWDE/book/book-christianbook/1318.htm","Read all Galatians: Free in Christ, Catholic Perspectives reviews"
"/media/Dados/bases/SWDE/book/book-christianbook/0988.htm",Read all One Big Rain: Poems for Rainy Days reviews
"/media/Dados/bases/SWDE/book/book-christianbook/0534.htm",Read all Paul: Pioneer for Israel's Messiah reviews
"/media/Dados/bases/SWDE/book/book-christianbook/0914.htm",Read all From Day to Day with D. L. Moody reviews
"/media/Dados/bases/SWDE/book/book-christianbook/1726.htm",Read all Cohesion and Structure in the Pastoral Epistles reviews
"/media/Dados/bases/SWDE/book/book-christianbook/0227.htm","Read all The Case for Faith, Student Edition--6 copies reviews"
"/media/Dados/bases/SWDE/book/book-christianbook/1386.htm",Read all Marks of Methodism: Theology in Ecclesial Practice reviews
"/media/Dados/bases/SWDE/book/book-christianbook/1859.htm",Read all Changing Frontiers in Mission reviews
"/media/Dados/bases/SWDE/book/book-christianbook/1877.htm","Read all La Tribulaci&#243n, The Tribulation reviews"
"/media/Dados/bases/SWDE/book/book-christianbook/1675.htm",Read all Jamaica is Thankful reviews
"/media/Dados/bases/SWDE/book/book-christianbook/0729.htm","Read all Dawn's Light, Restoration Series #4 Large Print reviews"
"/media/Dados/bases/SWDE/book/book-christianbook/1719.htm",Read all It Was Out of Love reviews
"/media/Dados/bases/SWDE/book/book-christianbook/0861.htm",Read all My Praise Journal reviews
"/media/Dados/bases/SWDE/book/book-christianbook/0248.htm",Read all Exploring Ephesians & Philippians reviews
"/media/Dados/bases/SWDE/book/book-christianbook/1689.htm",Read all The Mother's Book reviews
"/media/Dados/bases/SWDE/book/book-christianbook/1705.htm",Read all The Theology of the Gospel of Matthew reviews
"/media/Dados/bases/SWDE/book/book-christianbook/1382.htm",Read all A Heavenly Christmas in Hometown reviews
"/media/Dados/bases/SWDE/book/book-christianbook/1452.htm",Read all Psalm 119: The Exaltation of Torah reviews
"/media/Dados/bases/SWDE/book/book-christianbook/0850.htm",Read all God and the Future: Pannenberg's Eschatological Doctrine of God reviews
"/media/Dados/bases/SWDE/book/book-christianbook/0195.htm",Read all Spiritual Leadership: A Commitment to Excellence for Every Believer reviews
"/media/Dados/bases/SWDE/book/book-christianbook/1138.htm",Read all Storytelling from the Bible: Make Scripture Live for All Ages Through the Art of Storytelling reviews
"/media/Dados/bases/SWDE/book/book-christianbook/0618.htm",Read all African American Christian Worship: Second Edition reviews
"/media/Dados/bases/SWDE/book/book-christianbook/1015.htm","Read all Faithfulness and Holiness: The Witness of J. C. Ryle (Including the Full Text of the First Edition of Ryle's Classic Book, Holiness) reviews"
"/media/Dados/bases/SWDE/book/book-christianbook/0636.htm","Read all #1: Theodora's Wedding, Mass Market Editon reviews"
"/media/Dados/bases/SWDE/book/book-christianbook/1828.htm",Read all A Time For Change reviews
"/media/Dados/bases/SWDE/book/book-christianbook/1240.htm",Read all The World of Prayer reviews
"/media/Dados/bases/SWDE/book/book-christianbook/0640.htm",Read all Matthew: The First Gospel reviews
"/media/Dados/bases/SWDE/book/book-christianbook/1642.htm",Read all What Do Other Faiths Believe? A Study of World Religions reviews
"/media/Dados/bases/SWDE/book/book-christianbook/0805.htm","Read all McKenzie, Montana Skies Series #1 reviews"
"/media/Dados/bases/SWDE/book/book-christianbook/1145.htm",Read all Love and Intimacy: Five Ways to Get Together and Stay Together reviews
"/media/Dados/bases/SWDE/book/book-christianbook/0252.htm",Read all Why Boys & Girls Are Different--Ages 4 to 6 reviews
"/media/Dados/bases/SWDE/book/book-christianbook/1295.htm","Read all Fountain Creek Chronicles, Boxed Set reviews"
"/media/Dados/bases/SWDE/book/book-christianbook/0645.htm",Read all There's Snow Buddy Like You reviews
"/media/Dados/bases/SWDE/book/book-christianbook/0737.htm",Read all Heart Speaks to Heart: Three Gospel Meditations on Jesus reviews
"/media/Dados/bases/SWDE/book/book-christianbook/0510.htm","Read all There is a God, There is No God: A Companion for the Journey of Unknowing reviews"
"/media/Dados/bases/SWDE/book/book-christianbook/0973.htm",Read all An Introduction to the New Testament for Catholics reviews
"/media/Dados/bases/SWDE/book/book-christianbook/1843.htm",Read all Hidden Power: Tap Into a Kingdom Principle That Will Change You Forever reviews
"/media/Dados/bases/SWDE/book/book-christianbook/1574.htm",Read all NEW! #1: Meet Rebecca reviews
"/media/Dados/bases/SWDE/book/book-christianbook/0616.htm",Read all The Ten Commandments: Case Studies in Catholic Morality reviews
"/media/Dados/bases/SWDE/book/book-christianbook/0833.htm",Read all God Beyond Gender reviews
"/media/Dados/bases/SWDE/book/book-christianbook/1560.htm","Read all Renouncing the Rudiments, The Traveler Series #2 reviews"
"/media/Dados/bases/SWDE/book/book-christianbook/0561.htm",Read all The Undoing of Death reviews
"/media/Dados/bases/SWDE/book/book-christianbook/1350.htm","Read all Paul the Letter-Writer: His World, His Options, His Skills reviews"
"/media/Dados/bases/SWDE/book/book-christianbook/1008.htm",Read all The Making of a Mentor: Nine Essential Characteristics of Influential Christian Leaders reviews
"/media/Dados/bases/SWDE/book/book-christianbook/1727.htm",Read all Good and Evil reviews
"/media/Dados/bases/SWDE/book/book-christianbook/0698.htm",Read all The Essential Kierkegaard reviews
"/media/Dados/bases/SWDE/book/book-christianbook/1089.htm",Read all The Memory Book reviews
"/media/Dados/bases/SWDE/book/book-christianbook/0255.htm","Read all Abigail Adams, Sower Series reviews"
"/media/Dados/bases/SWDE/book/book-christianbook/1384.htm","Read all A Taste of the Classics, Volume 4: The Divine Comedy, Knowledge of the Holy, Pride and Prejudice and The Love of God reviews"
"/media/Dados/bases/SWDE/book/book-christianbook/0929.htm",Read all Living with Purpose in a Worn-Out Body: Spiritual Encouragement for Older Adults reviews
"/media/Dados/bases/SWDE/book/book-christianbook/1839.htm",Read all Siddhartha reviews
"/media/Dados/bases/SWDE/book/book-christianbook/1374.htm","Read all The Church We Believe In: One, Holy, Catholic & Apostolic reviews"
"/media/Dados/bases/SWDE/book/book-christianbook/1966.htm",Read all Secrets to Spiritual Success: Building Blocks and Disciplines For Living The Christian Life reviews
"/media/Dados/bases/SWDE/book/book-christianbook/0683.htm",Read all Understanding Theology: Volume III reviews
"/media/Dados/bases/SWDE/book/book-christianbook/1359.htm",Read all Ezekiel- Daniel reviews
"/media/Dados/bases/SWDE/book/book-christianbook/0619.htm",Read all Healing for a Woman's Emotions: Released from Damaging Thoughts and Feelings reviews
"/media/Dados/bases/SWDE/book/book-christianbook/0776.htm",Read all In Search of Norman Rockwell's America reviews
"/media/Dados/bases/SWDE/book/book-christianbook/1736.htm",Read all 100 Great Ideas to Be a Good Friend reviews
"/media/Dados/bases/SWDE/book/book-christianbook/1703.htm",Read all Joy at the End of the Tether reviews
"/media/Dados/bases/SWDE/book/book-christianbook/1140.htm",Read all Merton's Palace of Nowhere reviews
"/media/Dados/bases/SWDE/book/book-christianbook/1946.htm","Read all Twenty Wishes, Large print reviews"
"/media/Dados/bases/SWDE/book/book-christianbook/1979.htm","Read all Love Finds You in Calico, California reviews"
"/media/Dados/bases/SWDE/book/book-christianbook/1373.htm",Read all Discipline By Design - Workbook reviews
"/media/Dados/bases/SWDE/book/book-christianbook/1305.htm",Read all La Historia de la Creaci&#243n (The Story of Creation) reviews
"/media/Dados/bases/SWDE/book/book-christianbook/0874.htm",Read all Contagious Generosity: The Key to Continuous Blessing! reviews
"/media/Dados/bases/SWDE/book/book-christianbook/1530.htm",Read all Preacher on the Run (Jonah) reviews
"/media/Dados/bases/SWDE/book/book-christianbook/0308.htm",Read all Ready for Marriage? Booklet reviews
"/media/Dados/bases/SWDE/book/book-christianbook/0807.htm",Read all One Tiny Baby reviews
"/media/Dados/bases/SWDE/book/book-christianbook/0321.htm","Read all The Light and the Glory, 1492-1793 reviews"
"/media/Dados/bases/SWDE/book/book-christianbook/1961.htm","Read all Big, Bigger, Biggest! reviews"
"/media/Dados/bases/SWDE/book/book-christianbook/1415.htm",Read all Daniel en el Foso de los Leones (Daniel and the Roaring Lions) reviews
"/media/Dados/bases/SWDE/book/book-christianbook/0326.htm","Read all Timeless Illustrations for Preaching and Teaching: Over 500 Stories, Anecdotes & Illustrations reviews"
"/media/Dados/bases/SWDE/book/book-christianbook/1472.htm",Read all The Christmas Star reviews
"/media/Dados/bases/SWDE/book/book-christianbook/0701.htm",Read all A Churchmouse Christmas: A Musical for Children reviews
"/media/Dados/bases/SWDE/book/book-christianbook/1436.htm",Read all Not Counting Women & Children: Some Forgotten Stories from the Bible reviews
"/media/Dados/bases/SWDE/book/book-christianbook/1283.htm",Read all Don Quixote reviews
"/media/Dados/bases/SWDE/book/book-christianbook/1453.htm",Read all Spiritual Direction: Beyond the Beginnings reviews
"/media/Dados/bases/SWDE/book/book-christianbook/0823.htm","Read all On The Way for 11-14s, Book 6 reviews"
"/media/Dados/bases/SWDE/book/book-christianbook/0804.htm",Read all The Fourth Dimension Volume 1: Discovering A New World of Answered Prayer reviews
"/media/Dados/bases/SWDE/book/book-christianbook/1121.htm",Read all Trusted Advice Your Healthy Child reviews
"/media/Dados/bases/SWDE/book/book-christianbook/0819.htm","Read all In-Laws, Outlaws, and the Functional Family: A Real-World Guide to Resolving Today's Family Issues reviews"
"/media/Dados/bases/SWDE/book/book-christianbook/0816.htm",Read all Sports Outreach: Principles and Practice for Successful Sports Ministry reviews
"/media/Dados/bases/SWDE/book/book-christianbook/1484.htm",Read all Seasons of Comfort and Joy: Meditations in Verse Based on Select Scripture Readings reviews
"/media/Dados/bases/SWDE/book/book-christianbook/1764.htm",Read all The Interpretation of Cultures: Selected Essays reviews
"/media/Dados/bases/SWDE/book/book-christianbook/1376.htm","Read all Due to Rising Energy Costs The Light at the End of the Tunnel Has Been Turned Off, Large Print reviews"
"/media/Dados/bases/SWDE/book/book-christianbook/0743.htm",Read all Money Life Basics- Work & Business reviews
"/media/Dados/bases/SWDE/book/book-christianbook/1715.htm",Read all Spiritual Formation reviews
"/media/Dados/bases/SWDE/book/book-christianbook/1522.htm",Read all The Juice Lady's Turbo Diet reviews
"/media/Dados/bases/SWDE/book/book-christianbook/1094.htm","Read all The Whispering Statue, Nancy Drew Mysteries #14 reviews"
"/media/Dados/bases/SWDE/book/book-christianbook/1343.htm",Read all A Good Day Board Book reviews
"/media/Dados/bases/SWDE/book/book-christianbook/1184.htm",Read all My First Story of Easter reviews
"/media/Dados/bases/SWDE/book/book-christianbook/0787.htm",Read all Martha Speaks: Leader of the Pack reviews
"/media/Dados/bases/SWDE/book/book-christianbook/0040.htm",Read all Hope After Betrayal: Healing When Sexual Addiction Invades Your Marriage reviews
"/media/Dados/bases/SWDE/book/book-christianbook/0127.htm",Read all Mi Libro de Pascua (My Easter Book) reviews
"/media/Dados/bases/SWDE/book/book-christianbook/1115.htm",Read all Swept Away by His Presence: Refreshing the Church with the Power of Prayer reviews
"/media/Dados/bases/SWDE/book/book-christianbook/0542.htm",Read all Call: Called to Be God's People - Great Themes of the Bible reviews
"/media/Dados/bases/SWDE/book/book-christianbook/1203.htm",Read all In The Beginning: The Art of Bob Spence reviews
"/media/Dados/bases/SWDE/book/book-christianbook/1885.htm",Read all Wonders of Old: A Blank Timeline Book of World History reviews
"/media/Dados/bases/SWDE/book/book-christianbook/1467.htm","Read all Ring, Robe, and Shoes: Pencil Fun Books, Pack of 10 reviews"
"/media/Dados/bases/SWDE/book/book-christianbook/1993.htm",Read all Following God: Praying God's Way reviews
"/media/Dados/bases/SWDE/book/book-christianbook/0987.htm",Read all The Angel of the Lord reviews
"/media/Dados/bases/SWDE/book/book-christianbook/1124.htm",Read all Honoring the Dead: Catholics and Cremation reviews
"/media/Dados/bases/SWDE/book/book-christianbook/1205.htm","Read all Without Warning, Tanneberg Mystery Series #1 reviews"
"/media/Dados/bases/SWDE/book/book-christianbook/1671.htm",Read all Little Red Riding Hood reviews
"/media/Dados/bases/SWDE/book/book-christianbook/1286.htm",Read all The Spirit of Catholicism reviews
"/media/Dados/bases/SWDE/book/book-christianbook/1497.htm",Read all Flashing Fire Engines reviews
"/media/Dados/bases/SWDE/book/book-christianbook/0672.htm",Read all Life Is Simple: Eliminate Complexity From Your Life And Reclaim Stolen Time reviews
"/media/Dados/bases/SWDE/book/book-christianbook/1983.htm",Read all Sex.-Discovering Real Love in a World of Counterfeits reviews
"/media/Dados/bases/SWDE/book/book-christianbook/0005.htm",Read all Lambert's Pride reviews
"/media/Dados/bases/SWDE/book/book-christianbook/1456.htm","Read all The Elevator, Large Print reviews"
"/media/Dados/bases/SWDE/book/book-christianbook/1069.htm",Read all Covenant: God's Project/ Effective Christians - Great Themes of the Bible reviews
"/media/Dados/bases/SWDE/book/book-christianbook/1133.htm","Read all Intercambiando Lugares, Trading Places reviews"
"/media/Dados/bases/SWDE/book/book-christianbook/0508.htm",Read all Handoff: The Only Way to Win the Race of Life reviews
"/media/Dados/bases/SWDE/book/book-christianbook/1618.htm","Read all If a Woman's Hair Is Her Glory, Why am I Tweezing My Chin? reviews"
"/media/Dados/bases/SWDE/book/book-christianbook/0594.htm",Read all La Vida Sobrenatural (The Supernatural Life) reviews
"/media/Dados/bases/SWDE/book/book-christianbook/0649.htm","Read all Many Religions - One Covenant: Israel, the Church and the World reviews"
"/media/Dados/bases/SWDE/book/book-christianbook/1673.htm",Read all Cherishing The Earth: How to Care for God's Creation reviews
"/media/Dados/bases/SWDE/book/book-christianbook/1134.htm",Read all Key Events in the Life of the Historical Jesus: A Collaborative Exploration of Context and Coherence reviews
"/media/Dados/bases/SWDE/book/book-christianbook/1733.htm",Read all Exploring the Evolving View of God: From Ancient Israel to the Risen Jesus Recovery reviews
"/media/Dados/bases/SWDE/book/book-christianbook/1161.htm",Read all Let's Play A Bible Game reviews
"/media/Dados/bases/SWDE/book/book-christianbook/1923.htm","Read all Mouse and Mole, A Winter Wonderland reviews"
"/media/Dados/bases/SWDE/book/book-christianbook/1117.htm",Read all A Beginner's Guide to Reading the Bible reviews
"/media/Dados/bases/SWDE/book/book-christianbook/1036.htm",Read all #11: Jungle Doctor Stings a Scorpion reviews
"/media/Dados/bases/SWDE/book/book-christianbook/0559.htm",Read all The Gospel of Matthew A Contextual Introduction for Group Study reviews
"/media/Dados/bases/SWDE/book/book-christianbook/1957.htm",Read all Addy Boxed Set with Game reviews
"/media/Dados/bases/SWDE/book/book-christianbook/1229.htm",Read all Your Best Life Now: 7 Steps to Living at Your Full Potential (slightly imperfect) reviews
"/media/Dados/bases/SWDE/book/book-christianbook/0191.htm",Read all Jesus Loves the Little Children reviews
"/media/Dados/bases/SWDE/book/book-christianbook/0959.htm",Read all Henry and the Valentine Surprise reviews
"/media/Dados/bases/SWDE/book/book-christianbook/0703.htm",Read all Second Thoughts: One Hundred Upbeat Messages for Beat-Up Americans reviews
"/media/Dados/bases/SWDE/book/book-christianbook/1076.htm",Read all Un Segundo Plato de Sopa de Pollo para el Alma (A Second Serving of Chicken Soup for the Soul) reviews
"/media/Dados/bases/SWDE/book/book-christianbook/0670.htm",Read all The Peep of Day reviews
"/media/Dados/bases/SWDE/book/book-christianbook/0435.htm","Read all The Present Future: Six Tough Questions for the Church, DVD Curriculum reviews"
"/media/Dados/bases/SWDE/book/book-christianbook/1595.htm","Read all A New Song, Mitford Series #5 reviews"
"/media/Dados/bases/SWDE/book/book-christianbook/0333.htm",Read all Eusebius' Ecclesiastical History reviews
"/media/Dados/bases/SWDE/book/book-christianbook/1486.htm","Read all I'm Not Crazy, But I Might Be a Carrier: Infectious Inspiration from Comedian Charles Marshall reviews"
"/media/Dados/bases/SWDE/book/book-christianbook/0411.htm",Read all The Lie: Evolution reviews
"/media/Dados/bases/SWDE/book/book-christianbook/1034.htm",Read all Lion Access Guides: Christianity reviews
"/media/Dados/bases/SWDE/book/book-christianbook/1922.htm","Read all A History of Biblical Interpretation, Vol 2: The Medieval through the Reformation Periods reviews"
"/media/Dados/bases/SWDE/book/book-christianbook/1302.htm",Read all What Christians Believe reviews
"/media/Dados/bases/SWDE/book/book-christianbook/0039.htm",Read all The Silent War: Ministering to Those Trapped in the Deception of Pornography reviews
"/media/Dados/bases/SWDE/book/book-christianbook/0849.htm",Read all Allah: A Christian Response reviews
"/media/Dados/bases/SWDE/book/book-christianbook/0724.htm",Read all God Said Yes reviews
"/media/Dados/bases/SWDE/book/book-christianbook/0848.htm","Read all The Legal Guide for Religious Institutions: Churches, Synagogues, Mosques, Temples and Other Religious Communities reviews"
"/media/Dados/bases/SWDE/book/book-christianbook/0720.htm",Read all Looking For Love reviews
"/media/Dados/bases/SWDE/book/book-christianbook/0884.htm",Read all For the Sake of the World: Karl Barth and the Future of Ecclesial Theology reviews
"/media/Dados/bases/SWDE/book/book-christianbook/0253.htm",Read all Good Girls Don't Have to Dress Bad: A Style Guide for Every Woman reviews
"/media/Dados/bases/SWDE/book/book-christianbook/0740.htm","Read all Sweetwater Gap, Large print reviews"
"/media/Dados/bases/SWDE/book/book-christianbook/1219.htm",Read all Baby at the Farm: A Touch-and-Feel Book reviews
"/media/Dados/bases/SWDE/book/book-christianbook/0024.htm",Read all Love Online reviews
"/media/Dados/bases/SWDE/book/book-christianbook/1628.htm",Read all Just Us: Finding Intimacy with God and Each Other reviews
"/media/Dados/bases/SWDE/book/book-christianbook/1525.htm",Read all An Introduction to the Old Testament: Pentateuch reviews
"/media/Dados/bases/SWDE/book/book-christianbook/1781.htm",Read all Living On Target: What Are You Aiming For? reviews
"/media/Dados/bases/SWDE/book/book-christianbook/0877.htm","Read all The Spider Sapphire Mystery, Nancy Drew Mystery Stories Series #45 reviews"
"/media/Dados/bases/SWDE/book/book-christianbook/1815.htm","Read all A Month of Summer, Large Print reviews"
"/media/Dados/bases/SWDE/book/book-christianbook/1262.htm","Read all The Barefoot Believers, Large Print reviews"
"/media/Dados/bases/SWDE/book/book-christianbook/0831.htm",Read all Clifford Goes To Dog School reviews
"/media/Dados/bases/SWDE/book/book-christianbook/1265.htm",Read all Power Suit: The Armor of God Fit for the Feminine Frame reviews
"/media/Dados/bases/SWDE/book/book-christianbook/0937.htm",Read all When Your Father Dies: How a Man Deals with the Loss of His Father reviews
"/media/Dados/bases/SWDE/book/book-christianbook/0568.htm",Read all Mary: Images of the Mother of Jesus in Jewish and Christian Perspective reviews
"/media/Dados/bases/SWDE/book/book-christianbook/1807.htm",Read all The Bridge to Forgiveness: Stories and Prayers for Finding God and Restoring Wholeness reviews
"/media/Dados/bases/SWDE/book/book-christianbook/0083.htm",Read all The Knowledge of the Holy reviews
"/media/Dados/bases/SWDE/book/book-christianbook/0593.htm","Read all Chronicles and Its Synoptic Parallels in Samuel, Kings, and Related Biblical Texts reviews"
"/media/Dados/bases/SWDE/book/book-christianbook/1148.htm","Read all Symbolism in the Fourth Gospel: Meaning, Mystery, Community, 2nd Edition reviews"
"/media/Dados/bases/SWDE/book/book-christianbook/0742.htm",Read all Taking Up the Cross: New Testament Interpretation through Latina and Feminist Eyes reviews
"/media/Dados/bases/SWDE/book/book-christianbook/1998.htm","Read all Redemption, Accomplished and Applied reviews"
"/media/Dados/bases/SWDE/book/book-christianbook/0117.htm",Read all Growing Up Yanomamo: Missionary Adventures in the Amazon Rainforest reviews
"/media/Dados/bases/SWDE/book/book-christianbook/0895.htm",Read all Ladybug Girl Dresses Up! reviews
"/media/Dados/bases/SWDE/book/book-christianbook/0338.htm","Read all Foundations of the Christian Faith, Revised reviews"
"/media/Dados/bases/SWDE/book/book-christianbook/1911.htm","Read all Fair Warning, Large-print reviews"
"/media/Dados/bases/SWDE/book/book-christianbook/0249.htm",Read all Las 100 Principales Mujeres de la Biblia (The Top 100 Women of the Bible) reviews
"/media/Dados/bases/SWDE/book/book-christianbook/1087.htm",Read all Aesop and the CEO reviews
"/media/Dados/bases/SWDE/book/book-christianbook/0179.htm","Read all Love Finds You in Hope, Kansas reviews"
"/media/Dados/bases/SWDE/book/book-christianbook/0215.htm",Read all A Tale of Two Cities Progeny Press Study Guide reviews
"/media/Dados/bases/SWDE/book/book-christianbook/0604.htm",Read all Sins of My Mother reviews
"/media/Dados/bases/SWDE/book/book-christianbook/1900.htm",Read all Overcoming the World Missions Crisis reviews
"/media/Dados/bases/SWDE/book/book-christianbook/1687.htm",Read all 101 Questions & Answers on the Biblical Torah: Reflections on the Pentateuch reviews
"/media/Dados/bases/SWDE/book/book-christianbook/0289.htm","Read all An Introduction to the Old Testament Poetic Books, Revised and Expanded reviews"
"/media/Dados/bases/SWDE/book/book-christianbook/0055.htm",Read all Green's Not Your Best Color: Being an Original Girl in a Plastic World reviews
"/media/Dados/bases/SWDE/book/book-christianbook/1222.htm",Read all Spirituality of Sport: Balancing Body and Soul reviews
"/media/Dados/bases/SWDE/book/book-christianbook/1083.htm",Read all A Place to Call Home reviews
"/media/Dados/bases/SWDE/book/book-christianbook/1206.htm",Read all Héroes en 3D (Heroes in 3D) reviews
"/media/Dados/bases/SWDE/book/book-christianbook/0556.htm",Read all Obadiah: A Practical Commentary reviews
"/media/Dados/bases/SWDE/book/book-christianbook/1110.htm",Read all Archaeology: Theory & Practice reviews
"/media/Dados/bases/SWDE/book/book-christianbook/1162.htm",Read all When Love Bends Down: Images of the Christ Who Meets Us Where We Are reviews
"/media/Dados/bases/SWDE/book/book-christianbook/0644.htm",Read all Interpreting the Times: How God Intersects with Our Lives to Bring Revelation and Understanding reviews
"/media/Dados/bases/SWDE/book/book-christianbook/1116.htm",Read all Little Gorilla Lap Board Book reviews
"/media/Dados/bases/SWDE/book/book-christianbook/1523.htm",Read all The Epistle to the Romans The Pillar New Testament Commentary reviews
"/media/Dados/bases/SWDE/book/book-christianbook/1175.htm",Read all Parables and Passion: Jesus' Stories for the Days of Lent reviews
"/media/Dados/bases/SWDE/book/book-christianbook/0609.htm",Read all The Moon is La Luna: Silly Rhymes in English & Spanish reviews
"/media/Dados/bases/SWDE/book/book-christianbook/0873.htm","Read all Questions from Seventh Period: Doc Pennock Answers Teens' Questions on Life, Love, and the Catholic Faith reviews"
"/media/Dados/bases/SWDE/book/book-christianbook/1676.htm",Read all Elijah Benamozegh: Israel & Humanity reviews
"/media/Dados/bases/SWDE/book/book-christianbook/0314.htm",Read all The History of the Ancient World: From the Earliest Accounts to the Fall of Rome reviews
"/media/Dados/bases/SWDE/book/book-christianbook/0469.htm",Read all Joyce Meyer: A Life of Redemption and Destiny reviews
"/media/Dados/bases/SWDE/book/book-christianbook/0503.htm","Read all Apostolic Letters of Faith, Hope, and Love: Galatians, 1 Peter, and 1 John reviews"
"/media/Dados/bases/SWDE/book/book-christianbook/1221.htm",Read all Child of a King: What Joining God's Family Really Means reviews
"/media/Dados/bases/SWDE/book/book-christianbook/1451.htm",Read all Human Body reviews
"/media/Dados/bases/SWDE/book/book-christianbook/0662.htm",Read all M&#225s que Vencedores #2 (More than Conquerors #2) reviews
