URL,EXTRACTED VALUE
"/media/Dados/bases/SWDE/book/book-christianbook/1192.htm",Read all The Prodigal Son: An Astonishing Study of the Parable Jesus Told to Unveil God's Grace for You reviews
"/media/Dados/bases/SWDE/book/book-christianbook/1884.htm",Read all Hudson Taylor's Spiritual Secret reviews
"/media/Dados/bases/SWDE/book/book-christianbook/1012.htm",Read all Sir Gawain and the Green Knight reviews
"/media/Dados/bases/SWDE/book/book-christianbook/1792.htm",Read all Journey to the Cross: God's Amazing Plan of Salvation reviews
"/media/Dados/bases/SWDE/book/book-christianbook/1137.htm",Read all Speaking in Tongues: The New Testament Evidence in Context reviews
"/media/Dados/bases/SWDE/book/book-christianbook/1078.htm","Read all The Heart's Treasure, Large-print reviews"
"/media/Dados/bases/SWDE/book/book-christianbook/0062.htm",Read all Following God: Enhancing Your Marriage: A Women's Bible Study reviews
"/media/Dados/bases/SWDE/book/book-christianbook/0812.htm",Read all Julianus Pomerius the Contemplative Life reviews
"/media/Dados/bases/SWDE/book/book-christianbook/1565.htm",Read all Don't Sweat the Small Stuff in Love reviews
"/media/Dados/bases/SWDE/book/book-christianbook/0461.htm",Read all God's Appointed Times reviews
"/media/Dados/bases/SWDE/book/book-christianbook/0824.htm",Read all Leo le Chat Goes to School! reviews
"/media/Dados/bases/SWDE/book/book-christianbook/0311.htm",Read all Tried and True Job: The Book of Job for Children reviews
"/media/Dados/bases/SWDE/book/book-christianbook/1369.htm",Read all The Nephilim Imperatives: Dark Sentences reviews
"/media/Dados/bases/SWDE/book/book-christianbook/0072.htm",Read all Living a Life of Fire: An Autobiography reviews
"/media/Dados/bases/SWDE/book/book-christianbook/0817.htm",Read all The Covenant of God and the Children of Believers: Sovereign Grace in the Covenant reviews
"/media/Dados/bases/SWDE/book/book-christianbook/1244.htm",Read all Tight Fists or Open Hands? Wealth and Poverty in Old Testament Law reviews
"/media/Dados/bases/SWDE/book/book-christianbook/1320.htm","Read all 10 Lies Men Believe: The Truth About Women, Power, Sex, and God--and Why It Matters reviews"
"/media/Dados/bases/SWDE/book/book-christianbook/1393.htm",Read all What's So Funny? reviews
"/media/Dados/bases/SWDE/book/book-christianbook/1586.htm","Read all Church Dogmatics I.2 The Doctrine of the Word of God Prolegomena, The Revelation of God, Holy Scripture, and The Proclamation oh reviews"
"/media/Dados/bases/SWDE/book/book-christianbook/1159.htm",Read all &#191D&#243nde Renuncia Una Madre? (Where Does a Mother Go to Resign?) reviews
"/media/Dados/bases/SWDE/book/book-christianbook/1000.htm",Read all The Everything Health Guide To Postpartum Care: A Complete Guide To Looking And Feeling Great After Delivery And Beyond reviews
"/media/Dados/bases/SWDE/book/book-christianbook/1528.htm",Read all Grace reviews
"/media/Dados/bases/SWDE/book/book-christianbook/1482.htm",Read all Stop and Look at God's World reviews
"/media/Dados/bases/SWDE/book/book-christianbook/0642.htm",Read all Centripetal Worship: The Evangelical Heart of Lutheran Worship reviews
"/media/Dados/bases/SWDE/book/book-christianbook/1766.htm",Read all The Purpose and Power of Praise and Worship reviews
"/media/Dados/bases/SWDE/book/book-christianbook/1071.htm",Read all The Adventures of Tom Sawyer reviews
"/media/Dados/bases/SWDE/book/book-christianbook/1307.htm",Read all En mi Embarazo: Doce Oraciones de la Mujer Catolica (In My Pregnancy: Twelve Prayers of a Catholic Woman) reviews
"/media/Dados/bases/SWDE/book/book-christianbook/0138.htm","Read all Colossians & Philemon, Revised LifeGuide Scripture Studies reviews"
"/media/Dados/bases/SWDE/book/book-christianbook/1647.htm",Read all The Sovereignty of God reviews
"/media/Dados/bases/SWDE/book/book-christianbook/1390.htm","Read all The Word & You: A Lectionary-Based Exploration of the Bible, Volume 3 reviews"
"/media/Dados/bases/SWDE/book/book-christianbook/1364.htm",Read all Video Ministry: Using Media in Worship Without Going Hollywood reviews
"/media/Dados/bases/SWDE/book/book-christianbook/1598.htm",Read all A Hitchhiker's Guide to Jesus: Reading the Gospels on the Ground reviews
"/media/Dados/bases/SWDE/book/book-christianbook/1532.htm",Read all Bayport Buccaneers # 16 Hardy Boys (All New) Undercover Brothers reviews
"/media/Dados/bases/SWDE/book/book-christianbook/0073.htm",Read all Women and Stress A Practical Approach to Managing Tension reviews
"/media/Dados/bases/SWDE/book/book-christianbook/0945.htm",Read all Consider the Lilies: A Plea for Creational Theology reviews
"/media/Dados/bases/SWDE/book/book-christianbook/0935.htm",Read all Far as the Curse is Found: The Covenant Story of Redemption reviews
"/media/Dados/bases/SWDE/book/book-christianbook/1794.htm",Read all A Homemade Life: Stories and Recipes from My Kitchen Table reviews
"/media/Dados/bases/SWDE/book/book-christianbook/1032.htm",Read all Genesis reviews
"/media/Dados/bases/SWDE/book/book-christianbook/1335.htm","Read all Transforming Our Painful Emotions: A Spiritual Understanding of Anger, Shame, Grief, Fear and Loneliness reviews"
"/media/Dados/bases/SWDE/book/book-christianbook/0722.htm",Read all Bunny Days reviews
"/media/Dados/bases/SWDE/book/book-christianbook/0551.htm",Read all Holy Word For Morning Revival: 1 & 2 Kings reviews
"/media/Dados/bases/SWDE/book/book-christianbook/1450.htm",Read all Three Discourses on Imagined Occasions reviews
"/media/Dados/bases/SWDE/book/book-christianbook/1446.htm",Read all The Little Boy Down the Road reviews
"/media/Dados/bases/SWDE/book/book-christianbook/0522.htm",Read all El Ni&#241o en el Templo (The Boy in the Temple) reviews
"/media/Dados/bases/SWDE/book/book-christianbook/1651.htm",Read all The Hand That Rocks the Cradle: 400 Classic Books for Children reviews
"/media/Dados/bases/SWDE/book/book-christianbook/1552.htm","Read all Get Acquainted with Your Christian Faith, Leader's Guide reviews"
"/media/Dados/bases/SWDE/book/book-christianbook/0886.htm",Read all For the Living of These Days Resources for Enriching Worship reviews
"/media/Dados/bases/SWDE/book/book-christianbook/0468.htm",Read all Eat This Book: A Conversation in the Art of Spiritual Reading reviews
"/media/Dados/bases/SWDE/book/book-christianbook/0530.htm",Read all Charity & Its Fruits reviews
"/media/Dados/bases/SWDE/book/book-christianbook/1460.htm","Read all Sacra Pagina: First Corinthians, softcover reviews"
"/media/Dados/bases/SWDE/book/book-christianbook/0228.htm",Read all Invitation to Solitude and Silence: Experiencing God's Transforming Presence reviews
"/media/Dados/bases/SWDE/book/book-christianbook/1636.htm","Read all Barnabas: A Good Man, Full of Faith reviews"
"/media/Dados/bases/SWDE/book/book-christianbook/0018.htm","Read all Happy Day Books, Level 2: Simon Minds His Manners reviews"
"/media/Dados/bases/SWDE/book/book-christianbook/1932.htm",Read all The Best School Year Ever reviews
"/media/Dados/bases/SWDE/book/book-christianbook/0755.htm",Read all Line Upon Line - Volume 2 reviews
"/media/Dados/bases/SWDE/book/book-christianbook/0967.htm",Read all The Death of Evolution: Restoring Faith and Wonder in a World of Doubt reviews
"/media/Dados/bases/SWDE/book/book-christianbook/0589.htm",Read all You Will Be My Witnesses: Music for Christian Initiation Accomp. Edition reviews
"/media/Dados/bases/SWDE/book/book-christianbook/0057.htm",Read all Prayers of the New Testament reviews
"/media/Dados/bases/SWDE/book/book-christianbook/1538.htm",Read all One Another: Transformational Relationships in the Body of Christ reviews
"/media/Dados/bases/SWDE/book/book-christianbook/1575.htm","Read all If You Know Who You Are, You'll Know What to Do: Living with Integrity reviews"
"/media/Dados/bases/SWDE/book/book-christianbook/1264.htm",Read all The Liturgy of the Hours in the East and West reviews
"/media/Dados/bases/SWDE/book/book-christianbook/0190.htm",Read all Exploring The Minor Prophets reviews
"/media/Dados/bases/SWDE/book/book-christianbook/1779.htm",Read all Living God's Word: Reflections on the Weekly Gospels reviews
"/media/Dados/bases/SWDE/book/book-christianbook/0244.htm","Read all The Power of the Blood, Revised and Expanded reviews"
"/media/Dados/bases/SWDE/book/book-christianbook/1558.htm","Read all Christiana, Part 2: The New Amplified Pilgrim's Progress reviews"
"/media/Dados/bases/SWDE/book/book-christianbook/0943.htm",Read all Pastor Hsi: A Struggle for Chinese Christianity reviews
"/media/Dados/bases/SWDE/book/book-christianbook/1591.htm","Read all Kuyper Center Review, Vol. 1: 2010 reviews"
"/media/Dados/bases/SWDE/book/book-christianbook/1173.htm",Read all Give God the Glory! Let Your Light Shine reviews
"/media/Dados/bases/SWDE/book/book-christianbook/1814.htm",Read all The Pathfinder reviews
"/media/Dados/bases/SWDE/book/book-christianbook/1480.htm",Read all The Church Subtly Deceived reviews
"/media/Dados/bases/SWDE/book/book-christianbook/1825.htm","Read all Indivisible, Large print reviews"
"/media/Dados/bases/SWDE/book/book-christianbook/0229.htm",Read all The Way of the Master--Book with free download reviews
"/media/Dados/bases/SWDE/book/book-christianbook/1156.htm","Read all The Barefoot Brides, Large Print reviews"
"/media/Dados/bases/SWDE/book/book-christianbook/1834.htm",Read all Free In Christ reviews
"/media/Dados/bases/SWDE/book/book-christianbook/1218.htm",Read all Haiku Baby reviews
"/media/Dados/bases/SWDE/book/book-christianbook/1539.htm",Read all Losing the Thread: Joyful Wit and Wisdom for Today's Woman reviews
"/media/Dados/bases/SWDE/book/book-christianbook/0517.htm",Read all Isaiah reviews
"/media/Dados/bases/SWDE/book/book-christianbook/0813.htm",Read all A Stocking Full of Christmas: The Ultimate A-Z of Festive Gems reviews
"/media/Dados/bases/SWDE/book/book-christianbook/0607.htm","Read all John Blanchard: Guernsey's Evangelist, Author and Christian Apologist reviews"
"/media/Dados/bases/SWDE/book/book-christianbook/1949.htm","Read all Knowing Me, Knowing God reviews"
"/media/Dados/bases/SWDE/book/book-christianbook/0327.htm",Read all Portraits of American Girlhood: Seven Unit Studies Using Popular Historical Fiction reviews
"/media/Dados/bases/SWDE/book/book-christianbook/1632.htm",Read all American Muslims reviews
"/media/Dados/bases/SWDE/book/book-christianbook/1615.htm",Read all The Hardy Boys' Mysteries #15: The Sinister Sign Post reviews
"/media/Dados/bases/SWDE/book/book-christianbook/1362.htm",Read all Stretch Out Your Hand reviews
"/media/Dados/bases/SWDE/book/book-christianbook/0940.htm",Read all Heaven reviews
"/media/Dados/bases/SWDE/book/book-christianbook/1097.htm",Read all Saving Christianity From Empire reviews
"/media/Dados/bases/SWDE/book/book-christianbook/1459.htm",Read all Ascension Now: Implications of Christ's Ascension for Today's Church reviews
"/media/Dados/bases/SWDE/book/book-christianbook/1111.htm",Read all Preaching the Revised Common Lectionary: A Guide reviews
"/media/Dados/bases/SWDE/book/book-christianbook/1892.htm",Read all Israel & The Nations: The History of Israel from the Exodus to the Fall of the Second Temple reviews
"/media/Dados/bases/SWDE/book/book-christianbook/0068.htm","Read all Yesterday, Today, and Forever reviews"
"/media/Dados/bases/SWDE/book/book-christianbook/1194.htm",Read all Moving Toward the Mainstream: Twentieth-Century Change among the Brethren of Eastern Penns reviews
"/media/Dados/bases/SWDE/book/book-christianbook/1329.htm",Read all Four Cardinal Virtues reviews
"/media/Dados/bases/SWDE/book/book-christianbook/1271.htm",Read all 40-Day Journey with Dietrich Bonhoeffer reviews
"/media/Dados/bases/SWDE/book/book-christianbook/1144.htm",Read all Lighting Out for the Territory: How Samuel Clemens Became Mark Twain reviews
"/media/Dados/bases/SWDE/book/book-christianbook/0239.htm",Read all A Hat for Ivan-Board Book reviews
"/media/Dados/bases/SWDE/book/book-christianbook/1096.htm",Read all Oraci&#243n Poderosa (Breakthrough Prayer) reviews
"/media/Dados/bases/SWDE/book/book-christianbook/1827.htm",Read all The Life of St. Columba reviews
"/media/Dados/bases/SWDE/book/book-christianbook/0416.htm","Read all The Historical Reliability of the Gospels, Second Edition reviews"
"/media/Dados/bases/SWDE/book/book-christianbook/1317.htm",Read all The Christian East and The Rise of the Papacy: The Church AD 1071-1453 reviews
"/media/Dados/bases/SWDE/book/book-christianbook/1634.htm","Read all Commentary on Aristotle's Physics, Softcover reviews"
"/media/Dados/bases/SWDE/book/book-christianbook/0682.htm",Read all Global Warming reviews
"/media/Dados/bases/SWDE/book/book-christianbook/0078.htm",Read all Standing up in a Fallen World: A Study in the Book of Daniel for Young Adults reviews
"/media/Dados/bases/SWDE/book/book-christianbook/1947.htm",Read all Tacky and the Winter Games reviews
"/media/Dados/bases/SWDE/book/book-christianbook/0086.htm","Read all Born to Reproduce, Pack of 10 reviews"
"/media/Dados/bases/SWDE/book/book-christianbook/1104.htm",Read all The Roots of True Faith (Abridgement of The Christian's Great Interest) reviews
"/media/Dados/bases/SWDE/book/book-christianbook/0472.htm",Read all Life on The Line: The Extraordinary Life and Ministry of Des and Ros Sinclair reviews
"/media/Dados/bases/SWDE/book/book-christianbook/1718.htm","Read all The Pocket Idiot's Guide to Repairing Your Credit, 2nd Edition reviews"
"/media/Dados/bases/SWDE/book/book-christianbook/1204.htm",Read all Longing for Enough in a Culture of More reviews
"/media/Dados/bases/SWDE/book/book-christianbook/0851.htm","Read all Genesis 37-50: Joseph the Dreamer, Catholic Perspectives reviews"
