URL,EXTRACTED VALUE
"/media/Dados/bases/SWDE/book/book-christianbook/0382.htm",Crazy Love: Overwhelmed by a Relentless God
"/media/Dados/bases/SWDE/book/book-christianbook/0196.htm","Awesome Bible Adventures: Escape from the Fiery Furnace & Lot's Amazing Adventure, DVD"
"/media/Dados/bases/SWDE/book/book-christianbook/0260.htm",Thriving Family (1 Year Subscription - 6 issues)
"/media/Dados/bases/SWDE/book/book-christianbook/1986.htm",Missouri Brides
"/media/Dados/bases/SWDE/book/book-christianbook/0278.htm",Under the Big Sky: Three-in-One Collection
