URL,EXTRACTED VALUE
"/media/Dados/bases/SWDE/book/book-christianbook/1157.htm",has topics that will encourage readers to take the time to appreciate what God has done-and is doing at all times in their lives.
"/media/Dados/bases/SWDE/book/book-christianbook/0369.htm","invites readers to examine their deep need for redemption, to feel it, know it, and live like it is true in their lives."
"/media/Dados/bases/SWDE/book/book-christianbook/0730.htm",and
"/media/Dados/bases/SWDE/book/book-christianbook/1562.htm","a powerful, healing message."
"/media/Dados/bases/SWDE/book/book-christianbook/0113.htm",Even the most sacred principles mean very little unless lived out passionately by an informed citizenry.
"/media/Dados/bases/SWDE/book/book-christianbook/0121.htm","), Brian Godawa ("
