URL,EXTRACTED VALUE
"/media/Dados/bases/SWDE/book/book-christianbook/0627.htm",Same Kind of Different As Me
"/media/Dados/bases/SWDE/book/book-christianbook/0878.htm",Numbers in the Bible God's Unique Design in Biblical Numbers
"/media/Dados/bases/SWDE/book/book-christianbook/0329.htm",God Made You Special! A VeggieTales Board Book
"/media/Dados/bases/SWDE/book/book-christianbook/0795.htm","Twilight's Serenade, Songs of Alaska Series #3"
"/media/Dados/bases/SWDE/book/book-christianbook/0121.htm",The Fabric of Faithfulness: Weaving Together Belief and Behavior- Expanded Edition
"/media/Dados/bases/SWDE/book/book-christianbook/0412.htm","Heroes of History: Abraham Lincoln, A New Birth of Freedom"
"/media/Dados/bases/SWDE/book/book-christianbook/0069.htm",Living in the Power of the Holy Spirit
"/media/Dados/bases/SWDE/book/book-christianbook/0437.htm","Healing Waters, Sullivan Crisp Series #2"
"/media/Dados/bases/SWDE/book/book-christianbook/0390.htm","Wordly Wise 3000, Grade 7, 2nd Edition"
"/media/Dados/bases/SWDE/book/book-christianbook/0399.htm",Divine Secrets of Mentoring: Spiritual Growth Through Friendship
"/media/Dados/bases/SWDE/book/book-christianbook/1579.htm",Illuminated Musical Nativity Ornament
"/media/Dados/bases/SWDE/book/book-christianbook/1515.htm",When God's People Pray - Participant's Guide: Six Sessions on the Transforming Power of Prayer
"/media/Dados/bases/SWDE/book/book-christianbook/1291.htm","Mouse Tales: Things Hoped For, Stories for Advent, Christmas,"
"/media/Dados/bases/SWDE/book/book-christianbook/0801.htm",The Anger Workbook
"/media/Dados/bases/SWDE/book/book-christianbook/0777.htm",Foundations: The Afterlife Study Guide
"/media/Dados/bases/SWDE/book/book-christianbook/1019.htm",Witness to Holiness: Abba Daniel of Scetis
"/media/Dados/bases/SWDE/book/book-christianbook/1113.htm",People of the Spirit: Exploring Luke's View of the Church
"/media/Dados/bases/SWDE/book/book-christianbook/0291.htm",Faith in the Fog of War
"/media/Dados/bases/SWDE/book/book-christianbook/0685.htm",Wild Truth Journal-Dares from Jesus: 50 Daring Lessons form the Words of Jesus
"/media/Dados/bases/SWDE/book/book-christianbook/0309.htm",Bible Healing Study Course
"/media/Dados/bases/SWDE/book/book-christianbook/1189.htm",The Fruit of the Spirit is...Self-Control
"/media/Dados/bases/SWDE/book/book-christianbook/0541.htm","La Vida es Sagrada, Life is Sacred"
"/media/Dados/bases/SWDE/book/book-christianbook/0204.htm",Twelve Ordinary Men
"/media/Dados/bases/SWDE/book/book-christianbook/0433.htm","Old Testament Survey, Second Edition"
"/media/Dados/bases/SWDE/book/book-christianbook/0789.htm",Sixteen Brides
"/media/Dados/bases/SWDE/book/book-christianbook/1200.htm",Running Blind
"/media/Dados/bases/SWDE/book/book-christianbook/0523.htm",See the Morning CD
"/media/Dados/bases/SWDE/book/book-christianbook/1813.htm",A Collection of Love Gifts
"/media/Dados/bases/SWDE/book/book-christianbook/0071.htm",Wildflowers of Terezin
"/media/Dados/bases/SWDE/book/book-christianbook/1819.htm",Defying Autism
"/media/Dados/bases/SWDE/book/book-christianbook/0934.htm",The First Christmas: What The Gospels Really Teach About Jesus' Birth
"/media/Dados/bases/SWDE/book/book-christianbook/0782.htm","Gigi, God's Little Princess: Pop-Up Tea Party"
"/media/Dados/bases/SWDE/book/book-christianbook/1147.htm",Comparing Christianity with the Cults
"/media/Dados/bases/SWDE/book/book-christianbook/0340.htm",Families at the Crossroads: Beyond Traditional & Modern Options
"/media/Dados/bases/SWDE/book/book-christianbook/0111.htm","1 Peter, Baker Exegetical Commentary on the New Testament"
"/media/Dados/bases/SWDE/book/book-christianbook/0573.htm","Allison's Journey, Brides of Webster County Series #4"
"/media/Dados/bases/SWDE/book/book-christianbook/0183.htm","The Nativity Story, DVD"
"/media/Dados/bases/SWDE/book/book-christianbook/1850.htm","Let's Celebrate God's Blessing on Thanksgiving: Happy Day Holiday Book, Hardcover"
"/media/Dados/bases/SWDE/book/book-christianbook/0344.htm",The Gay Gospel? How Pro-Gay Advocates Misread the Bible
"/media/Dados/bases/SWDE/book/book-christianbook/1208.htm","Love Finds You in Pendleton, Oregon"
"/media/Dados/bases/SWDE/book/book-christianbook/1747.htm","On a Whim, Katie Weldon Series #2"
"/media/Dados/bases/SWDE/book/book-christianbook/0454.htm",The Gift of Sex: A Guide to Sexual Fulfillment
"/media/Dados/bases/SWDE/book/book-christianbook/0173.htm",Concord Cunningham Returns: The Scripture Sleuth #2
"/media/Dados/bases/SWDE/book/book-christianbook/0305.htm",Holding His Hand: A Devotional for Teen Girls
"/media/Dados/bases/SWDE/book/book-christianbook/1829.htm",Asphalt Jesus: Finding a New Christian Faith Along the Highways of America
"/media/Dados/bases/SWDE/book/book-christianbook/1346.htm","Jungle Jam and Friends, the Radio Show: Golden Rocks and the Three Pears - Audiobook on CD"
"/media/Dados/bases/SWDE/book/book-christianbook/0527.htm",Experiencing the Resurrection
"/media/Dados/bases/SWDE/book/book-christianbook/0342.htm",Bible Study Ribbon Bookmark
"/media/Dados/bases/SWDE/book/book-christianbook/0986.htm","NIV One Year Compact Bible, softcover--damaged"
"/media/Dados/bases/SWDE/book/book-christianbook/1195.htm",Mary: Glimpses of The Mother of Jesus
"/media/Dados/bases/SWDE/book/book-christianbook/0108.htm","No Distance Too Far, Home to Blessing Series #2"
"/media/Dados/bases/SWDE/book/book-christianbook/1419.htm",Beauty for Ashes: Receiving Emotional Healing- Revised Edition
"/media/Dados/bases/SWDE/book/book-christianbook/1858.htm",John Calvin
"/media/Dados/bases/SWDE/book/book-christianbook/0031.htm","A Place to Call Home Series, Vols 1-2"
"/media/Dados/bases/SWDE/book/book-christianbook/1602.htm","Daughters of Blessing, Volumes 1-3"
"/media/Dados/bases/SWDE/book/book-christianbook/1997.htm","What Every Mom Needs, Updated"
"/media/Dados/bases/SWDE/book/book-christianbook/0047.htm",The Smart Stepfamily
"/media/Dados/bases/SWDE/book/book-christianbook/1385.htm","One Year Bible Reading Plan, Pack of 25 Tracts"
"/media/Dados/bases/SWDE/book/book-christianbook/0428.htm",Life on the Vine: Cultivating the Fruit of the Spirit in Christian Community
"/media/Dados/bases/SWDE/book/book-christianbook/0230.htm","Ephesians: Building a Community in Christ, John Stott Bible Studies"
"/media/Dados/bases/SWDE/book/book-christianbook/1412.htm",Jesus Christ Our Lord
"/media/Dados/bases/SWDE/book/book-christianbook/0484.htm",Street Saints: Renewing America's Cities
"/media/Dados/bases/SWDE/book/book-christianbook/1130.htm",Lies Young Women Believe Book and Companion Guide
"/media/Dados/bases/SWDE/book/book-christianbook/1103.htm","El Plan de Salvación, 25 Marcadores (Plan of Salvation Bookmarks, 25)"
"/media/Dados/bases/SWDE/book/book-christianbook/1354.htm",The School Of Biblical Evangelism
"/media/Dados/bases/SWDE/book/book-christianbook/0990.htm",The Ten Commandments of Working in a Hostile Environment
"/media/Dados/bases/SWDE/book/book-christianbook/1077.htm",The Hardy Boys' Mysteries #53: The Clue of the Hissing Serpent
"/media/Dados/bases/SWDE/book/book-christianbook/0471.htm",Praying with Power
"/media/Dados/bases/SWDE/book/book-christianbook/0837.htm",The Origin of Satan
"/media/Dados/bases/SWDE/book/book-christianbook/1461.htm",You! God's Brand New Idea--Made to Be Amazing
"/media/Dados/bases/SWDE/book/book-christianbook/0388.htm",Things Which Become Sound Doctrine
"/media/Dados/bases/SWDE/book/book-christianbook/0226.htm","Echoes, Michelli Family Series #3"
"/media/Dados/bases/SWDE/book/book-christianbook/0372.htm",Making Love Last Forever
"/media/Dados/bases/SWDE/book/book-christianbook/1798.htm","America the Beautiful, America Series #1"
"/media/Dados/bases/SWDE/book/book-christianbook/0955.htm",Switched-On Schoolhouse 2010: Trigonometry
"/media/Dados/bases/SWDE/book/book-christianbook/0159.htm",Common Grace: Life and Faith in Classic Literature
"/media/Dados/bases/SWDE/book/book-christianbook/0105.htm","Being God's Man by Resisting the World - the Every Man Series, Bible Studies"
"/media/Dados/bases/SWDE/book/book-christianbook/1325.htm",Saint Francis of Assisi
"/media/Dados/bases/SWDE/book/book-christianbook/1882.htm","Take Three, Above the Line Series #3"
"/media/Dados/bases/SWDE/book/book-christianbook/0029.htm",If God Is Good . . . Faith in the Midst of Suffering and Evil
"/media/Dados/bases/SWDE/book/book-christianbook/1761.htm","God Loves You Barnabas, My First I Can Read! (Shared Reading)"
"/media/Dados/bases/SWDE/book/book-christianbook/0917.htm",Here and Now: Living in the Spirit
"/media/Dados/bases/SWDE/book/book-christianbook/0426.htm","The Cross of Christ: 20th Anniversary Edition, with Study Guide"
"/media/Dados/bases/SWDE/book/book-christianbook/0337.htm",Alpha Course Manual
"/media/Dados/bases/SWDE/book/book-christianbook/0907.htm","End of the Spear, DVD"
"/media/Dados/bases/SWDE/book/book-christianbook/0562.htm","New Testament Commentary, 12 Volumes"
"/media/Dados/bases/SWDE/book/book-christianbook/1073.htm","Four Gospels, One Jesus, revised ed."
"/media/Dados/bases/SWDE/book/book-christianbook/1463.htm",Crazy Love: Overwhelmed by a Relentless God
"/media/Dados/bases/SWDE/book/book-christianbook/1334.htm",How to Pray: The Best of John Wesley on Prayer
"/media/Dados/bases/SWDE/book/book-christianbook/0919.htm",Get in the Game: A Spiritual Workout For Athletes
"/media/Dados/bases/SWDE/book/book-christianbook/1371.htm","The Peacemaker: A Biblical Guide to Resolving Personal Conflict, Third Edition"
"/media/Dados/bases/SWDE/book/book-christianbook/1936.htm","Mountain Song Legacy Series, Vols 1-3"
"/media/Dados/bases/SWDE/book/book-christianbook/0231.htm",Planting Missional Churches
"/media/Dados/bases/SWDE/book/book-christianbook/0550.htm",You're Next: Outrageous Stories from My Life That Could Change Yours
"/media/Dados/bases/SWDE/book/book-christianbook/1448.htm",Early Christianity and Its Sacred Literature
"/media/Dados/bases/SWDE/book/book-christianbook/1047.htm","Manual De Exploracion #4 - Maestro /Sabio y Prudente Exploration Book #4, teacher's edition"
"/media/Dados/bases/SWDE/book/book-christianbook/0003.htm","Leah's Choice, Pleasant Valley Series #1"
"/media/Dados/bases/SWDE/book/book-christianbook/0234.htm",Living Lights: The Berenstain Bears Love Their Neighbors
"/media/Dados/bases/SWDE/book/book-christianbook/0115.htm",The New Testament Documents: Are They Reliable?
"/media/Dados/bases/SWDE/book/book-christianbook/0199.htm",Head in the Clouds
"/media/Dados/bases/SWDE/book/book-christianbook/1576.htm",My Heart's Desire: Living Every Moment in the Wonder of Worship
"/media/Dados/bases/SWDE/book/book-christianbook/1402.htm",Spiritual Direction & Meditation
"/media/Dados/bases/SWDE/book/book-christianbook/0731.htm",Finding God in The Hobbit
"/media/Dados/bases/SWDE/book/book-christianbook/1621.htm",Faith Has Its Reasons: An Integrative Approach to Defending Christianity--An Apologetics Handbook
"/media/Dados/bases/SWDE/book/book-christianbook/0259.htm",Life's Challenges Your Opportunities
"/media/Dados/bases/SWDE/book/book-christianbook/0148.htm","Robert E. Lee: Gallant Christian Soldier, The Sowers Series"
"/media/Dados/bases/SWDE/book/book-christianbook/0206.htm",Love Finds You: In Valentine Nebraska
"/media/Dados/bases/SWDE/book/book-christianbook/1458.htm","Tomorrow's Treasure, East of the Sun Series #1"
"/media/Dados/bases/SWDE/book/book-christianbook/0245.htm","Sir Kendrick and The Castle of Bel Lione, Knights of Arrethtrae"
"/media/Dados/bases/SWDE/book/book-christianbook/0688.htm",We Believe in Christmas
"/media/Dados/bases/SWDE/book/book-christianbook/0715.htm","Nehemiah: LifeGuide Bible Studies, Revised Edition"
"/media/Dados/bases/SWDE/book/book-christianbook/1994.htm","No Distance Too Far, Home to Blessing Series #2"
"/media/Dados/bases/SWDE/book/book-christianbook/0193.htm",Counsel for Christian Workers
"/media/Dados/bases/SWDE/book/book-christianbook/0257.htm",Let Go: Live Free of the Burdens All Women Know
"/media/Dados/bases/SWDE/book/book-christianbook/0391.htm","Kingdom of the Cults, rev. and updated ed."
"/media/Dados/bases/SWDE/book/book-christianbook/0613.htm","Straight From the Heart, DVD"
"/media/Dados/bases/SWDE/book/book-christianbook/0626.htm",Curious George and the Puppies Softcover
"/media/Dados/bases/SWDE/book/book-christianbook/1698.htm","On Peaceful Shores: 36 Soothing Panpipe Hymns & Songs, 3 CD Set"
"/media/Dados/bases/SWDE/book/book-christianbook/0241.htm",Twelve Who Followed Jesus
"/media/Dados/bases/SWDE/book/book-christianbook/1502.htm","KJV Personal Size Giant Print Reference Bible, imitation leather, black/tan"
"/media/Dados/bases/SWDE/book/book-christianbook/0312.htm",New International Encyclopedia of Bible Difficulties
"/media/Dados/bases/SWDE/book/book-christianbook/1009.htm","God, I Need to Talk to You about Hurting Others"
"/media/Dados/bases/SWDE/book/book-christianbook/0799.htm","Disaster Status, Mercy Hospital Series #2"
"/media/Dados/bases/SWDE/book/book-christianbook/0502.htm","The Promised Land Discovery Guide, Faith Lessons Vol. 1"
"/media/Dados/bases/SWDE/book/book-christianbook/1057.htm","God's Gifts to Me: God Made Food, Mini Board Book"
"/media/Dados/bases/SWDE/book/book-christianbook/1944.htm",The Case for Christmas
"/media/Dados/bases/SWDE/book/book-christianbook/1468.htm",The Antichrist
"/media/Dados/bases/SWDE/book/book-christianbook/0067.htm",Turn Up the Heat: A Couples' Guide to Sexual Intimacy
"/media/Dados/bases/SWDE/book/book-christianbook/0154.htm",Faith Factor NT: Thru-the-Bible Devotions
"/media/Dados/bases/SWDE/book/book-christianbook/1216.htm",1 & 2 Thessalonians: A Socio-Rhetorical Commentary
"/media/Dados/bases/SWDE/book/book-christianbook/1177.htm","Hermie and Friends Scripture Memory Songs: Verses About Being Special, CD"
"/media/Dados/bases/SWDE/book/book-christianbook/0841.htm",Jotham's Journey: A Storybook for Advent
"/media/Dados/bases/SWDE/book/book-christianbook/0295.htm",100 Ways to Simplify Your Life
"/media/Dados/bases/SWDE/book/book-christianbook/1018.htm",When God's People Pray--DVD-ROM
"/media/Dados/bases/SWDE/book/book-christianbook/0646.htm",100 Respuestas a 100 Preguntas Acerca de Dios (100 Answers to 100 Questions about God)
"/media/Dados/bases/SWDE/book/book-christianbook/0930.htm",Biblical Eldership Book and Study Guide
"/media/Dados/bases/SWDE/book/book-christianbook/0053.htm","In the Dust of the Rabbi Discovery Guide, Faith Lessons Vol. 6"
"/media/Dados/bases/SWDE/book/book-christianbook/0933.htm",Trading Places: The Best Move You'll Ever Make In Your Marriage
"/media/Dados/bases/SWDE/book/book-christianbook/1874.htm","Divine Secrets, The Divine Series #3"
"/media/Dados/bases/SWDE/book/book-christianbook/0361.htm",Maine Brides
"/media/Dados/bases/SWDE/book/book-christianbook/0748.htm",The Complete Gathered Gold
"/media/Dados/bases/SWDE/book/book-christianbook/1853.htm",Wrestling with Angels:Conversations in Modern Theology
"/media/Dados/bases/SWDE/book/book-christianbook/1619.htm",Amazing Grace (LP Version) [Music Download]
"/media/Dados/bases/SWDE/book/book-christianbook/1902.htm","VeggieTales Jibbitz Clog, Red, Size 12/13"
"/media/Dados/bases/SWDE/book/book-christianbook/0769.htm",Kindergarten Basics
"/media/Dados/bases/SWDE/book/book-christianbook/1770.htm","Romans 1-8, MacArthur New Testament Commentary"
"/media/Dados/bases/SWDE/book/book-christianbook/0423.htm",Heaven: Biblical Answers to Common Questions 20-Pack
"/media/Dados/bases/SWDE/book/book-christianbook/0392.htm","Maximizing Your Effectiveness, 2nd edition"
"/media/Dados/bases/SWDE/book/book-christianbook/0052.htm","No Distance Too Far, Home to Blessing Series #2"
"/media/Dados/bases/SWDE/book/book-christianbook/1491.htm",Decision Making and the Will of God
"/media/Dados/bases/SWDE/book/book-christianbook/0269.htm",Arch Books Bible Stories: Elijah Helps the Widow
"/media/Dados/bases/SWDE/book/book-christianbook/0217.htm",The Lily Series #5: Ask Lily (Fiction)
"/media/Dados/bases/SWDE/book/book-christianbook/0273.htm",Building Faith at Home: Why Family Ministry Should Be Your Church's #1 Priority
"/media/Dados/bases/SWDE/book/book-christianbook/0779.htm",Anointing for Healing--Book and Anointing Oil
"/media/Dados/bases/SWDE/book/book-christianbook/0643.htm",The Use of the Septuagint in New Testament Research
"/media/Dados/bases/SWDE/book/book-christianbook/1765.htm","The Lion, the Witch, and the Wardrobe - Focus on the Family Radio Theatre audiodrama on CD"
"/media/Dados/bases/SWDE/book/book-christianbook/0265.htm","God's Design for Sex Series, Book 3: What's the Big Deal? Why God Cares About Sex, Revised"
"/media/Dados/bases/SWDE/book/book-christianbook/1695.htm",Silver Boxes
"/media/Dados/bases/SWDE/book/book-christianbook/0900.htm",Pippi Longstocking
"/media/Dados/bases/SWDE/book/book-christianbook/0927.htm",Rikki-Tikki-Tavi
"/media/Dados/bases/SWDE/book/book-christianbook/0141.htm",God Is: Devotions Empowered by Biblical Statements of Faith
"/media/Dados/bases/SWDE/book/book-christianbook/1709.htm","For Couples Only, Boxed Set: With Free Conversation Guide"
"/media/Dados/bases/SWDE/book/book-christianbook/1118.htm",Leviticus: The Old Testament Library
"/media/Dados/bases/SWDE/book/book-christianbook/0383.htm",The Faith of the Christian Church: An Introduction to Theology
"/media/Dados/bases/SWDE/book/book-christianbook/1011.htm",Amazing Freedom: Devotions to Free Your Spirit and Fill Your Heart
"/media/Dados/bases/SWDE/book/book-christianbook/0458.htm",The Life of David Brainerd - Audiobook on MP3 CD-ROM
"/media/Dados/bases/SWDE/book/book-christianbook/1910.htm",Where Miracles Happen: True Stories of Heavenly Encounters
"/media/Dados/bases/SWDE/book/book-christianbook/1980.htm",Fearless DVD-Based Small Group Kit
"/media/Dados/bases/SWDE/book/book-christianbook/1160.htm",Lutheranism
"/media/Dados/bases/SWDE/book/book-christianbook/0042.htm",Flywheel: Director's Cut DVD
"/media/Dados/bases/SWDE/book/book-christianbook/1151.htm",Stayin' Alive... Laughing! DVD
"/media/Dados/bases/SWDE/book/book-christianbook/1864.htm",Why We're Not Emergent (By Two Guys Who Should Be)
"/media/Dados/bases/SWDE/book/book-christianbook/1652.htm",How to Pray: The Best of John Wesley on Prayer
"/media/Dados/bases/SWDE/book/book-christianbook/0953.htm",Of Mice and Men
"/media/Dados/bases/SWDE/book/book-christianbook/1383.htm","The Lord Is My Shepherd, Psalm 23 Mysteries Series #1"
"/media/Dados/bases/SWDE/book/book-christianbook/1960.htm",Jesus I Never Knew Participant's Guide: Six Sessions on the Life of Christ
"/media/Dados/bases/SWDE/book/book-christianbook/1661.htm","Sit, Walk, Stand"
"/media/Dados/bases/SWDE/book/book-christianbook/0903.htm",El Amor De Dios (The Love Of God)
"/media/Dados/bases/SWDE/book/book-christianbook/0000.htm",Marriage Under Fire: Why We Must Win This Battle
"/media/Dados/bases/SWDE/book/book-christianbook/0176.htm",How to Pray: The Best of John Wesley on Prayer
"/media/Dados/bases/SWDE/book/book-christianbook/0092.htm",Learning to Breathe Again: Choosing Life and Finding Hope After a Shattering Loss
"/media/Dados/bases/SWDE/book/book-christianbook/1427.htm",Héroes Cristianos de Ayer y de Hoy: Amy Carmichael (Christian Heroes Then & Now: Amy Carmichael)
"/media/Dados/bases/SWDE/book/book-christianbook/1021.htm","Bringing Up Boys, Paperback Edition"
"/media/Dados/bases/SWDE/book/book-christianbook/1060.htm","Michael Faraday: Spiritual Dynamo, Trail Blazers Series"
"/media/Dados/bases/SWDE/book/book-christianbook/1303.htm",Heaven
"/media/Dados/bases/SWDE/book/book-christianbook/1908.htm",The Lost Lake
"/media/Dados/bases/SWDE/book/book-christianbook/0032.htm",God's Rivals: Why Has God Allowed Different Religions? Insights from the Bible and the Early Church
"/media/Dados/bases/SWDE/book/book-christianbook/0224.htm","The Missing, Seasons of Grace Series #2"
"/media/Dados/bases/SWDE/book/book-christianbook/0853.htm",June Bug
"/media/Dados/bases/SWDE/book/book-christianbook/1875.htm","Dead of Night, Hidden Faces Series #3"
"/media/Dados/bases/SWDE/book/book-christianbook/0015.htm","The Five Love Languages, Singles Edition"
"/media/Dados/bases/SWDE/book/book-christianbook/1297.htm",Seeing Yourself Through God's Eyes: A 31-Day Devotional Guide
"/media/Dados/bases/SWDE/book/book-christianbook/1342.htm",Tales of the Hasidim
"/media/Dados/bases/SWDE/book/book-christianbook/1081.htm","Anything You Can Do, I Can Do Better, Misadventures Of Willie Plummet #3"
"/media/Dados/bases/SWDE/book/book-christianbook/0944.htm","God, I Need to Talk to You about Lying"
"/media/Dados/bases/SWDE/book/book-christianbook/1833.htm",How to Hear God's Voice
"/media/Dados/bases/SWDE/book/book-christianbook/0614.htm",Looking Up When Life is Looking Down
"/media/Dados/bases/SWDE/book/book-christianbook/1890.htm",Mack and Leeann's Guide to Short-Term Missions
"/media/Dados/bases/SWDE/book/book-christianbook/0450.htm",My Utmost For His Highest
"/media/Dados/bases/SWDE/book/book-christianbook/0407.htm",Arminian Theology: Myths and Realities
"/media/Dados/bases/SWDE/book/book-christianbook/1108.htm","The Bible Experience, TNIV New Testament--19 CDs and DVD"
"/media/Dados/bases/SWDE/book/book-christianbook/1366.htm",VeggieTales: Larry Boy and the Bad Apple: A Lesson in Fighting Temptation
"/media/Dados/bases/SWDE/book/book-christianbook/1735.htm","Sunset, Sunrise Series #4"
"/media/Dados/bases/SWDE/book/book-christianbook/1622.htm","Daughter of Silk, The Silk House Series #1"
"/media/Dados/bases/SWDE/book/book-christianbook/0988.htm",Rodney Robbins and the Rainy-Day Pond
"/media/Dados/bases/SWDE/book/book-christianbook/0534.htm",100 Amazing Answers to Prayer
"/media/Dados/bases/SWDE/book/book-christianbook/1443.htm",Disciplines of a Godly Woman
"/media/Dados/bases/SWDE/book/book-christianbook/0830.htm","Walking Gently on the Earth: Making Faithful Choices About Food, Energy, Shelter and More"
"/media/Dados/bases/SWDE/book/book-christianbook/1239.htm","Sunday School Musical, DVD"
"/media/Dados/bases/SWDE/book/book-christianbook/1386.htm",Sign Language for Everyone: A Basic Course in Communication with the Deaf--DVD Set
"/media/Dados/bases/SWDE/book/book-christianbook/0729.htm","Miracles, 2-in-1, Large Print"
"/media/Dados/bases/SWDE/book/book-christianbook/0304.htm",The Adventures of Sherlock Holmes
"/media/Dados/bases/SWDE/book/book-christianbook/1705.htm",The Theology of the Gospel of Luke
"/media/Dados/bases/SWDE/book/book-christianbook/1861.htm","30-Day Marriage Makeover: How to get Closer,Communicate Better and Experience More Passion in Just one Month!"
"/media/Dados/bases/SWDE/book/book-christianbook/0744.htm",Jesus Christ: Savior & Lord
"/media/Dados/bases/SWDE/book/book-christianbook/1066.htm","Bless Our Home, Large Flag"
"/media/Dados/bases/SWDE/book/book-christianbook/0195.htm",Crazy Love: Overwhelmed by a Relentless God
"/media/Dados/bases/SWDE/book/book-christianbook/1714.htm","&#191C&#243mo Llego a Fin de Mes? (How Do I Make It 'Til the End of the Month), DVD"
"/media/Dados/bases/SWDE/book/book-christianbook/1300.htm","Thru the Bible Commentary Set with Index, 6 Volumes"
"/media/Dados/bases/SWDE/book/book-christianbook/1483.htm",The Federalist Papers
"/media/Dados/bases/SWDE/book/book-christianbook/0791.htm",Fearless DVD-Based Small Group Kit
"/media/Dados/bases/SWDE/book/book-christianbook/1031.htm",The Mystery of God's Will
"/media/Dados/bases/SWDE/book/book-christianbook/0417.htm",The Dark Side of Islam
"/media/Dados/bases/SWDE/book/book-christianbook/1544.htm","Dutch Blue Floral, Ceramic Cross"
"/media/Dados/bases/SWDE/book/book-christianbook/1240.htm",Culture Matters: A Call for Consensus on Christian Cultural Engagement
"/media/Dados/bases/SWDE/book/book-christianbook/1642.htm","Christianity, Cults & Religions: Compare 17 Religions and Cults with Biblical Christianity"
"/media/Dados/bases/SWDE/book/book-christianbook/1278.htm",Sitting By My Laughing Fire
"/media/Dados/bases/SWDE/book/book-christianbook/1477.htm",The Battle Is the Lord's: Waging Victorious Spiritual Warfare
"/media/Dados/bases/SWDE/book/book-christianbook/0805.htm",A Tailor-Made Bride
"/media/Dados/bases/SWDE/book/book-christianbook/0028.htm",The Love Dare
"/media/Dados/bases/SWDE/book/book-christianbook/0648.htm",Funny You Should Ask: How to Make Up Jokes and Riddles with Word Play
"/media/Dados/bases/SWDE/book/book-christianbook/1145.htm",The Rules of Engagement: The Art of Strategic Prayer and Spiritual Warfare
"/media/Dados/bases/SWDE/book/book-christianbook/0252.htm",Where Do Babies Come From? Boys' edition
"/media/Dados/bases/SWDE/book/book-christianbook/1295.htm","Rekindled, Fountain Creek Chronicles Series #1"
"/media/Dados/bases/SWDE/book/book-christianbook/1730.htm","Consumer Math, Student Text (2nd Edition)"
"/media/Dados/bases/SWDE/book/book-christianbook/1863.htm",The Screwtape Letters
"/media/Dados/bases/SWDE/book/book-christianbook/1583.htm",Gift of Wonder
"/media/Dados/bases/SWDE/book/book-christianbook/1038.htm","Facing the Giants, DVD"
"/media/Dados/bases/SWDE/book/book-christianbook/0235.htm","Daily Light on the Daily Path, NIV"
"/media/Dados/bases/SWDE/book/book-christianbook/1536.htm",When a Nation Forgets God: 7 Lessons We Must Learn from Nazi Germany
"/media/Dados/bases/SWDE/book/book-christianbook/0058.htm",How to Read Genesis
"/media/Dados/bases/SWDE/book/book-christianbook/0973.htm",Revelation and the End of All Things
"/media/Dados/bases/SWDE/book/book-christianbook/1843.htm","The Message - NKJV Parallel Bible, Leathersoft, burgundy"
"/media/Dados/bases/SWDE/book/book-christianbook/1405.htm","Considering God's Creation, Sixth edition 2-volumes with CD"
"/media/Dados/bases/SWDE/book/book-christianbook/1574.htm","Happy Day Books, Level 2: Jesus Is My Special Friend"
