URL,EXTRACTED VALUE
"/media/Dados/bases/SWDE/book/book-christianbook/0065.htm","Sex Is Not the Problem, Lust Is"
"/media/Dados/bases/SWDE/book/book-christianbook/0254.htm",How to Pray: The Best of John Wesley on Prayer
"/media/Dados/bases/SWDE/book/book-christianbook/1008.htm",Deceptive Diagnosis: When Sin is Called Sickness
"/media/Dados/bases/SWDE/book/book-christianbook/1727.htm",Tales of the Hasidim
"/media/Dados/bases/SWDE/book/book-christianbook/0698.htm",Great Lives: JESUS Bible Companion
"/media/Dados/bases/SWDE/book/book-christianbook/0243.htm",Ancient Canaan & Israel: An Introduction
"/media/Dados/bases/SWDE/book/book-christianbook/0196.htm",Voices of the True Woman Movement: A Call to the Counter-revolution
"/media/Dados/bases/SWDE/book/book-christianbook/1049.htm","Wordly Wise 3000, Grade 6, 2nd Edition"
"/media/Dados/bases/SWDE/book/book-christianbook/0854.htm","Mentoring Leaders: Wisdom for Developing Character, Calling, and Competency"
"/media/Dados/bases/SWDE/book/book-christianbook/0811.htm",Making the Most of Marriage Curriculum
"/media/Dados/bases/SWDE/book/book-christianbook/0132.htm",The Case for the Real Jesus: A Journalist Investigates Current Attacks on the Identity of Christ
"/media/Dados/bases/SWDE/book/book-christianbook/1573.htm",Old Testament Challenge #1 PowerPoint CD-ROM: Creating a New Community
"/media/Dados/bases/SWDE/book/book-christianbook/0487.htm",I Spy I Love You (Level 1)
"/media/Dados/bases/SWDE/book/book-christianbook/1056.htm","The Sugar Creek Gang Series, 36 Volumes"
"/media/Dados/bases/SWDE/book/book-christianbook/0512.htm",Chosen for Life: The Case for Divine Election
"/media/Dados/bases/SWDE/book/book-christianbook/1996.htm","Think on These Things: Meditations for Leaders, 25th Anniversary Edition"
"/media/Dados/bases/SWDE/book/book-christianbook/0255.htm","Florence Nightingale, Sower Series"
"/media/Dados/bases/SWDE/book/book-christianbook/0684.htm",Take It Home: Inspiration and Events to Help Parents Spiritually Transform Their Children
"/media/Dados/bases/SWDE/book/book-christianbook/0697.htm",The Power of a Positive Mom & The Power of a Positive Woman (2 books in 1)
"/media/Dados/bases/SWDE/book/book-christianbook/1384.htm",Miniatures & Morals: The Christian Novels of Jane Austen
"/media/Dados/bases/SWDE/book/book-christianbook/0929.htm","Honey, I'm Home For Good"
"/media/Dados/bases/SWDE/book/book-christianbook/1966.htm",The Secret Things of God: Unlocking the Treasures Reserved For You
"/media/Dados/bases/SWDE/book/book-christianbook/1098.htm",Opening Up Proverbs
"/media/Dados/bases/SWDE/book/book-christianbook/0619.htm","Straight From the Heart, DVD"
"/media/Dados/bases/SWDE/book/book-christianbook/1976.htm","The Early Church Discovery Guide, Faith Lessons Vol. 5"
"/media/Dados/bases/SWDE/book/book-christianbook/1469.htm",Christian Beliefs: Twenty Basics Every Christian Should Know
"/media/Dados/bases/SWDE/book/book-christianbook/1979.htm",The Preacher's Bride
"/media/Dados/bases/SWDE/book/book-christianbook/1305.htm",El Sue&#241o de Jacob (Jacob's Dream)
"/media/Dados/bases/SWDE/book/book-christianbook/0874.htm",Fields of Gold
"/media/Dados/bases/SWDE/book/book-christianbook/1530.htm",Triumph of the King (2 Samuel)
"/media/Dados/bases/SWDE/book/book-christianbook/0308.htm",199 Treasures of Wisdom on Talking with God
"/media/Dados/bases/SWDE/book/book-christianbook/0915.htm","The Problems of Life! Is There an Answer?, Geared for Growth Bible Studies"
"/media/Dados/bases/SWDE/book/book-christianbook/1415.htm",Jes&#250s Lava los Pies a sus Disc&#237pulos (Jesus Washes Peter's Feet)
"/media/Dados/bases/SWDE/book/book-christianbook/0223.htm",Warfare Of The Spirit
"/media/Dados/bases/SWDE/book/book-christianbook/0326.htm",God's Methods for Holy Living
"/media/Dados/bases/SWDE/book/book-christianbook/1895.htm","#1: Finding Your Faith"
"/media/Dados/bases/SWDE/book/book-christianbook/0462.htm",High School TalkSheets: 50 Ready-to-Use Discussions of the Life of Christ
"/media/Dados/bases/SWDE/book/book-christianbook/0701.htm",Angels Among Us: Separating Fact From Fiction
"/media/Dados/bases/SWDE/book/book-christianbook/0923.htm","Come, Let Us Reason: An Introduction to Logical Thinking"
"/media/Dados/bases/SWDE/book/book-christianbook/0220.htm",199 Treasures of Wisdom on Talking with God
"/media/Dados/bases/SWDE/book/book-christianbook/1799.htm",Hope Against Hope: Johann Baptist Metz & Elie Wiesel Speak Out on the Holocaust
"/media/Dados/bases/SWDE/book/book-christianbook/1052.htm","Wee Sing Bible Songs: A Celebration of the Bible in Music and Song, Book and CD Pack"
"/media/Dados/bases/SWDE/book/book-christianbook/1453.htm","ESV Single Column Reference Bible, TruTone, Brown/Cordovan, Portfolio Design"
"/media/Dados/bases/SWDE/book/book-christianbook/0823.htm","On The Way for 11-14s, Book 4"
"/media/Dados/bases/SWDE/book/book-christianbook/1848.htm",Reinventing Jesus: How Contemporary Skeptics Miss the Real Jesus and Mislead Popular Culture
"/media/Dados/bases/SWDE/book/book-christianbook/1121.htm",Trusted Advice: Your Healthy Pregnancy
"/media/Dados/bases/SWDE/book/book-christianbook/1970.htm","First Place 4 Health: Giving Christ Control, Bible Study with Scripture Memory CD"
"/media/Dados/bases/SWDE/book/book-christianbook/0317.htm",The Case for the Real Jesus: A Journalist Investigates Current Attacks on the Identity of Christ
"/media/Dados/bases/SWDE/book/book-christianbook/1484.htm","Stainless Steel Water Bottle, Worship"
"/media/Dados/bases/SWDE/book/book-christianbook/0376.htm",Homework Manual for Biblical Living: Personal & Interpersonal Problems Volume 1
"/media/Dados/bases/SWDE/book/book-christianbook/0130.htm","The Letter of James, The Pillar New Testament Commentary"
"/media/Dados/bases/SWDE/book/book-christianbook/0936.htm",Redescubra el Reino (Rediscovering the Kingdom)
"/media/Dados/bases/SWDE/book/book-christianbook/0985.htm",Hinds Feet on High Places - Audiobook on CD
"/media/Dados/bases/SWDE/book/book-christianbook/1797.htm","Winter on the Farm, My First Little House Books"
"/media/Dados/bases/SWDE/book/book-christianbook/1570.htm","Fight Well In The Lord, Camo Bible Cover, Medium"
"/media/Dados/bases/SWDE/book/book-christianbook/1555.htm","NIV Quest Study Bible, Revised Edition Hardcover"
"/media/Dados/bases/SWDE/book/book-christianbook/1376.htm","Captivating, Large print"
"/media/Dados/bases/SWDE/book/book-christianbook/1648.htm","John, John MacArthur Study Guides"
"/media/Dados/bases/SWDE/book/book-christianbook/1981.htm",Life Lessons: Ephesians
"/media/Dados/bases/SWDE/book/book-christianbook/0743.htm",Money Life Basics- Debt & Bankruptcy
"/media/Dados/bases/SWDE/book/book-christianbook/1094.htm","The Message in the Hollow Oak, Nancy Drew Mystery Stories Series #12"
"/media/Dados/bases/SWDE/book/book-christianbook/0466.htm",Understanding Eternal Security
"/media/Dados/bases/SWDE/book/book-christianbook/1184.htm",Joy to the World
"/media/Dados/bases/SWDE/book/book-christianbook/1710.htm",Stand-Up Guy
"/media/Dados/bases/SWDE/book/book-christianbook/0040.htm",When You Love Too Much: Walking the Road to Healthy Intimacy
"/media/Dados/bases/SWDE/book/book-christianbook/0127.htm",El Hijo Pr&#243digo (The Prodigal Son)
"/media/Dados/bases/SWDE/book/book-christianbook/0297.htm",Setting Boundaries With Your Adult Children: Six Steps to Hope and Healing for Struggling Parents
"/media/Dados/bases/SWDE/book/book-christianbook/0301.htm",Enemies Among Us
"/media/Dados/bases/SWDE/book/book-christianbook/1418.htm",Faithgirlz! Body Talk
"/media/Dados/bases/SWDE/book/book-christianbook/0845.htm",Earth Day: Robin Hill School
"/media/Dados/bases/SWDE/book/book-christianbook/0555.htm","The Coming Economic Armageddon: What Bible Prophecy Warns About the New Global Economy, Largeprint"
"/media/Dados/bases/SWDE/book/book-christianbook/0440.htm","The Bait of Satan, 10th Anniversary Edition"
"/media/Dados/bases/SWDE/book/book-christianbook/1124.htm",A Will to Live: Clear Answers on End of Life Issues
"/media/Dados/bases/SWDE/book/book-christianbook/0672.htm",12 Steps to Becoming a More Organized Woman Practical Tips for Managing Your Home and Your Life
"/media/Dados/bases/SWDE/book/book-christianbook/1983.htm",Marriage Under Fire: Why We Must Win This Battle
"/media/Dados/bases/SWDE/book/book-christianbook/0952.htm",The Truth of the Cross
"/media/Dados/bases/SWDE/book/book-christianbook/1456.htm","The Voice, Large Print"
"/media/Dados/bases/SWDE/book/book-christianbook/1791.htm",The Paul Quest: The Renewed Search for the Jew of Tarsus
"/media/Dados/bases/SWDE/book/book-christianbook/0887.htm",One with God: Salvation as Deification and Justification
"/media/Dados/bases/SWDE/book/book-christianbook/1420.htm",Know Your Bible: All 66 Books Explained and Applied
"/media/Dados/bases/SWDE/book/book-christianbook/1618.htm",The Cafeteria Lady Eats Her Way Across America (And Lives to Tell About It!)
"/media/Dados/bases/SWDE/book/book-christianbook/0019.htm",The Love Dare
"/media/Dados/bases/SWDE/book/book-christianbook/0508.htm","NIV Thinline Bible, Softcover"
"/media/Dados/bases/SWDE/book/book-christianbook/0594.htm","Buenos Dias, Espiritu Santo- Edici&#243n Revisada (Good Morning, Holy Spirit- Revised Edition)"
"/media/Dados/bases/SWDE/book/book-christianbook/1134.htm","New Testament Greek: A Beginning and Intermediate Grammar, Revised and Expanded Edition with CD"
"/media/Dados/bases/SWDE/book/book-christianbook/0313.htm",Set-Apart Femininity: God's Sacred Intent for Every Young Woman
"/media/Dados/bases/SWDE/book/book-christianbook/0862.htm",Meghan Rose Takes the Cake
"/media/Dados/bases/SWDE/book/book-christianbook/1036.htm",The Jungle Doctor Series #5: Jungle Doctor's Enemies
"/media/Dados/bases/SWDE/book/book-christianbook/1957.htm",Schoolhouse Brides
"/media/Dados/bases/SWDE/book/book-christianbook/1261.htm","His Body Given For Us, Communion Bulletins, 100"
"/media/Dados/bases/SWDE/book/book-christianbook/1229.htm",How to Pray: The Best of John Wesley on Prayer
"/media/Dados/bases/SWDE/book/book-christianbook/1076.htm","Sopa de Pollo para el Alma del Adolescente/Chicken Soup for the Teenage Soul, Spanish Edition"
"/media/Dados/bases/SWDE/book/book-christianbook/1519.htm","He Chose the Nails, softcover"
"/media/Dados/bases/SWDE/book/book-christianbook/0670.htm",I Can Say to God: I'm Sorry
"/media/Dados/bases/SWDE/book/book-christianbook/0082.htm",Safe in the Arms of God: Words from Heaven About the Death of a Child
"/media/Dados/bases/SWDE/book/book-christianbook/1212.htm",Practice Resurrection: A Conversation on Growing Up in Christ
"/media/Dados/bases/SWDE/book/book-christianbook/0435.htm",The Seven Pillars of Health Church Resource Kit: An Interactive Blueprint for Healthy Living
"/media/Dados/bases/SWDE/book/book-christianbook/1595.htm","Out To Canaan, The Mitford Years Series #4"
"/media/Dados/bases/SWDE/book/book-christianbook/0303.htm",Experiencing Prayer with Jesus
"/media/Dados/bases/SWDE/book/book-christianbook/0333.htm",Ante Pacem: Archaeological Evidence of Church Life Before Constantine
"/media/Dados/bases/SWDE/book/book-christianbook/1486.htm","I Don't Suffer from Insanity, DayBrightener, Perpetual Calendar"
"/media/Dados/bases/SWDE/book/book-christianbook/0411.htm","Thousands Not Billions: Challenging an Icon of Evolution, Questioning the Age of the Earth"
"/media/Dados/bases/SWDE/book/book-christianbook/0046.htm",The Bride Collector
"/media/Dados/bases/SWDE/book/book-christianbook/1973.htm",Know Your Bible: All 66 Books Explained and Applied
"/media/Dados/bases/SWDE/book/book-christianbook/1062.htm",The Prophecy Answer Book
"/media/Dados/bases/SWDE/book/book-christianbook/0074.htm","An Introduction to the Old Testament Prophetic Books, Updated Edition"
"/media/Dados/bases/SWDE/book/book-christianbook/1754.htm",Footprints Stickers
"/media/Dados/bases/SWDE/book/book-christianbook/1517.htm",The Screwtape Letters
"/media/Dados/bases/SWDE/book/book-christianbook/0848.htm","Ethical, Legal, and Professional Issues in the Practice of Marriage and Family Therapy, Fourth Edition"
"/media/Dados/bases/SWDE/book/book-christianbook/0353.htm",Moses: A Man of Selfless Dedication
"/media/Dados/bases/SWDE/book/book-christianbook/1737.htm",The Voice of Christmas CD
"/media/Dados/bases/SWDE/book/book-christianbook/1276.htm","Three Crosses, Olive Wood Carved Ornament"
"/media/Dados/bases/SWDE/book/book-christianbook/0381.htm",The Berenstain Bears: The Truth
"/media/Dados/bases/SWDE/book/book-christianbook/0622.htm",Zondervan Illustrated Bible Backgrounds Commentary: Romans to Philemon
"/media/Dados/bases/SWDE/book/book-christianbook/0876.htm",Cute Barnyard Friends Valentine Cards
"/media/Dados/bases/SWDE/book/book-christianbook/0884.htm",Church Dogmatics IV.4 The Doctrine of Reconciliation Baptism as the Foundation for Christian Life (Fragment)
"/media/Dados/bases/SWDE/book/book-christianbook/0740.htm","Take Three, Above the Line Series #3"
"/media/Dados/bases/SWDE/book/book-christianbook/0276.htm",Crazy Talk: A Not-So-Stuffy Dictionary of Theological Terms
"/media/Dados/bases/SWDE/book/book-christianbook/0924.htm","Resting in Him, Women of Faith Bible Studies"
"/media/Dados/bases/SWDE/book/book-christianbook/0024.htm",Tennessee Weddings
"/media/Dados/bases/SWDE/book/book-christianbook/0516.htm","The 21 Irrefutable Laws of Leadership, 10th Anniversary Edition"
"/media/Dados/bases/SWDE/book/book-christianbook/1628.htm","Divorce Care: Hope, Help and Healing During and After Your Divorce"
"/media/Dados/bases/SWDE/book/book-christianbook/0246.htm",Hope for a Hopeless Day: Encouragement and Inspiration When You Need It Most
"/media/Dados/bases/SWDE/book/book-christianbook/1781.htm",Wide Awake: The Future Is Waiting Within You
"/media/Dados/bases/SWDE/book/book-christianbook/1620.htm",African American Heritage Hymnal (Hardcover)
"/media/Dados/bases/SWDE/book/book-christianbook/0016.htm",Courageous Leadership
"/media/Dados/bases/SWDE/book/book-christianbook/1262.htm","The Barefoot Brides, Large Print"
"/media/Dados/bases/SWDE/book/book-christianbook/0447.htm",Twisting the Truth Participant's Guide: Learning to Discern In a Culture of Deception
"/media/Dados/bases/SWDE/book/book-christianbook/1265.htm",Dressed to Kill: A Biblical Approach to Spiritual Warfare and Armor
"/media/Dados/bases/SWDE/book/book-christianbook/0089.htm",Life Lessons: The Gospel of Luke
"/media/Dados/bases/SWDE/book/book-christianbook/1236.htm","Her Mother's Hope, Marta's Legacy Series #1"
"/media/Dados/bases/SWDE/book/book-christianbook/0593.htm","1 & 2 Kings, Holman Old Testament Commentary Volume 7"
"/media/Dados/bases/SWDE/book/book-christianbook/1739.htm",Christian Perspectives on Politics: Revised & Expanded
"/media/Dados/bases/SWDE/book/book-christianbook/1557.htm","Dawn of a New Day, American Century Series"
"/media/Dados/bases/SWDE/book/book-christianbook/1674.htm",Clifford's First School Day
"/media/Dados/bases/SWDE/book/book-christianbook/1998.htm",The Letter to the Ephesians: The Pillar New Testament Commentary
"/media/Dados/bases/SWDE/book/book-christianbook/1182.htm",Itty-Bitty Bible Crossword Puzzles
"/media/Dados/bases/SWDE/book/book-christianbook/1432.htm",Maryland
"/media/Dados/bases/SWDE/book/book-christianbook/0449.htm",The Acts of the Apostles
"/media/Dados/bases/SWDE/book/book-christianbook/0441.htm","First the Dead, Bug Man Series #3"
"/media/Dados/bases/SWDE/book/book-christianbook/0398.htm",The Lily Series #5: Ask Lily (Fiction)
"/media/Dados/bases/SWDE/book/book-christianbook/0445.htm","Cape Refuge Series, Vols 1-4"
"/media/Dados/bases/SWDE/book/book-christianbook/0179.htm","Love Finds You in Hope, Kansas"
"/media/Dados/bases/SWDE/book/book-christianbook/0604.htm",Have a Little Faith
"/media/Dados/bases/SWDE/book/book-christianbook/0035.htm",Indivisible
"/media/Dados/bases/SWDE/book/book-christianbook/1687.htm",Fifty Reasons Why Jesus Came to Die
"/media/Dados/bases/SWDE/book/book-christianbook/0055.htm","It's Not About Me, Teen Edition"
"/media/Dados/bases/SWDE/book/book-christianbook/0090.htm",Marriage Under Fire: Why We Must Win This Battle
"/media/Dados/bases/SWDE/book/book-christianbook/1083.htm",A Match Made in Texas
"/media/Dados/bases/SWDE/book/book-christianbook/0556.htm",Exploring The Bible: Joshua: A Devotional Commentary
"/media/Dados/bases/SWDE/book/book-christianbook/0122.htm",Know Your Bible: All 66 Books Explained and Applied
"/media/Dados/bases/SWDE/book/book-christianbook/1668.htm","When People Are Big and God Is Small: Overcoming Peer Pressure, Codependency, and the Fear of Man"
"/media/Dados/bases/SWDE/book/book-christianbook/0283.htm","911 Series, Vols. 1-3"
"/media/Dados/bases/SWDE/book/book-christianbook/1665.htm","The Dating Game Volume 6 Leader's Guide: Dating, the Bible, and Teenagers"
"/media/Dados/bases/SWDE/book/book-christianbook/0609.htm",H&#225blame de Dios (Tell Me About God)
"/media/Dados/bases/SWDE/book/book-christianbook/1361.htm","Jesús, El Pan de Vida, 100 Boletines (Jesus Our Bread of Life, 100 Bulletins)"
"/media/Dados/bases/SWDE/book/book-christianbook/0835.htm",Oh Say Can You Seed?
"/media/Dados/bases/SWDE/book/book-christianbook/1676.htm",Francis de Sales- Jane de Chantal: Letter of Spiritual Direction
"/media/Dados/bases/SWDE/book/book-christianbook/0314.htm",Forged In Faith: How Faith Shaped The Founding Fathers and The Birth of a Nation
"/media/Dados/bases/SWDE/book/book-christianbook/0469.htm",I Dare You: Embrace Life with Passion
"/media/Dados/bases/SWDE/book/book-christianbook/1893.htm",Forgotten God: Reversing Our Tragic Neglect of the Holy Spirit
"/media/Dados/bases/SWDE/book/book-christianbook/1451.htm","Saxon Math 2, Meeting Book"
"/media/Dados/bases/SWDE/book/book-christianbook/0102.htm","How to Preach a Sermon--CD-ROM, updated edition"
"/media/Dados/bases/SWDE/book/book-christianbook/0732.htm",Marian Thoughts
"/media/Dados/bases/SWDE/book/book-christianbook/1363.htm",Schoolhouse Brides
"/media/Dados/bases/SWDE/book/book-christianbook/0860.htm",Spurgeon on Prayer & Spiritual Warfare
"/media/Dados/bases/SWDE/book/book-christianbook/0671.htm",The Epistles of John
"/media/Dados/bases/SWDE/book/book-christianbook/0187.htm","A Kiss for Cade, Western Sky Series #2"
"/media/Dados/bases/SWDE/book/book-christianbook/1281.htm","This Is Christmas, Large Applique FLag"
"/media/Dados/bases/SWDE/book/book-christianbook/0134.htm",The War of the Worlds
"/media/Dados/bases/SWDE/book/book-christianbook/0296.htm",Choose: Steer Wide of Total Stupidity
"/media/Dados/bases/SWDE/book/book-christianbook/0832.htm",Letters to My Daughters: A Dad's Thoughts on the Most Important Decision--Marriage
"/media/Dados/bases/SWDE/book/book-christianbook/1131.htm",La Reina Ester (Queen Esther)
"/media/Dados/bases/SWDE/book/book-christianbook/0583.htm","Psalms 1-75, Holman Old Testament Commentary Volume 11"
"/media/Dados/bases/SWDE/book/book-christianbook/0422.htm","Lord, Teach Me to Study the Bible in 28 Days"
"/media/Dados/bases/SWDE/book/book-christianbook/0366.htm",God Is In the Small Stuff - And it all Matters
"/media/Dados/bases/SWDE/book/book-christianbook/0137.htm",The Prodigal God: Recovering the Heart of the Christian Faith
"/media/Dados/bases/SWDE/book/book-christianbook/0125.htm","God's Design for Sex Series, Book 4: Facing the Facts: The Truth About Sex and You, Revised"
"/media/Dados/bases/SWDE/book/book-christianbook/1375.htm",How To Know God Exists: Scientific Proof of God
"/media/Dados/bases/SWDE/book/book-christianbook/1479.htm","Folded 5 x 7 Church Membership Certificates, 6"
"/media/Dados/bases/SWDE/book/book-christianbook/1099.htm",Mercer Mayer's Little Critter: Just Me and My Mom
"/media/Dados/bases/SWDE/book/book-christianbook/0182.htm",Free from Worry
"/media/Dados/bases/SWDE/book/book-christianbook/0315.htm",Irresistible Invitation: Responding to the Extravagant Heart of God Leader's Guide with DVD
"/media/Dados/bases/SWDE/book/book-christianbook/1578.htm","Revelation Part 1, Vision of Hope and Promise: Wisdom of the Word Series"
"/media/Dados/bases/SWDE/book/book-christianbook/0112.htm",The Messenger of Satan
"/media/Dados/bases/SWDE/book/book-christianbook/0146.htm",Fearless DVD-Based Small Group Kit
"/media/Dados/bases/SWDE/book/book-christianbook/0629.htm","10 Lies the Church Tells Women, Revised"
"/media/Dados/bases/SWDE/book/book-christianbook/1250.htm",Early Church Fathers Nicene & Post-Nicene II Volume 3
"/media/Dados/bases/SWDE/book/book-christianbook/1485.htm","Stories Jesus Told: The Selfish Servant, Board Book"
"/media/Dados/bases/SWDE/book/book-christianbook/0528.htm","A Cousin's Challenge, Indiana Cousins Series #3"
"/media/Dados/bases/SWDE/book/book-christianbook/1826.htm","The Winged Watchman, Living History Library"
"/media/Dados/bases/SWDE/book/book-christianbook/0360.htm",The Unexpected Journey: Conversations with People Who Turned from Other Beliefs to Jesus
"/media/Dados/bases/SWDE/book/book-christianbook/1604.htm",A Jewel in His Crown: Rediscovering Your Value as a Woman of Excellence
"/media/Dados/bases/SWDE/book/book-christianbook/0678.htm",Strawberry Shortcake: Have a Sweet Easter!
"/media/Dados/bases/SWDE/book/book-christianbook/0696.htm",The Me I Want to Be
"/media/Dados/bases/SWDE/book/book-christianbook/1024.htm","Daniel and the Lions' Den, Greatest Heroes and Legends of the Bible DVD"
"/media/Dados/bases/SWDE/book/book-christianbook/0543.htm",But They That Wait Throw
"/media/Dados/bases/SWDE/book/book-christianbook/1500.htm","The Spoils of Eden, Dawn of Hawaii Series #1"
"/media/Dados/bases/SWDE/book/book-christianbook/0251.htm","An Honest Love, Hearts of Middlefield Series #2"
"/media/Dados/bases/SWDE/book/book-christianbook/0864.htm",A Greek English Lexicon of the New Testament and O/ Early Christian Literature 3rd ed. (BDAG)
"/media/Dados/bases/SWDE/book/book-christianbook/1548.htm",Simply Strategic Volunteers: Empowering People for Ministry
"/media/Dados/bases/SWDE/book/book-christianbook/1304.htm",Heaven Is So Real! Expanded Edition
"/media/Dados/bases/SWDE/book/book-christianbook/0993.htm",Finding the Favor of God Your Life
"/media/Dados/bases/SWDE/book/book-christianbook/0723.htm",Into the Region of Awe: Mysticism in C. S. Lewis
"/media/Dados/bases/SWDE/book/book-christianbook/0483.htm",Nelson's Guide to Denominations
"/media/Dados/bases/SWDE/book/book-christianbook/0566.htm","Vincent's New Testament Word Studies, 4 Volumes"
"/media/Dados/bases/SWDE/book/book-christianbook/1871.htm",Bible Fun! New Testament Activities for Kids
"/media/Dados/bases/SWDE/book/book-christianbook/1067.htm",Putting Jesus in His Place: The Case for the Deity of Christ
"/media/Dados/bases/SWDE/book/book-christianbook/1255.htm",Using Scripture in Pastoral Counseling
"/media/Dados/bases/SWDE/book/book-christianbook/0965.htm",Attendance Pads (pkg. of 5)
"/media/Dados/bases/SWDE/book/book-christianbook/0186.htm",The 10 Most Important Things You Can Say to a Catholic
"/media/Dados/bases/SWDE/book/book-christianbook/0540.htm",God & the History of Art Revised
"/media/Dados/bases/SWDE/book/book-christianbook/0350.htm",Song of Solomon Students Guide
"/media/Dados/bases/SWDE/book/book-christianbook/0233.htm",Change Is Like a Slinky: 30 Strategies for Promoting and Surviving Change in Your Organization
"/media/Dados/bases/SWDE/book/book-christianbook/1725.htm",Opening Up Proverbs
"/media/Dados/bases/SWDE/book/book-christianbook/1215.htm",The Supernatural Ways of Royalty: Discovering Your Rights and Privileges of Being a Son or Daughter of God
"/media/Dados/bases/SWDE/book/book-christianbook/1914.htm","Beyond the Gates of Splendor, DVD"
"/media/Dados/bases/SWDE/book/book-christianbook/0467.htm",Avoiding the Greener Grass Syndrome
"/media/Dados/bases/SWDE/book/book-christianbook/1974.htm",Straight-Edge Ruler with Books of the Bible
"/media/Dados/bases/SWDE/book/book-christianbook/0806.htm",Star of Light
"/media/Dados/bases/SWDE/book/book-christianbook/0096.htm","Uncommon Heroes Series, Vols 1-3"
"/media/Dados/bases/SWDE/book/book-christianbook/0897.htm",Discerning the Voice of God: How to Recognize When God Speaks
"/media/Dados/bases/SWDE/book/book-christianbook/1948.htm","Concluding Unscientific PostScript to Philosophical Fragments, Vol. 1"
"/media/Dados/bases/SWDE/book/book-christianbook/1241.htm",The Mom Factor
"/media/Dados/bases/SWDE/book/book-christianbook/0163.htm","Allison's Journey, Brides of Webster County Series #4"
"/media/Dados/bases/SWDE/book/book-christianbook/1869.htm",Fatal Secrets
"/media/Dados/bases/SWDE/book/book-christianbook/1778.htm",Bought with Blood: The Divine Exchange at the Cross
"/media/Dados/bases/SWDE/book/book-christianbook/0680.htm","Sweetpea Beauty: A Girl After God's Own Heart, DVD"
"/media/Dados/bases/SWDE/book/book-christianbook/0757.htm",Shield of Faith--Pewter Pendant
"/media/Dados/bases/SWDE/book/book-christianbook/0928.htm",Torn Asunder: Recovering from an Extramarital Affair
"/media/Dados/bases/SWDE/book/book-christianbook/0022.htm","Fearless, Discussion Guide"
"/media/Dados/bases/SWDE/book/book-christianbook/0908.htm","1 Timothy & Titus: Fighting the Good Fight, John Stott Bible Studies"
"/media/Dados/bases/SWDE/book/book-christianbook/1040.htm","¿Cuál Religión Salva? Paq. de 25 Tratados (Which Church Saves? Tracts, Pkg. of 25)"
"/media/Dados/bases/SWDE/book/book-christianbook/0962.htm",Thru-the-Bible Coloring Pages (Ages 6-8)
"/media/Dados/bases/SWDE/book/book-christianbook/1514.htm",Know Your Bible: All 66 Books Explained and Applied
"/media/Dados/bases/SWDE/book/book-christianbook/1524.htm","Bonhoeffer: Pastor, Martyr, Prophet, Spy"
"/media/Dados/bases/SWDE/book/book-christianbook/1776.htm",10 Lies About God: And Truths That Shatter Deception
"/media/Dados/bases/SWDE/book/book-christianbook/0572.htm",The Little House
