URL,EXTRACTED VALUE
"/media/Dados/bases/SWDE/book/book-christianbook/0424.htm",five-in-one series:
"/media/Dados/bases/SWDE/book/book-christianbook/0205.htm","Wagner, whose spiritual gifts seminars are warmly received by a wide range of pastors and denominations, also gives new insights on:"
"/media/Dados/bases/SWDE/book/book-christianbook/0396.htm",", plus the seven volumes:"
"/media/Dados/bases/SWDE/book/book-christianbook/1016.htm","heart, too! 384 pages, softcover,"
"/media/Dados/bases/SWDE/book/book-christianbook/0154.htm","series, charts, and other materials to reinforce the sessions. Appropriate for the whole family, especially kids ages 4 to 12."
