URL,EXTRACTED VALUE
"/media/Dados/bases/SWDE/book/book-christianbook/0105.htm",2.Demonstrating: Modeling a relationship with God
"/media/Dados/bases/SWDE/book/book-christianbook/0423.htm",TRUE HOME ALWAYS IN SIGHT.
"/media/Dados/bases/SWDE/book/book-christianbook/0391.htm","to move freely into your future. Complete with a study guide for group or personal use,"
"/media/Dados/bases/SWDE/book/book-christianbook/0332.htm",cry out to Him…
"/media/Dados/bases/SWDE/book/book-christianbook/0102.htm",21st Century!
"/media/Dados/bases/SWDE/book/book-christianbook/0157.htm","Dave Kirby, Troy (Alabama) Broadcasting Corporation"
