URL,EXTRACTED VALUE
"/media/Dados/bases/SWDE/book/book-christianbook/1526.htm","We can hope there will be a continuing series.""--Michael Duduit,"
"/media/Dados/bases/SWDE/book/book-christianbook/1129.htm",", author of"
"/media/Dados/bases/SWDE/book/book-christianbook/0003.htm",is a New York Times best-selling author whose connection with the Amish community has been featured on
"/media/Dados/bases/SWDE/book/book-christianbook/0653.htm",Dell Computer Human Resources Executive
"/media/Dados/bases/SWDE/book/book-christianbook/0237.htm",", and"
