URL,EXTRACTED VALUE
"/media/Dados/bases/SWDE/book/book-christianbook/1075.htm",Counseling African American Marriages & Families
"/media/Dados/bases/SWDE/book/book-christianbook/0463.htm","The Truth Seeker, O'Malley Series #3"
"/media/Dados/bases/SWDE/book/book-christianbook/1653.htm",Pudgy Where is Your Nose? Book
"/media/Dados/bases/SWDE/book/book-christianbook/1920.htm","Luke, Beacon Bible Expositions"
"/media/Dados/bases/SWDE/book/book-christianbook/0579.htm","The Chronicles of Narnia, 7 Volumes: Full-Color Collector's Edition"
"/media/Dados/bases/SWDE/book/book-christianbook/1392.htm",Celebrating Sundays (pack 5): Ten Great Reasons to Enjoy Gods Priceless Gift of The Lords Day
"/media/Dados/bases/SWDE/book/book-christianbook/0877.htm","The Spider Sapphire Mystery, Nancy Drew Mystery Stories Series #45"
"/media/Dados/bases/SWDE/book/book-christianbook/1844.htm",Boat
"/media/Dados/bases/SWDE/book/book-christianbook/0846.htm",Sit-In: How Four Boys Stood Up By Sitting Down
"/media/Dados/bases/SWDE/book/book-christianbook/1471.htm","Flight of the Outcasts, Aedyn Chronicles Series #2"
"/media/Dados/bases/SWDE/book/book-christianbook/1717.htm",Winter: A Spiritual Biography of the Season
"/media/Dados/bases/SWDE/book/book-christianbook/0831.htm",Clifford Goes To Dog School
"/media/Dados/bases/SWDE/book/book-christianbook/1299.htm",Priorities: Mastering Time Management
"/media/Dados/bases/SWDE/book/book-christianbook/1549.htm",Curious George and the Ice Cream Surprise
"/media/Dados/bases/SWDE/book/book-christianbook/1428.htm",The Best Story
"/media/Dados/bases/SWDE/book/book-christianbook/0085.htm","Parables: Imagine Life God's Way, New Community Series"
"/media/Dados/bases/SWDE/book/book-christianbook/1092.htm","Stanley, Flat Again!"
"/media/Dados/bases/SWDE/book/book-christianbook/1654.htm","Heroes of History: Clara Barton, Angel of the Battlefield"
"/media/Dados/bases/SWDE/book/book-christianbook/1898.htm",Tom Crean's Rabbit
"/media/Dados/bases/SWDE/book/book-christianbook/1427.htm",Héroes Cristianos de Ayer y de Hoy: Eric Liddell (Christian Heroes Then & Now: Eric Liddell)
"/media/Dados/bases/SWDE/book/book-christianbook/0080.htm","The Judgment, The Rose Trilogy #2"
"/media/Dados/bases/SWDE/book/book-christianbook/1310.htm",Kings and Carpenters: One Hundred Bible Land Jobs You Might Have Praised or Panned
"/media/Dados/bases/SWDE/book/book-christianbook/1908.htm",Grandfathers Journey
"/media/Dados/bases/SWDE/book/book-christianbook/0374.htm",Be Decisive (Jeremiah)
"/media/Dados/bases/SWDE/book/book-christianbook/0625.htm","Juan, John"
"/media/Dados/bases/SWDE/book/book-christianbook/1900.htm",Overcoming the World Missions Crisis
"/media/Dados/bases/SWDE/book/book-christianbook/1391.htm",Safe at Home
"/media/Dados/bases/SWDE/book/book-christianbook/1503.htm",Travel with Billy Graham: In the footsteps of Gods Ambassador
"/media/Dados/bases/SWDE/book/book-christianbook/0533.htm","The Thirteenth Pearl, Nancy Drew Mystery Stories Series #56"
"/media/Dados/bases/SWDE/book/book-christianbook/1082.htm",James the Red Engine
"/media/Dados/bases/SWDE/book/book-christianbook/1668.htm",Problems: Solving Them God's Way
"/media/Dados/bases/SWDE/book/book-christianbook/1665.htm",La Generaci&#243n Emergente (The Emerging Generation)
"/media/Dados/bases/SWDE/book/book-christianbook/1550.htm",How Artists See III
"/media/Dados/bases/SWDE/book/book-christianbook/0501.htm",Anastasia Has The Answers
"/media/Dados/bases/SWDE/book/book-christianbook/0835.htm",There's A Map in My Lap: All About Maps (The Cat in the Hat's Learning Library)
"/media/Dados/bases/SWDE/book/book-christianbook/0878.htm",Signs of the Times
"/media/Dados/bases/SWDE/book/book-christianbook/1728.htm",Dora's First Trip
"/media/Dados/bases/SWDE/book/book-christianbook/1860.htm",The Holy Spirit and the Renewal of All Things: Pneumatology in Paul and Jurgen Moltmann
"/media/Dados/bases/SWDE/book/book-christianbook/0150.htm","Knowing the Bible 101: A Guide to God's Word in Plain Language, Christianity 101 Bible Studies"
"/media/Dados/bases/SWDE/book/book-christianbook/1476.htm",Pinocchio
"/media/Dados/bases/SWDE/book/book-christianbook/1256.htm",Thomas in Town: Valentine's Day in Vicarstown
"/media/Dados/bases/SWDE/book/book-christianbook/1105.htm",Toot and Puddle: Take a Leap!
"/media/Dados/bases/SWDE/book/book-christianbook/1318.htm","Galatians: Free in Christ, Catholic Perspectives"
"/media/Dados/bases/SWDE/book/book-christianbook/0421.htm","Stars Remember, McCord Brothers Series #1"
"/media/Dados/bases/SWDE/book/book-christianbook/1291.htm",Rufus M.
"/media/Dados/bases/SWDE/book/book-christianbook/1702.htm","The Apocalyptic Imagination, An Introduction to Jewish Apocalyptic Literature"
"/media/Dados/bases/SWDE/book/book-christianbook/1394.htm","#14: Crush Alert"
"/media/Dados/bases/SWDE/book/book-christianbook/0778.htm",Through Time: London
"/media/Dados/bases/SWDE/book/book-christianbook/1955.htm",The Gospel of John Gift Book
"/media/Dados/bases/SWDE/book/book-christianbook/1611.htm",Thomas and Friends: Activity Express
"/media/Dados/bases/SWDE/book/book-christianbook/1126.htm",Busy Baby: Tabbed Diggers
"/media/Dados/bases/SWDE/book/book-christianbook/0459.htm","Vicious Cycle, Intervention Series #2"
"/media/Dados/bases/SWDE/book/book-christianbook/1626.htm",NEW! TouchPoints For Recovery
"/media/Dados/bases/SWDE/book/book-christianbook/0567.htm",Autobiography
"/media/Dados/bases/SWDE/book/book-christianbook/1099.htm",Mercer Mayer's Little Critter: What a Bad Dream
"/media/Dados/bases/SWDE/book/book-christianbook/0529.htm",Alexandra's Scroll: The Story of the First Hanukkah
"/media/Dados/bases/SWDE/book/book-christianbook/1483.htm",The Vicar of Wakefield
"/media/Dados/bases/SWDE/book/book-christianbook/1917.htm","The Aeneid, Fresh Prose Translation"
"/media/Dados/bases/SWDE/book/book-christianbook/1826.htm","The Cottage at Bantry Bay, The O'Sullivan Family #1"
"/media/Dados/bases/SWDE/book/book-christianbook/1147.htm",The Cults: How to Respond
"/media/Dados/bases/SWDE/book/book-christianbook/1567.htm",Tea With Milk
"/media/Dados/bases/SWDE/book/book-christianbook/1585.htm","Love, Raggedy Ann"
"/media/Dados/bases/SWDE/book/book-christianbook/0640.htm",Matthew: The First Gospel
"/media/Dados/bases/SWDE/book/book-christianbook/0678.htm",Strawberry Shortcake: A Picnic Adventure
"/media/Dados/bases/SWDE/book/book-christianbook/1642.htm",What Do Other Faiths Believe? A Study of World Religions
"/media/Dados/bases/SWDE/book/book-christianbook/0543.htm",Clifford's Busy Week
"/media/Dados/bases/SWDE/book/book-christianbook/1870.htm","Upper Room Spiritual Classics, Series 2"
"/media/Dados/bases/SWDE/book/book-christianbook/1863.htm",The Scarlet Letter
"/media/Dados/bases/SWDE/book/book-christianbook/1225.htm",Missing Persons and Mistaken Identities: Women and Gender in Ancient Israel
"/media/Dados/bases/SWDE/book/book-christianbook/0587.htm",Lift the Flap: Lost Sheep
"/media/Dados/bases/SWDE/book/book-christianbook/0765.htm","Happy Day Books, Level 2: It's Harvest Time!"
"/media/Dados/bases/SWDE/book/book-christianbook/1012.htm",Sir Gawain and the Green Knight
"/media/Dados/bases/SWDE/book/book-christianbook/1856.htm",The Bald Eagle's View of American History
"/media/Dados/bases/SWDE/book/book-christianbook/0739.htm",Selected Poems
"/media/Dados/bases/SWDE/book/book-christianbook/1904.htm",The Theology of the Christian Life in J.I. Packer's Thought
"/media/Dados/bases/SWDE/book/book-christianbook/1346.htm",Mr. Putter & Tabby Spill the Beans
"/media/Dados/bases/SWDE/book/book-christianbook/0812.htm",Julianus Pomerius the Contemplative Life
"/media/Dados/bases/SWDE/book/book-christianbook/0970.htm",Two Noble Kinsmen
"/media/Dados/bases/SWDE/book/book-christianbook/0698.htm",The Essential Kierkegaard
"/media/Dados/bases/SWDE/book/book-christianbook/0946.htm",Four Ways of Holiness for the Universal Church: Drawn from the Monastic Tradition
"/media/Dados/bases/SWDE/book/book-christianbook/0525.htm",Curious Baby My First Nursery Songs (Curious George Book & CD)
"/media/Dados/bases/SWDE/book/book-christianbook/0827.htm","El Reino Inconmovible de Dios, Unshakable Kingdom of God"
"/media/Dados/bases/SWDE/book/book-christianbook/1000.htm",The Everything Health Guide To Postpartum Care: A Complete Guide To Looking And Feeling Great After Delivery And Beyond
"/media/Dados/bases/SWDE/book/book-christianbook/0307.htm","The Gospel of Mark, New International Commentary on the New Testament, NICNT, Revised"
"/media/Dados/bases/SWDE/book/book-christianbook/0790.htm","Leaving, Bailey Flanigan Series #1"
"/media/Dados/bases/SWDE/book/book-christianbook/1482.htm",Stop and Look at God's World
"/media/Dados/bases/SWDE/book/book-christianbook/0756.htm",Encyclopedia Brown and the Case of the Secret UFO
"/media/Dados/bases/SWDE/book/book-christianbook/1272.htm","Suing for America's Soul: John Whitehead, the Rutherford Institute, and Conservative Christians in the Courts"
"/media/Dados/bases/SWDE/book/book-christianbook/1839.htm",Siddhartha
"/media/Dados/bases/SWDE/book/book-christianbook/0981.htm",The Upanishads
"/media/Dados/bases/SWDE/book/book-christianbook/1707.htm",All the Pretty Little Horses
"/media/Dados/bases/SWDE/book/book-christianbook/1103.htm","Serie Preguntas Desafiantes &#191Cu&#225n confiable es la Biblia?, How Reliable is The Bible?"
"/media/Dados/bases/SWDE/book/book-christianbook/1532.htm",Bayport Buccaneers # 16 Hardy Boys (All New) Undercover Brothers
"/media/Dados/bases/SWDE/book/book-christianbook/1077.htm",The Hardy Boys' Mysteries #59: Night of the Werewolf
"/media/Dados/bases/SWDE/book/book-christianbook/0124.htm","The Rescuer, O'Malley Series #6"
"/media/Dados/bases/SWDE/book/book-christianbook/1645.htm","Boys of Wartime: Daniel at the Siege of Boston, 1776"
"/media/Dados/bases/SWDE/book/book-christianbook/1355.htm",The Hardy Boys' Mysteries #53: The Clue of the Hissing Serpent
"/media/Dados/bases/SWDE/book/book-christianbook/1249.htm","Blood Money, The Lake Champlain Mysteries #3"
"/media/Dados/bases/SWDE/book/book-christianbook/1798.htm",Fallen Stars and Bitter Waters: A Novel
"/media/Dados/bases/SWDE/book/book-christianbook/0915.htm",A Message For Today: A Study in Mark's Gospel
"/media/Dados/bases/SWDE/book/book-christianbook/1243.htm",Baptist Why and Why Not
"/media/Dados/bases/SWDE/book/book-christianbook/1154.htm",Journey to the Centre of the Earth
"/media/Dados/bases/SWDE/book/book-christianbook/1495.htm",God and the Rhetoric of Sexuality
"/media/Dados/bases/SWDE/book/book-christianbook/0611.htm",Renewing Tradition: Studies in Texts and Contexts in Honor of James W. Thompson
"/media/Dados/bases/SWDE/book/book-christianbook/0781.htm",Curious George Visits the Zoo Hardcover
"/media/Dados/bases/SWDE/book/book-christianbook/1552.htm","Get Acquainted with Your Christian Faith, Leader's Guide"
"/media/Dados/bases/SWDE/book/book-christianbook/1732.htm",Mysteries in Our National Parks #1: Wolf Stalker
"/media/Dados/bases/SWDE/book/book-christianbook/0907.htm",The Bible and The University
"/media/Dados/bases/SWDE/book/book-christianbook/1692.htm","Evidence of Grace, Jenna's Creek Series #3"
"/media/Dados/bases/SWDE/book/book-christianbook/1755.htm",Dressed to Steal # 22 Nancy Drew (All New) Girl Detective
"/media/Dados/bases/SWDE/book/book-christianbook/0746.htm",One Snowy Night
"/media/Dados/bases/SWDE/book/book-christianbook/1512.htm",Annie Oakley Saves the Day
"/media/Dados/bases/SWDE/book/book-christianbook/1498.htm","The Everything Learning French Book, Second Edition with CD"
"/media/Dados/bases/SWDE/book/book-christianbook/1797.htm",Raggedy Ann Stories
"/media/Dados/bases/SWDE/book/book-christianbook/1183.htm","Theodora's Baby, Theodora Series #3"
"/media/Dados/bases/SWDE/book/book-christianbook/1636.htm","Barnabas: A Good Man, Full of Faith"
"/media/Dados/bases/SWDE/book/book-christianbook/0637.htm",Diego's International Rescue League
"/media/Dados/bases/SWDE/book/book-christianbook/0018.htm","Happy Day Books, Level 2: Simon Minds His Manners"
"/media/Dados/bases/SWDE/book/book-christianbook/0234.htm",Berenstain Bears and the Joy of Giving
"/media/Dados/bases/SWDE/book/book-christianbook/1343.htm",A Good Day Board Book
"/media/Dados/bases/SWDE/book/book-christianbook/0499.htm",On Solitude
"/media/Dados/bases/SWDE/book/book-christianbook/0787.htm",Martha Speaks: Leader of the Pack
"/media/Dados/bases/SWDE/book/book-christianbook/0094.htm",The Treasure Tree
"/media/Dados/bases/SWDE/book/book-christianbook/1252.htm","Nicolas/Nicolae, Left Behind Series #3, Spanish Edition"
"/media/Dados/bases/SWDE/book/book-christianbook/0190.htm",Exploring The Minor Prophets
"/media/Dados/bases/SWDE/book/book-christianbook/0845.htm",Just Like Dora #8: Dora the Explorer
"/media/Dados/bases/SWDE/book/book-christianbook/1510.htm","Psalms 1-59, Continental Commentary Series"
"/media/Dados/bases/SWDE/book/book-christianbook/0951.htm","Gratitude: Words of Wisdom to Guide, Influence, Inspire and Share"
"/media/Dados/bases/SWDE/book/book-christianbook/1814.htm",The Pathfinder
"/media/Dados/bases/SWDE/book/book-christianbook/1153.htm",Tevye the Dairyman and Motl the Cantor's Son
"/media/Dados/bases/SWDE/book/book-christianbook/1368.htm",Arch Books Bible Stories: When Jesus Was Born
"/media/Dados/bases/SWDE/book/book-christianbook/0912.htm",Elmo's Ducky Day
"/media/Dados/bases/SWDE/book/book-christianbook/0515.htm",Yet with a Steady Beat: Contemporary U.S. Afrocentric Biblical Interpretation
"/media/Dados/bases/SWDE/book/book-christianbook/0613.htm",The Guide ... Colossians & Philemon
"/media/Dados/bases/SWDE/book/book-christianbook/0971.htm","Chicken Soup for the Soul: Devotional Stories for Mothers: 101 Daily Devotions to Comfort, Encourage, and Inspire Mothers"
"/media/Dados/bases/SWDE/book/book-christianbook/0932.htm",Schleiermacher: Abingdon Pillars of Theology Series
"/media/Dados/bases/SWDE/book/book-christianbook/1698.htm","Teens Talk Growing Up-Stories About Growing Up, Meeting Challenges, and Learning From Life"
"/media/Dados/bases/SWDE/book/book-christianbook/1810.htm",The Word in English Classrooms: Best Practices of Faith Integration
"/media/Dados/bases/SWDE/book/book-christianbook/0582.htm","Sisters In Time Series: Meg Follows a Dream, The Fight for Freedom (1844)"
"/media/Dados/bases/SWDE/book/book-christianbook/1036.htm","#11: Jungle Doctor Stings a Scorpion"
"/media/Dados/bases/SWDE/book/book-christianbook/1785.htm",Motivating Employees: Bringing Out The Best in Your People
"/media/Dados/bases/SWDE/book/book-christianbook/1216.htm",Perseverance in Gratitude: A Socio-Rhetorical Commentary on the Epistle to the Hebrews
"/media/Dados/bases/SWDE/book/book-christianbook/1102.htm",My Friend is Struggling With . . . Thoughts of Suicide
"/media/Dados/bases/SWDE/book/book-christianbook/0184.htm","Daniel, New American Commentary"
"/media/Dados/bases/SWDE/book/book-christianbook/1874.htm","Divine Confidential, The Divine Series #2"
"/media/Dados/bases/SWDE/book/book-christianbook/0155.htm",Participant's Guide
"/media/Dados/bases/SWDE/book/book-christianbook/1762.htm",A Man Of One Book?: John Wesley's Interpretation and Use of the Bible
"/media/Dados/bases/SWDE/book/book-christianbook/1595.htm","A New Song, Mitford Series #5"
"/media/Dados/bases/SWDE/book/book-christianbook/0654.htm",Teens Talk Tough Times-Stories About The Hardest Part of Being a Teenager
"/media/Dados/bases/SWDE/book/book-christianbook/0879.htm","Abraham Lincoln: Lawyer, Leader, Legend"
"/media/Dados/bases/SWDE/book/book-christianbook/1922.htm","A History of Biblical Interpretation, Vol 2: The Medieval through the Reformation Periods"
"/media/Dados/bases/SWDE/book/book-christianbook/1491.htm",Prayers and Promises: Timeless Gospel Stories
"/media/Dados/bases/SWDE/book/book-christianbook/0269.htm",Just in Time Esther: The Book of Esther for Children
"/media/Dados/bases/SWDE/book/book-christianbook/0779.htm",Revival Sermons: How You Can Be a Part of Today's Spiritual Awakening
"/media/Dados/bases/SWDE/book/book-christianbook/0643.htm",The Earliest Text of the Hebrew Bible: The Relationship between the Masoretic Text & the Hebrew base of the LXX
"/media/Dados/bases/SWDE/book/book-christianbook/1095.htm","Chicken Soup for the Soul: Thanks Dad: 101 Stories of Gratitude, Love, and Good Times"
"/media/Dados/bases/SWDE/book/book-christianbook/1718.htm","The Pocket Idiot's Guide to Repairing Your Credit, 2nd Edition"
"/media/Dados/bases/SWDE/book/book-christianbook/1599.htm",The Complete Idiot's Guide to Personal Bankruptcy
"/media/Dados/bases/SWDE/book/book-christianbook/1158.htm","1 Timothy, 2 Timothy, Titus, Philemon, Hebrews"
