URL,EXTRACTED VALUE
"/media/Dados/bases/SWDE/book/book-christianbook/0831.htm",It only takes a little to BE BIG!
"/media/Dados/bases/SWDE/book/book-christianbook/1224.htm",Peter Kalellis's
"/media/Dados/bases/SWDE/book/book-christianbook/1479.htm",will help you share the gift of prayer with others.
"/media/Dados/bases/SWDE/book/book-christianbook/0984.htm","is a wise and winning tale of growing up and discovering that though there are some things you just can’t do, that still leaves everything you can."
"/media/Dados/bases/SWDE/book/book-christianbook/1832.htm",SPANISH EDITION. Join Pastor Jack as he reveals Gods passion for a global and very personal awakening.
"/media/Dados/bases/SWDE/book/book-christianbook/0636.htm","More of the hilarious, sparkling and endearing diaries of a thirty-something Christian, Theodora Llewellyn."
"/media/Dados/bases/SWDE/book/book-christianbook/1837.htm","Being a trustworthy husband, a loving father, a steady worker, and a man of unwavering character"
"/media/Dados/bases/SWDE/book/book-christianbook/1863.htm",Ruben Toledos breathtaking drawings have appeared in such high-fashion magazines as
"/media/Dados/bases/SWDE/book/book-christianbook/1759.htm","""A SKILLFUL BLEND OF CHARACTER, PHILOSOPHY AND"
"/media/Dados/bases/SWDE/book/book-christianbook/1619.htm",Bob Beaudine believes
