URL,EXTRACTED VALUE
"/media/Dados/bases/SWDE/book/book-christianbook/0352.htm","Acts: Build Community, New Community Series"
"/media/Dados/bases/SWDE/book/book-christianbook/0892.htm","Do I Have to Go? 101 Questions About the Mass, the Eucharist, and Your Spiritual Life"
"/media/Dados/bases/SWDE/book/book-christianbook/1481.htm",Postmillennialism: An Eschatology of Hope
"/media/Dados/bases/SWDE/book/book-christianbook/1989.htm","Aloha Reef Series, Vols 1-4"
"/media/Dados/bases/SWDE/book/book-christianbook/0394.htm","Battlefield of the Mind, Winning the Battle in Your Mind"
"/media/Dados/bases/SWDE/book/book-christianbook/1449.htm",Twelve Ordinary Men
"/media/Dados/bases/SWDE/book/book-christianbook/0271.htm","Circle Series, Vols 1-3"
"/media/Dados/bases/SWDE/book/book-christianbook/1680.htm",Money Life Basics- Work & Business
"/media/Dados/bases/SWDE/book/book-christianbook/0582.htm","Sisters In Time Series: Rachel and the Riot, The Labor Movement Divides a Family (1889)"
"/media/Dados/bases/SWDE/book/book-christianbook/1324.htm","The Road to Cana, Christ the Lord Series #2"
"/media/Dados/bases/SWDE/book/book-christianbook/0044.htm","Straight From the Heart, DVD"
"/media/Dados/bases/SWDE/book/book-christianbook/1496.htm",Shield of Faith--Pewter Pendant
"/media/Dados/bases/SWDE/book/book-christianbook/1541.htm","Medieval Exegesis, Vol 3: The Four Senses of Scripture"
"/media/Dados/bases/SWDE/book/book-christianbook/0891.htm",Ever After-Large Print
"/media/Dados/bases/SWDE/book/book-christianbook/1693.htm",Follow You CD
"/media/Dados/bases/SWDE/book/book-christianbook/0387.htm",Annie's People Series Vols 1-2
"/media/Dados/bases/SWDE/book/book-christianbook/0084.htm",The Bible Story Handbook
"/media/Dados/bases/SWDE/book/book-christianbook/1950.htm","Happy Day Books, Level 3: God Made Our Bodies"
"/media/Dados/bases/SWDE/book/book-christianbook/0686.htm",The Me I Want to Be
"/media/Dados/bases/SWDE/book/book-christianbook/0960.htm",God Gave Us Christmas
"/media/Dados/bases/SWDE/book/book-christianbook/0524.htm",Prisoners of Hope
"/media/Dados/bases/SWDE/book/book-christianbook/0659.htm","Grade 3 Math Lifepac 3: Add/Sub. Facts, Fraction of a Set"
"/media/Dados/bases/SWDE/book/book-christianbook/0299.htm","Code Blue, Prescription for Trouble Series #1"
"/media/Dados/bases/SWDE/book/book-christianbook/0893.htm",Life Style: Real Perspectives from Radical Women in the Bible
"/media/Dados/bases/SWDE/book/book-christianbook/0279.htm",Cast of Characters
"/media/Dados/bases/SWDE/book/book-christianbook/0319.htm",Cultivating Contentment: Women of Faith Bible Studies
"/media/Dados/bases/SWDE/book/book-christianbook/0438.htm","Walk With Me Today, Lord: Devotions for Women"
"/media/Dados/bases/SWDE/book/book-christianbook/1417.htm",Exploring The Future
"/media/Dados/bases/SWDE/book/book-christianbook/1697.htm","Cedarmont Worship for Kids: Volume 2 (with Split Tracks), CD"
"/media/Dados/bases/SWDE/book/book-christianbook/1416.htm",The Bride Collector
"/media/Dados/bases/SWDE/book/book-christianbook/1581.htm","NASB The MacArthur Study Bible, Large Print Hardcover Edition"
"/media/Dados/bases/SWDE/book/book-christianbook/0332.htm",Lapel Pin with Message Card
"/media/Dados/bases/SWDE/book/book-christianbook/0001.htm",Know Your Bible: All 66 Books Explained and Applied
"/media/Dados/bases/SWDE/book/book-christianbook/1969.htm",From Anger to Intimacy: How Forgiveness Can Transform Your Marriage
"/media/Dados/bases/SWDE/book/book-christianbook/0414.htm",Understanding Dreams & Visions Audiobook on CD
"/media/Dados/bases/SWDE/book/book-christianbook/0721.htm",The Story Girl Book 8: Winds of Change
"/media/Dados/bases/SWDE/book/book-christianbook/1260.htm",Experiencing God: The Three Stages of Prayer
"/media/Dados/bases/SWDE/book/book-christianbook/0759.htm",Finding Your Way After Your Spouse Dies
"/media/Dados/bases/SWDE/book/book-christianbook/0345.htm",How to Pray: The Best of John Wesley on Prayer
"/media/Dados/bases/SWDE/book/book-christianbook/0363.htm",Sixteen Brides
"/media/Dados/bases/SWDE/book/book-christianbook/0797.htm",Life Lessons: Ephesians
"/media/Dados/bases/SWDE/book/book-christianbook/1717.htm","Seasons in the Year: Poems, Prayers, Praise, & Prose"
"/media/Dados/bases/SWDE/book/book-christianbook/1294.htm",The Lord's Prayer: Praying with Power
"/media/Dados/bases/SWDE/book/book-christianbook/0341.htm","Be Daring (Acts 13-28), The Be Series"
"/media/Dados/bases/SWDE/book/book-christianbook/0120.htm",Birches
"/media/Dados/bases/SWDE/book/book-christianbook/1413.htm","Jumping to Conclusions, Rachel Yoder Series #7"
"/media/Dados/bases/SWDE/book/book-christianbook/0916.htm","Joshua, Men Of Character Series"
"/media/Dados/bases/SWDE/book/book-christianbook/1971.htm",199 Treasures of Wisdom on Talking with God
"/media/Dados/bases/SWDE/book/book-christianbook/1631.htm","How We Got the Bible, 3d ed.: Revised and Expanded"
"/media/Dados/bases/SWDE/book/book-christianbook/1589.htm",Remember the Reason
"/media/Dados/bases/SWDE/book/book-christianbook/0668.htm",Sixteen Brides
"/media/Dados/bases/SWDE/book/book-christianbook/1310.htm","The Last Thing I Remember, Homelanders Series #1"
"/media/Dados/bases/SWDE/book/book-christianbook/0201.htm",Intercessory Prayer DVD
"/media/Dados/bases/SWDE/book/book-christianbook/1001.htm",Fasting: Spiritual Freedom Beyond Our Appetites
"/media/Dados/bases/SWDE/book/book-christianbook/0343.htm","The Gospel According to Mark, The Pillar New Testament Commentary"
"/media/Dados/bases/SWDE/book/book-christianbook/0175.htm",The Complete Book of Discipleship: On Being and Making Followers of Christ
"/media/Dados/bases/SWDE/book/book-christianbook/1308.htm","Suzanne Tate's Nature Series #18: Perky Pelican, A Tale of a Lively Bird"
"/media/Dados/bases/SWDE/book/book-christianbook/0418.htm",Casting Your Cares Upon The Lord
"/media/Dados/bases/SWDE/book/book-christianbook/1978.htm","Plain Paradise, Daughters of the Promise Series #4"
"/media/Dados/bases/SWDE/book/book-christianbook/1270.htm",A New Systematic Theology of the Christian Faith
"/media/Dados/bases/SWDE/book/book-christianbook/1988.htm","Seventh Day, A.D. Chronicles Series #7"
"/media/Dados/bases/SWDE/book/book-christianbook/0533.htm","Mystery of the Glowing Eye, Nancy Drew Mystery Stories Series #51"
"/media/Dados/bases/SWDE/book/book-christianbook/1163.htm","Preacher's Outline & Sermon Bible: KJV, Jeremiah 2 & Lamentations"
"/media/Dados/bases/SWDE/book/book-christianbook/0785.htm",How to Pray: The Best of John Wesley on Prayer
"/media/Dados/bases/SWDE/book/book-christianbook/0519.htm","Finding Peace: God's Promise of a Life Free from Regret, Anxiety, and Fear"
"/media/Dados/bases/SWDE/book/book-christianbook/1818.htm","Rose Book of Bible Charts, Maps & Time Lines--Volume 1"
"/media/Dados/bases/SWDE/book/book-christianbook/1891.htm",Perspectives on Election: Five Views
"/media/Dados/bases/SWDE/book/book-christianbook/1263.htm",UnLearning Church: New Edition
"/media/Dados/bases/SWDE/book/book-christianbook/0658.htm",Tokens of Trust: An Introduction to Christian Belief
"/media/Dados/bases/SWDE/book/book-christianbook/1865.htm","Confronting the Enemies Within, The Journey Series"
"/media/Dados/bases/SWDE/book/book-christianbook/0504.htm",Adjusting Your Life's Vision
"/media/Dados/bases/SWDE/book/book-christianbook/1410.htm",The Invitation CD
"/media/Dados/bases/SWDE/book/book-christianbook/1379.htm",Amplified & NASB Parallel Bible Hardcover
"/media/Dados/bases/SWDE/book/book-christianbook/1063.htm",Flickering Pixels: How Technology Shapes Your Faith
"/media/Dados/bases/SWDE/book/book-christianbook/0382.htm",Spiritual Direction: Wisdom for the Long Walk of Faith
"/media/Dados/bases/SWDE/book/book-christianbook/1488.htm",Following God Series: Life Principles for Following Christ
"/media/Dados/bases/SWDE/book/book-christianbook/0041.htm",The School of the Seers: A Practical Guide on How to See in the Unseen Realm
"/media/Dados/bases/SWDE/book/book-christianbook/1702.htm",A Short Introduction to the Hebrew Bible
"/media/Dados/bases/SWDE/book/book-christianbook/0448.htm",Everyday Promises: Spiritual Refreshment for Women
"/media/Dados/bases/SWDE/book/book-christianbook/1290.htm",Facing East: A Pilgrim's Journey into the Mysteries of Orthodoxy
"/media/Dados/bases/SWDE/book/book-christianbook/0961.htm",The Firstborn Advantage: Making Your Birth Order Work for You
"/media/Dados/bases/SWDE/book/book-christianbook/0157.htm","Greater Love, Tides of Truth Series #3"
"/media/Dados/bases/SWDE/book/book-christianbook/1365.htm",Amazing Miracles
"/media/Dados/bases/SWDE/book/book-christianbook/1999.htm",Faith in the Medieval World
"/media/Dados/bases/SWDE/book/book-christianbook/0012.htm",The Bare Bones Bible Handbook: 10 Minutes to Understanding Each Book of the Bible
"/media/Dados/bases/SWDE/book/book-christianbook/0165.htm","#6: Bailey's Peoria Problem"
"/media/Dados/bases/SWDE/book/book-christianbook/1600.htm","Nothing But Trouble, P.J. Sugar Series #1, Large Print"
"/media/Dados/bases/SWDE/book/book-christianbook/0136.htm",The Bride Collector
"/media/Dados/bases/SWDE/book/book-christianbook/1474.htm","Amplified & NKJV Parallel Bible Bonded Leather, Black, Large Print"
"/media/Dados/bases/SWDE/book/book-christianbook/1234.htm",California Capers
"/media/Dados/bases/SWDE/book/book-christianbook/1535.htm",The Art of Debt-Free Living: Living Large on Less than You Earn
"/media/Dados/bases/SWDE/book/book-christianbook/1332.htm",Foundations: The Afterlife Study Guide
"/media/Dados/bases/SWDE/book/book-christianbook/1080.htm",The Book of First Corinthians: Christianity in a Hostile Culture - Twenty-first Century Biblical Commentary
"/media/Dados/bases/SWDE/book/book-christianbook/0446.htm",White Christmas Pie
"/media/Dados/bases/SWDE/book/book-christianbook/1667.htm",Capyboppy
"/media/Dados/bases/SWDE/book/book-christianbook/0409.htm","Aloha Reef Series, Vols 1-4"
"/media/Dados/bases/SWDE/book/book-christianbook/0863.htm",A Sacred Sorrow: Meeting God in the Lost Language of Lament
"/media/Dados/bases/SWDE/book/book-christianbook/1225.htm","Belle and the Beast: A Christian Romance, DVD"
"/media/Dados/bases/SWDE/book/book-christianbook/0292.htm",Forgotten God: Reversing Our Tragic Neglect of the Holy Spirit
"/media/Dados/bases/SWDE/book/book-christianbook/1012.htm",God King: A Story in the Days of King Hezekiah
"/media/Dados/bases/SWDE/book/book-christianbook/0384.htm",Just Beyond the Clouds
"/media/Dados/bases/SWDE/book/book-christianbook/0207.htm","The Yada Yada Prayer Group Gets Caught, Yada Yada Series #5"
"/media/Dados/bases/SWDE/book/book-christianbook/0808.htm",Tracks of a Fellow Struggler: Living and Growing Through Grief
"/media/Dados/bases/SWDE/book/book-christianbook/0145.htm",Final Touch
"/media/Dados/bases/SWDE/book/book-christianbook/1123.htm",Ancient Near Eastern Thought and the Old Testament: Introducing the Conceptual World of the Hebrew Bible
"/media/Dados/bases/SWDE/book/book-christianbook/0062.htm",Raising Responsive Children: A Bible Study for Moms-Following God Christian Living Series
"/media/Dados/bases/SWDE/book/book-christianbook/1720.htm","Sex Is Not the Problem, Lust Is"
"/media/Dados/bases/SWDE/book/book-christianbook/1563.htm",John Calvin Audiobook on CD
"/media/Dados/bases/SWDE/book/book-christianbook/0181.htm",Masonic Lodge: What You Need to Know
"/media/Dados/bases/SWDE/book/book-christianbook/1369.htm",Nephilim Stargates and The Return of The Watchers
"/media/Dados/bases/SWDE/book/book-christianbook/0311.htm",Mary & Martha's Dinner Guest
"/media/Dados/bases/SWDE/book/book-christianbook/0725.htm",The Truth of the Cross
"/media/Dados/bases/SWDE/book/book-christianbook/0817.htm","Rise Up and Praise Him, Accompaniment CD"
"/media/Dados/bases/SWDE/book/book-christianbook/0072.htm",50 People Every Christian Should Know: Learning from Spiritual Giants of the Faith
"/media/Dados/bases/SWDE/book/book-christianbook/0615.htm","A Young Woman After God's Own Heart: A Teen's Guide to Friends, Faith, Family, and the Future"
"/media/Dados/bases/SWDE/book/book-christianbook/0828.htm",Foundations: Jesus: DVD Study Guide
"/media/Dados/bases/SWDE/book/book-christianbook/1393.htm","Colorful Butterfly Bible Cover, Extra Large"
"/media/Dados/bases/SWDE/book/book-christianbook/1159.htm",Where Is God When I'm Scared? A VeggieTales Board Book
"/media/Dados/bases/SWDE/book/book-christianbook/0763.htm","Christy: The Complete Series, DVD Set"
"/media/Dados/bases/SWDE/book/book-christianbook/0197.htm","Good Morning, Lord: I Don't Know Where You're Going Today But I'm Going with You"
"/media/Dados/bases/SWDE/book/book-christianbook/1000.htm",Sanctuary: Hope CD
"/media/Dados/bases/SWDE/book/book-christianbook/1378.htm","Return from Tomorrow, 30th anniversary edition"
"/media/Dados/bases/SWDE/book/book-christianbook/1888.htm",Don't Give In . . . God Wants You to Win: Preparing for Victory in the Battle of Life--DVD
"/media/Dados/bases/SWDE/book/book-christianbook/0356.htm","The Yada Yada Prayer Group Gets Down Yada Yada Series #2, Audiobook on CD"
"/media/Dados/bases/SWDE/book/book-christianbook/1307.htm",El Campo de Batalla de la Mente para Ni&#241os (Battlefield of the Mind for Kids)
"/media/Dados/bases/SWDE/book/book-christianbook/1647.htm","The Attributes of God, repackaged edition"
"/media/Dados/bases/SWDE/book/book-christianbook/1390.htm","Imaging the Word: An Arts & Lectionary Resource, Volume 1"
"/media/Dados/bases/SWDE/book/book-christianbook/1598.htm",Know Your Bible: All 66 Books Explained and Applied
"/media/Dados/bases/SWDE/book/book-christianbook/0768.htm","SummerHill Secrets, vol. 2"
"/media/Dados/bases/SWDE/book/book-christianbook/1657.htm",Announcing the Kingdom: The Story of God's Mission in the Bible
"/media/Dados/bases/SWDE/book/book-christianbook/0316.htm",3:16 Evangelio de Juan (3:16 Gospel of John)
"/media/Dados/bases/SWDE/book/book-christianbook/1249.htm",Try Darkness
"/media/Dados/bases/SWDE/book/book-christianbook/0935.htm",God as Storyteller: Seeking Meaning in Biblical Narrative
"/media/Dados/bases/SWDE/book/book-christianbook/1155.htm","Theological Lexicon of the Old Testament, Volume 2"
"/media/Dados/bases/SWDE/book/book-christianbook/1849.htm",Set Your Heart Free
"/media/Dados/bases/SWDE/book/book-christianbook/0676.htm",Whistle Light Key Ring; Assorted Colors
"/media/Dados/bases/SWDE/book/book-christianbook/1531.htm",How to Talk Confidently with Your Child About Sex: Fifth Edition
"/media/Dados/bases/SWDE/book/book-christianbook/1734.htm",Walking With God Booklet
"/media/Dados/bases/SWDE/book/book-christianbook/0439.htm","Come Thirsty, softcover"
"/media/Dados/bases/SWDE/book/book-christianbook/0221.htm","A Man's Strategy for Conquering Temptation, 40 Minute Bible Studies"
"/media/Dados/bases/SWDE/book/book-christianbook/1381.htm",Courage Book & Workbook
"/media/Dados/bases/SWDE/book/book-christianbook/0335.htm","Grace for the Moment, Morning & Evening Edition"
"/media/Dados/bases/SWDE/book/book-christianbook/0886.htm",Hymns II
"/media/Dados/bases/SWDE/book/book-christianbook/0460.htm","A Woman After God's Own Heart, Updated and Expanded Edition"
"/media/Dados/bases/SWDE/book/book-christianbook/1644.htm",The Prayer of Jabez: Breaking Through to the Blessed Life
"/media/Dados/bases/SWDE/book/book-christianbook/0530.htm",Works of Jonathan Edwards 1
"/media/Dados/bases/SWDE/book/book-christianbook/1755.htm",Reel Kids Adventures #10: The Himalayan Rescue
"/media/Dados/bases/SWDE/book/book-christianbook/0066.htm",Their God is Too Small
"/media/Dados/bases/SWDE/book/book-christianbook/1846.htm",America's Explorers and Pioneers on DVD Moral Values
"/media/Dados/bases/SWDE/book/book-christianbook/1460.htm","Sacra Pagina: The Gospel of Mark, softcover"
"/media/Dados/bases/SWDE/book/book-christianbook/1028.htm",Sweet Misfortune
"/media/Dados/bases/SWDE/book/book-christianbook/0228.htm",Know Your Bible: All 66 Books Explained and Applied
"/media/Dados/bases/SWDE/book/book-christianbook/1986.htm",North Carolina Weddings
"/media/Dados/bases/SWDE/book/book-christianbook/0242.htm","Assassins, Left Behind Series #6, Paperback"
"/media/Dados/bases/SWDE/book/book-christianbook/0139.htm",The Teenage Question and Answer Book
"/media/Dados/bases/SWDE/book/book-christianbook/0967.htm",Know Your Bible: All 66 Books Explained and Applied
"/media/Dados/bases/SWDE/book/book-christianbook/0057.htm",Following Jesus
"/media/Dados/bases/SWDE/book/book-christianbook/1881.htm",Proclaiming a Cross-Centered Theology
"/media/Dados/bases/SWDE/book/book-christianbook/0432.htm",Becoming a Woman of Simplicity
"/media/Dados/bases/SWDE/book/book-christianbook/1575.htm",Identity: Who You Are in Christ
"/media/Dados/bases/SWDE/book/book-christianbook/0094.htm",Monarch and Milkweed
"/media/Dados/bases/SWDE/book/book-christianbook/1779.htm","Surprised by Canon Law, Volume 2: More Questions Catholics Ask About Canon Law"
"/media/Dados/bases/SWDE/book/book-christianbook/0010.htm","Fire on the Mountain DVD, Faith Lessons Volume 9"
"/media/Dados/bases/SWDE/book/book-christianbook/0244.htm",The Power of the Blood
"/media/Dados/bases/SWDE/book/book-christianbook/1558.htm","Wordkeeper ¤ CBD Dry Highlighter Pack, Yellow Only"
"/media/Dados/bases/SWDE/book/book-christianbook/1591.htm",Nelson's Guide to Denominations
"/media/Dados/bases/SWDE/book/book-christianbook/1173.htm","Matthew, John MacArthur Study Guides"
"/media/Dados/bases/SWDE/book/book-christianbook/0106.htm","Luke, NIV Application Commentary"
"/media/Dados/bases/SWDE/book/book-christianbook/1480.htm",Heavenly Tongues or Earthly Languages
"/media/Dados/bases/SWDE/book/book-christianbook/0229.htm",The Way of the Master for Kids: Teaching Kids How to Share Their Faith
"/media/Dados/bases/SWDE/book/book-christianbook/1834.htm",Los Cinco Lenguajes del Amor (The Five Love Languages)
"/media/Dados/bases/SWDE/book/book-christianbook/1527.htm",Eagle Flexcover Journal
"/media/Dados/bases/SWDE/book/book-christianbook/1601.htm",Have You Heard of the Four Spiritual Laws? Pack of 25 tracts
"/media/Dados/bases/SWDE/book/book-christianbook/1810.htm",Nelson's Guide to Denominations
"/media/Dados/bases/SWDE/book/book-christianbook/1539.htm",I'm So Glad You Told Me What I Didn't Wanna Hear
"/media/Dados/bases/SWDE/book/book-christianbook/0813.htm","Outrageous, Contagious Joy: Five Big Questions to Help You Discover One Great Life (slightly imperfect)"
"/media/Dados/bases/SWDE/book/book-christianbook/1896.htm",Nelson's Guide to Denominations
"/media/Dados/bases/SWDE/book/book-christianbook/1949.htm",The Present Future: Six Tough Questions for the Church - audiobook on CD
"/media/Dados/bases/SWDE/book/book-christianbook/1777.htm","It's Not About Me, Teen Edition"
"/media/Dados/bases/SWDE/book/book-christianbook/0327.htm",Jon Gnagy Learn to Draw Kit
"/media/Dados/bases/SWDE/book/book-christianbook/0868.htm","From Jerusalem to Irian Jaya: A Biographical History of Christian Missions, Second Edition"
"/media/Dados/bases/SWDE/book/book-christianbook/0647.htm",Life Lessons: 1 Corinthians
"/media/Dados/bases/SWDE/book/book-christianbook/0369.htm",Crazy Love: Overwhelmed by a Relentless God
"/media/Dados/bases/SWDE/book/book-christianbook/1322.htm","Geography Songs, Compact Disc [CD]"
"/media/Dados/bases/SWDE/book/book-christianbook/1831.htm",Raising Maidens of Virtue: A Study of Feminine Loveliness for Mothers and Daughters
"/media/Dados/bases/SWDE/book/book-christianbook/1892.htm","Nelson's Complete Book of Bible Maps & Charts, Revised and Updated"
"/media/Dados/bases/SWDE/book/book-christianbook/1213.htm",The Invisible War
"/media/Dados/bases/SWDE/book/book-christianbook/1194.htm","Separated Brethren, Revised"
"/media/Dados/bases/SWDE/book/book-christianbook/1688.htm",Joel (Spanish Edition)
"/media/Dados/bases/SWDE/book/book-christianbook/0239.htm",Coming Home
"/media/Dados/bases/SWDE/book/book-christianbook/1096.htm",Breakthrough Prayer: The Secret of Receiving What You Need from God
"/media/Dados/bases/SWDE/book/book-christianbook/1827.htm",A 40-Day Journey with Julian of Norwich
"/media/Dados/bases/SWDE/book/book-christianbook/0431.htm","Nine Marks of a Healthy Church, Expanded Edition"
"/media/Dados/bases/SWDE/book/book-christianbook/0906.htm",What on Earth Am I Here For?
"/media/Dados/bases/SWDE/book/book-christianbook/0513.htm","Christianity, Cults & Religions: Compare 17 Religions and Cults with Biblical Christianity"
"/media/Dados/bases/SWDE/book/book-christianbook/0078.htm",Know Your Bible: All 66 Books Explained and Applied
"/media/Dados/bases/SWDE/book/book-christianbook/0575.htm","Jesus: Seeing Him More Clearly, InterActions Series"
"/media/Dados/bases/SWDE/book/book-christianbook/1501.htm",False Witness
"/media/Dados/bases/SWDE/book/book-christianbook/0954.htm",Handbook for Today's Catholic Family Revised
"/media/Dados/bases/SWDE/book/book-christianbook/0086.htm",VeggieTales The Pirates Who Don't Do Anything Board Books: I'm Not Afraid!
"/media/Dados/bases/SWDE/book/book-christianbook/0116.htm",2:52 Soul Gear : Weird and Gross Bible Stuff
"/media/Dados/bases/SWDE/book/book-christianbook/1095.htm",Heart of Addiction - Workbook
"/media/Dados/bases/SWDE/book/book-christianbook/0547.htm",Romans
"/media/Dados/bases/SWDE/book/book-christianbook/0472.htm","Signs, Wonders, And Worship: Tools of the End-Time Harvest"
"/media/Dados/bases/SWDE/book/book-christianbook/0109.htm",Enemy Access Denied: Slam the Devil's Door with One Simple Decision
"/media/Dados/bases/SWDE/book/book-christianbook/1204.htm",Where Mercy Fails: Darfur's Struggle to Survive
"/media/Dados/bases/SWDE/book/book-christianbook/0851.htm","The Interlinear Hebrew-Greek-English Bible, One-Volume Edition"
"/media/Dados/bases/SWDE/book/book-christianbook/1650.htm","Plain Promise, Daughters of the Promise Series #3"
"/media/Dados/bases/SWDE/book/book-christianbook/1905.htm",Choosing the Good: Christian Ethics in a Complex World
"/media/Dados/bases/SWDE/book/book-christianbook/1700.htm","The Five Points of Calvinism, 2nd Ed."
"/media/Dados/bases/SWDE/book/book-christianbook/1653.htm","Hush, Little One: A Lullaby for God's Children"
"/media/Dados/bases/SWDE/book/book-christianbook/1793.htm",The Remarkable Women of the Bible Growth and Study Guide: Their Life-Changing Journeys of Faith
"/media/Dados/bases/SWDE/book/book-christianbook/0579.htm",Singapore Math Primary Math Home Instructor's Guide 2B
"/media/Dados/bases/SWDE/book/book-christianbook/0691.htm",I Saw the Lord: A Wake-up Call for Your Heart
"/media/Dados/bases/SWDE/book/book-christianbook/0521.htm",Ethics 101: There's Only One Rule for Making Decisions
"/media/Dados/bases/SWDE/book/book-christianbook/1186.htm",Grounded in the Gospel: Building Believers the Old-Fashioned Way
"/media/Dados/bases/SWDE/book/book-christianbook/0211.htm","Acts: Living in the Power of the Holy Spirit, Christianity 101 Bible Studies"
"/media/Dados/bases/SWDE/book/book-christianbook/0451.htm",Give It All to Him: A Story of New Beginnings
"/media/Dados/bases/SWDE/book/book-christianbook/0734.htm","#5: Kate's Philadelphia Frenzy"
"/media/Dados/bases/SWDE/book/book-christianbook/0457.htm","199 Bible People, Places, and Things"
"/media/Dados/bases/SWDE/book/book-christianbook/1029.htm",Women Counseling Women
"/media/Dados/bases/SWDE/book/book-christianbook/0976.htm",The Soul of a Lion: The Life of Dietrich von Hildebrand
"/media/Dados/bases/SWDE/book/book-christianbook/0021.htm","Take Three, Above the Line Series #3"
"/media/Dados/bases/SWDE/book/book-christianbook/1655.htm","Ministering Cross-Culturally, 2d ed.: An Incarnational Model for Personal Relationships"
"/media/Dados/bases/SWDE/book/book-christianbook/1977.htm","Breaking the Jewish Code: 12 Secrets That Will Transform Your Life, Family, Health, and Finances"
"/media/Dados/bases/SWDE/book/book-christianbook/0142.htm",Discover Your Spiritual Gifts - Updated and Expanded
"/media/Dados/bases/SWDE/book/book-christianbook/1187.htm",Bringing Up Boys - Audiobook on CD
"/media/Dados/bases/SWDE/book/book-christianbook/0281.htm",Devotional Thoughts On The Bible - The Pentateuch
"/media/Dados/bases/SWDE/book/book-christianbook/1455.htm",The Case for the Real Jesus
"/media/Dados/bases/SWDE/book/book-christianbook/0639.htm",Know Your Bible: All 66 Books Explained and Applied
"/media/Dados/bases/SWDE/book/book-christianbook/0285.htm",The Pastoral Epistles with Philemon & Jude (Brazos Theological Commentary)
"/media/Dados/bases/SWDE/book/book-christianbook/0374.htm","Be Faithful (1 & 2 Timothy-Philemon), Repackaged"
"/media/Dados/bases/SWDE/book/book-christianbook/0794.htm",Hell: Separate Truth from Fiction and Get Your Toughest Questions Answered
"/media/Dados/bases/SWDE/book/book-christianbook/0113.htm","The NKJV American Patriot's Bible, Hardcover"
"/media/Dados/bases/SWDE/book/book-christianbook/0577.htm","Happy Day Books, Level 2: Simon Minds His Manners"
"/media/Dados/bases/SWDE/book/book-christianbook/1556.htm","Everything Must Change: Jesus, Global Crises and a Revolution of Hope"
"/media/Dados/bases/SWDE/book/book-christianbook/1772.htm",The Power of Words and the Wonder of God
"/media/Dados/bases/SWDE/book/book-christianbook/1780.htm","Loving God with All Your Mind, Updated and Expanded"
"/media/Dados/bases/SWDE/book/book-christianbook/0694.htm",The Lost Message of Jesus
"/media/Dados/bases/SWDE/book/book-christianbook/0585.htm",Love Talk Workbook for Women
"/media/Dados/bases/SWDE/book/book-christianbook/0118.htm","The Gods Aren't Angry, DVD"
"/media/Dados/bases/SWDE/book/book-christianbook/1380.htm",Many Are Called: Rediscovering the Glory of the Priesthood
"/media/Dados/bases/SWDE/book/book-christianbook/0354.htm",Monster
"/media/Dados/bases/SWDE/book/book-christianbook/0339.htm",The Pursuit of Holiness
