URL,EXTRACTED VALUE
"/media/Dados/bases/SWDE/camera/camera-ecost/0007.htm",±2 EV steps in 1/3 EV steps
"/media/Dados/bases/SWDE/camera/camera-ecost/0642.htm","Date & Time, Date, Off (user selectable)"
"/media/Dados/bases/SWDE/camera/camera-ecost/0542.htm",WAV
"/media/Dados/bases/SWDE/camera/camera-ecost/0643.htm","Date&Time, Date, Off (user selectable)"
"/media/Dados/bases/SWDE/camera/camera-ecost/0795.htm","Normal / Macro, Zoom Macro, Quick AF On/Off (On in Intelligent Auto), Continuous AF On/Off , AF Tracking"
"/media/Dados/bases/SWDE/camera/camera-ecost/0173.htm","Normal / Macro, Zoom Macro, Quick AF On/Off (On in Intelligent Auto), Continuous AF On/Off , AF Tracking"
