URL,EXTRACTED VALUE
"/sdd/edimar/Desktop/doutorado/doutorado04/bases/WEIR/videogame/games.teamxbox.com/1199_Madden-NFL-06.html",Jaguars' quarterback Byron Leftwich hits Reggie Williams from the Jacksonville 44 yard line.
"/sdd/edimar/Desktop/doutorado/doutorado04/bases/WEIR/videogame/games.teamxbox.com/1138_Call-of-Duty-2.html",Here we see infantry following closely behind an armored tank as they make their way into the village.
"/sdd/edimar/Desktop/doutorado/doutorado04/bases/WEIR/videogame/games.teamxbox.com/1612_Assault-Heroes.html",The combat continues under the surface as we venture out of our vehicle and continue on foot.
"/sdd/edimar/Desktop/doutorado/doutorado04/bases/WEIR/videogame/games.teamxbox.com/1623_SKATE.html",Here's some footage of us tearing up the pavement with EA's thrasher.
"/sdd/edimar/Desktop/doutorado/doutorado04/bases/WEIR/videogame/games.teamxbox.com/1165_Stranglehold.html",Tequila shows us why he doesn't need a partner as he blasts his way through anyone standing in his way.
"/sdd/edimar/Desktop/doutorado/doutorado04/bases/WEIR/videogame/games.teamxbox.com/1572_Halo-Wars.html",Multiplayer strategy combat in the Halo universe...what more do you want?
"/sdd/edimar/Desktop/doutorado/doutorado04/bases/WEIR/videogame/games.teamxbox.com/1161_Ultimate-SpiderMan.html",Spidey has to deal with lot of criminals. Watch the webslinger in action!
"/sdd/edimar/Desktop/doutorado/doutorado04/bases/WEIR/videogame/games.teamxbox.com/1322_Battlefield-2-Modern-Combat.html",A parachute jump into the center of town followed by intense infantry action.
"/sdd/edimar/Desktop/doutorado/doutorado04/bases/WEIR/videogame/games.teamxbox.com/820_Star-Wars-Republic-Commando.html","After getting to the factory control room, Fixer patches into the computer to clear the way for the Deltas."
"/sdd/edimar/Desktop/doutorado/doutorado04/bases/WEIR/videogame/games.teamxbox.com/1457_BioShock.html","Now that we've boosted our DNA with Electro Shock, it's time to put it to good use."
"/sdd/edimar/Desktop/doutorado/doutorado04/bases/WEIR/videogame/games.teamxbox.com/1574_Project-Gotham-Racing-4.html",The snow is falling in the brisk city of Quebec.
"/sdd/edimar/Desktop/doutorado/doutorado04/bases/WEIR/videogame/games.teamxbox.com/1550_Wheelman.html",Midway's latest trailer for the game based upon the movie starring Vin Diesel.
"/sdd/edimar/Desktop/doutorado/doutorado04/bases/WEIR/videogame/games.teamxbox.com/1757_Fallout-3.html","We now make our way to Tenpenny Tower, what used to be a swank hotel before the fallout took place."
"/sdd/edimar/Desktop/doutorado/doutorado04/bases/WEIR/videogame/games.teamxbox.com/742_Shadow-Ops-Red-Mercury.html","It's always better to take out the enemy before they see you coming, and nothing helps get the job done more than a well sighted sniper rifle."
"/sdd/edimar/Desktop/doutorado/doutorado04/bases/WEIR/videogame/games.teamxbox.com/916_Tiger-Woods-PGA-Tour-2005.html",A look at golf legend Ben Hogan in action on the course.
"/sdd/edimar/Desktop/doutorado/doutorado04/bases/WEIR/videogame/games.teamxbox.com/2052_Quantum-of-Solace.html",Here is the latest BTS video for Quantum of Solace featuring the game's environments.
"/sdd/edimar/Desktop/doutorado/doutorado04/bases/WEIR/videogame/games.teamxbox.com/576_Painkiller-Hell-Wars.html",Dreamcatcher Games has released a brand new movie of the catacombs level from its upcoming FPS gorefest Painkiller.
"/sdd/edimar/Desktop/doutorado/doutorado04/bases/WEIR/videogame/games.teamxbox.com/1197_True-Crime-New-York-City.html","The video ties into Activision's ""Guess the City & Win Marcus' Ride!"" contest, where entrants guess where True Crime 2 will take place."
"/sdd/edimar/Desktop/doutorado/doutorado04/bases/WEIR/videogame/games.teamxbox.com/1913_Rocket-Riot.html",On this level we must use our rockets to blast 20 pirates out of the water.
"/sdd/edimar/Desktop/doutorado/doutorado04/bases/WEIR/videogame/games.teamxbox.com/889_Terminator-3-The-Redemption.html","Skynet machines run rampant across L.A. roads and freeways, trying to hunt you down. Watch Terminator in action in this spectacular chase sequence."
"/sdd/edimar/Desktop/doutorado/doutorado04/bases/WEIR/videogame/games.teamxbox.com/1175_Dead-or-Alive-4.html","Having won the 4th Martial Arts Tournament, Christie takes the stage and wows the audience."
"/sdd/edimar/Desktop/doutorado/doutorado04/bases/WEIR/videogame/games.teamxbox.com/2087_Skate-2.html",Get to know the masterminds behind this year's story with this dev video on the game's career mode.
"/sdd/edimar/Desktop/doutorado/doutorado04/bases/WEIR/videogame/games.teamxbox.com/643_Advent-Rising.html",Majesco has released an exclusive preview trailer that will run in-theaters before Star Wars Episode III: Revenge of the Sith beginning next week.
"/sdd/edimar/Desktop/doutorado/doutorado04/bases/WEIR/videogame/games.teamxbox.com/928_Prince-of-Persia-Warrior-Within.html","Check out the brand new trailer; ""The Final Battle'"", the first in the ""Precursor to Fate"" series of trailers."
"/sdd/edimar/Desktop/doutorado/doutorado04/bases/WEIR/videogame/games.teamxbox.com/1804_The-Chronicles-of-Narnia-Prince-Caspian.html",A new gameplay video featuring 20 playable characters of the game.
"/sdd/edimar/Desktop/doutorado/doutorado04/bases/WEIR/videogame/games.teamxbox.com/1668_MotoGP-07.html",The desert plays host to a high speed race in Quatar.
"/sdd/edimar/Desktop/doutorado/doutorado04/bases/WEIR/videogame/games.teamxbox.com/1777_Left-4-Dead.html","The game's opening cinematic, which shows the state of the city only two weeks after the first infection."
"/sdd/edimar/Desktop/doutorado/doutorado04/bases/WEIR/videogame/games.teamxbox.com/1167_Gears-of-War.html","A brutal match of annex on Garden, one of the new maps now available for Gears of War."
"/sdd/edimar/Desktop/doutorado/doutorado04/bases/WEIR/videogame/games.teamxbox.com/1427_Rockstar-Games-Presents-Table-Tennis.html",One way to grip the paddle is by using the pen holder technique.
"/sdd/edimar/Desktop/doutorado/doutorado04/bases/WEIR/videogame/games.teamxbox.com/1689_LEGO-Batman-The-Videogame.html",Some direct feed footage of LEGO Batman.
"/sdd/edimar/Desktop/doutorado/doutorado04/bases/WEIR/videogame/games.teamxbox.com/1124_Burnout-Revenge.html",A hooptie clips a trailer in a crash junction gem.
"/sdd/edimar/Desktop/doutorado/doutorado04/bases/WEIR/videogame/games.teamxbox.com/1714_Undertow.html",More aquatic combat involving two teams fighting for control of each of the map's spawn points.
"/sdd/edimar/Desktop/doutorado/doutorado04/bases/WEIR/videogame/games.teamxbox.com/1312_Chromehounds.html",Here is a camper's favorite Chromehounds class: the Sniper.
"/sdd/edimar/Desktop/doutorado/doutorado04/bases/WEIR/videogame/games.teamxbox.com/1269_Tiger-Woods-PGA-Tour-06.html",Tiger Woods is back on the course for another season of competition on the greens.
"/sdd/edimar/Desktop/doutorado/doutorado04/bases/WEIR/videogame/games.teamxbox.com/1934_Tomb-Raider-Underworld.html",Here is the same movie but in widescreen standard definition.
"/sdd/edimar/Desktop/doutorado/doutorado04/bases/WEIR/videogame/games.teamxbox.com/1622_TNA-Impact.html",This is a behind the scenes look at how the Midway development team made TNA iMPACT! the most realistic and smooth-playing wrestling game ever.
"/sdd/edimar/Desktop/doutorado/doutorado04/bases/WEIR/videogame/games.teamxbox.com/1278_NinetyNine-Nights.html",Gameplay footage of the intense action of Ninety-Nine Nights.
"/sdd/edimar/Desktop/doutorado/doutorado04/bases/WEIR/videogame/games.teamxbox.com/1068_WWE-WrestleMania-21.html",Check out the Shawn Michaels's entrance into the ring of Wrestlemania 21.
"/sdd/edimar/Desktop/doutorado/doutorado04/bases/WEIR/videogame/games.teamxbox.com/1267_Unreal-Tournament-3.html",This time around we took questions for our forum members and asked the President of Epic games about UT3.
"/sdd/edimar/Desktop/doutorado/doutorado04/bases/WEIR/videogame/games.teamxbox.com/869_Far-Cry-Instincts.html",The Predator game mode pits several co-op Mercenary players against a single Feral player. Watch two minutes of predator action!
"/sdd/edimar/Desktop/doutorado/doutorado04/bases/WEIR/videogame/games.teamxbox.com/58_Hunter-The-Reckoning.html","Nothing quite touches the heart like the special moments in life, check out this special moment, Hunter style."
"/sdd/edimar/Desktop/doutorado/doutorado04/bases/WEIR/videogame/games.teamxbox.com/1940_Command-Conquer-Red-Alert-3.html","The Empire of the Rising Sun has risen in the East, making World War III a three-way struggle between the Soviets, the Allies, and the Empire."
"/sdd/edimar/Desktop/doutorado/doutorado04/bases/WEIR/videogame/games.teamxbox.com/957_Indigo-Prophecy.html","Originally named Fahrenheit overseas, Indigo Prophecy is coming to the Xbox and promises to offer games a truly unique gaming experience."
"/sdd/edimar/Desktop/doutorado/doutorado04/bases/WEIR/videogame/games.teamxbox.com/1377_Major-League-Baseball-2K6.html",Major League Baseball® 2K6 brings you the definitive baseball simulation. Watch the first trailer of game.
"/sdd/edimar/Desktop/doutorado/doutorado04/bases/WEIR/videogame/games.teamxbox.com/43_Dead-or-Alive-3.html",Watch you don't catch a cold while you challenge your opponents in the Ice cave.
"/sdd/edimar/Desktop/doutorado/doutorado04/bases/WEIR/videogame/games.teamxbox.com/1964_1942-Joint-Strike.html",Here is a clip that shows the intense moments you'll experience in Joint Strike.
"/sdd/edimar/Desktop/doutorado/doutorado04/bases/WEIR/videogame/games.teamxbox.com/1789_SpiderMan-Friend-or-Foe.html","You don't want to get Venom upset, and this video shows us why."
"/sdd/edimar/Desktop/doutorado/doutorado04/bases/WEIR/videogame/games.teamxbox.com/908_ESPN-NBA-2K5.html",24/7 invites you to create your own street baller.
"/sdd/edimar/Desktop/doutorado/doutorado04/bases/WEIR/videogame/games.teamxbox.com/1441_Brothers-In-Arms-Hells-Highway.html",Here the designers discuss the emotions and personal interactions of the game's characters.
"/sdd/edimar/Desktop/doutorado/doutorado04/bases/WEIR/videogame/games.teamxbox.com/1152_NHL-06.html","In a back-and-forth offensive showdown, Aleksey Morozov gives the Penguins the lead with a late goal in the 3rd period."
"/sdd/edimar/Desktop/doutorado/doutorado04/bases/WEIR/videogame/games.teamxbox.com/1559_Armored-Core-4.html",We bring you a four minute long trailer of Armored Core 4 featuring both cut scenes and gameplay sequences.
"/sdd/edimar/Desktop/doutorado/doutorado04/bases/WEIR/videogame/games.teamxbox.com/1785_Switchball.html",More puzzle solving in the brightly lit sky.
"/sdd/edimar/Desktop/doutorado/doutorado04/bases/WEIR/videogame/games.teamxbox.com/1539_Fuzion-Frenzy-2.html",Be the one to carry the most containers in the stadium back to your base using a vehicle with a lifter-arm attached to the front.
"/sdd/edimar/Desktop/doutorado/doutorado04/bases/WEIR/videogame/games.teamxbox.com/1532_HalfLife-2-The-Orange-Box.html",Meet the toughest guy of Team Fortress 2.
"/sdd/edimar/Desktop/doutorado/doutorado04/bases/WEIR/videogame/games.teamxbox.com/612_Outlaw-Golf-2.html","Born in a motorcycle repair shop, Harley grew up with a crowbar in one hand and a golf club in the other."
"/sdd/edimar/Desktop/doutorado/doutorado04/bases/WEIR/videogame/games.teamxbox.com/1794_Mirrors-Edge.html",Take a closer look at the choices Faith has had to make throughout her life.
"/sdd/edimar/Desktop/doutorado/doutorado04/bases/WEIR/videogame/games.teamxbox.com/833_NARC.html",NARC will make a bold statement as a gritty crime drama that offers an intense and thought-provoking view into the seedy world of the war on drugs.
"/sdd/edimar/Desktop/doutorado/doutorado04/bases/WEIR/videogame/games.teamxbox.com/1292_Elveon.html",The major characteristics of this fantasy action epic are its impressive graphics and the captivating atmosphere.
"/sdd/edimar/Desktop/doutorado/doutorado04/bases/WEIR/videogame/games.teamxbox.com/1639_Alien-Hominid-HD.html","The FBI tries to take down this little, but powerful alien as he works his through through town."
"/sdd/edimar/Desktop/doutorado/doutorado04/bases/WEIR/videogame/games.teamxbox.com/1195_NHL-2K6.html",Hockey the 2K6 way.
"/sdd/edimar/Desktop/doutorado/doutorado04/bases/WEIR/videogame/games.teamxbox.com/1327_Superman-Returns-The-Videogame.html","When Superman piss off, he uses his X-ray vision."
"/sdd/edimar/Desktop/doutorado/doutorado04/bases/WEIR/videogame/games.teamxbox.com/1129_Need-for-Speed-Most-Wanted.html",Go behind the scenes with this Xbox 360 racer.
"/sdd/edimar/Desktop/doutorado/doutorado04/bases/WEIR/videogame/games.teamxbox.com/1429_Just-Cause.html",See Rico in impressive mid-air action in this week's trailer which showcases the massive San Esperito island state aerial style!
"/sdd/edimar/Desktop/doutorado/doutorado04/bases/WEIR/videogame/games.teamxbox.com/411_Psychonauts.html",Raz visit a wacky character and enters the House of Cards.
"/sdd/edimar/Desktop/doutorado/doutorado04/bases/WEIR/videogame/games.teamxbox.com/1861_Saints-Row-2.html",See Mc Cain and Obama playing nice with each other in Saints Row 2.
"/sdd/edimar/Desktop/doutorado/doutorado04/bases/WEIR/videogame/games.teamxbox.com/937_Destroy-All-Humans.html","Be all that you can be, unless it involves battling a flying saucer"
"/sdd/edimar/Desktop/doutorado/doutorado04/bases/WEIR/videogame/games.teamxbox.com/2067_Geometry-Wars-Retro-Evolved-2.html",See the players facing wave of enemies one after another.
"/sdd/edimar/Desktop/doutorado/doutorado04/bases/WEIR/videogame/games.teamxbox.com/1952_Damnation.html",This all-new trailer gives an exclusive insight into the dark world of Damnation.
"/sdd/edimar/Desktop/doutorado/doutorado04/bases/WEIR/videogame/games.teamxbox.com/1930_FaceBreaker.html",Take a look behind the scenes as the game's designers interview several of the fighters.
"/sdd/edimar/Desktop/doutorado/doutorado04/bases/WEIR/videogame/games.teamxbox.com/1871_Bionic-Commando.html",A look at the multiplayer action of Bionic Commando.
"/sdd/edimar/Desktop/doutorado/doutorado04/bases/WEIR/videogame/games.teamxbox.com/1637_Heavy-Weapon.html",Today's forecast on the shores calls for cloudy skies filled with loads of enemies.
"/sdd/edimar/Desktop/doutorado/doutorado04/bases/WEIR/videogame/games.teamxbox.com/1425_Two-Worlds.html",This movieshot shows you confronting a monster. It won't be a true RPG without a minotaur-like monster.
"/sdd/edimar/Desktop/doutorado/doutorado04/bases/WEIR/videogame/games.teamxbox.com/811_MVP-Baseball-2004.html",Master the art of batting with MVP Baseball 2004's advanced Pure Swing System.
"/sdd/edimar/Desktop/doutorado/doutorado04/bases/WEIR/videogame/games.teamxbox.com/1911_Far-Cry-2.html",Take a look at the detailed map editor that allows players to customize their gameplay experience.
"/sdd/edimar/Desktop/doutorado/doutorado04/bases/WEIR/videogame/games.teamxbox.com/1557_Tenchu-Z.html","In this mission the target is Echigoya, a greedy man who cares more about money than the people he scams."
"/sdd/edimar/Desktop/doutorado/doutorado04/bases/WEIR/videogame/games.teamxbox.com/1655_FlatOut-Ultimate-Carnage.html",Here's an intense race through the busy streets of the city.
"/sdd/edimar/Desktop/doutorado/doutorado04/bases/WEIR/videogame/games.teamxbox.com/1332_Driver-Parallel-Lines.html",Here is another bunch of crashes.
"/sdd/edimar/Desktop/doutorado/doutorado04/bases/WEIR/videogame/games.teamxbox.com/1375_Arena-Football.html",Watch the Columbus Destroyers.
"/sdd/edimar/Desktop/doutorado/doutorado04/bases/WEIR/videogame/games.teamxbox.com/1517_NHL-07.html",Rookie phenom the latest cover athlete of EAs hockey franchise.
"/sdd/edimar/Desktop/doutorado/doutorado04/bases/WEIR/videogame/games.teamxbox.com/1488_HAZE.html",Watch the first trailer for HAZE.
"/sdd/edimar/Desktop/doutorado/doutorado04/bases/WEIR/videogame/games.teamxbox.com/226_Doom-3.html","Pay close attention to all the sounds happening around you, as a slight noise may be all the warning before evil attacks!"
"/sdd/edimar/Desktop/doutorado/doutorado04/bases/WEIR/videogame/games.teamxbox.com/1555_Kingdom-Under-Fire-Circle-of-Doom.html","Direct from Tokyo, we have the trailer being shown from Kingdom Under Fire Circle of Doom."
"/sdd/edimar/Desktop/doutorado/doutorado04/bases/WEIR/videogame/games.teamxbox.com/991_NFL-Street-2.html","Phillip Buchanon finds that going up against the Dolphins Jason Taylor is no Sunday picnic. That being said, he still comes out on top."
"/sdd/edimar/Desktop/doutorado/doutorado04/bases/WEIR/videogame/games.teamxbox.com/1801_Darksiders-Wrath-of-War.html",Experience the Godlike Power of WAR!
"/sdd/edimar/Desktop/doutorado/doutorado04/bases/WEIR/videogame/games.teamxbox.com/1231_GUN.html","Activision and Neversoft have finally pulled back the curtain, giving us the first look at their wild-west shooter in the gameplay trailer for GUN."
"/sdd/edimar/Desktop/doutorado/doutorado04/bases/WEIR/videogame/games.teamxbox.com/1870_Arkadian-Warriors.html",Some footage of Sierra's XBLA title.
"/sdd/edimar/Desktop/doutorado/doutorado04/bases/WEIR/videogame/games.teamxbox.com/1486_Blue-Dragon.html","By working together with his friends, Shu is able to defeat the Land Shark."
"/sdd/edimar/Desktop/doutorado/doutorado04/bases/WEIR/videogame/games.teamxbox.com/1611_NCAA-March-Madness-07.html",Watch as both the players and the cheerleaders get the crowd involved with some great plays and fancy movies.
"/sdd/edimar/Desktop/doutorado/doutorado04/bases/WEIR/videogame/games.teamxbox.com/1275_Resident-Evil-5.html",Here is the Resident Evil 5 trailer that Capcom released at Leipzig during the Games Convention 2008.
"/sdd/edimar/Desktop/doutorado/doutorado04/bases/WEIR/videogame/games.teamxbox.com/1064_Tim-Burtons-The-Nightmare-Before-Christmas-Oogies-Revenge.html",Toal results sound clip.
"/sdd/edimar/Desktop/doutorado/doutorado04/bases/WEIR/videogame/games.teamxbox.com/1501_Fable-II.html","To game fame and fortune, our hero fights his way through a series of battles gladiator style."
"/sdd/edimar/Desktop/doutorado/doutorado04/bases/WEIR/videogame/games.teamxbox.com/1308_MVP-06-NCAA-Baseball.html",Watch the Texas team playing and winning.
"/sdd/edimar/Desktop/doutorado/doutorado04/bases/WEIR/videogame/games.teamxbox.com/1297_BLACK.html","This is no ordinary walk in the woods, and being quiet will help prevent the enemy from alarming others."
"/sdd/edimar/Desktop/doutorado/doutorado04/bases/WEIR/videogame/games.teamxbox.com/1948_Tales-of-Vesperia.html","""Can we really defeat something this big?"""
"/sdd/edimar/Desktop/doutorado/doutorado04/bases/WEIR/videogame/games.teamxbox.com/939_Scaler.html",Check out the Doozum
"/sdd/edimar/Desktop/doutorado/doutorado04/bases/WEIR/videogame/games.teamxbox.com/1201_NCAA-Football-06.html","While our offense moves the ball down the field on the opening drive, it isnt enough to dent the scrappy team from UAB."
"/sdd/edimar/Desktop/doutorado/doutorado04/bases/WEIR/videogame/games.teamxbox.com/1286_Over-G-Fighters.html",Turn and burn in Ubis upcoming air combat title.
"/sdd/edimar/Desktop/doutorado/doutorado04/bases/WEIR/videogame/games.teamxbox.com/1676_Jetpac-Refuelled.html",Spin the clock back to 1983 and check out some classic gaming action.
"/sdd/edimar/Desktop/doutorado/doutorado04/bases/WEIR/videogame/games.teamxbox.com/1177_NBA-2K6.html","Watch the first trailer of the Xbox 360 version of NBA 2K6. Yes, this in-game footage."
"/sdd/edimar/Desktop/doutorado/doutorado04/bases/WEIR/videogame/games.teamxbox.com/1422_Family-Guy.html","In this cut-scene, Stewie starts his descent into Peter's body. Meanwhile, Peter begins his quest to eliminate Mr. Belvedere."
"/sdd/edimar/Desktop/doutorado/doutorado04/bases/WEIR/videogame/games.teamxbox.com/2034_Dark-Void.html",Take a look at some of the aerial gameplay of Dark Void.
"/sdd/edimar/Desktop/doutorado/doutorado04/bases/WEIR/videogame/games.teamxbox.com/954_Project-Snowblind.html",Project: Snowblind places unique emphasis to its intensive multiplayer and online play modes. Watch footage taken from a multiplayer game.
"/sdd/edimar/Desktop/doutorado/doutorado04/bases/WEIR/videogame/games.teamxbox.com/1310_Sonic-The-Hedgehog.html",Standard definition version.
"/sdd/edimar/Desktop/doutorado/doutorado04/bases/WEIR/videogame/games.teamxbox.com/1473_NHL-2K7.html",The Mighty Ducks go head to head with the Senators.
"/sdd/edimar/Desktop/doutorado/doutorado04/bases/WEIR/videogame/games.teamxbox.com/1942_Gears-of-War-2.html","The Combustible Map Pack unleashes three new multiplayer maps: Flood, Gold Rush and Fuel Station."
"/sdd/edimar/Desktop/doutorado/doutorado04/bases/WEIR/videogame/games.teamxbox.com/2092_Armored-Core-for-Answer.html",Time for a little one on one mechanized warfare.
"/sdd/edimar/Desktop/doutorado/doutorado04/bases/WEIR/videogame/games.teamxbox.com/1545_NBA-Street-Homecourt.html",Shaq and crew head to the beach to take on Kobe and the Lakers.
"/sdd/edimar/Desktop/doutorado/doutorado04/bases/WEIR/videogame/games.teamxbox.com/1370_Blazing-Angels-Squadrons-of-WWII.html","When taking on aircraft carriers, one will definitely need to make use of some fancy flying as we see here."
"/sdd/edimar/Desktop/doutorado/doutorado04/bases/WEIR/videogame/games.teamxbox.com/862_Dark-Sector.html",A Stinger is an evolved form of a Technocyte creature capable of leaping great distances and moving on all fours at high speeds.
"/sdd/edimar/Desktop/doutorado/doutorado04/bases/WEIR/videogame/games.teamxbox.com/1494_Pirates-of-the-Caribbean-At-Worlds-End.html","After breaking out a couple of pirates, Jack must put his sword to good use."
"/sdd/edimar/Desktop/doutorado/doutorado04/bases/WEIR/videogame/games.teamxbox.com/1960_Assault-Heroes-2.html",The longer version of the trailer for Assault Heroes 2.
"/sdd/edimar/Desktop/doutorado/doutorado04/bases/WEIR/videogame/games.teamxbox.com/1720_NBA-LIVE-08.html",Fans of the NBA LIVE franchise will soon be able to expand their virtual basketball experience to include teams from all over the world.
"/sdd/edimar/Desktop/doutorado/doutorado04/bases/WEIR/videogame/games.teamxbox.com/1358_RoboBlitz.html",Naked Sky shows us some of the features of RoboBlitz in this cool demo movie.
"/sdd/edimar/Desktop/doutorado/doutorado04/bases/WEIR/videogame/games.teamxbox.com/1749_Need-for-Speed-ProStreet.html",We hop behind the wheel of our speedy BMW M3 for a race through the desert.
"/sdd/edimar/Desktop/doutorado/doutorado04/bases/WEIR/videogame/games.teamxbox.com/2026_NBA-2K9.html",The fourth and final NBA 2K9 teaser trailer.
"/sdd/edimar/Desktop/doutorado/doutorado04/bases/WEIR/videogame/games.teamxbox.com/897_GoldenEye-Rogue-Agent.html",Multiplayer Mayhem is in full effect in this new video clip for GoldenEye: Rogue Agent.
"/sdd/edimar/Desktop/doutorado/doutorado04/bases/WEIR/videogame/games.teamxbox.com/841_Pariah.html",Watch the multiplayer features of Pariah in action in this new high resolution trailer.
"/sdd/edimar/Desktop/doutorado/doutorado04/bases/WEIR/videogame/games.teamxbox.com/480_Sudeki.html",This clip shows how great everything looks once it all comes together. Get ready for some intense (and simply gorgeous) Sudeki action!
"/sdd/edimar/Desktop/doutorado/doutorado04/bases/WEIR/videogame/games.teamxbox.com/1439_Tom-Clancys-Rainbow-Six-Vegas.html",This Chinese influenced restaurant heats up as we search for enemies.
"/sdd/edimar/Desktop/doutorado/doutorado04/bases/WEIR/videogame/games.teamxbox.com/1477_NBA-LIVE-07.html",This year NBA LIVE 07 will partner with the worldwide leader in sports to deliver more ESPN content in-game while you play than ever before.
"/sdd/edimar/Desktop/doutorado/doutorado04/bases/WEIR/videogame/games.teamxbox.com/1828_Prototype.html",Nonstop action of Prototype gameplay...well half a minute's worth at least.
"/sdd/edimar/Desktop/doutorado/doutorado04/bases/WEIR/videogame/games.teamxbox.com/1099_Midway-Arcade-Treasures-3.html",Here you can see gameplay footage of all the racing games included in Midway Arcade Treasures 3.
"/sdd/edimar/Desktop/doutorado/doutorado04/bases/WEIR/videogame/games.teamxbox.com/1480_Tony-Hawks-Project-8.html",Here's a behind-the-scenes video of Ryan Sheckler's mo-cap session.
"/sdd/edimar/Desktop/doutorado/doutorado04/bases/WEIR/videogame/games.teamxbox.com/1915_The-Incredible-Hulk.html",A behind the scenes look at the making of The Incredible Hulk game.
"/sdd/edimar/Desktop/doutorado/doutorado04/bases/WEIR/videogame/games.teamxbox.com/1742_Tony-Hawks-Proving-Ground.html",Check out the launch trailer for Activision's Tony Hawk's Proving Ground.
"/sdd/edimar/Desktop/doutorado/doutorado04/bases/WEIR/videogame/games.teamxbox.com/1298_Fight-Night-Round-3.html",Executive Producer Kudo Tsunoda explain us impact punches
"/sdd/edimar/Desktop/doutorado/doutorado04/bases/WEIR/videogame/games.teamxbox.com/883_Lord-of-the-Rings-The-Third-Age.html",I think this guy is praying at the end that this video doesnt come back to haunt him when he realizes that politics is his true calling.
"/sdd/edimar/Desktop/doutorado/doutorado04/bases/WEIR/videogame/games.teamxbox.com/1276_Too-Human.html",Here is the same movie but in widescreen standard definition.
"/sdd/edimar/Desktop/doutorado/doutorado04/bases/WEIR/videogame/games.teamxbox.com/1386_Far-Cry-Instincts-Predator.html",A leisurely stroll through the user created Oceanview map.
"/sdd/edimar/Desktop/doutorado/doutorado04/bases/WEIR/videogame/games.teamxbox.com/1646_Hour-of-Victory.html","Today, Midway released a trailer for Hour of Victory."
"/sdd/edimar/Desktop/doutorado/doutorado04/bases/WEIR/videogame/games.teamxbox.com/1931_Buku-Sudoku.html",Some footage of this XBLA puzzle game in action.
