URL,EXTRACTED VALUE
"/sdd/edimar/Desktop/doutorado/doutorado04/bases/WEIR/videogame/games.teamxbox.com/1324_Crackdown.html",Making use of the objects of the environment is a great way to get the upper hand on the opposition.
"/sdd/edimar/Desktop/doutorado/doutorado04/bases/WEIR/videogame/games.teamxbox.com/1325_Mass-Effect.html",Wed like to offer you a glimpse into the personalities of several key characters that you can enjoy until you can get your hands on the game.
"/sdd/edimar/Desktop/doutorado/doutorado04/bases/WEIR/videogame/games.teamxbox.com/1719_Call-of-Duty-4-Modern-Warfare.html",The man who stole Mr Burns his trillion dollar bill takes a look at Call of Duty 4.
"/sdd/edimar/Desktop/doutorado/doutorado04/bases/WEIR/videogame/games.teamxbox.com/1942_Gears-of-War-2.html",Some multiplayer footage of Epic's highly anticipated follow up to Gears of War.
"/sdd/edimar/Desktop/doutorado/doutorado04/bases/WEIR/videogame/games.teamxbox.com/1619_Tom-Clancys-Ghost-Recon-Advanced-Warfighter-2.html",A good sniper can help limit confrontations by taking enemies out from afar.
"/sdd/edimar/Desktop/doutorado/doutorado04/bases/WEIR/videogame/games.teamxbox.com/1353_Halo-3.html",Watch the trailer for Halo 3 as it was shown at Microsoft's press briefing.
