URL,EXTRACTED VALUE
"/sdd/edimar/Desktop/doutorado/doutorado04/bases/WEIR/videogame/games.teamxbox.com/1694_Rock-Band.html",Standalone Rock Band Instruments Coming
"/sdd/edimar/Desktop/doutorado/doutorado04/bases/WEIR/videogame/games.teamxbox.com/55_Halo.html",Halo for Windows Goes Gold
"/sdd/edimar/Desktop/doutorado/doutorado04/bases/WEIR/videogame/games.teamxbox.com/472_Halo-2.html",Is Guillermo Del Toro Directing The Halo Movie?
"/sdd/edimar/Desktop/doutorado/doutorado04/bases/WEIR/videogame/games.teamxbox.com/1942_Gears-of-War-2.html",Gears of War 2 Spring Showcase 2008 Metadata
"/sdd/edimar/Desktop/doutorado/doutorado04/bases/WEIR/videogame/games.teamxbox.com/1167_Gears-of-War.html",Gears of War: Marcus Fenix Statue on Sale on eBay
"/sdd/edimar/Desktop/doutorado/doutorado04/bases/WEIR/videogame/games.teamxbox.com/1353_Halo-3.html",Mark Rein on Forge: We Give You a Real Editor
