URL,EXTRACTED VALUE
"/sdd/edimar/Desktop/doutorado/doutorado04/bases/WEIR/videogame/games.teamxbox.com/1949_Battlestations-Pacific.html",Here is the first trailer of Battlestations Pacific featuring gameplay footage.
"/sdd/edimar/Desktop/doutorado/doutorado04/bases/WEIR/videogame/games.teamxbox.com/1149_MotoGP-3.html",Better make sure your helmet is on tight as we bring you the high speed action of MotoGP 3 in THQ's E3 trailer.
"/sdd/edimar/Desktop/doutorado/doutorado04/bases/WEIR/videogame/games.teamxbox.com/1482_Grand-Theft-Auto-IV.html",Just because we don't have a license doesn't mean we can't take the city bus for a spin.
"/sdd/edimar/Desktop/doutorado/doutorado04/bases/WEIR/videogame/games.teamxbox.com/650_Armed-Dangerous.html",Witness the off-the-wall weapons and all out action of this combat shooter with a twist.
"/sdd/edimar/Desktop/doutorado/doutorado04/bases/WEIR/videogame/games.teamxbox.com/1096_The-Suffering-Ties-That-Bind.html","You'll be afraid, very afraid, when you watch this E3 2005 Trailer of The Suffering: Ties that Bind."
"/sdd/edimar/Desktop/doutorado/doutorado04/bases/WEIR/videogame/games.teamxbox.com/902_Forza-Motorsport.html",Check out just how players will be able to customize their rides in Forza Motorsport's in depth customization garage.
"/sdd/edimar/Desktop/doutorado/doutorado04/bases/WEIR/videogame/games.teamxbox.com/807_BloodRayne-2.html","Rayne makes quick work of her foes, including using a wall fan like a Cuisinart."
"/sdd/edimar/Desktop/doutorado/doutorado04/bases/WEIR/videogame/games.teamxbox.com/730_Tom-Clancys-Splinter-Cell-Pandora-Tomorrow.html",The video shows how mercenaries can coordinate their defense of an area against intruders.
"/sdd/edimar/Desktop/doutorado/doutorado04/bases/WEIR/videogame/games.teamxbox.com/1353_Halo-3.html","Take a look at Rats Nest, one of the new maps of the Halo 3 Heroic Map Pack."
"/sdd/edimar/Desktop/doutorado/doutorado04/bases/WEIR/videogame/games.teamxbox.com/977_Winning-Eleven-8.html",Even more on the field footage of the gameplay of Winning Eleven 8.
"/sdd/edimar/Desktop/doutorado/doutorado04/bases/WEIR/videogame/games.teamxbox.com/1943_Red-Faction-Guerrilla.html",Some footage of the beta for Red Faction: Guerilla.
"/sdd/edimar/Desktop/doutorado/doutorado04/bases/WEIR/videogame/games.teamxbox.com/1483_Shadowrun.html",Here's the newly released launch trailer for Microsoft's Shadowrun.
"/sdd/edimar/Desktop/doutorado/doutorado04/bases/WEIR/videogame/games.teamxbox.com/1446_Madden-NFL-07.html",Hampton is an unstoppable force in the Bench Press.
"/sdd/edimar/Desktop/doutorado/doutorado04/bases/WEIR/videogame/games.teamxbox.com/1662_Star-Wars-The-Force-Unleashed.html",Here the apprentice makes his way through a massive TIE Fighter construction hanger while dispatching anyone and anything is his way.
"/sdd/edimar/Desktop/doutorado/doutorado04/bases/WEIR/videogame/games.teamxbox.com/1787_Legendary.html",This new trailer is a preview of the upcoming Behind the Scenes series.
"/sdd/edimar/Desktop/doutorado/doutorado04/bases/WEIR/videogame/games.teamxbox.com/909_ESPN-NFL-2K5.html",It won't be an ESPN videogame without the ability to trade players. Watch the feature in action.
"/sdd/edimar/Desktop/doutorado/doutorado04/bases/WEIR/videogame/games.teamxbox.com/1433_WWE-SmackDown-vs-RAW-2007.html",We grabbed some footage from the WWE SmackDown vs RAW 2007 demonstration.
"/sdd/edimar/Desktop/doutorado/doutorado04/bases/WEIR/videogame/games.teamxbox.com/1715_Tom-Clancys-EndWar.html","When the world's resources dry up, the superpowers fight for control over the Earth."
"/sdd/edimar/Desktop/doutorado/doutorado04/bases/WEIR/videogame/games.teamxbox.com/2011_Viva-Piata-Trouble-in-Paradise.html",Rare is back with their wild simulation title involving colorful creatures.
"/sdd/edimar/Desktop/doutorado/doutorado04/bases/WEIR/videogame/games.teamxbox.com/1848_Command-Conquer-3-Kanes-Wrath.html",Direct feed video of Electronic Arts' real time strategy game continuing the Command & Conquer series.
"/sdd/edimar/Desktop/doutorado/doutorado04/bases/WEIR/videogame/games.teamxbox.com/803_Hitman-Contracts.html",Even the bathroom isnt safe. What a way to go.
"/sdd/edimar/Desktop/doutorado/doutorado04/bases/WEIR/videogame/games.teamxbox.com/2009_The-Lord-of-the-Rings-Conquest.html",A brief summary of the epic story that sets the stage for The Lord of the Rings: Conquest.
"/sdd/edimar/Desktop/doutorado/doutorado04/bases/WEIR/videogame/games.teamxbox.com/1454_Marvel-Ultimate-Alliance.html",See Marvel character Luke in action is his trailer for Ultimate Alliance.
"/sdd/edimar/Desktop/doutorado/doutorado04/bases/WEIR/videogame/games.teamxbox.com/1248_Project-Gotham-Racing-3.html",Microsoft has released the direct feed X05 trailer of Project Gotham Racing 3.
"/sdd/edimar/Desktop/doutorado/doutorado04/bases/WEIR/videogame/games.teamxbox.com/1097_Gauntlet-Seven-Sorrows.html",Midway breathes new life into the Gauntlet series as shown here in their E3 gameplay footage.
"/sdd/edimar/Desktop/doutorado/doutorado04/bases/WEIR/videogame/games.teamxbox.com/1043_Mortal-Kombat-Shaolin-Monks.html",Midway has released a new trailer of Mortal Kombat: Shaolin Monks at Gamers' Day.
"/sdd/edimar/Desktop/doutorado/doutorado04/bases/WEIR/videogame/games.teamxbox.com/1775_Sid-Meiers-Civilization-Revolution.html","In Civilization, players strive to become ruler of the world by establishing and leading a civilization from the dawn of man into the space age."
"/sdd/edimar/Desktop/doutorado/doutorado04/bases/WEIR/videogame/games.teamxbox.com/1924_Bionic-Commando-Rearmed.html",Capcom has revealed the final and perhaps coolest new mode in Bionic Commando Rearmed: Multiplayer.
"/sdd/edimar/Desktop/doutorado/doutorado04/bases/WEIR/videogame/games.teamxbox.com/735_XMen-Legends.html","Leading the X-Men, Professor X is very important in the world of mutants."
"/sdd/edimar/Desktop/doutorado/doutorado04/bases/WEIR/videogame/games.teamxbox.com/1281_Enchanted-Arms.html",Watch the very first trailer of the localized version of eM.
"/sdd/edimar/Desktop/doutorado/doutorado04/bases/WEIR/videogame/games.teamxbox.com/1966_Baja.html",Check out this off road racer in action.
"/sdd/edimar/Desktop/doutorado/doutorado04/bases/WEIR/videogame/games.teamxbox.com/1798_FEAR-Files.html",Check out the opening scene of F.E.A.R.'s Perseus Mandate expansion.
"/sdd/edimar/Desktop/doutorado/doutorado04/bases/WEIR/videogame/games.teamxbox.com/1526_PROJECT-SYLPHEED.html",We continue the battle against the attackers in the demo now available for Project Sylpheed.
"/sdd/edimar/Desktop/doutorado/doutorado04/bases/WEIR/videogame/games.teamxbox.com/1547_Battlefield-Bad-Company.html",Some direct-feed footage of one of the new maps of Battlefield: Bad Company.
"/sdd/edimar/Desktop/doutorado/doutorado04/bases/WEIR/videogame/games.teamxbox.com/1519_Command-Conquer-3-Tiberium-Wars.html",Our editors Andy and Will go head to head in a match of siege.
"/sdd/edimar/Desktop/doutorado/doutorado04/bases/WEIR/videogame/games.teamxbox.com/1688_Ace-Combat-6-Fires-of-Liberation.html",Some high-flying action of fierce combat in the sky.
"/sdd/edimar/Desktop/doutorado/doutorado04/bases/WEIR/videogame/games.teamxbox.com/1516_NHL-07.html",This is the first Xbox 360 video for NHL 07 highlighting a shot on goal that is saved in the glove.
"/sdd/edimar/Desktop/doutorado/doutorado04/bases/WEIR/videogame/games.teamxbox.com/1506_Mercenaries-2-World-in-Flames.html",In this video the developers discuss their lack of rules when it comes to their approach to cooperative destruction.
"/sdd/edimar/Desktop/doutorado/doutorado04/bases/WEIR/videogame/games.teamxbox.com/1303_Rumble-Roses-XX.html",Konami has released a new trailer of Rumble Roses XX featuring new westlers.
"/sdd/edimar/Desktop/doutorado/doutorado04/bases/WEIR/videogame/games.teamxbox.com/1979_Tom-Clancys-HAWX.html",Another quick look at the action of Tom Clancy's H.A.W.X
"/sdd/edimar/Desktop/doutorado/doutorado04/bases/WEIR/videogame/games.teamxbox.com/1788_Destroy-All-Humans-Path-of-the-Furon.html",The first trailer from THQ of their latest out of this world title.
"/sdd/edimar/Desktop/doutorado/doutorado04/bases/WEIR/videogame/games.teamxbox.com/1268_NBA-Live-06.html",Watch the Scorer in action.
"/sdd/edimar/Desktop/doutorado/doutorado04/bases/WEIR/videogame/games.teamxbox.com/1619_Tom-Clancys-Ghost-Recon-Advanced-Warfighter-2.html",Take a look at the action available with the newly released content for GRAW 2.
"/sdd/edimar/Desktop/doutorado/doutorado04/bases/WEIR/videogame/games.teamxbox.com/1768_World-in-Conflict.html",A peek behind the scenes of the Cold War.
"/sdd/edimar/Desktop/doutorado/doutorado04/bases/WEIR/videogame/games.teamxbox.com/2035_NBA-Live-09.html",NBA LIVE 09 is back with new features that will make the NBA LIVE experience fun from beginning to end.
"/sdd/edimar/Desktop/doutorado/doutorado04/bases/WEIR/videogame/games.teamxbox.com/481_Kameo-Elements-of-Power.html",Major Ruin and Chilla combine their powers in order to traverse King Thorns castle.
"/sdd/edimar/Desktop/doutorado/doutorado04/bases/WEIR/videogame/games.teamxbox.com/1558_Eternal-Sonata.html",We bring you some off-the-screen footage of Trusty Bell.
"/sdd/edimar/Desktop/doutorado/doutorado04/bases/WEIR/videogame/games.teamxbox.com/1464_DiRT.html",Watch as we speed through the track in our high performance Evo.
"/sdd/edimar/Desktop/doutorado/doutorado04/bases/WEIR/videogame/games.teamxbox.com/1786_MX-vs-ATV-Untamed.html",What vehicle and where you drive it is up to you as long as you can keep up with the competition.
"/sdd/edimar/Desktop/doutorado/doutorado04/bases/WEIR/videogame/games.teamxbox.com/1762_NHL-08.html",See just how much attention to detail was put in by the designers to realistically reflect these Reebok jerseys.
"/sdd/edimar/Desktop/doutorado/doutorado04/bases/WEIR/videogame/games.teamxbox.com/980_Oddworld-Strangers-Wrath.html","Check out how Stranger continues his stealth takedowns using Live Ammo like the Stunkz, Thudslugs, and Fuzzles."
"/sdd/edimar/Desktop/doutorado/doutorado04/bases/WEIR/videogame/games.teamxbox.com/1802_Silent-Hill-Homecoming.html","Alex finds a knife stuck in the mirror in this hospital bathroom, but that's not all he finds..."
"/sdd/edimar/Desktop/doutorado/doutorado04/bases/WEIR/videogame/games.teamxbox.com/1141_Xbox-360.html",Here's quick montage of the Xbox 360's E3 2005 lineup of showcase titles.
"/sdd/edimar/Desktop/doutorado/doutorado04/bases/WEIR/videogame/games.teamxbox.com/1295_Tom-Clancys-Ghost-Recon-Advanced-Warfighter.html",Watch two minutes of off the screen footage recorded at X05.
