URL,EXTRACTED VALUE
"/sdd/edimar/Desktop/doutorado/doutorado04/bases/WEIR/videogame/games.teamxbox.com/1602_Novadrome.html","In this match, players must race their way to each beacon as it appears while trying to collect the most points against their opponents."
"/sdd/edimar/Desktop/doutorado/doutorado04/bases/WEIR/videogame/games.teamxbox.com/1872_Sega-Superstars-Tennis.html",Here is the mini game inspired in Super Monkey Ball.
"/sdd/edimar/Desktop/doutorado/doutorado04/bases/WEIR/videogame/games.teamxbox.com/726_SpiderMan-2.html",Spidey uses the Queensboro Bridge as his own personal Jungle Gym in this clip.
"/sdd/edimar/Desktop/doutorado/doutorado04/bases/WEIR/videogame/games.teamxbox.com/895_Forgotten-Realms-Demon-Stone.html","This second movie covers elements in the Gemspark Mine, where the party makes a critical mistake and frees two powerful demons."
"/sdd/edimar/Desktop/doutorado/doutorado04/bases/WEIR/videogame/games.teamxbox.com/1692_WWE-SmackDown-vs-RAW-2008.html",Here is the same movie but in widescreen standard definition.
"/sdd/edimar/Desktop/doutorado/doutorado04/bases/WEIR/videogame/games.teamxbox.com/1369_Lost-Planet.html",The ground shakes as this massive snow worm bursts through the surface.
"/sdd/edimar/Desktop/doutorado/doutorado04/bases/WEIR/videogame/games.teamxbox.com/1476_Forza-Motorsport-2.html",Check out the CG Xbox Live Auction House video that appeared during the Forza Motorsport Showdown on SPEED.
"/sdd/edimar/Desktop/doutorado/doutorado04/bases/WEIR/videogame/games.teamxbox.com/2104_Duke-Nukem-3D.html",We catch up online with a few of the devs at 3D Realms and take part in some cooperative Duke Nukem goodness.
"/sdd/edimar/Desktop/doutorado/doutorado04/bases/WEIR/videogame/games.teamxbox.com/1160_Test-Drive-Unlimited.html",Watch the Cadillac.
"/sdd/edimar/Desktop/doutorado/doutorado04/bases/WEIR/videogame/games.teamxbox.com/949_Need-for-Speed-Underground-2.html",Check out the slickness of Need For Speed Underground 2 and see just how tight this game is shaping up to be.
"/sdd/edimar/Desktop/doutorado/doutorado04/bases/WEIR/videogame/games.teamxbox.com/1475_Call-of-Duty-3.html",The only way to cross the bridge is to first eliminate all enemy targets.
"/sdd/edimar/Desktop/doutorado/doutorado04/bases/WEIR/videogame/games.teamxbox.com/1143_Prince-of-Persia-The-Two-Thrones.html",Check out this new developer video on the artistic direction taken for Prince of Persia 3.
"/sdd/edimar/Desktop/doutorado/doutorado04/bases/WEIR/videogame/games.teamxbox.com/805_Fight-Club.html",Here's a look at the story mode of Fight Club.
"/sdd/edimar/Desktop/doutorado/doutorado04/bases/WEIR/videogame/games.teamxbox.com/472_Halo-2.html","Here you have Halo 2 running on the Xbox 360. No glitches, fully compatible and looking better!"
"/sdd/edimar/Desktop/doutorado/doutorado04/bases/WEIR/videogame/games.teamxbox.com/2103_The-Godfather-II.html",Act like a mobster.
"/sdd/edimar/Desktop/doutorado/doutorado04/bases/WEIR/videogame/games.teamxbox.com/1624_Virtua-Fighter-5.html","High in the clouds, these two fighters battle it out for victory."
"/sdd/edimar/Desktop/doutorado/doutorado04/bases/WEIR/videogame/games.teamxbox.com/1682_Sacred-2-Fallen-Angel.html",Watch the first trailer of Sacred 2.
"/sdd/edimar/Desktop/doutorado/doutorado04/bases/WEIR/videogame/games.teamxbox.com/1324_Crackdown.html",See how the new downloadable content lets you unlock Pacific City.
"/sdd/edimar/Desktop/doutorado/doutorado04/bases/WEIR/videogame/games.teamxbox.com/1867_Aces-of-the-Galaxy.html",Watch Sierra's XBLA space shooter in action.
"/sdd/edimar/Desktop/doutorado/doutorado04/bases/WEIR/videogame/games.teamxbox.com/1593_Def-Jam-Icon.html","In this video, Producer Kudo Tsunoda talks about takedowns and grabs within the game."
"/sdd/edimar/Desktop/doutorado/doutorado04/bases/WEIR/videogame/games.teamxbox.com/1661_Enemy-Territory-Quake-Wars.html",The Strogg have adapted a North African oil refinery to Storyant production and are converting the GDF's strategic fuel reserves for their own use.
"/sdd/edimar/Desktop/doutorado/doutorado04/bases/WEIR/videogame/games.teamxbox.com/1148_Alan-Wake.html",We bring you a high resolution teaser trailer of Alan Wake.
"/sdd/edimar/Desktop/doutorado/doutorado04/bases/WEIR/videogame/games.teamxbox.com/1629_Burnout-Paradise.html",Looking for no strings attached? Look no further than Paradise City.
"/sdd/edimar/Desktop/doutorado/doutorado04/bases/WEIR/videogame/games.teamxbox.com/1459_Overlord.html",Use your minions to collect the essence from creatures in the environments.
"/sdd/edimar/Desktop/doutorado/doutorado04/bases/WEIR/videogame/games.teamxbox.com/1984_Beijing-2008.html","This trailer shows discus, the athletic competition in which a disk-shaped object is thrown as far as possible"
"/sdd/edimar/Desktop/doutorado/doutorado04/bases/WEIR/videogame/games.teamxbox.com/1996_Zombie-Wranglers.html","Wants to be the greatest Zombie Wrangler of all time, or Queen of Hip-Hop."
"/sdd/edimar/Desktop/doutorado/doutorado04/bases/WEIR/videogame/games.teamxbox.com/1157_Tom-Clancys-Ghost-Recon-Advanced-Warfighter.html",In this clip we see how taking advantage of modern technology can tilt the favor in our direction even when being outnumbered and outgunned.
"/sdd/edimar/Desktop/doutorado/doutorado04/bases/WEIR/videogame/games.teamxbox.com/1771_Bee-Movie-Game.html",Bee Movie is a buzz-worthy comedy that will change everything you think you know about bees.
"/sdd/edimar/Desktop/doutorado/doutorado04/bases/WEIR/videogame/games.teamxbox.com/182_Fable.html","Before venturing out into the wild, your hero will have to fine tune his skills on the target range."
"/sdd/edimar/Desktop/doutorado/doutorado04/bases/WEIR/videogame/games.teamxbox.com/1988_Blitz-The-League-II.html","If you're expecting to see a yellow flag in this league, maybe you should be playing a more ""missionary style"" football game."
"/sdd/edimar/Desktop/doutorado/doutorado04/bases/WEIR/videogame/games.teamxbox.com/1169_Dead-Rising.html",the force is with Frank
"/sdd/edimar/Desktop/doutorado/doutorado04/bases/WEIR/videogame/games.teamxbox.com/1551_Turning-Point-Fall-of-Liberty.html",A developer commentary video on the theme of retaliation.
"/sdd/edimar/Desktop/doutorado/doutorado04/bases/WEIR/videogame/games.teamxbox.com/1409_Shaun-White-Snowboarding.html",This snowboarding great is helping Ubisoft get you strapped in and ready for some action on the slopes.
"/sdd/edimar/Desktop/doutorado/doutorado04/bases/WEIR/videogame/games.teamxbox.com/1137_Halo-2-Multiplayer-Map-Pack.html",The dense fog makes for difficult viewing distances on Backwash as evident during this match of Team Slayer.
"/sdd/edimar/Desktop/doutorado/doutorado04/bases/WEIR/videogame/games.teamxbox.com/1706_Super-Street-Fighter-II-Turbo-HD-Remix.html",Other times you just have to match might against might as these two massive brawlers have it out.
"/sdd/edimar/Desktop/doutorado/doutorado04/bases/WEIR/videogame/games.teamxbox.com/1888_Tom-Clancys-Rainbow-Six-Vegas-2.html",A look at several levels of the game's Terrorist Hunt mode.
"/sdd/edimar/Desktop/doutorado/doutorado04/bases/WEIR/videogame/games.teamxbox.com/670_Conan.html","The interview is with Adrian Lacy, Product Manager with TDK Mediactive Europe at X03."
"/sdd/edimar/Desktop/doutorado/doutorado04/bases/WEIR/videogame/games.teamxbox.com/1274_The-Godfather.html",One of the main aspect of The Godfather game will be the car chases. Watch some of the four wheel action.
"/sdd/edimar/Desktop/doutorado/doutorado04/bases/WEIR/videogame/games.teamxbox.com/1498_SEGA-Rally-Revo.html",These racers aren't afraid to get a little dirty as they speed their way around the course.
"/sdd/edimar/Desktop/doutorado/doutorado04/bases/WEIR/videogame/games.teamxbox.com/1540_Vampire-Rain.html",This mission requires finding the advanced team's command vehicle before the nightwalkers stumble upon it and get suspicious.
"/sdd/edimar/Desktop/doutorado/doutorado04/bases/WEIR/videogame/games.teamxbox.com/1147_James-Bond-007-From-Russia-With-Love.html","From Russia With Love, the game, will be based on the classic Bond film,"
"/sdd/edimar/Desktop/doutorado/doutorado04/bases/WEIR/videogame/games.teamxbox.com/1508_Hellboy.html",Hellboy footage from Konami's Gamers' Day Event 2007.
"/sdd/edimar/Desktop/doutorado/doutorado04/bases/WEIR/videogame/games.teamxbox.com/1735_The-Simpsons-Game.html",Homer and Marge are up to the task in this latest trailer from The Simpsons Game.
"/sdd/edimar/Desktop/doutorado/doutorado04/bases/WEIR/videogame/games.teamxbox.com/851_Mercenaries.html",LucasArts and Pandemic Studios have released a brand new action-packed trailer of Mercenaries.
"/sdd/edimar/Desktop/doutorado/doutorado04/bases/WEIR/videogame/games.teamxbox.com/1667_Conan.html",Watch Conan use his might to fight his way through his enemies.
"/sdd/edimar/Desktop/doutorado/doutorado04/bases/WEIR/videogame/games.teamxbox.com/1876_Street-Fighter-IV.html","This new trailer features Street Fighter IVs final boss, Seth!"
"/sdd/edimar/Desktop/doutorado/doutorado04/bases/WEIR/videogame/games.teamxbox.com/830_Area-51.html",Things get out of control in Area-51 as shown here in this all out deathmatch.
"/sdd/edimar/Desktop/doutorado/doutorado04/bases/WEIR/videogame/games.teamxbox.com/2002_Tiger-Woods-PGA-Tour-09.html",EA takes to the course and tees off with this years release of Tiger Woods PGA Tour.
"/sdd/edimar/Desktop/doutorado/doutorado04/bases/WEIR/videogame/games.teamxbox.com/1541_Import-Tuner-Challenge.html",Racing movie in widescreen standard definition.
"/sdd/edimar/Desktop/doutorado/doutorado04/bases/WEIR/videogame/games.teamxbox.com/1392_Medal-of-Honor-Airborne.html","In order to pass this bridge, we must first wipe out the enemy forces that are currently in control of it."
"/sdd/edimar/Desktop/doutorado/doutorado04/bases/WEIR/videogame/games.teamxbox.com/1049_Major-League-Baseball-2K5.html",Watch the new Gamecast feature in action.
"/sdd/edimar/Desktop/doutorado/doutorado04/bases/WEIR/videogame/games.teamxbox.com/1061_Blitz-The-League.html",Get a closer look into the single player campaign mode of Blitz: The League.
"/sdd/edimar/Desktop/doutorado/doutorado04/bases/WEIR/videogame/games.teamxbox.com/898_Call-of-Duty-Finest-Hour.html",Here players will have to clear the way as escorts for a tank convoy.
"/sdd/edimar/Desktop/doutorado/doutorado04/bases/WEIR/videogame/games.teamxbox.com/1894_GRID.html",BMW Team Deutschland takes on the Jarama Grand Prix Circuit in a speedy 320SI.
"/sdd/edimar/Desktop/doutorado/doutorado04/bases/WEIR/videogame/games.teamxbox.com/1190_Full-Auto.html",Here is the new trailer that SEGA released at X05 in Amsterdam.
"/sdd/edimar/Desktop/doutorado/doutorado04/bases/WEIR/videogame/games.teamxbox.com/1534_Clive-Barkers-Jericho.html",Here is the same movie but in widescreen standard definition.
"/sdd/edimar/Desktop/doutorado/doutorado04/bases/WEIR/videogame/games.teamxbox.com/1704_Rocketmen-Axis-of-Evil.html",Beautiful cartoon-like art style brings life to the characters and environments.
"/sdd/edimar/Desktop/doutorado/doutorado04/bases/WEIR/videogame/games.teamxbox.com/1163_Full-Spectrum-Warrior-Ten-Hammers.html",Tactical combat just got better as we see here with some gameplay footage of Full Spectrum Warrior Ten Hammers.
"/sdd/edimar/Desktop/doutorado/doutorado04/bases/WEIR/videogame/games.teamxbox.com/2025_Guitar-Hero-World-Tour.html",Here is the same movie but in widescreen standard definition.
"/sdd/edimar/Desktop/doutorado/doutorado04/bases/WEIR/videogame/games.teamxbox.com/102_NFL-Fever-2002.html",The Denver defense puts up a fight with this endzone interception of a Dallas pass.
"/sdd/edimar/Desktop/doutorado/doutorado04/bases/WEIR/videogame/games.teamxbox.com/1678_Schizoid.html",Check out this Xbox LIVE Arcade title in action.
"/sdd/edimar/Desktop/doutorado/doutorado04/bases/WEIR/videogame/games.teamxbox.com/1769_Hail-to-the-Chimp.html",This candidate wants your vote!
"/sdd/edimar/Desktop/doutorado/doutorado04/bases/WEIR/videogame/games.teamxbox.com/808_Darkwatch.html",Watch the game's opening sequence as directed by Kyle Cooper.
"/sdd/edimar/Desktop/doutorado/doutorado04/bases/WEIR/videogame/games.teamxbox.com/868_Tom-Clancys-Rainbow-Six-3-Black-Arrow.html",Some in-game footage of the action of Rainbow Six 3: Black Arrow.
"/sdd/edimar/Desktop/doutorado/doutorado04/bases/WEIR/videogame/games.teamxbox.com/1738_Universe-at-War-Earth-Assault.html",Here is a battle taking place in Novus.
"/sdd/edimar/Desktop/doutorado/doutorado04/bases/WEIR/videogame/games.teamxbox.com/1408_Transformers-The-Game.html",Watch out these two big Transformers going hard on each other.
"/sdd/edimar/Desktop/doutorado/doutorado04/bases/WEIR/videogame/games.teamxbox.com/366_Outlaw-Volleyball.html","While out at E3 we had a chance to chat with Steve Carell of the Daily Show, who is providing the commentary for Outlaw Volleyball."
"/sdd/edimar/Desktop/doutorado/doutorado04/bases/WEIR/videogame/games.teamxbox.com/1487_Frontlines-Fuel-of-War.html",Call of Duty 4 is no longer the only game with cool air strikes.
"/sdd/edimar/Desktop/doutorado/doutorado04/bases/WEIR/videogame/games.teamxbox.com/562_Velvet-Assassin.html","on real-life British secret agent Violet Szabo, players will take on the role of Violet Summer as she risks her life behind German lines during WWII."
"/sdd/edimar/Desktop/doutorado/doutorado04/bases/WEIR/videogame/games.teamxbox.com/940_Robotech-Invasion.html",Check out this second gameplay movie showing the Cyclone in action.
"/sdd/edimar/Desktop/doutorado/doutorado04/bases/WEIR/videogame/games.teamxbox.com/1170_Perfect-Dark-Zero.html","Once your cover is blown, you'll have to act fast in order to stay alive."
"/sdd/edimar/Desktop/doutorado/doutorado04/bases/WEIR/videogame/games.teamxbox.com/1329_MotoGP-06.html",MotoGP is going next-gen as we see here in this footage from X05 running on the Xbox 360.
"/sdd/edimar/Desktop/doutorado/doutorado04/bases/WEIR/videogame/games.teamxbox.com/1737_Condemned-2-Bloodshot.html",Sega and Monolith once again invite you into the brutal world of Condemned.
"/sdd/edimar/Desktop/doutorado/doutorado04/bases/WEIR/videogame/games.teamxbox.com/1172_Prey.html",Here is the first clip in widescreen 480p.
"/sdd/edimar/Desktop/doutorado/doutorado04/bases/WEIR/videogame/games.teamxbox.com/1192_AND-1-Streetball.html",Associate Producer Matt Levning explains the motion capture process performed for AND1 Streeball.
"/sdd/edimar/Desktop/doutorado/doutorado04/bases/WEIR/videogame/games.teamxbox.com/1850_Ninja-Gaiden-2.html",Ryu uses his sword like no other as he takes on enemies who get in his way.
"/sdd/edimar/Desktop/doutorado/doutorado04/bases/WEIR/videogame/games.teamxbox.com/1903_Tiberium.html",Check out some direct feed gameplay of Tiberium in action.
"/sdd/edimar/Desktop/doutorado/doutorado04/bases/WEIR/videogame/games.teamxbox.com/2039_NHL-09.html",Another strategy covering the dump and chase style in order to get the puck back on defense.
"/sdd/edimar/Desktop/doutorado/doutorado04/bases/WEIR/videogame/games.teamxbox.com/1198_Kameo-Elements-of-Power.html",Watch a video documentary on the music behind Kameo: Elements of Power.
"/sdd/edimar/Desktop/doutorado/doutorado04/bases/WEIR/videogame/games.teamxbox.com/1452_Virtua-Tennis-3.html",Dodge balls and collect fruit on the court?
"/sdd/edimar/Desktop/doutorado/doutorado04/bases/WEIR/videogame/games.teamxbox.com/1571_Conflict-Denied-Ops.html",We bring you an exclusive trailer of Conflict: Denied Ops that features never-before-seen gameplay sequences.
"/sdd/edimar/Desktop/doutorado/doutorado04/bases/WEIR/videogame/games.teamxbox.com/910_ESPN-NHL-2K5.html",We got our hands behind the controls of NHL 2K5 to bring you some exclusive video clips of the game in action.
"/sdd/edimar/Desktop/doutorado/doutorado04/bases/WEIR/videogame/games.teamxbox.com/1921_Dragon-Ball-Z-Burst-Limit.html",The prince of the Saiyans shows his powers in this trailer.
"/sdd/edimar/Desktop/doutorado/doutorado04/bases/WEIR/videogame/games.teamxbox.com/1247_SSX-On-Tour.html",Mac throws down a massive monster trick.
"/sdd/edimar/Desktop/doutorado/doutorado04/bases/WEIR/videogame/games.teamxbox.com/1194_NBA-2K6.html",Crossovers in NBA 2K6 are a combination of simple movements on the Left Analog stick combined with tapping or holding the new Aggression button.
"/sdd/edimar/Desktop/doutorado/doutorado04/bases/WEIR/videogame/games.teamxbox.com/926_Delta-Force-Black-Hawk-Down.html",A rolling tank brigade meets up with some unfriendly locals.
"/sdd/edimar/Desktop/doutorado/doutorado04/bases/WEIR/videogame/games.teamxbox.com/863_Def-Jam-Fight-For-NY.html",You cant throw down in NYC until you create your own banger. Check out how its done.
"/sdd/edimar/Desktop/doutorado/doutorado04/bases/WEIR/videogame/games.teamxbox.com/1810_Geon-Emotions.html",Some gameplay of Eidos' Xbox Live Arcade title.
"/sdd/edimar/Desktop/doutorado/doutorado04/bases/WEIR/videogame/games.teamxbox.com/1466_The-Club.html",Here Renwick makes three laps while trying to beat the clock and rack up the points.
"/sdd/edimar/Desktop/doutorado/doutorado04/bases/WEIR/videogame/games.teamxbox.com/1191_Brothers-In-Arms-Earned-In-Blood.html",Watch a movie with the producers of Brothers In Arms Earned In Blood explaining the storyline of this second chapter in the series.
"/sdd/edimar/Desktop/doutorado/doutorado04/bases/WEIR/videogame/games.teamxbox.com/871_Brothers-in-Arms-Road-to-Hill-30.html","Ubisoft and Gearbox have released a new trailer of Brother in Arms, made entirely of in-game footage."
"/sdd/edimar/Desktop/doutorado/doutorado04/bases/WEIR/videogame/games.teamxbox.com/540_Men-of-Valor.html",Dean displays patience and some fancy shooting in order to penetrate this enemy stronghold.
"/sdd/edimar/Desktop/doutorado/doutorado04/bases/WEIR/videogame/games.teamxbox.com/1330_Alone-in-the-Dark.html","In addition to solving puzzles and driving around town, Edward is going to have to mix things up with more than a few enemies who cross his path."
"/sdd/edimar/Desktop/doutorado/doutorado04/bases/WEIR/videogame/games.teamxbox.com/1012_Sid-Meiers-Pirates.html",Sid Meir and his crew take us through the development of the remaking of Pirates!.
"/sdd/edimar/Desktop/doutorado/doutorado04/bases/WEIR/videogame/games.teamxbox.com/1751_Naruto-Rise-of-a-Ninja.html",Sakura and Haku have a score to settle in this rematch on the Riverside arena.
"/sdd/edimar/Desktop/doutorado/doutorado04/bases/WEIR/videogame/games.teamxbox.com/1670_Stuntman-Ignition.html",This James Bond type film requires some daring stunts on a frozen lake.
"/sdd/edimar/Desktop/doutorado/doutorado04/bases/WEIR/videogame/games.teamxbox.com/1467_NCAA-Football-07.html",Look for Mike Hart tear it up on the ground for Michigan.
"/sdd/edimar/Desktop/doutorado/doutorado04/bases/WEIR/videogame/games.teamxbox.com/1293_TimeShift.html",Even more video of the time altering demo available on XBL.
"/sdd/edimar/Desktop/doutorado/doutorado04/bases/WEIR/videogame/games.teamxbox.com/919_NBA-Live-2005.html",More how to help in the Slam Dunk Contest. This time players will get a look at how to perform an alleyoop dunk.
"/sdd/edimar/Desktop/doutorado/doutorado04/bases/WEIR/videogame/games.teamxbox.com/1495_Army-of-Two.html",We take out a few enemies while taking cover to prevent from getting hit.
"/sdd/edimar/Desktop/doutorado/doutorado04/bases/WEIR/videogame/games.teamxbox.com/1990_SpiderMan-Web-of-Shadows.html",See what happens when a symbiote takes on Wolverine...
"/sdd/edimar/Desktop/doutorado/doutorado04/bases/WEIR/videogame/games.teamxbox.com/1836_Viking-Battle-for-Asgard.html",The game's designers tell us just why they went with Vikings in their latest title.
"/sdd/edimar/Desktop/doutorado/doutorado04/bases/WEIR/videogame/games.teamxbox.com/1645_BlackSite-Area-51.html",Here is the same movie but in widescreen standard definition.
"/sdd/edimar/Desktop/doutorado/doutorado04/bases/WEIR/videogame/games.teamxbox.com/1525_Bullet-Witch.html",What's a typical day like for the deadly vixen of Bullet Witch?
"/sdd/edimar/Desktop/doutorado/doutorado04/bases/WEIR/videogame/games.teamxbox.com/1719_Call-of-Duty-4-Modern-Warfare.html",Multiplayer action on the new Chinatown map.
"/sdd/edimar/Desktop/doutorado/doutorado04/bases/WEIR/videogame/games.teamxbox.com/1985_Afro-Samurai.html","In this second part, Afro Samurai shows the innovative combat system found in the game."
"/sdd/edimar/Desktop/doutorado/doutorado04/bases/WEIR/videogame/games.teamxbox.com/1552_Assassins-Creed.html",Watch this great looking video that runs at the title menu for Assassin's Creed.
"/sdd/edimar/Desktop/doutorado/doutorado04/bases/WEIR/videogame/games.teamxbox.com/668_NBA-Ballers.html",Check out some fresh action on the courts of NBA Ballers.
"/sdd/edimar/Desktop/doutorado/doutorado04/bases/WEIR/videogame/games.teamxbox.com/1962_Lost-Planet-Colonies-Edition.html",In this match we fight over control of an Akrid Egg.
"/sdd/edimar/Desktop/doutorado/doutorado04/bases/WEIR/videogame/games.teamxbox.com/2048_Call-of-Duty-World-At-War.html",Here is the same movie but in widescreen standard definition.
"/sdd/edimar/Desktop/doutorado/doutorado04/bases/WEIR/videogame/games.teamxbox.com/1774_Rise-of-the-Argonauts.html",A closer look at the island of Kythra.
"/sdd/edimar/Desktop/doutorado/doutorado04/bases/WEIR/videogame/games.teamxbox.com/1217_Saints-Row.html","Check out this demo of Sain't Row in which we had time to play with day times, cars and interact with some pedestrians."
"/sdd/edimar/Desktop/doutorado/doutorado04/bases/WEIR/videogame/games.teamxbox.com/1325_Mass-Effect.html",This massive metallic asteroid is on a collision course with Terra Nova and Shepard is tasked with saving the planet.
"/sdd/edimar/Desktop/doutorado/doutorado04/bases/WEIR/videogame/games.teamxbox.com/1280_Operation-Darkness.html",Videos featuring the main characters of Operation Darkness.
"/sdd/edimar/Desktop/doutorado/doutorado04/bases/WEIR/videogame/games.teamxbox.com/1575_BanjoKazooie-Nuts-and-Bolts.html",Some of the first bits of gameplay footage from Rare's upcoming Xbox 360 debut of Banjo-Kazooie.
"/sdd/edimar/Desktop/doutorado/doutorado04/bases/WEIR/videogame/games.teamxbox.com/872_Madden-NFL-2005.html",McNabb takes advantage of the New England blitz and completes a 57 yard bomb for another Eagle touchdown.
"/sdd/edimar/Desktop/doutorado/doutorado04/bases/WEIR/videogame/games.teamxbox.com/2018_Soulcalibur.html",Nightmare faces the fiery Inferno in a battle to reclaim his soul.
"/sdd/edimar/Desktop/doutorado/doutorado04/bases/WEIR/videogame/games.teamxbox.com/1860_Dead-Space.html","Check out the newest Dev Diary from Dead Space talking about the Art, Gore and Creature Development in the game."
"/sdd/edimar/Desktop/doutorado/doutorado04/bases/WEIR/videogame/games.teamxbox.com/2021_NHL-2K9.html",Watch as the Penguins take the ice at the Igloo in Pittsburgh.
"/sdd/edimar/Desktop/doutorado/doutorado04/bases/WEIR/videogame/games.teamxbox.com/1764_Soulcalibur-IV.html",Korean fighter Seong Mi-na comes face to face with Hildegard von Krone.
"/sdd/edimar/Desktop/doutorado/doutorado04/bases/WEIR/videogame/games.teamxbox.com/1013_LA-Rush.html",Satisfy your craving for speed and car wrecks with some exclusive footage of LA Rush in action during Midway's Gamer's Day event.
"/sdd/edimar/Desktop/doutorado/doutorado04/bases/WEIR/videogame/games.teamxbox.com/1981_Sonic-Unleashed.html","We get the first look at Adabat, the newly revealed level in SEGAs upcoming Sonic Unleashed."
"/sdd/edimar/Desktop/doutorado/doutorado04/bases/WEIR/videogame/games.teamxbox.com/1189_Condemned-Criminal-Origins.html",SEGA has released a new trailer of Condemned: Criminal Origins featuring the combat aspect of the game.
"/sdd/edimar/Desktop/doutorado/doutorado04/bases/WEIR/videogame/games.teamxbox.com/922_FIFA-Soccer-2005.html","FIFA producer, Danny Isaac, answers community questions in the first installment of the FIFA 2005 Dev Diary."
"/sdd/edimar/Desktop/doutorado/doutorado04/bases/WEIR/videogame/games.teamxbox.com/1745_Midnight-Club-Los-Angeles.html",Pontiac's Firebird never looked better!
"/sdd/edimar/Desktop/doutorado/doutorado04/bases/WEIR/videogame/games.teamxbox.com/408_Blinx-The-Time-Sweeper.html",Slow down the pace for more time to react to things around you
"/sdd/edimar/Desktop/doutorado/doutorado04/bases/WEIR/videogame/games.teamxbox.com/2061_Race-Pro.html",Audi has been turning heads with their R8 roadster and we can see why.
"/sdd/edimar/Desktop/doutorado/doutorado04/bases/WEIR/videogame/games.teamxbox.com/55_Halo.html","With your forces dwindling, the Covenant drops forces to mount against you, fight hard...or die!"
"/sdd/edimar/Desktop/doutorado/doutorado04/bases/WEIR/videogame/games.teamxbox.com/1447_Battlestations-Midway.html",Watch as we take to the seas of combat in Eidos' multiplayer demo of Battlestations Midway.
"/sdd/edimar/Desktop/doutorado/doutorado04/bases/WEIR/videogame/games.teamxbox.com/677_Conker-Live-Reloaded.html","In Bad Fur Day you play as Conker, a mischievous squirrel about to embark on the wildest ride of his life. Watch footage from the third chapter."
"/sdd/edimar/Desktop/doutorado/doutorado04/bases/WEIR/videogame/games.teamxbox.com/1938_Pure.html",Here is the same movie but in widescreen standard definition.
"/sdd/edimar/Desktop/doutorado/doutorado04/bases/WEIR/videogame/games.teamxbox.com/1690_Prince-of-Persia.html","Set in a land rooted in ancient Persian mythology, the Prince finds himself caught in an epic battle between the primal forces of light and darkness."
"/sdd/edimar/Desktop/doutorado/doutorado04/bases/WEIR/videogame/games.teamxbox.com/1415_SpiderMan-3.html","Take a look at Lizard, one of the new characters in Spider-Man 3 the game."
