URL,EXTRACTED VALUE
"/sdd/edimar/Desktop/doutorado/doutorado04/bases/WEIR/videogame/games.teamxbox.com/1324_Crackdown.html",Here is a second part where you can see some nice explosions and big jumps.
"/sdd/edimar/Desktop/doutorado/doutorado04/bases/WEIR/videogame/games.teamxbox.com/1325_Mass-Effect.html",Mass Effect packs plenty of action as we see here with some more video of the game's combat.
"/sdd/edimar/Desktop/doutorado/doutorado04/bases/WEIR/videogame/games.teamxbox.com/1719_Call-of-Duty-4-Modern-Warfare.html",We fight for control of various headquarter positions on in this war torn town.
"/sdd/edimar/Desktop/doutorado/doutorado04/bases/WEIR/videogame/games.teamxbox.com/1439_Tom-Clancys-Rainbow-Six-Vegas.html","We bring you a 11 minute walkthrough of Tom Clancy's Rainbow Six Vegas, available for the first time for free."
"/sdd/edimar/Desktop/doutorado/doutorado04/bases/WEIR/videogame/games.teamxbox.com/1942_Gears-of-War-2.html",Here is the same movie but in widescreen standard definition.
"/sdd/edimar/Desktop/doutorado/doutorado04/bases/WEIR/videogame/games.teamxbox.com/1619_Tom-Clancys-Ghost-Recon-Advanced-Warfighter-2.html",Ubisoft has released a single player demo of GRAW2 now available on Xbox Live Marketplace. You can watch the entire thing right here.
"/sdd/edimar/Desktop/doutorado/doutorado04/bases/WEIR/videogame/games.teamxbox.com/1167_Gears-of-War.html",Marcus and crew need to eliminate the Locusts held up in the courtyard in order to continue moving forward.
"/sdd/edimar/Desktop/doutorado/doutorado04/bases/WEIR/videogame/games.teamxbox.com/1353_Halo-3.html",Master Chief's legend lives on in first-hand stories told by the men who served with him in the Battle for New Mombasa.
