URL,EXTRACTED VALUE
"/media/Dados/bases/SWDE/job/job-techcentric/1226.htm",Ability to work independently as well as within a team environment
"/media/Dados/bases/SWDE/job/job-techcentric/0318.htm",BS in Business/Computer Science or other related degrees
"/media/Dados/bases/SWDE/job/job-techcentric/0768.htm",Education:
"/media/Dados/bases/SWDE/job/job-techcentric/0370.htm",oMS Office/Microsoft Exchange/Internet Explorer
"/media/Dados/bases/SWDE/job/job-techcentric/0567.htm",Bachelor Degree is preferred.
"/media/Dados/bases/SWDE/job/job-techcentric/1295.htm",York Solutions
"/media/Dados/bases/SWDE/job/job-techcentric/1602.htm","oStrong analytical, data management and troubleshooting skills"
"/media/Dados/bases/SWDE/job/job-techcentric/1490.htm",Bilingual Korean is plus not required
