URL,EXTRACTED VALUE
"/media/Dados/bases/SWDE/job/job-techcentric/0495.htm",Ajilon is an Equal Opportunity Employer.
"/media/Dados/bases/SWDE/job/job-techcentric/0635.htm",Ajilon is an Equal Opportunity Employer.
"/media/Dados/bases/SWDE/job/job-techcentric/0214.htm",Education and Professional Experience Requirements:
"/media/Dados/bases/SWDE/job/job-techcentric/0637.htm","· Is a good communicator, independent worker and bring the can do attitude"
"/media/Dados/bases/SWDE/job/job-techcentric/0581.htm","Experience with MS Project, Visio, Excel and Power Point"
