URL,EXTRACTED VALUE
"/media/Dados/bases/SWDE/job/job-techcentric/1661.htm",Can you think beyond technology and develop solutions ?
"/media/Dados/bases/SWDE/job/job-techcentric/1965.htm",Communicating with Developers in support of debugging and investigation
"/media/Dados/bases/SWDE/job/job-techcentric/1334.htm",Coordination with business operations / data management team on various tasks for the development and maintenance of Scorecards / Reports
"/media/Dados/bases/SWDE/job/job-techcentric/0423.htm",WebSphere
"/media/Dados/bases/SWDE/job/job-techcentric/0845.htm","This dynamic team is looking for great people to make a difference, not just in their day-to-day work, but in the world around them."
"/media/Dados/bases/SWDE/job/job-techcentric/1509.htm",Has familiarity with and can write a Use Case document and use case model
"/media/Dados/bases/SWDE/job/job-techcentric/0603.htm","Troubleshooting as needed for entire stack, including Websphere application servers and IIS web servers"
"/media/Dados/bases/SWDE/job/job-techcentric/1727.htm",Iterate with design on UI
"/media/Dados/bases/SWDE/job/job-techcentric/1186.htm",Test and develop programming modifications
"/media/Dados/bases/SWDE/job/job-techcentric/0965.htm","Estimate effort for test design, test execution, and requirements documentation to assist in project planning and resource allocation."
"/media/Dados/bases/SWDE/job/job-techcentric/0499.htm",Must have previous experience with SaaS and Cloud Computing
"/media/Dados/bases/SWDE/job/job-techcentric/0954.htm",Strong analytical and problem solving skills
"/media/Dados/bases/SWDE/job/job-techcentric/0239.htm",Experience providing formal knowledge transfer
"/media/Dados/bases/SWDE/job/job-techcentric/1037.htm",Strong documentation skills and communication/presentation skills.
"/media/Dados/bases/SWDE/job/job-techcentric/0178.htm",Hibernate
"/media/Dados/bases/SWDE/job/job-techcentric/1180.htm",SQL and PL/SQL programming required
"/media/Dados/bases/SWDE/job/job-techcentric/1200.htm","Design BI dashboards, scorecards, charts/graphs, drill-downs, and dynamic reports to meet the new information needs."
"/media/Dados/bases/SWDE/job/job-techcentric/0227.htm",1+ years Lean/Agile development experience
"/media/Dados/bases/SWDE/job/job-techcentric/0169.htm",Object Oriented Programming
"/media/Dados/bases/SWDE/job/job-techcentric/0731.htm","Lead the effort to re-tool Humana for identifying management and associate provisioning, while maintaining current service level objectives"
"/media/Dados/bases/SWDE/job/job-techcentric/1063.htm",Full benefits
"/media/Dados/bases/SWDE/job/job-techcentric/0226.htm","XML, XSD"
"/media/Dados/bases/SWDE/job/job-techcentric/1137.htm",WinForms and XML to develop and configure thick client WPF.
"/media/Dados/bases/SWDE/job/job-techcentric/1458.htm",Participate in the design of new or changing components.
"/media/Dados/bases/SWDE/job/job-techcentric/1612.htm",Develop work estimates for projects.
"/media/Dados/bases/SWDE/job/job-techcentric/0354.htm",Visual Studio 08 Required 1 Years
"/media/Dados/bases/SWDE/job/job-techcentric/1569.htm",Classic ASP
"/media/Dados/bases/SWDE/job/job-techcentric/1811.htm","Participates in Meditech installation and upgrade projects, including development of the detailed project plans"
"/media/Dados/bases/SWDE/job/job-techcentric/1196.htm",Partner with other business areas within Humana to understand application requirements and develop programming specifications for development staff
"/media/Dados/bases/SWDE/job/job-techcentric/1495.htm",Help define product vision and roadmap
"/media/Dados/bases/SWDE/job/job-techcentric/1977.htm",Unix/Linux environment experience required.
"/media/Dados/bases/SWDE/job/job-techcentric/0681.htm",Intermediate level knowledge of Visual Studio environment
"/media/Dados/bases/SWDE/job/job-techcentric/0286.htm",Iterate with design on UI
"/media/Dados/bases/SWDE/job/job-techcentric/0400.htm",Solid experience working with development teams on the deployment of large volume transaction based applications (Java)
"/media/Dados/bases/SWDE/job/job-techcentric/1408.htm",Use of case management and other tools to insure timely resolution of open incidents.
"/media/Dados/bases/SWDE/job/job-techcentric/0236.htm",Analytical and diagnostic skills
"/media/Dados/bases/SWDE/job/job-techcentric/1696.htm",Can you think beyond technology and develop solutions ?
"/media/Dados/bases/SWDE/job/job-techcentric/1779.htm",Ensuring the development team uses these patterns and adheres to the Technical Standards.
"/media/Dados/bases/SWDE/job/job-techcentric/0946.htm",Communicate and enforce best practice coding standards to maintain the excellent code quality.
"/media/Dados/bases/SWDE/job/job-techcentric/1453.htm",Gather requirements and convert them into functional specifications
"/media/Dados/bases/SWDE/job/job-techcentric/0255.htm",WebSphere Message Broker
"/media/Dados/bases/SWDE/job/job-techcentric/1655.htm",Stong Experience developing in a Unix environment: Linux or Solaris a plus
"/media/Dados/bases/SWDE/job/job-techcentric/1665.htm",Utilize Excel and Access to launch theoretical claim queries into the system
"/media/Dados/bases/SWDE/job/job-techcentric/1191.htm",Iterate with design on UI
"/media/Dados/bases/SWDE/job/job-techcentric/1631.htm",J2EE
"/media/Dados/bases/SWDE/job/job-techcentric/0334.htm",1+ years Lean/Agile development experience
"/media/Dados/bases/SWDE/job/job-techcentric/0087.htm",C ommunicate to execution team and to server owners
"/media/Dados/bases/SWDE/job/job-techcentric/0484.htm",Expert at
"/media/Dados/bases/SWDE/job/job-techcentric/0055.htm",This person also has to have a creative side to them to help with generating new ideas for the business and how IT can help make Arhaus more money.
"/media/Dados/bases/SWDE/job/job-techcentric/1633.htm",HTML
"/media/Dados/bases/SWDE/job/job-techcentric/1794.htm","Maintenance and break fix of core applications (WTT, Build Tracker, DFS, SQL, IIS)"
"/media/Dados/bases/SWDE/job/job-techcentric/0038.htm",Good Winforms skills is a must
"/media/Dados/bases/SWDE/job/job-techcentric/0541.htm",Working with PM???s to understand business information needs to drive the requirements
"/media/Dados/bases/SWDE/job/job-techcentric/0268.htm",Working experience with J2EE. Understanding of WebLogic is a plus. Should have sound understanding of Spring framework.
"/media/Dados/bases/SWDE/job/job-techcentric/1624.htm",Data Analysis
"/media/Dados/bases/SWDE/job/job-techcentric/1096.htm","Must have Senior/Expert level in FI includes AP, AR, G/L, Asset management"
"/media/Dados/bases/SWDE/job/job-techcentric/0439.htm",Do you have a solution oriented engineering approach?
"/media/Dados/bases/SWDE/job/job-techcentric/1944.htm","Enterprise Content Management concepts and awareness (taxonomy, governance, document management, etc.)"
"/media/Dados/bases/SWDE/job/job-techcentric/1834.htm","Assist in the development of integrations between Endeca, WebSphere Commerce and other 3rd party systems as required."
"/media/Dados/bases/SWDE/job/job-techcentric/1121.htm",Translate system requirements into technical architectures and designs
"/media/Dados/bases/SWDE/job/job-techcentric/1707.htm",Manage deadlines and work to meet feature requirements and customer expectations
"/media/Dados/bases/SWDE/job/job-techcentric/0044.htm","Working with others to investigate environment issues, identify root causes and implement resolutions"
"/media/Dados/bases/SWDE/job/job-techcentric/1523.htm",Provide direction in the analysis and fixing of defects.
"/media/Dados/bases/SWDE/job/job-techcentric/1534.htm",Lead design and code reviews to notify and correct any issues where possible across organizations prior to implementation
"/media/Dados/bases/SWDE/job/job-techcentric/0003.htm",W2 ONLY!
"/media/Dados/bases/SWDE/job/job-techcentric/0428.htm","Proficiency with applied state-of-the-art methodologies, such as entity-relationship diagramming or object-oriented analysis and design required"
"/media/Dados/bases/SWDE/job/job-techcentric/1100.htm",Deploy WebSphere/WebLogic application builds to cluster.
"/media/Dados/bases/SWDE/job/job-techcentric/1952.htm",Ability to articulate ideas clearly and concisely
"/media/Dados/bases/SWDE/job/job-techcentric/1524.htm","General technical knowledge in software development methodologies, design and implementation"
"/media/Dados/bases/SWDE/job/job-techcentric/0570.htm",Migrate ASP.NET Web Services to WCF.
"/media/Dados/bases/SWDE/job/job-techcentric/0511.htm",Providing technical leadership in various aspects of the project life cycle
"/media/Dados/bases/SWDE/job/job-techcentric/1411.htm",Must have very strong oral communication skills
"/media/Dados/bases/SWDE/job/job-techcentric/0371.htm",Health insurance background
"/media/Dados/bases/SWDE/job/job-techcentric/0060.htm",2 - 4 Years MS SQL Server 6.5
"/media/Dados/bases/SWDE/job/job-techcentric/1653.htm",Meta Tagger
"/media/Dados/bases/SWDE/job/job-techcentric/0359.htm",SQL Server
"/media/Dados/bases/SWDE/job/job-techcentric/1069.htm",Perform root cause analysis on reported software defects.
"/media/Dados/bases/SWDE/job/job-techcentric/0916.htm",2+ years of Perl application architecture and design experience
"/media/Dados/bases/SWDE/job/job-techcentric/1345.htm","(3) 3+ years experience with .NET 2.0+,"
"/media/Dados/bases/SWDE/job/job-techcentric/0620.htm",Web Services
"/media/Dados/bases/SWDE/job/job-techcentric/0863.htm","Works with business end users to gather, create and document requirements for the enterprise Datawarehouse"
"/media/Dados/bases/SWDE/job/job-techcentric/0851.htm",Develop Service Engine/Binding components selection in Open ESB; do R/D in Open ESB and POC for a Rules engine like Drools
"/media/Dados/bases/SWDE/job/job-techcentric/0911.htm",Enterprise-level concurrent high-volume data transaction systems
"/media/Dados/bases/SWDE/job/job-techcentric/0291.htm",Experience building Security Master
"/media/Dados/bases/SWDE/job/job-techcentric/0744.htm",Influence external groups to close technical issues as they arise
"/media/Dados/bases/SWDE/job/job-techcentric/1643.htm","Experience with a wide range of Server Side Java Web technologies, including XML, Spring, Serlvets, JSP, Tomcat"
"/media/Dados/bases/SWDE/job/job-techcentric/0961.htm",SQL Server experience
"/media/Dados/bases/SWDE/job/job-techcentric/1995.htm",Research and explain changes in VaR.
"/media/Dados/bases/SWDE/job/job-techcentric/0919.htm",2+ years of JavaScript
"/media/Dados/bases/SWDE/job/job-techcentric/1694.htm",SaaS experience
"/media/Dados/bases/SWDE/job/job-techcentric/0205.htm",Map business process workflow
"/media/Dados/bases/SWDE/job/job-techcentric/0706.htm",2 years of SQL server 2005/2008 development experience
"/media/Dados/bases/SWDE/job/job-techcentric/1152.htm",Triaging issues to escalate to internal teams
"/media/Dados/bases/SWDE/job/job-techcentric/1465.htm",Respond to and resolve operational problems and adhere to service level agreements.
"/media/Dados/bases/SWDE/job/job-techcentric/0257.htm","Strong interpersonal, oral and written communication skills"
"/media/Dados/bases/SWDE/job/job-techcentric/0314.htm",Modify code to improve performance
"/media/Dados/bases/SWDE/job/job-techcentric/0775.htm","Operational support (e.g., job management, data transfer)"
"/media/Dados/bases/SWDE/job/job-techcentric/1441.htm",Has familiarity with and can write a Use Case document and use case model
"/media/Dados/bases/SWDE/job/job-techcentric/1880.htm",Experience with using Embedded SQL
"/media/Dados/bases/SWDE/job/job-techcentric/0614.htm","Experience with Veritas Volume Manager, Logical Volume Manager for the Linux operating system."
"/media/Dados/bases/SWDE/job/job-techcentric/0654.htm",PL/SQL programming is a plus
"/media/Dados/bases/SWDE/job/job-techcentric/0016.htm",Proven track record of successful design and delivery of complex technology systems in a global environment
"/media/Dados/bases/SWDE/job/job-techcentric/1756.htm","Must have hands-on experience on Web-services & Hibernate Architecture work, creating new components, libraries and related framework components."
"/media/Dados/bases/SWDE/job/job-techcentric/1831.htm",Stong Experience developing in a Unix environment: Linux or Solaris a plus
"/media/Dados/bases/SWDE/job/job-techcentric/0903.htm","Deliver service automation, business intelligence and reporting systems"
"/media/Dados/bases/SWDE/job/job-techcentric/1402.htm",Strong Windows UI knowledge
"/media/Dados/bases/SWDE/job/job-techcentric/0909.htm","Research, plan, install, configure, troubleshoot, maintain, and upgrade current systems."
"/media/Dados/bases/SWDE/job/job-techcentric/1644.htm","Participate in the complete life cycle of the project including design, development and testing through final production deployment"
"/media/Dados/bases/SWDE/job/job-techcentric/1662.htm",Responsible for performance tuning and testing of large and complex SQL in order ensure reliable performance of a system.
"/media/Dados/bases/SWDE/job/job-techcentric/0248.htm","Experience with Java, JSP, JSF, Struts,"
"/media/Dados/bases/SWDE/job/job-techcentric/1456.htm",J2EE Development including Enterprise Java Beans
"/media/Dados/bases/SWDE/job/job-techcentric/1420.htm",2 years of experience in Windows Presentation Foundation and Windows Communication Foundation ( WPF and WCF )
"/media/Dados/bases/SWDE/job/job-techcentric/0224.htm","Design, develop and maintain integration routines between PeopleSoft and non-PeopleSoft applications."
"/media/Dados/bases/SWDE/job/job-techcentric/0149.htm",Excellent documentation skills
"/media/Dados/bases/SWDE/job/job-techcentric/1578.htm",Work with and assist product teams with detailed analysis of high-level requirements to include the decomposition of requirements to the system level.
"/media/Dados/bases/SWDE/job/job-techcentric/0326.htm","Formal SQA methodologies including software development life cycles, testing processes and standards"
"/media/Dados/bases/SWDE/job/job-techcentric/1369.htm","Implement, maintain, and administer system and network performance monitoring programs."
"/media/Dados/bases/SWDE/job/job-techcentric/1857.htm",Provide Level 1 and 2 Support to Mortgage Trading and Analytics Applications
"/media/Dados/bases/SWDE/job/job-techcentric/0114.htm",Nice to have skills:
"/media/Dados/bases/SWDE/job/job-techcentric/1829.htm","At least 3 years developing using a framework (homegrown, Spring, etc.)"
"/media/Dados/bases/SWDE/job/job-techcentric/1325.htm",Reporting product anomalies when found
"/media/Dados/bases/SWDE/job/job-techcentric/0917.htm",Strong SQL/Database experience (Highly prefer Postgres SQL)
"/media/Dados/bases/SWDE/job/job-techcentric/0259.htm",Coordination and management of application updates and maintenance patches from Timelink.
"/media/Dados/bases/SWDE/job/job-techcentric/1961.htm","Provide timely and appropriate communication to business owners, stakeholders, and users on issue status and resolution"
"/media/Dados/bases/SWDE/job/job-techcentric/0106.htm",Manufacturing - Manufacturing Variance Analysis
"/media/Dados/bases/SWDE/job/job-techcentric/1255.htm",Symantec Storage Foundation
"/media/Dados/bases/SWDE/job/job-techcentric/0157.htm",Passion for high quality compliance documentation and interoperability
"/media/Dados/bases/SWDE/job/job-techcentric/1888.htm",Facelets heavily used in this group
"/media/Dados/bases/SWDE/job/job-techcentric/0077.htm",XMPP experience
"/media/Dados/bases/SWDE/job/job-techcentric/1858.htm","Escalating relevant issues to the various owners & up/down-stream groups, Lev-3 dev teams and Infrastructure group"
"/media/Dados/bases/SWDE/job/job-techcentric/1638.htm",Work with the C developers to define custom browser API extensions.
"/media/Dados/bases/SWDE/job/job-techcentric/1065.htm",Following standard practices and procedures in analyzing situations or data from which answers can be readily obtained
"/media/Dados/bases/SWDE/job/job-techcentric/1964.htm",Working experience with J2EE. Understanding of WebLogic is a plus. Should have sound understanding of Spring framework.
"/media/Dados/bases/SWDE/job/job-techcentric/1928.htm","Design, develop and maintain integration routines between PeopleSoft and non-PeopleSoft applications."
"/media/Dados/bases/SWDE/job/job-techcentric/1280.htm",Partner with other business areas within Humana to understand application requirements and develop programming specifications for development staff
"/media/Dados/bases/SWDE/job/job-techcentric/1545.htm",Respond appropriately to regulatory/legislative/competitive claims and report for statistical and management requirements.
"/media/Dados/bases/SWDE/job/job-techcentric/1976.htm",Partner with India support teams to support users across the globe
"/media/Dados/bases/SWDE/job/job-techcentric/1011.htm",Java - 7 yrs.
"/media/Dados/bases/SWDE/job/job-techcentric/0133.htm","Intermediate level skills with Adobe Flash, Adobe Photoshop, Informational Mapping, and HTML"
"/media/Dados/bases/SWDE/job/job-techcentric/1133.htm","Escalate issues encountered with the authoring and publishing platform appropriately, drive to timely resolution."
"/media/Dados/bases/SWDE/job/job-techcentric/1736.htm",Develop and test delivered software tools in accordance with ISE's software development life cycle to ensure high quality delivery
"/media/Dados/bases/SWDE/job/job-techcentric/0265.htm",Unit testing with JUnit
"/media/Dados/bases/SWDE/job/job-techcentric/1691.htm",Overall high aptitude with a wide range of JEE technologies.
"/media/Dados/bases/SWDE/job/job-techcentric/0162.htm",HTML
"/media/Dados/bases/SWDE/job/job-techcentric/1277.htm",Ability to write detailed design documents will be required as well as proficient in coding independently
"/media/Dados/bases/SWDE/job/job-techcentric/0072.htm",The ability to read and produce UML diagrams;
"/media/Dados/bases/SWDE/job/job-techcentric/0209.htm","Communication skills including facilitation, negotiation and conflict resolution"
"/media/Dados/bases/SWDE/job/job-techcentric/0908.htm",Daily build reporting
"/media/Dados/bases/SWDE/job/job-techcentric/1474.htm",Perform root cause analysis on reported software defects.
"/media/Dados/bases/SWDE/job/job-techcentric/0165.htm","Preferred, but not required, experience with AJAX, Silverlight, WCF, WPF, WinForms, SQL Server Reporting Services, and .NET certifications."
"/media/Dados/bases/SWDE/job/job-techcentric/0695.htm","Fluent in Ruby on Rails, DHTML and CSS."
"/media/Dados/bases/SWDE/job/job-techcentric/1737.htm",At least 1-2 years experience with Infragistics
"/media/Dados/bases/SWDE/job/job-techcentric/0948.htm","Demonstrate solid ability to understand, analyze, and solve problems"
"/media/Dados/bases/SWDE/job/job-techcentric/1843.htm","ASP.NET, C#, SQL Server 2005, SharePoint 2007,.NET CLR, Windows Workflow Foundation, AJAX, Telerik Controls etc..."
"/media/Dados/bases/SWDE/job/job-techcentric/0639.htm",Data Analysis and Modeling (3-5 years).
"/media/Dados/bases/SWDE/job/job-techcentric/0380.htm",Creating new reports in SQL reporting services to expose facets of the data
"/media/Dados/bases/SWDE/job/job-techcentric/1267.htm",Messaging
"/media/Dados/bases/SWDE/job/job-techcentric/1542.htm",We are unable to provide any type of visa sponsorship for this opportunity.
"/media/Dados/bases/SWDE/job/job-techcentric/0173.htm","Development experience in JSP, Java, and.NET"
"/media/Dados/bases/SWDE/job/job-techcentric/0341.htm",Application Development
"/media/Dados/bases/SWDE/job/job-techcentric/1038.htm",Estimate time effectively and manage workload to committed deadlines
"/media/Dados/bases/SWDE/job/job-techcentric/1541.htm",Use appropriate programming languages to create and modify the database systems.
"/media/Dados/bases/SWDE/job/job-techcentric/0448.htm","Lead design, development, testing and implementation efforts of integration portion of projects"
"/media/Dados/bases/SWDE/job/job-techcentric/0416.htm",You will be working on key bug fixes on the infrastructure.
"/media/Dados/bases/SWDE/job/job-techcentric/1815.htm",Web services/SOAP
"/media/Dados/bases/SWDE/job/job-techcentric/0222.htm",Review and evaluate requests to develop or modify reports
"/media/Dados/bases/SWDE/job/job-techcentric/0852.htm",Provide assistant on use of Microsoft Excel for data analysis and charting
"/media/Dados/bases/SWDE/job/job-techcentric/0970.htm",Respond to and resolve operational problems and adhere to service level agreements.
"/media/Dados/bases/SWDE/job/job-techcentric/0159.htm",User and Device Grouping
"/media/Dados/bases/SWDE/job/job-techcentric/1830.htm",Debugging and optimization of cross-platform product on Linux
"/media/Dados/bases/SWDE/job/job-techcentric/0228.htm",Migrating forms and reports from Oracle 6i to 10g and 11g
"/media/Dados/bases/SWDE/job/job-techcentric/0151.htm","Consult with and mentor other developers and contractors, both on and off shore"
"/media/Dados/bases/SWDE/job/job-techcentric/0616.htm",At least 2 years of formal education in computational science or other related field
"/media/Dados/bases/SWDE/job/job-techcentric/0445.htm",Experience with any platforms/application: Summit
"/media/Dados/bases/SWDE/job/job-techcentric/0564.htm",Clear understanding and working knowledge of EDI protocols.
"/media/Dados/bases/SWDE/job/job-techcentric/0755.htm",Subject-Matter-Expertise on ETL (particularly DataStage tool) process definition methodologies and tools
"/media/Dados/bases/SWDE/job/job-techcentric/0850.htm","Lead design, development, testing and implementation efforts of integration portion of projects"
"/media/Dados/bases/SWDE/job/job-techcentric/0005.htm",Integrate emerging technologies with Legacy systems
"/media/Dados/bases/SWDE/job/job-techcentric/1786.htm","Experience with Turnover, Abstract, CL, SQL, and various MS Tools (ex: MS Outlook, Word, etc.)."
"/media/Dados/bases/SWDE/job/job-techcentric/0213.htm",Java - 5 yrs.
"/media/Dados/bases/SWDE/job/job-techcentric/1570.htm",Strong Database fundamentals and data modeling knowledge
"/media/Dados/bases/SWDE/job/job-techcentric/1743.htm",Monitor the Black Box trading systems ensuring that stability and system startups are secure.
"/media/Dados/bases/SWDE/job/job-techcentric/0351.htm",Batch processing experience
"/media/Dados/bases/SWDE/job/job-techcentric/0615.htm",Head the development of our high profile site
"/media/Dados/bases/SWDE/job/job-techcentric/1367.htm","Implement, maintain, and administer system and network performance monitoring programs."
"/media/Dados/bases/SWDE/job/job-techcentric/1654.htm",Further improve management and automation of systems
"/media/Dados/bases/SWDE/job/job-techcentric/0074.htm",Interface with various organizations within the department to maintain current websites
"/media/Dados/bases/SWDE/job/job-techcentric/0671.htm",System audit/validation background and experience
"/media/Dados/bases/SWDE/job/job-techcentric/0252.htm",Servlets
"/media/Dados/bases/SWDE/job/job-techcentric/1471.htm",Team up with onsite as well as offshore professionals
"/media/Dados/bases/SWDE/job/job-techcentric/1552.htm",Strong familiarity with the .NET Framework version 2 required ( 3.5 and/or 4.0 a plus )
"/media/Dados/bases/SWDE/job/job-techcentric/0527.htm",Monthly review of scorecard information to identify process improvements.
"/media/Dados/bases/SWDE/job/job-techcentric/1997.htm",Linux/Unix - a must
"/media/Dados/bases/SWDE/job/job-techcentric/1968.htm","XML, XSD"
"/media/Dados/bases/SWDE/job/job-techcentric/1442.htm",Strong Windows UI knowledge
"/media/Dados/bases/SWDE/job/job-techcentric/1658.htm",Strong QA background and interest in exploratory testing
"/media/Dados/bases/SWDE/job/job-techcentric/0489.htm",This is a professional level non-supervisory position which may require coordination of programming activities being conducted by the team
"/media/Dados/bases/SWDE/job/job-techcentric/1553.htm",Strong Korn Shell and SQL Development
"/media/Dados/bases/SWDE/job/job-techcentric/1211.htm",Provide support to application owners and the Help Desk.
"/media/Dados/bases/SWDE/job/job-techcentric/1626.htm","Familiar with standard concepts, practices, and procedures within a particular field."
"/media/Dados/bases/SWDE/job/job-techcentric/0999.htm","Experience in high-performance Unix programming (Solaris & Linux), (threads, sockets), STL and ideally systems programming experience."
"/media/Dados/bases/SWDE/job/job-techcentric/0781.htm","Solid experience in .Net, Silverlight, XNA and Web services"
"/media/Dados/bases/SWDE/job/job-techcentric/1081.htm",Troubleshooting access and permission issues for custom applications / client applications
"/media/Dados/bases/SWDE/job/job-techcentric/0220.htm",Construct software based on design specifications
"/media/Dados/bases/SWDE/job/job-techcentric/0711.htm",Strong written and verbal communication skills.
"/media/Dados/bases/SWDE/job/job-techcentric/0528.htm","Ensure rigorous quality control over data, analyses and metrics, and organizational clarity and alignment for key business metrics."
"/media/Dados/bases/SWDE/job/job-techcentric/1891.htm",Experience with logical relational database design
"/media/Dados/bases/SWDE/job/job-techcentric/1469.htm",Develop knowledge of Pharmacy and all clinical programs in order to support these areas through reporting.
"/media/Dados/bases/SWDE/job/job-techcentric/0221.htm",Enterprise database platforms
"/media/Dados/bases/SWDE/job/job-techcentric/1818.htm",Test and develop programming modifications
"/media/Dados/bases/SWDE/job/job-techcentric/1532.htm",Reviews project control information to assure schedules and budgets are met.
"/media/Dados/bases/SWDE/job/job-techcentric/0109.htm",Performs other work as required or requested as well as additional assignments.
