URL,EXTRACTED VALUE
"/media/Dados/bases/SWDE/job/job-techcentric/1576.htm",We are currently looking for a Sr. C# developer for our client in St. Cloud.
"/media/Dados/bases/SWDE/job/job-techcentric/1271.htm",Responsibilities:
"/media/Dados/bases/SWDE/job/job-techcentric/1390.htm",Direct Hire Position in Sacramento
"/media/Dados/bases/SWDE/job/job-techcentric/1519.htm",Please send resume to
"/media/Dados/bases/SWDE/job/job-techcentric/1802.htm",*****************Visa Sponsorship is not available*********************
"/media/Dados/bases/SWDE/job/job-techcentric/1138.htm","We are looking for a dynamic individual that has experience designing, implementing and supporting IBM FileNet BPM system."
"/media/Dados/bases/SWDE/job/job-techcentric/0344.htm",Title: Sr. Web Developer / Analyst
