URL,EXTRACTED VALUE
"/media/Dados/bases/SWDE/job/job-techcentric/1612.htm",Ability to mentor and guide others in the use and/or development of the application
"/media/Dados/bases/SWDE/job/job-techcentric/1113.htm",Will be expected to be available for on-call response in order to provide 24x7 emergency response capabilities.
"/media/Dados/bases/SWDE/job/job-techcentric/0853.htm",Thorough knowledge of all stages of the Software Development Life Cycle.
"/media/Dados/bases/SWDE/job/job-techcentric/0220.htm",Ability to work under tight timelines in a fast-paced environment
"/media/Dados/bases/SWDE/job/job-techcentric/0207.htm","Strong familiarity with Oracle, SQL Server, Sybase database systems and reporting methodologies."
"/media/Dados/bases/SWDE/job/job-techcentric/0955.htm",Experience leading requirements gathering sessions.
"/media/Dados/bases/SWDE/job/job-techcentric/1995.htm","Strong quantitative, analytical, and reasoning skills."
"/media/Dados/bases/SWDE/job/job-techcentric/1920.htm",Ability to work under tight timelines in a fast-paced environment
