URL,EXTRACTED VALUE
"/media/Dados/bases/SWDE/job/job-techcentric/0281.htm",Assists in the definition of milestones
"/media/Dados/bases/SWDE/job/job-techcentric/1919.htm","Keeps current with new web technologies, coding standards, and best practices."
"/media/Dados/bases/SWDE/job/job-techcentric/0088.htm","Advanced debugging skill using WinDBG, Visual Studio, CDB or other debuggers (both managed and unmanaged) required"
"/media/Dados/bases/SWDE/job/job-techcentric/1031.htm","Senior level experience with J2EE, AJAX, JSP, MVC (Spring) is required."
"/media/Dados/bases/SWDE/job/job-techcentric/1212.htm","Writes detailed description of user needs, program functions, and steps required to develop or modify computer programs."
"/media/Dados/bases/SWDE/job/job-techcentric/0875.htm",Assisting in troubleshooting post-production performance issues with end user report queries
"/media/Dados/bases/SWDE/job/job-techcentric/0076.htm",General Work Experience:
"/media/Dados/bases/SWDE/job/job-techcentric/0362.htm","Utilizes and accurately interpret drawings, schematics and diagnostic/repair manuals."
"/media/Dados/bases/SWDE/job/job-techcentric/0920.htm",2+ years of VBA or .NET (prefer VB.NET)
"/media/Dados/bases/SWDE/job/job-techcentric/0287.htm",Equivalent combination of education and experience will be considered.
"/media/Dados/bases/SWDE/job/job-techcentric/0026.htm",End-to-end management of business requirements
"/media/Dados/bases/SWDE/job/job-techcentric/1475.htm",Intermediate level knowledge of Visual Studio environment
"/media/Dados/bases/SWDE/job/job-techcentric/1930.htm",Configuration of services including Windows services and web services
"/media/Dados/bases/SWDE/job/job-techcentric/1742.htm",Strong self motivation and desire for excellence
"/media/Dados/bases/SWDE/job/job-techcentric/0383.htm",Develop work estimates for projects.
"/media/Dados/bases/SWDE/job/job-techcentric/1951.htm",Education: Four year degree
"/media/Dados/bases/SWDE/job/job-techcentric/0451.htm",Create interface and system specification documents to satisfy project requirements.
"/media/Dados/bases/SWDE/job/job-techcentric/0272.htm","Expertise in Oracle, PL/SQL and stored procedures/packages."
"/media/Dados/bases/SWDE/job/job-techcentric/1472.htm",He or she must have a solid understanding of Kimball methodologies of dimensional modelling.
"/media/Dados/bases/SWDE/job/job-techcentric/0450.htm","Develops project work plans, assigns tasks, monitors efforts of other analysts and developers and reports progress as needed"
"/media/Dados/bases/SWDE/job/job-techcentric/0260.htm","Experience of Events Processing frameworks such has Esper, Tibco BusinessWorks & Aqua Logic BPM will be a plus."
"/media/Dados/bases/SWDE/job/job-techcentric/1551.htm",Expert knowledge of the SDLC and experience
"/media/Dados/bases/SWDE/job/job-techcentric/1499.htm",Experience with both 3rd and 4th normal form database design
"/media/Dados/bases/SWDE/job/job-techcentric/1527.htm","Establish project objectives, procedures, and standards. Coordinate the implementation of multiple projects with all internal end users."
"/media/Dados/bases/SWDE/job/job-techcentric/1762.htm",A huge plus would be experience in designing & developing X-Celsius dashboards using QAWS & Live Office.
"/media/Dados/bases/SWDE/job/job-techcentric/0040.htm",Experience with web server products and Servlets API
"/media/Dados/bases/SWDE/job/job-techcentric/1089.htm","UNIX-AIX, IBM WebSphere, WebLogic"
"/media/Dados/bases/SWDE/job/job-techcentric/0447.htm",Bachelor's Degree and5 or more years experience as a systems/business analyst in software development projectsfor Federal Government clients.
"/media/Dados/bases/SWDE/job/job-techcentric/1650.htm",Create interface and system specification documents to satisfy project requirements.
"/media/Dados/bases/SWDE/job/job-techcentric/0944.htm",Automate test procedures where appropriate
"/media/Dados/bases/SWDE/job/job-techcentric/0742.htm",Good communication skills
"/media/Dados/bases/SWDE/job/job-techcentric/0621.htm",Measuring site availability /Performance
"/media/Dados/bases/SWDE/job/job-techcentric/0545.htm",Two years experience supporting interfaces of a Mainframe DB2 system with various external systems such as web and file transfer protocols
"/media/Dados/bases/SWDE/job/job-techcentric/1770.htm",Proven track record of successful design and delivery of complex technology systems in a global environment
"/media/Dados/bases/SWDE/job/job-techcentric/1240.htm","Participates in Meditech installation and upgrade projects, including development of the detailed project plans"
"/media/Dados/bases/SWDE/job/job-techcentric/1027.htm",".Applies industry best-practices and regarding emerging technologies, risk mitigation, and continuity planning"
"/media/Dados/bases/SWDE/job/job-techcentric/1023.htm",MUST be able to start within 2 weeks from date of hire.
"/media/Dados/bases/SWDE/job/job-techcentric/0155.htm",.Net Framework.
"/media/Dados/bases/SWDE/job/job-techcentric/0444.htm",Streaming input may not be Real Time (faster or slower)
"/media/Dados/bases/SWDE/job/job-techcentric/0986.htm",Creates and updates the interface document that captures the interface and integration requirements on a client project.
"/media/Dados/bases/SWDE/job/job-techcentric/0449.htm","Communication including facilitation, negotiation and conflict resolution"
"/media/Dados/bases/SWDE/job/job-techcentric/0953.htm",Facets experience a plus
"/media/Dados/bases/SWDE/job/job-techcentric/1625.htm",Perform root cause analysis on reported software defects.
"/media/Dados/bases/SWDE/job/job-techcentric/1876.htm",8+ years of software development experience.
"/media/Dados/bases/SWDE/job/job-techcentric/1391.htm",Work within the Business Activity Monitor and the Business Activity Service to perform application instrumentation and business monitoring.
"/media/Dados/bases/SWDE/job/job-techcentric/0849.htm",Work closely with the internal Business Analysts to properly configure and modify the Oracle eBusiness applications in changing business environment.
"/media/Dados/bases/SWDE/job/job-techcentric/1113.htm","Monitor database performance, system utilization, configuration, growth/capacity planning"
"/media/Dados/bases/SWDE/job/job-techcentric/0104.htm",User and Device Grouping
"/media/Dados/bases/SWDE/job/job-techcentric/1865.htm",Candidate must be comfortable with working in multitasking environment with demanding users who expect things to be delivered `yesterday`
"/media/Dados/bases/SWDE/job/job-techcentric/0269.htm",Responsible for performance tuning and testing of large and complex SQL in order ensure reliable performance of a system.
"/media/Dados/bases/SWDE/job/job-techcentric/0346.htm",Business Objects
"/media/Dados/bases/SWDE/job/job-techcentric/1585.htm",Ability to write SQL queries
"/media/Dados/bases/SWDE/job/job-techcentric/0090.htm",Execute prepared unit test plans with guidance.
"/media/Dados/bases/SWDE/job/job-techcentric/1960.htm",Coordination and management of application updates and maintenance patches from Timelink.
"/media/Dados/bases/SWDE/job/job-techcentric/0299.htm",Writing queries in SQL
"/media/Dados/bases/SWDE/job/job-techcentric/1147.htm","Working knowledge of business analysis processes, techniques, and tools, with 5- 7 years of business analysis experience."
"/media/Dados/bases/SWDE/job/job-techcentric/1962.htm",Passion for high quality compliance documentation and interoperability
"/media/Dados/bases/SWDE/job/job-techcentric/0776.htm",Writing well-tuned SQL and stored procedures for Oracle or SQL Server.
"/media/Dados/bases/SWDE/job/job-techcentric/1265.htm","Experience with Turnover, Abstract, CL, SQL, and various MS Tools (ex: MS Outlook, Word, etc.)."
"/media/Dados/bases/SWDE/job/job-techcentric/0330.htm",Create and manage project schedules
"/media/Dados/bases/SWDE/job/job-techcentric/1457.htm","Knowledge of claim form(HCFA, UB04) data elements."
"/media/Dados/bases/SWDE/job/job-techcentric/0987.htm",Needs to have some EJB3/Hibernate (or other ORM experience)
"/media/Dados/bases/SWDE/job/job-techcentric/0825.htm",System development and deployment for current and upcoming projects
"/media/Dados/bases/SWDE/job/job-techcentric/0223.htm","Keeps current with new web technologies, coding standards, and best practices."
"/media/Dados/bases/SWDE/job/job-techcentric/1326.htm",Designs and performs analysis on complex programs and systems
"/media/Dados/bases/SWDE/job/job-techcentric/1915.htm",Disk space management
"/media/Dados/bases/SWDE/job/job-techcentric/0497.htm",Work with the development team to enhance and correct issues with the application
"/media/Dados/bases/SWDE/job/job-techcentric/0210.htm",Senior level experience in administrating and managing a Microsoft and Cisco enterprise environment
"/media/Dados/bases/SWDE/job/job-techcentric/1689.htm",Lead and coordinate the development and unit testing process
"/media/Dados/bases/SWDE/job/job-techcentric/0014.htm",Experience building Security Master
"/media/Dados/bases/SWDE/job/job-techcentric/1168.htm",White Box and Black Box testing
"/media/Dados/bases/SWDE/job/job-techcentric/1479.htm",Perform root cause analysis on reported software defects.
"/media/Dados/bases/SWDE/job/job-techcentric/1118.htm","Current releases of C#, ASP.NET, CSS"
"/media/Dados/bases/SWDE/job/job-techcentric/0309.htm",Monitors program execution for expected performance
"/media/Dados/bases/SWDE/job/job-techcentric/1832.htm",System and low level programming experience (prefer socket programming)
"/media/Dados/bases/SWDE/job/job-techcentric/1363.htm",Produce data-driven analysis to solve business problems. Engage in business initiatives to ensure the impact of changes will be measurable.
"/media/Dados/bases/SWDE/job/job-techcentric/0168.htm","Analysis, design and testing"
"/media/Dados/bases/SWDE/job/job-techcentric/0945.htm",Communicate and enforce best practice coding standards to maintain the excellent code quality.
"/media/Dados/bases/SWDE/job/job-techcentric/0246.htm","XML, XSD"
"/media/Dados/bases/SWDE/job/job-techcentric/1117.htm",C#
"/media/Dados/bases/SWDE/job/job-techcentric/1115.htm",Develop new device drivers as required by electronic and mechanical designs.
"/media/Dados/bases/SWDE/job/job-techcentric/1281.htm",A huge plus would be experience in designing & developing X-Celsius dashboards using QAWS & Live Office.
"/media/Dados/bases/SWDE/job/job-techcentric/0249.htm",Custom processing and packages designed as enhancements to standard EPM product
"/media/Dados/bases/SWDE/job/job-techcentric/1497.htm",Detailed oriented
"/media/Dados/bases/SWDE/job/job-techcentric/1467.htm","Must demonstrate above average knowledge of ERW/UBE coding, OMW usage, NER design, Business Function troubleshooting and analysis and SQL"
"/media/Dados/bases/SWDE/job/job-techcentric/0669.htm","Participates in Meditech installation and upgrade projects, including development of the detailed project plans"
"/media/Dados/bases/SWDE/job/job-techcentric/1757.htm",Prioritize defects and enhancement requests from business partners
"/media/Dados/bases/SWDE/job/job-techcentric/1920.htm",Construct software based on design specifications
"/media/Dados/bases/SWDE/job/job-techcentric/1712.htm",Active Directory
"/media/Dados/bases/SWDE/job/job-techcentric/0098.htm","XML, DHTML"
"/media/Dados/bases/SWDE/job/job-techcentric/1120.htm",5+ years.NET experience
"/media/Dados/bases/SWDE/job/job-techcentric/0389.htm",Document defects/problems and works to resolve them; reports progress on problem resolution to management
"/media/Dados/bases/SWDE/job/job-techcentric/0306.htm","Collaborate with PM, Software Development Managers and operations staff."
"/media/Dados/bases/SWDE/job/job-techcentric/1488.htm",Manage the testing and release of documentation deliverables
"/media/Dados/bases/SWDE/job/job-techcentric/0933.htm",Perl Scripting
"/media/Dados/bases/SWDE/job/job-techcentric/1606.htm",Understand and interact with AS/400-based systems
"/media/Dados/bases/SWDE/job/job-techcentric/1314.htm","delivering training programs through various modes such as: instructor-led, virtual class, web-cast, or web-based."
"/media/Dados/bases/SWDE/job/job-techcentric/1816.htm",Experience building Security Master
"/media/Dados/bases/SWDE/job/job-techcentric/0859.htm","Cobol, Unix, TSO, MVS, VSAM, and JCL."
"/media/Dados/bases/SWDE/job/job-techcentric/0093.htm",Perform software troubleshooting.
"/media/Dados/bases/SWDE/job/job-techcentric/1600.htm",Strong self motivation and desire for excellence
