URL,EXTRACTED VALUE
"/media/Dados/bases/SWDE/job/job-techcentric/1756.htm","Must have hands-on experience on Web-services & Hibernate Architecture work, creating new components, libraries and related framework components."
"/media/Dados/bases/SWDE/job/job-techcentric/0497.htm",Work with the development team to enhance and correct issues with the application
"/media/Dados/bases/SWDE/job/job-techcentric/0620.htm",Web Services
"/media/Dados/bases/SWDE/job/job-techcentric/0389.htm",Document defects/problems and works to resolve them; reports progress on problem resolution to management
"/media/Dados/bases/SWDE/job/job-techcentric/0269.htm",Responsible for performance tuning and testing of large and complex SQL in order ensure reliable performance of a system.
"/media/Dados/bases/SWDE/job/job-techcentric/1662.htm",Responsible for performance tuning and testing of large and complex SQL in order ensure reliable performance of a system.
"/media/Dados/bases/SWDE/job/job-techcentric/0151.htm","Consult with and mentor other developers and contractors, both on and off shore"
"/media/Dados/bases/SWDE/job/job-techcentric/1977.htm",Unix/Linux environment experience required.
