URL,EXTRACTED VALUE
"/media/Dados/bases/SWDE/job/job-techcentric/1357.htm","Excellent salary, benefits program."
"/media/Dados/bases/SWDE/job/job-techcentric/0081.htm",5) Fully documents all programs written or revised.
"/media/Dados/bases/SWDE/job/job-techcentric/0412.htm",Verify connectivity from Flextrade to the clients trade desk.
"/media/Dados/bases/SWDE/job/job-techcentric/0782.htm",Role:
"/media/Dados/bases/SWDE/job/job-techcentric/0137.htm",Knowledge of information standards and technologies.
"/media/Dados/bases/SWDE/job/job-techcentric/1822.htm","Excellent salary, benefits program."
"/media/Dados/bases/SWDE/job/job-techcentric/1223.htm","Excellent salary, benefits program."
"/media/Dados/bases/SWDE/job/job-techcentric/1516.htm",Serves as back-up for manager.
"/media/Dados/bases/SWDE/job/job-techcentric/0557.htm",Bachelors Degree in Computer Science or equivalent
