URL,EXTRACTED VALUE
"/media/Dados/bases/SWDE/job/job-jobtarget/0013.htm",Excellent teamwork skills with the proven ability to influence cross-functional teams
"/media/Dados/bases/SWDE/job/job-jobtarget/1694.htm",Ability to blend user requirements and interests into satisfactory and acceptable solutions
"/media/Dados/bases/SWDE/job/job-jobtarget/0103.htm","Strong conceptual, analytical, and problem-solving abilities"
"/media/Dados/bases/SWDE/job/job-jobtarget/0673.htm",High Aptitude
"/media/Dados/bases/SWDE/job/job-jobtarget/0378.htm",Negotiate with marketing teams
"/media/Dados/bases/SWDE/job/job-jobtarget/1196.htm",Strong problem solver
"/media/Dados/bases/SWDE/job/job-jobtarget/1534.htm",Responds to various requests for payroll reports and data from all internal and external sources
"/media/Dados/bases/SWDE/job/job-jobtarget/0101.htm",Familiar with Industrial Automation (IA) equipment.
"/media/Dados/bases/SWDE/job/job-jobtarget/1153.htm",Able to handle multiple projects and conflicting priorities.
