URL,EXTRACTED VALUE
"/media/Dados/bases/SWDE/job/job-jobtarget/1856.htm","Develop training programs, individually and in conjunction with an Instructional Designer."
"/media/Dados/bases/SWDE/job/job-jobtarget/0339.htm",Assist with scoping Storage Services engagements in support of Statement of Work and Proposal response preparation.
"/media/Dados/bases/SWDE/job/job-jobtarget/1270.htm",refine and evolve our mobile product roadmap
"/media/Dados/bases/SWDE/job/job-jobtarget/0455.htm",Responsible for level 1 and 2 support for SAP applications in the Plan to Produce area
"/media/Dados/bases/SWDE/job/job-jobtarget/1420.htm",Develop Corporate Screening's message and strategic marketing direction for maximum revenue growth.
"/media/Dados/bases/SWDE/job/job-jobtarget/0536.htm",Software Development and testing
"/media/Dados/bases/SWDE/job/job-jobtarget/1536.htm","Proven experience in the design, construction and operation of large multidisciplinary projects involving large scale components and complex systems."
"/media/Dados/bases/SWDE/job/job-jobtarget/0588.htm",BS in Computer Science or a related field. MS highly desired.
"/media/Dados/bases/SWDE/job/job-jobtarget/1103.htm",Respond to all customer inquiries in a professional and timely manner.
"/media/Dados/bases/SWDE/job/job-jobtarget/1111.htm",Respond to all customer inquiries in a professional and timely manner.
"/media/Dados/bases/SWDE/job/job-jobtarget/0048.htm",BS degree in Education or related field/Masters preferred
"/media/Dados/bases/SWDE/job/job-jobtarget/0250.htm",Develop solutions and design interfaces for High Availability of Matrix and Cloud operating environments.
"/media/Dados/bases/SWDE/job/job-jobtarget/1641.htm",Working more independently and from a standard protocol to respond to customer issues.
"/media/Dados/bases/SWDE/job/job-jobtarget/1232.htm",Adheres to Flagstar Bank operations procedures and guidelines.
"/media/Dados/bases/SWDE/job/job-jobtarget/1997.htm","Work with business and technology groups to finalize definition of all user, group access needs to DB and network resources"
"/media/Dados/bases/SWDE/job/job-jobtarget/1637.htm",We are recognized as a global leader in our sector
"/media/Dados/bases/SWDE/job/job-jobtarget/0085.htm",Ability to manage an engineering team who is dedicated to delivering the highest quality possible
"/media/Dados/bases/SWDE/job/job-jobtarget/1183.htm","quickly assimilate and implement desired work objectives,"
"/media/Dados/bases/SWDE/job/job-jobtarget/1962.htm","Consults with clients on requirements, processes and issues"
"/media/Dados/bases/SWDE/job/job-jobtarget/0871.htm",Establish documentation needs and obtain product knowledge with the developers
"/media/Dados/bases/SWDE/job/job-jobtarget/1548.htm",Must perform well as part of a development team.
"/media/Dados/bases/SWDE/job/job-jobtarget/1244.htm",Identify business requirements for Master Data as it relates to the scope of ITS
"/media/Dados/bases/SWDE/job/job-jobtarget/1685.htm",BS/MS Computer Science or equivalent
"/media/Dados/bases/SWDE/job/job-jobtarget/0780.htm","Test production and delivery, both Computer-based and Hard-copy"
"/media/Dados/bases/SWDE/job/job-jobtarget/1455.htm",Perform market and competitive research to develop sound product strategies and business cases
"/media/Dados/bases/SWDE/job/job-jobtarget/1945.htm","Determine needs, develop plans, and help prioritize training and development requirements across the corporation"
"/media/Dados/bases/SWDE/job/job-jobtarget/0765.htm",Realize your potential as a member of a supportive team that demonstrates the utmost professionalism
"/media/Dados/bases/SWDE/job/job-jobtarget/1982.htm",Participates as a member of development team.
"/media/Dados/bases/SWDE/job/job-jobtarget/1890.htm","Build monthly release roadmaps representing all assets; aligning project releases, oSRs, eSRs, warranty fixes and emergency RFC's to release windows"
"/media/Dados/bases/SWDE/job/job-jobtarget/0789.htm",Provide technical direction onsite for customers
"/media/Dados/bases/SWDE/job/job-jobtarget/1116.htm",Respond to all customer inquiries in a professional and timely manner.
"/media/Dados/bases/SWDE/job/job-jobtarget/0286.htm","Conduct, interpret, and report the results of educational policy research."
"/media/Dados/bases/SWDE/job/job-jobtarget/1036.htm",Working with the customer to identify key business intelligence needs in the organization
"/media/Dados/bases/SWDE/job/job-jobtarget/1184.htm",Several years hands on experience working with FM
"/media/Dados/bases/SWDE/job/job-jobtarget/0671.htm",1+ yr of experience in the input of Clinical Quality Data
"/media/Dados/bases/SWDE/job/job-jobtarget/1056.htm","Audits mortgage loans, using various methods to validate underwriting and detect possible misrepresentation of information."
"/media/Dados/bases/SWDE/job/job-jobtarget/1734.htm",Development and design of interfaces within the SAP environment or from non SAP Systems to SAP systems
"/media/Dados/bases/SWDE/job/job-jobtarget/1631.htm",Responsible for level 1 and 2 support for SAP applications in the RTR area
"/media/Dados/bases/SWDE/job/job-jobtarget/1610.htm",Increase market share and generate revenue
"/media/Dados/bases/SWDE/job/job-jobtarget/0023.htm",Participates as a member of development team or teams; may lead a small development team.
"/media/Dados/bases/SWDE/job/job-jobtarget/0075.htm",Participates as a member of and leads development teams.
"/media/Dados/bases/SWDE/job/job-jobtarget/1543.htm",Be the primary customer interface for the overall Program
"/media/Dados/bases/SWDE/job/job-jobtarget/1794.htm",Design and implement both manual & automated tests against a 3-tier web based application.
"/media/Dados/bases/SWDE/job/job-jobtarget/1097.htm",Respond to all customer inquiries in a professional and timely manner.
"/media/Dados/bases/SWDE/job/job-jobtarget/1118.htm",Respond to all customer inquiries in a professional and timely manner.
"/media/Dados/bases/SWDE/job/job-jobtarget/1027.htm",Assists in the development of the company's annual operating budget.
"/media/Dados/bases/SWDE/job/job-jobtarget/0097.htm","Entrepreneurial desire to build amazing products, sense of ownership and urgency."
"/media/Dados/bases/SWDE/job/job-jobtarget/1126.htm",Respond to all customer inquiries in a professional and timely manner.
"/media/Dados/bases/SWDE/job/job-jobtarget/0576.htm",North Coast 99 (Top 99 Companies to work for in Northeast Ohio)
"/media/Dados/bases/SWDE/job/job-jobtarget/1815.htm",Leads and/or directs the efforts of specialists on project(s).
"/media/Dados/bases/SWDE/job/job-jobtarget/0757.htm",North Coast 99 (Top 99 Companies to work for in Northeast Ohio)
"/media/Dados/bases/SWDE/job/job-jobtarget/1179.htm",- Associates Degree
"/media/Dados/bases/SWDE/job/job-jobtarget/1061.htm",Respond to all customer inquiries in a professional and timely manner.
"/media/Dados/bases/SWDE/job/job-jobtarget/1821.htm",On-site at the Pontiac Michigan Call Center 5 days a week is a requirement.
"/media/Dados/bases/SWDE/job/job-jobtarget/1059.htm",High school diploma required.
"/media/Dados/bases/SWDE/job/job-jobtarget/1138.htm",BS in Computer Science or a related field. MS highly desired.
"/media/Dados/bases/SWDE/job/job-jobtarget/0706.htm",Standardizing and simplifying of our clients finance processes
"/media/Dados/bases/SWDE/job/job-jobtarget/1530.htm","Track all incoming money (cash and checks), photocopies and/or scans and files to appropriate"
"/media/Dados/bases/SWDE/job/job-jobtarget/1127.htm",Respond to all customer inquiries in a professional and timely manner.
"/media/Dados/bases/SWDE/job/job-jobtarget/1048.htm",Provide L3/l4 Level HP-UX/Linux system administrative support for HP Business
"/media/Dados/bases/SWDE/job/job-jobtarget/1046.htm",University or Bachelor's degree
"/media/Dados/bases/SWDE/job/job-jobtarget/1883.htm",Proactively seek out new sales opportunities by developing new and existing technical relationships within accounts and prospects.
"/media/Dados/bases/SWDE/job/job-jobtarget/0039.htm",Participates as a member of development team or teams.
"/media/Dados/bases/SWDE/job/job-jobtarget/0779.htm",Will be relied upon to perform a variety of engineering and design activities involving power plant upgrades and/or new power plant projects.
"/media/Dados/bases/SWDE/job/job-jobtarget/1735.htm",Develop and integrate UI solutions and design interfaces for HP's Converged Infrastructure.
"/media/Dados/bases/SWDE/job/job-jobtarget/1882.htm",Take incoming calls from customers and provide appropriate assistance;
"/media/Dados/bases/SWDE/job/job-jobtarget/0929.htm",Meet/Increase sales quotas at existing customers though exceptional sales support as well as the introduction of new/existing products and services.
"/media/Dados/bases/SWDE/job/job-jobtarget/1233.htm",Adheres to Flagstar Bank operations procedures and guidelines.
"/media/Dados/bases/SWDE/job/job-jobtarget/1782.htm",Participates as a member of Testing team as well as lead Testing Teams.
"/media/Dados/bases/SWDE/job/job-jobtarget/1122.htm",Respond to all customer inquiries in a professional and timely manner.
"/media/Dados/bases/SWDE/job/job-jobtarget/1808.htm","Write production quality code that is maintainable, easy to troubleshoot, and efficient"
"/media/Dados/bases/SWDE/job/job-jobtarget/0307.htm",Software Development Lead for the Development of Space Exploration Sensors:
"/media/Dados/bases/SWDE/job/job-jobtarget/1837.htm",At least 5 years experience in IT support
"/media/Dados/bases/SWDE/job/job-jobtarget/1282.htm","reviewing and verifying the accuracy of monthly, quarterly, and annual financial statements prepared by the Bookkeeper;"
"/media/Dados/bases/SWDE/job/job-jobtarget/0583.htm",Ensures confidentiality of sensitive and proprietary information; adheres to company security policies.
"/media/Dados/bases/SWDE/job/job-jobtarget/0903.htm",Conducts research and analysis of various issues;
"/media/Dados/bases/SWDE/job/job-jobtarget/0185.htm",Working knowledge of FAA Air Traffic Management applications which are used to implement Traffic Management
"/media/Dados/bases/SWDE/job/job-jobtarget/0387.htm","Assist in gathering data, responding to questions, and preparing reports on a regular basis"
"/media/Dados/bases/SWDE/job/job-jobtarget/1820.htm",Formulate and define system scope and objectives using knowledge of information technology and industry knowledge/requirements.
"/media/Dados/bases/SWDE/job/job-jobtarget/1642.htm",Responsible for closing business and achieving/exceeding annual quota.
"/media/Dados/bases/SWDE/job/job-jobtarget/1058.htm",Respond to all customer inquiries in a professional and timely manner.
"/media/Dados/bases/SWDE/job/job-jobtarget/1655.htm",RHIT
"/media/Dados/bases/SWDE/job/job-jobtarget/1057.htm",Provide imaging expertise in MRI and other modalities as a translational readout for preclinical studies in animal models of MS.
"/media/Dados/bases/SWDE/job/job-jobtarget/1281.htm",Manage campus student finance operations to ensure financial compliance with company objectives and Federal/State regulations.
"/media/Dados/bases/SWDE/job/job-jobtarget/0904.htm",Conducts research and analysis of various issues;
"/media/Dados/bases/SWDE/job/job-jobtarget/0905.htm","Must be a functional expert on financial aid management systems, awarding requirements and federal Title IV aid compliance."
"/media/Dados/bases/SWDE/job/job-jobtarget/1121.htm",Respond to all customer inquiries in a professional and timely manner.
"/media/Dados/bases/SWDE/job/job-jobtarget/0143.htm","Demonstrated time and project management skills, and the ability to work consultatively as part of a team are preferred."
"/media/Dados/bases/SWDE/job/job-jobtarget/0865.htm","Bachelor degree in engineering, business administration or related field required. Advanced degree preferred."
"/media/Dados/bases/SWDE/job/job-jobtarget/1200.htm","Works with global functions/business units, region teams, group-level operations, and other HP business teams to develop long-term strategic plans."
"/media/Dados/bases/SWDE/job/job-jobtarget/1675.htm",MD or equivalent with several years of inpatient and/or outpatient experience
"/media/Dados/bases/SWDE/job/job-jobtarget/0076.htm","Acquires and applies broad knowledge of the business, its products, and processes."
"/media/Dados/bases/SWDE/job/job-jobtarget/1330.htm","Improve our emails opens, click-throughs, deliverability and more"
"/media/Dados/bases/SWDE/job/job-jobtarget/1596.htm",Multi-state income taxes
"/media/Dados/bases/SWDE/job/job-jobtarget/0610.htm","Preparation of Individual and Corporation Income Tax Returns; working knowledge of Lacerte Software is required,"
"/media/Dados/bases/SWDE/job/job-jobtarget/0847.htm",design and programming of PLC systems
"/media/Dados/bases/SWDE/job/job-jobtarget/1552.htm","Bachelor's degree in information systems, computer science or related field (or equivalent)"
"/media/Dados/bases/SWDE/job/job-jobtarget/1510.htm",Working as part of a multi-geography project team across multiple programs contributing to:
"/media/Dados/bases/SWDE/job/job-jobtarget/1541.htm",Performs varied and general tasks of a transactional nature involving the manufacturing process while using independent judgment.
"/media/Dados/bases/SWDE/job/job-jobtarget/1931.htm",Provides input to the development and/or modification of portfolio offers based on extensive business development contacts and experience
"/media/Dados/bases/SWDE/job/job-jobtarget/1361.htm",Development and delivery of GI reports to clients and prospects
"/media/Dados/bases/SWDE/job/job-jobtarget/1796.htm","Supports the deployment of ERA system hardware, software, and network at the data center facility"
"/media/Dados/bases/SWDE/job/job-jobtarget/1751.htm","Compiling and analyzing real-time safety-critical data, historical data, and analysis reports for ATO Office of Safety"
"/media/Dados/bases/SWDE/job/job-jobtarget/0589.htm",BS in Computer Science or equivalent
"/media/Dados/bases/SWDE/job/job-jobtarget/1359.htm",Accounts Payable input and reconciliation
"/media/Dados/bases/SWDE/job/job-jobtarget/0822.htm",North Coast 99 (Top 99 Companies to work for in Northeast Ohio)
"/media/Dados/bases/SWDE/job/job-jobtarget/0927.htm",Obtain and maintain a thorough understanding of the financial reporting and general ledger structure
"/media/Dados/bases/SWDE/job/job-jobtarget/0837.htm",Serves in a leadership role to develop a system-wide privacy program as part of the system's compliance program.
"/media/Dados/bases/SWDE/job/job-jobtarget/1325.htm",0-2 years prior experience in public accounting or similar role
"/media/Dados/bases/SWDE/job/job-jobtarget/1167.htm","Resonsible for generating sales and supporting the sales efforts of others leveraging product/services, industry, and/or technology expertise."
"/media/Dados/bases/SWDE/job/job-jobtarget/1573.htm","Implementation an development of standard and individual SAP software components, extensions or modules"
"/media/Dados/bases/SWDE/job/job-jobtarget/1698.htm",Creating the vision and road map for PV&V Automation for Desktop and Web Application project types
"/media/Dados/bases/SWDE/job/job-jobtarget/1607.htm",a high school diploma; fair housing training; IREM or Apt Assn designation
"/media/Dados/bases/SWDE/job/job-jobtarget/1070.htm",Bachelor's Degree required
"/media/Dados/bases/SWDE/job/job-jobtarget/0517.htm",Plan and manage a software application roadmap for select HP business notebook internally developed Professional Innovation applications and 3
"/media/Dados/bases/SWDE/job/job-jobtarget/0987.htm",Experience with the architecting and designing of Virtual Desktop Infrastructure projects
"/media/Dados/bases/SWDE/job/job-jobtarget/0397.htm",- Bachelors Degree
"/media/Dados/bases/SWDE/job/job-jobtarget/1972.htm",Develop high speed Fiber Optic systems for characterization and Fiber optic modules
"/media/Dados/bases/SWDE/job/job-jobtarget/0839.htm",Direct contact with various company personnel to assure proper underwriting procedures.
"/media/Dados/bases/SWDE/job/job-jobtarget/1017.htm",Significant development experience in C/C++ or Java
"/media/Dados/bases/SWDE/job/job-jobtarget/0399.htm",- Bachelors Degree
"/media/Dados/bases/SWDE/job/job-jobtarget/0068.htm",Participates as a member of development team or teams; may lead a small development team.
"/media/Dados/bases/SWDE/job/job-jobtarget/1432.htm",Maintains a thorough knowledge of the organization and adheres to all organizational standards. Manage CONTAX IT systems
"/media/Dados/bases/SWDE/job/job-jobtarget/1498.htm","SME level experience covering the architecture, design, implementation and support of Sharepoint technologies"
"/media/Dados/bases/SWDE/job/job-jobtarget/1137.htm","Participate in planning, creation, and implementation of new product features."
"/media/Dados/bases/SWDE/job/job-jobtarget/1278.htm",distributed systems and networks
"/media/Dados/bases/SWDE/job/job-jobtarget/1102.htm",Respond to all customer inquiries in a professional and timely manner.
"/media/Dados/bases/SWDE/job/job-jobtarget/1044.htm",Coordinates/Owns account plans for strategic commercial accounts in the account planning process
"/media/Dados/bases/SWDE/job/job-jobtarget/0838.htm","Provide IP legal review, as needed, of all agreements including licenses, user agreements, CRADAs, WFOs, NDAs and MTA."
"/media/Dados/bases/SWDE/job/job-jobtarget/1842.htm",Excellent analytical and problem solving skills
"/media/Dados/bases/SWDE/job/job-jobtarget/0794.htm",Knowledge of SAP Netweaver
"/media/Dados/bases/SWDE/job/job-jobtarget/1951.htm","Bachelor's or Master's degree in a technical discipline (e.g. Computer Science, Electrical or Computer Engineering) or equivalent experience."
"/media/Dados/bases/SWDE/job/job-jobtarget/1756.htm",Creating release builds of the P4000 SAN/iQ software.
"/media/Dados/bases/SWDE/job/job-jobtarget/1191.htm","Handle all materials received in the Mail Center [receive, review, receipt, document, process, prepare, identify, separate, deliver, transport, etc.]."
"/media/Dados/bases/SWDE/job/job-jobtarget/1797.htm",Create and sustain a work environment that employees want to be part of
"/media/Dados/bases/SWDE/job/job-jobtarget/0263.htm","Develop, coordinate, and manage exhibit device elements and projects"
"/media/Dados/bases/SWDE/job/job-jobtarget/0041.htm",Develops long term sales pipeline to increase HP's market share in specialized area.
"/media/Dados/bases/SWDE/job/job-jobtarget/1177.htm",- Associates Degree
"/media/Dados/bases/SWDE/job/job-jobtarget/0089.htm",Monitoring system health and performance;
