URL,EXTRACTED VALUE
"/media/Dados/bases/SWDE/job/job-jobtarget/1147.htm",Implements process refinement and improvement by applying a developing understanding of internal business processes and policies.
"/media/Dados/bases/SWDE/job/job-jobtarget/1027.htm","Works with Sales & Operations Organizations by providing analytical support through sales forecasting, performance metrics, and ad hoc analyses."
"/media/Dados/bases/SWDE/job/job-jobtarget/0097.htm",Open to agile software development methods
"/media/Dados/bases/SWDE/job/job-jobtarget/0576.htm",Deloitte & Touche Technology Fast 500
"/media/Dados/bases/SWDE/job/job-jobtarget/0757.htm",Deloitte & Touche Technology Fast 500
"/media/Dados/bases/SWDE/job/job-jobtarget/1821.htm",Participates in code reviews. Prepares and executes unit tests.
"/media/Dados/bases/SWDE/job/job-jobtarget/1059.htm",Call center experience preferred.
"/media/Dados/bases/SWDE/job/job-jobtarget/1613.htm",Assist CFO with year-end tasks (audit and review of K-1s).
"/media/Dados/bases/SWDE/job/job-jobtarget/1138.htm",Knowledge of OOP design concepts and design patterns with strong computer science fundamentals
"/media/Dados/bases/SWDE/job/job-jobtarget/0706.htm","Strengthening Performance Management, Budgeting and Forecasting Capabilities"
"/media/Dados/bases/SWDE/job/job-jobtarget/0505.htm","Contribute to the identification, definition, implementation, and continuous improvements of GOC's processes."
"/media/Dados/bases/SWDE/job/job-jobtarget/1048.htm","Use ITSM methodologies for Change Management, Problem Management, Configuration Management and Capacity Management."
"/media/Dados/bases/SWDE/job/job-jobtarget/1046.htm",Extensive selling experience within industry and on similar products.
"/media/Dados/bases/SWDE/job/job-jobtarget/1883.htm",Support and represent Vivísimo at partner seminars and industry trade shows.
"/media/Dados/bases/SWDE/job/job-jobtarget/0039.htm",Develops independently; participates in code reviews and may lead code reviews. May lead and provide mentoring and guidance to less senior developers.
"/media/Dados/bases/SWDE/job/job-jobtarget/0779.htm",Possess superior technical knowledge of electrical discipline.
"/media/Dados/bases/SWDE/job/job-jobtarget/1735.htm",Identify dependencies and requirements for ongoing development.
"/media/Dados/bases/SWDE/job/job-jobtarget/1882.htm",Make online presentations to current and potential customers;
"/media/Dados/bases/SWDE/job/job-jobtarget/1429.htm",Schedule and coordinate program meetings.
"/media/Dados/bases/SWDE/job/job-jobtarget/1135.htm",Develop oversee and conduct preventative maintenance as required for the building and its systems/equipment
"/media/Dados/bases/SWDE/job/job-jobtarget/1233.htm",Educates customers about the solutions Flagstar has to offer in a professional and knowledgeable manner.
"/media/Dados/bases/SWDE/job/job-jobtarget/1782.htm",Understands and recommends the use of the appropriate automated testing tools.
"/media/Dados/bases/SWDE/job/job-jobtarget/1808.htm",Conduct “train the trainer” style training presentations to other employees
"/media/Dados/bases/SWDE/job/job-jobtarget/1837.htm",Knowledge of database design concepts and the software life cycle
"/media/Dados/bases/SWDE/job/job-jobtarget/1476.htm",Ability to perform tax account reconciliations; return to tax provision analysis and true-ups
"/media/Dados/bases/SWDE/job/job-jobtarget/1282.htm",ensuring that Northern Plains' Internal Controls are followed;
"/media/Dados/bases/SWDE/job/job-jobtarget/0583.htm","Assist in preparation of well-written documents for technical staff, internal/external customers, and management."
"/media/Dados/bases/SWDE/job/job-jobtarget/0903.htm",Collaborates and coordinates with multiple units of the Foundation in order to gather and evaluate data for recommendations to the vice presidents;
"/media/Dados/bases/SWDE/job/job-jobtarget/0387.htm",Develop excel files; utilize queries and formulas
"/media/Dados/bases/SWDE/job/job-jobtarget/1820.htm","Support and conduct visualization, user experience and configuration elements of solution design."
"/media/Dados/bases/SWDE/job/job-jobtarget/1642.htm",Maintain knowledge of competitors in accounts to strategically position HP's products and services better.
"/media/Dados/bases/SWDE/job/job-jobtarget/1655.htm",LPN or RN with case management or coding experience in an acute care setting
"/media/Dados/bases/SWDE/job/job-jobtarget/1057.htm","Collaborate with neurobiologists in the generation of novel animal models, imaging biomarkers, and drug efficacy read-outs."
"/media/Dados/bases/SWDE/job/job-jobtarget/1281.htm","Monitors all student finance activities to ensure timely file processing, billing, funding and collections."
"/media/Dados/bases/SWDE/job/job-jobtarget/0904.htm",Collaborates and coordinates with multiple units of the Foundation in order to gather and evaluate data for recommendations to the vice presidents;
"/media/Dados/bases/SWDE/job/job-jobtarget/0905.htm","Keep commitments, meet deadlines and achieve demanding results"
"/media/Dados/bases/SWDE/job/job-jobtarget/0865.htm","Superior level of knowledge of the regulatory environment including workplace safety requirements, and environmental regulations and codes"
"/media/Dados/bases/SWDE/job/job-jobtarget/1675.htm",EMR experience required; experience with Epic EMR a plus
"/media/Dados/bases/SWDE/job/job-jobtarget/1330.htm",Improve website and landing pages for maximum conversions
"/media/Dados/bases/SWDE/job/job-jobtarget/0610.htm",Preparation of payroll and sales tax returns.
"/media/Dados/bases/SWDE/job/job-jobtarget/1875.htm",Lead a team of recruiting managers and recruiters
"/media/Dados/bases/SWDE/job/job-jobtarget/0523.htm",Broader services policy compliance & implementation of other services related accounting policies.
"/media/Dados/bases/SWDE/job/job-jobtarget/1039.htm","Provide combustion turbine interface knowledge and expertise to management, product line engineers and suppliers to accomplish assignment."
"/media/Dados/bases/SWDE/job/job-jobtarget/0847.htm",cooperation with manufacturing and system development to ensure feasibility of the design
"/media/Dados/bases/SWDE/job/job-jobtarget/1448.htm",Demonstrated organizational and leadership skills.
"/media/Dados/bases/SWDE/job/job-jobtarget/0081.htm","Create purchase orders, sales orders, invoices, promotional codes, check requests, and other accounting documents"
"/media/Dados/bases/SWDE/job/job-jobtarget/1931.htm",Customizes global offers to ensure optimum fit with local requirements
"/media/Dados/bases/SWDE/job/job-jobtarget/1541.htm",Supports the training of new employees.
"/media/Dados/bases/SWDE/job/job-jobtarget/1361.htm",Manage current and future reporting strategy to ensure competitive positioning in the marketplace
"/media/Dados/bases/SWDE/job/job-jobtarget/0482.htm",Maintenance of fiber optic systems.
"/media/Dados/bases/SWDE/job/job-jobtarget/0225.htm","Handling all logistics of the video recording, including making sure authors are prepared prior to recording."
"/media/Dados/bases/SWDE/job/job-jobtarget/1796.htm",Conducts diagnoses and repairs problems
"/media/Dados/bases/SWDE/job/job-jobtarget/1751.htm","Understanding current FAA data analysis, data sources, and requirements to provide recommended changes to improve timely access to data"
"/media/Dados/bases/SWDE/job/job-jobtarget/1359.htm","Prepare and post monthly closing entries, including depreciation, expense allocations, deferrals and accruals"
"/media/Dados/bases/SWDE/job/job-jobtarget/0927.htm",Supports budgeting and forecasting activities.
"/media/Dados/bases/SWDE/job/job-jobtarget/0822.htm",Deloitte & Touche Technology Fast 500
"/media/Dados/bases/SWDE/job/job-jobtarget/0837.htm","Assesses, evaluates, implements, maintains, and updates CCHHS information privacy policies and procedures."
"/media/Dados/bases/SWDE/job/job-jobtarget/1325.htm",Strong financial systems background; familiarity with QuickBooks a plus
"/media/Dados/bases/SWDE/job/job-jobtarget/1836.htm","Strong leadership, management, and program management skills"
"/media/Dados/bases/SWDE/job/job-jobtarget/1410.htm",Strong computer skills - Word
"/media/Dados/bases/SWDE/job/job-jobtarget/1698.htm",Mitigating roadblocks for the successful implementation of Automation for Desktop and Web Application products
"/media/Dados/bases/SWDE/job/job-jobtarget/1607.htm","able to analyze computerized rent rolls, receivable and payable reports and monthly financials"
"/media/Dados/bases/SWDE/job/job-jobtarget/1070.htm",Demonstrated expertise in effective communication to audiences of varying size-through print and electronic media and in person
"/media/Dados/bases/SWDE/job/job-jobtarget/0517.htm","Manage the product life cycle from strategic planning to tactical activities, including gathering requirements and driving cross-functional efforts."
"/media/Dados/bases/SWDE/job/job-jobtarget/0276.htm","Experience with Visual Studio 2003, 2005, or 2008"
"/media/Dados/bases/SWDE/job/job-jobtarget/0987.htm",Implementation experience with leading a project for the rollout of desktop upgrades
"/media/Dados/bases/SWDE/job/job-jobtarget/1972.htm",Design test boards and other hardware needed to integrate test systems
"/media/Dados/bases/SWDE/job/job-jobtarget/1017.htm",User Interface design knowledge
"/media/Dados/bases/SWDE/job/job-jobtarget/0068.htm",Develops independently; participates in code reviews and may lead code reviews. May lead and provide mentoring and guidance to less senior developers.
"/media/Dados/bases/SWDE/job/job-jobtarget/1432.htm",Work with resource managers to engage CONTAX professional services staff to work on CONTAX IT systems and processes as required
"/media/Dados/bases/SWDE/job/job-jobtarget/1498.htm",Strong analytical and problem solving abilities
"/media/Dados/bases/SWDE/job/job-jobtarget/1288.htm",Understand and abide by escalation procedures and interdepartmental policies
"/media/Dados/bases/SWDE/job/job-jobtarget/1137.htm",Work with cross-functional teams creating joint solutions using agile development process.
"/media/Dados/bases/SWDE/job/job-jobtarget/1278.htm",data centers and cloud computing
"/media/Dados/bases/SWDE/job/job-jobtarget/1842.htm",Ability to effectively handle multiple priorities
"/media/Dados/bases/SWDE/job/job-jobtarget/0794.htm",Experience of SAP EP
"/media/Dados/bases/SWDE/job/job-jobtarget/1951.htm","Developing and maintaining complex systems with numerous working components and multi-step processes in a distributed, multi-tiered design"
"/media/Dados/bases/SWDE/job/job-jobtarget/1756.htm",Executing and monitoring automated build testing to ensure quality prior to builds being released to test.
"/media/Dados/bases/SWDE/job/job-jobtarget/1191.htm",Deliver office supplies and copy paper.
"/media/Dados/bases/SWDE/job/job-jobtarget/0841.htm",Create engaging and effective membership opportunities and benefits that attract new members and retain existing members.
"/media/Dados/bases/SWDE/job/job-jobtarget/0263.htm","Review, manage, repair and upgrade current exhibit devices as needed"
"/media/Dados/bases/SWDE/job/job-jobtarget/0041.htm",Creates and grows reference customers
