URL,EXTRACTED VALUE
"/media/Dados/bases/SWDE/job/job-jobtarget/1603.htm",Optimize existing systems and revenue through application of detailed statistics analysis.
"/media/Dados/bases/SWDE/job/job-jobtarget/0804.htm",Set up the Community Member files and the Concierge department systems and communication protocols
"/media/Dados/bases/SWDE/job/job-jobtarget/0327.htm","Prepare all materials for events to include packing/shipping, printing name badges and registration materials."
"/media/Dados/bases/SWDE/job/job-jobtarget/0213.htm",Bonus eligible
"/media/Dados/bases/SWDE/job/job-jobtarget/1825.htm",Provide strategic and tactical public affairs consultation and support to the CEO and senior management team.
"/media/Dados/bases/SWDE/job/job-jobtarget/0608.htm",Coordinates regional clinical informatics and provides consulting services on clinical information management and processes for assigned hospitals.
"/media/Dados/bases/SWDE/job/job-jobtarget/0761.htm",Provide technical oversight for all mechanical and electrical systems at all Nicor Gas Facilities.
"/media/Dados/bases/SWDE/job/job-jobtarget/1588.htm",Operating access control systems and security based software programs to monitor campus activity and take corrective actions with system alarms.
"/media/Dados/bases/SWDE/job/job-jobtarget/1135.htm",Monitor and maintain systems and provide
"/media/Dados/bases/SWDE/job/job-jobtarget/0183.htm","Develop the application support strategy, overseeing the “promote to production” aspects of the software development lifecycle."
"/media/Dados/bases/SWDE/job/job-jobtarget/1197.htm","Prepare annual & quarterly budgets, reporting & analysis"
"/media/Dados/bases/SWDE/job/job-jobtarget/1539.htm","Produce name tags, table tents for both onsite and offsite events"
"/media/Dados/bases/SWDE/job/job-jobtarget/1597.htm","Ensures student financial services are in compliance with all federal, state, accreditation, and corporate guidelines/regulations"
"/media/Dados/bases/SWDE/job/job-jobtarget/0949.htm","Identifies potential quality and efficiency improvements, resulting in a better use of the system and/or processes."
"/media/Dados/bases/SWDE/job/job-jobtarget/1014.htm",Work with multidisciplinary design teams of user researchers and visual designers to deliver projects from concept to completion
"/media/Dados/bases/SWDE/job/job-jobtarget/0237.htm",Teaching experience
"/media/Dados/bases/SWDE/job/job-jobtarget/0236.htm",Teaching experience
"/media/Dados/bases/SWDE/job/job-jobtarget/1680.htm",Knowledge of any contingent labor management solution
"/media/Dados/bases/SWDE/job/job-jobtarget/0093.htm",Proven leadership skills
"/media/Dados/bases/SWDE/job/job-jobtarget/0690.htm",Coordinate with the quant team to develop hedging recommendations for the various product lines
"/media/Dados/bases/SWDE/job/job-jobtarget/0867.htm",Evidence of effective teaching of information systems courses at the undergraduate level
"/media/Dados/bases/SWDE/job/job-jobtarget/0649.htm","An extensive knowledge of ICD-9 and reimbursement methodologies, documentation practices, and MS-DRGschemes"
"/media/Dados/bases/SWDE/job/job-jobtarget/0593.htm",Patent cross-licensing
"/media/Dados/bases/SWDE/job/job-jobtarget/1312.htm","Strong organizational, project/time management, and detail orientation skills, reliable."
"/media/Dados/bases/SWDE/job/job-jobtarget/1967.htm",Corresponds with customers to determine market requirements.
"/media/Dados/bases/SWDE/job/job-jobtarget/1238.htm",A culture that encourages a passion for life both inside and outside of the office.
"/media/Dados/bases/SWDE/job/job-jobtarget/0146.htm",Prepare actuarial exhibits and reports
"/media/Dados/bases/SWDE/job/job-jobtarget/0624.htm","Ability to develop concise, complete, technically accurate and easy to understand technical information"
"/media/Dados/bases/SWDE/job/job-jobtarget/1840.htm","Knowledge of municipal codes, laws and ordinances impacting construction costs."
"/media/Dados/bases/SWDE/job/job-jobtarget/0160.htm",On-Site and Remote configuration of IrisGuard's Biometric software and hardware.
"/media/Dados/bases/SWDE/job/job-jobtarget/1843.htm",Initiating contact with prospect decision makers identified by partners to qualify the prospect and to introduce ERC’s talent acquisition solutions.
"/media/Dados/bases/SWDE/job/job-jobtarget/1463.htm","Fosters staff participation in assessing, planning, implementing and evaluating department activities and goals."
"/media/Dados/bases/SWDE/job/job-jobtarget/1242.htm",Resolve expense management issues and interpret/explain relocation policy to transferees
"/media/Dados/bases/SWDE/job/job-jobtarget/1091.htm",Develop and drive program timeline to include all logistical deliverables
"/media/Dados/bases/SWDE/job/job-jobtarget/1674.htm","Have the experience in customization of Ariba products including AMLs, extending the features, UI customizations."
"/media/Dados/bases/SWDE/job/job-jobtarget/1357.htm","Collaborate with institutional colleagues to develop programs and lecture series, etc."
"/media/Dados/bases/SWDE/job/job-jobtarget/1712.htm",Collaborate with multidisciplinary teams to deliver projects from concept to completion.
"/media/Dados/bases/SWDE/job/job-jobtarget/0943.htm",Direct oversight and responsibility for large HVAC systems and associated equipment.
"/media/Dados/bases/SWDE/job/job-jobtarget/1976.htm",Strong customer facing skills and ability to communicate to executives as well as other stakeholders at customer sites and within MetricStream
"/media/Dados/bases/SWDE/job/job-jobtarget/1391.htm",Grow the business
"/media/Dados/bases/SWDE/job/job-jobtarget/0893.htm","Ability to develop airplane technical manuals from engineering, manufacturing, flight, and supplier data."
"/media/Dados/bases/SWDE/job/job-jobtarget/1958.htm",Chooses and manipulates content and graphics appropriately for placement on the intranet and other online and hard copy communications vehicles.
"/media/Dados/bases/SWDE/job/job-jobtarget/1571.htm","Key systems supported include companywide headends,"
"/media/Dados/bases/SWDE/job/job-jobtarget/0621.htm",Perform all assigned duties in accordance with the
"/media/Dados/bases/SWDE/job/job-jobtarget/1156.htm",Prevent errors at inception without continuing through the production process.
"/media/Dados/bases/SWDE/job/job-jobtarget/1473.htm",Our firm is an involved member in one of the largest international accounting associations known as IGAF Worldwide.
"/media/Dados/bases/SWDE/job/job-jobtarget/1978.htm","Prepare for, lead and conduct solution requirements gathering sessions with customer business and technical SMEs"
"/media/Dados/bases/SWDE/job/job-jobtarget/0264.htm","5 - 7 years experience in Program Management, leading million dollar plus engagements, with proven ability to deliver customer success."
"/media/Dados/bases/SWDE/job/job-jobtarget/0119.htm","Skilled in developing project plan documentation, tracking progress to plan, and creative in meeting commitments while maintaining standards"
"/media/Dados/bases/SWDE/job/job-jobtarget/1329.htm","Execute ad-hoc, manual, and automated tests. Prioritize and manage defect resolutions"
"/media/Dados/bases/SWDE/job/job-jobtarget/0575.htm",Data analysis and reporting
"/media/Dados/bases/SWDE/job/job-jobtarget/0099.htm",Assemble and manage required teams of consultants and contractors
"/media/Dados/bases/SWDE/job/job-jobtarget/0788.htm",experience in an export corporate compliance function and / or government experience.
"/media/Dados/bases/SWDE/job/job-jobtarget/1065.htm",Proficient with Microsoft SharePoint Server Platform
"/media/Dados/bases/SWDE/job/job-jobtarget/0098.htm",Translate business needs into requirement documents and functional specifications.
"/media/Dados/bases/SWDE/job/job-jobtarget/0026.htm",New hire setup and employee termination paperwork
"/media/Dados/bases/SWDE/job/job-jobtarget/1365.htm",Experience with management and compliance of electronic and paper records
"/media/Dados/bases/SWDE/job/job-jobtarget/1162.htm",Prepare outbound courier shipments using computer or service providers.
"/media/Dados/bases/SWDE/job/job-jobtarget/1923.htm",Experience in Linux development
"/media/Dados/bases/SWDE/job/job-jobtarget/0195.htm",Program Leader General responsibilities
"/media/Dados/bases/SWDE/job/job-jobtarget/1245.htm",Resolve expense management issues and interpret/explain relocation policy to the transferees
