URL,EXTRACTED VALUE
"/media/Dados/bases/SWDE/job/job-jobtarget/1828.htm",Understands and recommends the use of the appropriate automated testing tools.
"/media/Dados/bases/SWDE/job/job-jobtarget/0846.htm",Work with each student through their learning process
"/media/Dados/bases/SWDE/job/job-jobtarget/0266.htm","Plays nice with others, and able to still get them to produce the work on time"
"/media/Dados/bases/SWDE/job/job-jobtarget/1419.htm",Possess the ability to communicate clearly and calmly in both English and Korean...
"/media/Dados/bases/SWDE/job/job-jobtarget/1280.htm","Monitors all student finance activities to ensure timely file processing, billing, funding and collections."
"/media/Dados/bases/SWDE/job/job-jobtarget/1369.htm",Deloitte & Touche Technology Fast 500
"/media/Dados/bases/SWDE/job/job-jobtarget/0572.htm",Intermediate to advanced skills in utilizing Microsoft Office.
"/media/Dados/bases/SWDE/job/job-jobtarget/1435.htm",Coordinates with offshore and other technical providers to ensure requirements and functional specifications are of high quality.
"/media/Dados/bases/SWDE/job/job-jobtarget/1047.htm",Extensive selling experience within industry and on similar products.
"/media/Dados/bases/SWDE/job/job-jobtarget/1447.htm",Develop public information programs to generate understanding of and support for the mission and values of the Museum.
"/media/Dados/bases/SWDE/job/job-jobtarget/0338.htm",Develops independently; participates in code reviews and may lead code reviews. May lead and provide mentoring and guidance to less senior developers.
"/media/Dados/bases/SWDE/job/job-jobtarget/1026.htm","Maintain active communication with clients to manage expectations, ensure satisfaction, and make sure deadlines are met."
"/media/Dados/bases/SWDE/job/job-jobtarget/0029.htm",Operate test equipment
"/media/Dados/bases/SWDE/job/job-jobtarget/0080.htm",Proven ability to plan and implement technology solutions and training
"/media/Dados/bases/SWDE/job/job-jobtarget/1142.htm",Extensive hands-on experience leading teams on design of virtualization technologies/features and implementation of those projects.
"/media/Dados/bases/SWDE/job/job-jobtarget/1859.htm",Strong knowledge of statistics as relevant to simulation analysis.
"/media/Dados/bases/SWDE/job/job-jobtarget/1946.htm",Applies growing technical knowledge to maintain a technology area (e.g. Web-site Development).
"/media/Dados/bases/SWDE/job/job-jobtarget/1728.htm",This will entail technical consulting with other support automation sub-system teams on maximizing the overall design for efficiency.
"/media/Dados/bases/SWDE/job/job-jobtarget/0170.htm",Negotiation and execution of major hotel and vendor contracts.
"/media/Dados/bases/SWDE/job/job-jobtarget/0334.htm","Liaison to the annual conference shadow host committee coordinating display booth, giveaways, etc."
"/media/Dados/bases/SWDE/job/job-jobtarget/1169.htm","The Clinical Nurse B,"
"/media/Dados/bases/SWDE/job/job-jobtarget/0112.htm",SQL query/script development
"/media/Dados/bases/SWDE/job/job-jobtarget/0156.htm",Virtual Library Systems (VLS)
"/media/Dados/bases/SWDE/job/job-jobtarget/1267.htm","Develop and implement training plans, including the creation of training material, for users."
"/media/Dados/bases/SWDE/job/job-jobtarget/1888.htm",Experience with application discovery and remediation with regards to desktop migrations
"/media/Dados/bases/SWDE/job/job-jobtarget/1078.htm","Background managing projects and teams in an industry, consulting, agency, or software / service role"
"/media/Dados/bases/SWDE/job/job-jobtarget/0694.htm","Curiosity, drive, creativity, and a desire to improve. You will learn FileMaker Pro and other technologies, as needed."
"/media/Dados/bases/SWDE/job/job-jobtarget/0879.htm",Manages the Volunteer Solutions software and the Volunteer Center Database
"/media/Dados/bases/SWDE/job/job-jobtarget/1252.htm",Developing the individual product line P&Ls and to insure that the resultant net profit distributions are conveyed to the product owners.
"/media/Dados/bases/SWDE/job/job-jobtarget/0310.htm",Upselling additional services
"/media/Dados/bases/SWDE/job/job-jobtarget/1666.htm","Provide world class support to customers as it relates to OnBase software, OnBase OnLine hosted services, and their OnBase solution"
"/media/Dados/bases/SWDE/job/job-jobtarget/0673.htm",Meet company and accounting department goals and guidelines.
"/media/Dados/bases/SWDE/job/job-jobtarget/1489.htm","Experience with organizational marketing practices, public relations activities and budget development."
"/media/Dados/bases/SWDE/job/job-jobtarget/0011.htm","Utilizing Windows-based applications to perform document and database management tasks such as indexing, scanning, coding, processing, and printing"
"/media/Dados/bases/SWDE/job/job-jobtarget/0171.htm","Take and distribute minutes from Board Meetings, Committee Meetings, etc"
"/media/Dados/bases/SWDE/job/job-jobtarget/1009.htm","Creation of test concepts, quality assurance and software testing"
"/media/Dados/bases/SWDE/job/job-jobtarget/0074.htm","Problem Management - develops action plans, corrects root cause of technical problems, and leads escalations."
"/media/Dados/bases/SWDE/job/job-jobtarget/0351.htm",o board-level test procedures and reports
"/media/Dados/bases/SWDE/job/job-jobtarget/0936.htm",A demonstrated ability to work independently as well as a member of a team.
"/media/Dados/bases/SWDE/job/job-jobtarget/1318.htm",Determines if payments should be expensed or treated as prepaid expenses or capitalized as fixed assets
"/media/Dados/bases/SWDE/job/job-jobtarget/0344.htm",Experience with network modeling and transportation management software strongly preferred.
"/media/Dados/bases/SWDE/job/job-jobtarget/1146.htm",Providing IT thought leadership
"/media/Dados/bases/SWDE/job/job-jobtarget/1819.htm",Design and build required queries and associated objects;
"/media/Dados/bases/SWDE/job/job-jobtarget/1866.htm",Act as liaison between their clients and other IT organizations within the University;
"/media/Dados/bases/SWDE/job/job-jobtarget/1716.htm","Executes tasks related to the production of the Test Plan, test cases, test scripts, and test data."
"/media/Dados/bases/SWDE/job/job-jobtarget/1392.htm","Provide technical consulting in identifying, implementing and supporting new database functionality;"
"/media/Dados/bases/SWDE/job/job-jobtarget/1788.htm","Specific experience using government accounting software such as Deltek, Microsoft Dynamics and Sympaq is preferred"
"/media/Dados/bases/SWDE/job/job-jobtarget/1547.htm",Influence the strategic direction of clients and their industry.
"/media/Dados/bases/SWDE/job/job-jobtarget/0577.htm",Deloitte & Touche Technology Fast 500
"/media/Dados/bases/SWDE/job/job-jobtarget/1296.htm",Support existing virtual machine and hardware architecture including maintenance and standardized deployment
"/media/Dados/bases/SWDE/job/job-jobtarget/1673.htm",Provides technical direction for performing software development tasks and reviewing work products for correctness and adherence to design standards.
"/media/Dados/bases/SWDE/job/job-jobtarget/0538.htm","Lead the Program and own Program deliverables to budget, time and quality."
"/media/Dados/bases/SWDE/job/job-jobtarget/1881.htm","Troubleshoot, diagnose and resolve hardware and software issues."
"/media/Dados/bases/SWDE/job/job-jobtarget/0274.htm","Hands-on knowledge of government business cultures, sales processes, and high-tech companies in your territory;"
"/media/Dados/bases/SWDE/job/job-jobtarget/1810.htm",Design and build required queries and associated objects;
"/media/Dados/bases/SWDE/job/job-jobtarget/0674.htm","Explore product requirements to figure out technical difficulties, recommend implementation approaches, and draft functional specifications (FRDs)"
"/media/Dados/bases/SWDE/job/job-jobtarget/0519.htm",Proactively guide the client program success and identify additional consulting needs to achieve desired business objectives.
"/media/Dados/bases/SWDE/job/job-jobtarget/1789.htm",Demonstrated analytical skills and strong attention to detail
"/media/Dados/bases/SWDE/job/job-jobtarget/1182.htm",Possess superior technical knowledge of electrical discipline.
"/media/Dados/bases/SWDE/job/job-jobtarget/1522.htm",Assists the University Director in setting Student Finance goals and objectives for the group and ensures that all goals are met.
"/media/Dados/bases/SWDE/job/job-jobtarget/1262.htm","Build strong, cooperative relationships with IT Security practitioners and across the entire PG&E"
"/media/Dados/bases/SWDE/job/job-jobtarget/0349.htm",Thorough knowledge of federal and state financial aid programs and regulations.
"/media/Dados/bases/SWDE/job/job-jobtarget/0930.htm",Assist in the preparation of all marketing materials including editing scientific program content
"/media/Dados/bases/SWDE/job/job-jobtarget/0057.htm",Solution quality & delivery feasibility
"/media/Dados/bases/SWDE/job/job-jobtarget/1746.htm",This will entail technical consulting with other support automation sub-system teams on maximizing the overall end user experience of the system
"/media/Dados/bases/SWDE/job/job-jobtarget/1230.htm",Educates customers about the solutions Flagstar has to offer in a professional and knowledgeable manner.
"/media/Dados/bases/SWDE/job/job-jobtarget/0188.htm",Assist with the preparation of annual budgets including the modeling of the budgets and assumptions.
"/media/Dados/bases/SWDE/job/job-jobtarget/1390.htm",Demonstrated competence with instructional design and courseware development methods.
"/media/Dados/bases/SWDE/job/job-jobtarget/0239.htm","Test Java based applications on Windows, Linux and HP UX operating systems."
"/media/Dados/bases/SWDE/job/job-jobtarget/1515.htm",Preparation of annual maintenance and capital budgets
"/media/Dados/bases/SWDE/job/job-jobtarget/0750.htm",Establish and maintain a schedule to conduct internal audits of tenant files.
"/media/Dados/bases/SWDE/job/job-jobtarget/0567.htm","Reviewing, researching, and investigating requests for the VP and recommending alternatives;"
"/media/Dados/bases/SWDE/job/job-jobtarget/1723.htm","Siebel Database- Experience in creating Siebel repository, and running a variety of database utilities. Siebel DB upgrade experience a major plus."
"/media/Dados/bases/SWDE/job/job-jobtarget/1237.htm","advance multiple activities concurrently and be flexible in a complex environment,"
"/media/Dados/bases/SWDE/job/job-jobtarget/1939.htm",Contributes to design activities; may design solutions.
"/media/Dados/bases/SWDE/job/job-jobtarget/1851.htm","Successful track record of selling COLD, ECM and document archive software solutions"
"/media/Dados/bases/SWDE/job/job-jobtarget/0991.htm",Must be qualified to sit for the CPA or possess a CPA.
"/media/Dados/bases/SWDE/job/job-jobtarget/1011.htm","Work closely with web staff to secure slots for banner ads, request new web pages and changes to existing web pages;"
"/media/Dados/bases/SWDE/job/job-jobtarget/0282.htm",Provides accurate estimates to Development Manager
"/media/Dados/bases/SWDE/job/job-jobtarget/0038.htm",Participates in code reviews. Prepares and executes unit tests.
"/media/Dados/bases/SWDE/job/job-jobtarget/1778.htm",Strong C programming skills
"/media/Dados/bases/SWDE/job/job-jobtarget/1342.htm",Assist with conducting training seminars on related topics and securing new business in this area.
"/media/Dados/bases/SWDE/job/job-jobtarget/1640.htm","Automotive industry certifications are preferred: ASE - Automotive/Medium-Heavy Duty, state issued certifications."
"/media/Dados/bases/SWDE/job/job-jobtarget/0275.htm","Experience with Visual Studio 2003, 2005, or 2008"
"/media/Dados/bases/SWDE/job/job-jobtarget/1033.htm",Fluent English
"/media/Dados/bases/SWDE/job/job-jobtarget/1776.htm","Strong communicator, verbal and written"
"/media/Dados/bases/SWDE/job/job-jobtarget/1922.htm",Strong understanding of OO principles
"/media/Dados/bases/SWDE/job/job-jobtarget/1623.htm","Ability to analyze financial data and prepare financial reports, statements and projections"
"/media/Dados/bases/SWDE/job/job-jobtarget/1988.htm",Make product improvement recommendations to the Development Manager
"/media/Dados/bases/SWDE/job/job-jobtarget/1961.htm",Develops independently; participates in code reviews and may lead code reviews. May lead and provide mentoring and guidance to less senior developers.
"/media/Dados/bases/SWDE/job/job-jobtarget/1643.htm",Report on status of product deliverables to senior management and product teams via rigorous execution of detailed plans and accurate reporting
"/media/Dados/bases/SWDE/job/job-jobtarget/1459.htm",Prepare letters of inquiry and proposals for corporations and foundations in consult with development team and appropriate faculty stakeholders.
"/media/Dados/bases/SWDE/job/job-jobtarget/0040.htm",Develops independently; participates in code reviews and may lead code reviews. May lead and provide mentoring and guidance to less senior developers.
"/media/Dados/bases/SWDE/job/job-jobtarget/1812.htm",Manages day-to-day operational aspects of project schedules and scope
"/media/Dados/bases/SWDE/job/job-jobtarget/1872.htm",Previous experience in data security and user access management is also a plus.
"/media/Dados/bases/SWDE/job/job-jobtarget/0755.htm",Strong programming skills.
"/media/Dados/bases/SWDE/job/job-jobtarget/0480.htm",Screen and prioritize incoming messages and mail for the Executive Director
"/media/Dados/bases/SWDE/job/job-jobtarget/1043.htm",Must have very good database analyzing skills and technical knowledge of RDBMS environment.
"/media/Dados/bases/SWDE/job/job-jobtarget/0066.htm","Participation in proposal writing, on-site solution sessions with clients and other relevant sales/assessment support activities"
"/media/Dados/bases/SWDE/job/job-jobtarget/0200.htm",Creates and grows reference customers
"/media/Dados/bases/SWDE/job/job-jobtarget/1549.htm",Designs solutions for others to develop.
"/media/Dados/bases/SWDE/job/job-jobtarget/1878.htm",Applies growing technical knowledge to maintain a technology area (e.g. Web-site Development).
"/media/Dados/bases/SWDE/job/job-jobtarget/1067.htm",Working with customers to foster full adoption and utilization of their systems.
"/media/Dados/bases/SWDE/job/job-jobtarget/1016.htm","Extensive knowledge of web protocols, networking, and systems."
"/media/Dados/bases/SWDE/job/job-jobtarget/0362.htm",Prior experience with the MG-ALFA financial modeling software is desired.
"/media/Dados/bases/SWDE/job/job-jobtarget/1747.htm",Excellent knowledge of the Internet and web based applications
"/media/Dados/bases/SWDE/job/job-jobtarget/1887.htm",Proactively managing delivery projects and teams to ensure successful delivery of HP solutions.
"/media/Dados/bases/SWDE/job/job-jobtarget/1370.htm",Provide knowledge transfer to customers appointed OnBase® System Administrator and customer's business users
"/media/Dados/bases/SWDE/job/job-jobtarget/0021.htm","Develops and implements regression, unit and integration testing plans for clinical systems software as required."
"/media/Dados/bases/SWDE/job/job-jobtarget/0941.htm",Assist with the installation of ClickSoftware products
"/media/Dados/bases/SWDE/job/job-jobtarget/0285.htm","Assist in developing goals, objectives, and strategic plans."
"/media/Dados/bases/SWDE/job/job-jobtarget/1145.htm","Being recognized as authority for resolving complex data, statistical modeling, process and analysis problems"
"/media/Dados/bases/SWDE/job/job-jobtarget/1198.htm",Capture/pre-contract Mgmt-
"/media/Dados/bases/SWDE/job/job-jobtarget/1421.htm",Fulfills departmental requirements in terms of providing work coverage and administrative notification during periods of personal absence.
"/media/Dados/bases/SWDE/job/job-jobtarget/0017.htm",Develops independently; participates in code reviews and may lead code reviews. May lead and provide mentoring and guidance to less senior developers.
"/media/Dados/bases/SWDE/job/job-jobtarget/1231.htm",Educates customers about the solutions Flagstar has to offer in a professional and knowledgeable manner.
"/media/Dados/bases/SWDE/job/job-jobtarget/1777.htm","Strong communicator, verbal and written"
"/media/Dados/bases/SWDE/job/job-jobtarget/1129.htm",Experience with statistics and related analysis methodologies
"/media/Dados/bases/SWDE/job/job-jobtarget/0345.htm",Help coordinate Desktop Stabilization Program's activities with internal and external dependencies
"/media/Dados/bases/SWDE/job/job-jobtarget/0091.htm","Lead team to work cross-functionally to deliver systems solutions that meet specifications, schedules, and quality standards."
"/media/Dados/bases/SWDE/job/job-jobtarget/1763.htm",Extensive experience with eCommerce applications.
"/media/Dados/bases/SWDE/job/job-jobtarget/1368.htm",Experience with creating software that performs well by understanding and following best practices for software performance.
"/media/Dados/bases/SWDE/job/job-jobtarget/1726.htm",Bring up new hardware of our InServe products
"/media/Dados/bases/SWDE/job/job-jobtarget/1932.htm",Develops independently; participates in code reviews and may lead code reviews. May lead and provide mentoring and guidance to less senior developers.
"/media/Dados/bases/SWDE/job/job-jobtarget/0032.htm",Applies growing technical knowledge to maintain a technology area (e.g. Web-site Development).
"/media/Dados/bases/SWDE/job/job-jobtarget/0454.htm",5 - 7 years work in adult learning program and subject matter development.
"/media/Dados/bases/SWDE/job/job-jobtarget/0042.htm",Creates and grows reference customers
"/media/Dados/bases/SWDE/job/job-jobtarget/0342.htm","Basic understanding of testing tools and unit and integration test scripting, and testing methodologies."
"/media/Dados/bases/SWDE/job/job-jobtarget/1297.htm",Acts as a team or project leader providing direction to team activities and facilitates information validation and team decision making process.
"/media/Dados/bases/SWDE/job/job-jobtarget/0823.htm",Deloitte & Touche Technology Fast 500
"/media/Dados/bases/SWDE/job/job-jobtarget/1725.htm",Bring up new hardware of our InServe products
"/media/Dados/bases/SWDE/job/job-jobtarget/0113.htm",SQL query/script development
"/media/Dados/bases/SWDE/job/job-jobtarget/1007.htm","Writes, collects, edits, and proofs copy for"
"/media/Dados/bases/SWDE/job/job-jobtarget/1775.htm","Strong communicator, verbal and written"
"/media/Dados/bases/SWDE/job/job-jobtarget/0509.htm","Knowledge of information systems, healthcare applications, database tools, and report writing software"
"/media/Dados/bases/SWDE/job/job-jobtarget/0087.htm",Knowledge of ISO 9000:2008 is desirable
"/media/Dados/bases/SWDE/job/job-jobtarget/0644.htm",Review/respond to RFIs/RFPs
"/media/Dados/bases/SWDE/job/job-jobtarget/0298.htm",Experience with system implementations preferred.
"/media/Dados/bases/SWDE/job/job-jobtarget/1341.htm",Assume the role of lead estimator as required and supervise a team of estimators
"/media/Dados/bases/SWDE/job/job-jobtarget/0256.htm","Work with GBU to provide product feedback, make product feature/cost trade-off decision, launch product TTM"
"/media/Dados/bases/SWDE/job/job-jobtarget/1255.htm",Maximizes CSBU return on investment from event participation
"/media/Dados/bases/SWDE/job/job-jobtarget/1123.htm",Prepares and conducts educational training on Nol-Tec equipment.
"/media/Dados/bases/SWDE/job/job-jobtarget/0123.htm",Participate in the development of policies and procedures related electronic clinical applications
"/media/Dados/bases/SWDE/job/job-jobtarget/1005.htm",Submit a weekly journal of accomplishments and lessons learned
"/media/Dados/bases/SWDE/job/job-jobtarget/0774.htm",Responsible for validation and operating rules for key packaging technologies
"/media/Dados/bases/SWDE/job/job-jobtarget/1239.htm",4. Ensure personnel are adequately trained and competent to perform assigned duties.
"/media/Dados/bases/SWDE/job/job-jobtarget/0092.htm",Provision
"/media/Dados/bases/SWDE/job/job-jobtarget/0249.htm","Several years of large systems software design and development experience, with extensive knowledge of Unix/Linux."
"/media/Dados/bases/SWDE/job/job-jobtarget/0028.htm","Creates documentation, training materials, user guides, title lists, FAQs, and other materials about ATLA products and data releases."
"/media/Dados/bases/SWDE/job/job-jobtarget/0562.htm","Experience with Transport Packages, job scheduling/troubleshooting, Java and ABAP stack maintenance required."
"/media/Dados/bases/SWDE/job/job-jobtarget/0532.htm",4. Develops enhancements to SAP Business Warehouse to meet reporting and analysis needs of the business
"/media/Dados/bases/SWDE/job/job-jobtarget/1294.htm","Experience with software development tools and processes. (Trace, JTAG, scopes, Logic Analyzers)"
"/media/Dados/bases/SWDE/job/job-jobtarget/0175.htm",Mentor one or more project managers
"/media/Dados/bases/SWDE/job/job-jobtarget/1254.htm","Identifies emerging vulnerabilities, evaluates associated risks and threats and provides countermeasures where necessary."
"/media/Dados/bases/SWDE/job/job-jobtarget/1742.htm",Report out test results and metrics.
"/media/Dados/bases/SWDE/job/job-jobtarget/0739.htm",Very strong business and technical knowledge in Web Service practices and related technologies required.
"/media/Dados/bases/SWDE/job/job-jobtarget/1856.htm","Effectively partner with business leaders, subject matter experts, and other groups."
"/media/Dados/bases/SWDE/job/job-jobtarget/0455.htm","Responsible for: tracking and reporting the status of issues, escalation of issues, and following through with issues until resolution."
"/media/Dados/bases/SWDE/job/job-jobtarget/1270.htm",distribute apps and market their features to grow the installed user base
"/media/Dados/bases/SWDE/job/job-jobtarget/1420.htm","Develop and maintain all marketing collateral including brochures, presentation material, slide shows, demos, sell sheets, proposals, etc."
"/media/Dados/bases/SWDE/job/job-jobtarget/1536.htm",A demonstrated ability to work independently as well as a member of a team.
"/media/Dados/bases/SWDE/job/job-jobtarget/0536.htm",Data change audit trails
"/media/Dados/bases/SWDE/job/job-jobtarget/0588.htm","Working knowledge of SQL, XML and Java/J2EE."
"/media/Dados/bases/SWDE/job/job-jobtarget/0048.htm",Excellent time management skills
"/media/Dados/bases/SWDE/job/job-jobtarget/0250.htm",Setup/enhance test infrastructure and implement unit test cases.
"/media/Dados/bases/SWDE/job/job-jobtarget/1713.htm",Provides communications of status reporting
"/media/Dados/bases/SWDE/job/job-jobtarget/1232.htm",Educates customers about the solutions Flagstar has to offer in a professional and knowledgeable manner.
"/media/Dados/bases/SWDE/job/job-jobtarget/1997.htm",Create and implement ETL/replication/batch processes to populate alternative data repositories
"/media/Dados/bases/SWDE/job/job-jobtarget/0085.htm","Ability to monitor projects, drive projects forward and be accountable for the results"
"/media/Dados/bases/SWDE/job/job-jobtarget/1816.htm",Designs units for others. Completes development to implement complex components.
"/media/Dados/bases/SWDE/job/job-jobtarget/1183.htm","advance multiple activities concurrently and be flexible in a complex environment,"
"/media/Dados/bases/SWDE/job/job-jobtarget/0871.htm",Generate online help with ePublisher
"/media/Dados/bases/SWDE/job/job-jobtarget/0780.htm",Customer Care
"/media/Dados/bases/SWDE/job/job-jobtarget/1685.htm",Strong C and Unix/Linux development environment
"/media/Dados/bases/SWDE/job/job-jobtarget/1455.htm",Manage launch process to prepare customers as well as internal groups for the deployment of quarterly product releases
"/media/Dados/bases/SWDE/job/job-jobtarget/1982.htm",Applies growing technical knowledge to maintain a technology area (e.g. Web-site Development).
"/media/Dados/bases/SWDE/job/job-jobtarget/0789.htm",Working directly with sales teams on opportunities
"/media/Dados/bases/SWDE/job/job-jobtarget/0286.htm","Assist in developing goals, objectives, and strategic plans."
"/media/Dados/bases/SWDE/job/job-jobtarget/1477.htm",Participates in current state assessments of corporate accounting policies and conformance to GAAP.
"/media/Dados/bases/SWDE/job/job-jobtarget/1625.htm","Maintain active communication with clients to manage expectations, ensure satisfaction, and make sure deadlines are met."
"/media/Dados/bases/SWDE/job/job-jobtarget/1036.htm",Facilitate and create a customer network and coordinate cross customer communication
"/media/Dados/bases/SWDE/job/job-jobtarget/1056.htm",Ensures that well documented files are maintained for all field reviews.
"/media/Dados/bases/SWDE/job/job-jobtarget/1631.htm",Responsible for documenting support-related activities.
"/media/Dados/bases/SWDE/job/job-jobtarget/1610.htm",Learn the product suite Value Proposition
"/media/Dados/bases/SWDE/job/job-jobtarget/0023.htm",Develops independently; participates in code reviews and may lead code reviews. May lead and provide mentoring and guidance to less senior developers.
"/media/Dados/bases/SWDE/job/job-jobtarget/0075.htm",Designs solutions for others to develop.
"/media/Dados/bases/SWDE/job/job-jobtarget/1543.htm","Lead the Program and own Program deliverables to budget, time and quality."
"/media/Dados/bases/SWDE/job/job-jobtarget/0240.htm",Translating system design into concrete policies at every level of the organization
"/media/Dados/bases/SWDE/job/job-jobtarget/1386.htm",o Maintain definitive source for project features
