URL,EXTRACTED VALUE
"/media/Dados/bases/SWDE/job/job-jobtarget/1959.htm",Represents the organization at the executive-level in partners' and customers' organizations
"/media/Dados/bases/SWDE/job/job-jobtarget/0697.htm","Advanced skills in Excel, Access, PowerPoint, Word and other Microsoft Office products"
"/media/Dados/bases/SWDE/job/job-jobtarget/0820.htm",25% international travel.
"/media/Dados/bases/SWDE/job/job-jobtarget/0124.htm","Demonstrate integrity and maturity, and a constructive approach to challenges"
"/media/Dados/bases/SWDE/job/job-jobtarget/1949.htm","Possess detailed technical skills in at least one platform (Unix/Sybase, Windows NT)."
"/media/Dados/bases/SWDE/job/job-jobtarget/1473.htm",Addresses client concerns in effective manner.
"/media/Dados/bases/SWDE/job/job-jobtarget/1497.htm","Breadth of influence goes across multiple organizations within the Business and is sought, valued and used"
