URL,EXTRACTED VALUE
"/media/Dados/bases/SWDE/job/job-jobtarget/1835.htm",We provide business critical services to our business units and present an excellent opportunity for growth for the right professionals
"/media/Dados/bases/SWDE/job/job-jobtarget/0028.htm",a plus.
"/media/Dados/bases/SWDE/job/job-jobtarget/0445.htm","Strong understanding of economic capital, other quantitative modeling, and related risk measures."
"/media/Dados/bases/SWDE/job/job-jobtarget/0532.htm",SAP Business Warehouse certification preferred
"/media/Dados/bases/SWDE/job/job-jobtarget/1101.htm",Lending in all 50 states
"/media/Dados/bases/SWDE/job/job-jobtarget/1369.htm",Highly organized and experience in multi-tasking
"/media/Dados/bases/SWDE/job/job-jobtarget/1099.htm",Lending in all 50 states
"/media/Dados/bases/SWDE/job/job-jobtarget/1865.htm",Experience in SW quality assurance development methods
"/media/Dados/bases/SWDE/job/job-jobtarget/1109.htm",Lending in all 50 states
"/media/Dados/bases/SWDE/job/job-jobtarget/1098.htm",Lending in all 50 states
"/media/Dados/bases/SWDE/job/job-jobtarget/1447.htm","Work experience in at least two of the following areas: media relations, strategic planning, marketing, journalism"
"/media/Dados/bases/SWDE/job/job-jobtarget/1791.htm",Experience in SW quality assurance development methods
"/media/Dados/bases/SWDE/job/job-jobtarget/1511.htm",Experience in Systems level quality assurance development methods
"/media/Dados/bases/SWDE/job/job-jobtarget/1742.htm",Software development experience.
"/media/Dados/bases/SWDE/job/job-jobtarget/0455.htm",Required to lift up to 25 lbs.
"/media/Dados/bases/SWDE/job/job-jobtarget/1270.htm",5+ years experience in a technology/e-commerce product management role
"/media/Dados/bases/SWDE/job/job-jobtarget/1060.htm",Lending in all 50 states
"/media/Dados/bases/SWDE/job/job-jobtarget/0810.htm",Minimum of 4 years of corporate communications experience
"/media/Dados/bases/SWDE/job/job-jobtarget/1105.htm",Lending in all 50 states
"/media/Dados/bases/SWDE/job/job-jobtarget/0334.htm",Solicit and contract with industry organizations to hold workshops in conjunction with their annual conference
"/media/Dados/bases/SWDE/job/job-jobtarget/1103.htm",Lending in all 50 states
"/media/Dados/bases/SWDE/job/job-jobtarget/1111.htm",Lending in all 50 states
"/media/Dados/bases/SWDE/job/job-jobtarget/0112.htm",Experience in the association or non-profit industry
"/media/Dados/bases/SWDE/job/job-jobtarget/0749.htm",Knowledge of MNR Assets Management System (AMS) and Incident Management System (IMS).
"/media/Dados/bases/SWDE/job/job-jobtarget/1790.htm",Experience in SW quality assurance development methods
"/media/Dados/bases/SWDE/job/job-jobtarget/1267.htm","Demonstrated understanding of Salesforce.com platform and services including SFA, Case Management, Force.com, Marketing and AppExchange."
"/media/Dados/bases/SWDE/job/job-jobtarget/1997.htm",SCM / TFS 2010
"/media/Dados/bases/SWDE/job/job-jobtarget/1461.htm","College/University names, city, and state"
"/media/Dados/bases/SWDE/job/job-jobtarget/1637.htm",Uses extensive business knowledge at domain level to drive engagement for the largest IT initiatives.
"/media/Dados/bases/SWDE/job/job-jobtarget/1481.htm",Familiarity with basic understanding of railway signal systems.
"/media/Dados/bases/SWDE/job/job-jobtarget/1816.htm",Ability to work with Web-development tools for new applications.
"/media/Dados/bases/SWDE/job/job-jobtarget/0740.htm",First level university degree with a focus in business or economics; advanced degree in business preferred.
"/media/Dados/bases/SWDE/job/job-jobtarget/1962.htm","Experience working for an airline performing Flight Operations Control function, a plus"
"/media/Dados/bases/SWDE/job/job-jobtarget/1687.htm",Advanced knowledge of project implementation methodologies
"/media/Dados/bases/SWDE/job/job-jobtarget/1548.htm",The candidate should be able to translate a functional requirement into a technical solution with minimal supervision and assistance.
"/media/Dados/bases/SWDE/job/job-jobtarget/1244.htm",Develop training documentation and conduct training on all necessary areas of master data
"/media/Dados/bases/SWDE/job/job-jobtarget/0879.htm","Event planning, as a key component in United Way's relationship building strategy with donors, volunteers, partner organizations and the community"
"/media/Dados/bases/SWDE/job/job-jobtarget/0310.htm",Technology background desired
"/media/Dados/bases/SWDE/job/job-jobtarget/0347.htm",Ability to interact effectively as a member of a team and work collaboratively with other departments.
"/media/Dados/bases/SWDE/job/job-jobtarget/0765.htm",Exceptional written and verbal communication skills;
"/media/Dados/bases/SWDE/job/job-jobtarget/1666.htm",Database query language experience
"/media/Dados/bases/SWDE/job/job-jobtarget/0673.htm",Prepare joint venture tax returns and K-1s for partners
"/media/Dados/bases/SWDE/job/job-jobtarget/1116.htm",Lending in all 50 states
"/media/Dados/bases/SWDE/job/job-jobtarget/1509.htm",Experience in Systems level quality assurance development methods
"/media/Dados/bases/SWDE/job/job-jobtarget/1100.htm",Lending in all 50 states
"/media/Dados/bases/SWDE/job/job-jobtarget/0351.htm",Solid digital design background including experience with:
"/media/Dados/bases/SWDE/job/job-jobtarget/1124.htm",Lending in all 50 states
"/media/Dados/bases/SWDE/job/job-jobtarget/1146.htm",Typically 8-12 years experience in technical consultative selling and account management
"/media/Dados/bases/SWDE/job/job-jobtarget/1788.htm","Knowledge and understanding of consulting organizations, internal IT organizations and advanced technology organizations"
"/media/Dados/bases/SWDE/job/job-jobtarget/1106.htm",Lending in all 50 states
"/media/Dados/bases/SWDE/job/job-jobtarget/1112.htm",Lending in all 50 states
"/media/Dados/bases/SWDE/job/job-jobtarget/0102.htm",Database design for data warehouses.
"/media/Dados/bases/SWDE/job/job-jobtarget/1029.htm",Familiarity with use of antimicrobial preservative systems
"/media/Dados/bases/SWDE/job/job-jobtarget/0023.htm",Ability to work with Web-development tools for new applications.
"/media/Dados/bases/SWDE/job/job-jobtarget/1386.htm",Bachelors degree in related field
"/media/Dados/bases/SWDE/job/job-jobtarget/1794.htm","You are comfortable with cross-team dependencies, rapid schedules, and constantly changing business needs."
"/media/Dados/bases/SWDE/job/job-jobtarget/1810.htm","Experience with full life cycle phase software development, testing methodologies, SAP's software transport process"
"/media/Dados/bases/SWDE/job/job-jobtarget/0519.htm","Experience with customer experience management, customer satisfaction / loyalty programs and customer feedback solutions"
"/media/Dados/bases/SWDE/job/job-jobtarget/1431.htm",Ability to apply Company policies and procedures in connection with complex investigations.
"/media/Dados/bases/SWDE/job/job-jobtarget/1097.htm",Lending in all 50 states
"/media/Dados/bases/SWDE/job/job-jobtarget/1110.htm",Lending in all 50 states
"/media/Dados/bases/SWDE/job/job-jobtarget/1118.htm",Lending in all 50 states
"/media/Dados/bases/SWDE/job/job-jobtarget/1147.htm","Typically 2-4 years of experience in a business related function, preferably sales, sales operations and finance."
"/media/Dados/bases/SWDE/job/job-jobtarget/1126.htm",Lending in all 50 states
"/media/Dados/bases/SWDE/job/job-jobtarget/1497.htm",8-12 years experience in technical consultative selling and solution/account management
"/media/Dados/bases/SWDE/job/job-jobtarget/0930.htm",Manage all registration desk functions; including cash management & credit card processing and management of exhibitor registration
"/media/Dados/bases/SWDE/job/job-jobtarget/0757.htm","Professional communication skills, both verbal and written"
"/media/Dados/bases/SWDE/job/job-jobtarget/0057.htm",Proprietary and open systems operating systems for network devices and appliances
"/media/Dados/bases/SWDE/job/job-jobtarget/1212.htm","College/University names, city, and state"
"/media/Dados/bases/SWDE/job/job-jobtarget/1061.htm",Lending in all 50 states
"/media/Dados/bases/SWDE/job/job-jobtarget/1530.htm","Organized, timely and accurate"
"/media/Dados/bases/SWDE/job/job-jobtarget/1127.htm",Lending in all 50 states
"/media/Dados/bases/SWDE/job/job-jobtarget/1883.htm",Serve as the technical sales lead and liaison from customer transitioning to Vivísimo Technical Support team during trial or evaluation phase.
"/media/Dados/bases/SWDE/job/job-jobtarget/0750.htm",Knowledge of financial and accounting software applications.
"/media/Dados/bases/SWDE/job/job-jobtarget/1508.htm",Meticulous attention to detail
"/media/Dados/bases/SWDE/job/job-jobtarget/0039.htm","More than 4 years experience writing code using languages such as (and not limited to) PL/1, Java, C, C++, J2EE, Struts"
"/media/Dados/bases/SWDE/job/job-jobtarget/1993.htm",Excellent code documentation and commenting skills.
"/media/Dados/bases/SWDE/job/job-jobtarget/1939.htm","More than 4 years experience writing code using languages such as (and not limited to) PL/1, Java, C, C++, J2EE, Struts"
"/media/Dados/bases/SWDE/job/job-jobtarget/0103.htm",Advanced degree in Information Sciences or Business (MBA or MIS) preferred
"/media/Dados/bases/SWDE/job/job-jobtarget/1851.htm",Utilize top-down selling techniques to determine key decision makers
"/media/Dados/bases/SWDE/job/job-jobtarget/1867.htm",Experience in SW quality assurance development methods
"/media/Dados/bases/SWDE/job/job-jobtarget/1011.htm","Proven experience in digital marketing (email, web, social media);"
"/media/Dados/bases/SWDE/job/job-jobtarget/0929.htm",Ability to understand and advise customers on application solutions.
"/media/Dados/bases/SWDE/job/job-jobtarget/1542.htm",Prior SAP configuration experience in R/3 4.6 or above; Prior SAP configuration experience in ECC6 is highly desired.
"/media/Dados/bases/SWDE/job/job-jobtarget/1342.htm",3-5+ Years Experience in Cost Accounting and/or Health and Human Service Programs
"/media/Dados/bases/SWDE/job/job-jobtarget/1122.htm",Lending in all 50 states
"/media/Dados/bases/SWDE/job/job-jobtarget/0307.htm",Familiarity with multi-platform development (particularly Windows / Linux)
"/media/Dados/bases/SWDE/job/job-jobtarget/1095.htm",Lending in all 50 states
"/media/Dados/bases/SWDE/job/job-jobtarget/1033.htm",Has not resided in Israel for the past 3 years
"/media/Dados/bases/SWDE/job/job-jobtarget/1282.htm",answering the office phones if no one else is available;
"/media/Dados/bases/SWDE/job/job-jobtarget/0903.htm","One to three years as a writer, analyst, or executive assistant in a complex organization"
"/media/Dados/bases/SWDE/job/job-jobtarget/0185.htm",Ability to obtain a US Secret Security Clearance.
"/media/Dados/bases/SWDE/job/job-jobtarget/1642.htm",Directly related previous work experience.
"/media/Dados/bases/SWDE/job/job-jobtarget/1058.htm",Lending in all 50 states
"/media/Dados/bases/SWDE/job/job-jobtarget/1961.htm","Business Process Knowledge -- Order Processing, Invoicing/Billing, Supplier Order processing."
"/media/Dados/bases/SWDE/job/job-jobtarget/1107.htm",Lending in all 50 states
"/media/Dados/bases/SWDE/job/job-jobtarget/0040.htm","More than 4 years experience writing code using languages such as (and not limited to) PL/1, Java, C, C++, J2EE, Struts"
"/media/Dados/bases/SWDE/job/job-jobtarget/1057.htm","PhD with 3+ years of relevant experience in in vivo imaging in small animals, preferably in neurological models."
"/media/Dados/bases/SWDE/job/job-jobtarget/1812.htm",Holds regular status meetings with project team
"/media/Dados/bases/SWDE/job/job-jobtarget/0904.htm","One to three years as a writer, analyst, or executive assistant in a complex organization"
"/media/Dados/bases/SWDE/job/job-jobtarget/1841.htm",Excellent code documentation and commenting skills.
"/media/Dados/bases/SWDE/job/job-jobtarget/0066.htm","Like knowing that your routine is in fact, not routine"
"/media/Dados/bases/SWDE/job/job-jobtarget/1121.htm",Lending in all 50 states
"/media/Dados/bases/SWDE/job/job-jobtarget/0200.htm",Directly related previous work experience.
"/media/Dados/bases/SWDE/job/job-jobtarget/1857.htm",Experience in SW quality assurance development methods
"/media/Dados/bases/SWDE/job/job-jobtarget/0076.htm",Experience using modeling software.
"/media/Dados/bases/SWDE/job/job-jobtarget/0816.htm",10+ years in leadership
"/media/Dados/bases/SWDE/job/job-jobtarget/1113.htm",Lending in all 50 states
"/media/Dados/bases/SWDE/job/job-jobtarget/1886.htm",Adept at designing and implementing technology enabled business solutions for clients
"/media/Dados/bases/SWDE/job/job-jobtarget/0523.htm",CPA required/MBA preferred
"/media/Dados/bases/SWDE/job/job-jobtarget/1201.htm","Work with other business units to ensure consistent quality processes are developed, applied, and maintained in a consistent manner across ESSN"
"/media/Dados/bases/SWDE/job/job-jobtarget/1887.htm",Experience with the architecting and designing of Windows desktop infrastructure projects
"/media/Dados/bases/SWDE/job/job-jobtarget/1120.htm",Lending in all 50 states
"/media/Dados/bases/SWDE/job/job-jobtarget/0847.htm",some working knowledge of high level languages like C/C++ would also be a great advantage
"/media/Dados/bases/SWDE/job/job-jobtarget/1370.htm","Experience with managing, documenting and deploying a software solution"
"/media/Dados/bases/SWDE/job/job-jobtarget/1448.htm",Develop and maintain organizational filing systems.
"/media/Dados/bases/SWDE/job/job-jobtarget/1984.htm",Ability to relate to all levels of the user community and translate technical language to lay audiences.
"/media/Dados/bases/SWDE/job/job-jobtarget/1510.htm",Experience in Systems level quality assurance development methods
"/media/Dados/bases/SWDE/job/job-jobtarget/0081.htm","Encourage and accelerate global adoption of green building practices through LEED standards, tools and performance criteria"
"/media/Dados/bases/SWDE/job/job-jobtarget/1541.htm",experience in manufacturing operations.
"/media/Dados/bases/SWDE/job/job-jobtarget/0225.htm","Excellent health, dental and vision insurance, 100% company paid premiums for employees and their dependent"
"/media/Dados/bases/SWDE/job/job-jobtarget/1198.htm",May perform project management role.
"/media/Dados/bases/SWDE/job/job-jobtarget/0589.htm",Knowledge of Microsoft Windows Deployment Services is a plus
"/media/Dados/bases/SWDE/job/job-jobtarget/0822.htm",Excellent written and verbal communication skills
"/media/Dados/bases/SWDE/job/job-jobtarget/0837.htm",Three+ (3+) years recent experience in a hospital setting or large multi-specialty physician group practice required
"/media/Dados/bases/SWDE/job/job-jobtarget/0226.htm",§ Excellent communication and interpersonal skills
"/media/Dados/bases/SWDE/job/job-jobtarget/0292.htm",Ability and willingness to learn new material quickly and with little top down management
"/media/Dados/bases/SWDE/job/job-jobtarget/1256.htm","Perform routine installations, configurations per standard protocols."
"/media/Dados/bases/SWDE/job/job-jobtarget/0091.htm","Experience in design and implement FPGA solutions using Verilog, simulation, synthesis, and Place and Route tools."
"/media/Dados/bases/SWDE/job/job-jobtarget/1114.htm",Lending in all 50 states
"/media/Dados/bases/SWDE/job/job-jobtarget/1972.htm",Competency in high speed electrical circuit design with semiconductor lasers and detectors is highly desirable
"/media/Dados/bases/SWDE/job/job-jobtarget/1422.htm",Minimum of basic knowledge of computers
"/media/Dados/bases/SWDE/job/job-jobtarget/0042.htm",Know strengths and weaknesses of key competitors in account and how to leverage this knowledge in the account.
"/media/Dados/bases/SWDE/job/job-jobtarget/0068.htm",Ability to work with Web-development tools for new applications.
"/media/Dados/bases/SWDE/job/job-jobtarget/0823.htm","Professional communication skills, both verbal and written"
"/media/Dados/bases/SWDE/job/job-jobtarget/0805.htm",Frequently lifts and carries 10-70lbs
"/media/Dados/bases/SWDE/job/job-jobtarget/1115.htm",Lending in all 50 states
"/media/Dados/bases/SWDE/job/job-jobtarget/0113.htm",Experience in the association or non-profit industry
"/media/Dados/bases/SWDE/job/job-jobtarget/1432.htm",Experience with a UNIX / LINUX environment
"/media/Dados/bases/SWDE/job/job-jobtarget/1007.htm",A benefits package that includes
"/media/Dados/bases/SWDE/job/job-jobtarget/0721.htm",5+ years with proven track record in new business development selling offshore IT services
"/media/Dados/bases/SWDE/job/job-jobtarget/1288.htm",Strong computer skills
"/media/Dados/bases/SWDE/job/job-jobtarget/1278.htm",develop advanced prototypes leading to demonstration in industrial environment
"/media/Dados/bases/SWDE/job/job-jobtarget/1102.htm",Lending in all 50 states
"/media/Dados/bases/SWDE/job/job-jobtarget/1044.htm",Ability to coordinate internal and external partners to deliver appropriate solution sale.
"/media/Dados/bases/SWDE/job/job-jobtarget/0838.htm",Vacation
"/media/Dados/bases/SWDE/job/job-jobtarget/1128.htm",Lending in all 50 states
"/media/Dados/bases/SWDE/job/job-jobtarget/0794.htm",Webdynpro Java
"/media/Dados/bases/SWDE/job/job-jobtarget/0841.htm",Five years of membership-related experience
"/media/Dados/bases/SWDE/job/job-jobtarget/1255.htm","Bachelor's Degree (undergraduate) required, preference would be in business or marketing or communications"
"/media/Dados/bases/SWDE/job/job-jobtarget/1123.htm",Facilitates negotiation/approval of contract.
"/media/Dados/bases/SWDE/job/job-jobtarget/1125.htm",Lending in all 50 states
"/media/Dados/bases/SWDE/job/job-jobtarget/1430.htm",Ability to apply Company policies and procedures in connection with complex investigations.
"/media/Dados/bases/SWDE/job/job-jobtarget/0041.htm",Directly related previous work experience.
"/media/Dados/bases/SWDE/job/job-jobtarget/1096.htm",Lending in all 50 states
