URL,EXTRACTED VALUE
"/media/Dados/bases/SWDE/job/job-jobtarget/1122.htm",Establish a referral base to generate business.
"/media/Dados/bases/SWDE/job/job-jobtarget/1808.htm","Help to define, document, and utilize consistent coding standards"
"/media/Dados/bases/SWDE/job/job-jobtarget/0305.htm",Develop software installations (as required).
"/media/Dados/bases/SWDE/job/job-jobtarget/1837.htm",Knowledge of software licensing concepts and implementations
"/media/Dados/bases/SWDE/job/job-jobtarget/1719.htm",Ability to develop automated custom QA solutions without relying on commercial software packages
"/media/Dados/bases/SWDE/job/job-jobtarget/1282.htm",ensuring that all internal and external reports are completed in a timely manner;
"/media/Dados/bases/SWDE/job/job-jobtarget/0387.htm",Assist with communication to customers and management team
"/media/Dados/bases/SWDE/job/job-jobtarget/1058.htm",Establish a referral base to generate business.
"/media/Dados/bases/SWDE/job/job-jobtarget/0908.htm",Submitting pending contracts to VP Network Development/Business Expansion for review and approval.
"/media/Dados/bases/SWDE/job/job-jobtarget/1057.htm",Represent Neurodegeneration therapeutic area team in biomarker planning for clinical research and development of molecules.
"/media/Dados/bases/SWDE/job/job-jobtarget/1326.htm",Requires inpatient and outpatient ICD-9-CM and CPT coding experience in a hospital setting utilizing an encoder.
"/media/Dados/bases/SWDE/job/job-jobtarget/1654.htm","Must be able to use their problem solving, reasoning, and judgment skills to resolve issues with minimal supervision."
"/media/Dados/bases/SWDE/job/job-jobtarget/1121.htm",Establish a referral base to generate business.
"/media/Dados/bases/SWDE/job/job-jobtarget/0994.htm",Contribute to knowledge capital via project documentation and best practice solutions
"/media/Dados/bases/SWDE/job/job-jobtarget/1675.htm","Relocation to the Madison, WI area is necessary and will be fully reimbursed"
"/media/Dados/bases/SWDE/job/job-jobtarget/0076.htm","Tests pricing assumptions and the appropriate premiums, interests margins, reserves, and cash values for new products."
"/media/Dados/bases/SWDE/job/job-jobtarget/1721.htm",Ability to develop automated custom QA solutions without relying on commercial software packages
"/media/Dados/bases/SWDE/job/job-jobtarget/0306.htm",Leads or participates in business process redesign teams.
"/media/Dados/bases/SWDE/job/job-jobtarget/1875.htm",Develop measurement systems to assess the effectiveness of recruiting efforts (metrics)
"/media/Dados/bases/SWDE/job/job-jobtarget/0944.htm",Negotiate rates that will achieve yearly department goals for Medical Loss Ratios (MRL).
"/media/Dados/bases/SWDE/job/job-jobtarget/0847.htm",work from functional design specifications
"/media/Dados/bases/SWDE/job/job-jobtarget/1552.htm",Detailed knowledge and experience using and facilitating the use of project management and system development life cycle methodologies
"/media/Dados/bases/SWDE/job/job-jobtarget/1448.htm",A proactive approach to task management and demonstrated ability to anticipate and prevent problems.
"/media/Dados/bases/SWDE/job/job-jobtarget/0482.htm",Maintenance of RTU's in a SCADA system.
"/media/Dados/bases/SWDE/job/job-jobtarget/1751.htm","Presents well-organized and convincing information, synthesizing complex ideas and communicating them clearly to others."
"/media/Dados/bases/SWDE/job/job-jobtarget/0058.htm",Prepare and/or review tax packages for IAC and its subsidiaries.
"/media/Dados/bases/SWDE/job/job-jobtarget/0822.htm",Weatherhead 100
"/media/Dados/bases/SWDE/job/job-jobtarget/0927.htm",Collaborates with all other financial department personnel to support overall goals and objectives
"/media/Dados/bases/SWDE/job/job-jobtarget/0837.htm",Designs system-wide plans for auditing and monitoring.
"/media/Dados/bases/SWDE/job/job-jobtarget/1325.htm",Working knowledge of GAAP and Sarbanes Oxley requirements
"/media/Dados/bases/SWDE/job/job-jobtarget/1410.htm",Web site management skills a plus.
"/media/Dados/bases/SWDE/job/job-jobtarget/1607.htm",reliable transportation to make daily deposits and property marketing
"/media/Dados/bases/SWDE/job/job-jobtarget/1070.htm",Have the ability to think creatively and work independently on projects and initiatives from conception to completion.
"/media/Dados/bases/SWDE/job/job-jobtarget/0320.htm",Basic understanding of IP networking and Active Directory
"/media/Dados/bases/SWDE/job/job-jobtarget/0467.htm",Ability to deal effectively with changing priorities
"/media/Dados/bases/SWDE/job/job-jobtarget/1972.htm","Firmware development using C, ++ for product support"
"/media/Dados/bases/SWDE/job/job-jobtarget/1017.htm",Experience with server-side web frameworks such as JSP or ASP.Net
"/media/Dados/bases/SWDE/job/job-jobtarget/1444.htm","Update all POG’s with new items, discontinued items, resets, etc. Ensure data integrity for all POG’s within the category."
"/media/Dados/bases/SWDE/job/job-jobtarget/1288.htm","Utilize the internal OnBase systems during the technical support process and find new, innovative ways to make the process more efficient"
"/media/Dados/bases/SWDE/job/job-jobtarget/1102.htm",Establish a referral base to generate business.
"/media/Dados/bases/SWDE/job/job-jobtarget/0838.htm",Assist in discussions between industry participants as necessary to address IP legal issues.
"/media/Dados/bases/SWDE/job/job-jobtarget/1305.htm",Basic coding expertise
"/media/Dados/bases/SWDE/job/job-jobtarget/0400.htm",Data analysis
"/media/Dados/bases/SWDE/job/job-jobtarget/1749.htm",Assists with identifying and estimating the cost of projects that are submitted through the strategic planning process
"/media/Dados/bases/SWDE/job/job-jobtarget/0794.htm",Knowledge of CE 7.1
"/media/Dados/bases/SWDE/job/job-jobtarget/1191.htm",Deliver overnight mail.
"/media/Dados/bases/SWDE/job/job-jobtarget/0263.htm",Demonstrate effective communication with colleagues
"/media/Dados/bases/SWDE/job/job-jobtarget/1035.htm",Contribute to knowledge capital via project documentation and best practice solutions
"/media/Dados/bases/SWDE/job/job-jobtarget/0089.htm","Documenting and developing routine and emergency procedures and practices, communicating same to UIT systems administration colleagues and management;"
