URL,EXTRACTED VALUE
"/media/Dados/bases/SWDE/job/job-jobtarget/1057.htm","Recruit, train and manage up to 3 direct reports."
"/media/Dados/bases/SWDE/job/job-jobtarget/0114.htm",Proficient use of statistical software SAS
"/media/Dados/bases/SWDE/job/job-jobtarget/1121.htm",3 - 5 Years Loan Officer experience.
"/media/Dados/bases/SWDE/job/job-jobtarget/0994.htm","Bachelors or equivalent degree in a business, technical or related field is required"
"/media/Dados/bases/SWDE/job/job-jobtarget/0076.htm",Bachelor's degree (or equivalent work experience).
"/media/Dados/bases/SWDE/job/job-jobtarget/0306.htm",A minimum two (2) years experience with information systems change management.
"/media/Dados/bases/SWDE/job/job-jobtarget/1596.htm","A 4-year degree in accounting, finance, business or related field"
"/media/Dados/bases/SWDE/job/job-jobtarget/0523.htm",Possesses strong US GAAP technical accounting and compliance knowledge.
"/media/Dados/bases/SWDE/job/job-jobtarget/1039.htm",Heavy overnight travel (at least 75%) by land and/or air.
"/media/Dados/bases/SWDE/job/job-jobtarget/0847.htm",PLC programming in IEC 61131
"/media/Dados/bases/SWDE/job/job-jobtarget/1448.htm",Prepare monthly financial reports for Executive Director and Board and identify areas of concern or risk.
"/media/Dados/bases/SWDE/job/job-jobtarget/0826.htm",Bachelor's degree in Computer Science or equivalent field
"/media/Dados/bases/SWDE/job/job-jobtarget/1510.htm","Assist in the setting and tracking of schedules, costs, actions and issues."
"/media/Dados/bases/SWDE/job/job-jobtarget/0081.htm",Perform quality control (QC) review of work done by external review teams
"/media/Dados/bases/SWDE/job/job-jobtarget/1541.htm",Executes job responsibilities (such as producing basic to moderately complex output) with limited guidance.
"/media/Dados/bases/SWDE/job/job-jobtarget/1931.htm",Profiles and qualifies opportunities rigorously to ensure sound application of HP's resources on significant deals
"/media/Dados/bases/SWDE/job/job-jobtarget/1361.htm",Health & Welfare Benefits Consulting
"/media/Dados/bases/SWDE/job/job-jobtarget/0482.htm",High school diploma or recognized equivalent.
"/media/Dados/bases/SWDE/job/job-jobtarget/0225.htm","A 4-year degree in technology, education, or communication-related program."
"/media/Dados/bases/SWDE/job/job-jobtarget/1796.htm",Monitor systems and identify performance issues reactively.
"/media/Dados/bases/SWDE/job/job-jobtarget/1751.htm",Required
"/media/Dados/bases/SWDE/job/job-jobtarget/0589.htm",6+ years of Windows product development experience
"/media/Dados/bases/SWDE/job/job-jobtarget/1359.htm","Proficiency with Microsoft Office (Excel, Word)"
"/media/Dados/bases/SWDE/job/job-jobtarget/0927.htm",5 - 7 years experience in the financial reporting and general ledger accounting.
"/media/Dados/bases/SWDE/job/job-jobtarget/1573.htm",SAP FS Business Partner
"/media/Dados/bases/SWDE/job/job-jobtarget/0517.htm",Demonstrated business acumen for product marketing management and proven ability to apply marketing fundamentals
"/media/Dados/bases/SWDE/job/job-jobtarget/1422.htm",Excellent communication skills
"/media/Dados/bases/SWDE/job/job-jobtarget/0626.htm",Ph.D. in Molecular Biology or related sciences.
"/media/Dados/bases/SWDE/job/job-jobtarget/0839.htm",Minimum of three years of commercial lines underwriting experience
"/media/Dados/bases/SWDE/job/job-jobtarget/1288.htm",Daycare
"/media/Dados/bases/SWDE/job/job-jobtarget/1137.htm","Knowledge of SOAP , C++ and C"
"/media/Dados/bases/SWDE/job/job-jobtarget/1278.htm",heterogeneous cluster architectures
"/media/Dados/bases/SWDE/job/job-jobtarget/1102.htm",3 - 5 Years Loan Officer experience.
"/media/Dados/bases/SWDE/job/job-jobtarget/1044.htm",University or Bachelor's degree preferred.
"/media/Dados/bases/SWDE/job/job-jobtarget/0838.htm","At least 3 years as a registered patent attorney (J.D., registration before the U.S. P.T.O., and license to practice in at least one state)."
"/media/Dados/bases/SWDE/job/job-jobtarget/0788.htm",influencing skills; mastery in English (Spanish is an asset).
"/media/Dados/bases/SWDE/job/job-jobtarget/0794.htm",Experience of WebDynpro and Java Development would be a real plus
"/media/Dados/bases/SWDE/job/job-jobtarget/1951.htm","Application development for integration with Microsoft Office desktop applications such as Outlook, Microsoft Exchange and SharePoint"
"/media/Dados/bases/SWDE/job/job-jobtarget/0841.htm",Bachelor’s degree from an accredited institution of higher education
"/media/Dados/bases/SWDE/job/job-jobtarget/1715.htm",Must have proven record of successful leadership to a technical team in design and development tasks.
"/media/Dados/bases/SWDE/job/job-jobtarget/1035.htm","Bachelors or equivalent degree in a business, technical or related field is required"
"/media/Dados/bases/SWDE/job/job-jobtarget/0041.htm",Works on a smaller number of accounts of greater strategic (long term) value to HP.
"/media/Dados/bases/SWDE/job/job-jobtarget/0089.htm",Bachelor's degree in a technical field and minimum of six plus (6+) years of related experience
