URL,EXTRACTED VALUE
"/media/Dados/bases/SWDE/job/job-jobtarget/1314.htm",5 years of health care insurance experience or operations experience in a call center or production environment
"/media/Dados/bases/SWDE/job/job-jobtarget/0757.htm",Crain's Cleveland Business Coolest Places to Work
"/media/Dados/bases/SWDE/job/job-jobtarget/0710.htm","When assigned design-related activities, prepares presentation drawings, and other deliverables as required by the Licensed Professional."
"/media/Dados/bases/SWDE/job/job-jobtarget/1061.htm","Analyze customers financial status, credit and property to determine available mortgage products."
"/media/Dados/bases/SWDE/job/job-jobtarget/0252.htm","Design, develop, document, test and support modules for a network monitoring agent"
"/media/Dados/bases/SWDE/job/job-jobtarget/1059.htm",Some degree related coursework preferred.
"/media/Dados/bases/SWDE/job/job-jobtarget/1470.htm",Working with business analysts to design and develop technical solutions to new business problems
"/media/Dados/bases/SWDE/job/job-jobtarget/0013.htm",Marketing lead to coordinate with Center of Excellence (COE) functions
"/media/Dados/bases/SWDE/job/job-jobtarget/1127.htm","Analyze customers financial status, credit and property to determine available mortgage products."
"/media/Dados/bases/SWDE/job/job-jobtarget/1335.htm",Architect and develop solutions based on different design algorithms to a set of highly complex problems.
"/media/Dados/bases/SWDE/job/job-jobtarget/0515.htm",Must be able to integrate various technologies to implement comprehensive research management applications.
"/media/Dados/bases/SWDE/job/job-jobtarget/1883.htm","Establish effective working relationship with sales executives, management and technical team members."
"/media/Dados/bases/SWDE/job/job-jobtarget/0779.htm","Experience with evaluation, selection and application of standard engineering methods, techniques, procedures and criteria."
"/media/Dados/bases/SWDE/job/job-jobtarget/1581.htm",Minimum two (2) years Quality experience in a hospital setting.
"/media/Dados/bases/SWDE/job/job-jobtarget/0490.htm",Work closely with department staff as well as staff in other corporate departments
"/media/Dados/bases/SWDE/job/job-jobtarget/1882.htm",Take incoming orders via phone and fax and enter into internal order system;
"/media/Dados/bases/SWDE/job/job-jobtarget/0929.htm",Expand customer base through the development and execution of a Target Account Business Plan.
"/media/Dados/bases/SWDE/job/job-jobtarget/1135.htm","appropriate and timely response: BMS, FLS, security, equipment and environmental monitoring"
"/media/Dados/bases/SWDE/job/job-jobtarget/1233.htm","Analyzes customer relationships relative to their financial needs, recommends products/services and sells solutions that will meet those needs."
"/media/Dados/bases/SWDE/job/job-jobtarget/1122.htm","Analyze customers financial status, credit and property to determine available mortgage products."
"/media/Dados/bases/SWDE/job/job-jobtarget/1808.htm",Develop and implement unit tests
"/media/Dados/bases/SWDE/job/job-jobtarget/1837.htm",Team leadership experience
"/media/Dados/bases/SWDE/job/job-jobtarget/1719.htm","Experience diagnosing, reporting, tracking and resolving quality issues"
"/media/Dados/bases/SWDE/job/job-jobtarget/1282.htm",serving as a primary contact for all banks and brokerage houses that Northern Plains has accounts with;
"/media/Dados/bases/SWDE/job/job-jobtarget/0903.htm","Produces, reports, and direct projects on behalf of the vice presidents;"
"/media/Dados/bases/SWDE/job/job-jobtarget/0583.htm","Collaborate with analysts, programmers, and designers in conceptualizing and development of new software programs and applications."
"/media/Dados/bases/SWDE/job/job-jobtarget/0387.htm","Provide support on various projects: developing new processes or tools for the Analyst Team, finding better ways to communicate information, etc."
"/media/Dados/bases/SWDE/job/job-jobtarget/1058.htm","Analyze customers financial status, credit and property to determine available mortgage products."
"/media/Dados/bases/SWDE/job/job-jobtarget/0908.htm",Performing complex analysis of utilization and network adequacy and formulating recommendations to V.P. of Network Operations/Business Development.
"/media/Dados/bases/SWDE/job/job-jobtarget/1655.htm",RHIA
"/media/Dados/bases/SWDE/job/job-jobtarget/1057.htm",Participate in and manage extramural academic collaborations and CRO imaging investigations.
"/media/Dados/bases/SWDE/job/job-jobtarget/1281.htm",Oversee the Title IV processing of new and continuing student loan and grant applications.
"/media/Dados/bases/SWDE/job/job-jobtarget/1326.htm","Requires RHIA, RHIT and/or CCS certification."
"/media/Dados/bases/SWDE/job/job-jobtarget/0904.htm","Produces, reports, and direct projects on behalf of the vice presidents;"
"/media/Dados/bases/SWDE/job/job-jobtarget/1121.htm","Analyze customers financial status, credit and property to determine available mortgage products."
"/media/Dados/bases/SWDE/job/job-jobtarget/1675.htm",Ability to successfully present to customers
"/media/Dados/bases/SWDE/job/job-jobtarget/1721.htm","Experience diagnosing, reporting, tracking and resolving quality issues"
"/media/Dados/bases/SWDE/job/job-jobtarget/1596.htm","Pass-through entities, both within and outside of a tiered structure"
"/media/Dados/bases/SWDE/job/job-jobtarget/1875.htm","Four-year degree, graduate degree preferred"
"/media/Dados/bases/SWDE/job/job-jobtarget/1039.htm","Implement safety and quality control procedures during disassembly, inspection, and assembly of combustion turbines."
"/media/Dados/bases/SWDE/job/job-jobtarget/0847.htm",design and programming of HMI systems
"/media/Dados/bases/SWDE/job/job-jobtarget/1552.htm",Minimum of five plus (5+) of related experience
"/media/Dados/bases/SWDE/job/job-jobtarget/1448.htm","Five years relevant administration experience, including at least three years working with project accounting, tracking, and measures."
"/media/Dados/bases/SWDE/job/job-jobtarget/0482.htm","Install, if necessary, and maintain all radios in the mobile communication systems, including base and repeater stations and mobile radios."
"/media/Dados/bases/SWDE/job/job-jobtarget/1751.htm",Analysis of current web and COTS Applications
"/media/Dados/bases/SWDE/job/job-jobtarget/0822.htm",Crain's Cleveland Business Coolest Places to Work
"/media/Dados/bases/SWDE/job/job-jobtarget/0927.htm","Ensure and accurate and timely monthly, quarterly and year end close."
"/media/Dados/bases/SWDE/job/job-jobtarget/0837.htm",Synchronizes system-wide privacy program materials and messaging to present a uniform message.
"/media/Dados/bases/SWDE/job/job-jobtarget/1325.htm",Bachelor’s degree in Accounting required; CPA track required
"/media/Dados/bases/SWDE/job/job-jobtarget/1410.htm","Self motivated, self starter - willing and able to work independently and in collaboration with a professional team."
"/media/Dados/bases/SWDE/job/job-jobtarget/1607.htm","a proven marketing, sales or public relations background"
"/media/Dados/bases/SWDE/job/job-jobtarget/1070.htm",Five plus years of experience working in a non-profit or academic environment
"/media/Dados/bases/SWDE/job/job-jobtarget/0320.htm",Strong analytical ability and troubleshooting skills
"/media/Dados/bases/SWDE/job/job-jobtarget/0467.htm",Systems validation experience preferred
"/media/Dados/bases/SWDE/job/job-jobtarget/1972.htm",Software development for data collection and test equipment controls using C# and SQL
"/media/Dados/bases/SWDE/job/job-jobtarget/1600.htm",Cultivate and maintain relationships with key providers
"/media/Dados/bases/SWDE/job/job-jobtarget/0839.htm",Direct contact with agents and policyholders regarding various risk situations.
"/media/Dados/bases/SWDE/job/job-jobtarget/1017.htm","Expert HTML, JavaScript, and CSS Skills; GWT a Plus"
"/media/Dados/bases/SWDE/job/job-jobtarget/1444.htm","Review and analyze information such as item movement, SKU assortment, sell-through, etc. Report assessment of data and trends to Category Manager."
"/media/Dados/bases/SWDE/job/job-jobtarget/1015.htm",Some experience in programming in both a high-order and an assembly language required.
"/media/Dados/bases/SWDE/job/job-jobtarget/0678.htm",Responsible for performing gap analysis and developing overall network development strategy for the assigned region for all lines of business.
"/media/Dados/bases/SWDE/job/job-jobtarget/1288.htm",Maintain ownership and follow through consistently on communication of all Support Issues
"/media/Dados/bases/SWDE/job/job-jobtarget/1102.htm","Analyze customers financial status, credit and property to determine available mortgage products."
"/media/Dados/bases/SWDE/job/job-jobtarget/0884.htm",Participate in process development and in projects to assure security policy and standards are applied appropriately
"/media/Dados/bases/SWDE/job/job-jobtarget/0205.htm",These technologies are leveraged to support the development and ongoing sustainment of applications created to meet Regence's business needs
"/media/Dados/bases/SWDE/job/job-jobtarget/1305.htm",5 years of health care insurance experience or operations experience in a call center or production environment
"/media/Dados/bases/SWDE/job/job-jobtarget/0400.htm",Running participants in brain wave experiments
"/media/Dados/bases/SWDE/job/job-jobtarget/1749.htm",Acts to facilitate in depth understanding to both technical and non-technical audiences while fulfilling business needs
"/media/Dados/bases/SWDE/job/job-jobtarget/0794.htm",Webdynpro Java
"/media/Dados/bases/SWDE/job/job-jobtarget/0263.htm",Provide construction documentation for outside contractors and ensures final products meet criteria
"/media/Dados/bases/SWDE/job/job-jobtarget/0886.htm",Cultivate and maintain relationships with key providers
"/media/Dados/bases/SWDE/job/job-jobtarget/0089.htm",Analyzing and resolving reported system and application problems;
