URL,EXTRACTED VALUE
"/media/Dados/bases/SWDE/job/job-jobtarget/1603.htm","Bidsystem is the 5th largest advertiser marketplace next to Google, Yahoo, Facebook and MSN."
"/media/Dados/bases/SWDE/job/job-jobtarget/1397.htm",Management Employment Opportunity
"/media/Dados/bases/SWDE/job/job-jobtarget/0662.htm",Apply online to position P05019 at the FEGS Career Website: www.fegs.org/careers. Please include cover letter indicating salary requirements.
"/media/Dados/bases/SWDE/job/job-jobtarget/1448.htm","Applicants must be proactive and resourceful, possess exceptional Excel and cost/project accounting skills, and pay extreme attention to detail."
"/media/Dados/bases/SWDE/job/job-jobtarget/1079.htm",b. Estimate review and validation
"/media/Dados/bases/SWDE/job/job-jobtarget/0159.htm",• They will also be responsible for working with the project team on Environment Migration and supporting all development activities.
"/media/Dados/bases/SWDE/job/job-jobtarget/0764.htm",Education
"/media/Dados/bases/SWDE/job/job-jobtarget/0272.htm","Are you interested in joining a foundry that is growing, expanding and emerging as a foundry that redefines the industry?"
"/media/Dados/bases/SWDE/job/job-jobtarget/0775.htm","Director, Facilities, Maintenance & Operations"
"/media/Dados/bases/SWDE/job/job-jobtarget/0288.htm",Research Scientist 3
"/media/Dados/bases/SWDE/job/job-jobtarget/1862.htm",HARVEY MUDD COLLEGE
"/media/Dados/bases/SWDE/job/job-jobtarget/1655.htm",Reviews facility case mix for financial data to identify trends and problem areas.
"/media/Dados/bases/SWDE/job/job-jobtarget/1234.htm",Why Work For Florida Career College?
"/media/Dados/bases/SWDE/job/job-jobtarget/0688.htm",Management Employment Opportunity
"/media/Dados/bases/SWDE/job/job-jobtarget/1439.htm","980 Fremont Street, Monterey, California 93940 • (831) 646-4016 • FAX (831) 646-3012"
"/media/Dados/bases/SWDE/job/job-jobtarget/1389.htm",and one of the nation's
"/media/Dados/bases/SWDE/job/job-jobtarget/1570.htm",ANNOUNCEMENT OF EMPLOYMENT OPPORTUNITY
"/media/Dados/bases/SWDE/job/job-jobtarget/0267.htm",This position would be 40 hours per week. Columbia Community Bank is a locally owned business bank focused on business banking clients.
"/media/Dados/bases/SWDE/job/job-jobtarget/0383.htm",ANNOUNCEMENT OF EMPLOYMENT OPPORTUNITY
"/media/Dados/bases/SWDE/job/job-jobtarget/0484.htm",Experience with any of the following:
"/media/Dados/bases/SWDE/job/job-jobtarget/1216.htm",JOB ANNOUNCEMENT
"/media/Dados/bases/SWDE/job/job-jobtarget/0146.htm",Valuation Section within the Retail Retirement Line of Business.
"/media/Dados/bases/SWDE/job/job-jobtarget/0150.htm",Qualifications/Requirements:
"/media/Dados/bases/SWDE/job/job-jobtarget/1355.htm","Human Resources Director, Americas Region"
"/media/Dados/bases/SWDE/job/job-jobtarget/1365.htm",This position r
"/media/Dados/bases/SWDE/job/job-jobtarget/0301.htm",Write policy and procedures related to staff development activities for the Clinic and draft and present trainings.
"/media/Dados/bases/SWDE/job/job-jobtarget/0151.htm",Provide training and assistance on daily system operational processes. Assist as needed with ad-hoc reports and identifying data integrity problems.
"/media/Dados/bases/SWDE/job/job-jobtarget/0214.htm",You don’t have to be a doctor to make a difference!
"/media/Dados/bases/SWDE/job/job-jobtarget/1132.htm","Provide career advising knowledge to students and graduates who are in need of identifying, exploring or changing a career direction."
"/media/Dados/bases/SWDE/job/job-jobtarget/1195.htm",The qualified candidate will be responsible for carrying out the following duties:
"/media/Dados/bases/SWDE/job/job-jobtarget/0670.htm",This is an excellent opportunity to take outpatient coding to the next level and be involved with other hospitals departments.
"/media/Dados/bases/SWDE/job/job-jobtarget/0149.htm",Qualifications/Requirements:
"/media/Dados/bases/SWDE/job/job-jobtarget/1091.htm",We are currently looking to fill a Project Manager position.
