URL,EXTRACTED VALUE
"/media/Dados/bases/SWDE/job/job-jobtarget/0768.htm",Superior knowledge of key business and contractual risks.
"/media/Dados/bases/SWDE/job/job-jobtarget/0266.htm",Bachelor's degree or equivalent experience in Marketing
"/media/Dados/bases/SWDE/job/job-jobtarget/0327.htm",Must be able to work independently and in a team environment.
"/media/Dados/bases/SWDE/job/job-jobtarget/1419.htm",2+ years experience in project management or product development.
"/media/Dados/bases/SWDE/job/job-jobtarget/0445.htm","Strong background and experience in audit, risk management or financial services."
"/media/Dados/bases/SWDE/job/job-jobtarget/1101.htm",3 - 5 Years Loan Officer experience.
"/media/Dados/bases/SWDE/job/job-jobtarget/1435.htm",Minimum of 3 years experience in IT positions
"/media/Dados/bases/SWDE/job/job-jobtarget/1447.htm",Bachelor’s degree from an accredited institution of higher education
"/media/Dados/bases/SWDE/job/job-jobtarget/1098.htm",3 - 5 Years loan origination experience
"/media/Dados/bases/SWDE/job/job-jobtarget/1047.htm","Is considered an expert in knowledge of products, solution or service offerings as well as competitor's offerings to be able to sell large solutions."
"/media/Dados/bases/SWDE/job/job-jobtarget/1511.htm","Assist in the setting and tracking of schedules, costs, actions and issues."
"/media/Dados/bases/SWDE/job/job-jobtarget/1026.htm",Bachelor's degree in Accounting.
"/media/Dados/bases/SWDE/job/job-jobtarget/1060.htm",3 - 5 Years loan origination experience
"/media/Dados/bases/SWDE/job/job-jobtarget/1142.htm",Familiarity with various networking protocols.
"/media/Dados/bases/SWDE/job/job-jobtarget/0810.htm","Excellent writing, editing, grammar and proofread skills (print and electronic media)"
"/media/Dados/bases/SWDE/job/job-jobtarget/1105.htm",3 - 5 Years Loan Officer experience.
"/media/Dados/bases/SWDE/job/job-jobtarget/1385.htm",Assist with product development.
"/media/Dados/bases/SWDE/job/job-jobtarget/1728.htm",Microsoft Visual Studio 2008
"/media/Dados/bases/SWDE/job/job-jobtarget/0334.htm",Develop sector strategies for exhibition and conferences
"/media/Dados/bases/SWDE/job/job-jobtarget/0112.htm",5+ years experience working with iMIS or other association management software
"/media/Dados/bases/SWDE/job/job-jobtarget/1267.htm",Assist in the administration of other CRM / “Back-Office” systems.
"/media/Dados/bases/SWDE/job/job-jobtarget/1888.htm",Experience with application packaging for the desktop
"/media/Dados/bases/SWDE/job/job-jobtarget/1461.htm",Full name
"/media/Dados/bases/SWDE/job/job-jobtarget/0088.htm","Understanding of basic Internet, website and technology concepts"
"/media/Dados/bases/SWDE/job/job-jobtarget/1894.htm",Bachelor's Degree in Electrical Engineering.
"/media/Dados/bases/SWDE/job/job-jobtarget/0694.htm","Experience with our core technologies (Adobe Flex, FileMaker, PHP and SQL)."
"/media/Dados/bases/SWDE/job/job-jobtarget/0879.htm",Create and manage corporate volunteer opportunities
"/media/Dados/bases/SWDE/job/job-jobtarget/1252.htm",Must have a BS in Accounting or Finance or other related area. An MBA is a plus.
"/media/Dados/bases/SWDE/job/job-jobtarget/0310.htm","1 - 3 years customer support, sales or account management experience"
"/media/Dados/bases/SWDE/job/job-jobtarget/0347.htm",Excellent written and verbal communication skills.
"/media/Dados/bases/SWDE/job/job-jobtarget/1666.htm","2 year degree in an IT related field, or 4 years experience in an IT related job position"
"/media/Dados/bases/SWDE/job/job-jobtarget/0673.htm",Maintain statistical data for general ledger allocations
"/media/Dados/bases/SWDE/job/job-jobtarget/1509.htm","Assist in the setting and tracking of schedules, costs, actions and issues."
"/media/Dados/bases/SWDE/job/job-jobtarget/1100.htm",3 - 5 Years Loan Officer experience.
"/media/Dados/bases/SWDE/job/job-jobtarget/1009.htm","Expert in SAP's CRM for Banking solutions: Account Origination (FS Quotation, Product configuration, Product Bundling, Total Commitment)"
"/media/Dados/bases/SWDE/job/job-jobtarget/0074.htm","A BS/MS in Computer Science, Information Systems, or Engineering."
"/media/Dados/bases/SWDE/job/job-jobtarget/0936.htm",A BS in mechanical engineering or in a related engineering discipline.
"/media/Dados/bases/SWDE/job/job-jobtarget/0351.htm",Undergraduate degree in Electrical Engineering
"/media/Dados/bases/SWDE/job/job-jobtarget/1124.htm",3 - 5 Years loan origination experience
"/media/Dados/bases/SWDE/job/job-jobtarget/1318.htm","Bachelor's Degree in accounting, finance, or business or three years of accounting experience is required"
"/media/Dados/bases/SWDE/job/job-jobtarget/1146.htm","Gathers and assesses customer needs, both business and technical"
"/media/Dados/bases/SWDE/job/job-jobtarget/1076.htm",A baccalaureate or higher degree
"/media/Dados/bases/SWDE/job/job-jobtarget/1819.htm",Ability to translate business needs into data analysis and reporting solutions.
"/media/Dados/bases/SWDE/job/job-jobtarget/1866.htm",Bachelor's degree OR a High School diploma and 3 years of directly related experience
"/media/Dados/bases/SWDE/job/job-jobtarget/0335.htm","Bachelor's degree in interaction design, graphic design, information design, art, or related field"
"/media/Dados/bases/SWDE/job/job-jobtarget/1392.htm","3+years' experience in SQL 2008/2005 database administration, utilities and tools;"
"/media/Dados/bases/SWDE/job/job-jobtarget/1788.htm","B.A., B.S. or equivalent work experience or technical and/or product knowledge comparable to four-year degree in a related area"
"/media/Dados/bases/SWDE/job/job-jobtarget/0157.htm",Manages the team supporting the projects and implementations of an Enterprise voice and data network at the U.S. Department of State.
"/media/Dados/bases/SWDE/job/job-jobtarget/1106.htm",3 - 5 Years Loan Officer experience.
"/media/Dados/bases/SWDE/job/job-jobtarget/1112.htm",3 - 5 Years Loan Officer experience.
"/media/Dados/bases/SWDE/job/job-jobtarget/0538.htm",Demonstrated Program Management skills and leadership abilities
"/media/Dados/bases/SWDE/job/job-jobtarget/1881.htm",Bachelor's degree in computer science or related field
"/media/Dados/bases/SWDE/job/job-jobtarget/1810.htm",Ability to translate business needs into data analysis and reporting solutions.
"/media/Dados/bases/SWDE/job/job-jobtarget/0519.htm",Consulting delivery
"/media/Dados/bases/SWDE/job/job-jobtarget/0752.htm",5-7 years application or storage system development experience.
"/media/Dados/bases/SWDE/job/job-jobtarget/1182.htm",BS or MS degree in electrical engineering from an accredited university.
"/media/Dados/bases/SWDE/job/job-jobtarget/1110.htm",3 - 5 Years Loan Officer experience.
"/media/Dados/bases/SWDE/job/job-jobtarget/1522.htm",Bachelor's degree required and Masters degree preferred.
"/media/Dados/bases/SWDE/job/job-jobtarget/0349.htm",Provide sensitive financial aid counsel regarding financial aid options available to students and families.
"/media/Dados/bases/SWDE/job/job-jobtarget/0930.htm",Prepare onsite materials and shipment for annual meetings
"/media/Dados/bases/SWDE/job/job-jobtarget/0057.htm",ITO - Specializes in Network Management solutions
"/media/Dados/bases/SWDE/job/job-jobtarget/1212.htm",Full name
"/media/Dados/bases/SWDE/job/job-jobtarget/1230.htm",High school diploma or GED required.
"/media/Dados/bases/SWDE/job/job-jobtarget/0188.htm","Ability to define problem, collect data, establish facts, and draw valid conclusions"
"/media/Dados/bases/SWDE/job/job-jobtarget/0239.htm",BS in Computer Science or a related field required.
"/media/Dados/bases/SWDE/job/job-jobtarget/1515.htm",5-10 years of operations management experience in Port operations or a related field
"/media/Dados/bases/SWDE/job/job-jobtarget/0567.htm",An Associates degree with three (3) years of related experience OR a High School Diploma with five( 5) years of directly related experience
"/media/Dados/bases/SWDE/job/job-jobtarget/1508.htm","A bachelor’s degree in Architecture, Engineering, Computer Science, Environmental Science, or related field"
"/media/Dados/bases/SWDE/job/job-jobtarget/0922.htm",Advanced degree
"/media/Dados/bases/SWDE/job/job-jobtarget/1237.htm",This position has no supervisory responsibilities.
"/media/Dados/bases/SWDE/job/job-jobtarget/1993.htm",5+ years experience in low-level BIOS or firmware.
"/media/Dados/bases/SWDE/job/job-jobtarget/0103.htm",Ability to determine the business needs of application users and map to a process design document (flows and definitions).
"/media/Dados/bases/SWDE/job/job-jobtarget/1851.htm",Competitive salary
"/media/Dados/bases/SWDE/job/job-jobtarget/1011.htm","Bachelor's degree in marketing, communications or other related industry."
"/media/Dados/bases/SWDE/job/job-jobtarget/0282.htm",Must have strong aptitude and analytical skills.
"/media/Dados/bases/SWDE/job/job-jobtarget/1542.htm","Bachelor's (undergraduate) degree in computer science, information systems, industrial engineering or accounting"
"/media/Dados/bases/SWDE/job/job-jobtarget/1778.htm",A good understanding of the following:
"/media/Dados/bases/SWDE/job/job-jobtarget/1640.htm",College degree in relevant field is also preferred or equivalent work experience
"/media/Dados/bases/SWDE/job/job-jobtarget/0928.htm",Advanced degree
"/media/Dados/bases/SWDE/job/job-jobtarget/1095.htm",3 - 5 Years loan origination experience
"/media/Dados/bases/SWDE/job/job-jobtarget/1033.htm",Neuroscience background
"/media/Dados/bases/SWDE/job/job-jobtarget/1196.htm",Private-Label / Co-Brand / Dual-Line Cards (Consumer & Commercial)
"/media/Dados/bases/SWDE/job/job-jobtarget/1988.htm","5 years+ web programming experience (C#, ASP.NET, SOA/Web Services, XML and XSL)"
"/media/Dados/bases/SWDE/job/job-jobtarget/1107.htm",3 - 5 Years Loan Officer experience.
"/media/Dados/bases/SWDE/job/job-jobtarget/1643.htm","Coaching, building and mentoring a geographically distributed development team."
"/media/Dados/bases/SWDE/job/job-jobtarget/1812.htm",Tracks and reports team hours and expenses on a weekly basis
"/media/Dados/bases/SWDE/job/job-jobtarget/0480.htm",Keep list of hardware and software needs and repairs and see that they are resolved
"/media/Dados/bases/SWDE/job/job-jobtarget/1841.htm",8+ years experience in low-level BIOS or firmware.
"/media/Dados/bases/SWDE/job/job-jobtarget/0520.htm",A few words stating why you're interested in this position.
"/media/Dados/bases/SWDE/job/job-jobtarget/0066.htm",Strong knowledge & experience in both Java and .Net
"/media/Dados/bases/SWDE/job/job-jobtarget/0200.htm",Works on a smaller number of accounts of greater strategic (long term) value to HP.
"/media/Dados/bases/SWDE/job/job-jobtarget/0995.htm","Bachelors or equivalent degree in a business, technical or related field is required"
"/media/Dados/bases/SWDE/job/job-jobtarget/0816.htm",Familiarity with large scale development and deployment in the airline (or related) industry
"/media/Dados/bases/SWDE/job/job-jobtarget/1113.htm",3 - 5 Years Loan Officer experience.
"/media/Dados/bases/SWDE/job/job-jobtarget/1067.htm","Completion of a Bachelor's Degree in IT, Business, a clinical discipline, or a related field."
"/media/Dados/bases/SWDE/job/job-jobtarget/1886.htm",Must possess 4-10 years of professional consulting services experience
"/media/Dados/bases/SWDE/job/job-jobtarget/1132.htm",Knowledge of career development theory and how it relates to present day college students.
"/media/Dados/bases/SWDE/job/job-jobtarget/0362.htm",0-2 years experience in insurance or financial services.
"/media/Dados/bases/SWDE/job/job-jobtarget/1887.htm",Must reside in or be willing to relocate to Washington DC Metro region
"/media/Dados/bases/SWDE/job/job-jobtarget/1120.htm",3 - 5 Years Loan Officer experience.
"/media/Dados/bases/SWDE/job/job-jobtarget/1370.htm","Bachelor's degree in related field, such as Management Information Systems or Computer Science or equivalent experience"
"/media/Dados/bases/SWDE/job/job-jobtarget/1984.htm",Business Acumen
"/media/Dados/bases/SWDE/job/job-jobtarget/0941.htm",Experience in Professional Services or similar client facing roles in a client/vendor relationship.
"/media/Dados/bases/SWDE/job/job-jobtarget/0021.htm",Bachelor's degree with a clinical focus and concentration in healthcare technology field preferred.
"/media/Dados/bases/SWDE/job/job-jobtarget/1198.htm",Build strong relationships with Procurement officials (customer for life strategy)
"/media/Dados/bases/SWDE/job/job-jobtarget/1145.htm","MS in Statistics, Mathematics, Econometrics or related field"
"/media/Dados/bases/SWDE/job/job-jobtarget/1215.htm",Bachelor's Degree
"/media/Dados/bases/SWDE/job/job-jobtarget/1421.htm",High school diploma required.
"/media/Dados/bases/SWDE/job/job-jobtarget/0622.htm",Complete required analysis: Weekly and Monthly
"/media/Dados/bases/SWDE/job/job-jobtarget/1231.htm",High school diploma or GED required.
"/media/Dados/bases/SWDE/job/job-jobtarget/0226.htm","§ Bachelor of Computer Science, or equivalent experience in the field."
"/media/Dados/bases/SWDE/job/job-jobtarget/1256.htm",Ability to identify incident trends in order to elevate incidents in accordance with standard protocols.
"/media/Dados/bases/SWDE/job/job-jobtarget/0345.htm",Must have a BA with 3 - 4 years experience in project management support areas
"/media/Dados/bases/SWDE/job/job-jobtarget/0091.htm","MSEE with 12+ years or BSEE with 14+ years of experience in FPGA/ASIC design and verification, including 4+ years in engineering managerial role."
"/media/Dados/bases/SWDE/job/job-jobtarget/1114.htm",3 - 5 Years Loan Officer experience.
"/media/Dados/bases/SWDE/job/job-jobtarget/1726.htm",BS/MS in EE or CS or equivalent years experience
"/media/Dados/bases/SWDE/job/job-jobtarget/0454.htm",Some travel is required.
"/media/Dados/bases/SWDE/job/job-jobtarget/0042.htm",Works on a smaller number of accounts of greater strategic (long term) value to HP.
"/media/Dados/bases/SWDE/job/job-jobtarget/0823.htm",Perform business process analysis and document the requirements of the solution
"/media/Dados/bases/SWDE/job/job-jobtarget/1895.htm",Bachelor's Degree in Electrical Engineering.
"/media/Dados/bases/SWDE/job/job-jobtarget/1725.htm",BS/MS in EE or CS or equivalent years of experience
"/media/Dados/bases/SWDE/job/job-jobtarget/0540.htm",Experience with SQL / Oracle
"/media/Dados/bases/SWDE/job/job-jobtarget/1115.htm",3 - 5 Years Loan Officer experience.
"/media/Dados/bases/SWDE/job/job-jobtarget/0113.htm",3+ years experience working with iMIS or other association management software
"/media/Dados/bases/SWDE/job/job-jobtarget/1007.htm","1-2 years of publications and/or public relations experience in a professional setting; experience in the Arts is preferred, but not required."
"/media/Dados/bases/SWDE/job/job-jobtarget/0721.htm",Develop and execute sales plan generating new business revenue
"/media/Dados/bases/SWDE/job/job-jobtarget/0966.htm",Bachelor's degree and 4-6 years brand mgmt or marketing communications experience.
"/media/Dados/bases/SWDE/job/job-jobtarget/0087.htm",Compensation: Commensurate with experience
"/media/Dados/bases/SWDE/job/job-jobtarget/1128.htm",3 - 5 Years loan origination experience
"/media/Dados/bases/SWDE/job/job-jobtarget/0644.htm","5+ years experience in the area of real world software development and build environments; Java/J2EE, .NET, C/C++, et al."
"/media/Dados/bases/SWDE/job/job-jobtarget/1341.htm","University degree in Engineering with a minimum of ten years of pertinent experience, or an equivalent combination of education and experience"
"/media/Dados/bases/SWDE/job/job-jobtarget/0256.htm","Bachelor Degree +10 years experience. Master Degree in Business Administration, Engineering or Finance preferred."
"/media/Dados/bases/SWDE/job/job-jobtarget/1255.htm","Partnering with business development and sales, create and manage the event-based CSBU marketing and sales strategy, messages and operational plan"
"/media/Dados/bases/SWDE/job/job-jobtarget/0123.htm","Bachelor's degree from accredited university or college in the Health Sciences (Nursing, Medicine, etc.)."
"/media/Dados/bases/SWDE/job/job-jobtarget/1123.htm",Analyze customer requests to determine solutions to material handling needs.
"/media/Dados/bases/SWDE/job/job-jobtarget/1125.htm",3 - 5 Years loan origination experience
"/media/Dados/bases/SWDE/job/job-jobtarget/1096.htm",3 - 5 Years loan origination experience
"/media/Dados/bases/SWDE/job/job-jobtarget/0028.htm",Bachelor's degree with minimum of three years of professional experience required.
"/media/Dados/bases/SWDE/job/job-jobtarget/0532.htm",4+ years experience developing and administering SAP's Business Warehouse at a medium to large scale company with an emphasis on FIGL and FICO
"/media/Dados/bases/SWDE/job/job-jobtarget/1099.htm",3 - 5 Years loan origination experience
"/media/Dados/bases/SWDE/job/job-jobtarget/1294.htm",MS or advanced degree in CS/CE or equivalent combination of education and experience.
"/media/Dados/bases/SWDE/job/job-jobtarget/0175.htm",10+ years of proven experience in managing enterprise software application implementations
"/media/Dados/bases/SWDE/job/job-jobtarget/1254.htm","Bachelor Degree in Business, Management, Computer Sciences, or equivalent prior work experience in a related field."
"/media/Dados/bases/SWDE/job/job-jobtarget/1109.htm",3 - 5 Years Loan Officer experience.
"/media/Dados/bases/SWDE/job/job-jobtarget/1742.htm",BS or MS in an engineering discipline combined with at least 5 years experience in a test related position.
"/media/Dados/bases/SWDE/job/job-jobtarget/0339.htm",100% travel. Travel on a weekly basis to various customer sites to perform implementations.
"/media/Dados/bases/SWDE/job/job-jobtarget/0455.htm","2 -4 years experience in supporting SAP applications, providing customer support, and analyzing/troubleshooting issues within the Plan to Produce area"
"/media/Dados/bases/SWDE/job/job-jobtarget/1270.htm",understanding of the mobile space and mobile apps
"/media/Dados/bases/SWDE/job/job-jobtarget/1856.htm",Bachelor's degree in a related technical field or equivalent work experience.
"/media/Dados/bases/SWDE/job/job-jobtarget/1420.htm",Honest
"/media/Dados/bases/SWDE/job/job-jobtarget/0566.htm",Bachelor's degree
"/media/Dados/bases/SWDE/job/job-jobtarget/1536.htm",A BS in mechanical engineering or in a related engineering discipline.
"/media/Dados/bases/SWDE/job/job-jobtarget/0588.htm","Experience with virtualization technologies such as VMware, Hyper-V and Xen"
"/media/Dados/bases/SWDE/job/job-jobtarget/1103.htm",3 - 5 Years Loan Officer experience.
"/media/Dados/bases/SWDE/job/job-jobtarget/0048.htm",Experience with principles of behavioral education
"/media/Dados/bases/SWDE/job/job-jobtarget/1111.htm",3 - 5 Years Loan Officer experience.
"/media/Dados/bases/SWDE/job/job-jobtarget/0250.htm",BS in Computer Science or equivalent.
"/media/Dados/bases/SWDE/job/job-jobtarget/0749.htm","Bachelor's Degree in Business, Engineering or Library Sciences."
"/media/Dados/bases/SWDE/job/job-jobtarget/1232.htm",High school diploma or GED required.
"/media/Dados/bases/SWDE/job/job-jobtarget/1997.htm",Define best practices for database objects scripts storage in Microsoft Team Foundation Server (TFS) source control
"/media/Dados/bases/SWDE/job/job-jobtarget/1637.htm",Professional competencies:
"/media/Dados/bases/SWDE/job/job-jobtarget/0085.htm",BS/MS Computer Science degree or equivalent
"/media/Dados/bases/SWDE/job/job-jobtarget/1481.htm",Bachelor's Degree in Electrical Engineering or related technical field.
"/media/Dados/bases/SWDE/job/job-jobtarget/0740.htm",Impacts a medium volume of large external customers.
"/media/Dados/bases/SWDE/job/job-jobtarget/0871.htm",Information Mapping
"/media/Dados/bases/SWDE/job/job-jobtarget/1687.htm",Bachelor's Degree or equivalent experience in the field
"/media/Dados/bases/SWDE/job/job-jobtarget/1183.htm",This position has no supervisory responsibilities.
"/media/Dados/bases/SWDE/job/job-jobtarget/1962.htm",Minimum of 5 years of Load Planning/Weight and Balance experience
"/media/Dados/bases/SWDE/job/job-jobtarget/1685.htm","Prior experience developing network, storage, or performance management applications"
"/media/Dados/bases/SWDE/job/job-jobtarget/1455.htm",Ability to communicate with both business and technical employees across cultures and geographies
"/media/Dados/bases/SWDE/job/job-jobtarget/1945.htm","Expertise in engineering, computer science or a scientific field"
"/media/Dados/bases/SWDE/job/job-jobtarget/0765.htm",Above average earnings and benefits package
"/media/Dados/bases/SWDE/job/job-jobtarget/1116.htm",3 - 5 Years Loan Officer experience.
"/media/Dados/bases/SWDE/job/job-jobtarget/1477.htm",Bachelor's degree in Accounting or Finance required.
"/media/Dados/bases/SWDE/job/job-jobtarget/1625.htm",Bachelor's degree in Accounting.
"/media/Dados/bases/SWDE/job/job-jobtarget/1184.htm",FM10 or FM 11 Certification
"/media/Dados/bases/SWDE/job/job-jobtarget/1056.htm",A minimum of 1-3 years mortgage underwriting experience required.
"/media/Dados/bases/SWDE/job/job-jobtarget/1734.htm","Individual development of connections to database applications (ORACEL, SQL Server, etc.)"
"/media/Dados/bases/SWDE/job/job-jobtarget/0102.htm",Assures high performance and customer focus from all direct reports for cross-functional impact by:
"/media/Dados/bases/SWDE/job/job-jobtarget/0943.htm",Minimum 7 years experience in facilities management and maintenance.
"/media/Dados/bases/SWDE/job/job-jobtarget/1029.htm",Ph.D. degree in Microbiology or related field
"/media/Dados/bases/SWDE/job/job-jobtarget/1610.htm",Minimum 2-5 years sales experience
"/media/Dados/bases/SWDE/job/job-jobtarget/1543.htm",Demonstrated Program Management skills and leadership abilities
"/media/Dados/bases/SWDE/job/job-jobtarget/1794.htm",Degree in CS or 5+ years of relevant QA work experience.
"/media/Dados/bases/SWDE/job/job-jobtarget/1097.htm",3 - 5 Years loan origination experience
"/media/Dados/bases/SWDE/job/job-jobtarget/1027.htm",Bachelor's degree in accounting or finance with a minimum of three years related experience preferably in a manufacturing / distribution environment.
"/media/Dados/bases/SWDE/job/job-jobtarget/1118.htm",3 - 5 Years Loan Officer experience.
"/media/Dados/bases/SWDE/job/job-jobtarget/1147.htm",Works within a broad scope under project manager within own country or sub-region.
"/media/Dados/bases/SWDE/job/job-jobtarget/1126.htm",3 - 5 Years loan origination experience
"/media/Dados/bases/SWDE/job/job-jobtarget/1497.htm",Bid Management
"/media/Dados/bases/SWDE/job/job-jobtarget/0576.htm","Develop a thorough, detailed understanding of the OnBase® database schema and database operations associated with:"
"/media/Dados/bases/SWDE/job/job-jobtarget/0757.htm",Perform outsourced systems administration skills for assigned customer(s)
"/media/Dados/bases/SWDE/job/job-jobtarget/1061.htm",3 - 5 Years loan origination experience
"/media/Dados/bases/SWDE/job/job-jobtarget/1138.htm",Familiarity with various networking protocols.
"/media/Dados/bases/SWDE/job/job-jobtarget/1530.htm",Prepares materials for income related activities including follow-up
"/media/Dados/bases/SWDE/job/job-jobtarget/0505.htm",A minimum of a Bachelors of Science or equivalent experience is required. PMP and other professional certifications are a plus.
"/media/Dados/bases/SWDE/job/job-jobtarget/1127.htm",3 - 5 Years loan origination experience
"/media/Dados/bases/SWDE/job/job-jobtarget/1048.htm",Degree in IT preferably with ITIL certification
"/media/Dados/bases/SWDE/job/job-jobtarget/1046.htm","Is considered an expert in knowledge of products, solution or service offerings as well as competitor's offerings to be able to sell large solutions."
"/media/Dados/bases/SWDE/job/job-jobtarget/1883.htm","Understand and uncover customer requirements and pains relative to Information Overload and Overlook, and map to our unique value statement."
"/media/Dados/bases/SWDE/job/job-jobtarget/0779.htm",BS or MS degree in electrical engineering from an accredited university.
"/media/Dados/bases/SWDE/job/job-jobtarget/1735.htm",BS in Computer Science or equivalent.
"/media/Dados/bases/SWDE/job/job-jobtarget/1671.htm",Bachelors Degree or equivalent work experience
"/media/Dados/bases/SWDE/job/job-jobtarget/0929.htm",Develop/execute commercial events as required to develop assigned territory.
"/media/Dados/bases/SWDE/job/job-jobtarget/1135.htm",High school diploma; additional training and/or trade certification a plus
"/media/Dados/bases/SWDE/job/job-jobtarget/1233.htm",High school diploma or GED required.
"/media/Dados/bases/SWDE/job/job-jobtarget/1122.htm",3 - 5 Years loan origination experience
"/media/Dados/bases/SWDE/job/job-jobtarget/0307.htm","Bachelor's Degree or Diploma in Computer Science, Computer Engineering or Electrical Engineering or related discipline"
"/media/Dados/bases/SWDE/job/job-jobtarget/1808.htm",Proficient .NET programming in C#
"/media/Dados/bases/SWDE/job/job-jobtarget/1837.htm",Familiarity with biological research and its requirements
"/media/Dados/bases/SWDE/job/job-jobtarget/1282.htm","Hiring, training, mentoring, and supervising the Bookkeeper;"
"/media/Dados/bases/SWDE/job/job-jobtarget/0185.htm",Working knowledge of Traffic Flow Management concepts and procedures and the ability to simplify these complex processes to NBAA members.
"/media/Dados/bases/SWDE/job/job-jobtarget/0387.htm",Bachelor's Degree
"/media/Dados/bases/SWDE/job/job-jobtarget/1642.htm",Works on HP's larger accounts.
"/media/Dados/bases/SWDE/job/job-jobtarget/1058.htm",3 - 5 Years Loan Officer experience.
