URL,EXTRACTED VALUE
"/media/Dados/bases/SWDE/job/job-jobtarget/1926.htm",It would be great if you had:
"/media/Dados/bases/SWDE/job/job-jobtarget/0668.htm",DESIRED (NICE-TO-HAVE) MINIMUM QUALIFICATIONS:
"/media/Dados/bases/SWDE/job/job-jobtarget/0348.htm",It would be great if you had:
"/media/Dados/bases/SWDE/job/job-jobtarget/1940.htm",Travel Requirements:
"/media/Dados/bases/SWDE/job/job-jobtarget/0158.htm",Maintenance Supervisor
"/media/Dados/bases/SWDE/job/job-jobtarget/0931.htm",ESSENTIAL DUTIES AND RESPONSIBILITIES
