URL,EXTRACTED VALUE
"/media/Dados/bases/SWDE/job/job-jobtarget/0266.htm",Able to assemble presentations for upper management on the fly
"/media/Dados/bases/SWDE/job/job-jobtarget/0846.htm",Provide fair assessments of all assignments
"/media/Dados/bases/SWDE/job/job-jobtarget/1307.htm",Basic coding expertise
"/media/Dados/bases/SWDE/job/job-jobtarget/0050.htm",Proactively facilitate the sharing of new tools and techniques for gathering insights and publishing content online among the partners.
"/media/Dados/bases/SWDE/job/job-jobtarget/1419.htm",Have exceptional problem solving skills and enjoy creating efficient systems...
"/media/Dados/bases/SWDE/job/job-jobtarget/1308.htm",Basic coding expertise
"/media/Dados/bases/SWDE/job/job-jobtarget/1101.htm",Establish a referral base to generate business.
"/media/Dados/bases/SWDE/job/job-jobtarget/0572.htm",Excellent communication and organizational skills.
"/media/Dados/bases/SWDE/job/job-jobtarget/1369.htm",Weatherhead 100
"/media/Dados/bases/SWDE/job/job-jobtarget/1153.htm","Ensure regular communications, through both written materials and verbal conversations, with funders and prospects."
"/media/Dados/bases/SWDE/job/job-jobtarget/1098.htm",Establish a referral base to generate business.
"/media/Dados/bases/SWDE/job/job-jobtarget/1447.htm",Serve as first point of contact for the media and lead spokesperson for Museum.
"/media/Dados/bases/SWDE/job/job-jobtarget/0029.htm","Work on special projects including, but not limited to, AMR/AMI/Smart Grid"
"/media/Dados/bases/SWDE/job/job-jobtarget/1602.htm",Answering the phone professionally and scheduling appointments and meetings;
"/media/Dados/bases/SWDE/job/job-jobtarget/1060.htm",Establish a referral base to generate business.
"/media/Dados/bases/SWDE/job/job-jobtarget/0637.htm","Create, execute and coordinate computer system validation testing (automated and manual)."
"/media/Dados/bases/SWDE/job/job-jobtarget/1589.htm",Attend student graduation ceremony at the end of the academic year.
"/media/Dados/bases/SWDE/job/job-jobtarget/1859.htm",Proven interpersonal skills and the ability to work well with others in a matrix organization are critical.
"/media/Dados/bases/SWDE/job/job-jobtarget/1679.htm",Satellite telemetry and commanding protocol knowledge is a major plus
"/media/Dados/bases/SWDE/job/job-jobtarget/1105.htm",Establish a referral base to generate business.
"/media/Dados/bases/SWDE/job/job-jobtarget/0170.htm","Manage development, maintenance, and growth of all convention/meeting related programs for clients."
"/media/Dados/bases/SWDE/job/job-jobtarget/0186.htm",Is responsible for maintaining project/program schedules and regularly reports progress.
"/media/Dados/bases/SWDE/job/job-jobtarget/0112.htm",Efficient management of multiple clients
"/media/Dados/bases/SWDE/job/job-jobtarget/1267.htm","Develop reports, dashboards, and processes to continuously monitor data quality and integrity."
"/media/Dados/bases/SWDE/job/job-jobtarget/0014.htm",Demonstrated ability to solve problems by applying analytical techniques.
"/media/Dados/bases/SWDE/job/job-jobtarget/0088.htm",Processing client data for e-discovery projects
"/media/Dados/bases/SWDE/job/job-jobtarget/1894.htm","Provide technical support to field forces on cutover, testing and troubleshooting of various relay protection & control systems."
"/media/Dados/bases/SWDE/job/job-jobtarget/1078.htm","Ability to effectively manage and oversee online marketing programs -- bridging the disciplines of marketing, measurement, technology, and databases"
"/media/Dados/bases/SWDE/job/job-jobtarget/0694.htm","Attention to detail, commitment to quality."
"/media/Dados/bases/SWDE/job/job-jobtarget/0809.htm",Provide reports on activity in each core area of responsibility.
"/media/Dados/bases/SWDE/job/job-jobtarget/1950.htm",manage and participate in software licensing initiatives;
"/media/Dados/bases/SWDE/job/job-jobtarget/0879.htm",Schedules Agency Speakers per request
"/media/Dados/bases/SWDE/job/job-jobtarget/0352.htm",Must be able to work in the US indefinitely and be considered a US Person.
"/media/Dados/bases/SWDE/job/job-jobtarget/0310.htm",Ongoing technical account management to your assigned accounts
"/media/Dados/bases/SWDE/job/job-jobtarget/0233.htm",Lead or participate in major donor events locally and throughout Minnesota.
"/media/Dados/bases/SWDE/job/job-jobtarget/1666.htm",Complete customer service requests/change requests in accordance with the procedures in the OnBase OnLine Process Manual
"/media/Dados/bases/SWDE/job/job-jobtarget/1489.htm","Experience supervising, evaluating and motivating staff efficiently and effectively."
"/media/Dados/bases/SWDE/job/job-jobtarget/0011.htm","Organizing, QCing, managing and maintaining digital trial databases for presentation during litigation proceedings"
"/media/Dados/bases/SWDE/job/job-jobtarget/1100.htm",Establish a referral base to generate business.
"/media/Dados/bases/SWDE/job/job-jobtarget/0171.htm","Create and manage budgets including monitoring revenue/expense performance, andcollection of registration and/or exhibit fees."
"/media/Dados/bases/SWDE/job/job-jobtarget/0351.htm",o engineering change notices
"/media/Dados/bases/SWDE/job/job-jobtarget/0936.htm",Ability to work in a start-up environment where quality and timeliness are essential.
"/media/Dados/bases/SWDE/job/job-jobtarget/1124.htm",Establish a referral base to generate business.
"/media/Dados/bases/SWDE/job/job-jobtarget/0344.htm",Candidate must be a well organized person capable of handling a variety of issues and assignments.
"/media/Dados/bases/SWDE/job/job-jobtarget/1866.htm",Install and troubleshoot hardware and software;
"/media/Dados/bases/SWDE/job/job-jobtarget/1392.htm","Create and modify reports and reporting tools for staff to query against SHM's database using Crystal Reports, SQL and IQA;"
"/media/Dados/bases/SWDE/job/job-jobtarget/1788.htm",Ability to manage multiple simultaneous projects
"/media/Dados/bases/SWDE/job/job-jobtarget/1106.htm",Establish a referral base to generate business.
"/media/Dados/bases/SWDE/job/job-jobtarget/0577.htm",Weatherhead 100
"/media/Dados/bases/SWDE/job/job-jobtarget/1112.htm",Establish a referral base to generate business.
"/media/Dados/bases/SWDE/job/job-jobtarget/0389.htm",Sets standards of performance for care staff and assists in the hiring of all care services staff.
"/media/Dados/bases/SWDE/job/job-jobtarget/1701.htm",Ability to develop automated custom QA solutions without relying on commercial software packages
"/media/Dados/bases/SWDE/job/job-jobtarget/1561.htm",Master's Degree in health-related field or information management desired.
"/media/Dados/bases/SWDE/job/job-jobtarget/0274.htm",Knowledge of key accounts and contacts in the territory;
"/media/Dados/bases/SWDE/job/job-jobtarget/1881.htm",Coordinate and oversee contract information technology specialists as needed.
"/media/Dados/bases/SWDE/job/job-jobtarget/0101.htm",Other duties as assigned
"/media/Dados/bases/SWDE/job/job-jobtarget/1789.htm","Understanding of relational database design, objects, and client access, e.g. Oracle"
"/media/Dados/bases/SWDE/job/job-jobtarget/1110.htm",Establish a referral base to generate business.
"/media/Dados/bases/SWDE/job/job-jobtarget/0709.htm","Produces well organized construction documents of good appearance, accuracy, clarity and correctness, adhering to team and discipline standards."
"/media/Dados/bases/SWDE/job/job-jobtarget/1262.htm","organization, establishing the Analysis Team as trusted and valued partners"
"/media/Dados/bases/SWDE/job/job-jobtarget/1301.htm",Basic coding expertise
"/media/Dados/bases/SWDE/job/job-jobtarget/0495.htm","Oversees, guides, and participates in integrated support that ranges from the back-end systems and infrastructure to the end-user's desktop."
"/media/Dados/bases/SWDE/job/job-jobtarget/0349.htm",Knowledge of the EdConnect and WebGrant processes.
"/media/Dados/bases/SWDE/job/job-jobtarget/0930.htm",Assist in the management of association/society website
"/media/Dados/bases/SWDE/job/job-jobtarget/0715.htm",Participates in the development of group and corporate standards committees
"/media/Dados/bases/SWDE/job/job-jobtarget/1300.htm",Basic coding expertise
"/media/Dados/bases/SWDE/job/job-jobtarget/1230.htm","Generates business through direct marketing, cross-selling, telemarketing and presence in the community."
"/media/Dados/bases/SWDE/job/job-jobtarget/0188.htm","Prepares reports, including charts and graphs and presents recommendations for action plans to management."
"/media/Dados/bases/SWDE/job/job-jobtarget/1303.htm",Basic coding expertise
"/media/Dados/bases/SWDE/job/job-jobtarget/0975.htm",Negotiate rates that will achieve yearly department goals for Medical Loss Ratios (MRL).
"/media/Dados/bases/SWDE/job/job-jobtarget/0976.htm",Negotiate rates that will achieve yearly department goals for Medical Loss Ratios (MRL).
"/media/Dados/bases/SWDE/job/job-jobtarget/1813.htm",Comply with all applicable U.S. export control and security regulations.
"/media/Dados/bases/SWDE/job/job-jobtarget/0239.htm",Assist development and support teams in resolving customer issues.
"/media/Dados/bases/SWDE/job/job-jobtarget/0750.htm",Prepare property for its annual management occupancy review (MOR). Attend MOR inspection.
"/media/Dados/bases/SWDE/job/job-jobtarget/0922.htm","Willingness to travel extensively, and at times, work odd hours and weekends"
"/media/Dados/bases/SWDE/job/job-jobtarget/1469.htm","Identify test requirements from specifications, map test case requirements and design test coverage plan."
"/media/Dados/bases/SWDE/job/job-jobtarget/1237.htm","organize thoughts and communicate effectively, both orally and in writing,"
"/media/Dados/bases/SWDE/job/job-jobtarget/1286.htm",Gaming/Food Industry Experience preferred
"/media/Dados/bases/SWDE/job/job-jobtarget/1851.htm","Ability to thrive in a dynamic, fast paced and high pressure environment"
"/media/Dados/bases/SWDE/job/job-jobtarget/1011.htm",Work closely with Membership Marketing Manager to ensure member benefits of company are cross-promoted.
"/media/Dados/bases/SWDE/job/job-jobtarget/1342.htm",Collaborate on other PCG projects as necessary.
"/media/Dados/bases/SWDE/job/job-jobtarget/0928.htm","Willingness to travel extensively, and at times, work odd hours and weekends"
"/media/Dados/bases/SWDE/job/job-jobtarget/1095.htm",Establish a referral base to generate business.
"/media/Dados/bases/SWDE/job/job-jobtarget/1922.htm",Experience with designing and architecting solutions
"/media/Dados/bases/SWDE/job/job-jobtarget/1623.htm",Proven skills to interpret market research and provide direction and support for short and long-range goals
"/media/Dados/bases/SWDE/job/job-jobtarget/0388.htm",Experience writing and managing independent proposals and developing solicitation strategies is essential
"/media/Dados/bases/SWDE/job/job-jobtarget/1988.htm","Provide quality assurance testing of bug fixes, new releases and new modules as needed"
"/media/Dados/bases/SWDE/job/job-jobtarget/1107.htm",Establish a referral base to generate business.
"/media/Dados/bases/SWDE/job/job-jobtarget/1459.htm",Arrange prospect meetings and coordinate site visits.
"/media/Dados/bases/SWDE/job/job-jobtarget/1812.htm",Reviews deliverables prepared by team
"/media/Dados/bases/SWDE/job/job-jobtarget/0480.htm",Prepare outgoing correspondence on behalf of/for Executive Director signature
"/media/Dados/bases/SWDE/job/job-jobtarget/0271.htm",Develop and maintain effective relationships within the team and across teams
"/media/Dados/bases/SWDE/job/job-jobtarget/0066.htm","Deep understanding of current trends in Web technology, including such concepts as web services, social media, mobile applications"
"/media/Dados/bases/SWDE/job/job-jobtarget/0995.htm",Contribute to knowledge capital via project documentation and best practice solutions
"/media/Dados/bases/SWDE/job/job-jobtarget/1445.htm","Update all POG’s with new items, discontinued items, resets, etc. Ensure data integrity for all POG’s within the category."
"/media/Dados/bases/SWDE/job/job-jobtarget/1416.htm",Participates in the development of group and corporate standards committees
"/media/Dados/bases/SWDE/job/job-jobtarget/1113.htm",Establish a referral base to generate business.
"/media/Dados/bases/SWDE/job/job-jobtarget/1067.htm",Collaborating with vendors to acquire and support systems.
"/media/Dados/bases/SWDE/job/job-jobtarget/1886.htm","This individual will work collaboratively and build relationships with other consultants, customer staff, and third-party consultants."
"/media/Dados/bases/SWDE/job/job-jobtarget/1016.htm","Commitment to delivering great software and releasing it quickly, efficiently and with increasing quality."
"/media/Dados/bases/SWDE/job/job-jobtarget/1747.htm","Demonstrated proficiency in: project management, accounting and financial systems, PSA applications"
"/media/Dados/bases/SWDE/job/job-jobtarget/1120.htm",Establish a referral base to generate business.
"/media/Dados/bases/SWDE/job/job-jobtarget/1370.htm","Collaborate with other OnBase® professionals, transferring expertise in delivering and supporting OnBase® solutions"
"/media/Dados/bases/SWDE/job/job-jobtarget/0073.htm",Content expert for internal new hire training
"/media/Dados/bases/SWDE/job/job-jobtarget/0285.htm","Develop a program of research, publication, and presentations at professional conferences on issues affecting ACT's business."
"/media/Dados/bases/SWDE/job/job-jobtarget/1320.htm",Basic coding expertise
"/media/Dados/bases/SWDE/job/job-jobtarget/1231.htm","Generates business through direct marketing, cross-selling, telemarketing and presence in the community."
"/media/Dados/bases/SWDE/job/job-jobtarget/0226.htm","§ Specifies, develops, modifies, implements, and maintains these systems to most effectively sell product and track sales"
"/media/Dados/bases/SWDE/job/job-jobtarget/1129.htm","Solid experience in Excel including pivot tables, chart-making, and manipulation of large data sets"
"/media/Dados/bases/SWDE/job/job-jobtarget/0299.htm","Taking and preparing meeting minutes, preparing documents and reports, and helping in the assembly of funding proposals and syllabi"
"/media/Dados/bases/SWDE/job/job-jobtarget/1368.htm",Ability to work both independently and within a team
"/media/Dados/bases/SWDE/job/job-jobtarget/1114.htm",Establish a referral base to generate business.
"/media/Dados/bases/SWDE/job/job-jobtarget/0478.htm","Attend key meetings with the staff of IA to include pipeline, retreats and committee planning"
"/media/Dados/bases/SWDE/job/job-jobtarget/0454.htm",Management-level work experience including staff supervision.
"/media/Dados/bases/SWDE/job/job-jobtarget/1895.htm","Provide technical support to field forces on cutover, testing and troubleshooting of various relay protection & control systems."
"/media/Dados/bases/SWDE/job/job-jobtarget/0823.htm",Weatherhead 100
"/media/Dados/bases/SWDE/job/job-jobtarget/1115.htm",Establish a referral base to generate business.
"/media/Dados/bases/SWDE/job/job-jobtarget/1190.htm",Develop and implement IT training programs for department staff and the Laboratory community.
"/media/Dados/bases/SWDE/job/job-jobtarget/0113.htm",Efficient management of multiple clients
"/media/Dados/bases/SWDE/job/job-jobtarget/0509.htm","Knowledge of medical terminology, ICD-9-CM and CPT-4 coding systems, as well as the uses and limitations of medical records"
"/media/Dados/bases/SWDE/job/job-jobtarget/0966.htm",Contribute to development/ maintenance of pricing strategies for business unit.
"/media/Dados/bases/SWDE/job/job-jobtarget/0087.htm",Excellent communication and problem solving skills
"/media/Dados/bases/SWDE/job/job-jobtarget/1128.htm",Establish a referral base to generate business.
"/media/Dados/bases/SWDE/job/job-jobtarget/0224.htm",Participates in major donor events locally and throughout Minnesota.
"/media/Dados/bases/SWDE/job/job-jobtarget/1125.htm",Establish a referral base to generate business.
"/media/Dados/bases/SWDE/job/job-jobtarget/1239.htm",5. Ensure proper handling of parts and the preservation of all units or parts during the work process through the Avionics Department.
"/media/Dados/bases/SWDE/job/job-jobtarget/1096.htm",Establish a referral base to generate business.
"/media/Dados/bases/SWDE/job/job-jobtarget/1449.htm",Prepare daily cash deposits for bank
"/media/Dados/bases/SWDE/job/job-jobtarget/0677.htm",Basic knowledge of library systems and catalogs and issues concerning digitization and catalog access to the collections required.
"/media/Dados/bases/SWDE/job/job-jobtarget/0249.htm","Coding skills in Python or Javascript/AJAX, database design and SQL, and/or knowledge of TCP/IP and network programming are a plus."
"/media/Dados/bases/SWDE/job/job-jobtarget/0028.htm",Prepares and ensures delivery of data and product according to production schedules.
"/media/Dados/bases/SWDE/job/job-jobtarget/0562.htm",Familiarity with formal Software Development Lifecycle process required.
"/media/Dados/bases/SWDE/job/job-jobtarget/0532.htm",5. Creates Business Objects Universes to present data to the business in an easy to use structure
"/media/Dados/bases/SWDE/job/job-jobtarget/1099.htm",Establish a referral base to generate business.
"/media/Dados/bases/SWDE/job/job-jobtarget/1109.htm",Establish a referral base to generate business.
"/media/Dados/bases/SWDE/job/job-jobtarget/0175.htm",Ensure customer satisfaction and service delivery satisfaction
"/media/Dados/bases/SWDE/job/job-jobtarget/1446.htm","Update all POG’s with new items, discontinued items, resets, etc. Ensure data integrity for all POG’s within the category."
"/media/Dados/bases/SWDE/job/job-jobtarget/1856.htm",Integrate training programs with relational databases of learning content and tracking.
"/media/Dados/bases/SWDE/job/job-jobtarget/0455.htm","Test and implement changes, document and train users on new processes while adhering to specific compliance measures (SOx, etc.)"
"/media/Dados/bases/SWDE/job/job-jobtarget/0698.htm",Basic knowledge of library systems and catalogs and issues concerning digitization and catalog access to the collections required.
"/media/Dados/bases/SWDE/job/job-jobtarget/0268.htm",Develop and maintain effective relationships within the team and across teams
"/media/Dados/bases/SWDE/job/job-jobtarget/1536.htm",Ability to work in a start-up environment where quality and timeliness are essential.
"/media/Dados/bases/SWDE/job/job-jobtarget/0536.htm",Internet access
"/media/Dados/bases/SWDE/job/job-jobtarget/0713.htm",Participates in the development of group and corporate standards committees
"/media/Dados/bases/SWDE/job/job-jobtarget/0370.htm",Design and conduct complex scientific studies functioning as an expert in major facets of the projects.
"/media/Dados/bases/SWDE/job/job-jobtarget/1103.htm",Establish a referral base to generate business.
"/media/Dados/bases/SWDE/job/job-jobtarget/0048.htm",Extremely detail-oriented and organized
"/media/Dados/bases/SWDE/job/job-jobtarget/1111.htm",Establish a referral base to generate business.
"/media/Dados/bases/SWDE/job/job-jobtarget/1232.htm","Generates business through direct marketing, cross-selling, telemarketing and presence in the community."
"/media/Dados/bases/SWDE/job/job-jobtarget/1443.htm","Update all POG’s with new items, discontinued items, resets, etc. Ensure data integrity for all POG’s within the category."
"/media/Dados/bases/SWDE/job/job-jobtarget/1481.htm","Research, Develop and institute new technologies to assist Metro-North to obtain corporate goals."
"/media/Dados/bases/SWDE/job/job-jobtarget/1183.htm","organize thoughts and communicate effectively, both orally and in writing,"
"/media/Dados/bases/SWDE/job/job-jobtarget/0871.htm",Create flash tutorials for the product and SDKs using BB Flashback - screen recorder
"/media/Dados/bases/SWDE/job/job-jobtarget/1687.htm","Take an active role in designing solutions, resolving conflicts, and delivering solutions"
"/media/Dados/bases/SWDE/job/job-jobtarget/0780.htm",Perform other duties as assigned or requested.
"/media/Dados/bases/SWDE/job/job-jobtarget/1455.htm","Support the sales, marketing, and client services organizations with detailed product positioning and feature descriptions"
"/media/Dados/bases/SWDE/job/job-jobtarget/1945.htm",Identify and utilize other development techniques in addition to training to modify and enhance staff performance and behavior
"/media/Dados/bases/SWDE/job/job-jobtarget/0269.htm",Develop and maintain effective relationships within the team and across teams
"/media/Dados/bases/SWDE/job/job-jobtarget/0300.htm","Oversee monthly KPI reports for lease/cpr CPR tracking, evergreen leases, renewals, lease/cpr marketing programs, and government CPR programs."
"/media/Dados/bases/SWDE/job/job-jobtarget/1116.htm",Establish a referral base to generate business.
"/media/Dados/bases/SWDE/job/job-jobtarget/0286.htm","Develop a program of research, publication, and presentations at professional conferences on issues affecting ACT's business."
"/media/Dados/bases/SWDE/job/job-jobtarget/1036.htm",Develop new service opportunities with the Professional Service Director
"/media/Dados/bases/SWDE/job/job-jobtarget/0712.htm",Access to cell phone to be used for business purposes required
"/media/Dados/bases/SWDE/job/job-jobtarget/0671.htm","Proficiency with Microsoft Word, Excel, Power Point and Access or other database programs"
"/media/Dados/bases/SWDE/job/job-jobtarget/1720.htm",Ability to develop automated custom QA solutions without relying on commercial software packages
"/media/Dados/bases/SWDE/job/job-jobtarget/1056.htm",Provides quality control reports of any findings and recommends actions on a timely basis.
"/media/Dados/bases/SWDE/job/job-jobtarget/1631.htm","Responsible for: tracking and reporting the status of issues, escalation of issues, and following through with issues until resolution."
"/media/Dados/bases/SWDE/job/job-jobtarget/1029.htm",Participate on Eastman's Biosafety Committee
"/media/Dados/bases/SWDE/job/job-jobtarget/1708.htm",Ability to develop automated custom QA solutions without relying on commercial software packages
"/media/Dados/bases/SWDE/job/job-jobtarget/1306.htm",Basic coding expertise
"/media/Dados/bases/SWDE/job/job-jobtarget/1321.htm",Basic coding expertise
"/media/Dados/bases/SWDE/job/job-jobtarget/1386.htm","o Track pre-releases, alphas and betas"
"/media/Dados/bases/SWDE/job/job-jobtarget/0382.htm",Basic knowledge of library systems and catalogs and issues concerning digitization and catalog access to the collections required.
"/media/Dados/bases/SWDE/job/job-jobtarget/1097.htm",Establish a referral base to generate business.
"/media/Dados/bases/SWDE/job/job-jobtarget/1118.htm",Establish a referral base to generate business.
"/media/Dados/bases/SWDE/job/job-jobtarget/1027.htm",Supports and administers appropriate Business Performance Management software packages.
"/media/Dados/bases/SWDE/job/job-jobtarget/1126.htm",Establish a referral base to generate business.
"/media/Dados/bases/SWDE/job/job-jobtarget/0576.htm",Weatherhead 100
"/media/Dados/bases/SWDE/job/job-jobtarget/1314.htm",Basic coding expertise
"/media/Dados/bases/SWDE/job/job-jobtarget/0757.htm",Weatherhead 100
"/media/Dados/bases/SWDE/job/job-jobtarget/0710.htm","Produces well organized construction documents of good appearance, accuracy, clarity and correctness, adhering to team and discipline standards."
"/media/Dados/bases/SWDE/job/job-jobtarget/1061.htm",Establish a referral base to generate business.
"/media/Dados/bases/SWDE/job/job-jobtarget/1059.htm",Excellent understanding of IRA laws and functions for compliance issues.
"/media/Dados/bases/SWDE/job/job-jobtarget/1117.htm",Other duties as requested.
"/media/Dados/bases/SWDE/job/job-jobtarget/1470.htm",Developing and testing technical solutions
"/media/Dados/bases/SWDE/job/job-jobtarget/1582.htm",Guide and support Einstein IT functions for the research endeavor;
"/media/Dados/bases/SWDE/job/job-jobtarget/0013.htm",Customer Requirements Documentation
"/media/Dados/bases/SWDE/job/job-jobtarget/1127.htm",Establish a referral base to generate business.
"/media/Dados/bases/SWDE/job/job-jobtarget/1525.htm","Interface daily with Technical Support, Service Lab, Parts and Shipping Departments."
"/media/Dados/bases/SWDE/job/job-jobtarget/1335.htm",Deliver the required functionality in an agreed upon timely manner.
"/media/Dados/bases/SWDE/job/job-jobtarget/0247.htm","Assists Health IT/IVD with software-related new releases, customer complaints, MDRs, CAPA and Field Correction / Recall activities"
"/media/Dados/bases/SWDE/job/job-jobtarget/0515.htm",Lead software implementation efforts including user training.
"/media/Dados/bases/SWDE/job/job-jobtarget/0466.htm","Develop process standards and conduct necessary investigations to develop significant new services, processes or operational improvements."
"/media/Dados/bases/SWDE/job/job-jobtarget/1882.htm",Follow up on new leads and referrals resulting from requests made mainly through our website;
"/media/Dados/bases/SWDE/job/job-jobtarget/0938.htm",Recommend new ideas and procedures to improve efficiency and effectiveness.
"/media/Dados/bases/SWDE/job/job-jobtarget/1429.htm","Event preparation including, arrangements for materials, space, set-up, catering, conference calling, and audio-visual."
"/media/Dados/bases/SWDE/job/job-jobtarget/1135.htm",Develop a method and maintain a comprehensive spare parts inventory for critical building equipment
"/media/Dados/bases/SWDE/job/job-jobtarget/1233.htm","Generates business through direct marketing, cross-selling, telemarketing and presence in the community."
