URL,EXTRACTED VALUE
"/media/Dados/bases/SWDE/job/job-jobtarget/0369.htm","7 years of experience as a cost, finance, economic and/or EVM analyst"
"/media/Dados/bases/SWDE/job/job-jobtarget/1706.htm",Ability to communicate clearly and effectively to all levels of staff and clients
"/media/Dados/bases/SWDE/job/job-jobtarget/1062.htm","Knowledge and experience with derivative investment instruments, such as Black-Scholes model."
"/media/Dados/bases/SWDE/job/job-jobtarget/1811.htm","Experience using Adobe CS Master Collection software titles (including: Photoshop, Flash Pro, Acrobat Pro)"
"/media/Dados/bases/SWDE/job/job-jobtarget/0773.htm",High School Diploma or GED
