URL,EXTRACTED VALUE
"/media/Dados/bases/SWDE/job/job-jobtarget/1405.htm",High school diploma required. Associates/Bachelors Degree and prior health care experience preferred.
"/media/Dados/bases/SWDE/job/job-jobtarget/0827.htm",Re-schedules any canceled appointments or surgeries in a timely manner.
"/media/Dados/bases/SWDE/job/job-jobtarget/1038.htm",QUALIFICATIONS
"/media/Dados/bases/SWDE/job/job-jobtarget/0934.htm",SUPERVISORY RESPONSIBILITY: List the number of FTEs supervised.
"/media/Dados/bases/SWDE/job/job-jobtarget/0897.htm",' Prepares for annual review
