URL,EXTRACTED VALUE
"/media/Dados/bases/SWDE/job/job-jobtarget/1828.htm",Participates as a member of Testing team as well as lead Testing Teams.
"/media/Dados/bases/SWDE/job/job-jobtarget/0768.htm",First level university degree (non-technical)
"/media/Dados/bases/SWDE/job/job-jobtarget/0846.htm",Teach assigned courses in the Medical Billing and Coding Program
"/media/Dados/bases/SWDE/job/job-jobtarget/0266.htm",Can do attitude with energy and work ethic to match
"/media/Dados/bases/SWDE/job/job-jobtarget/1168.htm",- Associates Degree
"/media/Dados/bases/SWDE/job/job-jobtarget/1419.htm","If you are detail oriented, precise, logical and organized..."
"/media/Dados/bases/SWDE/job/job-jobtarget/1280.htm",Manage campus student finance operations to ensure financial compliance with company objectives and Federal/State regulations.
"/media/Dados/bases/SWDE/job/job-jobtarget/1101.htm",Respond to all customer inquiries in a professional and timely manner.
"/media/Dados/bases/SWDE/job/job-jobtarget/1369.htm",North Coast 99 (Top 99 Companies to work for in Northeast Ohio)
"/media/Dados/bases/SWDE/job/job-jobtarget/0572.htm",Minimum of two years of payroll processing experience required.
"/media/Dados/bases/SWDE/job/job-jobtarget/1435.htm",Drive application standards and process simplifications
"/media/Dados/bases/SWDE/job/job-jobtarget/1098.htm",Respond to all customer inquiries in a professional and timely manner.
"/media/Dados/bases/SWDE/job/job-jobtarget/1047.htm",University or Bachelor's degree
"/media/Dados/bases/SWDE/job/job-jobtarget/1447.htm","Co-direct message platforms and communication channel strategies for internal, external, and online audiences with the Director of Marketing."
"/media/Dados/bases/SWDE/job/job-jobtarget/0985.htm",Product Life Cycle Management is an exciting and critical enabler for HP Business
"/media/Dados/bases/SWDE/job/job-jobtarget/0338.htm",Participates as a member of development team or teams; may lead a small development team.
"/media/Dados/bases/SWDE/job/job-jobtarget/1511.htm",Working as part of a multi-geography project team across multiple programs contributing to:
"/media/Dados/bases/SWDE/job/job-jobtarget/0029.htm",Operate computers and software applications
"/media/Dados/bases/SWDE/job/job-jobtarget/0080.htm","Familiarity with online fundraising software, e.g. Aristotle, Convio, GetActive"
"/media/Dados/bases/SWDE/job/job-jobtarget/1060.htm",Respond to all customer inquiries in a professional and timely manner.
"/media/Dados/bases/SWDE/job/job-jobtarget/1142.htm",BS in Computer Science or a related field. MS would be a strong plus.
"/media/Dados/bases/SWDE/job/job-jobtarget/1105.htm",Respond to all customer inquiries in a professional and timely manner.
"/media/Dados/bases/SWDE/job/job-jobtarget/1946.htm",Participates as a member of development team.
"/media/Dados/bases/SWDE/job/job-jobtarget/0170.htm","Responsible for account/revenue retention, generation and penetration and achieving financial goals set annually."
"/media/Dados/bases/SWDE/job/job-jobtarget/0334.htm",Financial reconciliation for Exhibition and Sponsorships
"/media/Dados/bases/SWDE/job/job-jobtarget/1169.htm",- Associates Degree
"/media/Dados/bases/SWDE/job/job-jobtarget/0829.htm","All work will be performed onsite in Richmond VA, normally M-F 8 hours per day (no teleworking or alternate work schedules)."
"/media/Dados/bases/SWDE/job/job-jobtarget/0156.htm",IBM Tivoli Storage Manager (TSM)
"/media/Dados/bases/SWDE/job/job-jobtarget/1375.htm",BS/MS in Computer Science/MIS or equivalent.
"/media/Dados/bases/SWDE/job/job-jobtarget/1888.htm",Experience with the architecting and designing of Windows desktop infrastructure projects
"/media/Dados/bases/SWDE/job/job-jobtarget/1461.htm",U.S. Citizenship required.
"/media/Dados/bases/SWDE/job/job-jobtarget/0014.htm",BS/BA in mathematics and/or business from an accredited institution. Two SOA examinations through ASA is preferred.
"/media/Dados/bases/SWDE/job/job-jobtarget/1894.htm",Provide Power Department's input into the design of all Capital Projects involved with Power Department facilities.
"/media/Dados/bases/SWDE/job/job-jobtarget/1078.htm",Marketing experience across multiple media
"/media/Dados/bases/SWDE/job/job-jobtarget/0694.htm",Bachelor's degree or equivalent; graduate degree a plus.
"/media/Dados/bases/SWDE/job/job-jobtarget/0879.htm",Primary administrative support to the Vice President of Community Impact
"/media/Dados/bases/SWDE/job/job-jobtarget/1252.htm",Managing the financial analysis function for various Sales & Marketing projects and programs.
"/media/Dados/bases/SWDE/job/job-jobtarget/0310.htm",Following up on inbound leads and information requests
"/media/Dados/bases/SWDE/job/job-jobtarget/0347.htm",Bachelor's degree in a related field required.
"/media/Dados/bases/SWDE/job/job-jobtarget/0673.htm","Supervise, mentor, train and develop staff members"
"/media/Dados/bases/SWDE/job/job-jobtarget/1666.htm","Safeguard the security, integrity, and confidentially of all customer data"
"/media/Dados/bases/SWDE/job/job-jobtarget/1509.htm",Working as part of a multi-geography project team across multiple programs contributing to:
"/media/Dados/bases/SWDE/job/job-jobtarget/1489.htm","Masters Degree in Educational Leadership, Human Resources, Organizational Administration or related fields."
"/media/Dados/bases/SWDE/job/job-jobtarget/1100.htm",Respond to all customer inquiries in a professional and timely manner.
"/media/Dados/bases/SWDE/job/job-jobtarget/0011.htm",Providing diligent and timely support throughout entire litigation process
"/media/Dados/bases/SWDE/job/job-jobtarget/0171.htm","Coordinate all aspects of conferences, meetings and events (pre-planning, onsite execution and post event wrap up)."
"/media/Dados/bases/SWDE/job/job-jobtarget/1009.htm",Advise our customers in strategic issues they are facing
"/media/Dados/bases/SWDE/job/job-jobtarget/0074.htm","Build, test, and implement new storage solutions (data backup and on-line storage) into production."
"/media/Dados/bases/SWDE/job/job-jobtarget/0351.htm",Act as design lead on a processor-based card
"/media/Dados/bases/SWDE/job/job-jobtarget/0936.htm","Proven experience in the design, construction and operation of large multidisciplinary projects involving large scale components and complex systems."
"/media/Dados/bases/SWDE/job/job-jobtarget/1124.htm",Respond to all customer inquiries in a professional and timely manner.
"/media/Dados/bases/SWDE/job/job-jobtarget/1178.htm",- Associates Degree
"/media/Dados/bases/SWDE/job/job-jobtarget/1318.htm",Administers expense and employee reimbursement policies and procedures
"/media/Dados/bases/SWDE/job/job-jobtarget/1146.htm",Designing and consulting on complex IT solutions
"/media/Dados/bases/SWDE/job/job-jobtarget/0344.htm",Bachelor's degree in related field required.
"/media/Dados/bases/SWDE/job/job-jobtarget/1076.htm",Member of the Hall Neighborhood House executive management team
"/media/Dados/bases/SWDE/job/job-jobtarget/1819.htm",Participate in or facilitate business process definition and modeling;
"/media/Dados/bases/SWDE/job/job-jobtarget/0335.htm",Create and maintain stylish HTML/CSS brand templates for marketing campaigns
"/media/Dados/bases/SWDE/job/job-jobtarget/1716.htm",Participates as a member of a Testing Team.
"/media/Dados/bases/SWDE/job/job-jobtarget/1392.htm","Perform the installation, configuration, testing, maintenance, monitoring, troubleshooting and reporting metrics for assigned databases;"
"/media/Dados/bases/SWDE/job/job-jobtarget/1788.htm",Minimum 5 years of business consulting experience
"/media/Dados/bases/SWDE/job/job-jobtarget/1106.htm",Respond to all customer inquiries in a professional and timely manner.
"/media/Dados/bases/SWDE/job/job-jobtarget/0157.htm",Serves as the Manager of project engineers for the Enterprise Data Network and as a consulting engineer to other Department entities.
"/media/Dados/bases/SWDE/job/job-jobtarget/0577.htm",North Coast 99 (Top 99 Companies to work for in Northeast Ohio)
"/media/Dados/bases/SWDE/job/job-jobtarget/1112.htm",Respond to all customer inquiries in a professional and timely manner.
"/media/Dados/bases/SWDE/job/job-jobtarget/0389.htm","Ensures clinical compliance with state licensing regulations, organizational and departmental policy and procedures."
"/media/Dados/bases/SWDE/job/job-jobtarget/1296.htm","Support existing build infrastructure by writing, enhancing and debugging scripts and programs used in our build process"
"/media/Dados/bases/SWDE/job/job-jobtarget/1673.htm",Leads and/or directs the efforts of specialists on project(s).
"/media/Dados/bases/SWDE/job/job-jobtarget/0538.htm",Be the primary customer interface for the overall Program
"/media/Dados/bases/SWDE/job/job-jobtarget/1561.htm",Bachelor's Degree required.
"/media/Dados/bases/SWDE/job/job-jobtarget/1881.htm",Manage HNHA's point of sale system (presently eight sales outlets)
"/media/Dados/bases/SWDE/job/job-jobtarget/0274.htm",Experience with hardware technical support or field engineering;
"/media/Dados/bases/SWDE/job/job-jobtarget/1810.htm",Participate in or facilitate business process definition and modeling;
"/media/Dados/bases/SWDE/job/job-jobtarget/0674.htm","Lead in the Analysis, Design, Development, and Testing phases of the new Simplified User Interface based on Flex/Flash technology."
"/media/Dados/bases/SWDE/job/job-jobtarget/0519.htm",Provide consulting services to guide senior executives in improving the customer experience/Net Promoter program to achieve business results.
"/media/Dados/bases/SWDE/job/job-jobtarget/0752.htm","Collaborating with Product Test teams to design, implement and document maintainable feature test, system test and performance automation solutions."
"/media/Dados/bases/SWDE/job/job-jobtarget/1789.htm","University degree in Computer Science, Software Engineering or equivalent"
"/media/Dados/bases/SWDE/job/job-jobtarget/1110.htm",Respond to all customer inquiries in a professional and timely manner.
"/media/Dados/bases/SWDE/job/job-jobtarget/1182.htm",Will perform a variety of engineering and design activities involving nuclear power plant upgrades and/or new power plant projects.
"/media/Dados/bases/SWDE/job/job-jobtarget/1262.htm","Lead the Security Intelligence Analysis Team, providing support, guidance and mentoring"
"/media/Dados/bases/SWDE/job/job-jobtarget/0930.htm","Management of the abstract selection process and web-based submission site; including report generation, author correspondence and follow-up"
"/media/Dados/bases/SWDE/job/job-jobtarget/0057.htm",Embodies Sales and the HP sales and sales support processes and tools
"/media/Dados/bases/SWDE/job/job-jobtarget/1212.htm",U.S. Citizenship required.
"/media/Dados/bases/SWDE/job/job-jobtarget/0398.htm",- Bachelors Degree
"/media/Dados/bases/SWDE/job/job-jobtarget/1230.htm",Adheres to Flagstar Bank operations procedures and guidelines.
"/media/Dados/bases/SWDE/job/job-jobtarget/0188.htm","Develop weekly, monthly and quarterly analysis of actual financial and operational results versus budget for each region and the company as a whole."
"/media/Dados/bases/SWDE/job/job-jobtarget/1390.htm","BS in Instructional Design, Education, Computer Science or related field required."
"/media/Dados/bases/SWDE/job/job-jobtarget/0239.htm",Create and Execute EDI test cases.
"/media/Dados/bases/SWDE/job/job-jobtarget/1049.htm",Must possess a minimum of 4+ years experience in database administration plus system support and training experience in Oracle RDBMS.
"/media/Dados/bases/SWDE/job/job-jobtarget/1515.htm",Work with tenants regarding vessel berth assignments
"/media/Dados/bases/SWDE/job/job-jobtarget/0750.htm",Determine the latest revisions to HUD policy and ensure that they are implemented.
"/media/Dados/bases/SWDE/job/job-jobtarget/0922.htm",Bachelor's degree
"/media/Dados/bases/SWDE/job/job-jobtarget/1723.htm",Installation and configuration of Siebel 7.x or 8.x SIA application stack.
"/media/Dados/bases/SWDE/job/job-jobtarget/1993.htm","Bachelor's or Master's Degree in Electrical Engineering, Computer Engineering, or Computer Science."
"/media/Dados/bases/SWDE/job/job-jobtarget/1237.htm",quickly assimilate and implement desired work objectives
"/media/Dados/bases/SWDE/job/job-jobtarget/1939.htm",Developed SQL code to support ETL downloads using DB2 or equivalent database.
"/media/Dados/bases/SWDE/job/job-jobtarget/1851.htm",7+ years of experience in an enterprise software vendor organization
"/media/Dados/bases/SWDE/job/job-jobtarget/0991.htm",Bachelor's degree in accounting required.
"/media/Dados/bases/SWDE/job/job-jobtarget/1011.htm",Create marketing campaigns for a variety of company's products.
"/media/Dados/bases/SWDE/job/job-jobtarget/1542.htm",The SAP FICO Functional Configurator's responsibilities include (but are not limited to):
"/media/Dados/bases/SWDE/job/job-jobtarget/0282.htm",Participates as a member of and leads global development teams.
"/media/Dados/bases/SWDE/job/job-jobtarget/0153.htm",At least five to seven years of progressive experience in a college financial aid position.
"/media/Dados/bases/SWDE/job/job-jobtarget/0038.htm",Participates as a member of development team.
"/media/Dados/bases/SWDE/job/job-jobtarget/1778.htm",BS in Computer Science or equivalent
"/media/Dados/bases/SWDE/job/job-jobtarget/1342.htm",Lead efforts to write and prepare cost allocation plans on behalf of PCG clients.
"/media/Dados/bases/SWDE/job/job-jobtarget/0928.htm",Bachelor's degree
"/media/Dados/bases/SWDE/job/job-jobtarget/1095.htm",Respond to all customer inquiries in a professional and timely manner.
"/media/Dados/bases/SWDE/job/job-jobtarget/1033.htm",Engineering or IT undergraduate or graduate degree
"/media/Dados/bases/SWDE/job/job-jobtarget/1196.htm",Closed-end Installment Loans (Consumer & Commercial)
"/media/Dados/bases/SWDE/job/job-jobtarget/1776.htm",3 to 5 years experience or equivalent (PhD)
"/media/Dados/bases/SWDE/job/job-jobtarget/1922.htm",3+ years of experience in software development
"/media/Dados/bases/SWDE/job/job-jobtarget/1623.htm","Accounting degree with a minimum seven (7) years’ experience in a leadership capacity in financial management, CPA desirable"
"/media/Dados/bases/SWDE/job/job-jobtarget/1988.htm",Work with our clients and consultants to diagnosis and resolve software issues
"/media/Dados/bases/SWDE/job/job-jobtarget/0720.htm",BS/MS in Computer Science/MIS or equivalent
"/media/Dados/bases/SWDE/job/job-jobtarget/1107.htm",Respond to all customer inquiries in a professional and timely manner.
"/media/Dados/bases/SWDE/job/job-jobtarget/1961.htm",Participates as a member of development team or production support teams; may lead a small development or production support team.
"/media/Dados/bases/SWDE/job/job-jobtarget/1643.htm","Coaching, building and mentoring a geographically distributed development team"
"/media/Dados/bases/SWDE/job/job-jobtarget/1459.htm",Implement a comprehensive corporate and foundation solicitation program.
"/media/Dados/bases/SWDE/job/job-jobtarget/0040.htm",Participates as a member of development team or teams.
"/media/Dados/bases/SWDE/job/job-jobtarget/1812.htm",Creates and executes project work plans
"/media/Dados/bases/SWDE/job/job-jobtarget/1872.htm",and build reports using BO. Prior experience in
"/media/Dados/bases/SWDE/job/job-jobtarget/0755.htm",7 years experience using C and/or C++ and/or assembly.
"/media/Dados/bases/SWDE/job/job-jobtarget/0480.htm","Answer telephone, direct calls, obtain and distribute messages and greet guests"
"/media/Dados/bases/SWDE/job/job-jobtarget/1841.htm","Bachelor's or Master's Degree in Electrical Engineering, Computer Engineering, or Computer Science."
"/media/Dados/bases/SWDE/job/job-jobtarget/0520.htm",Love to get and play games on opening day - I'm talking 12:01am.
"/media/Dados/bases/SWDE/job/job-jobtarget/1043.htm",Must possess a minimum of 4+ years experience in either database
"/media/Dados/bases/SWDE/job/job-jobtarget/0066.htm","10+ years in a development environment, Java or .Net"
"/media/Dados/bases/SWDE/job/job-jobtarget/0200.htm",Develops long term sales pipeline to increase HP's market share in specialized area.
"/media/Dados/bases/SWDE/job/job-jobtarget/1549.htm",Participates as a member of and leads development teams.
"/media/Dados/bases/SWDE/job/job-jobtarget/1878.htm",Participates as a member of development team.
"/media/Dados/bases/SWDE/job/job-jobtarget/1113.htm",Respond to all customer inquiries in a professional and timely manner.
"/media/Dados/bases/SWDE/job/job-jobtarget/0816.htm",Typically a Bachelor's degree or equivalent experience required. Masters degree preferred.
"/media/Dados/bases/SWDE/job/job-jobtarget/1067.htm",Ensuring that the EMR implementation delivers the results expected and is completed on time and on budget.
"/media/Dados/bases/SWDE/job/job-jobtarget/1132.htm","Earned Master's degree in Higher Education, Student or Career Development, Counseling, or a related academic field."
"/media/Dados/bases/SWDE/job/job-jobtarget/1016.htm","BS/MS or equivalent in Computer Science, PhD a plus."
"/media/Dados/bases/SWDE/job/job-jobtarget/0362.htm",Documenting financial modeling work.
"/media/Dados/bases/SWDE/job/job-jobtarget/1747.htm",Bachelor’s Degree
"/media/Dados/bases/SWDE/job/job-jobtarget/1887.htm",Selling and delivering engagements in cross practice domain areas.
"/media/Dados/bases/SWDE/job/job-jobtarget/1120.htm",Respond to all customer inquiries in a professional and timely manner.
"/media/Dados/bases/SWDE/job/job-jobtarget/1176.htm",- Associates Degree
"/media/Dados/bases/SWDE/job/job-jobtarget/0941.htm",Work with the Solution Architect and/or Business Analyst to translate the customer requirements into a working solution.
"/media/Dados/bases/SWDE/job/job-jobtarget/0285.htm","Conduct, interpret, and report the results of educational policy research."
"/media/Dados/bases/SWDE/job/job-jobtarget/1198.htm",Develop a contract summary outline for each Statewide/Strategic contract for a sales training and backup tool
"/media/Dados/bases/SWDE/job/job-jobtarget/1215.htm",Bring your knowledge of consulting to the following role:
"/media/Dados/bases/SWDE/job/job-jobtarget/1421.htm","Respond to, trouble shoot and resolve questions from Customers in an efficient, timely, and professional manner via the phone, email and web chat."
"/media/Dados/bases/SWDE/job/job-jobtarget/0017.htm",Participates as a member of development team or teams; may lead a small development team.
"/media/Dados/bases/SWDE/job/job-jobtarget/1231.htm",Adheres to Flagstar Bank operations procedures and guidelines.
"/media/Dados/bases/SWDE/job/job-jobtarget/0226.htm",§ Expert and Administrator of the entire suite of Ross Video's CRM software systems and data (Sage SalesLogix).
"/media/Dados/bases/SWDE/job/job-jobtarget/0292.htm","Participate in the analysis, design, development, and testing of Web Applications for consumer-facing photo web sites"
"/media/Dados/bases/SWDE/job/job-jobtarget/1256.htm",Monitor systems and identify performance issues reactively.
"/media/Dados/bases/SWDE/job/job-jobtarget/1777.htm",10+ years experience or equivalent (PhD)
"/media/Dados/bases/SWDE/job/job-jobtarget/1129.htm","Undergraduate degree in computer science, mathematics, economics or equivalent from a top-tier college/university"
"/media/Dados/bases/SWDE/job/job-jobtarget/0345.htm",Developing and maintaining detailed SDLC project plans
"/media/Dados/bases/SWDE/job/job-jobtarget/0091.htm","Lead team to work with product line management, architecture and software teams to translate product requirements into design specifications."
"/media/Dados/bases/SWDE/job/job-jobtarget/1763.htm",Experience with high-volume web sites.
"/media/Dados/bases/SWDE/job/job-jobtarget/1368.htm",Min 2 years development work experience
"/media/Dados/bases/SWDE/job/job-jobtarget/1114.htm",Respond to all customer inquiries in a professional and timely manner.
"/media/Dados/bases/SWDE/job/job-jobtarget/1726.htm","Develop and support in house BIOS code, firmware, kernel, driver code for our InServe products as part of the software platform team"
"/media/Dados/bases/SWDE/job/job-jobtarget/1932.htm",Participates as a member of development team or teams; may lead a small development team.
"/media/Dados/bases/SWDE/job/job-jobtarget/0032.htm",Participates as a member of development team.
"/media/Dados/bases/SWDE/job/job-jobtarget/1374.htm",BS/MS in computer Science with 10+ years related experience.
"/media/Dados/bases/SWDE/job/job-jobtarget/0454.htm","Must understand mobile crane applications, operation, and specifications."
"/media/Dados/bases/SWDE/job/job-jobtarget/0042.htm",Develops long term sales pipeline to increase HP's market share in specialized area.
"/media/Dados/bases/SWDE/job/job-jobtarget/0342.htm",Ability to work with Web-development tools for new applications.
"/media/Dados/bases/SWDE/job/job-jobtarget/1895.htm",Provide Power Department's input into the design of all Capital Projects involved with Power Department facilities.
"/media/Dados/bases/SWDE/job/job-jobtarget/0823.htm",North Coast 99 (Top 99 Companies to work for in Northeast Ohio)
"/media/Dados/bases/SWDE/job/job-jobtarget/1115.htm",Respond to all customer inquiries in a professional and timely manner.
"/media/Dados/bases/SWDE/job/job-jobtarget/1725.htm","Develop and support in house BIOS code, firmware, kernel, driver code for our InServe productions as part of the software platform team"
"/media/Dados/bases/SWDE/job/job-jobtarget/0540.htm","Strong knowledge of PHP, Perl, VBScript, or Python"
"/media/Dados/bases/SWDE/job/job-jobtarget/0721.htm",World Class CMMI level 3 and Agile software engineering and tailored solutions.
"/media/Dados/bases/SWDE/job/job-jobtarget/1775.htm",3 to 5 years experience or equivalent (PhD)
"/media/Dados/bases/SWDE/job/job-jobtarget/0509.htm","Associates or Bachelors Degree in Health Information Management required, Masters preferred"
"/media/Dados/bases/SWDE/job/job-jobtarget/0966.htm",Identify and recommend key advertising and promotional opportunities.
"/media/Dados/bases/SWDE/job/job-jobtarget/0087.htm",Three (3) years of data management experience
"/media/Dados/bases/SWDE/job/job-jobtarget/1128.htm",Respond to all customer inquiries in a professional and timely manner.
"/media/Dados/bases/SWDE/job/job-jobtarget/0644.htm","Perform pre-sales activities, supporting outside Sales and Tele-Sales personnel"
"/media/Dados/bases/SWDE/job/job-jobtarget/0298.htm","Looking for Accounting Manager, Controller or Director of Finance level to assist with a software implementation as a functional user."
"/media/Dados/bases/SWDE/job/job-jobtarget/1341.htm","Oversee the establishment for labour and construction equipment rates, equipment prices, bulk material unit prices and quantities"
"/media/Dados/bases/SWDE/job/job-jobtarget/0256.htm","Manage product roadmap, pricing, promotion and special sales programs for all HP hardware and software accessories"
"/media/Dados/bases/SWDE/job/job-jobtarget/1255.htm",Create a branded presence for CSBU and its offerings at events that is compelling to customer segments and differentiated versus competitors
"/media/Dados/bases/SWDE/job/job-jobtarget/1123.htm","Selects, trains, and evaluates sales representatives for territory."
"/media/Dados/bases/SWDE/job/job-jobtarget/0123.htm","Be familiar with organizational policies, procedures, business operations, and regulatory requirements relating to electronic clinical applications."
"/media/Dados/bases/SWDE/job/job-jobtarget/1125.htm",Respond to all customer inquiries in a professional and timely manner.
"/media/Dados/bases/SWDE/job/job-jobtarget/1005.htm","Support the efforts of the Advocacy and Policy Team in various projects, campaigns, events and initiatives; and"
"/media/Dados/bases/SWDE/job/job-jobtarget/0774.htm",Develop new concepts and evolutionary improvements in packaging technology for full Range of TE active fiber optic products
"/media/Dados/bases/SWDE/job/job-jobtarget/1096.htm",Respond to all customer inquiries in a professional and timely manner.
"/media/Dados/bases/SWDE/job/job-jobtarget/0092.htm",Star Team
"/media/Dados/bases/SWDE/job/job-jobtarget/0249.htm","BS, MS, or PhD in Computer Science or related technical discipline (or equivalent)."
"/media/Dados/bases/SWDE/job/job-jobtarget/0562.htm","7+ years of hands-on SAP BASIS experience with an emphasis in configuration, analysis and troubleshooting required."
"/media/Dados/bases/SWDE/job/job-jobtarget/0532.htm","1. Manages and maintains First Solar's SAP Business Warehouse and Business Objects reporting platform (content, performance, security, etc.)"
"/media/Dados/bases/SWDE/job/job-jobtarget/1099.htm",Respond to all customer inquiries in a professional and timely manner.
"/media/Dados/bases/SWDE/job/job-jobtarget/1294.htm",BS in CS/CE or equivalent combination of education and experience.
"/media/Dados/bases/SWDE/job/job-jobtarget/1109.htm",Respond to all customer inquiries in a professional and timely manner.
"/media/Dados/bases/SWDE/job/job-jobtarget/0175.htm",Own a portfolio of at least ten customers and customer engagements
"/media/Dados/bases/SWDE/job/job-jobtarget/1254.htm",Establishes and maintains a PCI program to protect cardholder data to comply with PCI Data Security Standards (DSS).
"/media/Dados/bases/SWDE/job/job-jobtarget/1742.htm",Articulate a comprehensive performance test strategy that supports the product roadmap.
"/media/Dados/bases/SWDE/job/job-jobtarget/1505.htm",- Associates Degree
"/media/Dados/bases/SWDE/job/job-jobtarget/0739.htm","Bachelor degree in Computer Science, Physics, or Mathematics, required; Master degree in either technology or business is an advantage."
