URL,EXTRACTED VALUE
"/media/Dados/bases/SWDE/job/job-jobtarget/1405.htm",Obtains patient signature on all appropriate forms.
"/media/Dados/bases/SWDE/job/job-jobtarget/1863.htm",Preferred:
"/media/Dados/bases/SWDE/job/job-jobtarget/0827.htm",Places patients in examination rooms in a timely and courteous manner.
"/media/Dados/bases/SWDE/job/job-jobtarget/1038.htm",Documents patient's PCP in the ED Registration system.
"/media/Dados/bases/SWDE/job/job-jobtarget/0989.htm",Change Management
"/media/Dados/bases/SWDE/job/job-jobtarget/0934.htm","QUALIFICATIONS: (MUST be realistic, neither overstated nor understated, and related to the essential functions of the job.)"
"/media/Dados/bases/SWDE/job/job-jobtarget/0897.htm","' Files, xeroxes, performs word processing"
"/media/Dados/bases/SWDE/job/job-jobtarget/0257.htm",Education/General IT Experience/Clearance:
