URL,EXTRACTED VALUE
"/media/Dados/bases/SWDE/job/job-jobtarget/0266.htm",Experience running
"/media/Dados/bases/SWDE/job/job-jobtarget/0846.htm",Adequately prepare all course materials and lessons
"/media/Dados/bases/SWDE/job/job-jobtarget/1307.htm",5 years of health care insurance experience or operations experience in a call center or production environment
"/media/Dados/bases/SWDE/job/job-jobtarget/0885.htm",Participate in process development and in projects to assure security policy and standards are applied appropriately
"/media/Dados/bases/SWDE/job/job-jobtarget/0050.htm",Take a lead role in execution of the web deployment process for each new partner.
"/media/Dados/bases/SWDE/job/job-jobtarget/0571.htm",Comply with all applicable U.S. export and security regulations.
"/media/Dados/bases/SWDE/job/job-jobtarget/1419.htm",Enthusiastically support your team and your company and bring a positive attitude to your job...
"/media/Dados/bases/SWDE/job/job-jobtarget/1308.htm",5 years of health care insurance experience or operations experience in a call center or production environment
"/media/Dados/bases/SWDE/job/job-jobtarget/1280.htm",Oversee the Title IV processing of new and continuing student loan and grant applications.
"/media/Dados/bases/SWDE/job/job-jobtarget/1101.htm","Analyze customers financial status, credit and property to determine available mortgage products."
"/media/Dados/bases/SWDE/job/job-jobtarget/0572.htm",Bachelor’s degree preferred.
"/media/Dados/bases/SWDE/job/job-jobtarget/1369.htm",Crain's Cleveland Business Coolest Places to Work
"/media/Dados/bases/SWDE/job/job-jobtarget/1435.htm","Ensure that design, development, delivery and supportability of application solutions are in accordance with business and IT objectives"
"/media/Dados/bases/SWDE/job/job-jobtarget/1098.htm","Analyze customers financial status, credit and property to determine available mortgage products."
"/media/Dados/bases/SWDE/job/job-jobtarget/1447.htm","Collaboratively create, manage and implement media and public relations campaign strategies for Crystal Bridges Museum of American Art."
"/media/Dados/bases/SWDE/job/job-jobtarget/0029.htm",Provide support for different types of meters
"/media/Dados/bases/SWDE/job/job-jobtarget/0962.htm","Make necessary entries into the FEP Case Tracking System (FIMS), and coordinate other government program projects"
"/media/Dados/bases/SWDE/job/job-jobtarget/1060.htm","Analyze customers financial status, credit and property to determine available mortgage products."
"/media/Dados/bases/SWDE/job/job-jobtarget/0637.htm",Write reports that summarize executed testing for business computer systems implementation and upgrades in an FDA regulated environment.
"/media/Dados/bases/SWDE/job/job-jobtarget/1859.htm",Strong knowledge of AM&S techniques.
"/media/Dados/bases/SWDE/job/job-jobtarget/1679.htm",Excellent communication skills
"/media/Dados/bases/SWDE/job/job-jobtarget/1105.htm","Analyze customers financial status, credit and property to determine available mortgage products."
"/media/Dados/bases/SWDE/job/job-jobtarget/0170.htm","Build and maintain strong relationships with clients; Create strategies to retain, grow and enhance client relationships."
"/media/Dados/bases/SWDE/job/job-jobtarget/0679.htm","K12 and postsecondary educational access, engagement and outcomes such as drop-out and college readiness for at risk populations"
"/media/Dados/bases/SWDE/job/job-jobtarget/0112.htm","Investigation of application issues, problem resolution, and status reporting"
"/media/Dados/bases/SWDE/job/job-jobtarget/0014.htm",Experience with life and/or annuity products is preferred.
"/media/Dados/bases/SWDE/job/job-jobtarget/0088.htm","Communicate with other processing team members, to create the right workflow, understand client deadlines and specific project needs."
"/media/Dados/bases/SWDE/job/job-jobtarget/1894.htm",Direct and manage various simulations and studies performed by third parties pertaining to protective relay coordination and power system reliability.
"/media/Dados/bases/SWDE/job/job-jobtarget/0694.htm",You will need to be proficient with and interested in computer systems (either Mac or Windows).
"/media/Dados/bases/SWDE/job/job-jobtarget/0879.htm","Greets the public and visitors in person or over the phone, and obtains (or provide) information"
"/media/Dados/bases/SWDE/job/job-jobtarget/0352.htm",Experience with Electro-Mechanical assembly design and manufacturing.
"/media/Dados/bases/SWDE/job/job-jobtarget/0310.htm",Delivering online training sessions to individual customers
"/media/Dados/bases/SWDE/job/job-jobtarget/0347.htm",Experience with Federal student loans or consumer credit or student financial aid preferable .
"/media/Dados/bases/SWDE/job/job-jobtarget/0233.htm",Manage dedicated portfolio of donors and prospects within moves management.
"/media/Dados/bases/SWDE/job/job-jobtarget/0673.htm",Review and post journal entries
"/media/Dados/bases/SWDE/job/job-jobtarget/1666.htm",Maintain the availability of the OnBase OnLine hosted service
"/media/Dados/bases/SWDE/job/job-jobtarget/0011.htm",Identifying/defining client needs; providing support and solutions based on client needs
"/media/Dados/bases/SWDE/job/job-jobtarget/1100.htm","Analyze customers financial status, credit and property to determine available mortgage products."
"/media/Dados/bases/SWDE/job/job-jobtarget/1009.htm",Together with the customer you analyze business requirements and processes with the aim of creating solutions tailored to the needs of the customer
"/media/Dados/bases/SWDE/job/job-jobtarget/0351.htm",prepare and maintain associated design documentation including:
"/media/Dados/bases/SWDE/job/job-jobtarget/1124.htm","Analyze customers financial status, credit and property to determine available mortgage products."
"/media/Dados/bases/SWDE/job/job-jobtarget/0344.htm","Approximately 5 years of related experience in logistics, transportation, traffic and sales/business interface."
"/media/Dados/bases/SWDE/job/job-jobtarget/1076.htm",Manage the operation of the NAEYC accredited child care center
"/media/Dados/bases/SWDE/job/job-jobtarget/1866.htm",Act as project coordinator in the introduction of new systems and applications;
"/media/Dados/bases/SWDE/job/job-jobtarget/0335.htm",Perform regular website maintenance and updates
"/media/Dados/bases/SWDE/job/job-jobtarget/1392.htm","Performs timely analysis, diagnosis and resolution of complex database issues."
"/media/Dados/bases/SWDE/job/job-jobtarget/0203.htm",These technologies are leveraged to support the development and ongoing sustainment of applications created to meet Regence's business needs
"/media/Dados/bases/SWDE/job/job-jobtarget/0206.htm",These technologies are leveraged to support the development and ongoing sustainment of applications created to meet Regence's business needs
"/media/Dados/bases/SWDE/job/job-jobtarget/1788.htm",PMP certification or equivalent is required
"/media/Dados/bases/SWDE/job/job-jobtarget/1106.htm","Analyze customers financial status, credit and property to determine available mortgage products."
"/media/Dados/bases/SWDE/job/job-jobtarget/0577.htm",Crain's Cleveland Business Coolest Places to Work
"/media/Dados/bases/SWDE/job/job-jobtarget/1112.htm","Analyze customers financial status, credit and property to determine available mortgage products."
"/media/Dados/bases/SWDE/job/job-jobtarget/0437.htm",Work closely with department staff as well as staff in other corporate departments
"/media/Dados/bases/SWDE/job/job-jobtarget/1701.htm","Experience diagnosing, reporting, tracking and resolving quality issues"
"/media/Dados/bases/SWDE/job/job-jobtarget/1561.htm",Minimum 4 years of demonstrated experience with clinical data management required.
"/media/Dados/bases/SWDE/job/job-jobtarget/0274.htm",Strong hardware troubleshooting skills are a must;
"/media/Dados/bases/SWDE/job/job-jobtarget/1789.htm",Minimum 3 year testing experience
"/media/Dados/bases/SWDE/job/job-jobtarget/1182.htm","Experience with evaluation, selection and application of standard engineering methods, techniques, procedures and criteria."
"/media/Dados/bases/SWDE/job/job-jobtarget/1110.htm","Analyze customers financial status, credit and property to determine available mortgage products."
"/media/Dados/bases/SWDE/job/job-jobtarget/0709.htm","When assigned design-related activities, prepares presentation drawings, and other deliverables as required by the Licensed Professional."
"/media/Dados/bases/SWDE/job/job-jobtarget/1262.htm",Ensure the provision of cogent intelligence analysis to PG&E decision makers in both written and oral form
"/media/Dados/bases/SWDE/job/job-jobtarget/1301.htm",5 years of health care insurance experience or operations experience in a call center or production environment
"/media/Dados/bases/SWDE/job/job-jobtarget/0495.htm",Designs and implements web applications that interface with databases;
"/media/Dados/bases/SWDE/job/job-jobtarget/0349.htm",A strong history of and commitment to customer service.
"/media/Dados/bases/SWDE/job/job-jobtarget/0930.htm","Main liaison for all housing requests, including management of reservations for all VIP's"
"/media/Dados/bases/SWDE/job/job-jobtarget/0715.htm",Makes presentations to internal and external customers
"/media/Dados/bases/SWDE/job/job-jobtarget/0378.htm",Prevents adverse selection by individuals and groups through sound underwriting
"/media/Dados/bases/SWDE/job/job-jobtarget/1300.htm",5 years of health care insurance experience or operations experience in a call center or production environment
"/media/Dados/bases/SWDE/job/job-jobtarget/1230.htm","Analyzes customer relationships relative to their financial needs, recommends products/services and sells solutions that will meet those needs."
"/media/Dados/bases/SWDE/job/job-jobtarget/1303.htm",5 years of health care insurance experience or operations experience in a call center or production environment
"/media/Dados/bases/SWDE/job/job-jobtarget/1813.htm",Repair and maintain customer hardware and software as necessary.
"/media/Dados/bases/SWDE/job/job-jobtarget/0239.htm",Design Architecture of EDI automation testing tools.
"/media/Dados/bases/SWDE/job/job-jobtarget/1870.htm",Provides direct support in the day-to-day operations on user systems
"/media/Dados/bases/SWDE/job/job-jobtarget/0750.htm","Prepare annual budgets, compare the budget and the actual financials at the end of each month, and notify home office of any major discrepancies."
"/media/Dados/bases/SWDE/job/job-jobtarget/0567.htm","Acting as a liaison to deans, faculty, trustees, government officials, students, staff, alumni and other constituents, both internal and external;"
"/media/Dados/bases/SWDE/job/job-jobtarget/0922.htm",5 years experience in fundraising or related sales experience
"/media/Dados/bases/SWDE/job/job-jobtarget/1469.htm","Backend database testing in Microsoft SQL environment including validating stored procs, jobs and triggers."
"/media/Dados/bases/SWDE/job/job-jobtarget/1237.htm","analyze processes and apply critical thinking skills,"
"/media/Dados/bases/SWDE/job/job-jobtarget/1286.htm",Bachelor's degree in Accounting/Finance required
"/media/Dados/bases/SWDE/job/job-jobtarget/0979.htm","Make necessary entries into the FEP Case Tracking System (FIMS), and coordinate other government program projects"
"/media/Dados/bases/SWDE/job/job-jobtarget/1851.htm",5+ years of successful software sales experience (preferably in a small to medium sized software vendor company)
"/media/Dados/bases/SWDE/job/job-jobtarget/1011.htm","Translate detailed marketing briefs provided by various business units to create emails, copy for e-newsletters, copy for web pages."
"/media/Dados/bases/SWDE/job/job-jobtarget/1342.htm",Lead efforts to prepare and negotiate indirect cost rates.
"/media/Dados/bases/SWDE/job/job-jobtarget/0928.htm",5 years experience in fundraising or related sales experience
"/media/Dados/bases/SWDE/job/job-jobtarget/1095.htm","Analyze customers financial status, credit and property to determine available mortgage products."
"/media/Dados/bases/SWDE/job/job-jobtarget/1033.htm",Strong background in signal analysis or machine learning
"/media/Dados/bases/SWDE/job/job-jobtarget/1196.htm",Revolving charge (Consumer & Commercial)
"/media/Dados/bases/SWDE/job/job-jobtarget/0937.htm","Collect urine specimens from patients in a randomized manner consistent with program policy, regulatory and accreditation agency requirements"
"/media/Dados/bases/SWDE/job/job-jobtarget/1922.htm",Experience in Mac
"/media/Dados/bases/SWDE/job/job-jobtarget/1623.htm",Master’s Degree preferred
"/media/Dados/bases/SWDE/job/job-jobtarget/0388.htm","Five plus (5+) years of fundraising, technology transfer, or related sales or marketing experience, preferably in higher education"
"/media/Dados/bases/SWDE/job/job-jobtarget/1988.htm",Develop maintenance releases to resolve software bugs in our product line
"/media/Dados/bases/SWDE/job/job-jobtarget/1107.htm","Analyze customers financial status, credit and property to determine available mortgage products."
"/media/Dados/bases/SWDE/job/job-jobtarget/0202.htm",These technologies are leveraged to support the development and ongoing sustainment of applications created to meet Regence's business needs
"/media/Dados/bases/SWDE/job/job-jobtarget/1812.htm",Revises project work plans as appropriate to meet changing needs and requirements
"/media/Dados/bases/SWDE/job/job-jobtarget/0480.htm","Respond to inquiries from public, disseminate information and promotional materials accordingly"
"/media/Dados/bases/SWDE/job/job-jobtarget/0520.htm",Have or be interested obtaining technology to record and edit gameplay on one or more of the top three consoles.
"/media/Dados/bases/SWDE/job/job-jobtarget/0066.htm",Experience leading a team of 3-4+ developers or architects
"/media/Dados/bases/SWDE/job/job-jobtarget/1445.htm","Review and analyze information such as item movement, SKU assortment, sell-through, etc. Report assessment of data and trends to Category Manager."
"/media/Dados/bases/SWDE/job/job-jobtarget/0883.htm",Participate in process development and in projects to assure security policy and standards are applied appropriately
"/media/Dados/bases/SWDE/job/job-jobtarget/1416.htm",Makes presentations to internal and external customers
"/media/Dados/bases/SWDE/job/job-jobtarget/1113.htm","Analyze customers financial status, credit and property to determine available mortgage products."
"/media/Dados/bases/SWDE/job/job-jobtarget/1067.htm",Managing staff to realize benefits expected from IT.
"/media/Dados/bases/SWDE/job/job-jobtarget/1016.htm","Good knowledge of Java, C++ or Python."
"/media/Dados/bases/SWDE/job/job-jobtarget/1120.htm","Analyze customers financial status, credit and property to determine available mortgage products."
"/media/Dados/bases/SWDE/job/job-jobtarget/0073.htm",Facilitates the delivery of the pharmacy component of purchased professional services.
"/media/Dados/bases/SWDE/job/job-jobtarget/0285.htm",Provide support to internal and external clients.
"/media/Dados/bases/SWDE/job/job-jobtarget/1320.htm",5 years of health care insurance experience or operations experience in a call center or production environment
"/media/Dados/bases/SWDE/job/job-jobtarget/1231.htm","Analyzes customer relationships relative to their financial needs, recommends products/services and sells solutions that will meet those needs."
"/media/Dados/bases/SWDE/job/job-jobtarget/0226.htm","§ Responsible for system and data security, accuracy, and availability."
"/media/Dados/bases/SWDE/job/job-jobtarget/1129.htm","0-1 years experience in digital media analytics at a leading online advertising agency, network, advertising exchange, or optimization firm"
"/media/Dados/bases/SWDE/job/job-jobtarget/0299.htm","Screening, sorting and distributing mail"
"/media/Dados/bases/SWDE/job/job-jobtarget/1368.htm",Bachelors degree in Computer Science or equivalent
"/media/Dados/bases/SWDE/job/job-jobtarget/1114.htm","Analyze customers financial status, credit and property to determine available mortgage products."
"/media/Dados/bases/SWDE/job/job-jobtarget/0454.htm",Able to read and interpret complex blueprints and schematics.
"/media/Dados/bases/SWDE/job/job-jobtarget/1895.htm",Direct and manage various simulations and studies performed by third parties pertaining to protective relay coordination and power system reliability.
"/media/Dados/bases/SWDE/job/job-jobtarget/0823.htm",Crain's Cleveland Business Coolest Places to Work
"/media/Dados/bases/SWDE/job/job-jobtarget/1115.htm","Analyze customers financial status, credit and property to determine available mortgage products."
"/media/Dados/bases/SWDE/job/job-jobtarget/0113.htm","Investigation of application issues, problem resolution, and status reporting"
"/media/Dados/bases/SWDE/job/job-jobtarget/0721.htm",Inherent cost effectiveness and pricing advantage.
"/media/Dados/bases/SWDE/job/job-jobtarget/0966.htm",Develop and execute full year promotional strategy and plan.
"/media/Dados/bases/SWDE/job/job-jobtarget/1669.htm","Assist PI's in meeting research goals of funded studies: conducting statistical analyses, preparing tables and reports of results"
"/media/Dados/bases/SWDE/job/job-jobtarget/0087.htm",BS degree in Information Management is a plus
"/media/Dados/bases/SWDE/job/job-jobtarget/1128.htm","Analyze customers financial status, credit and property to determine available mortgage products."
"/media/Dados/bases/SWDE/job/job-jobtarget/0224.htm",Manages a dedicated portfolio of donors and prospects within moves management.
"/media/Dados/bases/SWDE/job/job-jobtarget/0123.htm",Be familiar with national standards related to quality and safety.
"/media/Dados/bases/SWDE/job/job-jobtarget/1125.htm","Analyze customers financial status, credit and property to determine available mortgage products."
"/media/Dados/bases/SWDE/job/job-jobtarget/0774.htm","Use LDFSS tools for voice of the customer, inputs"
"/media/Dados/bases/SWDE/job/job-jobtarget/1096.htm","Analyze customers financial status, credit and property to determine available mortgage products."
"/media/Dados/bases/SWDE/job/job-jobtarget/1449.htm",Handle and resolve vendor inquires
"/media/Dados/bases/SWDE/job/job-jobtarget/0677.htm",Experience managing a collections budget and working with the development office in the cultivation of donor and financial resources.
"/media/Dados/bases/SWDE/job/job-jobtarget/0249.htm","A solid foundation in computer science, with strong competencies in data structures, algorithms, and software design."
"/media/Dados/bases/SWDE/job/job-jobtarget/0028.htm","Proactively works with database aggregators and partners on implementation, data, product content / information, and customer support issues."
"/media/Dados/bases/SWDE/job/job-jobtarget/0562.htm",2+ years in management/lead capacity
"/media/Dados/bases/SWDE/job/job-jobtarget/0532.htm","2. Manage the application of SAP Business Warehouse releases, patches and notes provided by SAP"
"/media/Dados/bases/SWDE/job/job-jobtarget/1099.htm","Analyze customers financial status, credit and property to determine available mortgage products."
"/media/Dados/bases/SWDE/job/job-jobtarget/1254.htm",Ensures quarterly and annual compliance reporting requirements are met.
"/media/Dados/bases/SWDE/job/job-jobtarget/1109.htm","Analyze customers financial status, credit and property to determine available mortgage products."
"/media/Dados/bases/SWDE/job/job-jobtarget/0175.htm","Responsible for project planning, project delivery, timelines and budget"
"/media/Dados/bases/SWDE/job/job-jobtarget/1446.htm","Review and analyze information such as item movement, SKU assortment, sell-through, etc. Report assessment of data and trends to Category Manager."
"/media/Dados/bases/SWDE/job/job-jobtarget/1617.htm",§ Work in tandem with fellow APC Senior Analysts' to develop corrective action recommendations for APCs as required.
"/media/Dados/bases/SWDE/job/job-jobtarget/1856.htm","May develop a range of products including online courses, simulations, assessments, graphics, etc."
"/media/Dados/bases/SWDE/job/job-jobtarget/0455.htm",Maintain and improve Application Service Level Agreements (SLAs).
"/media/Dados/bases/SWDE/job/job-jobtarget/1270.htm","craft a compelling, highly-usable UI that extends the priceline brand"
"/media/Dados/bases/SWDE/job/job-jobtarget/0698.htm",Experience managing a collections budget and working with the development office in the cultivation of donor and financial resources.
"/media/Dados/bases/SWDE/job/job-jobtarget/1420.htm","Design, implement, and facilitate an annual marketing plan to ensure optimal positioning in the market place."
"/media/Dados/bases/SWDE/job/job-jobtarget/0536.htm",Project Management
"/media/Dados/bases/SWDE/job/job-jobtarget/0713.htm",Makes presentations to internal and external customers
"/media/Dados/bases/SWDE/job/job-jobtarget/1103.htm","Analyze customers financial status, credit and property to determine available mortgage products."
"/media/Dados/bases/SWDE/job/job-jobtarget/0887.htm",Cultivate and maintain relationships with key providers
"/media/Dados/bases/SWDE/job/job-jobtarget/0048.htm",Minimum of 3-5 years experience in educational publishing or instructional design. K-12 education experience preferred.
"/media/Dados/bases/SWDE/job/job-jobtarget/1111.htm","Analyze customers financial status, credit and property to determine available mortgage products."
"/media/Dados/bases/SWDE/job/job-jobtarget/1232.htm","Analyzes customer relationships relative to their financial needs, recommends products/services and sells solutions that will meet those needs."
"/media/Dados/bases/SWDE/job/job-jobtarget/0533.htm","Receive ongoing training to build and extend professional, technical and management skills in all areas"
"/media/Dados/bases/SWDE/job/job-jobtarget/1443.htm","Review and analyze information such as item movement, SKU assortment, sell-through, etc. Report assessment of data and trends to Category Manager."
"/media/Dados/bases/SWDE/job/job-jobtarget/0047.htm",Prepares reports and analysis for quarterly Finance Committee meetings of the Board of Directors.
"/media/Dados/bases/SWDE/job/job-jobtarget/1183.htm","analyze processes and apply critical thinking skills,"
"/media/Dados/bases/SWDE/job/job-jobtarget/0780.htm",Client and vendor interface services
"/media/Dados/bases/SWDE/job/job-jobtarget/1455.htm",Meet with customers and prospects to determine high-level business needs as well as detailed product requirements
"/media/Dados/bases/SWDE/job/job-jobtarget/0300.htm",Partner with sales support to enhance software for pricing of financial products to customers
"/media/Dados/bases/SWDE/job/job-jobtarget/0765.htm",Join the #1 Choice for Hands-on-Help in Cancer Registry as we experience tremendous growth
"/media/Dados/bases/SWDE/job/job-jobtarget/1116.htm","Analyze customers financial status, credit and property to determine available mortgage products."
"/media/Dados/bases/SWDE/job/job-jobtarget/0286.htm",Provide support to internal and external clients.
"/media/Dados/bases/SWDE/job/job-jobtarget/1036.htm",Matching BI needs and making recommendations for MicroStrategy platform
"/media/Dados/bases/SWDE/job/job-jobtarget/0712.htm","2+ years of experience in workforce development, youth development or environmental education program planning and implementation"
"/media/Dados/bases/SWDE/job/job-jobtarget/1184.htm",Located in the Chicago area and able to work in the office at least 4 days per week
"/media/Dados/bases/SWDE/job/job-jobtarget/0671.htm",1+ yr of experience monitoring the workflow & productivity of a data abstraction team
"/media/Dados/bases/SWDE/job/job-jobtarget/1720.htm","Experience diagnosing, reporting, tracking and resolving quality issues"
"/media/Dados/bases/SWDE/job/job-jobtarget/1029.htm","Build a network of internal partners including business, technology, laboratories, manufacturing, quality, regulatory"
"/media/Dados/bases/SWDE/job/job-jobtarget/1708.htm","Experience diagnosing, reporting, tracking and resolving quality issues"
"/media/Dados/bases/SWDE/job/job-jobtarget/1306.htm",5 years of health care insurance experience or operations experience in a call center or production environment
"/media/Dados/bases/SWDE/job/job-jobtarget/1321.htm",5 years of health care insurance experience or operations experience in a call center or production environment
"/media/Dados/bases/SWDE/job/job-jobtarget/0240.htm",Serving as the primary thought leader for all elements of the design of the next-generation student achievement metrics and goals system
"/media/Dados/bases/SWDE/job/job-jobtarget/0382.htm",Experience managing a collections budget and working with the development office in the cultivation of donor and financial resources.
"/media/Dados/bases/SWDE/job/job-jobtarget/1097.htm","Analyze customers financial status, credit and property to determine available mortgage products."
"/media/Dados/bases/SWDE/job/job-jobtarget/1118.htm","Analyze customers financial status, credit and property to determine available mortgage products."
"/media/Dados/bases/SWDE/job/job-jobtarget/0207.htm",These technologies are leveraged to support the development and ongoing sustainment of applications created to meet Regence's business needs
"/media/Dados/bases/SWDE/job/job-jobtarget/1027.htm",Monitors budget performance compared to plan and alerts managers to potential issues.
"/media/Dados/bases/SWDE/job/job-jobtarget/1126.htm","Analyze customers financial status, credit and property to determine available mortgage products."
"/media/Dados/bases/SWDE/job/job-jobtarget/0576.htm",Crain's Cleveland Business Coolest Places to Work
