URL,EXTRACTED VALUE
"/media/Dados/bases/SWDE/job/job-jobtarget/1931.htm",Program/Project Management
"/media/Dados/bases/SWDE/job/job-jobtarget/1119.htm",Recommend changes in marketing philosophy and policy when such changes serve the best interests of the organization
"/media/Dados/bases/SWDE/job/job-jobtarget/1271.htm",Learn more about Seattle Public Utilities at:
"/media/Dados/bases/SWDE/job/job-jobtarget/0778.htm","Excellent verbal and written communication skills, professional manner and computer literacy"
"/media/Dados/bases/SWDE/job/job-jobtarget/0895.htm",· Superb work ethic
"/media/Dados/bases/SWDE/job/job-jobtarget/1846.htm",Coordinates the department director’s schedule and department meeting calendar. Confirms appointments and meetings as directed.
"/media/Dados/bases/SWDE/job/job-jobtarget/1959.htm",n
"/media/Dados/bases/SWDE/job/job-jobtarget/1591.htm",Only candidates selected for an interview will be contacted.
"/media/Dados/bases/SWDE/job/job-jobtarget/1154.htm",ILSCO Corporation
"/media/Dados/bases/SWDE/job/job-jobtarget/1766.htm","Fax resume and cover letter with salary req’s to Christy Jones, Human Resources Generalist, at #(703) 273-8432 or via e-mail to"
"/media/Dados/bases/SWDE/job/job-jobtarget/0689.htm",Strong understanding of the security marketplace especially in data encryption and/ or authentication technologies.
"/media/Dados/bases/SWDE/job/job-jobtarget/1473.htm",Owner or entrepreneurial attitude.
"/media/Dados/bases/SWDE/job/job-jobtarget/1593.htm",Profit Responsibilities:
"/media/Dados/bases/SWDE/job/job-jobtarget/0208.htm",PREFERRED:
"/media/Dados/bases/SWDE/job/job-jobtarget/1284.htm","40% Prepares, Manages, and Oversees Institution's Budget:"
"/media/Dados/bases/SWDE/job/job-jobtarget/0819.htm","Well-developed analytical, leadership, problem solving and negotiation skills"
"/media/Dados/bases/SWDE/job/job-jobtarget/1579.htm",Profit Responsibilities:
"/media/Dados/bases/SWDE/job/job-jobtarget/1925.htm",Esri is an equal opportunity employer (EOE) supporting diversity in the workforce.
