URL,EXTRACTED VALUE
"/media/Dados/bases/SWDE/job/job-monster/1088.htm",SENIOR APPLICATION DEVELOPER
"/media/Dados/bases/SWDE/job/job-monster/0672.htm","It’s a lot to ask, so what will we do in return? If you complete the application, we"
"/media/Dados/bases/SWDE/job/job-monster/1567.htm",What you’ll be doing:
"/media/Dados/bases/SWDE/job/job-monster/0036.htm","For immediate consideration, please apply online at"
"/media/Dados/bases/SWDE/job/job-monster/1565.htm",This is a fulltime position in midtown NY.
"/media/Dados/bases/SWDE/job/job-monster/0428.htm","IMC is looking for candidates to fill a FileNet ARCHITECT opening that we have in Baltimore, Maryland."
