URL,EXTRACTED VALUE
"/media/Dados/bases/SWDE/job/job-monster/0899.htm",Enhancing existing applications
"/media/Dados/bases/SWDE/job/job-monster/1558.htm","Prepare Meeting Notes, Status Reports and other project management documents"
"/media/Dados/bases/SWDE/job/job-monster/0819.htm",Ability to conduct classroom style training with up to 12 students at client location
"/media/Dados/bases/SWDE/job/job-monster/1573.htm",Immediate 24X7 response to critical site incidents
"/media/Dados/bases/SWDE/job/job-monster/0308.htm","5+ years experience with C#, SQL and SSIS."
"/media/Dados/bases/SWDE/job/job-monster/0183.htm",Seeking a mid- to senior-level programmer who works well with minimal supervision
"/media/Dados/bases/SWDE/job/job-monster/1582.htm","Provide technical and end-user support, perform software testing, and oversee vendor upgrades for Jenzibar EX and PowerFAIDS applications"
"/media/Dados/bases/SWDE/job/job-monster/1378.htm","Bachelors Degree in Computer Science, Engineering, or equivalent work experience with certifications such as CCNA, CCNP."
