URL,EXTRACTED VALUE
"/media/Dados/bases/SWDE/job/job-monster/0935.htm","5+ years demonstrated experience developing complex, large-scale web applications within an N-Tier environment using the following:"
"/media/Dados/bases/SWDE/job/job-monster/0877.htm",Participate in quality assurance testing/resolution and technical support
"/media/Dados/bases/SWDE/job/job-monster/0914.htm","WCF, WPF/Silverlight, or WF experience"
"/media/Dados/bases/SWDE/job/job-monster/1548.htm",Ability to drive positive results in difficult circumstances with ability to cope with rapid change.
"/media/Dados/bases/SWDE/job/job-monster/1812.htm",Ability to drive positive results in difficult circumstances with ability to cope with rapid change.
"/media/Dados/bases/SWDE/job/job-monster/1092.htm",Timely and efficient
