URL,EXTRACTED VALUE
"/media/Dados/bases/SWDE/job/job-monster/0405.htm",Be able to lift up to 75 lbs of weight
"/media/Dados/bases/SWDE/job/job-monster/1614.htm","Windows Server 2008, Active Directory and SQL Server 2008 administration a plus"
"/media/Dados/bases/SWDE/job/job-monster/0892.htm",Must be able to perform computer functions and operate routine office equipment.
"/media/Dados/bases/SWDE/job/job-monster/1632.htm","Holds the decision making power to make modifications, report design changes and format of graphics to meet the requirements of sales people."
"/media/Dados/bases/SWDE/job/job-monster/1392.htm",Systematic and thorough in process
