URL,EXTRACTED VALUE
"/media/Dados/bases/SWDE/job/job-monster/1551.htm",• Competitive Compensation
"/media/Dados/bases/SWDE/job/job-monster/1367.htm",Have experience in a direct outbound support role
"/media/Dados/bases/SWDE/job/job-monster/0253.htm",TYPICAL PHYSICAL DEMANDS:
"/media/Dados/bases/SWDE/job/job-monster/0229.htm",We would like to thank you personally for applying to Softchoice.
"/media/Dados/bases/SWDE/job/job-monster/1224.htm",- Define future business processes around Oracle Manufacturing modules
"/media/Dados/bases/SWDE/job/job-monster/1108.htm","Development and implementation of a technology roadmap execution strategy for assigned SMT areas, in accordance with ICG technology strategy."
"/media/Dados/bases/SWDE/job/job-monster/1130.htm","Again, thank you for your interest in a career at Softchoice."
"/media/Dados/bases/SWDE/job/job-monster/1248.htm","Maintain and update PMO Project Lists to include pending, active, closed, and on-hold projects"
"/media/Dados/bases/SWDE/job/job-monster/1643.htm","Energetic, inspired, dedicated, passionate about software development"
"/media/Dados/bases/SWDE/job/job-monster/0215.htm","(Will only consider candidates, who can work on our W2 )"
"/media/Dados/bases/SWDE/job/job-monster/0166.htm","Troubleshooting complicated user issues, mail client issues, and basic server problems"
"/media/Dados/bases/SWDE/job/job-monster/0415.htm",Follow development best practices and document required technical related to the project
"/media/Dados/bases/SWDE/job/job-monster/0737.htm",Large Medical Device
"/media/Dados/bases/SWDE/job/job-monster/1107.htm","Product training, and discussions regarding best practices for data protection and disaster recovery"
"/media/Dados/bases/SWDE/job/job-monster/1259.htm",Thank you for your interest in joining the School Improvement Network!
"/media/Dados/bases/SWDE/job/job-monster/0901.htm",• Expert knowledge of SAP R/3 inventory management and supply chain modules
"/media/Dados/bases/SWDE/job/job-monster/0182.htm","Business attire office environment; will require occasional weekend/evening work, reoccurring and occasional travel required."
"/media/Dados/bases/SWDE/job/job-monster/1371.htm","He/she will code, modify, and test applications using a variety of technologies and environments, such as; LAMP, XML, XHTML,"
"/media/Dados/bases/SWDE/job/job-monster/0035.htm","* Low level Embedded Software: Driver, Boot, BSP, DSP, A/D"
"/media/Dados/bases/SWDE/job/job-monster/0553.htm","To learn more about Everything Channel, please visit"
"/media/Dados/bases/SWDE/job/job-monster/1399.htm","This opening is for the Houston, TX area."
"/media/Dados/bases/SWDE/job/job-monster/1430.htm",Manage ongoing support requests and administrative needs of
"/media/Dados/bases/SWDE/job/job-monster/0227.htm",We would like to thank you personally for applying to Softchoice.
"/media/Dados/bases/SWDE/job/job-monster/0407.htm","· Demonstrated expertise with design and implementation of test plans, managing the software development life cycle."
"/media/Dados/bases/SWDE/job/job-monster/1352.htm","> Self-discipline: able to choose task, plan and execute completion of task - without someone managing them"
"/media/Dados/bases/SWDE/job/job-monster/1874.htm",Closing Date:
"/media/Dados/bases/SWDE/job/job-monster/1960.htm",- Familiarity with both Windows and OSX environments
"/media/Dados/bases/SWDE/job/job-monster/0075.htm",Security Clearance Required: Must be able to obtain a clearance at the SECRET level.
"/media/Dados/bases/SWDE/job/job-monster/1946.htm",Experience supporting complex systems in a 24x7 environment
"/media/Dados/bases/SWDE/job/job-monster/0559.htm",2-5 years professional experience.
"/media/Dados/bases/SWDE/job/job-monster/0922.htm","For more information, please visit"
"/media/Dados/bases/SWDE/job/job-monster/0811.htm",Qualifications
"/media/Dados/bases/SWDE/job/job-monster/0969.htm",Language Skills
"/media/Dados/bases/SWDE/job/job-monster/0228.htm",Experience
"/media/Dados/bases/SWDE/job/job-monster/0062.htm","We offer a competitive salary, excellent benefits package and positive work environment."
"/media/Dados/bases/SWDE/job/job-monster/1195.htm","+ Strong understanding of Windows server and desktop operating systems: Windows 7, Windows Server, Windows Vista, Windows XP."
"/media/Dados/bases/SWDE/job/job-monster/0216.htm",The team is a group of exceptional individuals who are committed and passionate about the future of the Company.
"/media/Dados/bases/SWDE/job/job-monster/1646.htm",Albany College of Pharmacy and Health Sciences
"/media/Dados/bases/SWDE/job/job-monster/1236.htm","Photoshop, Illustrator, Dream Weaver, Flash - required"
"/media/Dados/bases/SWDE/job/job-monster/0917.htm",Experience in Worflow applications
"/media/Dados/bases/SWDE/job/job-monster/1163.htm",. You can also call me on 609 924 3400 x 106 or 646 708 6699
"/media/Dados/bases/SWDE/job/job-monster/1329.htm","or mail/fax your resume, which MUST include salary history/requirements to:"
"/media/Dados/bases/SWDE/job/job-monster/1603.htm","Understanding of the payments industry including transaction flows, communication protocols, messaging formats, etc… a plus"
"/media/Dados/bases/SWDE/job/job-monster/1550.htm",• Competitive Compensation
"/media/Dados/bases/SWDE/job/job-monster/0996.htm","* Builds, maintains and configures development/test/sandbox/production environments for application development and deployment."
"/media/Dados/bases/SWDE/job/job-monster/0239.htm",We would like to thank you personally for applying to Softchoice.
"/media/Dados/bases/SWDE/job/job-monster/0051.htm",software installation
"/media/Dados/bases/SWDE/job/job-monster/0302.htm","• We hire intelligent, skilled recruiters who are trained in their industry and know the right questions to ask to identify the perfect candidate."
"/media/Dados/bases/SWDE/job/job-monster/1004.htm",".NET, C#, WF, WPF, WCF, LINQ, Silverlight, Jquery, TFS, MVP, MVVM"
"/media/Dados/bases/SWDE/job/job-monster/0151.htm",IT ServUs Desktop Support Tier 1 Technician - 3 positions
"/media/Dados/bases/SWDE/job/job-monster/1877.htm","• Strong project management, organizational, and communications skills;"
"/media/Dados/bases/SWDE/job/job-monster/0799.htm",Required Skills:
"/media/Dados/bases/SWDE/job/job-monster/1481.htm","This opportunity is located in Reston, VA. To obtain more information regarding this position or to apply, please contact"
"/media/Dados/bases/SWDE/job/job-monster/1596.htm","Submitting travel requests, trip reports, student rosters, and training feedback forms"
"/media/Dados/bases/SWDE/job/job-monster/0645.htm",5 - 8 years of professional experience.
"/media/Dados/bases/SWDE/job/job-monster/0230.htm",We would like to thank you personally for applying to Softchoice.
"/media/Dados/bases/SWDE/job/job-monster/1993.htm",Office or related machinery utilized:
