URL,EXTRACTED VALUE
"/media/Dados/bases/SWDE/job/job-monster/1998.htm",Must possess effective verbal and written communication skills
"/media/Dados/bases/SWDE/job/job-monster/1743.htm",Assist the Legal team with the review of client contracts as it relates to technology specific compliance requirements;
"/media/Dados/bases/SWDE/job/job-monster/1229.htm",Rigorously create and maintain documentation for all processes and procedures.
"/media/Dados/bases/SWDE/job/job-monster/1746.htm",IT team projects as assigned
"/media/Dados/bases/SWDE/job/job-monster/0151.htm",Customers Service skills
