URL,EXTRACTED VALUE
"/media/Dados/bases/SWDE/job/job-monster/1559.htm","Bachelor's Degree in Engineering, MIS, Information Technology, Management, or related field"
"/media/Dados/bases/SWDE/job/job-monster/0819.htm",Windows 2000/XP/Vista/7
"/media/Dados/bases/SWDE/job/job-monster/1228.htm",Applicants must have experience or training with at least one programming language.
"/media/Dados/bases/SWDE/job/job-monster/1093.htm",network
"/media/Dados/bases/SWDE/job/job-monster/0127.htm","Ability to prioritize and troubleshoot multiple issues, as well as adapt to new challenges quickly"
"/media/Dados/bases/SWDE/job/job-monster/0310.htm","Strong emphasis on supporting distributed parallel development, continuous integration, and build and test automation"
"/media/Dados/bases/SWDE/job/job-monster/1457.htm",Quality assurance and test methods development experience;
"/media/Dados/bases/SWDE/job/job-monster/0899.htm",Configuring hardware and software
"/media/Dados/bases/SWDE/job/job-monster/1558.htm",Cable Plant Design
"/media/Dados/bases/SWDE/job/job-monster/1573.htm",Conduct internal penetration tests
"/media/Dados/bases/SWDE/job/job-monster/1581.htm","Exceptional communication skills, both verbal and written."
"/media/Dados/bases/SWDE/job/job-monster/1436.htm",Administer and troubleshoot
"/media/Dados/bases/SWDE/job/job-monster/1196.htm",Work with client to determine functional requirements for the system within SAP BW.
"/media/Dados/bases/SWDE/job/job-monster/0183.htm",jQuery
"/media/Dados/bases/SWDE/job/job-monster/0777.htm","Identifies, troubleshoots and resolves hardware, software and network-related problems encountered by end-users"
"/media/Dados/bases/SWDE/job/job-monster/1582.htm",Assist DBA to administer MS SQL Server databases
"/media/Dados/bases/SWDE/job/job-monster/0746.htm",Linux experience
"/media/Dados/bases/SWDE/job/job-monster/1197.htm",Work with client to determine functional requirements for the system within SAP SD.
"/media/Dados/bases/SWDE/job/job-monster/0980.htm","responsible, self-motivated, and able to work independently"
