URL,EXTRACTED VALUE
"/media/Dados/bases/SWDE/job/job-monster/0988.htm",Adept networking and system administration abilities.
"/media/Dados/bases/SWDE/job/job-monster/0984.htm",Ability to work under pressure and adapt to a changing environment.
"/media/Dados/bases/SWDE/job/job-monster/1436.htm","Familiarity with common Office applications such as Word, PowerPoint, Excel, and Visio is essential"
"/media/Dados/bases/SWDE/job/job-monster/1076.htm","General knowledge of backup tape technologies, software and hardware preferred"
"/media/Dados/bases/SWDE/job/job-monster/1768.htm",Microsoft Certified Systems Engineer
"/media/Dados/bases/SWDE/job/job-monster/1223.htm",Current state issued drivers license
"/media/Dados/bases/SWDE/job/job-monster/0898.htm","Excellent customer service skills, positive attitude and the ability to communicate well with employees at all levels."
"/media/Dados/bases/SWDE/job/job-monster/0044.htm",Spring / Hibernate
