URL,EXTRACTED VALUE
"/media/Dados/bases/SWDE/job/job-monster/1314.htm",Our projects focus on software development and infrastructure support in the vertical markets of:
"/media/Dados/bases/SWDE/job/job-monster/1938.htm","Familiarity with Design Patterns, particularly Web 2.0 Model-View-Controller (MVC)"
"/media/Dados/bases/SWDE/job/job-monster/1418.htm","Create work plans, pricing estimates, and risk assessments for prospects"
"/media/Dados/bases/SWDE/job/job-monster/0355.htm","● Good problem solving, diagnosis and troubleshooting skills"
"/media/Dados/bases/SWDE/job/job-monster/0882.htm",; or equivalent combination of education and experience.
