URL,EXTRACTED VALUE
"/media/Dados/bases/SWDE/job/job-monster/1917.htm","Location Westborough, MA or Glastonbury, CT"
"/media/Dados/bases/SWDE/job/job-monster/1656.htm","Mail to: 29200 Aurora Road., Solon, Ohio 44139"
"/media/Dados/bases/SWDE/job/job-monster/0103.htm",· Assist in quality control/verification and validation activities.
"/media/Dados/bases/SWDE/job/job-monster/0534.htm","Additionally, Florida Virtual School is a member of the Florida Retirement System offering employer-paid pension/investment retirement plans."
"/media/Dados/bases/SWDE/job/job-monster/1473.htm","including: definition of strategic objectives, project charter, stakeholder analysis and business case"
"/media/Dados/bases/SWDE/job/job-monster/0722.htm",Excellent Verbal and Written Communication Skills
"/media/Dados/bases/SWDE/job/job-monster/0208.htm",automation devices while delivering and maintaining top notch customer service.
"/media/Dados/bases/SWDE/job/job-monster/0538.htm",One is
"/media/Dados/bases/SWDE/job/job-monster/0118.htm",Working knowledge of many or all of the following:
"/media/Dados/bases/SWDE/job/job-monster/0000.htm",Strong customer (internal) focus
"/media/Dados/bases/SWDE/job/job-monster/0659.htm",General SAN:
"/media/Dados/bases/SWDE/job/job-monster/0111.htm",Will work closely with internal Zones’ business units and Zones’ vendors to contribute to the online conversations.
