URL,EXTRACTED VALUE
"/media/Dados/bases/SWDE/job/job-monster/0694.htm","Knowledge of Active Directory, WINS, DHCP, and TCP/IP."
"/media/Dados/bases/SWDE/job/job-monster/1597.htm","Knowledge in HTML, JavaScript, Flash"
"/media/Dados/bases/SWDE/job/job-monster/1938.htm",Understanding of the full software development lifecycle.
"/media/Dados/bases/SWDE/job/job-monster/0967.htm",* Ability to work within a diverse team environment
"/media/Dados/bases/SWDE/job/job-monster/1596.htm","Ability to install, configure and trouble shoot basic networking services, such as TCP/IP and SMTP"
