URL,EXTRACTED VALUE
"/media/edimar/SAMSUNG/doutorado04/bases/SWDE/nbaplayer/nbaplayer-usatoday/0086.htm",Keyon Dooling has signed a contract with the Milwaukee Bucks.
"/media/edimar/SAMSUNG/doutorado04/bases/SWDE/nbaplayer/nbaplayer-usatoday/0032.htm","Jeff Foster made his season debut on Thursday, playing 12 minutes off the bench to score two points with four rebounds and two blocks."
"/media/edimar/SAMSUNG/doutorado04/bases/SWDE/nbaplayer/nbaplayer-usatoday/0312.htm","Paul Millsap played through the flu Friday and had 12 points, seven rebounds and three blocks."
"/media/edimar/SAMSUNG/doutorado04/bases/SWDE/nbaplayer/nbaplayer-usatoday/0306.htm","Al Jefferson scored 19 points on 7-of-18 shooting with eight rebounds, three assists, and two blocks in the Jazz's 94-83 win over the Kings on Monday."
"/media/edimar/SAMSUNG/doutorado04/bases/SWDE/nbaplayer/nbaplayer-usatoday/0016.htm","Omer Asik got another start for Joakim Noah (flu) on Friday and had six points, 10 rebounds and three blocks."
"/media/edimar/SAMSUNG/doutorado04/bases/SWDE/nbaplayer/nbaplayer-usatoday/0034.htm",Paul George came off the bench to hit 6-of-11 shots and five 3-pointers for 17 points and five rebounds in Tuesday's OT win.
"/media/edimar/SAMSUNG/doutorado04/bases/SWDE/nbaplayer/nbaplayer-usatoday/0226.htm","D.J. White double-doubled with 12 points, 13 rebounds and two blocks in a start for Thunder on Tuesday."
"/media/edimar/SAMSUNG/doutorado04/bases/SWDE/nbaplayer/nbaplayer-usatoday/0023.htm",The Bulls are epected to sign point guard John Lucas on Friday night prior to their game against the Nuggets in Denver.
"/media/edimar/SAMSUNG/doutorado04/bases/SWDE/nbaplayer/nbaplayer-usatoday/0379.htm",Knicks coach Mike D'Antoni confirmed that Anthony Randolph might not crack the rotation in the near future.
"/media/edimar/SAMSUNG/doutorado04/bases/SWDE/nbaplayer/nbaplayer-usatoday/0329.htm",Francisco Garcia practiced Monday after missing two games due to the flu.
"/media/edimar/SAMSUNG/doutorado04/bases/SWDE/nbaplayer/nbaplayer-usatoday/0193.htm","Chris Kaman will not play on Monday against the Kings, and will have an MRI taken Tuesday to determine how bad he re-injured it during Sunday's game."
"/media/edimar/SAMSUNG/doutorado04/bases/SWDE/nbaplayer/nbaplayer-usatoday/0085.htm","Carlos Delfino (neck, concussion) is probably a couple weeks away from playing, according to Bucks center Andrew Bogut."
"/media/edimar/SAMSUNG/doutorado04/bases/SWDE/nbaplayer/nbaplayer-usatoday/0211.htm","Hasheem Thabeet started for the Grizzlies vs. the Hornets on Saturday, but he picked up five fouls in just 14 minutes."
"/media/edimar/SAMSUNG/doutorado04/bases/SWDE/nbaplayer/nbaplayer-usatoday/0331.htm",The Kings signed veteran free agent Pooh Jeter to a contract.
"/media/edimar/SAMSUNG/doutorado04/bases/SWDE/nbaplayer/nbaplayer-usatoday/0037.htm","A.J. Price, Dahntay Jones and Lance Stephenson will be inactive for Indiana's opener against the Spurs."
"/media/edimar/SAMSUNG/doutorado04/bases/SWDE/nbaplayer/nbaplayer-usatoday/0043.htm",James Posey is expected to be Josh McRoberts' backup at power forward.
"/media/edimar/SAMSUNG/doutorado04/bases/SWDE/nbaplayer/nbaplayer-usatoday/0214.htm","Sam Young took advantage of injuries to Marc Gasol and Zach Randolph, finishing with 17 points, five boards, three steals and a 3-pointer Wednesday."
"/media/edimar/SAMSUNG/doutorado04/bases/SWDE/nbaplayer/nbaplayer-usatoday/0322.htm","Samuel Dalembert played 21 minutes off the bench on Monday, scoring six points on 2-of-5 shooting with 11 rebounds and two blocks."
"/media/edimar/SAMSUNG/doutorado04/bases/SWDE/nbaplayer/nbaplayer-usatoday/0390.htm",The Knicks could end up starting Roger Mason at shooting guard and Amare Stoudemire at center.
"/media/edimar/SAMSUNG/doutorado04/bases/SWDE/nbaplayer/nbaplayer-usatoday/0171.htm",Wayne Ellington returned from a thigh injury Wednesday and had zero points in three minutes.
"/media/edimar/SAMSUNG/doutorado04/bases/SWDE/nbaplayer/nbaplayer-usatoday/0081.htm",Luc Richard Mbah a Moute started again for the Bucks on Wednesday and had 10 points and nine rebounds in a loss to the Cavs.
"/media/edimar/SAMSUNG/doutorado04/bases/SWDE/nbaplayer/nbaplayer-usatoday/0164.htm","Kosta Koufos started in place of injured Darko Milicic Tuesday and had 10 points, six rebounds and two blocks in the loss."
"/media/edimar/SAMSUNG/doutorado04/bases/SWDE/nbaplayer/nbaplayer-usatoday/0313.htm",Raja Bell is in the starting lineup for the Jazz after missing a game with a thigh injury.
"/media/edimar/SAMSUNG/doutorado04/bases/SWDE/nbaplayer/nbaplayer-usatoday/0017.htm",The Bulls have agreed to a two-year deal with big man Kurt Thomas.
"/media/edimar/SAMSUNG/doutorado04/bases/SWDE/nbaplayer/nbaplayer-usatoday/0048.htm","Brandon Bass came off the bench Friday to hit 11-of-12 shots for a career-high 27 points to go along with three rebounds, two assists and a block."
"/media/edimar/SAMSUNG/doutorado04/bases/SWDE/nbaplayer/nbaplayer-usatoday/0195.htm","DeAndre Jordan had four points, 13 rebounds and three blocks in Wednesday's shocking win over the Spurs."
"/media/edimar/SAMSUNG/doutorado04/bases/SWDE/nbaplayer/nbaplayer-usatoday/0212.htm",Zach Randolph had 19 points and 19 rebounds in Wednesday's loss to the Hawks.
"/media/edimar/SAMSUNG/doutorado04/bases/SWDE/nbaplayer/nbaplayer-usatoday/0050.htm",The Magic have signed veteran forward Malik Allen.
"/media/edimar/SAMSUNG/doutorado04/bases/SWDE/nbaplayer/nbaplayer-usatoday/0324.htm",Darnell Jackson has been traded to the Kings in the sign-and-trade deal that will send Jon Brockman to Milwaukee.
"/media/edimar/SAMSUNG/doutorado04/bases/SWDE/nbaplayer/nbaplayer-usatoday/0408.htm","Chris Bosh scored 22 points on 9-of-18 shooting with eight rebounds, two assists, and two steals on Saturday."
"/media/edimar/SAMSUNG/doutorado04/bases/SWDE/nbaplayer/nbaplayer-usatoday/0198.htm",Craig Smith hit 8-of-9 shots for 18 points and four rebounds in Friday's loss.
"/media/edimar/SAMSUNG/doutorado04/bases/SWDE/nbaplayer/nbaplayer-usatoday/0173.htm","Wes Johnson, who is bothered by the flu, says he really wants to play on Monday at New York, and plans on doing so."
"/media/edimar/SAMSUNG/doutorado04/bases/SWDE/nbaplayer/nbaplayer-usatoday/0045.htm","Marcin Gortat started in place of Dwight Howard (flu) on Friday and had 14 points, 11 boards and three blocks in the win."
"/media/edimar/SAMSUNG/doutorado04/bases/SWDE/nbaplayer/nbaplayer-usatoday/0410.htm",Joel Anthony will be the Heat's starting center on Opening Night.
"/media/edimar/SAMSUNG/doutorado04/bases/SWDE/nbaplayer/nbaplayer-usatoday/0066.htm",Leandro Barbosa hit 7-of-12 shots and two 3-pointers for 22 points and two steals in Friday's win.
"/media/edimar/SAMSUNG/doutorado04/bases/SWDE/nbaplayer/nbaplayer-usatoday/0035.htm","Tyler Hansbrough played just 11 minutes on Saturday, scoring one point with one rebound and no other statistics."
"/media/edimar/SAMSUNG/doutorado04/bases/SWDE/nbaplayer/nbaplayer-usatoday/0308.htm",Kyrylo Fesenko left Monday's game during the fourth quarter due to an ankle injury and did not return.
"/media/edimar/SAMSUNG/doutorado04/bases/SWDE/nbaplayer/nbaplayer-usatoday/0205.htm",The Clippers signed second-round pick Willie Warren on Tuesday.
"/media/edimar/SAMSUNG/doutorado04/bases/SWDE/nbaplayer/nbaplayer-usatoday/0199.htm",Clippers forward Brian Cook was ejected from Sunday's game after committing a Flagrant-2 foul on Joel Przybilla.
"/media/edimar/SAMSUNG/doutorado04/bases/SWDE/nbaplayer/nbaplayer-usatoday/0319.htm","Jason Thompson scored just five points with four rebounds and two blocks on Saturday, hitting 1-of-5 shots from the field in 20 minutes."
"/media/edimar/SAMSUNG/doutorado04/bases/SWDE/nbaplayer/nbaplayer-usatoday/0027.htm",C.J. Watson left Saturday's game during the fourth quarter after dislocating his left finger and may not return.
"/media/edimar/SAMSUNG/doutorado04/bases/SWDE/nbaplayer/nbaplayer-usatoday/0165.htm","Timberwolves big man Nikola Pekovic could be out [one] week or weeks, according to beat writer Kent Youngblood."
"/media/edimar/SAMSUNG/doutorado04/bases/SWDE/nbaplayer/nbaplayer-usatoday/0320.htm","DeMarcus Cousins double-doubled with 17 points and 11 rebounds on Saturday, hitting 6-of-14 shots from the field to go with a block."
"/media/edimar/SAMSUNG/doutorado04/bases/SWDE/nbaplayer/nbaplayer-usatoday/0049.htm",Ryan Anderson will miss the rest of the Magic's road trip with a foot injury
"/media/edimar/SAMSUNG/doutorado04/bases/SWDE/nbaplayer/nbaplayer-usatoday/0169.htm","Michael Beasley (ankle) will start against the Knicks on Monday, as we expected."
"/media/edimar/SAMSUNG/doutorado04/bases/SWDE/nbaplayer/nbaplayer-usatoday/0061.htm",Coach Jay Triano said that rookie PF Ed Davis' playing time will simply depend on how he performs when he's on the floor.
"/media/edimar/SAMSUNG/doutorado04/bases/SWDE/nbaplayer/nbaplayer-usatoday/0057.htm",Jason Williams was ejected Wednesday after throwing the ball at Jamaal Magloire's head.
"/media/edimar/SAMSUNG/doutorado04/bases/SWDE/nbaplayer/nbaplayer-usatoday/0167.htm",Darko Milicic could reportedly barely walk after taking a knee to his thigh in the first quarter of Monday's loss to the Knicks.
"/media/edimar/SAMSUNG/doutorado04/bases/SWDE/nbaplayer/nbaplayer-usatoday/0309.htm","Jazz big man Francisco Elson scored a season-high eight points on Wednesday, and Jerry Sloan praised his defense."
"/media/edimar/SAMSUNG/doutorado04/bases/SWDE/nbaplayer/nbaplayer-usatoday/0062.htm","Hornets wingman Julian Wright is refusing to play for the Hornets summer league team, despite the wishes of new coach Monty Williams."
"/media/edimar/SAMSUNG/doutorado04/bases/SWDE/nbaplayer/nbaplayer-usatoday/0225.htm","Nick Collison's new four-year extension is worth just over $11 million, sources tell ESPN.com."
"/media/edimar/SAMSUNG/doutorado04/bases/SWDE/nbaplayer/nbaplayer-usatoday/0383.htm",Danilo Gallinari hit just 2-of-6 shots in 23 minutes for four points in Saturday's loss to the Hawks.
"/media/edimar/SAMSUNG/doutorado04/bases/SWDE/nbaplayer/nbaplayer-usatoday/0064.htm","Updating an earlier item, Reggie Evans will have surgery on his fractured foot on Thursday."
"/media/edimar/SAMSUNG/doutorado04/bases/SWDE/nbaplayer/nbaplayer-usatoday/0227.htm","Kevin Durant returned on Sunday after missing two games with a sprained knee, scoring 28 points with seven rebounds, three assists, and two blocks."
"/media/edimar/SAMSUNG/doutorado04/bases/SWDE/nbaplayer/nbaplayer-usatoday/0071.htm",Sonny Weems missed all nine of his shots and failed to score in 18 minutes on Friday.
"/media/edimar/SAMSUNG/doutorado04/bases/SWDE/nbaplayer/nbaplayer-usatoday/0175.htm",Sebastian Telfair is still dealing with plantar fasciitis.
"/media/edimar/SAMSUNG/doutorado04/bases/SWDE/nbaplayer/nbaplayer-usatoday/0021.htm",Taj Gibson (foot) is a game-time decision for Wednesday's game against the Magic.
"/media/edimar/SAMSUNG/doutorado04/bases/SWDE/nbaplayer/nbaplayer-usatoday/0220.htm",The Memphis Commercial Appeal confirms that Tony Allen's ankle injury is mild.
"/media/edimar/SAMSUNG/doutorado04/bases/SWDE/nbaplayer/nbaplayer-usatoday/0030.htm","Josh McRoberts had 16 points, nine rebounds, a block, four 3-pointers and eight turnovers on Friday against the Suns."
"/media/edimar/SAMSUNG/doutorado04/bases/SWDE/nbaplayer/nbaplayer-usatoday/0314.htm",Deron Williams verbally blasted rookie Gordon Hayward during Thursday's lopsided loss to the Suns.
"/media/edimar/SAMSUNG/doutorado04/bases/SWDE/nbaplayer/nbaplayer-usatoday/0044.htm",Dwight Howard received IV fluids at a hospital on Friday but he's recovered from his vicious stomach virus and will play on Monday.
"/media/edimar/SAMSUNG/doutorado04/bases/SWDE/nbaplayer/nbaplayer-usatoday/0235.htm","Thabo Sefolosha started and played 23 minutes, but didn't score and managed just three rebounds, two assists and a steal."
"/media/edimar/SAMSUNG/doutorado04/bases/SWDE/nbaplayer/nbaplayer-usatoday/0022.htm",Forward Luol Deng will have his minutes reduced when Carlos Boozer (hand) returns as soon as Wednesday.
"/media/edimar/SAMSUNG/doutorado04/bases/SWDE/nbaplayer/nbaplayer-usatoday/0201.htm","Randy Foye played five minutes despite a hamstring injury Thursday, but failed to score."
"/media/edimar/SAMSUNG/doutorado04/bases/SWDE/nbaplayer/nbaplayer-usatoday/0038.htm","Brandon Rush has 16 points through the early portion of the second quarter, after coming off the bench behind Mike Dunleavy in Monday's game."
"/media/edimar/SAMSUNG/doutorado04/bases/SWDE/nbaplayer/nbaplayer-usatoday/0210.htm",Hamed Haddadi hasn't joined the Grizzlies for training camp because legal issues have prevented his departure from Iran.
"/media/edimar/SAMSUNG/doutorado04/bases/SWDE/nbaplayer/nbaplayer-usatoday/0318.htm",Ronnie Price returned from a wrist injury and had six points in 11 minutes.
"/media/edimar/SAMSUNG/doutorado04/bases/SWDE/nbaplayer/nbaplayer-usatoday/0310.htm","Jeremy Evans (wrist) was active for Saturday's game against the Clippers, but did not play."
"/media/edimar/SAMSUNG/doutorado04/bases/SWDE/nbaplayer/nbaplayer-usatoday/0040.htm","T.J. Ford was held scoreless on Tuesday, shooting 0-for-2 from the field with no rebounds and two assists in 14 minutes off the bench."
"/media/edimar/SAMSUNG/doutorado04/bases/SWDE/nbaplayer/nbaplayer-usatoday/0208.htm","Marc Gasol had 20 points, seven rebounds, five assists, two steals and three blocks on 7-of-9 shooting on Friday."
"/media/edimar/SAMSUNG/doutorado04/bases/SWDE/nbaplayer/nbaplayer-usatoday/0080.htm","Ersan Ilyasova shot just 1-of-4 from the field to end up with four points, eight rebounds, and two assists on Saturday."
"/media/edimar/SAMSUNG/doutorado04/bases/SWDE/nbaplayer/nbaplayer-usatoday/0067.htm","Linas Kleiza saw just 10 minutes of action on Sunday against the Knicks, failing to score after missing his only two field-goal attempts of the game."
"/media/edimar/SAMSUNG/doutorado04/bases/SWDE/nbaplayer/nbaplayer-usatoday/0072.htm","DeMar DeRozan and Sonny Weems both started for the victorious Raptors on Wednesday, but neither played well."
"/media/edimar/SAMSUNG/doutorado04/bases/SWDE/nbaplayer/nbaplayer-usatoday/0325.htm",Tyreke Evans said on Twitter that he will see a foot specialist for his plantar fasciitis.
"/media/edimar/SAMSUNG/doutorado04/bases/SWDE/nbaplayer/nbaplayer-usatoday/0087.htm",The Bucks are close to signing point guard Earl Boykins to a one-year deal.
"/media/edimar/SAMSUNG/doutorado04/bases/SWDE/nbaplayer/nbaplayer-usatoday/0051.htm","Mickael Pietrus missed Friday's game with the flu and was sent back to Orlando, meaning he's out for Satruday too."
"/media/edimar/SAMSUNG/doutorado04/bases/SWDE/nbaplayer/nbaplayer-usatoday/0222.htm",Thunder center Byron Mullens and guard Mustafa Shakur were assigned to Tulsa 66ers on Friday.
"/media/edimar/SAMSUNG/doutorado04/bases/SWDE/nbaplayer/nbaplayer-usatoday/0384.htm","Wilson Chandler shot 8-of-14 to score 21 points in Sunday's win over the Raptors, adding three treys, three rebounds, one assist and one turnover."
"/media/edimar/SAMSUNG/doutorado04/bases/SWDE/nbaplayer/nbaplayer-usatoday/0219.htm","Greivis Vasquez (ankle) made his Grizzlies debut on Saturday, playing three minutes without logging any statistics other than a missed shot."
"/media/edimar/SAMSUNG/doutorado04/bases/SWDE/nbaplayer/nbaplayer-usatoday/0060.htm","Raptors second-round C Solomon Alabi, who suffers from Hepatitis B, is not expected to be hampered at all by his illness."
"/media/edimar/SAMSUNG/doutorado04/bases/SWDE/nbaplayer/nbaplayer-usatoday/0166.htm","Anthony Tolliver will be out a while due to a sprained right MCL in his knee, and will be re-evaluated on Monday."
"/media/edimar/SAMSUNG/doutorado04/bases/SWDE/nbaplayer/nbaplayer-usatoday/0315.htm",Veteran PG Earl Watson has officially signed with the Jazz and will be at training camp on Monday.
"/media/edimar/SAMSUNG/doutorado04/bases/SWDE/nbaplayer/nbaplayer-usatoday/0419.htm","Eddie House played just under two minutes in Monday's game, without logging any statistics."
"/media/edimar/SAMSUNG/doutorado04/bases/SWDE/nbaplayer/nbaplayer-usatoday/0026.htm","Kyle Korver returned from a knee injury Tuesday for 10 points, six rebounds, four assists, three steals and two 3-pointers in a win over the Rockets."
"/media/edimar/SAMSUNG/doutorado04/bases/SWDE/nbaplayer/nbaplayer-usatoday/0420.htm",Carlos Arroyo hit 6-of-9 shots and tied a career high with three 3-pointers on his way to 17 points in Friday's nine-point win over the Sixers.
"/media/edimar/SAMSUNG/doutorado04/bases/SWDE/nbaplayer/nbaplayer-usatoday/0070.htm",Peja Stojakovic (knee) will not dress for Sunday's game against the Knicks.
"/media/edimar/SAMSUNG/doutorado04/bases/SWDE/nbaplayer/nbaplayer-usatoday/0041.htm","Dahntay Jones, who got off to a hot start for the Pacers a year ago, has fallen completely out of the rotation this year."
"/media/edimar/SAMSUNG/doutorado04/bases/SWDE/nbaplayer/nbaplayer-usatoday/0018.htm",Free agent big man Brian Scalabrine has agreed to a non-guaranteed deal with the Bulls.
"/media/edimar/SAMSUNG/doutorado04/bases/SWDE/nbaplayer/nbaplayer-usatoday/0207.htm","Coach Vinny Del Negro provided no update on Baron Davis' hamstring injury Monday night, saying I don't know how bad it is."
"/media/edimar/SAMSUNG/doutorado04/bases/SWDE/nbaplayer/nbaplayer-usatoday/0052.htm",Magic PG Jameer Nelson (stomach virus) was sent home from Monday's shootaround.
"/media/edimar/SAMSUNG/doutorado04/bases/SWDE/nbaplayer/nbaplayer-usatoday/0015.htm",Joakim Noah had 14 points and 10 rebounds in Friday�s loss to the Celtics.
"/media/edimar/SAMSUNG/doutorado04/bases/SWDE/nbaplayer/nbaplayer-usatoday/0413.htm","Erick Dampier played 12 active minutes against the Wizards on Monday, scoring three points on 1-of-1 shooting with five rebounds and a block."
"/media/edimar/SAMSUNG/doutorado04/bases/SWDE/nbaplayer/nbaplayer-usatoday/0172.htm","Sundiata Gaines is the favorite to land a roster spot with the Wolves, who have been hit by the injury bug at PG."
"/media/edimar/SAMSUNG/doutorado04/bases/SWDE/nbaplayer/nbaplayer-usatoday/0317.htm",C.J. Miles scored just six points on 2-of-9 shooting (including a three) with one rebound and two assists in 21 minutes on Monday.
"/media/edimar/SAMSUNG/doutorado04/bases/SWDE/nbaplayer/nbaplayer-usatoday/0388.htm","Landry Fields, a starting shooting guard, had 15 points, 11 rebounds and a 3-pointer on 6-of-10 shooting in Saturday's loss to the Hawks."
"/media/edimar/SAMSUNG/doutorado04/bases/SWDE/nbaplayer/nbaplayer-usatoday/0321.htm","Hassan Whiteside (knee) made his preseason debut on Friday, scoring six points on 3-of-6 shooting with four rebounds and two blocks in 14 minutes."
"/media/edimar/SAMSUNG/doutorado04/bases/SWDE/nbaplayer/nbaplayer-usatoday/0407.htm",Veteran center Jamaal Magloire is expected to sign a one-year deal with the Heat for the veteran's minimum.
"/media/edimar/SAMSUNG/doutorado04/bases/SWDE/nbaplayer/nbaplayer-usatoday/0232.htm",Eric Maynor suffered a thumb injury in summer-league play that could keep him out for the remainder of OKC's games.
"/media/edimar/SAMSUNG/doutorado04/bases/SWDE/nbaplayer/nbaplayer-usatoday/0326.htm",Omri Casspi is not expected to miss any time following a fall late in Monday's loss to the Jazz.
"/media/edimar/SAMSUNG/doutorado04/bases/SWDE/nbaplayer/nbaplayer-usatoday/0209.htm",Darrell Arthur (groin) missed Wednesday's game against the Lakers and remains day to day.
"/media/edimar/SAMSUNG/doutorado04/bases/SWDE/nbaplayer/nbaplayer-usatoday/0385.htm","The Knicks have made inquiries to other teams about acquiring an affordable backup point guard, to keep Raymond Felton fresh."
"/media/edimar/SAMSUNG/doutorado04/bases/SWDE/nbaplayer/nbaplayer-usatoday/0028.htm",Derrick Rose hit just 5-of-13 shots and two 3-pointers for 15 points and four assists in Wednesday's loss to the Magic.
"/media/edimar/SAMSUNG/doutorado04/bases/SWDE/nbaplayer/nbaplayer-usatoday/0409.htm",Udonis Haslem had surgery on Tuesday on a primary foot ligament and could miss the duration of the regular season.
"/media/edimar/SAMSUNG/doutorado04/bases/SWDE/nbaplayer/nbaplayer-usatoday/0054.htm",J.J. Redick (flu) has been ruled out for Saturday's game.
"/media/edimar/SAMSUNG/doutorado04/bases/SWDE/nbaplayer/nbaplayer-usatoday/0223.htm",Thunder assigned C Cole Aldrich to the Tulsa 66ers of the D-League.
"/media/edimar/SAMSUNG/doutorado04/bases/SWDE/nbaplayer/nbaplayer-usatoday/0233.htm",Morris Peterson had just nine points and five boards in 27 minutes on Wednesday.
"/media/edimar/SAMSUNG/doutorado04/bases/SWDE/nbaplayer/nbaplayer-usatoday/0074.htm",Drew Gooden (plantar fasciitis) did not play on Saturday against the Magic.
"/media/edimar/SAMSUNG/doutorado04/bases/SWDE/nbaplayer/nbaplayer-usatoday/0218.htm","Xavier Henry scored nine points on 4-of-9 shooting (including a three) with two rebounds, no assists, and one block in 22 minutes on Saturday."
"/media/edimar/SAMSUNG/doutorado04/bases/SWDE/nbaplayer/nbaplayer-usatoday/0204.htm","Eric Bledsoe will start at PG for Monday's game against the Kings, and Baron Davis will come off the bench."
"/media/edimar/SAMSUNG/doutorado04/bases/SWDE/nbaplayer/nbaplayer-usatoday/0387.htm",Knicks signed second-round G Andy Rautins.
"/media/edimar/SAMSUNG/doutorado04/bases/SWDE/nbaplayer/nbaplayer-usatoday/0234.htm",The Thunder have signed free agent guard Royal Ivey.
"/media/edimar/SAMSUNG/doutorado04/bases/SWDE/nbaplayer/nbaplayer-usatoday/0059.htm","Unexpectedly, Joey Dorsey - not Amir Johnson - will start in place of Reggie Evans (fractured right foot) for Sunday's game against the Knicks."
"/media/edimar/SAMSUNG/doutorado04/bases/SWDE/nbaplayer/nbaplayer-usatoday/0075.htm",Jon Brockman (ankle) will not play in Wednesday's season opener.
