URL,EXTRACTED VALUE
"/media/edimar/SAMSUNG/doutorado04/bases/SWDE/nbaplayer/nbaplayer-usatoday/0086.htm",Keyon Dooling had 18 points and five assists off the Bucks bench on Wednesday in 25 minutes.
"/media/edimar/SAMSUNG/doutorado04/bases/SWDE/nbaplayer/nbaplayer-usatoday/0433.htm","Even Turner went scoreless on Saturday against the Bobcats, going 0-for-1 from the field with two rebounds and one assist in 11 minutes off the bench."
"/media/edimar/SAMSUNG/doutorado04/bases/SWDE/nbaplayer/nbaplayer-usatoday/0191.htm","Jeff Teague is officially splitting backup PG duties with rookie Jordan Crawford, based upon matchups."
"/media/edimar/SAMSUNG/doutorado04/bases/SWDE/nbaplayer/nbaplayer-usatoday/0155.htm",Jermaine Taylor has moved ahead of Ish Smith in the Rockets' rotation.
"/media/edimar/SAMSUNG/doutorado04/bases/SWDE/nbaplayer/nbaplayer-usatoday/0301.htm",Gary Neal hit 5-of-8 shots on Monday (all of his makes were threes) to go with one rebound and one steal in 14 minutes off the bench.
"/media/edimar/SAMSUNG/doutorado04/bases/SWDE/nbaplayer/nbaplayer-usatoday/0142.htm",Golden State rookie guard Jeremy Lin finished Sunday's blowout loss with a career-high 13 points in 18 minutes.
"/media/edimar/SAMSUNG/doutorado04/bases/SWDE/nbaplayer/nbaplayer-usatoday/0305.htm",The Spurs have signed veteran point guard Chris Quinn.
"/media/edimar/SAMSUNG/doutorado04/bases/SWDE/nbaplayer/nbaplayer-usatoday/0010.htm",Delonte West (wrist) said his cast will be removed in two weeks and he expects to return during the regular season.
"/media/edimar/SAMSUNG/doutorado04/bases/SWDE/nbaplayer/nbaplayer-usatoday/0354.htm","Mo Williams handed out 10 assists in Sunday's loss to Detroit, the second time in five games that he's dropped double-digit dimes."
"/media/edimar/SAMSUNG/doutorado04/bases/SWDE/nbaplayer/nbaplayer-usatoday/0023.htm",The Bulls signed point guard John Lucas on Friday.
"/media/edimar/SAMSUNG/doutorado04/bases/SWDE/nbaplayer/nbaplayer-usatoday/0008.htm",Celtics GM Danny Ainge said that Avery Bradley and Von Wafer have to step up as reserve guards in the rotation.
"/media/edimar/SAMSUNG/doutorado04/bases/SWDE/nbaplayer/nbaplayer-usatoday/0304.htm","George Hill stayed hot on Friday and had 20 points, a steal and a three on 7-of-12 shooting Friday."
"/media/edimar/SAMSUNG/doutorado04/bases/SWDE/nbaplayer/nbaplayer-usatoday/0330.htm",Luther Head failed to score in just 15 minutes on Friday.
"/media/edimar/SAMSUNG/doutorado04/bases/SWDE/nbaplayer/nbaplayer-usatoday/0201.htm",Randy Foye (hamstring) did not practice on Tuesday and we're calling him questionable for Wednesday's game against the Spurs.
"/media/edimar/SAMSUNG/doutorado04/bases/SWDE/nbaplayer/nbaplayer-usatoday/0037.htm","A.J. Price made his season-debut on Tuesday, scoring seven points on 2-of-3 shooting with no rebounds and two assists in 11 minutes."
"/media/edimar/SAMSUNG/doutorado04/bases/SWDE/nbaplayer/nbaplayer-usatoday/0417.htm","Mario Chalmers scored nine points on 4-of-10 shooting (including a three) with five rebounds, four assists, and a steal on Saturday."
"/media/edimar/SAMSUNG/doutorado04/bases/SWDE/nbaplayer/nbaplayer-usatoday/0259.htm",The NBA announced on Monday that it has purchased the Hornets from George Shinn.
"/media/edimar/SAMSUNG/doutorado04/bases/SWDE/nbaplayer/nbaplayer-usatoday/0118.htm",Rookie Dominique Jones was sent to the Texas Legends of the D-League on Monday.
"/media/edimar/SAMSUNG/doutorado04/bases/SWDE/nbaplayer/nbaplayer-usatoday/0341.htm","Devin Harris scored 18 points on 2-of-8 shooting (1-of-1 from deep, 13-of-16 from the foul line) to go with 13 assists and three steals on Tuesday."
"/media/edimar/SAMSUNG/doutorado04/bases/SWDE/nbaplayer/nbaplayer-usatoday/0013.htm",Rajon Rondo admitted that he is most concerned with his strained hamstring.
"/media/edimar/SAMSUNG/doutorado04/bases/SWDE/nbaplayer/nbaplayer-usatoday/0431.htm","Jrue Holiday hit just 2-of-7 shots on his way to four points, one rebounds and five assists in Friday�s loss to the Hawks."
"/media/edimar/SAMSUNG/doutorado04/bases/SWDE/nbaplayer/nbaplayer-usatoday/0065.htm",Marcus Banks will not be joining the Hornets under the advice of his representatives.
"/media/edimar/SAMSUNG/doutorado04/bases/SWDE/nbaplayer/nbaplayer-usatoday/0159.htm",Aaron Brooks (ankle) admitted that he still hasn't been cleared to practice.
"/media/edimar/SAMSUNG/doutorado04/bases/SWDE/nbaplayer/nbaplayer-usatoday/0262.htm",Marcus Thornton played 10 minutes on Wednesday and scored seven points after not getting off the bench on Monday.
"/media/edimar/SAMSUNG/doutorado04/bases/SWDE/nbaplayer/nbaplayer-usatoday/0104.htm",Gilbert Arenas admitted he did not know if he will stick in the starting lineup.
"/media/edimar/SAMSUNG/doutorado04/bases/SWDE/nbaplayer/nbaplayer-usatoday/0318.htm","Jazz guard Ronnie Price pitched in 14 points, six rebounds, nine assists and two steals vs. the Warriors on Tuesday."
"/media/edimar/SAMSUNG/doutorado04/bases/SWDE/nbaplayer/nbaplayer-usatoday/0302.htm","Manu Ginobili had a sore neck after Sunday's game, thanks to a collision with Emeka Okafor, but he said that he will be fine."
"/media/edimar/SAMSUNG/doutorado04/bases/SWDE/nbaplayer/nbaplayer-usatoday/0040.htm",T.J. Ford played 26 minutes and had 10 points and nine assists in a loss to the Suns.
"/media/edimar/SAMSUNG/doutorado04/bases/SWDE/nbaplayer/nbaplayer-usatoday/0117.htm",Roddy Beaubois (foot) has not even been cleared to do any running or jumping yet.
"/media/edimar/SAMSUNG/doutorado04/bases/SWDE/nbaplayer/nbaplayer-usatoday/0391.htm","Raymond Felton hit a career-high five 3-pointers on Monday, and scored 18 points on 6-of-13 shooting with three rebounds, 11 assists, and four steals."
"/media/edimar/SAMSUNG/doutorado04/bases/SWDE/nbaplayer/nbaplayer-usatoday/0230.htm","Russell Westbrook hit 14-of-32 shots for 38 points, 15 rebounds, nine assists and three steals in Wednesday's triple-overtime win over the Nets."
"/media/edimar/SAMSUNG/doutorado04/bases/SWDE/nbaplayer/nbaplayer-usatoday/0087.htm","The Bucks signed point guard Earl Boykins to a one-year, $1.3 million deal on Thursday."
"/media/edimar/SAMSUNG/doutorado04/bases/SWDE/nbaplayer/nbaplayer-usatoday/0355.htm","Coming off an 18-point effort, Ramon Sessions had just two points on 0-of-4 shooting in Sunday's loss to the Pistons."
"/media/edimar/SAMSUNG/doutorado04/bases/SWDE/nbaplayer/nbaplayer-usatoday/0358.htm",The Cleveland Plain Dealer speculates that coach Byron Scott may insert Daniel Gibson into the starting five in place of Anthony Parker.
"/media/edimar/SAMSUNG/doutorado04/bases/SWDE/nbaplayer/nbaplayer-usatoday/0244.htm",Sasha Vujacic made his Lakers debut on Sunday and had three points in eight minutes.
"/media/edimar/SAMSUNG/doutorado04/bases/SWDE/nbaplayer/nbaplayer-usatoday/0405.htm",Pistons G Terrico White (foot) expects to return sometime in December.
"/media/edimar/SAMSUNG/doutorado04/bases/SWDE/nbaplayer/nbaplayer-usatoday/0260.htm","Jarrett Jack has struggled since joining the Hornets, and the team is just 3-4 since his arrival."
"/media/edimar/SAMSUNG/doutorado04/bases/SWDE/nbaplayer/nbaplayer-usatoday/0174.htm","Luke Ridnour scored 16 points on 6-of-9 shooting (including three treys) with no rebounds, four assists, and a steal on Monday."
"/media/edimar/SAMSUNG/doutorado04/bases/SWDE/nbaplayer/nbaplayer-usatoday/0119.htm","Jason Kidd had just three points, one rebound and four assists in 34 minutes of Friday's loss against Derrick Rose and the Bulls."
"/media/edimar/SAMSUNG/doutorado04/bases/SWDE/nbaplayer/nbaplayer-usatoday/0371.htm","D.J. Augustin played through a sinus infection on Wednesday and had 13 points, six assists and a 3-pointer in the loss."
"/media/edimar/SAMSUNG/doutorado04/bases/SWDE/nbaplayer/nbaplayer-usatoday/0271.htm",Trail Blazers rookie Elliot Williams will undergo surgery to repair a dislocated right patella. He is expected to miss the rest of the 2010-11 season.
"/media/edimar/SAMSUNG/doutorado04/bases/SWDE/nbaplayer/nbaplayer-usatoday/0216.htm","Mike Conley hit 10-of-13 shots for the second straight night Wednesday, finishing with 22 points and nine assists in a loss to the Hawks."
"/media/edimar/SAMSUNG/doutorado04/bases/SWDE/nbaplayer/nbaplayer-usatoday/0036.htm","Darren Collison was able to walk off the ankle/leg injury he suffered late in Monday's win over the Raptors, according to Indycornrows.com."
"/media/edimar/SAMSUNG/doutorado04/bases/SWDE/nbaplayer/nbaplayer-usatoday/0157.htm","Ish Smith started Friday, but had no points, one assist and one steal in just 13 minutes in a win over the Pacers."
"/media/edimar/SAMSUNG/doutorado04/bases/SWDE/nbaplayer/nbaplayer-usatoday/0419.htm","Eddie House was furious at Daniel Gibson both during and following Thursday's game, and had to be talked out of a physical confrontation."
"/media/edimar/SAMSUNG/doutorado04/bases/SWDE/nbaplayer/nbaplayer-usatoday/0402.htm",Pistons guard Will Bynum was dropped from the rotation on Sunday for the second game in a row.
"/media/edimar/SAMSUNG/doutorado04/bases/SWDE/nbaplayer/nbaplayer-usatoday/0386.htm",Toney Douglas scored 11 points on 4-of-7 shooting (including a three) with six rebounds and no assists in 20 minutes off the bench on Monday.
"/media/edimar/SAMSUNG/doutorado04/bases/SWDE/nbaplayer/nbaplayer-usatoday/0275.htm","Rudy Fernandez (pelvic contusion) returned to action for the Blazers on Sunday, scoring six points in 11 minutes off the bench."
"/media/edimar/SAMSUNG/doutorado04/bases/SWDE/nbaplayer/nbaplayer-usatoday/0372.htm",Gerald Henderson (knee) hopes to resume on-court activity in a week.
"/media/edimar/SAMSUNG/doutorado04/bases/SWDE/nbaplayer/nbaplayer-usatoday/0207.htm","Baron Davis (hamstring) will be a game-time decision for Wednesday's game against the Lakers, based on how he feels after the team's shootaround."
"/media/edimar/SAMSUNG/doutorado04/bases/SWDE/nbaplayer/nbaplayer-usatoday/0189.htm","Mike Bibby scored 10 points on 4-of-10 shooting with five rebounds, six assists, and two treys on Saturday."
"/media/edimar/SAMSUNG/doutorado04/bases/SWDE/nbaplayer/nbaplayer-usatoday/0299.htm",Tony Parker says that he has rediscovered the aggressiveness that propelled him to new heights in the first 14 games of the season.
"/media/edimar/SAMSUNG/doutorado04/bases/SWDE/nbaplayer/nbaplayer-usatoday/0052.htm","Jameer Nelson has been cleared to travel with the Magic for their West Coast trip, starting on Thursday at Portland."
"/media/edimar/SAMSUNG/doutorado04/bases/SWDE/nbaplayer/nbaplayer-usatoday/0359.htm","Manny Harris tweeted Thursday that he made the Cavs' roster, which means that Danny Green will likely be cut."
"/media/edimar/SAMSUNG/doutorado04/bases/SWDE/nbaplayer/nbaplayer-usatoday/0172.htm",The Wolves have signed free agent guard Sundiata Gaines.
"/media/edimar/SAMSUNG/doutorado04/bases/SWDE/nbaplayer/nbaplayer-usatoday/0375.htm","The Bobcats signed undrafted rookie point guard Sherron Collins to a two-year, non-guaranteed deal on Friday."
"/media/edimar/SAMSUNG/doutorado04/bases/SWDE/nbaplayer/nbaplayer-usatoday/0129.htm",The Nuggets have officially re-signed 12-year NBA veteran Anthony Carter.
"/media/edimar/SAMSUNG/doutorado04/bases/SWDE/nbaplayer/nbaplayer-usatoday/0388.htm",Landry Fields has been named the Eastern Conference Rookie of the Month for November.
"/media/edimar/SAMSUNG/doutorado04/bases/SWDE/nbaplayer/nbaplayer-usatoday/0205.htm","Willie Warren could build off his career-high 17 minutes played on Friday, if Eric Bledsoe (ankle) and Randy Foye (hamstring) cannot play on Sunday."
"/media/edimar/SAMSUNG/doutorado04/bases/SWDE/nbaplayer/nbaplayer-usatoday/0007.htm",Ray Allen scored 35 points with seven threes on 13-of-23 shooting in Thursday's 112-107 win over the Heat.
"/media/edimar/SAMSUNG/doutorado04/bases/SWDE/nbaplayer/nbaplayer-usatoday/0027.htm",C.J. Watson played through a dislocated finger on Wednesday and had five points off the bench.
"/media/edimar/SAMSUNG/doutorado04/bases/SWDE/nbaplayer/nbaplayer-usatoday/0131.htm","Arron Afflalo made a series of clutch shots on his way to a career-high 25 points on Sunday, making 10-of-14 FGs, including 3-of-5 from downtown."
"/media/edimar/SAMSUNG/doutorado04/bases/SWDE/nbaplayer/nbaplayer-usatoday/0232.htm",Eric Maynor hit 4-of-6 shots for 10 points and two steals in Wednesday's preseason game.
"/media/edimar/SAMSUNG/doutorado04/bases/SWDE/nbaplayer/nbaplayer-usatoday/0188.htm",Joe Johnson had surgery on his right elbow on Thursday -- he will begin his rehab on Friday but isn't expected to play for four-to-six weeks.
"/media/edimar/SAMSUNG/doutorado04/bases/SWDE/nbaplayer/nbaplayer-usatoday/0258.htm",Marco Belinelli finished Sunday's blowout loss with just two points on 0-of-6 FTs and 2-of-2 FTs.
"/media/edimar/SAMSUNG/doutorado04/bases/SWDE/nbaplayer/nbaplayer-usatoday/0278.htm",Andre Miller was suspended for Tuesday's game for his involvement in a mini-altercation in Sunday's game against the Clippers.
"/media/edimar/SAMSUNG/doutorado04/bases/SWDE/nbaplayer/nbaplayer-usatoday/0068.htm","Jose Calderon is averaging 11.9 points, 8.0 assists, 1.6 steals and 1.3 3-pointers in the eight games since Jarrett Jack has been traded."
"/media/edimar/SAMSUNG/doutorado04/bases/SWDE/nbaplayer/nbaplayer-usatoday/0011.htm",Nate Robinson missed Tuesday's practice due to a death in the family.
"/media/edimar/SAMSUNG/doutorado04/bases/SWDE/nbaplayer/nbaplayer-usatoday/0204.htm","Eric Bledsoe scored 15 points on 4-of-12 shooting (including two threes) with three rebounds, three assists, and a steal on Monday."
"/media/edimar/SAMSUNG/doutorado04/bases/SWDE/nbaplayer/nbaplayer-usatoday/0387.htm",Andy Rautins (knee bruise) is expected to be ready for training camp.
"/media/edimar/SAMSUNG/doutorado04/bases/SWDE/nbaplayer/nbaplayer-usatoday/0261.htm",Willie Green came off the bench for 19 points and two 3-pointers on 7-of-11 shooting in 29 minutes Friday.
"/media/edimar/SAMSUNG/doutorado04/bases/SWDE/nbaplayer/nbaplayer-usatoday/0042.htm",The Pacers have no plans to send second round G Lance Stephenson to the NBADL.
"/media/edimar/SAMSUNG/doutorado04/bases/SWDE/nbaplayer/nbaplayer-usatoday/0231.htm","James Harden came off the bench for 20 points, four boards and three assists in Friday's loss to the Raptors."
"/media/edimar/SAMSUNG/doutorado04/bases/SWDE/nbaplayer/nbaplayer-usatoday/0170.htm",Jonny Flynn (hip) will return to the NBADL for two more games this weekend.
"/media/edimar/SAMSUNG/doutorado04/bases/SWDE/nbaplayer/nbaplayer-usatoday/0115.htm","J.J. Barea hit just 2-of-13 shots, but still managed nine points, six rebounds and six assists in Wednesday's loss to the Hornets."
