URL,EXTRACTED VALUE
"/media/edimar/SAMSUNG/doutorado04/bases/SWDE/nbaplayer/nbaplayer-usatoday/0404.htm",Austin Daye is not expected to return to the Pistons' rotation this week.
"/media/edimar/SAMSUNG/doutorado04/bases/SWDE/nbaplayer/nbaplayer-usatoday/0315.htm",Veteran PG Earl Watson has officially signed with the Jazz and will be at training camp on Monday.
"/media/edimar/SAMSUNG/doutorado04/bases/SWDE/nbaplayer/nbaplayer-usatoday/0016.htm","Omer Asik got another start for Joakim Noah (flu) on Friday and had six points, 10 rebounds and three blocks."
"/media/edimar/SAMSUNG/doutorado04/bases/SWDE/nbaplayer/nbaplayer-usatoday/0071.htm",Sonny Weems missed all nine of his shots and failed to score in 18 minutes on Friday.
"/media/edimar/SAMSUNG/doutorado04/bases/SWDE/nbaplayer/nbaplayer-usatoday/0295.htm",Antonio McDyess scored seven points on 2-of-3 shooting with five rebounds and four blocks in 22 minutes off the bench on Monday.
"/media/edimar/SAMSUNG/doutorado04/bases/SWDE/nbaplayer/nbaplayer-usatoday/0314.htm",Deron Williams verbally blasted rookie Gordon Hayward during Thursday's lopsided loss to the Suns.
"/media/edimar/SAMSUNG/doutorado04/bases/SWDE/nbaplayer/nbaplayer-usatoday/0336.htm","Kris Humphries had six points, 15 rebounds, two steals and two blocks in Wednesday's triple-overtime loss to the Thunder."
"/media/edimar/SAMSUNG/doutorado04/bases/SWDE/nbaplayer/nbaplayer-usatoday/0030.htm","Josh McRoberts had 16 points, nine rebounds, a block, four 3-pointers and eight turnovers on Friday against the Suns."
"/media/edimar/SAMSUNG/doutorado04/bases/SWDE/nbaplayer/nbaplayer-usatoday/0012.htm","Von Wafer has signed a fully guaranteed, one-year deal with the Celtics for the veteran's minimum."
"/media/edimar/SAMSUNG/doutorado04/bases/SWDE/nbaplayer/nbaplayer-usatoday/0113.htm","Jason Terry scored just six points in the Mavs' blowout win on Monday, hitting 2-of-7 shots from the field with no other statistics in 21 minutes."
"/media/edimar/SAMSUNG/doutorado04/bases/SWDE/nbaplayer/nbaplayer-usatoday/0235.htm","Thabo Sefolosha started and played 23 minutes, but didn't score and managed just three rebounds, two assists and a steal."
"/media/edimar/SAMSUNG/doutorado04/bases/SWDE/nbaplayer/nbaplayer-usatoday/0369.htm",Tyrus Thomas limped off the court late in the fourth quarter of Tuesday's game with left quad tightness and will not return.
"/media/edimar/SAMSUNG/doutorado04/bases/SWDE/nbaplayer/nbaplayer-usatoday/0182.htm","Al Horford hit 10-of-11 shots from the field on Saturday, scoring 22 points with nine rebounds, one assist, and one steal against the Heat."
"/media/edimar/SAMSUNG/doutorado04/bases/SWDE/nbaplayer/nbaplayer-usatoday/0280.htm",Channing Frye may continue to start for Phoenix even after Robin Lopez (knee) returns from injury this month.
"/media/edimar/SAMSUNG/doutorado04/bases/SWDE/nbaplayer/nbaplayer-usatoday/0150.htm","Luis Scola scored 27 points on 9-of-18 shooting with eight rebounds, three assists, and a block in Saturday's overtime loss to the Bulls."
"/media/edimar/SAMSUNG/doutorado04/bases/SWDE/nbaplayer/nbaplayer-usatoday/0422.htm",Coach Doug Collins said that Spencer Hawes is locked in as his starting center.
"/media/edimar/SAMSUNG/doutorado04/bases/SWDE/nbaplayer/nbaplayer-usatoday/0199.htm",Clippers forward Brian Cook was ejected from Sunday's game after committing a Flagrant-2 foul on Joel Przybilla.
"/media/edimar/SAMSUNG/doutorado04/bases/SWDE/nbaplayer/nbaplayer-usatoday/0254.htm","The Hornets signed center D.J. Mbenga, who last played for the Lakers, to a contract."
"/media/edimar/SAMSUNG/doutorado04/bases/SWDE/nbaplayer/nbaplayer-usatoday/0403.htm","Rodney Stuckey had 17 points, three rebounds, seven assists, one steal, and four turnovers in a road victory against the Kings on Sunday."
"/media/edimar/SAMSUNG/doutorado04/bases/SWDE/nbaplayer/nbaplayer-usatoday/0322.htm","Samuel Dalembert played 21 minutes off the bench on Monday, scoring six points on 2-of-5 shooting with 11 rebounds and two blocks."
"/media/edimar/SAMSUNG/doutorado04/bases/SWDE/nbaplayer/nbaplayer-usatoday/0348.htm","Ryan Hollins made a start at center in Thursday's loss and finished with six points, 14 rebounds, a steal and two blocks."
"/media/edimar/SAMSUNG/doutorado04/bases/SWDE/nbaplayer/nbaplayer-usatoday/0038.htm","Brandon Rush has 16 points through the early portion of the second quarter, after coming off the bench behind Mike Dunleavy in Monday's game."
"/media/edimar/SAMSUNG/doutorado04/bases/SWDE/nbaplayer/nbaplayer-usatoday/0165.htm","Timberwolves big man Nikola Pekovic could be out [one] week or weeks, according to beat writer Kent Youngblood."
"/media/edimar/SAMSUNG/doutorado04/bases/SWDE/nbaplayer/nbaplayer-usatoday/0320.htm","DeMarcus Cousins double-doubled with 17 points and 11 rebounds on Saturday, hitting 6-of-14 shots from the field to go with a block."
"/media/edimar/SAMSUNG/doutorado04/bases/SWDE/nbaplayer/nbaplayer-usatoday/0274.htm",Wesley Matthews avoided suspension on Monday after possibly leaving the bench area during a fracas on Sunday night.
"/media/edimar/SAMSUNG/doutorado04/bases/SWDE/nbaplayer/nbaplayer-usatoday/0232.htm",Eric Maynor suffered a thumb injury in summer-league play that could keep him out for the remainder of OKC's games.
"/media/edimar/SAMSUNG/doutorado04/bases/SWDE/nbaplayer/nbaplayer-usatoday/0003.htm",Shaquille O'Neal left at halftime of Sunday's game with a sore right calf. He finished with three points and four rebounds in 11 minutes of action.
"/media/edimar/SAMSUNG/doutorado04/bases/SWDE/nbaplayer/nbaplayer-usatoday/0209.htm",Darrell Arthur (groin) missed Wednesday's game against the Lakers and remains day to day.
"/media/edimar/SAMSUNG/doutorado04/bases/SWDE/nbaplayer/nbaplayer-usatoday/0376.htm",Stephen Jackson will start for the Bobcats on Tuesday despite missing shootaround with a sore calf.
"/media/edimar/SAMSUNG/doutorado04/bases/SWDE/nbaplayer/nbaplayer-usatoday/0356.htm",Joey Graham will not play in Saturday's game against the Wolves due to the flu.
"/media/edimar/SAMSUNG/doutorado04/bases/SWDE/nbaplayer/nbaplayer-usatoday/0081.htm",Luc Richard Mbah a Moute started again for the Bucks on Wednesday and had 10 points and nine rebounds in a loss to the Cavs.
"/media/edimar/SAMSUNG/doutorado04/bases/SWDE/nbaplayer/nbaplayer-usatoday/0167.htm",Darko Milicic could reportedly barely walk after taking a knee to his thigh in the first quarter of Monday's loss to the Knicks.
"/media/edimar/SAMSUNG/doutorado04/bases/SWDE/nbaplayer/nbaplayer-usatoday/0154.htm","Shane Battier, who missed shootaround earlier in the day due to the flu, will play on Tuesday against the Pistons."
"/media/edimar/SAMSUNG/doutorado04/bases/SWDE/nbaplayer/nbaplayer-usatoday/0127.htm",Al Harrington missed all four of his shots on Friday to finish with just three points and six boards in 23 minutes.
"/media/edimar/SAMSUNG/doutorado04/bases/SWDE/nbaplayer/nbaplayer-usatoday/0278.htm",Andre Miller left Friday's game after spraining his left ankle but returned to start the second half.
"/media/edimar/SAMSUNG/doutorado04/bases/SWDE/nbaplayer/nbaplayer-usatoday/0187.htm","Maurice Evans will come off the bench on Monday, as the Hawks decided to use Jason Collins in the starting lineup against Dwight Howard and the Magic."
"/media/edimar/SAMSUNG/doutorado04/bases/SWDE/nbaplayer/nbaplayer-usatoday/0122.htm",Melvin Ely started in place of injured Nene on Friday and had five points and eight boards in 30 minutes.
"/media/edimar/SAMSUNG/doutorado04/bases/SWDE/nbaplayer/nbaplayer-usatoday/0208.htm","Marc Gasol had 20 points, seven rebounds, five assists, two steals and three blocks on 7-of-9 shooting on Friday."
"/media/edimar/SAMSUNG/doutorado04/bases/SWDE/nbaplayer/nbaplayer-usatoday/0106.htm","Mavericks center Brendan Haywood appears to be sulking about his role off the bench, according to beat writer Eddie Sefko."
"/media/edimar/SAMSUNG/doutorado04/bases/SWDE/nbaplayer/nbaplayer-usatoday/0313.htm",Raja Bell is in the starting lineup for the Jazz after missing a game with a thigh injury.
"/media/edimar/SAMSUNG/doutorado04/bases/SWDE/nbaplayer/nbaplayer-usatoday/0345.htm","Jordan Farmar hit just 6-of-18 shots, but also hit a 3-pointer and had 16 points and 10 assists in Friday's loss to the Bobcats."
"/media/edimar/SAMSUNG/doutorado04/bases/SWDE/nbaplayer/nbaplayer-usatoday/0095.htm","The Timberwolves selected PF Trevor Booker with the 23rd pick in the draft, but will trade him to the Wizards."
"/media/edimar/SAMSUNG/doutorado04/bases/SWDE/nbaplayer/nbaplayer-usatoday/0357.htm","Jawad Williams returned from a personal absence Tuesday and had 12 points, four boards and two 3-pointers in a win over Philly."
"/media/edimar/SAMSUNG/doutorado04/bases/SWDE/nbaplayer/nbaplayer-usatoday/0384.htm","Wilson Chandler shot 8-of-14 to score 21 points in Sunday's win over the Raptors, adding three treys, three rebounds, one assist and one turnover."
"/media/edimar/SAMSUNG/doutorado04/bases/SWDE/nbaplayer/nbaplayer-usatoday/0089.htm",Andray Blatche scored 24 points on 10-of-13 shooting in Sunday's loss to the Suns.
"/media/edimar/SAMSUNG/doutorado04/bases/SWDE/nbaplayer/nbaplayer-usatoday/0284.htm","Hakim Warrick came to life with 26 points off the bench on Sunday, making 10-of-13 FGs and 6-of-10 FTs, with six rebounds and two assists."
"/media/edimar/SAMSUNG/doutorado04/bases/SWDE/nbaplayer/nbaplayer-usatoday/0126.htm",Gary Forbes scored four points on 2-of-2 shooting with one rebound and one assist in 11 minutes off the bench.
