URL,EXTRACTED VALUE
"/media/edimar/SAMSUNG/doutorado04/bases/SWDE/nbaplayer/nbaplayer-usatoday/0149.htm",Yao Ming (ankle/leg) will not practice this week.
"/media/edimar/SAMSUNG/doutorado04/bases/SWDE/nbaplayer/nbaplayer-usatoday/0378.htm",Coach Mike D'Antoni said Ronny Turiaf won't be re-entering the starting lineup.
"/media/edimar/SAMSUNG/doutorado04/bases/SWDE/nbaplayer/nbaplayer-usatoday/0064.htm",Reggie Evans is expected to be sidelined for approximately eight weeks after having surgery on his fractured foot.
"/media/edimar/SAMSUNG/doutorado04/bases/SWDE/nbaplayer/nbaplayer-usatoday/0155.htm",Jermaine Taylor has moved ahead of Ish Smith in the Rockets' rotation.
"/media/edimar/SAMSUNG/doutorado04/bases/SWDE/nbaplayer/nbaplayer-usatoday/0034.htm",Pacers rookie Paul George will no longer be part of the team's four-man wing rotation.
"/media/edimar/SAMSUNG/doutorado04/bases/SWDE/nbaplayer/nbaplayer-usatoday/0270.htm",Blazers assigned first-round F Luke Babbitt to the Idaho Stampede of the NBADL.
"/media/edimar/SAMSUNG/doutorado04/bases/SWDE/nbaplayer/nbaplayer-usatoday/0010.htm",Delonte West (wrist) said his cast will be removed in two weeks and he expects to return during the regular season.
"/media/edimar/SAMSUNG/doutorado04/bases/SWDE/nbaplayer/nbaplayer-usatoday/0023.htm",The Bulls signed point guard John Lucas on Friday.
"/media/edimar/SAMSUNG/doutorado04/bases/SWDE/nbaplayer/nbaplayer-usatoday/0340.htm",Quinton Ross returned to action from a calf injury on Friday but played just 28 seconds.
"/media/edimar/SAMSUNG/doutorado04/bases/SWDE/nbaplayer/nbaplayer-usatoday/0335.htm",Coach Avery Johnson confirmed that Joe Smith will start at power forward in Wednesday's season opener.
"/media/edimar/SAMSUNG/doutorado04/bases/SWDE/nbaplayer/nbaplayer-usatoday/0201.htm",Randy Foye (hamstring) did not practice on Tuesday and we're calling him questionable for Wednesday's game against the Spurs.
"/media/edimar/SAMSUNG/doutorado04/bases/SWDE/nbaplayer/nbaplayer-usatoday/0193.htm","The MRI taken on Chris Kaman's injured left ankle showed a bone bruise, and he will not play in Wednesday's game and possibly more."
"/media/edimar/SAMSUNG/doutorado04/bases/SWDE/nbaplayer/nbaplayer-usatoday/0085.htm",Carlos Delfino (concussion symptoms) admitted that he is still experiencing headaches.
"/media/edimar/SAMSUNG/doutorado04/bases/SWDE/nbaplayer/nbaplayer-usatoday/0093.htm",The Wizards are unlikely to sign second-round pick Hamady Ndiaye for the upcoming season.
"/media/edimar/SAMSUNG/doutorado04/bases/SWDE/nbaplayer/nbaplayer-usatoday/0229.htm",Daequan Cook hit three 3-pointers to score 13 points on 5-of-9 shooting Wednesday.
"/media/edimar/SAMSUNG/doutorado04/bases/SWDE/nbaplayer/nbaplayer-usatoday/0037.htm","A.J. Price made his season-debut on Tuesday, scoring seven points on 2-of-3 shooting with no rebounds and two assists in 11 minutes."
"/media/edimar/SAMSUNG/doutorado04/bases/SWDE/nbaplayer/nbaplayer-usatoday/0282.htm",The Suns have invited center Garret Siler to training camp on an unguaranteed contract.
"/media/edimar/SAMSUNG/doutorado04/bases/SWDE/nbaplayer/nbaplayer-usatoday/0143.htm","Charlie Bell has been traded to the Warriors, along with Dan Gadzuric, in exchange for Corey Maggette."
"/media/edimar/SAMSUNG/doutorado04/bases/SWDE/nbaplayer/nbaplayer-usatoday/0125.htm","Nuggets forward Renaldo Balkman hasn't been giving it his all at practice, according to beat writer Benjamin Hochman."
"/media/edimar/SAMSUNG/doutorado04/bases/SWDE/nbaplayer/nbaplayer-usatoday/0252.htm",Veteren big man David Andersen has been traded from Toronto to New Orleans.
"/media/edimar/SAMSUNG/doutorado04/bases/SWDE/nbaplayer/nbaplayer-usatoday/0242.htm",Luke Walton returned to action on Friday November 5.
"/media/edimar/SAMSUNG/doutorado04/bases/SWDE/nbaplayer/nbaplayer-usatoday/0341.htm","Devin Harris scored 18 points on 2-of-8 shooting (1-of-1 from deep, 13-of-16 from the foul line) to go with 13 assists and three steals on Tuesday."
"/media/edimar/SAMSUNG/doutorado04/bases/SWDE/nbaplayer/nbaplayer-usatoday/0118.htm",Rookie Dominique Jones was sent to the Texas Legends of the D-League on Monday.
"/media/edimar/SAMSUNG/doutorado04/bases/SWDE/nbaplayer/nbaplayer-usatoday/0362.htm","DeSagana Diop had four points, four rebounds, a block and a steal in 20 minutes Wednesday and coach Larry Brown liked what he saw."
"/media/edimar/SAMSUNG/doutorado04/bases/SWDE/nbaplayer/nbaplayer-usatoday/0065.htm",Marcus Banks will not be joining the Hornets under the advice of his representatives.
"/media/edimar/SAMSUNG/doutorado04/bases/SWDE/nbaplayer/nbaplayer-usatoday/0159.htm",Aaron Brooks (ankle) admitted that he still hasn't been cleared to practice.
"/media/edimar/SAMSUNG/doutorado04/bases/SWDE/nbaplayer/nbaplayer-usatoday/0283.htm",The Suns are not expected to pick up Earl Clark's extension.
"/media/edimar/SAMSUNG/doutorado04/bases/SWDE/nbaplayer/nbaplayer-usatoday/0262.htm",Marcus Thornton played 10 minutes on Wednesday and scored seven points after not getting off the bench on Monday.
"/media/edimar/SAMSUNG/doutorado04/bases/SWDE/nbaplayer/nbaplayer-usatoday/0162.htm",Jared Jeffries had 12 points and eight rebounds on 6-of-9 shooting in Wednesday's exhibition game in China.
"/media/edimar/SAMSUNG/doutorado04/bases/SWDE/nbaplayer/nbaplayer-usatoday/0122.htm",Melvin Ely scored a season-high nine points on 4-of-14 shooting with six rebounds and one assist in 17 minutes off the bench.
"/media/edimar/SAMSUNG/doutorado04/bases/SWDE/nbaplayer/nbaplayer-usatoday/0435.htm",Jason Kapono returned to 76ers practice on Monday after spending some time away for personal reasons.
"/media/edimar/SAMSUNG/doutorado04/bases/SWDE/nbaplayer/nbaplayer-usatoday/0244.htm",Sasha Vujacic made his Lakers debut on Sunday and had three points in eight minutes.
"/media/edimar/SAMSUNG/doutorado04/bases/SWDE/nbaplayer/nbaplayer-usatoday/0364.htm",Eduardo Najera (groin) returned to action from a groin injury when he played for one second on Saturday night.
"/media/edimar/SAMSUNG/doutorado04/bases/SWDE/nbaplayer/nbaplayer-usatoday/0060.htm",The Raptors assigned rookie center Solomon Alabi to the D-League.
"/media/edimar/SAMSUNG/doutorado04/bases/SWDE/nbaplayer/nbaplayer-usatoday/0090.htm",Hilton Armstrong returned from a one-game suspension on Friday and had six points and three rebounds in 12 minutes.
"/media/edimar/SAMSUNG/doutorado04/bases/SWDE/nbaplayer/nbaplayer-usatoday/0237.htm","Theo Ratliff suffered a setback after working out his surgically repaired knee, and his timetable for return is unknown at this time as a result."
"/media/edimar/SAMSUNG/doutorado04/bases/SWDE/nbaplayer/nbaplayer-usatoday/0396.htm",Pistons rookies DaJuan Summers and Austin Daye each shot 1-of-7 off the bench in Tuesday's loss to the Bobcats.
"/media/edimar/SAMSUNG/doutorado04/bases/SWDE/nbaplayer/nbaplayer-usatoday/0427.htm","Sixers F Craig Brackins is averaging 20.3 points, 9.3 rebounds and 2.0 assists in three games with the Springfield Armor of the NBADL."
"/media/edimar/SAMSUNG/doutorado04/bases/SWDE/nbaplayer/nbaplayer-usatoday/0041.htm","The Pacers will continue to try and trade Dahntay Jones, according to the Indianapolis Star."
"/media/edimar/SAMSUNG/doutorado04/bases/SWDE/nbaplayer/nbaplayer-usatoday/0070.htm",Peja Stojakovic is not traveling with the Raptors due to his knee injury and will miss his fourth straight game on Monday.
"/media/edimar/SAMSUNG/doutorado04/bases/SWDE/nbaplayer/nbaplayer-usatoday/0281.htm",Robin Lopez (knee) could return to full team practices as soon as next week.
"/media/edimar/SAMSUNG/doutorado04/bases/SWDE/nbaplayer/nbaplayer-usatoday/0372.htm",Gerald Henderson (knee) hopes to resume on-court activity in a week.
"/media/edimar/SAMSUNG/doutorado04/bases/SWDE/nbaplayer/nbaplayer-usatoday/0359.htm","Manny Harris tweeted Thursday that he made the Cavs' roster, which means that Danny Green will likely be cut."
"/media/edimar/SAMSUNG/doutorado04/bases/SWDE/nbaplayer/nbaplayer-usatoday/0343.htm",Nets recalled Terrence Williams from the Springfield Armor of the NBADL.
"/media/edimar/SAMSUNG/doutorado04/bases/SWDE/nbaplayer/nbaplayer-usatoday/0375.htm","The Bobcats signed undrafted rookie point guard Sherron Collins to a two-year, non-guaranteed deal on Friday."
"/media/edimar/SAMSUNG/doutorado04/bases/SWDE/nbaplayer/nbaplayer-usatoday/0129.htm",The Nuggets have officially re-signed 12-year NBA veteran Anthony Carter.
"/media/edimar/SAMSUNG/doutorado04/bases/SWDE/nbaplayer/nbaplayer-usatoday/0178.htm","The Hawks signed free agent center Etan Thomas, who played for the Thunder last season."
"/media/edimar/SAMSUNG/doutorado04/bases/SWDE/nbaplayer/nbaplayer-usatoday/0194.htm",Jarron Collins is reportedly planning to sign with the Clippers.
"/media/edimar/SAMSUNG/doutorado04/bases/SWDE/nbaplayer/nbaplayer-usatoday/0321.htm",Hassan Whiteside was sent to the D-league on Monday.
"/media/edimar/SAMSUNG/doutorado04/bases/SWDE/nbaplayer/nbaplayer-usatoday/0205.htm","Willie Warren could build off his career-high 17 minutes played on Friday, if Eric Bledsoe (ankle) and Randy Foye (hamstring) cannot play on Sunday."
"/media/edimar/SAMSUNG/doutorado04/bases/SWDE/nbaplayer/nbaplayer-usatoday/0350.htm",Cavaliers rookie Samardo Samuels missed the end of Tuesday's practice because of cramping. He was given fluids and will be fine.
"/media/edimar/SAMSUNG/doutorado04/bases/SWDE/nbaplayer/nbaplayer-usatoday/0407.htm",Veteran center Jamaal Magloire has officially signed a one-year contract to remain with the Heat next season. He will earn the veteran's minimum.
"/media/edimar/SAMSUNG/doutorado04/bases/SWDE/nbaplayer/nbaplayer-usatoday/0188.htm",Joe Johnson had surgery on his right elbow on Thursday -- he will begin his rehab on Friday but isn't expected to play for four-to-six weeks.
"/media/edimar/SAMSUNG/doutorado04/bases/SWDE/nbaplayer/nbaplayer-usatoday/0209.htm",Darrell Arthur came back from a knee injury and had seven points and four rebounds in 19 minutes on Friday.
"/media/edimar/SAMSUNG/doutorado04/bases/SWDE/nbaplayer/nbaplayer-usatoday/0179.htm","Jason Collins started at center on Tuesday against Brook Lopez and the Nets, with Marvin Williams getting the start at shooting guard."
"/media/edimar/SAMSUNG/doutorado04/bases/SWDE/nbaplayer/nbaplayer-usatoday/0426.htm",Darius Songaila has reportedly been traded to the Sixers from the Hornets.
"/media/edimar/SAMSUNG/doutorado04/bases/SWDE/nbaplayer/nbaplayer-usatoday/0409.htm",Udonis Haslem (foot surgery) said he is targeting April for his return.
"/media/edimar/SAMSUNG/doutorado04/bases/SWDE/nbaplayer/nbaplayer-usatoday/0240.htm",Lakers rookie Devin Ebanks sat out Sunday's game because of intestinal flu.
"/media/edimar/SAMSUNG/doutorado04/bases/SWDE/nbaplayer/nbaplayer-usatoday/0223.htm",The Thunder recalled rookie Cole Aldrich from the D-League on Monday.
"/media/edimar/SAMSUNG/doutorado04/bases/SWDE/nbaplayer/nbaplayer-usatoday/0004.htm","Jermaine O'Neal is back with the Celtics and working out, but could still be two weeks away from returning."
"/media/edimar/SAMSUNG/doutorado04/bases/SWDE/nbaplayer/nbaplayer-usatoday/0074.htm","Drew Gooden (foot) will not play on Monday, and rookie Larry Sanders will get another start in his place against the Heat."
"/media/edimar/SAMSUNG/doutorado04/bases/SWDE/nbaplayer/nbaplayer-usatoday/0387.htm",Andy Rautins (knee bruise) is expected to be ready for training camp.
"/media/edimar/SAMSUNG/doutorado04/bases/SWDE/nbaplayer/nbaplayer-usatoday/0138.htm",Brandon Wright (back) will not play against the Suns Thursday night.
"/media/edimar/SAMSUNG/doutorado04/bases/SWDE/nbaplayer/nbaplayer-usatoday/0300.htm",Spurs rookie James Anderson has a stress fracture in his right foot and is expected to miss about eight weeks.
