URL,EXTRACTED VALUE
"/media/edimar/SAMSUNG/doutorado04/bases/SWDE/nbaplayer/nbaplayer-usatoday/0000.htm","Celtics center Kendrick Perkins (ACL surgery) hopes to resume playing by January, but the team doesn't expect him back until February or March."
"/media/edimar/SAMSUNG/doutorado04/bases/SWDE/nbaplayer/nbaplayer-usatoday/0378.htm",Ronny Turiaf (knee) will return for the Knicks vs. Minnesota on Monday.
"/media/edimar/SAMSUNG/doutorado04/bases/SWDE/nbaplayer/nbaplayer-usatoday/0064.htm",Reggie Evans tweeted that he'll have surgery on his fractured foot December 2.
"/media/edimar/SAMSUNG/doutorado04/bases/SWDE/nbaplayer/nbaplayer-usatoday/0395.htm","The Pistons may soon invite another young big man to training camp, though they already have 15 players under contract."
"/media/edimar/SAMSUNG/doutorado04/bases/SWDE/nbaplayer/nbaplayer-usatoday/0032.htm",Beat writer Mike Wells reports that Jim O'Brien is not planning to use Jeff Foster (ankle) at power forward upon his return.
"/media/edimar/SAMSUNG/doutorado04/bases/SWDE/nbaplayer/nbaplayer-usatoday/0412.htm","Juwan Howard, who has been cleared to play on Friday, will wear a mask to protect his broken nose."
"/media/edimar/SAMSUNG/doutorado04/bases/SWDE/nbaplayer/nbaplayer-usatoday/0238.htm",Pau Gasol (hamstring) did not practice on Saturday.
"/media/edimar/SAMSUNG/doutorado04/bases/SWDE/nbaplayer/nbaplayer-usatoday/0224.htm","Nenad Krstic (back) started at center against the Hornets on Monday, moving Serge Ibaka back to the bench."
"/media/edimar/SAMSUNG/doutorado04/bases/SWDE/nbaplayer/nbaplayer-usatoday/0019.htm",Carlos Boozer had 12 points and two rebounds in 21 minutes on Friday.
"/media/edimar/SAMSUNG/doutorado04/bases/SWDE/nbaplayer/nbaplayer-usatoday/0135.htm","Andris Biedrins grabbed 18 rebounds on Tuesday against the Spurs, and also added four points on 2-of-6 shooting and two assists."
"/media/edimar/SAMSUNG/doutorado04/bases/SWDE/nbaplayer/nbaplayer-usatoday/0335.htm",The Nets officially signed forward Joe Smith on Friday.
"/media/edimar/SAMSUNG/doutorado04/bases/SWDE/nbaplayer/nbaplayer-usatoday/0128.htm",Nuggets forward Kenyon Martin (knee) should have a timetable for his return after meeting with an orthopedic specialist after Thanksgiving weekend.
"/media/edimar/SAMSUNG/doutorado04/bases/SWDE/nbaplayer/nbaplayer-usatoday/0044.htm","Dwight Howard, J.J. Redick, and Mickael Pietrus will all be ready to play on Monday night."
"/media/edimar/SAMSUNG/doutorado04/bases/SWDE/nbaplayer/nbaplayer-usatoday/0193.htm","Chris Kaman (sprained ankle) was visibly frustrated after aggravating his injury on Sunday, and his status for Monday's game is in doubt."
"/media/edimar/SAMSUNG/doutorado04/bases/SWDE/nbaplayer/nbaplayer-usatoday/0392.htm",Pistons big man Chris Wilcox remains sidelined with a hamstring injury.
"/media/edimar/SAMSUNG/doutorado04/bases/SWDE/nbaplayer/nbaplayer-usatoday/0348.htm",Timberwolves center Ryan Hollins was traded to the Cavaliers as part of Monday's four-player swap.
"/media/edimar/SAMSUNG/doutorado04/bases/SWDE/nbaplayer/nbaplayer-usatoday/0236.htm","Andrew Bynum is targeting a return sometime during the Lakers' upcoming six-game road trip, but the Lakers have not announced a set timetable."
"/media/edimar/SAMSUNG/doutorado04/bases/SWDE/nbaplayer/nbaplayer-usatoday/0333.htm","Free agent center Johan Petro has reached agreement on a three year, $10 million deal with the Nets, according to Yahoo! Sports."
"/media/edimar/SAMSUNG/doutorado04/bases/SWDE/nbaplayer/nbaplayer-usatoday/0076.htm",Brian Skinner saw 28 minutes in Saturday's game when the Bucks starting frontcourt of Drew Gooden and Ersan Ilyasova got into early foul trouble.
"/media/edimar/SAMSUNG/doutorado04/bases/SWDE/nbaplayer/nbaplayer-usatoday/0353.htm",Leon Powe said recently that his knee is 100% healthy and he can now squat 275 pounds.
"/media/edimar/SAMSUNG/doutorado04/bases/SWDE/nbaplayer/nbaplayer-usatoday/0362.htm",DeSagana Diop (dizzy spells) would return to action on Friday.
"/media/edimar/SAMSUNG/doutorado04/bases/SWDE/nbaplayer/nbaplayer-usatoday/0109.htm",The Mavericks signed free agent forward Steve Novak.
"/media/edimar/SAMSUNG/doutorado04/bases/SWDE/nbaplayer/nbaplayer-usatoday/0120.htm",Chris Andersen is day-to-day with a bruised lower back -- X-rays were negative but he is questionable to play on Sunday.
"/media/edimar/SAMSUNG/doutorado04/bases/SWDE/nbaplayer/nbaplayer-usatoday/0381.htm","Eddy Curry did not play on Saturday against the Clippers, one day after missing Friday's game to attend to a family matter."
"/media/edimar/SAMSUNG/doutorado04/bases/SWDE/nbaplayer/nbaplayer-usatoday/0162.htm","Rockets forward Jared Jeffries has decided not to opt out of the final year of his contract, worth $6.9 million."
"/media/edimar/SAMSUNG/doutorado04/bases/SWDE/nbaplayer/nbaplayer-usatoday/0122.htm",Melvin Ely will start in place for Nene for the Nuggets on Friday.
"/media/edimar/SAMSUNG/doutorado04/bases/SWDE/nbaplayer/nbaplayer-usatoday/0286.htm",Josh Childress is expected to continue playing with a splint on his hand for two more weeks.
"/media/edimar/SAMSUNG/doutorado04/bases/SWDE/nbaplayer/nbaplayer-usatoday/0073.htm","Andrew Bogut (back) will start on Monday against the Heat, as expected."
"/media/edimar/SAMSUNG/doutorado04/bases/SWDE/nbaplayer/nbaplayer-usatoday/0414.htm","As expected, Zydrunas Ilgauskas will remain the Heat's starting center, with newly acquired Erick Dampier to be worked in slowly off the bench."
"/media/edimar/SAMSUNG/doutorado04/bases/SWDE/nbaplayer/nbaplayer-usatoday/0017.htm",The Knicks have reached out to veteran PF/C Kurt Thomas.
"/media/edimar/SAMSUNG/doutorado04/bases/SWDE/nbaplayer/nbaplayer-usatoday/0284.htm","One game after his first start of the season, Hakim Warrick plummeted down the Suns' depth chart and wound up playing just nine minutes off the bench."
"/media/edimar/SAMSUNG/doutorado04/bases/SWDE/nbaplayer/nbaplayer-usatoday/0090.htm",The Wizards are expecting Hilton Armstrong to be suspended for Wednesday's game in Toronto.
"/media/edimar/SAMSUNG/doutorado04/bases/SWDE/nbaplayer/nbaplayer-usatoday/0048.htm",Brandon Bass had 17 points and five rebounds on 5-of-8 shooting in Wednesday's win over the Bulls.
"/media/edimar/SAMSUNG/doutorado04/bases/SWDE/nbaplayer/nbaplayer-usatoday/0237.htm","Theo Ratliff underwent successful knee surgery on Tuesday, and is expected to be out a minimum of 4-6 weeks."
"/media/edimar/SAMSUNG/doutorado04/bases/SWDE/nbaplayer/nbaplayer-usatoday/0266.htm",Marcus Camby was benched after playing just under three minutes of the first half of Friday's game.
"/media/edimar/SAMSUNG/doutorado04/bases/SWDE/nbaplayer/nbaplayer-usatoday/0050.htm",Malik Allen cited a great relationship with George Karl and the Nuggets in general as a reason he would like to play for them again next season.
"/media/edimar/SAMSUNG/doutorado04/bases/SWDE/nbaplayer/nbaplayer-usatoday/0180.htm",Zaza Pachulia sat out the second half of Tuesday's game with a hip flexor injury.
"/media/edimar/SAMSUNG/doutorado04/bases/SWDE/nbaplayer/nbaplayer-usatoday/0363.htm","Nazr Mohammed is back in the starting lineup for the Bobcats, pushing Tyrus Thomas back to the bench."
"/media/edimar/SAMSUNG/doutorado04/bases/SWDE/nbaplayer/nbaplayer-usatoday/0041.htm","Dahntay Jones remains on the trading block, according to the Indianapolis Star."
"/media/edimar/SAMSUNG/doutorado04/bases/SWDE/nbaplayer/nbaplayer-usatoday/0267.htm",Sean Marks (sprained ankle) did not play in Portland's loss to the Nets on Sunday.
"/media/edimar/SAMSUNG/doutorado04/bases/SWDE/nbaplayer/nbaplayer-usatoday/0198.htm",Clippers PF Craig Smith plans to appeal the Flagrant-2 foul that got him ejected from Monday's game.
"/media/edimar/SAMSUNG/doutorado04/bases/SWDE/nbaplayer/nbaplayer-usatoday/0063.htm","Amir Johnson quietly had a perfect night with 14 points, nine rebounds, a steal and a block in 31 minutes of Friday's win."
"/media/edimar/SAMSUNG/doutorado04/bases/SWDE/nbaplayer/nbaplayer-usatoday/0129.htm",Impending free agent G Anthony Carter said he hopes to sign a one-year deal to remain in Denver.
"/media/edimar/SAMSUNG/doutorado04/bases/SWDE/nbaplayer/nbaplayer-usatoday/0288.htm",Coach Alvin Gentry does not appear concerned about the foot sprain Grant Hill suffered in Wednesday's practice.
"/media/edimar/SAMSUNG/doutorado04/bases/SWDE/nbaplayer/nbaplayer-usatoday/0178.htm","Etan Thomas, who hasn't played since Dec. 4, had four points and three rebounds in 15 minutes of Wednesday's loss."
"/media/edimar/SAMSUNG/doutorado04/bases/SWDE/nbaplayer/nbaplayer-usatoday/0393.htm",Jason Maxiell started at power forward again on Wednesday but hit just 1-of-6 shots for two points and four rebounds.
"/media/edimar/SAMSUNG/doutorado04/bases/SWDE/nbaplayer/nbaplayer-usatoday/0425.htm",Elton Brand served his one-game suspension on Wednesday and is ready to return vs. the Heat on Friday.
"/media/edimar/SAMSUNG/doutorado04/bases/SWDE/nbaplayer/nbaplayer-usatoday/0365.htm",Kwame Brown is ready to make his season debut for the Bobcats on Monday.
"/media/edimar/SAMSUNG/doutorado04/bases/SWDE/nbaplayer/nbaplayer-usatoday/0029.htm",Pacers big man Solomon Jones has grabbed a mere three rebounds in 58 minutes of action this season.
"/media/edimar/SAMSUNG/doutorado04/bases/SWDE/nbaplayer/nbaplayer-usatoday/0254.htm",Free agent C D.J. Mbenga is reportedly close to a one-year deal with the Hornets.
"/media/edimar/SAMSUNG/doutorado04/bases/SWDE/nbaplayer/nbaplayer-usatoday/0137.htm",Louis Amundson (finger) is practicing with the Warriors and hopes to return in a week to 10 days.
"/media/edimar/SAMSUNG/doutorado04/bases/SWDE/nbaplayer/nbaplayer-usatoday/0407.htm","Jamaal Magloire had six points, nine rebounds and three blocks in Wednesday's win."
"/media/edimar/SAMSUNG/doutorado04/bases/SWDE/nbaplayer/nbaplayer-usatoday/0179.htm","Jason Collins will start at center on Friday against the Wolves, moving Al Horford to power forward and Josh Smith to small forward."
"/media/edimar/SAMSUNG/doutorado04/bases/SWDE/nbaplayer/nbaplayer-usatoday/0356.htm","Joey Graham scored 12 points on 5-of-10 shooting (including two threes) with three rebounds, one assist, one steal, and one block in 29 minutes."
"/media/edimar/SAMSUNG/doutorado04/bases/SWDE/nbaplayer/nbaplayer-usatoday/0136.htm","David Lee scored 18 points on 7-of-12 shooting with seven rebounds, five assists, and two steals on Tuesday."
"/media/edimar/SAMSUNG/doutorado04/bases/SWDE/nbaplayer/nbaplayer-usatoday/0309.htm",Francisco Elson finally made his debut for the Jazz after returning from an injured hamstring.
"/media/edimar/SAMSUNG/doutorado04/bases/SWDE/nbaplayer/nbaplayer-usatoday/0124.htm","Shelden Williams had eight points, 13 rebounds and zero blocks on Friday."
"/media/edimar/SAMSUNG/doutorado04/bases/SWDE/nbaplayer/nbaplayer-usatoday/0347.htm",Anderson Varejao is still being held out of contact drills in practice due to his bruised ribs.
"/media/edimar/SAMSUNG/doutorado04/bases/SWDE/nbaplayer/nbaplayer-usatoday/0424.htm",76ers center Tony Battie suffered a quad strain on Saturday and is listed day-to-day.
"/media/edimar/SAMSUNG/doutorado04/bases/SWDE/nbaplayer/nbaplayer-usatoday/0004.htm","Jermaine O'Neal (knee), who is with the team for Sunday's game in New Jersey, will participate in an on-court workout tomorrow."
"/media/edimar/SAMSUNG/doutorado04/bases/SWDE/nbaplayer/nbaplayer-usatoday/0106.htm",Brendan Haywood scored seven points on 3-of-7 shooting with 10 rebounds and one assist in 21 minutes on Wednesday.
"/media/edimar/SAMSUNG/doutorado04/bases/SWDE/nbaplayer/nbaplayer-usatoday/0024.htm",Ronnie Brewer played 18 minutes on Saturday as he looks to get back on track after a hamstring injury cost him his projected starting spot.
"/media/edimar/SAMSUNG/doutorado04/bases/SWDE/nbaplayer/nbaplayer-usatoday/0074.htm","Drew Gooden (plantar fasciitis) did not practice on Friday, instead resting his left heel."
"/media/edimar/SAMSUNG/doutorado04/bases/SWDE/nbaplayer/nbaplayer-usatoday/0374.htm","Shaun Livingston played 15 minutes on Wednesday, finishing with zero points and three assists off the bench."
"/media/edimar/SAMSUNG/doutorado04/bases/SWDE/nbaplayer/nbaplayer-usatoday/0151.htm",Chuck Hayes started at center for the Rockets and had eight points and eight rebounds in Monday's loss.
"/media/edimar/SAMSUNG/doutorado04/bases/SWDE/nbaplayer/nbaplayer-usatoday/0268.htm",Joel Przybilla is finally over his stomach flu and should be ready to make his season debut on Friday.
"/media/edimar/SAMSUNG/doutorado04/bases/SWDE/nbaplayer/nbaplayer-usatoday/0225.htm",Thunder signed C Nick Collison to a four-year contract extension.
