URL,EXTRACTED VALUE
"/media/edimar/SAMSUNG/doutorado04/bases/SWDE/nbaplayer/nbaplayer-usatoday/0090.htm",He has no fantasy value as long as JaVale McGee can walk.
"/media/edimar/SAMSUNG/doutorado04/bases/SWDE/nbaplayer/nbaplayer-usatoday/0181.htm","He got hot tonight, but didn't do anything else and should be ignored in most leagues."
"/media/edimar/SAMSUNG/doutorado04/bases/SWDE/nbaplayer/nbaplayer-usatoday/0114.htm","He'll do this every once in a while, but he's nowhere near consistent enough for use in fantasy leagues. Stay away."
"/media/edimar/SAMSUNG/doutorado04/bases/SWDE/nbaplayer/nbaplayer-usatoday/0050.htm","He gives the Magic somebody they can count on in a pinch, but he won't sniff a fantasy lineup all year long."
"/media/edimar/SAMSUNG/doutorado04/bases/SWDE/nbaplayer/nbaplayer-usatoday/0005.htm","Kevin Garnett was ejected and this was a preseason game. Don't plan on drafting Harangody in your fantasy league, but keep an eye on him."
"/media/edimar/SAMSUNG/doutorado04/bases/SWDE/nbaplayer/nbaplayer-usatoday/0070.htm","He went from being a potential starter to street clothes, and given his injury history, may not become a meaningful player again this season."
"/media/edimar/SAMSUNG/doutorado04/bases/SWDE/nbaplayer/nbaplayer-usatoday/0142.htm",Lin only got the extra minutes because Monta Ellis (hip) was sidelined and the game was totally lopsided by halftime.
"/media/edimar/SAMSUNG/doutorado04/bases/SWDE/nbaplayer/nbaplayer-usatoday/0046.htm","Great news for Orton and the rest of his career, but he's not going to have any fantasy relevance this season."
"/media/edimar/SAMSUNG/doutorado04/bases/SWDE/nbaplayer/nbaplayer-usatoday/0255.htm","The starters played sparingly in this one and Pondexter got a long look, but don't expect him to see the court much this year."
"/media/edimar/SAMSUNG/doutorado04/bases/SWDE/nbaplayer/nbaplayer-usatoday/0372.htm",Henderson went for a second examination on his knee and it showed no additional injury. He just needs rest.
"/media/edimar/SAMSUNG/doutorado04/bases/SWDE/nbaplayer/nbaplayer-usatoday/0226.htm",He has no fantasy value and is day-to-day.
"/media/edimar/SAMSUNG/doutorado04/bases/SWDE/nbaplayer/nbaplayer-usatoday/0052.htm","Nelson should be good to go and they're off until then, so get him back in your lineup."
"/media/edimar/SAMSUNG/doutorado04/bases/SWDE/nbaplayer/nbaplayer-usatoday/0012.htm","Wafer has an outside shot at making the team, but offers no fantasy value if he is on the bench on opening night."
"/media/edimar/SAMSUNG/doutorado04/bases/SWDE/nbaplayer/nbaplayer-usatoday/0425.htm",Brand has double-doubled in two of his last three games and appears to have broken out of the funk he was in.
"/media/edimar/SAMSUNG/doutorado04/bases/SWDE/nbaplayer/nbaplayer-usatoday/0321.htm","Finally, a move out of Sacramento that makes complete sense. Whiteside needs to play and he can do that in the D-League."
"/media/edimar/SAMSUNG/doutorado04/bases/SWDE/nbaplayer/nbaplayer-usatoday/0308.htm",Fesenko is averaging just nine minutes per game. Francisco Elson will pick up some extra minutes at backup center.
"/media/edimar/SAMSUNG/doutorado04/bases/SWDE/nbaplayer/nbaplayer-usatoday/0029.htm","The Pacers don�t have anyone really effective at backing up Roy Hibbert, so Jones is getting some run. Keep an eye on him."
"/media/edimar/SAMSUNG/doutorado04/bases/SWDE/nbaplayer/nbaplayer-usatoday/0037.htm","Until he crawls out of the No. 3 PG slot in Indy, he will have no value in fantasy leagues."
"/media/edimar/SAMSUNG/doutorado04/bases/SWDE/nbaplayer/nbaplayer-usatoday/0254.htm","So far the Hornets have avoided a Magic-style outbreak, and Mbenga's absence shouldn't make any difference in fantasy leagues."
"/media/edimar/SAMSUNG/doutorado04/bases/SWDE/nbaplayer/nbaplayer-usatoday/0025.htm","Bogans is worth a look in deeper leagues, but it's possible the two players cancel out each other's value for most of the season."
"/media/edimar/SAMSUNG/doutorado04/bases/SWDE/nbaplayer/nbaplayer-usatoday/0143.htm","Bell always showed some promise in Milwaukee, but will likely be buried behind Steph Curry and Monta Ellis next season, if he even makes the team."
"/media/edimar/SAMSUNG/doutorado04/bases/SWDE/nbaplayer/nbaplayer-usatoday/0350.htm","Samuels will likely fill a minor role backing up PF for the Cavs, but he'll be persona non grata in fantasyland."
"/media/edimar/SAMSUNG/doutorado04/bases/SWDE/nbaplayer/nbaplayer-usatoday/0141.htm","We pegged him as a desperation play, and these are desperate results. He has no business being owned unless you're in a massive league."
"/media/edimar/SAMSUNG/doutorado04/bases/SWDE/nbaplayer/nbaplayer-usatoday/0232.htm","He is over a thumb injury, but will be relegated to a back up role for OKC."
"/media/edimar/SAMSUNG/doutorado04/bases/SWDE/nbaplayer/nbaplayer-usatoday/0171.htm","He won't get nearly this much time once Michael Beasley (ankle) returns to action, so we're not buying this line one bit."
"/media/edimar/SAMSUNG/doutorado04/bases/SWDE/nbaplayer/nbaplayer-usatoday/0176.htm","No return date has been given, but don't be surprised to see him play on Wednesday night against the Thunder."
"/media/edimar/SAMSUNG/doutorado04/bases/SWDE/nbaplayer/nbaplayer-usatoday/0209.htm",He has no fantasy value as long as Zach Randolph is healthy.
"/media/edimar/SAMSUNG/doutorado04/bases/SWDE/nbaplayer/nbaplayer-usatoday/0240.htm",Ebanks is day-to-day but his presence or absence should not impact any fantasy lineups.
"/media/edimar/SAMSUNG/doutorado04/bases/SWDE/nbaplayer/nbaplayer-usatoday/0310.htm","If you're in a 30-team league, give him a look. Otherwise, just quietly welcome him to the NBA."
"/media/edimar/SAMSUNG/doutorado04/bases/SWDE/nbaplayer/nbaplayer-usatoday/0004.htm","He'll have very limited fantasy value when he's back, so we're not exactly counting down the days."
"/media/edimar/SAMSUNG/doutorado04/bases/SWDE/nbaplayer/nbaplayer-usatoday/0435.htm","Kapono's playing time has mostly come at the end of blowout losses, and there are no indications that his role is changing any time soon."
"/media/edimar/SAMSUNG/doutorado04/bases/SWDE/nbaplayer/nbaplayer-usatoday/0234.htm","He's expected back for the next one, not that you even noticed he was gone."
"/media/edimar/SAMSUNG/doutorado04/bases/SWDE/nbaplayer/nbaplayer-usatoday/0087.htm","He will compete with Keyon Dooling for second-string minutes behind Brandon Jennings, and needless to say he is a longshot for having fantasy value."
"/media/edimar/SAMSUNG/doutorado04/bases/SWDE/nbaplayer/nbaplayer-usatoday/0112.htm","Cardinal has a great shot at being on the opening-night roster, Brown could make the team and Haluska is a long shot at this point."
"/media/edimar/SAMSUNG/doutorado04/bases/SWDE/nbaplayer/nbaplayer-usatoday/0244.htm","He's over his concussion, but will not have fantasy value this season."
"/media/edimar/SAMSUNG/doutorado04/bases/SWDE/nbaplayer/nbaplayer-usatoday/0405.htm",White is still in a walking boot after breaking his foot on opening night. He is set for a bit role in the Pistons' crowded wing rotation.
"/media/edimar/SAMSUNG/doutorado04/bases/SWDE/nbaplayer/nbaplayer-usatoday/0361.htm",Eyenga was the final pick of the first round in 2009. The native of Congo has never appeared in an NBA game.
"/media/edimar/SAMSUNG/doutorado04/bases/SWDE/nbaplayer/nbaplayer-usatoday/0075.htm",He has no fantasy value.
"/media/edimar/SAMSUNG/doutorado04/bases/SWDE/nbaplayer/nbaplayer-usatoday/0364.htm","No, the Eduardo Najera era is not beginning. He is about as irrelevant as an NBA player can be in fantasy leagues."
"/media/edimar/SAMSUNG/doutorado04/bases/SWDE/nbaplayer/nbaplayer-usatoday/0060.htm",He needs to get some minutes under his belt and it's not happening in Toronto.
