URL,EXTRACTED VALUE
"/media/edimar/SAMSUNG/doutorado04/bases/SWDE/nbaplayer/nbaplayer-usatoday/0156.htm","He's still not worth owning in most leagues, but could be if he's going to start playing well. This is a signal to put him on your radar."
"/media/edimar/SAMSUNG/doutorado04/bases/SWDE/nbaplayer/nbaplayer-usatoday/0181.htm","He got hot tonight, but didn't do anything else and should be ignored in most leagues."
"/media/edimar/SAMSUNG/doutorado04/bases/SWDE/nbaplayer/nbaplayer-usatoday/0114.htm","He'll do this every once in a while, but he's nowhere near consistent enough for use in fantasy leagues. Stay away."
"/media/edimar/SAMSUNG/doutorado04/bases/SWDE/nbaplayer/nbaplayer-usatoday/0070.htm","He went from being a potential starter to street clothes, and given his injury history, may not become a meaningful player again this season."
"/media/edimar/SAMSUNG/doutorado04/bases/SWDE/nbaplayer/nbaplayer-usatoday/0142.htm",Lin only got the extra minutes because Monta Ellis (hip) was sidelined and the game was totally lopsided by halftime.
"/media/edimar/SAMSUNG/doutorado04/bases/SWDE/nbaplayer/nbaplayer-usatoday/0270.htm",Babbitt has appeared in just eight games of mop-up duty this season. He needs much more seasoning.
"/media/edimar/SAMSUNG/doutorado04/bases/SWDE/nbaplayer/nbaplayer-usatoday/0046.htm","Great news for Orton and the rest of his career, but he's not going to have any fantasy relevance this season."
"/media/edimar/SAMSUNG/doutorado04/bases/SWDE/nbaplayer/nbaplayer-usatoday/0226.htm",He has no fantasy value and is day-to-day.
"/media/edimar/SAMSUNG/doutorado04/bases/SWDE/nbaplayer/nbaplayer-usatoday/0052.htm","Nelson should be good to go and they're off until then, so get him back in your lineup."
"/media/edimar/SAMSUNG/doutorado04/bases/SWDE/nbaplayer/nbaplayer-usatoday/0425.htm",Brand has double-doubled in two of his last three games and appears to have broken out of the funk he was in.
"/media/edimar/SAMSUNG/doutorado04/bases/SWDE/nbaplayer/nbaplayer-usatoday/0321.htm","Finally, a move out of Sacramento that makes complete sense. Whiteside needs to play and he can do that in the D-League."
"/media/edimar/SAMSUNG/doutorado04/bases/SWDE/nbaplayer/nbaplayer-usatoday/0037.htm","Until he crawls out of the No. 3 PG slot in Indy, he will have no value in fantasy leagues."
"/media/edimar/SAMSUNG/doutorado04/bases/SWDE/nbaplayer/nbaplayer-usatoday/0254.htm","So far the Hornets have avoided a Magic-style outbreak, and Mbenga's absence shouldn't make any difference in fantasy leagues."
"/media/edimar/SAMSUNG/doutorado04/bases/SWDE/nbaplayer/nbaplayer-usatoday/0025.htm","Bogans is worth a look in deeper leagues, but it's possible the two players cancel out each other's value for most of the season."
"/media/edimar/SAMSUNG/doutorado04/bases/SWDE/nbaplayer/nbaplayer-usatoday/0020.htm",JJ will go back to obscurity once Gibson and Carlos Boozer are healthy.
"/media/edimar/SAMSUNG/doutorado04/bases/SWDE/nbaplayer/nbaplayer-usatoday/0141.htm","We pegged him as a desperation play, and these are desperate results. He has no business being owned unless you're in a massive league."
"/media/edimar/SAMSUNG/doutorado04/bases/SWDE/nbaplayer/nbaplayer-usatoday/0165.htm",He is merely a backup to Darko Milicic at this point and has no real fantasy value.
"/media/edimar/SAMSUNG/doutorado04/bases/SWDE/nbaplayer/nbaplayer-usatoday/0171.htm","He won't get nearly this much time once Michael Beasley (ankle) returns to action, so we're not buying this line one bit."
"/media/edimar/SAMSUNG/doutorado04/bases/SWDE/nbaplayer/nbaplayer-usatoday/0176.htm","No return date has been given, but don't be surprised to see him play on Wednesday night against the Thunder."
"/media/edimar/SAMSUNG/doutorado04/bases/SWDE/nbaplayer/nbaplayer-usatoday/0250.htm","West won�t be out long, so go ahead and continue to ignore Smith."
"/media/edimar/SAMSUNG/doutorado04/bases/SWDE/nbaplayer/nbaplayer-usatoday/0283.htm","Tough break for Clark and somewhat rare for a lottery pick, as he will become an unrestricted free agent after this season."
"/media/edimar/SAMSUNG/doutorado04/bases/SWDE/nbaplayer/nbaplayer-usatoday/0309.htm","The ailment isn't serious, but Elson's minimal fantasy value is on life support with Mehmet Okur closing in on a return."
"/media/edimar/SAMSUNG/doutorado04/bases/SWDE/nbaplayer/nbaplayer-usatoday/0310.htm","If you're in a 30-team league, give him a look. Otherwise, just quietly welcome him to the NBA."
"/media/edimar/SAMSUNG/doutorado04/bases/SWDE/nbaplayer/nbaplayer-usatoday/0187.htm","He's going to be limited with a gimpy knee, anyway, but tonight's result confirms that he should not be owned in fantasy leagues."
"/media/edimar/SAMSUNG/doutorado04/bases/SWDE/nbaplayer/nbaplayer-usatoday/0004.htm","He'll have very limited fantasy value when he's back, so we're not exactly counting down the days."
"/media/edimar/SAMSUNG/doutorado04/bases/SWDE/nbaplayer/nbaplayer-usatoday/0435.htm","Kapono's playing time has mostly come at the end of blowout losses, and there are no indications that his role is changing any time soon."
"/media/edimar/SAMSUNG/doutorado04/bases/SWDE/nbaplayer/nbaplayer-usatoday/0087.htm","He will compete with Keyon Dooling for second-string minutes behind Brandon Jennings, and needless to say he is a longshot for having fantasy value."
"/media/edimar/SAMSUNG/doutorado04/bases/SWDE/nbaplayer/nbaplayer-usatoday/0112.htm","Cardinal has a great shot at being on the opening-night roster, Brown could make the team and Haluska is a long shot at this point."
"/media/edimar/SAMSUNG/doutorado04/bases/SWDE/nbaplayer/nbaplayer-usatoday/0405.htm",White is still in a walking boot after breaking his foot on opening night. He is set for a bit role in the Pistons' crowded wing rotation.
"/media/edimar/SAMSUNG/doutorado04/bases/SWDE/nbaplayer/nbaplayer-usatoday/0244.htm","He's over his concussion, but will not have fantasy value this season."
"/media/edimar/SAMSUNG/doutorado04/bases/SWDE/nbaplayer/nbaplayer-usatoday/0075.htm",He has no fantasy value.
"/media/edimar/SAMSUNG/doutorado04/bases/SWDE/nbaplayer/nbaplayer-usatoday/0361.htm",Eyenga was the final pick of the first round in 2009. The native of Congo has never appeared in an NBA game.
"/media/edimar/SAMSUNG/doutorado04/bases/SWDE/nbaplayer/nbaplayer-usatoday/0364.htm","No, the Eduardo Najera era is not beginning. He is about as irrelevant as an NBA player can be in fantasy leagues."
