URL,EXTRACTED VALUE
"/media/edimar/SAMSUNG/doutorado04/bases/SWDE/nbaplayer/nbaplayer-usatoday/0395.htm","Ben Wallace had 13 rebounds with two steals and two blocks on Saturday, and also chipped in with four points on 2-of-4 shooting and two assists."
"/media/edimar/SAMSUNG/doutorado04/bases/SWDE/nbaplayer/nbaplayer-usatoday/0142.htm",Golden State rookie guard Jeremy Lin finished Sunday's blowout loss with a career-high 13 points in 18 minutes.
"/media/edimar/SAMSUNG/doutorado04/bases/SWDE/nbaplayer/nbaplayer-usatoday/0135.htm","Andris Biedrins returned from an upset stomach on Sunday, finishing with four points and six rebounds in 23 foul-plagued minutes."
"/media/edimar/SAMSUNG/doutorado04/bases/SWDE/nbaplayer/nbaplayer-usatoday/0226.htm",D.J. White left Friday's game with a sprained ankle and didn't return.
"/media/edimar/SAMSUNG/doutorado04/bases/SWDE/nbaplayer/nbaplayer-usatoday/0196.htm","Blake Griffin had 21 points and 15 rebounds vs. the Blazers on Sunday, but he was just 7-of-16 from the FT line."
"/media/edimar/SAMSUNG/doutorado04/bases/SWDE/nbaplayer/nbaplayer-usatoday/0354.htm","Mo Williams handed out 10 assists in Sunday's loss to Detroit, the second time in five games that he's dropped double-digit dimes."
"/media/edimar/SAMSUNG/doutorado04/bases/SWDE/nbaplayer/nbaplayer-usatoday/0193.htm","The MRI taken on Chris Kaman's injured left ankle showed a bone bruise, and he will not play in Wednesday's game and possibly more."
"/media/edimar/SAMSUNG/doutorado04/bases/SWDE/nbaplayer/nbaplayer-usatoday/0211.htm","Hasheem Thabeet came off the bench for zero points, three rebounds and three blocks in a loss to the Hawks on Wednesday."
"/media/edimar/SAMSUNG/doutorado04/bases/SWDE/nbaplayer/nbaplayer-usatoday/0092.htm",Wizards rookie Kevin Seraphin recently received his work visa and arrived in Washington on Saturday.
"/media/edimar/SAMSUNG/doutorado04/bases/SWDE/nbaplayer/nbaplayer-usatoday/0214.htm",Sam Young admitted he is baffled by his role in the Grizzlies' rotation so far this season.
"/media/edimar/SAMSUNG/doutorado04/bases/SWDE/nbaplayer/nbaplayer-usatoday/0125.htm","Nuggets forward Renaldo Balkman hasn't been giving it his all at practice, according to beat writer Benjamin Hochman."
"/media/edimar/SAMSUNG/doutorado04/bases/SWDE/nbaplayer/nbaplayer-usatoday/0341.htm","Devin Harris scored 18 points on 2-of-8 shooting (1-of-1 from deep, 13-of-16 from the foul line) to go with 13 assists and three steals on Tuesday."
"/media/edimar/SAMSUNG/doutorado04/bases/SWDE/nbaplayer/nbaplayer-usatoday/0353.htm","Leon Powe scored 10 points on 5-of-9 shooting with six rebounds, no assists, and no steals or blocks in a start at small forward on Saturday."
"/media/edimar/SAMSUNG/doutorado04/bases/SWDE/nbaplayer/nbaplayer-usatoday/0147.htm",Warriors swingman Rodney Carney didn't practice on Friday due to a left foot sprain.
"/media/edimar/SAMSUNG/doutorado04/bases/SWDE/nbaplayer/nbaplayer-usatoday/0290.htm","Hedo Turkoglu played just 18 minutes on Tuesday, scoring six points on 2-of-4 shooting (including two threes) with two rebounds and five assists."
"/media/edimar/SAMSUNG/doutorado04/bases/SWDE/nbaplayer/nbaplayer-usatoday/0120.htm","Chris Andersen has a small fracture in his lower vertebrae, and Nuggets coach George Karl believes he will miss about two weeks."
"/media/edimar/SAMSUNG/doutorado04/bases/SWDE/nbaplayer/nbaplayer-usatoday/0391.htm","Raymond Felton hit a career-high five 3-pointers on Monday, and scored 18 points on 6-of-13 shooting with three rebounds, 11 assists, and four steals."
"/media/edimar/SAMSUNG/doutorado04/bases/SWDE/nbaplayer/nbaplayer-usatoday/0122.htm",Melvin Ely scored a season-high nine points on 4-of-14 shooting with six rebounds and one assist in 17 minutes off the bench.
"/media/edimar/SAMSUNG/doutorado04/bases/SWDE/nbaplayer/nbaplayer-usatoday/0286.htm",Josh Childress (finger) will still have to wear a splint on his right (shooting) hand for two more weeks.
"/media/edimar/SAMSUNG/doutorado04/bases/SWDE/nbaplayer/nbaplayer-usatoday/0355.htm","Coming off an 18-point effort, Ramon Sessions had just two points on 0-of-4 shooting in Sunday's loss to the Pistons."
"/media/edimar/SAMSUNG/doutorado04/bases/SWDE/nbaplayer/nbaplayer-usatoday/0058.htm",Andrea Bargnani hit 11-of-20 shots and a 3-pointer on the way to his first double-double of the season with 26 points and 12 rebounds.
"/media/edimar/SAMSUNG/doutorado04/bases/SWDE/nbaplayer/nbaplayer-usatoday/0338.htm","Damion James got 19 minutes of run off the bench in Tuesday's game, scoring 10 points on 5-of-9 shooting with six rebounds, one assist, and one steal."
"/media/edimar/SAMSUNG/doutorado04/bases/SWDE/nbaplayer/nbaplayer-usatoday/0212.htm",Zach Randolph hopes that he'll eventually be invited to play for Team USA.
"/media/edimar/SAMSUNG/doutorado04/bases/SWDE/nbaplayer/nbaplayer-usatoday/0266.htm","Marcus Camby bounced back after a miserable game on Friday, scoring 12 points and grabbing 19 rebounds in a fiesty win against the visiting Clippers."
"/media/edimar/SAMSUNG/doutorado04/bases/SWDE/nbaplayer/nbaplayer-usatoday/0291.htm","Jason Richardson had just six points in 24 minutes on Tuesday night, mostly due to foul trouble."
"/media/edimar/SAMSUNG/doutorado04/bases/SWDE/nbaplayer/nbaplayer-usatoday/0396.htm",Pistons rookies DaJuan Summers and Austin Daye each shot 1-of-7 off the bench in Tuesday's loss to the Bobcats.
"/media/edimar/SAMSUNG/doutorado04/bases/SWDE/nbaplayer/nbaplayer-usatoday/0275.htm","Rudy Fernandez (pelvic contusion) returned to action for the Blazers on Sunday, scoring six points in 11 minutes off the bench."
"/media/edimar/SAMSUNG/doutorado04/bases/SWDE/nbaplayer/nbaplayer-usatoday/0281.htm",Robin Lopez (knee) could return to full team practices as soon as next week.
"/media/edimar/SAMSUNG/doutorado04/bases/SWDE/nbaplayer/nbaplayer-usatoday/0198.htm","Craig Smith scored eight points on 3-of-5 shooting with four rebounds, no assists, and two steals in 22 minutes on Tuesday."
"/media/edimar/SAMSUNG/doutorado04/bases/SWDE/nbaplayer/nbaplayer-usatoday/0359.htm","Manny Harris tweeted Thursday that he made the Cavs' roster, which means that Danny Green will likely be cut."
"/media/edimar/SAMSUNG/doutorado04/bases/SWDE/nbaplayer/nbaplayer-usatoday/0336.htm",Kris Humphries scored eight points on 3-of-7 shooting with seven rebounds and five assists in 24 minutes of action on Tuesday.
"/media/edimar/SAMSUNG/doutorado04/bases/SWDE/nbaplayer/nbaplayer-usatoday/0194.htm",Jarron Collins is reportedly planning to sign with the Clippers.
"/media/edimar/SAMSUNG/doutorado04/bases/SWDE/nbaplayer/nbaplayer-usatoday/0332.htm",Troy Murphy was a DNP-CD for Tuesday's loss to the Hawks.
"/media/edimar/SAMSUNG/doutorado04/bases/SWDE/nbaplayer/nbaplayer-usatoday/0205.htm","Willie Warren could build off his career-high 17 minutes played on Friday, if Eric Bledsoe (ankle) and Randy Foye (hamstring) cannot play on Sunday."
"/media/edimar/SAMSUNG/doutorado04/bases/SWDE/nbaplayer/nbaplayer-usatoday/0352.htm",Antawn Jamison said he has made no trade demands.
"/media/edimar/SAMSUNG/doutorado04/bases/SWDE/nbaplayer/nbaplayer-usatoday/0199.htm",Brian Cook has been suspended for two games after a flagrant foul on Joel Przybilla and subsequent scuffle against the Blazers on Sunday.
"/media/edimar/SAMSUNG/doutorado04/bases/SWDE/nbaplayer/nbaplayer-usatoday/0197.htm","Al-Farouq Aminu's struggles continued on Monday, as he scored just three points on 1-of-3 shooting with two rebounds and a 3-pointer in 18 minutes."
"/media/edimar/SAMSUNG/doutorado04/bases/SWDE/nbaplayer/nbaplayer-usatoday/0131.htm","Arron Afflalo made a series of clutch shots on his way to a career-high 25 points on Sunday, making 10-of-14 FGs, including 3-of-5 from downtown."
"/media/edimar/SAMSUNG/doutorado04/bases/SWDE/nbaplayer/nbaplayer-usatoday/0061.htm","Ed Davis played 17 minutes off the bench on Sunday and collected six points, eight rebounds, one steal and one turnover."
"/media/edimar/SAMSUNG/doutorado04/bases/SWDE/nbaplayer/nbaplayer-usatoday/0399.htm","Charlie Villanueva, who will miss Tuesday's game for personal reasons, is expected back for Wednesday's game at New Orleans."
"/media/edimar/SAMSUNG/doutorado04/bases/SWDE/nbaplayer/nbaplayer-usatoday/0062.htm",Swingman Julian Wright was traded from the Hornets to the Raptors on Wednesday.
"/media/edimar/SAMSUNG/doutorado04/bases/SWDE/nbaplayer/nbaplayer-usatoday/0278.htm",Andre Miller was suspended for Tuesday's game for his involvement in a mini-altercation in Sunday's game against the Clippers.
"/media/edimar/SAMSUNG/doutorado04/bases/SWDE/nbaplayer/nbaplayer-usatoday/0068.htm","Jose Calderon is averaging 11.9 points, 8.0 assists, 1.6 steals and 1.3 3-pointers in the eight games since Jarrett Jack has been traded."
"/media/edimar/SAMSUNG/doutorado04/bases/SWDE/nbaplayer/nbaplayer-usatoday/0145.htm","Reggie Williams scored just six points in 15 minutes of action on Saturday,"
"/media/edimar/SAMSUNG/doutorado04/bases/SWDE/nbaplayer/nbaplayer-usatoday/0337.htm",Coach Avery Johnson hinted that rookie Derrick Favors may join the starting lineup at some point soon.
"/media/edimar/SAMSUNG/doutorado04/bases/SWDE/nbaplayer/nbaplayer-usatoday/0225.htm",Thunder PF/C Nick Collison did not play on Sunday because of poor matchups.
"/media/edimar/SAMSUNG/doutorado04/bases/SWDE/nbaplayer/nbaplayer-usatoday/0123.htm",Carmelo Anthony admitted Tuesday night that he is still feeling the effects of that cold.
"/media/edimar/SAMSUNG/doutorado04/bases/SWDE/nbaplayer/nbaplayer-usatoday/0231.htm","James Harden came off the bench for 20 points, four boards and three assists in Friday's loss to the Raptors."
"/media/edimar/SAMSUNG/doutorado04/bases/SWDE/nbaplayer/nbaplayer-usatoday/0126.htm",Gary Forbes played just four minutes on Monday night while J.R. Smith saw 16 minutes.
"/media/edimar/SAMSUNG/doutorado04/bases/SWDE/nbaplayer/nbaplayer-usatoday/0378.htm",Coach Mike D'Antoni said Ronny Turiaf won't be re-entering the starting lineup.
"/media/edimar/SAMSUNG/doutorado04/bases/SWDE/nbaplayer/nbaplayer-usatoday/0064.htm",Reggie Evans is expected to be sidelined for approximately eight weeks after having surgery on his fractured foot.
"/media/edimar/SAMSUNG/doutorado04/bases/SWDE/nbaplayer/nbaplayer-usatoday/0224.htm","Nenad Krstic scored a season-high 18 points on 8-of-12 shooting with six rebounds, one assist, and one block on Monday."
"/media/edimar/SAMSUNG/doutorado04/bases/SWDE/nbaplayer/nbaplayer-usatoday/0270.htm",Blazers assigned first-round F Luke Babbitt to the Idaho Stampede of the NBADL.
"/media/edimar/SAMSUNG/doutorado04/bases/SWDE/nbaplayer/nbaplayer-usatoday/0071.htm","Sonny Weems played just 19 minutes in Monday's blowout loss, scoring eight points on 3-of-10 shooting with five rebounds, one assist, and two steals."
"/media/edimar/SAMSUNG/doutorado04/bases/SWDE/nbaplayer/nbaplayer-usatoday/0220.htm",Tony Allen has fallen out of the Grizzlies' rotation.
"/media/edimar/SAMSUNG/doutorado04/bases/SWDE/nbaplayer/nbaplayer-usatoday/0340.htm",Quinton Ross returned to action from a calf injury on Friday but played just 28 seconds.
"/media/edimar/SAMSUNG/doutorado04/bases/SWDE/nbaplayer/nbaplayer-usatoday/0335.htm",Coach Avery Johnson confirmed that Joe Smith will start at power forward in Wednesday's season opener.
"/media/edimar/SAMSUNG/doutorado04/bases/SWDE/nbaplayer/nbaplayer-usatoday/0398.htm",Coach John Kuester said he would like to use Tayshaun Prince at power forward a lot.
"/media/edimar/SAMSUNG/doutorado04/bases/SWDE/nbaplayer/nbaplayer-usatoday/0380.htm","Timofey Mozgov had five points, six boards and three blocks in Saturday's loss to the Hawks."
"/media/edimar/SAMSUNG/doutorado04/bases/SWDE/nbaplayer/nbaplayer-usatoday/0140.htm",Jeff Adrien hit 6-of-11 shots for 12 points and eight rebounds in 31 minutes off the Warriors bench on Friday.
"/media/edimar/SAMSUNG/doutorado04/bases/SWDE/nbaplayer/nbaplayer-usatoday/0235.htm","Thabo Sefolosha scored 13 points on 5-of-5 shooting with 11 rebounds, three assists, and one steal in 36 minutes on Monday."
"/media/edimar/SAMSUNG/doutorado04/bases/SWDE/nbaplayer/nbaplayer-usatoday/0392.htm",Chris Wilcox made his season debut for the Pistons on Wednesday and had four points in three minutes.
"/media/edimar/SAMSUNG/doutorado04/bases/SWDE/nbaplayer/nbaplayer-usatoday/0201.htm",Randy Foye (hamstring) did not practice on Tuesday and we're calling him questionable for Wednesday's game against the Spurs.
"/media/edimar/SAMSUNG/doutorado04/bases/SWDE/nbaplayer/nbaplayer-usatoday/0093.htm",The Wizards are unlikely to sign second-round pick Hamady Ndiaye for the upcoming season.
"/media/edimar/SAMSUNG/doutorado04/bases/SWDE/nbaplayer/nbaplayer-usatoday/0229.htm",Daequan Cook hit three 3-pointers to score 13 points on 5-of-9 shooting Wednesday.
"/media/edimar/SAMSUNG/doutorado04/bases/SWDE/nbaplayer/nbaplayer-usatoday/0143.htm","Charlie Bell has been traded to the Warriors, along with Dan Gadzuric, in exchange for Corey Maggette."
"/media/edimar/SAMSUNG/doutorado04/bases/SWDE/nbaplayer/nbaplayer-usatoday/0282.htm",The Suns have invited center Garret Siler to training camp on an unguaranteed contract.
"/media/edimar/SAMSUNG/doutorado04/bases/SWDE/nbaplayer/nbaplayer-usatoday/0333.htm",Nets center Johan Petro is averaging a mere 0.8 points and 2.2 rebounds this season.
"/media/edimar/SAMSUNG/doutorado04/bases/SWDE/nbaplayer/nbaplayer-usatoday/0104.htm",Gilbert Arenas admitted he did not know if he will stick in the starting lineup.
"/media/edimar/SAMSUNG/doutorado04/bases/SWDE/nbaplayer/nbaplayer-usatoday/0283.htm",The Suns are not expected to pick up Earl Clark's extension.
"/media/edimar/SAMSUNG/doutorado04/bases/SWDE/nbaplayer/nbaplayer-usatoday/0230.htm","Russell Westbrook hit 14-of-32 shots for 38 points, 15 rebounds, nine assists and three steals in Wednesday's triple-overtime win over the Nets."
"/media/edimar/SAMSUNG/doutorado04/bases/SWDE/nbaplayer/nbaplayer-usatoday/0358.htm",The Cleveland Plain Dealer speculates that coach Byron Scott may insert Daniel Gibson into the starting five in place of Anthony Parker.
"/media/edimar/SAMSUNG/doutorado04/bases/SWDE/nbaplayer/nbaplayer-usatoday/0222.htm","B.J. Mullens, the No. 24 overall draft pick in 2009, will get the start at center for Tuesday's preseason game against the Grizzlies."
"/media/edimar/SAMSUNG/doutorado04/bases/SWDE/nbaplayer/nbaplayer-usatoday/0384.htm",Wilson Chandler will get another start at PF on Monday despite the return of Ronny Turiaf.
"/media/edimar/SAMSUNG/doutorado04/bases/SWDE/nbaplayer/nbaplayer-usatoday/0060.htm",The Raptors assigned rookie center Solomon Alabi to the D-League.
"/media/edimar/SAMSUNG/doutorado04/bases/SWDE/nbaplayer/nbaplayer-usatoday/0216.htm","Mike Conley hit 10-of-13 shots for the second straight night Wednesday, finishing with 22 points and nine assists in a loss to the Hawks."
"/media/edimar/SAMSUNG/doutorado04/bases/SWDE/nbaplayer/nbaplayer-usatoday/0090.htm",Hilton Armstrong returned from a one-game suspension on Friday and had six points and three rebounds in 12 minutes.
"/media/edimar/SAMSUNG/doutorado04/bases/SWDE/nbaplayer/nbaplayer-usatoday/0402.htm",Pistons guard Will Bynum was dropped from the rotation on Sunday for the second game in a row.
"/media/edimar/SAMSUNG/doutorado04/bases/SWDE/nbaplayer/nbaplayer-usatoday/0386.htm",Toney Douglas scored 11 points on 4-of-7 shooting (including a three) with six rebounds and no assists in 20 minutes off the bench on Monday.
"/media/edimar/SAMSUNG/doutorado04/bases/SWDE/nbaplayer/nbaplayer-usatoday/0070.htm",Peja Stojakovic is not traveling with the Raptors due to his knee injury and will miss his fourth straight game on Monday.
"/media/edimar/SAMSUNG/doutorado04/bases/SWDE/nbaplayer/nbaplayer-usatoday/0207.htm","Baron Davis (hamstring) will be a game-time decision for Wednesday's game against the Lakers, based on how he feels after the team's shootaround."
"/media/edimar/SAMSUNG/doutorado04/bases/SWDE/nbaplayer/nbaplayer-usatoday/0063.htm","Amir Johnson scored 15 points on 7-of-13 shooting with nine rebounds, two assists, and a steal in 28 minutes on Monday."
"/media/edimar/SAMSUNG/doutorado04/bases/SWDE/nbaplayer/nbaplayer-usatoday/0343.htm",Nets recalled Terrence Williams from the Springfield Armor of the NBADL.
"/media/edimar/SAMSUNG/doutorado04/bases/SWDE/nbaplayer/nbaplayer-usatoday/0129.htm",The Nuggets have officially re-signed 12-year NBA veteran Anthony Carter.
"/media/edimar/SAMSUNG/doutorado04/bases/SWDE/nbaplayer/nbaplayer-usatoday/0388.htm",Landry Fields has been named the Eastern Conference Rookie of the Month for November.
"/media/edimar/SAMSUNG/doutorado04/bases/SWDE/nbaplayer/nbaplayer-usatoday/0133.htm","J.R. Smith scored 14 points on 5-of-9 shooting (including four treys) with three rebounds, no assists, and two steals on Tuesday."
"/media/edimar/SAMSUNG/doutorado04/bases/SWDE/nbaplayer/nbaplayer-usatoday/0264.htm","LaMarcus Aldridge had 16 points and 15 rebounds, but hit just 6-of-17 shots in Friday's loss at Washington."
"/media/edimar/SAMSUNG/doutorado04/bases/SWDE/nbaplayer/nbaplayer-usatoday/0269.htm","Dante Cunningham played 19 minutes off the bench on Thursday, recording just one point, two rebounds and one assist."
"/media/edimar/SAMSUNG/doutorado04/bases/SWDE/nbaplayer/nbaplayer-usatoday/0350.htm",Cavaliers rookie Samardo Samuels missed the end of Tuesday's practice because of cramping. He was given fluids and will be fine.
"/media/edimar/SAMSUNG/doutorado04/bases/SWDE/nbaplayer/nbaplayer-usatoday/0232.htm",Eric Maynor hit 4-of-6 shots for 10 points and two steals in Wednesday's preseason game.
"/media/edimar/SAMSUNG/doutorado04/bases/SWDE/nbaplayer/nbaplayer-usatoday/0209.htm",Darrell Arthur came back from a knee injury and had seven points and four rebounds in 19 minutes on Friday.
"/media/edimar/SAMSUNG/doutorado04/bases/SWDE/nbaplayer/nbaplayer-usatoday/0385.htm",Bill Walker (knee) will not play in Monday's game against the Wolves.
"/media/edimar/SAMSUNG/doutorado04/bases/SWDE/nbaplayer/nbaplayer-usatoday/0356.htm","Joey Graham returned to the Cavaliers lineup on Sunday, after missing Saturday's game with a stomach virus."
"/media/edimar/SAMSUNG/doutorado04/bases/SWDE/nbaplayer/nbaplayer-usatoday/0136.htm","David Lee scored 20 points on 9-of-22 shooting with eight rebounds, seven assists, and one steal on Tuesday."
"/media/edimar/SAMSUNG/doutorado04/bases/SWDE/nbaplayer/nbaplayer-usatoday/0339.htm","Nets forward Travis Outlaw scored just seven points on 2-of-9 shooting in Sunday's victory, the fourth straight game he's been held to single-digits."
"/media/edimar/SAMSUNG/doutorado04/bases/SWDE/nbaplayer/nbaplayer-usatoday/0223.htm",The Thunder recalled rookie Cole Aldrich from the D-League on Monday.
"/media/edimar/SAMSUNG/doutorado04/bases/SWDE/nbaplayer/nbaplayer-usatoday/0347.htm",Cavaliers coach Byron Scott is considering sweeping lineup changes in light of his team's recent struggles.
"/media/edimar/SAMSUNG/doutorado04/bases/SWDE/nbaplayer/nbaplayer-usatoday/0344.htm",The Nets have signed G/F Stephen Graham to a two-year deal.
"/media/edimar/SAMSUNG/doutorado04/bases/SWDE/nbaplayer/nbaplayer-usatoday/0351.htm","Byron Scott is reportedly thinking about changing the starting lineup for the Cavaliers, but gave no hints as to what he might do."
"/media/edimar/SAMSUNG/doutorado04/bases/SWDE/nbaplayer/nbaplayer-usatoday/0204.htm","Eric Bledsoe scored 15 points on 4-of-12 shooting (including two threes) with three rebounds, three assists, and a steal on Monday."
"/media/edimar/SAMSUNG/doutorado04/bases/SWDE/nbaplayer/nbaplayer-usatoday/0387.htm",Andy Rautins (knee bruise) is expected to be ready for training camp.
"/media/edimar/SAMSUNG/doutorado04/bases/SWDE/nbaplayer/nbaplayer-usatoday/0095.htm","Wizards big man Trevor Booker scored a career-high nine points on Sunday, playing 13 minutes off the bench."
"/media/edimar/SAMSUNG/doutorado04/bases/SWDE/nbaplayer/nbaplayer-usatoday/0234.htm",Royal Ivey missed Friday's game for personal reasons.
"/media/edimar/SAMSUNG/doutorado04/bases/SWDE/nbaplayer/nbaplayer-usatoday/0059.htm","Joey Dorsey started and played 19 minutes on Sunday, scoring nine points on 4-of-6 shooting with six rebounds and two assists."
"/media/edimar/SAMSUNG/doutorado04/bases/SWDE/nbaplayer/nbaplayer-usatoday/0268.htm","Joel Przybilla played 10 minutes off the bench on Tuesday, scoring two points with four rebounds."
"/media/edimar/SAMSUNG/doutorado04/bases/SWDE/nbaplayer/nbaplayer-usatoday/0138.htm",Brandon Wright (back) will not play against the Suns Thursday night.
"/media/edimar/SAMSUNG/doutorado04/bases/SWDE/nbaplayer/nbaplayer-usatoday/0089.htm","Andray Blatche is a late scratch for Tuesday's game due to a hip contusion, and Yi Jianlian will start in his place."
