URL,EXTRACTED VALUE
"/media/edimar/SAMSUNG/doutorado04/bases/SWDE/nbaplayer/nbaplayer-usatoday/0166.htm","This is pretty good news for owners of Kevin Love and Darko Milicic, as they will be very difficult to take off the court now."
"/media/edimar/SAMSUNG/doutorado04/bases/SWDE/nbaplayer/nbaplayer-usatoday/0050.htm","He's another solid veteran tutor off the bench, but has no shot at serious playing time with Brandon Bass ready for a bigger role this season."
"/media/edimar/SAMSUNG/doutorado04/bases/SWDE/nbaplayer/nbaplayer-usatoday/0155.htm",Taylor is clearly the low man on the totem pole in Houston and he's unlikely to crack the rotation any time soon.
"/media/edimar/SAMSUNG/doutorado04/bases/SWDE/nbaplayer/nbaplayer-usatoday/0070.htm",Stojakovic has missed the last three games and is more trouble than he's worth right now.
"/media/edimar/SAMSUNG/doutorado04/bases/SWDE/nbaplayer/nbaplayer-usatoday/0041.htm",He played one minute on Friday when the Pacers lost Mike Dunleavy and were without T.J. Ford and Danny Granger.
"/media/edimar/SAMSUNG/doutorado04/bases/SWDE/nbaplayer/nbaplayer-usatoday/0305.htm","He's got a chance to land on another roster before the end of the season, but it's clear he won't ever become an everyday player."
"/media/edimar/SAMSUNG/doutorado04/bases/SWDE/nbaplayer/nbaplayer-usatoday/0010.htm",The Celtics are declining to put a timetable on West's return. Coach Doc Rivers has said he is hopeful the combo guard can contribute in the playoffs.
"/media/edimar/SAMSUNG/doutorado04/bases/SWDE/nbaplayer/nbaplayer-usatoday/0220.htm",Allen will be fine to play his defensive stopper role for the start of the season. He'll need injuries in front of him to be a fantasy factor.
"/media/edimar/SAMSUNG/doutorado04/bases/SWDE/nbaplayer/nbaplayer-usatoday/0194.htm","He's a starter in name only, and this is a good measure of what to expect in terms of playing time, and needless to say he is not a fantasy option."
"/media/edimar/SAMSUNG/doutorado04/bases/SWDE/nbaplayer/nbaplayer-usatoday/0205.htm",The shooting guard will simply be trying to make the team's final roster this fall.
"/media/edimar/SAMSUNG/doutorado04/bases/SWDE/nbaplayer/nbaplayer-usatoday/0201.htm","He has not fantasy value, especially with Baron Davis on his way back from knee and conditioning issues."
"/media/edimar/SAMSUNG/doutorado04/bases/SWDE/nbaplayer/nbaplayer-usatoday/0001.htm","Davis has played well as of late, scoring in double figures in four of his last five games. He's worth owning in deep leagues."
"/media/edimar/SAMSUNG/doutorado04/bases/SWDE/nbaplayer/nbaplayer-usatoday/0214.htm","If Gasol and Randolph are going to miss time, Young will be worth a look in some fantasy leagues."
"/media/edimar/SAMSUNG/doutorado04/bases/SWDE/nbaplayer/nbaplayer-usatoday/0350.htm","Samuels is 6'9, 260 lbs and could see spot minutes filling out Cleveland's sparse bench. Just don't expect him to have any fantasy relevance."
"/media/edimar/SAMSUNG/doutorado04/bases/SWDE/nbaplayer/nbaplayer-usatoday/0333.htm","As long as Lopez is healthy, forget about Petro."
"/media/edimar/SAMSUNG/doutorado04/bases/SWDE/nbaplayer/nbaplayer-usatoday/0076.htm","That gets their roster down to 15. Skinner wasn't needed because the Bucks are very deep, albeit undersized, on the front line."
"/media/edimar/SAMSUNG/doutorado04/bases/SWDE/nbaplayer/nbaplayer-usatoday/0003.htm","Being that it's merely soreness (as of right now), the injury doesn't sound serious. Consider him day-to-day."
"/media/edimar/SAMSUNG/doutorado04/bases/SWDE/nbaplayer/nbaplayer-usatoday/0057.htm",He played just 41 seconds and has no fantasy value.
"/media/edimar/SAMSUNG/doutorado04/bases/SWDE/nbaplayer/nbaplayer-usatoday/0283.htm",He is averaging under three points per game this season and is not worth fantasy consideration.
"/media/edimar/SAMSUNG/doutorado04/bases/SWDE/nbaplayer/nbaplayer-usatoday/0309.htm","Elson's minutes have been fairly regular, but he doesn't offer fantasy value and his long-term outlook is bleak with Mehmet Okur returning eventually."
"/media/edimar/SAMSUNG/doutorado04/bases/SWDE/nbaplayer/nbaplayer-usatoday/0164.htm","Koufos has no fantasy value as long as Darko (neck, shoulder) is starting for the Wolves."
"/media/edimar/SAMSUNG/doutorado04/bases/SWDE/nbaplayer/nbaplayer-usatoday/0344.htm",Graham is an affordable rotation player who can fill either wing position and plays hard-nosed defense.
"/media/edimar/SAMSUNG/doutorado04/bases/SWDE/nbaplayer/nbaplayer-usatoday/0112.htm",Cardinal entered Dallas' radar when Tim Thomas retired and it sounds like this is nearly a done deal.
"/media/edimar/SAMSUNG/doutorado04/bases/SWDE/nbaplayer/nbaplayer-usatoday/0123.htm","Karl is in good health after overcoming throat/neck cancer last year, and is closing in on 1,000 coaching victories."
"/media/edimar/SAMSUNG/doutorado04/bases/SWDE/nbaplayer/nbaplayer-usatoday/0260.htm","After a 12-3-4 line in his Hornets debut, he has not eclipsed four points or two assists in four games since. Needless to say, he should not be owned."
"/media/edimar/SAMSUNG/doutorado04/bases/SWDE/nbaplayer/nbaplayer-usatoday/0293.htm","Until he proves he can stay in the rotation for at least 2-3 games, he should be left on waivers."
"/media/edimar/SAMSUNG/doutorado04/bases/SWDE/nbaplayer/nbaplayer-usatoday/0300.htm","Anderson headed to Junction City, Ark. and might not be able to make it back by tipoff."
"/media/edimar/SAMSUNG/doutorado04/bases/SWDE/nbaplayer/nbaplayer-usatoday/0219.htm",He'll backup Mike Conley but won't have any fantasy value unless Conley goes down.
