URL,EXTRACTED VALUE
"/media/edimar/SAMSUNG/doutorado04/bases/SWDE/nbaplayer/nbaplayer-usatoday/0114.htm","Frankly, we're surprised he produced this much. He is the starter in name only and should not be paid attention to in fantasy leagues."
"/media/edimar/SAMSUNG/doutorado04/bases/SWDE/nbaplayer/nbaplayer-usatoday/0009.htm","He has no fantasy value, especially with the return of Delonte West from suspension."
"/media/edimar/SAMSUNG/doutorado04/bases/SWDE/nbaplayer/nbaplayer-usatoday/0312.htm","He didn't have his A game, but played and at least put up some big-man numbers for his owners."
"/media/edimar/SAMSUNG/doutorado04/bases/SWDE/nbaplayer/nbaplayer-usatoday/0155.htm",Taylor is clearly the low man on the totem pole in Houston and he's unlikely to crack the rotation any time soon.
"/media/edimar/SAMSUNG/doutorado04/bases/SWDE/nbaplayer/nbaplayer-usatoday/0412.htm","Even with Udonis Haslem (foot) possibly out some time, he's much too old and ineffective to be worth a pickup unless he shows some signs of life."
"/media/edimar/SAMSUNG/doutorado04/bases/SWDE/nbaplayer/nbaplayer-usatoday/0305.htm","He's got a chance to land on another roster before the end of the season, but it's clear he won't ever become an everyday player."
"/media/edimar/SAMSUNG/doutorado04/bases/SWDE/nbaplayer/nbaplayer-usatoday/0010.htm",The Celtics are declining to put a timetable on West's return. Coach Doc Rivers has said he is hopeful the combo guard can contribute in the playoffs.
"/media/edimar/SAMSUNG/doutorado04/bases/SWDE/nbaplayer/nbaplayer-usatoday/0021.htm","Gibson's role will be minor even if he plays. Carlos Boozer is back, sending Gibson to fantasy waiver wires."
"/media/edimar/SAMSUNG/doutorado04/bases/SWDE/nbaplayer/nbaplayer-usatoday/0220.htm",Allen will be fine to play his defensive stopper role for the start of the season. He'll need injuries in front of him to be a fantasy factor.
"/media/edimar/SAMSUNG/doutorado04/bases/SWDE/nbaplayer/nbaplayer-usatoday/0340.htm",Ross isn't really part of New Jersey's rotation so it's hard to know where the injury ends and the DNP-CD begins.
"/media/edimar/SAMSUNG/doutorado04/bases/SWDE/nbaplayer/nbaplayer-usatoday/0201.htm","He has not fantasy value, especially with Baron Davis on his way back from knee and conditioning issues."
"/media/edimar/SAMSUNG/doutorado04/bases/SWDE/nbaplayer/nbaplayer-usatoday/0392.htm",Wilcox won't see enough minutes to make any kind of meaningful fantasy impact; his return only jeopardizes Austin Daye's playing time.
"/media/edimar/SAMSUNG/doutorado04/bases/SWDE/nbaplayer/nbaplayer-usatoday/0331.htm","He played well in summer league for Cleveland, but is not a lock to make the team's opening-night roster."
"/media/edimar/SAMSUNG/doutorado04/bases/SWDE/nbaplayer/nbaplayer-usatoday/0001.htm","Davis has played well as of late, scoring in double figures in four of his last five games. He's worth owning in deep leagues."
"/media/edimar/SAMSUNG/doutorado04/bases/SWDE/nbaplayer/nbaplayer-usatoday/0214.htm","If Gasol and Randolph are going to miss time, Young will be worth a look in some fantasy leagues."
"/media/edimar/SAMSUNG/doutorado04/bases/SWDE/nbaplayer/nbaplayer-usatoday/0143.htm",Bell's absence was not a distraction and had nothing to do with the Bucks' season-ending loss. He'll return next season as a bit player off the bench.
"/media/edimar/SAMSUNG/doutorado04/bases/SWDE/nbaplayer/nbaplayer-usatoday/0333.htm","As long as Lopez is healthy, forget about Petro."
"/media/edimar/SAMSUNG/doutorado04/bases/SWDE/nbaplayer/nbaplayer-usatoday/0076.htm","That gets their roster down to 15. Skinner wasn't needed because the Bucks are very deep, albeit undersized, on the front line."
"/media/edimar/SAMSUNG/doutorado04/bases/SWDE/nbaplayer/nbaplayer-usatoday/0298.htm",Jefferson rebounded from a dismal shooting performance on Friday when he scored just two points while going 0-for-4 from the field.
"/media/edimar/SAMSUNG/doutorado04/bases/SWDE/nbaplayer/nbaplayer-usatoday/0171.htm","Remember when he was the starting shooting guard this season? Yeah, good times."
"/media/edimar/SAMSUNG/doutorado04/bases/SWDE/nbaplayer/nbaplayer-usatoday/0003.htm","Being that it's merely soreness (as of right now), the injury doesn't sound serious. Consider him day-to-day."
"/media/edimar/SAMSUNG/doutorado04/bases/SWDE/nbaplayer/nbaplayer-usatoday/0376.htm","He was never in doubt of missing tonight's game, but the injury is worth keeping an eye on."
"/media/edimar/SAMSUNG/doutorado04/bases/SWDE/nbaplayer/nbaplayer-usatoday/0283.htm",He is averaging under three points per game this season and is not worth fantasy consideration.
"/media/edimar/SAMSUNG/doutorado04/bases/SWDE/nbaplayer/nbaplayer-usatoday/0081.htm","He's been starting since Carlos Delfino went down with a concussion, but this was easily his best game in weeks. Continue to ignore him."
"/media/edimar/SAMSUNG/doutorado04/bases/SWDE/nbaplayer/nbaplayer-usatoday/0310.htm","He plays a very small role off the bench, so fantasy owners should spend their time looking elsewhere."
"/media/edimar/SAMSUNG/doutorado04/bases/SWDE/nbaplayer/nbaplayer-usatoday/0381.htm","Shockingly, Curry is not expected to play Saturday."
"/media/edimar/SAMSUNG/doutorado04/bases/SWDE/nbaplayer/nbaplayer-usatoday/0208.htm","He�s been struggling this season, but righted the ship tonight."
"/media/edimar/SAMSUNG/doutorado04/bases/SWDE/nbaplayer/nbaplayer-usatoday/0164.htm","Koufos has no fantasy value as long as Darko (neck, shoulder) is starting for the Wolves."
"/media/edimar/SAMSUNG/doutorado04/bases/SWDE/nbaplayer/nbaplayer-usatoday/0177.htm","When Beasley returns he will likely go back to the bench, making him mostly unusable in fantasy leagues."
"/media/edimar/SAMSUNG/doutorado04/bases/SWDE/nbaplayer/nbaplayer-usatoday/0313.htm","Bell is not a guy fantasy owners should be after, but teammate C.J. Miles, who comes off the bench, is."
"/media/edimar/SAMSUNG/doutorado04/bases/SWDE/nbaplayer/nbaplayer-usatoday/0249.htm","Ron Artest has said that he will play Wednesday, so Barnes probably isn't worth a look in most formats."
"/media/edimar/SAMSUNG/doutorado04/bases/SWDE/nbaplayer/nbaplayer-usatoday/0357.htm","He was out after his wife had a baby, but looked great tonight. If you're in an extremely deep league, he's worth keeping an eye on."
"/media/edimar/SAMSUNG/doutorado04/bases/SWDE/nbaplayer/nbaplayer-usatoday/0051.htm",Get him on the bench if you can.
"/media/edimar/SAMSUNG/doutorado04/bases/SWDE/nbaplayer/nbaplayer-usatoday/0243.htm","He is expected to play on Tuesday, and while he isn't a fantasy option himself he will take a few minutes away from the rest of the backcourt."
"/media/edimar/SAMSUNG/doutorado04/bases/SWDE/nbaplayer/nbaplayer-usatoday/0112.htm",Cardinal entered Dallas' radar when Tim Thomas retired and it sounds like this is nearly a done deal.
"/media/edimar/SAMSUNG/doutorado04/bases/SWDE/nbaplayer/nbaplayer-usatoday/0260.htm","After a 12-3-4 line in his Hornets debut, he has not eclipsed four points or two assists in four games since. Needless to say, he should not be owned."
"/media/edimar/SAMSUNG/doutorado04/bases/SWDE/nbaplayer/nbaplayer-usatoday/0364.htm",Najera will be ready to go for a towel-waiving role come Opening Night.
"/media/edimar/SAMSUNG/doutorado04/bases/SWDE/nbaplayer/nbaplayer-usatoday/0293.htm","Until he proves he can stay in the rotation for at least 2-3 games, he should be left on waivers."
"/media/edimar/SAMSUNG/doutorado04/bases/SWDE/nbaplayer/nbaplayer-usatoday/0219.htm",He'll backup Mike Conley but won't have any fantasy value unless Conley goes down.
"/media/edimar/SAMSUNG/doutorado04/bases/SWDE/nbaplayer/nbaplayer-usatoday/0090.htm",Armstrong will not play in Wednesday's game against the Raptors. JaVale McGee will pick up a few extra minutes despite his bad back.
"/media/edimar/SAMSUNG/doutorado04/bases/SWDE/nbaplayer/nbaplayer-usatoday/0156.htm","Budinger still has a chance to become a deep-league sleeper at some point this season, but it hasn't been a great run thus far."
"/media/edimar/SAMSUNG/doutorado04/bases/SWDE/nbaplayer/nbaplayer-usatoday/0166.htm","This is pretty good news for owners of Kevin Love and Darko Milicic, as they will be very difficult to take off the court now."
"/media/edimar/SAMSUNG/doutorado04/bases/SWDE/nbaplayer/nbaplayer-usatoday/0212.htm",This was his best line in some time and could be a sign that he's about ready to turn it on again.
"/media/edimar/SAMSUNG/doutorado04/bases/SWDE/nbaplayer/nbaplayer-usatoday/0097.htm","He'll be relevant again, but will be worked back into the mix slowly. And once Josh Howard makes his season debut, Thorntons' value should disappear."
"/media/edimar/SAMSUNG/doutorado04/bases/SWDE/nbaplayer/nbaplayer-usatoday/0195.htm","He's starting to finally play well, but Chris Kaman is due back this weekend, meaning Jordan's run will likely be over before it truly begins."
"/media/edimar/SAMSUNG/doutorado04/bases/SWDE/nbaplayer/nbaplayer-usatoday/0256.htm","West missed Friday's game due to illness, but is apparently feeling better after using the day between games to rest."
"/media/edimar/SAMSUNG/doutorado04/bases/SWDE/nbaplayer/nbaplayer-usatoday/0014.htm","Obviously it's nothing serious, but worth keeping an eye on."
"/media/edimar/SAMSUNG/doutorado04/bases/SWDE/nbaplayer/nbaplayer-usatoday/0324.htm",Jackson won't see much run in Sacramento.
"/media/edimar/SAMSUNG/doutorado04/bases/SWDE/nbaplayer/nbaplayer-usatoday/0050.htm","He's another solid veteran tutor off the bench, but has no shot at serious playing time with Brandon Bass ready for a bigger role this season."
"/media/edimar/SAMSUNG/doutorado04/bases/SWDE/nbaplayer/nbaplayer-usatoday/0253.htm","If he was somehow dropped in your league, and we've seen him on some waiver wires after a bad opening night, go get him."
"/media/edimar/SAMSUNG/doutorado04/bases/SWDE/nbaplayer/nbaplayer-usatoday/0026.htm","Korver is not a must-own guy, but is worth a look if you need threes."
"/media/edimar/SAMSUNG/doutorado04/bases/SWDE/nbaplayer/nbaplayer-usatoday/0180.htm",He means more to the Hawks as a backup big man than he does in fantasy leagues.
"/media/edimar/SAMSUNG/doutorado04/bases/SWDE/nbaplayer/nbaplayer-usatoday/0386.htm",He has lost all of his momentum after a decent start to the year. Leave him on the wire but be ready to grab him if he heats up.
"/media/edimar/SAMSUNG/doutorado04/bases/SWDE/nbaplayer/nbaplayer-usatoday/0363.htm","Tyrus Thomas started in the last one for matchup reasons, but Mohammed was back at center tonight and played well against the undersized Rockets."
"/media/edimar/SAMSUNG/doutorado04/bases/SWDE/nbaplayer/nbaplayer-usatoday/0041.htm",He played one minute on Friday when the Pacers lost Mike Dunleavy and were without T.J. Ford and Danny Granger.
"/media/edimar/SAMSUNG/doutorado04/bases/SWDE/nbaplayer/nbaplayer-usatoday/0070.htm",Stojakovic has missed the last three games and is more trouble than he's worth right now.
"/media/edimar/SAMSUNG/doutorado04/bases/SWDE/nbaplayer/nbaplayer-usatoday/0267.htm","He'd been out with an ankle injury, not that it matters in fantasyland. There's also no guarantees that he plays."
"/media/edimar/SAMSUNG/doutorado04/bases/SWDE/nbaplayer/nbaplayer-usatoday/0275.htm",He didn't return and should be considered day-to-day for now.
"/media/edimar/SAMSUNG/doutorado04/bases/SWDE/nbaplayer/nbaplayer-usatoday/0413.htm","He looked spry enough in his time on the court, but we'll still have to see if he can do it for 20 minutes before we're adding him in deep leagues."
"/media/edimar/SAMSUNG/doutorado04/bases/SWDE/nbaplayer/nbaplayer-usatoday/0129.htm","He's a solid role player for Denver, but won't offer fantasy value."
"/media/edimar/SAMSUNG/doutorado04/bases/SWDE/nbaplayer/nbaplayer-usatoday/0410.htm",He will be the starter in name only and will not get the minutes to be a viable option in most fantasy leagues.
"/media/edimar/SAMSUNG/doutorado04/bases/SWDE/nbaplayer/nbaplayer-usatoday/0194.htm","He's a starter in name only, and this is a good measure of what to expect in terms of playing time, and needless to say he is not a fantasy option."
"/media/edimar/SAMSUNG/doutorado04/bases/SWDE/nbaplayer/nbaplayer-usatoday/0130.htm",Billups doesn't need to risk aggravating any of his injuries at practice. He'll be ready for his usual 31-34 minutes.
"/media/edimar/SAMSUNG/doutorado04/bases/SWDE/nbaplayer/nbaplayer-usatoday/0247.htm","Fisher was a borderline PG option in fantasy leagues last season, and as long as Blake is around he's probably not worth owning."
"/media/edimar/SAMSUNG/doutorado04/bases/SWDE/nbaplayer/nbaplayer-usatoday/0146.htm",He's been a joy to own this year and things only figure to get better with David Lee back in the lineup.
"/media/edimar/SAMSUNG/doutorado04/bases/SWDE/nbaplayer/nbaplayer-usatoday/0205.htm",The shooting guard will simply be trying to make the team's final roster this fall.
"/media/edimar/SAMSUNG/doutorado04/bases/SWDE/nbaplayer/nbaplayer-usatoday/0254.htm","Mbenga has a couple rings and tends to be a fan favorite, but it's hard to imagine him getting much run for the Hornets."
"/media/edimar/SAMSUNG/doutorado04/bases/SWDE/nbaplayer/nbaplayer-usatoday/0027.htm","He had logged just six minutes with only an assist to his credit, so needless to say his one-game run as a fantasy stud has come to an end."
"/media/edimar/SAMSUNG/doutorado04/bases/SWDE/nbaplayer/nbaplayer-usatoday/0350.htm","Samuels is 6'9, 260 lbs and could see spot minutes filling out Cleveland's sparse bench. Just don't expect him to have any fantasy relevance."
"/media/edimar/SAMSUNG/doutorado04/bases/SWDE/nbaplayer/nbaplayer-usatoday/0101.htm","He played 40 minutes, which is great news, but he still doesn't look fully healthy or comfortable. Keep him in your lineup until further notice."
"/media/edimar/SAMSUNG/doutorado04/bases/SWDE/nbaplayer/nbaplayer-usatoday/0169.htm",He moved around well at shootaround and should be in owners' lineups.
"/media/edimar/SAMSUNG/doutorado04/bases/SWDE/nbaplayer/nbaplayer-usatoday/0232.htm","X-rays didn't reveal a break, which is great news, but his summer-league action could already be over."
"/media/edimar/SAMSUNG/doutorado04/bases/SWDE/nbaplayer/nbaplayer-usatoday/0209.htm",Arthur injured himself while lifting weights after Monday's practice. Zach Randolph will play at least 40 minutes a night while Arthur is out.
"/media/edimar/SAMSUNG/doutorado04/bases/SWDE/nbaplayer/nbaplayer-usatoday/0057.htm",He played just 41 seconds and has no fantasy value.
"/media/edimar/SAMSUNG/doutorado04/bases/SWDE/nbaplayer/nbaplayer-usatoday/0356.htm","J.J. Hickson is also out, with Leon Powe and Jawad Williams drawing the start. Jamario Moon should pick up minutes, as well."
"/media/edimar/SAMSUNG/doutorado04/bases/SWDE/nbaplayer/nbaplayer-usatoday/0309.htm","Elson's minutes have been fairly regular, but he doesn't offer fantasy value and his long-term outlook is bleak with Mehmet Okur returning eventually."
"/media/edimar/SAMSUNG/doutorado04/bases/SWDE/nbaplayer/nbaplayer-usatoday/0233.htm","Darren Collison, Chris Paul and Marcus Thornton all played more minutes, and we're guessing Peterson's run is about to come to an end."
"/media/edimar/SAMSUNG/doutorado04/bases/SWDE/nbaplayer/nbaplayer-usatoday/0154.htm","Go ahead and get him into your lineups, but if you have better options the flu could be used as a tie-breaker between him and another player."
"/media/edimar/SAMSUNG/doutorado04/bases/SWDE/nbaplayer/nbaplayer-usatoday/0424.htm",He is buried on the depth chart and would need multiple injuries in front of him to have value in fantasy leagues.
"/media/edimar/SAMSUNG/doutorado04/bases/SWDE/nbaplayer/nbaplayer-usatoday/0344.htm",Graham is an affordable rotation player who can fill either wing position and plays hard-nosed defense.
"/media/edimar/SAMSUNG/doutorado04/bases/SWDE/nbaplayer/nbaplayer-usatoday/0234.htm","Ivey will be a third-string point guard, but the Thunder are going to have to make another move, as this gives them 16 players under contract."
"/media/edimar/SAMSUNG/doutorado04/bases/SWDE/nbaplayer/nbaplayer-usatoday/0261.htm","Green is a career 42% shooter, and we'll file this under Reasons the Hornets traded for Jarrett Jack."
"/media/edimar/SAMSUNG/doutorado04/bases/SWDE/nbaplayer/nbaplayer-usatoday/0285.htm",Sunday's game was just a case of Dudley doing more with his 18-20 minutes per night than he typically does. You can leave him alone.
"/media/edimar/SAMSUNG/doutorado04/bases/SWDE/nbaplayer/nbaplayer-usatoday/0075.htm",Brockman was a long shot to see more than five minutes a game anyway.
"/media/edimar/SAMSUNG/doutorado04/bases/SWDE/nbaplayer/nbaplayer-usatoday/0123.htm","Karl is in good health after overcoming throat/neck cancer last year, and is closing in on 1,000 coaching victories."
"/media/edimar/SAMSUNG/doutorado04/bases/SWDE/nbaplayer/nbaplayer-usatoday/0300.htm","Anderson headed to Junction City, Ark. and might not be able to make it back by tipoff."
"/media/edimar/SAMSUNG/doutorado04/bases/SWDE/nbaplayer/nbaplayer-usatoday/0096.htm","Yi still settles for too many jumpshots (he shot 6-of-14), and his bench role further limits his fantasy potential."
