URL,EXTRACTED VALUE
"/media/edimar/SAMSUNG/doutorado04/bases/SWDE/nbaplayer/nbaplayer-usatoday/0086.htm",The Nets are expected to save $3.3 million by waiving backup PG Keyon Dooling before June 29th.
"/media/edimar/SAMSUNG/doutorado04/bases/SWDE/nbaplayer/nbaplayer-usatoday/0191.htm","Jeff Teague was held scoreless in 13 minutes of action on Monday, going 0-for-3 from the field with one rebound and one block."
"/media/edimar/SAMSUNG/doutorado04/bases/SWDE/nbaplayer/nbaplayer-usatoday/0251.htm",Aaron Gray was back in the lineup Wednesday night after missing Monday due to a gastro-intestinal infection.
"/media/edimar/SAMSUNG/doutorado04/bases/SWDE/nbaplayer/nbaplayer-usatoday/0149.htm","Yao Ming (leg) and Aaron Brooks (ankle) are still weeks away from returning, according to coach Rick Adelman."
"/media/edimar/SAMSUNG/doutorado04/bases/SWDE/nbaplayer/nbaplayer-usatoday/0378.htm",Ronny Turiaf (knee) is officially out for Friday's game.
"/media/edimar/SAMSUNG/doutorado04/bases/SWDE/nbaplayer/nbaplayer-usatoday/0064.htm","According to Raptors radio play-by-play man Paul Jones, Reggie Evans has a non-displaced fracture of the fifth metatarsal on his right foot."
"/media/edimar/SAMSUNG/doutorado04/bases/SWDE/nbaplayer/nbaplayer-usatoday/0032.htm",Pacers center Jeff Foster (sprained right ankle) is on schedule to return to the lineup next week.
"/media/edimar/SAMSUNG/doutorado04/bases/SWDE/nbaplayer/nbaplayer-usatoday/0303.htm",Kings swingman Ime Udoka is inactive on Tuesday because of a sprained left knee and left ankle.
"/media/edimar/SAMSUNG/doutorado04/bases/SWDE/nbaplayer/nbaplayer-usatoday/0142.htm",The Warriors are said to be on the verge of signing undrafted PG Jeremy Lin.
"/media/edimar/SAMSUNG/doutorado04/bases/SWDE/nbaplayer/nbaplayer-usatoday/0034.htm","Paul George came off the bench for 10 points, six rebounds, two assists and two 3-pointers on 4-of-10 shooting Wednesday."
"/media/edimar/SAMSUNG/doutorado04/bases/SWDE/nbaplayer/nbaplayer-usatoday/0270.htm",Luke Babbitt missed most of the Trail Blazers� summer-league practice Monday due to a right foot injury.
"/media/edimar/SAMSUNG/doutorado04/bases/SWDE/nbaplayer/nbaplayer-usatoday/0227.htm",Kevin Durant (knee) is listed as day-to-day.
"/media/edimar/SAMSUNG/doutorado04/bases/SWDE/nbaplayer/nbaplayer-usatoday/0010.htm",Delonte West suffered a broken right wrist on a hard fall on Wednesday.
"/media/edimar/SAMSUNG/doutorado04/bases/SWDE/nbaplayer/nbaplayer-usatoday/0220.htm",Former Celtics swingman Tony Allen is officially taking his talents to Memphis.
"/media/edimar/SAMSUNG/doutorado04/bases/SWDE/nbaplayer/nbaplayer-usatoday/0340.htm",Quinton Ross was traded to the Nets in exchange for Yi Jianlian.
"/media/edimar/SAMSUNG/doutorado04/bases/SWDE/nbaplayer/nbaplayer-usatoday/0008.htm",Avery Bradley will be shut down until his surgically repaired ankle is healthy according to coach Doc Rivers.
"/media/edimar/SAMSUNG/doutorado04/bases/SWDE/nbaplayer/nbaplayer-usatoday/0012.htm",Veteran SG Von Wafer officially signed a 10-day contract with the Mavericks on Wednesday.
"/media/edimar/SAMSUNG/doutorado04/bases/SWDE/nbaplayer/nbaplayer-usatoday/0335.htm",Hawks coach Mike Woodson regrets his decision to use just six players in the second half of Friday's game.
"/media/edimar/SAMSUNG/doutorado04/bases/SWDE/nbaplayer/nbaplayer-usatoday/0379.htm","Anthony Randolph played just seven minutes Wednesday, finishing with zero points and three rebounds against the Warriors."
"/media/edimar/SAMSUNG/doutorado04/bases/SWDE/nbaplayer/nbaplayer-usatoday/0044.htm",Dwight Howard (stomach virus) has officially been ruled out of Friday's game.
"/media/edimar/SAMSUNG/doutorado04/bases/SWDE/nbaplayer/nbaplayer-usatoday/0429.htm",Andres Nocioni will start at small forward Tuesday night with Andre Iguodala (Achilles) out.
"/media/edimar/SAMSUNG/doutorado04/bases/SWDE/nbaplayer/nbaplayer-usatoday/0330.htm","Kings PG Luther Head finished Sunday's game with 11 points on 4-of-4 shooting, nailing all three of his 3-point attempts in 37 minutes."
"/media/edimar/SAMSUNG/doutorado04/bases/SWDE/nbaplayer/nbaplayer-usatoday/0392.htm",Chris Wilcox (hamstring) will sit out again on Friday when the Pistons face the Thunder.
"/media/edimar/SAMSUNG/doutorado04/bases/SWDE/nbaplayer/nbaplayer-usatoday/0201.htm",Coach Vinny Del Negro said that Randy Foye (hamstring) is unlikely to play on Monday.
"/media/edimar/SAMSUNG/doutorado04/bases/SWDE/nbaplayer/nbaplayer-usatoday/0085.htm",Carlos Delfino (neck/concussion) will not play in Wednesday's game against the Cavs.
"/media/edimar/SAMSUNG/doutorado04/bases/SWDE/nbaplayer/nbaplayer-usatoday/0037.htm","Point guard A.J. Price, recovering from knee surgery, should be ready for the start of training camp."
"/media/edimar/SAMSUNG/doutorado04/bases/SWDE/nbaplayer/nbaplayer-usatoday/0417.htm","Heat coach Erik Spoelstra said that PG Mario Chalmers is not in our doghouse, and described Chalmers' inactivity as circumstantial."
"/media/edimar/SAMSUNG/doutorado04/bases/SWDE/nbaplayer/nbaplayer-usatoday/0092.htm","Draft prospect Kevin Seraphin will miss 2-3 weeks with a minor knee injury, which essentially prevents him from working out for NBA teams."
"/media/edimar/SAMSUNG/doutorado04/bases/SWDE/nbaplayer/nbaplayer-usatoday/0214.htm",Sam Young was hot from the floor Friday night shooting a blazing 7-of-8 from the floor and 5-of-6 from the line to finish with 19 points.
"/media/edimar/SAMSUNG/doutorado04/bases/SWDE/nbaplayer/nbaplayer-usatoday/0125.htm","Renaldo Balkman is hoping to return to practice Friday, a key step towards recovery from a bulging disk in his back."
"/media/edimar/SAMSUNG/doutorado04/bases/SWDE/nbaplayer/nbaplayer-usatoday/0020.htm","James Johnson (foot) returned to action on Tuesday, but scored just two points in four minutes off the bench."
"/media/edimar/SAMSUNG/doutorado04/bases/SWDE/nbaplayer/nbaplayer-usatoday/0390.htm","The Bulls are still looking at free agents Roger Mason Jr. and Keith Bogans, according to beat writer Mike McGraw."
"/media/edimar/SAMSUNG/doutorado04/bases/SWDE/nbaplayer/nbaplayer-usatoday/0242.htm","As expected, Luke Walton (hamstring) will be inactive for Tuesday's season opener."
"/media/edimar/SAMSUNG/doutorado04/bases/SWDE/nbaplayer/nbaplayer-usatoday/0252.htm",David Andersen (back) sat out the Raptors' exhibition on Sunday.
"/media/edimar/SAMSUNG/doutorado04/bases/SWDE/nbaplayer/nbaplayer-usatoday/0171.htm",Wayne Ellington (bruised thigh) will not play for the Wolves on Friday.
"/media/edimar/SAMSUNG/doutorado04/bases/SWDE/nbaplayer/nbaplayer-usatoday/0341.htm",Devin Harris (strained knee) is considered probable for Sunday's game vs. Boston.
"/media/edimar/SAMSUNG/doutorado04/bases/SWDE/nbaplayer/nbaplayer-usatoday/0362.htm","DeSagana Diop was held from Wednesday night's game but this was due to coach's decision, not injury."
"/media/edimar/SAMSUNG/doutorado04/bases/SWDE/nbaplayer/nbaplayer-usatoday/0159.htm",Aaron Brooks (ankle) was cleared to remove his protective boot Sunday.
"/media/edimar/SAMSUNG/doutorado04/bases/SWDE/nbaplayer/nbaplayer-usatoday/0262.htm",Marcus Thornton logged eight minutes off the Hornets bench on Sunday.
"/media/edimar/SAMSUNG/doutorado04/bases/SWDE/nbaplayer/nbaplayer-usatoday/0310.htm",Jazz rookie Jeremy Evans (sprained right wrist) is day-to-day -- X-rays came back negative.
"/media/edimar/SAMSUNG/doutorado04/bases/SWDE/nbaplayer/nbaplayer-usatoday/0122.htm","Former Hornets big man Melvin Ely will join the Nuggets during training camp this year, as they look to fill out their frontcourt rotation."
"/media/edimar/SAMSUNG/doutorado04/bases/SWDE/nbaplayer/nbaplayer-usatoday/0435.htm",Jason Kapono started Wednesday's opener but recorded two points in just 12 minutes.
"/media/edimar/SAMSUNG/doutorado04/bases/SWDE/nbaplayer/nbaplayer-usatoday/0087.htm",Earl Boykins (virus) is out for Friday's game against the Blazers.
"/media/edimar/SAMSUNG/doutorado04/bases/SWDE/nbaplayer/nbaplayer-usatoday/0073.htm","Andrew Bogut (back) and Larry Sanders will start on Saturday against the Magic, while Drew Gooden (foot) will not play."
"/media/edimar/SAMSUNG/doutorado04/bases/SWDE/nbaplayer/nbaplayer-usatoday/0051.htm",Mickael Pietrus (leg) returned to practice on Wednesday and is expected to play on Thursday against the Suns.
"/media/edimar/SAMSUNG/doutorado04/bases/SWDE/nbaplayer/nbaplayer-usatoday/0222.htm",B.J. Mullens was called up from the D-League on Monday.
"/media/edimar/SAMSUNG/doutorado04/bases/SWDE/nbaplayer/nbaplayer-usatoday/0112.htm",Veteran forward Brian Cardinal is expected to rejoin the Timberwolves on Tuesday for the final three weeks of the season.
"/media/edimar/SAMSUNG/doutorado04/bases/SWDE/nbaplayer/nbaplayer-usatoday/0244.htm",Sasha Vujacic (concussion) will be re-evaluated on Monday.
"/media/edimar/SAMSUNG/doutorado04/bases/SWDE/nbaplayer/nbaplayer-usatoday/0002.htm","Celtic C Semih Erden had two points, two blocks and three rebounds in his NBA debut Tuesday night."
"/media/edimar/SAMSUNG/doutorado04/bases/SWDE/nbaplayer/nbaplayer-usatoday/0017.htm","Kurt Thomas started at center in place of injured Andrew Bogut on Tuesday, getting four points, 14 rebounds, two assists and one block in 32 minutes."
"/media/edimar/SAMSUNG/doutorado04/bases/SWDE/nbaplayer/nbaplayer-usatoday/0364.htm",Eduardo Najera has been traded from Dallas to Charlotte in the Tyson Chandler deal.
"/media/edimar/SAMSUNG/doutorado04/bases/SWDE/nbaplayer/nbaplayer-usatoday/0060.htm","The Celtics are reportedly keen on Florida State center Solomon Alabi, who got the highest-ever score on their IQ test."
"/media/edimar/SAMSUNG/doutorado04/bases/SWDE/nbaplayer/nbaplayer-usatoday/0272.htm","The Blazers have a decision to make with regard to a logjam at the guard position, which in part involves Armon Johnson and Patrick Mills."
"/media/edimar/SAMSUNG/doutorado04/bases/SWDE/nbaplayer/nbaplayer-usatoday/0134.htm",Dan Gadzuric will miss Wednesday's game with back spasms.
"/media/edimar/SAMSUNG/doutorado04/bases/SWDE/nbaplayer/nbaplayer-usatoday/0237.htm","Theo Ratliff will have arthroscopic surgery on his sore left knee, and no timetable for his return has been announced."
"/media/edimar/SAMSUNG/doutorado04/bases/SWDE/nbaplayer/nbaplayer-usatoday/0324.htm",The Cavs recalled forward Darnell Jackson from the D-League.
"/media/edimar/SAMSUNG/doutorado04/bases/SWDE/nbaplayer/nbaplayer-usatoday/0026.htm",Kyle Korver could miss some time for the Bulls due to a right knee injury.
"/media/edimar/SAMSUNG/doutorado04/bases/SWDE/nbaplayer/nbaplayer-usatoday/0402.htm",Will Bynum has been ruled out for Tuesday due to a hamstring injury.
"/media/edimar/SAMSUNG/doutorado04/bases/SWDE/nbaplayer/nbaplayer-usatoday/0386.htm","Toney Douglas missed all five of his shots in 28 minutes on Saturday, finishing with two points in a loss to the Hawks."
"/media/edimar/SAMSUNG/doutorado04/bases/SWDE/nbaplayer/nbaplayer-usatoday/0070.htm",Peja Stojakovic (knee) did not practice on Monday.
"/media/edimar/SAMSUNG/doutorado04/bases/SWDE/nbaplayer/nbaplayer-usatoday/0275.htm","Rudy Fernandez played just 15 minutes on Saturday, scoring four points on 1-of-6 shooting with no rebounds, three assists, and a 3-pointer."
"/media/edimar/SAMSUNG/doutorado04/bases/SWDE/nbaplayer/nbaplayer-usatoday/0281.htm",Robin Lopez is now expected to miss several weeks with moderate sprains of his MCL and PCL in his left knee.
"/media/edimar/SAMSUNG/doutorado04/bases/SWDE/nbaplayer/nbaplayer-usatoday/0372.htm",Bobcats SG Gerald Henderson has inflammation in his left knee and it's unclear when he'll return to action.
"/media/edimar/SAMSUNG/doutorado04/bases/SWDE/nbaplayer/nbaplayer-usatoday/0018.htm","Impending free agent Brian Scalabrine is expected to garner interest from the Nets and Sixers, according to Yahoo."
"/media/edimar/SAMSUNG/doutorado04/bases/SWDE/nbaplayer/nbaplayer-usatoday/0052.htm",Jameer Nelson is out for the Magic on Friday due to the flu.
"/media/edimar/SAMSUNG/doutorado04/bases/SWDE/nbaplayer/nbaplayer-usatoday/0343.htm",Terrence Williams will not be recalled from the NBADL despite Devin Harris' knee injury.
"/media/edimar/SAMSUNG/doutorado04/bases/SWDE/nbaplayer/nbaplayer-usatoday/0178.htm","Etan Thomas sat out again on Saturday, though it's not clear if he's injured or just out of the rotation."
"/media/edimar/SAMSUNG/doutorado04/bases/SWDE/nbaplayer/nbaplayer-usatoday/0349.htm","Cavaliers head coach Byron Scott was fined $35,000 for publicly criticizing game officials following the team's 111-100 loss at Orlando on Friday."
"/media/edimar/SAMSUNG/doutorado04/bases/SWDE/nbaplayer/nbaplayer-usatoday/0393.htm","Jason Maxiell will start for the Pistons again on Thursday, raising doubt if Austin Daye will even play."
"/media/edimar/SAMSUNG/doutorado04/bases/SWDE/nbaplayer/nbaplayer-usatoday/0247.htm",The Lakers have officially announced the re-signing of Derek Fisher on Wednesday.
"/media/edimar/SAMSUNG/doutorado04/bases/SWDE/nbaplayer/nbaplayer-usatoday/0321.htm",Rookie PF/C Hassan Whiteside has missed the last four days of practice due to a strained patellar tendon.
"/media/edimar/SAMSUNG/doutorado04/bases/SWDE/nbaplayer/nbaplayer-usatoday/0027.htm",C.J. Watson (quad) returned to action on Tuesday night.
"/media/edimar/SAMSUNG/doutorado04/bases/SWDE/nbaplayer/nbaplayer-usatoday/0273.htm",Patty Mills and Jeff Pendergraph will likely be waived by the Blazers.
"/media/edimar/SAMSUNG/doutorado04/bases/SWDE/nbaplayer/nbaplayer-usatoday/0165.htm","Nikola Pekovic notched his first career double-double on Sunday, scoring 12 points on 3-of-9 shooting with 11 rebounds in 21 minutes off the bench."
"/media/edimar/SAMSUNG/doutorado04/bases/SWDE/nbaplayer/nbaplayer-usatoday/0108.htm",Alexis Ajinca's torn ligament in his right thumb will keep him out more than six weeks.
"/media/edimar/SAMSUNG/doutorado04/bases/SWDE/nbaplayer/nbaplayer-usatoday/0049.htm","Magic PF Ryan Anderson will no longer be starting for Orlando, even against bigger opponents."
"/media/edimar/SAMSUNG/doutorado04/bases/SWDE/nbaplayer/nbaplayer-usatoday/0257.htm","The Spanish team Caja Laboral has released Pops Mensah-Bonsu, possibly because of a knee injury."
"/media/edimar/SAMSUNG/doutorado04/bases/SWDE/nbaplayer/nbaplayer-usatoday/0188.htm",Joe Johnson woke up with a sore right (shooting) elbow and is questionable for Wednesday's game against the Grizzlies.
"/media/edimar/SAMSUNG/doutorado04/bases/SWDE/nbaplayer/nbaplayer-usatoday/0241.htm",The Lakers have signed second-round draft pick Derrick Caracter to a two-year contract.
"/media/edimar/SAMSUNG/doutorado04/bases/SWDE/nbaplayer/nbaplayer-usatoday/0258.htm","Marco Belinelli scored 18 points on 6-of-9 shooting (with four 3-pointers) to go with three rebounds, no assists, and one steal on Saturday."
"/media/edimar/SAMSUNG/doutorado04/bases/SWDE/nbaplayer/nbaplayer-usatoday/0385.htm",Bill Walker (ankle) did not play in Saturday's preseason game against the Celtics.
"/media/edimar/SAMSUNG/doutorado04/bases/SWDE/nbaplayer/nbaplayer-usatoday/0426.htm",Darius Songaila will play in Wednesday's game against the Grizzlies.
"/media/edimar/SAMSUNG/doutorado04/bases/SWDE/nbaplayer/nbaplayer-usatoday/0054.htm",J.J. Redick will miss Wednesday's game due to a stomach virus.
"/media/edimar/SAMSUNG/doutorado04/bases/SWDE/nbaplayer/nbaplayer-usatoday/0240.htm",West Virginia forward Devin Ebanks has declared for the NBA Draft.
"/media/edimar/SAMSUNG/doutorado04/bases/SWDE/nbaplayer/nbaplayer-usatoday/0223.htm",Cole Aldrich missed Thursday's preseason game due to an injured shoulder.
"/media/edimar/SAMSUNG/doutorado04/bases/SWDE/nbaplayer/nbaplayer-usatoday/0077.htm",Corey Maggette (ankle) said he will play against the Nuggets on Wednesday.
"/media/edimar/SAMSUNG/doutorado04/bases/SWDE/nbaplayer/nbaplayer-usatoday/0062.htm","Julian Wright saw his playing time taken down to 23 minutes on Thursday, and he finished with just two points, two rebounds, two assists, and a block."
"/media/edimar/SAMSUNG/doutorado04/bases/SWDE/nbaplayer/nbaplayer-usatoday/0098.htm",Nick Young (bruised thigh) will be inactive for Friday's game vs. the Trail Blazers.
"/media/edimar/SAMSUNG/doutorado04/bases/SWDE/nbaplayer/nbaplayer-usatoday/0011.htm","Nate Robinson (sore left foot) is the latest Celtics guard to battle an injury, though he plans to keep playing."
"/media/edimar/SAMSUNG/doutorado04/bases/SWDE/nbaplayer/nbaplayer-usatoday/0004.htm",Jermaine O'Neal will not play this week and doesn't sound anywhere close to a return from knee soreness.
"/media/edimar/SAMSUNG/doutorado04/bases/SWDE/nbaplayer/nbaplayer-usatoday/0351.htm","Jamario Moon hit 4-of-8 shots and two 3-pointers for 10 points, five rebounds, an assist, a steal and block in Wednesday's win."
"/media/edimar/SAMSUNG/doutorado04/bases/SWDE/nbaplayer/nbaplayer-usatoday/0406.htm",Tracy McGrady left Friday's game after just six minutes due to soreness in his legs.
"/media/edimar/SAMSUNG/doutorado04/bases/SWDE/nbaplayer/nbaplayer-usatoday/0059.htm",Joey Dorsey was reinstated from his suspension on Wednesday.
"/media/edimar/SAMSUNG/doutorado04/bases/SWDE/nbaplayer/nbaplayer-usatoday/0138.htm",Warriors forward Brandan Wright is not traveling with the team to L.A. because of a lower back strain.
"/media/edimar/SAMSUNG/doutorado04/bases/SWDE/nbaplayer/nbaplayer-usatoday/0300.htm",The Spurs signed swingman James Anderson to a contract on Friday.
