URL,EXTRACTED VALUE
"/media/edimar/SAMSUNG/doutorado04/bases/SWDE/nbaplayer/nbaplayer-usatoday/0161.htm",Kevin Martin (flu) will play on Saturday against the Bulls.
"/media/edimar/SAMSUNG/doutorado04/bases/SWDE/nbaplayer/nbaplayer-usatoday/0009.htm",Marquis Daniels (personal) is likely out for Wednesday's game against the Wizards.
"/media/edimar/SAMSUNG/doutorado04/bases/SWDE/nbaplayer/nbaplayer-usatoday/0288.htm",Coach Alvin Gentry does not appear concerned about the foot sprain Grant Hill suffered in Wednesday's practice.
"/media/edimar/SAMSUNG/doutorado04/bases/SWDE/nbaplayer/nbaplayer-usatoday/0402.htm",Will Bynum (hamstring) will play on Friday against the Bobcats.
"/media/edimar/SAMSUNG/doutorado04/bases/SWDE/nbaplayer/nbaplayer-usatoday/0420.htm","Carlos Arroyo is the only point guard in the Heat's rotation, and coach Erik Spoelstra intends to keep it that way."
"/media/edimar/SAMSUNG/doutorado04/bases/SWDE/nbaplayer/nbaplayer-usatoday/0423.htm",Marreese Speights had two points and 11 rebounds off the bench in Wednesday's win over the Pacers.
"/media/edimar/SAMSUNG/doutorado04/bases/SWDE/nbaplayer/nbaplayer-usatoday/0399.htm","Charlie Villanueva had 15 points, eight rebounds, three 3-pointers, a steal and a block in Friday's win."
"/media/edimar/SAMSUNG/doutorado04/bases/SWDE/nbaplayer/nbaplayer-usatoday/0081.htm","Luc Richard Mbah a Moute was held scoreless on 0-for-4 shooting with three rebounds, one assist, and one steal in 24 minutes on Tuesday."
"/media/edimar/SAMSUNG/doutorado04/bases/SWDE/nbaplayer/nbaplayer-usatoday/0133.htm","J.R. Smith is officially out of the doghouse in Denver and had 21 points, four rebounds and three 3-pointers on 6-of-10 shooting on Friday."
"/media/edimar/SAMSUNG/doutorado04/bases/SWDE/nbaplayer/nbaplayer-usatoday/0174.htm",Luke Ridnour is expected to regain his starting job starting Wednesday night.
"/media/edimar/SAMSUNG/doutorado04/bases/SWDE/nbaplayer/nbaplayer-usatoday/0007.htm","Ray Allen had season-high 25 points, three 3-pointers, three rebounds, three assists and two steals in Friday's win."
"/media/edimar/SAMSUNG/doutorado04/bases/SWDE/nbaplayer/nbaplayer-usatoday/0063.htm","Amir Johnson quietly had a perfect night with 14 points, nine rebounds, a steal and a block in 31 minutes of Friday's win."
"/media/edimar/SAMSUNG/doutorado04/bases/SWDE/nbaplayer/nbaplayer-usatoday/0025.htm",Keith Bogans (back) is a game-time decision for Wednesday's preseason game against the Raptors.
