URL,EXTRACTED VALUE
"/media/edimar/SAMSUNG/doutorado04/bases/SWDE/nbaplayer/nbaplayer-usatoday/0086.htm",Keyon Dooling had 18 points and five assists off the Bucks bench on Wednesday in 25 minutes.
"/media/edimar/SAMSUNG/doutorado04/bases/SWDE/nbaplayer/nbaplayer-usatoday/0036.htm","Darren Collison was able to walk off the ankle/leg injury he suffered late in Monday's win over the Raptors, according to Indycornrows.com."
"/media/edimar/SAMSUNG/doutorado04/bases/SWDE/nbaplayer/nbaplayer-usatoday/0253.htm","Emeka Okafor hit 12-of-13 shots for a season high 26 points, 13 rebounds and a block against Joel Anthony, Chris Bosh and the Heat on Friday."
"/media/edimar/SAMSUNG/doutorado04/bases/SWDE/nbaplayer/nbaplayer-usatoday/0419.htm","Eddie House was furious at Daniel Gibson both during and following Thursday's game, and had to be talked out of a physical confrontation."
"/media/edimar/SAMSUNG/doutorado04/bases/SWDE/nbaplayer/nbaplayer-usatoday/0010.htm",Delonte West (wrist) said his cast will be removed in two weeks and he expects to return during the regular season.
"/media/edimar/SAMSUNG/doutorado04/bases/SWDE/nbaplayer/nbaplayer-usatoday/0220.htm",Tony Allen has fallen out of the Grizzlies' rotation.
"/media/edimar/SAMSUNG/doutorado04/bases/SWDE/nbaplayer/nbaplayer-usatoday/0410.htm","Joel Anthony started and logged 24 minutes on Sunday, collecting one point, three rebounds, four blocks and a steal."
"/media/edimar/SAMSUNG/doutorado04/bases/SWDE/nbaplayer/nbaplayer-usatoday/0398.htm",Coach John Kuester said he would like to use Tayshaun Prince at power forward a lot.
"/media/edimar/SAMSUNG/doutorado04/bases/SWDE/nbaplayer/nbaplayer-usatoday/0365.htm",Kwame Brown scored 12 points on 4-of-6 shooting with seven boards and one assist in 21 minutes off the bench on Saturday.
"/media/edimar/SAMSUNG/doutorado04/bases/SWDE/nbaplayer/nbaplayer-usatoday/0035.htm","Tyler Hansbrough played just seven minutes on Monday, finishing with four points on 2-of-2 shooting with no other statistics."
"/media/edimar/SAMSUNG/doutorado04/bases/SWDE/nbaplayer/nbaplayer-usatoday/0352.htm",Antawn Jamison said he has made no trade demands.
"/media/edimar/SAMSUNG/doutorado04/bases/SWDE/nbaplayer/nbaplayer-usatoday/0199.htm",Brian Cook has been suspended for two games after a flagrant foul on Joel Przybilla and subsequent scuffle against the Blazers on Sunday.
"/media/edimar/SAMSUNG/doutorado04/bases/SWDE/nbaplayer/nbaplayer-usatoday/0029.htm","Solomon Jones had five points, six rebounds, a steal and two blocks on Friday."
"/media/edimar/SAMSUNG/doutorado04/bases/SWDE/nbaplayer/nbaplayer-usatoday/0131.htm","Arron Afflalo made a series of clutch shots on his way to a career-high 25 points on Sunday, making 10-of-14 FGs, including 3-of-5 from downtown."
"/media/edimar/SAMSUNG/doutorado04/bases/SWDE/nbaplayer/nbaplayer-usatoday/0232.htm",Eric Maynor hit 4-of-6 shots for 10 points and two steals in Wednesday's preseason game.
"/media/edimar/SAMSUNG/doutorado04/bases/SWDE/nbaplayer/nbaplayer-usatoday/0298.htm","Richard Jefferson had 15 points, 10 rebounds, a steal, two blocks and two 3-pointers on 5-of-13 shooting in Friday's win."
"/media/edimar/SAMSUNG/doutorado04/bases/SWDE/nbaplayer/nbaplayer-usatoday/0003.htm","Shaquille O�Neal is experiencing the same knee soreness that caused him to miss five games last month, though he's gamely playing through the pain."
"/media/edimar/SAMSUNG/doutorado04/bases/SWDE/nbaplayer/nbaplayer-usatoday/0385.htm",Bill Walker (knee) will not play in Monday's game against the Wolves.
"/media/edimar/SAMSUNG/doutorado04/bases/SWDE/nbaplayer/nbaplayer-usatoday/0356.htm","Joey Graham returned to the Cavaliers lineup on Sunday, after missing Saturday's game with a stomach virus."
"/media/edimar/SAMSUNG/doutorado04/bases/SWDE/nbaplayer/nbaplayer-usatoday/0339.htm","Nets forward Travis Outlaw scored just seven points on 2-of-9 shooting in Sunday's victory, the fourth straight game he's been held to single-digits."
"/media/edimar/SAMSUNG/doutorado04/bases/SWDE/nbaplayer/nbaplayer-usatoday/0347.htm",Cavaliers coach Byron Scott is considering sweeping lineup changes in light of his team's recent struggles.
"/media/edimar/SAMSUNG/doutorado04/bases/SWDE/nbaplayer/nbaplayer-usatoday/0187.htm","Maurice Evans went back to the bench for Monday's game, playing just 10 minutes without scoring with just one rebound to his credit."
"/media/edimar/SAMSUNG/doutorado04/bases/SWDE/nbaplayer/nbaplayer-usatoday/0351.htm","Byron Scott is reportedly thinking about changing the starting lineup for the Cavaliers, but gave no hints as to what he might do."
"/media/edimar/SAMSUNG/doutorado04/bases/SWDE/nbaplayer/nbaplayer-usatoday/0204.htm","Eric Bledsoe scored 15 points on 4-of-12 shooting (including two threes) with three rebounds, three assists, and a steal on Monday."
"/media/edimar/SAMSUNG/doutorado04/bases/SWDE/nbaplayer/nbaplayer-usatoday/0095.htm","Wizards big man Trevor Booker scored a career-high nine points on Sunday, playing 13 minutes off the bench."
"/media/edimar/SAMSUNG/doutorado04/bases/SWDE/nbaplayer/nbaplayer-usatoday/0337.htm",Coach Avery Johnson hinted that rookie Derrick Favors may join the starting lineup at some point soon.
"/media/edimar/SAMSUNG/doutorado04/bases/SWDE/nbaplayer/nbaplayer-usatoday/0225.htm",Thunder PF/C Nick Collison did not play on Sunday because of poor matchups.
"/media/edimar/SAMSUNG/doutorado04/bases/SWDE/nbaplayer/nbaplayer-usatoday/0384.htm",Wilson Chandler will get another start at PF on Monday despite the return of Ronny Turiaf.
"/media/edimar/SAMSUNG/doutorado04/bases/SWDE/nbaplayer/nbaplayer-usatoday/0126.htm",Gary Forbes played just four minutes on Monday night while J.R. Smith saw 16 minutes.
"/media/edimar/SAMSUNG/doutorado04/bases/SWDE/nbaplayer/nbaplayer-usatoday/0115.htm","J.J. Barea hit just 2-of-13 shots, but still managed nine points, six rebounds and six assists in Wednesday's loss to the Hornets."
