URL,EXTRACTED VALUE
"/media/edimar/SAMSUNG/doutorado04/bases/SWDE/nbaplayer/nbaplayer-usatoday/0114.htm",DeShawn Stevenson started at shooting guard on Wednesday but had just two points and three assists in 26 minutes.
"/media/edimar/SAMSUNG/doutorado04/bases/SWDE/nbaplayer/nbaplayer-usatoday/0433.htm",Coach Doug Collins said that he would rather not remove struggling rookie Evan Turner from the starting lineup.
"/media/edimar/SAMSUNG/doutorado04/bases/SWDE/nbaplayer/nbaplayer-usatoday/0324.htm",The Cavs recalled forward Darnell Jackson from the D-League.
"/media/edimar/SAMSUNG/doutorado04/bases/SWDE/nbaplayer/nbaplayer-usatoday/0019.htm",Carlos Boozer reported no soreness or pain in his right hand following his season debut on Wednesday.
"/media/edimar/SAMSUNG/doutorado04/bases/SWDE/nbaplayer/nbaplayer-usatoday/0175.htm","Sebastian Telfair played through ankle/foot pain and scored 11 points on 5-of-11 shooting with one rebound, one trey, and six assists on Monday."
"/media/edimar/SAMSUNG/doutorado04/bases/SWDE/nbaplayer/nbaplayer-usatoday/0408.htm",Chris Bosh had 21 points and six rebounds on 7-of-13 shooting in Wednesday's loss to the Magic.
"/media/edimar/SAMSUNG/doutorado04/bases/SWDE/nbaplayer/nbaplayer-usatoday/0317.htm","C.J. Miles had just six points in 20 minutes on Wednesday, but played very well."
"/media/edimar/SAMSUNG/doutorado04/bases/SWDE/nbaplayer/nbaplayer-usatoday/0368.htm",Boris Diaw scored a team-high 26 points on 11-of-17 shooting (4-of-8 from downtown) with two rebounds and six assists against the Suns on Saturday.
"/media/edimar/SAMSUNG/doutorado04/bases/SWDE/nbaplayer/nbaplayer-usatoday/0428.htm",Thaddeus Young scored 15 points on 7-of-8 shooting (including a three) with four rebounds and one assist in 24 minutes off the bench on Tuesday.
"/media/edimar/SAMSUNG/doutorado04/bases/SWDE/nbaplayer/nbaplayer-usatoday/0007.htm","Ray Allen hit 9-of-14 shots and four 3-pointers for 24 points, five rebounds, two assists and two steals in Wednesday's win over the Knicks."
"/media/edimar/SAMSUNG/doutorado04/bases/SWDE/nbaplayer/nbaplayer-usatoday/0025.htm",The Bulls signed veteran shooting guard Keith Bogans to a two-year deal on Wednesday.
"/media/edimar/SAMSUNG/doutorado04/bases/SWDE/nbaplayer/nbaplayer-usatoday/0027.htm",C.J. Watson (quad) returned to action on Tuesday night.
"/media/edimar/SAMSUNG/doutorado04/bases/SWDE/nbaplayer/nbaplayer-usatoday/0038.htm",Brandon Rush started over Mike Dunleavy on Wednesday night so he could guard Deron Williams.
"/media/edimar/SAMSUNG/doutorado04/bases/SWDE/nbaplayer/nbaplayer-usatoday/0320.htm",Coach Paul Westphal said that DeMarcus Cousins' playing time will not be affected by him getting kicked out of Monday's practice.
"/media/edimar/SAMSUNG/doutorado04/bases/SWDE/nbaplayer/nbaplayer-usatoday/0069.htm","Jerryd Bayless has a clearly defined role as Jose Calderon's backup, according to the Toronto Star."
"/media/edimar/SAMSUNG/doutorado04/bases/SWDE/nbaplayer/nbaplayer-usatoday/0061.htm","As expected, Raptors rookie Ed Davis (knee) will join the D-League's Erie BayHawks for a short-term rehabilitation and conditioning stint."
"/media/edimar/SAMSUNG/doutorado04/bases/SWDE/nbaplayer/nbaplayer-usatoday/0239.htm","Lamar Odom, bothered by a sore hand and foot, had 15 points, 14 rebounds and four assists on 5-of-8 shooting in Wednesday's win over the Pistons."
"/media/edimar/SAMSUNG/doutorado04/bases/SWDE/nbaplayer/nbaplayer-usatoday/0102.htm","Wizards coach Flip Saunders wasn't pleased with the performance of his three-guard lineup (John Wall, Gilbert Arenas, Kirk Hinrich) on Thursday."
"/media/edimar/SAMSUNG/doutorado04/bases/SWDE/nbaplayer/nbaplayer-usatoday/0221.htm",Serge Ibaka shot 7-of-7 from the field on Sunday for 16 points and added eight rebounds and three blocks despite playing only 23 minutes.
"/media/edimar/SAMSUNG/doutorado04/bases/SWDE/nbaplayer/nbaplayer-usatoday/0431.htm","Jrue Holiday racked up his third double-double of the season on Friday, finishing with 11 points, 13 assists and a steal on 5-of-12 shooting."
"/media/edimar/SAMSUNG/doutorado04/bases/SWDE/nbaplayer/nbaplayer-usatoday/0028.htm","Derrick Rose (neck) will play Saturday against the Kings, according to the Bulls' television crew."
"/media/edimar/SAMSUNG/doutorado04/bases/SWDE/nbaplayer/nbaplayer-usatoday/0345.htm",Jordan Farmar scored 14 points on 5-of-10 shooting (3-of-8 from downtown) with two rebounds and five assists in 27 minutes off the bench.
"/media/edimar/SAMSUNG/doutorado04/bases/SWDE/nbaplayer/nbaplayer-usatoday/0337.htm",Coach Avery Johnson said that Troy Murphy's return will not affect Derrick Favors' minutes going forward.
"/media/edimar/SAMSUNG/doutorado04/bases/SWDE/nbaplayer/nbaplayer-usatoday/0222.htm",B.J. Mullens was called up from the D-League on Monday.
"/media/edimar/SAMSUNG/doutorado04/bases/SWDE/nbaplayer/nbaplayer-usatoday/0089.htm","Andray Blatche left Thursday's game after being poked in both eyes while attempting a put-back, but he didn't sound concerned after the game."
"/media/edimar/SAMSUNG/doutorado04/bases/SWDE/nbaplayer/nbaplayer-usatoday/0115.htm",Owner Mark Cuban said the Mavericks will pick up J.J. Barea's team option for 2010/11.
