URL,EXTRACTED VALUE
"/media/Dados/bases/SWDE/job/job-careerbuilder/1013.htm",Strong customer service orientation
"/media/Dados/bases/SWDE/job/job-careerbuilder/0572.htm",�	Ability to configure the production AX environment
"/media/Dados/bases/SWDE/job/job-careerbuilder/0964.htm","Experience with Java / JavaBeans / Servlets /JSP, Perl 5.8, Apache Tomcat, and Informix V10/11x."
"/media/Dados/bases/SWDE/job/job-careerbuilder/1016.htm",Experience working with large objects (objects > 10GB) is a huge plus
"/media/Dados/bases/SWDE/job/job-careerbuilder/1186.htm","Lifting and transporting of heavy to moderately heavy objects, such as computers and peripherals."
"/media/Dados/bases/SWDE/job/job-careerbuilder/1097.htm","Practical working knowledge of Analysis & Design, unit test framework, test automation tools, approaches and techniques."
"/media/Dados/bases/SWDE/job/job-careerbuilder/1094.htm","Monitor application performance, recommends and executes performance improvements."
