URL,EXTRACTED VALUE
"/media/Dados/bases/SWDE/job/job-careerbuilder/0780.htm",Five (5) years experience working with business clients to gather business requirements for implementation into a computer application.
"/media/Dados/bases/SWDE/job/job-careerbuilder/1143.htm","* Pharmaceutical/Biotech supply chain operations, Supply/Network planning, validated manufacturing control networks, and contract manufacturing."
"/media/Dados/bases/SWDE/job/job-careerbuilder/0552.htm",’ to submit your resume for consideration. If you need further assistance please call
"/media/Dados/bases/SWDE/job/job-careerbuilder/0049.htm",Advanced analytical and quantitative skills
"/media/Dados/bases/SWDE/job/job-careerbuilder/0549.htm",", in word format, elaborating your projects in tune with the client’s requirement. These will assist us in placing you with one of our clients."
"/media/Dados/bases/SWDE/job/job-careerbuilder/1410.htm",973-598-3967
"/media/Dados/bases/SWDE/job/job-careerbuilder/1746.htm",You can also reach me at (925)467-0719
"/media/Dados/bases/SWDE/job/job-careerbuilder/0101.htm",to view more of our open positions.
"/media/Dados/bases/SWDE/job/job-careerbuilder/0411.htm",MS SQL Server
"/media/Dados/bases/SWDE/job/job-careerbuilder/1019.htm",to job #10770
"/media/Dados/bases/SWDE/job/job-careerbuilder/0056.htm",to view more of our open positions.
"/media/Dados/bases/SWDE/job/job-careerbuilder/0046.htm",discovery/analysis through implementation
"/media/Dados/bases/SWDE/job/job-careerbuilder/0100.htm",to view more of our open positions.
"/media/Dados/bases/SWDE/job/job-careerbuilder/1750.htm",You can also reach me at (925)467-0719
"/media/Dados/bases/SWDE/job/job-careerbuilder/0477.htm",Please send your resume @
"/media/Dados/bases/SWDE/job/job-careerbuilder/0350.htm",No relocations please. Thank you.
"/media/Dados/bases/SWDE/job/job-careerbuilder/0959.htm",• Experience with the Oracle Finance and Human Resource Business Intelligence Applications
"/media/Dados/bases/SWDE/job/job-careerbuilder/1411.htm",Project Management Professional (PMP) certification desired
"/media/Dados/bases/SWDE/job/job-careerbuilder/1966.htm","At least five years of development experience in Java, including experience with Swing, AWT, and JNI."
"/media/Dados/bases/SWDE/job/job-careerbuilder/1365.htm",• be able to maintain tools to fix bugs and add features
"/media/Dados/bases/SWDE/job/job-careerbuilder/1685.htm",", HTML, JavaScript, CSS, Microsoft"
