URL,EXTRACTED VALUE
"/media/Dados/bases/SWDE/job/job-careerbuilder/1965.htm","Conversant in web technologies such as HTML, JQuery, Javascript, search, ASP.NET, database concepts"
"/media/Dados/bases/SWDE/job/job-careerbuilder/0915.htm",Participates in the continuous improvement process within operations and Deployment Processes.
"/media/Dados/bases/SWDE/job/job-careerbuilder/0846.htm",Make recommendations for process improvements
"/media/Dados/bases/SWDE/job/job-careerbuilder/0553.htm",Support for client OS such as Windows XP/2000
"/media/Dados/bases/SWDE/job/job-careerbuilder/0844.htm",Conduct design and code reviews
"/media/Dados/bases/SWDE/job/job-careerbuilder/0845.htm",Manual execution of Predefined testcases
