URL,EXTRACTED VALUE
"/media/Dados/bases/SWDE/job/job-careerbuilder/0569.htm",Experience in the retail business is desired.
"/media/Dados/bases/SWDE/job/job-careerbuilder/0570.htm",Four to six years project management experience in complex business and technical environments
"/media/Dados/bases/SWDE/job/job-careerbuilder/1054.htm",We are developing our application with Visual Studio 2010 and SQL Server 2008
"/media/Dados/bases/SWDE/job/job-careerbuilder/1595.htm",Ability to complete assigned tasks on time
"/media/Dados/bases/SWDE/job/job-careerbuilder/0567.htm",Requires strong PC skills
"/media/Dados/bases/SWDE/job/job-careerbuilder/1957.htm",Security (Functional Option Group Setup/maintenance) PT skills
"/media/Dados/bases/SWDE/job/job-careerbuilder/0568.htm",Two years of experience in the retail business or related field.
"/media/Dados/bases/SWDE/job/job-careerbuilder/1060.htm","Solid technical background with strong experience in Java development technologies (J2EE, XML, HTML, Java Frameworks including Hibernate & Spring)"
