URL,EXTRACTED VALUE
"/media/Dados/bases/SWDE/job/job-careerbuilder/0479.htm",Cisco Certifications CCNP/CCVP/CCDA/CCIE- Strong Preferred for Equivalent Experience
"/media/Dados/bases/SWDE/job/job-careerbuilder/1855.htm",Utilize strong writing skills to draft System Support Documentation as needed
"/media/Dados/bases/SWDE/job/job-careerbuilder/0451.htm",Excel
"/media/Dados/bases/SWDE/job/job-careerbuilder/0859.htm","Liaise with project managers, development and QA leaders to ensure standards compliance"
"/media/Dados/bases/SWDE/job/job-careerbuilder/1823.htm",responsible for maintaining and extending the tool
"/media/Dados/bases/SWDE/job/job-careerbuilder/1845.htm","Experience in design, deployment and maintenance of relational databases in a highly available environment"
"/media/Dados/bases/SWDE/job/job-careerbuilder/1849.htm","Working knowledge of current versions of MS Office, Adobe FrameMaker, and related technologies"
"/media/Dados/bases/SWDE/job/job-careerbuilder/1113.htm",Performs Unit Stat/ISO reporting computer operations and data update/correction.
