URL,EXTRACTED VALUE
"/media/Dados/bases/SWDE/job/job-job/0858.htm",Level of Experience: Team lead
"/media/Dados/bases/SWDE/job/job-job/1847.htm",Database Types: SQL Server (Microsoft)
"/media/Dados/bases/SWDE/job/job-job/0636.htm",Test/Application Environment: Application development tools
"/media/Dados/bases/SWDE/job/job-job/1485.htm",Areas of Responsibility: Help desk/customer service
"/media/Dados/bases/SWDE/job/job-job/1512.htm",Programming Languages: Python
"/media/Dados/bases/SWDE/job/job-job/1335.htm",Level of Experience: Individual contributor
