URL,EXTRACTED VALUE
"/media/Dados/bases/SWDE/job/job-job/0134.htm",Database Types: PostgreSQL (open source)
"/media/Dados/bases/SWDE/job/job-job/0192.htm",Application Frameworks: . NET Compact Framework
"/media/Dados/bases/SWDE/job/job-job/0595.htm",Application Types: Enterprise business applications
"/media/Dados/bases/SWDE/job/job-job/0440.htm",Programming Languages: JAVA
"/media/Dados/bases/SWDE/job/job-job/0164.htm",System Architecture/Platform: Online/Website environments
"/media/Dados/bases/SWDE/job/job-job/0662.htm",Operating Systems: UNIX/Linux
"/media/Dados/bases/SWDE/job/job-job/1292.htm",Database Types: Oracle Database (Oracle)
"/media/Dados/bases/SWDE/job/job-job/0871.htm",System Architecture/Platform: Embedded systems
