URL,EXTRACTED VALUE
"/media/Dados/bases/SWDE/job/job-job/1172.htm",Automated Software Testing: Rational TestManager (IBM)
"/media/Dados/bases/SWDE/job/job-job/0369.htm",Application Types: Application integration/Middleware
"/media/Dados/bases/SWDE/job/job-job/0902.htm",Design/Verification Digital Chip: Conduct digital chip design verifications
"/media/Dados/bases/SWDE/job/job-job/1571.htm",Web Technologies: Ruby on Rails
"/media/Dados/bases/SWDE/job/job-job/1668.htm",Application Frameworks: ASP. NET
"/media/Dados/bases/SWDE/job/job-job/0255.htm",Programming Languages: JAVA
"/media/Dados/bases/SWDE/job/job-job/0372.htm",Application Types: Application development tools
