URL,EXTRACTED VALUE
"/media/Dados/bases/SWDE/job/job-job/0305.htm",Web Technologies: Ruby on Rails
"/media/Dados/bases/SWDE/job/job-job/1372.htm",Test/Application Environment: Functional system type
"/media/Dados/bases/SWDE/job/job-job/1340.htm",Programming Languages: VB. Net (Microsoft)
"/media/Dados/bases/SWDE/job/job-job/0367.htm",Programming Languages: Visual Basic (Microsoft)
"/media/Dados/bases/SWDE/job/job-job/1875.htm",Security Technology/Products: Network monitoring systems
"/media/Dados/bases/SWDE/job/job-job/0733.htm",Level of Experience: Individual contributor
