URL,EXTRACTED VALUE
"/media/Dados/bases/SWDE/job/job-job/0597.htm","Extensive knowledge in 2G and 3G WIRELESS STANDARDS(GSM, GPRS, EDGE, CDMA, 1xRTT, EVDO, HSDPA, and UMTS."
"/media/Dados/bases/SWDE/job/job-job/0284.htm",Responsibilities:
"/media/Dados/bases/SWDE/job/job-job/1191.htm",Must have 1-2 years of Web Developer-Programmer/Analyst experience
"/media/Dados/bases/SWDE/job/job-job/0661.htm","Knowledge and experience in Java , Servlet, Weblogic and tools like JIRA, CVS would be added advantage"
"/media/Dados/bases/SWDE/job/job-job/0649.htm",-Familiarity with common best coding practices
"/media/Dados/bases/SWDE/job/job-job/0665.htm","Knowledge and experience in Java , Servlet, Weblogic and tools like JIRA, CVS would be added advantage"
"/media/Dados/bases/SWDE/job/job-job/0615.htm",Required Experience
"/media/Dados/bases/SWDE/job/job-job/1739.htm",Strong API design skills and empathy for other programmers
"/media/Dados/bases/SWDE/job/job-job/1611.htm",Work Location Country: United States
"/media/Dados/bases/SWDE/job/job-job/0005.htm",Ability to Participate in Consulting Engagements:
"/media/Dados/bases/SWDE/job/job-job/1443.htm","One year of Java, XML and other internet technologies."
"/media/Dados/bases/SWDE/job/job-job/0666.htm","Should have strong experience and knowledge in Oracle 91, SQL Server, 2000, Java Script, Shell Scripting."
