URL,EXTRACTED VALUE
"/media/Dados/bases/SWDE/job/job-job/0644.htm",Job Title: Software Engineer (C#/. NET)
"/media/Dados/bases/SWDE/job/job-job/0616.htm",Job Title: Senior Software Engineer
"/media/Dados/bases/SWDE/job/job-job/1020.htm",Job Title: Senior Software Engineer
"/media/Dados/bases/SWDE/job/job-job/0087.htm",Job Title: Embedded C++ Linux Developer
"/media/Dados/bases/SWDE/job/job-job/0780.htm",Job Title: Hardware Engineer
"/media/Dados/bases/SWDE/job/job-job/1301.htm",Job Title: QA Analyst
"/media/Dados/bases/SWDE/job/job-job/0060.htm","Job Title: iPhone Application Developer (Objective-C, Cocoa, X-Code, Mac)"
