URL,EXTRACTED VALUE
"/media/Dados/bases/SWDE/job/job-job/1624.htm",Application Testing: Interface directly with Engineering/Development
"/media/Dados/bases/SWDE/job/job-job/1555.htm",Industry: IT/Technology/Electronics
"/media/Dados/bases/SWDE/job/job-job/0933.htm",Areas of Responsibility: Network management applications
"/media/Dados/bases/SWDE/job/job-job/0380.htm",Database Types: SQL Server (Microsoft)
"/media/Dados/bases/SWDE/job/job-job/1437.htm",Application Testing: Quality standards
"/media/Dados/bases/SWDE/job/job-job/0159.htm",Database Types: MySQL (MySQL AB)
"/media/Dados/bases/SWDE/job/job-job/1436.htm",Programming Languages: PHP
