URL,EXTRACTED VALUE
"/media/Dados/bases/SWDE/job/job-job/1096.htm",Good understanding of Networking and systems security
"/media/Dados/bases/SWDE/job/job-job/0210.htm","In-depth knowledge of the Linux OS (Redhat EL 4. x, 5. x)"
"/media/Dados/bases/SWDE/job/job-job/1812.htm",NISPOM Chapter 8 Certification required within six months of hire
"/media/Dados/bases/SWDE/job/job-job/1024.htm",4+ years experience as a Systems Analyst.
"/media/Dados/bases/SWDE/job/job-job/1444.htm",High attention to detail and the ability to work with large degree of independence
