URL,EXTRACTED VALUE
"/media/Dados/bases/SWDE/job/job-job/1096.htm",Strong understanding of normalization concepts and indexing approaches
"/media/Dados/bases/SWDE/job/job-job/0210.htm","Design, document and execute systems tests to complement the technical testing process"
"/media/Dados/bases/SWDE/job/job-job/1812.htm",Candidate must have a Bachelor's degree in related discipline plus 1 to 2 years of directly related experience in information technology systems.
"/media/Dados/bases/SWDE/job/job-job/1024.htm",EOE statement: American Express is an Equal Opportunity Employer.
"/media/Dados/bases/SWDE/job/job-job/1444.htm",Exceptional troubleshooting and analytical problem-solving skills
