URL,EXTRACTED VALUE
"/media/Dados/bases/SWDE/movie/movie-boxofficemojo/0044.htm",Opening Weekends
"/media/Dados/bases/SWDE/movie/movie-boxofficemojo/1344.htm",Single Day Sunday Gross
"/media/Dados/bases/SWDE/movie/movie-boxofficemojo/1753.htm",Single Day Saturday Gross
"/media/Dados/bases/SWDE/movie/movie-boxofficemojo/0538.htm",Single Day Sunday Gross
"/media/Dados/bases/SWDE/movie/movie-boxofficemojo/0562.htm",Single Day Friday Gross
"/media/Dados/bases/SWDE/movie/movie-boxofficemojo/0217.htm",Sunday Share of Opening Weekends
