URL,EXTRACTED VALUE
"/media/Dados/bases/SWDE/movie/movie-boxofficemojo/0756.htm",Widest PG-13 Rated Openings
"/media/Dados/bases/SWDE/movie/movie-boxofficemojo/0761.htm",Rated PG
"/media/Dados/bases/SWDE/movie/movie-boxofficemojo/1403.htm",Rated PG
"/media/Dados/bases/SWDE/movie/movie-boxofficemojo/0170.htm",Widest PG Rated Openings
"/media/Dados/bases/SWDE/movie/movie-boxofficemojo/1539.htm",Widest PG-13 Rated Openings
"/media/Dados/bases/SWDE/movie/movie-boxofficemojo/0305.htm",Widest PG-13 Rated Releases
"/media/Dados/bases/SWDE/movie/movie-boxofficemojo/0091.htm","Smallest Drops, All Wide Releases"
