URL,EXTRACTED VALUE
"/sdd/edimar/Desktop/doutorado/doutorado04/bases/WEIR/soccer/www.skysports.com/92690.html",Baros plays down Rosicky loss
"/sdd/edimar/Desktop/doutorado/doutorado04/bases/WEIR/soccer/www.skysports.com/73798.html",Late relief for Van der Sar
"/sdd/edimar/Desktop/doutorado/doutorado04/bases/WEIR/soccer/www.skysports.com/6564.html",Domenech keeps faith in Vieira
"/sdd/edimar/Desktop/doutorado/doutorado04/bases/WEIR/soccer/www.skysports.com/9135.html",Gerrard will skipper England
"/sdd/edimar/Desktop/doutorado/doutorado04/bases/WEIR/soccer/www.skysports.com/125925.html",Toni takes it day by day
"/sdd/edimar/Desktop/doutorado/doutorado04/bases/WEIR/soccer/www.skysports.com/6527.html",Henry targets final chapter
"/sdd/edimar/Desktop/doutorado/doutorado04/bases/WEIR/soccer/www.skysports.com/94592.html",Scolari urges Ron to join Real
"/sdd/edimar/Desktop/doutorado/doutorado04/bases/WEIR/soccer/www.skysports.com/93984.html",Swedes out for revenge
