URL,EXTRACTED VALUE
"/sdd/edimar/Desktop/doutorado/doutorado04/bases/WEIR/soccer/www.skysports.com/94259.html",Simao International stats
"/sdd/edimar/Desktop/doutorado/doutorado04/bases/WEIR/soccer/www.skysports.com/93973.html",Zdenek Grygera International stats
"/sdd/edimar/Desktop/doutorado/doutorado04/bases/WEIR/soccer/www.skysports.com/100154.html",Konstatin Zurianov International stats
"/sdd/edimar/Desktop/doutorado/doutorado04/bases/WEIR/soccer/www.skysports.com/94150.html",David Rozehnal International stats
"/sdd/edimar/Desktop/doutorado/doutorado04/bases/WEIR/soccer/www.skysports.com/97289.html",Marek Jankulovski International stats
"/sdd/edimar/Desktop/doutorado/doutorado04/bases/WEIR/soccer/www.skysports.com/3691.html",Giovanni van Bronckhorst International stats
"/sdd/edimar/Desktop/doutorado/doutorado04/bases/WEIR/soccer/www.skysports.com/97097.html",Xavi International stats
"/sdd/edimar/Desktop/doutorado/doutorado04/bases/WEIR/soccer/www.skysports.com/136763.html",Nani International stats
"/sdd/edimar/Desktop/doutorado/doutorado04/bases/WEIR/soccer/www.skysports.com/107243.html",Simon Rolfes International stats
"/sdd/edimar/Desktop/doutorado/doutorado04/bases/WEIR/soccer/www.skysports.com/99459.html",Nikos Liberopoulos International stats
"/sdd/edimar/Desktop/doutorado/doutorado04/bases/WEIR/soccer/www.skysports.com/93984.html",Zlatan Ibrahimovic International stats
"/sdd/edimar/Desktop/doutorado/doutorado04/bases/WEIR/soccer/www.skysports.com/124088.html",Yuri Zhirkov International stats
"/sdd/edimar/Desktop/doutorado/doutorado04/bases/WEIR/soccer/www.skysports.com/97313.html",Daniele De Rossi International stats
"/sdd/edimar/Desktop/doutorado/doutorado04/bases/WEIR/soccer/www.skysports.com/93978.html",Wesley Sneijder International stats
"/sdd/edimar/Desktop/doutorado/doutorado04/bases/WEIR/soccer/www.skysports.com/126237.html",Pepe International stats
"/sdd/edimar/Desktop/doutorado/doutorado04/bases/WEIR/soccer/www.skysports.com/45386.html",Olof Mellberg International stats
"/sdd/edimar/Desktop/doutorado/doutorado04/bases/WEIR/soccer/www.skysports.com/6527.html",Thierry Henry International stats
"/sdd/edimar/Desktop/doutorado/doutorado04/bases/WEIR/soccer/www.skysports.com/99309.html",Ricardo Carvalho International stats
"/sdd/edimar/Desktop/doutorado/doutorado04/bases/WEIR/soccer/www.skysports.com/126532.html",Alberto Aquilani International stats
"/sdd/edimar/Desktop/doutorado/doutorado04/bases/WEIR/soccer/www.skysports.com/94966.html",Robin Van Persie International stats
"/sdd/edimar/Desktop/doutorado/doutorado04/bases/WEIR/soccer/www.skysports.com/92953.html",Philipp Lahm International stats
"/sdd/edimar/Desktop/doutorado/doutorado04/bases/WEIR/soccer/www.skysports.com/149113.html",Nikos Spyropoulos International stats
"/sdd/edimar/Desktop/doutorado/doutorado04/bases/WEIR/soccer/www.skysports.com/136842.html",Demy De Zeeuw International stats
"/sdd/edimar/Desktop/doutorado/doutorado04/bases/WEIR/soccer/www.skysports.com/97110.html",Iniesta International stats
"/sdd/edimar/Desktop/doutorado/doutorado04/bases/WEIR/soccer/www.skysports.com/94209.html",Joan Capdevila International stats
"/sdd/edimar/Desktop/doutorado/doutorado04/bases/WEIR/soccer/www.skysports.com/94818.html",Jeremy Toulalan International stats
"/sdd/edimar/Desktop/doutorado/doutorado04/bases/WEIR/soccer/www.skysports.com/126422.html",Samir Nasri International stats
"/sdd/edimar/Desktop/doutorado/doutorado04/bases/WEIR/soccer/www.skysports.com/95729.html",Arjen Robben International stats
"/sdd/edimar/Desktop/doutorado/doutorado04/bases/WEIR/soccer/www.skysports.com/105030.html",Dmitri Torbinskiy International stats
"/sdd/edimar/Desktop/doutorado/doutorado04/bases/WEIR/soccer/www.skysports.com/123961.html",Andreas Isaksson International stats
"/sdd/edimar/Desktop/doutorado/doutorado04/bases/WEIR/soccer/www.skysports.com/104383.html",Cesc Fabregas International stats
"/sdd/edimar/Desktop/doutorado/doutorado04/bases/WEIR/soccer/www.skysports.com/133711.html",Jan Polak International stats
"/sdd/edimar/Desktop/doutorado/doutorado04/bases/WEIR/soccer/www.skysports.com/97730.html",Gennaro Gattuso International stats
"/sdd/edimar/Desktop/doutorado/doutorado04/bases/WEIR/soccer/www.skysports.com/99292.html",Radoslav Kovac International stats
"/sdd/edimar/Desktop/doutorado/doutorado04/bases/WEIR/soccer/www.skysports.com/131420.html",Karim Benzema International stats
"/sdd/edimar/Desktop/doutorado/doutorado04/bases/WEIR/soccer/www.skysports.com/61621.html",Milan Baros International stats
"/sdd/edimar/Desktop/doutorado/doutorado04/bases/WEIR/soccer/www.skysports.com/106253.html",Lukas Podolski International stats
"/sdd/edimar/Desktop/doutorado/doutorado04/bases/WEIR/soccer/www.skysports.com/94689.html",Joris Mathijsen International stats
"/sdd/edimar/Desktop/doutorado/doutorado04/bases/WEIR/soccer/www.skysports.com/151320.html",Markus Rosenberg International stats
"/sdd/edimar/Desktop/doutorado/doutorado04/bases/WEIR/soccer/www.skysports.com/125719.html",Denis Kolodin International stats
"/sdd/edimar/Desktop/doutorado/doutorado04/bases/WEIR/soccer/www.skysports.com/104277.html",Georgios Karagounis International stats
"/sdd/edimar/Desktop/doutorado/doutorado04/bases/WEIR/soccer/www.skysports.com/93401.html",Tomas Ujfalusi International stats
"/sdd/edimar/Desktop/doutorado/doutorado04/bases/WEIR/soccer/www.skysports.com/97214.html",Simone Perrotta International stats
"/sdd/edimar/Desktop/doutorado/doutorado04/bases/WEIR/soccer/www.skysports.com/98718.html",Sidney Govou International stats
"/sdd/edimar/Desktop/doutorado/doutorado04/bases/WEIR/soccer/www.skysports.com/97252.html",Gianluca Zambrotta International stats
"/sdd/edimar/Desktop/doutorado/doutorado04/bases/WEIR/soccer/www.skysports.com/101921.html",Johnny Heitinga International stats
"/sdd/edimar/Desktop/doutorado/doutorado04/bases/WEIR/soccer/www.skysports.com/90026.html",Xabi Alonso International stats
"/sdd/edimar/Desktop/doutorado/doutorado04/bases/WEIR/soccer/www.skysports.com/97719.html",Daniel Andersson International stats
"/sdd/edimar/Desktop/doutorado/doutorado04/bases/WEIR/soccer/www.skysports.com/97096.html",Carles Puyol International stats
"/sdd/edimar/Desktop/doutorado/doutorado04/bases/WEIR/soccer/www.skysports.com/127167.html",Giorgio Chiellini International stats
"/sdd/edimar/Desktop/doutorado/doutorado04/bases/WEIR/soccer/www.skysports.com/125924.html",Andrea Pirlo International stats
"/sdd/edimar/Desktop/doutorado/doutorado04/bases/WEIR/soccer/www.skysports.com/93977.html",Rafael Van der Vaart International stats
"/sdd/edimar/Desktop/doutorado/doutorado04/bases/WEIR/soccer/www.skysports.com/126502.html",Ra�l Jos� Trindade Meireles International stats
"/sdd/edimar/Desktop/doutorado/doutorado04/bases/WEIR/soccer/www.skysports.com/94567.html",Per Mertesacker International stats
"/sdd/edimar/Desktop/doutorado/doutorado04/bases/WEIR/soccer/www.skysports.com/94920.html",Nigel de Jong International stats
"/sdd/edimar/Desktop/doutorado/doutorado04/bases/WEIR/soccer/www.skysports.com/92507.html",Jaroslav Plasil International stats
"/sdd/edimar/Desktop/doutorado/doutorado04/bases/WEIR/soccer/www.skysports.com/124081.html",Igor Akinfeev International stats
"/sdd/edimar/Desktop/doutorado/doutorado04/bases/WEIR/soccer/www.skysports.com/90049.html",Fernando Torres International stats
"/sdd/edimar/Desktop/doutorado/doutorado04/bases/WEIR/soccer/www.skysports.com/101562.html",Angelos Basinas International stats
"/sdd/edimar/Desktop/doutorado/doutorado04/bases/WEIR/soccer/www.skysports.com/94565.html",Clemens Fritz International stats
"/sdd/edimar/Desktop/doutorado/doutorado04/bases/WEIR/soccer/www.skysports.com/124411.html",Klaas-Jan Huntelaar International stats
"/sdd/edimar/Desktop/doutorado/doutorado04/bases/WEIR/soccer/www.skysports.com/156105.html",Jakub Wawrzyniak International stats
"/sdd/edimar/Desktop/doutorado/doutorado04/bases/WEIR/soccer/www.skysports.com/138752.html",Ivan Rakitic International stats
"/sdd/edimar/Desktop/doutorado/doutorado04/bases/WEIR/soccer/www.skysports.com/15808.html",Iker Casillas International stats
"/sdd/edimar/Desktop/doutorado/doutorado04/bases/WEIR/soccer/www.skysports.com/125724.html",Andrei Arshavin International stats
"/sdd/edimar/Desktop/doutorado/doutorado04/bases/WEIR/soccer/www.skysports.com/93709.html",Arne Friedrich International stats
"/sdd/edimar/Desktop/doutorado/doutorado04/bases/WEIR/soccer/www.skysports.com/137653.html",Daniel Gonzalez Guiza International stats
"/sdd/edimar/Desktop/doutorado/doutorado04/bases/WEIR/soccer/www.skysports.com/100578.html",Mariusz Lewandowski International stats
"/sdd/edimar/Desktop/doutorado/doutorado04/bases/WEIR/soccer/www.skysports.com/92121.html",Eric Abidal International stats
"/sdd/edimar/Desktop/doutorado/doutorado04/bases/WEIR/soccer/www.skysports.com/126261.html",Sergio Ramos International stats
"/sdd/edimar/Desktop/doutorado/doutorado04/bases/WEIR/soccer/www.skysports.com/125925.html",Luca Toni International stats
"/sdd/edimar/Desktop/doutorado/doutorado04/bases/WEIR/soccer/www.skysports.com/99315.html",Deco International stats
"/sdd/edimar/Desktop/doutorado/doutorado04/bases/WEIR/soccer/www.skysports.com/132806.html",Theofanis Gekas International stats
"/sdd/edimar/Desktop/doutorado/doutorado04/bases/WEIR/soccer/www.skysports.com/7001.html",Thomas Hitzlsperger International stats
"/sdd/edimar/Desktop/doutorado/doutorado04/bases/WEIR/soccer/www.skysports.com/95011.html",Petter Hansson International stats
"/sdd/edimar/Desktop/doutorado/doutorado04/bases/WEIR/soccer/www.skysports.com/94447.html",Andre Ooijer International stats
"/sdd/edimar/Desktop/doutorado/doutorado04/bases/WEIR/soccer/www.skysports.com/94967.html",Dirk Kuyt International stats
"/sdd/edimar/Desktop/doutorado/doutorado04/bases/WEIR/soccer/www.skysports.com/110982.html",Ryan Babel International stats
"/sdd/edimar/Desktop/doutorado/doutorado04/bases/WEIR/soccer/www.skysports.com/123744.html",Jacek Krzynowek International stats
"/sdd/edimar/Desktop/doutorado/doutorado04/bases/WEIR/soccer/www.skysports.com/97253.html",Alessandro Del Piero International stats
"/sdd/edimar/Desktop/doutorado/doutorado04/bases/WEIR/soccer/www.skysports.com/92098.html",Bastian Schweinsteiger International stats
"/sdd/edimar/Desktop/doutorado/doutorado04/bases/WEIR/soccer/www.skysports.com/92145.html",Florent Malouda International stats
"/sdd/edimar/Desktop/doutorado/doutorado04/bases/WEIR/soccer/www.skysports.com/92211.html",Miroslav Klose International stats
"/sdd/edimar/Desktop/doutorado/doutorado04/bases/WEIR/soccer/www.skysports.com/94251.html",Miguel International stats
"/sdd/edimar/Desktop/doutorado/doutorado04/bases/WEIR/soccer/www.skysports.com/99321.html",Jose Bosingwa International stats
"/sdd/edimar/Desktop/doutorado/doutorado04/bases/WEIR/soccer/www.skysports.com/97245.html",Gianluigi Buffon International stats
"/sdd/edimar/Desktop/doutorado/doutorado04/bases/WEIR/soccer/www.skysports.com/100358.html",Roman Pavlyuchenko International stats
"/sdd/edimar/Desktop/doutorado/doutorado04/bases/WEIR/soccer/www.skysports.com/99824.html",Fabio Grosso International stats
"/sdd/edimar/Desktop/doutorado/doutorado04/bases/WEIR/soccer/www.skysports.com/97260.html",Mauro Camoranesi International stats
"/sdd/edimar/Desktop/doutorado/doutorado04/bases/WEIR/soccer/www.skysports.com/128689.html",Dariusz Dudka International stats
"/sdd/edimar/Desktop/doutorado/doutorado04/bases/WEIR/soccer/www.skysports.com/99490.html",Sergei Ignashevich International stats
"/sdd/edimar/Desktop/doutorado/doutorado04/bases/WEIR/soccer/www.skysports.com/128669.html",Vladimir Bystrov International stats
"/sdd/edimar/Desktop/doutorado/doutorado04/bases/WEIR/soccer/www.skysports.com/97271.html",Antonio Di Natale International stats
"/sdd/edimar/Desktop/doutorado/doutorado04/bases/WEIR/soccer/www.skysports.com/92950.html",Kevin Kuranyi International stats
"/sdd/edimar/Desktop/doutorado/doutorado04/bases/WEIR/soccer/www.skysports.com/99457.html",Konstantinos Katsouranis International stats
"/sdd/edimar/Desktop/doutorado/doutorado04/bases/WEIR/soccer/www.skysports.com/97555.html",David Villa International stats
"/sdd/edimar/Desktop/doutorado/doutorado04/bases/WEIR/soccer/www.skysports.com/145166.html",Marcin Wasilewski International stats
"/sdd/edimar/Desktop/doutorado/doutorado04/bases/WEIR/soccer/www.skysports.com/123977.html",Franck Ribery International stats
"/sdd/edimar/Desktop/doutorado/doutorado04/bases/WEIR/soccer/www.skysports.com/92690.html",Petr Cech International stats
"/sdd/edimar/Desktop/doutorado/doutorado04/bases/WEIR/soccer/www.skysports.com/110423.html",Kim Kallstrom International stats
"/sdd/edimar/Desktop/doutorado/doutorado04/bases/WEIR/soccer/www.skysports.com/113750.html",Raul Albiol International stats
"/sdd/edimar/Desktop/doutorado/doutorado04/bases/WEIR/soccer/www.skysports.com/16443.html",Nicolas Anelka International stats
"/sdd/edimar/Desktop/doutorado/doutorado04/bases/WEIR/soccer/www.skysports.com/92501.html",Patrice Evra International stats
"/sdd/edimar/Desktop/doutorado/doutorado04/bases/WEIR/soccer/www.skysports.com/114125.html",Mario Gomez International stats
"/sdd/edimar/Desktop/doutorado/doutorado04/bases/WEIR/soccer/www.skysports.com/40681.html",William Gallas International stats
"/sdd/edimar/Desktop/doutorado/doutorado04/bases/WEIR/soccer/www.skysports.com/100144.html",Igor Semshov International stats
"/sdd/edimar/Desktop/doutorado/doutorado04/bases/WEIR/soccer/www.skysports.com/100581.html",Darijo Srna International stats
