URL,EXTRACTED VALUE
"/sdd/edimar/Desktop/doutorado/doutorado04/bases/WEIR/videogame/ps2.gamespy.com/psi-ops-the-mindgate-conspiracy.html",Psi-Ops: The Mindgate Conspiracy Strategy Guide
"/sdd/edimar/Desktop/doutorado/doutorado04/bases/WEIR/videogame/ps2.gamespy.com/ico-ii.html",Shadow of the Colossus Strategy Guide
"/sdd/edimar/Desktop/doutorado/doutorado04/bases/WEIR/videogame/ps2.gamespy.com/jak-x.html",Jak X: Combat Racing Strategy Guide
"/sdd/edimar/Desktop/doutorado/doutorado04/bases/WEIR/videogame/ps2.gamespy.com/def-jam-vendetta-2.html",Def Jam: Fight for NY Strategy Guide
"/sdd/edimar/Desktop/doutorado/doutorado04/bases/WEIR/videogame/ps2.gamespy.com/gran-turismo-4.html",Gran Turismo 4 Strategy Guide
"/sdd/edimar/Desktop/doutorado/doutorado04/bases/WEIR/videogame/ps2.gamespy.com/god-of-war.html",God of War Strategy Guide
