URL,EXTRACTED VALUE
"/sdd/edimar/Desktop/doutorado/doutorado04/bases/WEIR/videogame/ps2.gamespy.com/devil-kings.html",derivative too clone for comfort?
"/sdd/edimar/Desktop/doutorado/doutorado04/bases/WEIR/videogame/ps2.gamespy.com/from-tv-animation-one-piece-grand-battle-rush.html",", and becomes a PS2 fighting game."
"/sdd/edimar/Desktop/doutorado/doutorado04/bases/WEIR/videogame/ps2.gamespy.com/dynasty-warriors-5.html","will surprise no one, but its newfound innovations might just turn some heads."
"/sdd/edimar/Desktop/doutorado/doutorado04/bases/WEIR/videogame/ps2.gamespy.com/xenosaga-iii.html",listened. The story continues.
"/sdd/edimar/Desktop/doutorado/doutorado04/bases/WEIR/videogame/ps2.gamespy.com/terminator-3-rise-of-the-machines.html",game will be better than the last.
"/sdd/edimar/Desktop/doutorado/doutorado04/bases/WEIR/videogame/ps2.gamespy.com/bujingai-the-forsaken-city.html","leaps out of the pack with its smooth, enjoyable gameplay and rockstar-like style."
"/sdd/edimar/Desktop/doutorado/doutorado04/bases/WEIR/videogame/ps2.gamespy.com/project-melfes.html",series is shaping up to be one RPG worth checking out in its latest for the PS2.
"/sdd/edimar/Desktop/doutorado/doutorado04/bases/WEIR/videogame/ps2.gamespy.com/naruto-narutimett-hero.html","the ultimate fighting game? Not really, but it does look solid."
"/sdd/edimar/Desktop/doutorado/doutorado04/bases/WEIR/videogame/ps2.gamespy.com/phantom-brave.html",are set to deliver another wacky strategy RPG of unprecedented depth and uncommon value.
"/sdd/edimar/Desktop/doutorado/doutorado04/bases/WEIR/videogame/ps2.gamespy.com/guitar-hero-iii.html",from start to finish.
"/sdd/edimar/Desktop/doutorado/doutorado04/bases/WEIR/videogame/ps2.gamespy.com/sole-predator.html","in the water! Oh wait, you're Jaws. Drink away."
"/sdd/edimar/Desktop/doutorado/doutorado04/bases/WEIR/videogame/ps2.gamespy.com/hot-shots-golf-fore.html","is better than ever. Best of all, the addictive gameplay is getting online!"
"/sdd/edimar/Desktop/doutorado/doutorado04/bases/WEIR/videogame/ps2.gamespy.com/urban-reign.html",'s most popular characters.
