URL,EXTRACTED VALUE
"/media/Dados/bases/SWDE/movie/movie-allmovie/1883.htm",Western bandit Kid Rio (
"/media/Dados/bases/SWDE/movie/movie-allmovie/0036.htm",") is an IRA volunteer who, despite personal misgivings, takes part in the kidnapping of a black British soldier, Jody ("
"/media/Dados/bases/SWDE/movie/movie-allmovie/1145.htm","Based on a true story,"
"/media/Dados/bases/SWDE/movie/movie-allmovie/1744.htm","' popular novel was published in 1932, and it has been adapted twice for British television, first as a miniseries in 1971, then by director"
"/media/Dados/bases/SWDE/movie/movie-allmovie/1946.htm",Swedish director
"/media/Dados/bases/SWDE/movie/movie-allmovie/0042.htm","Lending his burlesque touch to 1970s genre revision,"
"/media/Dados/bases/SWDE/movie/movie-allmovie/0399.htm",Jeff Grant (
"/media/Dados/bases/SWDE/movie/movie-allmovie/1651.htm","With the whimsical tagline Jack Deth is back and he's never been here before, director"
"/media/Dados/bases/SWDE/movie/movie-allmovie/0051.htm","When there's a full moon over Brooklyn, anything can happen, and everything happens in the neighborhood where widowed bookkeeper Loretta Castorini ("
"/media/Dados/bases/SWDE/movie/movie-allmovie/1702.htm",The second Biblical epic to be turned into a musical by composer
"/media/Dados/bases/SWDE/movie/movie-allmovie/1589.htm","Erotic, funny, and very French, this film relies heavily on the critically-acclaimed performance of"
"/media/Dados/bases/SWDE/movie/movie-allmovie/0591.htm",Chili-born Italian director
"/media/Dados/bases/SWDE/movie/movie-allmovie/1842.htm",As penned by
"/media/Dados/bases/SWDE/movie/movie-allmovie/0531.htm",covers three decades in the lives of widow Aurora Greenway (
"/media/Dados/bases/SWDE/movie/movie-allmovie/0352.htm",", the second in the series of"
"/media/Dados/bases/SWDE/movie/movie-allmovie/1246.htm","With this all-star Cinerama epic, producer/director"
"/media/Dados/bases/SWDE/movie/movie-allmovie/0039.htm","With ornate imagery reminiscent of paintings from the story's 18th century period,"
"/media/Dados/bases/SWDE/movie/movie-allmovie/1683.htm",Director
"/media/Dados/bases/SWDE/movie/movie-allmovie/0142.htm","), an experimental subject who obtained penicillin from a military doctor and left the study to fight in World War II."
"/media/Dados/bases/SWDE/movie/movie-allmovie/1939.htm",stars in this revisionist western directed by
"/media/Dados/bases/SWDE/movie/movie-allmovie/1319.htm",) plans to sell the small French boarding school where the young orphan Madeline (nine-year-old British actress
"/media/Dados/bases/SWDE/movie/movie-allmovie/1998.htm",Continuing cinema's fascination with bringing the stories of handicaps and the mentally challenged to the big screen (
"/media/Dados/bases/SWDE/movie/movie-allmovie/0777.htm",The final installment in
"/media/Dados/bases/SWDE/movie/movie-allmovie/0896.htm","Made for theatrical release by a Dutch TV production firm, this stars"
"/media/Dados/bases/SWDE/movie/movie-allmovie/1377.htm","For all its state-of-the-art special effects,"
"/media/Dados/bases/SWDE/movie/movie-allmovie/1129.htm","Running nearly three hours,"
"/media/Dados/bases/SWDE/movie/movie-allmovie/0616.htm",A socially inept young woman slowly learns to overcome her insecurities in this sleeper hit from Australia. The unconventional Muriel (
"/media/Dados/bases/SWDE/movie/movie-allmovie/0855.htm",In
"/media/Dados/bases/SWDE/movie/movie-allmovie/0605.htm","; footage from his unfinished version, known as The Deep, can be seen in the documentary"
"/media/Dados/bases/SWDE/movie/movie-allmovie/0565.htm",) and moral support by demanding but big-hearted instructor Hanna Long (
"/media/Dados/bases/SWDE/movie/movie-allmovie/0129.htm","), and a tiny plastic model of an Indian from his best friend Patrick ("
"/media/Dados/bases/SWDE/movie/movie-allmovie/1218.htm",Expanding on their
"/media/Dados/bases/SWDE/movie/movie-allmovie/0162.htm","Originally networkcast in three installments, the 8-hour"
"/media/Dados/bases/SWDE/movie/movie-allmovie/0215.htm","is set in the world of competitive yacht racing, where a young sailor ("
"/media/Dados/bases/SWDE/movie/movie-allmovie/0494.htm","If they move, kill 'em! Beginning and ending with two of the bloodiest battles in screen history,"
"/media/Dados/bases/SWDE/movie/movie-allmovie/0847.htm",A follow-up to the 1988 film
"/media/Dados/bases/SWDE/movie/movie-allmovie/1433.htm",A reporter gets more than she bargained for when she tries to prove that a murder has occurred in
"/media/Dados/bases/SWDE/movie/movie-allmovie/1601.htm","In the style of an operetta, like director"
"/media/Dados/bases/SWDE/movie/movie-allmovie/1615.htm",One woman decides to change the world by changing the lives of the people she knows in this charming and romantic comic fantasy from director
"/media/Dados/bases/SWDE/movie/movie-allmovie/0635.htm","In this Australian comedy, adapted by"
"/media/Dados/bases/SWDE/movie/movie-allmovie/1662.htm","Crash landing on a barren penal-colony planet with an unwelcomed visitor in tow, Ripley ("
"/media/Dados/bases/SWDE/movie/movie-allmovie/1605.htm",In this first film in
"/media/Dados/bases/SWDE/movie/movie-allmovie/1908.htm",In
"/media/Dados/bases/SWDE/movie/movie-allmovie/1307.htm",", the son of Muppet founder"
"/media/Dados/bases/SWDE/movie/movie-allmovie/0171.htm",and screenwriter
"/media/Dados/bases/SWDE/movie/movie-allmovie/1896.htm","An offbeat 1970s black-comic Western with an all-star cast, this"
"/media/Dados/bases/SWDE/movie/movie-allmovie/0331.htm",The best-selling novel by
"/media/Dados/bases/SWDE/movie/movie-allmovie/1371.htm",Handsome young Washington attorney Louie Jeffries (
"/media/Dados/bases/SWDE/movie/movie-allmovie/1659.htm","), they encounter villainous robots, threatening their journey to find Earth."
"/media/Dados/bases/SWDE/movie/movie-allmovie/0370.htm","This big-budget, big-studio espionage film is set in the last years of World War II."
"/media/Dados/bases/SWDE/movie/movie-allmovie/1290.htm",A crime of passion unwittingly leads to a miracle in this satirical comedy. Tex (
"/media/Dados/bases/SWDE/movie/movie-allmovie/0783.htm",Following up on his 1989 masterpiece
"/media/Dados/bases/SWDE/movie/movie-allmovie/0155.htm","is a dramatization of the life story of one of the most intriguing figures in all history. A crude peasant from Siberia, Rasputin ("
"/media/Dados/bases/SWDE/movie/movie-allmovie/0390.htm",seems more aloof and detached than usual in the Hong Kong-produced crime caper
"/media/Dados/bases/SWDE/movie/movie-allmovie/0621.htm","), a middle-aged writer living with her French husband J.P. ("
"/media/Dados/bases/SWDE/movie/movie-allmovie/1538.htm","Despite its relative failure at the box office, this is a worthwhile thriller from the director of"
"/media/Dados/bases/SWDE/movie/movie-allmovie/1752.htm",Much as he would later do with
"/media/Dados/bases/SWDE/movie/movie-allmovie/1765.htm",This 5.7-million-dollar British comedy from writer/director
"/media/Dados/bases/SWDE/movie/movie-allmovie/1851.htm",British filmmaker
"/media/Dados/bases/SWDE/movie/movie-allmovie/1795.htm",) leaves a ship and ambles toward the home of his long-lost brother Maurice Guppy (
"/media/Dados/bases/SWDE/movie/movie-allmovie/1254.htm",The lightly mocking title
"/media/Dados/bases/SWDE/movie/movie-allmovie/1564.htm",Comic leading man
"/media/Dados/bases/SWDE/movie/movie-allmovie/0402.htm","), be located and brought back to the United States. Capt. Miller gets the assignment, and he chooses a translator, Cpl. Upham ("
"/media/Dados/bases/SWDE/movie/movie-allmovie/1375.htm",'s sequel to the phenomenally successful
"/media/Dados/bases/SWDE/movie/movie-allmovie/0123.htm","One of Disney's most entertaining forays into live-action, this hit family comedy stars"
"/media/Dados/bases/SWDE/movie/movie-allmovie/1642.htm","), the beautiful Akima (voice of"
"/media/Dados/bases/SWDE/movie/movie-allmovie/0785.htm",is the last film directed by Hong Kong action auteur
"/media/Dados/bases/SWDE/movie/movie-allmovie/1733.htm","'s treatment of the story may be too muted, and"
"/media/Dados/bases/SWDE/movie/movie-allmovie/1812.htm",Comic actor
"/media/Dados/bases/SWDE/movie/movie-allmovie/1533.htm","is accused of emulating Spring Heel'd Jack. Before the film is half over,"
"/media/Dados/bases/SWDE/movie/movie-allmovie/1480.htm",This sexy horror story from Britain's Hammer Films finds
"/media/Dados/bases/SWDE/movie/movie-allmovie/1119.htm",Featuring
"/media/Dados/bases/SWDE/movie/movie-allmovie/0521.htm","Grease, said the poster and the"
"/media/Dados/bases/SWDE/movie/movie-allmovie/1241.htm","At the suggestion of a friend, Constance ("
"/media/Dados/bases/SWDE/movie/movie-allmovie/1860.htm",takes over the legacy of
"/media/Dados/bases/SWDE/movie/movie-allmovie/1248.htm","is an infectious, engaging comedy starring the rap duo"
"/media/Dados/bases/SWDE/movie/movie-allmovie/0658.htm",Former documentary filmmaker
"/media/Dados/bases/SWDE/movie/movie-allmovie/1575.htm","). Henri's sister, Betty ("
"/media/Dados/bases/SWDE/movie/movie-allmovie/0722.htm",'s
"/media/Dados/bases/SWDE/movie/movie-allmovie/0805.htm","One of the most influential examples of anime,"
"/media/Dados/bases/SWDE/movie/movie-allmovie/0456.htm","Hardcore pornography, sadomasochism, mind control, and living televisions all play crucial roles in"
"/media/Dados/bases/SWDE/movie/movie-allmovie/0255.htm",'s delicious black comedy was lovingly translated to the screen by legendary director
"/media/Dados/bases/SWDE/movie/movie-allmovie/1239.htm",is without a doubt the most tasteless of the
"/media/Dados/bases/SWDE/movie/movie-allmovie/0682.htm",plays
"/media/Dados/bases/SWDE/movie/movie-allmovie/0443.htm","One of the most highly regarded haunted house films ever produced,"
"/media/Dados/bases/SWDE/movie/movie-allmovie/0434.htm",) discerns that The Thing (played by future
"/media/Dados/bases/SWDE/movie/movie-allmovie/1291.htm",(1998) meets
"/media/Dados/bases/SWDE/movie/movie-allmovie/1596.htm",) is an episodic comedy drama composed of several sequences that explore childhood in director
"/media/Dados/bases/SWDE/movie/movie-allmovie/0716.htm",Directed by
"/media/Dados/bases/SWDE/movie/movie-allmovie/0120.htm","co-produced and directed this often heartwarming yarn, the first animated feature presented by"
"/media/Dados/bases/SWDE/movie/movie-allmovie/0265.htm",Noted Mexican filmmaker
"/media/Dados/bases/SWDE/movie/movie-allmovie/0257.htm","Long considered a classic of European film noir, this existential gangster drama from French director"
"/media/Dados/bases/SWDE/movie/movie-allmovie/1378.htm","Following up on his critically acclaimed, blood-splattered epic"
"/media/Dados/bases/SWDE/movie/movie-allmovie/1818.htm",Director
"/media/Dados/bases/SWDE/movie/movie-allmovie/0047.htm",The launching pad for
"/media/Dados/bases/SWDE/movie/movie-allmovie/0477.htm",One of the more prominent works of Italy's premier horror stylist
"/media/Dados/bases/SWDE/movie/movie-allmovie/1836.htm",Supernatural horror meets character drama in this
"/media/Dados/bases/SWDE/movie/movie-allmovie/0096.htm",) witnesses the death of his mother in a rockslide and is forced to set out to fend for himself. The young bear encounters a giant grizzly (
"/media/Dados/bases/SWDE/movie/movie-allmovie/0686.htm",is told in flashback as Naval officer Tom Farrell (
"/media/Dados/bases/SWDE/movie/movie-allmovie/0398.htm",") is the host of a television news show who once a year spends a long weekend with three of his best friends from college, Bernard Osterman ("
"/media/Dados/bases/SWDE/movie/movie-allmovie/0648.htm","Based on fact,"
"/media/Dados/bases/SWDE/movie/movie-allmovie/0209.htm","returns to his adventuring Indiana Jones-esque Asian Hawk character with this rollicking action-adventure yarn. In this go-around,"
"/media/Dados/bases/SWDE/movie/movie-allmovie/1388.htm",directed this brilliant psychological Western reminiscent of
"/media/Dados/bases/SWDE/movie/movie-allmovie/1814.htm",'s
"/media/Dados/bases/SWDE/movie/movie-allmovie/1215.htm",is a
"/media/Dados/bases/SWDE/movie/movie-allmovie/1166.htm",introduced a feminist mindset to Nashville years before the phrase women's liberation became common currency.
"/media/Dados/bases/SWDE/movie/movie-allmovie/1849.htm",'s masterful
"/media/Dados/bases/SWDE/movie/movie-allmovie/0877.htm",In
"/media/Dados/bases/SWDE/movie/movie-allmovie/1015.htm",The Yugoslavian
"/media/Dados/bases/SWDE/movie/movie-allmovie/0205.htm",Loosely adapted from the classic 1932 horror film starring
"/media/Dados/bases/SWDE/movie/movie-allmovie/1311.htm",Based on the popular animated children's program
"/media/Dados/bases/SWDE/movie/movie-allmovie/0622.htm",) first sees Melissa (
"/media/Dados/bases/SWDE/movie/movie-allmovie/1335.htm","opens on the first day of school for a new batch of students at St. Francis Academy, run by a very strong-willed Mother Superior ("
"/media/Dados/bases/SWDE/movie/movie-allmovie/1724.htm",One of the more cinematic entries in the mid-1970s
"/media/Dados/bases/SWDE/movie/movie-allmovie/0848.htm",is the second of Indian director
"/media/Dados/bases/SWDE/movie/movie-allmovie/1610.htm","is Nelly, a middle-class Parisian housewife, married to possessive husband Andre ("
"/media/Dados/bases/SWDE/movie/movie-allmovie/0826.htm","), while the passengers who climb from the wreckage include a police officer ("
"/media/Dados/bases/SWDE/movie/movie-allmovie/0966.htm",William Shakespeare (
"/media/Dados/bases/SWDE/movie/movie-allmovie/1185.htm",Monologist
"/media/Dados/bases/SWDE/movie/movie-allmovie/1407.htm",A quote from
"/media/Dados/bases/SWDE/movie/movie-allmovie/0719.htm","), she is thrilled to learn that he has no plans to work in the mines. When Margaret and Neil marry over the opposition of Margaret's stern mother ("
"/media/Dados/bases/SWDE/movie/movie-allmovie/0642.htm","In this small Australian comedy,"
"/media/Dados/bases/SWDE/movie/movie-allmovie/1037.htm",In the third and last in the original
"/media/Dados/bases/SWDE/movie/movie-allmovie/0631.htm",Unrequited love and mistaken identity are the lynchpins of this romantic comedy from Australia.
"/media/Dados/bases/SWDE/movie/movie-allmovie/1973.htm",Set in Great Britain in the late 1980s -- in the midst of
"/media/Dados/bases/SWDE/movie/movie-allmovie/0625.htm","Sex, religion, and morality are the key ingredients in this Australian comedy set in the 1930s. Rev. Anthony Campion ("
"/media/Dados/bases/SWDE/movie/movie-allmovie/1114.htm",Before his commercial breakthrough with
"/media/Dados/bases/SWDE/movie/movie-allmovie/0782.htm","In this classic martial arts film from Hong Kong,"
"/media/Dados/bases/SWDE/movie/movie-allmovie/0158.htm",Two years before director
"/media/Dados/bases/SWDE/movie/movie-allmovie/1815.htm",On the heels of
"/media/Dados/bases/SWDE/movie/movie-allmovie/1340.htm",produced and
"/media/Dados/bases/SWDE/movie/movie-allmovie/0414.htm",The first of two consecutive films to see director
"/media/Dados/bases/SWDE/movie/movie-allmovie/0168.htm",This is a long-awaited film telling the story of the trials of Medgar Evers' killer. Medger Evers (
"/media/Dados/bases/SWDE/movie/movie-allmovie/0121.htm",This Disney feature-length cartoon combines the most entertaining elements of
"/media/Dados/bases/SWDE/movie/movie-allmovie/0473.htm",") questions Neal, who then begins his own investigation into the bizarre case with the help of his assistant, Anne ("
"/media/Dados/bases/SWDE/movie/movie-allmovie/1138.htm","), a malcontent who's partnered with a drifter, Robert Syverton ("
"/media/Dados/bases/SWDE/movie/movie-allmovie/0388.htm",makes his first appearance as Bond...James Bond in 1973's
"/media/Dados/bases/SWDE/movie/movie-allmovie/0005.htm",Based on stories by
"/media/Dados/bases/SWDE/movie/movie-allmovie/1525.htm",A sterling cast headed by Oscar-nominated
"/media/Dados/bases/SWDE/movie/movie-allmovie/0204.htm",This 1954 Disney version of
"/media/Dados/bases/SWDE/movie/movie-allmovie/0070.htm","In 1973, health-food store owner Miles Monroe ("
"/media/Dados/bases/SWDE/movie/movie-allmovie/0928.htm","Political rivals, divided by a bloody war, are forced to come to terms with one another in this drama, which was adapted from"
"/media/Dados/bases/SWDE/movie/movie-allmovie/1479.htm",Director
"/media/Dados/bases/SWDE/movie/movie-allmovie/0032.htm","Though he made allusions to his own life in all of his films,"
"/media/Dados/bases/SWDE/movie/movie-allmovie/0278.htm","After a break of more than 15 years, director"
"/media/Dados/bases/SWDE/movie/movie-allmovie/1397.htm","Desperate for money, frontier rancher"
"/media/Dados/bases/SWDE/movie/movie-allmovie/0527.htm",'s Oscar-winning adaptation of
"/media/Dados/bases/SWDE/movie/movie-allmovie/1100.htm","), a producer for"
"/media/Dados/bases/SWDE/movie/movie-allmovie/1954.htm","A woman realizes that friends can be lovers, but now has to convince the friend in question in this romantic comedy. Michael O'Neal ("
"/media/Dados/bases/SWDE/movie/movie-allmovie/1618.htm",and
"/media/Dados/bases/SWDE/movie/movie-allmovie/0028.htm",follows up on his critically acclaimed masterpiece
"/media/Dados/bases/SWDE/movie/movie-allmovie/1095.htm",Character actor and noted photographer
"/media/Dados/bases/SWDE/movie/movie-allmovie/0929.htm",Each film of
"/media/Dados/bases/SWDE/movie/movie-allmovie/1361.htm","A modern farce about medieval life, this is a time-travel comedy by French director"
"/media/Dados/bases/SWDE/movie/movie-allmovie/0074.htm",This modernization of
"/media/Dados/bases/SWDE/movie/movie-allmovie/0366.htm",made a bid to change her squeaky clean image with this elaborately mounted World War I musical. Lili Smith (
"/media/Dados/bases/SWDE/movie/movie-allmovie/0952.htm","In 1959 Sweden, young Ingemar ("
"/media/Dados/bases/SWDE/movie/movie-allmovie/0634.htm","Based on the testimony of survivors, this historical drama recounts the WWII heroism of female prisoners of war. ("
"/media/Dados/bases/SWDE/movie/movie-allmovie/1820.htm","Woody Allen spent most of the 1980s and '90s veering between comedy and drama, and he rarely combined the two with greater success than in"
"/media/Dados/bases/SWDE/movie/movie-allmovie/1905.htm",'s 1965 feature
"/media/Dados/bases/SWDE/movie/movie-allmovie/1009.htm",The men in
"/media/Dados/bases/SWDE/movie/movie-allmovie/1447.htm",taking refuge in a doll factory.
"/media/Dados/bases/SWDE/movie/movie-allmovie/1130.htm",Cinematographer
"/media/Dados/bases/SWDE/movie/movie-allmovie/1864.htm",Filmed independently by
"/media/Dados/bases/SWDE/movie/movie-allmovie/0034.htm",The operative word in
"/media/Dados/bases/SWDE/movie/movie-allmovie/1205.htm","directed, co-produced (with"
"/media/Dados/bases/SWDE/movie/movie-allmovie/1365.htm",Businessman Larry Burrows (
"/media/Dados/bases/SWDE/movie/movie-allmovie/1066.htm","A runaway box-office hit to the tune of 17 million dollars,"
"/media/Dados/bases/SWDE/movie/movie-allmovie/0949.htm",For the Spanish
"/media/Dados/bases/SWDE/movie/movie-allmovie/1171.htm",In the same year that filmmaker
"/media/Dados/bases/SWDE/movie/movie-allmovie/0118.htm","), Christmas Present ("
"/media/Dados/bases/SWDE/movie/movie-allmovie/1577.htm",A year after the untimely death of her husband and fellow filmmaker
"/media/Dados/bases/SWDE/movie/movie-allmovie/0553.htm",L.A. cop Martin Riggs (
"/media/Dados/bases/SWDE/movie/movie-allmovie/0246.htm","Popularly viewed as one of the best American films ever made, the multi-generational crime saga"
"/media/Dados/bases/SWDE/movie/movie-allmovie/0866.htm",Director
"/media/Dados/bases/SWDE/movie/movie-allmovie/1022.htm",' grim drama documents a romantic triangle of sorts involving prostitute Sera (
"/media/Dados/bases/SWDE/movie/movie-allmovie/1369.htm",Director
"/media/Dados/bases/SWDE/movie/movie-allmovie/1135.htm",", directed by"
"/media/Dados/bases/SWDE/movie/movie-allmovie/0160.htm",Featuring a majestic score by
"/media/Dados/bases/SWDE/movie/movie-allmovie/1887.htm",) and the intimidating Angel (
"/media/Dados/bases/SWDE/movie/movie-allmovie/1830.htm",Private eye Harry Moseby (
"/media/Dados/bases/SWDE/movie/movie-allmovie/0023.htm","Following 24 characters through 5 days in the country music capital,"
"/media/Dados/bases/SWDE/movie/movie-allmovie/1995.htm",The discovery of marital troubles in her family causes a young woman to question her own upcoming nuptials in this clever romantic comedy.
"/media/Dados/bases/SWDE/movie/movie-allmovie/0654.htm",is a Belgian faux-documentary and high-concept satire of media violence which follows the lethal exploits of Benoit
"/media/Dados/bases/SWDE/movie/movie-allmovie/0944.htm",Rodrigo de Arista (
"/media/Dados/bases/SWDE/movie/movie-allmovie/0592.htm","The true story of a gifted Australian piano prodigy, this biographical drama was nominated for seven Oscars, with actor"
"/media/Dados/bases/SWDE/movie/movie-allmovie/0439.htm",'s
"/media/Dados/bases/SWDE/movie/movie-allmovie/0137.htm",makes his feature-film directorial debut with this adaptation of
"/media/Dados/bases/SWDE/movie/movie-allmovie/0469.htm","The story begins as an innocuous romantic triangle involving wealthy, spoiled Melanie Daniels ("
"/media/Dados/bases/SWDE/movie/movie-allmovie/1652.htm",When last we left the crew of the star ship
"/media/Dados/bases/SWDE/movie/movie-allmovie/1594.htm",Long-established director
"/media/Dados/bases/SWDE/movie/movie-allmovie/0666.htm","In his directorial debut, Pulitzer Prize-winning playwright"
"/media/Dados/bases/SWDE/movie/movie-allmovie/1681.htm",Set during the
"/media/Dados/bases/SWDE/movie/movie-allmovie/0485.htm","directed this gritty drama of gangland murder and police corruption, which was considered quite violent in its day. Dave Bannion ("
"/media/Dados/bases/SWDE/movie/movie-allmovie/0927.htm","), a Laplander whose husband is off to war, scavenges for food, she runs across the bombing and finds disgraced soldier Ivan ("
"/media/Dados/bases/SWDE/movie/movie-allmovie/1364.htm",If you know the
"/media/Dados/bases/SWDE/movie/movie-allmovie/0350.htm",This modest Australian fantasy stars
"/media/Dados/bases/SWDE/movie/movie-allmovie/1828.htm",Based on the mystery novel by
"/media/Dados/bases/SWDE/movie/movie-allmovie/0100.htm",A boy's best friend is his robot in this animated adventure from
"/media/Dados/bases/SWDE/movie/movie-allmovie/0053.htm",'s whimsical tale of sweet-natured corporate rapacity features standout performances by
"/media/Dados/bases/SWDE/movie/movie-allmovie/1159.htm",Bull Meechum (
"/media/Dados/bases/SWDE/movie/movie-allmovie/0794.htm",One of the best action films starring the legendary
"/media/Dados/bases/SWDE/movie/movie-allmovie/0650.htm",From the directors of the critically acclaimed
"/media/Dados/bases/SWDE/movie/movie-allmovie/1431.htm",) to eradicate the lizard-like aliens from the body politic.
"/media/Dados/bases/SWDE/movie/movie-allmovie/1181.htm",Russian playwright
"/media/Dados/bases/SWDE/movie/movie-allmovie/0343.htm",and
"/media/Dados/bases/SWDE/movie/movie-allmovie/0584.htm",Self-involved corporate raider Edward Lewis (
"/media/Dados/bases/SWDE/movie/movie-allmovie/1195.htm",directed this adaptation of
"/media/Dados/bases/SWDE/movie/movie-allmovie/0193.htm",This comic interpretation of Alexandre Dumas's classic adventure saga picks up where 1974's
"/media/Dados/bases/SWDE/movie/movie-allmovie/1484.htm","In this loose adaptation of the 1942 horror classic of the same name, a"
"/media/Dados/bases/SWDE/movie/movie-allmovie/0645.htm",A naive girl's love for Switzerland is put to the test in this satiric comedy. Irina (
"/media/Dados/bases/SWDE/movie/movie-allmovie/1621.htm",) after their father leaves for battle as part of the Union Army. At the center is Jo March (
"/media/Dados/bases/SWDE/movie/movie-allmovie/1490.htm","directed this well-crafted thriller, which recalls the style and themes of his best-known work of the 1960s. Marie-Claire Mika Muller ("
"/media/Dados/bases/SWDE/movie/movie-allmovie/0835.htm",", seemingly along for the ride solely because of how she looks in a skintight diving suit. The film's Oscar-winning visual effects (by"
"/media/Dados/bases/SWDE/movie/movie-allmovie/0740.htm",was the first directorial effort of controversial Chinese filmmaker
"/media/Dados/bases/SWDE/movie/movie-allmovie/0984.htm",Noted actor
"/media/Dados/bases/SWDE/movie/movie-allmovie/1322.htm",In the third installment in the
"/media/Dados/bases/SWDE/movie/movie-allmovie/0163.htm",is the belated film adaptation of
"/media/Dados/bases/SWDE/movie/movie-allmovie/0970.htm",Adapted by
"/media/Dados/bases/SWDE/movie/movie-allmovie/1007.htm",' mines
"/media/Dados/bases/SWDE/movie/movie-allmovie/0011.htm",' harrowing masterpiece charts the emotional meltdown of a suburban housewife and its effects on her blue-collar Italian family.
"/media/Dados/bases/SWDE/movie/movie-allmovie/1713.htm","' blissful, evocative and non-narrative follow-up to his"
"/media/Dados/bases/SWDE/movie/movie-allmovie/0392.htm",is better in
"/media/Dados/bases/SWDE/movie/movie-allmovie/0284.htm",British writer
"/media/Dados/bases/SWDE/movie/movie-allmovie/0083.htm","More than anything else, 13-year old New Jerseyite Josh ("
"/media/Dados/bases/SWDE/movie/movie-allmovie/1600.htm",ends his cycle of
"/media/Dados/bases/SWDE/movie/movie-allmovie/1658.htm",") takes refuge in a quasi-marriage with his beloved sex robot, Cherry ("
"/media/Dados/bases/SWDE/movie/movie-allmovie/0267.htm",The feature film debut of Scottish director
"/media/Dados/bases/SWDE/movie/movie-allmovie/0230.htm",One of
"/media/Dados/bases/SWDE/movie/movie-allmovie/0110.htm","(1959) was Oscar nominated for its musical score, which featured adaptations of Tchaikovsky compositions."
"/media/Dados/bases/SWDE/movie/movie-allmovie/1163.htm",Real-life siblings
