URL,EXTRACTED VALUE
"/media/Dados/bases/SWDE/movie/movie-allmovie/1252.htm",lives in the Manhattan apartment of her latest lost love with her daughter
"/media/Dados/bases/SWDE/movie/movie-allmovie/0819.htm",'s phenomenally successful sci-fi adventure thriller is graced by state-of-the-art special effects from the team of
"/media/Dados/bases/SWDE/movie/movie-allmovie/1476.htm",) -- a kind of swashbuckling Sherlock Holmes of the occult sciences -- and his hunchbacked companion Professor Grost (
"/media/Dados/bases/SWDE/movie/movie-allmovie/0849.htm","in the carnival flick,"
"/media/Dados/bases/SWDE/movie/movie-allmovie/1286.htm",is the sixth of French director
"/media/Dados/bases/SWDE/movie/movie-allmovie/1545.htm",This thriller is adapted from the 1995 novel by
"/media/Dados/bases/SWDE/movie/movie-allmovie/1554.htm",In
"/media/Dados/bases/SWDE/movie/movie-allmovie/0816.htm",Billy Pilgrim has come unstuck in time. These opening words of
"/media/Dados/bases/SWDE/movie/movie-allmovie/1710.htm",One of
"/media/Dados/bases/SWDE/movie/movie-allmovie/0085.htm","Based on Helen Fielding's hugely popular novel, this romantic comedy follows Bridget ("
"/media/Dados/bases/SWDE/movie/movie-allmovie/0779.htm",This French coming-of-age movie marked the debut of writer-director
"/media/Dados/bases/SWDE/movie/movie-allmovie/1455.htm",Charlatan Frank Bannister (
"/media/Dados/bases/SWDE/movie/movie-allmovie/0231.htm",This cinematic/literary hybrid fuses motifs from Beat writer
"/media/Dados/bases/SWDE/movie/movie-allmovie/1629.htm",is the nominal star of
"/media/Dados/bases/SWDE/movie/movie-allmovie/0614.htm",Dutch-Australian director
"/media/Dados/bases/SWDE/movie/movie-allmovie/0393.htm",is an interesting espionage movie with some good performances.
"/media/Dados/bases/SWDE/movie/movie-allmovie/0823.htm","), Jeremy Stone ("
"/media/Dados/bases/SWDE/movie/movie-allmovie/1308.htm",ventures into
"/media/Dados/bases/SWDE/movie/movie-allmovie/1268.htm",") is the widowed matriarch of a small-town Mississippi family, which includes her nieces Camille ("
"/media/Dados/bases/SWDE/movie/movie-allmovie/0976.htm",", producer"
"/media/Dados/bases/SWDE/movie/movie-allmovie/1719.htm",This unadorned biography of playwright
"/media/Dados/bases/SWDE/movie/movie-allmovie/1748.htm",A priest is torn between church dogma and his personal beliefs in this British drama. Father Greg (
"/media/Dados/bases/SWDE/movie/movie-allmovie/0925.htm","directed this frothy tribute to the Hollywood musicals of the 1940s, a follow-up to his earlier success"
"/media/Dados/bases/SWDE/movie/movie-allmovie/0741.htm","), assisted by his son Erming ("
"/media/Dados/bases/SWDE/movie/movie-allmovie/1543.htm","Filmed on location in Montreal and New York,"
"/media/Dados/bases/SWDE/movie/movie-allmovie/1595.htm",French filmmaker
"/media/Dados/bases/SWDE/movie/movie-allmovie/1858.htm",plays an attorney whose affable Hungarian-immigrant father
"/media/Dados/bases/SWDE/movie/movie-allmovie/1148.htm",) and his loving wife (
"/media/Dados/bases/SWDE/movie/movie-allmovie/0993.htm","The film equivalent of a stroll through the Louvre, the documentary"
"/media/Dados/bases/SWDE/movie/movie-allmovie/1557.htm","Based on the controversial sequel novel of the same name,"
"/media/Dados/bases/SWDE/movie/movie-allmovie/0824.htm",Directed by British filmmaker
"/media/Dados/bases/SWDE/movie/movie-allmovie/0853.htm",An amalgam of fairy tales penned by Jewish author
"/media/Dados/bases/SWDE/movie/movie-allmovie/0172.htm",Indiana Jones (
"/media/Dados/bases/SWDE/movie/movie-allmovie/1184.htm","On the occasion of his 50th birthday, blue-collar family man"
"/media/Dados/bases/SWDE/movie/movie-allmovie/1811.htm",is a film that looks back at the rock band era of the 1970s.
"/media/Dados/bases/SWDE/movie/movie-allmovie/0264.htm",This drama about an undercover cop who learns the hidden dangers of working his way inside the mob was based on a true story. Joe Pistone (
"/media/Dados/bases/SWDE/movie/movie-allmovie/0332.htm","drive out the Blue Meanies and restore Pepperland to tranquility armed with only music, love, and witty remarks."
"/media/Dados/bases/SWDE/movie/movie-allmovie/0125.htm",Based on the popular Nickelodeon TV series
"/media/Dados/bases/SWDE/movie/movie-allmovie/0400.htm",CIA computer technician
"/media/Dados/bases/SWDE/movie/movie-allmovie/0252.htm",directed this crime caper adapted from the novel by
"/media/Dados/bases/SWDE/movie/movie-allmovie/1068.htm",This 1978 re-remake of
"/media/Dados/bases/SWDE/movie/movie-allmovie/1855.htm","They didn't kill me; I was dead already, is the statement uttered by Dexter Cornell ("
"/media/Dados/bases/SWDE/movie/movie-allmovie/1113.htm",marked the directorial debut of country singer turned actor
"/media/Dados/bases/SWDE/movie/movie-allmovie/1706.htm","A failed effort to revive the big-budget movie musical,"
"/media/Dados/bases/SWDE/movie/movie-allmovie/0447.htm","Big-budget special effects, swiftly paced action, and a distinct feminist subtext from writer/director"
"/media/Dados/bases/SWDE/movie/movie-allmovie/0647.htm","In an Austrian farming village during the '30s, narrator Severin ("
"/media/Dados/bases/SWDE/movie/movie-allmovie/1227.htm",'s adaptation of William Shakespeare's
"/media/Dados/bases/SWDE/movie/movie-allmovie/1149.htm",made his directorial debut and
"/media/Dados/bases/SWDE/movie/movie-allmovie/0176.htm",German filmmaker
"/media/Dados/bases/SWDE/movie/movie-allmovie/1599.htm",'s
"/media/Dados/bases/SWDE/movie/movie-allmovie/1097.htm",Two women connected by family are drawn closer by fate in this low-key drama. Frances (
"/media/Dados/bases/SWDE/movie/movie-allmovie/1539.htm",Based on
"/media/Dados/bases/SWDE/movie/movie-allmovie/1553.htm","A tortured man finds himself caught in a middle-ground between hallucination and reality in this supernatural thriller, scripted by"
"/media/Dados/bases/SWDE/movie/movie-allmovie/0301.htm",'s
"/media/Dados/bases/SWDE/movie/movie-allmovie/0982.htm",. William Thacker (played by
"/media/Dados/bases/SWDE/movie/movie-allmovie/1457.htm",meets
"/media/Dados/bases/SWDE/movie/movie-allmovie/1581.htm","Based on a real-life case study, recorded in"
"/media/Dados/bases/SWDE/movie/movie-allmovie/1587.htm",'s
"/media/Dados/bases/SWDE/movie/movie-allmovie/0803.htm",The second entry in
"/media/Dados/bases/SWDE/movie/movie-allmovie/0368.htm","), British spy Paula Caplan ("
"/media/Dados/bases/SWDE/movie/movie-allmovie/0552.htm",", the Thomas Harris novel that introduced serial killer Hannibal Lecter to the world, was adapted for the screen by"
"/media/Dados/bases/SWDE/movie/movie-allmovie/1489.htm","After forays into film noir, thrillers, dramas, and even documentaries, director"
"/media/Dados/bases/SWDE/movie/movie-allmovie/0676.htm",'s thriller
"/media/Dados/bases/SWDE/movie/movie-allmovie/0315.htm","The fortunes of a family of Hungarian Jews are followed over the course of nearly 150 years in this epic historical drama, with leading man"
"/media/Dados/bases/SWDE/movie/movie-allmovie/0012.htm",All the animals come out at night -- and one of them is a cabby about to snap. In
"/media/Dados/bases/SWDE/movie/movie-allmovie/1374.htm",) and a subsequent slapstick sequence upstage (
"/media/Dados/bases/SWDE/movie/movie-allmovie/1996.htm",A new '90s expressiveness regarding homosexuality in movies is gently mined for laughs in this 1993 comedy that predates the similar but much more raw
"/media/Dados/bases/SWDE/movie/movie-allmovie/1718.htm",Based on the novel by
"/media/Dados/bases/SWDE/movie/movie-allmovie/0082.htm",'s Broadway hit was transferred to the screen with only a few passing nods to the stricter censorship required by films.
"/media/Dados/bases/SWDE/movie/movie-allmovie/0986.htm","Based on the 1902 Henry James novel of the same name,"
"/media/Dados/bases/SWDE/movie/movie-allmovie/0505.htm",Four years after setting box offices ablaze in
"/media/Dados/bases/SWDE/movie/movie-allmovie/0380.htm","made his first appearance as James Bond in this action thriller, the 17th in the series (excluding the 1967"
"/media/Dados/bases/SWDE/movie/movie-allmovie/1141.htm","), Alex to her friends, has a younger man as her sometime lover, the young sculptor Bob Elkin ("
"/media/Dados/bases/SWDE/movie/movie-allmovie/1537.htm","), continues his investigation with his colleague Vernon Bayliss ("
"/media/Dados/bases/SWDE/movie/movie-allmovie/1796.htm",British filmmaker
"/media/Dados/bases/SWDE/movie/movie-allmovie/1004.htm",marks the directorial debut for actress
"/media/Dados/bases/SWDE/movie/movie-allmovie/1840.htm",Rusty Sabich (
"/media/Dados/bases/SWDE/movie/movie-allmovie/1507.htm",", and"
"/media/Dados/bases/SWDE/movie/movie-allmovie/1285.htm","A smaller, amusing comedy from writer/director"
"/media/Dados/bases/SWDE/movie/movie-allmovie/0595.htm",stars in this period political thriller directed by
"/media/Dados/bases/SWDE/movie/movie-allmovie/1465.htm",'s
"/media/Dados/bases/SWDE/movie/movie-allmovie/0335.htm",Independent filmmaker
"/media/Dados/bases/SWDE/movie/movie-allmovie/1440.htm",adapted the screenplay of
"/media/Dados/bases/SWDE/movie/movie-allmovie/1732.htm",Writer/director
"/media/Dados/bases/SWDE/movie/movie-allmovie/0497.htm",The my in
"/media/Dados/bases/SWDE/movie/movie-allmovie/1219.htm","Unhappy with her job and her loser boyfriend,"
"/media/Dados/bases/SWDE/movie/movie-allmovie/0638.htm","plays a French woman who travels to Australia after leaving her husband. Injured in an accident,"
"/media/Dados/bases/SWDE/movie/movie-allmovie/1635.htm",We first see Asian cave dweller
"/media/Dados/bases/SWDE/movie/movie-allmovie/0389.htm",finds director
"/media/Dados/bases/SWDE/movie/movie-allmovie/0022.htm",") has had an errand-boy job because of the influence of his brother Charley, a crooked union lawyer ("
"/media/Dados/bases/SWDE/movie/movie-allmovie/1725.htm","Based on a novel by Evelyn Waugh,"
"/media/Dados/bases/SWDE/movie/movie-allmovie/1524.htm",This is the third film based on
"/media/Dados/bases/SWDE/movie/movie-allmovie/0104.htm",", also the author of"
"/media/Dados/bases/SWDE/movie/movie-allmovie/0836.htm",) -- and suddenly has a flash-forward to a nuclear holocaust.
"/media/Dados/bases/SWDE/movie/movie-allmovie/1837.htm",The
"/media/Dados/bases/SWDE/movie/movie-allmovie/0922.htm",Having previously staged
"/media/Dados/bases/SWDE/movie/movie-allmovie/0458.htm","A gripping exercise in body horror and social paranoia, prolific Canadian director"
"/media/Dados/bases/SWDE/movie/movie-allmovie/1357.htm",A darkly comic and surreal contemporization of
"/media/Dados/bases/SWDE/movie/movie-allmovie/0867.htm",Italian filmmaker
"/media/Dados/bases/SWDE/movie/movie-allmovie/0909.htm",The second feature in filmmaker
"/media/Dados/bases/SWDE/movie/movie-allmovie/0846.htm","). However, if the force of evil presents itself to the stones instead, the Earth will be destroyed, and an evil being named Zorg ("
"/media/Dados/bases/SWDE/movie/movie-allmovie/0026.htm",The film that elevated German director
"/media/Dados/bases/SWDE/movie/movie-allmovie/1436.htm","Adapted from a Fred Mustard Stewart novel, this offbeat occult thriller stars"
"/media/Dados/bases/SWDE/movie/movie-allmovie/0486.htm","is a brilliantly conceived and executed anatomy of a crime -- or, as director"
"/media/Dados/bases/SWDE/movie/movie-allmovie/0660.htm","stars as Rio de Janeiro journalist Fernando Gabeira, who decides with his friend Cesar ("
"/media/Dados/bases/SWDE/movie/movie-allmovie/1646.htm","In this sci-fi/horror scarefest, Dr. William Weir ("
"/media/Dados/bases/SWDE/movie/movie-allmovie/0881.htm",Idiosyncratic auteur
"/media/Dados/bases/SWDE/movie/movie-allmovie/0297.htm",The sophomore film effort from music video director
"/media/Dados/bases/SWDE/movie/movie-allmovie/0559.htm","Greed is Good. This is the credo of the aptly named Gordon Gekko (Michael Douglas), the antihero of Oliver Stone's"
"/media/Dados/bases/SWDE/movie/movie-allmovie/0915.htm",Adapted from
"/media/Dados/bases/SWDE/movie/movie-allmovie/1281.htm",From director
"/media/Dados/bases/SWDE/movie/movie-allmovie/1034.htm","), Conrad can't shake the belief that he should have died instead of his brother; nor do his preoccupied parents ("
"/media/Dados/bases/SWDE/movie/movie-allmovie/1295.htm","Featuring a soundtrack filled with beloved standard songs such as Just You, Just Me and My Baby Just Cares for Me, this musical comedy by"
"/media/Dados/bases/SWDE/movie/movie-allmovie/1897.htm","After being blacklisted from Hollywood for 21 years, writer/director"
"/media/Dados/bases/SWDE/movie/movie-allmovie/0788.htm",) and Ken (
"/media/Dados/bases/SWDE/movie/movie-allmovie/1827.htm",Psychiatrist Alex (
"/media/Dados/bases/SWDE/movie/movie-allmovie/1945.htm",Based on
"/media/Dados/bases/SWDE/movie/movie-allmovie/0566.htm",") has the opposite problem; a trust-fund baby with body-image issues and little sexual experience, she's hung up on Billy ("
"/media/Dados/bases/SWDE/movie/movie-allmovie/0525.htm","cuts a startlingly new and powerful heroic figure as John Shaft, the cat who won't cop out, when there's danger all about in"
"/media/Dados/bases/SWDE/movie/movie-allmovie/0444.htm","Considered fairly gruesome in its day, the original 1958"
"/media/Dados/bases/SWDE/movie/movie-allmovie/1288.htm",In this comedy from
"/media/Dados/bases/SWDE/movie/movie-allmovie/1512.htm",The true-life horror story of Jack the Ripper gets a new spin in this screen adaptation of the acclaimed graphic novel by
"/media/Dados/bases/SWDE/movie/movie-allmovie/1081.htm",The dark-horse box-office hit
"/media/Dados/bases/SWDE/movie/movie-allmovie/1955.htm",The classic
"/media/Dados/bases/SWDE/movie/movie-allmovie/0431.htm","Using relatively unknown actors, first-time screenwriter-director"
"/media/Dados/bases/SWDE/movie/movie-allmovie/1972.htm","In this romantic comedy, two people brought together by marriage are brought even closer by their mates. Maria Hardy ("
"/media/Dados/bases/SWDE/movie/movie-allmovie/1740.htm",was based on the semi-autobiographical book by
"/media/Dados/bases/SWDE/movie/movie-allmovie/1893.htm",This routine western finds Union Colonel John Henry Thomas (
"/media/Dados/bases/SWDE/movie/movie-allmovie/1434.htm","is a surprisingly artful and imaginative horror film, an impressive film for 23-year-old director"
"/media/Dados/bases/SWDE/movie/movie-allmovie/0919.htm",Based extremely loosely on the Stephen Vincent Benet story
"/media/Dados/bases/SWDE/movie/movie-allmovie/0641.htm",Guy (
"/media/Dados/bases/SWDE/movie/movie-allmovie/0227.htm","This twisted black comedy is obsessed in turn with swans, twins, and decay. Alba Bewick ("
"/media/Dados/bases/SWDE/movie/movie-allmovie/0878.htm","In 1962, he wrote a companion book,"
"/media/Dados/bases/SWDE/movie/movie-allmovie/0776.htm",A woman's long history of bad luck starts to change when she puts her life on the line in this romantic drama. Adle (
"/media/Dados/bases/SWDE/movie/movie-allmovie/0734.htm",", a charter member of China's politically beleaguered, so-called Fifth Generation of Directors (along with"
"/media/Dados/bases/SWDE/movie/movie-allmovie/1953.htm",A woman is torn by both romantic and maternal love in this period romantic drama set in the 1830s. Elisabeth (
"/media/Dados/bases/SWDE/movie/movie-allmovie/1550.htm",The polar-opposite worlds of opera and horror collide in this gory giallo film from director
"/media/Dados/bases/SWDE/movie/movie-allmovie/0258.htm","Based on a true 1972 story,"
"/media/Dados/bases/SWDE/movie/movie-allmovie/0067.htm",The sophomore directorial effort from ill-fated Japanese filmmaker
"/media/Dados/bases/SWDE/movie/movie-allmovie/0532.htm","Endlessly imitated,"
"/media/Dados/bases/SWDE/movie/movie-allmovie/1936.htm","is a colorful, action-packed western feature with an all-star cast. Mackenna ("
"/media/Dados/bases/SWDE/movie/movie-allmovie/0290.htm",This directorial effort from
"/media/Dados/bases/SWDE/movie/movie-allmovie/1560.htm",is based on
"/media/Dados/bases/SWDE/movie/movie-allmovie/1214.htm",and
"/media/Dados/bases/SWDE/movie/movie-allmovie/0567.htm",After the highly acclaimed independent film
"/media/Dados/bases/SWDE/movie/movie-allmovie/1154.htm",Dreams die hard in wintry Atlantic City in
"/media/Dados/bases/SWDE/movie/movie-allmovie/0241.htm","Though some viewers might be put off by its length, graphic violence, and absence of likable characters,"
"/media/Dados/bases/SWDE/movie/movie-allmovie/0200.htm",The third installment in the widely beloved
"/media/Dados/bases/SWDE/movie/movie-allmovie/0365.htm",Borrowing liberally from the French film
"/media/Dados/bases/SWDE/movie/movie-allmovie/0608.htm","Set in Australia in the 1930s, this drama stars"
"/media/Dados/bases/SWDE/movie/movie-allmovie/0275.htm",The
"/media/Dados/bases/SWDE/movie/movie-allmovie/0575.htm","Reminiscent of a fine novel in depth and complexity, writer-director"
"/media/Dados/bases/SWDE/movie/movie-allmovie/1101.htm","Based on a true story, this drama was adapted from the life of"
"/media/Dados/bases/SWDE/movie/movie-allmovie/0228.htm",Puzzle-master
"/media/Dados/bases/SWDE/movie/movie-allmovie/1915.htm",Maverick writer-director
"/media/Dados/bases/SWDE/movie/movie-allmovie/1884.htm",Who are you? the dwarf Mordecai (
"/media/Dados/bases/SWDE/movie/movie-allmovie/0167.htm",stars
"/media/Dados/bases/SWDE/movie/movie-allmovie/0285.htm","Set amidst the eerie desolation of the Australian outback,"
"/media/Dados/bases/SWDE/movie/movie-allmovie/0222.htm",In typical
"/media/Dados/bases/SWDE/movie/movie-allmovie/1446.htm",Director
"/media/Dados/bases/SWDE/movie/movie-allmovie/0914.htm",Reportedly the third in acclaimed director
"/media/Dados/bases/SWDE/movie/movie-allmovie/1011.htm","Based on a true story,"
"/media/Dados/bases/SWDE/movie/movie-allmovie/0721.htm","Lensed on a smile and a shoeshine on 16 millimeter,"
"/media/Dados/bases/SWDE/movie/movie-allmovie/1301.htm",The starring cast of the hit
"/media/Dados/bases/SWDE/movie/movie-allmovie/1901.htm",A former friend betrays a legendary outlaw in
"/media/Dados/bases/SWDE/movie/movie-allmovie/0090.htm","), Santa (voice of"
"/media/Dados/bases/SWDE/movie/movie-allmovie/1727.htm",John Fowles' original novel
"/media/Dados/bases/SWDE/movie/movie-allmovie/1386.htm",About ten minutes into
"/media/Dados/bases/SWDE/movie/movie-allmovie/0279.htm",In
"/media/Dados/bases/SWDE/movie/movie-allmovie/1793.htm","Calling to mind the whimsical, swinging London comedies of the 1960s, such as the"
"/media/Dados/bases/SWDE/movie/movie-allmovie/1862.htm",Director
"/media/Dados/bases/SWDE/movie/movie-allmovie/0640.htm",After his Oscar-winning performance in
"/media/Dados/bases/SWDE/movie/movie-allmovie/1645.htm",Director
"/media/Dados/bases/SWDE/movie/movie-allmovie/1269.htm",Just as the charming British film
"/media/Dados/bases/SWDE/movie/movie-allmovie/0271.htm","Thoroughly disillusioned by the Vietnam War, John, a journalist ("
"/media/Dados/bases/SWDE/movie/movie-allmovie/0804.htm","A blend of science fiction and noir detective fiction,"
"/media/Dados/bases/SWDE/movie/movie-allmovie/0098.htm",In this reteaming of actor
"/media/Dados/bases/SWDE/movie/movie-allmovie/1816.htm",'s documentary of the 1976 final performance of the legendary Sixties rock group
"/media/Dados/bases/SWDE/movie/movie-allmovie/1472.htm",Horror auteur
"/media/Dados/bases/SWDE/movie/movie-allmovie/1172.htm","Shot against the barren sand dunes of Africa's Namib Desert,"
"/media/Dados/bases/SWDE/movie/movie-allmovie/0229.htm","Usually misattributed to the horror genre, this challenging and highly unusual drama stars"
"/media/Dados/bases/SWDE/movie/movie-allmovie/1249.htm","In this early film, award-winning director"
"/media/Dados/bases/SWDE/movie/movie-allmovie/1237.htm",In
"/media/Dados/bases/SWDE/movie/movie-allmovie/1055.htm",") is the smart but silly one, Dylan ("
"/media/Dados/bases/SWDE/movie/movie-allmovie/0242.htm",Though
"/media/Dados/bases/SWDE/movie/movie-allmovie/1592.htm",is one of a handful of amiable character studies (and the last one to date) directed by
"/media/Dados/bases/SWDE/movie/movie-allmovie/0943.htm",A boy goes on a vacation with his father and ends up taking the ride of his life in the comedy
"/media/Dados/bases/SWDE/movie/movie-allmovie/1486.htm",A sinister illusionist gets away with ghastly murders on-stage in this unique horror story. Though Montag the Magnificent (
"/media/Dados/bases/SWDE/movie/movie-allmovie/0076.htm",takes a scalpel to Hollywood ethics in the 1990s (or the lack thereof) in his acidic satire
"/media/Dados/bases/SWDE/movie/movie-allmovie/0058.htm","Vulgar, crude, and occasionally scandalous in its racial humor, this hilarious bad-taste spoof of Westerns, co-written by"
"/media/Dados/bases/SWDE/movie/movie-allmovie/1546.htm",Jerry Fletcher (
"/media/Dados/bases/SWDE/movie/movie-allmovie/0466.htm",This high-octane semi-sequel to
"/media/Dados/bases/SWDE/movie/movie-allmovie/1098.htm",Following on the heels of director
"/media/Dados/bases/SWDE/movie/movie-allmovie/0796.htm",'s classic
"/media/Dados/bases/SWDE/movie/movie-allmovie/1387.htm",'s fifth film as a director and eighth Western as a star (ninth if you count
"/media/Dados/bases/SWDE/movie/movie-allmovie/0415.htm",". Like Nicholson, cynical journalist Henderson ("
"/media/Dados/bases/SWDE/movie/movie-allmovie/1454.htm",This above-average horror film concerns a young couple (
"/media/Dados/bases/SWDE/movie/movie-allmovie/0546.htm",College friends reunite for a New England summer weekend in this low-budget first feature by accomplished independent filmmaker
"/media/Dados/bases/SWDE/movie/movie-allmovie/0304.htm","ranked as the most expensive film in Hollywood history at the time of its release, and became the most successful. Writer-director"
"/media/Dados/bases/SWDE/movie/movie-allmovie/1722.htm",Like many of
"/media/Dados/bases/SWDE/movie/movie-allmovie/1264.htm",One of
"/media/Dados/bases/SWDE/movie/movie-allmovie/0965.htm","Noted for intimate character studies created in collaboration with his actors, director"
"/media/Dados/bases/SWDE/movie/movie-allmovie/0175.htm","Though generally unknown to Western audiences,"
"/media/Dados/bases/SWDE/movie/movie-allmovie/0375.htm",Having already been seen spying for the Nazis in 1979's
"/media/Dados/bases/SWDE/movie/movie-allmovie/1233.htm",directed this adaptation of
"/media/Dados/bases/SWDE/movie/movie-allmovie/1684.htm",A family history is recalled by the venerable patriarch Carlo (
"/media/Dados/bases/SWDE/movie/movie-allmovie/1025.htm","It's 1958, and the producers of the quiz show"
"/media/Dados/bases/SWDE/movie/movie-allmovie/1563.htm",) dining together. Is she a paranoid conspiracy theorist or a sleuth uncovering a bizarre murder mystery? When a retired secretary (
"/media/Dados/bases/SWDE/movie/movie-allmovie/0353.htm",) and his beautiful associate Aki (
"/media/Dados/bases/SWDE/movie/movie-allmovie/0322.htm",This biography of Oliver Cromwell recalls the political and religious struggles of 17th century England. Cromwell (
"/media/Dados/bases/SWDE/movie/movie-allmovie/1174.htm",Writer/director
"/media/Dados/bases/SWDE/movie/movie-allmovie/0717.htm","Ten years after he disappeared from his family's life, Sweet William ("
"/media/Dados/bases/SWDE/movie/movie-allmovie/0135.htm","), Pu Yi plots an escape from his cocoon by means of marriage. He selects Manchu descendant Wan Jung ("
"/media/Dados/bases/SWDE/movie/movie-allmovie/0985.htm",) returns to his old neighborhood and sees former-flame Maggie (
"/media/Dados/bases/SWDE/movie/movie-allmovie/1298.htm",Director
"/media/Dados/bases/SWDE/movie/movie-allmovie/1394.htm",This musical spoof of Westerns featured
"/media/Dados/bases/SWDE/movie/movie-allmovie/0603.htm","This stunning, post-apocalyptic action thriller from director"
"/media/Dados/bases/SWDE/movie/movie-allmovie/1284.htm",added a classic comic hero to the film landscape with
"/media/Dados/bases/SWDE/movie/movie-allmovie/0842.htm",Canadian filmmaker
"/media/Dados/bases/SWDE/movie/movie-allmovie/0715.htm",Written and directed by Canadian filmmaker
"/media/Dados/bases/SWDE/movie/movie-allmovie/1202.htm",Peter Gibbons (
"/media/Dados/bases/SWDE/movie/movie-allmovie/1924.htm",Ex-lawman turned rancher Jed Cooper (
"/media/Dados/bases/SWDE/movie/movie-allmovie/1614.htm",The ads for
"/media/Dados/bases/SWDE/movie/movie-allmovie/1921.htm","Writer, director, and star"
"/media/Dados/bases/SWDE/movie/movie-allmovie/0839.htm",Based on the novella by
"/media/Dados/bases/SWDE/movie/movie-allmovie/1044.htm",). Both Xavier and Magneto also have to contend with Senator Kelly (
"/media/Dados/bases/SWDE/movie/movie-allmovie/0119.htm",is the heartwarming true story of a British couple who teach their pet lioness how to survive in the wilds of the African jungles.
"/media/Dados/bases/SWDE/movie/movie-allmovie/1667.htm",Directed by former
"/media/Dados/bases/SWDE/movie/movie-allmovie/1798.htm",Violence and anti-gay prejudice combine to make a heated custody battle all the more ugly in this tense domestic drama. Hannah Wyatt (
"/media/Dados/bases/SWDE/movie/movie-allmovie/0426.htm",stars in
"/media/Dados/bases/SWDE/movie/movie-allmovie/0385.htm",The title of the 1983 James Bond adventure
"/media/Dados/bases/SWDE/movie/movie-allmovie/1757.htm",Based on
"/media/Dados/bases/SWDE/movie/movie-allmovie/0396.htm",Director
"/media/Dados/bases/SWDE/movie/movie-allmovie/1151.htm",The final film of stars
"/media/Dados/bases/SWDE/movie/movie-allmovie/1459.htm",becomes a werewolf in this bizarre comedy-horror film directed by
"/media/Dados/bases/SWDE/movie/movie-allmovie/1039.htm","directed this minimalist chase film, starring"
