URL,EXTRACTED VALUE
"/sdd/edimar/Desktop/doutorado/doutorado04/bases/WEIR/finance/quotes.stocknod.com/wb.html",Schaeffer's Andrea Kramer takes a look at unusual option activity on the Street
"/sdd/edimar/Desktop/doutorado/doutorado04/bases/WEIR/finance/quotes.stocknod.com/kbh.html",Elizabeth Harrow takes a look back at news that drove the major market indices today.
"/sdd/edimar/Desktop/doutorado/doutorado04/bases/WEIR/finance/quotes.stocknod.com/mar.html",Andrea Kramer takes a look back at news that drove the major market indices today.
"/sdd/edimar/Desktop/doutorado/doutorado04/bases/WEIR/finance/quotes.stocknod.com/ges.html",Elizabeth Harrow takes a look back at news that drove the major market indices today.
"/sdd/edimar/Desktop/doutorado/doutorado04/bases/WEIR/finance/quotes.stocknod.com/vc.html","General Motors, IMPART Media Group, SonicWALL, Alloy, Inc, RadioShack, Seacoast Banking Corp"
"/sdd/edimar/Desktop/doutorado/doutorado04/bases/WEIR/finance/quotes.stocknod.com/amgn.html",Schaeffer's analyst Colleen S. King takes a look back at the major news of the day on Wall Street.
"/sdd/edimar/Desktop/doutorado/doutorado04/bases/WEIR/finance/quotes.stocknod.com/csco.html",Schaeffer's Andrea Kramer takes a look at unusual option activity on the Street
"/sdd/edimar/Desktop/doutorado/doutorado04/bases/WEIR/finance/quotes.stocknod.com/tif.html",Schaeffer's analyst Colleen S. King takes a look at the major news of the day on Wall Street.
"/sdd/edimar/Desktop/doutorado/doutorado04/bases/WEIR/finance/quotes.stocknod.com/jbl.html",Elizabeth Harrow takes a look back at news that drove the major market indices today.
"/sdd/edimar/Desktop/doutorado/doutorado04/bases/WEIR/finance/quotes.stocknod.com/hum.html",Joseph Hargett takes a look back at news that drove the major market indices today.
"/sdd/edimar/Desktop/doutorado/doutorado04/bases/WEIR/finance/quotes.stocknod.com/bbi.html",Colleen King takes a look at news on the Street after the market close.
"/sdd/edimar/Desktop/doutorado/doutorado04/bases/WEIR/finance/quotes.stocknod.com/bmc.html",Schaeffer's Colleen King takes a look at activity on the Street after the market close
"/sdd/edimar/Desktop/doutorado/doutorado04/bases/WEIR/finance/quotes.stocknod.com/fpl.html",Tom Dorsey and Tammy DeRosier - Lights Out - Stock Picker's Market
"/sdd/edimar/Desktop/doutorado/doutorado04/bases/WEIR/finance/quotes.stocknod.com/gm.html",Schaeffer's analyst Morgan Searcy takes a look at news on the Street.
