URL,EXTRACTED VALUE
"/sdd/edimar/Desktop/doutorado/doutorado04/bases/WEIR/finance/quotes.stocknod.com/lnc.html",The Annual AIFA Conference - Day One
"/sdd/edimar/Desktop/doutorado/doutorado04/bases/WEIR/finance/quotes.stocknod.com/hlth.html",Tom Dorsey and Tammy DeRosier talk about the Market and the Release of Point and Figure Charting 3rd Edition
"/sdd/edimar/Desktop/doutorado/doutorado04/bases/WEIR/finance/quotes.stocknod.com/dltr.html",Fourth Quarter 2006 Earnings Results Conference Call
"/sdd/edimar/Desktop/doutorado/doutorado04/bases/WEIR/finance/quotes.stocknod.com/gpc.html","Two Wall Street Analysts Review Value Line's March 30, 2007 Edition"
"/sdd/edimar/Desktop/doutorado/doutorado04/bases/WEIR/finance/quotes.stocknod.com/nwl.html","Two Wall Street Analysts Review Value Line's January 5, 2007 Edition"
"/sdd/edimar/Desktop/doutorado/doutorado04/bases/WEIR/finance/quotes.stocknod.com/uis.html","Yahoo, eBay, Centene Corp, EMAK Worldwide, Alloy, Inc, Rentech, Inc, Teva Pharmaceuticals, Magic Software Enterprises"
"/sdd/edimar/Desktop/doutorado/doutorado04/bases/WEIR/finance/quotes.stocknod.com/altr.html","Time Warner, Microsoft, Apple Computer, Playboy Enterprises, Nike, Nanophase Technologies"
"/sdd/edimar/Desktop/doutorado/doutorado04/bases/WEIR/finance/quotes.stocknod.com/fitb.html",Schaeffer's Carly Schaeffer takes a look at activity on the Street ahead of the market open
"/sdd/edimar/Desktop/doutorado/doutorado04/bases/WEIR/finance/quotes.stocknod.com/fo.html",Schaeffer's Laura Houser takes a look at activity on the Street ahead of the market open
"/sdd/edimar/Desktop/doutorado/doutorado04/bases/WEIR/finance/quotes.stocknod.com/cpwr.html","Johnson Controls, Advanced Micro Devices, Interactive Intelligence, Capital One Financial, Hyperion Solutions"
"/sdd/edimar/Desktop/doutorado/doutorado04/bases/WEIR/finance/quotes.stocknod.com/tkr.html","Two Wall Street Analysts Review Value Line's June 23, 2006 Edition"
"/sdd/edimar/Desktop/doutorado/doutorado04/bases/WEIR/finance/quotes.stocknod.com/pll.html","Goldman Sachs, Lehman Brothers, Telefonica De Argentina, Verizon, Deutsche Telekom, Evergreen Solar, Peabody Energy"
"/sdd/edimar/Desktop/doutorado/doutorado04/bases/WEIR/finance/quotes.stocknod.com/pby.html",Elizabeth Harrow takes a look back at news that drove the major market indices today.
"/sdd/edimar/Desktop/doutorado/doutorado04/bases/WEIR/finance/quotes.stocknod.com/ust.html","Two Wall Street Analysts Review Value Line's February 2, 2007 Edition"
"/sdd/edimar/Desktop/doutorado/doutorado04/bases/WEIR/finance/quotes.stocknod.com/fe.html",Midwest Utilities Seminar
"/sdd/edimar/Desktop/doutorado/doutorado04/bases/WEIR/finance/quotes.stocknod.com/bdx.html",Two Underground Wall Street Analysts Review Value Line's Mar 3 2006 Stock Picks
"/sdd/edimar/Desktop/doutorado/doutorado04/bases/WEIR/finance/quotes.stocknod.com/sape.html","Astea International, Generex Biotechnology, NYSE Group, Applied Materials, Intuitive Surgical, Baidu.com"
"/sdd/edimar/Desktop/doutorado/doutorado04/bases/WEIR/finance/quotes.stocknod.com/zqk.html",Back to School... Back to the Markets with Tammy Derosier and Paul Keeton
"/sdd/edimar/Desktop/doutorado/doutorado04/bases/WEIR/finance/quotes.stocknod.com/nsc.html",Andrea Kramer takes a look at today's unusual options activity.
"/sdd/edimar/Desktop/doutorado/doutorado04/bases/WEIR/finance/quotes.stocknod.com/sanm.html",Joseph Hargett takes a look at events driving the market today.
"/sdd/edimar/Desktop/doutorado/doutorado04/bases/WEIR/finance/quotes.stocknod.com/swy.html","McDonalds Inks Deal to Distribute Arch Cards at Safeway, Inc Locations"
"/sdd/edimar/Desktop/doutorado/doutorado04/bases/WEIR/finance/quotes.stocknod.com/molx.html",Second Quarter 2007 Earnings Conference Call
"/sdd/edimar/Desktop/doutorado/doutorado04/bases/WEIR/finance/quotes.stocknod.com/tup.html","Two Wall Street Analysts Review Value Line's January 5, 2007 Edition"
"/sdd/edimar/Desktop/doutorado/doutorado04/bases/WEIR/finance/quotes.stocknod.com/mstr.html","Ford Motor, Pepsico, RadioShack, Whole Foods Market, Weight Watchers Intl, InfoSonics, Dell Inc"
