URL,EXTRACTED VALUE
"/sdd/edimar/Desktop/doutorado/doutorado04/bases/WEIR/finance/quotes.stocknod.com/stj.html","General Motors, IMPART Media Group, SonicWALL, Alloy, Inc, RadioShack, Seacoast Banking Corp"
"/sdd/edimar/Desktop/doutorado/doutorado04/bases/WEIR/finance/quotes.stocknod.com/bk.html",Joseph Hargett takes a look at new on the Street prior to the start of trading.
"/sdd/edimar/Desktop/doutorado/doutorado04/bases/WEIR/finance/quotes.stocknod.com/bce.html",Schaeffer's analyst Colleen S. King takes a look at the major news of the day on Wall Street.
"/sdd/edimar/Desktop/doutorado/doutorado04/bases/WEIR/finance/quotes.stocknod.com/mbi.html",Schaeffer's Colleen S. King takes a look at activity on the Street after the market close
"/sdd/edimar/Desktop/doutorado/doutorado04/bases/WEIR/finance/quotes.stocknod.com/flex.html",Joseph Hargett takes a look back at news that drove the major market indices today.
"/sdd/edimar/Desktop/doutorado/doutorado04/bases/WEIR/finance/quotes.stocknod.com/ncr.html","Two Veteran Wall Street Analysts Review the July 11, 2008 Edition of the Value Line Investment Survey"
"/sdd/edimar/Desktop/doutorado/doutorado04/bases/WEIR/finance/quotes.stocknod.com/wwy.html",Tammy DeRosier and Jay Ball - Dow Jones vs. New York Stock Exchange Bullish Percent
"/sdd/edimar/Desktop/doutorado/doutorado04/bases/WEIR/finance/quotes.stocknod.com/oi.html","Two Wall Street Analysts Review Value Line's January 5, 2007 Edition"
"/sdd/edimar/Desktop/doutorado/doutorado04/bases/WEIR/finance/quotes.stocknod.com/brcd.html",Ed Stenson takes a look at market news before the open.
"/sdd/edimar/Desktop/doutorado/doutorado04/bases/WEIR/finance/quotes.stocknod.com/nvda.html",Schaeffer's Laura Houser takes a look at activity on the Street after the market close
"/sdd/edimar/Desktop/doutorado/doutorado04/bases/WEIR/finance/quotes.stocknod.com/affx.html",Elizabeth Harrow takes a look back at news that drove the major market indices today.
"/sdd/edimar/Desktop/doutorado/doutorado04/bases/WEIR/finance/quotes.stocknod.com/ntrs.html","Two Veteran Wall Street Analysts discuss: (Vern:) LMT, AVAV, CRS; (Val:) CLF, NTRS, LH"
"/sdd/edimar/Desktop/doutorado/doutorado04/bases/WEIR/finance/quotes.stocknod.com/eds.html","Two Wall Street Analysts Review Value Line's November 24, 2006 Edition"
"/sdd/edimar/Desktop/doutorado/doutorado04/bases/WEIR/finance/quotes.stocknod.com/xlnx.html",Schaeffer's analyst Colleen S. King takes a look at the major news of the day on Wall Street.
"/sdd/edimar/Desktop/doutorado/doutorado04/bases/WEIR/finance/quotes.stocknod.com/mlnm.html",Ryan Detrick and Ed Stenson take a look at the Energy Sector
"/sdd/edimar/Desktop/doutorado/doutorado04/bases/WEIR/finance/quotes.stocknod.com/g.html",Q3 2007 Earnings Results Conference Call Webcast
"/sdd/edimar/Desktop/doutorado/doutorado04/bases/WEIR/finance/quotes.stocknod.com/adp.html",Tom Dorsey and Tammy DeRosier - Understanding Covered Writes
"/sdd/edimar/Desktop/doutorado/doutorado04/bases/WEIR/finance/quotes.stocknod.com/phg.html","Freescale Semiconductor, Hewlett-Packard, Nutrisystem, Autozone, Apple Computer, FortuNet Inc, Luna Innovations"
"/sdd/edimar/Desktop/doutorado/doutorado04/bases/WEIR/finance/quotes.stocknod.com/bac.html",Schaeffer's Andrea Kramer takes a look at unusual option activity on the Street
"/sdd/edimar/Desktop/doutorado/doutorado04/bases/WEIR/finance/quotes.stocknod.com/n.html","Abercrombie and Fitch, American Eagle Outfitters, Mills Corp, Daktronics, Ford Motor Co, The Gap"
"/sdd/edimar/Desktop/doutorado/doutorado04/bases/WEIR/finance/quotes.stocknod.com/jnpr.html",Schaeffer's Laura Houser takes a look at activity on the Street ahead of the market open
"/sdd/edimar/Desktop/doutorado/doutorado04/bases/WEIR/finance/quotes.stocknod.com/tmo.html","Two Veteran Wall Street Analysts Review the November 28, 2008 Edition of the Value Line Investment Survey"
"/sdd/edimar/Desktop/doutorado/doutorado04/bases/WEIR/finance/quotes.stocknod.com/dri.html",Schaeffer's Laura Houser takes a look at activity on the Street ahead of the market open
"/sdd/edimar/Desktop/doutorado/doutorado04/bases/WEIR/finance/quotes.stocknod.com/mxim.html","Hewlett-Packard,Spectrum Brands,Magic Software,InPhonic,Rick’s Cabaret International, Books-A-Million"
"/sdd/edimar/Desktop/doutorado/doutorado04/bases/WEIR/finance/quotes.stocknod.com/tibx.html",Ian Stansel takes a look at news currently driving the market.
"/sdd/edimar/Desktop/doutorado/doutorado04/bases/WEIR/finance/quotes.stocknod.com/mygn.html",Schaeffer's Laura Houser takes a look at activity on the Street ahead of the market open
"/sdd/edimar/Desktop/doutorado/doutorado04/bases/WEIR/finance/quotes.stocknod.com/klac.html",Andrea Kramer takes a look at news on the Street prior to the start of trading.
"/sdd/edimar/Desktop/doutorado/doutorado04/bases/WEIR/finance/quotes.stocknod.com/aa.html",Schaeffer's Andrea Kramer takes a look at unusual option activity on the Street
"/sdd/edimar/Desktop/doutorado/doutorado04/bases/WEIR/finance/quotes.stocknod.com/mtg.html",Andrea Kramer takes a look at the market before the open
"/sdd/edimar/Desktop/doutorado/doutorado04/bases/WEIR/finance/quotes.stocknod.com/csc.html",Andrea Kramer takes a look at the market before the open
"/sdd/edimar/Desktop/doutorado/doutorado04/bases/WEIR/finance/quotes.stocknod.com/hpc.html","Two Veteran Wall Street Analysts Review the December 14, 2007 Edition of the Value Line Investment Survey"
"/sdd/edimar/Desktop/doutorado/doutorado04/bases/WEIR/finance/quotes.stocknod.com/utsi.html","Ford Motor, Pepsico, RadioShack, Whole Foods Market, Weight Watchers Intl, InfoSonics, Dell Inc"
"/sdd/edimar/Desktop/doutorado/doutorado04/bases/WEIR/finance/quotes.stocknod.com/cpn.html","Tom Dorsey and Tammy DeRosier - The Election is Over, Now What Do We Do?"
"/sdd/edimar/Desktop/doutorado/doutorado04/bases/WEIR/finance/quotes.stocknod.com/dhr.html",Joseph Hargett takes a look at news on the Street before the market opens.
"/sdd/edimar/Desktop/doutorado/doutorado04/bases/WEIR/finance/quotes.stocknod.com/tbl.html","Two Wall Street Analysts Review Value Line's November 10, 2006 Edition"
