URL,EXTRACTED VALUE
"/sdd/edimar/Desktop/doutorado/doutorado04/bases/WEIR/finance/quotes.stocknod.com/wwe.html",- Toy and video game maker Jakks Pacific
"/sdd/edimar/Desktop/doutorado/doutorado04/bases/WEIR/finance/quotes.stocknod.com/intu.html",Maybe we should listen.
"/sdd/edimar/Desktop/doutorado/doutorado04/bases/WEIR/finance/quotes.stocknod.com/sun.html",". Traditionally, European refineries have produced diesel for domestic use, with a large amount of the"
"/sdd/edimar/Desktop/doutorado/doutorado04/bases/WEIR/finance/quotes.stocknod.com/cf.html",It doesn't get much cheaper than this.
"/sdd/edimar/Desktop/doutorado/doutorado04/bases/WEIR/finance/quotes.stocknod.com/bmy.html","We are removing four names from our ""Best Dividend Stocks"" list this morning."
"/sdd/edimar/Desktop/doutorado/doutorado04/bases/WEIR/finance/quotes.stocknod.com/cag.html",Food stocks are a great-looking long-term buy. Some of the larger companies (like Kraft) have some impressive foods under their umbrellas.
"/sdd/edimar/Desktop/doutorado/doutorado04/bases/WEIR/finance/quotes.stocknod.com/mmc.html",Visit StreetInsider.com at http://www.streetinsider.com/news.php?st=p&id=4665139 for the full story.
"/sdd/edimar/Desktop/doutorado/doutorado04/bases/WEIR/finance/quotes.stocknod.com/hban.html",Visit StreetInsider.com at http://www.streetinsider.com/news.php?st=p&id=4721098 for the full story.
"/sdd/edimar/Desktop/doutorado/doutorado04/bases/WEIR/finance/quotes.stocknod.com/gps.html","Gap To Revamp 50 Old Navys, Grows Internationally"
"/sdd/edimar/Desktop/doutorado/doutorado04/bases/WEIR/finance/quotes.stocknod.com/pbg.html",Visit StreetInsider.com at http://www.streetinsider.com/news.php?st=p&id=4713410 for the full story.
"/sdd/edimar/Desktop/doutorado/doutorado04/bases/WEIR/finance/quotes.stocknod.com/dd.html",Boeing's not the only airplane maker losing orders.
"/sdd/edimar/Desktop/doutorado/doutorado04/bases/WEIR/finance/quotes.stocknod.com/tmk.html",NOTE TO EDITORS: The Following Is an Investment Opinion Being Issued by TheFortuneFinancial.com.
"/sdd/edimar/Desktop/doutorado/doutorado04/bases/WEIR/finance/quotes.stocknod.com/sti.html",Visit StreetInsider.com at http://www.streetinsider.com/news.php?st=p&id=4719629 for the full story.
"/sdd/edimar/Desktop/doutorado/doutorado04/bases/WEIR/finance/quotes.stocknod.com/rtn.html",Global Military Spending Hit $1.5 Trillion In '08
"/sdd/edimar/Desktop/doutorado/doutorado04/bases/WEIR/finance/quotes.stocknod.com/nke.html",Market-lagging returns could be written in these two stars.
"/sdd/edimar/Desktop/doutorado/doutorado04/bases/WEIR/finance/quotes.stocknod.com/wag.html",Sorting a real growth story from a flash in the pan.
"/sdd/edimar/Desktop/doutorado/doutorado04/bases/WEIR/finance/quotes.stocknod.com/sbux.html","If it's Wednesday, that means another change at"
"/sdd/edimar/Desktop/doutorado/doutorado04/bases/WEIR/finance/quotes.stocknod.com/utx.html",Don't let this scary market make you do something you'll regret.
"/sdd/edimar/Desktop/doutorado/doutorado04/bases/WEIR/finance/quotes.stocknod.com/azo.html","Green shoots optimism has withered under a small bout of June Gloom, but bulls remain largely in control."
"/sdd/edimar/Desktop/doutorado/doutorado04/bases/WEIR/finance/quotes.stocknod.com/pg.html",Today was one of those days where the overall market direction never felt entrenched nor felt certain. The news of ten banks
"/sdd/edimar/Desktop/doutorado/doutorado04/bases/WEIR/finance/quotes.stocknod.com/celg.html",A twist on the old index fund does well.
"/sdd/edimar/Desktop/doutorado/doutorado04/bases/WEIR/finance/quotes.stocknod.com/ek.html",The doctor is in.
"/sdd/edimar/Desktop/doutorado/doutorado04/bases/WEIR/finance/quotes.stocknod.com/bcr.html",Stocks In Focus For Thursday
"/sdd/edimar/Desktop/doutorado/doutorado04/bases/WEIR/finance/quotes.stocknod.com/sne.html",Her index includes:
"/sdd/edimar/Desktop/doutorado/doutorado04/bases/WEIR/finance/quotes.stocknod.com/bks.html","Barnes & Noble's quarterly earnings were down, but its outlook is up. Is this justified in the difficult bookselling climate?"
"/sdd/edimar/Desktop/doutorado/doutorado04/bases/WEIR/finance/quotes.stocknod.com/lly.html",Visit StreetInsider.com at http://www.streetinsider.com/news.php?st=p&id=4717272 for the full story.
"/sdd/edimar/Desktop/doutorado/doutorado04/bases/WEIR/finance/quotes.stocknod.com/sle.html",Visit StreetInsider.com at http://www.streetinsider.com/news.php?st=p&id=4695698 for the full story.
"/sdd/edimar/Desktop/doutorado/doutorado04/bases/WEIR/finance/quotes.stocknod.com/hsy.html",Are you going to let it pass by?
"/sdd/edimar/Desktop/doutorado/doutorado04/bases/WEIR/finance/quotes.stocknod.com/cl.html",Changing buying habits spell opportunity.
"/sdd/edimar/Desktop/doutorado/doutorado04/bases/WEIR/finance/quotes.stocknod.com/ups.html","Now is the time, or you'll regret it later."
"/sdd/edimar/Desktop/doutorado/doutorado04/bases/WEIR/finance/quotes.stocknod.com/fcx.html",Looking to make money in the market? Think metals.
"/sdd/edimar/Desktop/doutorado/doutorado04/bases/WEIR/finance/quotes.stocknod.com/oxy.html",Visit StreetInsider.com at http://www.streetinsider.com/news.php?st=p&id=4687800 for the full story.
"/sdd/edimar/Desktop/doutorado/doutorado04/bases/WEIR/finance/quotes.stocknod.com/mdr.html",Companies featured:
"/sdd/edimar/Desktop/doutorado/doutorado04/bases/WEIR/finance/quotes.stocknod.com/mo.html",Grow your wealth no matter what the market does.
"/sdd/edimar/Desktop/doutorado/doutorado04/bases/WEIR/finance/quotes.stocknod.com/etn.html",Market-trouncing returns could be written in these four stars.
"/sdd/edimar/Desktop/doutorado/doutorado04/bases/WEIR/finance/quotes.stocknod.com/snv.html",Visit StreetInsider.com at http://www.streetinsider.com/news.php?st=p&id=4703651 for the full story.
"/sdd/edimar/Desktop/doutorado/doutorado04/bases/WEIR/finance/quotes.stocknod.com/a.html","The market ended the week on a down note, and we also witnessed the end of the Nasdaq and Transport 9-week winning streak."
"/sdd/edimar/Desktop/doutorado/doutorado04/bases/WEIR/finance/quotes.stocknod.com/aee.html",Energy & Capital editor Nick Hodge discusses cap and trade under an Obama administration and what that means for investing in cleantech.
"/sdd/edimar/Desktop/doutorado/doutorado04/bases/WEIR/finance/quotes.stocknod.com/nsc.html",Visit StreetInsider.com at http://www.streetinsider.com/news.php?st=p&id=4665823 for the full story.
"/sdd/edimar/Desktop/doutorado/doutorado04/bases/WEIR/finance/quotes.stocknod.com/thc.html",A roundup of the latest corporate earnings reports and what companies are saying about future quarters.
"/sdd/edimar/Desktop/doutorado/doutorado04/bases/WEIR/finance/quotes.stocknod.com/rig.html",A move to higher crude prices could thwart our economic recovery.
"/sdd/edimar/Desktop/doutorado/doutorado04/bases/WEIR/finance/quotes.stocknod.com/bms.html",NOTE TO EDITORS: The Following Is an Investment Opinion Being Issued by TheFortuneFinancial.com.
"/sdd/edimar/Desktop/doutorado/doutorado04/bases/WEIR/finance/quotes.stocknod.com/gd.html","(Yes, really. We're already up to seven.)"
"/sdd/edimar/Desktop/doutorado/doutorado04/bases/WEIR/finance/quotes.stocknod.com/lnc.html",Investors should remain wary of commercial REITs for the time being.
"/sdd/edimar/Desktop/doutorado/doutorado04/bases/WEIR/finance/quotes.stocknod.com/chl.html","Like the smart hedge-fund operators, these CAPS investors bet against a stock -- and won big!"
"/sdd/edimar/Desktop/doutorado/doutorado04/bases/WEIR/finance/quotes.stocknod.com/abx.html",An oasis for an uncertain investing environment.
"/sdd/edimar/Desktop/doutorado/doutorado04/bases/WEIR/finance/quotes.stocknod.com/bby.html",Consumer electronics retailer
"/sdd/edimar/Desktop/doutorado/doutorado04/bases/WEIR/finance/quotes.stocknod.com/payx.html",This Fool made a great call on Caterpillar -- check out these other recent picks.
"/sdd/edimar/Desktop/doutorado/doutorado04/bases/WEIR/finance/quotes.stocknod.com/hd.html",NOTE TO EDITORS: The Following Is an Investment Opinion Being Issued by WallStSense.com
"/sdd/edimar/Desktop/doutorado/doutorado04/bases/WEIR/finance/quotes.stocknod.com/low.html","Volatile session ends with losses, but stocks do come off intraday lows following disappointing Treasury action."
"/sdd/edimar/Desktop/doutorado/doutorado04/bases/WEIR/finance/quotes.stocknod.com/aa.html",Looking to make money in the market? Think metals.
"/sdd/edimar/Desktop/doutorado/doutorado04/bases/WEIR/finance/quotes.stocknod.com/csc.html",What's your story?
"/sdd/edimar/Desktop/doutorado/doutorado04/bases/WEIR/finance/quotes.stocknod.com/pdli.html",Visit StreetInsider.com at http://www.streetinsider.com/news.php?st=p&id=4656967 for the full story.
"/sdd/edimar/Desktop/doutorado/doutorado04/bases/WEIR/finance/quotes.stocknod.com/utsi.html",Visit StreetInsider.com at http://www.streetinsider.com/news.php?st=p&id=4722323 for the full story.
"/sdd/edimar/Desktop/doutorado/doutorado04/bases/WEIR/finance/quotes.stocknod.com/sndk.html","The tech sector edged up after a bumpy start Friday morning, as the Nasdaq Composite Index stayed on track for a second straight week of gains."
"/sdd/edimar/Desktop/doutorado/doutorado04/bases/WEIR/finance/quotes.stocknod.com/twx.html",NOTE TO EDITORS: The Following Is an Investment Opinion Being Issued by WallStSense.com
"/sdd/edimar/Desktop/doutorado/doutorado04/bases/WEIR/finance/quotes.stocknod.com/fdx.html",It could be because oil prices have been slowly rising again as inventories are drawn down.
