URL,EXTRACTED VALUE
"/sdd/edimar/Desktop/doutorado/doutorado04/bases/WEIR/finance/quotes.stocknod.com/intu.html",Intuit GoPayment Turns Palm Pre Phone Into Credit Card Terminal
"/sdd/edimar/Desktop/doutorado/doutorado04/bases/WEIR/finance/quotes.stocknod.com/eix.html",Mohave Generating Station Owners to Dismantle Plant
"/sdd/edimar/Desktop/doutorado/doutorado04/bases/WEIR/finance/quotes.stocknod.com/tm.html",A.M. Best Affirms Rating of Toyota Motor Insurance Company
"/sdd/edimar/Desktop/doutorado/doutorado04/bases/WEIR/finance/quotes.stocknod.com/ibm.html",IBM cloud chief: Private clouds a fit for test and development
"/sdd/edimar/Desktop/doutorado/doutorado04/bases/WEIR/finance/quotes.stocknod.com/sun.html","June 12, 2009 - Today's Industrial Market News from Industrialinfo.com"
"/sdd/edimar/Desktop/doutorado/doutorado04/bases/WEIR/finance/quotes.stocknod.com/bmy.html",Value Investing
"/sdd/edimar/Desktop/doutorado/doutorado04/bases/WEIR/finance/quotes.stocknod.com/uis.html",Unisys Corporation Announces Extension of Expiration Date for Private Debt Exchange Offer and Concurrent Private Notes Offering
"/sdd/edimar/Desktop/doutorado/doutorado04/bases/WEIR/finance/quotes.stocknod.com/amgn.html","News Briefs: Blackrock To Become World’s Largest Money Manager, Bank Of America Raises Price Target On Palm"
"/sdd/edimar/Desktop/doutorado/doutorado04/bases/WEIR/finance/quotes.stocknod.com/fo.html",National Association of Drug Court Professionals Honors Beam Global With NADCP Ambassador Award
"/sdd/edimar/Desktop/doutorado/doutorado04/bases/WEIR/finance/quotes.stocknod.com/hal.html","Wall Street News Alert: Stock in Focus: Arrow Resources Development! June 12, 2009"
"/sdd/edimar/Desktop/doutorado/doutorado04/bases/WEIR/finance/quotes.stocknod.com/qcom.html",Bret Barakett's Tremblant Capital Group Bets On Technology: 13F Filing Q1 2009
"/sdd/edimar/Desktop/doutorado/doutorado04/bases/WEIR/finance/quotes.stocknod.com/pll.html","Analyst upgrades, downgrades and initiations: BP, DB, NUE, TLB, X, YHOO ..."
"/sdd/edimar/Desktop/doutorado/doutorado04/bases/WEIR/finance/quotes.stocknod.com/amat.html","StockPreacher Issues Technical Trade Alerts on: AMAT, AXP, BBT, GS"
"/sdd/edimar/Desktop/doutorado/doutorado04/bases/WEIR/finance/quotes.stocknod.com/pbg.html",50 Top Future Prospects for the “Recommended” List-June 13 Edition
"/sdd/edimar/Desktop/doutorado/doutorado04/bases/WEIR/finance/quotes.stocknod.com/apc.html",Boone Pickens' Hedge Fund BP Capital: Licking Wounds (13F Filing Q1 2009)
"/sdd/edimar/Desktop/doutorado/doutorado04/bases/WEIR/finance/quotes.stocknod.com/abt.html","News Briefs: Blackrock To Become World’s Largest Money Manager, Bank Of America Raises Price Target On Palm"
"/sdd/edimar/Desktop/doutorado/doutorado04/bases/WEIR/finance/quotes.stocknod.com/sti.html",TARP Repayment: Positives And Negatives
"/sdd/edimar/Desktop/doutorado/doutorado04/bases/WEIR/finance/quotes.stocknod.com/mat.html",Mattel to Webcast Analyst Conference
"/sdd/edimar/Desktop/doutorado/doutorado04/bases/WEIR/finance/quotes.stocknod.com/adbe.html",Earnings Preview For June 15 - 19 - Earnings Preview
"/sdd/edimar/Desktop/doutorado/doutorado04/bases/WEIR/finance/quotes.stocknod.com/jcp.html",Retail stocks mixed; Lululemon guidance misses
"/sdd/edimar/Desktop/doutorado/doutorado04/bases/WEIR/finance/quotes.stocknod.com/utx.html",Five Stocks With A Low Dividend Payout Ratio
"/sdd/edimar/Desktop/doutorado/doutorado04/bases/WEIR/finance/quotes.stocknod.com/ccl.html",The Most Dangerous Way to Invest Today
"/sdd/edimar/Desktop/doutorado/doutorado04/bases/WEIR/finance/quotes.stocknod.com/hlth.html",WebMD to Present at Jefferies 3rd Annual Healthcare Conference
"/sdd/edimar/Desktop/doutorado/doutorado04/bases/WEIR/finance/quotes.stocknod.com/hnz.html",Analysts Say This Stock Is a Double
"/sdd/edimar/Desktop/doutorado/doutorado04/bases/WEIR/finance/quotes.stocknod.com/kr.html",Kroger to Webcast Annual Meeting of Shareholders June 25
"/sdd/edimar/Desktop/doutorado/doutorado04/bases/WEIR/finance/quotes.stocknod.com/sle.html",Valassis Uses News America's Own Clients Against in Trial; Feel the Wrath of Sara Lee!
"/sdd/edimar/Desktop/doutorado/doutorado04/bases/WEIR/finance/quotes.stocknod.com/hum.html",Humana Games for Health Launches One-of-a-Kind Game-Idea Competition Called “InsertCoin”
"/sdd/edimar/Desktop/doutorado/doutorado04/bases/WEIR/finance/quotes.stocknod.com/rsh.html","TheFortuneFinancial.com Free Market Research on ARE, CAG, NCR and RSH"
"/sdd/edimar/Desktop/doutorado/doutorado04/bases/WEIR/finance/quotes.stocknod.com/mcd.html","WallStSense.com Fundamental & Technical Coverage of SLM, MCD, IO and UEC"
"/sdd/edimar/Desktop/doutorado/doutorado04/bases/WEIR/finance/quotes.stocknod.com/pgr.html",Progressive Announces Election of Lawton W. Fitt to Board of Directors and Share Repurchase Authorization
"/sdd/edimar/Desktop/doutorado/doutorado04/bases/WEIR/finance/quotes.stocknod.com/zqk.html","Monday?s Disappointing Retail Results (BTH, PBY, MW, ZQK)"
"/sdd/edimar/Desktop/doutorado/doutorado04/bases/WEIR/finance/quotes.stocknod.com/bp.html","Analyst upgrades, downgrades and initiations: BP, DB, NUE, TLB, X, YHOO ..."
"/sdd/edimar/Desktop/doutorado/doutorado04/bases/WEIR/finance/quotes.stocknod.com/de.html",Where Did All the Volatility Go?
"/sdd/edimar/Desktop/doutorado/doutorado04/bases/WEIR/finance/quotes.stocknod.com/ter.html",Sigurd Accepts 500th Teradyne Gen4 Microwave Instrument
"/sdd/edimar/Desktop/doutorado/doutorado04/bases/WEIR/finance/quotes.stocknod.com/ir.html",Cap Utilization To Give Clues
"/sdd/edimar/Desktop/doutorado/doutorado04/bases/WEIR/finance/quotes.stocknod.com/fitb.html",TARP Repayment: Positives And Negatives
"/sdd/edimar/Desktop/doutorado/doutorado04/bases/WEIR/finance/quotes.stocknod.com/dis.html",The Walt Disney Company Executives to Discuss Fiscal Third Quarter 2009 Financial Results via Webcast
"/sdd/edimar/Desktop/doutorado/doutorado04/bases/WEIR/finance/quotes.stocknod.com/dte.html",New Systems Reduce Emissions at Detroit Edison's Monroe Power Plant
"/sdd/edimar/Desktop/doutorado/doutorado04/bases/WEIR/finance/quotes.stocknod.com/efx.html",Regulatory DataCorp Expands Executive Team
"/sdd/edimar/Desktop/doutorado/doutorado04/bases/WEIR/finance/quotes.stocknod.com/ebay.html","Stocks To Gain On Back Of Overseas Rally, Commodities Buzz"
"/sdd/edimar/Desktop/doutorado/doutorado04/bases/WEIR/finance/quotes.stocknod.com/brcd.html","PennyStockPickAlert.com Announces Mid-Morning Most Active NASDAQ Stocks and Top Gaining NASDAQ Stocks:EFTC, SNIC, RMBS, TRCI, BRCD"
"/sdd/edimar/Desktop/doutorado/doutorado04/bases/WEIR/finance/quotes.stocknod.com/china.html",CDC Games Reports Significant Improvement In Yulgang Metrics After Launch of New Update
"/sdd/edimar/Desktop/doutorado/doutorado04/bases/WEIR/finance/quotes.stocknod.com/a.html","TRADE NEWS: Agilent Technologies’ Solutions for Engineering, Electronics Educators Integrated into PSG College of Technology’s Curriculum"
"/sdd/edimar/Desktop/doutorado/doutorado04/bases/WEIR/finance/quotes.stocknod.com/ed.html","Analyst upgrades, downgrades and initiations: CLX, ED, JBHT, HMC, PCG ..."
"/sdd/edimar/Desktop/doutorado/doutorado04/bases/WEIR/finance/quotes.stocknod.com/all.html","Allstate's Good Hands Gone Bad? (ALL, TRV, PGR, PRU, BRK.A, C, AIG, BLK)"
"/sdd/edimar/Desktop/doutorado/doutorado04/bases/WEIR/finance/quotes.stocknod.com/pbi.html",Pitney Bowes Flexible Productivity System Inserter Achieves 1500th Order
"/sdd/edimar/Desktop/doutorado/doutorado04/bases/WEIR/finance/quotes.stocknod.com/adm.html",StockSource.us Reports Major Opportunity for Shareholders ELRA.
"/sdd/edimar/Desktop/doutorado/doutorado04/bases/WEIR/finance/quotes.stocknod.com/cof.html","Young Adults Navigate Economic Challenges, Auto Financing Options on Their Own"
"/sdd/edimar/Desktop/doutorado/doutorado04/bases/WEIR/finance/quotes.stocknod.com/molx.html","AnalystChoice.com Brings You the Best Complimentary Research Report on NFLX, STEM, MOLX and ETFC"
"/sdd/edimar/Desktop/doutorado/doutorado04/bases/WEIR/finance/quotes.stocknod.com/bhi.html","Wall Street News Alert: Stock in Focus: PrimeGen Energy -- June 11, 2009"
"/sdd/edimar/Desktop/doutorado/doutorado04/bases/WEIR/finance/quotes.stocknod.com/gd.html","TheFortuneFinancial.com Free Market Research on BEN, GD, CBE and FDX"
"/sdd/edimar/Desktop/doutorado/doutorado04/bases/WEIR/finance/quotes.stocknod.com/lnc.html","Hartford falls after accepting TARP, selling stock"
"/sdd/edimar/Desktop/doutorado/doutorado04/bases/WEIR/finance/quotes.stocknod.com/flr.html",45 Dividend Stocks that May Lead Any Rally This Week - June 13 Edition
"/sdd/edimar/Desktop/doutorado/doutorado04/bases/WEIR/finance/quotes.stocknod.com/nav.html","Movado, Navistar, Oxford and Pep Boys shares rise on Tuesday earnings reports"
"/sdd/edimar/Desktop/doutorado/doutorado04/bases/WEIR/finance/quotes.stocknod.com/mrk.html","Wall Street Ends Higher, Bank Of America (NYSE: BAC) Soars"
"/sdd/edimar/Desktop/doutorado/doutorado04/bases/WEIR/finance/quotes.stocknod.com/fnm.html",Keepin' It Real Estate: Where Have All the Houses Gone?
"/sdd/edimar/Desktop/doutorado/doutorado04/bases/WEIR/finance/quotes.stocknod.com/nem.html",Hot commodity stocks to watch
"/sdd/edimar/Desktop/doutorado/doutorado04/bases/WEIR/finance/quotes.stocknod.com/cck.html",Crown Holdings (CCK) PriceWatch Alert Technicals Showing Bullish
"/sdd/edimar/Desktop/doutorado/doutorado04/bases/WEIR/finance/quotes.stocknod.com/pby.html","Movado, Navistar, Oxford and Pep Boys shares rise on Tuesday earnings reports"
"/sdd/edimar/Desktop/doutorado/doutorado04/bases/WEIR/finance/quotes.stocknod.com/unp.html",Bret Barakett's Tremblant Capital Group Bets On Technology: 13F Filing Q1 2009
"/sdd/edimar/Desktop/doutorado/doutorado04/bases/WEIR/finance/quotes.stocknod.com/cah.html",The following is an investment opinion release issued by InsaneStox.com
"/sdd/edimar/Desktop/doutorado/doutorado04/bases/WEIR/finance/quotes.stocknod.com/r.html","Toys ""R"" Us Counting on Cyber Spree to Boost Share"
"/sdd/edimar/Desktop/doutorado/doutorado04/bases/WEIR/finance/quotes.stocknod.com/utsi.html",UTStarcom Announces Corporate Initiatives to Improve Financial Performance
"/sdd/edimar/Desktop/doutorado/doutorado04/bases/WEIR/finance/quotes.stocknod.com/bni.html",How Not To Invest
"/sdd/edimar/Desktop/doutorado/doutorado04/bases/WEIR/finance/quotes.stocknod.com/sndk.html","AnalystChoice.com Brings You the Best Complimentary Research Report on NVS, SNDK, PCLN and ORCL"
"/sdd/edimar/Desktop/doutorado/doutorado04/bases/WEIR/finance/quotes.stocknod.com/gis.html",Del Monte's Q4 rocked -- buy or sell on the news?
