URL,EXTRACTED VALUE
"/sdd/edimar/Desktop/doutorado/doutorado04/bases/WEIR/finance/quotes.stocknod.com/intu.html","Recently, I had the pleasure of attending"
"/sdd/edimar/Desktop/doutorado/doutorado04/bases/WEIR/finance/quotes.stocknod.com/trow.html",(NYSE:
"/sdd/edimar/Desktop/doutorado/doutorado04/bases/WEIR/finance/quotes.stocknod.com/fitb.html","Yet, that was the fear. OK, I'm shaking."
"/sdd/edimar/Desktop/doutorado/doutorado04/bases/WEIR/finance/quotes.stocknod.com/mmm.html","According to CNBC’s Jim Cramer, Honeywell International Inc. (NYSE:HON) is a screaming buy when it dips below $30."
"/sdd/edimar/Desktop/doutorado/doutorado04/bases/WEIR/finance/quotes.stocknod.com/ctl.html",Weekly Mergers and Acquisitions Report.
"/sdd/edimar/Desktop/doutorado/doutorado04/bases/WEIR/finance/quotes.stocknod.com/jkhy.html","Entertainment software stocks, Luxottica and Hansen Medical were today's noteworthy initiations:"
"/sdd/edimar/Desktop/doutorado/doutorado04/bases/WEIR/finance/quotes.stocknod.com/cpwr.html",After last week's
"/sdd/edimar/Desktop/doutorado/doutorado04/bases/WEIR/finance/quotes.stocknod.com/oi.html","Owens-Illinois (OI), a maker of glass containers, fell 7.6% to 19 after KeyBanc cut its '09 EPS estimate to $3, below views for $3.59. KeyBanc..."
"/sdd/edimar/Desktop/doutorado/doutorado04/bases/WEIR/finance/quotes.stocknod.com/ebay.html",In the past we've written about eBay's
"/sdd/edimar/Desktop/doutorado/doutorado04/bases/WEIR/finance/quotes.stocknod.com/cvg.html","European banks, the Paper and Forest Products sector, Kindred Healthcare and Convergys were today's noteworthy upgrades:"
"/sdd/edimar/Desktop/doutorado/doutorado04/bases/WEIR/finance/quotes.stocknod.com/snv.html","KeyCorp (KEY) and Synovus (SNV) said they'll both get cash infusions from the Treasury. KeyCorp will get $2.5 bil, Synovus will receive $973 mil."
"/sdd/edimar/Desktop/doutorado/doutorado04/bases/WEIR/finance/quotes.stocknod.com/mhp.html","He would stand next to the overhead projected stock chart at the front of the trading room and recite,"
"/sdd/edimar/Desktop/doutorado/doutorado04/bases/WEIR/finance/quotes.stocknod.com/ltr.html",(NYSE:
"/sdd/edimar/Desktop/doutorado/doutorado04/bases/WEIR/finance/quotes.stocknod.com/peg.html",", editor of"
"/sdd/edimar/Desktop/doutorado/doutorado04/bases/WEIR/finance/quotes.stocknod.com/beas.html","Oracle Corporation (Public,"
"/sdd/edimar/Desktop/doutorado/doutorado04/bases/WEIR/finance/quotes.stocknod.com/rfmd.html",UBS is out with a major call on RF Micro (NASDAQ:RFMD) upgrading the stock to a Buy with a $3 tgt.
"/sdd/edimar/Desktop/doutorado/doutorado04/bases/WEIR/finance/quotes.stocknod.com/eds.html",By Eric Jackson
"/sdd/edimar/Desktop/doutorado/doutorado04/bases/WEIR/finance/quotes.stocknod.com/crgn.html",Normal 0 false false false <w:
"/sdd/edimar/Desktop/doutorado/doutorado04/bases/WEIR/finance/quotes.stocknod.com/mso.html","Wenda Harris Millard, co-CEO of Martha Stewart Living Omnimedia, recalls her reaction to the ""deal of the century."""
"/sdd/edimar/Desktop/doutorado/doutorado04/bases/WEIR/finance/quotes.stocknod.com/ceg.html","Dow 8,331.32 +46.43 (0.56%)"
"/sdd/edimar/Desktop/doutorado/doutorado04/bases/WEIR/finance/quotes.stocknod.com/bgg.html","Posted By Optiondragon for myhappytrading.com, a social network made by traders for traders."
"/sdd/edimar/Desktop/doutorado/doutorado04/bases/WEIR/finance/quotes.stocknod.com/mlnm.html","Hershey Foods, Genentech and Garmin were today's noteworthy downgrades:"
"/sdd/edimar/Desktop/doutorado/doutorado04/bases/WEIR/finance/quotes.stocknod.com/amcc.html",Sanmina Corp
"/sdd/edimar/Desktop/doutorado/doutorado04/bases/WEIR/finance/quotes.stocknod.com/mck.html","As promised during his election campaign, President Obama seems to be swiftly acting on the US healthcare reform."
"/sdd/edimar/Desktop/doutorado/doutorado04/bases/WEIR/finance/quotes.stocknod.com/nwl.html",US stocks finished higher on Wednesday after an unexpected jump in durable orders and new home sales data boosted investor sentiment.
"/sdd/edimar/Desktop/doutorado/doutorado04/bases/WEIR/finance/quotes.stocknod.com/bks.html",(NYSE:
"/sdd/edimar/Desktop/doutorado/doutorado04/bases/WEIR/finance/quotes.stocknod.com/bsy.html","Smith & Nephew, British Sky Broadcasting and Electronic Data Systems were today's noteworthy downgrades:"
"/sdd/edimar/Desktop/doutorado/doutorado04/bases/WEIR/finance/quotes.stocknod.com/hsy.html",(NYSE:
"/sdd/edimar/Desktop/doutorado/doutorado04/bases/WEIR/finance/quotes.stocknod.com/qlti.html","by H.S. Ayoub, DMD"
"/sdd/edimar/Desktop/doutorado/doutorado04/bases/WEIR/finance/quotes.stocknod.com/tkr.html","VMWare, Validus Holdings and Hologic were today's noteworthy initiations:"
"/sdd/edimar/Desktop/doutorado/doutorado04/bases/WEIR/finance/quotes.stocknod.com/uvv.html",I had the honor of being invited to speak to the MBA students at Howard University in Washington DC on March 13th.
"/sdd/edimar/Desktop/doutorado/doutorado04/bases/WEIR/finance/quotes.stocknod.com/advs.html","Entertainment software stocks, Luxottica and Hansen Medical were today's noteworthy initiations:"
"/sdd/edimar/Desktop/doutorado/doutorado04/bases/WEIR/finance/quotes.stocknod.com/aria.html","Ariad Pharma, FNB Corp. and Fortune Brands were today's noteworthy initiations:"
"/sdd/edimar/Desktop/doutorado/doutorado04/bases/WEIR/finance/quotes.stocknod.com/cb.html",", editor of"
"/sdd/edimar/Desktop/doutorado/doutorado04/bases/WEIR/finance/quotes.stocknod.com/syy.html","There are many lists of dividend companies such as S&P 500 Dividend Aristocrats, US Broad Dividend Achievers™ Index and The U.S. Dividend Champions."
"/sdd/edimar/Desktop/doutorado/doutorado04/bases/WEIR/finance/quotes.stocknod.com/ci.html",US stocks finished with solid weekly gains on hopes that the massive stimulus plan and bank rescue package will bolster the US economy.
"/sdd/edimar/Desktop/doutorado/doutorado04/bases/WEIR/finance/quotes.stocknod.com/cbe.html",Ford Motor Co (
"/sdd/edimar/Desktop/doutorado/doutorado04/bases/WEIR/finance/quotes.stocknod.com/fpl.html",Energy & Capital editor Nick Hodge discusses smart grid companies in light of the billions of federal dollars now available to the sector.
