URL,EXTRACTED VALUE
"/sdd/edimar/Desktop/doutorado/doutorado04/bases/WEIR/finance/quotes.stocknod.com/jbx.html","Economic PPI & Core (0.2%, -1.5%)"
"/sdd/edimar/Desktop/doutorado/doutorado04/bases/WEIR/finance/quotes.stocknod.com/gpc.html",Genuine Parts Company GPC 6/3/09 5.04%
"/sdd/edimar/Desktop/doutorado/doutorado04/bases/WEIR/finance/quotes.stocknod.com/plug.html","Economic: MBA Purchase Applications, ICSC-Goldman Store Sales, Redbook"
"/sdd/edimar/Desktop/doutorado/doutorado04/bases/WEIR/finance/quotes.stocknod.com/osis.html",) reported an August same-store sales rise of just 1.4%. Please find today's market-moving news below:
"/sdd/edimar/Desktop/doutorado/doutorado04/bases/WEIR/finance/quotes.stocknod.com/pep.html","Sony (SNE) Columbia Records label, Obsessed movie, distributed by Screen Gems, subsidiary of Sony; Cadillac Records movie, TriStar subsidiary of Sony"
